"CAVS_CODE","CAAB_CODE","NAMES_VARIOUS","SCIENTIFIC_NAME","FAMILY","GENUS","SUBGENUS","SPECIES","SUBSPECIES","NAME_TYPE","NAME_SUBTYPE","RANK","QUALIFICATION","AUTHOR","YEAR","ORIG_COMBINATION","NAME_GUID","NAME_LAST_UPDATE","TAXON_GUID","TAXON_LAST_UPDATE","PARENT_TAXON_GUID","CONCEPT_GUID","PUB_PUB_AUTHOR","PUB_PUB_YEAR","PUB_PUB_TITLE","PUB_PUB_PAGES","PUB_PUB_PARENT_BOOK_TITLE","PUB_PUB_PARENT_JOURNAL_TITLE","PUB_PUB_PARENT_ARTICLE_TITLE","PUB_PUB_PUBLICATION_DATE","PUB_PUB_PUBLISHER","PUB_PUB_FORMATTED","PUB_PUB_QUALIFICATION","PUB_PUB_TYPE","PUBLICATION_GUID","PUBLICATION_LAST_UPDATE","PARENT_PUBLICATION_GUID"
"","","Brachycerinae","Brachycerinae Billberg, 1820","CURCULIONIDAE","","","","","Valid Name","","Subfamily","","Billberg","1820","Y","db4ccc62-ccb6-4e48-ac8a-f3cd1f9d6e4d","20220606T03:24:46.885+0000","916926f7-34f1-404d-8aae-b2c0f2580df8","20220616T08:53:57.456+0000","93d87aaf-8f67-4723-85c6-6ff6c407e64b","916926f7-34f1-404d-8aae-b2c0f2580df8","","","","","","","","","","","","","","",""
"","","Bagoini","Bagoini Thomson, 1859","CURCULIONIDAE","","","","","Valid Name","","Tribe","","Thomson","1859","Y","6159d2f7-5ae7-493c-a96e-216b0223707b","20220606T03:24:46.885+0000","fd5d40ee-2b29-449e-a339-beecc8648008","20220616T08:53:57.456+0000","916926f7-34f1-404d-8aae-b2c0f2580df8","fd5d40ee-2b29-449e-a339-beecc8648008","","","","","","","","","","","","","","",""
"","","Azollaebagous","Azollaebagous Caldara, O'Brien & Meregalli, 2017","","Azollaebagous","","","","Valid Name","","Genus","","Caldara, O'Brien & Meregalli","2017","Y","13672b72-6b74-4c61-8b10-533631a53bf6","20220606T03:24:46.885+0000","14d6ac21-9ce8-4b33-9b98-e1617144f98d","20220616T08:53:57.456+0000","fd5d40ee-2b29-449e-a339-beecc8648008","14d6ac21-9ce8-4b33-9b98-e1617144f98d","","","","","","","","","","","","","","",""
"","","Azollaebagous","Azollaebagous Caldara, O'Brien & Meregalli, 2017","","Azollaebagous","","","","Synonym","synonym","Genus","","Caldara, O'Brien & Meregalli","2017","Y","d6802887-b377-4eb6-b7c3-207fe76473c9","20220606T03:24:46.885+0000","14d6ac21-9ce8-4b33-9b98-e1617144f98d","20220616T08:53:57.456+0000","","563237f8-449b-4838-8e63-c3f2a5043f26","Caldara, R., O'Brien, C.W. & Meregalli, M.","2017","A phylogenetic analysis of the aquatic weevil tribe Bagoini (Coleoptera: Curculionidae) based on morphological characters of adults","1-63","","Zootaxa","","","","<!--MARK--><a href='null61c7532a-b977-4e1d-a1f6-c0c846af684d' class='mouseoverHref'>Caldara, R., O'Brien, C.W. & Meregalli, M. 2017. A phylogenetic analysis of the aquatic weevil tribe Bagoini (Coleoptera: Curculionidae) based on morphological characters of adults.</a> <!--MARK--><!--MARK--><a href='null96466227-221c-4922-ac97-1ac2dd946d0a' class='mouseoverHref'><em>Zootaxa</em></a> <strong>4287</strong>(1): 1-63<!--MARK-->","","Article in Journal","61c7532a-b977-4e1d-a1f6-c0c846af684d","20171003T21:21:00.302+0000","96466227-221c-4922-ac97-1ac2dd946d0a"
"","","clarenciensis","Azollaebagous clarenciensis (Blackburn, 1894)","","Azollaebagous","","clarenciensis","","Valid Name","","Species","","Blackburn","1894","N","1875f3ec-18f0-4781-abeb-c3afebaa95e7","20220606T03:24:46.885+0000","cd835cf5-9346-41e4-a4b7-915beb8ff453","20220616T08:53:57.456+0000","14d6ac21-9ce8-4b33-9b98-e1617144f98d","cd835cf5-9346-41e4-a4b7-915beb8ff453","","","","","","","","","","","","","","",""
"","","clarenciensis","Bagous clarenciensis Blackburn, 1894","","Bagous","","clarenciensis","","Synonym","synonym","Species","","Blackburn","1894","Y","2d04f3f8-086b-436d-8b1f-ef5a2801835c","20220606T03:24:46.885+0000","cd835cf5-9346-41e4-a4b7-915beb8ff453","20220616T08:53:57.456+0000","","e0cc882f-c975-4df2-822e-5309ab0d699e","Blackburn, T.","1894","Further notes on Australian Coleoptera, with descriptions of new genera and species. Part XV","139-168","","Transactions of the Royal Society of South Australia","","","","<!--MARK--><a href='null03cb2440-48db-4ab4-93fb-2f125a2fa56d' class='mouseoverHref'>Blackburn, T. 1894. Further notes on Australian Coleoptera, with descriptions of new genera and species. Part XV.</a> <!--MARK--><!--MARK--><a href='null8b48b0a3-dd7a-4aea-be0d-10a223710ebc' class='mouseoverHref'><em>Transactions of the Royal Society of South Australia</em></a> <strong>18</strong>: 139-168<!--MARK-->","","Article in Journal","03cb2440-48db-4ab4-93fb-2f125a2fa56d","20120515T21:10:21.958+0000","8b48b0a3-dd7a-4aea-be0d-10a223710ebc"
"","","clarenciensis","Azollaebagous clarenciensis (Blackburn, 1894)","","Azollaebagous","","clarenciensis","","Generic Combination","","Species","","Blackburn","1894","N","1131153b-d799-41bc-8a6b-8afd96723a1f","20220606T03:24:46.885+0000","cd835cf5-9346-41e4-a4b7-915beb8ff453","20220616T08:53:57.456+0000","","eea3aec8-43c8-45aa-9965-ca725cae85c9","Caldara, R., O'Brien, C.W. & Meregalli, M.","2017","A phylogenetic analysis of the aquatic weevil tribe Bagoini (Coleoptera: Curculionidae) based on morphological characters of adults","1-63","","Zootaxa","","","","<!--MARK--><a href='null61c7532a-b977-4e1d-a1f6-c0c846af684d' class='mouseoverHref'>Caldara, R., O'Brien, C.W. & Meregalli, M. 2017. A phylogenetic analysis of the aquatic weevil tribe Bagoini (Coleoptera: Curculionidae) based on morphological characters of adults.</a> <!--MARK--><!--MARK--><a href='null96466227-221c-4922-ac97-1ac2dd946d0a' class='mouseoverHref'><em>Zootaxa</em></a> <strong>4287</strong>(1): 1-63<!--MARK-->","","Article in Journal","61c7532a-b977-4e1d-a1f6-c0c846af684d","20171003T21:21:00.302+0000","96466227-221c-4922-ac97-1ac2dd946d0a"
"","","Bagous","Bagous Germar, 1817","CURCULIONIDAE","Bagous","","","","Valid Name","","Genus","","Germar","1817","Y","355e979b-1611-42db-8bbe-0fe3d8ef21ad","20220606T03:24:46.885+0000","30533f73-a5ea-4ffd-b1e9-4f3dc70720fc","20220616T08:53:57.456+0000","fd5d40ee-2b29-449e-a339-beecc8648008","30533f73-a5ea-4ffd-b1e9-4f3dc70720fc","","","","","","","","","","","","","","",""
"","","Macropelmus","Bagous (Macropelmus) Dejean, 1821","CURCULIONIDAE","Bagous","Macropelmus","","","Valid Name","","Subgenus","","Dejean","1821","Y","4aef2442-bea8-4fce-bd0f-b7955d522376","20220606T03:24:46.885+0000","ac10273f-e29e-4ef1-8d73-9d6320a7a1ae","20220616T08:53:57.456+0000","30533f73-a5ea-4ffd-b1e9-4f3dc70720fc","ac10273f-e29e-4ef1-8d73-9d6320a7a1ae","","","","","","","","","","","","","","",""
"","","Macropelmus","Macropelmus Dejean, 1821","","Macropelmus","","","","Synonym","subjective synonym","Subgenus","","Dejean","1821","Y","c4be5dd9-b722-48a8-8177-bc6a4e4654ed","20220606T03:24:46.885+0000","ac10273f-e29e-4ef1-8d73-9d6320a7a1ae","20220616T08:53:57.456+0000","","1e7e89c5-3d1a-489d-8410-e72390e70634","Dejean, P.F.M.A.","1821","Catalogue de la Collection de Coléoptères de M. le Baron Dejean","viii 136 pp.","","","","","Crevot, Libraire","<!--MARK--><a href='nullc5981f53-318a-4e58-988f-e9131223490f' class='mouseoverHref'>Dejean, P.F.M.A. 1821. <em>Catalogue de la Collection de Coléoptères de M. le Baron Dejean</em>. Paris : Crevot, Libraire viii 136 pp.</a><!--MARK-->","","Book","c5981f53-318a-4e58-988f-e9131223490f","20081009T05:11:37.000+0000",""
"","","Cyprus","Cyprus Schoenherr, 1825","","Cyprus","","","","Synonym","subjective synonym","Subgenus","","Schoenherr","1825","Y","5ddb66c1-14b4-4c57-95a2-cb0a31bb2b17","20220606T03:24:46.885+0000","ac10273f-e29e-4ef1-8d73-9d6320a7a1ae","20220616T08:53:57.456+0000","","5049c054-5721-42f0-82f3-a4701fb0c56c","Schoenherr, C.J.","1825","Continuatio tabulae synopticae familiae curculionidum.","581-588","","Isis von Oken","","","","<!--MARK--><a href='null96754b44-2d20-4ed3-9af8-438d632a72c9' class='mouseoverHref'>Schoenherr, C.J. 1825. Continuatio tabulae synopticae familiae curculionidum.</a> <!--MARK--><!--MARK--><a href='null8c6c1811-e289-4280-abc3-68c2b2da3975' class='mouseoverHref'><em>Isis von Oken</em></a> <strong>1825</strong>(5): 581-588<!--MARK-->","","Article in Journal","96754b44-2d20-4ed3-9af8-438d632a72c9","20111017T00:29:27.559+0000","8c6c1811-e289-4280-abc3-68c2b2da3975"
"","","Lyprus","Lyprus Schoenherr, 1826","","","","","","Synonym","subjective synonym","Subgenus","incorrect subsequent spelling of Cyprus?","Schoenherr","1826","Y","a90d56b7-4755-4da0-910f-97f981c33b34","20220606T03:24:46.885+0000","ac10273f-e29e-4ef1-8d73-9d6320a7a1ae","20220616T08:53:57.456+0000","","5a75bf32-b0da-45c8-a46b-e9aeb87c5d9f","Schoenherr, C.J.","1826","Curculionidum dispositio methodica cum generum characteribus, descriptionibus atque observationibus variis seu Prodromus ad Synonymiae Insectorum. Partem IV.","x + 338 pp.","","","","","Fleischer","<!--MARK--><a href='nulle6b78db3-5218-49db-9321-d6c54850e30e' class='mouseoverHref'>Schoenherr, C.J. 1826. <em>Curculionidum dispositio methodica cum generum characteribus, descriptionibus atque observationibus variis seu Prodromus ad Synonymiae Insectorum. Partem IV</em>. Lipsiae : Fleischer x + 338 pp.</a><!--MARK-->","","Book","e6b78db3-5218-49db-9321-d6c54850e30e","20111017T00:38:46.604+0000",""
"","","Dicranthus","Dicranthus Motschulsky, 1845","","Dicranthus","","","","Synonym","subjective synonym","Subgenus","","Motschulsky","1845","Y","7c5ff400-a3cf-4304-ae4f-289abb3e99ae","20220606T03:24:46.885+0000","ac10273f-e29e-4ef1-8d73-9d6320a7a1ae","20220616T08:53:57.456+0000","","c9959906-34f3-42a8-a1e6-954d2e539ca2","Motschulsky, V. von","1845","Remarques sur la collection de coléoptères russes de Victor deMotschulsky. Article 1","1-127","","Bulletin de la Société Impériale des Naturalistes de Moscou","","","","<!--MARK--><a href='nulleace1c03-a3f8-4517-a531-e6478d0fc4d5' class='mouseoverHref'>Motschulsky, V. von 1845. Remarques sur la collection de coléoptères russes de Victor deMotschulsky. Article 1.</a> <!--MARK--><!--MARK--><a href='nulla7cbc93a-fdd0-40a5-9cc8-35de71b7d18a' class='mouseoverHref'><em>Bulletin de la Société Impériale des Naturalistes de Moscou</em></a> <strong>18</strong>(1): 1-127<!--MARK-->","","Article in Journal","eace1c03-a3f8-4517-a531-e6478d0fc4d5","20110831T04:09:06.748+0000","a7cbc93a-fdd0-40a5-9cc8-35de71b7d18a"
"","","Ephimeropus","Ephimeropus Hochhuth, 1847","","Ephimeropus","","","","Synonym","subjective synonym","Subgenus","","Hochhuth","1847","Y","51fef515-3ae9-4071-98f5-3d1b037cd933","20220606T03:24:46.885+0000","ac10273f-e29e-4ef1-8d73-9d6320a7a1ae","20220616T08:53:57.456+0000","","eddfb5a2-5d7d-4ccc-8db0-4779c298c9d4","Hochhuth, I.H.","1847","Enumeration der Rüsselkäfer, welche vom Baron Maximilian von Chaudoir und vom Baron A. von Gotsch auf ihren Reisen im Kaukasus und in Transkaukasien im Jahre 1845 gesammelt wurden; nebst Beschreibung der neuentdeckten Arten.","448-587","","Bulletin de la Société Impériale des Naturalistes de Moscou","","","","<!--MARK--><a href='null83dd5140-9c72-4744-9466-9e9a97559d45' class='mouseoverHref'>Hochhuth, I.H. 1847. Enumeration der Rüsselkäfer, welche vom Baron Maximilian von Chaudoir und vom Baron A. von Gotsch auf ihren Reisen im Kaukasus und in Transkaukasien im Jahre 1845 gesammelt wurden; nebst Beschreibung der neuentdeckten Arten.</a> <!--MARK--><!--MARK--><a href='nulla7cbc93a-fdd0-40a5-9cc8-35de71b7d18a' class='mouseoverHref'><em>Bulletin de la Société Impériale des Naturalistes de Moscou</em></a> <strong>20</strong>(1): 448-587<!--MARK-->","","Article in Journal","83dd5140-9c72-4744-9466-9e9a97559d45","20120328T22:17:25.171+0000","a7cbc93a-fdd0-40a5-9cc8-35de71b7d18a"
"","","Elmidomorphus","Elmidomorphus Cussac, 1851","","Elmidomorphus","","","","Synonym","subjective synonym","Subgenus","","Cussac","1851","Y","7fe9e9e3-84bc-4691-87db-119c4c338bad","20220606T03:24:46.885+0000","ac10273f-e29e-4ef1-8d73-9d6320a7a1ae","20220616T08:53:57.456+0000","","ac2f96bd-48db-417b-bc7e-75a43bddad17","Cussac, E.","1851","Description d'un genre nouveau de Curculionites propre à la faune française.","203-208, pl. 4","","Annales de la Société Entomologique de France","","23-VI-1851","","<!--MARK--><a href='null6dcc1b16-a3af-431e-9751-a130474dc9b8' class='mouseoverHref'>Cussac, E. 1851. Description d'un genre nouveau de Curculionites propre à la faune française.</a> <!--MARK--><!--MARK--><a href='null6462279b-2aaf-46a3-a434-cab7d8a2c33d' class='mouseoverHref'><em>Annales de la Société Entomologique de France</em></a> 2 <strong>9</strong>(2): 203-208, pl. 4<!--MARK--> [Date published 23-VI-1851]","","Article in Journal","6dcc1b16-a3af-431e-9751-a130474dc9b8","20120328T22:23:27.409+0000","6462279b-2aaf-46a3-a434-cab7d8a2c33d"
"","","Anactodes","Anactodes Brisout de Barneville, 1863","","","","","","Synonym","subjective synonym","Subgenus","","Brisout de Barneville","1863","Y","0b979f8f-e6c9-4470-a63e-0ca25c19b7bf","20220606T03:24:46.885+0000","ac10273f-e29e-4ef1-8d73-9d6320a7a1ae","20220616T08:53:57.456+0000","","07528800-5328-4dfc-b4ef-820d7b7d2638","Brisout de Barneville, H.","1863","Monographie des espèces européennes et algériennes du genre <i>Bagous</i>","491-524","","Annales de la Société Entomologique de France","","25-XI-1863","","<!--MARK--><a href='nulld5b47a34-4e36-46fa-abba-db409b0cd214' class='mouseoverHref'>Brisout de Barneville, H. 1863. Monographie des espèces européennes et algériennes du genre <i>Bagous</i>.</a> <!--MARK--><!--MARK--><a href='null6462279b-2aaf-46a3-a434-cab7d8a2c33d' class='mouseoverHref'><em>Annales de la Société Entomologique de France</em></a> 4 <strong>3</strong>(3): 491-524<!--MARK--> [Date published 25-XI-1863]","","Article in Journal","d5b47a34-4e36-46fa-abba-db409b0cd214","20150224T21:16:07.502+0000","6462279b-2aaf-46a3-a434-cab7d8a2c33d"
"","","Pnigodes","Pnigodes LeConte, 1876","","","","","","Synonym","synonym","Subgenus","","LeConte","1876","Y","1aa74e94-a362-44ac-9e06-44c1bfa2b497","20220606T03:24:46.885+0000","ac10273f-e29e-4ef1-8d73-9d6320a7a1ae","20220616T08:53:57.456+0000","","51a23381-9a07-4d2f-915a-49d9a27de71c","LeConte, J.L. & Horn, G.H.","1876","The Rhynchophora of America north of Mexico.","i-xvi, 1-455, figs 1-2","","Proceedings of the American Philosophical Society","","","","<!--MARK--><a href='nullf069a06c-0db8-4812-90f4-da009c945651' class='mouseoverHref'>LeConte, J.L. & Horn, G.H. 1876. The Rhynchophora of America north of Mexico.</a> <!--MARK--><!--MARK--><a href='null404f350f-cee2-4ecd-9efc-956d451539f6' class='mouseoverHref'><em>Proceedings of the American Philosophical Society</em></a> <strong>15</strong>: i-xvi, 1-455, figs 1-2<!--MARK-->","","Article in Journal","f069a06c-0db8-4812-90f4-da009c945651","20120515T22:38:57.134+0000","404f350f-cee2-4ecd-9efc-956d451539f6"
"","","Bagoimorphus","Bagoimorphus Desbrochers, 1905","","Bagoimorphus","","","","Synonym","subjective synonym","Subgenus","","Desbrochers","1905","Y","47f42447-4975-48f6-beff-f36f01a13785","20220606T03:24:46.885+0000","ac10273f-e29e-4ef1-8d73-9d6320a7a1ae","20220616T08:53:57.456+0000","","cbd04aa2-fe7c-41ed-b499-d2e436cb985e","Desbrochers, J.","1905","Curculionides nouveaux d'Europe et circa.","9-16","","Le Frelon","","IX-1905","","<!--MARK--><a href='nullaf569a03-1229-4443-a8b6-037fb578d955' class='mouseoverHref'>Desbrochers, J. 1905. Curculionides nouveaux d'Europe et circa.</a> <!--MARK--><!--MARK--><a href='nullf7621968-ed26-4cb3-ad03-4f2e372a7483' class='mouseoverHref'><em>Le Frelon</em></a> <strong>14</strong>(1): 9-16<!--MARK--> [Date published IX-1905]","","Article in Journal","af569a03-1229-4443-a8b6-037fb578d955","20120328T22:39:19.200+0000","f7621968-ed26-4cb3-ad03-4f2e372a7483"
"","","Probagous","Probagous Sharp, 1916","","Probagous","","","","Synonym","subjective synonym","Subgenus","","Sharp","1916","Y","6a2a1910-4072-4631-a0aa-26c1af60da8a","20220606T03:24:46.885+0000","ac10273f-e29e-4ef1-8d73-9d6320a7a1ae","20220616T08:53:57.456+0000","","22237b13-1add-4cdf-a34a-9112976df27e","Sharp, D.","1916","Re-arrangement of the Bagoini. Preliminary list of the British members.","275","","Entomologist's Monthly Magazine","","XII-1916","","<!--MARK--><a href='null2ffb7b55-53df-4fbb-8be5-a74663e3674d' class='mouseoverHref'>Sharp, D. 1916. Re-arrangement of the Bagoini. Preliminary list of the British members.</a> <!--MARK--><!--MARK--><a href='nullcbd5c497-64d0-4fae-97ee-22719c3ca286' class='mouseoverHref'><em>Entomologist's Monthly Magazine</em></a> <strong>52</strong>: 275<!--MARK--> [Date published XII-1916]","","Article in Journal","2ffb7b55-53df-4fbb-8be5-a74663e3674d","20120328T22:51:04.188+0000","cbd5c497-64d0-4fae-97ee-22719c3ca286"
"","","Heterobagous","Heterobagous Solari, 1930","","Heterobagous","","","","Synonym","subjective synonym","Subgenus","","Solari","1930","Y","b228716a-511f-4875-b0eb-2215142bc0a8","20220606T03:24:46.885+0000","ac10273f-e29e-4ef1-8d73-9d6320a7a1ae","20220616T08:53:57.456+0000","","6e155aa8-8d46-47e3-a962-ae43e08e9e3d","Solari, F.","1930","Sulla eccezionale conformazione dei tarsi (visibilmente pentameri) nel genere <i>Ephimeropus</i> Hochhuth ed in alcuni altri Bagoini (Col. Curc.)","42-50","","Bollettino della Società Entomologica Italiana","","26-III-1930","","<!--MARK--><a href='null3e3e222a-7c9f-4c45-801d-0b328d0bbfa5' class='mouseoverHref'>Solari, F. 1930. Sulla eccezionale conformazione dei tarsi (visibilmente pentameri) nel genere <i>Ephimeropus</i> Hochhuth ed in alcuni altri Bagoini (Col. Curc.).</a> <!--MARK--><!--MARK--><a href='null97b2190f-c3d9-47f5-a348-20c26559e7d6' class='mouseoverHref'><em>Bollettino della Società Entomologica Italiana</em></a> <strong>62</strong>(3): 42-50<!--MARK--> [Date published 26-III-1930]","","Article in Journal","3e3e222a-7c9f-4c45-801d-0b328d0bbfa5","20120516T01:22:52.942+0000","97b2190f-c3d9-47f5-a348-20c26559e7d6"
"","","natator","Bagous (Macropelmus) natator O'Brien, 1992","CURCULIONIDAE","Bagous","Macropelmus","natator","","Valid Name","","Species","","O'Brien","1992","Y","b9d89593-2dfb-4788-b769-bb5ded7c3684","20220606T03:24:46.885+0000","be861d8a-75ca-4eb5-bcaa-6d5106686141","20220616T08:53:57.456+0000","ac10273f-e29e-4ef1-8d73-9d6320a7a1ae","be861d8a-75ca-4eb5-bcaa-6d5106686141","","","","","","","","","","","","","","",""
"","","natator","Bagous natator O'Brien, 1992","","Bagous","","natator","","Synonym","synonym","Species","","O'Brien","1992","Y","818b3f32-61f2-4759-9da0-3ca1befb80da","20220606T03:24:46.885+0000","be861d8a-75ca-4eb5-bcaa-6d5106686141","20220616T08:53:57.456+0000","","18746750-961d-47df-bda8-947caf336998","O'Brien, C.W. & Askevold, I.S.","1992","Systematics and evolution of weevils of the genus <i>Bagous</i> Germar (Coleoptera: Curculionidae), I. Species of Australia","331-452","","Transactions of the American Entomological Society","","15-XII-1992","","<!--MARK--><a href='null554b39cc-2211-4482-a1f9-c354b0ce288b' class='mouseoverHref'>O'Brien, C.W. & Askevold, I.S. 1992. Systematics and evolution of weevils of the genus <i>Bagous</i> Germar (Coleoptera: Curculionidae), I. Species of Australia.</a> <!--MARK--><!--MARK--><a href='nullab463570-432f-4c53-bc7c-2254ed8f75b1' class='mouseoverHref'><em>Transactions of the American Entomological Society</em></a> <strong>118</strong>(4): 331-452<!--MARK--> [Date published 15-XII-1992]","","Article in Journal","554b39cc-2211-4482-a1f9-c354b0ce288b","20120516T00:50:33.666+0000","ab463570-432f-4c53-bc7c-2254ed8f75b1"
"","","adelaidae","Bagous (Macropelmus) adelaidae Blackburn, 1894","CURCULIONIDAE","Bagous","Macropelmus","adelaidae","","Valid Name","","Species","","Blackburn","1894","Y","8cd099a1-2263-4ac6-a265-49aa426a97bf","20220606T03:24:46.885+0000","c13d8668-0a6e-4395-a816-df43d95ab8e7","20220616T08:53:57.456+0000","ac10273f-e29e-4ef1-8d73-9d6320a7a1ae","c13d8668-0a6e-4395-a816-df43d95ab8e7","","","","","","","","","","","","","","",""
"","","adelaidae","Bagous adelaidae Blackburn, 1894","","Bagous","","adelaidae","","Synonym","synonym","Species","","Blackburn","1894","Y","b733cf17-6094-4d39-91fc-6829d39ea4ca","20220606T03:24:46.885+0000","c13d8668-0a6e-4395-a816-df43d95ab8e7","20220616T08:53:57.456+0000","","18574fb5-8c71-49d8-a714-631faf4e5a24","Blackburn, T.","1894","Notes on Australian Coleoptera, with descriptions of new species. Part XIV","245-286","","Proceedings of the Linnean Society of New South Wales","","12-III-1894","","<!--MARK--><a href='null707acc5f-21a1-4ae3-a788-05cda745d046' class='mouseoverHref'>Blackburn, T. 1894. Notes on Australian Coleoptera, with descriptions of new species. Part XIV.</a> <!--MARK--><!--MARK--><a href='nullc12cd779-adb5-41ea-bd2c-75f6864cf22e' class='mouseoverHref'><em>Proceedings of the Linnean Society of New South Wales</em></a> 2 <strong>8</strong>: 245-286<!--MARK--> [Date published 12-III-1894]","","Article in Journal","707acc5f-21a1-4ae3-a788-05cda745d046","20110831T03:46:50.686+0000","c12cd779-adb5-41ea-bd2c-75f6864cf22e"
"","","apicalis","Bagous (Macropelmus) apicalis O'Brien, 1992","CURCULIONIDAE","Bagous","Macropelmus","apicalis","","Valid Name","","Species","","O'Brien","1992","Y","b36a983d-d74e-4591-9cc7-1bef4685e6a5","20220606T03:24:46.885+0000","cf63ea1a-9b1f-46b7-8e63-a27483c58262","20220616T08:53:57.456+0000","ac10273f-e29e-4ef1-8d73-9d6320a7a1ae","cf63ea1a-9b1f-46b7-8e63-a27483c58262","","","","","","","","","","","","","","",""
"","","apicalis","Bagous apicalis O'Brien, 1992","","Bagous","","apicalis","","Synonym","synonym","Species","","O'Brien","1992","Y","280165d2-6a9e-4988-b2b6-1f00e503d157","20220606T03:24:46.885+0000","cf63ea1a-9b1f-46b7-8e63-a27483c58262","20220616T08:53:57.456+0000","","2afd121d-f579-4fd7-a577-a3d682784117","O'Brien, C.W. & Askevold, I.S.","1992","Systematics and evolution of weevils of the genus <i>Bagous</i> Germar (Coleoptera: Curculionidae), I. Species of Australia","331-452","","Transactions of the American Entomological Society","","15-XII-1992","","<!--MARK--><a href='null554b39cc-2211-4482-a1f9-c354b0ce288b' class='mouseoverHref'>O'Brien, C.W. & Askevold, I.S. 1992. Systematics and evolution of weevils of the genus <i>Bagous</i> Germar (Coleoptera: Curculionidae), I. Species of Australia.</a> <!--MARK--><!--MARK--><a href='nullab463570-432f-4c53-bc7c-2254ed8f75b1' class='mouseoverHref'><em>Transactions of the American Entomological Society</em></a> <strong>118</strong>(4): 331-452<!--MARK--> [Date published 15-XII-1992]","","Article in Journal","554b39cc-2211-4482-a1f9-c354b0ce288b","20120516T00:50:33.666+0000","ab463570-432f-4c53-bc7c-2254ed8f75b1"
"","","dostinei","Bagous (Macropelmus) dostinei O'Brien, 1992","CURCULIONIDAE","Bagous","Macropelmus","dostinei","","Valid Name","","Species","","O'Brien","1992","Y","dda4f32d-e59a-48e4-b073-2ac8f3894d92","20220606T03:24:46.885+0000","a9bc816d-3317-4c51-b3aa-4b30569a7139","20220616T08:53:57.456+0000","ac10273f-e29e-4ef1-8d73-9d6320a7a1ae","a9bc816d-3317-4c51-b3aa-4b30569a7139","","","","","","","","","","","","","","",""
"","","dostinei","Bagous dostinei O'Brien, 1992","","Bagous","","dostinei","","Synonym","synonym","Species","","O'Brien","1992","Y","37e50fa8-6f33-4c80-9ba0-a0ae0d90fdb9","20220606T03:24:46.885+0000","a9bc816d-3317-4c51-b3aa-4b30569a7139","20220616T08:53:57.456+0000","","29f407bd-a826-4ee9-aba4-cf637428010d","O'Brien, C.W. & Askevold, I.S.","1992","Systematics and evolution of weevils of the genus <i>Bagous</i> Germar (Coleoptera: Curculionidae), I. Species of Australia","331-452","","Transactions of the American Entomological Society","","15-XII-1992","","<!--MARK--><a href='null554b39cc-2211-4482-a1f9-c354b0ce288b' class='mouseoverHref'>O'Brien, C.W. & Askevold, I.S. 1992. Systematics and evolution of weevils of the genus <i>Bagous</i> Germar (Coleoptera: Curculionidae), I. Species of Australia.</a> <!--MARK--><!--MARK--><a href='nullab463570-432f-4c53-bc7c-2254ed8f75b1' class='mouseoverHref'><em>Transactions of the American Entomological Society</em></a> <strong>118</strong>(4): 331-452<!--MARK--> [Date published 15-XII-1992]","","Article in Journal","554b39cc-2211-4482-a1f9-c354b0ce288b","20120516T00:50:33.666+0000","ab463570-432f-4c53-bc7c-2254ed8f75b1"
"","","simulans","Bagous (Macropelmus) simulans O'Brien, 1992","CURCULIONIDAE","Bagous","Macropelmus","simulans","","Valid Name","","Species","","O'Brien","1992","Y","d91add34-c323-4326-9722-f620c2037d51","20220606T03:24:46.885+0000","6afd7b1e-4ca3-420f-ae2d-51af98e3349e","20220616T08:53:57.456+0000","ac10273f-e29e-4ef1-8d73-9d6320a7a1ae","6afd7b1e-4ca3-420f-ae2d-51af98e3349e","","","","","","","","","","","","","","",""
"","","simulans","Bagous simulans O'Brien, 1992","","Bagous","","simulans","","Synonym","synonym","Species","","O'Brien","1992","Y","d8d949ba-d721-4b93-ab28-1399fc0a16db","20220606T03:24:46.885+0000","6afd7b1e-4ca3-420f-ae2d-51af98e3349e","20220616T08:53:57.456+0000","","20a35759-43d7-496d-9c90-c5d66cb0325f","O'Brien, C.W. & Askevold, I.S.","1992","Systematics and evolution of weevils of the genus <i>Bagous</i> Germar (Coleoptera: Curculionidae), I. Species of Australia","331-452","","Transactions of the American Entomological Society","","15-XII-1992","","<!--MARK--><a href='null554b39cc-2211-4482-a1f9-c354b0ce288b' class='mouseoverHref'>O'Brien, C.W. & Askevold, I.S. 1992. Systematics and evolution of weevils of the genus <i>Bagous</i> Germar (Coleoptera: Curculionidae), I. Species of Australia.</a> <!--MARK--><!--MARK--><a href='nullab463570-432f-4c53-bc7c-2254ed8f75b1' class='mouseoverHref'><em>Transactions of the American Entomological Society</em></a> <strong>118</strong>(4): 331-452<!--MARK--> [Date published 15-XII-1992]","","Article in Journal","554b39cc-2211-4482-a1f9-c354b0ce288b","20120516T00:50:33.666+0000","ab463570-432f-4c53-bc7c-2254ed8f75b1"
"","","utriculariae","Bagous (Macropelmus) utriculariae O'Brien, 1992","CURCULIONIDAE","Bagous","Macropelmus","utriculariae","","Valid Name","","Species","","O'Brien","1992","Y","1ffc6bbc-06ae-41d2-baae-0b4fca7602cb","20220606T03:24:46.885+0000","5c874dca-d26a-4d3f-b663-2465c93f9af3","20220616T08:53:57.456+0000","ac10273f-e29e-4ef1-8d73-9d6320a7a1ae","5c874dca-d26a-4d3f-b663-2465c93f9af3","","","","","","","","","","","","","","",""
