"CAVS_CODE","CAAB_CODE","NAMES_VARIOUS","SCIENTIFIC_NAME","FAMILY","GENUS","SUBGENUS","SPECIES","SUBSPECIES","NAME_TYPE","NAME_SUBTYPE","RANK","QUALIFICATION","AUTHOR","YEAR","ORIG_COMBINATION","NAME_GUID","NAME_LAST_UPDATE","TAXON_GUID","TAXON_LAST_UPDATE","PARENT_TAXON_GUID","CONCEPT_GUID","PUB_PUB_AUTHOR","PUB_PUB_YEAR","PUB_PUB_TITLE","PUB_PUB_PAGES","PUB_PUB_PARENT_BOOK_TITLE","PUB_PUB_PARENT_JOURNAL_TITLE","PUB_PUB_PARENT_ARTICLE_TITLE","PUB_PUB_PUBLICATION_DATE","PUB_PUB_PUBLISHER","PUB_PUB_FORMATTED","PUB_PUB_QUALIFICATION","PUB_PUB_TYPE","PUBLICATION_GUID","PUBLICATION_LAST_UPDATE","PARENT_PUBLICATION_GUID"
"","","Caenophanes","Caenophanes Belokobylskij, Iqbal & Austin, 2004","BRACONIDAE","Caenophanes","","","","Valid Name","","Genus","","Belokobylskij, Iqbal & Austin","2004","Y","ea86ad17-c002-4535-9346-89805719c334","20220209T23:01:57.078+0000","8f8c94a2-8e24-4152-bc76-ed396f807cf7","20220616T08:49:13.574+0000","d7ec53ec-c171-467c-b68a-52d3eb80c8fc","8f8c94a2-8e24-4152-bc76-ed396f807cf7","","","","","","","","","","","","","","",""
"","","Caenophanes","Caenophanes Belokobylskij, Iqbal & Austin, 2004","BRACONIDAE","Caenophanes","","","","Synonym","synonym","Genus","","Belokobylskij, Iqbal & Austin","2004","Y","356166c5-4ace-4a64-a6d0-ca56c2fe08d5","20220209T23:01:57.078+0000","8f8c94a2-8e24-4152-bc76-ed396f807cf7","20220616T08:49:13.574+0000","","34915e2c-a654-4851-8eaf-5cc8ca2feb22","Belokobylskij, S.A., Iqbal, M. & Austin, A.D.","2004","Systematics, distribution and diversity of the Australian doryctine wasps (Hymenoptera, Braconidae, Doryctinae)","1-150","","Records of the South Australian Museum (Adelaide) Monogr. Ser","","","","<!--MARK--><a href='../../../../publication/cd47f20c-6b48-4cb7-9d73-82060a9bc6e4' class='mouseoverHref'>Belokobylskij, S.A., Iqbal, M. & Austin, A.D. 2004. Systematics, distribution and diversity of the Australian doryctine wasps (Hymenoptera, Braconidae, Doryctinae).</a> <!--MARK--><!--MARK--><a href='../../../../publication/72a46492-91b3-4ce1-8ecd-cf143202df1d' class='mouseoverHref'><em>Records of the South Australian Museum (Adelaide) Monogr. Ser</em></a> 8. 1-150<!--MARK-->","","Article in Journal","cd47f20c-6b48-4cb7-9d73-82060a9bc6e4","20101222T06:35:02.522+0000","72a46492-91b3-4ce1-8ecd-cf143202df1d"
"","","nukunu","Caenophanes nukunu (Marsh & Austin, 1994)","BRACONIDAE","Caenophanes","","nukunu","","Valid Name","","Species","","Marsh & Austin","1994","N","3de9edd1-c688-4a24-9f98-781ca748250f","20220209T23:01:57.078+0000","e53d0354-3364-4352-9d7e-739e838a0643","20220616T08:49:13.574+0000","8f8c94a2-8e24-4152-bc76-ed396f807cf7","e53d0354-3364-4352-9d7e-739e838a0643","","","","","","","","","","","","","","",""
"","","nukunu","Heterospilus nukunu Marsh & Austin, 1994","","Heterospilus","","nukunu","","Synonym","synonym","Species","","Marsh & Austin","1994","Y","d879874b-2cc2-42bf-b404-6fe750a6f87d","20220209T23:01:57.078+0000","e53d0354-3364-4352-9d7e-739e838a0643","20220616T08:49:13.574+0000","","b9c691b9-c7e7-48f8-ab38-175aa72b360a","Marsh, P.M. & Austin, A.D.","1994","<i>In</i>: Austin, A.D., Quicke, D.L.J.  & Marsh, P.M. The hymenopterous parasitoids of eucalypt longicorn beetles, <i>Phoracantha</i> spp. (Coleoptera: Cerambycidae) in Australia","145-174","","Bulletin of Entomological Research","","","","<!--MARK--><a href='../../../../publication/fd9222b7-d75a-4557-a88a-afb76dd0f4e9' class='mouseoverHref'>Marsh, P.M. & Austin, A.D. 1994. <i>In</i>: Austin, A.D., Quicke, D.L.J.  & Marsh, P.M. The hymenopterous parasitoids of eucalypt longicorn beetles, <i>Phoracantha</i> spp. (Coleoptera: Cerambycidae) in Australia.</a> <!--MARK--><!--MARK--><a href='../../../../publication/ef0b7d10-3b2d-4f9f-affe-9a3dc2101d9f' class='mouseoverHref'><em>Bulletin of Entomological Research</em></a> <strong>84</strong>: 145-174<!--MARK-->","","Article in Journal","fd9222b7-d75a-4557-a88a-afb76dd0f4e9","20081009T05:11:37.000+0000","ef0b7d10-3b2d-4f9f-affe-9a3dc2101d9f"
"","","nukunu","Caenophanes nukunu (Marsh & Austin, 1994)","","Caenophanes","","nukunu","","Generic Combination","","Species","","Marsh & Austin","1994","N","b782043d-dd51-4452-81ec-30688f38c179","20220209T23:01:57.078+0000","e53d0354-3364-4352-9d7e-739e838a0643","20220616T08:49:13.574+0000","","c6f1340e-0f56-4c83-ae13-2cede8f13ddf","Belokobylskij, S.A., Iqbal, M. & Austin, A.D.","2004","Systematics, distribution and diversity of the Australian doryctine wasps (Hymenoptera, Braconidae, Doryctinae)","1-150","","Records of the South Australian Museum (Adelaide) Monogr. Ser","","","","<!--MARK--><a href='../../../../publication/cd47f20c-6b48-4cb7-9d73-82060a9bc6e4' class='mouseoverHref'>Belokobylskij, S.A., Iqbal, M. & Austin, A.D. 2004. Systematics, distribution and diversity of the Australian doryctine wasps (Hymenoptera, Braconidae, Doryctinae).</a> <!--MARK--><!--MARK--><a href='../../../../publication/72a46492-91b3-4ce1-8ecd-cf143202df1d' class='mouseoverHref'><em>Records of the South Australian Museum (Adelaide) Monogr. Ser</em></a> 8. 1-150<!--MARK-->","","Article in Journal","cd47f20c-6b48-4cb7-9d73-82060a9bc6e4","20101222T06:35:02.522+0000","72a46492-91b3-4ce1-8ecd-cf143202df1d"
"","","asion","Caenophanes asion (Nixon, 1943)","BRACONIDAE","Caenophanes","","asion","","Valid Name","","Species","","Nixon","1943","N","f55133da-01c0-4d6f-b380-72e430db72fb","20220209T23:01:57.078+0000","b45ff7be-a7c0-4eae-9f96-830d7bfb31b9","20220616T08:49:13.574+0000","8f8c94a2-8e24-4152-bc76-ed396f807cf7","b45ff7be-a7c0-4eae-9f96-830d7bfb31b9","","","","","","","","","","","","","","",""
"","","asion","Heterospilus asion Nixon, 1943","","Heterospilus","","asion","","Synonym","synonym","Species","","Nixon","1943","Y","9142b3f6-c565-4419-81f3-7b4a33cd7be4","20220209T23:01:57.078+0000","b45ff7be-a7c0-4eae-9f96-830d7bfb31b9","20220616T08:49:13.574+0000","","d7852e64-e9bd-4d46-bee0-b186060c6dd9","Nixon, G.E.J.","1943","New braconid parasites of Australian wood-boring beetles with notes on the subfamily Hecabolinae (Hym., Braconidae)","257-267","","Bulletin of Entomological Research","","","","<!--MARK--><a href='../../../../publication/f30b7868-aae6-48b6-94cf-8dfe72dcb901' class='mouseoverHref'>Nixon, G.E.J. 1943. New braconid parasites of Australian wood-boring beetles with notes on the subfamily Hecabolinae (Hym., Braconidae).</a> <!--MARK--><!--MARK--><a href='../../../../publication/ef0b7d10-3b2d-4f9f-affe-9a3dc2101d9f' class='mouseoverHref'><em>Bulletin of Entomological Research</em></a> <strong>34</strong>: 257-267<!--MARK-->","","Article in Journal","f30b7868-aae6-48b6-94cf-8dfe72dcb901","20081009T05:11:37.000+0000","ef0b7d10-3b2d-4f9f-affe-9a3dc2101d9f"
"","","asion","Caenophanes asion (Nixon, 1943)","","Caenophanes","","asion","","Generic Combination","","Species","","Nixon","1943","N","ac078cd7-7833-459f-a1b6-48e4adeacc30","20220209T23:01:57.078+0000","b45ff7be-a7c0-4eae-9f96-830d7bfb31b9","20220616T08:49:13.574+0000","","b4a102ba-1014-435e-894c-613de75ae937","Belokobylskij, S.A., Iqbal, M. & Austin, A.D.","2004","Systematics, distribution and diversity of the Australian doryctine wasps (Hymenoptera, Braconidae, Doryctinae)","1-150","","Records of the South Australian Museum (Adelaide) Monogr. Ser","","","","<!--MARK--><a href='../../../../publication/cd47f20c-6b48-4cb7-9d73-82060a9bc6e4' class='mouseoverHref'>Belokobylskij, S.A., Iqbal, M. & Austin, A.D. 2004. Systematics, distribution and diversity of the Australian doryctine wasps (Hymenoptera, Braconidae, Doryctinae).</a> <!--MARK--><!--MARK--><a href='../../../../publication/72a46492-91b3-4ce1-8ecd-cf143202df1d' class='mouseoverHref'><em>Records of the South Australian Museum (Adelaide) Monogr. Ser</em></a> 8. 1-150<!--MARK-->","","Article in Journal","cd47f20c-6b48-4cb7-9d73-82060a9bc6e4","20101222T06:35:02.522+0000","72a46492-91b3-4ce1-8ecd-cf143202df1d"
