"CAVS_CODE","CAAB_CODE","NAMES_VARIOUS","SCIENTIFIC_NAME","FAMILY","GENUS","SUBGENUS","SPECIES","SUBSPECIES","NAME_TYPE","NAME_SUBTYPE","RANK","QUALIFICATION","AUTHOR","YEAR","ORIG_COMBINATION","NAME_GUID","NAME_LAST_UPDATE","TAXON_GUID","TAXON_LAST_UPDATE","PARENT_TAXON_GUID","CONCEPT_GUID","PUB_PUB_AUTHOR","PUB_PUB_YEAR","PUB_PUB_TITLE","PUB_PUB_PAGES","PUB_PUB_PARENT_BOOK_TITLE","PUB_PUB_PARENT_JOURNAL_TITLE","PUB_PUB_PARENT_ARTICLE_TITLE","PUB_PUB_PUBLICATION_DATE","PUB_PUB_PUBLISHER","PUB_PUB_FORMATTED","PUB_PUB_QUALIFICATION","PUB_PUB_TYPE","PUBLICATION_GUID","PUBLICATION_LAST_UPDATE","PARENT_PUBLICATION_GUID"
"","","CALAPPIDAE","CALAPPIDAE De Haan, 1833","","","","","","Valid Name","","Family","","De Haan","1833","Y","097652e0-35e6-4bbe-a832-c2dedf5473a5","20220504T01:21:58.041+0000","2ac24ca9-eed5-463d-8eeb-2c0802793b8a","20220510T08:28:17.473+0000","c0344c13-bc05-4452-b5c7-8bdc2dd3bdf3","2ac24ca9-eed5-463d-8eeb-2c0802793b8a","","","","","","","","","","","","","","",""
"","","Calappidea","Calappidea De Haan, 1833","Calappidea","","","","","Synonym","synonym","Family","corrected to Calappidae by White, A. 1847. <em>List of the Specimens of Crustacea in the Collection of the British Museum</em>. London : British Museum viii 143 pp. (44); Name No. 371 on Official List of Family-Group Names in Zoology, see International Commission on Zoological Nomenclature 1964. Opinion 712. Forty-seven genera of Decapod Crustacea: placed on the Official List. <em>Bulletin of Zoological Nomenclature</em> <strong>21</strong>: 336-351 [26 November 1964]","De Haan","1833","Y","59f59046-69a8-4a98-99c8-491d0e9c1163","20220504T01:21:58.041+0000","2ac24ca9-eed5-463d-8eeb-2c0802793b8a","20220510T08:28:17.473+0000","","340265f1-2f01-4b2e-a5cc-3e2564b7cfe5","De Haan, W.","1833","Crustacea","i-xvii, i-xxxi, ix-xvi, 1-243 pls A-J,","Fauna Japonica sive Descriptio Animalium, quae in Itinere per Japoniam<i>, Jussu et Auspiciis Superiorum, qui Summum in India Batava Imperium Tenent, Suscepto, Annis 1823-1830 Collegit, Notis, Observationibus et Adumbrationibus Illustravit</i>","","","","","<!--MARK--><a href='null9249e415-0893-4288-be37-d8289334b19d' class='mouseoverHref'>De Haan, W. 1833. Crustacea. i-xvii, i-xxxi, ix-xvi, 1-243 pls A-J,</a> <!--MARK--><em>in</em> <!--MARK--><a href='null8fcd42e5-30fa-41a0-a67c-7e253cb1c03f' class='mouseoverHref'>Von Siebold, P.F. (ed.). <em>Fauna Japonica sive Descriptio Animalium, quae in Itinere per Japoniam<i>, Jussu et Auspiciis Superiorum, qui Summum in India Batava Imperium Tenent, Suscepto, Annis 1823-1830 Collegit, Notis, Observationibus et Adumbrationibus Illustravit</i></em>. Leiden : Lugduni-Batavorum.</a><!--MARK--><!--MARK--> [published from 1833-1850]","published from 1833-1850","Chapter in Book","9249e415-0893-4288-be37-d8289334b19d","20081009T05:11:37.000+0000","8fcd42e5-30fa-41a0-a67c-7e253cb1c03f"
"","","Calappa","Calappa Weber, 1795","CALAPPIDAE","Calappa","","","","Valid Name","","Genus","","Weber","1795","Y","11c54a6c-eb20-440c-a39b-df8b0e75c963","20220504T01:21:58.041+0000","29b7b911-411d-4ed0-80c6-5edf88b23dcc","20220510T08:28:17.473+0000","2ac24ca9-eed5-463d-8eeb-2c0802793b8a","29b7b911-411d-4ed0-80c6-5edf88b23dcc","","","","","","","","","","","","","","",""
"","","Calappa","Calappa Weber, 1795","","Calappa","","","","Synonym","synonym","Genus","name placed on the Official List of Generic Names in Zoology, see International Commission on Zoological Nomenclature 1964. Opinion 712. Forty-seven genera of Decapod Crustacea: placed on the Official List. <em>Bulletin of Zoological Nomenclature</em> <strong>21</strong>: 336-351 [26 November 1964]; gender feminine","Weber","1795","Y","ea2e586b-284d-49d1-958c-72bd41a8a20a","20220504T01:21:58.041+0000","29b7b911-411d-4ed0-80c6-5edf88b23dcc","20220510T08:28:17.473+0000","","3fa2f090-4241-4e6d-b9be-cd8c33f839bc","Weber, F.","1795","Nomenclator entomologicus secundum entomologian systematicam ill. Fabricii, adjectis speciebus recens detectis et varietatibus","viii 171","","","","","C.E. Bohn","<!--MARK--><a href='null2ef0d4e3-91ec-44ca-b055-544e829ce030' class='mouseoverHref'>Weber, F. 1795. <em>Nomenclator entomologicus secundum entomologian systematicam ill. Fabricii, adjectis speciebus recens detectis et varietatibus</em>. Chiloni et Hamburgi : C.E. Bohn viii 171 pp.</a><!--MARK-->","","Book","2ef0d4e3-91ec-44ca-b055-544e829ce030","20081009T05:11:37.000+0000",""
"","","Gallus","Gallus De Haan, 1837","","Gallus","","","","Synonym","synonym","Genus","junior homonym of <I>Gallus</I> Brisson, 1760 (Aves); gender masculine","De Haan","1837","Y","81a03f24-901e-447d-8d89-ea356355f9ce","20220504T01:21:58.041+0000","29b7b911-411d-4ed0-80c6-5edf88b23dcc","20220510T08:28:17.473+0000","","c3b15273-76d2-40c1-b542-8593f510b3f3","De Haan, W.","1837","Crustacea","1-243 pls A-J, L-Q, 1-55, circ. tab. 2","Fauna Japonica sive Descriptio Animalium, quae in Itinere per Japoniam<i>, Jussu et Auspiciis Superiorum, qui Summum in India Batava Imperium Tenent, Suscepto, Annis 1823-1830 Collegit, Notis, Observationibus et Adumbrationibus Illustravit</i>","","","","","<!--MARK--><a href='null28434c5b-f8de-455f-8fe1-12c8b3cf10b8' class='mouseoverHref'>De Haan, W. 1837. Crustacea. 1-243 pls A-J, L-Q, 1-55, circ. tab. 2</a> <!--MARK--><em>in</em> <!--MARK--><a href='null86d2ae19-2794-4b72-b4fd-b31cbf4cf5d4' class='mouseoverHref'>Von Siebold, P.F. (ed.). <em>Fauna Japonica sive Descriptio Animalium, quae in Itinere per Japoniam<i>, Jussu et Auspiciis Superiorum, qui Summum in India Batava Imperium Tenent, Suscepto, Annis 1823-1830 Collegit, Notis, Observationibus et Adumbrationibus Illustravit</i></em>. Leiden : Lugundi-Batavorum.</a><!--MARK--><!--MARK--> [published from 1833-1850]","published from 1833-1850","Chapter in Book","28434c5b-f8de-455f-8fe1-12c8b3cf10b8","20081009T05:11:37.000+0000","86d2ae19-2794-4b72-b4fd-b31cbf4cf5d4"
"","","Camara","Camara De Haan, 1837","","Camara","","","","Synonym","synonym","Genus","gender feminine","De Haan","1837","Y","c0e1da7f-aa35-4839-a087-61e87742c80b","20220504T01:21:58.041+0000","29b7b911-411d-4ed0-80c6-5edf88b23dcc","20220510T08:28:17.473+0000","","70fae924-b158-44ee-83c4-03f53797afd9","De Haan, W.","1837","Crustacea","1-243 pls A-J, L-Q, 1-55, circ. tab. 2","Fauna Japonica sive Descriptio Animalium, quae in Itinere per Japoniam<i>, Jussu et Auspiciis Superiorum, qui Summum in India Batava Imperium Tenent, Suscepto, Annis 1823-1830 Collegit, Notis, Observationibus et Adumbrationibus Illustravit</i>","","","","","<!--MARK--><a href='null28434c5b-f8de-455f-8fe1-12c8b3cf10b8' class='mouseoverHref'>De Haan, W. 1837. Crustacea. 1-243 pls A-J, L-Q, 1-55, circ. tab. 2</a> <!--MARK--><em>in</em> <!--MARK--><a href='null86d2ae19-2794-4b72-b4fd-b31cbf4cf5d4' class='mouseoverHref'>Von Siebold, P.F. (ed.). <em>Fauna Japonica sive Descriptio Animalium, quae in Itinere per Japoniam<i>, Jussu et Auspiciis Superiorum, qui Summum in India Batava Imperium Tenent, Suscepto, Annis 1823-1830 Collegit, Notis, Observationibus et Adumbrationibus Illustravit</i></em>. Leiden : Lugundi-Batavorum.</a><!--MARK--><!--MARK--> [published from 1833-1850]","published from 1833-1850","Chapter in Book","28434c5b-f8de-455f-8fe1-12c8b3cf10b8","20081009T05:11:37.000+0000","86d2ae19-2794-4b72-b4fd-b31cbf4cf5d4"
"","","Lophos","Lophos De Haan, 1837","","Lophos","","","","Synonym","synonym","Genus","gender masculine","De Haan","1837","Y","3f24d9ef-3dd7-4902-934d-7dda99e3293b","20220504T01:21:58.041+0000","29b7b911-411d-4ed0-80c6-5edf88b23dcc","20220510T08:28:17.473+0000","","db12efba-1362-42c3-8cc6-388759576882","De Haan, W.","1837","Crustacea","1-243 pls A-J, L-Q, 1-55, circ. tab. 2","Fauna Japonica sive Descriptio Animalium, quae in Itinere per Japoniam<i>, Jussu et Auspiciis Superiorum, qui Summum in India Batava Imperium Tenent, Suscepto, Annis 1823-1830 Collegit, Notis, Observationibus et Adumbrationibus Illustravit</i>","","","","","<!--MARK--><a href='null28434c5b-f8de-455f-8fe1-12c8b3cf10b8' class='mouseoverHref'>De Haan, W. 1837. Crustacea. 1-243 pls A-J, L-Q, 1-55, circ. tab. 2</a> <!--MARK--><em>in</em> <!--MARK--><a href='null86d2ae19-2794-4b72-b4fd-b31cbf4cf5d4' class='mouseoverHref'>Von Siebold, P.F. (ed.). <em>Fauna Japonica sive Descriptio Animalium, quae in Itinere per Japoniam<i>, Jussu et Auspiciis Superiorum, qui Summum in India Batava Imperium Tenent, Suscepto, Annis 1823-1830 Collegit, Notis, Observationibus et Adumbrationibus Illustravit</i></em>. Leiden : Lugundi-Batavorum.</a><!--MARK--><!--MARK--> [published from 1833-1850]","published from 1833-1850","Chapter in Book","28434c5b-f8de-455f-8fe1-12c8b3cf10b8","20081009T05:11:37.000+0000","86d2ae19-2794-4b72-b4fd-b31cbf4cf5d4"
"","","Pistor","Pistor Gistel, 1848","","Pistor","","","","Synonym","synonym","Genus","<I>nom. nov.</I> for <I>Gallus</I> De Haan, 1837; gender masculine","Gistel","1848","Y","c11e0f0d-0704-435d-ba1b-3a486358226b","20220504T01:21:58.041+0000","29b7b911-411d-4ed0-80c6-5edf88b23dcc","20220510T08:28:17.473+0000","","87a34201-b689-46b6-bc4a-c05995269152","Gistel, J.","1848","Naturgeschichte des Thierreichs für höhere schulen bearbeitet","xvi 216 pp., 32 pls","","","","","","<!--MARK--><a href='nullba7c0e60-5b8b-4422-aed4-9003721a7d38' class='mouseoverHref'>Gistel, J. 1848. <em>Naturgeschichte des Thierreichs für höhere schulen bearbeitet</em>. Stuttgart xvi 216 pp., 32 pls.</a><!--MARK-->","","Book","ba7c0e60-5b8b-4422-aed4-9003721a7d38","20110915T01:47:52.336+0000",""
"","","calappa","Calappa calappa (Linnaeus, 1758)","CALAPPIDAE","Calappa","","calappa","","Valid Name","","Species","","Linnaeus","1758","N","68d9b579-771d-4202-8ec3-8d0c8ee94025","20220504T01:21:58.041+0000","362fbef6-bb99-4147-b302-4ad8fc835596","20220510T08:28:17.473+0000","29b7b911-411d-4ed0-80c6-5edf88b23dcc","362fbef6-bb99-4147-b302-4ad8fc835596","","","","","","","","","","","","","","",""
"","","Giant Box Crab","","","","","","","Common Name","General","Species","","","","","70cb1195-6863-4560-b897-fa66d1aee066","20220504T01:21:58.041+0000","362fbef6-bb99-4147-b302-4ad8fc835596","20220510T08:28:17.473+0000","","","","","","","","","","","","","","","","",""
"","","calappoides","Cancer calappoides Rumphius, 1741","","Cancer","","calappoides","","Synonym","synonym","Species","pre-Linnaean, and therefore nomenclaturally unavailable","Rumphius","1741","Y","fb4c8825-c7f0-41aa-af2c-0cba5487d8d8","20220504T01:21:58.041+0000","362fbef6-bb99-4147-b302-4ad8fc835596","20220510T08:28:17.473+0000","","1c77c73b-025b-410a-b987-b6c82645d6c7","Rumphius, G.E.","1741","<i>D'Amboinsche Rariteitkamer</i>, behelzende eene beschryvinge van allerhande zoo weeke als harde schaalvisschen, te weeten raare Krabben, Kreeften, en diergelyke Zeedieren, als mede allerhande Hoorntjes en Schulpen, die men in d'Amboinsche Zee vindt : daar beneven zommige Mineraalen, Gesteenten, en soorten van Aarde, die in d'Amboinsche, en zommige omleggende Eilanden gevonden worden : Verdeelt in drie bocken, &c. Rumpf, Georg Eberhard, 1627-1702","","","","","","","<!--MARK--><a href='null6cce1d33-0cd8-49c0-bdca-1a552e107716' class='mouseoverHref'>Rumphius, G.E. 1741. <i>D'Amboinsche Rariteitkamer</i>, behelzende eene beschryvinge van allerhande zoo weeke als harde schaalvisschen, te weeten raare Krabben, Kreeften, en diergelyke Zeedieren, als mede allerhande Hoorntjes en Schulpen, die men in d'Amboinsche Zee vindt : daar beneven zommige Mineraalen, Gesteenten, en soorten van Aarde, die in d'Amboinsche, en zommige omleggende Eilanden gevonden worden : Verdeelt in drie bocken, &c. Rumpf, Georg Eberhard, 1627-1702. Amsterdam Vol. I 340 pp. 60 pls [first edition 1705].</a>","","Miscellaneous","6cce1d33-0cd8-49c0-bdca-1a552e107716","20081009T05:11:37.000+0000",""
"","","calappa","Cancer calappa Linnaeus, 1758","","Cancer","","calappa","","Synonym","synonym","Species","","Linnaeus","1758","Y","73e89db3-1772-4675-a9aa-858bd5e5e953","20220504T01:21:58.041+0000","362fbef6-bb99-4147-b302-4ad8fc835596","20220510T08:28:17.473+0000","","5ba202d0-8dbe-456e-b58f-1f71b604eea6","Linnaeus, C.","1758","Cancer","pp. 625-634","Systema naturae per regna tria naturae, secundem classes, ordines, genera, species, cum characteribus, differentis, synonymis, locis. Editio decima, reformata","","","","","<!--MARK--><a href='nulle273f538-9d59-4e7b-81c7-506c571f6181' class='mouseoverHref'>Linnaeus, C. 1758. Cancer. pp. 625-634</a> <!--MARK--><em>in</em> <!--MARK--><a href='null95f7aebe-acdc-4241-a7a8-403bf099042e' class='mouseoverHref'>Linnaeus, C. <em>Systema naturae per regna tria naturae, secundem classes, ordines, genera, species, cum characteribus, differentis, synonymis, locis. Editio decima, reformata</em>. Holmiae : Laurentii Salvii Tomus I 824 pp.</a><!--MARK-->","","Chapter in Book","e273f538-9d59-4e7b-81c7-506c571f6181","20170928T06:00:06.936+0000","95f7aebe-acdc-4241-a7a8-403bf099042e"
"","","flosculus","Cancer flosculus Seba, 1759","","Cancer","","flosculus","","Synonym","synonym","Species","name not formed as a Linnaean binominal, and therefore nomenclaturally unavailable","Seba","1759","Y","542b8044-4c2f-47d4-b682-cabe620962ba","20220504T01:21:58.041+0000","362fbef6-bb99-4147-b302-4ad8fc835596","20220510T08:28:17.473+0000","","75c9eced-f850-46bf-af72-b3473671f360","Seba, A.","1759","<i>Locupletissimi rerum naturalium thesauri accurata descriptio et iconibus artificiosissimis expressio per universam physices historiam</i>","212 pp. 116 pls","","","","","","<!--MARK--><a href='null77dbc8ae-c9d8-4435-9f94-2b1edbe48074' class='mouseoverHref'>Seba, A. 1759. <i>Locupletissimi rerum naturalium thesauri accurata descriptio et iconibus artificiosissimis expressio per universam physices historiam</i>. Amsterdam. Vol. 3. 212 pp. 116 pls</a>","","Miscellaneous","77dbc8ae-c9d8-4435-9f94-2b1edbe48074","20081009T05:11:37.000+0000",""
"","","heracleoticus","Cancer heracleoticus Seba, 1759","","Cancer","","heracleoticus","","Synonym","synonym","Species","name not formed as a Linnaean binominal, and therefore nomenclaturally unavailable","Seba","1759","Y","034d1572-b595-4b1a-b125-06b500c74eb0","20220504T01:21:58.041+0000","362fbef6-bb99-4147-b302-4ad8fc835596","20220510T08:28:17.473+0000","","7b9ff03a-f975-4ba2-918d-c4daa81d6076","Seba, A.","1759","<i>Locupletissimi rerum naturalium thesauri accurata descriptio et iconibus artificiosissimis expressio per universam physices historiam</i>","212 pp. 116 pls","","","","","","<!--MARK--><a href='null77dbc8ae-c9d8-4435-9f94-2b1edbe48074' class='mouseoverHref'>Seba, A. 1759. <i>Locupletissimi rerum naturalium thesauri accurata descriptio et iconibus artificiosissimis expressio per universam physices historiam</i>. Amsterdam. Vol. 3. 212 pp. 116 pls</a>","","Miscellaneous","77dbc8ae-c9d8-4435-9f94-2b1edbe48074","20081009T05:11:37.000+0000",""
"","","fornicatus","Cancer fornicatus Fabricius, 1781","","Cancer","","fornicatus","","Synonym","synonym","Species","","Fabricius","1781","Y","5e4af0a3-0d08-434e-8415-5dc53df4d7bd","20220504T01:21:58.041+0000","362fbef6-bb99-4147-b302-4ad8fc835596","20220510T08:28:17.473+0000","","d6acc6c9-5bcf-4ad4-97d4-2f2acc8123aa","Fabricius, J.C.","1781","Species Insectorum <i>exhibentes eorum Differentias, specificas, Synonyma auctorum, Loca natalia, Metamorphosia adiectis Observationibus, Descriptionibus</i>","viii 552","","","","","C.E. Bohnii","<!--MARK--><a href='nulle2508e8e-84fa-43fa-81d8-fb704342e20b' class='mouseoverHref'>Fabricius, J.C. 1781. <em>Species Insectorum <i>exhibentes eorum Differentias, specificas, Synonyma auctorum, Loca natalia, Metamorphosia adiectis Observationibus, Descriptionibus</i></em>. Hamburg & Kilonii : C.E. Bohnii Vol. 2 viii 552 pp.</a><!--MARK-->","","Book","e2508e8e-84fa-43fa-81d8-fb704342e20b","20081009T05:11:37.000+0000",""
"","","cerratonis","Cancer cerratonis Curtis, 1944","","Cancer","","cerratonis","","Synonym","synonym","Species","","Curtis","1944","Y","fe2b9fed-8b66-474e-b605-5c8d94ae7b96","20220504T01:21:58.041+0000","362fbef6-bb99-4147-b302-4ad8fc835596","20220510T08:28:17.473+0000","","2cac5772-9669-410c-bf02-dc578e9bf270","Curtiss, A.","1944","Further notes on the zoology of Tahiti","30 pp.","","","","","","<!--MARK--><a href='nullfad9ef95-3f02-4cef-93fd-aef001992b21' class='mouseoverHref'>Curtiss, A. 1944. Further notes on the zoology of Tahiti. Privately printed. 30 pp.</a>","","Miscellaneous","fad9ef95-3f02-4cef-93fd-aef001992b21","20111118T01:32:52.331+0000",""
"","","capellonis","Calappa capellonis Laurie, 1906","CALAPPIDAE","Calappa","","capellonis","","Valid Name","","Species","","Laurie","1906","Y","c697c51e-b3f8-4f3e-9636-ff6f9f03f3da","20220504T01:21:58.041+0000","04f2ed36-f889-4b05-945e-30cc9a1dcb4a","20220510T08:28:17.473+0000","29b7b911-411d-4ed0-80c6-5edf88b23dcc","04f2ed36-f889-4b05-945e-30cc9a1dcb4a","","","","","","","","","","","","","","",""
"","","capellonis","Calappa gallus capellonis Laurie, 1906","","Calappa","","gallus","capellonis","Synonym","synonym","Species","","Laurie","1906","Y","4377243b-7e8c-482e-8f29-e0d6eced83d3","20220504T01:21:58.041+0000","04f2ed36-f889-4b05-945e-30cc9a1dcb4a","20220510T08:28:17.473+0000","","1110b2b9-767f-4752-a38b-c28bd681a652","Laurie, R.D.","1906","Report on the Brachyura collected by Professor Herdman, at Ceylon, in 1902. Part V. Supplementary Report","349-432 figs 1-2 pls 1, 2","Report to the Government of Ceylon on the Pearl Oyster Fisheries of the Gulf of Manaar","","","","","<!--MARK--><a href='nullde8d771e-c367-469f-aa6c-28d0390ff415' class='mouseoverHref'>Laurie, R.D. 1906. Report on the Brachyura collected by Professor Herdman, at Ceylon, in 1902. Part V. Supplementary Report. 349-432 figs 1-2 pls 1, 2</a> <!--MARK--><em>in</em> <!--MARK--><a href='null7f0aff4e-93bb-4590-96b3-ff13d7e33113' class='mouseoverHref'>Herdman, W.A. (ed.). <em>Report to the Government of Ceylon on the Pearl Oyster Fisheries of the Gulf of Manaar</em>. London : Royal Society.</a><!--MARK-->","","Chapter in Book","de8d771e-c367-469f-aa6c-28d0390ff415","20081009T05:11:37.000+0000","7f0aff4e-93bb-4590-96b3-ff13d7e33113"
"","","clypeata","Calappa clypeata Borradaile, 1903","CALAPPIDAE","Calappa","","clypeata","","Valid Name","","Species","","Borradaile","1903","Y","24d45158-640f-4662-93dc-c2e108daafc8","20220504T01:21:58.041+0000","26b6d93d-1532-4746-96ee-17b4d92bef41","20220510T08:28:17.473+0000","29b7b911-411d-4ed0-80c6-5edf88b23dcc","26b6d93d-1532-4746-96ee-17b4d92bef41","","","","","","","","","","","","","","",""
"","","clypeata","Calappa pustulosa clypeata Borradaile, 1903","","Calappa","","pustulosa","clypeata","Synonym","synonym","Species","","Borradaile","1903","Y","e82e334f-91a7-4c91-9450-b360beec79ce","20220504T01:21:58.041+0000","26b6d93d-1532-4746-96ee-17b4d92bef41","20220510T08:28:17.473+0000","","af9ce68a-d229-451b-a67a-18822c04c22b","Borradaile, L.A.","1903","Marine Crustaceans. VI. The Sand Crabs (Oxystomata)","(pp. 434-439, pl. XXII, figs 115-117)","The Fauna and Geography of the Maldive and Laccadive Archipelagoes, being an account of the work carried on and of the collections made by an expedition during the years 1899 and 1900","","","","","<!--MARK--><a href='null905b28e1-2b9d-4052-984d-3122cfc946c6' class='mouseoverHref'>Borradaile, L.A. 1903. Marine Crustaceans. VI. The Sand Crabs (Oxystomata). (pp. 434-439, pl. XXII, figs 115-117)</a> <!--MARK--><em>in</em> <!--MARK--><a href='nullf0eb2dd0-1356-40ba-8054-d3ec37a7d1f6' class='mouseoverHref'>Gardiner, J.S. (ed.). <em>The Fauna and Geography of the Maldive and Laccadive Archipelagoes, being an account of the work carried on and of the collections made by an expedition during the years 1899 and 1900</em>. Cambridge : Cambridge University Press Vol. I(Part IV) pp. 347-470, pls. XVIII-XXV.</a><!--MARK-->","","Chapter in Book","905b28e1-2b9d-4052-984d-3122cfc946c6","20171201T02:16:49.521+0000","f0eb2dd0-1356-40ba-8054-d3ec37a7d1f6"
"","","terraereginae","Calappa terraereginae Ward, 1936","","Calappa","","terraereginae","","Synonym","synonym","Species","","Ward","1936","Y","7ad8e677-e94b-4999-932c-ca7b01019c64","20220504T01:21:58.041+0000","26b6d93d-1532-4746-96ee-17b4d92bef41","20220510T08:28:17.473+0000","","c8c43c99-ba3a-4db2-b8b4-5d09561a12ff","Ward, M.","1936","Crustacea Brachyura from the coasts of Queensland","1-13, 3 pls","","Memoirs of the Queensland Museum","","","","<!--MARK--><a href='nullb4e556e0-75e6-4c61-bd1d-dca9b2859eab' class='mouseoverHref'>Ward, M. 1936. Crustacea Brachyura from the coasts of Queensland.</a> <!--MARK--><!--MARK--><a href='null1a0a2982-9f30-43e1-a641-b0379699837c' class='mouseoverHref'><em>Memoirs of the Queensland Museum</em></a> <strong>XI</strong>(1): 1-13, 3 pls<!--MARK-->","","Article in Journal","b4e556e0-75e6-4c61-bd1d-dca9b2859eab","20081009T05:11:37.000+0000","1a0a2982-9f30-43e1-a641-b0379699837c"
"","","woodmasoni","Calappa woodmasoni Alcock, 1896","CALAPPIDAE","Calappa","","woodmasoni","","Valid Name","","Species","","Alcock","1896","Y","68e2282c-ba51-4533-8042-c0c401938d3c","20220504T01:21:58.041+0000","568d7a4f-d671-4777-9738-3ea44c2cb3cb","20220510T08:28:17.473+0000","29b7b911-411d-4ed0-80c6-5edf88b23dcc","568d7a4f-d671-4777-9738-3ea44c2cb3cb","","","","","","","","","","","","","","",""
"","","Little Crested Crab","","","","","","","Common Name","General","Species","","","","","456109a1-25ed-4be8-b0e9-943a7b817981","20220504T01:21:58.041+0000","568d7a4f-d671-4777-9738-3ea44c2cb3cb","20220510T08:28:17.473+0000","","","","","","","","","","","","","","","","",""
"","","depressa","Calappa depressa Miers, 1886","","Calappa","","depressa","","Synonym","synonym","Species","name preoccupied","Miers","1886","Y","356a1d3d-053f-4e8f-8d40-6de6cc94b570","20220504T01:21:58.041+0000","568d7a4f-d671-4777-9738-3ea44c2cb3cb","20220510T08:28:17.473+0000","","2c3dfd30-ce20-4bb2-9474-eeb00b1ded9e","Miers, E.J.","1886","Report on the Brachyura collected by H.M.S. <i>Challenger</i> during the Years 1873-76","i-xlix 1-362 pls 1-29","","Report on the Scientific Results of the Voyage of H.M.S. Challenger 1873-1876, Zoology","","","","<!--MARK--><a href='null58f10b16-251d-4c61-9489-c861448ce232' class='mouseoverHref'>Miers, E.J. 1886. Report on the Brachyura collected by H.M.S. <i>Challenger</i> during the Years 1873-76.</a> <!--MARK--><!--MARK--><a href='null1db4d8a3-1c27-4eff-aef5-d93514e06c4f' class='mouseoverHref'><em>Report on the Scientific Results of the Voyage of H.M.S. Challenger 1873-1876, Zoology</em></a> <strong>17</strong>(49): i-xlix 1-362 pls 1-29<!--MARK-->","","Article in Journal","58f10b16-251d-4c61-9489-c861448ce232","20130124T04:31:49.403+0000","1db4d8a3-1c27-4eff-aef5-d93514e06c4f"
"","","woodmasoni","Calappa woodmasoni Alcock, 1896","","Calappa","","woodmasoni","","Synonym","synonym","Species","","Alcock","1896","Y","71e5cbb6-3f0b-4d39-84e4-125948b55b30","20220504T01:21:58.041+0000","568d7a4f-d671-4777-9738-3ea44c2cb3cb","20220510T08:28:17.473+0000","","75020629-473c-40c1-ad39-f44125c72d8c","Alcock, A.","1896","Materials for a Carcinological Fauna of India. No. 2. The Brachyura Oxystoma","134-296 pls 6-8","","Journal of the Asiatic Society of Bengal","","","","<!--MARK--><a href='null3d590c76-2bd2-4592-a4a5-35dcbfda6359' class='mouseoverHref'>Alcock, A. 1896. Materials for a Carcinological Fauna of India. No. 2. The Brachyura Oxystoma.</a> <!--MARK--><!--MARK--><a href='nulld16b9dfb-88f3-4e8f-aa43-b64265b2b69a' class='mouseoverHref'><em>Journal of the Asiatic Society of Bengal</em></a> <strong>65</strong>(Pt 2 No. 2): 134-296 pls 6-8<!--MARK-->","","Article in Journal","3d590c76-2bd2-4592-a4a5-35dcbfda6359","20081009T05:11:37.000+0000","d16b9dfb-88f3-4e8f-aa43-b64265b2b69a"
"","","alata","Calappa alata Rathbun, 1911","","Calappa","","alata","","Synonym","synonym","Species","","Rathbun","1911","Y","fe1340f8-752c-4d01-9400-8181804fd02c","20220504T01:21:58.041+0000","568d7a4f-d671-4777-9738-3ea44c2cb3cb","20220510T08:28:17.473+0000","","d61917a2-08ed-40d9-8ff0-5129c4b140c9","Rathbun, M.J.","1911","Reports of the Percy Sladen Trust Expedition to the Indian Ocean in 1905, under the leadership of Mr. J. Stanley Gardiner. Vol. III. No. XI. Marine Brachyura","191-261, text-figs 1, 2 pls 15-20","","Transactions of the Linnean Society of London","","","","<!--MARK--><a href='null11b750ce-8cf9-4eae-8961-8e45c07ca179' class='mouseoverHref'>Rathbun, M.J. 1911. Reports of the Percy Sladen Trust Expedition to the Indian Ocean in 1905, under the leadership of Mr. J. Stanley Gardiner. Vol. III. No. XI. Marine Brachyura.</a> <!--MARK--><!--MARK--><a href='nulla6b0ca4d-471d-4666-96a2-8fee5114bc35' class='mouseoverHref'><em>Transactions of the Linnean Society of London</em></a> Zool. <strong>14</strong>(2): 191-261, text-figs 1, 2 pls 15-20<!--MARK-->","","Article in Journal","11b750ce-8cf9-4eae-8961-8e45c07ca179","20081009T05:11:37.000+0000","a6b0ca4d-471d-4666-96a2-8fee5114bc35"
"","","exanthematosa","Calappa exanthematosa Alcock & Anderson, 1894","CALAPPIDAE","Calappa","","exanthematosa","","Valid Name","","Species","","Alcock & Anderson","1894","Y","9f56060e-cb33-41c2-9760-02980281b7e2","20220504T01:21:58.041+0000","4a3bc46e-a839-414a-a1bd-4b278b97a737","20220510T08:28:17.473+0000","29b7b911-411d-4ed0-80c6-5edf88b23dcc","4a3bc46e-a839-414a-a1bd-4b278b97a737","","","","","","","","","","","","","","",""
