"CAVS_CODE","CAAB_CODE","NAMES_VARIOUS","SCIENTIFIC_NAME","FAMILY","GENUS","SUBGENUS","SPECIES","SUBSPECIES","NAME_TYPE","NAME_SUBTYPE","RANK","QUALIFICATION","AUTHOR","YEAR","ORIG_COMBINATION","NAME_GUID","NAME_LAST_UPDATE","TAXON_GUID","TAXON_LAST_UPDATE","PARENT_TAXON_GUID","CONCEPT_GUID","PUB_PUB_AUTHOR","PUB_PUB_YEAR","PUB_PUB_TITLE","PUB_PUB_PAGES","PUB_PUB_PARENT_BOOK_TITLE","PUB_PUB_PARENT_JOURNAL_TITLE","PUB_PUB_PARENT_ARTICLE_TITLE","PUB_PUB_PUBLICATION_DATE","PUB_PUB_PUBLISHER","PUB_PUB_FORMATTED","PUB_PUB_QUALIFICATION","PUB_PUB_TYPE","PUBLICATION_GUID","PUBLICATION_LAST_UPDATE","PARENT_PUBLICATION_GUID"
"","","Chorebus","Chorebus Haliday, 1833","BRACONIDAE","Chorebus","","","","Valid Name","","Genus","","Haliday","1833","Y","4debe431-37a2-4b53-9151-aca2eccfdd84","20220209T23:01:57.078+0000","601d9f14-c674-4f4b-b206-25f5c85f6c18","20220616T08:49:13.574+0000","c90a6d59-c38f-4862-8530-124257778233","601d9f14-c674-4f4b-b206-25f5c85f6c18","","","","","","","","","","","","","","",""
"","","Chorebus","Chorebus Haliday, 1833","","Chorebus","","","","Synonym","synonym","Genus","","Haliday","1833","Y","7ceeac1a-690c-41f4-b7f8-fe7d50d51e4e","20220209T23:01:57.078+0000","601d9f14-c674-4f4b-b206-25f5c85f6c18","20220616T08:49:13.574+0000","","5634bb39-6e64-4c10-a3de-d4c0aa38038b","Haliday, A.H.","1833","An essay on the classification of the parasitic Hymenoptera of Britain, which correspond with the <i>Ichneumones minuti</i> of Linnaeus","259-276","","Entomological Magazine. London","","","","<!--MARK--><a href='null01af4c7e-6178-4cc4-9baf-9c2e72a9b9fc' class='mouseoverHref'>Haliday, A.H. 1833. An essay on the classification of the parasitic Hymenoptera of Britain, which correspond with the <i>Ichneumones minuti</i> of Linnaeus.</a> <!--MARK--><!--MARK--><a href='nullbd16f5b5-5afd-4047-a0f2-e1a3dcf6d95b' class='mouseoverHref'><em>Entomological Magazine. London</em></a> <strong>1</strong>: 259-276<!--MARK-->","","Article in Journal","01af4c7e-6178-4cc4-9baf-9c2e72a9b9fc","20081009T05:11:37.000+0000","bd16f5b5-5afd-4047-a0f2-e1a3dcf6d95b"
"","","Ametria","Ametria Foerster, 1862","","Ametria","","","","Synonym","synonym","Genus","","Foerster","1862","Y","a748f1d9-40cf-4a37-b2d4-51111249af3a","20220209T23:01:57.078+0000","601d9f14-c674-4f4b-b206-25f5c85f6c18","20220616T08:49:13.574+0000","","3d9532a8-4c82-4f14-9527-4fcbf31b759e","Foerster, A.","1862","Synopsis der Familien und Gattungen der Braconiden.","225-288","","Verhandlungen des Naturhistorischen Vereins der Preussischen Rheinlande und Westfalens","","","","<!--MARK--><a href='null97b42d86-0720-4137-b58e-de2ba893892d' class='mouseoverHref'>Foerster, A. 1862. Synopsis der Familien und Gattungen der Braconiden.</a> <!--MARK--><!--MARK--><a href='null10d2aa7b-ea13-48ea-9e2a-ef9cc86f474f' class='mouseoverHref'><em>Verhandlungen des Naturhistorischen Vereins der Preussischen Rheinlande und Westfalens</em></a> <strong>19</strong>: 225-288<!--MARK-->","","Article in Journal","97b42d86-0720-4137-b58e-de2ba893892d","20110511T01:50:09.267+0000","10d2aa7b-ea13-48ea-9e2a-ef9cc86f474f"
"","","Gyrocampa","Gyrocampa Foerster, 1862","","Gyrocampa","","","","Synonym","synonym","Genus","","Foerster","1862","Y","e26ec09f-ce88-4ec5-919d-ef2941e0c197","20220209T23:01:57.078+0000","601d9f14-c674-4f4b-b206-25f5c85f6c18","20220616T08:49:13.574+0000","","b5ac3d69-7a2f-4a76-b903-b3ea472e8b81","Foerster, A.","1862","Synopsis der Familien und Gattungen der Braconiden.","225-288","","Verhandlungen des Naturhistorischen Vereins der Preussischen Rheinlande und Westfalens","","","","<!--MARK--><a href='null97b42d86-0720-4137-b58e-de2ba893892d' class='mouseoverHref'>Foerster, A. 1862. Synopsis der Familien und Gattungen der Braconiden.</a> <!--MARK--><!--MARK--><a href='null10d2aa7b-ea13-48ea-9e2a-ef9cc86f474f' class='mouseoverHref'><em>Verhandlungen des Naturhistorischen Vereins der Preussischen Rheinlande und Westfalens</em></a> <strong>19</strong>: 225-288<!--MARK-->","","Article in Journal","97b42d86-0720-4137-b58e-de2ba893892d","20110511T01:50:09.267+0000","10d2aa7b-ea13-48ea-9e2a-ef9cc86f474f"
"","","Diplusia","Diplusia Brischke, 1882","","Diplusia","","","","Synonym","nomen nudum","Genus","","Brischke","1882","Y","393b1f90-e136-432e-828b-823e05e65e0d","20220209T23:01:57.078+0000","601d9f14-c674-4f4b-b206-25f5c85f6c18","20220616T08:49:13.574+0000","","9ed8621d-815f-470f-acbe-a47c2fa2504d","Brischke, C.G.A.","1882","Die Ichneumoniden der Provinzen West- und Ostpreussen.","121-183, 194-199","","Schriften der Naturforschenden Gesellschaft in Danzig","","","","<!--MARK--><a href='null13e8289e-07da-4502-bb37-5dc412c8e5a8' class='mouseoverHref'>Brischke, C.G.A. 1882. Die Ichneumoniden der Provinzen West- und Ostpreussen.</a> <!--MARK--><!--MARK--><a href='null7c28df8c-93a0-4ee1-b5f8-bb45349fcbec' class='mouseoverHref'><em>Schriften der Naturforschenden Gesellschaft in Danzig</em></a> <strong>5</strong>(3): 121-183, 194-199<!--MARK-->","","Article in Journal","13e8289e-07da-4502-bb37-5dc412c8e5a8","20110831T03:52:48.756+0000","7c28df8c-93a0-4ee1-b5f8-bb45349fcbec"
"","","nigricapitis","Chorebus nigricapitis Wharton, 1991","BRACONIDAE","Chorebus","","nigricapitis","","Valid Name","","Species","","Wharton","1991","Y","4c87c572-1a21-45bd-b5c9-0257da110474","20220209T23:01:57.078+0000","32654eed-5a52-404b-bc5a-616c60f5c50c","20220616T08:49:13.574+0000","601d9f14-c674-4f4b-b206-25f5c85f6c18","32654eed-5a52-404b-bc5a-616c60f5c50c","","","","","","","","","","","","","","",""
"","","nigricapitis","Chorebus nigricapitis Wharton, 1991","","Chorebus","","nigricapitis","","Synonym","synonym","Species","","Wharton","1991","Y","fc7e9338-3fbf-42f1-ae1a-86fe051b4397","20220209T23:01:57.078+0000","32654eed-5a52-404b-bc5a-616c60f5c50c","20220616T08:49:13.574+0000","","cd9c970c-133c-40f0-8307-adbdc7c9350c","Wharton, R.A. in Wharton, R.A. & Austin, A.D.","1991","Revision of Australian Dacnusini (Hymenoptera: Braconidae: Alysiinae), parasitoids of cyclorrhaphous Diptera","193-206","","Journal of the Australian Entomological Society","","","","<!--MARK--><a href='nullc6dd6d8d-86aa-4530-849f-a3e6934ea198' class='mouseoverHref'>Wharton, R.A. <i>in</i> Wharton, R.A. & Austin, A.D. 1991. Revision of Australian Dacnusini (Hymenoptera: Braconidae: Alysiinae), parasitoids of cyclorrhaphous Diptera.</a> <!--MARK--><!--MARK--><a href='nullc2544f9f-3978-4f18-846d-a1fd3122c9c4' class='mouseoverHref'><em>Journal of the Australian Entomological Society</em></a> <strong>30</strong>: 193-206<!--MARK-->","","Article in Journal","c6dd6d8d-86aa-4530-849f-a3e6934ea198","20081009T05:11:37.000+0000","c2544f9f-3978-4f18-846d-a1fd3122c9c4"
