"CAVS_CODE","CAAB_CODE","NAMES_VARIOUS","SCIENTIFIC_NAME","FAMILY","GENUS","SUBGENUS","SPECIES","SUBSPECIES","NAME_TYPE","NAME_SUBTYPE","RANK","QUALIFICATION","AUTHOR","YEAR","ORIG_COMBINATION","NAME_GUID","NAME_LAST_UPDATE","TAXON_GUID","TAXON_LAST_UPDATE","PARENT_TAXON_GUID","CONCEPT_GUID","PUB_PUB_AUTHOR","PUB_PUB_YEAR","PUB_PUB_TITLE","PUB_PUB_PAGES","PUB_PUB_PARENT_BOOK_TITLE","PUB_PUB_PARENT_JOURNAL_TITLE","PUB_PUB_PARENT_ARTICLE_TITLE","PUB_PUB_PUBLICATION_DATE","PUB_PUB_PUBLISHER","PUB_PUB_FORMATTED","PUB_PUB_QUALIFICATION","PUB_PUB_TYPE","PUBLICATION_GUID","PUBLICATION_LAST_UPDATE","PARENT_PUBLICATION_GUID"
"","","CRANGONOIDEA","CRANGONOIDEA Haworth, 1825","","","","","","Valid Name","","Superfamily","","Haworth","1825","Y","b586872d-f37e-46fc-9b9d-d0482e84f77c","20220504T01:21:58.041+0000","fd77a149-481f-4be5-b7ea-fa293f51b3f6","20220510T08:28:17.473+0000","b95c43ac-8125-4a42-b042-76e48ac71db0","fd77a149-481f-4be5-b7ea-fa293f51b3f6","","","","","","","","","","","","","","",""
"","","CRANGONIDAE","CRANGONIDAE Haworth, 1825","","","","","","Valid Name","","Family","","Haworth","1825","Y","8bceb060-8800-4ec9-a665-1824a4b233d8","20220504T01:21:58.041+0000","df658333-79ba-412c-92dd-1f3346d2e936","20220510T08:28:17.473+0000","fd77a149-481f-4be5-b7ea-fa293f51b3f6","df658333-79ba-412c-92dd-1f3346d2e936","","","","","","","","","","","","","","",""
"","","Crangonidae","Crangonidae Haworth, 1825","Crangonidae","","","","","Synonym","synonym","Family","name, as Crangonidae White, 1847, placed on the Official List of Family-Group Names in Zoology, see International Commission on Zoological Nomenclature 1955. Opinion 334. Validation, under the Plenary Powers, of the generic names <I>Crangon</I> Fabricius, 1798, and <I>Alpheus</I> Fabricius, 1798 (Class Crustacea, Order Decapoda). <em>Opinions and Declarations rendered by the International Commission on Zoological Nomenclature</em> <strong>10</strong>: 1-44, but corrected in 1987, in Official Lists: 11","Haworth","1825","Y","27d3fc13-afb4-4a93-9d95-0e5dead0a4ca","20220504T01:21:58.041+0000","df658333-79ba-412c-92dd-1f3346d2e936","20220510T08:28:17.473+0000","","14723ae5-7235-4984-b42d-08136e04ab14","Haworth, A.H.","1825","A new binary arrangement of the macrurus Crustacea","183-184","","Philosophical Magazine and Journal","","","","<!--MARK--><a href='null9c96911b-eda0-45eb-a042-4e2515ce3aac' class='mouseoverHref'>Haworth, A.H. 1825. A new binary arrangement of the macrurus Crustacea.</a> <!--MARK--><!--MARK--><a href='nullc740616d-59bf-4f3c-9bf5-a6bad76f8652' class='mouseoverHref'><em>Philosophical Magazine and Journal</em></a> <strong>65</strong>: 183-184<!--MARK-->","","Article in Journal","9c96911b-eda0-45eb-a042-4e2515ce3aac","20081009T05:11:37.000+0000","c740616d-59bf-4f3c-9bf5-a6bad76f8652"
"","","Pontocaridinae","Pontocaridinae Christofferson, 1988","Pontocaridinae","","","","","Synonym","synonym","Family","","Christofferson","1988","Y","3489a74f-522b-4bf3-b979-b8fdb5ff17de","20220504T01:21:58.041+0000","df658333-79ba-412c-92dd-1f3346d2e936","20220510T08:28:17.473+0000","","40b38c54-199c-4c3e-b85f-52c2559a3404","Christofferson, M.L.","1988","Genealogy and phylogenetic classification of the world Crangonidae (Crustacea, Caridea), with a new species and new records of the south western Atlantic","43-59, illustrated","","Revista Nordestina de Biologia","","","","<!--MARK--><a href='nullb3f362bf-5d27-433b-8c40-214d5997e4b8' class='mouseoverHref'>Christofferson, M.L. 1988. Genealogy and phylogenetic classification of the world Crangonidae (Crustacea, Caridea), with a new species and new records of the south western Atlantic.</a> <!--MARK--><!--MARK--><a href='null9b00a9c0-9b90-46b1-9ff9-4062440f6a90' class='mouseoverHref'><em>Revista Nordestina de Biologia</em></a> <strong>6</strong>(1): 43-59, illustrated<!--MARK-->","","Article in Journal","b3f362bf-5d27-433b-8c40-214d5997e4b8","20081009T05:11:37.000+0000","9b00a9c0-9b90-46b1-9ff9-4062440f6a90"
"","","Philocherinae","Philocherinae Christofferson, 1988","Philocherinae","","","","","Synonym","synonym","Family","","Christofferson","1988","Y","70235464-637f-42de-8afc-3f53f26195df","20220504T01:21:58.041+0000","df658333-79ba-412c-92dd-1f3346d2e936","20220510T08:28:17.473+0000","","f2313688-e77e-41d8-a46f-7ca3d69808a6","Christofferson, M.L.","1988","Genealogy and phylogenetic classification of the world Crangonidae (Crustacea, Caridea), with a new species and new records of the south western Atlantic","43-59, illustrated","","Revista Nordestina de Biologia","","","","<!--MARK--><a href='nullb3f362bf-5d27-433b-8c40-214d5997e4b8' class='mouseoverHref'>Christofferson, M.L. 1988. Genealogy and phylogenetic classification of the world Crangonidae (Crustacea, Caridea), with a new species and new records of the south western Atlantic.</a> <!--MARK--><!--MARK--><a href='null9b00a9c0-9b90-46b1-9ff9-4062440f6a90' class='mouseoverHref'><em>Revista Nordestina de Biologia</em></a> <strong>6</strong>(1): 43-59, illustrated<!--MARK-->","","Article in Journal","b3f362bf-5d27-433b-8c40-214d5997e4b8","20081009T05:11:37.000+0000","9b00a9c0-9b90-46b1-9ff9-4062440f6a90"
"","","Pontophilinae","Pontophilinae Christofferson, 1988","Pontophilinae","","","","","Synonym","synonym","Family","","Christofferson","1988","Y","b11e49b1-aa29-4cfe-b55e-44cfa324606b","20220504T01:21:58.041+0000","df658333-79ba-412c-92dd-1f3346d2e936","20220510T08:28:17.473+0000","","bebc13a8-0040-40a5-a76e-3a449058ac26","Christofferson, M.L.","1988","Genealogy and phylogenetic classification of the world Crangonidae (Crustacea, Caridea), with a new species and new records of the south western Atlantic","43-59, illustrated","","Revista Nordestina de Biologia","","","","<!--MARK--><a href='nullb3f362bf-5d27-433b-8c40-214d5997e4b8' class='mouseoverHref'>Christofferson, M.L. 1988. Genealogy and phylogenetic classification of the world Crangonidae (Crustacea, Caridea), with a new species and new records of the south western Atlantic.</a> <!--MARK--><!--MARK--><a href='null9b00a9c0-9b90-46b1-9ff9-4062440f6a90' class='mouseoverHref'><em>Revista Nordestina de Biologia</em></a> <strong>6</strong>(1): 43-59, illustrated<!--MARK-->","","Article in Journal","b3f362bf-5d27-433b-8c40-214d5997e4b8","20081009T05:11:37.000+0000","9b00a9c0-9b90-46b1-9ff9-4062440f6a90"
"","","Paracrangonidae","Paracrangonidae Christofferson, 1988","Paracrangonidae","","","","","Synonym","synonym","Family","","Christofferson","1988","Y","86deef91-dbe5-49f8-b747-1ca0f323a467","20220504T01:21:58.041+0000","df658333-79ba-412c-92dd-1f3346d2e936","20220510T08:28:17.473+0000","","657e9bec-9802-47f1-9b77-23bcdb8ca80d","Christofferson, M.L.","1988","Genealogy and phylogenetic classification of the world Crangonidae (Crustacea, Caridea), with a new species and new records of the south western Atlantic","43-59, illustrated","","Revista Nordestina de Biologia","","","","<!--MARK--><a href='nullb3f362bf-5d27-433b-8c40-214d5997e4b8' class='mouseoverHref'>Christofferson, M.L. 1988. Genealogy and phylogenetic classification of the world Crangonidae (Crustacea, Caridea), with a new species and new records of the south western Atlantic.</a> <!--MARK--><!--MARK--><a href='null9b00a9c0-9b90-46b1-9ff9-4062440f6a90' class='mouseoverHref'><em>Revista Nordestina de Biologia</em></a> <strong>6</strong>(1): 43-59, illustrated<!--MARK-->","","Article in Journal","b3f362bf-5d27-433b-8c40-214d5997e4b8","20081009T05:11:37.000+0000","9b00a9c0-9b90-46b1-9ff9-4062440f6a90"
"","","Parapontocaris","Parapontocaris Alcock, 1901","CRANGONIDAE","Parapontocaris","","","","Valid Name","","Genus","","Alcock","1901","Y","f420d7c8-aabb-43cf-b4dd-c044e546434d","20220504T01:21:58.041+0000","25fc755e-c629-4dd3-b554-ae123ac9fe12","20220510T08:28:17.473+0000","df658333-79ba-412c-92dd-1f3346d2e936","25fc755e-c629-4dd3-b554-ae123ac9fe12","","","","","","","","","","","","","","",""
"","","Parapontocaris","Parapontocaris Alcock, 1901","CRANGONIDAE","Parapontocaris","","","","Synonym","synonym","Genus","","Alcock","1901","Y","cac8cb6d-17f8-4a9e-b753-337692d14b36","20220504T01:21:58.041+0000","25fc755e-c629-4dd3-b554-ae123ac9fe12","20220510T08:28:17.473+0000","","4ca0cfb0-3e87-4f51-b555-068ed881c2f1","Alcock, A.","1901","A Descriptive Catalogue of the Indian Deep-sea Crustacea Decapoda Macrura and Anomura in the Indian Museum<i>. Being a revised account of the deep-sea species collected by the Royal Indian marine survey ship Investigator</i>","286 pp. 3 pls","","","","","Indian Museum","<!--MARK--><a href='nullb694fd3b-06f4-49e7-a886-e2f460cecc6c' class='mouseoverHref'>Alcock, A. 1901. <em>A Descriptive Catalogue of the Indian Deep-sea Crustacea Decapoda Macrura and Anomura in the Indian Museum<i>. Being a revised account of the deep-sea species collected by the Royal Indian marine survey ship Investigator</i></em>. Calcutta : Indian Museum Vol. 4 286 pp. 3 pls.</a><!--MARK-->","","Book","b694fd3b-06f4-49e7-a886-e2f460cecc6c","20120222T20:40:51.443+0000",""
"","","levigata","Parapontocaris levigata Chace, 1984","CRANGONIDAE","Parapontocaris","","levigata","","Valid Name","","Species","","Chace","1984","Y","1b017bf8-e1de-495e-86c5-085fdf07eb5f","20220504T01:21:58.041+0000","b3ebc6b1-ae56-4b78-b780-5ff47952d1d7","20220510T08:28:17.473+0000","25fc755e-c629-4dd3-b554-ae123ac9fe12","b3ebc6b1-ae56-4b78-b780-5ff47952d1d7","","","","","","","","","","","","","","",""
"","","levigata","Parapontocaris levigata Chace, 1984","CRANGONIDAE","Parapontocaris","","levigata","","Synonym","synonym","Species","","Chace","1984","Y","3f74cc9a-49ac-4faf-b901-574f6dc421e6","20220504T01:21:58.041+0000","b3ebc6b1-ae56-4b78-b780-5ff47952d1d7","20220510T08:28:17.473+0000","","13922793-cba5-43c5-b2fe-964806da8b13","Chace, F.A., Jr","1984","The Caridean Shrimps (Crustacea: Decapoda) of the <i>Albatross</i> Philippine Expedition, 1907-1910, Part 2: Families Glyphocrangonidae and Crangonidae","1-63","","Smithsonian Contributions to Zoology","","","","<!--MARK--><a href='null56e04404-ceaa-41b0-9cc7-0df760ee71aa' class='mouseoverHref'>Chace, F.A., Jr 1984. The Caridean Shrimps (Crustacea: Decapoda) of the <i>Albatross</i> Philippine Expedition, 1907-1910, Part 2: Families Glyphocrangonidae and Crangonidae.</a> <!--MARK--><!--MARK--><a href='nullcf8b640e-574a-4713-8a6f-74b8ef9e2f2c' class='mouseoverHref'><em>Smithsonian Contributions to Zoology</em></a> <strong>No. 397</strong>: 1-63<!--MARK-->","","Article in Journal","56e04404-ceaa-41b0-9cc7-0df760ee71aa","20081009T05:11:37.000+0000","cf8b640e-574a-4713-8a6f-74b8ef9e2f2c"
"","","Aegaeon","Aegaeon Agassiz, 1846","CRANGONIDAE","Aegaeon","","","","Valid Name","","Genus","","Agassiz","1846","Y","03684f4e-f5ea-406b-ae5a-22dde5300ff7","20220504T01:21:58.041+0000","685db208-2999-404d-818b-44f24f550ef8","20220510T08:28:17.473+0000","df658333-79ba-412c-92dd-1f3346d2e936","685db208-2999-404d-818b-44f24f550ef8","","","","","","","","","","","","","","",""
"","","Egeon","Egeon Bosc, 1813","","Egeon","","","","Synonym","synonym","Genus","junior homonym of <I>Egeon </I>du Montfort, 1808 (Protozoa)","Bosc","1813","Y","38945f99-1425-472a-ac87-0da10de97a88","20220504T01:21:58.041+0000","685db208-2999-404d-818b-44f24f550ef8","20220510T08:28:17.473+0000","","60fab63c-647b-418f-a0f9-ceddf450bbc7","Bosc, L.A.G.","1813","Essai historique sur les crustacés de la mer de Nice par M. RISSO (extrait d'un rapport fait par M. Bosc à l'Institut en 1812)","233-234","","Nouveau Bulletin des Sciences, par la Société Philomatique de Paris","","March 1813","","<!--MARK--><a href='null9c0a4564-9e2d-40d5-aa46-b09039a0c985' class='mouseoverHref'>Bosc, L.A.G. 1813. Essai historique sur les crustacés de la mer de Nice par M. RISSO (extrait d'un rapport fait par M. Bosc à l'Institut en 1812).</a> <!--MARK--><!--MARK--><a href='null6443598c-bb95-4da3-9d5f-a129b712849a' class='mouseoverHref'><em>Nouveau Bulletin des Sciences, par la Société Philomatique de Paris</em></a> <strong>3</strong>(66): 233-234<!--MARK--> [Date published March 1813]","","Article in Journal","9c0a4564-9e2d-40d5-aa46-b09039a0c985","20081009T05:11:37.000+0000","6443598c-bb95-4da3-9d5f-a129b712849a"
"","","Aegaeon","Aegaeon Agassiz, 1846","","Aegaeon","","","","Synonym","synonym","Genus","<I>nom. nov.</I> for <I>Egeon</I> Bosc, 1813; gender masculine","Agassiz","1846","Y","c6469fb5-f4f3-49e8-8de3-7c6f56d96dd0","20220504T01:21:58.041+0000","685db208-2999-404d-818b-44f24f550ef8","20220510T08:28:17.473+0000","","13ca0b58-efa8-4090-8003-7474b8d06ae1","Agassiz, L.","1846","Nomenclatoris Zoologici Index Universalis, continens nomina systematica classium, ordinum, familiarum et generum animalium omnium, tam viventium quam fossilium, secundum ordinem alphabeticum unicum disposita, adjectis homonymiis plantarum, nec non variis adnotationibus et emendationibus","viii 393 pp.","","","","","Jent & Gassmann","<!--MARK--><a href='nulla7f8268e-1702-44aa-a663-3d76db7d33b2' class='mouseoverHref'>Agassiz, L. 1846. <em>Nomenclatoris Zoologici Index Universalis, continens nomina systematica classium, ordinum, familiarum et generum animalium omnium, tam viventium quam fossilium, secundum ordinem alphabeticum unicum disposita, adjectis homonymiis plantarum, nec non variis adnotationibus et emendationibus</em>. Soloduri [= Solothurn, Switzerland] : Jent & Gassmann viii 393 pp.</a><!--MARK--> [published between 1846-1848]","published between 1846-1848","Book","a7f8268e-1702-44aa-a663-3d76db7d33b2","20100827T06:57:54.862+0000",""
"","","lacazei","Aegaeon lacazei (Gourret, 1887)","CRANGONIDAE","Aegaeon","","lacazei","","Valid Name","","Species","","Gourret","1887","N","3946642c-9971-444b-baf2-ded6fab8ed1c","20220504T01:21:58.041+0000","c1924335-adc9-4766-bc94-9284bab0b046","20220510T08:28:17.473+0000","685db208-2999-404d-818b-44f24f550ef8","c1924335-adc9-4766-bc94-9284bab0b046","","","","","","","","","","","","","","",""
"","","lacazei","Crangon lacazei Gourret, 1887","","Crangon","","lacazei","","Synonym","synonym","Species","","Gourret","1887","Y","d6cd173e-d769-4251-a3d8-d2d9c0ba8cc7","20220504T01:21:58.041+0000","c1924335-adc9-4766-bc94-9284bab0b046","20220510T08:28:17.473+0000","","5e19557c-8d10-4aec-94f7-ec482742c146","Gourret, P.","1887","Sur quelques Décapodes macroures nouveaux de Golfe de Marseille","1033-1035","","Comptes Rendus (Hebdomadaires) des Séances de l'Academie des Sciences. Série D. Sciences Naturelles","","","","<!--MARK--><a href='null7f39f07a-1e1a-46c1-9b8c-48e772fff0aa' class='mouseoverHref'>Gourret, P. 1887. Sur quelques Décapodes macroures nouveaux de Golfe de Marseille.</a> <!--MARK--><!--MARK--><a href='null77294646-7b61-4cee-974d-0ed045692670' class='mouseoverHref'><em>Comptes Rendus (Hebdomadaires) des Séances de l'Academie des Sciences. Série D. Sciences Naturelles</em></a> <strong>105</strong>: 1033-1035<!--MARK-->","","Article in Journal","7f39f07a-1e1a-46c1-9b8c-48e772fff0aa","20081009T05:11:37.000+0000","77294646-7b61-4cee-974d-0ed045692670"
"","","habereri","Pontocaris habereri Doflein, 1902","","Pontocaris","","habereri","","Synonym","synonym","Species","","Doflein","1902","Y","f443575d-a89d-4c39-95c7-c4a72125caa4","20220504T01:21:58.041+0000","c1924335-adc9-4766-bc94-9284bab0b046","20220510T08:28:17.473+0000","","13bbd8e0-4834-4f9f-ad18-4c95200b43b1","Doflein, F.","1902","Ostasiatische Dekapoden","611-670 pls 1-6","","Abhandlungen der Bayerischen Akademie der Wissenschaften","","","","<!--MARK--><a href='nullf7619a7b-17b6-48c9-b4dd-7c2db8471d61' class='mouseoverHref'>Doflein, F. 1902. Ostasiatische Dekapoden.</a> <!--MARK--><!--MARK--><a href='null95538fd9-1187-44b5-89c2-c0f4dabffa6d' class='mouseoverHref'><em>Abhandlungen der Bayerischen Akademie der Wissenschaften</em></a> II Classe <strong>21</strong>(3): 611-670 pls 1-6<!--MARK-->","","Article in Journal","f7619a7b-17b6-48c9-b4dd-7c2db8471d61","20081009T05:11:37.000+0000","95538fd9-1187-44b5-89c2-c0f4dabffa6d"
"","","brendani","Aegeon brendani Kemp, 1906","","Aegeon","","brendani","","Synonym","synonym","Species","","Kemp","1906","Y","ace31aaf-b85d-4876-8b08-fa62266b86c3","20220504T01:21:58.041+0000","c1924335-adc9-4766-bc94-9284bab0b046","20220510T08:28:17.473+0000","","0965cb0b-5a19-4aaf-ae66-0444d9eede2d","Kemp, S.","1906","Two new species of Carida from the west coast of Ireland","297-300","","Annals and Magazine of Natural History","","","","<!--MARK--><a href='nulld4882b28-db3f-4e41-8648-8de21c222c74' class='mouseoverHref'>Kemp, S. 1906. Two new species of Carida from the west coast of Ireland.</a> <!--MARK--><!--MARK--><a href='nullefa8de69-3a29-4a43-8ef2-cbefda205976' class='mouseoverHref'><em>Annals and Magazine of Natural History</em></a> 7 <strong>17</strong>: 297-300<!--MARK-->","","Article in Journal","d4882b28-db3f-4e41-8648-8de21c222c74","20081009T05:11:37.000+0000","efa8de69-3a29-4a43-8ef2-cbefda205976"
"","","rathbuni","Aegaeon rathbuni de Man, 1918","CRANGONIDAE","Aegaeon","","rathbuni","","Valid Name","","Species","","de Man","1918","Y","c263f8f2-9689-453f-b068-3f46bc54b656","20220504T01:21:58.041+0000","6598859a-958d-4272-afcd-b173eab1a745","20220510T08:28:17.473+0000","685db208-2999-404d-818b-44f24f550ef8","6598859a-958d-4272-afcd-b173eab1a745","","","","","","","","","","","","","","",""
"","","rathbuni","Aegeon rathbuni de Man, 1918","","Aegeon","","rathbuni","","Synonym","synonym","Species","","de Man","1918","Y","01f89539-6765-4969-8e93-f8da745ee757","20220504T01:21:58.041+0000","6598859a-958d-4272-afcd-b173eab1a745","20220510T08:28:17.473+0000","","3f248794-ed49-46fd-a899-e7e81157669d","de Man, J.G.","1918","Diagnoses of new species of macrurous decapod Crustacea from the <i>Siboga</i>-Expedition","293-306","","Tijdschrift der Nederlandsche Dierkundige Vereeniging","","","","<!--MARK--><a href='nulle88dfe63-0174-410d-8b5b-d78d53319b47' class='mouseoverHref'>de Man, J.G. 1918. Diagnoses of new species of macrurous decapod Crustacea from the <i>Siboga</i>-Expedition.</a> <!--MARK--><!--MARK--><a href='nullc72b342a-b6ad-4cb2-b289-1da811d50f06' class='mouseoverHref'><em>Tijdschrift der Nederlandsche Dierkundige Vereeniging</em></a> 2 <strong>16</strong>: 293-306<!--MARK-->","","Article in Journal","e88dfe63-0174-410d-8b5b-d78d53319b47","20081009T05:11:37.000+0000","c72b342a-b6ad-4cb2-b289-1da811d50f06"
"","","Crangon","Crangon Fabricus, 1798","CRANGONIDAE","Crangon","","","","Valid Name","","Genus","","Fabricus","1798","Y","ea7c4234-05a5-429f-9633-daf3d0473f82","20220504T01:21:58.041+0000","e5dcd8f8-1c12-4fc0-a75b-2794da3cb60b","20220510T08:28:17.473+0000","df658333-79ba-412c-92dd-1f3346d2e936","e5dcd8f8-1c12-4fc0-a75b-2794da3cb60b","","","","","","","","","","","","","","",""
"","","Crangon","Crangon Fabricus, 1798","CRANGONIDAE","Crangon","","","","Synonym","synonym","Genus","","Fabricus","1798","Y","c08e6a1f-c745-4f5f-88f7-f2a402e357b9","20220504T01:21:58.041+0000","e5dcd8f8-1c12-4fc0-a75b-2794da3cb60b","20220510T08:28:17.473+0000","","","","","","","","","","","","","","","","",""
"","","Crago","Crago Lamarck, 1801","","Crago","","","","Synonym","synonym","Genus","","Lamarck","1801","Y","4696c3a9-8775-4fce-8d68-18622f3f7402","20220504T01:21:58.041+0000","e5dcd8f8-1c12-4fc0-a75b-2794da3cb60b","20220510T08:28:17.473+0000","","","","","","","","","","","","","","","","",""
"","","Crangonus","Crangonus Rafinesque, 1815","","Crangonus","","","","Synonym","synonym","Genus","<i>nomen novum</i> for <i>Crangon</i> Fabricius, 1798, gender masculine; name placed on the Official Index of Rejected and Invalid Generic Names in Zoology in Opinion 334 in 1955","Rafinesque","1815","Y","59208ee0-733a-41f4-9fa9-2a85f11ad504","20220504T01:21:58.041+0000","e5dcd8f8-1c12-4fc0-a75b-2794da3cb60b","20220510T08:28:17.473+0000","","f1fa75a6-ff23-46d7-bef3-9dd0885894c7","Rafinesque, C.S.","1815","Analyse de la nature, ou tableau de l'univers et des corps organises","224 pp.","","","","April to July","Privately Published","<!--MARK--><a href='null4ae59d55-8ed7-49b6-a36f-2ed9d77de4c2' class='mouseoverHref'>Rafinesque, C.S. 1815. <em>Analyse de la nature, ou tableau de l'univers et des corps organises</em>. Palermo (Italy) : Privately Published 224 pp.</a><!--MARK--> [Date published April to July]","","Book","4ae59d55-8ed7-49b6-a36f-2ed9d77de4c2","20190116T06:07:29.632+0000",""
"","","Steiracrangon","Steiracrangon Kinahan, 1862","","Steiracrangon","","","","Synonym","synonym","Genus","","Kinahan","1862","Y","d24e70cd-5587-4f19-9059-81d4251ac260","20220504T01:21:58.041+0000","e5dcd8f8-1c12-4fc0-a75b-2794da3cb60b","20220510T08:28:17.473+0000","","74c9e565-1feb-4857-8dc6-2afc1857d551","Kinahan, J.R.","1862","On the Britannic species of <i>Crangon</i> and <i>Galathea</i>, with some remarks on the homologies of these groups","45-113 15 pls","","Transactions of the Royal Irish Academy","","","","<!--MARK--><a href='null9f1c1fd6-697f-45dc-8516-78a721a862b5' class='mouseoverHref'>Kinahan, J.R. 1862. On the Britannic species of <i>Crangon</i> and <i>Galathea</i>, with some remarks on the homologies of these groups.</a> <!--MARK--><!--MARK--><a href='null037d1f3b-13cd-4041-a9e0-90d11a706159' class='mouseoverHref'><em>Transactions of the Royal Irish Academy</em></a> <strong>24</strong>(II): 45-113 15 pls<!--MARK-->","","Article in Journal","9f1c1fd6-697f-45dc-8516-78a721a862b5","20081009T05:11:37.000+0000","037d1f3b-13cd-4041-a9e0-90d11a706159"
"","","uritai","Crangon uritai Hayashi & Kim, 1999","CRANGONIDAE","Crangon","","uritai","","Valid Name","","Species","","Hayashi & Kim","1999","Y","eec68474-a0ba-484b-8854-256ce200f344","20220504T01:21:58.041+0000","255dc7b6-7b92-403e-b4df-fcb0b597fafb","20220510T08:28:17.473+0000","e5dcd8f8-1c12-4fc0-a75b-2794da3cb60b","255dc7b6-7b92-403e-b4df-fcb0b597fafb","","","","","","","","","","","","","","",""
"","","uritai","Crangon uritai Hayashi & Kim, 1999","CRANGONIDAE","Crangon","","uritai","","Synonym","synonym","Species","","Hayashi & Kim","1999","Y","76a7d342-cb08-4e64-8fc8-bb0a75f5a01c","20220504T01:21:58.041+0000","255dc7b6-7b92-403e-b4df-fcb0b597fafb","20220510T08:28:17.473+0000","","df2628ca-4d1f-40a1-a652-2149dee36a68","Hayashi, K-I., & Kim, J. N.","1999","Revision of the East Asian species of <i>Crangon</i> (Decapoda: Caridea: Crangonidae)","62-103","","Crustacean Research","","","","<!--MARK--><a href='null914d8f04-90eb-4452-83d6-fbc7cb1f7a34' class='mouseoverHref'>Hayashi, K-I., & Kim, J. N. 1999. Revision of the East Asian species of <i>Crangon</i> (Decapoda: Caridea: Crangonidae).</a> <!--MARK--><!--MARK--><a href='nulld22eb2d4-bc45-403b-9b8c-50c4eba96c73' class='mouseoverHref'><em>Crustacean Research</em></a> <strong>28</strong>: 62-103<!--MARK-->","","Article in Journal","914d8f04-90eb-4452-83d6-fbc7cb1f7a34","20111012T05:45:30.382+0000","d22eb2d4-bc45-403b-9b8c-50c4eba96c73"
"","","Lissosabinea","Lissosabinea Christoffersen, 1988","CRANGONIDAE","Lissosabinea","","","","Valid Name","","Genus","","Christoffersen","1988","Y","84074bd0-0c50-46a3-b2e6-a29e59ce004a","20220504T01:21:58.041+0000","532dceba-c191-4ab4-9813-fe2a23807feb","20220510T08:28:17.473+0000","df658333-79ba-412c-92dd-1f3346d2e936","532dceba-c191-4ab4-9813-fe2a23807feb","","","","","","","","","","","","","","",""
"","","Lissosabinea","Lissosabinea Christoffersen, 1988","CRANGONIDAE","Lissosabinea","","","","Synonym","synonym","Genus","","Christoffersen","1988","Y","bee8655a-94c4-4818-8e82-4c26b263f155","20220504T01:21:58.041+0000","532dceba-c191-4ab4-9813-fe2a23807feb","20220510T08:28:17.473+0000","","","","","","","","","","","","","","","","",""
"","","indica","Lissosabinea indica (De Man, 1918)","CRANGONIDAE","Lissosabinea","","indica","","Valid Name","","Species","","De Man","1918","N","1cc29d03-79b0-4e39-8ade-4f506ab114d6","20220504T01:21:58.041+0000","18f10c54-d5f0-4092-a9f2-3ec4035b7499","20220510T08:28:17.473+0000","532dceba-c191-4ab4-9813-fe2a23807feb","18f10c54-d5f0-4092-a9f2-3ec4035b7499","","","","","","","","","","","","","","",""
"","","indica","Sabinea indica De Man, 1918","","Sabinea","","indica","","Synonym","original spelling","Species","","De Man","1918","Y","e2a8c612-39b7-486b-980c-682c296942d0","20220504T01:21:58.041+0000","18f10c54-d5f0-4092-a9f2-3ec4035b7499","20220510T08:28:17.473+0000","","da25f00e-bcb8-4f81-952e-24ebcf10fa18","de Man, J.G.","1918","Diagnosis of new species of macrurous decapod Crustacea from <i>Siboga</i>-Expedition","159-166","","Zoologische Mededelingen (Leiden)","","","","<!--MARK--><a href='nullde4bdad3-5218-4aaa-9b44-20f229806ed1' class='mouseoverHref'>de Man, J.G. 1918. Diagnosis of new species of macrurous decapod Crustacea from <i>Siboga</i>-Expedition.</a> <!--MARK--><!--MARK--><a href='null42ce8f11-9401-4dfc-ae20-52feb2a315f5' class='mouseoverHref'><em>Zoologische Mededelingen (Leiden)</em></a> <strong>4</strong>(3): 159-166<!--MARK-->","","Article in Journal","de4bdad3-5218-4aaa-9b44-20f229806ed1","20081009T05:11:37.000+0000","42ce8f11-9401-4dfc-ae20-52feb2a315f5"
"","","indica","Lissosabinea indica (De Man, 1918)","CRANGONIDAE","Lissosabinea","","indica","","Generic Combination","","Species","","De Man","1918","N","0236cf66-694f-4136-a70b-61f80df853c9","20220504T01:21:58.041+0000","18f10c54-d5f0-4092-a9f2-3ec4035b7499","20220510T08:28:17.473+0000","","","","","","","","","","","","","","","","",""
"","","arthuri","Lissosabinea arthuri Taylor & Collins, 2009","CRANGONIDAE","Lissosabinea","","arthuri","","Valid Name","","Species","","Taylor & Collins","2009","Y","431d5d7e-e044-4b12-8f1e-e0d76adbf404","20220504T01:21:58.041+0000","08448770-98a5-4aed-823e-955b669806a6","20220510T08:28:17.473+0000","532dceba-c191-4ab4-9813-fe2a23807feb","08448770-98a5-4aed-823e-955b669806a6","","","","","","","","","","","","","","",""
