"CAVS_CODE","CAAB_CODE","NAMES_VARIOUS","SCIENTIFIC_NAME","FAMILY","GENUS","SUBGENUS","SPECIES","SUBSPECIES","NAME_TYPE","NAME_SUBTYPE","RANK","QUALIFICATION","AUTHOR","YEAR","ORIG_COMBINATION","NAME_GUID","NAME_LAST_UPDATE","TAXON_GUID","TAXON_LAST_UPDATE","PARENT_TAXON_GUID","CONCEPT_GUID","PUB_PUB_AUTHOR","PUB_PUB_YEAR","PUB_PUB_TITLE","PUB_PUB_PAGES","PUB_PUB_PARENT_BOOK_TITLE","PUB_PUB_PARENT_JOURNAL_TITLE","PUB_PUB_PARENT_ARTICLE_TITLE","PUB_PUB_PUBLICATION_DATE","PUB_PUB_PUBLISHER","PUB_PUB_FORMATTED","PUB_PUB_QUALIFICATION","PUB_PUB_TYPE","PUBLICATION_GUID","PUBLICATION_LAST_UPDATE","PARENT_PUBLICATION_GUID"
"","","macromeles","Pseudopalicus macromeles Castro, 2000","","Pseudopalicus","","macromeles","","Synonym","synonym","Species","","Castro","2000","Y","843d78b9-1e23-4778-afd7-816caeacfe8d","20220504T01:21:58.041+0000","f15bc064-dfd3-4c49-97c5-bde1d6ff261a","20220510T08:28:17.473+0000","","095bbed8-f27d-40a2-9b19-6955cfd064b2","Castro, P.","2000","Crustacea Decapoda: A revision of the Indo-west Pacific species of palicid crabs (Brachyura Palicidae Bouvier, 1898)","pp. 437-610, figs 1-61","","Mémoires du Muséum national d'Histoire naturelle, Paris","Résultats des campagnes MUSORSTOM, Volume 21","","","<!--MARK--><a href='nullbab5c66c-49a2-41be-8677-ad4f4429d1fb' class='mouseoverHref'>Castro, P. 2000. Crustacea Decapoda: A revision of the Indo-west Pacific species of palicid crabs (Brachyura Palicidae Bouvier, 1898). pp. 437-610, figs 1-61</a> <!--MARK--><em>in</em> <!--MARK--><a href='null1783599d-9c2d-4d36-8bbd-75db312289ae' class='mouseoverHref'>Crosnier, A. (ed.). Résultats des campagnes MUSORSTOM, Volume 21.</a> <!--MARK--><!--MARK--><a href='null93c2cf00-5323-4c6b-85b2-9b9ff8e2dfb9' class='mouseoverHref'><em>Mémoires du Muséum national d'Histoire naturelle, Paris</em></a><!--MARK--> [1936-1950] <strong>184</strong>: 1-813<!--MARK-->","","Section in Article","bab5c66c-49a2-41be-8677-ad4f4429d1fb","20081009T05:11:37.000+0000","1783599d-9c2d-4d36-8bbd-75db312289ae"
"","","oahuensis","Pseudopalicus oahuensis (Rathbun, 1906)","PALICIDAE","Pseudopalicus","","oahuensis","","Valid Name","","Species","","Rathbun","1906","N","829dda42-b9fc-4154-a34f-8f490b5a1a08","20220504T01:21:58.041+0000","a3000232-8242-4f31-94c1-135f40b0b71f","20220510T08:28:17.473+0000","e85b6099-b56f-455e-ba17-c3c629d2edd5","a3000232-8242-4f31-94c1-135f40b0b71f","","","","","","","","","","","","","","",""
"","","oahuensis","Palicus oahuensis Rathbun, 1906","","Palicus","","oahuensis","","Synonym","synonym","Species","","Rathbun","1906","Y","490ef3b1-51c5-4271-9043-055d135ede83","20220504T01:21:58.041+0000","a3000232-8242-4f31-94c1-135f40b0b71f","20220510T08:28:17.473+0000","","bc7e9df4-52b3-44a3-924c-58c6d27a0e97","Rathbun, M.J.","1906","The Brachyura and Macrura of the Hawaiian Islands","827-930, text-figs 1-79 pls 1-24","","Bulletin of the United States Fish Commission","","","","<!--MARK--><a href='null0a4226ae-ae23-43bd-a8a6-fdf4dcef5106' class='mouseoverHref'>Rathbun, M.J. 1906. The Brachyura and Macrura of the Hawaiian Islands.</a> <!--MARK--><!--MARK--><a href='null5baa11e8-ef94-4875-8924-0fec1d5fda27' class='mouseoverHref'><em>Bulletin of the United States Fish Commission</em></a> <strong>23</strong>(3): 827-930, text-figs 1-79 pls 1-24<!--MARK-->","","Article in Journal","0a4226ae-ae23-43bd-a8a6-fdf4dcef5106","20081009T05:11:37.000+0000","5baa11e8-ef94-4875-8924-0fec1d5fda27"
"","","serripes","Pseudopalicus serripes (Alcock & Anderson, 1895)","PALICIDAE","Pseudopalicus","","serripes","","Valid Name","","Species","","Alcock & Anderson","1895","N","8477376f-1ae4-4b3f-b936-fb21eb9ca704","20220504T01:21:58.041+0000","ad799b78-ebfa-4306-aa94-6ea76038430d","20220510T08:28:17.473+0000","e85b6099-b56f-455e-ba17-c3c629d2edd5","ad799b78-ebfa-4306-aa94-6ea76038430d","","","","","","","","","","","","","","",""
"","","serripes","Cymopolia serripes Alcock & Anderson, 1895","","Cymopolia","","serripes","","Synonym","synonym","Species","","Alcock & Anderson","1895","Y","3982053b-add1-4848-9616-371b48b8444c","20220504T01:21:58.041+0000","ad799b78-ebfa-4306-aa94-6ea76038430d","20220510T08:28:17.473+0000","","c4d034e2-7ed7-4130-9e0a-a20ec6b46b53","Alcock, A. & Anderson, A.R.S.","1895","Natural history notes from H.M. Indian Marine Survey Steamer Investigator, Commander C.F. Oldham, R.N., commanding. Series II., No 17. List of the Shore and Shallow-water Brachyura collected during the Season 1893-1894","197-209","","Journal of the Asiatic Society of Bengal","","","","<!--MARK--><a href='null3afbe398-5b68-49c1-a0b2-c880d8d48624' class='mouseoverHref'>Alcock, A. & Anderson, A.R.S. 1895. Natural history notes from H.M. Indian Marine Survey Steamer Investigator, Commander C.F. Oldham, R.N., commanding. Series II., No 17. List of the Shore and Shallow-water Brachyura collected during the Season 1893-1894.</a> <!--MARK--><!--MARK--><a href='nulld16b9dfb-88f3-4e8f-aa43-b64265b2b69a' class='mouseoverHref'><em>Journal of the Asiatic Society of Bengal</em></a> <strong>63</strong>(Pt 2 No. 4): 197-209<!--MARK-->","","Article in Journal","3afbe398-5b68-49c1-a0b2-c880d8d48624","20081009T05:11:37.000+0000","d16b9dfb-88f3-4e8f-aa43-b64265b2b69a"
