"CAVS_CODE","CAAB_CODE","NAMES_VARIOUS","SCIENTIFIC_NAME","FAMILY","GENUS","SUBGENUS","SPECIES","SUBSPECIES","NAME_TYPE","NAME_SUBTYPE","RANK","QUALIFICATION","AUTHOR","YEAR","ORIG_COMBINATION","NAME_GUID","NAME_LAST_UPDATE","TAXON_GUID","TAXON_LAST_UPDATE","PARENT_TAXON_GUID","CONCEPT_GUID","PUB_PUB_AUTHOR","PUB_PUB_YEAR","PUB_PUB_TITLE","PUB_PUB_PAGES","PUB_PUB_PARENT_BOOK_TITLE","PUB_PUB_PARENT_JOURNAL_TITLE","PUB_PUB_PARENT_ARTICLE_TITLE","PUB_PUB_PUBLICATION_DATE","PUB_PUB_PUBLISHER","PUB_PUB_FORMATTED","PUB_PUB_QUALIFICATION","PUB_PUB_TYPE","PUBLICATION_GUID","PUBLICATION_LAST_UPDATE","PARENT_PUBLICATION_GUID"
"","","PALICOIDEA","PALICOIDEA Bouvier, 1898","","","","","","Valid Name","","Superfamily","","Bouvier","1898","Y","bbbfd593-e580-4a52-a6e6-dd293211fc9f","20220504T01:21:58.041+0000","49c02b22-0e3e-4a7f-aade-708f5871c690","20220510T08:28:17.473+0000","c7d22fcc-d8be-44c9-9dfa-a6171ee46bf2","49c02b22-0e3e-4a7f-aade-708f5871c690","","","","","","","","","","","","","","",""
"","","CROSSOTONOTIDAE","CROSSOTONOTIDAE Moosa & Serène, 1981","","","","","","Valid Name","","Family","","Moosa & Serène","1981","Y","8a392ec4-9f29-45e8-94a9-907f860ed906","20220504T01:21:58.041+0000","c0c05525-5cbd-4b17-af63-29e70bf49725","20220510T08:28:17.473+0000","49c02b22-0e3e-4a7f-aade-708f5871c690","c0c05525-5cbd-4b17-af63-29e70bf49725","","","","","","","","","","","","","","",""
"","","Crossotonotinae","Crossotonotinae Moosa & Serène, 1981","","","","","","Synonym","synonym","Family","","Moosa & Serène","1981","Y","7a4885de-01c4-4b0c-8a8f-908ac145f6dc","20220504T01:21:58.041+0000","c0c05525-5cbd-4b17-af63-29e70bf49725","20220510T08:28:17.473+0000","","","","","","","","","","","","","","","","",""
"","","Crossotonotus","Crossotonotus A. Milne Edwards, 1873","CROSSOTONOTIDAE","Crossotonotus","","","","Valid Name","","Genus","","A. Milne Edwards","1873","Y","bbfab24f-960c-4c9b-b2b3-375e7f5e6e08","20220504T01:21:58.041+0000","2f0631f6-cc46-48d1-9590-cdc5ef30ce3b","20220510T08:28:17.473+0000","c0c05525-5cbd-4b17-af63-29e70bf49725","2f0631f6-cc46-48d1-9590-cdc5ef30ce3b","","","","","","","","","","","","","","",""
"","","Crossotonotus","Crossotonotus A. Milne Edwards, 1873","","Crossotonotus","","","","Synonym","synonym","Genus","gender masculine","A. Milne Edwards","1873","Y","6ea110c6-c6a6-4eed-bdd5-4dc69b32d4a4","20220504T01:21:58.041+0000","2f0631f6-cc46-48d1-9590-cdc5ef30ce3b","20220510T08:28:17.473+0000","","0e2438d2-7f37-443f-a4fe-a66149e249c7","Milne Edwards, A.","1873","Description de quelques Crustacés nouveaux ou peu connus provenant du Musée de M.C. Godeffroy","77-88 pls 12, 13","","Journal des Museum Godeffroy, Hamburg","","","","<!--MARK--><a href='nulld713d28c-1329-4272-9527-e00745b5cd03' class='mouseoverHref'>Milne Edwards, A. 1873. Description de quelques Crustacés nouveaux ou peu connus provenant du Musée de M.C. Godeffroy.</a> <!--MARK--><!--MARK--><a href='null28313c9a-6bca-4375-9643-f488f6e53c98' class='mouseoverHref'><em>Journal des Museum Godeffroy, Hamburg</em></a> <strong>1</strong>(4): 77-88 pls 12, 13<!--MARK-->","","Article in Journal","d713d28c-1329-4272-9527-e00745b5cd03","20081009T05:11:37.000+0000","28313c9a-6bca-4375-9643-f488f6e53c98"
"","","Manella","Manella Rathbun, 1906","","Manella","","","","Synonym","synonym","Genus","","Rathbun","1906","Y","5c01eed2-7291-4d96-9f06-a2a2b16229b0","20220504T01:21:58.041+0000","2f0631f6-cc46-48d1-9590-cdc5ef30ce3b","20220510T08:28:17.473+0000","","46dabc8d-4424-47b4-9405-25af574db928","Rathbun, M.J.","1906","The Brachyura and Macrura of the Hawaiian Islands","827-930, text-figs 1-79 pls 1-24","","Bulletin of the United States Fish Commission","","","","<!--MARK--><a href='null0a4226ae-ae23-43bd-a8a6-fdf4dcef5106' class='mouseoverHref'>Rathbun, M.J. 1906. The Brachyura and Macrura of the Hawaiian Islands.</a> <!--MARK--><!--MARK--><a href='null5baa11e8-ef94-4875-8924-0fec1d5fda27' class='mouseoverHref'><em>Bulletin of the United States Fish Commission</em></a> <strong>23</strong>(3): 827-930, text-figs 1-79 pls 1-24<!--MARK-->","","Article in Journal","0a4226ae-ae23-43bd-a8a6-fdf4dcef5106","20081009T05:11:37.000+0000","5baa11e8-ef94-4875-8924-0fec1d5fda27"
"","","compressipes","Crossotonotus compressipes A. Milne Edwards, 1873","CROSSOTONOTIDAE","Crossotonotus","","compressipes","","Valid Name","","Species","","A. Milne Edwards","1873","Y","a3be1336-db24-44d2-9361-8d251b965429","20220504T01:21:58.041+0000","8a4738e1-d6aa-4dd5-993a-24ba388aaa94","20220510T08:28:17.473+0000","2f0631f6-cc46-48d1-9590-cdc5ef30ce3b","8a4738e1-d6aa-4dd5-993a-24ba388aaa94","","","","","","","","","","","","","","",""
"","","compressipes","Crossotonotus compressipes A. Milne Edwards, 1873","","Crossotonotus","","compressipes","","Synonym","synonym","Species","","A. Milne Edwards","1873","Y","c11d1f5f-25fd-46c7-a30d-2a2369b801c8","20220504T01:21:58.041+0000","8a4738e1-d6aa-4dd5-993a-24ba388aaa94","20220510T08:28:17.473+0000","","c30c43b5-5361-4f97-987c-a0553607d0a0","Milne Edwards, A.","1873","Description de quelques Crustacés nouveaux ou peu connus provenant du Musée de M.C. Godeffroy","77-88 pls 12, 13","","Journal des Museum Godeffroy, Hamburg","","","","<!--MARK--><a href='nulld713d28c-1329-4272-9527-e00745b5cd03' class='mouseoverHref'>Milne Edwards, A. 1873. Description de quelques Crustacés nouveaux ou peu connus provenant du Musée de M.C. Godeffroy.</a> <!--MARK--><!--MARK--><a href='null28313c9a-6bca-4375-9643-f488f6e53c98' class='mouseoverHref'><em>Journal des Museum Godeffroy, Hamburg</em></a> <strong>1</strong>(4): 77-88 pls 12, 13<!--MARK-->","","Article in Journal","d713d28c-1329-4272-9527-e00745b5cd03","20081009T05:11:37.000+0000","28313c9a-6bca-4375-9643-f488f6e53c98"
"","","taketomiensis","Crossotonotus taketomiensis Sakai, 1974","","Crossotonotus","","taketomiensis","","Synonym","synonym","Species","","Sakai","1974","Y","94af7094-090d-4a03-9c92-59e2d4edd604","20220504T01:21:58.041+0000","8a4738e1-d6aa-4dd5-993a-24ba388aaa94","20220510T08:28:17.473+0000","","ed697e90-f53c-4e23-ac9a-703c318cebd6","Sakai, T.","1974","Notes from the carcinological fauna of Japan (V)","86-102, frontispiece, fig. 1","","Researches on Crustacea","","","","<!--MARK--><a href='null7f8a73fd-ac4c-40d2-a3b2-f3626f81f343' class='mouseoverHref'>Sakai, T. 1974. Notes from the carcinological fauna of Japan (V).</a> <!--MARK--><!--MARK--><a href='null46431584-2701-4b95-a05e-c2b9bd10c0a3' class='mouseoverHref'><em>Researches on Crustacea</em></a> <strong>6</strong>: 86-102, frontispiece, fig. 1<!--MARK-->","","Article in Journal","7f8a73fd-ac4c-40d2-a3b2-f3626f81f343","20081009T05:11:37.000+0000","46431584-2701-4b95-a05e-c2b9bd10c0a3"
"","","spinipes","Crossotonotus spinipes (de Man, 1888)","CROSSOTONOTIDAE","Crossotonotus","","spinipes","","Valid Name","","Species","","de Man","1888","N","b2d43110-afe7-40e4-8128-b76f60919b35","20220504T01:21:58.041+0000","cea68972-831c-475c-84fc-a22cb42f923a","20220510T08:28:17.473+0000","2f0631f6-cc46-48d1-9590-cdc5ef30ce3b","cea68972-831c-475c-84fc-a22cb42f923a","","","","","","","","","","","","","","",""
"","","spinipes","Pleurophricus spinipes de Man, 1888","","Pleurophricus","","spinipes","","Synonym","synonym","Species","","de Man","1888","Y","cd564f32-ece6-4e41-abfe-e1ea090bbc54","20220504T01:21:58.041+0000","cea68972-831c-475c-84fc-a22cb42f923a","20220510T08:28:17.473+0000","","317d6f40-068c-4cd3-85b2-0d145900c86e","de Man, J.G.","1888","Bericht über die von Herrn Dr. J. Brock im indischen Archipel gesammelten Decapoden und Stomatopoden","215-600 pls 7-22, 22a","","Archiv für Naturgeschichte","","","","<!--MARK--><a href='nullc688b0bb-249d-4510-85f2-4afdc2af55bf' class='mouseoverHref'>de Man, J.G. 1888. Bericht über die von Herrn Dr. J. Brock im indischen Archipel gesammelten Decapoden und Stomatopoden.</a> <!--MARK--><!--MARK--><a href='nullf5b5f7c7-fc53-4502-951d-1c96b680d874' class='mouseoverHref'><em>Archiv für Naturgeschichte</em></a> <strong>53</strong>(1): 215-600 pls 7-22, 22a<!--MARK--> [for publication date Clark, P.F., Harrison, K. & Goodman, S.L. 1990. Brock's Indian Archipelago Decapoda and Stomatopoda by De Man: 1887 or 1888?. <em>Arch. Nat. Hist.</em> <strong>17</strong>(1): 79-80]","for publication date Clark, P.F., Harrison, K. & Goodman, S.L. 1990. Brock's Indian Archipelago Decapoda and Stomatopoda by De Man: 1887 or 1888?. <em>Arch. Nat. Hist.</em> <strong>17</strong>(1): 79-80","Article in Journal","c688b0bb-249d-4510-85f2-4afdc2af55bf","20081009T05:11:37.000+0000","f5b5f7c7-fc53-4502-951d-1c96b680d874"
"","","gardineri","Manella gardineri Rathbun, 1911","","Manella","","gardineri","","Synonym","synonym","Species","","Rathbun","1911","Y","0e1bb678-221a-49e1-be9a-074ed6848890","20220504T01:21:58.041+0000","cea68972-831c-475c-84fc-a22cb42f923a","20220510T08:28:17.473+0000","","1f576f78-73a2-4695-b5ef-f98758d131c4","Rathbun, M.J.","1911","Reports of the Percy Sladen Trust Expedition to the Indian Ocean in 1905, under the leadership of Mr. J. Stanley Gardiner. Vol. III. No. XI. Marine Brachyura","191-261, text-figs 1, 2 pls 15-20","","Transactions of the Linnean Society of London","","","","<!--MARK--><a href='null11b750ce-8cf9-4eae-8961-8e45c07ca179' class='mouseoverHref'>Rathbun, M.J. 1911. Reports of the Percy Sladen Trust Expedition to the Indian Ocean in 1905, under the leadership of Mr. J. Stanley Gardiner. Vol. III. No. XI. Marine Brachyura.</a> <!--MARK--><!--MARK--><a href='nulla6b0ca4d-471d-4666-96a2-8fee5114bc35' class='mouseoverHref'><em>Transactions of the Linnean Society of London</em></a> Zool. <strong>14</strong>(2): 191-261, text-figs 1, 2 pls 15-20<!--MARK-->","","Article in Journal","11b750ce-8cf9-4eae-8961-8e45c07ca179","20081009T05:11:37.000+0000","a6b0ca4d-471d-4666-96a2-8fee5114bc35"
"","","brevimana","Manella brevimana Ward, 1933","","Manella","","brevimana","","Synonym","synonym","Species","","Ward","1933","Y","da36224a-7520-438f-aa64-86129e4dfe50","20220504T01:21:58.041+0000","cea68972-831c-475c-84fc-a22cb42f923a","20220510T08:28:17.473+0000","","2b210576-febd-48c9-8394-8d6ec576e69c","Ward, M.","1933","New genera and species of marine Decapoda Brachyura from the coasts of New South Wales and Queensland","377-394 pls 21-23","","The Australian Zoologist","","","","<!--MARK--><a href='nulldd3bf9fc-91d8-4675-99a5-d4e160aa8ae4' class='mouseoverHref'>Ward, M. 1933. New genera and species of marine Decapoda Brachyura from the coasts of New South Wales and Queensland.</a> <!--MARK--><!--MARK--><a href='null48148530-5362-4b4a-a304-7ea21fe0d6b7' class='mouseoverHref'><em>The Australian Zoologist</em></a> <strong>7</strong>(5): 377-394 pls 21-23<!--MARK-->","","Article in Journal","dd3bf9fc-91d8-4675-99a5-d4e160aa8ae4","20081009T05:11:37.000+0000","48148530-5362-4b4a-a304-7ea21fe0d6b7"
"","","Pleurophricus","Pleurophricus A. Milne Edwards, 1873","CROSSOTONOTIDAE","Pleurophricus","","","","Valid Name","","Genus","","A. Milne Edwards","1873","Y","1e5baa5c-7db3-444c-9d92-deb4740bfc1f","20220504T01:21:58.041+0000","437a6189-f9cf-4522-bd33-0a9215f6fbd9","20220510T08:28:17.473+0000","c0c05525-5cbd-4b17-af63-29e70bf49725","437a6189-f9cf-4522-bd33-0a9215f6fbd9","","","","","","","","","","","","","","",""
"","","Pleurophricus","Pleurophricus A. Milne Edwards, 1873","","Pleurophricus","","","","Synonym","synonym","Genus","","A. Milne Edwards","1873","Y","2b8f3154-e299-4b06-b696-0f760610551f","20220504T01:21:58.041+0000","437a6189-f9cf-4522-bd33-0a9215f6fbd9","20220510T08:28:17.473+0000","","03df48da-9c33-47b4-9a1f-88f2b0d1761e","Milne Edwards, A.","1873","Description de quelques Crustacés nouveaux ou peu connus provenant du Musée de M.C. Godeffroy","77-88 pls 12, 13","","Journal des Museum Godeffroy, Hamburg","","","","<!--MARK--><a href='nulld713d28c-1329-4272-9527-e00745b5cd03' class='mouseoverHref'>Milne Edwards, A. 1873. Description de quelques Crustacés nouveaux ou peu connus provenant du Musée de M.C. Godeffroy.</a> <!--MARK--><!--MARK--><a href='null28313c9a-6bca-4375-9643-f488f6e53c98' class='mouseoverHref'><em>Journal des Museum Godeffroy, Hamburg</em></a> <strong>1</strong>(4): 77-88 pls 12, 13<!--MARK-->","","Article in Journal","d713d28c-1329-4272-9527-e00745b5cd03","20081009T05:11:37.000+0000","28313c9a-6bca-4375-9643-f488f6e53c98"
"","","cristatipes","Pleurophricus cristatipes A. Milne Edwards, 1873","CROSSOTONOTIDAE","Pleurophricus","","cristatipes","","Valid Name","","Species","","A. Milne Edwards","1873","Y","5d97d207-fa09-431a-bb27-922bf1ece15d","20220504T01:21:58.041+0000","41539860-77b6-4855-ad17-7ad5552f83e5","20220510T08:28:17.473+0000","437a6189-f9cf-4522-bd33-0a9215f6fbd9","41539860-77b6-4855-ad17-7ad5552f83e5","","","","","","","","","","","","","","",""
"","","cristatipes","Pleurophricus cristatipes A. Milne Edwards, 1873","","Pleurophricus","","cristatipes","","Synonym","synonym","Species","","A. Milne Edwards","1873","Y","4e974f7e-528a-4fb7-a5b7-eb7c4dce9098","20220504T01:21:58.041+0000","41539860-77b6-4855-ad17-7ad5552f83e5","20220510T08:28:17.473+0000","","403c20d2-1c66-40e6-b3ef-72ba1791e5aa","Milne Edwards, A.","1873","Description de quelques Crustacés nouveaux ou peu connus provenant du Musée de M.C. Godeffroy","77-88 pls 12, 13","","Journal des Museum Godeffroy, Hamburg","","","","<!--MARK--><a href='nulld713d28c-1329-4272-9527-e00745b5cd03' class='mouseoverHref'>Milne Edwards, A. 1873. Description de quelques Crustacés nouveaux ou peu connus provenant du Musée de M.C. Godeffroy.</a> <!--MARK--><!--MARK--><a href='null28313c9a-6bca-4375-9643-f488f6e53c98' class='mouseoverHref'><em>Journal des Museum Godeffroy, Hamburg</em></a> <strong>1</strong>(4): 77-88 pls 12, 13<!--MARK-->","","Article in Journal","d713d28c-1329-4272-9527-e00745b5cd03","20081009T05:11:37.000+0000","28313c9a-6bca-4375-9643-f488f6e53c98"
"","","PALICIDAE","PALICIDAE Bouvier, 1898","","","","","","Valid Name","","Family","","Bouvier","1898","Y","5b267ac5-f566-4a99-87bc-a7bff9c4a4ef","20220504T01:21:58.041+0000","294ce95a-aeea-4f28-869d-97d981bce739","20220510T08:28:17.473+0000","49c02b22-0e3e-4a7f-aade-708f5871c690","294ce95a-aeea-4f28-869d-97d981bce739","","","","","","","","","","","","","","",""
"","","Cymopoliidae","Cymopoliidae Dana, 1854","Cymopoliidae","","","","","Synonym","synonym","Family","as Cymopolidae, corrected to Cymopoliidae by Faxon, W. 1895. Stalk-eyed Crustacea of the Albatross. <em>Memoirs of the Museum of Comparative Zoology, Harvard</em> <strong>18</strong>: 1-292, 56 pls (38); Name No. 406 on the Official List of Family-Group Names in Zoology, see International Commission on Zoological Nomenclature 1964. Opinion 712. Forty-seven genera of Decapod Crustacea: placed on the Official List. <em>Bulletin of Zoological Nomenclature</em> <strong>21</strong>: 336-351 [26 November 1964]","Dana","1854","Y","fcdc842e-b7c5-400a-896b-0a287c1ff85a","20220504T01:21:58.041+0000","294ce95a-aeea-4f28-869d-97d981bce739","20220510T08:28:17.473+0000","","7c53e6a2-ed29-4ca6-ba30-65c0b14fde28","Dana, J.D.","1854","On the geographical distribution of Crustacea","1-45, 1 map","","American Journal of Science and Arts","","","","<!--MARK--><a href='nullf9a74bbd-2e0c-4c0e-9f77-9c1e3f55760c' class='mouseoverHref'>Dana, J.D. 1854. On the geographical distribution of Crustacea.</a> <!--MARK--><!--MARK--><a href='nulla4b57759-bfef-4187-bf77-d4db5e70c9cc' class='mouseoverHref'><em>American Journal of Science and Arts</em></a> 2 <strong>18</strong>: 1-45, 1 map<!--MARK-->","","Article in Journal","f9a74bbd-2e0c-4c0e-9f77-9c1e3f55760c","20081009T05:11:37.000+0000","a4b57759-bfef-4187-bf77-d4db5e70c9cc"
"","","Palicés","Palicés Bouvier, 1897","","","","","","Synonym","invalid name","Family","not in Latin, unavailable name","Bouvier","1897","Y","48f84627-7b68-43f8-9823-6ce987b073a2","20220504T01:21:58.041+0000","294ce95a-aeea-4f28-869d-97d981bce739","20220510T08:28:17.473+0000","","","","","","","","","","","","","","","","",""
"","","Palicae","Palicae Bouvier, 1898","","","","","","Synonym","synonym","Family","","Bouvier","1898","Y","ea8748bb-b2d7-4d2b-a40d-df9d2ab43a9a","20220504T01:21:58.041+0000","294ce95a-aeea-4f28-869d-97d981bce739","20220510T08:28:17.473+0000","","","","","","","","","","","","","","","","",""
"","","Palici","Palici Bouvier, 1898","Palici","","","","","Synonym","synonym","Family","","Bouvier","1898","Y","c7e2f472-115a-471e-9841-43cb8d4da9f3","20220504T01:21:58.041+0000","294ce95a-aeea-4f28-869d-97d981bce739","20220510T08:28:17.473+0000","","fa763bc3-c684-4379-9a46-9e309356ee45","Bouvier, E.L.","1898","Observations on the crabs of the family Dorippidae","103-105","","Annals and Magazine of Natural History","","","","<!--MARK--><a href='null5289bd26-51c6-4e62-843c-ce357e5fdb98' class='mouseoverHref'>Bouvier, E.L. 1898. Observations on the crabs of the family Dorippidae.</a> <!--MARK--><!--MARK--><a href='nullefa8de69-3a29-4a43-8ef2-cbefda205976' class='mouseoverHref'><em>Annals and Magazine of Natural History</em></a> 7 <strong>1</strong>: 103-105<!--MARK-->","","Article in Journal","5289bd26-51c6-4e62-843c-ce357e5fdb98","20081009T05:11:37.000+0000","efa8de69-3a29-4a43-8ef2-cbefda205976"
"","","Palicidae","Palicidae Rathbun, 1898","","","","","","Synonym","synonym","Family","Name No. 406 on Official List of Family-Group Names in Zoology, see International Commission on Zoological Nomenclature 1964. Opinion 712. Forty-seven genera of Decapod Crustacea: placed on the Official List. <em>Bulletin of Zoological Nomenclature</em> <strong>21</strong>: 336-351 [26 November 1964], but authorship and citation erroneous, see Castro, P. 2000. Crustacea Decapoda: A revision of the Indo-west Pacific species of palicid crabs (Brachyura Palicidae Bouvier, 1898). 437-610, figs 1-61 <em>in</em> Crosnier, A. (ed.). Résultats des campagnes MUSORSTOM, Volume 21. <em>Mémoires du Muséum National d'Histoire Naturelle, Paris</em> <strong>184</strong>: 1-813","Rathbun","1898","Y","da58d3e7-7642-4d62-ab83-18e7236e0f67","20220504T01:21:58.041+0000","294ce95a-aeea-4f28-869d-97d981bce739","20220510T08:28:17.473+0000","","bab436c3-dad5-4608-af57-fd601cccfbcd","Rathbun, M.J.","1898","The Brachyura collected by the U.S. Fish Commission steamer <i>Albatross</i> on the voyage from Norfolk, Virginia, to San Francisco, California, 1887-1888","567-616 pls 41-44","","Proceedings of the United States National Museum","","","","<!--MARK--><a href='null9a8882c3-2dce-4119-b492-55681d0f0155' class='mouseoverHref'>Rathbun, M.J. 1898. The Brachyura collected by the U.S. Fish Commission steamer <i>Albatross</i> on the voyage from Norfolk, Virginia, to San Francisco, California, 1887-1888.</a> <!--MARK--><!--MARK--><a href='null0e32c453-4bc6-48a2-a3a2-d40281874533' class='mouseoverHref'><em>Proceedings of the United States National Museum</em></a> <strong>21</strong>: 567-616 pls 41-44<!--MARK-->","","Article in Journal","9a8882c3-2dce-4119-b492-55681d0f0155","20081009T05:11:37.000+0000","0e32c453-4bc6-48a2-a3a2-d40281874533"
"","","Exopalicus","Exopalicus Castro, 2000","PALICIDAE","Exopalicus","","","","Valid Name","","Genus","","Castro","2000","Y","72a943c7-a941-4d3c-867d-e6b29178c40f","20220504T01:21:58.041+0000","1d701db3-8c89-4f94-ba4c-7116b6d26368","20220510T08:28:17.473+0000","294ce95a-aeea-4f28-869d-97d981bce739","1d701db3-8c89-4f94-ba4c-7116b6d26368","","","","","","","","","","","","","","",""
"","","Exopalicus","Exopalicus Castro, 2000","PALICIDAE","Exopalicus","","","","Synonym","synonym","Genus","","Castro","2000","Y","a76ab291-bee2-4e7e-a5b7-dfc58c378327","20220504T01:21:58.041+0000","1d701db3-8c89-4f94-ba4c-7116b6d26368","20220510T08:28:17.473+0000","","55c245f1-4be2-440f-ab30-9719e79fadba","Castro, P.","2000","Crustacea Decapoda: A revision of the Indo-west Pacific species of palicid crabs (Brachyura Palicidae Bouvier, 1898)","pp. 437-610, figs 1-61","","Mémoires du Muséum national d'Histoire naturelle, Paris","Résultats des campagnes MUSORSTOM, Volume 21","","","<!--MARK--><a href='nullbab5c66c-49a2-41be-8677-ad4f4429d1fb' class='mouseoverHref'>Castro, P. 2000. Crustacea Decapoda: A revision of the Indo-west Pacific species of palicid crabs (Brachyura Palicidae Bouvier, 1898). pp. 437-610, figs 1-61</a> <!--MARK--><em>in</em> <!--MARK--><a href='null1783599d-9c2d-4d36-8bbd-75db312289ae' class='mouseoverHref'>Crosnier, A. (ed.). Résultats des campagnes MUSORSTOM, Volume 21.</a> <!--MARK--><!--MARK--><a href='null93c2cf00-5323-4c6b-85b2-9b9ff8e2dfb9' class='mouseoverHref'><em>Mémoires du Muséum national d'Histoire naturelle, Paris</em></a><!--MARK--> [1936-1950] <strong>184</strong>: 1-813<!--MARK-->","","Section in Article","bab5c66c-49a2-41be-8677-ad4f4429d1fb","20081009T05:11:37.000+0000","1783599d-9c2d-4d36-8bbd-75db312289ae"
"","","maculatus","Exopalicus maculatus (Edmondson, 1930)","PALICIDAE","Exopalicus","","maculatus","","Valid Name","","Species","","Edmondson","1930","N","99b02e60-facf-4817-ac7f-1f4efced00c3","20220504T01:21:58.041+0000","ec10a4e5-127a-4390-be66-6a1d9a1fe374","20220510T08:28:17.473+0000","1d701db3-8c89-4f94-ba4c-7116b6d26368","ec10a4e5-127a-4390-be66-6a1d9a1fe374","","","","","","","","","","","","","","",""
"","","maculatus","Exopalicus maculatus (Edmondson, 1930)","PALICIDAE","Exopalicus","","maculatus","","Synonym","synonym","Species","","Edmondson","1930","N","cefc1687-3b79-4c1f-b819-c68bb8e45488","20220504T01:21:58.041+0000","ec10a4e5-127a-4390-be66-6a1d9a1fe374","20220510T08:28:17.473+0000","","03aa4c69-3bb7-4ec9-960f-e001f2d28134","Edmonson, C.H.","1930","New Hawaiian Crustacea","3-18","","Occasional Papers of the Bernice P. Bishop Museum","","","","<!--MARK--><a href='nullfac1613f-2277-4585-aa54-54281ebbcd9c' class='mouseoverHref'>Edmonson, C.H. 1930. New Hawaiian Crustacea.</a> <!--MARK--><!--MARK--><a href='null03e996fa-9f03-40cc-9067-f4fcb8b052a8' class='mouseoverHref'><em>Occasional Papers of the Bernice P. Bishop Museum</em></a> <strong>9</strong>: 3-18<!--MARK-->","","Article in Journal","fac1613f-2277-4585-aa54-54281ebbcd9c","20180807T04:27:27.183+0000","03e996fa-9f03-40cc-9067-f4fcb8b052a8"
"","","maculatus","Exopalicus maculatus (Edmondson, 1930)","PALICIDAE","Exopalicus","","maculatus","","Generic Combination","","Species","","Edmondson","1930","N","da184e25-e40e-41d8-bac1-4be1f5902873","20220504T01:21:58.041+0000","ec10a4e5-127a-4390-be66-6a1d9a1fe374","20220510T08:28:17.473+0000","","594397d8-ea3b-44d8-a5e6-9a707420f040","Castro, P.","2000","Crustacea Decapoda: A revision of the Indo-west Pacific species of palicid crabs (Brachyura Palicidae Bouvier, 1898)","pp. 437-610, figs 1-61","","Mémoires du Muséum national d'Histoire naturelle, Paris","Résultats des campagnes MUSORSTOM, Volume 21","","","<!--MARK--><a href='nullbab5c66c-49a2-41be-8677-ad4f4429d1fb' class='mouseoverHref'>Castro, P. 2000. Crustacea Decapoda: A revision of the Indo-west Pacific species of palicid crabs (Brachyura Palicidae Bouvier, 1898). pp. 437-610, figs 1-61</a> <!--MARK--><em>in</em> <!--MARK--><a href='null1783599d-9c2d-4d36-8bbd-75db312289ae' class='mouseoverHref'>Crosnier, A. (ed.). Résultats des campagnes MUSORSTOM, Volume 21.</a> <!--MARK--><!--MARK--><a href='null93c2cf00-5323-4c6b-85b2-9b9ff8e2dfb9' class='mouseoverHref'><em>Mémoires du Muséum national d'Histoire naturelle, Paris</em></a><!--MARK--> [1936-1950] <strong>184</strong>: 1-813<!--MARK-->","","Section in Article","bab5c66c-49a2-41be-8677-ad4f4429d1fb","20081009T05:11:37.000+0000","1783599d-9c2d-4d36-8bbd-75db312289ae"
"","","Miropalicus","Miropalicus Castro, 2000","PALICIDAE","Miropalicus","","","","Valid Name","","Genus","","Castro","2000","Y","9544fdfb-a400-4eec-92bf-777d41fc9375","20220504T01:21:58.041+0000","59131431-0fb4-492b-88bb-2e59cc1bedc6","20220510T08:28:17.473+0000","294ce95a-aeea-4f28-869d-97d981bce739","59131431-0fb4-492b-88bb-2e59cc1bedc6","","","","","","","","","","","","","","",""
"","","Miropalicus","Miropalicus Castro, 2000","PALICIDAE","Miropalicus","","","","Synonym","synonym","Genus","","Castro","2000","Y","814cf454-735b-497e-99c8-1d2d01900b1d","20220504T01:21:58.041+0000","59131431-0fb4-492b-88bb-2e59cc1bedc6","20220510T08:28:17.473+0000","","6e55b0c4-866e-4c91-a5fc-ca0fbb3831cf","Castro, P.","2000","Crustacea Decapoda: A revision of the Indo-west Pacific species of palicid crabs (Brachyura Palicidae Bouvier, 1898)","pp. 437-610, figs 1-61","","Mémoires du Muséum national d'Histoire naturelle, Paris","Résultats des campagnes MUSORSTOM, Volume 21","","","<!--MARK--><a href='nullbab5c66c-49a2-41be-8677-ad4f4429d1fb' class='mouseoverHref'>Castro, P. 2000. Crustacea Decapoda: A revision of the Indo-west Pacific species of palicid crabs (Brachyura Palicidae Bouvier, 1898). pp. 437-610, figs 1-61</a> <!--MARK--><em>in</em> <!--MARK--><a href='null1783599d-9c2d-4d36-8bbd-75db312289ae' class='mouseoverHref'>Crosnier, A. (ed.). Résultats des campagnes MUSORSTOM, Volume 21.</a> <!--MARK--><!--MARK--><a href='null93c2cf00-5323-4c6b-85b2-9b9ff8e2dfb9' class='mouseoverHref'><em>Mémoires du Muséum national d'Histoire naturelle, Paris</em></a><!--MARK--> [1936-1950] <strong>184</strong>: 1-813<!--MARK-->","","Section in Article","bab5c66c-49a2-41be-8677-ad4f4429d1fb","20081009T05:11:37.000+0000","1783599d-9c2d-4d36-8bbd-75db312289ae"
"","","vietnamensis","Miropalicus cf. vietnamensis (Zarenkov, 1968)","PALICIDAE","Miropalicus","","vietnamensis","","Valid Name","","Species","","Zarenkov","1968","N","d67f3c50-77bc-4360-98ac-cde1a4a8dbcb","20220504T01:21:58.041+0000","b3bbbe1b-d7ce-4a15-bad8-08d61536f363","20220510T08:28:17.473+0000","59131431-0fb4-492b-88bb-2e59cc1bedc6","b3bbbe1b-d7ce-4a15-bad8-08d61536f363","","","","","","","","","","","","","","",""
