"CAVS_CODE","CAAB_CODE","NAMES_VARIOUS","SCIENTIFIC_NAME","FAMILY","GENUS","SUBGENUS","SPECIES","SUBSPECIES","NAME_TYPE","NAME_SUBTYPE","RANK","QUALIFICATION","AUTHOR","YEAR","ORIG_COMBINATION","NAME_GUID","NAME_LAST_UPDATE","TAXON_GUID","TAXON_LAST_UPDATE","PARENT_TAXON_GUID","CONCEPT_GUID","PUB_PUB_AUTHOR","PUB_PUB_YEAR","PUB_PUB_TITLE","PUB_PUB_PAGES","PUB_PUB_PARENT_BOOK_TITLE","PUB_PUB_PARENT_JOURNAL_TITLE","PUB_PUB_PARENT_ARTICLE_TITLE","PUB_PUB_PUBLICATION_DATE","PUB_PUB_PUBLISHER","PUB_PUB_FORMATTED","PUB_PUB_QUALIFICATION","PUB_PUB_TYPE","PUBLICATION_GUID","PUBLICATION_LAST_UPDATE","PARENT_PUBLICATION_GUID"
"","","crassicornis","Chlorotocus crassicornis (Costa, 1871)","PANDALIDAE","Chlorotocus","","crassicornis","","Valid Name","","Species","","Costa","1871","N","2821477f-0f4a-4cbb-a016-1e9246534bbd","20220504T01:21:58.041+0000","9c2f266f-430a-46ba-b5e2-6c9e275c2a4e","20220510T08:28:17.473+0000","3af2576a-68f5-4e39-8171-a1812dc79cda","9c2f266f-430a-46ba-b5e2-6c9e275c2a4e","","","","","","","","","","","","","","",""
"","","crassicornis","Pandalus crassicornis Costa, 1871","","Pandalus","","crassicornis","","Synonym","synonym","Species","","Costa","1871","Y","0a8584e3-8a60-46bc-b480-f56d58a2de64","20220504T01:21:58.041+0000","9c2f266f-430a-46ba-b5e2-6c9e275c2a4e","20220510T08:28:17.473+0000","","28c46a40-3730-4ab7-8b90-534dea0fa64f","Costa, A.","1871","Specie del genere <i>Pandalus</i> rinvenute nel Golfo di Napoli","89-92 pl. 2","","Annuario dell'Istituto e Museo di Zoologia dell'Università di Napoli","","","","<!--MARK--><a href='null02c6f6cb-b6c4-40b3-98f0-7e7f887b1d1e' class='mouseoverHref'>Costa, A. 1871. Specie del genere <i>Pandalus</i> rinvenute nel Golfo di Napoli.</a> <!--MARK--><!--MARK--><a href='nullbf626ba6-dfbc-4589-b3d0-084e47483cca' class='mouseoverHref'><em>Annuario dell'Istituto e Museo di Zoologia dell'Università di Napoli</em></a> <strong>6</strong>: 89-92 pl. 2<!--MARK-->","","Article in Journal","02c6f6cb-b6c4-40b3-98f0-7e7f887b1d1e","20081009T05:11:37.000+0000","bf626ba6-dfbc-4589-b3d0-084e47483cca"
"","","gracilipes","Chlorotocus gracilipes A. Milne Edwards, 1882","","Chlorotocus","","gracilipes","","Synonym","synonym","Species","","A. Milne Edwards","1882","Y","cae29636-3ecd-4773-b51f-c1409c0396d9","20220504T01:21:58.041+0000","9c2f266f-430a-46ba-b5e2-6c9e275c2a4e","20220510T08:28:17.473+0000","","ac8c63fc-af51-4b4f-8ff0-4ae8c228b23b","Milne Edwards, A.","1882","Rapport sur les travaux de la Commission chargée d'étudier la faune sous-marine dans les grandes profondeurs de la Mediterranée et de l'océan Atlantique","1-59","","Archives des Missions Scientifiques et Litteraires, Paris","","","","<!--MARK--><a href='null276e77f4-4ccd-491f-a6a4-9d20d5e75e96' class='mouseoverHref'>Milne Edwards, A. 1882. Rapport sur les travaux de la Commission chargée d'étudier la faune sous-marine dans les grandes profondeurs de la Mediterranée et de l'océan Atlantique.</a> <!--MARK--><!--MARK--><a href='nulld1cbaa16-d2c7-46d0-8779-a8e3e7fc0bfb' class='mouseoverHref'><em>Archives des Missions Scientifiques et Litteraires, Paris</em></a> Ser. 3 <strong>9</strong>: 1-59<!--MARK-->","","Article in Journal","276e77f4-4ccd-491f-a6a4-9d20d5e75e96","20190307T05:31:26.199+0000","d1cbaa16-d2c7-46d0-8779-a8e3e7fc0bfb"
"","","chlorotocus","Palemon chlorotocus Filhol, 1885","","Palemon","","chlorotocus","","Synonym","synonym","Species","","Filhol","1885","Y","ca3dac12-aa1d-4f0a-8ea0-7b268b116e66","20220504T01:21:58.041+0000","9c2f266f-430a-46ba-b5e2-6c9e275c2a4e","20220510T08:28:17.473+0000","","7b9e03a7-95d8-48d4-a247-48cabe6a5ae8","Filhol, H.","1885","La vie au fond des mers. Les explorations sous-marines et les voyages du Travailleur et du Talisman. Bibliothèque de la Nature","303 pp.","","","","","G. Masson","<!--MARK--><a href='null51ada0a8-38f6-4b81-a0c6-3cdf0a7084af' class='mouseoverHref'>Filhol, H. 1885. <em>La vie au fond des mers. Les explorations sous-marines et les voyages du Travailleur et du Talisman. Bibliothèque de la Nature</em>. Paris : G. Masson 303 pp.</a><!--MARK-->","","Book","51ada0a8-38f6-4b81-a0c6-3cdf0a7084af","20100120T22:47:58.482+0000",""
"","","incertus","?Chlorotocus incertus Spence Bate, 1888","","?Chlorotocus","","incertus","","Synonym","synonym","Species","","Spence Bate","1888","Y","db7a4b40-3df7-4888-861a-0e73461d97f7","20220504T01:21:58.041+0000","9c2f266f-430a-46ba-b5e2-6c9e275c2a4e","20220510T08:28:17.473+0000","","8cb3fe8d-cc12-4191-9280-2b45532b9596","Spence Bate, C.","1888","Report on the Crustacea Macrura collected by H.M.S. Challenger during the years 1873-76","1-942, i-xc figs 1-76 pls 1-150","","Report on the Scientific Results of the Voyage of H.M.S. Challenger 1873-1876, Zoology","","","","<!--MARK--><a href='null4488d011-e0c7-4f63-9849-2dba62669cd1' class='mouseoverHref'>Spence Bate, C. 1888. Report on the Crustacea Macrura collected by H.M.S. Challenger during the years 1873-76.</a> <!--MARK--><!--MARK--><a href='null1db4d8a3-1c27-4eff-aef5-d93514e06c4f' class='mouseoverHref'><em>Report on the Scientific Results of the Voyage of H.M.S. Challenger 1873-1876, Zoology</em></a> <strong>24</strong>: 1-942, i-xc figs 1-76 pls 1-150<!--MARK-->","","Article in Journal","4488d011-e0c7-4f63-9849-2dba62669cd1","20180731T03:35:13.746+0000","1db4d8a3-1c27-4eff-aef5-d93514e06c4f"
"","","andamanensis","Chlorotocus gracilipes andamanensis Alcock & Anderson, 1899","","Chlorotocus","","gracilipes","andamanensis","Synonym","synonym","Species","","Alcock & Anderson","1899","Y","6d293e5d-5ddf-486d-b532-c16cac81b4cb","20220504T01:21:58.041+0000","9c2f266f-430a-46ba-b5e2-6c9e275c2a4e","20220510T08:28:17.473+0000","","0dcd6f67-1ef2-44e5-bf30-40e6c130ab9b","Alcock, A.W. & Anderson, A.R.S.","1899","Natural history notes from H.M. royal Indian marine survey ship Investigator, Commander T.H. Heming, R.N., commanding. Ser. III, No. 2. An account of the deep-sea Crustacea dredged during the surveying-season of 1897-1898","1-27, 278-292","","Annals and Magazine of Natural History","","","","<!--MARK--><a href='nulld9928c5e-d780-490a-99e6-2e2ded213660' class='mouseoverHref'>Alcock, A.W. & Anderson, A.R.S. 1899. Natural history notes from H.M. royal Indian marine survey ship Investigator, Commander T.H. Heming, R.N., commanding. Ser. III, No. 2. An account of the deep-sea Crustacea dredged during the surveying-season of 1897-1898.</a> <!--MARK--><!--MARK--><a href='nullefa8de69-3a29-4a43-8ef2-cbefda205976' class='mouseoverHref'><em>Annals and Magazine of Natural History</em></a> 7 <strong>3</strong>: 1-27, 278-292<!--MARK-->","","Article in Journal","d9928c5e-d780-490a-99e6-2e2ded213660","20081009T05:11:37.000+0000","efa8de69-3a29-4a43-8ef2-cbefda205976"
"","","novaezealandiae","Chlorotocus novaezealandiae (Borradaile, 1916)","PANDALIDAE","Chlorotocus","","novaezealandiae","","Valid Name","","Species","","Borradaile","1916","N","bf8af0f9-7c12-41af-96bb-b98f6a7775d9","20220504T01:21:58.041+0000","3e0024b3-c6f1-4042-a60d-2b63210f22c6","20220510T08:28:17.473+0000","3af2576a-68f5-4e39-8171-a1812dc79cda","3e0024b3-c6f1-4042-a60d-2b63210f22c6","","","","","","","","","","","","","","",""
"","","novaezealandiae","Thalassocaris novaezealandiae Borradaile, 1916","","Thalassocaris","","novaezealandiae","","Synonym","synonym","Species","as <I>Thalassocaris novae-zealandiae</I>","Borradaile","1916","Y","a9470291-722a-423c-9af7-0c71a86e1b23","20220504T01:21:58.041+0000","3e0024b3-c6f1-4042-a60d-2b63210f22c6","20220510T08:28:17.473+0000","","c0aaf262-6506-4c9b-a582-47cbd12d59aa","Borradaile, L.A.","1916","Crustacea. Part 1--Decapoda","75-110 figs 1-6","","Natural History Report of the British Antarctic Terra Nova Expedition","","","","<!--MARK--><a href='null7639b681-9155-49f5-ae11-9c5cb925ed37' class='mouseoverHref'>Borradaile, L.A. 1916. Crustacea. Part 1--Decapoda.</a> <!--MARK--><!--MARK--><a href='null28df8005-2970-4cc9-849d-57939e50a694' class='mouseoverHref'><em>Natural History Report of the British Antarctic Terra Nova Expedition</em></a> <strong>3</strong>(2): 75-110 figs 1-6<!--MARK-->","","Article in Journal","7639b681-9155-49f5-ae11-9c5cb925ed37","20081009T05:11:37.000+0000","28df8005-2970-4cc9-849d-57939e50a694"
"","","Heterocarpus","Heterocarpus A. Milne Edwards, 1881","PANDALIDAE","Heterocarpus","","","","Valid Name","","Genus","","A. Milne Edwards","1881","Y","71c6b263-fad3-47d1-bc20-770db6377e62","20220504T01:21:58.041+0000","672d497e-28a5-41ff-9eb9-8572b2bc1d65","20220510T08:28:17.473+0000","ca433a92-fe0a-4326-b70a-18fe0450f9b3","672d497e-28a5-41ff-9eb9-8572b2bc1d65","","","","","","","","","","","","","","",""
"","","Heterocarpus","Heterocarpus A. Milne Edwards, 1881","","Heterocarpus","","","","Synonym","synonym","Genus","name placed on the Official List of Generic Names in Zoology, see International Commission on Zoological Nomenclature 1957. Opinion 470. Additions to the <I>Official List of Family-Group Names in Zoology</I> of the names of one hundred and two genera of Caridea (Class Crustacea, Order Decapoda) and use of the Plenary Powers for various purposes in connection therewith. <em>Opinions and Declarations rendered by the International Commission on Zoological Nomenclature</em> <strong>16</strong>: 129-202; gender masculine","A. Milne Edwards","1881","Y","934b9196-6a50-43ed-a887-a14da1145a7e","20220504T01:21:58.041+0000","672d497e-28a5-41ff-9eb9-8572b2bc1d65","20220510T08:28:17.473+0000","","b3248c58-91db-4fb4-990e-003221c96794","Milne Edwards, A.","1881","Description de quelques Crustacés macroures provenant des grandes profondeurs de la mer des Antilles","1-16","","Annales des Sciences Naturelles, Paris","","","","<!--MARK--><a href='nullefdb4261-b671-486f-8683-4836ffea1666' class='mouseoverHref'>Milne Edwards, A. 1881. Description de quelques Crustacés macroures provenant des grandes profondeurs de la mer des Antilles.</a> <!--MARK--><!--MARK--><a href='null8728aca1-f2e1-4662-b5b6-40183f95151b' class='mouseoverHref'><em>Annales des Sciences Naturelles, Paris</em></a> Zool. (6) <strong>11</strong>(4): 1-16<!--MARK-->","","Article in Journal","efdb4261-b671-486f-8683-4836ffea1666","20190307T05:31:33.212+0000","8728aca1-f2e1-4662-b5b6-40183f95151b"
"","","Atlantocaris","Atlantocaris Ortmann, 1893","","Atlantocaris","","","","Synonym","synonym","Genus","gender feminine","Ortmann","1893","Y","cef60879-d677-4025-ba97-a6f90a52a4dc","20220504T01:21:58.041+0000","672d497e-28a5-41ff-9eb9-8572b2bc1d65","20220510T08:28:17.473+0000","","d407b111-e188-4188-b913-632ce4cb7dc6","Ortmann, A.E.","1893","Decapoden und Schizopoden der Plankton-Expedition","1-120 pls 1-10","","Ergebnisse der Hamburger Magalhaensischen Sammelreise","","","","<!--MARK--><a href='nullf195b23f-635d-4fde-b5a2-b59a21cf2ff5' class='mouseoverHref'>Ortmann, A.E. 1893. Decapoden und Schizopoden der Plankton-Expedition.</a> <!--MARK--><!--MARK--><a href='null04235aa5-f0d1-48d5-b21f-655bb7358f70' class='mouseoverHref'><em>Ergebnisse der Hamburger Magalhaensischen Sammelreise</em></a> <strong>2</strong>(Gb): 1-120 pls 1-10<!--MARK-->","","Article in Journal","f195b23f-635d-4fde-b5a2-b59a21cf2ff5","20081009T05:11:37.000+0000","04235aa5-f0d1-48d5-b21f-655bb7358f70"
"","","dorsalis","Heterocarpus dorsalis Spence Bate, 1888","PANDALIDAE","Heterocarpus","","dorsalis","","Valid Name","","Species","","Spence Bate","1888","Y","3275a781-b23d-46f9-b7bd-9dd9afdae25e","20220504T01:21:58.041+0000","1fbf8ef9-1083-42e0-a27a-f473fadc91e6","20220510T08:28:17.473+0000","672d497e-28a5-41ff-9eb9-8572b2bc1d65","1fbf8ef9-1083-42e0-a27a-f473fadc91e6","","","","","","","","","","","","","","",""
"","","Madagascar Nylon Shrimp (Fao)","","","","","","","Common Name","General","Species","","","","","0aa39fb8-d841-4799-b131-6fa0761caf38","20220504T01:21:58.041+0000","1fbf8ef9-1083-42e0-a27a-f473fadc91e6","20220510T08:28:17.473+0000","","","","","","","","","","","","","","","","",""
"","","Pink Carid","","","","","","","Common Name","General","Species","","","","","fb981046-7713-4b6d-a267-5e23faf00ca2","20220504T01:21:58.041+0000","1fbf8ef9-1083-42e0-a27a-f473fadc91e6","20220510T08:28:17.473+0000","","","","","","","","","","","","","","","","",""
"","","dorsalis","Heterocarpus dorsalis Spence Bate, 1888","","Heterocarpus","","dorsalis","","Synonym","synonym","Species","","Spence Bate","1888","Y","499aa7b5-211c-47a4-bcb1-71d24b718432","20220504T01:21:58.041+0000","1fbf8ef9-1083-42e0-a27a-f473fadc91e6","20220510T08:28:17.473+0000","","a5697eee-e77d-4767-ad82-2aa2befa24ea","Spence Bate, C.","1888","Report on the Crustacea Macrura collected by H.M.S. Challenger during the years 1873-76","1-942, i-xc figs 1-76 pls 1-150","","Report on the Scientific Results of the Voyage of H.M.S. Challenger 1873-1876, Zoology","","","","<!--MARK--><a href='null4488d011-e0c7-4f63-9849-2dba62669cd1' class='mouseoverHref'>Spence Bate, C. 1888. Report on the Crustacea Macrura collected by H.M.S. Challenger during the years 1873-76.</a> <!--MARK--><!--MARK--><a href='null1db4d8a3-1c27-4eff-aef5-d93514e06c4f' class='mouseoverHref'><em>Report on the Scientific Results of the Voyage of H.M.S. Challenger 1873-1876, Zoology</em></a> <strong>24</strong>: 1-942, i-xc figs 1-76 pls 1-150<!--MARK-->","","Article in Journal","4488d011-e0c7-4f63-9849-2dba62669cd1","20180731T03:35:13.746+0000","1db4d8a3-1c27-4eff-aef5-d93514e06c4f"
"","","alphonsi","Heterocarpus alphonsi Spence Bate, 1888","","Heterocarpus","","alphonsi","","Synonym","synonym","Species","","Spence Bate","1888","Y","51248d5e-9ca6-4088-a9a4-ae6e395fa332","20220504T01:21:58.041+0000","1fbf8ef9-1083-42e0-a27a-f473fadc91e6","20220510T08:28:17.473+0000","","24804c6c-12af-4cbd-8944-398220524ad9","Spence Bate, C.","1888","Report on the Crustacea Macrura collected by H.M.S. Challenger during the years 1873-76","1-942, i-xc figs 1-76 pls 1-150","","Report on the Scientific Results of the Voyage of H.M.S. Challenger 1873-1876, Zoology","","","","<!--MARK--><a href='null4488d011-e0c7-4f63-9849-2dba62669cd1' class='mouseoverHref'>Spence Bate, C. 1888. Report on the Crustacea Macrura collected by H.M.S. Challenger during the years 1873-76.</a> <!--MARK--><!--MARK--><a href='null1db4d8a3-1c27-4eff-aef5-d93514e06c4f' class='mouseoverHref'><em>Report on the Scientific Results of the Voyage of H.M.S. Challenger 1873-1876, Zoology</em></a> <strong>24</strong>: 1-942, i-xc figs 1-76 pls 1-150<!--MARK-->","","Article in Journal","4488d011-e0c7-4f63-9849-2dba62669cd1","20180731T03:35:13.746+0000","1db4d8a3-1c27-4eff-aef5-d93514e06c4f"
"","","affinis","Heterocarpus affinis Borradaile, 1915","","Heterocarpus","","affinis","","Synonym","synonym","Species","","Borradaile","1915","Y","a9afd18c-d45e-43da-a0f0-042d643e2a46","20220504T01:21:58.041+0000","1fbf8ef9-1083-42e0-a27a-f473fadc91e6","20220510T08:28:17.473+0000","","2d537ea3-138f-4cd2-a52e-b519930360cb","Borradaile, L.A.","1915","Notes on Carides","205-213","","Annals and Magazine of Natural History","","","","<!--MARK--><a href='nullcc47cba2-8937-4f5f-90b7-fa97054f96e0' class='mouseoverHref'>Borradaile, L.A. 1915. Notes on Carides.</a> <!--MARK--><!--MARK--><a href='nullefa8de69-3a29-4a43-8ef2-cbefda205976' class='mouseoverHref'><em>Annals and Magazine of Natural History</em></a> <strong>15</strong>: 205-213<!--MARK-->","","Article in Journal","cc47cba2-8937-4f5f-90b7-fa97054f96e0","20081009T05:11:37.000+0000","efa8de69-3a29-4a43-8ef2-cbefda205976"
"","","gibbosus","Heterocarpus gibbosus Spence Bate, 1888","PANDALIDAE","Heterocarpus","","gibbosus","","Valid Name","","Species","","Spence Bate","1888","Y","7e2ed7e9-09f8-463a-bb1d-f0845ea32952","20220504T01:21:58.041+0000","2404895f-8fec-4720-ab02-a74a13af3ed6","20220510T08:28:17.473+0000","672d497e-28a5-41ff-9eb9-8572b2bc1d65","2404895f-8fec-4720-ab02-a74a13af3ed6","","","","","","","","","","","","","","",""
"","","Humpback Nylon Shrimp (Fao)","","","","","","","Common Name","General","Species","","","","","f8600d20-3de1-4b62-a1c6-da35f9e5d387","20220504T01:21:58.041+0000","2404895f-8fec-4720-ab02-a74a13af3ed6","20220510T08:28:17.473+0000","","","","","","","","","","","","","","","","",""
"","","Red-crested Carid","","","","","","","Common Name","General","Species","","","","","dd344ee8-806e-4bd5-8526-15bbd9f69b5e","20220504T01:21:58.041+0000","2404895f-8fec-4720-ab02-a74a13af3ed6","20220510T08:28:17.473+0000","","","","","","","","","","","","","","","","",""
"","","Redhead Carid","","","","","","","Common Name","General","Species","","","","","328dc1a3-c1f3-4509-b878-603ed978d353","20220504T01:21:58.041+0000","2404895f-8fec-4720-ab02-a74a13af3ed6","20220510T08:28:17.473+0000","","","","","","","","","","","","","","","","",""
"","","gibbosus","Heterocarpus gibbosus Spence Bate, 1888","","Heterocarpus","","gibbosus","","Synonym","synonym","Species","","Spence Bate","1888","Y","affd1957-a5d7-4511-9411-84fbc9d5c263","20220504T01:21:58.041+0000","2404895f-8fec-4720-ab02-a74a13af3ed6","20220510T08:28:17.473+0000","","34a408a9-216c-43fd-834c-95f8e6fa6cbb","Spence Bate, C.","1888","Report on the Crustacea Macrura collected by H.M.S. Challenger during the years 1873-76","1-942, i-xc figs 1-76 pls 1-150","","Report on the Scientific Results of the Voyage of H.M.S. Challenger 1873-1876, Zoology","","","","<!--MARK--><a href='null4488d011-e0c7-4f63-9849-2dba62669cd1' class='mouseoverHref'>Spence Bate, C. 1888. Report on the Crustacea Macrura collected by H.M.S. Challenger during the years 1873-76.</a> <!--MARK--><!--MARK--><a href='null1db4d8a3-1c27-4eff-aef5-d93514e06c4f' class='mouseoverHref'><em>Report on the Scientific Results of the Voyage of H.M.S. Challenger 1873-1876, Zoology</em></a> <strong>24</strong>: 1-942, i-xc figs 1-76 pls 1-150<!--MARK-->","","Article in Journal","4488d011-e0c7-4f63-9849-2dba62669cd1","20180731T03:35:13.746+0000","1db4d8a3-1c27-4eff-aef5-d93514e06c4f"
"","","hayashii","Heterocarpus hayashii Crosnier, 1988","PANDALIDAE","Heterocarpus","","hayashii","","Valid Name","","Species","","Crosnier","1988","Y","86aab152-0c85-4e9f-9443-f803aaa8c872","20220504T01:21:58.041+0000","4bdb1b86-1693-468f-801c-db2f24f059e4","20220510T08:28:17.473+0000","672d497e-28a5-41ff-9eb9-8572b2bc1d65","4bdb1b86-1693-468f-801c-db2f24f059e4","","","","","","","","","","","","","","",""
"","","Hayashi Carid","","","","","","","Common Name","General","Species","","","","","f700e2fd-13eb-4807-9677-48a8cf488f60","20220504T01:21:58.041+0000","4bdb1b86-1693-468f-801c-db2f24f059e4","20220510T08:28:17.473+0000","","","","","","","","","","","","","","","","",""
"","","White Carid","","","","","","","Common Name","General","Species","","","","","00353247-585d-48fc-a450-57cae41a21ae","20220504T01:21:58.041+0000","4bdb1b86-1693-468f-801c-db2f24f059e4","20220510T08:28:17.473+0000","","","","","","","","","","","","","","","","",""
"","","hayashii","Heterocarpus hayashii Crosnier, 1988","","Heterocarpus","","hayashii","","Synonym","synonym","Species","","Crosnier","1988","Y","d510ceda-43bb-46ef-a15a-a18342ef78fc","20220504T01:21:58.041+0000","4bdb1b86-1693-468f-801c-db2f24f059e4","20220510T08:28:17.473+0000","","9662f4e7-8e8e-4429-9433-ba928c865e45","Crosnier, A.","1988","Sur les <i>Heterocarpus</i> (Crustacea, Decapoda, Pandalidae) du sud-ouest de l'océan Indien. Remarques sur d'autres espèces ouest-pacifiques du genre et description de quatre taxa nouveaux","57-103","","Bulletin du Muséum National d'Histoire Naturelle, Paris","","","","<!--MARK--><a href='null3d9cb9cf-11e3-447e-9483-4f28bde5507f' class='mouseoverHref'>Crosnier, A. 1988. Sur les <i>Heterocarpus</i> (Crustacea, Decapoda, Pandalidae) du sud-ouest de l'océan Indien. Remarques sur d'autres espèces ouest-pacifiques du genre et description de quatre taxa nouveaux.</a> <!--MARK--><!--MARK--><a href='null796711f5-67db-4504-bf92-fda69a7bdc27' class='mouseoverHref'><em>Bulletin du Muséum National d'Histoire Naturelle, Paris</em></a><!--MARK--> [published 1907-1971] <strong>10</strong>(sect. A, No. 1): 57-103<!--MARK-->","","Article in Journal","3d9cb9cf-11e3-447e-9483-4f28bde5507f","20081009T05:11:37.000+0000","796711f5-67db-4504-bf92-fda69a7bdc27"
"","","laevigatus","Heterocarpus laevigatus Spence Bate, 1888","PANDALIDAE","Heterocarpus","","laevigatus","","Valid Name","","Species","","Spence Bate","1888","Y","098d5911-5d38-4344-92e2-2c633d92ebb4","20220504T01:21:58.041+0000","fdb65448-1203-458f-816f-d0632cb88f1d","20220510T08:28:17.473+0000","672d497e-28a5-41ff-9eb9-8572b2bc1d65","fdb65448-1203-458f-816f-d0632cb88f1d","","","","","","","","","","","","","","",""
"","","laevigatus","Heterocarpus laevigatus Spence Bate, 1888","","Heterocarpus","","laevigatus","","Synonym","synonym","Species","","Spence Bate","1888","Y","26ce73d9-c8a8-4b91-900b-48b881a79e4e","20220504T01:21:58.041+0000","fdb65448-1203-458f-816f-d0632cb88f1d","20220510T08:28:17.473+0000","","16adca0a-a29a-4a29-8f76-b5942e5505ff","Spence Bate, C.","1888","Report on the Crustacea Macrura collected by H.M.S. Challenger during the years 1873-76","1-942, i-xc figs 1-76 pls 1-150","","Report on the Scientific Results of the Voyage of H.M.S. Challenger 1873-1876, Zoology","","","","<!--MARK--><a href='null4488d011-e0c7-4f63-9849-2dba62669cd1' class='mouseoverHref'>Spence Bate, C. 1888. Report on the Crustacea Macrura collected by H.M.S. Challenger during the years 1873-76.</a> <!--MARK--><!--MARK--><a href='null1db4d8a3-1c27-4eff-aef5-d93514e06c4f' class='mouseoverHref'><em>Report on the Scientific Results of the Voyage of H.M.S. Challenger 1873-1876, Zoology</em></a> <strong>24</strong>: 1-942, i-xc figs 1-76 pls 1-150<!--MARK-->","","Article in Journal","4488d011-e0c7-4f63-9849-2dba62669cd1","20180731T03:35:13.746+0000","1db4d8a3-1c27-4eff-aef5-d93514e06c4f"
"","","longirostris","Heterocarpus longirostris MacGilchrist, 1905","PANDALIDAE","Heterocarpus","","longirostris","","Valid Name","","Species","","MacGilchrist","1905","Y","6804b07a-72ed-4d4e-9bb2-eb1afd2dc9ca","20220504T01:21:58.041+0000","dad201f6-5c7d-495e-b196-2f27f403ac73","20220510T08:28:17.473+0000","672d497e-28a5-41ff-9eb9-8572b2bc1d65","dad201f6-5c7d-495e-b196-2f27f403ac73","","","","","","","","","","","","","","",""
"","","longirostris","Heterocarpus longirostris MacGilchrist, 1905","","Heterocarpus","","longirostris","","Synonym","synonym","Species","","MacGilchrist","1905","Y","5f36eedf-a7f8-4e27-8826-e52ab458a464","20220504T01:21:58.041+0000","dad201f6-5c7d-495e-b196-2f27f403ac73","20220510T08:28:17.473+0000","","8d10b87f-810d-4b20-9a3d-07b0a444866b","MacGilchrist, A.C.","1905","Natural History Notes from the R.I.M.S.S. Investigator, Capt T.H. Heming, R.N. (retired), commanding. -- Series III., No. 6. An account of the new and some of the rarer Decapod Crustacea obtained during the surveying seasons 1901-1904","233-268","","Annals and Magazine of Natural History","","","","<!--MARK--><a href='nullc5284383-3aa6-45c0-8870-fc2836a46930' class='mouseoverHref'>MacGilchrist, A.C. 1905. Natural History Notes from the R.I.M.S.S. Investigator, Capt T.H. Heming, R.N. (retired), commanding. -- Series III., No. 6. An account of the new and some of the rarer Decapod Crustacea obtained during the surveying seasons 1901-1904.</a> <!--MARK--><!--MARK--><a href='nullefa8de69-3a29-4a43-8ef2-cbefda205976' class='mouseoverHref'><em>Annals and Magazine of Natural History</em></a> <strong>15</strong>(87): 233-268<!--MARK-->","","Article in Journal","c5284383-3aa6-45c0-8870-fc2836a46930","20081009T05:11:37.000+0000","efa8de69-3a29-4a43-8ef2-cbefda205976"
"","","facetus","Heterocarpus facetus Zarenkov & Khodkina, 1981","","Heterocarpus","","facetus","","Synonym","synonym","Species","","Zarenkov & Khodkina","1981","Y","36395d6c-7486-4a9f-b61c-4ccb52229f5c","20220504T01:21:58.041+0000","dad201f6-5c7d-495e-b196-2f27f403ac73","20220510T08:28:17.473+0000","","7d9db85e-1c5c-43b4-8739-d6ce5deda021","Zarenkov, N.A. & Khodkina, I.V.","1981","Decapoda.","pp. 83-93","","","","","","<!--MARK--><a href='null3f609771-7019-41d6-bfd1-7a1c016fbd2b' class='mouseoverHref'>Zarenkov, N.A. & Khodkina, I.V. 1981. Decapoda. In: Kuznetsov, A.P. & A.N. Mironov (ed.), Benthos of the submarine mountains Marcus-Necker and adjacent Pacific regions [in Russian]. Academyof Sciences of the USSR, P.P. Shirshov Institute of Oceanology, Moscow. pp. 83-93</a>","","Miscellaneous","3f609771-7019-41d6-bfd1-7a1c016fbd2b","20120120T03:47:44.753+0000",""
"","","parvispina","Heterocarpus parvispina de Man, 1917","PANDALIDAE","Heterocarpus","","parvispina","","Valid Name","","Species","","de Man","1917","Y","0d9a73cd-652f-4a6d-9fdf-ea7c11d962fc","20220504T01:21:58.041+0000","14b2de81-a88b-4501-9ffe-a8b83794da2b","20220510T08:28:17.473+0000","672d497e-28a5-41ff-9eb9-8572b2bc1d65","14b2de81-a88b-4501-9ffe-a8b83794da2b","","","","","","","","","","","","","","",""
"","","parvispina","Heterocarpus ensifer parvispina de Man, 1917","","Heterocarpus","","ensifer","parvispina","Synonym","synonym","Species","","de Man","1917","Y","ea199e8a-e1e8-4ece-9075-0326465e020e","20220504T01:21:58.041+0000","14b2de81-a88b-4501-9ffe-a8b83794da2b","20220510T08:28:17.473+0000","","91c0213d-f498-48c8-84bf-b3b94588c730","de Man, J.G.","1917","Diagnoses of new species of macrurous decapod Crustacea from the Siboga-Expedition","279-284","","Zoologische Mededelingen (Leiden)","","","","<!--MARK--><a href='null3760eb38-f63e-4d87-8f33-d6c2b810fcd4' class='mouseoverHref'>de Man, J.G. 1917. Diagnoses of new species of macrurous decapod Crustacea from the Siboga-Expedition.</a> <!--MARK--><!--MARK--><a href='null42ce8f11-9401-4dfc-ae20-52feb2a315f5' class='mouseoverHref'><em>Zoologische Mededelingen (Leiden)</em></a> <strong>3</strong>(4): 279-284<!--MARK-->","","Article in Journal","3760eb38-f63e-4d87-8f33-d6c2b810fcd4","20081009T05:11:37.000+0000","42ce8f11-9401-4dfc-ae20-52feb2a315f5"
