"CAVS_CODE","CAAB_CODE","NAMES_VARIOUS","SCIENTIFIC_NAME","FAMILY","GENUS","SUBGENUS","SPECIES","SUBSPECIES","NAME_TYPE","NAME_SUBTYPE","RANK","QUALIFICATION","AUTHOR","YEAR","ORIG_COMBINATION","NAME_GUID","NAME_LAST_UPDATE","TAXON_GUID","TAXON_LAST_UPDATE","PARENT_TAXON_GUID","CONCEPT_GUID","PUB_PUB_AUTHOR","PUB_PUB_YEAR","PUB_PUB_TITLE","PUB_PUB_PAGES","PUB_PUB_PARENT_BOOK_TITLE","PUB_PUB_PARENT_JOURNAL_TITLE","PUB_PUB_PARENT_ARTICLE_TITLE","PUB_PUB_PUBLICATION_DATE","PUB_PUB_PUBLISHER","PUB_PUB_FORMATTED","PUB_PUB_QUALIFICATION","PUB_PUB_TYPE","PUBLICATION_GUID","PUBLICATION_LAST_UPDATE","PARENT_PUBLICATION_GUID"
"","","PANDALOIDEA","PANDALOIDEA Haworth, 1825","","","","","","Valid Name","","Superfamily","","Haworth","1825","Y","c77bfc18-0290-44ab-a9a6-6d4531997325","20220504T01:21:58.041+0000","db524f40-bad4-4a8a-8e79-390c0877af24","20220510T08:28:17.473+0000","b95c43ac-8125-4a42-b042-76e48ac71db0","db524f40-bad4-4a8a-8e79-390c0877af24","","","","","","","","","","","","","","",""
"","","CHLOROTOCELLIDAE","CHLOROTOCELLIDAE Komai, Chan & De Grave, 2019","","","","","","Valid Name","","Family","","Komai, Chan & De Grave","2019","Y","06719e2e-9d75-48d0-97a1-282164edb0a6","20220504T01:21:58.041+0000","1ddc017a-1aab-4187-9d71-066db5f1f9c7","20220510T08:28:17.473+0000","db524f40-bad4-4a8a-8e79-390c0877af24","1ddc017a-1aab-4187-9d71-066db5f1f9c7","","","","","","","","","","","","","","",""
"","","Chlorotocellidae","Chlorotocellidae Komai, Chan & De Grave, 2019","","","","","","Synonym","synonym","Family","","Komai, Chan & De Grave","2019","Y","cbd336c5-0d34-4ad1-97cf-cd0274553ad5","20220504T01:21:58.041+0000","1ddc017a-1aab-4187-9d71-066db5f1f9c7","20220510T08:28:17.473+0000","","c270090a-7fd7-48cc-8477-b9af8b54f452","Komai, T., Chan, T-Y, & De Grave, S.","2019","Establishment of a new shrimp family Chlorotocellidae for four genera previously assigned to Pandalidae (Decapoda, Caridea, Pandaloidea)","391-402","","Zoosystematics and Evolution","","","","<!--MARK--><a href='null89bcb67f-0d62-4388-885c-7387fe83f61b' class='mouseoverHref'>Komai, T., Chan, T-Y, & De Grave, S. 2019. Establishment of a new shrimp family Chlorotocellidae for four genera previously assigned to Pandalidae (Decapoda, Caridea, Pandaloidea).</a> <!--MARK--><!--MARK--><a href='nullfc7575d3-3592-49aa-914b-39d714e53ad3' class='mouseoverHref'><em>Zoosystematics and Evolution</em></a> <strong>95</strong>(2): 391-402<!--MARK-->","","Article in Journal","89bcb67f-0d62-4388-885c-7387fe83f61b","20191204T00:47:15.983+0000","fc7575d3-3592-49aa-914b-39d714e53ad3"
"","","Chlorocurtis","Chlorocurtis Kemp, 1925","CHLOROTOCELLIDAE","Chlorocurtis","","","","Valid Name","","Genus","","Kemp","1925","Y","4d46c9c0-e522-45f3-befb-16c403635f48","20220504T01:21:58.041+0000","20b0f6d4-5dc4-4879-9d59-e67d2b023b64","20220510T08:28:17.473+0000","1ddc017a-1aab-4187-9d71-066db5f1f9c7","20b0f6d4-5dc4-4879-9d59-e67d2b023b64","","","","","","","","","","","","","","",""
"","","Chlorocurtis","Chlorocurtis Kemp, 1925","PANDALIDAE","Chlorocurtis","","","","Synonym","synonym","Genus","","Kemp","1925","Y","ea9310ec-e39e-4e2b-a3af-a880cc0ce63f","20220504T01:21:58.041+0000","20b0f6d4-5dc4-4879-9d59-e67d2b023b64","20220510T08:28:17.473+0000","","822d518e-b2b7-442b-b349-c691b8c79b06","Kemp, S.","1925","Notes on Crustacea Decapoda in the Indian Museum. XVII--On various Caridea","249-343 figs 1-24","","Records of the Indian Museum","","","","<!--MARK--><a href='null676c24d7-4b0c-410c-8221-7b0056ac3447' class='mouseoverHref'>Kemp, S. 1925. Notes on Crustacea Decapoda in the Indian Museum. XVII--On various Caridea.</a> <!--MARK--><!--MARK--><a href='null6c35e896-740a-4f0a-9785-d35f1fc27b0d' class='mouseoverHref'><em>Records of the Indian Museum</em></a> <strong>27</strong>(4): 249-343 figs 1-24<!--MARK-->","","Article in Journal","676c24d7-4b0c-410c-8221-7b0056ac3447","20081009T05:11:37.000+0000","6c35e896-740a-4f0a-9785-d35f1fc27b0d"
"","","jactans","Chlorocurtis jactans (Nobili, 1904)","CHLOROTOCELLIDAE","Chlorocurtis","","jactans","","Valid Name","","Species","","Nobili","1904","N","ee9891e6-86ca-4b23-b823-0dbd6b50ad78","20220504T01:21:58.041+0000","ea3ea23c-4de7-464f-a8db-a034a03f3854","20220510T08:28:17.473+0000","20b0f6d4-5dc4-4879-9d59-e67d2b023b64","ea3ea23c-4de7-464f-a8db-a034a03f3854","","","","","","","","","","","","","","",""
"","","jactans","Virbius (?) jactans Nobili, 1904","","Virbius (?)","","jactans","","Synonym","synonym","Species","","Nobili","1904","Y","d063e4fb-34bf-4bc6-9d8a-2671ffae8a9d","20220504T01:21:58.041+0000","ea3ea23c-4de7-464f-a8db-a034a03f3854","20220510T08:28:17.473+0000","","e04d573e-b975-47a0-8c37-32a710b47a50","Nobili, G.","1904","Diagnoses préliminaires de vingt-huit espèces nouvelles de Stomatopodes et Décapodes Macroures de la Mer Rouge","228-238","","Bulletin du Muséum National d'Histoire Naturelle, Paris","","","","<!--MARK--><a href='null531ea482-6ea7-405b-a219-538104f09b6f' class='mouseoverHref'>Nobili, G. 1904. Diagnoses préliminaires de vingt-huit espèces nouvelles de Stomatopodes et Décapodes Macroures de la Mer Rouge.</a> <!--MARK--><!--MARK--><a href='null796711f5-67db-4504-bf92-fda69a7bdc27' class='mouseoverHref'><em>Bulletin du Muséum National d'Histoire Naturelle, Paris</em></a><!--MARK--> [published 1907-1971] <strong>10</strong>: 228-238<!--MARK-->","","Article in Journal","531ea482-6ea7-405b-a219-538104f09b6f","20081009T05:11:37.000+0000","796711f5-67db-4504-bf92-fda69a7bdc27"
"","","miser","Chorocurtis miser Kemp, 1925","","Chorocurtis","","miser","","Synonym","synonym","Species","","Kemp","1925","Y","4be467b5-379b-4ab8-9ff0-15686f0273d0","20220504T01:21:58.041+0000","ea3ea23c-4de7-464f-a8db-a034a03f3854","20220510T08:28:17.473+0000","","5770e7f5-1db9-4bf9-ad97-06e4a4e58325","Kemp, S.","1925","Notes on Crustacea Decapoda in the Indian Museum. XVII--On various Caridea","249-343 figs 1-24","","Records of the Indian Museum","","","","<!--MARK--><a href='null676c24d7-4b0c-410c-8221-7b0056ac3447' class='mouseoverHref'>Kemp, S. 1925. Notes on Crustacea Decapoda in the Indian Museum. XVII--On various Caridea.</a> <!--MARK--><!--MARK--><a href='null6c35e896-740a-4f0a-9785-d35f1fc27b0d' class='mouseoverHref'><em>Records of the Indian Museum</em></a> <strong>27</strong>(4): 249-343 figs 1-24<!--MARK-->","","Article in Journal","676c24d7-4b0c-410c-8221-7b0056ac3447","20081009T05:11:37.000+0000","6c35e896-740a-4f0a-9785-d35f1fc27b0d"
"","","jactans","Chlorocurtis jactans (Nobili, 1904)","","Chlorocurtis","","jactans","","Generic Combination","","Species","","Nobili","1904","N","16782a75-2e6e-4647-88a6-42823edc254a","20220504T01:21:58.041+0000","ea3ea23c-4de7-464f-a8db-a034a03f3854","20220510T08:28:17.473+0000","","7ad7e9bd-ff99-408a-8389-c91aec18a2a3","Holthuis, L.B.","1955","The recent genera of the caridean and stenopodidean shrimps (Class Crustacea, Order Decapoda, Supersection Natantia) with keys for their determination","1-157","","Zoologische Verhandelingen (Leiden)","","","","<!--MARK--><a href='null1d012362-eb7f-4b71-a1f6-50a9030b8f7b' class='mouseoverHref'>Holthuis, L.B. 1955. The recent genera of the caridean and stenopodidean shrimps (Class Crustacea, Order Decapoda, Supersection Natantia) with keys for their determination.</a> <!--MARK--><!--MARK--><a href='nullef9c29c7-02e1-45c1-816e-05f980b8b1fd' class='mouseoverHref'><em>Zoologische Verhandelingen (Leiden)</em></a> <strong>26</strong>: 1-157<!--MARK-->","","Article in Journal","1d012362-eb7f-4b71-a1f6-50a9030b8f7b","20081009T05:11:37.000+0000","ef9c29c7-02e1-45c1-816e-05f980b8b1fd"
"","","Chlorotocella","Chlorotocella Balss, 1914","CHLOROTOCELLIDAE","Chlorotocella","","","","Valid Name","","Genus","","Balss","1914","Y","c2f077ef-25e7-4a8d-9c89-94ca19aed201","20220504T01:21:58.041+0000","9b1e0251-7efa-4d2f-ac62-407295678f1e","20220510T08:28:17.473+0000","1ddc017a-1aab-4187-9d71-066db5f1f9c7","9b1e0251-7efa-4d2f-ac62-407295678f1e","","","","","","","","","","","","","","",""
"","","Chlorotocella","Chlorotocella Balss, 1914","","Chlorotocella","","","","Synonym","synonym","Genus","name placed on the Official List of Generic Names in Zoology, see International Commission on Zoological Nomenclature 1957. Opinion 470. Additions to the <I>Official List of Family-Group Names in Zoology</I> of the names of one hundred and two genera of Caridea (Class Crustacea, Order Decapoda) and use of the Plenary Powers for various purposes in connection therewith. <em>Opinions and Declarations rendered by the International Commission on Zoological Nomenclature</em> <strong>16</strong>: 129-202; gender feminine","Balss","1914","Y","c73e2a55-108d-4b16-95fd-979b3bec388c","20220504T01:21:58.041+0000","9b1e0251-7efa-4d2f-ac62-407295678f1e","20220510T08:28:17.473+0000","","e4111254-0569-470f-bbbe-818dbbf80cae","Balss, H.","1914","Ostasiatische Decapoden, II. Die Natantia und Reptantia","","","","","","","<!--MARK--><a href='null92f23459-72cd-4af1-991c-7d1cceeb6d22' class='mouseoverHref'>Balss, H. 1914. Ostasiatische Decapoden, II. Die Natantia und Reptantia. pp. 1-101 figs 1-50 pl. 1 in, Doflein, F. <I>Beiträge zur Naturgeschichte Ostasiens</I>. Abh. Bayer. Akad. Wiss. (Suppl.) 2(10).</a>","","Miscellaneous","92f23459-72cd-4af1-991c-7d1cceeb6d22","20081009T05:11:37.000+0000",""
"","","gracilis","Chlorotocella gracilis Balss, 1914","CHLOROTOCELLIDAE","Chlorotocella","","gracilis","","Valid Name","","Species","","Balss","1914","Y","d9137e69-519d-4027-a8fd-dba816236885","20220504T01:21:58.041+0000","d8ba230e-4dad-4202-b2b4-c36a80c61a2d","20220510T08:28:17.473+0000","9b1e0251-7efa-4d2f-ac62-407295678f1e","d8ba230e-4dad-4202-b2b4-c36a80c61a2d","","","","","","","","","","","","","","",""
"","","gracilis","Chlorotocella gracilis Balss, 1914","","Chlorotocella","","gracilis","","Synonym","synonym","Species","","Balss","1914","Y","d564548f-9d7d-4481-9048-a77542bfb9e8","20220504T01:21:58.041+0000","d8ba230e-4dad-4202-b2b4-c36a80c61a2d","20220510T08:28:17.473+0000","","22a364e9-e25b-4dad-94a9-9a1abb027518","Balss, H.","1914","Ostasiatische Decapoden, II. Die Natantia und Reptantia","","","","","","","<!--MARK--><a href='null92f23459-72cd-4af1-991c-7d1cceeb6d22' class='mouseoverHref'>Balss, H. 1914. Ostasiatische Decapoden, II. Die Natantia und Reptantia. pp. 1-101 figs 1-50 pl. 1 in, Doflein, F. <I>Beiträge zur Naturgeschichte Ostasiens</I>. Abh. Bayer. Akad. Wiss. (Suppl.) 2(10).</a>","","Miscellaneous","92f23459-72cd-4af1-991c-7d1cceeb6d22","20081009T05:11:37.000+0000",""
"","","spinicaudus","Chlorotocella spinicaudus (H. Milne Edwards, 1837)","CHLOROTOCELLIDAE","Chlorotocella","","spinicaudus","","Valid Name","","Species","","H. Milne Edwards","1837","N","4601e45b-9057-4c8a-97c3-9f29f8b00167","20220504T01:21:58.041+0000","e5d0a5c0-95aa-4402-85a3-86341c532c2a","20220510T08:28:17.473+0000","9b1e0251-7efa-4d2f-ac62-407295678f1e","e5d0a5c0-95aa-4402-85a3-86341c532c2a","","","","","","","","","","","","","","",""
"","","Slender-beaked Prawn","","","","","","","Common Name","General","Species","","","","","3381d417-899c-4c69-9f15-0a5ce80b1dbd","20220504T01:21:58.041+0000","e5d0a5c0-95aa-4402-85a3-86341c532c2a","20220510T08:28:17.473+0000","","","","","","","","","","","","","","","","",""
"","","spinicaudus","Hippolyte spinicaudus H. Milne Edwards, 1837","","Hippolyte","","spinicaudus","","Synonym","synonym","Species","","H. Milne Edwards","1837","Y","ab82f6a5-20e0-4ee9-a827-be7f9de6b6e8","20220504T01:21:58.041+0000","e5d0a5c0-95aa-4402-85a3-86341c532c2a","20220510T08:28:17.473+0000","","b4de0056-4a5f-405a-b87b-ce9b11a1ce85","Milne Edwards, H.","1837","Histoire Naturelle des Crustacés, comprenant l'anatomie, la physiologie et la classification de ces animaux","532 pp., Atlas 32 pp., 42 pls","","","","","Libraire Encyclopedique de Roret","<!--MARK--><a href='null0d954e54-4a0f-4c7d-8c90-e03cdfed791a' class='mouseoverHref'>Milne Edwards, H. 1837. <em>Histoire Naturelle des Crustacés, comprenant l'anatomie, la physiologie et la classification de ces animaux</em>. Paris : Libraire Encyclopedique de Roret Vol. 2 532 pp., Atlas 32 pp., 42 pls.</a><!--MARK-->","","Book","0d954e54-4a0f-4c7d-8c90-e03cdfed791a","20081009T05:11:37.000+0000",""
"","","leptorhynchus","Pandalus leptorhynchus Stimpson, 1860","","Pandalus","","leptorhynchus","","Synonym","synonym","Species","","Stimpson","1860","Y","9436edcd-6ee8-476a-8006-8a541270f172","20220504T01:21:58.041+0000","e5d0a5c0-95aa-4402-85a3-86341c532c2a","20220510T08:28:17.473+0000","","83cb62de-0339-4ffe-bf70-12225bcec30e","Stimpson, W.","1860","Crustacea Macrura. Pars VIII of Prodromus descriptionis animalium evertebratorum, quae in Expeditione ad Oceanum Pacificum Septentrionalem, a Republica Federata missa, Cadwaladaro Ringgold et Johanne Rodgers Ducibus, observavit et descripsit","22-47","","Proceedings of the Academy of Natural Sciences, Philadelphia","","","","<!--MARK--><a href='nullb296f376-b02a-4167-a46b-c28b562bfb35' class='mouseoverHref'>Stimpson, W. 1860. Crustacea Macrura. Pars VIII of Prodromus descriptionis animalium evertebratorum, quae in Expeditione ad Oceanum Pacificum Septentrionalem, a Republica Federata missa, Cadwaladaro Ringgold et Johanne Rodgers Ducibus, observavit et descripsit.</a> <!--MARK--><!--MARK--><a href='null9dfe7fba-63cc-4968-b0be-a8904006864b' class='mouseoverHref'><em>Proceedings of the Academy of Natural Sciences, Philadelphia</em></a> <strong>12</strong>: 22-47<!--MARK-->","","Article in Journal","b296f376-b02a-4167-a46b-c28b562bfb35","20081009T05:11:37.000+0000","9dfe7fba-63cc-4968-b0be-a8904006864b"
"","","gibber","Pandalus (Parapandalus) spinicauda gibber Hale, 1924","","Pandalus","Parapandalus","spinicauda","gibber","Synonym","synonym","Species","","Hale","1924","Y","9dd031fa-ae69-4c07-99ac-8d6c3669a84b","20220504T01:21:58.041+0000","e5d0a5c0-95aa-4402-85a3-86341c532c2a","20220510T08:28:17.473+0000","","a2c0ce2d-26a0-4a8b-93b4-0d9bedcb2cc4","Hale, H.M.","1924","The flora and fauna of Nuyts Archipelago and the Investigator Group. No. 16.-- The Crustacea","67-73","","Transactions of the Royal Society of South Australia","","","","<!--MARK--><a href='null35887c94-3e42-4a77-b6d8-a37d0c6e6c05' class='mouseoverHref'>Hale, H.M. 1924. The flora and fauna of Nuyts Archipelago and the Investigator Group. No. 16.-- The Crustacea.</a> <!--MARK--><!--MARK--><a href='null8b48b0a3-dd7a-4aea-be0d-10a223710ebc' class='mouseoverHref'><em>Transactions of the Royal Society of South Australia</em></a> <strong>48</strong>: 67-73<!--MARK-->","","Article in Journal","35887c94-3e42-4a77-b6d8-a37d0c6e6c05","20081009T05:11:37.000+0000","8b48b0a3-dd7a-4aea-be0d-10a223710ebc"
"","","PANDALIDAE","PANDALIDAE Haworth, 1825","","","","","","Valid Name","","Family","","Haworth","1825","Y","d9b0fab2-064c-4c37-9dfa-b5620a20dab0","20220504T01:21:58.041+0000","ca433a92-fe0a-4326-b70a-18fe0450f9b3","20220510T08:28:17.473+0000","db524f40-bad4-4a8a-8e79-390c0877af24","ca433a92-fe0a-4326-b70a-18fe0450f9b3","","","","","","","","","","","","","","",""
"","","Pandalidae","Pandalidae Haworth, 1825","Pandalidae","","","","","Synonym","synonym","Family","","Haworth","1825","Y","4d7a94a4-f221-48cd-a02e-d4868e924d1f","20220504T01:21:58.041+0000","ca433a92-fe0a-4326-b70a-18fe0450f9b3","20220510T08:28:17.473+0000","","a02370e9-018b-40c0-8824-3692fdabc371","Haworth, A.H.","1825","A new binary arrangement of the macrurus Crustacea","183-184","","Philosophical Magazine and Journal","","","","<!--MARK--><a href='null9c96911b-eda0-45eb-a042-4e2515ce3aac' class='mouseoverHref'>Haworth, A.H. 1825. A new binary arrangement of the macrurus Crustacea.</a> <!--MARK--><!--MARK--><a href='nullc740616d-59bf-4f3c-9bf5-a6bad76f8652' class='mouseoverHref'><em>Philosophical Magazine and Journal</em></a> <strong>65</strong>: 183-184<!--MARK-->","","Article in Journal","9c96911b-eda0-45eb-a042-4e2515ce3aac","20081009T05:11:37.000+0000","c740616d-59bf-4f3c-9bf5-a6bad76f8652"
"","","Heterocarpodidae","Heterocarpodidae Thompson, 1965","Heterocarpodidae","","","","","Synonym","synonym","Family","full text in Thompson, J.R. 1966. Comments on phylogeny of section Caridea (Decapoda Natantia) and the phylogenetic importance of the Oplophoroidea. <I>Symp. Ser. Mar. Biol. Assoc. India. </I>No. 2. <I>Proceedings of the Symposium on Crustacea held at Ernakulam, 12-15 Jan 1965</I>. Part I. pp. 314-326 Marine Biological Association of India. Bangalore : Bangalore Press. 314-326 pp.","Thompson","1965","Y","63ceae70-81dc-4591-84c4-f46a57ec293e","20220504T01:21:58.041+0000","ca433a92-fe0a-4326-b70a-18fe0450f9b3","20220510T08:28:17.473+0000","","4287ef83-c3fc-402e-96bd-f920cb454512","Thompson, J.R.","1965","Comments on phylogeny of section Caridea (Decapoda Natantia) and the phylogenetic importance of the Oplophoroidea","","","","","","","<!--MARK--><a href='nulla31e74c6-256b-486e-9ac8-bbf665752ff9' class='mouseoverHref'>Thompson, J.R. 1965. Comments on phylogeny of section Caridea (Decapoda Natantia) and the phylogenetic importance of the Oplophoroidea. <I>Abstract Pap. Symp. Crust. Ernakulam, India</I>: 5.</a>","","Miscellaneous","a31e74c6-256b-486e-9ac8-bbf665752ff9","20081009T05:11:37.000+0000",""
"","","Pantominae","Pantominae Christofferson, 1989","Pantominae","","","","","Synonym","synonym","Family","","Christofferson","1989","Y","9f974276-25f2-46a7-8c48-29b1cdebd7f5","20220504T01:21:58.041+0000","ca433a92-fe0a-4326-b70a-18fe0450f9b3","20220510T08:28:17.473+0000","","1ff0ae34-af35-4c37-aae9-3d0b3adecb87","Christofferson, M.L.","1989","Phylogeny and classification of the Pandaloidea (Crustacea, Caridea)","259-274","","Cladistics","","","","<!--MARK--><a href='nulla3516338-5fe6-425e-8946-c507b2bb7a61' class='mouseoverHref'>Christofferson, M.L. 1989. Phylogeny and classification of the Pandaloidea (Crustacea, Caridea).</a> <!--MARK--><!--MARK--><a href='null5fce340d-5163-4796-a5f1-192ae181af59' class='mouseoverHref'><em>Cladistics</em></a> <strong>5</strong>(3): 259-274<!--MARK-->","","Article in Journal","a3516338-5fe6-425e-8946-c507b2bb7a61","20081009T05:11:37.000+0000","5fce340d-5163-4796-a5f1-192ae181af59"
"","","Austropandalini","Austropandalini Christofferson, 1989","Austropandalini","","","","","Synonym","synonym","Family","","Christofferson","1989","Y","1e91a2b3-1689-45dd-b5fe-45c1b103fd21","20220504T01:21:58.041+0000","ca433a92-fe0a-4326-b70a-18fe0450f9b3","20220510T08:28:17.473+0000","","42635c18-4e39-49ec-9b3f-19fefb641192","Christofferson, M.L.","1989","Phylogeny and classification of the Pandaloidea (Crustacea, Caridea)","259-274","","Cladistics","","","","<!--MARK--><a href='nulla3516338-5fe6-425e-8946-c507b2bb7a61' class='mouseoverHref'>Christofferson, M.L. 1989. Phylogeny and classification of the Pandaloidea (Crustacea, Caridea).</a> <!--MARK--><!--MARK--><a href='null5fce340d-5163-4796-a5f1-192ae181af59' class='mouseoverHref'><em>Cladistics</em></a> <strong>5</strong>(3): 259-274<!--MARK-->","","Article in Journal","a3516338-5fe6-425e-8946-c507b2bb7a61","20081009T05:11:37.000+0000","5fce340d-5163-4796-a5f1-192ae181af59"
"","","Pandalini","Pandalini Christofferson, 1989","Pandalini","","","","","Synonym","synonym","Family","","Christofferson","1989","Y","658cfab9-7046-4349-ba5d-58e8aac5249d","20220504T01:21:58.041+0000","ca433a92-fe0a-4326-b70a-18fe0450f9b3","20220510T08:28:17.473+0000","","53e7925d-0faf-49f6-bea0-bd3b5ad45df3","Christofferson, M.L.","1989","Phylogeny and classification of the Pandaloidea (Crustacea, Caridea)","259-274","","Cladistics","","","","<!--MARK--><a href='nulla3516338-5fe6-425e-8946-c507b2bb7a61' class='mouseoverHref'>Christofferson, M.L. 1989. Phylogeny and classification of the Pandaloidea (Crustacea, Caridea).</a> <!--MARK--><!--MARK--><a href='null5fce340d-5163-4796-a5f1-192ae181af59' class='mouseoverHref'><em>Cladistics</em></a> <strong>5</strong>(3): 259-274<!--MARK-->","","Article in Journal","a3516338-5fe6-425e-8946-c507b2bb7a61","20081009T05:11:37.000+0000","5fce340d-5163-4796-a5f1-192ae181af59"
"","","Plesionikidae","Plesionikidae Christofferson, 1989","Plesionikidae","","","","","Synonym","synonym","Family","","Christofferson","1989","Y","a8570a29-2515-4315-9841-a671b41ece59","20220504T01:21:58.041+0000","ca433a92-fe0a-4326-b70a-18fe0450f9b3","20220510T08:28:17.473+0000","","625c67c3-7d4c-4506-ac20-de5a5d626d4b","Christofferson, M.L.","1989","Phylogeny and classification of the Pandaloidea (Crustacea, Caridea)","259-274","","Cladistics","","","","<!--MARK--><a href='nulla3516338-5fe6-425e-8946-c507b2bb7a61' class='mouseoverHref'>Christofferson, M.L. 1989. Phylogeny and classification of the Pandaloidea (Crustacea, Caridea).</a> <!--MARK--><!--MARK--><a href='null5fce340d-5163-4796-a5f1-192ae181af59' class='mouseoverHref'><em>Cladistics</em></a> <strong>5</strong>(3): 259-274<!--MARK-->","","Article in Journal","a3516338-5fe6-425e-8946-c507b2bb7a61","20081009T05:11:37.000+0000","5fce340d-5163-4796-a5f1-192ae181af59"
"","","Heterocarpidae","Heterocarpidae Christofferson, 1989","Heterocarpidae","","","","","Synonym","synonym","Family","","Christofferson","1989","Y","224c44b4-3573-4df3-b422-e6b3c5a545cf","20220504T01:21:58.041+0000","ca433a92-fe0a-4326-b70a-18fe0450f9b3","20220510T08:28:17.473+0000","","fec85017-dd09-4c12-a2f9-6c75c4a9786a","Christofferson, M.L.","1989","Phylogeny and classification of the Pandaloidea (Crustacea, Caridea)","259-274","","Cladistics","","","","<!--MARK--><a href='nulla3516338-5fe6-425e-8946-c507b2bb7a61' class='mouseoverHref'>Christofferson, M.L. 1989. Phylogeny and classification of the Pandaloidea (Crustacea, Caridea).</a> <!--MARK--><!--MARK--><a href='null5fce340d-5163-4796-a5f1-192ae181af59' class='mouseoverHref'><em>Cladistics</em></a> <strong>5</strong>(3): 259-274<!--MARK-->","","Article in Journal","a3516338-5fe6-425e-8946-c507b2bb7a61","20081009T05:11:37.000+0000","5fce340d-5163-4796-a5f1-192ae181af59"
"","","Heterocarpoididae","Heterocarpoididae Christofferson, 1989","Heterocarpoididae","","","","","Synonym","synonym","Family","","Christofferson","1989","Y","4bee3dd4-f499-4864-aa2c-ce9806281984","20220504T01:21:58.041+0000","ca433a92-fe0a-4326-b70a-18fe0450f9b3","20220510T08:28:17.473+0000","","341a35d8-56b7-424d-8ecb-d012399c3585","Christofferson, M.L.","1989","Phylogeny and classification of the Pandaloidea (Crustacea, Caridea)","259-274","","Cladistics","","","","<!--MARK--><a href='nulla3516338-5fe6-425e-8946-c507b2bb7a61' class='mouseoverHref'>Christofferson, M.L. 1989. Phylogeny and classification of the Pandaloidea (Crustacea, Caridea).</a> <!--MARK--><!--MARK--><a href='null5fce340d-5163-4796-a5f1-192ae181af59' class='mouseoverHref'><em>Cladistics</em></a> <strong>5</strong>(3): 259-274<!--MARK-->","","Article in Journal","a3516338-5fe6-425e-8946-c507b2bb7a61","20081009T05:11:37.000+0000","5fce340d-5163-4796-a5f1-192ae181af59"
"","","Dorodoteidae","Dorodoteidae Christofferson, 1989","Dorodoteidae","","","","","Synonym","synonym","Family","","Christofferson","1989","Y","0d987af8-a45c-4988-b74c-8511c20d9618","20220504T01:21:58.041+0000","ca433a92-fe0a-4326-b70a-18fe0450f9b3","20220510T08:28:17.473+0000","","0392d1ee-6d39-45ec-97ca-21203634d7a8","Christofferson, M.L.","1989","Phylogeny and classification of the Pandaloidea (Crustacea, Caridea)","259-274","","Cladistics","","","","<!--MARK--><a href='nulla3516338-5fe6-425e-8946-c507b2bb7a61' class='mouseoverHref'>Christofferson, M.L. 1989. Phylogeny and classification of the Pandaloidea (Crustacea, Caridea).</a> <!--MARK--><!--MARK--><a href='null5fce340d-5163-4796-a5f1-192ae181af59' class='mouseoverHref'><em>Cladistics</em></a> <strong>5</strong>(3): 259-274<!--MARK-->","","Article in Journal","a3516338-5fe6-425e-8946-c507b2bb7a61","20081009T05:11:37.000+0000","5fce340d-5163-4796-a5f1-192ae181af59"
"","","Chlorotocus","Chlorotocus A. Milne Edwards, 1882","PANDALIDAE","Chlorotocus","","","","Valid Name","","Genus","","A. Milne Edwards","1882","Y","3491e3d6-adbe-4936-92d8-145119096ee4","20220504T01:21:58.041+0000","3af2576a-68f5-4e39-8171-a1812dc79cda","20220510T08:28:17.473+0000","ca433a92-fe0a-4326-b70a-18fe0450f9b3","3af2576a-68f5-4e39-8171-a1812dc79cda","","","","","","","","","","","","","","",""
"","","Chlorotocus","Chlorotocus A. Milne Edwards, 1882","","Chlorotocus","","","","Synonym","synonym","Genus","name placed on the Official List of Generic Names in Zoology, see International Commission on Zoological Nomenclature 1957. Opinion 470. Additions to the <I>Official List of Family-Group Names in Zoology</I> of the names of one hundred and two genera of Caridea (Class Crustacea, Order Decapoda) and use of the Plenary Powers for various purposes in connection therewith. <em>Opinions and Declarations rendered by the International Commission on Zoological Nomenclature</em> <strong>16</strong>: 129-202; gender masculine","A. Milne Edwards","1882","Y","da7c2b60-598e-4ddd-8386-fdf4e243984d","20220504T01:21:58.041+0000","3af2576a-68f5-4e39-8171-a1812dc79cda","20220510T08:28:17.473+0000","","7bb75f5c-d460-4ebc-adf7-98211fd955ec","Milne Edwards, A.","1882","Rapport sur les travaux de la Commission chargée d'étudier la faune sous-marine dans les grandes profondeurs de la Mediterranée et de l'océan Atlantique","1-59","","Archives des Missions Scientifiques et Litteraires, Paris","","","","<!--MARK--><a href='null276e77f4-4ccd-491f-a6a4-9d20d5e75e96' class='mouseoverHref'>Milne Edwards, A. 1882. Rapport sur les travaux de la Commission chargée d'étudier la faune sous-marine dans les grandes profondeurs de la Mediterranée et de l'océan Atlantique.</a> <!--MARK--><!--MARK--><a href='nulld1cbaa16-d2c7-46d0-8779-a8e3e7fc0bfb' class='mouseoverHref'><em>Archives des Missions Scientifiques et Litteraires, Paris</em></a> Ser. 3 <strong>9</strong>: 1-59<!--MARK-->","","Article in Journal","276e77f4-4ccd-491f-a6a4-9d20d5e75e96","20190307T05:31:26.199+0000","d1cbaa16-d2c7-46d0-8779-a8e3e7fc0bfb"
