"CAVS_CODE","CAAB_CODE","NAMES_VARIOUS","SCIENTIFIC_NAME","FAMILY","GENUS","SUBGENUS","SPECIES","SUBSPECIES","NAME_TYPE","NAME_SUBTYPE","RANK","QUALIFICATION","AUTHOR","YEAR","ORIG_COMBINATION","NAME_GUID","NAME_LAST_UPDATE","TAXON_GUID","TAXON_LAST_UPDATE","PARENT_TAXON_GUID","CONCEPT_GUID","PUB_PUB_AUTHOR","PUB_PUB_YEAR","PUB_PUB_TITLE","PUB_PUB_PAGES","PUB_PUB_PARENT_BOOK_TITLE","PUB_PUB_PARENT_JOURNAL_TITLE","PUB_PUB_PARENT_ARTICLE_TITLE","PUB_PUB_PUBLICATION_DATE","PUB_PUB_PUBLISHER","PUB_PUB_FORMATTED","PUB_PUB_QUALIFICATION","PUB_PUB_TYPE","PUBLICATION_GUID","PUBLICATION_LAST_UPDATE","PARENT_PUBLICATION_GUID"
"","","PHOLOIDIDAE","PHOLOIDIDAE","PHOLOIDIDAE","","","","","Valid Name","","Family","","","","Y","a8b077eb-d798-4eba-aefe-b7bb932790b6","20210810T02:44:50.388+0000","27a8ac00-37ad-4b79-99a1-1b88feb0ee62","20220322T01:21:01.806+0000","de1db2b1-56b5-47f1-b4bd-68a4d9339e0d","27a8ac00-37ad-4b79-99a1-1b88feb0ee62","","","","","","","","","","","","","","",""
"","","Pholoides","Pholoides Pruvot, 1895","PHOLOIDIDAE","Pholoides","","","","Valid Name","","Genus","","Pruvot","1895","Y","52e8b55e-4ac7-491e-be1f-c29760c9ec5d","20210810T02:44:50.388+0000","9842b066-fa39-4291-9a8f-3192c4b66825","20220322T01:21:01.806+0000","27a8ac00-37ad-4b79-99a1-1b88feb0ee62","9842b066-fa39-4291-9a8f-3192c4b66825","","","","","","","","","","","","","","",""
"","","Pholoides","Pholoides Pruvot, 1895","","Pholoides","","","","Synonym","synonym","Genus","","Pruvot","1895","Y","68f9c9b4-2a84-4e80-86a0-7fe9b0b81eb9","20210810T02:44:50.388+0000","9842b066-fa39-4291-9a8f-3192c4b66825","20220322T01:21:01.806+0000","","e4287a96-f6c4-44bd-b8d6-0777bff102f6","Pruvot, G.","1895","Coup d'oeil sur la distribution générale des invertèbres dans la region de Banyuls (Golfe de Lion)","629-658","","Archives de Zoologie Expérimentale et Générale","","","","<!--MARK--><a href='null27c0943c-f187-4325-b7fc-615175ed5398' class='mouseoverHref'>Pruvot, G. 1895. Coup d'oeil sur la distribution générale des invertèbres dans la region de Banyuls (Golfe de Lion).</a> <!--MARK--><!--MARK--><a href='null1ee9e2fd-e394-4e8a-bdac-59c249e54978' class='mouseoverHref'><em>Archives de Zoologie Expérimentale et Générale</em></a> <strong>3</strong>(3): 629-658<!--MARK-->","","Article in Journal","27c0943c-f187-4325-b7fc-615175ed5398","20081009T05:11:37.000+0000","1ee9e2fd-e394-4e8a-bdac-59c249e54978"
"","","Peisidice","Peisidice Johnson, 1897","","Peisidice","","","","Synonym","synonym","Genus","","Johnson","1897","Y","60ff3dec-3fe1-4ffe-9e45-b37e19d5caef","20210810T02:44:50.388+0000","9842b066-fa39-4291-9a8f-3192c4b66825","20220322T01:21:01.806+0000","","7d66a42f-cda6-46cf-94e2-496827769745","Johnson, H.P.","1897","A preliminary account of the marine annelids of the Pacific coast, with descriptions of new species","153-198","","Proceedings of the California Academy of Sciences","","","","<!--MARK--><a href='null261f0a74-fe37-4da6-8d09-bfecc3835a8c' class='mouseoverHref'>Johnson, H.P. 1897. A preliminary account of the marine annelids of the Pacific coast, with descriptions of new species.</a> <!--MARK--><!--MARK--><a href='nullf0c48c7c-b524-46f8-9011-173fe38eb630' class='mouseoverHref'><em>Proceedings of the California Academy of Sciences</em></a> 3 <strong>1</strong>: 153-198<!--MARK-->","","Article in Journal","261f0a74-fe37-4da6-8d09-bfecc3835a8c","20081009T05:11:37.000+0000","f0c48c7c-b524-46f8-9011-173fe38eb630"
"","","Parapholoe","Parapholoe Hartmann-Schröder, 1965","","Parapholoe","","","","Synonym","synonym","Genus","","Hartmann-Schröder","1965","Y","a27f3a82-e428-452e-8983-799f85375cb6","20210810T02:44:50.388+0000","9842b066-fa39-4291-9a8f-3192c4b66825","20220322T01:21:01.806+0000","","1e3c2340-15ae-4bef-bff1-8f045145448f","Hartmann-Schröder, G.","1965","Die Polychaeten des Sublitorals. Zur Kenntnis des Sublitorals der chilenischen Küste unter besonderer Berücksichtigung der Polychaeten und Ostracoden","59-305","","Mitteilungen aus dem Hamburgischen Zoologischen Museum und Institut","","","","<!--MARK--><a href='null3cd2f9f4-895d-4c17-9ec9-977b50e04135' class='mouseoverHref'>Hartmann-Schröder, G. 1965. Die Polychaeten des Sublitorals. Zur Kenntnis des Sublitorals der chilenischen Küste unter besonderer Berücksichtigung der Polychaeten und Ostracoden.</a> <!--MARK--><!--MARK--><a href='null171ccd89-642b-4041-beef-26bac3a726db' class='mouseoverHref'><em>Mitteilungen aus dem Hamburgischen Zoologischen Museum und Institut</em></a> <strong>62</strong>: 59-305<!--MARK-->","","Article in Journal","3cd2f9f4-895d-4c17-9ec9-977b50e04135","20081009T05:11:37.000+0000","171ccd89-642b-4041-beef-26bac3a726db"
"","","Metaxypsamma","Metaxypsamma Wolf, 1986","","Metaxypsamma","","","","Synonym","synonym","Genus","","Wolf","1986","Y","3d55aa93-5977-4b12-9907-3e785dd58b27","20210810T02:44:50.388+0000","9842b066-fa39-4291-9a8f-3192c4b66825","20220322T01:21:01.806+0000","","f585edbe-4dd8-4808-b834-f2f31e036951","Wolf, P.S.","1986","A new genus and species of interstitial Sigalionidae and a report on the presence of venom glands in some scale-worm families (Annelida: Polychaeta)","79-83","","Proceedings of the Biological Society of Washington","","","","<!--MARK--><a href='null7c4b70d8-88c4-49e1-9dfb-186f36cc195b' class='mouseoverHref'>Wolf, P.S. 1986. A new genus and species of interstitial Sigalionidae and a report on the presence of venom glands in some scale-worm families (Annelida: Polychaeta).</a> <!--MARK--><!--MARK--><a href='null4153f314-120d-40d7-987b-b5ba47399aec' class='mouseoverHref'><em>Proceedings of the Biological Society of Washington</em></a> <strong>99</strong>: 79-83<!--MARK-->","","Article in Journal","7c4b70d8-88c4-49e1-9dfb-186f36cc195b","20081009T05:11:37.000+0000","4153f314-120d-40d7-987b-b5ba47399aec"
"","","Laubierpholoe","Laubierpholoe Pettibone, 1992","","Laubierpholoe","","","","Synonym","synonym","Genus","","Pettibone","1992","Y","f8182452-8500-4c99-aed4-4abf7422a267","20210810T02:44:50.388+0000","9842b066-fa39-4291-9a8f-3192c4b66825","20220322T01:21:01.806+0000","","cf447505-df97-4d17-98c3-69dbdb957a12","Pettibone, M.H.","1992","Contribution to the Polychaete Family Pholoidae Kinberg","1-22","","Smithsonian Contributions to Zoology","","","","<!--MARK--><a href='nulla899fbe0-f456-4ee6-8c1c-cd460d7bb0e9' class='mouseoverHref'>Pettibone, M.H. 1992. Contribution to the Polychaete Family Pholoidae Kinberg.</a> <!--MARK--><!--MARK--><a href='nullcf8b640e-574a-4713-8a6f-74b8ef9e2f2c' class='mouseoverHref'><em>Smithsonian Contributions to Zoology</em></a> <strong>532</strong>: 1-22<!--MARK-->","","Article in Journal","a899fbe0-f456-4ee6-8c1c-cd460d7bb0e9","20081009T05:11:37.000+0000","cf8b640e-574a-4713-8a6f-74b8ef9e2f2c"
"","","Imajimapholoe","Imajimapholoe Pettibone, 1992","","Imajimapholoe","","","","Synonym","synonym","Genus","","Pettibone","1992","Y","145ce900-0829-4026-869d-6f52010260ee","20210810T02:44:50.388+0000","9842b066-fa39-4291-9a8f-3192c4b66825","20220322T01:21:01.806+0000","","de3204d5-2b2e-4fe4-adfc-f4ab649aa3f8","Pettibone, M.H.","1992","Contribution to the Polychaete Family Pholoidae Kinberg","1-22","","Smithsonian Contributions to Zoology","","","","<!--MARK--><a href='nulla899fbe0-f456-4ee6-8c1c-cd460d7bb0e9' class='mouseoverHref'>Pettibone, M.H. 1992. Contribution to the Polychaete Family Pholoidae Kinberg.</a> <!--MARK--><!--MARK--><a href='nullcf8b640e-574a-4713-8a6f-74b8ef9e2f2c' class='mouseoverHref'><em>Smithsonian Contributions to Zoology</em></a> <strong>532</strong>: 1-22<!--MARK-->","","Article in Journal","a899fbe0-f456-4ee6-8c1c-cd460d7bb0e9","20081009T05:11:37.000+0000","cf8b640e-574a-4713-8a6f-74b8ef9e2f2c"
"","","Taylorpholoe","Taylorpholoe Pettibone, 1992","","Taylorpholoe","","","","Synonym","synonym","Genus","","Pettibone","1992","Y","ab5e5bad-a660-46a4-9ea2-f6f5cb5508fb","20210810T02:44:50.388+0000","9842b066-fa39-4291-9a8f-3192c4b66825","20220322T01:21:01.806+0000","","ce92a672-1a87-4024-b9e7-898c062d1f3f","Pettibone, M.H.","1992","Contribution to the Polychaete Family Pholoidae Kinberg","1-22","","Smithsonian Contributions to Zoology","","","","<!--MARK--><a href='nulla899fbe0-f456-4ee6-8c1c-cd460d7bb0e9' class='mouseoverHref'>Pettibone, M.H. 1992. Contribution to the Polychaete Family Pholoidae Kinberg.</a> <!--MARK--><!--MARK--><a href='nullcf8b640e-574a-4713-8a6f-74b8ef9e2f2c' class='mouseoverHref'><em>Smithsonian Contributions to Zoology</em></a> <strong>532</strong>: 1-22<!--MARK-->","","Article in Journal","a899fbe0-f456-4ee6-8c1c-cd460d7bb0e9","20081009T05:11:37.000+0000","cf8b640e-574a-4713-8a6f-74b8ef9e2f2c"
"","","mendeleevi","Pholoides mendeleevi (Averincev, 1978)","PHOLOIDIDAE","Pholoides","","mendeleevi","","Valid Name","","Species","","Averincev","1978","N","1a05cf56-a1bd-47c8-ae75-9472d383fe21","20210810T02:44:50.388+0000","5c96b635-7af8-439e-ab77-a63cc074b00a","20220322T01:21:01.806+0000","9842b066-fa39-4291-9a8f-3192c4b66825","5c96b635-7af8-439e-ab77-a63cc074b00a","","","","","","","","","","","","","","",""
"","","mendeleevi","Pholoe mendeleevi Averincev, 1978","","Pholoe","","mendeleevi","","Synonym","synonym","Species","","Averincev","1978","Y","b2ee9f43-f284-4201-824e-6f974c7dc4a9","20210810T02:44:50.388+0000","5c96b635-7af8-439e-ab77-a63cc074b00a","20220322T01:21:01.806+0000","","a959caf1-7763-4220-8127-af14a6784925","Averincev, V.G.","1978","The Polychaetous Annelids of the Aphroditiformia of the Shelf and New Zealand Region and of Macquarie Island on the base data of 16th Cruise of R/V Dimitry Mendeleev","51-72","","Trudy Instituta Okeanologii. Akademiya Nauk SSSR. Moskva","","","","<!--MARK--><a href='nullafb9d295-7d72-4977-b4b4-31ffa3feb65b' class='mouseoverHref'>Averincev, V.G. 1978. The Polychaetous Annelids of the Aphroditiformia of the Shelf and New Zealand Region and of Macquarie Island on the base data of 16th Cruise of R/V Dimitry Mendeleev.</a> <!--MARK--><!--MARK--><a href='null51d33770-c052-476c-aef5-ca509377ac04' class='mouseoverHref'><em>Trudy Instituta Okeanologii. Akademiya Nauk SSSR. Moskva</em></a> <strong>113</strong>: 51-72<!--MARK--> [in Russian]","in Russian","Article in Journal","afb9d295-7d72-4977-b4b4-31ffa3feb65b","20081009T05:11:37.000+0000","51d33770-c052-476c-aef5-ca509377ac04"
