"CAVS_CODE","CAAB_CODE","NAMES_VARIOUS","SCIENTIFIC_NAME","FAMILY","GENUS","SUBGENUS","SPECIES","SUBSPECIES","NAME_TYPE","NAME_SUBTYPE","RANK","QUALIFICATION","AUTHOR","YEAR","ORIG_COMBINATION","NAME_GUID","NAME_LAST_UPDATE","TAXON_GUID","TAXON_LAST_UPDATE","PARENT_TAXON_GUID","CONCEPT_GUID","PUB_PUB_AUTHOR","PUB_PUB_YEAR","PUB_PUB_TITLE","PUB_PUB_PAGES","PUB_PUB_PARENT_BOOK_TITLE","PUB_PUB_PARENT_JOURNAL_TITLE","PUB_PUB_PARENT_ARTICLE_TITLE","PUB_PUB_PUBLICATION_DATE","PUB_PUB_PUBLISHER","PUB_PUB_FORMATTED","PUB_PUB_QUALIFICATION","PUB_PUB_TYPE","PUBLICATION_GUID","PUBLICATION_LAST_UPDATE","PARENT_PUBLICATION_GUID"
"","","Stenobracon","Stenobracon Szépligeti, 1901","BRACONIDAE","Stenobracon","","","","Valid Name","","Genus","","Szépligeti","1901","Y","133bf8a4-0feb-4cbe-8d44-5042ca8a1fbf","20220209T23:01:57.078+0000","68a25011-db93-4e8a-b51e-d1a4b46f06c5","20220616T08:49:13.574+0000","bc77f57f-21f2-4ecd-8151-19edb4ec155d","68a25011-db93-4e8a-b51e-d1a4b46f06c5","","","","","","","","","","","","","","",""
"","","Stenobracon","Stenobracon Szépligeti, 1901","","Stenobracon","","","","Synonym","synonym","Genus","","Szépligeti","1901","Y","9e6c09d5-ea52-4970-a11c-2664622d1332","20220209T23:01:57.078+0000","68a25011-db93-4e8a-b51e-d1a4b46f06c5","20220616T08:49:13.574+0000","","f0cd3fad-0bc2-45e0-ae66-8d4ed1b0d15b","Szépligeti, G.V.","1901","Tropische Cenocoelioniden und Braconiden aus der sammlung des ungarischen national-museums","353-402","","Természetrajzi Füzetek","","","","<!--MARK--><a href='../../../../publication/334f94f6-2150-4045-af74-1866420a5505' class='mouseoverHref'>Szépligeti, G.V. 1901. Tropische Cenocoelioniden und Braconiden aus der sammlung des ungarischen national-museums.</a> <!--MARK--><!--MARK--><a href='../../../../publication/090d36a9-98bf-46b0-9011-f30bd8af3030' class='mouseoverHref'><em>Természetrajzi Füzetek</em></a> <strong>24</strong>: 353-402<!--MARK-->","","Article in Journal","334f94f6-2150-4045-af74-1866420a5505","20081009T05:11:37.000+0000","090d36a9-98bf-46b0-9011-f30bd8af3030"
"","","Elphea","Elphea Cameron, 1903","","Elphea","","","","Synonym","synonym","Genus","","Cameron","1903","Y","b5851c4e-4b3a-4242-90e6-83d84e257c1d","20220209T23:01:57.078+0000","68a25011-db93-4e8a-b51e-d1a4b46f06c5","20220616T08:49:13.574+0000","","53a20b00-61ac-4e3c-a7c6-2c3c19a2429f","Cameron, P.","1903","Descriptions of new genera and species of Hymenoptera taken by Mr. Robert Shelford at Sarawak, Borneo","89-181","","Journal of the Straits Branch of the Royal Asiatic Society","","31/12/1903","","<!--MARK--><a href='../../../../publication/36f5bb12-5298-42c9-abc5-3beeba10aac8' class='mouseoverHref'>Cameron, P. 1903. Descriptions of new genera and species of Hymenoptera taken by Mr. Robert Shelford at Sarawak, Borneo.</a> <!--MARK--><!--MARK--><a href='../../../../publication/da938502-f1b9-423a-ae42-daaf55054ac0' class='mouseoverHref'><em>Journal of the Straits Branch of the Royal Asiatic Society</em></a> <strong>39</strong>: 89-181<!--MARK--> [Date published 31/12/1903]","","Article in Journal","36f5bb12-5298-42c9-abc5-3beeba10aac8","20081009T05:11:37.000+0000","da938502-f1b9-423a-ae42-daaf55054ac0"
"","","Phanaulax","Phanaulax Cameron, 1910","","Phanaulax","","","","Synonym","synonym","Genus","","Cameron","1910","Y","db718f2a-7a90-4a7f-bc86-bc1ccbb4194e","20220209T23:01:57.078+0000","68a25011-db93-4e8a-b51e-d1a4b46f06c5","20220616T08:49:13.574+0000","","9d7b93d4-f919-4ba4-a2fb-95cb77c970e3","Cameron, P.","1910","On some Asiatic species of the subfamilies Exothecinae, Spathiinae, Hormioinae, Cheloninae and Macrocentrinae in the Royal Berlin Zoological Museum.","41-55","","Tijdschrift voor Entomologie","","","","<!--MARK--><a href='../../../../publication/3d8fd556-44b9-4ac1-919c-457d15b6eebb' class='mouseoverHref'>Cameron, P. 1910. On some Asiatic species of the subfamilies Exothecinae, Spathiinae, Hormioinae, Cheloninae and Macrocentrinae in the Royal Berlin Zoological Museum.</a> <!--MARK--><!--MARK--><a href='../../../../publication/6b0f0fc0-01fc-4ed4-aae0-c8b621477f01' class='mouseoverHref'><em>Tijdschrift voor Entomologie</em></a> <strong>53</strong>: 41-55<!--MARK-->","","Article in Journal","3d8fd556-44b9-4ac1-919c-457d15b6eebb","20110803T05:12:30.818+0000","6b0f0fc0-01fc-4ed4-aae0-c8b621477f01"
"","","clarus","Stenobracon clarus Chishti & Quicke, 1996","BRACONIDAE","Stenobracon","","clarus","","Valid Name","","Species","","Chishti & Quicke","1996","Y","a7fe287b-5475-45f7-a088-9104a65c39cd","20220209T23:01:57.078+0000","e0f9b25d-bcfb-455a-b7bd-8fb06795a86f","20220616T08:49:13.574+0000","68a25011-db93-4e8a-b51e-d1a4b46f06c5","e0f9b25d-bcfb-455a-b7bd-8fb06795a86f","","","","","","","","","","","","","","",""
"","","clarus","Stenobracon clarus Chishti & Quicke, 1996","","Stenobracon","","clarus","","Synonym","synonym","Species","","Chishti & Quicke","1996","Y","f5975761-67a4-4a8e-9a94-6a91bf29b6ab","20220209T23:01:57.078+0000","e0f9b25d-bcfb-455a-b7bd-8fb06795a86f","20220616T08:49:13.574+0000","","32686f4e-befd-4600-a872-abc800eee270","Chishti, M.J.K. & Quicke, D.L.J.","1996","A revision of the Indo-Australian species of <i>Stenobracon</i> (Hymenoptera: Braconidae) parasitoids of lepidopterous stem borers of graminaceous crops","227-245","","Bulletin of Entomological Research","","","","<!--MARK--><a href='../../../../publication/058f7e3e-9e13-4e17-ae21-f4e370838ec4' class='mouseoverHref'>Chishti, M.J.K. & Quicke, D.L.J. 1996. A revision of the Indo-Australian species of <i>Stenobracon</i> (Hymenoptera: Braconidae) parasitoids of lepidopterous stem borers of graminaceous crops.</a> <!--MARK--><!--MARK--><a href='../../../../publication/ef0b7d10-3b2d-4f9f-affe-9a3dc2101d9f' class='mouseoverHref'><em>Bulletin of Entomological Research</em></a> <strong>86</strong>: 227-245<!--MARK-->","","Article in Journal","058f7e3e-9e13-4e17-ae21-f4e370838ec4","20081009T05:11:37.000+0000","ef0b7d10-3b2d-4f9f-affe-9a3dc2101d9f"
