"CAVS_CODE","CAAB_CODE","NAMES_VARIOUS","SCIENTIFIC_NAME","FAMILY","GENUS","SUBGENUS","SPECIES","SUBSPECIES","NAME_TYPE","NAME_SUBTYPE","RANK","QUALIFICATION","AUTHOR","YEAR","ORIG_COMBINATION","NAME_GUID","NAME_LAST_UPDATE","TAXON_GUID","TAXON_LAST_UPDATE","PARENT_TAXON_GUID","CONCEPT_GUID","PUB_PUB_AUTHOR","PUB_PUB_YEAR","PUB_PUB_TITLE","PUB_PUB_PAGES","PUB_PUB_PARENT_BOOK_TITLE","PUB_PUB_PARENT_JOURNAL_TITLE","PUB_PUB_PARENT_ARTICLE_TITLE","PUB_PUB_PUBLICATION_DATE","PUB_PUB_PUBLISHER","PUB_PUB_FORMATTED","PUB_PUB_QUALIFICATION","PUB_PUB_TYPE","PUBLICATION_GUID","PUBLICATION_LAST_UPDATE","PARENT_PUBLICATION_GUID"
"","","STENOPODIDAE","STENOPODIDAE Claus, 1872","STENOPODIDAE","","","","","Valid Name","","Family","","Claus","1872","Y","42b050f5-6706-4903-8da1-b67f7cd9d796","20220504T01:21:58.041+0000","84d14690-54e4-4172-ad78-fe9ff19d7684","20220510T08:28:17.473+0000","ee5f9e67-22e2-4f37-ba7d-56d2b83a5d7d","84d14690-54e4-4172-ad78-fe9ff19d7684","","","","","","","","","","","","","","",""
"","","Stenopinae","Stenopinae Claus, 1872","Stenopinae","","","","","Synonym","synonym","Family","","Claus","1872","Y","682682c9-c72f-4a08-8727-2118c1fa09ed","20220504T01:21:58.041+0000","84d14690-54e4-4172-ad78-fe9ff19d7684","20220510T08:28:17.473+0000","","6048aa40-c785-4749-8da0-028df4bf019d","Claus, C.F.W.","1872","Grundzüge der Zoologie","","","","","","Elwert","<!--MARK--><a href='null28a086bf-4e91-47a6-8d34-fd9c141846b5' class='mouseoverHref'>Claus, C.F.W. 1872. <em>Grundzüge der Zoologie</em>. Marburg und Leipzig : Elwert.</a><!--MARK-->","","Book","28a086bf-4e91-47a6-8d34-fd9c141846b5","20120127T11:56:10.524+0000",""
"","","Odontozona","Odontozona Holthuis, 1946","STENOPODIDAE","Odontozona","","","","Valid Name","","Genus","","Holthuis","1946","Y","bc6d21a7-fd15-4265-827c-1e5569469783","20220504T01:21:58.041+0000","9e395ac5-ef40-4825-9af2-86efada1b83c","20220510T08:28:17.473+0000","84d14690-54e4-4172-ad78-fe9ff19d7684","9e395ac5-ef40-4825-9af2-86efada1b83c","","","","","","","","","","","","","","",""
"","","Odontozona","Odontozona Holthuis, 1946","","Odontozona","","","","Synonym","synonym","Genus","gender feminine","Holthuis","1946","Y","fe6c01f1-3ef2-4a98-94a8-4f9676f6269d","20220504T01:21:58.041+0000","9e395ac5-ef40-4825-9af2-86efada1b83c","20220510T08:28:17.473+0000","","bd0e5909-a682-4851-9077-f0e962d338ee","Holthuis, L.B.","1946","Biological results of the Snellius Expedition XIV. The Decapoda Macrura of the Snellius Expedition. I. The Stenopodidae, Nephropsidae, Scyllaridae and Palinuridae","1-177 11 pls","","Temminckia","","","","<!--MARK--><a href='nullc22273c3-7714-4b30-9a21-3c5feb4eca26' class='mouseoverHref'>Holthuis, L.B. 1946. Biological results of the Snellius Expedition XIV. The Decapoda Macrura of the Snellius Expedition. I. The Stenopodidae, Nephropsidae, Scyllaridae and Palinuridae.</a> <!--MARK--><!--MARK--><a href='null751f7f0f-f4f6-427c-a599-a6e79cc4e53d' class='mouseoverHref'><em>Temminckia</em></a> <strong>7</strong>: 1-177 11 pls<!--MARK-->","","Article in Journal","c22273c3-7714-4b30-9a21-3c5feb4eca26","20081009T05:11:37.000+0000","751f7f0f-f4f6-427c-a599-a6e79cc4e53d"
"","","sculpticaudata","Odontozona sculpticaudata Holthuis, 1946","STENOPODIDAE","Odontozona","","sculpticaudata","","Valid Name","","Species","","Holthuis","1946","Y","804ab8cb-e749-4130-a6e4-5cfd5cf7ef1d","20220504T01:21:58.041+0000","d896bad0-85f0-469d-9a82-65a2edc67419","20220510T08:28:17.473+0000","9e395ac5-ef40-4825-9af2-86efada1b83c","d896bad0-85f0-469d-9a82-65a2edc67419","","","","","","","","","","","","","","",""
"","","sculpticaudata","Odontozona sculpticaudata Holthuis, 1946","","Odontozona","","sculpticaudata","","Synonym","synonym","Species","","Holthuis","1946","Y","7957c185-0b09-4869-9c17-7cda701b69c9","20220504T01:21:58.041+0000","d896bad0-85f0-469d-9a82-65a2edc67419","20220510T08:28:17.473+0000","","7cfe67a7-1503-4a7e-b01f-62043105e5eb","Holthuis, L.B.","1946","Biological results of the Snellius Expedition XIV. The Decapoda Macrura of the Snellius Expedition. I. The Stenopodidae, Nephropsidae, Scyllaridae and Palinuridae","1-177 11 pls","","Temminckia","","","","<!--MARK--><a href='nullc22273c3-7714-4b30-9a21-3c5feb4eca26' class='mouseoverHref'>Holthuis, L.B. 1946. Biological results of the Snellius Expedition XIV. The Decapoda Macrura of the Snellius Expedition. I. The Stenopodidae, Nephropsidae, Scyllaridae and Palinuridae.</a> <!--MARK--><!--MARK--><a href='null751f7f0f-f4f6-427c-a599-a6e79cc4e53d' class='mouseoverHref'><em>Temminckia</em></a> <strong>7</strong>: 1-177 11 pls<!--MARK-->","","Article in Journal","c22273c3-7714-4b30-9a21-3c5feb4eca26","20081009T05:11:37.000+0000","751f7f0f-f4f6-427c-a599-a6e79cc4e53d"
"","","Stenopus","Stenopus Latreille, 1819","STENOPODIDAE","Stenopus","","","","Valid Name","","Genus","","Latreille","1819","Y","7bfd0ef8-5312-4b68-a65a-65bf1b59b6df","20220504T01:21:58.041+0000","98d771c1-d430-45aa-9a26-554eae66693c","20220510T08:28:17.473+0000","84d14690-54e4-4172-ad78-fe9ff19d7684","98d771c1-d430-45aa-9a26-554eae66693c","","","","","","","","","","","","","","",""
"","","Byzenus","Byzenus Rafinesque, 1814","","Byzenus","","","","Synonym","synonym","Genus","name of genus, and of its type species, suppressed for the purposes of the Principle of Priority, but not for those of the Principle of Homomymy, under the plenary powers of the ICZN; placed on the Official Index of Rejected and Invalid Generic Names in Zoology, see International Commission on Zoological Nomenclature 1958. Opinion 522. Suppression under the Plenary Powers (i) of certain names published by C.S. Rafinesque for genera and species of the Orders Decapoda and Stomatopoda (Class Crustacea) in the period 1814-1818 and (ii) of certain specific names currently regarded as senior subjective synonyms of the names of the type species of <I>Homola</I> Leach, 1815, and <I>Lissa</I> Leach, 1815 respectively both being genera assigned to the list of the foregoing Orders. <em>Opinions and Declarations rendered by the International Commission on Zoological Nomenclature</em> <strong>19</strong>: 209-248; gender masculine","Rafinesque","1814","Y","ae902762-7f8b-4550-ab9c-cc0c1e5cc8e0","20220504T01:21:58.041+0000","98d771c1-d430-45aa-9a26-554eae66693c","20220510T08:28:17.473+0000","","8fc4f16f-dd78-45fd-9f13-851a27a1f9a6","Rafinesque-Schmaltz, C.S.","1814","Précis des découvertes et travaux somiologiques de M. r. C. S. Rafinesque-Schmaltz entre 1800 et 1814<i>. Ou choix raisonné de ses principales découvertes en zoologie et en botanique, pour servir d'introduction à ses ouvrages futurs</i>","55 pp. + errata","","","","","Royale Typographie Militaire","<!--MARK--><a href='nulla441c84c-7946-412c-8287-b3b66c9c0698' class='mouseoverHref'>Rafinesque-Schmaltz, C.S. 1814. <em>Précis des découvertes et travaux somiologiques de M. r. C. S. Rafinesque-Schmaltz entre 1800 et 1814<i>. Ou choix raisonné de ses principales découvertes en zoologie et en botanique, pour servir d'introduction à ses ouvrages futurs</i></em>. Palermo : Royale Typographie Militaire 55 pp. + errata.</a><!--MARK-->","","Book","a441c84c-7946-412c-8287-b3b66c9c0698","20081009T05:11:37.000+0000",""
"","","Stenopus","Stenopus Latreille, 1819","","Stenopus","","","","Synonym","synonym","Genus","name placed on the Official List of Generic Names in Zoology, see International Commission on Zoological Nomenclature 1958. Opinion 522. Suppression under the Plenary Powers (i) of certain names published by C.S. Rafinesque for genera and species of the Orders Decapoda and Stomatopoda (Class Crustacea) in the period 1814-1818 and (ii) of certain specific names currently regarded as senior subjective synonyms of the names of the type species of <I>Homola</I> Leach, 1815, and <I>Lissa</I> Leach, 1815 respectively both being genera assigned to the list of the foregoing Orders. <em>Opinions and Declarations rendered by the International Commission on Zoological Nomenclature</em> <strong>19</strong>: 209-248; gender masculine","Latreille","1819","Y","b25728b6-bbfd-475e-be46-dfa79e1a2eb0","20220504T01:21:58.041+0000","98d771c1-d430-45aa-9a26-554eae66693c","20220510T08:28:17.473+0000","","ef2e2001-2fce-44d8-af0b-13dbb44a7adc","Latreille, P.A.","1819","<i>Nouveau dictionnaire d'histoire naturelle</i>, appliquée aux arts, à l'agriculture, à l'economie rurale et domestique, à la médecine, etc","71-72","","","","","","<!--MARK--><a href='nulld0c82882-8953-4a56-9724-20b704bbac67' class='mouseoverHref'>Latreille, P.A. 1819. <i>Nouveau dictionnaire d'histoire naturelle</i>, appliquée aux arts, à l'agriculture, à l'economie rurale et domestique, à la médecine, etc. edn 2. Vol. 30. 71-72 pp.</a>","","Miscellaneous","d0c82882-8953-4a56-9724-20b704bbac67","20081009T05:11:37.000+0000",""
"","","Embryocaris","Embryocaris Ortmann, 1893","","Embryocaris","","","","Synonym","synonym","Genus","gender feminine","Ortmann","1893","Y","af159a22-f1fc-4166-9164-fa364ec4a97c","20220504T01:21:58.041+0000","98d771c1-d430-45aa-9a26-554eae66693c","20220510T08:28:17.473+0000","","04ce33a5-1b91-4ce3-a53a-679489a70a0c","Ortmann, A.E.","1893","Decapoden und Schizopoden der Plankton-Expedition","1-120 pls 1-10","","Ergebnisse der Hamburger Magalhaensischen Sammelreise","","","","<!--MARK--><a href='nullf195b23f-635d-4fde-b5a2-b59a21cf2ff5' class='mouseoverHref'>Ortmann, A.E. 1893. Decapoden und Schizopoden der Plankton-Expedition.</a> <!--MARK--><!--MARK--><a href='null04235aa5-f0d1-48d5-b21f-655bb7358f70' class='mouseoverHref'><em>Ergebnisse der Hamburger Magalhaensischen Sammelreise</em></a> <strong>2</strong>(Gb): 1-120 pls 1-10<!--MARK-->","","Article in Journal","f195b23f-635d-4fde-b5a2-b59a21cf2ff5","20081009T05:11:37.000+0000","04235aa5-f0d1-48d5-b21f-655bb7358f70"
"","","chrysexanthus","Stenopus chrysexanthus Goy, 1992","STENOPODIDAE","Stenopus","","chrysexanthus","","Valid Name","","Species","","Goy","1992","Y","9a89128f-4feb-47da-b164-b9312802a0be","20220504T01:21:58.041+0000","888dd18f-a7da-48d8-a226-b8dcf79b9830","20220510T08:28:17.473+0000","98d771c1-d430-45aa-9a26-554eae66693c","888dd18f-a7da-48d8-a226-b8dcf79b9830","","","","","","","","","","","","","","",""
"","","chrysexanthus","Stenopus chrysexanthus Goy, 1992","","Stenopus","","chrysexanthus","","Synonym","synonym","Species","","Goy","1992","Y","97ce3c20-dff7-4e1e-8f0d-7aa9aa15c9a2","20220504T01:21:58.041+0000","888dd18f-a7da-48d8-a226-b8dcf79b9830","20220510T08:28:17.473+0000","","4554196e-59b7-41ed-a22e-9ab0b9bb8f7b","Goy, J.W.","1992","A new species of <i>Stenopus</i> from Australia, with a redescription of <i>Stenopus cyanoscelis</i> (Crustacea: Decapoda: Stenopodidea)","79-102","","Journal of Natural History","","","","<!--MARK--><a href='nulld083a47e-b38f-461a-a264-5aa2c39897fd' class='mouseoverHref'>Goy, J.W. 1992. A new species of <i>Stenopus</i> from Australia, with a redescription of <i>Stenopus cyanoscelis</i> (Crustacea: Decapoda: Stenopodidea).</a> <!--MARK--><!--MARK--><a href='nullad79edeb-4c47-4124-a7ea-9bcbbce0efa4' class='mouseoverHref'><em>Journal of Natural History</em></a> <strong>26</strong>: 79-102<!--MARK-->","","Article in Journal","d083a47e-b38f-461a-a264-5aa2c39897fd","20081009T05:11:37.000+0000","ad79edeb-4c47-4124-a7ea-9bcbbce0efa4"
"","","cyanoscelis","Stenopus cyanoscelis Goy, 1984","STENOPODIDAE","Stenopus","","cyanoscelis","","Valid Name","","Species","","Goy","1984","Y","0164f6f1-aeae-439b-8847-dae6ec53b750","20220504T01:21:58.041+0000","5da2bbf2-e953-48fb-97b6-c7a53ba17f2d","20220510T08:28:17.473+0000","98d771c1-d430-45aa-9a26-554eae66693c","5da2bbf2-e953-48fb-97b6-c7a53ba17f2d","","","","","","","","","","","","","","",""
"","","cyanoscelis","Stenopus cyanoscelis Goy, 1984","","Stenopus","","cyanoscelis","","Synonym","synonym","Species","","Goy","1984","Y","a578cf9b-fabe-4625-9a57-559119c58e1a","20220504T01:21:58.041+0000","5da2bbf2-e953-48fb-97b6-c7a53ba17f2d","20220510T08:28:17.473+0000","","418fc583-b36a-4484-8c89-d7811ccfdc40","Goy, J.W.","1984","Diagnoses of three new <i>Stenopus</i> species","116-117","Armoured Knights of the Sea","","","","","<!--MARK--><a href='nulldd093e47-68d5-4df0-b88a-0e83da63203f' class='mouseoverHref'>Goy, J.W. 1984. Diagnoses of three new <i>Stenopus</i> species. pp. 116-117</a> <!--MARK--><em>in</em> <!--MARK--><a href='nulld4a71818-85a5-4ad1-8c8e-a684d9f01887' class='mouseoverHref'>Debelius, H. (ed.). <em>Armoured Knights of the Sea</em>. Essen : Kernen 120 pp.</a><!--MARK-->","","Chapter in Book","dd093e47-68d5-4df0-b88a-0e83da63203f","20081009T05:11:37.000+0000","d4a71818-85a5-4ad1-8c8e-a684d9f01887"
"","","hispidus","Stenopus hispidus (Olivier, 1811)","STENOPODIDAE","Stenopus","","hispidus","","Valid Name","","Species","","Olivier","1811","N","d05fc322-5db2-4d1e-a02a-82e8db004600","20220504T01:21:58.041+0000","0f0a3c26-4f1b-48aa-9747-96f007e41050","20220510T08:28:17.473+0000","98d771c1-d430-45aa-9a26-554eae66693c","0f0a3c26-4f1b-48aa-9747-96f007e41050","","","","","","","","","","","","","","",""
"","","Banded Coral Shrimp, Banded Cleaner Shrimp","","","","","","","Common Name","General","Species","","","","","e655dd11-8251-482e-9160-0f8ff83fc757","20220504T01:21:58.041+0000","0f0a3c26-4f1b-48aa-9747-96f007e41050","20220510T08:28:17.473+0000","","","","","","","","","","","","","","","","",""
"","","groenlandica","Squilla groenlandica Seba, 1761","","Squilla","","groenlandica","","Synonym","synonym","Species","nomenclaturally unavailable as not proposed as a Linnaean binominal","Seba","1761","Y","35964b3e-3f76-4f43-8927-2c1e25ebee8d","20220504T01:21:58.041+0000","0f0a3c26-4f1b-48aa-9747-96f007e41050","20220510T08:28:17.473+0000","","5e721db7-03a3-45f1-984a-337bf5d448ce","Seba, A.","1761","<i>Locupletissimi Rerum Naturalium Thesauri accurata Descriptio et Iconibus artificiosissimis Expressio per Universam Physices Historiam</i>","1-212 pls 1-116","","","","","","<!--MARK--><a href='null27e43d5c-6872-402b-8dd4-acc9027a597a' class='mouseoverHref'>Seba, A. 1761. <i>Locupletissimi Rerum Naturalium Thesauri accurata Descriptio et Iconibus artificiosissimis Expressio per Universam Physices Historiam</i>. Amsterdam : [s.n.] Vol. 3 pp. 1-212 pls 1-116. 1-212 pls 1-116</a>","","Miscellaneous","27e43d5c-6872-402b-8dd4-acc9027a597a","20081009T05:11:37.000+0000",""
"","","muricatus","Astacus muricatus Olivier, 1791","","Astacus","","muricatus","","Synonym","synonym","Species","name placed on the Official Index of Rejected and Invalid Specific Names in Zoology, see International Commission on Zoological Nomenclature 1956. Opinion 381. Suppression under the plenary powers of two long-neglected specific names for the purpose of rendering the specific name hispidus Olivier, 1811, as published in the combination Palaemon hispidus (Class Crustacea, Order Decapoda) the oldest available name for the species concerned. <em>Opinions and Declarations rendered by the International Commission on Zoological Nomenclature</em> <strong>12</strong>: 35-42","Olivier","1791","Y","495cf66a-f6b5-4372-ada6-8a32187bf9df","20220504T01:21:58.041+0000","0f0a3c26-4f1b-48aa-9747-96f007e41050","20220510T08:28:17.473+0000","","a17d63d7-3496-45a8-8356-900940427804","Olivier, A.G.","1791","Écrevisse, <i>Astacus</i>","327-349","Encyclopédie Méthodique d'Histoire naturelle des Insectes","","","","","<!--MARK--><a href='null47f600b0-9561-4f17-af1a-66ee4e59eebf' class='mouseoverHref'>Olivier, A.G. 1791. Écrevisse, <i>Astacus</i>. pp. 327-349</a> <!--MARK--><em>in</em> <!--MARK--><a href='nullcb9108a8-4654-4de1-aba5-81d9310262ba' class='mouseoverHref'>Olivier, A.G. (ed.). <em>Encyclopédie Méthodique d'Histoire naturelle des Insectes</em>. Paris : Agasse Vol. 6.</a><!--MARK-->","","Chapter in Book","47f600b0-9561-4f17-af1a-66ee4e59eebf","20081009T05:11:37.000+0000","cb9108a8-4654-4de1-aba5-81d9310262ba"
"","","longipes","Cancer (Astacus) longipes Herbst, 1793","","Cancer","Astacus","longipes","","Synonym","synonym","Species","junior homonym of <I>Cancer longipes</I> Linnaeus, 1758; name placed on the Official Index of Rejected and Invalid Specific Names in Zoology, see International Commission on Zoological Nomenclature 1956. Opinion 381. Suppression under the plenary powers of two long-neglected specific names for the purpose of rendering the specific name hispidus Olivier, 1811, as published in the combination Palaemon hispidus (Class Crustacea, Order Decapoda) the oldest available name for the species concerned. <em>Opinions and Declarations rendered by the International Commission on Zoological Nomenclature</em> <strong>12</strong>: 35-42","Herbst","1793","Y","5d5fb9a0-0dc3-4ce7-8804-d9a7c184dac5","20220504T01:21:58.041+0000","0f0a3c26-4f1b-48aa-9747-96f007e41050","20220510T08:28:17.473+0000","","652dc6c4-0c0b-45a4-bf57-ccb25c79277d","Herbst, J.F.W.","1793","<i>Versuch einer Naturgeschichte der Krabben und Krebse nebst einer Systematischen Beischreibung ihrer Verschieden Arten</i>","","","","","","","<!--MARK--><a href='null340d5cc5-c0e4-499a-aed0-a20ecc67e60e' class='mouseoverHref'>Herbst, J.F.W. 1793. <i>Versuch einer Naturgeschichte der Krabben und Krebse nebst einer Systematischen Beischreibung ihrer Verschieden Arten</i>. Berlin & Stralsund Vol. 2 Pt 3 pp. 79-98 pls 30-33.</a>","","Miscellaneous","340d5cc5-c0e4-499a-aed0-a20ecc67e60e","20081009T05:11:37.000+0000",""
"","","borealis","Penaeus borealis Latreille, 1802","","Penaeus","","borealis","","Synonym","synonym","Species","name placed on the Official Index of Rejected and Invalid Specific Names in Zoology, see International Commission on Zoological Nomenclature 1956. Opinion 381. Suppression under the plenary powers of two long-neglected specific names for the purpose of rendering the specific name hispidus Olivier, 1811, as published in the combination Palaemon hispidus (Class Crustacea, Order Decapoda) the oldest available name for the species concerned. <em>Opinions and Declarations rendered by the International Commission on Zoological Nomenclature</em> <strong>12</strong>: 35-42","Latreille","1802","Y","b588a957-d245-456f-8390-26695e6830eb","20220504T01:21:58.041+0000","0f0a3c26-4f1b-48aa-9747-96f007e41050","20220510T08:28:17.473+0000","","9990d065-8664-4a0c-8567-9baf4f4e8d95","Latreille, P.A.","1802","Histoire Naturelle, Générale et Particulière des Crustacés et des Insectes. Ouvrage faisant suite à l?histoire naturelle générale et particulière, composée par Leclerc de Buffon, et rédigée par C.S. Sonnini, membre de plusieurs sociétés savantes. Familles naturelles des genres. Tome troisième.","xii + 13-467 + [1] pp.","","","","","F. Dufart","<!--MARK--><a href='null6f173923-80dc-4723-b34c-8d67e8b4b3ee' class='mouseoverHref'>Latreille, P.A. 1802. <em>Histoire Naturelle, Générale et Particulière des Crustacés et des Insectes. Ouvrage faisant suite à l?histoire naturelle générale et particulière, composée par Leclerc de Buffon, et rédigée par C.S. Sonnini, membre de plusieurs sociétés savantes. Familles naturelles des genres. Tome troisième</em>. Paris : F. Dufart xii + 13-467 + [1] pp.</a><!--MARK--> [An X (title page = 1802)]","An X (title page = 1802)","Book","6f173923-80dc-4723-b34c-8d67e8b4b3ee","20190116T04:15:43.496+0000",""
"","","hispidus","Palaemon hispidus Olivier, 1811","","Palaemon","","hispidus","","Synonym","synonym","Species","Name No. 614 on the Official List of Specific Names in Zoology, see International Commission on Zoological Nomenclature 1956. Opinion 381. Suppression under the plenary powers of two long-neglected specific names for the purpose of rendering the specific name hispidus Olivier, 1811, as published in the combination Palaemon hispidus (Class Crustacea, Order Decapoda) the oldest available name for the species concerned. <em>Opinions and Declarations rendered by the International Commission on Zoological Nomenclature</em> <strong>12</strong>: 35-42","Olivier","1811","Y","06e4a3d9-b955-4edd-92fb-82163871eb64","20220504T01:21:58.041+0000","0f0a3c26-4f1b-48aa-9747-96f007e41050","20220510T08:28:17.473+0000","","76eed5d9-f509-4652-ade3-551bf618bdad","Olivier, A.G.","1811","Palémon","652-667","Encyclopédie Méthodique. Histoire Naturelle. Insectes","","","","","<!--MARK--><a href='nullf7f2f28a-68a4-4d04-a78c-7e7392dbcfc7' class='mouseoverHref'>Olivier, A.G. 1811. Palémon. pp. 652-667</a> <!--MARK--><em>in</em> <!--MARK--><a href='nulla9745a8c-0b5f-420e-a9fd-c4aff436301b' class='mouseoverHref'>Olivier, A.G. (ed.). <em>Encyclopédie Méthodique. Histoire Naturelle. Insectes</em>. Paris : H. Agasse Vol. 8 722 pp.</a><!--MARK-->","","Chapter in Book","f7f2f28a-68a4-4d04-a78c-7e7392dbcfc7","20081009T05:11:37.000+0000","a9745a8c-0b5f-420e-a9fd-c4aff436301b"
"","","stylicauda","Embryocaris stylicauda Ortmann, 1893","","Embryocaris","","stylicauda","","Synonym","synonym","Species","","Ortmann","1893","Y","dc7c3658-f224-41cd-bfab-8754679b8ab5","20220504T01:21:58.041+0000","0f0a3c26-4f1b-48aa-9747-96f007e41050","20220510T08:28:17.473+0000","","585d686e-f3de-4228-b266-c88b58ca0b6f","Ortmann, A.E.","1893","Decapoden und Schizopoden der Plankton-Expedition","1-120 pls 1-10","","Ergebnisse der Hamburger Magalhaensischen Sammelreise","","","","<!--MARK--><a href='nullf195b23f-635d-4fde-b5a2-b59a21cf2ff5' class='mouseoverHref'>Ortmann, A.E. 1893. Decapoden und Schizopoden der Plankton-Expedition.</a> <!--MARK--><!--MARK--><a href='null04235aa5-f0d1-48d5-b21f-655bb7358f70' class='mouseoverHref'><em>Ergebnisse der Hamburger Magalhaensischen Sammelreise</em></a> <strong>2</strong>(Gb): 1-120 pls 1-10<!--MARK-->","","Article in Journal","f195b23f-635d-4fde-b5a2-b59a21cf2ff5","20081009T05:11:37.000+0000","04235aa5-f0d1-48d5-b21f-655bb7358f70"
"","","tenuirostris","Stenopus tenuirostris de Man, 1888","STENOPODIDAE","Stenopus","","tenuirostris","","Valid Name","","Species","","de Man","1888","Y","30061ffc-bfc9-49c8-897d-ee7a55814e2c","20220504T01:21:58.041+0000","351c8c59-1fd9-4353-b56a-b842d80902cb","20220510T08:28:17.473+0000","98d771c1-d430-45aa-9a26-554eae66693c","351c8c59-1fd9-4353-b56a-b842d80902cb","","","","","","","","","","","","","","",""
"","","tenuirostris","Stenopus tenuirostris de Man, 1888","","Stenopus","","tenuirostris","","Synonym","synonym","Species","","de Man","1888","Y","b3ecf76c-2dbc-4883-8450-b93779280d92","20220504T01:21:58.041+0000","351c8c59-1fd9-4353-b56a-b842d80902cb","20220510T08:28:17.473+0000","","211c22ef-eb78-4d2a-96b0-57235c742936","de Man, J.G.","1888","Bericht über die von Herrn Dr. J. Brock im indischen Archipel gesammelten Decapoden und Stomatopoden","215-600 pls 7-22, 22a","","Archiv für Naturgeschichte","","","","<!--MARK--><a href='nullc688b0bb-249d-4510-85f2-4afdc2af55bf' class='mouseoverHref'>de Man, J.G. 1888. Bericht über die von Herrn Dr. J. Brock im indischen Archipel gesammelten Decapoden und Stomatopoden.</a> <!--MARK--><!--MARK--><a href='nullf5b5f7c7-fc53-4502-951d-1c96b680d874' class='mouseoverHref'><em>Archiv für Naturgeschichte</em></a> <strong>53</strong>(1): 215-600 pls 7-22, 22a<!--MARK--> [for publication date Clark, P.F., Harrison, K. & Goodman, S.L. 1990. Brock's Indian Archipelago Decapoda and Stomatopoda by De Man: 1887 or 1888?. <em>Arch. Nat. Hist.</em> <strong>17</strong>(1): 79-80]","for publication date Clark, P.F., Harrison, K. & Goodman, S.L. 1990. Brock's Indian Archipelago Decapoda and Stomatopoda by De Man: 1887 or 1888?. <em>Arch. Nat. Hist.</em> <strong>17</strong>(1): 79-80","Article in Journal","c688b0bb-249d-4510-85f2-4afdc2af55bf","20081009T05:11:37.000+0000","f5b5f7c7-fc53-4502-951d-1c96b680d874"
