"CAVS_CODE","CAAB_CODE","NAMES_VARIOUS","SCIENTIFIC_NAME","FAMILY","GENUS","SUBGENUS","SPECIES","SUBSPECIES","NAME_TYPE","NAME_SUBTYPE","RANK","QUALIFICATION","AUTHOR","YEAR","ORIG_COMBINATION","NAME_GUID","NAME_LAST_UPDATE","TAXON_GUID","TAXON_LAST_UPDATE","PARENT_TAXON_GUID","CONCEPT_GUID","PUB_PUB_AUTHOR","PUB_PUB_YEAR","PUB_PUB_TITLE","PUB_PUB_PAGES","PUB_PUB_PARENT_BOOK_TITLE","PUB_PUB_PARENT_JOURNAL_TITLE","PUB_PUB_PARENT_ARTICLE_TITLE","PUB_PUB_PUBLICATION_DATE","PUB_PUB_PUBLISHER","PUB_PUB_FORMATTED","PUB_PUB_QUALIFICATION","PUB_PUB_TYPE","PUBLICATION_GUID","PUBLICATION_LAST_UPDATE","PARENT_PUBLICATION_GUID"
"","","STRUTHIOLARIIDAE","STRUTHIOLARIIDAE Gabb, 1868","","","","","","Valid Name","","Family","","Gabb","1868","Y","fdead471-0845-4370-ae3c-5b5137d2eda9","20210421T00:08:50.201+0000","2f59e20d-8522-4669-8af0-a50489a88ca9","20210601T08:14:25.837+0000","22dbd57a-8807-45c6-9219-0d27238363cb","2f59e20d-8522-4669-8af0-a50489a88ca9","","","","","","","","","","","","","","",""
"","","Struthiolarinae","Struthiolarinae Gabb, 1868","","","","","","Synonym","original spelling","Family","","Gabb","1868","Y","6f166b07-eb90-4e84-95e6-1d78a127e2bf","20210421T00:08:50.201+0000","2f59e20d-8522-4669-8af0-a50489a88ca9","20210601T08:14:25.837+0000","","b7be1574-f5a8-4cba-9eaf-370e9eff62c2","Gabb, W.M.","1868","An attempt at the revision of the two families Strombidae and Aporrhaidae","137-149","","American Journal of Conchology","","","","<!--MARK--><a href='null0319c71a-2f2f-41c4-af38-ced4ebfe8792' class='mouseoverHref'>Gabb, W.M. 1868. An attempt at the revision of the two families Strombidae and Aporrhaidae.</a> <!--MARK--><!--MARK--><a href='null914e4dda-4a49-49d4-956d-2a0be5178988' class='mouseoverHref'><em>American Journal of Conchology</em></a> <strong>4</strong>(3): 137-149<!--MARK-->","","Article in Journal","0319c71a-2f2f-41c4-af38-ced4ebfe8792","20190318T23:03:30.938+0000","914e4dda-4a49-49d4-956d-2a0be5178988"
"","","Tylospira","Tylospira Harris, 1897","STRUTHIOLARIIDAE","Tylospira","","","","Valid Name","","Genus","","Harris","1897","Y","da80976c-fba7-4c8f-af93-d408395b2b2a","20210421T00:08:50.201+0000","bf891454-5dec-4d03-b906-f2223cc655be","20210601T08:14:25.837+0000","2f59e20d-8522-4669-8af0-a50489a88ca9","bf891454-5dec-4d03-b906-f2223cc655be","","","","","","","","","","","","","","",""
"","","Tylospira","Tylospira Harris, 1897","","Tylospira","","","","Synonym","synonym","Genus","","Harris","1897","Y","85c55685-3af4-473b-93bf-4f8a808c9cbf","20210421T00:08:50.201+0000","bf891454-5dec-4d03-b906-f2223cc655be","20210601T08:14:25.837+0000","","50300947-9af6-4181-b0c4-4b106ae0fcfa","Harris, G.F.","1897","Catalogue of Tertiary Mollusca in the Department of Geology, British Museum (Natural History). The Australasian Tertiary Mollusca","407 pp., 8 pls","","","","","British Museum of Natural History","<!--MARK--><a href='null392bee8f-ba17-4ad8-adbf-370f112f3aca' class='mouseoverHref'>Harris, G.F. 1897. <em>Catalogue of Tertiary Mollusca in the Department of Geology, British Museum (Natural History). The Australasian Tertiary Mollusca</em>. London : British Museum of Natural History Part 1 407 pp., 8 pls.</a><!--MARK-->","","Book","392bee8f-ba17-4ad8-adbf-370f112f3aca","20120315T00:58:52.359+0000",""
"","","scutulata","Tylospira scutulata (Gmelin, 1791)","STRUTHIOLARIIDAE","Tylospira","","scutulata","","Valid Name","","Species","","Gmelin","1791","N","77ac33ad-968e-4d85-b151-ca166f03283a","20210421T00:08:50.201+0000","9838a924-7168-47c8-b820-34efe24bfeac","20210601T08:14:25.837+0000","bf891454-5dec-4d03-b906-f2223cc655be","9838a924-7168-47c8-b820-34efe24bfeac","","","","","","","","","","","","","","",""
"","","Ostrich Foot Shell","","","","","","","Common Name","","Species","","","","","71ab254c-71ba-4eb9-ad29-2453ce83dd47","20210421T00:08:50.201+0000","9838a924-7168-47c8-b820-34efe24bfeac","20210601T08:14:25.837+0000","","0ed18ccd-57b9-477a-928e-b2d50ff9245b","Allan, J.K.","1950","Australian shells: with related animals living in the sea, in freshwater and on the land","xix, 470 pp., 45 pls, 112 text figs","","","","","Georgian House","<!--MARK--><a href='nullc4e311eb-d59e-424a-8ebe-323bb0b5b6e4' class='mouseoverHref'>Allan, J.K. 1950. <em>Australian shells: with related animals living in the sea, in freshwater and on the land</em>. Melbourne : Georgian House xix, 470 pp., 45 pls, 112 text figs.</a><!--MARK-->","","Book","c4e311eb-d59e-424a-8ebe-323bb0b5b6e4","20171102T21:53:38.674+0000",""
"","","scutulata","Buccinum scutulata Gmelin, 1791","","Buccinum","","scutulata","","Synonym","synonym","Species","","Gmelin","1791","Y","b93778f8-78cf-47e1-b69f-e3b126a4dbca","20210421T00:08:50.201+0000","9838a924-7168-47c8-b820-34efe24bfeac","20210601T08:14:25.837+0000","","d3bdcdc7-d6b9-483c-8b97-33527f56a1e1","Gmelin J.F.","1791","Caroli a Linné. Systema Naturae per regna tria naturae, secundum classes, ordines, genera, species, cum characteribus, differentiis, synonymis, locis.","3021-3910","","","","","Georg. Emanuel. Beer","<!--MARK--><a href='null385ec822-ae0f-46cc-8012-3203949d5423' class='mouseoverHref'>Gmelin J.F. 1791. <em>Caroli a Linné. Systema Naturae per regna tria naturae, secundum classes, ordines, genera, species, cum characteribus, differentiis, synonymis, locis</em>. Lipsiae : Georg. Emanuel. Beer Vermes. Vol. 1(Part 6) pp. 3021-3910.</a><!--MARK--> [officially regarded by the ICZN Opinion 296 (26 Oct 1954) as the 13th edition of <i>Systema Naturae</i>]","officially regarded by the ICZN Opinion 296 (26 Oct 1954) as the 13th edition of <i>Systema Naturae</i>","Book","385ec822-ae0f-46cc-8012-3203949d5423","20171116T03:24:30.463+0000",""
"","","scutulata","Tylospira scutulata (Gmelin, 1791)","","Tylospira","","scutulata","","Generic Combination","","Species","","Gmelin","1791","N","85892b2f-d2c4-4afe-b3b9-6e6738d294d6","20210421T00:08:50.201+0000","9838a924-7168-47c8-b820-34efe24bfeac","20210601T08:14:25.837+0000","","2df071bf-94f6-4931-b75a-ca03361962d9","Iredale, T. & McMichael, D.F.","1962","A reference list of the marine Mollusca of New South Wales","1-109","","Memoirs of the Australian Museum","","","","<!--MARK--><a href='null0fbb8e94-a1f6-42b8-95cc-d5e7a50b79b9' class='mouseoverHref'>Iredale, T. & McMichael, D.F. 1962. A reference list of the marine Mollusca of New South Wales.</a> <!--MARK--><!--MARK--><a href='null272826c2-c2bf-425b-bd6f-11ddaf2aaeaa' class='mouseoverHref'><em>Memoirs of the Australian Museum</em></a> <strong>11</strong>: 1-109<!--MARK-->","","Article in Journal","0fbb8e94-a1f6-42b8-95cc-d5e7a50b79b9","20171019T23:46:28.734+0000","272826c2-c2bf-425b-bd6f-11ddaf2aaeaa"
