"CAVS_CODE","CAAB_CODE","NAMES_VARIOUS","SCIENTIFIC_NAME","FAMILY","GENUS","SUBGENUS","SPECIES","SUBSPECIES","NAME_TYPE","NAME_SUBTYPE","RANK","QUALIFICATION","AUTHOR","YEAR","ORIG_COMBINATION","NAME_GUID","NAME_LAST_UPDATE","TAXON_GUID","TAXON_LAST_UPDATE","PARENT_TAXON_GUID","CONCEPT_GUID","PUB_PUB_AUTHOR","PUB_PUB_YEAR","PUB_PUB_TITLE","PUB_PUB_PAGES","PUB_PUB_PARENT_BOOK_TITLE","PUB_PUB_PARENT_JOURNAL_TITLE","PUB_PUB_PARENT_ARTICLE_TITLE","PUB_PUB_PUBLICATION_DATE","PUB_PUB_PUBLISHER","PUB_PUB_FORMATTED","PUB_PUB_QUALIFICATION","PUB_PUB_TYPE","PUBLICATION_GUID","PUBLICATION_LAST_UPDATE","PARENT_PUBLICATION_GUID"
"","","Seriatula","Seriatula Gray, 1867","","Seriatula","","","","Synonym","synonym","Subgenus","objective synonym of <I></I>Halichondria<I></I> by synonymy of <I></I>Spongia seriata<I></I> Grant, 1826 with <I></I>Halichondria panicea<I></I> Pallas, 1766, as determined by Howson & Chambers, 1998","Gray","1867","Y","0a393338-084d-44a1-b8b7-d8aff521c9ea","20210803T02:25:31.270+0000","652258b3-301c-4374-8318-61fea1f76814","20220303T02:16:47.770+0000","","da3d8619-f12c-4e38-8b5d-4d063f927e10","Gray, J.E.","1867","Notes on the arrangement of sponges, with the description of some new genera","492-558 pls 27-28","","Proceedings of the Zoological Society of London","","","","<!--MARK--><a href='null51eface9-4ece-4e50-9b32-e075f93c3617' class='mouseoverHref'>Gray, J.E. 1867. Notes on the arrangement of sponges, with the description of some new genera.</a> <!--MARK--><!--MARK--><a href='null511f299d-99ec-413c-bc4c-04a380829c96' class='mouseoverHref'><em>Proceedings of the Zoological Society of London</em></a> <strong>1867</strong>: 492-558 pls 27-28<!--MARK-->","","Article in Journal","51eface9-4ece-4e50-9b32-e075f93c3617","20081009T05:11:37.000+0000","511f299d-99ec-413c-bc4c-04a380829c96"
"","","Raspaigella","Raspaigella Schmidt, 1868","","Raspaigella","","","","Synonym","synonym","Subgenus","","Schmidt","1868","Y","b9ecc2af-b85a-4d46-a1d6-d7930477e58d","20210803T02:25:31.270+0000","652258b3-301c-4374-8318-61fea1f76814","20220303T02:16:47.770+0000","","b8c5ac36-aee5-4ff8-b1c5-4a8dc17b8a73","Schmidt, E.O.","1868","Die Spongien der Küste von Algier. Mit Nachträgen zu den Spongien des Adriatischen Meeres","44 pp. 5 pls","","","","","Engelmann","<!--MARK--><a href='null89e2a571-aa10-4630-93f6-af735ad19382' class='mouseoverHref'>Schmidt, E.O. 1868. <em>Die Spongien der Küste von Algier. Mit Nachträgen zu den Spongien des Adriatischen Meeres</em>. Leipzig : Engelmann 44 pp. 5 pls.</a><!--MARK-->","","Book","89e2a571-aa10-4630-93f6-af735ad19382","20081009T05:11:37.000+0000",""
"","","Eumastia","Eumastia Schmidt, 1870","","Eumastia","","","","Synonym","synonym","Subgenus","type species transferred to <I>Halichondria </I>Fleming, 1828 by Koltun, V.M. 1959. The Cornacuspongida of the northern and far eastern seas of the U.S.S.R. pp. 1-236 43 pls <I>in</I>, <I>Keys to the Fauna of the U.S.S.R</I>. Vol. 67 Published by the Zoological Institute, Akademia Nauk SSSR.  [in Russian]; see also Topsent, E. 1915. Spongiaires recueillies par la <I>Scotia</I> dans l'Antarctique (1903-1904). Supplement. <em>Transactions of the Royal Society of Edinburgh</em> <strong>51</strong>: 35-43 (38)","Schmidt","1870","Y","74b87c59-ecdf-467e-9fa4-78564cab11cb","20210803T02:25:31.270+0000","652258b3-301c-4374-8318-61fea1f76814","20220303T02:16:47.770+0000","","a72e3962-4f79-4e8f-ac54-a70128ed20ef","Schmidt, E.O.","1870","Grundzüge einer Spongien-Fauna des Atlantischen Gebietes","88 pp. 6 pls","","","","","Engelmann","<!--MARK--><a href='null66b5e8cd-b494-433f-855d-dd74959cadc5' class='mouseoverHref'>Schmidt, E.O. 1870. <em>Grundzüge einer Spongien-Fauna des Atlantischen Gebietes</em>. Leipzig : Engelmann 88 pp. 6 pls.</a><!--MARK-->","","Book","66b5e8cd-b494-433f-855d-dd74959cadc5","20081009T05:11:37.000+0000",""
"","","Spuma","Spuma Miklucho-Maclay, 1870","","Spuma","","","","Synonym","synonym","Subgenus","","Miklucho-Maclay","1870","Y","d344ae66-fbe9-4ad5-8571-c47343bb1cce","20210803T02:25:31.270+0000","652258b3-301c-4374-8318-61fea1f76814","20220303T02:16:47.770+0000","","126ed580-622c-42e3-bf90-365cfc2fc3b0","Miklucho-Maclay, N.N.","1870","Ueber einige Schwämme des nördlichen stillen Oceans und des Eismeeres. Ein Beitrag zur Morphologie und Verbreitung der Spongien","13","","Mémoires de l'Academie Imperial de la Société des Sciences, Saint Pétersburg","","","","<!--MARK--><a href='null24e758db-c368-4e7a-abe8-177159df7900' class='mouseoverHref'>Miklucho-Maclay, N.N. 1870. Ueber einige Schwämme des nördlichen stillen Oceans und des Eismeeres. Ein Beitrag zur Morphologie und Verbreitung der Spongien.</a> <!--MARK--><!--MARK--><a href='nulle0e564a6-69d1-4958-b893-400e49ca467e' class='mouseoverHref'><em>Mémoires de l'Academie Imperial de la Société des Sciences, Saint Pétersburg</em></a> 7 <strong>15</strong>(3): 13<!--MARK-->","","Article in Journal","24e758db-c368-4e7a-abe8-177159df7900","20081009T05:11:37.000+0000","e0e564a6-69d1-4958-b893-400e49ca467e"
"","","Menanetia","Menanetia Topsent, 1896","","Menanetia","","","","Synonym","synonym","Subgenus","","Topsent","1896","Y","5392015a-4903-4cae-ad6a-a4cf708da607","20210803T02:25:31.270+0000","652258b3-301c-4374-8318-61fea1f76814","20220303T02:16:47.770+0000","","35509a3d-d731-411e-a60c-4d8e4827afa4","Topsent, E.","1896","Matériaux pour servir à l'étude de la faune des Spongiaires de France","113-133","","Mémoires de la Société Zoologique de France","","","","<!--MARK--><a href='nulle001167a-94a7-4c33-ac2c-f7551adca115' class='mouseoverHref'>Topsent, E. 1896. Matériaux pour servir à l'étude de la faune des Spongiaires de France.</a> <!--MARK--><!--MARK--><a href='nulla552236b-f9a6-427c-8084-4d203a8a3d1b' class='mouseoverHref'><em>Mémoires de la Société Zoologique de France</em></a> <strong>9</strong>: 113-133<!--MARK-->","","Article in Journal","e001167a-94a7-4c33-ac2c-f7551adca115","20081009T05:11:37.000+0000","a552236b-f9a6-427c-8084-4d203a8a3d1b"
"","","Pyloderma","Pyloderma Kirkpatrick, 1908","","Pyloderma","","","","Synonym","synonym","Subgenus","","Kirkpatrick","1908","Y","0abd6db5-3597-4f06-815c-9b89b5a5be0c","20210803T02:25:31.270+0000","652258b3-301c-4374-8318-61fea1f76814","20220303T02:16:47.770+0000","","78d214ff-fb72-43b0-9895-a768136c5490","Kirkpatrick, R.","1908","Porifera. II. Tetraxonida.","1-56 pls 8-26","","","","","British Museum","<!--MARK--><a href='null7e259890-1471-4b88-a789-24ebeafa04f8' class='mouseoverHref'>Kirkpatrick, R. 1908. <em>Porifera. II. Tetraxonida</em>. <em>National Antarctic Expedition 1901-1904. Natural History</em> London : British Museum Vol. 4 1-56 pls 8-26.</a><!--MARK-->","","Book","7e259890-1471-4b88-a789-24ebeafa04f8","20140202T22:26:10.760+0000",""
"","","Halichondriella","Halichondriella Burton, 1931","","Halichondriella","","","","Synonym","synonym","Subgenus","","Burton","1931","Y","2491b75e-487f-4568-bbf0-4425767a2594","20210803T02:25:31.270+0000","652258b3-301c-4374-8318-61fea1f76814","20220303T02:16:47.770+0000","","284cf746-b5df-42ff-acb0-c0a11389dbb4","Burton, M.","1931","Studies on Norwegian sponges. I","136-143","","Kongelige Norske Videnskabernes Selskabs Forhanglinger","","","","<!--MARK--><a href='nulldaae87b2-070c-4462-b3a1-fa43479f9205' class='mouseoverHref'>Burton, M. 1931. Studies on Norwegian sponges. I.</a> <!--MARK--><!--MARK--><a href='null729f3b16-6385-4a7d-a5c2-6dcb47776ee1' class='mouseoverHref'><em>Kongelige Norske Videnskabernes Selskabs Forhanglinger</em></a> <strong>4</strong>: 136-143<!--MARK-->","","Article in Journal","daae87b2-070c-4462-b3a1-fa43479f9205","20081009T05:11:37.000+0000","729f3b16-6385-4a7d-a5c2-6dcb47776ee1"
"","","Trachyopsilla","Trachyopsilla Burton, 1931","","Trachyopsilla","","","","Synonym","synonym","Subgenus","","Burton","1931","Y","77e451d3-5883-4ec4-8c59-e76b20fcd2c8","20210803T02:25:31.270+0000","652258b3-301c-4374-8318-61fea1f76814","20220303T02:16:47.770+0000","","95e6f555-30f3-4977-b05c-e27d7888af00","Burton, M.","1931","Studies on Norwegian sponges. I","136-143","","Kongelige Norske Videnskabernes Selskabs Forhanglinger","","","","<!--MARK--><a href='nulldaae87b2-070c-4462-b3a1-fa43479f9205' class='mouseoverHref'>Burton, M. 1931. Studies on Norwegian sponges. I.</a> <!--MARK--><!--MARK--><a href='null729f3b16-6385-4a7d-a5c2-6dcb47776ee1' class='mouseoverHref'><em>Kongelige Norske Videnskabernes Selskabs Forhanglinger</em></a> <strong>4</strong>: 136-143<!--MARK-->","","Article in Journal","daae87b2-070c-4462-b3a1-fa43479f9205","20081009T05:11:37.000+0000","729f3b16-6385-4a7d-a5c2-6dcb47776ee1"
"","","Ciocalapata","Ciocalapata Laubenfels, 1936","","Ciocalapata","","","","Synonym","synonym","Subgenus","","Laubenfels","1936","Y","4d69ede7-f8ce-487c-976a-bea33992af02","20210803T02:25:31.270+0000","652258b3-301c-4374-8318-61fea1f76814","20220303T02:16:47.770+0000","","050c4ee1-4b09-41ea-8464-a495fd95c2ab","Laubenfels, M.W. de","1936","A discussion of the sponge fauna of the Dry Tortugas in particular, and the West Indies in general, with material for a revision of the families and orders of the Porifera. (Tortugas Lab. Paper No. 467)","1-225 22 pls 1 map","","Publication of the Carnegie Institution of Washington","","","","<!--MARK--><a href='nullf13281d3-3323-4b05-85de-7d3a3f1cc15e' class='mouseoverHref'>Laubenfels, M.W. de 1936. A discussion of the sponge fauna of the Dry Tortugas in particular, and the West Indies in general, with material for a revision of the families and orders of the Porifera. (Tortugas Lab. Paper No. 467).</a> <!--MARK--><!--MARK--><a href='null21197fbf-e955-4b91-b8c9-7be6b681c3e1' class='mouseoverHref'><em>Publication of the Carnegie Institution of Washington</em></a> Washington <strong>30</strong>: 1-225 22 pls 1 map<!--MARK-->","","Article in Journal","f13281d3-3323-4b05-85de-7d3a3f1cc15e","20081009T05:11:37.000+0000","21197fbf-e955-4b91-b8c9-7be6b681c3e1"
"","","Cioxeamastia","Cioxeamastia Laubenfels, 1942","","Cioxeamastia","","","","Synonym","synonym","Subgenus","","Laubenfels","1942","Y","1b5803ca-4326-4a34-9f59-51298f3326fa","20210803T02:25:31.270+0000","652258b3-301c-4374-8318-61fea1f76814","20220303T02:16:47.770+0000","","8d670ca6-740e-4c22-91c3-9b0347162490","Laubenfels, M.W. de","1942","Porifera from Greenland and Baffinland collected by Capt. Robert A. Bartlett","263-269","","Journal of the Washington Academy of Sciences","","","","<!--MARK--><a href='null8bd032a9-6add-4849-a2a9-d89054521838' class='mouseoverHref'>Laubenfels, M.W. de 1942. Porifera from Greenland and Baffinland collected by Capt. Robert A. Bartlett.</a> <!--MARK--><!--MARK--><a href='nullba6795b3-056d-49fe-8d9a-6b51e798e280' class='mouseoverHref'><em>Journal of the Washington Academy of Sciences</em></a> <strong>32</strong>: 263-269<!--MARK-->","","Article in Journal","8bd032a9-6add-4849-a2a9-d89054521838","20081009T05:11:37.000+0000","ba6795b3-056d-49fe-8d9a-6b51e798e280"
"","","microbiana","Halichondria (Halichondria) microbiana Alvarez & Hooper, 2011","HALICHONDRIIDAE","Halichondria","Halichondria","microbiana","","Valid Name","","Species","","Alvarez & Hooper","2011","Y","9caf014e-3c2d-41d7-ab36-749513ac9bd5","20210803T02:25:31.270+0000","2c93a390-140c-4cdc-b870-8f4cf155b358","20220303T02:16:47.770+0000","652258b3-301c-4374-8318-61fea1f76814","2c93a390-140c-4cdc-b870-8f4cf155b358","","","","","","","","","","","","","","",""
"","","microbiana","Halichondria (Halichondria) microbiana Alvarez & Hooper, 2011","HALICHONDRIIDAE","Halichondria","Halichondria","microbiana","","Synonym","synonym","Species","","Alvarez & Hooper","2011","Y","174dfc82-e15a-4023-aee2-c67d1b308a80","20210803T02:25:31.270+0000","2c93a390-140c-4cdc-b870-8f4cf155b358","20220303T02:16:47.770+0000","","13b061e4-1d3a-42e7-b6a0-41377912149d","Alvarez, B. & Hooper, J.N.A.","2011","Taxonomic revision of the order Halichondrida (Porifera: Demospongiae) of northern Australia. Family Halichondriidae.","55-84","","The Beagle, Records of the Museums and Art Galleries of the Northern Territory","","","","<!--MARK--><a href='null6f3253e8-95dd-4f38-813d-3f9d7c77f6a4' class='mouseoverHref'>Alvarez, B. & Hooper, J.N.A. 2011. Taxonomic revision of the order Halichondrida (Porifera: Demospongiae) of northern Australia. Family Halichondriidae.</a> <!--MARK--><!--MARK--><a href='null8adcca9b-ba23-4332-8764-3137d09e3776' class='mouseoverHref'><em>The Beagle, Records of the Museums and Art Galleries of the Northern Territory</em></a> <strong>27</strong>: 55-84<!--MARK-->","","Article in Journal","6f3253e8-95dd-4f38-813d-3f9d7c77f6a4","20111230T10:15:07.671+0000","8adcca9b-ba23-4332-8764-3137d09e3776"
"","","aciculata","Halichondria (Halichondria) aciculata Carter, 1885","HALICHONDRIIDAE","Halichondria","Halichondria","aciculata","","Valid Name","","Species","","Carter","1885","Y","3110afdf-f913-4296-b7df-5dfe50d082f1","20210803T02:25:31.270+0000","f969700d-5f96-4db1-a4b1-6d3f57183f45","20220303T02:16:47.770+0000","652258b3-301c-4374-8318-61fea1f76814","f969700d-5f96-4db1-a4b1-6d3f57183f45","","","","","","","","","","","","","","",""
"","","aciculata","Ciocalypta penicillus aciculata Carter, 1885","","Ciocalypta","","penicillus","aciculata","Synonym","synonym","Species","","Carter","1885","Y","08876f71-d2a9-4e88-a1c3-c0ac9eebe0be","20210803T02:25:31.270+0000","f969700d-5f96-4db1-a4b1-6d3f57183f45","20220303T02:16:47.770+0000","","995c6007-ff8d-430c-9433-d69c69dc9ff3","Carter, H.J.","1885","Description of sponges from the neighbourhood of Port Phillip Heads, South Australia","347-368","","Annals and Magazine of Natural History","","","","<!--MARK--><a href='null2dd631df-7cd5-451c-b7f9-cf6e6bbe6ca0' class='mouseoverHref'>Carter, H.J. 1885. Description of sponges from the neighbourhood of Port Phillip Heads, South Australia.</a> <!--MARK--><!--MARK--><a href='nullefa8de69-3a29-4a43-8ef2-cbefda205976' class='mouseoverHref'><em>Annals and Magazine of Natural History</em></a> 5 <strong>16</strong>: 347-368<!--MARK-->","","Article in Journal","2dd631df-7cd5-451c-b7f9-cf6e6bbe6ca0","20081009T05:11:37.000+0000","efa8de69-3a29-4a43-8ef2-cbefda205976"
"","","arenacea","Halichondria (Halichondria) arenacea Dendy, 1895","HALICHONDRIIDAE","Halichondria","Halichondria","arenacea","","Valid Name","","Species","","Dendy","1895","Y","2d9b6005-1f94-4189-b33f-777c5310b676","20210803T02:25:31.270+0000","73fa8ad0-ecc9-451e-b844-bc298271fcfb","20220303T02:16:47.770+0000","652258b3-301c-4374-8318-61fea1f76814","73fa8ad0-ecc9-451e-b844-bc298271fcfb","","","","","","","","","","","","","","",""
"","","arenacea","Halichondria arenacea Dendy, 1895","","Halichondria","","arenacea","","Synonym","synonym","Species","","Dendy","1895","Y","de9d3346-aa2c-4eeb-acb4-45f0eaa98f72","20210803T02:25:31.270+0000","73fa8ad0-ecc9-451e-b844-bc298271fcfb","20220303T02:16:47.770+0000","","eee513e1-5b73-40c9-ad41-fa0b4819a459","Dendy, A.","1895","Catalogue of non-calcareous sponges collected by J. Bracebridge Wilson, Esq., M.A., in the neighbourhood of Port Phillip Heads. Part 1","232-260","","Proceedings of the Royal Society of Victoria","","","","<!--MARK--><a href='nulled0dd478-ed64-4b87-b93d-25834bfe7659' class='mouseoverHref'>Dendy, A. 1895. Catalogue of non-calcareous sponges collected by J. Bracebridge Wilson, Esq., M.A., in the neighbourhood of Port Phillip Heads. Part 1.</a> <!--MARK--><!--MARK--><a href='nullce333794-3a02-427f-ba27-346079f1efa0' class='mouseoverHref'><em>Proceedings of the Royal Society of Victoria</em></a> ns <strong>7</strong>: 232-260<!--MARK-->","","Article in Journal","ed0dd478-ed64-4b87-b93d-25834bfe7659","20081009T05:11:37.000+0000","ce333794-3a02-427f-ba27-346079f1efa0"
"","","carotenoidea","Halichondria (Halichondria) carotenoidea Alvarez & Hooper, 2011","HALICHONDRIIDAE","Halichondria","Halichondria","carotenoidea","","Valid Name","","Species","","Alvarez & Hooper","2011","Y","63de496c-08f9-45b1-8b77-d48913046cd2","20210803T02:25:31.270+0000","3e63c1a2-5e6e-44d5-9954-a5d6106d3a8d","20220303T02:16:47.770+0000","652258b3-301c-4374-8318-61fea1f76814","3e63c1a2-5e6e-44d5-9954-a5d6106d3a8d","","","","","","","","","","","","","","",""
"","","carotenoidea","Halichondria carotenoidea Alvarez & Hooper, 2011","","Halichondria","","carotenoidea","","Synonym","synonym","Species","","Alvarez & Hooper","2011","Y","aa803c0a-b2db-489a-a5eb-dc278a024771","20210803T02:25:31.270+0000","3e63c1a2-5e6e-44d5-9954-a5d6106d3a8d","20220303T02:16:47.770+0000","","36af00be-f592-4de9-8337-0f530efcd898","Alvarez, B. & Hooper, J.N.A.","2011","Taxonomic revision of the order Halichondrida (Porifera: Demospongiae) of northern Australia. Family Halichondriidae.","55-84","","The Beagle, Records of the Museums and Art Galleries of the Northern Territory","","","","<!--MARK--><a href='null6f3253e8-95dd-4f38-813d-3f9d7c77f6a4' class='mouseoverHref'>Alvarez, B. & Hooper, J.N.A. 2011. Taxonomic revision of the order Halichondrida (Porifera: Demospongiae) of northern Australia. Family Halichondriidae.</a> <!--MARK--><!--MARK--><a href='null8adcca9b-ba23-4332-8764-3137d09e3776' class='mouseoverHref'><em>The Beagle, Records of the Museums and Art Galleries of the Northern Territory</em></a> <strong>27</strong>: 55-84<!--MARK-->","","Article in Journal","6f3253e8-95dd-4f38-813d-3f9d7c77f6a4","20111230T10:15:07.671+0000","8adcca9b-ba23-4332-8764-3137d09e3776"
"","","claviformis","Halichondria (Halichondria) claviformis Carter, 1886","HALICHONDRIIDAE","Halichondria","Halichondria","claviformis","","Valid Name","","Species","","Carter","1886","Y","7a8e33c1-84d0-4803-80e1-62b15d0e5680","20210803T02:25:31.270+0000","c3be2a81-18f1-4453-a3ed-8b46bbd07cc1","20220303T02:16:47.770+0000","652258b3-301c-4374-8318-61fea1f76814","c3be2a81-18f1-4453-a3ed-8b46bbd07cc1","","","","","","","","","","","","","","",""
"","","claviformis","Halichondria claviformis Carter, 1886","","Halichondria","","claviformis","","Synonym","synonym","Species","type series composite, excluded syntype to <FA>Phloeodictyidae<FT>","Carter","1886","Y","f12518e5-8f23-4e0b-bb88-d613e3379807","20210803T02:25:31.270+0000","c3be2a81-18f1-4453-a3ed-8b46bbd07cc1","20220303T02:16:47.770+0000","","f6ee1e08-fba2-42cc-af37-1051b27905fd","Carter, H.J.","1886","Supplement to the descriptions of Mr. J. Bracebridge Wilson's Australian sponges","369-379","","Annals and Magazine of Natural History","","","","<!--MARK--><a href='nulled228233-7cd2-48df-b58a-d8482ad0ae50' class='mouseoverHref'>Carter, H.J. 1886. Supplement to the descriptions of Mr. J. Bracebridge Wilson's Australian sponges.</a> <!--MARK--><!--MARK--><a href='nullefa8de69-3a29-4a43-8ef2-cbefda205976' class='mouseoverHref'><em>Annals and Magazine of Natural History</em></a> 5 <strong>18</strong>: 369-379<!--MARK-->","","Article in Journal","ed228233-7cd2-48df-b58a-d8482ad0ae50","20081009T05:11:37.000+0000","efa8de69-3a29-4a43-8ef2-cbefda205976"
"","","darwinensis","Halichondria (Halichondria) darwinensis Hooper, Cook, Hobbs & Kennedy, 1997","HALICHONDRIIDAE","Halichondria","Halichondria","darwinensis","","Valid Name","","Species","","Hooper, Cook, Hobbs & Kennedy","1997","Y","b9559b47-cef9-41d2-878b-2628a2bd5c9a","20210803T02:25:31.270+0000","2bc563a4-fd79-4313-9174-ce38dd3713b0","20220303T02:16:47.770+0000","652258b3-301c-4374-8318-61fea1f76814","2bc563a4-fd79-4313-9174-ce38dd3713b0","","","","","","","","","","","","","","",""
"","","darwinensis","Halichondria darwinensis Hooper, Cook, Hobbs & Kennedy, 1997","","Halichondria","","darwinensis","","Synonym","synonym","Species","","Hooper, Cook, Hobbs & Kennedy","1997","Y","19f7350a-635a-4378-ad18-f2d027bd0399","20210803T02:25:31.270+0000","2bc563a4-fd79-4313-9174-ce38dd3713b0","20220303T02:16:47.770+0000","","5f2540c0-202c-4c4d-9ed0-2507c6fc48a1","Hooper, J.N.A., Cook, S.D., Hobbs, L.J. & Kennedy, J.A.","1997","Australian Halichondriidae (Porifera: Demospongiae): I. Species from the Beagle Gulf","1-65","The Marine Flora and Fauna of Darwin Harbour, Northern Territory, Australia. Proceedings of the Sixth International  Marine Biology Workshop","","","","","<!--MARK--><a href='null80111c47-5e06-494d-8450-51ae3c6160b9' class='mouseoverHref'>Hooper, J.N.A., Cook, S.D., Hobbs, L.J. & Kennedy, J.A. 1997. Australian Halichondriidae (Porifera: Demospongiae): I. Species from the Beagle Gulf. pp. 1-65</a> <!--MARK--><em>in</em> <!--MARK--><a href='null70752299-3f11-4a85-baa1-80f42f74ab4c' class='mouseoverHref'>Hanley, H.R., Caswell, G., Megirian, D. & Larson, H.K. (eds). <em>The Marine Flora and Fauna of Darwin Harbour, Northern Territory, Australia. Proceedings of the Sixth International  Marine Biology Workshop</em>. Darwin : Museum and Art Gallery of the Northern Territory 466 pp.</a><!--MARK-->","","Chapter in Book","80111c47-5e06-494d-8450-51ae3c6160b9","20081009T05:11:37.000+0000","70752299-3f11-4a85-baa1-80f42f74ab4c"
"","","latrunculioides","Halichondria (Halichondria) latrunculioides Ridley & Dendy, 1886","HALICHONDRIIDAE","Halichondria","Halichondria","latrunculioides","","Valid Name","","Species","","Ridley & Dendy","1886","Y","f8a542bb-81f3-49c5-ad45-21181f4d7bd5","20210803T02:25:31.270+0000","02ae08b6-3a50-4e6c-a034-8c04f425981b","20220303T02:16:47.770+0000","652258b3-301c-4374-8318-61fea1f76814","02ae08b6-3a50-4e6c-a034-8c04f425981b","","","","","","","","","","","","","","",""
"","","latrunculioides","Halichondria latrunculioides Ridley & Dendy, 1886","","Halichondria","","latrunculioides","","Synonym","synonym","Species","","Ridley & Dendy","1886","Y","5c7c53f7-ac68-48b8-9c7d-c5933fe48091","20210803T02:25:31.270+0000","02ae08b6-3a50-4e6c-a034-8c04f425981b","20220303T02:16:47.770+0000","","9ba92ad6-e534-4efd-86e7-1188f1d9a7b0","Ridley, S.O. & Dendy, A.","1886","Preliminary report on the Monaxonida collected by H.M.S. <i>Challenger</i>","325-351, 470-493","","Annals and Magazine of Natural History","","","","<!--MARK--><a href='null5c445270-340b-4e66-b6ac-20ccbbfd56d8' class='mouseoverHref'>Ridley, S.O. & Dendy, A. 1886. Preliminary report on the Monaxonida collected by H.M.S. <i>Challenger</i>.</a> <!--MARK--><!--MARK--><a href='nullefa8de69-3a29-4a43-8ef2-cbefda205976' class='mouseoverHref'><em>Annals and Magazine of Natural History</em></a> 5 <strong>18</strong>: 325-351, 470-493<!--MARK-->","","Article in Journal","5c445270-340b-4e66-b6ac-20ccbbfd56d8","20081009T05:11:37.000+0000","efa8de69-3a29-4a43-8ef2-cbefda205976"
"","","lycopodium","Halichondria (Halichondria) lycopodium (Esper, 1794)","HALICHONDRIIDAE","Halichondria","Halichondria","lycopodium","","Valid Name","","Species","","Esper","1794","N","17e28577-7d83-4286-8024-48c44b9536a3","20210803T02:25:31.270+0000","8cf3b1de-752a-4d9c-bbae-8d457afbbb77","20220303T02:16:47.770+0000","652258b3-301c-4374-8318-61fea1f76814","8cf3b1de-752a-4d9c-bbae-8d457afbbb77","","","","","","","","","","","","","","",""
"","","lycopodium","Spongia lycopodium Esper, 1794","","Spongia","","lycopodium","","Synonym","synonym","Species","","Esper","1794","Y","18ae140c-0a9b-4391-9137-f281fa208fde","20210803T02:25:31.270+0000","8cf3b1de-752a-4d9c-bbae-8d457afbbb77","20220303T02:16:47.770+0000","","","","","","","","","","","","","","","","",""
"","","symbiotica","Halichondria symbiotica Lévi, 1961","","Halichondria","","symbiotica","","Synonym","synonym","Species","","Lévi","1961","Y","7224e20e-7bf2-44ac-b2fd-5e52d2035306","20210803T02:25:31.270+0000","8cf3b1de-752a-4d9c-bbae-8d457afbbb77","20220303T02:16:47.770+0000","","3d9b6c4e-d260-4d63-892b-d6dcf5d4de82","Lévi, C.","1961","Eponges intercotidales de Nha Trang (Viet Nam)","127-150 pls 1, 2","","Archives de Zoologie Expérimentale et Générale","","","","<!--MARK--><a href='null7ec9190d-2c2c-4c3a-987c-2453be52fba4' class='mouseoverHref'>Lévi, C. 1961. Eponges intercotidales de Nha Trang (Viet Nam).</a> <!--MARK--><!--MARK--><a href='null1ee9e2fd-e394-4e8a-bdac-59c249e54978' class='mouseoverHref'><em>Archives de Zoologie Expérimentale et Générale</em></a> <strong>100</strong>(2): 127-150 pls 1, 2<!--MARK-->","","Article in Journal","7ec9190d-2c2c-4c3a-987c-2453be52fba4","20081009T05:11:37.000+0000","1ee9e2fd-e394-4e8a-bdac-59c249e54978"
"","","mollissima","Halichondria (Halichondria) mollissima (Lendenfeld, 1887)","HALICHONDRIIDAE","Halichondria","Halichondria","mollissima","","Valid Name","","Species","","Lendenfeld","1887","N","846ad55d-4531-42df-a955-6ff6ac2b79c0","20210803T02:25:31.270+0000","a7ac0ac1-49ce-43ca-a671-2a1f19baedf1","20220303T02:16:47.770+0000","652258b3-301c-4374-8318-61fea1f76814","a7ac0ac1-49ce-43ca-a671-2a1f19baedf1","","","","","","","","","","","","","","",""
"","","mollissima","Cacochalina truncatella mollissima Lendenfeld, 1887","","Cacochalina","","truncatella","mollissima","Synonym","synonym","Species","","Lendenfeld","1887","Y","e6323ffb-bf45-4ebb-b2cd-21ad1c209308","20210803T02:25:31.270+0000","a7ac0ac1-49ce-43ca-a671-2a1f19baedf1","20220303T02:16:47.770+0000","","713678c8-ddc3-4642-83db-913e2afc2017","Lendenfeld, R. von","1887","Die Chalineen des australischen Gebietes","723-828 pls 18-26, 28","","Zoologische Jahrbücher","","","","<!--MARK--><a href='nullc70af5dc-e3c9-450e-976f-7ae94a4c6e3f' class='mouseoverHref'>Lendenfeld, R. von 1887. Die Chalineen des australischen Gebietes.</a> <!--MARK--><!--MARK--><a href='nullf04e1683-5b63-4a96-a101-87347c8a22ce' class='mouseoverHref'><em>Zoologische Jahrbücher</em></a> Syst. <strong>2</strong>: 723-828 pls 18-26, 28<!--MARK-->","","Article in Journal","c70af5dc-e3c9-450e-976f-7ae94a4c6e3f","20081009T05:11:37.000+0000","f04e1683-5b63-4a96-a101-87347c8a22ce"
"","","nigrocutis","Halichondria (Halichondria) nigrocutis (Carter, 1886)","HALICHONDRIIDAE","Halichondria","Halichondria","nigrocutis","","Valid Name","","Species","","Carter","1886","N","c31b5e8a-c6a2-49bd-b944-6c40bead2f0e","20210803T02:25:31.270+0000","c8a6ab12-7ad2-4001-a98e-10ac176a8294","20220303T02:16:47.770+0000","652258b3-301c-4374-8318-61fea1f76814","c8a6ab12-7ad2-4001-a98e-10ac176a8294","","","","","","","","","","","","","","",""
