"CAVS_CODE","CAAB_CODE","NAMES_VARIOUS","SCIENTIFIC_NAME","FAMILY","GENUS","SUBGENUS","SPECIES","SUBSPECIES","NAME_TYPE","NAME_SUBTYPE","RANK","QUALIFICATION","AUTHOR","YEAR","ORIG_COMBINATION","NAME_GUID","NAME_LAST_UPDATE","TAXON_GUID","TAXON_LAST_UPDATE","PARENT_TAXON_GUID","CONCEPT_GUID","PUB_PUB_AUTHOR","PUB_PUB_YEAR","PUB_PUB_TITLE","PUB_PUB_PAGES","PUB_PUB_PARENT_BOOK_TITLE","PUB_PUB_PARENT_JOURNAL_TITLE","PUB_PUB_PARENT_ARTICLE_TITLE","PUB_PUB_PUBLICATION_DATE","PUB_PUB_PUBLISHER","PUB_PUB_FORMATTED","PUB_PUB_QUALIFICATION","PUB_PUB_TYPE","PUBLICATION_GUID","PUBLICATION_LAST_UPDATE","PARENT_PUBLICATION_GUID"
"","","donatioides","Laxosuberites proteus donatioides Hentschel, 1909","","Laxosuberites","","proteus","donatioides","Synonym","synonym","Species","","Hentschel","1909","Y","10413a36-1118-4080-851a-56e7252e79b3","20210803T02:25:31.270+0000","fa9f85f1-0c81-4fa0-9945-741a42043107","20220303T02:16:47.770+0000","","7bce1643-c6b9-4a98-a136-32003af02d35","Hentschel, E.","1909","Tetraxonida","347-402 pls 22-23 1. Teil.","Die Fauna Südwest-Australiens","","","","","<!--MARK--><a href='nullad606030-5bb2-48fa-9e1a-f2618ed74014' class='mouseoverHref'>Hentschel, E. 1909. Tetraxonida. 347-402 pls 22-23 1. Teil.</a> <!--MARK--><em>in</em> <!--MARK--><a href='nullbf830cc7-98f5-419a-a55c-b96b3e5d0ad2' class='mouseoverHref'>Michaelsen, W. & Hartmeyer, R. (eds). <em>Die Fauna Südwest-Australiens</em>. Jena : G. Fischer Vol. 2 (21).</a><!--MARK-->","","Chapter in Book","ad606030-5bb2-48fa-9e1a-f2618ed74014","20081009T05:11:37.000+0000","bf830cc7-98f5-419a-a55c-b96b3e5d0ad2"
"","","tectulum","Laxosuberites proteus tectulum Hentschel, 1909","","Laxosuberites","","proteus","tectulum","Synonym","synonym","Species","","Hentschel","1909","Y","d40afc6b-3528-429a-a987-1109dcfa34f7","20210803T02:25:31.270+0000","fa9f85f1-0c81-4fa0-9945-741a42043107","20220303T02:16:47.770+0000","","137aa742-6359-4120-b7f4-db8ad434d423","Hentschel, E.","1909","Tetraxonida","347-402 pls 22-23 1. Teil.","Die Fauna Südwest-Australiens","","","","","<!--MARK--><a href='nullad606030-5bb2-48fa-9e1a-f2618ed74014' class='mouseoverHref'>Hentschel, E. 1909. Tetraxonida. 347-402 pls 22-23 1. Teil.</a> <!--MARK--><em>in</em> <!--MARK--><a href='nullbf830cc7-98f5-419a-a55c-b96b3e5d0ad2' class='mouseoverHref'>Michaelsen, W. & Hartmeyer, R. (eds). <em>Die Fauna Südwest-Australiens</em>. Jena : G. Fischer Vol. 2 (21).</a><!--MARK-->","","Chapter in Book","ad606030-5bb2-48fa-9e1a-f2618ed74014","20081009T05:11:37.000+0000","bf830cc7-98f5-419a-a55c-b96b3e5d0ad2"
"","","rigida","Hymeniacidon rigida Dendy, 1897","HALICHONDRIIDAE","Hymeniacidon","","rigida","","Valid Name","","Species","","Dendy","1897","Y","af9e7b31-bea3-4e59-ac65-df0ae6e404a1","20210803T02:25:31.270+0000","18447919-92b0-4324-863f-bafef18dda70","20220303T02:16:47.770+0000","505fff7e-661c-410e-ab33-2c9f38e1db24","18447919-92b0-4324-863f-bafef18dda70","","","","","","","","","","","","","","",""
"","","rigida","Hymeniacidon rigida Dendy, 1897","","Hymeniacidon","","rigida","","Synonym","synonym","Species","","Dendy","1897","Y","8d06528a-704f-4828-a747-1323b8f7676a","20210803T02:25:31.270+0000","18447919-92b0-4324-863f-bafef18dda70","20220303T02:16:47.770+0000","","19b615cc-ff03-4a83-81e3-cadcaf6f08b9","Dendy, A.","1897","Catalogue of non-calcareous sponges collected by J. Bracebridge Wilson, Esq., M.A., in the neighbourhood of Port Phillip Heads. Part 3","230-259","","Proceedings of the Royal Society of Victoria","","","","<!--MARK--><a href='null609dcc51-e1b7-4d24-9492-3b447cc87f42' class='mouseoverHref'>Dendy, A. 1897. Catalogue of non-calcareous sponges collected by J. Bracebridge Wilson, Esq., M.A., in the neighbourhood of Port Phillip Heads. Part 3.</a> <!--MARK--><!--MARK--><a href='nullce333794-3a02-427f-ba27-346079f1efa0' class='mouseoverHref'><em>Proceedings of the Royal Society of Victoria</em></a> ns <strong>9</strong>: 230-259<!--MARK-->","","Article in Journal","609dcc51-e1b7-4d24-9492-3b447cc87f42","20081009T05:11:37.000+0000","ce333794-3a02-427f-ba27-346079f1efa0"
"","","victoriana","Hymeniacidon victoriana Hallmann, 1914","","Hymeniacidon","","victoriana","","Synonym","synonym","Species","unnecessary <I>nom. nov.</I> for <I>Hymeniacidon rigida</I> Dendy, 1897","Hallmann","1914","Y","f28b24e0-c907-4a6a-a25c-09ff1fc5218a","20210803T02:25:31.270+0000","18447919-92b0-4324-863f-bafef18dda70","20220303T02:16:47.770+0000","","2acc44df-91a1-43ee-b407-93f32208cfb8","Hallmann, E.F.","1914","A revision of the monaxonid species described as new in Lendenfeld's 'Catalogue of the sponges in the Australian Museum'","327-376 12 figs","","Proceedings of the Linnean Society of New South Wales","","","","<!--MARK--><a href='null80f818c2-2936-49f8-895f-2774ca2e69e8' class='mouseoverHref'>Hallmann, E.F. 1914. A revision of the monaxonid species described as new in Lendenfeld's 'Catalogue of the sponges in the Australian Museum'.</a> <!--MARK--><!--MARK--><a href='nullc12cd779-adb5-41ea-bd2c-75f6864cf22e' class='mouseoverHref'><em>Proceedings of the Linnean Society of New South Wales</em></a> <strong>39</strong>(Part 2): 327-376 12 figs<!--MARK-->","","Article in Journal","80f818c2-2936-49f8-895f-2774ca2e69e8","20160725T00:42:04.082+0000","c12cd779-adb5-41ea-bd2c-75f6864cf22e"
"","","scariola","Hymeniacidon scariola (Lamarck, 1814)","HALICHONDRIIDAE","Hymeniacidon","","scariola","","Valid Name","","Species","","Lamarck","1814","N","ad50b9fc-6d0d-41e8-9c97-9444553c4d31","20210803T02:25:31.270+0000","22312b1c-336b-460a-a409-16ab469c69ea","20220303T02:16:47.770+0000","505fff7e-661c-410e-ab33-2c9f38e1db24","22312b1c-336b-460a-a409-16ab469c69ea","","","","","","","","","","","","","","",""
"","","scariola","Spongia scariola Lamarck, 1814","","Spongia","","scariola","","Synonym","synonym","Species","","Lamarck","1814","Y","071825d8-3881-4caa-b5c0-4d64d7c93707","20210803T02:25:31.270+0000","22312b1c-336b-460a-a409-16ab469c69ea","20220303T02:16:47.770+0000","","80f3aa57-32db-4490-9a8b-ca8ae5889634","Lamarck, J.B.P.A. de Monet","1814","Sur les polypiers empâtés","294-312, 370-386, 432-458","","Annales du Muséum National d'Histoire Naturelle. Paris","","","","<!--MARK--><a href='nulle687a75e-a3eb-423f-88ea-540d03003250' class='mouseoverHref'>Lamarck, J.B.P.A. de Monet 1814. Sur les polypiers empâtés.</a> <!--MARK--><!--MARK--><a href='null8d3d82c3-0c66-4fc1-8699-44a0527a52d9' class='mouseoverHref'><em>Annales du Muséum National d'Histoire Naturelle. Paris</em></a> <strong>20</strong>: 294-312, 370-386, 432-458<!--MARK-->","","Article in Journal","e687a75e-a3eb-423f-88ea-540d03003250","20140916T04:54:45.110+0000","8d3d82c3-0c66-4fc1-8699-44a0527a52d9"
"","","torquata","Hymeniacidon torquata Topsent, 1917","HALICHONDRIIDAE","Hymeniacidon","","torquata","","Valid Name","","Species","","Topsent","1917","Y","567c2228-77fd-4cfb-b3d3-3b1ff6040a5f","20210803T02:25:31.270+0000","8981a45d-19e3-4d0b-8a99-534023a05a02","20220303T02:16:47.770+0000","505fff7e-661c-410e-ab33-2c9f38e1db24","8981a45d-19e3-4d0b-8a99-534023a05a02","","","","","","","","","","","","","","",""
"","","torquata","Hymeniacidon torquata Topsent, 1917","","Hymeniacidon","","torquata","","Synonym","synonym","Species","","Topsent","1917","Y","a5bd7b8a-3ed0-4136-8b07-560e337fa72c","20210803T02:25:31.270+0000","8981a45d-19e3-4d0b-8a99-534023a05a02","20220303T02:16:47.770+0000","","189679f9-b152-4c3a-9932-92f92b0a5264","Topsent, E.","1917","Spongiaires","1-88 6 pls","Deuxième Expédition Antarctique Française (1908-1910) commandée par le Dr. Jean Charcot","","","","","<!--MARK--><a href='nullb4cc46c3-c446-44f9-8041-3aa244486092' class='mouseoverHref'>Topsent, E. 1917. Spongiaires. 1-88 6 pls</a> <!--MARK--><em>in</em> <!--MARK--><a href='nulld77d08b4-1d73-4448-9e17-56256796e53b' class='mouseoverHref'>Joubin, L. (ed.). <em>Deuxième Expédition Antarctique Française (1908-1910) commandée par le Dr. Jean Charcot</em>. Paris : Masson.</a><!--MARK-->","","Chapter in Book","b4cc46c3-c446-44f9-8041-3aa244486092","20081009T05:11:37.000+0000","d77d08b4-1d73-4448-9e17-56256796e53b"
"","","Topsentia","Topsentia Berg, 1899","HALICHONDRIIDAE","Topsentia","","","","Valid Name","","Genus","","Berg","1899","Y","d47646a5-1e7b-4366-b085-bede1d3b6007","20210803T02:25:31.270+0000","4453efcb-e25c-4b8a-beba-fa6a44e88649","20220303T02:16:47.770+0000","7ce1391a-b562-4925-8d1e-290df8a79d02","4453efcb-e25c-4b8a-beba-fa6a44e88649","","","","","","","","","","","","","","",""
"","","[Anisoxya]","[Anisoxya] Topsent, 1898","","[Anisoxya]","","","","Synonym","synonym","Genus","junior homonym of <I>Anisoxya </I>Mulsant, 1856 (Coleoptera)","Topsent","1898","Y","dcf7dccc-209e-4ca1-888c-87920a69f84d","20210803T02:25:31.270+0000","4453efcb-e25c-4b8a-beba-fa6a44e88649","20220303T02:16:47.770+0000","","f90a4e5f-39a4-4932-b78a-17accc1bfe1b","Topsent, E.","1898","Eponges nouvelles des Açores (première série)","225-255","","Mémoires de la Société Zoologique de France","","","","<!--MARK--><a href='nullb75afcb4-ee1f-4d4e-8724-c9ca2b80f4a2' class='mouseoverHref'>Topsent, E. 1898. Eponges nouvelles des Açores (première série).</a> <!--MARK--><!--MARK--><a href='nulla552236b-f9a6-427c-8084-4d203a8a3d1b' class='mouseoverHref'><em>Mémoires de la Société Zoologique de France</em></a> <strong>11</strong>: 225-255<!--MARK-->","","Article in Journal","b75afcb4-ee1f-4d4e-8724-c9ca2b80f4a2","20081009T05:11:37.000+0000","a552236b-f9a6-427c-8084-4d203a8a3d1b"
"","","Topsentia","Topsentia Berg, 1899","","Topsentia","","","","Synonym","synonym","Genus","","Berg","1899","Y","6930d10e-4edc-42c8-8bf3-17dd5ddd00e4","20210803T02:25:31.270+0000","4453efcb-e25c-4b8a-beba-fa6a44e88649","20220303T02:16:47.770+0000","","4d405d26-c2fe-4d62-9550-552aa71f4abd","Berg, C.","1899","Substitucion de nombres genericos. III","77-80","","Comunicaciones del Museo Nacional de Buenos Aires","","","","<!--MARK--><a href='nulld736c9b2-4446-48ef-9ede-c2eb2cb35f13' class='mouseoverHref'>Berg, C. 1899. Substitucion de nombres genericos. III.</a> <!--MARK--><!--MARK--><a href='null1e609368-14bd-44d4-8a1f-a3c7b37607d1' class='mouseoverHref'><em>Comunicaciones del Museo Nacional de Buenos Aires</em></a> <strong>1</strong>: 77-80<!--MARK-->","","Article in Journal","d736c9b2-4446-48ef-9ede-c2eb2cb35f13","20140917T01:23:57.709+0000","1e609368-14bd-44d4-8a1f-a3c7b37607d1"
"","","Trachyopsis","Trachyopsis Dendy, 1905","","Trachyopsis","","","","Synonym","synonym","Genus","","Dendy","1905","Y","1f24019c-2546-4c5d-b79f-0cd95f2694aa","20210803T02:25:31.270+0000","4453efcb-e25c-4b8a-beba-fa6a44e88649","20220303T02:16:47.770+0000","","e843fd97-e727-45f4-adab-7607f4baad5b","Dendy, A.","1905","Report on the sponges collected by Professor Herdman, at Ceylon, in 1902","57-246 pls 1-16","Report to the Government of Ceylon on the Pearl Oyster Fisheries of the Gulf of Manaar","","","","","<!--MARK--><a href='null1aa46ebe-e87b-4408-8cfe-3c2a95e2fbb2' class='mouseoverHref'>Dendy, A. 1905. Report on the sponges collected by Professor Herdman, at Ceylon, in 1902. 57-246 pls 1-16</a> <!--MARK--><em>in</em> <!--MARK--><a href='nulle7cd37ed-c88c-4d05-a0f6-c90b49913e56' class='mouseoverHref'>Herdman, W.A. (ed.). <em>Report to the Government of Ceylon on the Pearl Oyster Fisheries of the Gulf of Manaar</em>. London : Royal Society Vol. 3 Suppl. 18.</a><!--MARK-->","","Chapter in Book","1aa46ebe-e87b-4408-8cfe-3c2a95e2fbb2","20081009T05:11:37.000+0000","e7cd37ed-c88c-4d05-a0f6-c90b49913e56"
"","","Oxeostilon","Oxeostilon Ferrer-Hernandez, 1923","","","","","","Synonym","synonym","Genus","","Ferrer-Hernandez","1923","Y","b523ea6a-68d3-42fb-a1d0-f60edf9ef411","20210803T02:25:31.270+0000","4453efcb-e25c-4b8a-beba-fa6a44e88649","20220303T02:16:47.770+0000","","ebf76d5e-f0e2-4a29-866f-c7cc50d64054","Hernandez, F.F.","1923","Mas datos para el conocimiento de las esponjas de las costas espanolas","247-272","","Boletín de Pescas Madrid","","","","<!--MARK--><a href='null427913a4-dbbe-4629-bf99-3dc65c26163d' class='mouseoverHref'>Hernandez, F.F. 1923. Mas datos para el conocimiento de las esponjas de las costas espanolas.</a> <!--MARK--><!--MARK--><a href='null6c2909e1-93da-4334-8b95-50e78f4fc607' class='mouseoverHref'><em>Boletín de Pescas Madrid</em></a> <strong>7</strong>: 247-272<!--MARK-->","","Article in Journal","427913a4-dbbe-4629-bf99-3dc65c26163d","20081009T05:11:37.000+0000","6c2909e1-93da-4334-8b95-50e78f4fc607"
"","","Allosclera","Allosclera Topsent, 1927","","Allosclera","","","","Synonym","synonym","Genus","junior objective synonym of <I>Topsentia </I>Berg, 1899","Topsent","1927","Y","b6726984-5b39-4fa8-98e9-199aa5276678","20210803T02:25:31.270+0000","4453efcb-e25c-4b8a-beba-fa6a44e88649","20220303T02:16:47.770+0000","","6e2c9fd3-8808-48d1-a6bf-60e34826b3d0","Topsent, E.","1927","Diagnoses d'Eponges nouvelles recueillies par le Prince Albert Ier de Monaco","1-19","","Bulletin de l'Institut Océanographique Monaco","","","","<!--MARK--><a href='null72895e1e-8ab9-4f1c-9f06-8549d7fcf77b' class='mouseoverHref'>Topsent, E. 1927. Diagnoses d'Eponges nouvelles recueillies par le Prince Albert Ier de Monaco.</a> <!--MARK--><!--MARK--><a href='null9df4671f-e0a0-49cc-b5f1-c5b125c26f94' class='mouseoverHref'><em>Bulletin de l'Institut Océanographique Monaco</em></a> <strong>502</strong>: 1-19<!--MARK-->","","Article in Journal","72895e1e-8ab9-4f1c-9f06-8549d7fcf77b","20081009T05:11:37.000+0000","9df4671f-e0a0-49cc-b5f1-c5b125c26f94"
"","","Coelocalypta","Coelocalypta Topsent, 1928","","Coelocalypta","","","","Synonym","synonym","Genus","","Topsent","1928","Y","90e40869-7cfc-4e3c-a1a4-6b8f812a6acb","20210803T02:25:31.270+0000","4453efcb-e25c-4b8a-beba-fa6a44e88649","20220303T02:16:47.770+0000","","f52fb68b-980c-4a0b-9961-e255e9fac57e","Topsent, E.","1928","Spongiaires de l'Atlantique et de la Méditerranée provenant des croisières du Prince Albert Ier de Monaco","1-376 11 pls","","Résultats des Campagnes Scientifiques accomplies par le Prince Albert I. Monaco","","","","<!--MARK--><a href='nulld56f41fa-50aa-4401-b7b2-7785add90b60' class='mouseoverHref'>Topsent, E. 1928. Spongiaires de l'Atlantique et de la Méditerranée provenant des croisières du Prince Albert Ier de Monaco.</a> <!--MARK--><!--MARK--><a href='null1a65fcef-ecff-46eb-a991-0bbcda6bd7ae' class='mouseoverHref'><em>Résultats des Campagnes Scientifiques accomplies par le Prince Albert I. Monaco</em></a> <strong>74</strong>: 1-376 11 pls<!--MARK-->","","Article in Journal","d56f41fa-50aa-4401-b7b2-7785add90b60","20081009T05:11:37.000+0000","1a65fcef-ecff-46eb-a991-0bbcda6bd7ae"
"","","Laminospongia","Laminospongia Pulitzer-Finali, 1983","","Laminospongia","","","","Synonym","synonym","Genus","","Pulitzer-Finali","1983","Y","dea948fa-9fb1-4226-8e8f-6fc084915d10","20210803T02:25:31.270+0000","4453efcb-e25c-4b8a-beba-fa6a44e88649","20220303T02:16:47.770+0000","","fcc79dfc-b226-479c-a537-febe3cf9ca7f","Pulitzer-Finali, G.","1983","A collection of Mediterranean Demospongiae (Porifera) with, in appendix, a list of the Demospongiae hitherto recorded from the Mediterranean Sea","445-621","","Annali del Museo Civico di Storia Naturale Giacomo Doria, Genova","","","","<!--MARK--><a href='nulla6d6cdef-8aec-4e59-be07-05990d2f8cef' class='mouseoverHref'>Pulitzer-Finali, G. 1983. A collection of Mediterranean Demospongiae (Porifera) with, in appendix, a list of the Demospongiae hitherto recorded from the Mediterranean Sea.</a> <!--MARK--><!--MARK--><a href='nulld85b9f36-d289-41ce-a8b6-f50087483d67' class='mouseoverHref'><em>Annali del Museo Civico di Storia Naturale Giacomo Doria, Genova</em></a> <strong>84</strong>: 445-621<!--MARK-->","","Article in Journal","a6d6cdef-8aec-4e59-be07-05990d2f8cef","20170407T02:08:06.832+0000","d85b9f36-d289-41ce-a8b6-f50087483d67"
"","","ridleyi","Topsentia ridleyi (Hooper, Cook, Hobbs & Kennedy, 1997)","HALICHONDRIIDAE","Topsentia","","ridleyi","","Valid Name","","Species","","Hooper, Cook, Hobbs & Kennedy","1997","N","f34f90b1-37ea-4e84-a848-4a720a00cdba","20210803T02:25:31.270+0000","068cb70e-6bc2-49cb-b8ea-0a7578a6131c","20220303T02:16:47.770+0000","4453efcb-e25c-4b8a-beba-fa6a44e88649","068cb70e-6bc2-49cb-b8ea-0a7578a6131c","","","","","","","","","","","","","","",""
"","","ridleyi","Halichondria ridleyi Hooper, Cook, Hobbs & Kennedy, 1997","","Halichondria","","ridleyi","","Synonym","synonym","Species","","Hooper, Cook, Hobbs & Kennedy","1997","Y","366a4690-8136-4d19-8c74-40b7c69b39e4","20210803T02:25:31.270+0000","068cb70e-6bc2-49cb-b8ea-0a7578a6131c","20220303T02:16:47.770+0000","","8545dff6-45fa-4d07-ba28-ec246609b0ad","Hooper, J.N.A., Cook, S.D., Hobbs, L.J. & Kennedy, J.A.","1997","Australian Halichondriidae (Porifera: Demospongiae): I. Species from the Beagle Gulf","1-65","The Marine Flora and Fauna of Darwin Harbour, Northern Territory, Australia. Proceedings of the Sixth International  Marine Biology Workshop","","","","","<!--MARK--><a href='null80111c47-5e06-494d-8450-51ae3c6160b9' class='mouseoverHref'>Hooper, J.N.A., Cook, S.D., Hobbs, L.J. & Kennedy, J.A. 1997. Australian Halichondriidae (Porifera: Demospongiae): I. Species from the Beagle Gulf. pp. 1-65</a> <!--MARK--><em>in</em> <!--MARK--><a href='null70752299-3f11-4a85-baa1-80f42f74ab4c' class='mouseoverHref'>Hanley, H.R., Caswell, G., Megirian, D. & Larson, H.K. (eds). <em>The Marine Flora and Fauna of Darwin Harbour, Northern Territory, Australia. Proceedings of the Sixth International  Marine Biology Workshop</em>. Darwin : Museum and Art Gallery of the Northern Territory 466 pp.</a><!--MARK-->","","Chapter in Book","80111c47-5e06-494d-8450-51ae3c6160b9","20081009T05:11:37.000+0000","70752299-3f11-4a85-baa1-80f42f74ab4c"
"","","ridleyi","Topsentia ridleyi (Hooper, Cook, Hobbs & Kennedy, 1997)","","Topsentia","","ridleyi","","Generic Combination","","Species","","Hooper, Cook, Hobbs & Kennedy","1997","N","4d3865c2-66aa-4ebe-bfe0-82b45de4ef8b","20210803T02:25:31.270+0000","068cb70e-6bc2-49cb-b8ea-0a7578a6131c","20220303T02:16:47.770+0000","","6b16a682-ebf8-4ad5-8529-31076aa6978d","Alvarez, B. & Hooper, J.N.A.","2011","Taxonomic revision of the order Halichondrida (Porifera: Demospongiae) of northern Australia. Family Halichondriidae.","55-84","","The Beagle, Records of the Museums and Art Galleries of the Northern Territory","","","","<!--MARK--><a href='null6f3253e8-95dd-4f38-813d-3f9d7c77f6a4' class='mouseoverHref'>Alvarez, B. & Hooper, J.N.A. 2011. Taxonomic revision of the order Halichondrida (Porifera: Demospongiae) of northern Australia. Family Halichondriidae.</a> <!--MARK--><!--MARK--><a href='null8adcca9b-ba23-4332-8764-3137d09e3776' class='mouseoverHref'><em>The Beagle, Records of the Museums and Art Galleries of the Northern Territory</em></a> <strong>27</strong>: 55-84<!--MARK-->","","Article in Journal","6f3253e8-95dd-4f38-813d-3f9d7c77f6a4","20111230T10:15:07.671+0000","8adcca9b-ba23-4332-8764-3137d09e3776"
"","","dura","Topsentia dura (Lindgren, 1897)","HALICHONDRIIDAE","Topsentia","","dura","","Valid Name","","Species","","Lindgren","1897","N","6423ea94-5e25-4d4c-8adc-d2427ab60125","20210803T02:25:31.270+0000","481d6e12-78b4-4d90-96df-a097038b6d51","20220303T02:16:47.770+0000","4453efcb-e25c-4b8a-beba-fa6a44e88649","481d6e12-78b4-4d90-96df-a097038b6d51","","","","","","","","","","","","","","",""
"","","dura","Halichondria dura Lindgren, 1897","","Halichondria","","dura","","Synonym","synonym","Species","","Lindgren","1897","Y","3914e303-cbd6-4fda-b7ab-444364e4fcb3","20210803T02:25:31.270+0000","481d6e12-78b4-4d90-96df-a097038b6d51","20220303T02:16:47.770+0000","","db010d12-4d87-40a0-8604-adec5248db60","Lindgren, N.G.","1897","Beitrag zur Kenntniss der Spongienfauna des Malaiischen Archipels und der Chinesischen Meere","480-487","","Zoologischer Anzeiger","","","","<!--MARK--><a href='null1e0c838b-db6d-4058-8ec7-45c091b5b5c9' class='mouseoverHref'>Lindgren, N.G. 1897. Beitrag zur Kenntniss der Spongienfauna des Malaiischen Archipels und der Chinesischen Meere.</a> <!--MARK--><!--MARK--><a href='null4b894062-2782-48ef-bf96-6997840d9060' class='mouseoverHref'><em>Zoologischer Anzeiger</em></a> <strong>20</strong>: 480-487<!--MARK-->","","Article in Journal","1e0c838b-db6d-4058-8ec7-45c091b5b5c9","20081009T05:11:37.000+0000","4b894062-2782-48ef-bf96-6997840d9060"
"","","dura","Topsentia dura (Lindgren, 1897)","","Topsentia","","dura","","Generic Combination","","Species","","Lindgren","1897","N","e91230ff-808a-4490-b330-6f3c0f983a4b","20210803T02:25:31.270+0000","481d6e12-78b4-4d90-96df-a097038b6d51","20220303T02:16:47.770+0000","","22c09cc4-9c58-4fc2-8ab7-02f953df6a60","Hooper, J.N.A., Cook, S.D., Hobbs, L.J. & Kennedy, J.A.","1997","Australian Halichondriidae (Porifera: Demospongiae): I. Species from the Beagle Gulf","1-65","The Marine Flora and Fauna of Darwin Harbour, Northern Territory, Australia. Proceedings of the Sixth International  Marine Biology Workshop","","","","","<!--MARK--><a href='null80111c47-5e06-494d-8450-51ae3c6160b9' class='mouseoverHref'>Hooper, J.N.A., Cook, S.D., Hobbs, L.J. & Kennedy, J.A. 1997. Australian Halichondriidae (Porifera: Demospongiae): I. Species from the Beagle Gulf. pp. 1-65</a> <!--MARK--><em>in</em> <!--MARK--><a href='null70752299-3f11-4a85-baa1-80f42f74ab4c' class='mouseoverHref'>Hanley, H.R., Caswell, G., Megirian, D. & Larson, H.K. (eds). <em>The Marine Flora and Fauna of Darwin Harbour, Northern Territory, Australia. Proceedings of the Sixth International  Marine Biology Workshop</em>. Darwin : Museum and Art Gallery of the Northern Territory 466 pp.</a><!--MARK-->","","Chapter in Book","80111c47-5e06-494d-8450-51ae3c6160b9","20081009T05:11:37.000+0000","70752299-3f11-4a85-baa1-80f42f74ab4c"
"","","halichondrioides","Topsentia halichondrioides (Dendy, 1905)","HALICHONDRIIDAE","Topsentia","","halichondrioides","","Valid Name","","Species","","Dendy","1905","N","f38c2184-0661-4360-a27f-2ea17d0d3873","20210803T02:25:31.270+0000","591d9a49-0f42-4a9c-9429-6597df557319","20220303T02:16:47.770+0000","4453efcb-e25c-4b8a-beba-fa6a44e88649","591d9a49-0f42-4a9c-9429-6597df557319","","","","","","","","","","","","","","",""
"","","halichondrioides","Trachyopsis halichondrioides Dendy, 1905","","Trachyopsis","","halichondrioides","","Synonym","synonym","Species","","Dendy","1905","Y","0d1f5907-949d-4f87-b8b6-d72e2c22fb96","20210803T02:25:31.270+0000","591d9a49-0f42-4a9c-9429-6597df557319","20220303T02:16:47.770+0000","","38601e2d-b717-4866-9010-915bbd5e0d2d","Dendy, A.","1905","Report on the sponges collected by Professor Herdman, at Ceylon, in 1902","57-246 pls 1-16","Report to the Government of Ceylon on the Pearl Oyster Fisheries of the Gulf of Manaar","","","","","<!--MARK--><a href='null1aa46ebe-e87b-4408-8cfe-3c2a95e2fbb2' class='mouseoverHref'>Dendy, A. 1905. Report on the sponges collected by Professor Herdman, at Ceylon, in 1902. 57-246 pls 1-16</a> <!--MARK--><em>in</em> <!--MARK--><a href='nulle7cd37ed-c88c-4d05-a0f6-c90b49913e56' class='mouseoverHref'>Herdman, W.A. (ed.). <em>Report to the Government of Ceylon on the Pearl Oyster Fisheries of the Gulf of Manaar</em>. London : Royal Society Vol. 3 Suppl. 18.</a><!--MARK-->","","Chapter in Book","1aa46ebe-e87b-4408-8cfe-3c2a95e2fbb2","20081009T05:11:37.000+0000","e7cd37ed-c88c-4d05-a0f6-c90b49913e56"
"","","solida","Topsentia solida (Ridley & Dendy, 1886)","HALICHONDRIIDAE","Topsentia","","solida","","Valid Name","","Species","","Ridley & Dendy","1886","N","cac42697-4f07-49e4-b21f-747f57cd2e7b","20210803T02:25:31.270+0000","ed1a39a8-adfc-4fec-9990-aea25fe6d995","20220303T02:16:47.770+0000","4453efcb-e25c-4b8a-beba-fa6a44e88649","ed1a39a8-adfc-4fec-9990-aea25fe6d995","","","","","","","","","","","","","","",""
"","","rugosa","Halichondria solida rugosa Ridley & Dendy, 1886","","Halichondria","","solida","rugosa","Synonym","synonym","Species","","Ridley & Dendy","1886","Y","b1e9eeaa-bc4d-445b-8e3a-d37bd5908b04","20210803T02:25:31.270+0000","ed1a39a8-adfc-4fec-9990-aea25fe6d995","20220303T02:16:47.770+0000","","e47f8d0e-21f7-436d-92ff-7660dd555b2c","Ridley, S.O. & Dendy, A.","1886","Preliminary report on the Monaxonida collected by H.M.S. <i>Challenger</i>","325-351, 470-493","","Annals and Magazine of Natural History","","","","<!--MARK--><a href='null5c445270-340b-4e66-b6ac-20ccbbfd56d8' class='mouseoverHref'>Ridley, S.O. & Dendy, A. 1886. Preliminary report on the Monaxonida collected by H.M.S. <i>Challenger</i>.</a> <!--MARK--><!--MARK--><a href='nullefa8de69-3a29-4a43-8ef2-cbefda205976' class='mouseoverHref'><em>Annals and Magazine of Natural History</em></a> 5 <strong>18</strong>: 325-351, 470-493<!--MARK-->","","Article in Journal","5c445270-340b-4e66-b6ac-20ccbbfd56d8","20081009T05:11:37.000+0000","efa8de69-3a29-4a43-8ef2-cbefda205976"
"","","solida","Halichondria solida Ridley & Dendy, 1886","","Halichondria","","solida","","Synonym","synonym","Species","","Ridley & Dendy","1886","Y","044125a0-8ff3-4a30-a8e6-beb296318b7a","20210803T02:25:31.270+0000","ed1a39a8-adfc-4fec-9990-aea25fe6d995","20220303T02:16:47.770+0000","","5ae21c58-5ee1-47f5-bc5b-af6f6fdff8e0","Ridley, S.O. & Dendy, A.","1886","Preliminary report on the Monaxonida collected by H.M.S. <i>Challenger</i>","325-351, 470-493","","Annals and Magazine of Natural History","","","","<!--MARK--><a href='null5c445270-340b-4e66-b6ac-20ccbbfd56d8' class='mouseoverHref'>Ridley, S.O. & Dendy, A. 1886. Preliminary report on the Monaxonida collected by H.M.S. <i>Challenger</i>.</a> <!--MARK--><!--MARK--><a href='nullefa8de69-3a29-4a43-8ef2-cbefda205976' class='mouseoverHref'><em>Annals and Magazine of Natural History</em></a> 5 <strong>18</strong>: 325-351, 470-493<!--MARK-->","","Article in Journal","5c445270-340b-4e66-b6ac-20ccbbfd56d8","20081009T05:11:37.000+0000","efa8de69-3a29-4a43-8ef2-cbefda205976"
