"CAVS_CODE","CAAB_CODE","NAMES_VARIOUS","SCIENTIFIC_NAME","FAMILY","GENUS","SUBGENUS","SPECIES","SUBSPECIES","NAME_TYPE","NAME_SUBTYPE","RANK","QUALIFICATION","AUTHOR","YEAR","ORIG_COMBINATION","NAME_GUID","NAME_LAST_UPDATE","TAXON_GUID","TAXON_LAST_UPDATE","PARENT_TAXON_GUID","CONCEPT_GUID","PUB_PUB_AUTHOR","PUB_PUB_YEAR","PUB_PUB_TITLE","PUB_PUB_PAGES","PUB_PUB_PARENT_BOOK_TITLE","PUB_PUB_PARENT_JOURNAL_TITLE","PUB_PUB_PARENT_ARTICLE_TITLE","PUB_PUB_PUBLICATION_DATE","PUB_PUB_PUBLISHER","PUB_PUB_FORMATTED","PUB_PUB_QUALIFICATION","PUB_PUB_TYPE","PUBLICATION_GUID","PUBLICATION_LAST_UPDATE","PARENT_PUBLICATION_GUID"
"","","SUBERITIDA","SUBERITIDA Chombard & Boury-Esnault, 1999","","","","","","Valid Name","","Order","","Chombard & Boury-Esnault","1999","Y","4039a5e0-17b9-478c-9d53-71fadff4f25b","20210803T02:25:31.270+0000","3e559f64-9d11-40af-a47f-e89eb800f64a","20220303T02:16:47.770+0000","004248df-8fae-44fb-9ea3-b2339251062c","3e559f64-9d11-40af-a47f-e89eb800f64a","","","","","","","","","","","","","","",""
"","","HALICHONDRIIDAE","HALICHONDRIIDAE Gray, 1867","HALICHONDRIIDAE","","","","","Valid Name","","Family","","Gray","1867","Y","e8eca03c-8032-4495-844f-2f923830df77","20210803T02:25:31.270+0000","7ce1391a-b562-4925-8d1e-290df8a79d02","20220303T02:16:47.770+0000","3e559f64-9d11-40af-a47f-e89eb800f64a","7ce1391a-b562-4925-8d1e-290df8a79d02","","","","","","","","","","","","","","",""
"","","Amorphinopsis","Amorphinopsis Carter, 1887","HALICHONDRIIDAE","Amorphinopsis","","","","Valid Name","","Genus","","Carter","1887","Y","e675ca95-dd13-43a3-a93e-0763768685f3","20210803T02:25:31.270+0000","515b86c9-ca05-4a76-9574-494aa8e0151f","20220303T02:16:47.770+0000","7ce1391a-b562-4925-8d1e-290df8a79d02","515b86c9-ca05-4a76-9574-494aa8e0151f","","","","","","","","","","","","","","",""
"","","Amorphinopsis","Amorphinopsis Carter, 1887","","Amorphinopsis","","","","Synonym","synonym","Genus","","Carter","1887","Y","502a38b1-5098-445d-9375-cf732157f462","20210803T02:25:31.270+0000","515b86c9-ca05-4a76-9574-494aa8e0151f","20220303T02:16:47.770+0000","","055de986-2c47-4284-adea-5c9648e27004","Carter, H.J.","1887","Report on the marine sponges, chiefly from King Island in the Mergui Archipelago, collected for the Trustees of the Indian Museum, Calcutta, by Dr John Anderson","61-84 pls 5-7","","Journal of the Linnean Society of London, Zoology","","","","<!--MARK--><a href='null18366cff-23f3-49f5-9499-0860692e79f7' class='mouseoverHref'>Carter, H.J. 1887. Report on the marine sponges, chiefly from King Island in the Mergui Archipelago, collected for the Trustees of the Indian Museum, Calcutta, by Dr John Anderson.</a> <!--MARK--><!--MARK--><a href='null9da0901d-c795-4d2c-b9ad-d6a85cdf1cce' class='mouseoverHref'><em>Journal of the Linnean Society of London, Zoology</em></a> Zool. <strong>21</strong>: 61-84 pls 5-7<!--MARK-->","","Article in Journal","18366cff-23f3-49f5-9499-0860692e79f7","20081009T05:11:37.000+0000","9da0901d-c795-4d2c-b9ad-d6a85cdf1cce"
"","","[Migas]","[Migas] Sollas, 1908","","[Migas]","","","","Synonym","synonym","Genus","junior homonym of <I>Migas </I>Koch, 1873 (Arachnida)","Sollas","1908","Y","f1eb1ea9-9fb0-488c-aa68-c03357124313","20210803T02:25:31.270+0000","515b86c9-ca05-4a76-9574-494aa8e0151f","20220303T02:16:47.770+0000","","01319880-44cc-4717-aab9-e6abb7661590","Sollas, I.B.G.","1908","The inclusion of foreign bodies by sponges, with a description of a new genus and species of Monaxonida","395-401","","Annals and Magazine of Natural History","","","","<!--MARK--><a href='null32b08d60-ce38-4c6e-9c5c-b018f51786e6' class='mouseoverHref'>Sollas, I.B.G. 1908. The inclusion of foreign bodies by sponges, with a description of a new genus and species of Monaxonida.</a> <!--MARK--><!--MARK--><a href='nullefa8de69-3a29-4a43-8ef2-cbefda205976' class='mouseoverHref'><em>Annals and Magazine of Natural History</em></a> 8 <strong>1</strong>: 395-401<!--MARK-->","","Article in Journal","32b08d60-ce38-4c6e-9c5c-b018f51786e6","20081009T05:11:37.000+0000","efa8de69-3a29-4a43-8ef2-cbefda205976"
"","","Prostylissa","Prostylissa Topsent, 1925","","Prostylissa","","","","Synonym","synonym","Genus","","Topsent","1925","Y","35154421-4814-4e42-91d3-dfa523c97265","20210803T02:25:31.270+0000","515b86c9-ca05-4a76-9574-494aa8e0151f","20220303T02:16:47.770+0000","","","","","","","","","","","","","","","","",""
"","","Tumata","Tumata Laubenfels, 1936","","Tumata","","","","Synonym","synonym","Genus","","Laubenfels","1936","Y","17b6f64d-2c4f-48e6-9771-b6188f24e0b2","20210803T02:25:31.270+0000","515b86c9-ca05-4a76-9574-494aa8e0151f","20220303T02:16:47.770+0000","","19ac6ecb-062d-49f0-ba43-6685f785cf9e","Laubenfels, M.W. de","1936","A discussion of the sponge fauna of the Dry Tortugas in particular, and the West Indies in general, with material for a revision of the families and orders of the Porifera. (Tortugas Lab. Paper No. 467)","1-225 22 pls 1 map","","Publication of the Carnegie Institution of Washington","","","","<!--MARK--><a href='nullf13281d3-3323-4b05-85de-7d3a3f1cc15e' class='mouseoverHref'>Laubenfels, M.W. de 1936. A discussion of the sponge fauna of the Dry Tortugas in particular, and the West Indies in general, with material for a revision of the families and orders of the Porifera. (Tortugas Lab. Paper No. 467).</a> <!--MARK--><!--MARK--><a href='null21197fbf-e955-4b91-b8c9-7be6b681c3e1' class='mouseoverHref'><em>Publication of the Carnegie Institution of Washington</em></a> Washington <strong>30</strong>: 1-225 22 pls 1 map<!--MARK-->","","Article in Journal","f13281d3-3323-4b05-85de-7d3a3f1cc15e","20081009T05:11:37.000+0000","21197fbf-e955-4b91-b8c9-7be6b681c3e1"
"","","Milne","Milne Laubenfels, 1954","","Milne","","","","Synonym","synonym","Genus","<I>nom. nov. </I>for <I>Migas </I>Sollas, 1908","Laubenfels","1954","Y","8ebb90de-64c1-4cc4-b73a-9bc2dba4e98f","20210803T02:25:31.270+0000","515b86c9-ca05-4a76-9574-494aa8e0151f","20220303T02:16:47.770+0000","","795cdab2-2d24-461c-99be-94f3c18d55fd","Laubenfels, M.W. de","1954","The sponges of the West-Central Pacific","1-306 pls 1-12","","Oregon State Monographs. Studies in Zoology","","","","<!--MARK--><a href='nulldce138a8-c67d-4f25-b62c-791559283c4e' class='mouseoverHref'>Laubenfels, M.W. de 1954. The sponges of the West-Central Pacific.</a> <!--MARK--><!--MARK--><a href='null2402e10e-3361-4b8b-9df0-4056590c6a96' class='mouseoverHref'><em>Oregon State Monographs. Studies in Zoology</em></a> <strong>7</strong>: 1-306 pls 1-12<!--MARK-->","","Article in Journal","dce138a8-c67d-4f25-b62c-791559283c4e","20081009T05:11:37.000+0000","2402e10e-3361-4b8b-9df0-4056590c6a96"
"","","maculosa","Amorphinopsis maculosa (Pulitzer-Finali, 1996)","HALICHONDRIIDAE","Amorphinopsis","","maculosa","","Valid Name","","Species","","Pulitzer-Finali","1996","N","26d0b4f2-848b-4dfd-bec1-32a25c76eee0","20210803T02:25:31.270+0000","3cd78ddc-d54a-449d-8997-b75c5a086daa","20220303T02:16:47.770+0000","515b86c9-ca05-4a76-9574-494aa8e0151f","3cd78ddc-d54a-449d-8997-b75c5a086daa","","","","","","","","","","","","","","",""
"","","maculosa","Topsentia maculosa Pulitzer-Finali, 1996","","Topsentia","","maculosa","","Synonym","synonym","Species","","Pulitzer-Finali","1996","Y","20fbcf0d-823b-4a31-b51f-4b4d62d3a139","20210803T02:25:31.270+0000","3cd78ddc-d54a-449d-8997-b75c5a086daa","20220303T02:16:47.770+0000","","600b79db-80a1-4702-b568-c5acdf87dc47","Pulitzer-Finali, G.","1996","Sponges from the Bismarck Sea.","101-138","","Bollettino dei Musei e degli Instituti Biologici della Università di Genova","","","","<!--MARK--><a href='null9e72c489-94d7-484f-9a5c-38d7b96917b9' class='mouseoverHref'>Pulitzer-Finali, G. 1996. Sponges from the Bismarck Sea.</a> <!--MARK--><!--MARK--><a href='null1fce394f-32f6-462d-874e-c582cc14d9ce' class='mouseoverHref'><em>Bollettino dei Musei e degli Instituti Biologici della Università di Genova</em></a> <strong>60-61</strong>: 101-138<!--MARK-->","","Article in Journal","9e72c489-94d7-484f-9a5c-38d7b96917b9","20120101T04:35:06.785+0000","1fce394f-32f6-462d-874e-c582cc14d9ce"
"","","maculosa","Amorphinopsis maculosa (Pulitzer-Finali, 1996)","HALICHONDRIIDAE","Amorphinopsis","","maculosa","","Generic Combination","","Species","","Pulitzer-Finali","1996","N","7d474be7-d86e-4067-8e15-97596f5e0427","20210803T02:25:31.270+0000","3cd78ddc-d54a-449d-8997-b75c5a086daa","20220303T02:16:47.770+0000","","c456fe35-961b-4a17-949b-f20c06bdc75e","Alvarez, B. & Hooper, J.N.A.","2011","Taxonomic revision of the order Halichondrida (Porifera: Demospongiae) of northern Australia. Family Halichondriidae.","55-84","","The Beagle, Records of the Museums and Art Galleries of the Northern Territory","","","","<!--MARK--><a href='null6f3253e8-95dd-4f38-813d-3f9d7c77f6a4' class='mouseoverHref'>Alvarez, B. & Hooper, J.N.A. 2011. Taxonomic revision of the order Halichondrida (Porifera: Demospongiae) of northern Australia. Family Halichondriidae.</a> <!--MARK--><!--MARK--><a href='null8adcca9b-ba23-4332-8764-3137d09e3776' class='mouseoverHref'><em>The Beagle, Records of the Museums and Art Galleries of the Northern Territory</em></a> <strong>27</strong>: 55-84<!--MARK-->","","Article in Journal","6f3253e8-95dd-4f38-813d-3f9d7c77f6a4","20111230T10:15:07.671+0000","8adcca9b-ba23-4332-8764-3137d09e3776"
"","","excavans","Amorphinopsis excavans Carter, 1887","HALICHONDRIIDAE","Amorphinopsis","","excavans","","Valid Name","","Species","","Carter","1887","Y","6dbf87bf-187b-4999-b01d-e29bcf0299cc","20210803T02:25:31.270+0000","c8146b0f-4105-4ed0-a2b0-4e06d2929d9a","20220303T02:16:47.770+0000","515b86c9-ca05-4a76-9574-494aa8e0151f","c8146b0f-4105-4ed0-a2b0-4e06d2929d9a","","","","","","","","","","","","","","",""
"","","excavans","Amorphinopsis excavans Carter, 1887","","Amorphinopsis","","excavans","","Synonym","synonym","Species","","Carter","1887","Y","9f21b83c-26d6-4693-a4ea-a6f8c888c3d5","20210803T02:25:31.270+0000","c8146b0f-4105-4ed0-a2b0-4e06d2929d9a","20220303T02:16:47.770+0000","","4307b4cc-5f56-4769-b7a2-a77ef0d6ecab","Carter, H.J.","1887","Report on the marine sponges, chiefly from King Island in the Mergui Archipelago, collected for the Trustees of the Indian Museum, Calcutta, by Dr John Anderson","61-84 pls 5-7","","Journal of the Linnean Society of London, Zoology","","","","<!--MARK--><a href='null18366cff-23f3-49f5-9499-0860692e79f7' class='mouseoverHref'>Carter, H.J. 1887. Report on the marine sponges, chiefly from King Island in the Mergui Archipelago, collected for the Trustees of the Indian Museum, Calcutta, by Dr John Anderson.</a> <!--MARK--><!--MARK--><a href='null9da0901d-c795-4d2c-b9ad-d6a85cdf1cce' class='mouseoverHref'><em>Journal of the Linnean Society of London, Zoology</em></a> Zool. <strong>21</strong>: 61-84 pls 5-7<!--MARK-->","","Article in Journal","18366cff-23f3-49f5-9499-0860692e79f7","20081009T05:11:37.000+0000","9da0901d-c795-4d2c-b9ad-d6a85cdf1cce"
"","","armata","Halichondria armata Lindgren, 1897","","Halichondria","","armata","","Synonym","synonym","Species","","Lindgren","1897","Y","3774c4bb-020b-43c0-bfd1-6c1eaf2d7250","20210803T02:25:31.270+0000","c8146b0f-4105-4ed0-a2b0-4e06d2929d9a","20220303T02:16:47.770+0000","","392e6ade-ea40-428e-933c-45ca95013b2e","Lindgren, N.G.","1897","Beitrag zur Kenntniss der Spongienfauna des Malaiischen Archipels und der Chinesischen Meere","480-487","","Zoologischer Anzeiger","","","","<!--MARK--><a href='null1e0c838b-db6d-4058-8ec7-45c091b5b5c9' class='mouseoverHref'>Lindgren, N.G. 1897. Beitrag zur Kenntniss der Spongienfauna des Malaiischen Archipels und der Chinesischen Meere.</a> <!--MARK--><!--MARK--><a href='null4b894062-2782-48ef-bf96-6997840d9060' class='mouseoverHref'><em>Zoologischer Anzeiger</em></a> <strong>20</strong>: 480-487<!--MARK-->","","Article in Journal","1e0c838b-db6d-4058-8ec7-45c091b5b5c9","20081009T05:11:37.000+0000","4b894062-2782-48ef-bf96-6997840d9060"
"","","hemisphaerica","Halichondria panicea hemisphaerica Dendy, 1905","","Halichondria","","panicea","hemisphaerica","Synonym","synonym","Species","","Dendy","1905","Y","9b10f82e-b21f-4af0-b69e-e4c20384ced4","20210803T02:25:31.270+0000","c8146b0f-4105-4ed0-a2b0-4e06d2929d9a","20220303T02:16:47.770+0000","","913b034f-09c2-48ff-9b03-14cd7a025f4d","Dendy, A.","1905","Report on the sponges collected by Professor Herdman, at Ceylon, in 1902","57-246 pls 1-16","Report to the Government of Ceylon on the Pearl Oyster Fisheries of the Gulf of Manaar","","","","","<!--MARK--><a href='null1aa46ebe-e87b-4408-8cfe-3c2a95e2fbb2' class='mouseoverHref'>Dendy, A. 1905. Report on the sponges collected by Professor Herdman, at Ceylon, in 1902. 57-246 pls 1-16</a> <!--MARK--><em>in</em> <!--MARK--><a href='nulle7cd37ed-c88c-4d05-a0f6-c90b49913e56' class='mouseoverHref'>Herdman, W.A. (ed.). <em>Report to the Government of Ceylon on the Pearl Oyster Fisheries of the Gulf of Manaar</em>. London : Royal Society Vol. 3 Suppl. 18.</a><!--MARK-->","","Chapter in Book","1aa46ebe-e87b-4408-8cfe-3c2a95e2fbb2","20081009T05:11:37.000+0000","e7cd37ed-c88c-4d05-a0f6-c90b49913e56"
"","","digitifera","Amorphinopsis excavans digitifera Annandale, 1915","","Amorphinopsis","","excavans","digitifera","Synonym","synonym","Species","","Annandale","1915","Y","7cf23edb-e717-4824-bf6c-116453f3b4b4","20210803T02:25:31.270+0000","c8146b0f-4105-4ed0-a2b0-4e06d2929d9a","20220303T02:16:47.770+0000","","1823510e-09e5-48d2-a6c1-6f3101718921","Annandale, N.","1915","Some sponges parasitic on Clionidae with further notes on that family","457-478 pl. 34","","Records of the Indian Museum","","","","<!--MARK--><a href='null059c2ade-eaa5-42d3-9464-fb9348218fc4' class='mouseoverHref'>Annandale, N. 1915. Some sponges parasitic on Clionidae with further notes on that family.</a> <!--MARK--><!--MARK--><a href='null6c35e896-740a-4f0a-9785-d35f1fc27b0d' class='mouseoverHref'><em>Records of the Indian Museum</em></a> <strong>11</strong>: 457-478 pl. 34<!--MARK-->","","Article in Journal","059c2ade-eaa5-42d3-9464-fb9348218fc4","20081009T05:11:37.000+0000","6c35e896-740a-4f0a-9785-d35f1fc27b0d"
"","","kempi","Amorphinopsis kempi Kumar, 1925","","Amorphinopsis","","kempi","","Synonym","synonym","Species","","Kumar","1925","Y","9bd28104-dbfb-43f9-816f-bf345b296d55","20210803T02:25:31.270+0000","c8146b0f-4105-4ed0-a2b0-4e06d2929d9a","20220303T02:16:47.770+0000","","1755a321-acb7-4c6f-ad05-f6e8e3c4526e","Kumar, D.A.","1925","Report on some tetraxonid sponges in the collection of the Indian Museum","211-229","","Records of the Indian Museum","","","","<!--MARK--><a href='nullc99bc7be-8567-4a3a-9ebf-4976ed1130d9' class='mouseoverHref'>Kumar, D.A. 1925. Report on some tetraxonid sponges in the collection of the Indian Museum.</a> <!--MARK--><!--MARK--><a href='null6c35e896-740a-4f0a-9785-d35f1fc27b0d' class='mouseoverHref'><em>Records of the Indian Museum</em></a> <strong>27</strong>: 211-229<!--MARK-->","","Article in Journal","c99bc7be-8567-4a3a-9ebf-4976ed1130d9","20081009T05:11:37.000+0000","6c35e896-740a-4f0a-9785-d35f1fc27b0d"
"","","siamensis","Prostylissa siamensis Topsent, 1925","","Prostylissa","","siamensis","","Synonym","synonym","Species","","Topsent","1925","Y","a1aecc2b-fe75-4104-9017-83ad8396c743","20210803T02:25:31.270+0000","c8146b0f-4105-4ed0-a2b0-4e06d2929d9a","20220303T02:16:47.770+0000","","","","","","","","","","","","","","","","",""
"","","fenestrata","Amorphinopsis fenestrata (Ridley, 1884)","HALICHONDRIIDAE","Amorphinopsis","","fenestrata","","Valid Name","","Species","","Ridley","1884","N","f1550c30-0afc-4bc5-ba95-a2daaa5ac4e7","20210803T02:25:31.270+0000","10039669-2c7b-455b-940b-5d62601d766c","20220303T02:16:47.770+0000","515b86c9-ca05-4a76-9574-494aa8e0151f","10039669-2c7b-455b-940b-5d62601d766c","","","","","","","","","","","","","","",""
"","","fenestratus","Leucophloeus fenestratus Ridley, 1884","","Leucophloeus","","fenestratus","","Synonym","synonym","Species","with unnamed variety, Arafura Sea, type status confirmed","Ridley","1884","Y","87710e63-f734-4306-af3f-bfecc098c45f","20210803T02:25:31.270+0000","10039669-2c7b-455b-940b-5d62601d766c","20220303T02:16:47.770+0000","","bd425f73-599e-4987-9cb9-709ae6ce1b81","Ridley, S.O.","1884","Report on the Zoological Collections made in the Indo-Pacific Ocean during the voyage of H.M.S. <i>Alert,</i> 1881-1882. <i>Spongiida. (Part 1, Australian sponges)</i>","366-482, pls 39-43","","","","","British Museum (Natural History)","<!--MARK--><a href='nullc7ad9d21-6abd-4313-aba8-9113c8f32cc2' class='mouseoverHref'>Ridley, S.O. 1884. <em>Report on the Zoological Collections made in the Indo-Pacific Ocean during the voyage of H.M.S. <i>Alert,</i> 1881-1882. <i>Spongiida. (Part 1, Australian sponges)</i></em>. London : British Museum (Natural History) 366-482, pls 39-43.</a><!--MARK-->","","Book","c7ad9d21-6abd-4313-aba8-9113c8f32cc2","20081009T05:11:37.000+0000",""
"","","confossa","Ciocalypta confossa Hooper, Cook, Hobbs & Kennedy, 1997","","Ciocalypta","","confossa","","Synonym","synonym","Species","","Hooper, Cook, Hobbs & Kennedy","1997","Y","57d3550b-7b41-46dd-8968-a3af46110f61","20210803T02:25:31.270+0000","10039669-2c7b-455b-940b-5d62601d766c","20220303T02:16:47.770+0000","","","","","","","","","","","","","","","","",""
"","","oscitans","Ciocalypta oscitans Hooper, Cook, Hobbs & Kennedy, 1997","","Ciocalypta","","oscitans","","Synonym","synonym","Species","","Hooper, Cook, Hobbs & Kennedy","1997","Y","84a668f7-d353-4afe-a634-236a59db979a","20210803T02:25:31.270+0000","10039669-2c7b-455b-940b-5d62601d766c","20220303T02:16:47.770+0000","","aa1b15ea-6f8f-4c03-b74a-6217d0fd8428","Hooper, J.N.A., Cook, S.D., Hobbs, L.J. & Kennedy, J.A.","1997","Australian Halichondriidae (Porifera: Demospongiae): I. Species from the Beagle Gulf","1-65","The Marine Flora and Fauna of Darwin Harbour, Northern Territory, Australia. Proceedings of the Sixth International  Marine Biology Workshop","","","","","<!--MARK--><a href='null80111c47-5e06-494d-8450-51ae3c6160b9' class='mouseoverHref'>Hooper, J.N.A., Cook, S.D., Hobbs, L.J. & Kennedy, J.A. 1997. Australian Halichondriidae (Porifera: Demospongiae): I. Species from the Beagle Gulf. pp. 1-65</a> <!--MARK--><em>in</em> <!--MARK--><a href='null70752299-3f11-4a85-baa1-80f42f74ab4c' class='mouseoverHref'>Hanley, H.R., Caswell, G., Megirian, D. & Larson, H.K. (eds). <em>The Marine Flora and Fauna of Darwin Harbour, Northern Territory, Australia. Proceedings of the Sixth International  Marine Biology Workshop</em>. Darwin : Museum and Art Gallery of the Northern Territory 466 pp.</a><!--MARK-->","","Chapter in Book","80111c47-5e06-494d-8450-51ae3c6160b9","20081009T05:11:37.000+0000","70752299-3f11-4a85-baa1-80f42f74ab4c"
"","","fenestrata","Amorphinopsis fenestrata (Ridley, 1884)","","Amorphinopsis","","fenestrata","","Generic Combination","","Species","","Ridley","1884","N","a289cc1b-f0c7-4930-aacb-1030c6fc3b74","20210803T02:25:31.270+0000","10039669-2c7b-455b-940b-5d62601d766c","20220303T02:16:47.770+0000","","92626cda-cba4-46ee-9048-186235494407","Alvarez, B. & Hooper, J.N.A.","2011","Taxonomic revision of the order Halichondrida (Porifera: Demospongiae) of northern Australia. Family Halichondriidae.","55-84","","The Beagle, Records of the Museums and Art Galleries of the Northern Territory","","","","<!--MARK--><a href='null6f3253e8-95dd-4f38-813d-3f9d7c77f6a4' class='mouseoverHref'>Alvarez, B. & Hooper, J.N.A. 2011. Taxonomic revision of the order Halichondrida (Porifera: Demospongiae) of northern Australia. Family Halichondriidae.</a> <!--MARK--><!--MARK--><a href='null8adcca9b-ba23-4332-8764-3137d09e3776' class='mouseoverHref'><em>The Beagle, Records of the Museums and Art Galleries of the Northern Territory</em></a> <strong>27</strong>: 55-84<!--MARK-->","","Article in Journal","6f3253e8-95dd-4f38-813d-3f9d7c77f6a4","20111230T10:15:07.671+0000","8adcca9b-ba23-4332-8764-3137d09e3776"
"","","foetida","Amorphinopsis foetida (Dendy, 1889)","HALICHONDRIIDAE","Amorphinopsis","","foetida","","Valid Name","","Species","","Dendy","1889","N","b0f85c9d-93d4-4541-a3b2-51d2e6c08bb3","20210803T02:25:31.270+0000","04077443-1980-4bce-bbbb-d59b66fe9f13","20220303T02:16:47.770+0000","515b86c9-ca05-4a76-9574-494aa8e0151f","04077443-1980-4bce-bbbb-d59b66fe9f13","","","","","","","","","","","","","","",""
"","","foetida","Hymeniacidon foetida Dendy, 1889","","Hymeniacidon","","foetida","","Synonym","synonym","Species","","Dendy","1889","Y","65629d5f-06d6-4925-a240-f3bcf4dde5b9","20210803T02:25:31.270+0000","04077443-1980-4bce-bbbb-d59b66fe9f13","20220303T02:16:47.770+0000","","294793f3-669f-4bc6-a961-b313ad111f2f","Dendy, A.","1889","Report on a second collection of sponges from the Gulf of Manaar","73-99 pls 3-5","","Annals and Magazine of Natural History","","","","<!--MARK--><a href='null2fec294c-51df-4ecd-843c-f0a50fbf3e00' class='mouseoverHref'>Dendy, A. 1889. Report on a second collection of sponges from the Gulf of Manaar.</a> <!--MARK--><!--MARK--><a href='nullefa8de69-3a29-4a43-8ef2-cbefda205976' class='mouseoverHref'><em>Annals and Magazine of Natural History</em></a> 6 <strong>3</strong>: 73-99 pls 3-5<!--MARK-->","","Article in Journal","2fec294c-51df-4ecd-843c-f0a50fbf3e00","20081009T05:11:37.000+0000","efa8de69-3a29-4a43-8ef2-cbefda205976"
"","","megarrhaphea","Amorphinopsis megarrhaphea (Lendenfeld, 1888)","HALICHONDRIIDAE","Amorphinopsis","","megarrhaphea","","Valid Name","","Species","","Lendenfeld","1888","N","54ccdf83-70a1-4fad-8669-eac00e900090","20210803T02:25:31.270+0000","4c28d6ed-96fe-4198-aa8e-47924cc21a54","20220303T02:16:47.770+0000","515b86c9-ca05-4a76-9574-494aa8e0151f","4c28d6ed-96fe-4198-aa8e-47924cc21a54","","","","","","","","","","","","","","",""
"","","megarrhaphea","Reniera megarrhaphea Lendenfeld, 1888","","Reniera","","megarrhaphea","","Synonym","synonym","Species","","Lendenfeld","1888","Y","10fa5142-1fd7-4b32-bf70-a241c45a8799","20210803T02:25:31.270+0000","4c28d6ed-96fe-4198-aa8e-47924cc21a54","20220303T02:16:47.770+0000","","e6613802-6c97-4624-a18a-4d97d146e858","Lendenfeld, R. von","1888","Descriptive Catalogue of the Sponges in the Australian Museum, Sydney","260 pp. 12 pls","","","","","Taylor & Francis","<!--MARK--><a href='null8d9d50d0-9157-4751-856c-474cc64b22a7' class='mouseoverHref'>Lendenfeld, R. von 1888. <em>Descriptive Catalogue of the Sponges in the Australian Museum, Sydney</em>. London : Taylor & Francis 260 pp. 12 pls.</a><!--MARK-->","","Book","8d9d50d0-9157-4751-856c-474cc64b22a7","20081009T05:11:37.000+0000",""
"","","Axinyssa","Axinyssa Lendenfeld, 1897","HALICHONDRIIDAE","Axinyssa","","","","Valid Name","","Genus","","Lendenfeld","1897","Y","b162a5f1-b5e6-43c9-b7c1-c8af0218741c","20210803T02:25:31.270+0000","266f6c83-cc8e-4806-91af-2d2eb1d81648","20220303T02:16:47.770+0000","7ce1391a-b562-4925-8d1e-290df8a79d02","266f6c83-cc8e-4806-91af-2d2eb1d81648","","","","","","","","","","","","","","",""
"","","Axinyssa","Axinyssa Lendenfeld, 1897","","Axinyssa","","","","Synonym","synonym","Genus","","Lendenfeld","1897","Y","b1c04799-511a-48b0-9b27-78d2a9c5c6e1","20210803T02:25:31.270+0000","266f6c83-cc8e-4806-91af-2d2eb1d81648","20220303T02:16:47.770+0000","","81f92119-8cbd-4cee-a609-2baf3b7f9a4d","Lendenfeld, R. von","1897","Spongien von Sansibar","93-133 pls 9-10","","Abhandlungen der Senckenbergischen Naturforschenden Gesellschaft","","","","<!--MARK--><a href='null59a8d30b-082f-4d7f-bc70-28e22dcc0205' class='mouseoverHref'>Lendenfeld, R. von 1897. Spongien von Sansibar.</a> <!--MARK--><!--MARK--><a href='nullc837cea0-a318-4e95-8cd3-1f59a91095df' class='mouseoverHref'><em>Abhandlungen der Senckenbergischen Naturforschenden Gesellschaft</em></a> <strong>21</strong>: 93-133 pls 9-10<!--MARK-->","","Article in Journal","59a8d30b-082f-4d7f-bc70-28e22dcc0205","20081009T05:11:37.000+0000","c837cea0-a318-4e95-8cd3-1f59a91095df"
"","","Pseudaxinyssa","Pseudaxinyssa Burton, 1931","","Pseudaxinyssa","","","","Synonym","synonym","Genus","","Burton","1931","Y","8dd1e64b-ef81-4dc0-8b09-cd8fbdbf821f","20210803T02:25:31.270+0000","266f6c83-cc8e-4806-91af-2d2eb1d81648","20220303T02:16:47.770+0000","","c0f1883e-9e60-4196-8fce-70785aebffac","Burton, M.","1931","On a collection of marine sponges mostly from the Natal coast","337-358 9 figs pl. 23","","Annals of the Natal Museum","","","","<!--MARK--><a href='null90f959bb-e10c-4371-9752-10590d3f399c' class='mouseoverHref'>Burton, M. 1931. On a collection of marine sponges mostly from the Natal coast.</a> <!--MARK--><!--MARK--><a href='null7f9d49f2-a947-4661-ad5e-e7ff8b3cc589' class='mouseoverHref'><em>Annals of the Natal Museum</em></a> <strong>6</strong>: 337-358 9 figs pl. 23<!--MARK-->","","Article in Journal","90f959bb-e10c-4371-9752-10590d3f399c","20081009T05:11:37.000+0000","7f9d49f2-a947-4661-ad5e-e7ff8b3cc589"
