"CAVS_CODE","CAAB_CODE","NAMES_VARIOUS","SCIENTIFIC_NAME","FAMILY","GENUS","SUBGENUS","SPECIES","SUBSPECIES","NAME_TYPE","NAME_SUBTYPE","RANK","QUALIFICATION","AUTHOR","YEAR","ORIG_COMBINATION","NAME_GUID","NAME_LAST_UPDATE","TAXON_GUID","TAXON_LAST_UPDATE","PARENT_TAXON_GUID","CONCEPT_GUID","PUB_PUB_AUTHOR","PUB_PUB_YEAR","PUB_PUB_TITLE","PUB_PUB_PAGES","PUB_PUB_PARENT_BOOK_TITLE","PUB_PUB_PARENT_JOURNAL_TITLE","PUB_PUB_PARENT_ARTICLE_TITLE","PUB_PUB_PUBLICATION_DATE","PUB_PUB_PUBLISHER","PUB_PUB_FORMATTED","PUB_PUB_QUALIFICATION","PUB_PUB_TYPE","PUBLICATION_GUID","PUBLICATION_LAST_UPDATE","PARENT_PUBLICATION_GUID"
"","","Trachyderini","Trachyderini Dupont, 1836","CERAMBYCIDAE","","","","","Valid Name","","Tribe","","Dupont","1836","Y","cecf99c1-fe29-4839-b88a-5f1d012d13f1","20210602T01:04:07.158+0000","b731746d-9390-4586-8f07-e80137805df6","20220609T01:52:13.610+0000","734b52ab-358f-45ac-8c8a-5b53d9dacaca","b731746d-9390-4586-8f07-e80137805df6","","","","","","","","","","","","","","",""
"","","Purpuricenus","Purpuricenus Dejean, 1821","CERAMBYCIDAE","Purpuricenus","","","","Valid Name","","Genus","","Dejean","1821","Y","0b369829-4b26-481c-9e70-796e706a8914","20210602T01:04:07.158+0000","abaac7f7-f47f-42c3-8e0a-fbf1589ff18d","20210804T05:35:18.792+0000","b731746d-9390-4586-8f07-e80137805df6","abaac7f7-f47f-42c3-8e0a-fbf1589ff18d","","","","","","","","","","","","","","",""
"","","Purpuricenus","Purpuricenus Dejean, 1821","","Purpuricenus","","","","Synonym","synonym","Genus","","Dejean","1821","Y","97ae8e50-2781-46bd-a1fe-b1e26e0c8192","20210602T01:04:07.158+0000","abaac7f7-f47f-42c3-8e0a-fbf1589ff18d","20210804T05:35:18.792+0000","","5e9a78ae-6aa2-4b26-8187-e09efe3617c4","Dejean, P.F.M.A.","1821","Catalogue de la Collection de Coléoptères de M. le Baron Dejean","viii 136 pp.","","","","","Crevot, Libraire","<!--MARK--><a href='nullc5981f53-318a-4e58-988f-e9131223490f' class='mouseoverHref'>Dejean, P.F.M.A. 1821. <em>Catalogue de la Collection de Coléoptères de M. le Baron Dejean</em>. Paris : Crevot, Libraire viii 136 pp.</a><!--MARK-->","","Book","c5981f53-318a-4e58-988f-e9131223490f","20081009T05:11:37.000+0000",""
"","","Cyclodera","Cyclodera White, 1846","","Cyclodera","","","","Synonym","synonym","Genus","","White","1846","Y","81386018-5fae-414d-b966-738922e88dfd","20210602T01:04:07.158+0000","abaac7f7-f47f-42c3-8e0a-fbf1589ff18d","20210804T05:35:18.792+0000","","974aa9dd-c081-48c9-b032-66cf6a3eb09d","White, A.","1846","Description of new or unfigured species of Coleoptera from Australia","505-512","Discoveries in Australia <i>with an account of the Coasts and Rivers explored and surveyed during the Voyage of H.M.S. Beagle in the years 1837-1838-1839-1840-1841-1842-1843</i>","","","","","<!--MARK--><a href='null421d33f6-2c31-4115-a80d-2c20ec032495' class='mouseoverHref'>White, A. 1846. Description of new or unfigured species of Coleoptera from Australia. pp. 505-512</a> <!--MARK--><em>in</em> <!--MARK--><a href='nullf9853f31-2440-4c35-bfc1-497febe668d1' class='mouseoverHref'>Lord Stokes, J. (ed.). <em>Discoveries in Australia <i>with an account of the Coasts and Rivers explored and surveyed during the Voyage of H.M.S. Beagle in the years 1837-1838-1839-1840-1841-1842-1843</i></em>. London : T. & W. Boone Vol. I Appendix.</a><!--MARK-->","","Chapter in Book","421d33f6-2c31-4115-a80d-2c20ec032495","20081009T05:11:37.000+0000","f9853f31-2440-4c35-bfc1-497febe668d1"
"","","Philagathes","Philagathes Thomson, 1864","","Philagathes","","","","Synonym","synonym","Genus","","Thomson","1864","Y","ce19b892-43d4-45f2-924f-f3748ca3ac76","20210602T01:04:07.158+0000","abaac7f7-f47f-42c3-8e0a-fbf1589ff18d","20210804T05:35:18.792+0000","","e9257de2-1584-4842-b8a3-6d9ef286d696","Thomson, J.","1864","Systema cerambycidarum ou exposé de tous les genres compris dans la famille des cérambycides et familles limitrophes","578 pp.","","","","1864: pp. 1-352; 1865: 353-578","H. Dessain","<!--MARK--><a href='nullabd8b9f7-e92e-499d-90a9-6b1f54840e5f' class='mouseoverHref'>Thomson, J. 1864. <em>Systema cerambycidarum ou exposé de tous les genres compris dans la famille des cérambycides et familles limitrophes</em>. Liége : H. Dessain 578 pp.</a><!--MARK--> [Date published 1864: pp. 1-352; 1865: 353-578: 1864-1865]","1864-1865","Book","abd8b9f7-e92e-499d-90a9-6b1f54840e5f","20140618T23:14:46.683+0000",""
"","","quadrinotata","Purpuricenus quadrinotata (White, 1846)","CERAMBYCIDAE","Purpuricenus","","quadrinotata","","Valid Name","","Species","","White","1846","N","28cb2432-e0c6-4a2f-9a2b-aaae3f697d0c","20210602T01:04:07.158+0000","2d4203de-5c54-40c7-876c-2045f6000563","20210804T05:35:18.792+0000","abaac7f7-f47f-42c3-8e0a-fbf1589ff18d","2d4203de-5c54-40c7-876c-2045f6000563","","","","","","","","","","","","","","",""
"","","quadrinotata","Cyclodera quadrinotata White, 1846","","Cyclodera","","quadrinotata","","Synonym","synonym","Species","","White","1846","Y","7f4ef972-eb69-4a34-b68f-4e1cd37e1c8d","20210602T01:04:07.158+0000","2d4203de-5c54-40c7-876c-2045f6000563","20210804T05:35:18.792+0000","","65d913ab-d350-4f91-91a2-f7d9442d6dd6","White, A.","1846","Description of new or unfigured species of Coleoptera from Australia","505-512","Discoveries in Australia <i>with an account of the Coasts and Rivers explored and surveyed during the Voyage of H.M.S. Beagle in the years 1837-1838-1839-1840-1841-1842-1843</i>","","","","","<!--MARK--><a href='null421d33f6-2c31-4115-a80d-2c20ec032495' class='mouseoverHref'>White, A. 1846. Description of new or unfigured species of Coleoptera from Australia. pp. 505-512</a> <!--MARK--><em>in</em> <!--MARK--><a href='nullf9853f31-2440-4c35-bfc1-497febe668d1' class='mouseoverHref'>Lord Stokes, J. (ed.). <em>Discoveries in Australia <i>with an account of the Coasts and Rivers explored and surveyed during the Voyage of H.M.S. Beagle in the years 1837-1838-1839-1840-1841-1842-1843</i></em>. London : T. & W. Boone Vol. I Appendix.</a><!--MARK-->","","Chapter in Book","421d33f6-2c31-4115-a80d-2c20ec032495","20081009T05:11:37.000+0000","f9853f31-2440-4c35-bfc1-497febe668d1"
"","","angasii","Cyclodera angasii White, 1853","","Cyclodera","","angasii","","Synonym","synonym","Species","","White","1853","Y","86a7e2f9-bf00-4fb7-8eed-850db90c06f7","20210602T01:04:07.158+0000","2d4203de-5c54-40c7-876c-2045f6000563","20210804T05:35:18.792+0000","","9bd093c2-64d0-485c-84e3-0bec7a6e6e71","White, A.","1853","Catalogue of Coleopterous Insects in the Collection of the British Museum. Part vii. Longicornia I","1-174 pls i-iv","","","","Jan. 1853","British Museum","<!--MARK--><a href='null9f1b92fc-58e0-44e7-b2d3-5a2d8df7c6d0' class='mouseoverHref'>White, A. 1853. <em>Catalogue of Coleopterous Insects in the Collection of the British Museum. Part vii. Longicornia I</em>. London : British Museum Vol. iv 1-174 pls i-iv.</a><!--MARK--> [Date published Jan. 1853]","","Book","9f1b92fc-58e0-44e7-b2d3-5a2d8df7c6d0","20100930T22:38:08.374+0000",""
"","","australicus","Purpuricenus australicus Thomson, 1861","","Purpuricenus","","australicus","","Synonym","synonym","Species","","Thomson","1861","Y","5b64668d-b0d9-4d72-bf7f-f377ca97956a","20210602T01:04:07.158+0000","2d4203de-5c54-40c7-876c-2045f6000563","20210804T05:35:18.792+0000","","bf085042-b2d5-42de-a703-f507e266eded","Thomson, J.","1861","Essai d'une classification de la famille des cérambycides et materiaux pour servir a une monographie de cette famille","396 pp. + 3 pls","","","","","J. Thomson","<!--MARK--><a href='null4e8ec691-3fad-400c-a040-e86041da06b3' class='mouseoverHref'>Thomson, J. 1861. <em>Essai d'une classification de la famille des cérambycides et materiaux pour servir a une monographie de cette famille</em>. Paris : J. Thomson 396 pp. + 3 pls.</a><!--MARK--> [1860-1861: pp. xvi + 128 = 1860; pp. 129-396 = 1861]","1860-1861: pp. xvi + 128 = 1860; pp. 129-396 = 1861","Book","4e8ec691-3fad-400c-a040-e86041da06b3","20140618T23:15:36.508+0000",""
"","","quadrinotata","Purpuricenus quadrinotata (White, 1846)","","Purpuricenus","","quadrinotata","","Generic Combination","","Species","","White","1846","N","08c140e2-0004-4c34-b73a-385d4522d6d9","20210602T01:04:07.158+0000","2d4203de-5c54-40c7-876c-2045f6000563","20210804T05:35:18.792+0000","","","","","","","","","","","","","","","","",""
