"PUB_AUTHOR","PUB_YEAR","PUB_TITLE","PUB_PAGES","PUB_PARENT_BOOK_TITLE","PUB_PARENT_JOURNAL_TITLE","PUB_PARENT_ARTICLE_TITLE","PUB_PUBLICATION_DATE","PUB_PUBLISHER","PUB_FORMATTED","PUB_QUALIFICATION","PUB_TYPE","PUBLICATION_GUID","PUBLICATION_LAST_UPDATE","PARENT_PUBLICATION_GUID"
"Boisduval, J.-A. & Guenée, A. (eds)","1852","Histoire Naturelle des Insectes. Species Général des Lépidoptères","442 pp., 24 pls","","","","","Librarie Encyclopédique de Roret","<!--MARK--><a href='null8df48d76-7d1d-41f2-8b56-6d107c44c9cb' class='mouseoverHref'>Boisduval, J.-A. & Guenée, A. (eds) 1852. <em>Histoire Naturelle des Insectes. Species Général des Lépidoptères</em>. Paris : Librarie Encyclopédique de Roret Vol. 7 442 pp., 24 pls.</a><!--MARK-->","","Book","8df48d76-7d1d-41f2-8b56-6d107c44c9cb","20081009T05:11:37.000+0000",""
"Hampson, G.F.","1898","The moths of India. Supplementary paper to the volumes in 'The Fauna of British India'. Part III","698-724","","Journal of the Bombay Natural History Society","","","","<!--MARK--><a href='null0e654d5f-9fa5-4837-bd2f-896d35bcac4f' class='mouseoverHref'>Hampson, G.F. 1898. The moths of India. Supplementary paper to the volumes in 'The Fauna of British India'. Part III.</a> <!--MARK--><!--MARK--><a href='nulla54826a4-3d80-4759-86e1-ba44a5b76e37' class='mouseoverHref'><em>Journal of the Bombay Natural History Society</em></a> <strong>11</strong>: 698-724<!--MARK-->","","Article in Journal","0e654d5f-9fa5-4837-bd2f-896d35bcac4f","20111108T20:00:01.147+0000","a54826a4-3d80-4759-86e1-ba44a5b76e37"
"Hampson, G.F.","1926","Descriptions of New Genera and Species of Lepidoptera Phalaenae of the subfamily Noctuinae (Noctuidae) in the British Museum (Natural History)","641 pp.","","","","","British Museum (Natural History)","<!--MARK--><a href='nullfe0ce245-9100-4c0f-b099-1e6a92deea29' class='mouseoverHref'>Hampson, G.F. 1926. <em>Descriptions of New Genera and Species of Lepidoptera Phalaenae of the subfamily Noctuinae (Noctuidae) in the British Museum (Natural History)</em>. London : British Museum (Natural History) 641 pp.</a><!--MARK-->","","Book","fe0ce245-9100-4c0f-b099-1e6a92deea29","20081009T05:11:37.000+0000",""
"Roepke, W.","1938","Über Indomalayische Lepidoptera Heterocera des Kön. Museums für Naturkunde in Brüssel","1-72","","Bulletin du Musée Royal d'Histoire Naturelle du Belgique","","","","<!--MARK--><a href='null323140fb-946f-4012-a9ba-4c6e20144ea5' class='mouseoverHref'>Roepke, W. 1938. Über Indomalayische Lepidoptera Heterocera des Kön. Museums für Naturkunde in Brüssel.</a> <!--MARK--><!--MARK--><a href='nullcaf19178-ac09-401c-9213-911c8d2e4686' class='mouseoverHref'><em>Bulletin du Musée Royal d'Histoire Naturelle du Belgique</em></a> <strong>14</strong>(13): 1-72<!--MARK-->","","Article in Journal","323140fb-946f-4012-a9ba-4c6e20144ea5","20081009T05:11:37.000+0000","caf19178-ac09-401c-9213-911c8d2e4686"
"Turner, A.J.","1908","New Australian Lepidoptera of the families Noctuidae and Pyralidae","55-109","","Transactions of the Royal Society of South Australia","","","","<!--MARK--><a href='null039b93f9-44fe-44af-9952-a7f6205701f9' class='mouseoverHref'>Turner, A.J. 1908. New Australian Lepidoptera of the families Noctuidae and Pyralidae.</a> <!--MARK--><!--MARK--><a href='null8b48b0a3-dd7a-4aea-be0d-10a223710ebc' class='mouseoverHref'><em>Transactions of the Royal Society of South Australia</em></a> <strong>32</strong>: 55-109<!--MARK-->","","Article in Journal","039b93f9-44fe-44af-9952-a7f6205701f9","20081009T05:11:37.000+0000","8b48b0a3-dd7a-4aea-be0d-10a223710ebc"
"Walker, F.","1858","Noctuidae","1520-1888 [incl. index to parts 9-15]","","List of the Specimens of Lepidopterous Insects in the Collection of the British Museum","","","","<!--MARK--><a href='null4ae7258a-c3f7-4caf-abf1-e14b4e0513b1' class='mouseoverHref'>Walker, F. 1858. Noctuidae.</a> <!--MARK--><!--MARK--><a href='null642c8f2c-b31c-4c9f-9ca3-4c940f907155' class='mouseoverHref'><em>List of the Specimens of Lepidopterous Insects in the Collection of the British Museum</em></a> <strong>15</strong>: 1520-1888 [incl. index to parts 9-15]<!--MARK-->","","Article in Journal","4ae7258a-c3f7-4caf-abf1-e14b4e0513b1","","642c8f2c-b31c-4c9f-9ca3-4c940f907155"
