"PUB_AUTHOR","PUB_YEAR","PUB_TITLE","PUB_PAGES","PUB_PARENT_BOOK_TITLE","PUB_PARENT_JOURNAL_TITLE","PUB_PARENT_ARTICLE_TITLE","PUB_PUBLICATION_DATE","PUB_PUBLISHER","PUB_FORMATTED","PUB_QUALIFICATION","PUB_TYPE","PUBLICATION_GUID","PUBLICATION_LAST_UPDATE","PARENT_PUBLICATION_GUID"
"Fain, A.","1984","A new genus of mite (Acari : Acaridae) phoretic on bees (<i>Ctenocolletes</i>) in Australia","77-86","","Records of the Western Australian Museum","","","","<!--MARK--><a href='../../../../publication/aeb2dae3-f8af-4eaf-95bd-05be7af381e5' class='mouseoverHref'>Fain, A. 1984. A new genus of mite (Acari : Acaridae) phoretic on bees (<i>Ctenocolletes</i>) in Australia.</a> <!--MARK--><!--MARK--><a href='../../../../publication/a2cbd1fb-97d5-493a-a1d7-c2b99709890b' class='mouseoverHref'><em>Records of the Western Australian Museum</em></a> <strong>11</strong>: 77-86<!--MARK-->","","Article in Journal","aeb2dae3-f8af-4eaf-95bd-05be7af381e5","20081009T05:11:37.000+0000","a2cbd1fb-97d5-493a-a1d7-c2b99709890b"
"Fain, A.","1985","Observations sur les genres <i>Suidasia</i> Oudemans, 1905, <i>Tyrophagus</i> Oudemans, 1924 et <i>Madaglyphus</i> Fain, 1971 (Acari, Acaridae)","159-164","","Revue de Zoologie Africaine","","","","<!--MARK--><a href='../../../../publication/d5cf5527-35e1-4a4e-99b0-75c21d88e511' class='mouseoverHref'>Fain, A. 1985. Observations sur les genres <i>Suidasia</i> Oudemans, 1905, <i>Tyrophagus</i> Oudemans, 1924 et <i>Madaglyphus</i> Fain, 1971 (Acari, Acaridae).</a> <!--MARK--><!--MARK--><a href='../../../../publication/46c39bd8-0042-4db4-9cc5-af9cd1bc4711' class='mouseoverHref'><em>Revue de Zoologie Africaine</em></a> <strong>99</strong>: 159-164<!--MARK-->","","Article in Journal","d5cf5527-35e1-4a4e-99b0-75c21d88e511","20081009T05:11:37.000+0000","46c39bd8-0042-4db4-9cc5-af9cd1bc4711"
"Fain, A.","1986","A new mite (Acari, Acaridae) from a nest of the wasp <i>Paragia tricolor</i> Smith in Australia","407-413","","Records of the Western Australian Museum","","","","<!--MARK--><a href='../../../../publication/177491af-3122-48d7-9610-ff0cec27ea75' class='mouseoverHref'>Fain, A. 1986. A new mite (Acari, Acaridae) from a nest of the wasp <i>Paragia tricolor</i> Smith in Australia.</a> <!--MARK--><!--MARK--><a href='../../../../publication/a2cbd1fb-97d5-493a-a1d7-c2b99709890b' class='mouseoverHref'><em>Records of the Western Australian Museum</em></a> <strong>12</strong>: 407-413<!--MARK-->","","Article in Journal","177491af-3122-48d7-9610-ff0cec27ea75","20081009T05:11:37.000+0000","a2cbd1fb-97d5-493a-a1d7-c2b99709890b"
"Fain, A.","1986","Deux nouveaux hypopes d'Acaridae (Acari)","49-54","","Bulletin de l'Institut Royal des Sciences Naturelles de Belgique, Entomologie","","","","<!--MARK--><a href='../../../../publication/cb93f3d1-f072-4e89-b0fb-5b70c7c7ae44' class='mouseoverHref'>Fain, A. 1986. Deux nouveaux hypopes d'Acaridae (Acari).</a> <!--MARK--><!--MARK--><a href='../../../../publication/3fa06c09-f9f6-4877-828c-e82cbd6a83fa' class='mouseoverHref'><em>Bulletin de l'Institut Royal des Sciences Naturelles de Belgique, Entomologie</em></a> <strong>56</strong>: 49-54<!--MARK-->","","Article in Journal","cb93f3d1-f072-4e89-b0fb-5b70c7c7ae44","20081009T05:11:37.000+0000","3fa06c09-f9f6-4877-828c-e82cbd6a83fa"
"Fain, A.","1987","Observations on the hypopi of the genus <i>Forcellinia</i> Oudemans, 1924 (Acari de l'Acaridae)","111-120","","Bulletin de l'Institut Royal des Sciences Naturelles de Belgique, Entomologie","","","","<!--MARK--><a href='../../../../publication/8d71f0bb-4bd0-4e6a-864c-14e35d9ae87f' class='mouseoverHref'>Fain, A. 1987. Observations on the hypopi of the genus <i>Forcellinia</i> Oudemans, 1924 (Acari de l'Acaridae).</a> <!--MARK--><!--MARK--><a href='../../../../publication/3fa06c09-f9f6-4877-828c-e82cbd6a83fa' class='mouseoverHref'><em>Bulletin de l'Institut Royal des Sciences Naturelles de Belgique, Entomologie</em></a> <strong>57</strong>: 111-120<!--MARK-->","","Article in Journal","8d71f0bb-4bd0-4e6a-864c-14e35d9ae87f","20081009T05:11:37.000+0000","3fa06c09-f9f6-4877-828c-e82cbd6a83fa"
"Fain, A.","1988","Notes sur le genre <i>Rhizoglyphus</i> Claparède, 1869 (Acari, Acaridae) avec description de deux espèces nouvelles","53-62","","Acarologia","","","","<!--MARK--><a href='../../../../publication/2fa27164-a3ae-477f-b622-21ae144c516c' class='mouseoverHref'>Fain, A. 1988. Notes sur le genre <i>Rhizoglyphus</i> Claparède, 1869 (Acari, Acaridae) avec description de deux espèces nouvelles.</a> <!--MARK--><!--MARK--><a href='../../../../publication/ca52b0dd-4050-4ed0-b7a9-fad0329897d3' class='mouseoverHref'><em>Acarologia</em></a> <strong>29</strong>: 53-62<!--MARK-->","","Article in Journal","2fa27164-a3ae-477f-b622-21ae144c516c","20081009T05:11:37.000+0000","ca52b0dd-4050-4ed0-b7a9-fad0329897d3"
"Fain, A.","1991","Notes on mites parasitic or phoretic on Australian centipedes, spiders and scorpion","69-82","","Records of the Western Australian Museum","","","","<!--MARK--><a href='../../../../publication/4051fbb6-8831-46fb-a692-a60bb6cdf505' class='mouseoverHref'>Fain, A. 1991. Notes on mites parasitic or phoretic on Australian centipedes, spiders and scorpion.</a> <!--MARK--><!--MARK--><a href='../../../../publication/a2cbd1fb-97d5-493a-a1d7-c2b99709890b' class='mouseoverHref'><em>Records of the Western Australian Museum</em></a> <strong>15</strong>: 69-82<!--MARK-->","","Article in Journal","4051fbb6-8831-46fb-a692-a60bb6cdf505","20081009T05:11:37.000+0000","a2cbd1fb-97d5-493a-a1d7-c2b99709890b"
"Fain, A., Bartholomaeus, F., Cooke, B. & Beaucornu, J.C.","1990","Two new species of phoretic deutonymphs (Acari, Astigmata) from Australian fleas","97-101","","Bulletin de l'Institut Royal des Sciences Naturelles de Belgique","","","","<!--MARK--><a href='../../../../publication/bb4e846f-6bdb-4975-90f9-1e4e3175cb71' class='mouseoverHref'>Fain, A., Bartholomaeus, F., Cooke, B. & Beaucornu, J.C. 1990. Two new species of phoretic deutonymphs (Acari, Astigmata) from Australian fleas.</a> <!--MARK--><!--MARK--><a href='../../../../publication/c23e8b41-25c3-4670-a436-a1aee129531e' class='mouseoverHref'><em>Bulletin de l'Institut Royal des Sciences Naturelles de Belgique</em></a> <strong>60</strong>: 97-101<!--MARK-->","","Article in Journal","bb4e846f-6bdb-4975-90f9-1e4e3175cb71","20081009T05:11:37.000+0000","c23e8b41-25c3-4670-a436-a1aee129531e"
"Fain, A. & Fauvel, G.","1993","<I>Tyrophagus curvipenis</I> n.sp. from an orchid cultivation in a greenhouse in Portugal (Acari: Acaridae).","95-100","","International Journal of Acarology","","","","<!--MARK--><a href='../../../../publication/872469c8-97ce-460d-a7c0-051b1ecb2142' class='mouseoverHref'>Fain, A. & Fauvel, G. 1993. <I>Tyrophagus curvipenis</I> n.sp. from an orchid cultivation in a greenhouse in Portugal (Acari: Acaridae).</a> <!--MARK--><!--MARK--><a href='../../../../publication/faec4fc9-a979-4ddf-985e-e23330b3c030' class='mouseoverHref'><em>International Journal of Acarology</em></a> <strong>19</strong>: 95-100<!--MARK-->","","Article in Journal","872469c8-97ce-460d-a7c0-051b1ecb2142","20130506T04:16:55.439+0000","faec4fc9-a979-4ddf-985e-e23330b3c030"
"Fain, A. & Friend, J.A.","1984","Two new acarid hypopi (Acari, Astigmata) from the faeces of the numbat <i>Myrmecobius fasciatus</i> Waterhouse (Marsupiala, Myrmecobiidae)","101-108","","Records of the Western Australian Museum","","","","<!--MARK--><a href='../../../../publication/2e175c56-f1ee-4a83-a056-fcebc483f2c9' class='mouseoverHref'>Fain, A. & Friend, J.A. 1984. Two new acarid hypopi (Acari, Astigmata) from the faeces of the numbat <i>Myrmecobius fasciatus</i> Waterhouse (Marsupiala, Myrmecobiidae).</a> <!--MARK--><!--MARK--><a href='../../../../publication/a2cbd1fb-97d5-493a-a1d7-c2b99709890b' class='mouseoverHref'><em>Records of the Western Australian Museum</em></a> <strong>11</strong>: 101-108<!--MARK-->","","Article in Journal","2e175c56-f1ee-4a83-a056-fcebc483f2c9","20081009T05:11:37.000+0000","a2cbd1fb-97d5-493a-a1d7-c2b99709890b"
"Fain, A. & Heard, T.A.","1987","Description and life cycle of <i>Cerophagus trigona</i> spec. nov. (Acari, Acaridae), associated with the stingless bee <i>Trigona carbonaria</i> Smith in Australia","197-202","","Bulletin de l'Institut Royal des Sciences Naturelles de Belgique","","","","<!--MARK--><a href='../../../../publication/01d15859-3e2a-4210-8212-5b6ccfe4977a' class='mouseoverHref'>Fain, A. & Heard, T.A. 1987. Description and life cycle of <i>Cerophagus trigona</i> spec. nov. (Acari, Acaridae), associated with the stingless bee <i>Trigona carbonaria</i> Smith in Australia.</a> <!--MARK--><!--MARK--><a href='../../../../publication/c23e8b41-25c3-4670-a436-a1aee129531e' class='mouseoverHref'><em>Bulletin de l'Institut Royal des Sciences Naturelles de Belgique</em></a> <strong>57</strong>: 197-202<!--MARK-->","","Article in Journal","01d15859-3e2a-4210-8212-5b6ccfe4977a","20081009T05:11:37.000+0000","c23e8b41-25c3-4670-a436-a1aee129531e"
"Fain, A. & Houston, T.F.","1986","Life cycle stages of mites of the genus <i>Ctenocolletacarus</i> Fain (Acari: Acaridae) associated with <i>Ctenocolletes</i> bees in Australia","67-77","","Records of the Western Australian Museum","","31/12/1986","","<!--MARK--><a href='../../../../publication/be1d6789-bc64-43d8-9c70-52cdb3a8db4a' class='mouseoverHref'>Fain, A. & Houston, T.F. 1986. Life cycle stages of mites of the genus <i>Ctenocolletacarus</i> Fain (Acari: Acaridae) associated with <i>Ctenocolletes</i> bees in Australia.</a> <!--MARK--><!--MARK--><a href='../../../../publication/a2cbd1fb-97d5-493a-a1d7-c2b99709890b' class='mouseoverHref'><em>Records of the Western Australian Museum</em></a> <strong>13</strong>: 67-77<!--MARK--> [Date published 31/12/1986]","","Article in Journal","be1d6789-bc64-43d8-9c70-52cdb3a8db4a","20081009T05:11:37.000+0000","a2cbd1fb-97d5-493a-a1d7-c2b99709890b"
"Fain, A. & Johnston, D.","1974","Three new species of hypopi phoretic on springtails (Collembola) in England (Acari : Acaridiae)","411-420","","Journal of Natural History","","","","<!--MARK--><a href='../../../../publication/32d0782c-644c-4886-a92d-9144ce115204' class='mouseoverHref'>Fain, A. & Johnston, D. 1974. Three new species of hypopi phoretic on springtails (Collembola) in England (Acari : Acaridiae).</a> <!--MARK--><!--MARK--><a href='../../../../publication/ad79edeb-4c47-4124-a7ea-9bcbbce0efa4' class='mouseoverHref'><em>Journal of Natural History</em></a> <strong>8</strong>: 411-420<!--MARK-->","","Article in Journal","32d0782c-644c-4886-a92d-9144ce115204","20081009T05:11:37.000+0000","ad79edeb-4c47-4124-a7ea-9bcbbce0efa4"
"Fain, A. & Philips, J.R.","1978","Astigmatic mites from nests of birds of prey in U.S.A. III. <i>Sapracarus tuberculatus</i> g.n., sp.n. (Acari, Astigmata, Saproglyphidae)","227-231","","Acta Zoologica et Pathologica Antverpiensia","","","","<!--MARK--><a href='../../../../publication/f7f518b2-0127-4c48-bd90-b224b1a2fb79' class='mouseoverHref'>Fain, A. & Philips, J.R. 1978. Astigmatic mites from nests of birds of prey in U.S.A. III. <i>Sapracarus tuberculatus</i> g.n., sp.n. (Acari, Astigmata, Saproglyphidae).</a> <!--MARK--><!--MARK--><a href='../../../../publication/de341f7b-7cd3-4752-aea1-101d8d83514f' class='mouseoverHref'><em>Acta Zoologica et Pathologica Antverpiensia</em></a> <strong>70</strong>: 227-231<!--MARK-->","","Article in Journal","f7f518b2-0127-4c48-bd90-b224b1a2fb79","20081009T05:11:37.000+0000","de341f7b-7cd3-4752-aea1-101d8d83514f"
"Fan, Q.-F. & Zhang, Z.-Q.","2004","Revision of <I>Rhizoglyphus</I> Claparède (Acari: Acaridae) of Australasia and Oceania.","pp. 374","","","","","Systematic and Applied Acarology Society","<!--MARK--><a href='../../../../publication/d15c334c-a323-4f0c-a62a-443712b0860a' class='mouseoverHref'>Fan, Q.-F. & Zhang, Z.-Q. 2004. <em>Revision of <I>Rhizoglyphus</I> Claparède (Acari: Acaridae) of Australasia and Oceania</em>. London : Systematic and Applied Acarology Society pp. 374.</a><!--MARK-->","","Book","d15c334c-a323-4f0c-a62a-443712b0860a","20110207T03:46:18.052+0000",""
"Fan, Q.-H. & Zhang, Z.-Q.","2006","Revision of <i>Tyroborus</i> Oudemans, 1924 (Acari: Astigmata: Acaridae)","1-43","","Zootaxa","","","","<!--MARK--><a href='../../../../publication/dfd9e717-9bde-43d9-bf01-231d1c0efa3d' class='mouseoverHref'>Fan, Q.-H. & Zhang, Z.-Q. 2006. Revision of <i>Tyroborus</i> Oudemans, 1924 (Acari: Astigmata: Acaridae).</a> <!--MARK--><!--MARK--><a href='../../../../publication/96466227-221c-4922-ac97-1ac2dd946d0a' class='mouseoverHref'><em>Zootaxa</em></a> <strong>1152</strong>: 1-43<!--MARK-->","","Article in Journal","dfd9e717-9bde-43d9-bf01-231d1c0efa3d","20101120T08:03:01.420+0000","96466227-221c-4922-ac97-1ac2dd946d0a"
"Fan, Q.-H. & Zhang, Z.-Q.","2007","<i>Tyrophagus</i> (Acari: Astigmata: Acaridae)","1-290","","Fauna of New Zealand","","","","<!--MARK--><a href='../../../../publication/4ef551a2-1525-4b5c-9e4f-53ad023b1265' class='mouseoverHref'>Fan, Q.-H. & Zhang, Z.-Q. 2007. <i>Tyrophagus</i> (Acari: Astigmata: Acaridae).</a> <!--MARK--><!--MARK--><a href='../../../../publication/9a9e30f2-8e04-49ff-b629-4f9b8a3edcf7' class='mouseoverHref'><em>Fauna of New Zealand</em></a> <strong>56</strong>: 1-290<!--MARK-->","","Article in Journal","4ef551a2-1525-4b5c-9e4f-53ad023b1265","20100823T03:11:42.593+0000","9a9e30f2-8e04-49ff-b629-4f9b8a3edcf7"
"Fan, Q.-H. & Zhang, Z.-Q.","2007","Revision of some species of <I>Tyrophagus</I> (Acari: Acaridae) in the Oudemans Collection.","253-280","","Systematic and Applied Acarology","","","","<!--MARK--><a href='../../../../publication/80009b3a-7a74-4bc1-af73-82fb488d08c6' class='mouseoverHref'>Fan, Q.-H. & Zhang, Z.-Q. 2007. Revision of some species of <I>Tyrophagus</I> (Acari: Acaridae) in the Oudemans Collection.</a> <!--MARK--><!--MARK--><a href='../../../../publication/c638db21-efd0-4717-b8b8-5dcbbfb42bee' class='mouseoverHref'><em>Systematic and Applied Acarology</em></a> <strong>12</strong>: 253-280<!--MARK-->","","Article in Journal","80009b3a-7a74-4bc1-af73-82fb488d08c6","20110519T03:47:22.385+0000","c638db21-efd0-4717-b8b8-5dcbbfb42bee"
"Frost, W.E. & Bailey, P.","1997","Identifying Mites on Inland Australian Citrus. A Colour Guide for Growers, Packers and Quarantine Staff","8","","","","","","<!--MARK--><a href='../../../../publication/c01e3230-6ddb-4e2b-8258-021d97864977' class='mouseoverHref'>Frost, W.E. & Bailey, P. 1997. Identifying Mites on Inland Australian Citrus. A Colour Guide for Growers, Packers and Quarantine Staff. South Australian Research and Development Institute, Adelaide. 8 pp.</a>","","Miscellaneous","c01e3230-6ddb-4e2b-8258-021d97864977","20081009T05:11:37.000+0000",""
"Fumouze, A. & Robin, C.","1868","Observations sur une nouvelle espèce d'Acariens du genre <i>Tyroglyphus</i>","287-306","","Journal de l'Anatomie et de la Physiologie Normales et Pathologiques de l'Homme et des Animaux","","","","<!--MARK--><a href='../../../../publication/a021ff83-4950-4b73-99db-3699a78502d7' class='mouseoverHref'>Fumouze, A. & Robin, C. 1868. Observations sur une nouvelle espèce d'Acariens du genre <i>Tyroglyphus</i>.</a> <!--MARK--><!--MARK--><a href='../../../../publication/eb7bbcb9-e926-4491-b54d-eb1abc349ff0' class='mouseoverHref'><em>Journal de l'Anatomie et de la Physiologie Normales et Pathologiques de l'Homme et des Animaux</em></a> <strong>5</strong>: 287-306<!--MARK-->","","Article in Journal","a021ff83-4950-4b73-99db-3699a78502d7","20081009T05:11:37.000+0000","eb7bbcb9-e926-4491-b54d-eb1abc349ff0"
"Geary, M.J., Knihinicki, D.K., Halliday, R.B. & Russell, R.C.","2000","Contact dermatitis associated with the brown-legged mite, <I>Aleuroglyphus ovatus</I> (Troupeau) (Acari: Acaridae), in Australia.","351-352","","Australian Journal of Entomology","","","","<!--MARK--><a href='../../../../publication/e50f2181-e44a-4f93-aedd-ab52d220ab58' class='mouseoverHref'>Geary, M.J., Knihinicki, D.K., Halliday, R.B. & Russell, R.C. 2000. Contact dermatitis associated with the brown-legged mite, <I>Aleuroglyphus ovatus</I> (Troupeau) (Acari: Acaridae), in Australia.</a> <!--MARK--><!--MARK--><a href='../../../../publication/77b15fe9-6d88-4390-b074-3a3a6d3683a6' class='mouseoverHref'><em>Australian Journal of Entomology</em></a> <strong>39</strong>: 351-352<!--MARK-->","","Article in Journal","e50f2181-e44a-4f93-aedd-ab52d220ab58","20110904T05:23:37.190+0000","77b15fe9-6d88-4390-b074-3a3a6d3683a6"
"Gerson, U., Yathom, S., Capua, S. & Thorens, D.","1985","<i>Rhizoglyphus robini</i> Claparède (Acari : Astigmata : Acaridae) as a soil mite","371-380","","Acarologia","","","","<!--MARK--><a href='../../../../publication/fc1b5205-e542-4a82-96bb-82e1bf3676e9' class='mouseoverHref'>Gerson, U., Yathom, S., Capua, S. & Thorens, D. 1985. <i>Rhizoglyphus robini</i> Claparède (Acari : Astigmata : Acaridae) as a soil mite.</a> <!--MARK--><!--MARK--><a href='../../../../publication/ca52b0dd-4050-4ed0-b7a9-fad0329897d3' class='mouseoverHref'><em>Acarologia</em></a> <strong>26</strong>: 371-380<!--MARK-->","","Article in Journal","fc1b5205-e542-4a82-96bb-82e1bf3676e9","20081009T05:11:37.000+0000","ca52b0dd-4050-4ed0-b7a9-fad0329897d3"
"Gervais, F.L.P.","1844","Acarides","260-266","<i>Histoire Naturelle des Insectes. Aptères</i>","","","","","<!--MARK--><a href='../../../../publication/7fb12b8b-9a49-42fc-9d4b-4d250a807a46' class='mouseoverHref'>Gervais, F.L.P. 1844. Acarides. pp. 260-266</a> <!--MARK--><em>in</em> <!--MARK--><a href='../../../../publication/9bf1f724-e40f-43a3-98d3-be47291bc489' class='mouseoverHref'>Walckenaer (ed.). <em><i>Histoire Naturelle des Insectes. Aptères</i></em>. Paris : Roret Vol. 3.</a><!--MARK-->","","Chapter in Book","7fb12b8b-9a49-42fc-9d4b-4d250a807a46","20081009T05:11:37.000+0000","9bf1f724-e40f-43a3-98d3-be47291bc489"
"Griffiths, D.A.","1964","A revision of the genus <i>Acarus</i> L., 1758 (Acaridae, Acarina)","415-464 pl. 1","","Bulletin of the British Museum (Natural History) Zoology","","","","<!--MARK--><a href='../../../../publication/c7ce4da9-6a1d-45c2-b6ab-4f92995bf83a' class='mouseoverHref'>Griffiths, D.A. 1964. A revision of the genus <i>Acarus</i> L., 1758 (Acaridae, Acarina).</a> <!--MARK--><!--MARK--><a href='../../../../publication/b3f9c838-f530-4385-85ff-15e3c5466fb7' class='mouseoverHref'><em>Bulletin of the British Museum (Natural History) Zoology</em></a> <strong>11</strong>: 415-464 pl. 1<!--MARK-->","","Article in Journal","c7ce4da9-6a1d-45c2-b6ab-4f92995bf83a","20081009T05:11:37.000+0000","b3f9c838-f530-4385-85ff-15e3c5466fb7"
"Griffiths, D.A.","1970","A further systematic study of the genus <i>Acarus</i> L., 1758 (Acaridae, Acarina), with a key to species","85-118 pls 1-4","","Bulletin of the British Museum (Natural History) Zoology","","","","<!--MARK--><a href='../../../../publication/8cdec38b-7cd1-477a-8d24-17e503cccfbc' class='mouseoverHref'>Griffiths, D.A. 1970. A further systematic study of the genus <i>Acarus</i> L., 1758 (Acaridae, Acarina), with a key to species.</a> <!--MARK--><!--MARK--><a href='../../../../publication/b3f9c838-f530-4385-85ff-15e3c5466fb7' class='mouseoverHref'><em>Bulletin of the British Museum (Natural History) Zoology</em></a> <strong>19</strong>: 85-118 pls 1-4<!--MARK-->","","Article in Journal","8cdec38b-7cd1-477a-8d24-17e503cccfbc","20081009T05:11:37.000+0000","b3f9c838-f530-4385-85ff-15e3c5466fb7"
"Griffiths, D.A.","1979","The morpho-species and its relationship to the biological species in the genus <i>Tyrophagus</i> (Acaridae, Acarina)","199-212","Recent Advances in Acarology. Proceedings of the 5th International Congress of Acarology (East Lansing, Michigan 1978)","","","","","<!--MARK--><a href='../../../../publication/4ee0abaf-d6bb-4f6f-b70c-3757a668fe7b' class='mouseoverHref'>Griffiths, D.A. 1979. The morpho-species and its relationship to the biological species in the genus <i>Tyrophagus</i> (Acaridae, Acarina). pp. 199-212</a> <!--MARK--><em>in</em> <!--MARK--><a href='../../../../publication/c964d0da-29f7-4c30-975f-d2fef1515d2b' class='mouseoverHref'>Rodriguez, J. G. (ed.). <em>Recent Advances in Acarology. Proceedings of the 5th International Congress of Acarology (East Lansing, Michigan 1978)</em>. New York : Academic Press Vol. 1.</a><!--MARK-->","","Chapter in Book","4ee0abaf-d6bb-4f6f-b70c-3757a668fe7b","20081009T05:11:37.000+0000","c964d0da-29f7-4c30-975f-d2fef1515d2b"
"Gueye-Ndiaye, A. & Marchand, B.","1989","<i>Lardoglyphus konoi</i> et <i>Suidasia pontifica</i> deprédateurs des sardinelle braisées-séchées au Sénégal étude en microscopie électronique a balayage","131-137","","Acarologia","","","","<!--MARK--><a href='../../../../publication/3d476cca-7ffc-48ce-876a-f0b8c1e05e23' class='mouseoverHref'>Gueye-Ndiaye, A. & Marchand, B. 1989. <i>Lardoglyphus konoi</i> et <i>Suidasia pontifica</i> deprédateurs des sardinelle braisées-séchées au Sénégal étude en microscopie électronique a balayage.</a> <!--MARK--><!--MARK--><a href='../../../../publication/ca52b0dd-4050-4ed0-b7a9-fad0329897d3' class='mouseoverHref'><em>Acarologia</em></a> <strong>30</strong>: 131-137<!--MARK-->","","Article in Journal","3d476cca-7ffc-48ce-876a-f0b8c1e05e23","20081009T05:11:37.000+0000","ca52b0dd-4050-4ed0-b7a9-fad0329897d3"
"Halliday, R.B.","2002","Two genera of mites new to the Australian fauna (Acari: Acaridae)","119-122","","Australian Entomologist","","","","<!--MARK--><a href='../../../../publication/f835317c-f85f-4feb-99d6-8fbca4ea0a2d' class='mouseoverHref'>Halliday, R.B. 2002. Two genera of mites new to the Australian fauna (Acari: Acaridae).</a> <!--MARK--><!--MARK--><a href='../../../../publication/3ffa056e-e79b-45d8-a5e0-27f16422b74e' class='mouseoverHref'><em>Australian Entomologist</em></a> <strong>29</strong>: 119-122<!--MARK-->","","Article in Journal","f835317c-f85f-4feb-99d6-8fbca4ea0a2d","20100830T21:14:07.128+0000","3ffa056e-e79b-45d8-a5e0-27f16422b74e"
"Harvey, M.S., Gray, M.R., Hunt, G.S. & Lee, D.C.","1993","The cavernicolous Arachnida and Myriapoda of Cape Range, Western Australia","pp. 129-144","","Records of the Western Australian Museum","The Biogeography of Cape Range Western Australia","","","<!--MARK--><a href='../../../../publication/fd6ce049-68cb-4eef-898e-175dd3abd976' class='mouseoverHref'>Harvey, M.S., Gray, M.R., Hunt, G.S. & Lee, D.C. 1993. The cavernicolous Arachnida and Myriapoda of Cape Range, Western Australia. pp. 129-144</a> <!--MARK--><em>in</em> <!--MARK--><a href='../../../../publication/17cd7e8b-34fe-4639-a420-7d7fbb965dbb' class='mouseoverHref'>Humphreys, W.F. The Biogeography of Cape Range Western Australia.</a> <!--MARK--><!--MARK--><a href='../../../../publication/a2cbd1fb-97d5-493a-a1d7-c2b99709890b' class='mouseoverHref'><em>Records of the Western Australian Museum</em></a> <strong>45</strong>(Supplement)<!--MARK-->","","Section in Article","fd6ce049-68cb-4eef-898e-175dd3abd976","20081009T05:11:37.000+0000","17cd7e8b-34fe-4639-a420-7d7fbb965dbb"
"Heatwole, H., Done, T. & Cameron, E.","1981","Community Ecology of a Coral Cay: A study of One-Tree Island, Great Barrier Reef, Australia","379 pp.","","","","","W. Junk","<!--MARK--><a href='../../../../publication/caf46063-5883-4591-83e1-f4e008c0e3db' class='mouseoverHref'>Heatwole, H., Done, T. & Cameron, E. 1981. <em>Community Ecology of a Coral Cay: A study of One-Tree Island, Great Barrier Reef, Australia</em>. The Hague : W. Junk 379 pp.</a><!--MARK-->","","Book","caf46063-5883-4591-83e1-f4e008c0e3db","20081009T05:11:37.000+0000",""
"Hirst, S.","1912","Report on the mite causing Copra Itch","374-375","","Journal of Tropical Medicine and Hygiene","","","","<!--MARK--><a href='../../../../publication/bc054b7e-64de-4d59-bfb7-3bcab5b752ef' class='mouseoverHref'>Hirst, S. 1912. Report on the mite causing Copra Itch.</a> <!--MARK--><!--MARK--><a href='../../../../publication/c178cfc1-9d76-4a69-8623-944a90d5dd24' class='mouseoverHref'><em>Journal of Tropical Medicine and Hygiene</em></a> <strong>15</strong>: 374-375<!--MARK-->","","Article in Journal","bc054b7e-64de-4d59-bfb7-3bcab5b752ef","20081009T05:11:37.000+0000","c178cfc1-9d76-4a69-8623-944a90d5dd24"
"Hodgkin, L.K., Elgar, M.A. & Symonds, M.R.E.","2010","Positive and negative effects of phoretic mites on the reproductive output of an invasive bark beetle","198-204","","Australian Journal of Zoology","","","","<!--MARK--><a href='../../../../publication/35a76fa7-dbb8-40f2-be5e-440d1fcdadb0' class='mouseoverHref'>Hodgkin, L.K., Elgar, M.A. & Symonds, M.R.E. 2010. Positive and negative effects of phoretic mites on the reproductive output of an invasive bark beetle.</a> <!--MARK--><!--MARK--><a href='../../../../publication/53c3abd8-0254-4532-a73e-d9ef6b7ac2ef' class='mouseoverHref'><em>Australian Journal of Zoology</em></a> <strong>58</strong>: 198-204<!--MARK-->","","Article in Journal","35a76fa7-dbb8-40f2-be5e-440d1fcdadb0","20101007T09:15:50.099+0000","53c3abd8-0254-4532-a73e-d9ef6b7ac2ef"
"Houston, T.F.","1984","Bionomics of a pollen-collecting wasp, <i>Paragia tricolor</i> (Hymenoptera: Vespidae: Masarinae), in Western Australia","141-151","","Records of the Western Australian Museum","","","","<!--MARK--><a href='../../../../publication/c90febf9-dd2d-41de-864c-7a55676b2cf3' class='mouseoverHref'>Houston, T.F. 1984. Bionomics of a pollen-collecting wasp, <i>Paragia tricolor</i> (Hymenoptera: Vespidae: Masarinae), in Western Australia.</a> <!--MARK--><!--MARK--><a href='../../../../publication/a2cbd1fb-97d5-493a-a1d7-c2b99709890b' class='mouseoverHref'><em>Records of the Western Australian Museum</em></a> <strong>11</strong>: 141-151<!--MARK-->","","Article in Journal","c90febf9-dd2d-41de-864c-7a55676b2cf3","20081009T05:11:37.000+0000","a2cbd1fb-97d5-493a-a1d7-c2b99709890b"
