"PUB_AUTHOR","PUB_YEAR","PUB_TITLE","PUB_PAGES","PUB_PARENT_BOOK_TITLE","PUB_PARENT_JOURNAL_TITLE","PUB_PARENT_ARTICLE_TITLE","PUB_PUBLICATION_DATE","PUB_PUBLISHER","PUB_FORMATTED","PUB_QUALIFICATION","PUB_TYPE","PUBLICATION_GUID","PUBLICATION_LAST_UPDATE","PARENT_PUBLICATION_GUID"
"Allen, G.R., Seeman, O.D., Schmid-Hempel, P. & Buttermore, R.E.","2007","Low parasite loads accompany the invading population of the bumblebee, <i>Bombus terrestris</i> in Tasmania","56-63","","Insectes Sociaux","","","","<!--MARK--><a href='../../../../publication/d88e91c1-535a-4630-b342-10873a005e12' class='mouseoverHref'>Allen, G.R., Seeman, O.D., Schmid-Hempel, P. & Buttermore, R.E. 2007. Low parasite loads accompany the invading population of the bumblebee, <i>Bombus terrestris</i> in Tasmania.</a> <!--MARK--><!--MARK--><a href='../../../../publication/efe5b121-c808-4063-a667-9a1a7bec4bea' class='mouseoverHref'><em>Insectes Sociaux</em></a> <strong>54</strong>: 56-63<!--MARK-->","","Article in Journal","d88e91c1-535a-4630-b342-10873a005e12","20101117T08:58:32.279+0000","efe5b121-c808-4063-a667-9a1a7bec4bea"
"Al-Safadi, M.M.","1987","The life cycle of the Acari <i>Tyrophagus similis</i>","141-146","","Journal of Zoology, London","","","","<!--MARK--><a href='../../../../publication/a91e3a0b-bab7-43ba-a35e-5c156e2e1ef5' class='mouseoverHref'>Al-Safadi, M.M. 1987. The life cycle of the Acari <i>Tyrophagus similis</i>.</a> <!--MARK--><!--MARK--><a href='../../../../publication/e9fd3ce8-3d30-4401-bcd5-058de8d17ad6' class='mouseoverHref'><em>Journal of Zoology, London</em></a> <strong>213</strong>: 141-146<!--MARK-->","","Article in Journal","a91e3a0b-bab7-43ba-a35e-5c156e2e1ef5","20081009T05:11:37.000+0000","e9fd3ce8-3d30-4401-bcd5-058de8d17ad6"
"Baker, E.W.","1985","<I>Neotropacarus</I>, new name for <I>Tropacarus</I> Cunliffe (Acari: Acaridae).","289","","International Journal of Acarology","","","","<!--MARK--><a href='../../../../publication/8198c548-6548-4777-86bd-a4fa676edbc3' class='mouseoverHref'>Baker, E.W. 1985. <I>Neotropacarus</I>, new name for <I>Tropacarus</I> Cunliffe (Acari: Acaridae).</a> <!--MARK--><!--MARK--><a href='../../../../publication/faec4fc9-a979-4ddf-985e-e23330b3c030' class='mouseoverHref'><em>International Journal of Acarology</em></a> <strong>11</strong>: 289<!--MARK-->","","Article in Journal","8198c548-6548-4777-86bd-a4fa676edbc3","20110310T05:06:49.596+0000","faec4fc9-a979-4ddf-985e-e23330b3c030"
"Baker, G.T.","1983","Observations on the biology of <i>Rhizoglyphus robini</i> Claparède (Acaridae)","162-166","","Zeitschrift für Angewandte Entomologie","","","","<!--MARK--><a href='../../../../publication/82ea57c8-14d2-44da-9c1f-d457c989ab52' class='mouseoverHref'>Baker, G.T. 1983. Observations on the biology of <i>Rhizoglyphus robini</i> Claparède (Acaridae).</a> <!--MARK--><!--MARK--><a href='../../../../publication/651fa51a-e1e4-40f9-b784-148631ebdaf0' class='mouseoverHref'><em>Zeitschrift für Angewandte Entomologie</em></a> <strong>95</strong>: 162-166<!--MARK-->","","Article in Journal","82ea57c8-14d2-44da-9c1f-d457c989ab52","20081009T05:11:37.000+0000","651fa51a-e1e4-40f9-b784-148631ebdaf0"
"Banks, N.","1906","A revision of the Tyroglyphidae of the United States","1-34 pls I-VI","","United States Department of Agriculture. Bureau of Entomology. Technical Series","","","","<!--MARK--><a href='../../../../publication/e5b0e5de-a6ff-49cd-91e4-6cf9116b86aa' class='mouseoverHref'>Banks, N. 1906. A revision of the Tyroglyphidae of the United States.</a> <!--MARK--><!--MARK--><a href='../../../../publication/cea84925-a3a5-40ef-8114-5bdfecd2ef60' class='mouseoverHref'><em>United States Department of Agriculture. Bureau of Entomology. Technical Series</em></a> <strong>13</strong>: 1-34 pls I-VI<!--MARK-->","","Article in Journal","e5b0e5de-a6ff-49cd-91e4-6cf9116b86aa","20081009T05:11:37.000+0000","cea84925-a3a5-40ef-8114-5bdfecd2ef60"
"Banks, N.","1916","Acarians from Australian and Tasmanian ants and ant-nests","224-240 pls XXIII-XXX","","Transactions of the Royal Society of South Australia","","","","<!--MARK--><a href='../../../../publication/74b32ac0-6038-427e-825c-e4cbc0aa2a01' class='mouseoverHref'>Banks, N. 1916. Acarians from Australian and Tasmanian ants and ant-nests.</a> <!--MARK--><!--MARK--><a href='../../../../publication/8b48b0a3-dd7a-4aea-be0d-10a223710ebc' class='mouseoverHref'><em>Transactions of the Royal Society of South Australia</em></a> <strong>40</strong>: 224-240 pls XXIII-XXX<!--MARK-->","","Article in Journal","74b32ac0-6038-427e-825c-e4cbc0aa2a01","20081009T05:11:37.000+0000","8b48b0a3-dd7a-4aea-be0d-10a223710ebc"
"Barton, N.J., Stephens, L.R. & Domrow, R.","1988","Infestation of sheep with the stored product mite <i>Sancassania berlesei</i> (Acaridae)","140-143","","Australian Veterinary Journal","","","","<!--MARK--><a href='../../../../publication/fe606749-68ab-45a4-9f9f-0cf4eb0e7601' class='mouseoverHref'>Barton, N.J., Stephens, L.R. & Domrow, R. 1988. Infestation of sheep with the stored product mite <i>Sancassania berlesei</i> (Acaridae).</a> <!--MARK--><!--MARK--><a href='../../../../publication/0d20256a-6324-43b5-a6d5-a9316bda2434' class='mouseoverHref'><em>Australian Veterinary Journal</em></a> <strong>65</strong>: 140-143<!--MARK-->","","Article in Journal","fe606749-68ab-45a4-9f9f-0cf4eb0e7601","20081009T05:11:37.000+0000","0d20256a-6324-43b5-a6d5-a9316bda2434"
"Berlese, A.","1923","Centuria sesta di Acari nuovi","237-262","","Redia. Giornale di entomologia, Firenze","","","","<!--MARK--><a href='../../../../publication/ad357c6e-d20d-4166-8965-99065f95e6b9' class='mouseoverHref'>Berlese, A. 1923. Centuria sesta di Acari nuovi.</a> <!--MARK--><!--MARK--><a href='../../../../publication/116966a8-7c23-4f72-a4e3-de1b7b90f1ca' class='mouseoverHref'><em>Redia. Giornale di entomologia, Firenze</em></a> <strong>15</strong>: 237-262<!--MARK-->","","Article in Journal","ad357c6e-d20d-4166-8965-99065f95e6b9","20081009T05:11:37.000+0000","116966a8-7c23-4f72-a4e3-de1b7b90f1ca"
"Canestrini, G.","1884","Acari nuovi o poco noti","693-724 pls VI-IX","","Atti del Reale Istituto Veneto di Scienze, Lettere ed Arti","","","","<!--MARK--><a href='../../../../publication/91219d66-cf89-48de-9867-67913bdb5d16' class='mouseoverHref'>Canestrini, G. 1884. Acari nuovi o poco noti.</a> <!--MARK--><!--MARK--><a href='../../../../publication/5a2ea9cc-327b-4443-953f-3e15b41ebc8d' class='mouseoverHref'><em>Atti del Reale Istituto Veneto di Scienze, Lettere ed Arti</em></a> 6 <strong>2</strong>: 693-724 pls VI-IX<!--MARK-->","","Article in Journal","91219d66-cf89-48de-9867-67913bdb5d16","20081009T05:11:37.000+0000","5a2ea9cc-327b-4443-953f-3e15b41ebc8d"
"Canestrini, G.","1888","Prospetto dell' Acarofauna Italiana. Famiglie: Tarsonemini e Tirogilifini e Appendice agli Analgesini","309-425 pp.,  pls xx-xxxvi","","","","","Unknown","<!--MARK--><a href='../../../../publication/8567b8ea-52f2-4b83-befc-6ae9264e00bc' class='mouseoverHref'>Canestrini, G. 1888. <em>Prospetto dell' Acarofauna Italiana. Famiglie: Tarsonemini e Tirogilifini e Appendice agli Analgesini</em>. Padova : Unknown Vol. 3 309-425 pp.,  pls xx-xxxvi.</a><!--MARK-->","","Book","8567b8ea-52f2-4b83-befc-6ae9264e00bc","20100110T22:03:47.099+0000",""
"Canestrini, G. & Kramer, P.","1899","Demodicidae and Sarcoptidae","1-193 (Reprinted 1965 by Verlag Cramer, Weinheim)","","Das Tierreich","","","","<!--MARK--><a href='../../../../publication/06390a08-7b64-4b73-8772-1806ff5178b7' class='mouseoverHref'>Canestrini, G. & Kramer, P. 1899. Demodicidae and Sarcoptidae.</a> <!--MARK--><!--MARK--><a href='../../../../publication/fcb2b75c-eb8d-4868-89bd-d2fd1a2779ad' class='mouseoverHref'><em>Das Tierreich</em></a> <strong>7</strong>: 1-193 (Reprinted 1965 by Verlag Cramer, Weinheim)<!--MARK-->","","Article in Journal","06390a08-7b64-4b73-8772-1806ff5178b7","20081009T05:11:37.000+0000","fcb2b75c-eb8d-4868-89bd-d2fd1a2779ad"
"Carne, P.B. (ed.)","1987","Scientific and Common Names of Insects and Allied Forms Occurring in Australia","120 pp.","","","","","CSIRO","<!--MARK--><a href='../../../../publication/77c0c680-14bd-4ddf-b4b0-6546c3da9836' class='mouseoverHref'>Carne, P.B. (ed.) 1987. <em>Scientific and Common Names of Insects and Allied Forms Occurring in Australia</em>. Melbourne : CSIRO 120 pp.</a><!--MARK-->","","Book","77c0c680-14bd-4ddf-b4b0-6546c3da9836","20081009T05:11:37.000+0000",""
"Champ, B.R.","1965","An investigation of peanut storage pests in Queensland. 1. Introduction, species and pest status","227-240","","Queensland Journal of Agricultural and Animal Science","","","","<!--MARK--><a href='../../../../publication/e0674695-c9ca-443b-9f1f-517f2ade501b' class='mouseoverHref'>Champ, B.R. 1965. An investigation of peanut storage pests in Queensland. 1. Introduction, species and pest status.</a> <!--MARK--><!--MARK--><a href='../../../../publication/20b24b44-c62c-4381-a32a-d65f63e4a6cb' class='mouseoverHref'><em>Queensland Journal of Agricultural and Animal Science</em></a> <strong>22</strong>: 227-240<!--MARK-->","","Article in Journal","e0674695-c9ca-443b-9f1f-517f2ade501b","20081009T05:11:37.000+0000","20b24b44-c62c-4381-a32a-d65f63e4a6cb"
"Champ, B.R.","1966","Insects and mites associated with stored products in Queensland. 4. Acarina and Pseudoscorpiones","197-210","","Queensland Journal of Agricultural and Animal Science","","","","<!--MARK--><a href='../../../../publication/9d87b0ed-580d-4595-aeed-fc0097ccda56' class='mouseoverHref'>Champ, B.R. 1966. Insects and mites associated with stored products in Queensland. 4. Acarina and Pseudoscorpiones.</a> <!--MARK--><!--MARK--><a href='../../../../publication/20b24b44-c62c-4381-a32a-d65f63e4a6cb' class='mouseoverHref'><em>Queensland Journal of Agricultural and Animal Science</em></a> <strong>23</strong>: 197-210<!--MARK-->","","Article in Journal","9d87b0ed-580d-4595-aeed-fc0097ccda56","20081009T05:11:37.000+0000","20b24b44-c62c-4381-a32a-d65f63e4a6cb"
"Clancy, G.","1981","Observations of mites associated with the low yielding crops of cultivated <i>Agaricus bisporus</i> in Australia","233-244","","Mushroom Science","","","","<!--MARK--><a href='../../../../publication/860d4750-b5b9-497c-bd46-4119ed969d1c' class='mouseoverHref'>Clancy, G. 1981. Observations of mites associated with the low yielding crops of cultivated <i>Agaricus bisporus</i> in Australia.</a> <!--MARK--><!--MARK--><a href='../../../../publication/35f4a48d-cf13-4827-abd5-542e6b2ffcd3' class='mouseoverHref'><em>Mushroom Science</em></a> <strong>11</strong>: 233-244<!--MARK-->","","Article in Journal","860d4750-b5b9-497c-bd46-4119ed969d1c","20081009T05:11:37.000+0000","35f4a48d-cf13-4827-abd5-542e6b2ffcd3"
"Claparède, E.","1868","Studien an Acariden","445-546 pls XXX-XL","","Zeitschrift für Wissenschaftliche Zoologie","","","","<!--MARK--><a href='../../../../publication/049db26a-6212-48ec-b4bc-36b16ff0270c' class='mouseoverHref'>Claparède, E. 1868. Studien an Acariden.</a> <!--MARK--><!--MARK--><a href='../../../../publication/d8df55e6-ffed-4756-acd5-061bda3ce3ac' class='mouseoverHref'><em>Zeitschrift für Wissenschaftliche Zoologie</em></a> <strong>18</strong>: 445-546 pls XXX-XL<!--MARK-->","","Article in Journal","049db26a-6212-48ec-b4bc-36b16ff0270c","20081009T05:11:37.000+0000","d8df55e6-ffed-4756-acd5-061bda3ce3ac"
"Clift, A.D.","1978","The identity, economic importance and control of insect pests of mushrooms in New South Wales, Australia","367-383","","Mushroom Science","","","","<!--MARK--><a href='../../../../publication/b91e943f-d791-4f67-b231-5c060336f212' class='mouseoverHref'>Clift, A.D. 1978. The identity, economic importance and control of insect pests of mushrooms in New South Wales, Australia.</a> <!--MARK--><!--MARK--><a href='../../../../publication/35f4a48d-cf13-4827-abd5-542e6b2ffcd3' class='mouseoverHref'><em>Mushroom Science</em></a> <strong>10</strong>: 367-383<!--MARK-->","","Article in Journal","b91e943f-d791-4f67-b231-5c060336f212","20081009T05:11:37.000+0000","35f4a48d-cf13-4827-abd5-542e6b2ffcd3"
"Clift, A.D.","1979","The pest status and control of insects and mites associated with cultivated mushrooms in Australia","113-116","","Mushroom Journal","","","","<!--MARK--><a href='../../../../publication/b7968e5a-11be-40a2-b5a4-78eb8af735fb' class='mouseoverHref'>Clift, A.D. 1979. The pest status and control of insects and mites associated with cultivated mushrooms in Australia.</a> <!--MARK--><!--MARK--><a href='../../../../publication/c7f7dca4-ea5c-46dd-ac8a-7c02ace6bad6' class='mouseoverHref'><em>Mushroom Journal</em></a> <strong>75</strong>: 113-116<!--MARK-->","","Article in Journal","b7968e5a-11be-40a2-b5a4-78eb8af735fb","20081009T05:11:37.000+0000","c7f7dca4-ea5c-46dd-ac8a-7c02ace6bad6"
"Clift, A.D.","1983","Insect and mite pests of mushrooms","1-8","","Agfacts, Department of Agriculture, New South Wales","","","","<!--MARK--><a href='../../../../publication/ad35bb90-b2b7-4d08-836f-4b6252eaec98' class='mouseoverHref'>Clift, A.D. 1983. Insect and mite pests of mushrooms.</a> <!--MARK--><!--MARK--><a href='../../../../publication/cdbb0f24-890e-4d68-b3fb-7e6e81b7d3a9' class='mouseoverHref'><em>Agfacts, Department of Agriculture, New South Wales</em></a> <strong>H8.AE.3</strong>: 1-8<!--MARK-->","","Article in Journal","ad35bb90-b2b7-4d08-836f-4b6252eaec98","20081009T05:11:37.000+0000","cdbb0f24-890e-4d68-b3fb-7e6e81b7d3a9"
"Colloff, M.J.","2009","Dust Mites.","pp. 583","","","","","CSIRO Publishing","<!--MARK--><a href='../../../../publication/7c7b949c-3d36-4bd0-b651-6970487192d7' class='mouseoverHref'>Colloff, M.J. 2009. <em>Dust Mites</em>. Melbourne : CSIRO Publishing pp. 583.</a><!--MARK-->","","Book","7c7b949c-3d36-4bd0-b651-6970487192d7","20110511T21:57:22.631+0000",""
"Colloff, M.J., Stewart, G.A. & Thompson, P.J.","1991","House dust acarofauna and <i>Der p</i> I equivalent in Australia : the relative importance of <i>Dermatophagoides pteronyssinus</i> and <i>Euroglyphus maynei</i>","225-230","","Clinical and Experimental Allergy","","","","<!--MARK--><a href='../../../../publication/336c1f58-a61d-4e75-a992-19010e57de80' class='mouseoverHref'>Colloff, M.J., Stewart, G.A. & Thompson, P.J. 1991. House dust acarofauna and <i>Der p</i> I equivalent in Australia : the relative importance of <i>Dermatophagoides pteronyssinus</i> and <i>Euroglyphus maynei</i>.</a> <!--MARK--><!--MARK--><a href='../../../../publication/55b07206-0c15-4ae0-a7db-73640ee483c1' class='mouseoverHref'><em>Clinical and Experimental Allergy</em></a> <strong>21</strong>: 225-230<!--MARK-->","","Article in Journal","336c1f58-a61d-4e75-a992-19010e57de80","20081009T05:11:37.000+0000","55b07206-0c15-4ae0-a7db-73640ee483c1"
"Conroy, R.J., Darley, E.C. & Shanahan, G.J.","1966","Mushroom Culture","1-64","","NSW Department of Agriculture Bulletin","","","","<!--MARK--><a href='../../../../publication/607fb448-fed0-4064-bc8a-ac4d6b811c39' class='mouseoverHref'>Conroy, R.J., Darley, E.C. & Shanahan, G.J. 1966. Mushroom Culture.</a> <!--MARK--><!--MARK--><a href='../../../../publication/c2a3695f-10c2-4526-aa0c-ea0db1ec1a88' class='mouseoverHref'><em>NSW Department of Agriculture Bulletin</em></a> <strong>17</strong>: 1-64<!--MARK-->","","Article in Journal","607fb448-fed0-4064-bc8a-ac4d6b811c39","20081009T05:11:37.000+0000","c2a3695f-10c2-4526-aa0c-ea0db1ec1a88"
"Costa, M.","1975","<i>Hunteracarus womersleyi</i> gen. n., sp. n., a laelapid mite (Acari) associated with <i>Cephalodesmius armiger</i> Westwood (Coleoptera : Scarabaeidae)","263-269","","Journal of the Australian Entomological Society","","","","<!--MARK--><a href='../../../../publication/8c3fe713-5d5c-43d9-975a-ed1c25d8bd52' class='mouseoverHref'>Costa, M. 1975. <i>Hunteracarus womersleyi</i> gen. n., sp. n., a laelapid mite (Acari) associated with <i>Cephalodesmius armiger</i> Westwood (Coleoptera : Scarabaeidae).</a> <!--MARK--><!--MARK--><a href='../../../../publication/c2544f9f-3978-4f18-846d-a1fd3122c9c4' class='mouseoverHref'><em>Journal of the Australian Entomological Society</em></a> <strong>14</strong>: 263-269<!--MARK-->","","Article in Journal","8c3fe713-5d5c-43d9-975a-ed1c25d8bd52","20081009T05:11:37.000+0000","c2544f9f-3978-4f18-846d-a1fd3122c9c4"
"Delfinado-Baker, M., Baker, E.W. & Phoon, A.C.G.","1989","Mites (Acari) associated with bees (Apidae) in Asia, with description of a new species","609-610, 612-613","","American Bee Journal","","","","<!--MARK--><a href='../../../../publication/0852c71e-262b-4751-9faf-4cc5b1d1b27a' class='mouseoverHref'>Delfinado-Baker, M., Baker, E.W. & Phoon, A.C.G. 1989. Mites (Acari) associated with bees (Apidae) in Asia, with description of a new species.</a> <!--MARK--><!--MARK--><a href='../../../../publication/09f0eacf-1707-4529-bd99-f035bd3151f3' class='mouseoverHref'><em>American Bee Journal</em></a> <strong>129</strong>: 609-610, 612-613<!--MARK-->","","Article in Journal","0852c71e-262b-4751-9faf-4cc5b1d1b27a","20081009T05:11:37.000+0000","09f0eacf-1707-4529-bd99-f035bd3151f3"
"Delfinado-Baker, M. & Baker, E.W.","1989","A new mite in beehives : <i>Forcellinia faini</i>, n. sp. (Acari : Acaridae)","127-128","","American Bee Journal","","","","<!--MARK--><a href='../../../../publication/3343bf33-4f88-4356-be25-a0aacf6a2457' class='mouseoverHref'>Delfinado-Baker, M. & Baker, E.W. 1989. A new mite in beehives : <i>Forcellinia faini</i>, n. sp. (Acari : Acaridae).</a> <!--MARK--><!--MARK--><a href='../../../../publication/09f0eacf-1707-4529-bd99-f035bd3151f3' class='mouseoverHref'><em>American Bee Journal</em></a> <strong>129</strong>: 127-128<!--MARK-->","","Article in Journal","3343bf33-4f88-4356-be25-a0aacf6a2457","20081009T05:11:37.000+0000","09f0eacf-1707-4529-bd99-f035bd3151f3"
"Díaz, A., Okabe, K., Eckenrode, C.J., Villani, M.G. & OConnor, B.M.","2000","Biology, ecology, and management of the bulb mites of the genus <I>Rhizoglyphus</I> (Acari: Acaridae).","85-113","","Experimental and Applied Acarology","","","","<!--MARK--><a href='../../../../publication/0350da7e-ceab-4984-9c70-7dae43155b53' class='mouseoverHref'>Díaz, A., Okabe, K., Eckenrode, C.J., Villani, M.G. & OConnor, B.M. 2000. Biology, ecology, and management of the bulb mites of the genus <I>Rhizoglyphus</I> (Acari: Acaridae).</a> <!--MARK--><!--MARK--><a href='../../../../publication/2c1681ed-7d3f-420e-8b04-38c7c988f58b' class='mouseoverHref'><em>Experimental and Applied Acarology</em></a> <strong>24</strong>: 85-113<!--MARK-->","","Article in Journal","0350da7e-ceab-4984-9c70-7dae43155b53","20110207T23:40:57.003+0000","2c1681ed-7d3f-420e-8b04-38c7c988f58b"
"Domrow, R.","1992","Acari Astigmata (excluding feather mites) parasitic on Australian vertebrates: an annotated checklist, keys and bibliography","1459-1606","","Invertebrate Taxonomy","","","","<!--MARK--><a href='../../../../publication/6ac65528-cc27-4d30-ba43-4240f33d5a66' class='mouseoverHref'>Domrow, R. 1992. Acari Astigmata (excluding feather mites) parasitic on Australian vertebrates: an annotated checklist, keys and bibliography.</a> <!--MARK--><!--MARK--><a href='../../../../publication/9846f41b-d755-4682-9049-5e59d363951b' class='mouseoverHref'><em>Invertebrate Taxonomy</em></a> <strong>6</strong>: 1459-1606<!--MARK-->","","Article in Journal","6ac65528-cc27-4d30-ba43-4240f33d5a66","20081009T05:11:37.000+0000","9846f41b-d755-4682-9049-5e59d363951b"
"Domrow, R. & Smith, D.J.W.","1956","Acarina from five hundred native mammals from Queensland","201-206","","Proceedings of the Linnean Society of New South Wales","","","","<!--MARK--><a href='../../../../publication/20ac8247-f180-4db1-b16b-fc78055ea5be' class='mouseoverHref'>Domrow, R. & Smith, D.J.W. 1956. Acarina from five hundred native mammals from Queensland.</a> <!--MARK--><!--MARK--><a href='../../../../publication/c12cd779-adb5-41ea-bd2c-75f6864cf22e' class='mouseoverHref'><em>Proceedings of the Linnean Society of New South Wales</em></a> <strong>80</strong>: 201-206<!--MARK-->","","Article in Journal","20ac8247-f180-4db1-b16b-fc78055ea5be","20081009T05:11:37.000+0000","c12cd779-adb5-41ea-bd2c-75f6864cf22e"
"Donnadieu, A.L.","1868","Recherches anatomiques et zoologiques sur le genre <i>Trichdactyle</i>","69-85 pl. 1","","Annales des Sciences Naturelles, Paris","","","","<!--MARK--><a href='../../../../publication/74bd649d-926e-4639-9585-addf48cb5a40' class='mouseoverHref'>Donnadieu, A.L. 1868. Recherches anatomiques et zoologiques sur le genre <i>Trichdactyle</i>.</a> <!--MARK--><!--MARK--><a href='../../../../publication/8728aca1-f2e1-4662-b5b6-40183f95151b' class='mouseoverHref'><em>Annales des Sciences Naturelles, Paris</em></a> V <strong>10</strong>: 69-85 pl. 1<!--MARK-->","","Article in Journal","74bd649d-926e-4639-9585-addf48cb5a40","20081009T05:11:37.000+0000","8728aca1-f2e1-4662-b5b6-40183f95151b"
"Dujardin, F.","1849","Additions au mémoire sur les <i>Hypopus</i>","259-265 + Plate II","","Annales des Sciences Naturelles, Zoologie","","","","<!--MARK--><a href='../../../../publication/bca1001f-657d-4b12-8eca-5fab1a34334b' class='mouseoverHref'>Dujardin, F. 1849. Additions au mémoire sur les <i>Hypopus</i>.</a> <!--MARK--><!--MARK--><a href='../../../../publication/50cfb179-94f7-42cc-b386-18673adebfc1' class='mouseoverHref'><em>Annales des Sciences Naturelles, Zoologie</em></a> 3 <strong>12</strong>: 259-265 + Plate II<!--MARK-->","","Article in Journal","bca1001f-657d-4b12-8eca-5fab1a34334b","20100830T21:28:03.342+0000","50cfb179-94f7-42cc-b386-18673adebfc1"
"Emery, R.N. & Nayak, M.K.","2007","Pests of stored grains.","pp. 40-62","Pests of Field Crops and Pastures. Identification and Control.","","","","","<!--MARK--><a href='../../../../publication/1b66ffaf-810f-4d1c-a782-7bd52c469225' class='mouseoverHref'>Emery, R.N. & Nayak, M.K. 2007. Pests of stored grains. pp. 40-62</a> <!--MARK--><em>in</em> <!--MARK--><a href='../../../../publication/6d4cf618-a629-48b6-9016-bddc34e021cf' class='mouseoverHref'>Bailey, P.T. (ed.). <em>Pests of Field Crops and Pastures. Identification and Control</em>. Melbourne : CSIRO Publishing pp. 520.</a><!--MARK-->","","Chapter in Book","1b66ffaf-810f-4d1c-a782-7bd52c469225","20110511T18:16:39.604+0000","6d4cf618-a629-48b6-9016-bddc34e021cf"
"Eyndhoven, G.L.van","1968","<i>Rhizoglyphus engeli</i> nov. spec., with notes on the genus <i>Rhizoglyphus</i> (Acari, Acaridae)","95-103","","Beaufortia","","","","<!--MARK--><a href='../../../../publication/c86a8e4f-0bf8-4240-831b-ff1f868c8a77' class='mouseoverHref'>Eyndhoven, G.L.van 1968. <i>Rhizoglyphus engeli</i> nov. spec., with notes on the genus <i>Rhizoglyphus</i> (Acari, Acaridae).</a> <!--MARK--><!--MARK--><a href='../../../../publication/a4b0ec84-2d82-4181-8ee0-a4cc499b66fc' class='mouseoverHref'><em>Beaufortia</em></a> <strong>193</strong>: 95-103<!--MARK-->","","Article in Journal","c86a8e4f-0bf8-4240-831b-ff1f868c8a77","20081009T05:11:37.000+0000","a4b0ec84-2d82-4181-8ee0-a4cc499b66fc"
"Fain, A.","1977","Caractères comparés des hypopes de <i>Rhizoglyphus echinopus</i> Fum. et Robin et de <i>Sancassania chelone</i> Oudemans (Astigmates : Acaridae)","105-111","","Acarologia","","","","<!--MARK--><a href='../../../../publication/ff953274-d62a-42e4-acfb-0e544c96b614' class='mouseoverHref'>Fain, A. 1977. Caractères comparés des hypopes de <i>Rhizoglyphus echinopus</i> Fum. et Robin et de <i>Sancassania chelone</i> Oudemans (Astigmates : Acaridae).</a> <!--MARK--><!--MARK--><a href='../../../../publication/ca52b0dd-4050-4ed0-b7a9-fad0329897d3' class='mouseoverHref'><em>Acarologia</em></a> <strong>19</strong>: 105-111<!--MARK-->","","Article in Journal","ff953274-d62a-42e4-acfb-0e544c96b614","20081009T05:11:37.000+0000","ca52b0dd-4050-4ed0-b7a9-fad0329897d3"
"Fain, A.","1977","Notes sur le genre <i>Schwiebea</i> Oudemans, 1916 (Acarina, Astigmata, Acaridae)","251-276","","Bulletin et Annales de la Société Royale Belgique d'Entomologie","","","","<!--MARK--><a href='../../../../publication/8b670850-4cb5-4e08-9965-dcf2878b1fa0' class='mouseoverHref'>Fain, A. 1977. Notes sur le genre <i>Schwiebea</i> Oudemans, 1916 (Acarina, Astigmata, Acaridae).</a> <!--MARK--><!--MARK--><a href='../../../../publication/931619a7-755d-40e2-8d8a-2805dca68be9' class='mouseoverHref'><em>Bulletin et Annales de la Société Royale Belgique d'Entomologie</em></a> <strong>113</strong>: 251-276<!--MARK-->","","Article in Journal","8b670850-4cb5-4e08-9965-dcf2878b1fa0","20081009T05:11:37.000+0000","931619a7-755d-40e2-8d8a-2805dca68be9"
"Fain, A.","1982","Revision des genres <i>Thyreophagus</i> Rondani, 1874 et <i>Michaelopus</i> Fain & Johnston, 1974 (Acari, Acaridae) avec description de neuf espèces nouvelles","1-47","","Bulletin de l'Institut Royal des Sciences Naturelles de Belgique, Entomologie","","","","<!--MARK--><a href='../../../../publication/6401ed22-83af-4699-8d17-7f89dbcf94f5' class='mouseoverHref'>Fain, A. 1982. Revision des genres <i>Thyreophagus</i> Rondani, 1874 et <i>Michaelopus</i> Fain & Johnston, 1974 (Acari, Acaridae) avec description de neuf espèces nouvelles.</a> <!--MARK--><!--MARK--><a href='../../../../publication/3fa06c09-f9f6-4877-828c-e82cbd6a83fa' class='mouseoverHref'><em>Bulletin de l'Institut Royal des Sciences Naturelles de Belgique, Entomologie</em></a> <strong>54</strong>(7): 1-47<!--MARK-->","","Article in Journal","6401ed22-83af-4699-8d17-7f89dbcf94f5","20081009T05:11:37.000+0000","3fa06c09-f9f6-4877-828c-e82cbd6a83fa"
