"PUB_AUTHOR","PUB_YEAR","PUB_TITLE","PUB_PAGES","PUB_PARENT_BOOK_TITLE","PUB_PARENT_JOURNAL_TITLE","PUB_PARENT_ARTICLE_TITLE","PUB_PUBLICATION_DATE","PUB_PUBLISHER","PUB_FORMATTED","PUB_QUALIFICATION","PUB_TYPE","PUBLICATION_GUID","PUBLICATION_LAST_UPDATE","PARENT_PUBLICATION_GUID"
"Houston, T.F.","1988","The symbiosis of acarid mites, genus <i>Ctenocolletacarus</i> (Acarina: Acariformes), and stenotritid bees, genus <i>Ctenocolletes</i> (Insecta: Hymenoptera)","459-468","","Australian Journal of Zoology","","31/12/1988","","<!--MARK--><a href='../../../../publication/20e7eeea-5ccd-4d72-9c24-0a3ac1b0122b' class='mouseoverHref'>Houston, T.F. 1988. The symbiosis of acarid mites, genus <i>Ctenocolletacarus</i> (Acarina: Acariformes), and stenotritid bees, genus <i>Ctenocolletes</i> (Insecta: Hymenoptera).</a> <!--MARK--><!--MARK--><a href='../../../../publication/53c3abd8-0254-4532-a73e-d9ef6b7ac2ef' class='mouseoverHref'><em>Australian Journal of Zoology</em></a> <strong>35</strong>(1987): 459-468<!--MARK--> [Date published 31/12/1988]","","Article in Journal","20e7eeea-5ccd-4d72-9c24-0a3ac1b0122b","20081009T05:11:37.000+0000","53c3abd8-0254-4532-a73e-d9ef6b7ac2ef"
"Hughes, A.M.","1948","A new Tyroglyphid mite, <i>Suidasia nesbitti</i>, sp. n","543-552","","Proceedings of the Zoological Society of London","","","","<!--MARK--><a href='../../../../publication/4047d7d5-1c17-4a57-ace0-0754ce7d71c8' class='mouseoverHref'>Hughes, A.M. 1948. A new Tyroglyphid mite, <i>Suidasia nesbitti</i>, sp. n.</a> <!--MARK--><!--MARK--><a href='../../../../publication/511f299d-99ec-413c-bc4c-04a380829c96' class='mouseoverHref'><em>Proceedings of the Zoological Society of London</em></a> <strong>118</strong>: 543-552<!--MARK-->","","Article in Journal","4047d7d5-1c17-4a57-ace0-0754ce7d71c8","20081009T05:11:37.000+0000","511f299d-99ec-413c-bc4c-04a380829c96"
"Hughes, A.M.","1957","A new species of <i>Acarus</i> (<i>A. gracilis</i> sp. n.) belonging to the family Tyroglyphidae Donnadieu 1868, (Acarina)","753-761","","Annals and Magazine of Natural History","","","","<!--MARK--><a href='../../../../publication/4a53617b-7ccb-40ae-918e-601ec6c9db27' class='mouseoverHref'>Hughes, A.M. 1957. A new species of <i>Acarus</i> (<i>A. gracilis</i> sp. n.) belonging to the family Tyroglyphidae Donnadieu 1868, (Acarina).</a> <!--MARK--><!--MARK--><a href='../../../../publication/efa8de69-3a29-4a43-8ef2-cbefda205976' class='mouseoverHref'><em>Annals and Magazine of Natural History</em></a> 12 <strong>10</strong>: 753-761<!--MARK-->","","Article in Journal","4a53617b-7ccb-40ae-918e-601ec6c9db27","20081009T05:11:37.000+0000","efa8de69-3a29-4a43-8ef2-cbefda205976"
"Hughes, A.M.","1961","The Mites of Stored Food Ministry of Agriculture, Fisheries and Food, Technical Bulletin no. 9","287 pp.","","","","","Her Majesty's Stationery Office","<!--MARK--><a href='../../../../publication/c876d5da-19d3-479a-90f4-85cd4504eefd' class='mouseoverHref'>Hughes, A.M. 1961. <em>The Mites of Stored Food Ministry of Agriculture, Fisheries and Food, Technical Bulletin no. 9</em>. London : Her Majesty's Stationery Office 287 pp.</a><!--MARK-->","","Book","c876d5da-19d3-479a-90f4-85cd4504eefd","20100714T06:08:14.418+0000",""
"Hughes, A.M.","1976","The Mites of Stored Food and Houses. Ministry of Agriculture, Fisheries and Food, Technical Bulletin","400 pp.","","","","","Her Majesty's Stationery Office","<!--MARK--><a href='../../../../publication/81b95922-878c-47ba-b1b8-7131bdf70db4' class='mouseoverHref'>Hughes, A.M. 1976. <em>The Mites of Stored Food and Houses. Ministry of Agriculture, Fisheries and Food, Technical Bulletin</em>. London : Her Majesty's Stationery Office Vol. 9 400 pp.</a><!--MARK-->","","Book","81b95922-878c-47ba-b1b8-7131bdf70db4","20101223T23:47:52.411+0000",""
"ICZN","1985","Opinion 1298. <i>Tyrophagus</i> Oudemans, 1924 (Acarina) Clarification of name of type species and conservation","124-127","","Bulletin of Zoological Nomenclature","","","","<!--MARK--><a href='../../../../publication/9928e487-a9f7-4892-9e99-ed5ef2680445' class='mouseoverHref'>ICZN 1985. Opinion 1298. <i>Tyrophagus</i> Oudemans, 1924 (Acarina) Clarification of name of type species and conservation.</a> <!--MARK--><!--MARK--><a href='../../../../publication/a4cf2b4b-baae-48a9-9e16-867e582bfbcc' class='mouseoverHref'><em>Bulletin of Zoological Nomenclature</em></a> <strong>42</strong>: 124-127<!--MARK-->","","Article in Journal","9928e487-a9f7-4892-9e99-ed5ef2680445","20110221T21:53:13.389+0000","a4cf2b4b-baae-48a9-9e16-867e582bfbcc"
"James, D.G.","1993","Pollen, mould mites and fungi: improvements to mass rearing of <i>Typhlodromus doreenae</i> and <i>Amblyseius victoriensis</i>","271-276","","Experimental and Applied Acarology","","","","<!--MARK--><a href='../../../../publication/2893ff7e-bc67-4321-9b59-18eb7b4051f2' class='mouseoverHref'>James, D.G. 1993. Pollen, mould mites and fungi: improvements to mass rearing of <i>Typhlodromus doreenae</i> and <i>Amblyseius victoriensis</i>.</a> <!--MARK--><!--MARK--><a href='../../../../publication/2c1681ed-7d3f-420e-8b04-38c7c988f58b' class='mouseoverHref'><em>Experimental and Applied Acarology</em></a> <strong>17</strong>: 271-276<!--MARK-->","","Article in Journal","2893ff7e-bc67-4321-9b59-18eb7b4051f2","20081009T05:11:37.000+0000","2c1681ed-7d3f-420e-8b04-38c7c988f58b"
"Johnston, D.E. & Bruce, W.A.","1965","<I>Tyrophagus neiswanderi</I>, a new acarid mite of agricultural importance.","1-17","","Ohio Agricultural Research and Development Center Research Bulletin","","","","<!--MARK--><a href='../../../../publication/d53609a1-b9cd-4f74-9708-25041d512776' class='mouseoverHref'>Johnston, D.E. & Bruce, W.A. 1965. <I>Tyrophagus neiswanderi</I>, a new acarid mite of agricultural importance.</a> <!--MARK--><!--MARK--><a href='../../../../publication/bd287bf3-53ab-4bc3-a341-23f0f2475f36' class='mouseoverHref'><em>Ohio Agricultural Research and Development Center Research Bulletin</em></a> <strong>977</strong>: 1-17<!--MARK-->","","Article in Journal","d53609a1-b9cd-4f74-9708-25041d512776","20110602T04:04:23.518+0000","bd287bf3-53ab-4bc3-a341-23f0f2475f36"
"Klimov, P.B. & OConnor, B.M.","2003","Phylogeny, historical ecology and systematics of some mushroom-associated mites of the genus <I>Sancassania</I> (Acari: Acaridae), with new generic synonymies.","469-514","","Invertebrate Systematics","","","","<!--MARK--><a href='../../../../publication/3048f331-d5ef-4d4a-b625-ee9d49b76fb8' class='mouseoverHref'>Klimov, P.B. & OConnor, B.M. 2003. Phylogeny, historical ecology and systematics of some mushroom-associated mites of the genus <I>Sancassania</I> (Acari: Acaridae), with new generic synonymies.</a> <!--MARK--><!--MARK--><a href='../../../../publication/7ef62e6c-73cc-4912-8ea7-5752f95e8e8a' class='mouseoverHref'><em>Invertebrate Systematics</em></a> <strong>17</strong>: 469-514<!--MARK-->","","Article in Journal","3048f331-d5ef-4d4a-b625-ee9d49b76fb8","20110904T22:14:05.805+0000","7ef62e6c-73cc-4912-8ea7-5752f95e8e8a"
"Klimov, P.B. & OConnor, B.M.","2009","Conservation of the name <i>Tyrophagus putrescentiae</i>, a medically and economically important mite species (Acari: Acaridae)","95-114","","International Journal of Acarology","","","","<!--MARK--><a href='../../../../publication/68d8079f-29ce-434d-bf81-383f8aae0273' class='mouseoverHref'>Klimov, P.B. & OConnor, B.M. 2009. Conservation of the name <i>Tyrophagus putrescentiae</i>, a medically and economically important mite species (Acari: Acaridae).</a> <!--MARK--><!--MARK--><a href='../../../../publication/faec4fc9-a979-4ddf-985e-e23330b3c030' class='mouseoverHref'><em>International Journal of Acarology</em></a> <strong>35</strong>: 95-114<!--MARK-->","","Article in Journal","68d8079f-29ce-434d-bf81-383f8aae0273","20100823T03:20:27.936+0000","faec4fc9-a979-4ddf-985e-e23330b3c030"
"Klimov, P.B. & OConnor, B.M.","2010","<i>Acarus putrescentiae</i> Schrank, 1781 (currently <i>Tyrophagus putrescenitae</i>; Acariformes, Acaridae): proposed conservation of usage by designation of a replacement neotype","24-27","","Bulletin of Zoological Nomenclature","","","","<!--MARK--><a href='../../../../publication/1da5f8c2-a80a-4481-9d15-0ae54e5dc286' class='mouseoverHref'>Klimov, P.B. & OConnor, B.M. 2010. <i>Acarus putrescentiae</i> Schrank, 1781 (currently <i>Tyrophagus putrescenitae</i>; Acariformes, Acaridae): proposed conservation of usage by designation of a replacement neotype.</a> <!--MARK--><!--MARK--><a href='../../../../publication/a4cf2b4b-baae-48a9-9e16-867e582bfbcc' class='mouseoverHref'><em>Bulletin of Zoological Nomenclature</em></a> <strong>67</strong>: 24-27<!--MARK-->","","Article in Journal","1da5f8c2-a80a-4481-9d15-0ae54e5dc286","20100823T03:17:23.227+0000","a4cf2b4b-baae-48a9-9e16-867e582bfbcc"
"Koch, L.E.","1986","The holotypes of the Acari (Arthropoda : Arachnida) in the Western Australian Museum","53-65","","Records of the Western Australian Museum","","","","<!--MARK--><a href='../../../../publication/396e8174-b069-4af1-9bf9-5b68c925cb9e' class='mouseoverHref'>Koch, L.E. 1986. The holotypes of the Acari (Arthropoda : Arachnida) in the Western Australian Museum.</a> <!--MARK--><!--MARK--><a href='../../../../publication/a2cbd1fb-97d5-493a-a1d7-c2b99709890b' class='mouseoverHref'><em>Records of the Western Australian Museum</em></a> <strong>13</strong>: 53-65<!--MARK-->","","Article in Journal","396e8174-b069-4af1-9bf9-5b68c925cb9e","20081009T05:11:37.000+0000","a2cbd1fb-97d5-493a-a1d7-c2b99709890b"
"Laboulbène, A.","1852","Une note contenant la description d'un <i>Acarus</i> qui se développe très souvent sur les insectes","54","","Bulletin de la Société Entomologique de France","","","","<!--MARK--><a href='../../../../publication/74a37fec-fe8c-4c0b-9d83-3b33ff9ae18f' class='mouseoverHref'>Laboulbène, A. 1852. Une note contenant la description d'un <i>Acarus</i> qui se développe très souvent sur les insectes.</a> <!--MARK--><!--MARK--><a href='../../../../publication/7853f77c-aa1b-42ec-bc2c-9758f7ff72c7' class='mouseoverHref'><em>Bulletin de la Société Entomologique de France</em></a> 2 <strong>10</strong>: 54<!--MARK-->","","Article in Journal","74a37fec-fe8c-4c0b-9d83-3b33ff9ae18f","20081009T05:11:37.000+0000","7853f77c-aa1b-42ec-bc2c-9758f7ff72c7"
"Laboulbène, A. & Robin, C.","1862","Description de L'<i>Acarus (Tyroglyphus) entomophagus</i> Laboulbène et observations anatomiques sur le genre <i>Tyroglyphus</i>","317-338 pl. 10","","Annales de la Société Entomologique de France","","","","<!--MARK--><a href='../../../../publication/ed019482-0e1f-477d-9af1-9343585dfbe5' class='mouseoverHref'>Laboulbène, A. & Robin, C. 1862. Description de L'<i>Acarus (Tyroglyphus) entomophagus</i> Laboulbène et observations anatomiques sur le genre <i>Tyroglyphus</i>.</a> <!--MARK--><!--MARK--><a href='../../../../publication/6462279b-2aaf-46a3-a434-cab7d8a2c33d' class='mouseoverHref'><em>Annales de la Société Entomologique de France</em></a> 4 <strong>2</strong>: 317-338 pl. 10<!--MARK-->","","Article in Journal","ed019482-0e1f-477d-9af1-9343585dfbe5","20081009T05:11:37.000+0000","6462279b-2aaf-46a3-a434-cab7d8a2c33d"
"Latreille, P.A.","1796","Précis des Caractères génériques des Insectes, disposés dans un order naturel par citoyen Latreille","xiv 201 pp. 5 pls","","","","","F. Bourdeaux","<!--MARK--><a href='../../../../publication/0030c279-1ff5-40e2-bd9d-0937961910c3' class='mouseoverHref'>Latreille, P.A. 1796. <em>Précis des Caractères génériques des Insectes, disposés dans un order naturel par citoyen Latreille</em>. Brive : F. Bourdeaux xiv 201 pp. 5 pls.</a><!--MARK-->","","Book","0030c279-1ff5-40e2-bd9d-0937961910c3","20111102T21:17:02.041+0000",""
"Latreille, P.A.","1802","Histoire Naturelle, Générale et Particulière des Crustacés et des Insectes. Ouvrage faisant suite à l?histoire naturelle générale et particulière, composée par Leclerc de Buffon, et rédigée par C.S. Sonnini, membre de plusieurs sociétés savantes. Familles naturelles des genres. Tome troisième.","xii + 13-467 + [1] pp.","","","","","F. Dufart","<!--MARK--><a href='../../../../publication/6f173923-80dc-4723-b34c-8d67e8b4b3ee' class='mouseoverHref'>Latreille, P.A. 1802. <em>Histoire Naturelle, Générale et Particulière des Crustacés et des Insectes. Ouvrage faisant suite à l?histoire naturelle générale et particulière, composée par Leclerc de Buffon, et rédigée par C.S. Sonnini, membre de plusieurs sociétés savantes. Familles naturelles des genres. Tome troisième</em>. Paris : F. Dufart xii + 13-467 + [1] pp.</a><!--MARK--> [An X (title page = 1802)]","An X (title page = 1802)","Book","6f173923-80dc-4723-b34c-8d67e8b4b3ee","20190116T04:15:43.496+0000",""
"Lea, A.M.","1908","Insect and Fungus Pests of the Orchard and Farm","175 pp.","","","","","Government Printer","<!--MARK--><a href='../../../../publication/ef6af46f-66f2-4f87-b5e5-ee0b8bff746b' class='mouseoverHref'>Lea, A.M. 1908. <em>Insect and Fungus Pests of the Orchard and Farm</em>. Hobart, Tasmania : Government Printer 3, 175 pp.</a><!--MARK-->","","Book","ef6af46f-66f2-4f87-b5e5-ee0b8bff746b","20120127T00:37:11.667+0000",""
"Lee, D.C.","1985","Mites of South Australian Soils. pp. 57-59 <i>in</i> . (eds) Western Australian Institute of Technology, School of Biology Bulletin number 12","57-59","","","","","","<!--MARK--><a href='../../../../publication/1f5d59b7-0ea4-4903-a243-878ff37e1fb0' class='mouseoverHref'>Lee, D.C. 1985. Mites of South Australian Soils. pp. 57-59 <i>in</i> . (eds) Western Australian Institute of Technology, School of Biology Bulletin number 12. Soil and Litter Invertebrates of Some Australian Mediterranean-Type Ecosystems. 57-59 pp.</a>","","Miscellaneous","1f5d59b7-0ea4-4903-a243-878ff37e1fb0","20081009T05:11:37.000+0000",""
"Lee, D.C. & Southcott, R.V.","1979","Spiders and other Arachnids of South Australia. <i>In</i> South Australian Yearbook, 1979","15","","","","","","<!--MARK--><a href='../../../../publication/5451b1e2-1a22-4552-b710-9b0d1c1d0de2' class='mouseoverHref'>Lee, D.C. & Southcott, R.V. 1979. Spiders and other Arachnids of South Australia. <i>In</i> South Australian Yearbook, 1979. South Australian Government Printer : Adelaide. 15 pp.</a>","","Miscellaneous","5451b1e2-1a22-4552-b710-9b0d1c1d0de2","20081009T05:11:37.000+0000",""
"Linnaeus, C.","1758","Systema naturae per regna tria naturae, secundem classes, ordines, genera, species, cum characteribus, differentis, synonymis, locis. Editio decima, reformata","824","","","","","Laurentii Salvii","<!--MARK--><a href='../../../../publication/95f7aebe-acdc-4241-a7a8-403bf099042e' class='mouseoverHref'>Linnaeus, C. 1758. <em>Systema naturae per regna tria naturae, secundem classes, ordines, genera, species, cum characteribus, differentis, synonymis, locis. Editio decima, reformata</em>. Holmiae : Laurentii Salvii Tomus I 824 pp.</a><!--MARK-->","","Book","95f7aebe-acdc-4241-a7a8-403bf099042e","20171116T23:58:37.127+0000",""
"Longstaff, B.C., Greenslade, P.J.M., Colloff, M., Reid, I., Hart, P. & Packer, I.","1999","Managing Soils in Agriculture. The Impact of Soil Tillage Practices on Soil Fauna.","pp. 65","","","","","Rural Industries Research and Development Corporation Publication No 99/18.","<!--MARK--><a href='../../../../publication/ebcf9d9f-110d-45da-82cb-dd9489f383d5' class='mouseoverHref'>Longstaff, B.C., Greenslade, P.J.M., Colloff, M., Reid, I., Hart, P. & Packer, I. 1999. <em>Managing Soils in Agriculture. The Impact of Soil Tillage Practices on Soil Fauna</em>. Canberra, Australia : Rural Industries Research and Development Corporation Publication No 99/18. pp. 65.</a><!--MARK-->","","Book","ebcf9d9f-110d-45da-82cb-dd9489f383d5","20110306T04:13:45.053+0000",""
"Manson, D.C.M.","1972","A contribution to the study of the genus <i>Rhizoglyphus</i> Claparede, 1869 (Acarina : Acaridae)","621-650","","Acarologia","","","","<!--MARK--><a href='../../../../publication/afbfd074-5fcd-4c13-8e88-e7fc3ef26332' class='mouseoverHref'>Manson, D.C.M. 1972. A contribution to the study of the genus <i>Rhizoglyphus</i> Claparede, 1869 (Acarina : Acaridae).</a> <!--MARK--><!--MARK--><a href='../../../../publication/ca52b0dd-4050-4ed0-b7a9-fad0329897d3' class='mouseoverHref'><em>Acarologia</em></a> <strong>13</strong>: 621-650<!--MARK-->","","Article in Journal","afbfd074-5fcd-4c13-8e88-e7fc3ef26332","20081009T05:11:37.000+0000","ca52b0dd-4050-4ed0-b7a9-fad0329897d3"
"Manson, D.C.M.","1972","Three new species, and a redescription of mites of the genus <i>Schwiebia</i> (Acarina : Tyroglyphidae)","71-80","","Acarologia","","","","<!--MARK--><a href='../../../../publication/95e37946-640d-4011-9fd9-49712ee8fed3' class='mouseoverHref'>Manson, D.C.M. 1972. Three new species, and a redescription of mites of the genus <i>Schwiebia</i> (Acarina : Tyroglyphidae).</a> <!--MARK--><!--MARK--><a href='../../../../publication/ca52b0dd-4050-4ed0-b7a9-fad0329897d3' class='mouseoverHref'><em>Acarologia</em></a> <strong>14</strong>: 71-80<!--MARK-->","","Article in Journal","95e37946-640d-4011-9fd9-49712ee8fed3","20081009T05:11:37.000+0000","ca52b0dd-4050-4ed0-b7a9-fad0329897d3"
"Mathur, S. & Dalal, M.","1989","Influence of food quality on the development and growth of the acarid mite, <i>Suidasia nesbitti</i> (Acari : Acaridae)","231-239","Progress in Acarology","","","","","<!--MARK--><a href='../../../../publication/2a825e76-d519-4d8d-985c-9344c1d200d9' class='mouseoverHref'>Mathur, S. & Dalal, M. 1989. Influence of food quality on the development and growth of the acarid mite, <i>Suidasia nesbitti</i> (Acari : Acaridae). pp. 231-239</a> <!--MARK--><em>in</em> <!--MARK--><a href='../../../../publication/eaaa5b07-498c-4cce-afcb-de1ea68675cc' class='mouseoverHref'>Channabasavanna, G.P. & Viraktamath, C.A. (eds). <em>Progress in Acarology</em>. Leiden : E.J. Brill Vol. 2.</a><!--MARK-->","","Chapter in Book","2a825e76-d519-4d8d-985c-9344c1d200d9","20081009T05:11:37.000+0000","eaaa5b07-498c-4cce-afcb-de1ea68675cc"
"Mégnin, P.","1874","Mémoire sur les <i>Hypopus</i> (Dugès), Acariens parasites encore nommés <i>Homopus</i>, Koch, et <i>Trichodactylus</i>, L. Dufour; détermination de leur position zoologique et de leur rôle physiologique","225-254 pls vii-x","","Journal de l'Anatomie et de la Physiologie Normales et Pathologiques de l'Homme et des Animaux","","","","<!--MARK--><a href='../../../../publication/320061a1-af08-4c86-9baa-f228be7d784d' class='mouseoverHref'>Mégnin, P. 1874. Mémoire sur les <i>Hypopus</i> (Dugès), Acariens parasites encore nommés <i>Homopus</i>, Koch, et <i>Trichodactylus</i>, L. Dufour; détermination de leur position zoologique et de leur rôle physiologique.</a> <!--MARK--><!--MARK--><a href='../../../../publication/eb7bbcb9-e926-4491-b54d-eb1abc349ff0' class='mouseoverHref'><em>Journal de l'Anatomie et de la Physiologie Normales et Pathologiques de l'Homme et des Animaux</em></a> <strong>10</strong>: 225-254 pls vii-x<!--MARK-->","","Article in Journal","320061a1-af08-4c86-9baa-f228be7d784d","20081009T05:11:37.000+0000","eb7bbcb9-e926-4491-b54d-eb1abc349ff0"
"Meyer, M.K.P. (Smith)","1981","Mite pests of crops in southern Africa","1-92","","Department of Agriculture and Fisheries, Republic of South Africa, Science Bulletin","","","","<!--MARK--><a href='../../../../publication/0ef2f6ca-511e-4515-9b70-c03702cc3633' class='mouseoverHref'>Meyer, M.K.P. (Smith) 1981. Mite pests of crops in southern Africa.</a> <!--MARK--><!--MARK--><a href='../../../../publication/eddc68a0-e49b-41dd-8e76-ec16be572bc9' class='mouseoverHref'><em>Department of Agriculture and Fisheries, Republic of South Africa, Science Bulletin</em></a> <strong>397</strong>: 1-92<!--MARK-->","","Article in Journal","0ef2f6ca-511e-4515-9b70-c03702cc3633","20081009T05:11:37.000+0000","eddc68a0-e49b-41dd-8e76-ec16be572bc9"
"Michael, A.D.","1885","Notes on the life-histories of some little-known Tyroglyphidae","19-32 pl. III","","Journal of the Royal Microscopical Society, London","","","","<!--MARK--><a href='../../../../publication/fa1b167d-12e8-420b-b7bb-904c67df2f7e' class='mouseoverHref'>Michael, A.D. 1885. Notes on the life-histories of some little-known Tyroglyphidae.</a> <!--MARK--><!--MARK--><a href='../../../../publication/27e4b17c-ade2-4bbd-bbf1-764de8cc231a' class='mouseoverHref'><em>Journal of the Royal Microscopical Society, London</em></a> 2 <strong>5</strong>: 19-32 pl. III<!--MARK-->","","Article in Journal","fa1b167d-12e8-420b-b7bb-904c67df2f7e","20081009T05:11:37.000+0000","27e4b17c-ade2-4bbd-bbf1-764de8cc231a"
"Michael, A.D.","1903","British Tyroglyphidae","183 pls i-x","","","","","Ray Society","<!--MARK--><a href='../../../../publication/8f087dab-172a-41ef-b226-fff3cb716355' class='mouseoverHref'>Michael, A.D. 1903. <em>British Tyroglyphidae</em>. London : Ray Society Vol. 2 183 pls i-x.</a><!--MARK-->","","Book","8f087dab-172a-41ef-b226-fff3cb716355","20081009T05:11:37.000+0000",""
"Monteith, G.B. & Storey, R.I.","1981","The biology of <i>Cephalodesmius</i>, a genus of dung beetles which synthesizes 'dung' from plant material (Coleoptera : Scarabaeidae : Scarabaeinae)","253-271 pls 1-3","","Memoirs of the Queensland Museum","","","","<!--MARK--><a href='../../../../publication/985152ff-4384-46df-8a5a-5f5247dde0b6' class='mouseoverHref'>Monteith, G.B. & Storey, R.I. 1981. The biology of <i>Cephalodesmius</i>, a genus of dung beetles which synthesizes 'dung' from plant material (Coleoptera : Scarabaeidae : Scarabaeinae).</a> <!--MARK--><!--MARK--><a href='../../../../publication/1a0a2982-9f30-43e1-a641-b0379699837c' class='mouseoverHref'><em>Memoirs of the Queensland Museum</em></a> <strong>20</strong>: 253-271 pls 1-3<!--MARK-->","","Article in Journal","985152ff-4384-46df-8a5a-5f5247dde0b6","20081009T05:11:37.000+0000","1a0a2982-9f30-43e1-a641-b0379699837c"
"Mubarak, K.V.A. & Haq, M.A.","1989","Postembryonic development of <i>Caloglyphus oudemansi</i> (Acari : Acaridae), a pest of stored grains in Kerala, India","264-269","Progress in Acarology","","","","","<!--MARK--><a href='../../../../publication/750a184a-6617-4e3c-b084-2ca6adb8ee1e' class='mouseoverHref'>Mubarak, K.V.A. & Haq, M.A. 1989. Postembryonic development of <i>Caloglyphus oudemansi</i> (Acari : Acaridae), a pest of stored grains in Kerala, India. pp. 264-269</a> <!--MARK--><em>in</em> <!--MARK--><a href='../../../../publication/eaaa5b07-498c-4cce-afcb-de1ea68675cc' class='mouseoverHref'>Channabasavanna, G.P. & Viraktamath, C.A. (eds). <em>Progress in Acarology</em>. Leiden : E.J. Brill Vol. 2.</a><!--MARK-->","","Chapter in Book","750a184a-6617-4e3c-b084-2ca6adb8ee1e","20081009T05:11:37.000+0000","eaaa5b07-498c-4cce-afcb-de1ea68675cc"
"Naumann, I.","1993","CSIRO Handbook of Australian Insect Names. Common and Scientific Names for Insects and Allied Organisms of Economic and Environmental Importance","v 200","","","","31/12/1993","CSIRO Publications","<!--MARK--><a href='../../../../publication/06ee5622-20fb-45ec-9434-f60c8a120f05' class='mouseoverHref'>Naumann, I. 1993. <em>CSIRO Handbook of Australian Insect Names. Common and Scientific Names for Insects and Allied Organisms of Economic and Environmental Importance</em>. Melbourne : CSIRO Publications v 200 pp.</a><!--MARK--> [Date published 31/12/1993]","","Book","06ee5622-20fb-45ec-9434-f60c8a120f05","20120712T02:11:22.982+0000",""
"Noble, J.C., Tongway, D.J., Roper, M.M. & Whitford, W.G.","1996","Fire studies in mallee (<i>Eucalyptus</i> spp.) communities of western New South Wales: spatial and temporal fluxes in soil chemistry and soil biology following prescribed fire","398-413","","Pacific Conservation Biology","","","","<!--MARK--><a href='../../../../publication/3b723060-b8aa-4a0e-a3d0-0b3058dc3f51' class='mouseoverHref'>Noble, J.C., Tongway, D.J., Roper, M.M. & Whitford, W.G. 1996. Fire studies in mallee (<i>Eucalyptus</i> spp.) communities of western New South Wales: spatial and temporal fluxes in soil chemistry and soil biology following prescribed fire.</a> <!--MARK--><!--MARK--><a href='../../../../publication/cd58431e-d46c-4ecb-b058-59bf628a8ebe' class='mouseoverHref'><em>Pacific Conservation Biology</em></a> <strong>2</strong>: 398-413<!--MARK-->","","Article in Journal","3b723060-b8aa-4a0e-a3d0-0b3058dc3f51","20081009T05:11:37.000+0000","cd58431e-d46c-4ecb-b058-59bf628a8ebe"
"Noble, J.C., Whitford, W.G. & Kaliszewski, M.","1996","Soil and litter microarthropod populations from two contrasting ecosystems in semi-arid eastern Australia","329-346","","Journal of Arid Environments","","","","<!--MARK--><a href='../../../../publication/4141c080-a71f-47d0-9cf9-8af62d688c79' class='mouseoverHref'>Noble, J.C., Whitford, W.G. & Kaliszewski, M. 1996. Soil and litter microarthropod populations from two contrasting ecosystems in semi-arid eastern Australia.</a> <!--MARK--><!--MARK--><a href='../../../../publication/95182fac-40d5-479c-a9e6-2330c04db410' class='mouseoverHref'><em>Journal of Arid Environments</em></a> <strong>32</strong>: 329-346<!--MARK-->","","Article in Journal","4141c080-a71f-47d0-9cf9-8af62d688c79","20081009T05:11:37.000+0000","95182fac-40d5-479c-a9e6-2330c04db410"
"O'Dowd, D.J.","1994","Mite association with the leaf domatia of coffee (<i>Coffea arabica</i>) in north Queensland, Australia","361-366","","Bulletin of Entomological Research","","","","<!--MARK--><a href='../../../../publication/a931e86c-ac94-4996-a428-5a01943fd8c6' class='mouseoverHref'>O'Dowd, D.J. 1994. Mite association with the leaf domatia of coffee (<i>Coffea arabica</i>) in north Queensland, Australia.</a> <!--MARK--><!--MARK--><a href='../../../../publication/ef0b7d10-3b2d-4f9f-affe-9a3dc2101d9f' class='mouseoverHref'><em>Bulletin of Entomological Research</em></a> <strong>84</strong>: 361-366<!--MARK-->","","Article in Journal","a931e86c-ac94-4996-a428-5a01943fd8c6","20081009T05:11:37.000+0000","ef0b7d10-3b2d-4f9f-affe-9a3dc2101d9f"
