"PUB_AUTHOR","PUB_YEAR","PUB_TITLE","PUB_PAGES","PUB_PARENT_BOOK_TITLE","PUB_PARENT_JOURNAL_TITLE","PUB_PARENT_ARTICLE_TITLE","PUB_PUBLICATION_DATE","PUB_PUBLISHER","PUB_FORMATTED","PUB_QUALIFICATION","PUB_TYPE","PUBLICATION_GUID","PUBLICATION_LAST_UPDATE","PARENT_PUBLICATION_GUID"
"Bellamy, C.L.","1985","A catalogue of the higher taxa of the family Buprestidae (Coleoptera)","405-472","","Navorsinge van die Nasionale Museum, Bloemfontein","","","","<!--MARK--><a href='../publication/de590e1e-7d0b-4071-8ce9-5c85505c9c81' class='mouseoverHref'>Bellamy, C.L. 1985. A catalogue of the higher taxa of the family Buprestidae (Coleoptera).</a> <!--MARK--><!--MARK--><a href='../publication/1d147a96-f184-40b1-8520-9dad9d327704' class='mouseoverHref'><em>Navorsinge van die Nasionale Museum, Bloemfontein</em></a> <strong>4</strong>(15): 405-472<!--MARK-->","","Article in Journal","de590e1e-7d0b-4071-8ce9-5c85505c9c81","20081009T05:11:37.000+0000","1d147a96-f184-40b1-8520-9dad9d327704"
"Bellamy, C.L.","1987","A revision of the genus <i>Synechocera</i> Deyrolle (Coleoptera, Buprestidae, Agrilinae)","17-34","","Invertebrate Taxonomy","","","","<!--MARK--><a href='../publication/4609f4c1-2e35-484a-bc8d-35a9af15df20' class='mouseoverHref'>Bellamy, C.L. 1987. A revision of the genus <i>Synechocera</i> Deyrolle (Coleoptera, Buprestidae, Agrilinae).</a> <!--MARK--><!--MARK--><a href='../publication/9846f41b-d755-4682-9049-5e59d363951b' class='mouseoverHref'><em>Invertebrate Taxonomy</em></a> <strong>1</strong>(1): 17-34<!--MARK-->","","Article in Journal","4609f4c1-2e35-484a-bc8d-35a9af15df20","20081009T05:11:37.000+0000","9846f41b-d755-4682-9049-5e59d363951b"
"Bellamy, C.L., Williams, G.A., Hasenpusch, J. & Sundholm, A.","2013","A summary of the published data on host plants and morphology of immature stages of Australian jewel beetles (Coleoptera: Buprestidae), with additional new records","1-172","","Insecta Mundi","","","","<!--MARK--><a href='../publication/4a53ce12-d067-4403-b97f-113bbc37be8f' class='mouseoverHref'>Bellamy, C.L., Williams, G.A., Hasenpusch, J. & Sundholm, A. 2013. A summary of the published data on host plants and morphology of immature stages of Australian jewel beetles (Coleoptera: Buprestidae), with additional new records.</a> <!--MARK--><!--MARK--><a href='../publication/21f84ce0-1a36-4082-a807-ecacc5afb744' class='mouseoverHref'><em>Insecta Mundi</em></a> <strong>0293</strong>: 1-172<!--MARK-->","","Article in Journal","4a53ce12-d067-4403-b97f-113bbc37be8f","20170308T07:19:55.274+0000","21f84ce0-1a36-4082-a807-ecacc5afb744"
"Bellamy, C.L. & Peterson, M.","2000","Contributions to the taxonomy of Australian Buprestidae (Coleoptera) Part I. New synonymy, combinations, and names","72-100","","Folia Heyrovskyana","","","","<!--MARK--><a href='../publication/30c370ce-7c75-48d8-96eb-c30c811ebbb9' class='mouseoverHref'>Bellamy, C.L. & Peterson, M. 2000. Contributions to the taxonomy of Australian Buprestidae (Coleoptera) Part I. New synonymy, combinations, and names.</a> <!--MARK--><!--MARK--><a href='../publication/7a52723e-6b60-42af-ba52-1c7f2d9813f4' class='mouseoverHref'><em>Folia Heyrovskyana</em></a> <strong>8</strong>(2): 72-100<!--MARK--> [31 Oct. 2000]","31 Oct. 2000","Article in Journal","30c370ce-7c75-48d8-96eb-c30c811ebbb9","","7a52723e-6b60-42af-ba52-1c7f2d9813f4"
"Blackburn, T.","1887","Further notes on Australian Coleoptera, with descriptions of new genera and species","177-287","","Transactions of the Royal Society of South Australia","","","","<!--MARK--><a href='../publication/e1b303e3-3c03-441d-aa48-b8dd83082960' class='mouseoverHref'>Blackburn, T. 1887. Further notes on Australian Coleoptera, with descriptions of new genera and species.</a> <!--MARK--><!--MARK--><a href='../publication/8b48b0a3-dd7a-4aea-be0d-10a223710ebc' class='mouseoverHref'><em>Transactions of the Royal Society of South Australia</em></a> <strong>10</strong>: 177-287<!--MARK-->","","Article in Journal","e1b303e3-3c03-441d-aa48-b8dd83082960","20081009T05:11:37.000+0000","8b48b0a3-dd7a-4aea-be0d-10a223710ebc"
"Blackburn, T.","1891","Further notes on Australian Coleoptera, with descriptions of new genera and species. Part X","292-345","","Transactions of the Royal Society of South Australia","","","","<!--MARK--><a href='../publication/ad8d48b6-b233-4c9b-8608-a3e2a2862aa0' class='mouseoverHref'>Blackburn, T. 1891. Further notes on Australian Coleoptera, with descriptions of new genera and species. Part X.</a> <!--MARK--><!--MARK--><a href='../publication/8b48b0a3-dd7a-4aea-be0d-10a223710ebc' class='mouseoverHref'><em>Transactions of the Royal Society of South Australia</em></a> <strong>14</strong>: 292-345<!--MARK-->","","Article in Journal","ad8d48b6-b233-4c9b-8608-a3e2a2862aa0","20081009T05:11:37.000+0000","8b48b0a3-dd7a-4aea-be0d-10a223710ebc"
"Blackburn, T.","1892","Coleoptera, in Scientific results of the Elder Exploring Expedition","16-61","","Transactions of the Royal Society of South Australia","","","","<!--MARK--><a href='../publication/8797bb30-d222-40f4-9880-bbd069da1c64' class='mouseoverHref'>Blackburn, T. 1892. Coleoptera, in Scientific results of the Elder Exploring Expedition.</a> <!--MARK--><!--MARK--><a href='../publication/8b48b0a3-dd7a-4aea-be0d-10a223710ebc' class='mouseoverHref'><em>Transactions of the Royal Society of South Australia</em></a> <strong>16</strong>: 16-61<!--MARK-->","","Article in Journal","8797bb30-d222-40f4-9880-bbd069da1c64","20081009T05:11:37.000+0000","8b48b0a3-dd7a-4aea-be0d-10a223710ebc"
"Blackburn, T.","1892","Further notes on Australian Coleoptera, with descriptions of new genera and species. Part XII","207-261","","Transactions of the Royal Society of South Australia","","","","<!--MARK--><a href='../publication/0d84cf24-1eeb-492f-b841-63c4658cc46e' class='mouseoverHref'>Blackburn, T. 1892. Further notes on Australian Coleoptera, with descriptions of new genera and species. Part XII.</a> <!--MARK--><!--MARK--><a href='../publication/8b48b0a3-dd7a-4aea-be0d-10a223710ebc' class='mouseoverHref'><em>Transactions of the Royal Society of South Australia</em></a> <strong>15</strong>(2): 207-261<!--MARK-->","","Article in Journal","0d84cf24-1eeb-492f-b841-63c4658cc46e","20081009T05:11:37.000+0000","8b48b0a3-dd7a-4aea-be0d-10a223710ebc"
"Britton, E.B. & Stanbury, P.J.","1981","Type specimens in the Macleay Museum, University of Sydney. VIII. Insects: Beetles (Insecta: Coleoptera)","241-293","","Proceedings of the Linnean Society of New South Wales","","","","<!--MARK--><a href='../publication/48e6cf4c-3337-471e-8fbd-33e72df05a22' class='mouseoverHref'>Britton, E.B. & Stanbury, P.J. 1981. Type specimens in the Macleay Museum, University of Sydney. VIII. Insects: Beetles (Insecta: Coleoptera).</a> <!--MARK--><!--MARK--><a href='../publication/c12cd779-adb5-41ea-bd2c-75f6864cf22e' class='mouseoverHref'><em>Proceedings of the Linnean Society of New South Wales</em></a> <strong>105</strong>(4): 241-293<!--MARK-->","","Article in Journal","48e6cf4c-3337-471e-8fbd-33e72df05a22","20081009T05:11:37.000+0000","c12cd779-adb5-41ea-bd2c-75f6864cf22e"
"Burns, G.G. & Burns, A.J.","1992","The distribution of Victorian jewel beetles (Coleoptera: Buprestidae) - an ENTRECS project","1-53","","Occasional Papers of the Museum of Victoria","","","","<!--MARK--><a href='../publication/7371027d-6bd2-49ec-be53-37556124ece2' class='mouseoverHref'>Burns, G.G. & Burns, A.J. 1992. The distribution of Victorian jewel beetles (Coleoptera: Buprestidae) - an ENTRECS project.</a> <!--MARK--><!--MARK--><a href='../publication/cdd01b00-8de7-4463-89a2-450d27bc4256' class='mouseoverHref'><em>Occasional Papers of the Museum of Victoria</em></a> <strong>5</strong>: 1-53<!--MARK-->","","Article in Journal","7371027d-6bd2-49ec-be53-37556124ece2","20081009T05:11:37.000+0000","cdd01b00-8de7-4463-89a2-450d27bc4256"
"Carter, H.J.","1921","Results of Dr. E. Mjöberg's Swedish scientific expeditions to Australia 1910-1913. 25. Buprestidae","1-6","","Arkiv för Zoologi","","","","<!--MARK--><a href='../publication/f8bde7db-b2be-4e9f-b3dc-e0ef103c186d' class='mouseoverHref'>Carter, H.J. 1921. Results of Dr. E. Mjöberg's Swedish scientific expeditions to Australia 1910-1913. 25. Buprestidae.</a> <!--MARK--><!--MARK--><a href='../publication/ea0f28cc-317a-4542-aaf0-5fa8122b7a93' class='mouseoverHref'><em>Arkiv för Zoologi</em></a> <strong>13</strong>(22): 1-6<!--MARK-->","","Article in Journal","f8bde7db-b2be-4e9f-b3dc-e0ef103c186d","20081009T05:11:37.000+0000","ea0f28cc-317a-4542-aaf0-5fa8122b7a93"
"Carter, H.J.","1923","Revision of the genera <i>Ethon</i>, <i>Cisseis</i> and their allies (Buprestidae)","159-176","","Proceedings of the Linnean Society of New South Wales","","","","<!--MARK--><a href='../publication/6cc5c5bd-c979-4b3a-a30d-12d4ecaccce2' class='mouseoverHref'>Carter, H.J. 1923. Revision of the genera <i>Ethon</i>, <i>Cisseis</i> and their allies (Buprestidae).</a> <!--MARK--><!--MARK--><a href='../publication/c12cd779-adb5-41ea-bd2c-75f6864cf22e' class='mouseoverHref'><em>Proceedings of the Linnean Society of New South Wales</em></a> <strong>48</strong>(2): 159-176<!--MARK-->","","Article in Journal","6cc5c5bd-c979-4b3a-a30d-12d4ecaccce2","20081009T05:11:37.000+0000","c12cd779-adb5-41ea-bd2c-75f6864cf22e"
"Carter, H.J.","1924","Australian Coleoptera -- notes and new species. No. iii","19-45","","Proceedings of the Linnean Society of New South Wales","","","","<!--MARK--><a href='../publication/055d900c-c951-4f2c-880e-3699ebb96c58' class='mouseoverHref'>Carter, H.J. 1924. Australian Coleoptera -- notes and new species. No. iii.</a> <!--MARK--><!--MARK--><a href='../publication/c12cd779-adb5-41ea-bd2c-75f6864cf22e' class='mouseoverHref'><em>Proceedings of the Linnean Society of New South Wales</em></a> <strong>49</strong>: 19-45<!--MARK-->","","Article in Journal","055d900c-c951-4f2c-880e-3699ebb96c58","","c12cd779-adb5-41ea-bd2c-75f6864cf22e"
"Carter, H.J.","1924","Australian Coleoptera -- notes and new species. No. iv","521-544","","Proceedings of the Linnean Society of New South Wales","","","","<!--MARK--><a href='../publication/0edf4101-5077-405b-b0eb-7f547db88946' class='mouseoverHref'>Carter, H.J. 1924. Australian Coleoptera -- notes and new species. No. iv.</a> <!--MARK--><!--MARK--><a href='../publication/c12cd779-adb5-41ea-bd2c-75f6864cf22e' class='mouseoverHref'><em>Proceedings of the Linnean Society of New South Wales</em></a> <strong>49</strong>: 521-544<!--MARK-->","","Article in Journal","0edf4101-5077-405b-b0eb-7f547db88946","20081009T05:11:37.000+0000","c12cd779-adb5-41ea-bd2c-75f6864cf22e"
"Carter, H.J.","1929","A check list of the Australian Buprestidae. With tables and keys to sub-families, tribes, and genera (by A. Théry)","265-304","","The Australian Zoologist","","24 Mar 1929","","<!--MARK--><a href='../publication/ffb0f112-a5c2-465a-9d40-0c596d20a3f9' class='mouseoverHref'>Carter, H.J. 1929. A check list of the Australian Buprestidae. With tables and keys to sub-families, tribes, and genera (by A. Théry).</a> <!--MARK--><!--MARK--><a href='../publication/48148530-5362-4b4a-a304-7ea21fe0d6b7' class='mouseoverHref'><em>The Australian Zoologist</em></a> <strong>5</strong>(4): 265-304<!--MARK--> [Date published 24 Mar 1929]","","Article in Journal","ffb0f112-a5c2-465a-9d40-0c596d20a3f9","20130319T03:02:12.553+0000","48148530-5362-4b4a-a304-7ea21fe0d6b7"
"Carter, H.J.","1931","Checklist of the Australian Buprestidae. Corrigenda, Addenda and Synonyms omitted","107-108","","The Australian Zoologist","","","","<!--MARK--><a href='../publication/a383aeb7-2507-42b6-8d1d-56d0dd67308c' class='mouseoverHref'>Carter, H.J. 1931. Checklist of the Australian Buprestidae. Corrigenda, Addenda and Synonyms omitted.</a> <!--MARK--><!--MARK--><a href='../publication/48148530-5362-4b4a-a304-7ea21fe0d6b7' class='mouseoverHref'><em>The Australian Zoologist</em></a> <strong>6</strong>: 107-108<!--MARK-->","","Article in Journal","a383aeb7-2507-42b6-8d1d-56d0dd67308c","20081009T05:11:37.000+0000","48148530-5362-4b4a-a304-7ea21fe0d6b7"
"Carter, H.J.","1940","Australian Buprestidae and the Junk Catalogue","380-389","","Annals and Magazine of Natural History","","","","<!--MARK--><a href='../publication/ee6b67f8-5ab7-42bb-b1fd-2e6221c5ec62' class='mouseoverHref'>Carter, H.J. 1940. Australian Buprestidae and the Junk Catalogue.</a> <!--MARK--><!--MARK--><a href='../publication/efa8de69-3a29-4a43-8ef2-cbefda205976' class='mouseoverHref'><em>Annals and Magazine of Natural History</em></a> 11 <strong>6</strong>: 380-389<!--MARK-->","","Article in Journal","ee6b67f8-5ab7-42bb-b1fd-2e6221c5ec62","20081009T05:11:37.000+0000","efa8de69-3a29-4a43-8ef2-cbefda205976"
"Cowie, D.","2001","Jewel Beetles of Tasmania","41 pp.","","","","","Tasmanian Field Naturalists' Club Inc.","<!--MARK--><a href='../publication/45d7debc-7a87-4f3d-8267-6e90232e03c1' class='mouseoverHref'>Cowie, D. 2001. <em>Jewel Beetles of Tasmania</em>. Hobart : Tasmanian Field Naturalists' Club Inc. 41 pp.</a><!--MARK-->","","Book","45d7debc-7a87-4f3d-8267-6e90232e03c1","20081009T05:11:37.000+0000",""
"Creutzer, C.","1799","Entomologische Versuche","142 pp. 3 pls","","","","","K. Schaumburg","<!--MARK--><a href='../publication/f7f42fbe-d812-42fb-8cce-46a650088366' class='mouseoverHref'>Creutzer, C. 1799. <em>Entomologische Versuche</em>. Wien : K. Schaumburg 142 pp. 3 pls.</a><!--MARK-->","","Book","f7f42fbe-d812-42fb-8cce-46a650088366","20120227T01:55:41.196+0000",""
"Curletti, G.","2001","The genus <i>Agrilus</i> in Australia (Coleoptera, Buprestidae)","1-45, 8 pls","","Jewel Beetles","","","","<!--MARK--><a href='../publication/cd1699a2-a931-4dbe-8d5d-9a61451d5601' class='mouseoverHref'>Curletti, G. 2001. The genus <i>Agrilus</i> in Australia (Coleoptera, Buprestidae).</a> <!--MARK--><!--MARK--><a href='../publication/aa5088c3-b8e7-49f4-b68c-d4006624e255' class='mouseoverHref'><em>Jewel Beetles</em></a> <strong>9</strong>: 1-45, 8 pls<!--MARK-->","","Article in Journal","cd1699a2-a931-4dbe-8d5d-9a61451d5601","20100803T01:51:41.978+0000","aa5088c3-b8e7-49f4-b68c-d4006624e255"
"Curletti, G.","2002","The genus <em>Agrilus</em> in Australia. Supplement 1","1-4","","Jewel Beetles","","","","<!--MARK--><a href='../publication/d835d81c-28c3-4602-8633-c786a0b8db46' class='mouseoverHref'>Curletti, G. 2002. The genus <em>Agrilus</em> in Australia. Supplement 1.</a> <!--MARK--><!--MARK--><a href='../publication/aa5088c3-b8e7-49f4-b68c-d4006624e255' class='mouseoverHref'><em>Jewel Beetles</em></a> <strong>11</strong>: 1-4<!--MARK-->","","Article in Journal","d835d81c-28c3-4602-8633-c786a0b8db46","20170524T02:04:23.110+0000","aa5088c3-b8e7-49f4-b68c-d4006624e255"
"Curletti, G.","2003","The genus <em>Agrilus</em> in Australia - Supplement 2. A new synonymy (Coleoptera, Buprestidae)","293-294","","Rivista Piemontese di Storia Naturale","","","","<!--MARK--><a href='../publication/f1131ef6-936f-4d66-8cb0-e36efcad7f58' class='mouseoverHref'>Curletti, G. 2003. The genus <em>Agrilus</em> in Australia - Supplement 2. A new synonymy (Coleoptera, Buprestidae).</a> <!--MARK--><!--MARK--><a href='../publication/db4ec5cc-c4b3-4a1a-8adb-d880e3768a19' class='mouseoverHref'><em>Rivista Piemontese di Storia Naturale</em></a> <strong>24</strong>: 293-294<!--MARK-->","","Article in Journal","f1131ef6-936f-4d66-8cb0-e36efcad7f58","20170524T01:50:42.865+0000","db4ec5cc-c4b3-4a1a-8adb-d880e3768a19"
"Curletti, G.","2006","The genus <i>Agrilus</i> Curtis, 1825 in New Guinea and nearest islands (Coleoptera, Buprestidae)","157-257","","Annali del Museo Civico di Storia Naturale Giacomo Doria, Genova","","","","<!--MARK--><a href='../publication/c174b879-edf4-4d3f-a07e-57423d9cb79a' class='mouseoverHref'>Curletti, G. 2006. The genus <i>Agrilus</i> Curtis, 1825 in New Guinea and nearest islands (Coleoptera, Buprestidae).</a> <!--MARK--><!--MARK--><a href='../publication/d85b9f36-d289-41ce-a8b6-f50087483d67' class='mouseoverHref'><em>Annali del Museo Civico di Storia Naturale Giacomo Doria, Genova</em></a> <strong>98</strong>: 157-257<!--MARK-->","","Article in Journal","c174b879-edf4-4d3f-a07e-57423d9cb79a","20170407T01:51:35.628+0000","d85b9f36-d289-41ce-a8b6-f50087483d67"
"Curletti, G.","2007","Una nuova specie Australiana di <i>Agrilus</i> Curtis, 1825 rinvenuta nel corso del progetto Ibisca Queensland 2006 (Coleoptera, Buprestidae)","416-418","","Lambillionea, Revue Internationale d'Entomologie","","","","<!--MARK--><a href='../publication/2414acc8-d838-4e96-8dc9-c38e6338aa2d' class='mouseoverHref'>Curletti, G. 2007. Una nuova specie Australiana di <i>Agrilus</i> Curtis, 1825 rinvenuta nel corso del progetto Ibisca Queensland 2006 (Coleoptera, Buprestidae).</a> <!--MARK--><!--MARK--><a href='../publication/23698ecd-21f8-4b70-a0fb-0759f53738b1' class='mouseoverHref'><em>Lambillionea, Revue Internationale d'Entomologie</em></a> <strong>CVII</strong>: 416-418<!--MARK-->","","Article in Journal","2414acc8-d838-4e96-8dc9-c38e6338aa2d","20150624T22:08:26.674+0000","23698ecd-21f8-4b70-a0fb-0759f53738b1"
"Curletti, G.","2008","Nuove specie di <em>Agrilus</em> del Queensland","511-516","","Lambillionea, Revue Internationale d'Entomologie","","","","<!--MARK--><a href='../publication/d15e6035-b0ee-4667-9a14-f55d2445141d' class='mouseoverHref'>Curletti, G. 2008. Nuove specie di <em>Agrilus</em> del Queensland.</a> <!--MARK--><!--MARK--><a href='../publication/23698ecd-21f8-4b70-a0fb-0759f53738b1' class='mouseoverHref'><em>Lambillionea, Revue Internationale d'Entomologie</em></a> <strong>CVIII</strong>: 511-516<!--MARK-->","","Article in Journal","d15e6035-b0ee-4667-9a14-f55d2445141d","20170525T00:42:58.719+0000","23698ecd-21f8-4b70-a0fb-0759f53738b1"
"Curletti, G.","2009","<i>Agrilus (Agrilus) sundholmi</i>, a new <i>Agrilus</i> from Australia (Coleoptera: Buprestidae)","66-68","","Zootaxa","","","","<!--MARK--><a href='../publication/f7694a36-a4f7-4edc-93b4-b4607fad8be8' class='mouseoverHref'>Curletti, G. 2009. <i>Agrilus (Agrilus) sundholmi</i>, a new <i>Agrilus</i> from Australia (Coleoptera: Buprestidae).</a> <!--MARK--><!--MARK--><a href='../publication/96466227-221c-4922-ac97-1ac2dd946d0a' class='mouseoverHref'><em>Zootaxa</em></a> <strong>2137</strong>: 66-68<!--MARK-->","","Article in Journal","f7694a36-a4f7-4edc-93b4-b4607fad8be8","20140122T23:03:23.617+0000","96466227-221c-4922-ac97-1ac2dd946d0a"
"Curletti, G.","2010","A new species of <i>Agrilus</i> Curtis (Coleoptera: Buprestidae) from eastern Australia","167-169","","Australian Entomologist","","","","<!--MARK--><a href='../publication/d627b1de-9946-42cd-9061-be118a281b5e' class='mouseoverHref'>Curletti, G. 2010. A new species of <i>Agrilus</i> Curtis (Coleoptera: Buprestidae) from eastern Australia.</a> <!--MARK--><!--MARK--><a href='../publication/3ffa056e-e79b-45d8-a5e0-27f16422b74e' class='mouseoverHref'><em>Australian Entomologist</em></a> <strong>36</strong>(4): 167-169<!--MARK-->","","Article in Journal","d627b1de-9946-42cd-9061-be118a281b5e","20101216T22:19:20.313+0000","3ffa056e-e79b-45d8-a5e0-27f16422b74e"
"Curletti, G. & Aberlenc, H.-P.","2010","<i>Agrilus (Pinarinus) dingoides</i> n. sp. du nord de l'Australie (Coleoptera, Buprestidae)","279-280","","Bulletin de la Société Entomologique de France","","","","<!--MARK--><a href='../publication/d44428be-9749-4a8d-8a9f-a099449f5a99' class='mouseoverHref'>Curletti, G. & Aberlenc, H.-P. 2010. <i>Agrilus (Pinarinus) dingoides</i> n. sp. du nord de l'Australie (Coleoptera, Buprestidae).</a> <!--MARK--><!--MARK--><a href='../publication/7853f77c-aa1b-42ec-bc2c-9758f7ff72c7' class='mouseoverHref'><em>Bulletin de la Société Entomologique de France</em></a> <strong>115</strong>(3): 279-280<!--MARK-->","","Article in Journal","d44428be-9749-4a8d-8a9f-a099449f5a99","20150706T01:46:49.256+0000","7853f77c-aa1b-42ec-bc2c-9758f7ff72c7"
"Curtis, J.","1825","British Entomology; being illustrations and descriptions of the genera of insects found in Great Britain and Ireland; containing coloured figures from nature of the most rare and beautiful species, and in many instances of the plants upon which they are found","51-98 pp.","","","","","J. Curtis","<!--MARK--><a href='../publication/3ce97932-3657-4115-ac10-7af93565685f' class='mouseoverHref'>Curtis, J. 1825. <em>British Entomology; being illustrations and descriptions of the genera of insects found in Great Britain and Ireland; containing coloured figures from nature of the most rare and beautiful species, and in many instances of the plants upon which they are found</em>. London : J. Curtis Vol. 2 51-98 pp.</a><!--MARK-->","","Book","3ce97932-3657-4115-ac10-7af93565685f","20081009T05:11:37.000+0000",""
"Deyrolle, H.","1864","Description des Buprestides de la Malaisie recueillis par M. Wallace","1-269 4 pls","","Annales de la Société Entomologique de Belgique (Comptes-rendus)","","","","<!--MARK--><a href='../publication/d408f0e4-fc07-497f-a490-119427fd6bec' class='mouseoverHref'>Deyrolle, H. 1864. Description des Buprestides de la Malaisie recueillis par M. Wallace.</a> <!--MARK--><!--MARK--><a href='../publication/acc7fcdb-707a-4cbe-8f70-d7595ac25c58' class='mouseoverHref'><em>Annales de la Société Entomologique de Belgique (Comptes-rendus)</em></a> <strong>8</strong>: 1-269 4 pls<!--MARK-->","","Article in Journal","d408f0e4-fc07-497f-a490-119427fd6bec","","acc7fcdb-707a-4cbe-8f70-d7595ac25c58"
"Deyrolle, H.","1865","Description des Buprestides de la Malaisie recueillis par M. Wallace","1-269 pls i-iv","","Annales de la Société Entomologique de Belgique (Comptes-rendus)","","Mar 1965","","<!--MARK--><a href='../publication/3d830c03-fe5a-4726-ae36-b8fc70ec6be5' class='mouseoverHref'>Deyrolle, H. 1865. Description des Buprestides de la Malaisie recueillis par M. Wallace.</a> <!--MARK--><!--MARK--><a href='../publication/acc7fcdb-707a-4cbe-8f70-d7595ac25c58' class='mouseoverHref'><em>Annales de la Société Entomologique de Belgique (Comptes-rendus)</em></a> <strong>8</strong>: 1-269 pls i-iv<!--MARK--> [Date published Mar 1965: publication bears the date of 1864 but was not published until March 1865]","publication bears the date of 1864 but was not published until March 1865","Article in Journal","3d830c03-fe5a-4726-ae36-b8fc70ec6be5","20081009T05:11:37.000+0000","acc7fcdb-707a-4cbe-8f70-d7595ac25c58"
"Eschscholtz, J.F.","1822","Entomographien","128 pp.","","","","","G. Reimer","<!--MARK--><a href='../publication/d77928e2-ed23-431c-9ab6-46f393c177dc' class='mouseoverHref'>Eschscholtz, J.F. 1822. <em>Entomographien</em>. Berlin : G. Reimer Vol. 1 (erste Lieferung) 128 pp.</a><!--MARK-->","","Book","d77928e2-ed23-431c-9ab6-46f393c177dc","20081009T05:11:37.000+0000",""
"Fairmaire, L.","1849","Essai sur les Coléoptères de la Polynesie","227-291, 352-365, 410-422, 445-460, 504-516, 550-559","","Revue et Magasin de Zoologie (Paris)","","","","<!--MARK--><a href='../publication/15ba9f73-0bff-4a61-9808-665302969ae2' class='mouseoverHref'>Fairmaire, L. 1849. Essai sur les Coléoptères de la Polynesie.</a> <!--MARK--><!--MARK--><a href='../publication/db688e1b-7165-434e-a1c0-eec6a75c5f67' class='mouseoverHref'><em>Revue et Magasin de Zoologie (Paris)</em></a> 2 <strong>1</strong>: 227-291, 352-365, 410-422, 445-460, 504-516, 550-559<!--MARK-->","","Article in Journal","15ba9f73-0bff-4a61-9808-665302969ae2","20110121T01:01:21.839+0000","db688e1b-7165-434e-a1c0-eec6a75c5f67"
"Froggatt, W.W.","1927","Native insects and introduced trees","12-14","","Australian Naturalist","","","","<!--MARK--><a href='../publication/a46d702d-5b1c-4a6e-9572-9f725e1c329d' class='mouseoverHref'>Froggatt, W.W. 1927. Native insects and introduced trees.</a> <!--MARK--><!--MARK--><a href='../publication/3a064dc1-fa80-49dd-8964-bb1d7a6449b0' class='mouseoverHref'><em>Australian Naturalist</em></a> <strong>7</strong>: 12-14<!--MARK-->","","Article in Journal","a46d702d-5b1c-4a6e-9572-9f725e1c329d","20081009T05:11:37.000+0000","3a064dc1-fa80-49dd-8964-bb1d7a6449b0"
"Gemminger, M. & Harold, E. von","1869","Catalogus Coleopterorum hucusque descriptorum synonymicus et systematicus","1347-1608 pp.","","","","","Monachii","<!--MARK--><a href='../publication/b4bbc969-6257-4908-8b9b-84e07eb19960' class='mouseoverHref'>Gemminger, M. & Harold, E. von 1869. <em>Catalogus Coleopterorum hucusque descriptorum synonymicus et systematicus</em>. London : Monachii Vol. 5 1347-1608 pp.</a><!--MARK-->","","Book","b4bbc969-6257-4908-8b9b-84e07eb19960","20100203T01:35:46.528+0000",""
"Germain, E.F.","1848","Beiträge zur Insektenfauna von Adelaide.","153-247","","Linnaea Entomologica","","","","<!--MARK--><a href='../publication/a30fc011-fd68-429c-846c-c82e2462c71b' class='mouseoverHref'>Germain, E.F. 1848. Beiträge zur Insektenfauna von Adelaide.</a> <!--MARK--><!--MARK--><a href='../publication/1bd3bf76-d7c0-4a57-98cf-a1c6278fdaac' class='mouseoverHref'><em>Linnaea Entomologica</em></a> <strong>3</strong>: 153-247<!--MARK-->","","Article in Journal","a30fc011-fd68-429c-846c-c82e2462c71b","20190123T02:22:23.790+0000","1bd3bf76-d7c0-4a57-98cf-a1c6278fdaac"
"Gory, H.L. & Laporte de Castelnau, F.L.","1837","Histoire naturelle et iconographie des insectes Coléoptères. Monographie des buprestides. genera: <i>Colobogaster, Chrysobothris, Agrilus</i>; (genera paged separately)","","","","","","P. Duménil","<!--MARK--><a href='../publication/a39b1663-3522-4e24-8f67-e273f6b0d1ca' class='mouseoverHref'>Gory, H.L. & Laporte de Castelnau, F.L. 1837. <em>Histoire naturelle et iconographie des insectes Coléoptères. Monographie des buprestides. genera: <i>Colobogaster, Chrysobothris, Agrilus</i>; (genera paged separately)</em>. Paris : P. Duménil Vol. 2(12-16).</a><!--MARK-->","","Book","a39b1663-3522-4e24-8f67-e273f6b0d1ca","20100208T23:04:48.208+0000",""
