"PUB_AUTHOR","PUB_YEAR","PUB_TITLE","PUB_PAGES","PUB_PARENT_BOOK_TITLE","PUB_PARENT_JOURNAL_TITLE","PUB_PARENT_ARTICLE_TITLE","PUB_PUBLICATION_DATE","PUB_PUBLISHER","PUB_FORMATTED","PUB_QUALIFICATION","PUB_TYPE","PUBLICATION_GUID","PUBLICATION_LAST_UPDATE","PARENT_PUBLICATION_GUID"
"Hawkeswood, T.J.","1981","Observations on two sympatric species of Buprestidae (Coleoptera) from sand dunes on the north coast of New South Wales","146-151","","Victorian Naturalist","","","","<!--MARK--><a href='../publication/35c45178-1321-4e19-b28b-718b53c4e02f' class='mouseoverHref'>Hawkeswood, T.J. 1981. Observations on two sympatric species of Buprestidae (Coleoptera) from sand dunes on the north coast of New South Wales.</a> <!--MARK--><!--MARK--><a href='../publication/97b8093b-d60f-43a6-94fc-97de34f03b6b' class='mouseoverHref'><em>Victorian Naturalist</em></a> <strong>98</strong>: 146-151<!--MARK-->","","Article in Journal","35c45178-1321-4e19-b28b-718b53c4e02f","20081009T05:11:37.000+0000","97b8093b-d60f-43a6-94fc-97de34f03b6b"
"Hawkeswood, T.J.","1987","Beetles of Australia","248 pp.","","","","","Angus & Robertson","<!--MARK--><a href='../publication/3c69e15b-d5e6-4995-9e8f-07aa967d5004' class='mouseoverHref'>Hawkeswood, T.J. 1987. <em>Beetles of Australia</em>. North Ryde, NSW : Angus & Robertson 248 pp.</a><!--MARK-->","","Book","3c69e15b-d5e6-4995-9e8f-07aa967d5004","20111128T05:57:22.061+0000",""
"Hawkeswood, T.J.","1992","Review of the biology and host plants of the Australian jewel beetle <i>Agrilus australasiae</i> Laporte & Gory","81-87","","Spixiana (Munich)","","","","<!--MARK--><a href='../publication/cb9934be-4458-4d28-82db-ea212a67771d' class='mouseoverHref'>Hawkeswood, T.J. 1992. Review of the biology and host plants of the Australian jewel beetle <i>Agrilus australasiae</i> Laporte & Gory.</a> <!--MARK--><!--MARK--><a href='../publication/ce825dec-bfed-4bd4-81bc-3368e292b581' class='mouseoverHref'><em>Spixiana (Munich)</em></a> <strong>15</strong>(1): 81-87<!--MARK-->","","Article in Journal","cb9934be-4458-4d28-82db-ea212a67771d","20081009T05:11:37.000+0000","ce825dec-bfed-4bd4-81bc-3368e292b581"
"Hawkeswood, T.J. & Peterson, M.","1982","A review of larval host records for Australian jewel beetles (Coleoptera: Buprestidae)","240-251","","Victorian Naturalist","","","","<!--MARK--><a href='../publication/da6a34d2-69cb-4654-a3e0-a2cdeb35be31' class='mouseoverHref'>Hawkeswood, T.J. & Peterson, M. 1982. A review of larval host records for Australian jewel beetles (Coleoptera: Buprestidae).</a> <!--MARK--><!--MARK--><a href='../publication/97b8093b-d60f-43a6-94fc-97de34f03b6b' class='mouseoverHref'><em>Victorian Naturalist</em></a> <strong>99</strong>: 240-251<!--MARK-->","","Article in Journal","da6a34d2-69cb-4654-a3e0-a2cdeb35be31","20081009T05:11:37.000+0000","97b8093b-d60f-43a6-94fc-97de34f03b6b"
"Holynski, R.","1993","A reassessment of the internal classification of the Buprestidae Leach (Coleoptera)","1-42","","Crystal, series Zoologica","","","","<!--MARK--><a href='../publication/20612be2-ec82-41fc-a558-c61f229716bd' class='mouseoverHref'>Holynski, R. 1993. A reassessment of the internal classification of the Buprestidae Leach (Coleoptera).</a> <!--MARK--><!--MARK--><a href='../publication/1f22e98b-5f71-4ea9-8082-d9139af00798' class='mouseoverHref'><em>Crystal, series Zoologica</em></a> <strong>1</strong>: 1-42<!--MARK-->","","Article in Journal","20612be2-ec82-41fc-a558-c61f229716bd","20081009T05:11:37.000+0000","1f22e98b-5f71-4ea9-8082-d9139af00798"
"Hope, F.W.","1846","Descriptions of new species of Buprestidae from New Holland","62-65","","Annals and Magazine of Natural History","","","","<!--MARK--><a href='../publication/f01817b0-573a-46d1-98b9-e502ad45645d' class='mouseoverHref'>Hope, F.W. 1846. Descriptions of new species of Buprestidae from New Holland.</a> <!--MARK--><!--MARK--><a href='../publication/efa8de69-3a29-4a43-8ef2-cbefda205976' class='mouseoverHref'><em>Annals and Magazine of Natural History</em></a> <strong>17</strong>: 62-65<!--MARK-->","","Article in Journal","f01817b0-573a-46d1-98b9-e502ad45645d","20081009T05:11:37.000+0000","efa8de69-3a29-4a43-8ef2-cbefda205976"
"Hope, F.W.","1846","Descriptions of new species of Buprestidae from New Holland, chiefly collected by D. E. Fortnum, Esq","208-220","","Transactions of the Entomological Society of London","","2 Mar. 1846","","<!--MARK--><a href='../publication/a9f3eed5-1c80-4380-90d2-c3d100474eb9' class='mouseoverHref'>Hope, F.W. 1846. Descriptions of new species of Buprestidae from New Holland, chiefly collected by D. E. Fortnum, Esq.</a> <!--MARK--><!--MARK--><a href='../publication/5cf355b3-abc5-451e-9abc-ed3282d7811a' class='mouseoverHref'><em>Transactions of the Entomological Society of London</em></a> <strong>4</strong>: 208-220<!--MARK--> [Date published 2 Mar. 1846]","","Article in Journal","a9f3eed5-1c80-4380-90d2-c3d100474eb9","20140119T22:44:24.307+0000","5cf355b3-abc5-451e-9abc-ed3282d7811a"
"Jendek, E.","2013","Revision of the <i>Agrilus occipitalis</i> species-group (Coleoptera, Buprestidae, Agrilini)","35-79","","ZooKeys","","","","<!--MARK--><a href='../publication/884a7aaf-90ca-471a-921c-b28a208f6e5a' class='mouseoverHref'>Jendek, E. 2013. Revision of the <i>Agrilus occipitalis</i> species-group (Coleoptera, Buprestidae, Agrilini).</a> <!--MARK--><!--MARK--><a href='../publication/8cb7bef9-51f4-441c-a060-649dc8095e71' class='mouseoverHref'><em>ZooKeys</em></a> <strong>256</strong>: 35-79<!--MARK-->","","Article in Journal","884a7aaf-90ca-471a-921c-b28a208f6e5a","20130114T00:47:15.631+0000","8cb7bef9-51f4-441c-a060-649dc8095e71"
"Kerremans, C.","1885","Enumeration des Buprestides decrits posterieurement au Catalogue de M. Gemminger & de Harold","119-157","","Annales de la Société Entomologique de Belgique (Comptes-rendus)","","","","<!--MARK--><a href='../publication/f823d107-3270-4068-b6b2-2d7f2c248ec7' class='mouseoverHref'>Kerremans, C. 1885. Enumeration des Buprestides decrits posterieurement au Catalogue de M. Gemminger & de Harold.</a> <!--MARK--><!--MARK--><a href='../publication/acc7fcdb-707a-4cbe-8f70-d7595ac25c58' class='mouseoverHref'><em>Annales de la Société Entomologique de Belgique (Comptes-rendus)</em></a> <strong>29</strong>: 119-157<!--MARK-->","","Article in Journal","f823d107-3270-4068-b6b2-2d7f2c248ec7","20081009T05:11:37.000+0000","acc7fcdb-707a-4cbe-8f70-d7595ac25c58"
"Kerremans, C.","1892","Catalogue synonymique des Buprestides decrits de 1758 à 1890","1-304","","Mémoires de la Société Entomologique de Belgique","","","","<!--MARK--><a href='../publication/7e24e8d8-2e02-4560-856c-45caa7f98194' class='mouseoverHref'>Kerremans, C. 1892. Catalogue synonymique des Buprestides decrits de 1758 à 1890.</a> <!--MARK--><!--MARK--><a href='../publication/919e8bdf-0a87-4070-9049-04f444aeaa06' class='mouseoverHref'><em>Mémoires de la Société Entomologique de Belgique</em></a> <strong>1</strong>: 1-304<!--MARK-->","","Article in Journal","7e24e8d8-2e02-4560-856c-45caa7f98194","20081009T05:11:37.000+0000","919e8bdf-0a87-4070-9049-04f444aeaa06"
"Kerremans, C.","1893","Essai de groupement des Buprestides","94-122","","Annales de la Société Entomologique de Belgique (Comptes-rendus)","","","","<!--MARK--><a href='../publication/24dc06a1-e9b3-47e0-b3da-31b6abb0d749' class='mouseoverHref'>Kerremans, C. 1893. Essai de groupement des Buprestides.</a> <!--MARK--><!--MARK--><a href='../publication/acc7fcdb-707a-4cbe-8f70-d7595ac25c58' class='mouseoverHref'><em>Annales de la Société Entomologique de Belgique (Comptes-rendus)</em></a> <strong>37</strong>: 94-122<!--MARK-->","","Article in Journal","24dc06a1-e9b3-47e0-b3da-31b6abb0d749","20081009T05:11:37.000+0000","acc7fcdb-707a-4cbe-8f70-d7595ac25c58"
"Kerremans, C.","1898","Buprestides nouveaux de l'Australie et des régiones voisines","113-182","","Annales de la Société Entomologique de Belgique (Comptes-rendus)","","","","<!--MARK--><a href='../publication/e0159bb7-9a8b-408a-b38a-f424f3e9549b' class='mouseoverHref'>Kerremans, C. 1898. Buprestides nouveaux de l'Australie et des régiones voisines.</a> <!--MARK--><!--MARK--><a href='../publication/acc7fcdb-707a-4cbe-8f70-d7595ac25c58' class='mouseoverHref'><em>Annales de la Société Entomologique de Belgique (Comptes-rendus)</em></a> <strong>42</strong>: 113-182<!--MARK-->","","Article in Journal","e0159bb7-9a8b-408a-b38a-f424f3e9549b","20081009T05:11:37.000+0000","acc7fcdb-707a-4cbe-8f70-d7595ac25c58"
"Kerremans, C.","1900","Buprestides Indo-Malais, troisième partie","61-93","","Mémoires de la Société Entomologique de Belgique","","","","<!--MARK--><a href='../publication/ef2e7e61-de87-4e56-855e-26c044bd2fc0' class='mouseoverHref'>Kerremans, C. 1900. Buprestides Indo-Malais, troisième partie.</a> <!--MARK--><!--MARK--><a href='../publication/919e8bdf-0a87-4070-9049-04f444aeaa06' class='mouseoverHref'><em>Mémoires de la Société Entomologique de Belgique</em></a> <strong>7</strong>: 61-93<!--MARK-->","","Article in Journal","ef2e7e61-de87-4e56-855e-26c044bd2fc0","20081009T05:11:37.000+0000","919e8bdf-0a87-4070-9049-04f444aeaa06"
"Kerremans, C.","1903","Coleoptera, Fam. Buprestidae","49-338","Genera Insectorum","","","","","<!--MARK--><a href='../publication/fcf35f5e-ca2e-44ee-ae82-df28a819535b' class='mouseoverHref'>Kerremans, C. 1903. Coleoptera, Fam. Buprestidae. pp. 49-338</a> <!--MARK--><em>in</em> <!--MARK--><a href='../publication/0b34e01e-8aba-4388-921b-d1e59fba4cde' class='mouseoverHref'>Wytsman, P. (ed.). <em>Genera Insectorum</em>. Bruxelles : Verteneuil & Desmet Vol. 12b-d.</a><!--MARK-->","","Chapter in Book","fcf35f5e-ca2e-44ee-ae82-df28a819535b","20081009T05:11:37.000+0000","0b34e01e-8aba-4388-921b-d1e59fba4cde"
"Kubán, V., Majer, K. & Kolibác, J.","2001","Classification of the tribe Coraebini Bedel, 1921 (Coleoptera, Buprestidae, Agrilinae)","185-287","","Acta Musei Moraviae, Scientiae biologicae (Brno)","","","","<!--MARK--><a href='../publication/55d18deb-224f-45c5-bcff-b2e721f2791e' class='mouseoverHref'>Kubán, V., Majer, K. & Kolibác, J. 2001. Classification of the tribe Coraebini Bedel, 1921 (Coleoptera, Buprestidae, Agrilinae).</a> <!--MARK--><!--MARK--><a href='../publication/1b10c5ca-9907-4eb5-a966-7239eeb6e32d' class='mouseoverHref'><em>Acta Musei Moraviae, Scientiae biologicae (Brno)</em></a> <strong>85</strong>: 185-287<!--MARK-->","","Article in Journal","55d18deb-224f-45c5-bcff-b2e721f2791e","20081009T05:11:37.000+0000","1b10c5ca-9907-4eb5-a966-7239eeb6e32d"
"Lacordaire, J.T.","1857","Histoire naturelle des insectes. Genera des Coléoptères ou exposé méthodique de critique de tous les genres proposés jusqu'ici dans cet ordre d'insectes","554 pp.","","","","","Roret","<!--MARK--><a href='../publication/3412cf36-8641-4715-a108-ca35170b1bf3' class='mouseoverHref'>Lacordaire, J.T. 1857. <em>Histoire naturelle des insectes. Genera des Coléoptères ou exposé méthodique de critique de tous les genres proposés jusqu'ici dans cet ordre d'insectes</em>. Paris : Roret Vol. 4 554 pp.</a><!--MARK-->","","Book","3412cf36-8641-4715-a108-ca35170b1bf3","20081009T05:11:37.000+0000",""
"Laporte de Castelnau, F.L.","1835","Études entomologiqes ou descriptions d'insectes nouveaux et observations sur la synonymie, par M. F. L. de Laporte, Comte de Castelnau","157-181","","Revue d'Entomologie (Caen)","","","","<!--MARK--><a href='../publication/bca94dff-2a58-4734-997a-05da93499c39' class='mouseoverHref'>Laporte de Castelnau, F.L. 1835. Études entomologiqes ou descriptions d'insectes nouveaux et observations sur la synonymie, par M. F. L. de Laporte, Comte de Castelnau.</a> <!--MARK--><!--MARK--><a href='../publication/38321dc8-dea0-4f88-bdf3-a1b7460e3beb' class='mouseoverHref'><em>Revue d'Entomologie (Caen)</em></a> <strong>3</strong>: 157-181<!--MARK-->","","Article in Journal","bca94dff-2a58-4734-997a-05da93499c39","20081009T05:11:37.000+0000","38321dc8-dea0-4f88-bdf3-a1b7460e3beb"
"Lea, A.M.","1912","The late Rev. Canon Thomas Blackburn, B.A., and his entomological work","v-xl","","Transactions of the Royal Society of South Australia","","","","<!--MARK--><a href='../publication/0e444ef8-42db-4e4f-b26c-6500489466b6' class='mouseoverHref'>Lea, A.M. 1912. The late Rev. Canon Thomas Blackburn, B.A., and his entomological work.</a> <!--MARK--><!--MARK--><a href='../publication/8b48b0a3-dd7a-4aea-be0d-10a223710ebc' class='mouseoverHref'><em>Transactions of the Royal Society of South Australia</em></a> <strong>36</strong>: v-xl<!--MARK-->","","Article in Journal","0e444ef8-42db-4e4f-b26c-6500489466b6","20081009T05:11:37.000+0000","8b48b0a3-dd7a-4aea-be0d-10a223710ebc"
"Macleay, W.J.","1872","Notes on a collection of insects from Gayndah. Second paper","239-318","","Transactions of the Entomological Society of New South Wales","","","","<!--MARK--><a href='../publication/6319486a-42f4-4129-aaae-8d90903d90a2' class='mouseoverHref'>Macleay, W.J. 1872. Notes on a collection of insects from Gayndah. Second paper.</a> <!--MARK--><!--MARK--><a href='../publication/69b821b6-f09d-44b0-ae3f-0e6c294b532e' class='mouseoverHref'><em>Transactions of the Entomological Society of New South Wales</em></a> <strong>2</strong>(4): 239-318<!--MARK-->","","Article in Journal","6319486a-42f4-4129-aaae-8d90903d90a2","20081009T05:11:37.000+0000","69b821b6-f09d-44b0-ae3f-0e6c294b532e"
"Masters, G.","1886","Catalogue of the described Coleoptera of Australia. Part III. Lucanidae and Scarabaeidae","21-126","","Proceedings of the Linnean Society of New South Wales","","","","<!--MARK--><a href='../publication/10ac3176-1b8b-40d1-9acd-fee3dc68231e' class='mouseoverHref'>Masters, G. 1886. Catalogue of the described Coleoptera of Australia. Part III. Lucanidae and Scarabaeidae.</a> <!--MARK--><!--MARK--><a href='../publication/c12cd779-adb5-41ea-bd2c-75f6864cf22e' class='mouseoverHref'><em>Proceedings of the Linnean Society of New South Wales</em></a> 2 <strong>1</strong>: 21-126<!--MARK-->","","Article in Journal","10ac3176-1b8b-40d1-9acd-fee3dc68231e","20081009T05:11:37.000+0000","c12cd779-adb5-41ea-bd2c-75f6864cf22e"
"Matthews, E.G.","1985","A guide to the genera of beetles of South Australia, Part 4 Polyphaga: Byrrhoidea, Buprestoidea, Dyropoidea, Elateroidea, Cantharoidea, Derodontoidea, and Bostrichoidea","1-68","","South Australian Museum, Special Education Bulletin","","","","<!--MARK--><a href='../publication/1cada913-5d73-4659-b387-14403f1a717d' class='mouseoverHref'>Matthews, E.G. 1985. A guide to the genera of beetles of South Australia, Part 4 Polyphaga: Byrrhoidea, Buprestoidea, Dyropoidea, Elateroidea, Cantharoidea, Derodontoidea, and Bostrichoidea.</a> <!--MARK--><!--MARK--><a href='../publication/9048d040-9473-4180-92f2-49518e3cd950' class='mouseoverHref'><em>South Australian Museum, Special Education Bulletin</em></a> <strong>7</strong>: 1-68<!--MARK-->","","Article in Journal","1cada913-5d73-4659-b387-14403f1a717d","20081009T05:11:37.000+0000","9048d040-9473-4180-92f2-49518e3cd950"
"Obenberger, J.","1916","Analecta I. Fam. Buprestidae","17-22","","Neue Beiträge zur Systematischen Insektenkunde","","","","<!--MARK--><a href='../publication/7e9a9e1c-c0d2-491e-b873-21d8418ca2dc' class='mouseoverHref'>Obenberger, J. 1916. Analecta I. Fam. Buprestidae.</a> <!--MARK--><!--MARK--><a href='../publication/56d9e75e-b658-4bb9-9e0e-10fe88d22211' class='mouseoverHref'><em>Neue Beiträge zur Systematischen Insektenkunde</em></a> <strong>1</strong>: 17-22<!--MARK-->","","Article in Journal","7e9a9e1c-c0d2-491e-b873-21d8418ca2dc","20081009T05:11:37.000+0000","56d9e75e-b658-4bb9-9e0e-10fe88d22211"
"Obenberger, J.","1923","Description of new Australian Buprestidae","72-81","","Acta Entomologica Musei Nationalis Pragae","","","","<!--MARK--><a href='../publication/9b04afb4-1f49-40c9-8a92-1f896d02a8e9' class='mouseoverHref'>Obenberger, J. 1923. Description of new Australian Buprestidae.</a> <!--MARK--><!--MARK--><a href='../publication/800acc84-1853-4834-bb99-26053db41072' class='mouseoverHref'><em>Acta Entomologica Musei Nationalis Pragae</em></a> <strong>1</strong>: 72-81<!--MARK-->","","Article in Journal","9b04afb4-1f49-40c9-8a92-1f896d02a8e9","20081009T05:11:37.000+0000","800acc84-1853-4834-bb99-26053db41072"
"Obenberger, J.","1924","Kritische studien über die Buprestiden (Col.)","1-171","","Archiv für Naturgeschichte","","","","<!--MARK--><a href='../publication/0d3c1e65-8c72-44dd-9a56-9f9e2d0fd069' class='mouseoverHref'>Obenberger, J. 1924. Kritische studien über die Buprestiden (Col.).</a> <!--MARK--><!--MARK--><a href='../publication/f5b5f7c7-fc53-4502-951d-1c96b680d874' class='mouseoverHref'><em>Archiv für Naturgeschichte</em></a> <strong>90A</strong>(3): 1-171<!--MARK-->","","Article in Journal","0d3c1e65-8c72-44dd-9a56-9f9e2d0fd069","20170524T04:29:18.672+0000","f5b5f7c7-fc53-4502-951d-1c96b680d874"
"Obenberger, J.","1928","Opuscula Buprestologica I. Beiträge zur Kenntnis der Buprestiden (Col.)","1-350","","Archiv für Naturgeschichte","","","","<!--MARK--><a href='../publication/10629a92-83b4-4b6d-a2df-b5d589aea388' class='mouseoverHref'>Obenberger, J. 1928. Opuscula Buprestologica I. Beiträge zur Kenntnis der Buprestiden (Col.).</a> <!--MARK--><!--MARK--><a href='../publication/f5b5f7c7-fc53-4502-951d-1c96b680d874' class='mouseoverHref'><em>Archiv für Naturgeschichte</em></a> <strong>92</strong>(9-11): 1-350<!--MARK-->","","Article in Journal","10629a92-83b4-4b6d-a2df-b5d589aea388","20081009T05:11:37.000+0000","f5b5f7c7-fc53-4502-951d-1c96b680d874"
"Obenberger, J.","1931","Meine Antwort auf die Kritiken des Herrn H.J. Carter","77-83","","Entomologische Blätter","","","","<!--MARK--><a href='../publication/4f9f10df-15c0-4e1f-9472-bd44d3438d9b' class='mouseoverHref'>Obenberger, J. 1931. Meine Antwort auf die Kritiken des Herrn H.J. Carter.</a> <!--MARK--><!--MARK--><a href='../publication/a4ae2141-5f28-40ed-8d5f-f1e9aebf1631' class='mouseoverHref'><em>Entomologische Blätter</em></a> <strong>27</strong>: 77-83<!--MARK-->","","Article in Journal","4f9f10df-15c0-4e1f-9472-bd44d3438d9b","20081009T05:11:37.000+0000","a4ae2141-5f28-40ed-8d5f-f1e9aebf1631"
"Obenberger, J.","1935","Buprestidae 4","785-934","Coleopterorum Catalogus","","","","","<!--MARK--><a href='../publication/346c321c-4338-483e-a17f-8c84d32e3367' class='mouseoverHref'>Obenberger, J. 1935. Buprestidae 4. pp. 785-934</a> <!--MARK--><em>in</em> <!--MARK--><a href='../publication/d75b6ce7-021e-493b-b023-c51e1f480e29' class='mouseoverHref'>W. Junk & S. Schenkling (eds). <em>Coleopterorum Catalogus</em>. 's-Gravenhage : W. Junk Vol. 143.</a><!--MARK-->","","Chapter in Book","346c321c-4338-483e-a17f-8c84d32e3367","20081009T05:11:37.000+0000","d75b6ce7-021e-493b-b023-c51e1f480e29"
"Obenberger, J.","1936","Buprestidae 5","935-1246","Coleopterorum Catalogus","","","","","<!--MARK--><a href='../publication/1879daf3-0899-41e4-826f-664b718b6863' class='mouseoverHref'>Obenberger, J. 1936. Buprestidae 5. pp. 935-1246</a> <!--MARK--><em>in</em> <!--MARK--><a href='../publication/195b11a6-93a7-4b5c-b145-df3919d65a98' class='mouseoverHref'>Junk, W. & Schenkling, S. (eds). <em>Coleopterorum Catalogus</em>. ?s-Gravenhage : W. Junk Vol. 152.</a><!--MARK-->","","Chapter in Book","1879daf3-0899-41e4-826f-664b718b6863","20081009T05:11:37.000+0000","195b11a6-93a7-4b5c-b145-df3919d65a98"
"Obenberger, J.","1936","De novis regionis orientalis Agrili generis speciebus (Col. Bupr.) II","33-44","","Acta Societatis Entomologicae Cechosloveniae","","","","<!--MARK--><a href='../publication/84d1ccf7-1206-4ff6-bec3-2ef8c8958d8a' class='mouseoverHref'>Obenberger, J. 1936. De novis regionis orientalis Agrili generis speciebus (Col. Bupr.) II.</a> <!--MARK--><!--MARK--><a href='../publication/a8a6a567-49ff-4819-bf02-53909bbbc83e' class='mouseoverHref'><em>Acta Societatis Entomologicae Cechosloveniae</em></a> <strong>33</strong>: 33-44<!--MARK-->","","Article in Journal","84d1ccf7-1206-4ff6-bec3-2ef8c8958d8a","20081009T05:11:37.000+0000","a8a6a567-49ff-4819-bf02-53909bbbc83e"
"Obenberger, J.","1959","Sur les espèces du genre <i>Agrilus</i> Curtis de l'Australie et Océanie (Coleoptera Buprestidae)","223-240","","Acta Entomologica Musei Nationalis Pragae","","","","<!--MARK--><a href='../publication/a70d1df9-12df-464a-b15f-63b693897f5b' class='mouseoverHref'>Obenberger, J. 1959. Sur les espèces du genre <i>Agrilus</i> Curtis de l'Australie et Océanie (Coleoptera Buprestidae).</a> <!--MARK--><!--MARK--><a href='../publication/800acc84-1853-4834-bb99-26053db41072' class='mouseoverHref'><em>Acta Entomologica Musei Nationalis Pragae</em></a> <strong>33</strong>: 223-240<!--MARK-->","","Article in Journal","a70d1df9-12df-464a-b15f-63b693897f5b","20081009T05:11:37.000+0000","800acc84-1853-4834-bb99-26053db41072"
"Saunders, E.","1868","A revision of the Australian Buprestidae described by the Rev. F. W. Hope","1-67","","Transactions of the Royal Entomological Society of London","","April 1868","","<!--MARK--><a href='../publication/a8978335-b648-4540-9eb1-c23630681ec7' class='mouseoverHref'>Saunders, E. 1868. A revision of the Australian Buprestidae described by the Rev. F. W. Hope.</a> <!--MARK--><!--MARK--><a href='../publication/aa458993-1b17-4c34-bd31-d6f8224d9b7d' class='mouseoverHref'><em>Transactions of the Royal Entomological Society of London</em></a> <strong>16</strong>: 1-67<!--MARK--> [Date published April 1868]","","Article in Journal","a8978335-b648-4540-9eb1-c23630681ec7","20081009T05:11:37.000+0000","aa458993-1b17-4c34-bd31-d6f8224d9b7d"
"Saunders, E.","1871","Catalogus Buprestidarum Synonymicus et Systematicus","171","","","","","Janson","<!--MARK--><a href='../publication/9d177b5a-e42c-4caf-8e78-7adb07c08841' class='mouseoverHref'>Saunders, E. 1871. <em>Catalogus Buprestidarum Synonymicus et Systematicus</em>. London : Janson 171 pp.</a><!--MARK-->","","Book","9d177b5a-e42c-4caf-8e78-7adb07c08841","20081009T05:11:37.000+0000",""
"Théry, A.","1929","Classification","pp. 266-275","","The Australian Zoologist","A check list of the Australian Buprestidae. With tables and keys to sub-families, tribes, and genera (by A. Théry)","","","<!--MARK--><a href='../publication/e01689db-380f-418e-aad5-0d65adcca6db' class='mouseoverHref'>Théry, A. 1929. Classification. pp. 266-275</a> <!--MARK--><em>in</em> <!--MARK--><a href='../publication/ffb0f112-a5c2-465a-9d40-0c596d20a3f9' class='mouseoverHref'>Carter, H.J. A check list of the Australian Buprestidae. With tables and keys to sub-families, tribes, and genera (by A. Théry).</a> <!--MARK--><!--MARK--><a href='../publication/48148530-5362-4b4a-a304-7ea21fe0d6b7' class='mouseoverHref'><em>The Australian Zoologist</em></a> <strong>5</strong>(4): 265-304<!--MARK--> [Date published 24 Mar 1929]","","Section in Article","e01689db-380f-418e-aad5-0d65adcca6db","20130319T03:02:02.580+0000","ffb0f112-a5c2-465a-9d40-0c596d20a3f9"
"Théry, A.","1934","Études sur les Buprestides (quartième partie)","131-151","","Bulletin et Annales de la Société Royale Belgique d'Entomologie","","","","<!--MARK--><a href='../publication/c86563d1-c851-42c7-ba2e-2473f1ae8cf6' class='mouseoverHref'>Théry, A. 1934. Études sur les Buprestides (quartième partie).</a> <!--MARK--><!--MARK--><a href='../publication/931619a7-755d-40e2-8d8a-2805dca68be9' class='mouseoverHref'><em>Bulletin et Annales de la Société Royale Belgique d'Entomologie</em></a> <strong>47</strong>: 131-151<!--MARK-->","","Article in Journal","c86563d1-c851-42c7-ba2e-2473f1ae8cf6","20081009T05:11:37.000+0000","931619a7-755d-40e2-8d8a-2805dca68be9"
"Théry, A.","1936","Notes synonymique sur les Buprestides (Col.)","59-61","","Bulletin de la Société Entomologique de France","","","","<!--MARK--><a href='../publication/9076fe6f-5199-46e7-a3ad-040e6fc17db9' class='mouseoverHref'>Théry, A. 1936. Notes synonymique sur les Buprestides (Col.).</a> <!--MARK--><!--MARK--><a href='../publication/7853f77c-aa1b-42ec-bc2c-9758f7ff72c7' class='mouseoverHref'><em>Bulletin de la Société Entomologique de France</em></a> <strong>41</strong>(4): 59-61<!--MARK-->","","Article in Journal","9076fe6f-5199-46e7-a3ad-040e6fc17db9","20081009T05:11:37.000+0000","7853f77c-aa1b-42ec-bc2c-9758f7ff72c7"
"Théry, A.","1937","New Buprestid beetles collected in the Solomon Islands and Fiji Islands by Dr. W.H. Mann, with descriptions of some other Indo-Malayan species","33-54","","Psyche","","","","<!--MARK--><a href='../publication/7757de41-5ff3-45f5-89a7-54b319b97006' class='mouseoverHref'>Théry, A. 1937. New Buprestid beetles collected in the Solomon Islands and Fiji Islands by Dr. W.H. Mann, with descriptions of some other Indo-Malayan species.</a> <!--MARK--><!--MARK--><a href='../publication/01098377-9f96-4b2e-8f04-e4df5897b48e' class='mouseoverHref'><em>Psyche</em></a> <strong>44</strong>: 33-54<!--MARK-->","","Article in Journal","7757de41-5ff3-45f5-89a7-54b319b97006","20170524T04:21:01.829+0000","01098377-9f96-4b2e-8f04-e4df5897b48e"
"Théry, A.","1946","Corrections au Coleopterorum Catalogus","155-156","","Novitates Entomologicae","","","","<!--MARK--><a href='../publication/984e24a1-9448-41f7-a140-aa2ab73944a3' class='mouseoverHref'>Théry, A. 1946. Corrections au Coleopterorum Catalogus.</a> <!--MARK--><!--MARK--><a href='../publication/3b10c530-2504-4072-8bab-288972027cb8' class='mouseoverHref'><em>Novitates Entomologicae</em></a> <strong>15-16</strong>: 155-156<!--MARK-->","","Article in Journal","984e24a1-9448-41f7-a140-aa2ab73944a3","20081009T05:11:37.000+0000","3b10c530-2504-4072-8bab-288972027cb8"
"Thomson, J.","1878","Typi Buprestidarum Musaei Thomsoniani","103","","","","","E. Deyrolle","<!--MARK--><a href='../publication/577d5c26-8f3b-4c3c-bbba-b2bfebf8462c' class='mouseoverHref'>Thomson, J. 1878. <em>Typi Buprestidarum Musaei Thomsoniani</em>. Paris : E. Deyrolle 103 pp.</a><!--MARK-->","","Book","577d5c26-8f3b-4c3c-bbba-b2bfebf8462c","20081009T05:11:37.000+0000",""
