"PUB_AUTHOR","PUB_YEAR","PUB_TITLE","PUB_PAGES","PUB_PARENT_BOOK_TITLE","PUB_PARENT_JOURNAL_TITLE","PUB_PARENT_ARTICLE_TITLE","PUB_PUBLICATION_DATE","PUB_PUBLISHER","PUB_FORMATTED","PUB_QUALIFICATION","PUB_TYPE","PUBLICATION_GUID","PUBLICATION_LAST_UPDATE","PARENT_PUBLICATION_GUID"
"Mironov, S.V. & Dabert, J.","1997","A systematic review of the feather mite genus <i>Bychovskiata</i> Dubinin (Analgoidea: Avenzoariidae) with description of 11 new species","91-123","","Mitteilungen aus dem Hamburgischen Zoologischen Museum und Institut","","","","<!--MARK--><a href='nullfdfb77bf-0954-4ee6-b799-e9773e447819' class='mouseoverHref'>Mironov, S.V. & Dabert, J. 1997. A systematic review of the feather mite genus <i>Bychovskiata</i> Dubinin (Analgoidea: Avenzoariidae) with description of 11 new species.</a> <!--MARK--><!--MARK--><a href='null171ccd89-642b-4041-beef-26bac3a726db' class='mouseoverHref'><em>Mitteilungen aus dem Hamburgischen Zoologischen Museum und Institut</em></a> <strong>94</strong>: 91-123<!--MARK-->","","Article in Journal","fdfb77bf-0954-4ee6-b799-e9773e447819","20081009T05:11:37.000+0000","171ccd89-642b-4041-beef-26bac3a726db"
"Mironov, S.V. & Proctor, H.C.","2005","A new feather mite genus of the family Psoroptoididae (Acari: Analgoidea) from cassowaries","3297-3304","","Journal of Natural History","","","","<!--MARK--><a href='null7a18dca7-6941-43fc-9dc0-14541ab69be0' class='mouseoverHref'>Mironov, S.V. & Proctor, H.C. 2005. A new feather mite genus of the family Psoroptoididae (Acari: Analgoidea) from cassowaries.</a> <!--MARK--><!--MARK--><a href='nullad79edeb-4c47-4124-a7ea-9bcbbce0efa4' class='mouseoverHref'><em>Journal of Natural History</em></a> <strong>39</strong>: 3297-3304<!--MARK-->","","Article in Journal","7a18dca7-6941-43fc-9dc0-14541ab69be0","20100921T21:45:34.549+0000","ad79edeb-4c47-4124-a7ea-9bcbbce0efa4"
"Mironov, S.V. & Proctor, H.C.","2008","The probable association of feather mites of the genus <I>Ingrassia</I> (Analgoidea: Xolalgidae) with the blue penguin <I>Eudyptula minor</I> (Aves: Sphenisciformes) in Australia.","1243-1248","","Journal of Parasitology","","","","<!--MARK--><a href='nullad81820e-efbf-40c7-8cd4-1747d8a584e6' class='mouseoverHref'>Mironov, S.V. & Proctor, H.C. 2008. The probable association of feather mites of the genus <I>Ingrassia</I> (Analgoidea: Xolalgidae) with the blue penguin <I>Eudyptula minor</I> (Aves: Sphenisciformes) in Australia.</a> <!--MARK--><!--MARK--><a href='nulle52ecfa4-7e99-4ea0-acd3-ce3d83537d01' class='mouseoverHref'><em>Journal of Parasitology</em></a> <strong>94</strong>: 1243-1248<!--MARK-->","","Article in Journal","ad81820e-efbf-40c7-8cd4-1747d8a584e6","20110130T22:51:19.994+0000","e52ecfa4-7e99-4ea0-acd3-ce3d83537d01"
"Mironov, S.V. & Proctor, H.C.","2009","<i>Atelophyllodes</i> gen. n., a new feather mite genus of the family Proctophyllodidae (Astigmata: Analgoidea) from lyrebirds (Passeriformes: Menuridae)","51-61","","Zootaxa","","","","<!--MARK--><a href='null7f66bebf-adb3-4d40-bfc4-d13de919099f' class='mouseoverHref'>Mironov, S.V. & Proctor, H.C. 2009. <i>Atelophyllodes</i> gen. n., a new feather mite genus of the family Proctophyllodidae (Astigmata: Analgoidea) from lyrebirds (Passeriformes: Menuridae).</a> <!--MARK--><!--MARK--><a href='null96466227-221c-4922-ac97-1ac2dd946d0a' class='mouseoverHref'><em>Zootaxa</em></a> <strong>2326</strong>: 51-61<!--MARK-->","","Article in Journal","7f66bebf-adb3-4d40-bfc4-d13de919099f","20101125T07:45:04.371+0000","96466227-221c-4922-ac97-1ac2dd946d0a"
"Mourik, S.C.van & Norman, F.I.","1985","Ectoparasites of some waterfowl (Anatidae) from Victoria","1-3","","Occasional Papers of the Museum of Victoria","","","","<!--MARK--><a href='nullb61e8f1c-7152-44da-827e-60d58ffa7846' class='mouseoverHref'>Mourik, S.C.van & Norman, F.I. 1985. Ectoparasites of some waterfowl (Anatidae) from Victoria.</a> <!--MARK--><!--MARK--><a href='nullcdd01b00-8de7-4463-89a2-450d27bc4256' class='mouseoverHref'><em>Occasional Papers of the Museum of Victoria</em></a> <strong>2</strong>: 1-3<!--MARK-->","","Article in Journal","b61e8f1c-7152-44da-827e-60d58ffa7846","20081009T05:11:37.000+0000","cdd01b00-8de7-4463-89a2-450d27bc4256"
"Mullen, G.R. & OConnor, B.M.","2009","Mites (Acari)","pp. 433-492","Medical and Veterinary Entomology","","","","","<!--MARK--><a href='null98dbd908-afc1-423f-ad88-3dcb812b0c33' class='mouseoverHref'>Mullen, G.R. & OConnor, B.M. 2009. Mites (Acari). pp. 433-492</a> <!--MARK--><em>in</em> <!--MARK--><a href='nullbf1ef1fe-970a-4e6a-86dc-9ae3731251d7' class='mouseoverHref'>Mullen, G.R. & Durden, L.A. <em>Medical and Veterinary Entomology</em>. Amsterdam : Elsevier 2.</a><!--MARK-->","","Chapter in Book","98dbd908-afc1-423f-ad88-3dcb812b0c33","20100726T22:42:42.766+0000","bf1ef1fe-970a-4e6a-86dc-9ae3731251d7"
"Mulvey, P.M.","1972","Cot death survey. Anaphylaxis and the house dust mite","1240-1244","","Medical Journal of Australia","","","","<!--MARK--><a href='null58167385-3438-4f76-a5e4-7204fee04c11' class='mouseoverHref'>Mulvey, P.M. 1972. Cot death survey. Anaphylaxis and the house dust mite.</a> <!--MARK--><!--MARK--><a href='null4fa29965-b1a9-4ea3-9cd4-472ef0fabe56' class='mouseoverHref'><em>Medical Journal of Australia</em></a> <strong>1972</strong>(2): 1240-1244<!--MARK-->","","Article in Journal","58167385-3438-4f76-a5e4-7204fee04c11","20081009T05:11:37.000+0000","4fa29965-b1a9-4ea3-9cd4-472ef0fabe56"
"Murray, M.D.","1959","The attachment of eggs of a mite <i>Epidermoptes bilobatus</i> to the skin of its host","372-373","","Parasitology","","","","<!--MARK--><a href='null4335bdc3-ee81-4c07-8d71-ae15677987c4' class='mouseoverHref'>Murray, M.D. 1959. The attachment of eggs of a mite <i>Epidermoptes bilobatus</i> to the skin of its host.</a> <!--MARK--><!--MARK--><a href='nullb2746c84-c004-431c-8966-2f153b82b814' class='mouseoverHref'><em>Parasitology</em></a> <strong>49</strong>: 372-373<!--MARK-->","","Article in Journal","4335bdc3-ee81-4c07-8d71-ae15677987c4","20081009T05:11:37.000+0000","b2746c84-c004-431c-8966-2f153b82b814"
"Murton, J.J. & Madden, J.L.","1977","Observations on the biology, behaviour and ecology of the house-dust mite, <i>Dermatophagoides pteronyssinus</i> (Trouessart) (Acarina : Pyroglyphidae) in Tasmania","281-287","","Journal of the Australian Entomological Society","","","","<!--MARK--><a href='nullbd4c63c1-ab68-4a4b-948f-0909a454766f' class='mouseoverHref'>Murton, J.J. & Madden, J.L. 1977. Observations on the biology, behaviour and ecology of the house-dust mite, <i>Dermatophagoides pteronyssinus</i> (Trouessart) (Acarina : Pyroglyphidae) in Tasmania.</a> <!--MARK--><!--MARK--><a href='nullc2544f9f-3978-4f18-846d-a1fd3122c9c4' class='mouseoverHref'><em>Journal of the Australian Entomological Society</em></a> <strong>16</strong>: 281-287<!--MARK-->","","Article in Journal","bd4c63c1-ab68-4a4b-948f-0909a454766f","20081009T05:11:37.000+0000","c2544f9f-3978-4f18-846d-a1fd3122c9c4"
"Naumann, I.","1993","CSIRO Handbook of Australian Insect Names. Common and Scientific Names for Insects and Allied Organisms of Economic and Environmental Importance","v 200","","","","31/12/1993","CSIRO Publications","<!--MARK--><a href='null06ee5622-20fb-45ec-9434-f60c8a120f05' class='mouseoverHref'>Naumann, I. 1993. <em>CSIRO Handbook of Australian Insect Names. Common and Scientific Names for Insects and Allied Organisms of Economic and Environmental Importance</em>. Melbourne : CSIRO Publications v 200 pp.</a><!--MARK--> [Date published 31/12/1993]","","Book","06ee5622-20fb-45ec-9434-f60c8a120f05","20120712T02:11:22.982+0000",""
"Newton, L.G. & O'Sullivan, P.J.","1956","A note on the occurrence of the mite <i>Cnemidocoptes pilae</i> on budgerigars in Queensland","89-90","","Australian Veterinary Journal","","","","<!--MARK--><a href='nullde7886cd-e744-4db2-bdae-125eac29227a' class='mouseoverHref'>Newton, L.G. & O'Sullivan, P.J. 1956. A note on the occurrence of the mite <i>Cnemidocoptes pilae</i> on budgerigars in Queensland.</a> <!--MARK--><!--MARK--><a href='null0d20256a-6324-43b5-a6d5-a9316bda2434' class='mouseoverHref'><em>Australian Veterinary Journal</em></a> <strong>32</strong>: 89-90<!--MARK-->","","Article in Journal","de7886cd-e744-4db2-bdae-125eac29227a","20081009T05:11:37.000+0000","0d20256a-6324-43b5-a6d5-a9316bda2434"
"Nitzsch, C.L.","1818","Acaridiae, Acarina, <i>Acarus</i>","","Allgemeine Encyclopädie der Wissenschaften und Künste","","","","","<!--MARK--><a href='nullff77d788-e2af-41d0-89a6-caf4b1574769' class='mouseoverHref'>Nitzsch, C.L. 1818. Acaridiae, Acarina, <i>Acarus</i>.</a> <!--MARK--><em>In,</em> <!--MARK--><a href='null28d8a255-98a8-4d82-9bbc-d6613a83b066' class='mouseoverHref'>Ersch, J.S. & Grube, J.G. (eds). <em>Allgemeine Encyclopädie der Wissenschaften und Künste</em>. Leipzig : J.F. Gleditsch Vol. 1.</a><!--MARK-->","","Chapter in Book","ff77d788-e2af-41d0-89a6-caf4b1574769","20081009T05:11:37.000+0000","28d8a255-98a8-4d82-9bbc-d6613a83b066"
"OConnor, B.M.","2009","Cohort Astigmatina","pp. 565-657","A Manual of Acarology","","","","","<!--MARK--><a href='nullab762d1c-2c17-438a-8324-4d77429d9bfe' class='mouseoverHref'>OConnor, B.M. 2009. Cohort Astigmatina. pp. 565-657</a> <!--MARK--><em>in</em> <!--MARK--><a href='null4adea5fa-3e8b-4daf-bac9-2ec7aa45d0fd' class='mouseoverHref'>Krantz, G.W. & Walter, D.E. (eds). <em>A Manual of Acarology</em>. Lubbock, Texas : Texas Tech University Press Third edition, 807 pp.</a><!--MARK-->","","Chapter in Book","ab762d1c-2c17-438a-8324-4d77429d9bfe","20120130T21:29:57.061+0000","4adea5fa-3e8b-4daf-bac9-2ec7aa45d0fd"
"Oudemans, A.C.","1905","Acarologische aanteekeningen XV","207-210","","Entomologische Berichten (Amsterdam)","","","","<!--MARK--><a href='null8f21304f-24e7-4a14-9726-74b1ae7cd218' class='mouseoverHref'>Oudemans, A.C. 1905. Acarologische aanteekeningen XV.</a> <!--MARK--><!--MARK--><a href='null64444303-afa9-4ecc-b061-09541c96dc49' class='mouseoverHref'><em>Entomologische Berichten (Amsterdam)</em></a> <strong>1</strong>(21): 207-210<!--MARK-->","","Article in Journal","8f21304f-24e7-4a14-9726-74b1ae7cd218","20081009T05:11:37.000+0000","64444303-afa9-4ecc-b061-09541c96dc49"
"Oudemans, A.C.","1905","Acarologische Aanteekeningen XVII.","222-226","","Entomologische Berichten (Amsterdam)","","","","<!--MARK--><a href='null73736ccd-0450-4ce7-8bac-2e438fbed62d' class='mouseoverHref'>Oudemans, A.C. 1905. Acarologische Aanteekeningen XVII.</a> <!--MARK--><!--MARK--><a href='null64444303-afa9-4ecc-b061-09541c96dc49' class='mouseoverHref'><em>Entomologische Berichten (Amsterdam)</em></a> <strong>1</strong>(23): 222-226<!--MARK-->","","Article in Journal","73736ccd-0450-4ce7-8bac-2e438fbed62d","20110130T22:46:36.601+0000","64444303-afa9-4ecc-b061-09541c96dc49"
"Oudemans, A.C.","1908","Notes on Acari. XVth series. (Parasitidae, Acaridae)","28-88 pls 1-3","","Tijdschrift voor Entomologie","","","","<!--MARK--><a href='null046506b8-c4fe-40d5-bd95-6e02b89199bc' class='mouseoverHref'>Oudemans, A.C. 1908. Notes on Acari. XVth series. (Parasitidae, Acaridae).</a> <!--MARK--><!--MARK--><a href='null6b0f0fc0-01fc-4ed4-aae0-c8b621477f01' class='mouseoverHref'><em>Tijdschrift voor Entomologie</em></a> <strong>51</strong>: 28-88 pls 1-3<!--MARK-->","","Article in Journal","046506b8-c4fe-40d5-bd95-6e02b89199bc","20081009T05:11:37.000+0000","6b0f0fc0-01fc-4ed4-aae0-c8b621477f01"
"Park, C.K. & Atyeo, W.T.","1971","A generic revision of the Pterodectinae, a new subfamily of feather mites (Sarcoptiformes : Analgoidea)","39-88","","Bulletin of the University of Nebraska State Museum","","","","<!--MARK--><a href='null34dd968f-7799-4071-9342-499f6c472883' class='mouseoverHref'>Park, C.K. & Atyeo, W.T. 1971. A generic revision of the Pterodectinae, a new subfamily of feather mites (Sarcoptiformes : Analgoidea).</a> <!--MARK--><!--MARK--><a href='null7875fdac-320e-4fc2-9bc8-e3f514a89fed' class='mouseoverHref'><em>Bulletin of the University of Nebraska State Museum</em></a> <strong>9</strong>(3): 39-88<!--MARK-->","","Article in Journal","34dd968f-7799-4071-9342-499f6c472883","20081009T05:11:37.000+0000","7875fdac-320e-4fc2-9bc8-e3f514a89fed"
"Pence, D.B.","1975","Keys, species and host list, and bibliography for nasal mites of north American birds (Acarina : Rhinonyssinae, Turbinoptinae, Speleognathinae, and Cytoditidae)","1-148","","Special Publications of the Museum. Texas Technical University","","","","<!--MARK--><a href='nullc7699fd4-38d4-4293-ad8f-a95930787a65' class='mouseoverHref'>Pence, D.B. 1975. Keys, species and host list, and bibliography for nasal mites of north American birds (Acarina : Rhinonyssinae, Turbinoptinae, Speleognathinae, and Cytoditidae).</a> <!--MARK--><!--MARK--><a href='null82f833cc-fc55-40f3-bee6-81e2a742cd08' class='mouseoverHref'><em>Special Publications of the Museum. Texas Technical University</em></a> <strong>8</strong>: 1-148<!--MARK-->","","Article in Journal","c7699fd4-38d4-4293-ad8f-a95930787a65","20081009T05:11:37.000+0000","82f833cc-fc55-40f3-bee6-81e2a742cd08"
"Peterson, P.C.","1971","A revision of the feather mite genus <i>Brephosceles</i> (Proctophyllodidae: Alloptinae)","89-172","","Bulletin of the University of Nebraska State Museum","","","","<!--MARK--><a href='null09997819-425b-43fc-a293-32bece9ef712' class='mouseoverHref'>Peterson, P.C. 1971. A revision of the feather mite genus <i>Brephosceles</i> (Proctophyllodidae: Alloptinae).</a> <!--MARK--><!--MARK--><a href='null7875fdac-320e-4fc2-9bc8-e3f514a89fed' class='mouseoverHref'><em>Bulletin of the University of Nebraska State Museum</em></a> <strong>9</strong>: 89-172<!--MARK-->","","Article in Journal","09997819-425b-43fc-a293-32bece9ef712","20081009T05:11:37.000+0000","7875fdac-320e-4fc2-9bc8-e3f514a89fed"
"Philips, J.R. & Fain, A.","1991","Acarine symbionts of louseflies (Diptera : Hippoboscidae)","377-384","","Acarologia","","","","<!--MARK--><a href='null0222ed83-a84f-47d1-a496-6dc4ff5dee98' class='mouseoverHref'>Philips, J.R. & Fain, A. 1991. Acarine symbionts of louseflies (Diptera : Hippoboscidae).</a> <!--MARK--><!--MARK--><a href='nullca52b0dd-4050-4ed0-b7a9-fad0329897d3' class='mouseoverHref'><em>Acarologia</em></a> <strong>32</strong>: 377-384<!--MARK-->","","Article in Journal","0222ed83-a84f-47d1-a496-6dc4ff5dee98","20081009T05:11:37.000+0000","ca52b0dd-4050-4ed0-b7a9-fad0329897d3"
"Proctor, H., Kanowski, J., Catterall, C.P., Wardell-Johnson, G. & Reis, T.","2011","Rainforest-restoration success as judged by assemblages of soil- and litter-dwelling mites (Arachnida: Acari).","234-254","","Zoosymposia","","","","<!--MARK--><a href='null21def376-53f4-4862-aa67-7eeaa772a567' class='mouseoverHref'>Proctor, H., Kanowski, J., Catterall, C.P., Wardell-Johnson, G. & Reis, T. 2011. Rainforest-restoration success as judged by assemblages of soil- and litter-dwelling mites (Arachnida: Acari).</a> <!--MARK--><!--MARK--><a href='null415b326a-b277-4eb2-807a-dc5308a7a1ce' class='mouseoverHref'><em>Zoosymposia</em></a> <strong>6</strong>: 234-254<!--MARK-->","","Article in Journal","21def376-53f4-4862-aa67-7eeaa772a567","20130117T07:09:34.061+0000","415b326a-b277-4eb2-807a-dc5308a7a1ce"
"Proctor, H.C.","2001","<i>Megninia casuaricola</i> sp. n. (Acari: Analgidae), the first feather mite from a cassowary (Aves: Struthioniformes: Casuariidae)","335-341","","Australian Journal of Entomology","","","","<!--MARK--><a href='null89352e2a-72ef-4629-9ccd-559717fd40c3' class='mouseoverHref'>Proctor, H.C. 2001. <i>Megninia casuaricola</i> sp. n. (Acari: Analgidae), the first feather mite from a cassowary (Aves: Struthioniformes: Casuariidae).</a> <!--MARK--><!--MARK--><a href='null77b15fe9-6d88-4390-b074-3a3a6d3683a6' class='mouseoverHref'><em>Australian Journal of Entomology</em></a> <strong>40</strong>: 335-341<!--MARK-->","","Article in Journal","89352e2a-72ef-4629-9ccd-559717fd40c3","20100909T03:59:10.979+0000","77b15fe9-6d88-4390-b074-3a3a6d3683a6"
"Radford, C.D.","1950","Systematic Check List of Mite Genera and Type Species","232","","","","","Secrétariat Général de l'Union Internationale des Sciences Biologiques","<!--MARK--><a href='null4c2c660e-2abf-43c1-b874-7273e971d381' class='mouseoverHref'>Radford, C.D. 1950. <em>Systematic Check List of Mite Genera and Type Species</em>. Paris : Secrétariat Général de l'Union Internationale des Sciences Biologiques 232 pp.</a><!--MARK-->","","Book","4c2c660e-2abf-43c1-b874-7273e971d381","20081009T05:11:37.000+0000",""
"Radford, C.D.","1953","The mites (Acarina : Analgesidae) living on or in the feathers of birds","199-230","","Parasitology","","","","<!--MARK--><a href='nulla045fa91-a9a8-4559-8ca8-4cb06be341ad' class='mouseoverHref'>Radford, C.D. 1953. The mites (Acarina : Analgesidae) living on or in the feathers of birds.</a> <!--MARK--><!--MARK--><a href='nullb2746c84-c004-431c-8966-2f153b82b814' class='mouseoverHref'><em>Parasitology</em></a> <strong>42</strong>: 199-230<!--MARK-->","","Article in Journal","a045fa91-a9a8-4559-8ca8-4cb06be341ad","20081009T05:11:37.000+0000","b2746c84-c004-431c-8966-2f153b82b814"
"Railliet, A.","1887","Étude zoologique du sarcopte lisse (<i>Sarcoptes laevis</i> Rail.), nouvelle forme acarienne parasite des oiseaux de basse-cour","127-136 pl. II","","Bulletin de la Société Zoologique de France","","","","<!--MARK--><a href='null549bb60b-f504-42d5-9f97-59589e75a60f' class='mouseoverHref'>Railliet, A. 1887. Étude zoologique du sarcopte lisse (<i>Sarcoptes laevis</i> Rail.), nouvelle forme acarienne parasite des oiseaux de basse-cour.</a> <!--MARK--><!--MARK--><a href='null8dec2bf0-72c6-4775-b21a-2bd0ec166210' class='mouseoverHref'><em>Bulletin de la Société Zoologique de France</em></a> <strong>12</strong>: 127-136 pl. II<!--MARK-->","","Article in Journal","549bb60b-f504-42d5-9f97-59589e75a60f","20081009T05:11:37.000+0000","8dec2bf0-72c6-4775-b21a-2bd0ec166210"
"Rainbow, W.J.","1906","A synopsis of Australian Acarina","145-193","","Records of the Australian Museum","","","","<!--MARK--><a href='nulle4225f16-1e8a-4a04-a9b6-bd2f73d6ed94' class='mouseoverHref'>Rainbow, W.J. 1906. A synopsis of Australian Acarina.</a> <!--MARK--><!--MARK--><a href='null7c07530b-0b38-44f5-8f95-368da97d6ac2' class='mouseoverHref'><em>Records of the Australian Museum</em></a> <strong>6</strong>: 145-193<!--MARK-->","","Article in Journal","e4225f16-1e8a-4a04-a9b6-bd2f73d6ed94","20081009T05:11:37.000+0000","7c07530b-0b38-44f5-8f95-368da97d6ac2"
"Rivolta, S. & Delprato, P.","1880","L'Ornitojatria o la Medicina degli Uccelli Domestici e Semidomestici","","","","","","G. G. A. Ubelhart","<!--MARK--><a href='null308d4bc8-7003-40ca-9785-16d9dca243cc' class='mouseoverHref'>Rivolta, S. & Delprato, P. 1880. <em>L'Ornitojatria o la Medicina degli Uccelli Domestici e Semidomestici</em>. Pisa : G. G. A. Ubelhart.</a><!--MARK-->","","Book","308d4bc8-7003-40ca-9785-16d9dca243cc","20081009T05:11:37.000+0000",""
"Roberts, F.H.S.","1936","The feather mites of poultry","42-43","","Queensland Agricultural Journal","","","","<!--MARK--><a href='null1f9b0106-582f-45ef-835e-eeab8ca40e4b' class='mouseoverHref'>Roberts, F.H.S. 1936. The feather mites of poultry.</a> <!--MARK--><!--MARK--><a href='null0acc8dde-afa1-48c1-9ca4-6a5a5a8549aa' class='mouseoverHref'><em>Queensland Agricultural Journal</em></a> <strong>45</strong>: 42-43<!--MARK-->","","Article in Journal","1f9b0106-582f-45ef-835e-eeab8ca40e4b","20081009T05:11:37.000+0000","0acc8dde-afa1-48c1-9ca4-6a5a5a8549aa"
"Roberts, F.H.S.","1952","Insects Affecting Livestock","267","","","","","Angus and Robertson","<!--MARK--><a href='null1574eb9a-dcbf-48aa-b05a-cf5142b42f7f' class='mouseoverHref'>Roberts, F.H.S. 1952. <em>Insects Affecting Livestock</em>. Sydney and London : Angus and Robertson 267 pp.</a><!--MARK-->","","Book","1574eb9a-dcbf-48aa-b05a-cf5142b42f7f","20081009T05:11:37.000+0000",""
"Robin, C.","1868","Mémoire sur les Sarcoptides avicoles et sur les métamorphoses des Acariens","776-787","","Comptes Rendus (Hebdomadaires) des Séances de l'Academie des Sciences. Série D. Sciences Naturelles","","","","<!--MARK--><a href='null526fb15d-a5c1-43c8-bb55-b19cecce0f6c' class='mouseoverHref'>Robin, C. 1868. Mémoire sur les Sarcoptides avicoles et sur les métamorphoses des Acariens.</a> <!--MARK--><!--MARK--><a href='null77294646-7b61-4cee-974d-0ed045692670' class='mouseoverHref'><em>Comptes Rendus (Hebdomadaires) des Séances de l'Academie des Sciences. Série D. Sciences Naturelles</em></a> <strong>66</strong>: 776-787<!--MARK-->","","Article in Journal","526fb15d-a5c1-43c8-bb55-b19cecce0f6c","20081009T05:11:37.000+0000","77294646-7b61-4cee-974d-0ed045692670"
"Robin, C. & Mégnin, P.","1877","Mémoire sur les Sarcoptides plumicoles","629-656 pls XXXVI-XXXVIII","","Journal de l'Anatomie et de la Physiologie Normales et Pathologiques de l'Homme et des Animaux","","","","<!--MARK--><a href='null8d20049d-775d-4061-89e3-38325a2b2ed8' class='mouseoverHref'>Robin, C. & Mégnin, P. 1877. Mémoire sur les Sarcoptides plumicoles.</a> <!--MARK--><!--MARK--><a href='nulleb7bbcb9-e926-4491-b54d-eb1abc349ff0' class='mouseoverHref'><em>Journal de l'Anatomie et de la Physiologie Normales et Pathologiques de l'Homme et des Animaux</em></a> <strong>13</strong>: 629-656 pls XXXVI-XXXVIII<!--MARK-->","","Article in Journal","8d20049d-775d-4061-89e3-38325a2b2ed8","20081009T05:11:37.000+0000","eb7bbcb9-e926-4491-b54d-eb1abc349ff0"
"Robin, C.P. & Lanquetin, E.","1859","Mémoire sur une nouvelle espèce de <i>Sarcoptes</i>, parasite des Gallinacés","793-795","","Comptes Rendus (Hebdomadaires) des Séances de l'Academie des Sciences. Série D. Sciences Naturelles","","","","<!--MARK--><a href='null35e38569-57e4-434f-b789-b13985e9d5a9' class='mouseoverHref'>Robin, C.P. & Lanquetin, E. 1859. Mémoire sur une nouvelle espèce de <i>Sarcoptes</i>, parasite des Gallinacés.</a> <!--MARK--><!--MARK--><a href='null77294646-7b61-4cee-974d-0ed045692670' class='mouseoverHref'><em>Comptes Rendus (Hebdomadaires) des Séances de l'Academie des Sciences. Série D. Sciences Naturelles</em></a> <strong>49</strong>: 793-795<!--MARK-->","","Article in Journal","35e38569-57e4-434f-b789-b13985e9d5a9","20081009T05:11:37.000+0000","77294646-7b61-4cee-974d-0ed045692670"
"Santana, F.J.","1976","A review of the genus <i>Trouessartia</i>","1-128","","Journal of Medical Entomology","","","","<!--MARK--><a href='null9c31c8c7-8230-47a5-8dc3-5f9694e2d55f' class='mouseoverHref'>Santana, F.J. 1976. A review of the genus <i>Trouessartia</i>.</a> <!--MARK--><!--MARK--><a href='null093356b1-6028-4655-a360-33643254a6df' class='mouseoverHref'><em>Journal of Medical Entomology</em></a> Supplement <strong>1</strong>: 1-128<!--MARK-->","","Article in Journal","9c31c8c7-8230-47a5-8dc3-5f9694e2d55f","20090731T03:05:35.994+0000","093356b1-6028-4655-a360-33643254a6df"
"Seddon, H.R.","1952","<i>Diseases of Domestic Animals in Australia. Part 3. Tick and Mite Infestations</i>. Commonwealth of Australia Department of Health, Service Publication (Division of Veterinary Hygeine) <B>7</B>. 200 pp","","","","","","","<!--MARK--><a href='null61e62cd1-3e2d-4f4c-b045-085753eaabdc' class='mouseoverHref'>Seddon, H.R. 1952. <i>Diseases of Domestic Animals in Australia. Part 3. Tick and Mite Infestations</i>. Commonwealth of Australia Department of Health, Service Publication (Division of Veterinary Hygeine) <B>7</B>. 200 pp.</a>","","Miscellaneous","61e62cd1-3e2d-4f4c-b045-085753eaabdc","20081009T05:11:37.000+0000",""
"Seddon, H.R.","1968","<i>Diseases of Domestic Animals in Australia. Part 3. Arthropod Infestations (Ticks and Mites).</i> <i>Commonwealth of Australia Department of Health, Service Publication (Veterinary Hygeine)</i>  (Revised by H. E. Albiston) Vol. 7 170 pp","","","","","","","<!--MARK--><a href='nulld1e8bf30-1221-44ce-8fb6-a06a8015072e' class='mouseoverHref'>Seddon, H.R. 1968. <i>Diseases of Domestic Animals in Australia. Part 3. Arthropod Infestations (Ticks and Mites).</i> <i>Commonwealth of Australia Department of Health, Service Publication (Veterinary Hygeine)</i>  (Revised by H. E. Albiston) Vol. 7 170 pp.</a>","","Miscellaneous","d1e8bf30-1221-44ce-8fb6-a06a8015072e","20081009T05:11:37.000+0000",""
"Southcott, R.V.","1976","Arachnidism and allied syndromes in the Australian region","97-186","","Records of the Adelaide Children's Hospital","","","","<!--MARK--><a href='null5b71fa5d-9cf7-4172-b251-bed2dfcfc28f' class='mouseoverHref'>Southcott, R.V. 1976. Arachnidism and allied syndromes in the Australian region.</a> <!--MARK--><!--MARK--><a href='nulldd91f311-be5e-4a9f-ab26-d27886b6bce2' class='mouseoverHref'><em>Records of the Adelaide Children's Hospital</em></a> <strong>1</strong>: 97-186<!--MARK-->","","Article in Journal","5b71fa5d-9cf7-4172-b251-bed2dfcfc28f","20081009T05:11:37.000+0000","dd91f311-be5e-4a9f-ab26-d27886b6bce2"
"Southcott, R.V.","1978","Australian Harmful Arachnids and Their Allies","36","","","","","R. V. Southcott","<!--MARK--><a href='null152087e7-d3b5-45bc-8c44-a899bc2c5e7d' class='mouseoverHref'>Southcott, R.V. 1978. <em>Australian Harmful Arachnids and Their Allies</em>. Mitcham, South Australia : R. V. Southcott 36 pp.</a><!--MARK-->","","Book","152087e7-d3b5-45bc-8c44-a899bc2c5e7d","20081009T05:11:37.000+0000",""
"Spieksma, F.T.M.","1988","Taxonomic identity of <i>Dermatophagoides</i> species","5-21","International Symposium on Mite and Midge Allergy","","","","","<!--MARK--><a href='nulldb0390b1-d278-4765-bbc9-198caa32b69e' class='mouseoverHref'>Spieksma, F.T.M. 1988. Taxonomic identity of <i>Dermatophagoides</i> species. pp. 5-21</a> <!--MARK--><em>in</em> <!--MARK--><a href='null63ea110f-f361-4a82-a2ea-2be07c2b7b3e' class='mouseoverHref'>Miyamoto, T. (ed.). <em>International Symposium on Mite and Midge Allergy</em>. Tokyo : Ministry of Education, Science and Culture, Japanese Government.</a><!--MARK-->","","Chapter in Book","db0390b1-d278-4765-bbc9-198caa32b69e","20081009T05:11:37.000+0000","63ea110f-f361-4a82-a2ea-2be07c2b7b3e"
