"PUB_AUTHOR","PUB_YEAR","PUB_TITLE","PUB_PAGES","PUB_PARENT_BOOK_TITLE","PUB_PARENT_JOURNAL_TITLE","PUB_PARENT_ARTICLE_TITLE","PUB_PUBLICATION_DATE","PUB_PUBLISHER","PUB_FORMATTED","PUB_QUALIFICATION","PUB_TYPE","PUBLICATION_GUID","PUBLICATION_LAST_UPDATE","PARENT_PUBLICATION_GUID"
"Gaud, J.","1982","Acariens sarcoptiformes plumicoles des oiseaux Ciconiiformes d'Afrique. III. Parasites des Threskiornithidae","701-730","","Revue de Zoologie Africaine","","","","<!--MARK--><a href='null883ff36c-70c3-4b4a-a459-cda1c58e429f' class='mouseoverHref'>Gaud, J. 1982. Acariens sarcoptiformes plumicoles des oiseaux Ciconiiformes d'Afrique. III. Parasites des Threskiornithidae.</a> <!--MARK--><!--MARK--><a href='null46c39bd8-0042-4db4-9cc5-af9cd1bc4711' class='mouseoverHref'><em>Revue de Zoologie Africaine</em></a> <strong>96</strong>: 701-730<!--MARK-->","","Article in Journal","883ff36c-70c3-4b4a-a459-cda1c58e429f","20081009T05:11:37.000+0000","46c39bd8-0042-4db4-9cc5-af9cd1bc4711"
"Gaud, J. & Atyeo, W.T.","1967","Genres nouveaux de la famille Analgidae, Trouessart and Megnin","447-464","","Acarologia","","","","<!--MARK--><a href='null8b87e528-5991-433c-ba6e-b80415cb2a69' class='mouseoverHref'>Gaud, J. & Atyeo, W.T. 1967. Genres nouveaux de la famille Analgidae, Trouessart and Megnin.</a> <!--MARK--><!--MARK--><a href='nullca52b0dd-4050-4ed0-b7a9-fad0329897d3' class='mouseoverHref'><em>Acarologia</em></a> <strong>9</strong>: 447-464<!--MARK-->","","Article in Journal","8b87e528-5991-433c-ba6e-b80415cb2a69","20081009T05:11:37.000+0000","ca52b0dd-4050-4ed0-b7a9-fad0329897d3"
"Gaud, J. & Atyeo, W.T.","1976","Discordances entre les aires de répartition géographique des parasites et celles de leurs hôtes chez les Sarcoptiformes plumicoles","329-344","","Acarologia","","","","<!--MARK--><a href='nullf2094afc-f817-4acf-9f30-ccbe1c15ee93' class='mouseoverHref'>Gaud, J. & Atyeo, W.T. 1976. Discordances entre les aires de répartition géographique des parasites et celles de leurs hôtes chez les Sarcoptiformes plumicoles.</a> <!--MARK--><!--MARK--><a href='nullca52b0dd-4050-4ed0-b7a9-fad0329897d3' class='mouseoverHref'><em>Acarologia</em></a> <strong>18</strong>: 329-344<!--MARK-->","","Article in Journal","f2094afc-f817-4acf-9f30-ccbe1c15ee93","20081009T05:11:37.000+0000","ca52b0dd-4050-4ed0-b7a9-fad0329897d3"
"Gaud, J. & Atyeo, W.T.","1996","Feather mites of the world (Acarina, Astigmata) The supraspecific taxa","Pt I, 1-193, Pt II, 1-436","","Annales du Musée Royal de l'Afrique Centrale Tervuren Belgique","","","","<!--MARK--><a href='nullddc8d2b1-610f-4be6-837a-a60cb5111967' class='mouseoverHref'>Gaud, J. & Atyeo, W.T. 1996. Feather mites of the world (Acarina, Astigmata) The supraspecific taxa.</a> <!--MARK--><!--MARK--><a href='null67ebf567-c3fe-47a3-8c95-fc520694b6e2' class='mouseoverHref'><em>Annales du Musée Royal de l'Afrique Centrale Tervuren Belgique</em></a> <strong>277</strong>: Pt I, 1-193, Pt II, 1-436<!--MARK-->","","Article in Journal","ddc8d2b1-610f-4be6-837a-a60cb5111967","20081009T05:11:37.000+0000","67ebf567-c3fe-47a3-8c95-fc520694b6e2"
"Gaud, J. & Mouchet, J.","1957","Acariens plumicoles (Analgesoidea) des oiseaux du Cameroun. I. Proctophyllodidae","491-546","","Annales de Parasitologie Humaine et Comparée","","","","<!--MARK--><a href='null32319cd0-1c11-4cd5-8770-5b68f632b54e' class='mouseoverHref'>Gaud, J. & Mouchet, J. 1957. Acariens plumicoles (Analgesoidea) des oiseaux du Cameroun. I. Proctophyllodidae.</a> <!--MARK--><!--MARK--><a href='nullea816730-12e3-47dc-8f86-d252a344ac74' class='mouseoverHref'><em>Annales de Parasitologie Humaine et Comparée</em></a> <strong>32</strong>: 491-546<!--MARK-->","","Article in Journal","32319cd0-1c11-4cd5-8770-5b68f632b54e","20081009T05:11:37.000+0000","ea816730-12e3-47dc-8f86-d252a344ac74"
"Gaud, J. & Mouchet, J.","1959","Acariens plumicoles (Analgesoidea) parasites des oiseaux du Cameroun. II. Analgesidae","149-208","","Annales de Parasitologie Humaine et Comparée","","","","<!--MARK--><a href='nulla663bd0f-f99c-4fc6-b58a-6662e69a5677' class='mouseoverHref'>Gaud, J. & Mouchet, J. 1959. Acariens plumicoles (Analgesoidea) parasites des oiseaux du Cameroun. II. Analgesidae.</a> <!--MARK--><!--MARK--><a href='nullea816730-12e3-47dc-8f86-d252a344ac74' class='mouseoverHref'><em>Annales de Parasitologie Humaine et Comparée</em></a> <strong>34</strong>: 149-208<!--MARK-->","","Article in Journal","a663bd0f-f99c-4fc6-b58a-6662e69a5677","20081009T05:11:37.000+0000","ea816730-12e3-47dc-8f86-d252a344ac74"
"Green, R.H.","1989","The ectoparasitic mites of Tasmanian vertebrate animals","1-25","","Records of the Queen Victoria Museum, Launceston","","","","<!--MARK--><a href='nullc3b1a768-623a-4cee-b008-8cd51c3f6995' class='mouseoverHref'>Green, R.H. 1989. The ectoparasitic mites of Tasmanian vertebrate animals.</a> <!--MARK--><!--MARK--><a href='null4bc4ff1d-da1e-425d-bfcb-8045ec03810a' class='mouseoverHref'><em>Records of the Queen Victoria Museum, Launceston</em></a> <strong>98</strong>: 1-25<!--MARK-->","","Article in Journal","c3b1a768-623a-4cee-b008-8cd51c3f6995","20081009T05:11:37.000+0000","4bc4ff1d-da1e-425d-bfcb-8045ec03810a"
"Green, W.F.","1983","The house dust mite, <i>Dermatophagoides farinae</i>, in Australia","259-260","","Medical Journal of Australia","","","","<!--MARK--><a href='null8143671b-77e1-4de2-8aef-d815fc342689' class='mouseoverHref'>Green, W.F. 1983. The house dust mite, <i>Dermatophagoides farinae</i>, in Australia.</a> <!--MARK--><!--MARK--><a href='null4fa29965-b1a9-4ea3-9cd4-472ef0fabe56' class='mouseoverHref'><em>Medical Journal of Australia</em></a> <strong>2</strong>: 259-260<!--MARK-->","","Article in Journal","8143671b-77e1-4de2-8aef-d815fc342689","20081009T05:11:37.000+0000","4fa29965-b1a9-4ea3-9cd4-472ef0fabe56"
"Green, W.F., Sedgwick, C., Woolcock., A.J., Leeder, S.R. & Stuckey, M.,","1986","House dust mites and skin tests in different Australian localities","639-643","","Australian and New Zealand Journal of Medicine","","","","<!--MARK--><a href='nulled6b9167-131b-4a50-b194-6ec03e7e33a3' class='mouseoverHref'>Green, W.F., Sedgwick, C., Woolcock., A.J., Leeder, S.R. & Stuckey, M., 1986. House dust mites and skin tests in different Australian localities.</a> <!--MARK--><!--MARK--><a href='nulld016b4ae-58b1-4ec4-b5a3-6e2ed6dbe59e' class='mouseoverHref'><em>Australian and New Zealand Journal of Medicine</em></a> <strong>16</strong>: 639-643<!--MARK-->","","Article in Journal","ed6b9167-131b-4a50-b194-6ec03e7e33a3","20081009T05:11:37.000+0000","d016b4ae-58b1-4ec4-b5a3-6e2ed6dbe59e"
"Hart, B.J. & Fain, A.","1988","Morphological and biological studies of medically important house-dust mites","285-295","","Acarologia","","","","<!--MARK--><a href='null39ac39d7-978a-40cb-8d0f-f6ef22b79ab3' class='mouseoverHref'>Hart, B.J. & Fain, A. 1988. Morphological and biological studies of medically important house-dust mites.</a> <!--MARK--><!--MARK--><a href='nullca52b0dd-4050-4ed0-b7a9-fad0329897d3' class='mouseoverHref'><em>Acarologia</em></a> <strong>29</strong>: 285-295<!--MARK-->","","Article in Journal","39ac39d7-978a-40cb-8d0f-f6ef22b79ab3","20081009T05:11:37.000+0000","ca52b0dd-4050-4ed0-b7a9-fad0329897d3"
"Hernandes, F.A. & Mironov, S.V.","2017","A systematic review of the feather mite genus <I>Hyperpedalloptes</I> Dubinin (Acariformes: Alloptidae) from Old World ibises (Pelicaniformes: Threskiornithidae), with descriptions of previously unknown adult morphs.","1936-1958.","","Systematic and Applied Acarology","","","","<!--MARK--><a href='nulld87898a9-ac3b-49c2-9612-80cf2589012d' class='mouseoverHref'>Hernandes, F.A. & Mironov, S.V. 2017. A systematic review of the feather mite genus <I>Hyperpedalloptes</I> Dubinin (Acariformes: Alloptidae) from Old World ibises (Pelicaniformes: Threskiornithidae), with descriptions of previously unknown adult morphs.</a> <!--MARK--><!--MARK--><a href='nullc638db21-efd0-4717-b8b8-5dcbbfb42bee' class='mouseoverHref'><em>Systematic and Applied Acarology</em></a> <strong>22</strong>: 1936-1958.<!--MARK-->","","Article in Journal","d87898a9-ac3b-49c2-9612-80cf2589012d","20190721T23:18:53.796+0000","c638db21-efd0-4717-b8b8-5dcbbfb42bee"
"Holz, P.H., Beveridge, I. & Ross, T.","2005","<i>Knemidocoptes intermedius</i> in wild supeb lyrebirds (<i>Menura novaehollandiae</i>)","374-375","","Australian Veterinary Journal","","","","<!--MARK--><a href='null29ea2d5e-fc80-46e4-8e72-8484b02a7aaa' class='mouseoverHref'>Holz, P.H., Beveridge, I. & Ross, T. 2005. <i>Knemidocoptes intermedius</i> in wild supeb lyrebirds (<i>Menura novaehollandiae</i>).</a> <!--MARK--><!--MARK--><a href='null0d20256a-6324-43b5-a6d5-a9316bda2434' class='mouseoverHref'><em>Australian Veterinary Journal</em></a> <strong>83</strong>: 374-375<!--MARK-->","","Article in Journal","29ea2d5e-fc80-46e4-8e72-8484b02a7aaa","20110108T09:15:12.156+0000","0d20256a-6324-43b5-a6d5-a9316bda2434"
"Hughes, A.M.","1961","The Mites of Stored Food Ministry of Agriculture, Fisheries and Food, Technical Bulletin no. 9","287 pp.","","","","","Her Majesty's Stationery Office","<!--MARK--><a href='nullc876d5da-19d3-479a-90f4-85cd4504eefd' class='mouseoverHref'>Hughes, A.M. 1961. <em>The Mites of Stored Food Ministry of Agriculture, Fisheries and Food, Technical Bulletin no. 9</em>. London : Her Majesty's Stationery Office 287 pp.</a><!--MARK-->","","Book","c876d5da-19d3-479a-90f4-85cd4504eefd","20100714T06:08:14.418+0000",""
"Hughes, A.M.","1976","The Mites of Stored Food and Houses. Ministry of Agriculture, Fisheries and Food, Technical Bulletin","400 pp.","","","","","Her Majesty's Stationery Office","<!--MARK--><a href='null81b95922-878c-47ba-b1b8-7131bdf70db4' class='mouseoverHref'>Hughes, A.M. 1976. <em>The Mites of Stored Food and Houses. Ministry of Agriculture, Fisheries and Food, Technical Bulletin</em>. London : Her Majesty's Stationery Office Vol. 9 400 pp.</a><!--MARK-->","","Book","81b95922-878c-47ba-b1b8-7131bdf70db4","20101223T23:47:52.411+0000",""
"Hull, J.","1934","Concerning British Analgidae (Feather-mites)","200-206","","Transactions of the Northern Naturalists Union","","","","<!--MARK--><a href='nullabb23bd7-f8bc-4fd8-b614-e92145a5502b' class='mouseoverHref'>Hull, J. 1934. Concerning British Analgidae (Feather-mites).</a> <!--MARK--><!--MARK--><a href='nulldd554049-78ae-48cb-9488-616c14c485fd' class='mouseoverHref'><em>Transactions of the Northern Naturalists Union</em></a> <strong>1</strong>: 200-206<!--MARK-->","","Article in Journal","abb23bd7-f8bc-4fd8-b614-e92145a5502b","20081009T05:11:37.000+0000","dd554049-78ae-48cb-9488-616c14c485fd"
"Koch, C.L.","1841","Deutschlands Crustaceen, Myriapoden und Arachniden. Ein Beitrag zur Deutschen Fauna","","","","","","Herrich-Schäffer","<!--MARK--><a href='nulle816a560-151f-405c-8b28-0a28ae37c4df' class='mouseoverHref'>Koch, C.L. 1841. <em>Deutschlands Crustaceen, Myriapoden und Arachniden. Ein Beitrag zur Deutschen Fauna</em>. Regensburg : Herrich-Schäffer Vol. 33.</a><!--MARK-->","","Book","e816a560-151f-405c-8b28-0a28ae37c4df","20100309T23:07:02.555+0000",""
"Koch, L.E.","1986","The holotypes of the Acari (Arthropoda : Arachnida) in the Western Australian Museum","53-65","","Records of the Western Australian Museum","","","","<!--MARK--><a href='null396e8174-b069-4af1-9bf9-5b68c925cb9e' class='mouseoverHref'>Koch, L.E. 1986. The holotypes of the Acari (Arthropoda : Arachnida) in the Western Australian Museum.</a> <!--MARK--><!--MARK--><a href='nulla2cbd1fb-97d5-493a-a1d7-c2b99709890b' class='mouseoverHref'><em>Records of the Western Australian Museum</em></a> <strong>13</strong>: 53-65<!--MARK-->","","Article in Journal","396e8174-b069-4af1-9bf9-5b68c925cb9e","20081009T05:11:37.000+0000","a2cbd1fb-97d5-493a-a1d7-c2b99709890b"
"Kutzer, E.","1964","Die Gattung <i>Knemidocoptes</i> (Acari, Sarcoptoidea)","561-577","","Zeitschrift für Parasitenkunde","","","","<!--MARK--><a href='null45aad140-8079-4250-b3df-190ab8d166bb' class='mouseoverHref'>Kutzer, E. 1964. Die Gattung <i>Knemidocoptes</i> (Acari, Sarcoptoidea).</a> <!--MARK--><!--MARK--><a href='nullb236c97d-96b4-4948-9f30-13c9d9f71206' class='mouseoverHref'><em>Zeitschrift für Parasitenkunde</em></a> <strong>24</strong>: 561-577<!--MARK-->","","Article in Journal","45aad140-8079-4250-b3df-190ab8d166bb","20081009T05:11:37.000+0000","b236c97d-96b4-4948-9f30-13c9d9f71206"
"Lavoipierre, M. & Griffiths, R.B.","1951","A preliminary note on a new species of <i>Cnemidocoptes</i> (Acarina) causing scaly leg in a budgerigar (<i>Melopsittacus undulatus</i>) in Great Britain","253-254 pl. XIII","","Annals of Tropical Medicine and Parasitology","","","","<!--MARK--><a href='null8bfad2bf-6f2d-47cb-8593-fcb9f11cef2a' class='mouseoverHref'>Lavoipierre, M. & Griffiths, R.B. 1951. A preliminary note on a new species of <i>Cnemidocoptes</i> (Acarina) causing scaly leg in a budgerigar (<i>Melopsittacus undulatus</i>) in Great Britain.</a> <!--MARK--><!--MARK--><a href='null3ef5baff-75a6-4933-bdcf-fa25763b443e' class='mouseoverHref'><em>Annals of Tropical Medicine and Parasitology</em></a> <strong>45</strong>: 253-254 pl. XIII<!--MARK-->","","Article in Journal","8bfad2bf-6f2d-47cb-8593-fcb9f11cef2a","20081009T05:11:37.000+0000","3ef5baff-75a6-4933-bdcf-fa25763b443e"
"Lee, D.C. & Southcott, R.V.","1979","Spiders and other Arachnids of South Australia. <i>In</i> South Australian Yearbook, 1979","15","","","","","","<!--MARK--><a href='null5451b1e2-1a22-4552-b710-9b0d1c1d0de2' class='mouseoverHref'>Lee, D.C. & Southcott, R.V. 1979. Spiders and other Arachnids of South Australia. <i>In</i> South Australian Yearbook, 1979. South Australian Government Printer : Adelaide. 15 pp.</a>","","Miscellaneous","5451b1e2-1a22-4552-b710-9b0d1c1d0de2","20081009T05:11:37.000+0000",""
"Lowry, J.W.J.","1980","Ecological Relationships of Western Australian Cavernicoles","Vol. 1 367 pp., Vol. 2 204 pp. + appendices","","","","","","<!--MARK--><a href='null9bc68327-87c6-4b1c-a687-1bf85dad9b23' class='mouseoverHref'>Lowry, J.W.J. 1980. Ecological Relationships of Western Australian Cavernicoles. MSc. Thesis, School of Zoology, University of New South Wales. Vol. 1 367 pp., Vol. 2 204 pp. + appendices</a>","","Miscellaneous","9bc68327-87c6-4b1c-a687-1bf85dad9b23","20081009T05:11:37.000+0000",""
"Lukoschus, F. & Lombert, H.A.P.M.","1979","Parasites of Western Australia. VII. Observations on quill wall mites (Acarina : Astigmata)","265-286","","Records of the Western Australian Museum","","","","<!--MARK--><a href='null3edadc52-1c48-42d2-bc20-1d0b61fd64e8' class='mouseoverHref'>Lukoschus, F. & Lombert, H.A.P.M. 1979. Parasites of Western Australia. VII. Observations on quill wall mites (Acarina : Astigmata).</a> <!--MARK--><!--MARK--><a href='nulla2cbd1fb-97d5-493a-a1d7-c2b99709890b' class='mouseoverHref'><em>Records of the Western Australian Museum</em></a> <strong>7</strong>: 265-286<!--MARK-->","","Article in Journal","3edadc52-1c48-42d2-bc20-1d0b61fd64e8","20081009T05:11:37.000+0000","a2cbd1fb-97d5-493a-a1d7-c2b99709890b"
"Lukoschus, F. & Lombert, H.A.P.M.","1980","Five new species of quill mites from European birds (Astigmata: Laminosioptidae: Fainocoptinae)","63-78","","International Journal of Acarology","","","","<!--MARK--><a href='nullea6568e8-fac3-4816-add8-84f3a89aa9ae' class='mouseoverHref'>Lukoschus, F. & Lombert, H.A.P.M. 1980. Five new species of quill mites from European birds (Astigmata: Laminosioptidae: Fainocoptinae).</a> <!--MARK--><!--MARK--><a href='nullfaec4fc9-a979-4ddf-985e-e23330b3c030' class='mouseoverHref'><em>International Journal of Acarology</em></a> <strong>6</strong>: 63-78<!--MARK-->","","Article in Journal","ea6568e8-fac3-4816-add8-84f3a89aa9ae","20081009T05:11:37.000+0000","faec4fc9-a979-4ddf-985e-e23330b3c030"
"Mason, R.W. & Fain, A.","1988","<i>Knemidocoptes intermedius</i> identified in forest ravens (<i>Corvus tasmanicus</i>)","260","","Australian Veterinary Journal","","","","<!--MARK--><a href='null78309068-d12c-4302-b9f6-41421fb363dc' class='mouseoverHref'>Mason, R.W. & Fain, A. 1988. <i>Knemidocoptes intermedius</i> identified in forest ravens (<i>Corvus tasmanicus</i>).</a> <!--MARK--><!--MARK--><a href='null0d20256a-6324-43b5-a6d5-a9316bda2434' class='mouseoverHref'><em>Australian Veterinary Journal</em></a> <strong>65</strong>: 260<!--MARK-->","","Article in Journal","78309068-d12c-4302-b9f6-41421fb363dc","20081009T05:11:37.000+0000","0d20256a-6324-43b5-a6d5-a9316bda2434"
"Mégnin, J.P.","1879","Les acariens parasites du tissu cellulaire et des reservoirs aeriens chez les oiseux.","123-153","","Journal de l'Anatomie et de la Physiologie Normales et Pathologiques de l'Homme et des Animaux","","","","<!--MARK--><a href='nullff4d5643-8a3b-4fa0-a475-a0b75282ac72' class='mouseoverHref'>Mégnin, J.P. 1879. Les acariens parasites du tissu cellulaire et des reservoirs aeriens chez les oiseux.</a> <!--MARK--><!--MARK--><a href='nulleb7bbcb9-e926-4491-b54d-eb1abc349ff0' class='mouseoverHref'><em>Journal de l'Anatomie et de la Physiologie Normales et Pathologiques de l'Homme et des Animaux</em></a> <strong>15</strong>: 123-153<!--MARK-->","","Article in Journal","ff4d5643-8a3b-4fa0-a475-a0b75282ac72","20110622T23:06:18.182+0000","eb7bbcb9-e926-4491-b54d-eb1abc349ff0"
"Mégnin, P.","1880","Les Parasites et les Maladies Parasitaires chez l'Homme, les Animaux Domestiques et les Animaux Sauvages avec lesquels ils peuvent être en Contact","Vol. 1 Texte 478 pp., Vol. 2 Atlas pls I-XXVI","","","","","Masson","<!--MARK--><a href='nulla7ceee05-709c-40de-82e0-f37f1d6b1e27' class='mouseoverHref'>Mégnin, P. 1880. <em>Les Parasites et les Maladies Parasitaires chez l'Homme, les Animaux Domestiques et les Animaux Sauvages avec lesquels ils peuvent être en Contact</em>. Paris : Masson Vol. 1 Texte 478 pp., Vol. 2 Atlas pls I-XXVI.</a><!--MARK-->","","Book","a7ceee05-709c-40de-82e0-f37f1d6b1e27","20081009T05:11:37.000+0000",""
"Mégnin, P. & Trouessart, E.L.","1884","Les Sarcoptides plumicoles. Révision du groupe des Analgesinae, et description des espèces et genres nouveaux de la collection du Musée d'Angers","150-157","","Journal de Micrographie","","","","<!--MARK--><a href='null84ee6c87-ae1e-4b63-b248-441a53dba102' class='mouseoverHref'>Mégnin, P. & Trouessart, E.L. 1884. Les Sarcoptides plumicoles. Révision du groupe des Analgesinae, et description des espèces et genres nouveaux de la collection du Musée d'Angers.</a> <!--MARK--><!--MARK--><a href='nulle3383884-cf3b-470e-b035-3489acf27d61' class='mouseoverHref'><em>Journal de Micrographie</em></a> <strong>8</strong>: 150-157<!--MARK-->","","Article in Journal","84ee6c87-ae1e-4b63-b248-441a53dba102","20081009T05:11:37.000+0000","e3383884-cf3b-470e-b035-3489acf27d61"
"Mégnin, P. in Girard, M.","1877","Sur le parasitisme acarien du tissu cellulaire et des bourses aeriennes chez les oiseaux. Multiplication croissante du <i>Taenia inerme</i> dans le Midi de la France","129-130","","Petites Nouvelles Entomologiques","","","","<!--MARK--><a href='null47a53a3e-a79c-4334-9e0f-4b574a558010' class='mouseoverHref'>Mégnin, P. <i>in</i> Girard, M. 1877. Sur le parasitisme acarien du tissu cellulaire et des bourses aeriennes chez les oiseaux. Multiplication croissante du <i>Taenia inerme</i> dans le Midi de la France.</a> <!--MARK--><!--MARK--><a href='null0f4a0caa-1da0-4af1-bdee-a55f4114ea2f' class='mouseoverHref'><em>Petites Nouvelles Entomologiques</em></a> <strong>2</strong>: 129-130<!--MARK-->","","Article in Journal","47a53a3e-a79c-4334-9e0f-4b574a558010","20081009T05:11:37.000+0000","0f4a0caa-1da0-4af1-bdee-a55f4114ea2f"
"Mégnin, P. in Robin, C. & Mégnin, P.","1877","Mémoire sur les Sarcoptides plumicoles","498-520 pls XXVI-XXIX","","Journal de l'Anatomie et de la Physiologie Normales et Pathologiques de l'Homme et des Animaux","","","","<!--MARK--><a href='nullbfb6966c-eee2-4f72-bbae-51cd22678de1' class='mouseoverHref'>Mégnin, P. <i>in</i> Robin, C. & Mégnin, P. 1877. Mémoire sur les Sarcoptides plumicoles.</a> <!--MARK--><!--MARK--><a href='nulleb7bbcb9-e926-4491-b54d-eb1abc349ff0' class='mouseoverHref'><em>Journal de l'Anatomie et de la Physiologie Normales et Pathologiques de l'Homme et des Animaux</em></a> <strong>13</strong>: 498-520 pls XXVI-XXIX<!--MARK-->","","Article in Journal","bfb6966c-eee2-4f72-bbae-51cd22678de1","20081009T05:11:37.000+0000","eb7bbcb9-e926-4491-b54d-eb1abc349ff0"
"Mines, J.J.","1967","<i>Cnemidocoptes jamaicensis</i> in goldfinches in Queensland","597","","Australian Veterinary Journal","","","","<!--MARK--><a href='nullf89e2605-abd7-4131-82d3-e87df4961f75' class='mouseoverHref'>Mines, J.J. 1967. <i>Cnemidocoptes jamaicensis</i> in goldfinches in Queensland.</a> <!--MARK--><!--MARK--><a href='null0d20256a-6324-43b5-a6d5-a9316bda2434' class='mouseoverHref'><em>Australian Veterinary Journal</em></a> <strong>43</strong>: 597<!--MARK-->","","Article in Journal","f89e2605-abd7-4131-82d3-e87df4961f75","20081009T05:11:37.000+0000","0d20256a-6324-43b5-a6d5-a9316bda2434"
"Mironov, S.V.","1994","New species of feather mites of the genus <i>Bychovskiata</i> (Analgoidea: Avenzoariidae) from shorebirds (Charadriiformes)","333-341","","Parazitologia","","","","<!--MARK--><a href='nulle59771f8-a29f-4636-9723-d170574a78a5' class='mouseoverHref'>Mironov, S.V. 1994. New species of feather mites of the genus <i>Bychovskiata</i> (Analgoidea: Avenzoariidae) from shorebirds (Charadriiformes).</a> <!--MARK--><!--MARK--><a href='nullc6d351df-785d-4176-90d7-c4015bb8da0b' class='mouseoverHref'><em>Parazitologia</em></a> <strong>28</strong>: 333-341<!--MARK-->","","Article in Journal","e59771f8-a29f-4636-9723-d170574a78a5","20081009T05:11:37.000+0000","c6d351df-785d-4176-90d7-c4015bb8da0b"
"Mironov, S.V.","1995","A new genus of feather mites of the family Avenzoariidae (Acariformes: Analgoidea) from lapwings","90-100","","Parazitologia","","","","<!--MARK--><a href='nullc334a30e-6e41-4033-9a75-6ac2918cbbfa' class='mouseoverHref'>Mironov, S.V. 1995. A new genus of feather mites of the family Avenzoariidae (Acariformes: Analgoidea) from lapwings.</a> <!--MARK--><!--MARK--><a href='nullc6d351df-785d-4176-90d7-c4015bb8da0b' class='mouseoverHref'><em>Parazitologia</em></a> <strong>29</strong>: 90-100<!--MARK-->","","Article in Journal","c334a30e-6e41-4033-9a75-6ac2918cbbfa","20081009T05:11:37.000+0000","c6d351df-785d-4176-90d7-c4015bb8da0b"
"Mironov, S.V.","1997","A new species of the feather mite of the genus <i>Bychovskiata</i> (Analgoidea: Avenzoariidae) from the masked lapwing (Aves: Charadriidae: <i>Vanellus miles novaehollandiae</i>)","13-17","","Acarina","","","","<!--MARK--><a href='nulld8e478c0-09e9-44af-9877-3f05023650fd' class='mouseoverHref'>Mironov, S.V. 1997. A new species of the feather mite of the genus <i>Bychovskiata</i> (Analgoidea: Avenzoariidae) from the masked lapwing (Aves: Charadriidae: <i>Vanellus miles novaehollandiae</i>).</a> <!--MARK--><!--MARK--><a href='null442db0bd-b149-484d-b163-51439170bbd9' class='mouseoverHref'><em>Acarina</em></a> <strong>5</strong>: 13-17<!--MARK-->","","Article in Journal","d8e478c0-09e9-44af-9877-3f05023650fd","20081009T05:11:37.000+0000","442db0bd-b149-484d-b163-51439170bbd9"
"Mironov, S.V.","2007","Systematic notes on two genera of the feather mite family Psoroptoididae (Astigmata: Analgoidea)","135-141","","Acarina. Russian Journal of Acarology","","","","<!--MARK--><a href='null00ccc13e-ee8b-43eb-93eb-1a8519a3bada' class='mouseoverHref'>Mironov, S.V. 2007. Systematic notes on two genera of the feather mite family Psoroptoididae (Astigmata: Analgoidea).</a> <!--MARK--><!--MARK--><a href='nullbc011b4b-8e3c-40bc-9bd9-53aff93d329e' class='mouseoverHref'><em>Acarina. Russian Journal of Acarology</em></a> <strong>15</strong>: 135-141<!--MARK-->","","Article in Journal","00ccc13e-ee8b-43eb-93eb-1a8519a3bada","20100921T10:26:14.497+0000","bc011b4b-8e3c-40bc-9bd9-53aff93d329e"
"Mironov, S.V.","2012","New species of the feather mite genus <em>Proctophyllodes</em> Robin, 1877 (Acari: Analgoidea: Proctophyllodidae) from European passerines (Aves: Passeriformes), with an updated checklist of the genus.","130-158.","","Acarina. Russian Journal of Acarology","","","","<!--MARK--><a href='null739d12ff-e94c-4039-b80b-3c3d4d5a1934' class='mouseoverHref'>Mironov, S.V. 2012. New species of the feather mite genus <em>Proctophyllodes</em> Robin, 1877 (Acari: Analgoidea: Proctophyllodidae) from European passerines (Aves: Passeriformes), with an updated checklist of the genus.</a> <!--MARK--><!--MARK--><a href='nullbc011b4b-8e3c-40bc-9bd9-53aff93d329e' class='mouseoverHref'><em>Acarina. Russian Journal of Acarology</em></a> <strong>20</strong>: 130-158.<!--MARK-->","","Article in Journal","739d12ff-e94c-4039-b80b-3c3d4d5a1934","20170126T06:59:19.808+0000","bc011b4b-8e3c-40bc-9bd9-53aff93d329e"
"Mironov, S.V., Ehrnsberger, R. & Dabert, J.","2017","Feather mites of the genera <I>Dubininia</I> and <I>Cacatualges</I> (Acari: Xolalgidae) associated with parrots (Aves: Psittaciformes) of the Old World.","451-490.","","Zootaxa","","","","<!--MARK--><a href='nullb805ebf0-587a-43f1-8345-d8e1637be9ae' class='mouseoverHref'>Mironov, S.V., Ehrnsberger, R. & Dabert, J. 2017. Feather mites of the genera <I>Dubininia</I> and <I>Cacatualges</I> (Acari: Xolalgidae) associated with parrots (Aves: Psittaciformes) of the Old World.</a> <!--MARK--><!--MARK--><a href='null96466227-221c-4922-ac97-1ac2dd946d0a' class='mouseoverHref'><em>Zootaxa</em></a> <strong>4272</strong>(4): 451-490.<!--MARK-->","","Article in Journal","b805ebf0-587a-43f1-8345-d8e1637be9ae","20190730T22:09:46.809+0000","96466227-221c-4922-ac97-1ac2dd946d0a"
