"PUB_AUTHOR","PUB_YEAR","PUB_TITLE","PUB_PAGES","PUB_PARENT_BOOK_TITLE","PUB_PARENT_JOURNAL_TITLE","PUB_PARENT_ARTICLE_TITLE","PUB_PUBLICATION_DATE","PUB_PUBLISHER","PUB_FORMATTED","PUB_QUALIFICATION","PUB_TYPE","PUBLICATION_GUID","PUBLICATION_LAST_UPDATE","PARENT_PUBLICATION_GUID"
"Arlian, L.G.","1989","Biology and ecology of house dust mites, <i>Dermatophagoides</i> spp. and <i>Euroglyphus</i> spp","339-356","","Immunology and Allergy Clinics of North America","","","","<!--MARK--><a href='null54fa4e68-9745-426f-bceb-9f3fd4a96eee' class='mouseoverHref'>Arlian, L.G. 1989. Biology and ecology of house dust mites, <i>Dermatophagoides</i> spp. and <i>Euroglyphus</i> spp.</a> <!--MARK--><!--MARK--><a href='nullfc3a46dc-b113-4208-aaf8-7c45853af06a' class='mouseoverHref'><em>Immunology and Allergy Clinics of North America</em></a> <strong>9</strong>: 339-356<!--MARK-->","","Article in Journal","54fa4e68-9745-426f-bceb-9f3fd4a96eee","20081009T05:11:37.000+0000","fc3a46dc-b113-4208-aaf8-7c45853af06a"
"Atyeo, W.T.","1971","<i>Exochojoubertia</i>, a new genus of proctophyllodid feather mites (Acarina : Analgoidea)","219-223","","New Zealand Journal of Science","","","","<!--MARK--><a href='null983a7e15-8426-4795-a1e8-f5acd1db9e34' class='mouseoverHref'>Atyeo, W.T. 1971. <i>Exochojoubertia</i>, a new genus of proctophyllodid feather mites (Acarina : Analgoidea).</a> <!--MARK--><!--MARK--><a href='null7ed29f42-7cc6-4afd-8b74-710847db4a17' class='mouseoverHref'><em>New Zealand Journal of Science</em></a> <strong>14</strong>: 219-223<!--MARK-->","","Article in Journal","983a7e15-8426-4795-a1e8-f5acd1db9e34","20081009T05:11:37.000+0000","7ed29f42-7cc6-4afd-8b74-710847db4a17"
"Atyeo, W.T.","1971","Analgoid mites (Proctophyllodidae) from the Dicaeidae (Aves : Passeriformes)","37-42","","Journal of the Australian Entomological Society","","","","<!--MARK--><a href='nullaf5bca17-8331-431f-926e-5d5a933f71de' class='mouseoverHref'>Atyeo, W.T. 1971. Analgoid mites (Proctophyllodidae) from the Dicaeidae (Aves : Passeriformes).</a> <!--MARK--><!--MARK--><a href='nullc2544f9f-3978-4f18-846d-a1fd3122c9c4' class='mouseoverHref'><em>Journal of the Australian Entomological Society</em></a> <strong>10</strong>: 37-42<!--MARK-->","","Article in Journal","af5bca17-8331-431f-926e-5d5a933f71de","20081009T05:11:37.000+0000","c2544f9f-3978-4f18-846d-a1fd3122c9c4"
"Atyeo, W.T. & Braasch, N.L.","1966","The feather mite genus <em>Proctophyllodes</em> (Sarcoptiformes: Proctophyllodidae).","1-354.","","Bulletin of the University of Nebraska State Museum","","","","<!--MARK--><a href='null9743593c-87ee-4bf7-bbd4-326cf90e49e2' class='mouseoverHref'>Atyeo, W.T. & Braasch, N.L. 1966. The feather mite genus <em>Proctophyllodes</em> (Sarcoptiformes: Proctophyllodidae).</a> <!--MARK--><!--MARK--><a href='null7875fdac-320e-4fc2-9bc8-e3f514a89fed' class='mouseoverHref'><em>Bulletin of the University of Nebraska State Museum</em></a> <strong>5</strong>: 1-354.<!--MARK-->","","Article in Journal","9743593c-87ee-4bf7-bbd4-326cf90e49e2","20170126T06:55:14.641+0000","7875fdac-320e-4fc2-9bc8-e3f514a89fed"
"Atyeo, W.T. & Gaud, J.","1970","The feather mite genus <i>Monojoubertia</i> Radford, 1950 (Analgoidea : Proctophyllodidae)","145-155","","Entomologische Blätter","","","","<!--MARK--><a href='null0b53fc6b-a55d-4f69-ad2f-7088c018f32e' class='mouseoverHref'>Atyeo, W.T. & Gaud, J. 1970. The feather mite genus <i>Monojoubertia</i> Radford, 1950 (Analgoidea : Proctophyllodidae).</a> <!--MARK--><!--MARK--><a href='nulla4ae2141-5f28-40ed-8d5f-f1e9aebf1631' class='mouseoverHref'><em>Entomologische Blätter</em></a> <strong>4</strong>(71): 145-155<!--MARK-->","","Article in Journal","0b53fc6b-a55d-4f69-ad2f-7088c018f32e","20081009T05:11:37.000+0000","a4ae2141-5f28-40ed-8d5f-f1e9aebf1631"
"Atyeo, W.T. & Gaud, J.","1987","Feather mites (Acarina) of the parakeet, <i>Melopsittacus undulatus</i> (Shaw) (Aves : Psittacidae)","203-206","","Journal of Parasitology","","","","<!--MARK--><a href='null9906a357-02bf-494a-b4e2-9c5b0a4426c7' class='mouseoverHref'>Atyeo, W.T. & Gaud, J. 1987. Feather mites (Acarina) of the parakeet, <i>Melopsittacus undulatus</i> (Shaw) (Aves : Psittacidae).</a> <!--MARK--><!--MARK--><a href='nulle52ecfa4-7e99-4ea0-acd3-ce3d83537d01' class='mouseoverHref'><em>Journal of Parasitology</em></a> <strong>73</strong>: 203-206<!--MARK-->","","Article in Journal","9906a357-02bf-494a-b4e2-9c5b0a4426c7","20081009T05:11:37.000+0000","e52ecfa4-7e99-4ea0-acd3-ce3d83537d01"
"Atyeo, W.T. & Gaud, J.","1991","Microspalacinae, a new subfamily of the feather mite family Alloptidae Gaud (Acarina, Analgoidea)","327-343","","Folia Parasitologica. Prague","","","","<!--MARK--><a href='null8c4ccd94-27aa-464b-835f-cde14cec6979' class='mouseoverHref'>Atyeo, W.T. & Gaud, J. 1991. Microspalacinae, a new subfamily of the feather mite family Alloptidae Gaud (Acarina, Analgoidea).</a> <!--MARK--><!--MARK--><a href='nullbe204155-0185-44a3-af5a-9126a2892d95' class='mouseoverHref'><em>Folia Parasitologica. Prague</em></a> <strong>38</strong>: 327-343<!--MARK-->","","Article in Journal","8c4ccd94-27aa-464b-835f-cde14cec6979","20081009T05:11:37.000+0000","be204155-0185-44a3-af5a-9126a2892d95"
"Bell, P.J.","1996","Survey of the nasal mite fauna (Rhinonyssidae and Kytoditidae) of the gouldian finch, <i>Erythrura gouldiae</i>, and some co-occurring birds in the Northern Territory","675-685","","Wildlife Research","","","","<!--MARK--><a href='null29813000-1b1d-4030-9ab5-2e0935737141' class='mouseoverHref'>Bell, P.J. 1996. Survey of the nasal mite fauna (Rhinonyssidae and Kytoditidae) of the gouldian finch, <i>Erythrura gouldiae</i>, and some co-occurring birds in the Northern Territory.</a> <!--MARK--><!--MARK--><a href='null84cebac1-32cc-421d-bace-080d35aa0254' class='mouseoverHref'><em>Wildlife Research</em></a> <strong>23</strong>: 675-685<!--MARK-->","","Article in Journal","29813000-1b1d-4030-9ab5-2e0935737141","20081009T05:11:37.000+0000","84cebac1-32cc-421d-bace-080d35aa0254"
"Berlese, A.","1882","Gamasidi nuovi e poco noti","1-15","","Bollettino della Società Entomologica Italiana","","","","<!--MARK--><a href='null8fdf31e8-9abc-4822-b863-c965955c7720' class='mouseoverHref'>Berlese, A. 1882. Gamasidi nuovi e poco noti.</a> <!--MARK--><!--MARK--><a href='null97b2190f-c3d9-47f5-a348-20c26559e7d6' class='mouseoverHref'><em>Bollettino della Società Entomologica Italiana</em></a> <strong>14</strong>: 1-15<!--MARK-->","","Article in Journal","8fdf31e8-9abc-4822-b863-c965955c7720","20081009T05:11:37.000+0000","97b2190f-c3d9-47f5-a348-20c26559e7d6"
"Berlese, A.","1883","<i>Acari, Myriopoda et Scorpiones hucusque in Italia reperta</i><B> 4</B>. 12 text pages + Plates 1-10","","","","","","","<!--MARK--><a href='null9d7f923a-e917-4d49-8886-44ac239c0462' class='mouseoverHref'>Berlese, A. 1883. <i>Acari, Myriopoda et Scorpiones hucusque in Italia reperta</i><B> 4</B>. 12 text pages + Plates 1-10. Reprint by Junk, The Hague, 1979.</a>","","Miscellaneous","9d7f923a-e917-4d49-8886-44ac239c0462","20081009T05:11:37.000+0000",""
"Berlese, A.","1886","<i>Acari, Myriopoda et Scorpiones hucusque in Italia reperta</i> <B>24</B>. 14 text pages + Plates 1-10","","","","","","","<!--MARK--><a href='nullce1bd4ea-3a66-42b2-868e-7c12e50828b2' class='mouseoverHref'>Berlese, A. 1886. <i>Acari, Myriopoda et Scorpiones hucusque in Italia reperta</i> <B>24</B>. 14 text pages + Plates 1-10. Reprint by Junk, The Hague, 1979.</a>","","Miscellaneous","ce1bd4ea-3a66-42b2-868e-7c12e50828b2","20081009T05:11:37.000+0000",""
"Berlese, A.","1892","<i>Acari, Myriopoda et Scorpiones hucusque in Italia reperta</i> <B>61</B>","17 text pages + pls 1-10","","","","","","<!--MARK--><a href='null224279ed-4a81-4b46-87fc-db9fc24e5449' class='mouseoverHref'>Berlese, A. 1892. <i>Acari, Myriopoda et Scorpiones hucusque in Italia reperta</i> <B>61</B>. Reprint by Junk, The Hague, 1979. 17 text pages + pls 1-10</a>","","Miscellaneous","224279ed-4a81-4b46-87fc-db9fc24e5449","20081009T05:11:37.000+0000",""
"Berlese, A.","1897","Acari, Myriopoda et Scorpiones hucusque in Italia reperta. Ordo Cryptostigmata (Sarcoptidae)","190 pp.","","","","","Sumptibus Auctoris","<!--MARK--><a href='null28e38519-49ae-48c4-8c89-38ee676d99e9' class='mouseoverHref'>Berlese, A. 1897. <em>Acari, Myriopoda et Scorpiones hucusque in Italia reperta. Ordo Cryptostigmata (Sarcoptidae)</em>. Portici : Sumptibus Auctoris 190 pp.</a><!--MARK-->","","Book","28e38519-49ae-48c4-8c89-38ee676d99e9","20081009T05:11:37.000+0000",""
"Bogdanoff, A.","1864","Deux acariens, trouvés par M. Schérémétewsky sur l'homme","341-345 pl. VII","","Bulletin de la Société Impériale des Naturalistes de Moscou","","","","<!--MARK--><a href='nullcbeadfee-c82b-454b-b34a-e8cece8f8510' class='mouseoverHref'>Bogdanoff, A. 1864. Deux acariens, trouvés par M. Schérémétewsky sur l'homme.</a> <!--MARK--><!--MARK--><a href='nulla7cbc93a-fdd0-40a5-9cc8-35de71b7d18a' class='mouseoverHref'><em>Bulletin de la Société Impériale des Naturalistes de Moscou</em></a> <strong>37</strong>: 341-345 pl. VII<!--MARK-->","","Article in Journal","cbeadfee-c82b-454b-b34a-e8cece8f8510","20081009T05:11:37.000+0000","a7cbc93a-fdd0-40a5-9cc8-35de71b7d18a"
"Bonnet, A.","1924","Révision des genres <i>Megninia, Mesalges</i> et genres voisins de la sous-famille des sarcoptides plumicoles. (2e partie)","190-218","","Bulletin de la Société Zoologique de France","","","","<!--MARK--><a href='null5e169de1-22c2-45b1-8524-b78df952df88' class='mouseoverHref'>Bonnet, A. 1924. Révision des genres <i>Megninia, Mesalges</i> et genres voisins de la sous-famille des sarcoptides plumicoles. (2e partie).</a> <!--MARK--><!--MARK--><a href='null8dec2bf0-72c6-4775-b21a-2bd0ec166210' class='mouseoverHref'><em>Bulletin de la Société Zoologique de France</em></a> <strong>49</strong>: 190-218<!--MARK-->","","Article in Journal","5e169de1-22c2-45b1-8524-b78df952df88","20081009T05:11:37.000+0000","8dec2bf0-72c6-4775-b21a-2bd0ec166210"
"Bonnet, A.","1924","Révision des genres <i>Megninia, Mesalges</i> et genres voisins de la sous-famille des sarcoptides plumicoles. (Première partie)","146-188","","Bulletin de la Société Zoologique de France","","","","<!--MARK--><a href='null74509947-cbf0-46fc-a307-572e0e5c62f2' class='mouseoverHref'>Bonnet, A. 1924. Révision des genres <i>Megninia, Mesalges</i> et genres voisins de la sous-famille des sarcoptides plumicoles. (Première partie).</a> <!--MARK--><!--MARK--><a href='null8dec2bf0-72c6-4775-b21a-2bd0ec166210' class='mouseoverHref'><em>Bulletin de la Société Zoologique de France</em></a> <strong>49</strong>: 146-188<!--MARK-->","","Article in Journal","74509947-cbf0-46fc-a307-572e0e5c62f2","20081009T05:11:37.000+0000","8dec2bf0-72c6-4775-b21a-2bd0ec166210"
"Boyd, E.M.","1949","A new genus and species of mite from the nasal cavity of the ring-billed gull, (Acarina, Epidermoptidae)","295-300","","Journal of Parasitology","","","","<!--MARK--><a href='null8780269b-33c1-4232-80bf-4ac8e94e29b5' class='mouseoverHref'>Boyd, E.M. 1949. A new genus and species of mite from the nasal cavity of the ring-billed gull, (Acarina, Epidermoptidae).</a> <!--MARK--><!--MARK--><a href='nulle52ecfa4-7e99-4ea0-acd3-ce3d83537d01' class='mouseoverHref'><em>Journal of Parasitology</em></a> <strong>35</strong>: 295-300<!--MARK-->","","Article in Journal","8780269b-33c1-4232-80bf-4ac8e94e29b5","20081009T05:11:37.000+0000","e52ecfa4-7e99-4ea0-acd3-ce3d83537d01"
"Bradshaw, G.","1906","Diseases of poultry. Scaly legs","125-131","","Agricultural Gazette of New South Wales","","","","<!--MARK--><a href='null50f339bb-0943-4d18-aec2-1fbbc6febccf' class='mouseoverHref'>Bradshaw, G. 1906. Diseases of poultry. Scaly legs.</a> <!--MARK--><!--MARK--><a href='null4197a935-3630-406b-b88e-759e63272a02' class='mouseoverHref'><em>Agricultural Gazette of New South Wales</em></a> <strong>17</strong>: 125-131<!--MARK-->","","Article in Journal","50f339bb-0943-4d18-aec2-1fbbc6febccf","20081009T05:11:37.000+0000","4197a935-3630-406b-b88e-759e63272a02"
"Brown","1897","A new <I>Acarus</I>","1675","","British Medical Journal","","","","<!--MARK--><a href='nullfa577298-d7d5-41d8-bf39-e763dec678b7' class='mouseoverHref'>Brown 1897. A new <I>Acarus</I>.</a> <!--MARK--><!--MARK--><a href='null749122ba-5a76-47f5-b789-e82538bca125' class='mouseoverHref'><em>British Medical Journal</em></a> <strong>2</strong>: 1675<!--MARK-->","","Article in Journal","fa577298-d7d5-41d8-bf39-e763dec678b7","20110622T22:59:44.612+0000","749122ba-5a76-47f5-b789-e82538bca125"
"Canestrini, G.","1878","Nouve specie del genere <i>Dermaleichus</i>","43-70","","Atti del Reale Istituto Veneto di Scienze, Lettere ed Arti","","","","<!--MARK--><a href='null8a496508-f383-4b95-a475-270cd37bc0a3' class='mouseoverHref'>Canestrini, G. 1878. Nouve specie del genere <i>Dermaleichus</i>.</a> <!--MARK--><!--MARK--><a href='null5a2ea9cc-327b-4443-953f-3e15b41ebc8d' class='mouseoverHref'><em>Atti del Reale Istituto Veneto di Scienze, Lettere ed Arti</em></a> 5 <strong>5</strong>: 43-70<!--MARK-->","","Article in Journal","8a496508-f383-4b95-a475-270cd37bc0a3","20081009T05:11:37.000+0000","5a2ea9cc-327b-4443-953f-3e15b41ebc8d"
"Canestrini, G.","1894","Prospetto dell'Acarofauna Italiana. Part VI. Famiglia dei psoroptidi (Psoroptidae). Appendice ai fitoptidi italiani. Varia Prorergates, Hemisarcoptes, Histiogaster, Psoroptes ovis, Otodectes furonis. Gli epidermoptini","","","","","","Stabilimento Proserpini","<!--MARK--><a href='nullf838c5ea-967e-4951-943d-dda08cf5ef60' class='mouseoverHref'>Canestrini, G. 1894. <em>Prospetto dell'Acarofauna Italiana. Part VI. Famiglia dei psoroptidi (Psoroptidae). Appendice ai fitoptidi italiani. Varia Prorergates, Hemisarcoptes, Histiogaster, Psoroptes ovis, Otodectes furonis. Gli epidermoptini</em>. Padova : Stabilimento Proserpini.</a><!--MARK-->","","Book","f838c5ea-967e-4951-943d-dda08cf5ef60","20081009T05:11:37.000+0000",""
"Canestrini, G. & Kramer, P.","1899","Demodicidae and Sarcoptidae","1-193 (Reprinted 1965 by Verlag Cramer, Weinheim)","","Das Tierreich","","","","<!--MARK--><a href='null06390a08-7b64-4b73-8772-1806ff5178b7' class='mouseoverHref'>Canestrini, G. & Kramer, P. 1899. Demodicidae and Sarcoptidae.</a> <!--MARK--><!--MARK--><a href='nullfcb2b75c-eb8d-4868-89bd-d2fd1a2779ad' class='mouseoverHref'><em>Das Tierreich</em></a> <strong>7</strong>: 1-193 (Reprinted 1965 by Verlag Cramer, Weinheim)<!--MARK-->","","Article in Journal","06390a08-7b64-4b73-8772-1806ff5178b7","20081009T05:11:37.000+0000","fcb2b75c-eb8d-4868-89bd-d2fd1a2779ad"
"Carne, P.B. (ed.)","1987","Scientific and Common Names of Insects and Allied Forms Occurring in Australia","120 pp.","","","","","CSIRO","<!--MARK--><a href='null77c0c680-14bd-4ddf-b4b0-6546c3da9836' class='mouseoverHref'>Carne, P.B. (ed.) 1987. <em>Scientific and Common Names of Insects and Allied Forms Occurring in Australia</em>. Melbourne : CSIRO 120 pp.</a><!--MARK-->","","Book","77c0c680-14bd-4ddf-b4b0-6546c3da9836","20081009T05:11:37.000+0000",""
"Castro, M.P. de & Periera, C.","1951","'<i>Rhinoptes gallinae'</i> n. g., n. sp. (Acari -Sarcoptiformes : Epidermoptidae), das fossas nasais da galinha, e critica do conceito de cohortes nos Acaridiae Latr","67-72","","Arquivos do Instituto Biologico, São Paulo","","","","<!--MARK--><a href='null1f2edf76-330e-4644-9d55-2d30c77e0a5d' class='mouseoverHref'>Castro, M.P. de & Periera, C. 1951. '<i>Rhinoptes gallinae'</i> n. g., n. sp. (Acari -Sarcoptiformes : Epidermoptidae), das fossas nasais da galinha, e critica do conceito de cohortes nos Acaridiae Latr.</a> <!--MARK--><!--MARK--><a href='null2936b3e5-3356-444b-855f-c53d67bf993d' class='mouseoverHref'><em>Arquivos do Instituto Biologico, São Paulo</em></a> <strong>20</strong>: 67-72<!--MARK-->","","Article in Journal","1f2edf76-330e-4644-9d55-2d30c77e0a5d","20081009T05:11:37.000+0000","2936b3e5-3356-444b-855f-c53d67bf993d"
"Colloff, M.J.","1991","A review of biology and allergenicity of the house-dust mite <i>Euroglyphus maynei</i> (Acari : Pyroglyphidae)","177-198","","Experimental and Applied Acarology","","","","<!--MARK--><a href='null3e79ef3a-2dde-4178-a462-d75ce1c472cd' class='mouseoverHref'>Colloff, M.J. 1991. A review of biology and allergenicity of the house-dust mite <i>Euroglyphus maynei</i> (Acari : Pyroglyphidae).</a> <!--MARK--><!--MARK--><a href='null2c1681ed-7d3f-420e-8b04-38c7c988f58b' class='mouseoverHref'><em>Experimental and Applied Acarology</em></a> <strong>11</strong>: 177-198<!--MARK-->","","Article in Journal","3e79ef3a-2dde-4178-a462-d75ce1c472cd","20081009T05:11:37.000+0000","2c1681ed-7d3f-420e-8b04-38c7c988f58b"
"Colloff, M.J.","1991","Practical and theoretical aspects of the ecology of house dust mites (Acari : Pyroglyphidae) in relation to the study of mite-mediated allergy","611-630","","Review of Medical and Veterinary Entomology","","","","<!--MARK--><a href='null1d8f0028-13d6-4c3f-a71d-1872b7e1cf9b' class='mouseoverHref'>Colloff, M.J. 1991. Practical and theoretical aspects of the ecology of house dust mites (Acari : Pyroglyphidae) in relation to the study of mite-mediated allergy.</a> <!--MARK--><!--MARK--><a href='null3f94591d-ba5c-4ebf-aae8-ca7d082367e7' class='mouseoverHref'><em>Review of Medical and Veterinary Entomology</em></a> <strong>79</strong>: 611-630<!--MARK-->","","Article in Journal","1d8f0028-13d6-4c3f-a71d-1872b7e1cf9b","20081009T05:11:37.000+0000","3f94591d-ba5c-4ebf-aae8-ca7d082367e7"
"Colloff, M.J.","2009","Dust Mites.","pp. 583","","","","","CSIRO Publishing","<!--MARK--><a href='null7c7b949c-3d36-4bd0-b651-6970487192d7' class='mouseoverHref'>Colloff, M.J. 2009. <em>Dust Mites</em>. Melbourne : CSIRO Publishing pp. 583.</a><!--MARK-->","","Book","7c7b949c-3d36-4bd0-b651-6970487192d7","20110511T21:57:22.631+0000",""
"Colloff, M.J., Stewart, G.A. & Thompson, P.J.","1991","House dust acarofauna and <i>Der p</i> I equivalent in Australia : the relative importance of <i>Dermatophagoides pteronyssinus</i> and <i>Euroglyphus maynei</i>","225-230","","Clinical and Experimental Allergy","","","","<!--MARK--><a href='null336c1f58-a61d-4e75-a992-19010e57de80' class='mouseoverHref'>Colloff, M.J., Stewart, G.A. & Thompson, P.J. 1991. House dust acarofauna and <i>Der p</i> I equivalent in Australia : the relative importance of <i>Dermatophagoides pteronyssinus</i> and <i>Euroglyphus maynei</i>.</a> <!--MARK--><!--MARK--><a href='null55b07206-0c15-4ae0-a7db-73640ee483c1' class='mouseoverHref'><em>Clinical and Experimental Allergy</em></a> <strong>21</strong>: 225-230<!--MARK-->","","Article in Journal","336c1f58-a61d-4e75-a992-19010e57de80","20081009T05:11:37.000+0000","55b07206-0c15-4ae0-a7db-73640ee483c1"
"Constantinescu, I.C., Chi?amera, G.D. & Costic?, A.","2018","Redescription of six feather mite species of the genus <I>Proterothrix</I> Gaud, 1968 (Analgoidea: Proctophyllodidae: Pterodectinae) from the Édouard Louis Trouessart Collection.","451-479","","Zootaxa","","","","<!--MARK--><a href='null68cafac3-2ac8-467a-af80-6a3899a90697' class='mouseoverHref'>Constantinescu, I.C., Chi?amera, G.D. & Costic?, A. 2018. Redescription of six feather mite species of the genus <I>Proterothrix</I> Gaud, 1968 (Analgoidea: Proctophyllodidae: Pterodectinae) from the Édouard Louis Trouessart Collection.</a> <!--MARK--><!--MARK--><a href='null96466227-221c-4922-ac97-1ac2dd946d0a' class='mouseoverHref'><em>Zootaxa</em></a> <strong>4486</strong>(4): 451-479<!--MARK-->","","Article in Journal","68cafac3-2ac8-467a-af80-6a3899a90697","20190718T03:28:32.265+0000","96466227-221c-4922-ac97-1ac2dd946d0a"
"Cooreman, J.","1950","Sur un Acarien nouveau, préjudiciable aux matières alimentaires entreposées : <i>Mealia maynéi</i> n. sp","164-168","","Bulletin et Annales de la Société Royale Belgique d'Entomologie","","","","<!--MARK--><a href='null91c99e85-641a-4b37-a6f6-5099316d446e' class='mouseoverHref'>Cooreman, J. 1950. Sur un Acarien nouveau, préjudiciable aux matières alimentaires entreposées : <i>Mealia maynéi</i> n. sp.</a> <!--MARK--><!--MARK--><a href='null931619a7-755d-40e2-8d8a-2805dca68be9' class='mouseoverHref'><em>Bulletin et Annales de la Société Royale Belgique d'Entomologie</em></a> <strong>86</strong>: 164-168<!--MARK-->","","Article in Journal","91c99e85-641a-4b37-a6f6-5099316d446e","20081009T05:11:37.000+0000","931619a7-755d-40e2-8d8a-2805dca68be9"
"Cunliffe, F.","1958","<i>Pyroglyphus morlani</i>, a new genus and species of mite forming a new family, Pyroglyphidae, in the Acaridiae","85-86","","Proceedings of the Entomological Society of Washington","","","","<!--MARK--><a href='nullb4232fca-53c9-4932-8997-ded4df3f28c1' class='mouseoverHref'>Cunliffe, F. 1958. <i>Pyroglyphus morlani</i>, a new genus and species of mite forming a new family, Pyroglyphidae, in the Acaridiae.</a> <!--MARK--><!--MARK--><a href='null4ba9cd44-fd2a-4a01-b171-da890c5efd6b' class='mouseoverHref'><em>Proceedings of the Entomological Society of Washington</em></a> <strong>60</strong>: 85-86<!--MARK-->","","Article in Journal","b4232fca-53c9-4932-8997-ded4df3f28c1","20081009T05:11:37.000+0000","4ba9cd44-fd2a-4a01-b171-da890c5efd6b"
"Domrow, R.","1965","<i>Oxleya</i>, a new turbinoptid genus (Acarina)","84-90","","Acarologia","","","","<!--MARK--><a href='null6483f7c1-a44f-41a3-8bd1-1295955c9db5' class='mouseoverHref'>Domrow, R. 1965. <i>Oxleya</i>, a new turbinoptid genus (Acarina).</a> <!--MARK--><!--MARK--><a href='nullca52b0dd-4050-4ed0-b7a9-fad0329897d3' class='mouseoverHref'><em>Acarologia</em></a> <strong>7</strong>: 84-90<!--MARK-->","","Article in Journal","6483f7c1-a44f-41a3-8bd1-1295955c9db5","20081009T05:11:37.000+0000","ca52b0dd-4050-4ed0-b7a9-fad0329897d3"
"Domrow, R.","1966","Some mite parasites of Australian birds","190-217","","Proceedings of the Linnean Society of New South Wales","","","","<!--MARK--><a href='null8cfe96b1-dd36-4610-a374-d0cb5a1cdd1c' class='mouseoverHref'>Domrow, R. 1966. Some mite parasites of Australian birds.</a> <!--MARK--><!--MARK--><a href='nullc12cd779-adb5-41ea-bd2c-75f6864cf22e' class='mouseoverHref'><em>Proceedings of the Linnean Society of New South Wales</em></a> <strong>90</strong>: 190-217<!--MARK-->","","Article in Journal","8cfe96b1-dd36-4610-a374-d0cb5a1cdd1c","20081009T05:11:37.000+0000","c12cd779-adb5-41ea-bd2c-75f6864cf22e"
"Domrow, R.","1969","The nasal mites of Queensland birds (Acari : Dermanyssidae, Ereynetidae and Epidermoptidae)","297-426 pls XXX-XXXI","","Proceedings of the Linnean Society of New South Wales","","","","<!--MARK--><a href='nulld407ac3f-4a2f-4cda-a3cc-9e8094e7433b' class='mouseoverHref'>Domrow, R. 1969. The nasal mites of Queensland birds (Acari : Dermanyssidae, Ereynetidae and Epidermoptidae).</a> <!--MARK--><!--MARK--><a href='nullc12cd779-adb5-41ea-bd2c-75f6864cf22e' class='mouseoverHref'><em>Proceedings of the Linnean Society of New South Wales</em></a> <strong>93</strong>: 297-426 pls XXX-XXXI<!--MARK-->","","Article in Journal","d407ac3f-4a2f-4cda-a3cc-9e8094e7433b","20081009T05:11:37.000+0000","c12cd779-adb5-41ea-bd2c-75f6864cf22e"
"Domrow, R.","1970","Seasonal variation in numbers of the house-dust mite in Brisbane","1248-1250","","Medical Journal of Australia","","","","<!--MARK--><a href='null41a110e2-94b6-4d67-90be-d1c36cd906e7' class='mouseoverHref'>Domrow, R. 1970. Seasonal variation in numbers of the house-dust mite in Brisbane.</a> <!--MARK--><!--MARK--><a href='null4fa29965-b1a9-4ea3-9cd4-472ef0fabe56' class='mouseoverHref'><em>Medical Journal of Australia</em></a> <strong>1970</strong>(2): 1248-1250<!--MARK-->","","Article in Journal","41a110e2-94b6-4d67-90be-d1c36cd906e7","20081009T05:11:37.000+0000","4fa29965-b1a9-4ea3-9cd4-472ef0fabe56"
"Domrow, R.","1974","Miscellaneous mites from Australian vertebrates. 1-48","15-35","","Proceedings of the Linnean Society of New South Wales","","","","<!--MARK--><a href='null6a8acb6d-e4b1-4538-8d35-4d3e0d369fc0' class='mouseoverHref'>Domrow, R. 1974. Miscellaneous mites from Australian vertebrates. 1-48.</a> <!--MARK--><!--MARK--><a href='nullc12cd779-adb5-41ea-bd2c-75f6864cf22e' class='mouseoverHref'><em>Proceedings of the Linnean Society of New South Wales</em></a> <strong>99</strong>: 15-35<!--MARK-->","","Article in Journal","6a8acb6d-e4b1-4538-8d35-4d3e0d369fc0","20081009T05:11:37.000+0000","c12cd779-adb5-41ea-bd2c-75f6864cf22e"
"Domrow, R.","1992","Acari Astigmata (excluding feather mites) parasitic on Australian vertebrates: an annotated checklist, keys and bibliography","1459-1606","","Invertebrate Taxonomy","","","","<!--MARK--><a href='null6ac65528-cc27-4d30-ba43-4240f33d5a66' class='mouseoverHref'>Domrow, R. 1992. Acari Astigmata (excluding feather mites) parasitic on Australian vertebrates: an annotated checklist, keys and bibliography.</a> <!--MARK--><!--MARK--><a href='null9846f41b-d755-4682-9049-5e59d363951b' class='mouseoverHref'><em>Invertebrate Taxonomy</em></a> <strong>6</strong>: 1459-1606<!--MARK-->","","Article in Journal","6ac65528-cc27-4d30-ba43-4240f33d5a66","20081009T05:11:37.000+0000","9846f41b-d755-4682-9049-5e59d363951b"
"Dubinin, V.B.","1949","The fauna of the feather mites occurring on birds belonging to the Order Procellariiformes and its peculiarities","201-228","","Parazitologicheskii Sbornik","","","","<!--MARK--><a href='null8af3a4d5-b37e-4ee2-bfc8-b102eeea9565' class='mouseoverHref'>Dubinin, V.B. 1949. The fauna of the feather mites occurring on birds belonging to the Order Procellariiformes and its peculiarities.</a> <!--MARK--><!--MARK--><a href='null89294d6a-ae2f-43a5-92ec-37d1397d5c37' class='mouseoverHref'><em>Parazitologicheskii Sbornik</em></a> <strong>11</strong>: 201-228<!--MARK-->","","Article in Journal","8af3a4d5-b37e-4ee2-bfc8-b102eeea9565","20081009T05:11:37.000+0000","89294d6a-ae2f-43a5-92ec-37d1397d5c37"
