"PUB_AUTHOR","PUB_YEAR","PUB_TITLE","PUB_PAGES","PUB_PARENT_BOOK_TITLE","PUB_PARENT_JOURNAL_TITLE","PUB_PARENT_ARTICLE_TITLE","PUB_PUBLICATION_DATE","PUB_PUBLISHER","PUB_FORMATTED","PUB_QUALIFICATION","PUB_TYPE","PUBLICATION_GUID","PUBLICATION_LAST_UPDATE","PARENT_PUBLICATION_GUID"
"Dubinin, V.B.","1951","Feather mites of birds of the Barabinsk Steppe. 1. Feather mites of waterfowl and wading birds of the orders of rails, grebes, palmipedes, anserines, herons, gulls, and limicoles","120-256","","Parazitologicheskii Sbornik","","","","<!--MARK--><a href='null762ce992-635f-4c33-9781-f75307aec1e7' class='mouseoverHref'>Dubinin, V.B. 1951. Feather mites of birds of the Barabinsk Steppe. 1. Feather mites of waterfowl and wading birds of the orders of rails, grebes, palmipedes, anserines, herons, gulls, and limicoles.</a> <!--MARK--><!--MARK--><a href='null89294d6a-ae2f-43a5-92ec-37d1397d5c37' class='mouseoverHref'><em>Parazitologicheskii Sbornik</em></a> <strong>13</strong>: 120-256<!--MARK-->","","Article in Journal","762ce992-635f-4c33-9781-f75307aec1e7","20081009T05:11:37.000+0000","89294d6a-ae2f-43a5-92ec-37d1397d5c37"
"Dubinin, V.B.","1953","Feather mites (Analgesoidea). Part II. Families Epidermoptidae and Freyanidae","1-412 (USSR Academy of Sciences, Leningrad)","","Fauna of the USSR","","","","<!--MARK--><a href='nulld03ac2b0-d1e8-446d-bcf5-61abad5a3de2' class='mouseoverHref'>Dubinin, V.B. 1953. Feather mites (Analgesoidea). Part II. Families Epidermoptidae and Freyanidae.</a> <!--MARK--><!--MARK--><a href='null24fe518d-e211-4de2-9bc3-22a8320ab9af' class='mouseoverHref'><em>Fauna of the USSR</em></a> <strong>6</strong>(6): 1-412 (USSR Academy of Sciences, Leningrad)<!--MARK-->","","Article in Journal","d03ac2b0-d1e8-446d-bcf5-61abad5a3de2","20081009T05:11:37.000+0000","24fe518d-e211-4de2-9bc3-22a8320ab9af"
"Dubinin, V.B.","1955","New genera and species of feather mites (Analgesoidea).","248-286","","Trudy Zoologicheskogo Instituta, Akademiya Nauk SSSR","","","","<!--MARK--><a href='null59af9bb2-0300-46b8-88ff-96275f608040' class='mouseoverHref'>Dubinin, V.B. 1955. New genera and species of feather mites (Analgesoidea).</a> <!--MARK--><!--MARK--><a href='null2a1ca156-64c7-4d07-a82d-60f795213426' class='mouseoverHref'><em>Trudy Zoologicheskogo Instituta, Akademiya Nauk SSSR</em></a> <strong>18</strong>: 248-286<!--MARK-->","","Article in Journal","59af9bb2-0300-46b8-88ff-96275f608040","20190721T23:07:35.665+0000","2a1ca156-64c7-4d07-a82d-60f795213426"
"Dubinin, V.B.","1956","Feather mites (Analgesoidea). Part III. Family Pterolichidae. (Arachnida)","1-914","","Fauna of the USSR","","","","<!--MARK--><a href='nulla6935699-7c7e-41ac-8d81-988f05daeff7' class='mouseoverHref'>Dubinin, V.B. 1956. Feather mites (Analgesoidea). Part III. Family Pterolichidae. (Arachnida).</a> <!--MARK--><!--MARK--><a href='null24fe518d-e211-4de2-9bc3-22a8320ab9af' class='mouseoverHref'><em>Fauna of the USSR</em></a> <strong>6</strong>(7): 1-914<!--MARK-->","","Article in Journal","a6935699-7c7e-41ac-8d81-988f05daeff7","20081009T05:11:37.000+0000","24fe518d-e211-4de2-9bc3-22a8320ab9af"
"Evans, G.O., Fain, A. & Bafort, J.","1963","Decouverte du cycle evolutif du genre <i>Myialges</i> avec description d'une espèce nouvelle (Myialgidae : Sarcoptiformes)","486-500","","Bulletin et Annales de la Société Royale Belgique d'Entomologie","","","","<!--MARK--><a href='null5f324867-0791-4e0d-8a7a-7508a5c52758' class='mouseoverHref'>Evans, G.O., Fain, A. & Bafort, J. 1963. Decouverte du cycle evolutif du genre <i>Myialges</i> avec description d'une espèce nouvelle (Myialgidae : Sarcoptiformes).</a> <!--MARK--><!--MARK--><a href='null931619a7-755d-40e2-8d8a-2805dca68be9' class='mouseoverHref'><em>Bulletin et Annales de la Société Royale Belgique d'Entomologie</em></a> <strong>99</strong>: 486-500<!--MARK-->","","Article in Journal","5f324867-0791-4e0d-8a7a-7508a5c52758","20081009T05:11:37.000+0000","931619a7-755d-40e2-8d8a-2805dca68be9"
"Fain, A.","1956","Les Acariens de la famille Epidermoptidae (Sarcoptiformes) parasites des fosses nasales chez les oiseaux au Congo belge (note preliminaire)","209-222","","Revue de Zoologie et de Botanique Africaines","","","","<!--MARK--><a href='null89452e27-ac01-4af3-bd0a-6924270c695a' class='mouseoverHref'>Fain, A. 1956. Les Acariens de la famille Epidermoptidae (Sarcoptiformes) parasites des fosses nasales chez les oiseaux au Congo belge (note preliminaire).</a> <!--MARK--><!--MARK--><a href='null1d82d934-7b0c-4e56-93e8-eb7594a06062' class='mouseoverHref'><em>Revue de Zoologie et de Botanique Africaines</em></a> <strong>54</strong>: 209-222<!--MARK-->","","Article in Journal","89452e27-ac01-4af3-bd0a-6924270c695a","20081009T05:11:37.000+0000","1d82d934-7b0c-4e56-93e8-eb7594a06062"
"Fain, A.","1956","Une nouvelle famille d'acariens endoparasites des chauves-souris : Gastronyssidae fam. nov. (Acarina : Sarcoptiformes)","87-98","","Annales de la Société Belge de Médecine Tropicale","","","","<!--MARK--><a href='nullbc243486-88bb-4530-99a3-41fc72291744' class='mouseoverHref'>Fain, A. 1956. Une nouvelle famille d'acariens endoparasites des chauves-souris : Gastronyssidae fam. nov. (Acarina : Sarcoptiformes).</a> <!--MARK--><!--MARK--><a href='nullcab581ef-8427-4696-8721-aa9dbbf289fa' class='mouseoverHref'><em>Annales de la Société Belge de Médecine Tropicale</em></a> <strong>36</strong>: 87-98<!--MARK-->","","Article in Journal","bc243486-88bb-4530-99a3-41fc72291744","20081009T05:11:37.000+0000","cab581ef-8427-4696-8721-aa9dbbf289fa"
"Fain, A.","1957","Les acariens des familles Epidermoptidae et Rhinonyssidae parasites des fosses nasales d'oiseaux au Ruanda-Urundi et au Congo belge","1-176","","Annales du Musée Royal du Congo Belge, Tervuren","","","","<!--MARK--><a href='null12c376e3-87f0-4a5c-ac62-fd910a18b01d' class='mouseoverHref'>Fain, A. 1957. Les acariens des familles Epidermoptidae et Rhinonyssidae parasites des fosses nasales d'oiseaux au Ruanda-Urundi et au Congo belge.</a> <!--MARK--><!--MARK--><a href='nulld0e398c0-642c-497c-a113-b0ff9326b633' class='mouseoverHref'><em>Annales du Musée Royal du Congo Belge, Tervuren</em></a> ns in 8vo, Sci. Zool. <strong>60</strong>: 1-176<!--MARK-->","","Article in Journal","12c376e3-87f0-4a5c-ac62-fd910a18b01d","20081009T05:11:37.000+0000","d0e398c0-642c-497c-a113-b0ff9326b633"
"Fain, A.","1960","Révision du genre <i>Cytodites</i> (Megnin) et description de deux espèces et un genre nouveaux dans la famille Cytoditidae Oudemans (Acarina : sarcoptiformes)","238-249","","Acarologia","","","","<!--MARK--><a href='null428228b7-91e3-4b9b-a6b9-13bdc25b2f84' class='mouseoverHref'>Fain, A. 1960. Révision du genre <i>Cytodites</i> (Megnin) et description de deux espèces et un genre nouveaux dans la famille Cytoditidae Oudemans (Acarina : sarcoptiformes).</a> <!--MARK--><!--MARK--><a href='nullca52b0dd-4050-4ed0-b7a9-fad0329897d3' class='mouseoverHref'><em>Acarologia</em></a> <strong>2</strong>: 238-249<!--MARK-->","","Article in Journal","428228b7-91e3-4b9b-a6b9-13bdc25b2f84","20081009T05:11:37.000+0000","ca52b0dd-4050-4ed0-b7a9-fad0329897d3"
"Fain, A.","1964","Acariens Sarcoptiformes nouveaux - diagnoses preliminaires.","183-188","","Revue de Zoologie et de Botanique Africaines","","","","<!--MARK--><a href='nullb1a6f019-c69b-4512-aa87-05533284dee3' class='mouseoverHref'>Fain, A. 1964. Acariens Sarcoptiformes nouveaux - diagnoses preliminaires.</a> <!--MARK--><!--MARK--><a href='null1d82d934-7b0c-4e56-93e8-eb7594a06062' class='mouseoverHref'><em>Revue de Zoologie et de Botanique Africaines</em></a> <strong>69</strong>: 183-188<!--MARK-->","","Article in Journal","b1a6f019-c69b-4512-aa87-05533284dee3","20110311T00:16:00.399+0000","1d82d934-7b0c-4e56-93e8-eb7594a06062"
"Fain, A.","1964","Notes sur trois nouveaux acariens parasites","297-300","","Revue de Zoologie et de Botanique Africaines","","","","<!--MARK--><a href='null4f8cfdfa-ee98-4cab-ae78-7e3623560e59' class='mouseoverHref'>Fain, A. 1964. Notes sur trois nouveaux acariens parasites.</a> <!--MARK--><!--MARK--><a href='null1d82d934-7b0c-4e56-93e8-eb7594a06062' class='mouseoverHref'><em>Revue de Zoologie et de Botanique Africaines</em></a> <strong>70</strong>: 297-300<!--MARK-->","","Article in Journal","4f8cfdfa-ee98-4cab-ae78-7e3623560e59","20081009T05:11:37.000+0000","1d82d934-7b0c-4e56-93e8-eb7594a06062"
"Fain, A.","1965","A review of the family Epidermoptidae Trouessart parasitic on the skin of birds (Acarina : Sarcoptiformes)","Pt I (text) 1-176, Pt II (figures) 1-144","","Verhandelingen van de Koninklijke (Vlaamse) Academie voor Wetenschappen, Letteren en Schone Kunsten van België. Klasse der Wetenschappen","","","","<!--MARK--><a href='null0a2c1d1a-6c67-4413-8ab6-ab305bf550e4' class='mouseoverHref'>Fain, A. 1965. A review of the family Epidermoptidae Trouessart parasitic on the skin of birds (Acarina : Sarcoptiformes).</a> <!--MARK--><!--MARK--><a href='nulle034e7f5-3836-4e17-8283-584387fde686' class='mouseoverHref'><em>Verhandelingen van de Koninklijke (Vlaamse) Academie voor Wetenschappen, Letteren en Schone Kunsten van België. Klasse der Wetenschappen</em></a> <strong>84</strong>: Pt I (text) 1-176, Pt II (figures) 1-144<!--MARK-->","","Article in Journal","0a2c1d1a-6c67-4413-8ab6-ab305bf550e4","20081009T05:11:37.000+0000","e034e7f5-3836-4e17-8283-584387fde686"
"Fain, A.","1965","Les Acariens nidicoles et detriticoles de la famille Pyroglyphidae Cunliffe (Sarcoptiformes)","257-288","","Revue de Zoologie et de Botanique Africaines","","","","<!--MARK--><a href='nulla36c2630-8036-463a-abec-9c4a185c62b6' class='mouseoverHref'>Fain, A. 1965. Les Acariens nidicoles et detriticoles de la famille Pyroglyphidae Cunliffe (Sarcoptiformes).</a> <!--MARK--><!--MARK--><a href='null1d82d934-7b0c-4e56-93e8-eb7594a06062' class='mouseoverHref'><em>Revue de Zoologie et de Botanique Africaines</em></a> <strong>72</strong>: 257-288<!--MARK-->","","Article in Journal","a36c2630-8036-463a-abec-9c4a185c62b6","20081009T05:11:37.000+0000","1d82d934-7b0c-4e56-93e8-eb7594a06062"
"Fain, A.","1966","<i>Procnemidocoptes jansseni</i> g.n., sp.n., et <i>Neocnemidocoptes</i> g.n. Remaniement des Knemidokoptidae, parasites cuticoles des Oiseaux (Acarina : Sarcoptiformes)","390-396","","Revue de Zoologie et de Botanique Africaines","","","","<!--MARK--><a href='nullf31022cf-f35b-4c2f-aa1a-03cf7e174073' class='mouseoverHref'>Fain, A. 1966. <i>Procnemidocoptes jansseni</i> g.n., sp.n., et <i>Neocnemidocoptes</i> g.n. Remaniement des Knemidokoptidae, parasites cuticoles des Oiseaux (Acarina : Sarcoptiformes).</a> <!--MARK--><!--MARK--><a href='null1d82d934-7b0c-4e56-93e8-eb7594a06062' class='mouseoverHref'><em>Revue de Zoologie et de Botanique Africaines</em></a> <strong>73</strong>: 390-396<!--MARK-->","","Article in Journal","f31022cf-f35b-4c2f-aa1a-03cf7e174073","20081009T05:11:37.000+0000","1d82d934-7b0c-4e56-93e8-eb7594a06062"
"Fain, A.","1966","Nouvelle description de <i>Dermatophagoides pteronyssinus</i> (Trouessart, 1897). Importance de cet acarien en pathologie humaine (Psoroptidae : Sarcoptiformes)","302-327","","Acarologia","","","","<!--MARK--><a href='null430b9d61-afb6-4fc1-85c9-dff3599c055b' class='mouseoverHref'>Fain, A. 1966. Nouvelle description de <i>Dermatophagoides pteronyssinus</i> (Trouessart, 1897). Importance de cet acarien en pathologie humaine (Psoroptidae : Sarcoptiformes).</a> <!--MARK--><!--MARK--><a href='nullca52b0dd-4050-4ed0-b7a9-fad0329897d3' class='mouseoverHref'><em>Acarologia</em></a> <strong>8</strong>: 302-327<!--MARK-->","","Article in Journal","430b9d61-afb6-4fc1-85c9-dff3599c055b","20081009T05:11:37.000+0000","ca52b0dd-4050-4ed0-b7a9-fad0329897d3"
"Fain, A.","1967","Le genre <i>Dermatophagoides</i> Bogdanov 1864 son importance dans les allergies respiratoires et cutanées chez l'homme (Psoroptidae : Sarcoptiformes)","179-225","","Acarologia","","","","<!--MARK--><a href='null933c94d2-aec6-4015-94e7-eba623fb25c2' class='mouseoverHref'>Fain, A. 1967. Le genre <i>Dermatophagoides</i> Bogdanov 1864 son importance dans les allergies respiratoires et cutanées chez l'homme (Psoroptidae : Sarcoptiformes).</a> <!--MARK--><!--MARK--><a href='nullca52b0dd-4050-4ed0-b7a9-fad0329897d3' class='mouseoverHref'><em>Acarologia</em></a> <strong>9</strong>: 179-225<!--MARK-->","","Article in Journal","933c94d2-aec6-4015-94e7-eba623fb25c2","20081009T05:11:37.000+0000","ca52b0dd-4050-4ed0-b7a9-fad0329897d3"
"Fain, A.","1974","Notes sur les Knemidokoptidae avec description de taxa nouveaux","182-188","","Acarologia","","","","<!--MARK--><a href='nulle3f96e3d-5960-4124-9728-032eb5db5469' class='mouseoverHref'>Fain, A. 1974. Notes sur les Knemidokoptidae avec description de taxa nouveaux.</a> <!--MARK--><!--MARK--><a href='nullca52b0dd-4050-4ed0-b7a9-fad0329897d3' class='mouseoverHref'><em>Acarologia</em></a> <strong>16</strong>: 182-188<!--MARK-->","","Article in Journal","e3f96e3d-5960-4124-9728-032eb5db5469","20081009T05:11:37.000+0000","ca52b0dd-4050-4ed0-b7a9-fad0329897d3"
"Fain, A.","1977","Observations sur les Turbinoptidae d'Afrique au Sud du Sahara (Acarina: Astigmata).","83-116","","Revue de Zoologie Africaine","","","","<!--MARK--><a href='null336b1d8d-7419-421e-bec1-cd7b54ecf934' class='mouseoverHref'>Fain, A. 1977. Observations sur les Turbinoptidae d'Afrique au Sud du Sahara (Acarina: Astigmata).</a> <!--MARK--><!--MARK--><a href='null46c39bd8-0042-4db4-9cc5-af9cd1bc4711' class='mouseoverHref'><em>Revue de Zoologie Africaine</em></a> <strong>91</strong>: 83-116<!--MARK-->","","Article in Journal","336b1d8d-7419-421e-bec1-cd7b54ecf934","20111012T20:10:07.785+0000","46c39bd8-0042-4db4-9cc5-af9cd1bc4711"
"Fain, A.","1979","Notes sur les acariens astigmatiques cavernicoles. Description de deux genres nouveaux et de quatre espèces nouvelles","116-127","","Acarologia","","","","<!--MARK--><a href='nullf0dd6562-39f1-4026-a43d-7cce38eca808' class='mouseoverHref'>Fain, A. 1979. Notes sur les acariens astigmatiques cavernicoles. Description de deux genres nouveaux et de quatre espèces nouvelles.</a> <!--MARK--><!--MARK--><a href='nullca52b0dd-4050-4ed0-b7a9-fad0329897d3' class='mouseoverHref'><em>Acarologia</em></a> <strong>20</strong>: 116-127<!--MARK-->","","Article in Journal","f0dd6562-39f1-4026-a43d-7cce38eca808","20081009T05:11:37.000+0000","ca52b0dd-4050-4ed0-b7a9-fad0329897d3"
"Fain, A.","1981","Notes on the genus <i>Laminosioptes</i> Megnin, 1880 (Acari, Astigmata) with description of three new species","123-132","","Systematic Parasitology","","","","<!--MARK--><a href='nullcbe4b2d8-db58-4ab1-bbe4-75b6b823cb01' class='mouseoverHref'>Fain, A. 1981. Notes on the genus <i>Laminosioptes</i> Megnin, 1880 (Acari, Astigmata) with description of three new species.</a> <!--MARK--><!--MARK--><a href='nullb0bb30a0-dfa7-4cf2-bf21-216d851b8d01' class='mouseoverHref'><em>Systematic Parasitology</em></a> <strong>2</strong>: 123-132<!--MARK-->","","Article in Journal","cbe4b2d8-db58-4ab1-bbe4-75b6b823cb01","20081009T05:11:37.000+0000","b0bb30a0-dfa7-4cf2-bf21-216d851b8d01"
"Fain, A. & Bafort, J.","1964","Les acariens de la famille Cytoditidae (Sarcoptiformes) description de sept espèces nouvelles","504-528","","Acarologia","","","","<!--MARK--><a href='null8f7c1aa4-5d04-4b1b-a11c-69973ce63556' class='mouseoverHref'>Fain, A. & Bafort, J. 1964. Les acariens de la famille Cytoditidae (Sarcoptiformes) description de sept espèces nouvelles.</a> <!--MARK--><!--MARK--><a href='nullca52b0dd-4050-4ed0-b7a9-fad0329897d3' class='mouseoverHref'><em>Acarologia</em></a> <strong>6</strong>: 504-528<!--MARK-->","","Article in Journal","8f7c1aa4-5d04-4b1b-a11c-69973ce63556","20081009T05:11:37.000+0000","ca52b0dd-4050-4ed0-b7a9-fad0329897d3"
"Fain, A. & Elsen, P.","1967","Les acariens de la famille Knemidokoptidae producteurs de gale chez les oiseaux","1-142","","Acta Zoologica et Pathologica Antverpiensia","","","","<!--MARK--><a href='null8d28d519-d651-49a6-8ed4-2078ce480098' class='mouseoverHref'>Fain, A. & Elsen, P. 1967. Les acariens de la famille Knemidokoptidae producteurs de gale chez les oiseaux.</a> <!--MARK--><!--MARK--><a href='nullde341f7b-7cd3-4752-aea1-101d8d83514f' class='mouseoverHref'><em>Acta Zoologica et Pathologica Antverpiensia</em></a> <strong>45</strong>: 1-142<!--MARK-->","","Article in Journal","8d28d519-d651-49a6-8ed4-2078ce480098","20081009T05:11:37.000+0000","de341f7b-7cd3-4752-aea1-101d8d83514f"
"Fain, A. & Evans, G.O.","1964","On three mites of the genus <i>Epidermoptes</i> Rivolta (Acari)","595-608","","Annals and Magazine of Natural History","","","","<!--MARK--><a href='null434fca53-e9dc-45e7-8e1e-bbb403434400' class='mouseoverHref'>Fain, A. & Evans, G.O. 1964. On three mites of the genus <i>Epidermoptes</i> Rivolta (Acari).</a> <!--MARK--><!--MARK--><a href='nullefa8de69-3a29-4a43-8ef2-cbefda205976' class='mouseoverHref'><em>Annals and Magazine of Natural History</em></a> 13 <strong>6</strong>: 595-608<!--MARK-->","","Article in Journal","434fca53-e9dc-45e7-8e1e-bbb403434400","20081009T05:11:37.000+0000","efa8de69-3a29-4a43-8ef2-cbefda205976"
"Fain, A. & Lowry, J.W.J.","1975","A new pyroglyphid mite from Australia (Acarina : Sarcoptiformes, Pyroglyphidae)","331-339","","Acarologia","","","","<!--MARK--><a href='null6361f501-1966-4718-a819-704e53bf33a2' class='mouseoverHref'>Fain, A. & Lowry, J.W.J. 1975. A new pyroglyphid mite from Australia (Acarina : Sarcoptiformes, Pyroglyphidae).</a> <!--MARK--><!--MARK--><a href='nullca52b0dd-4050-4ed0-b7a9-fad0329897d3' class='mouseoverHref'><em>Acarologia</em></a> <strong>16</strong>: 331-339<!--MARK-->","","Article in Journal","6361f501-1966-4718-a819-704e53bf33a2","20081009T05:11:37.000+0000","ca52b0dd-4050-4ed0-b7a9-fad0329897d3"
"Fain, A. & Lukoschus, F.S.","1979","Parasites of Western Australia. II. Nasal mites from birds (Acarina : Rhinonyssidae, Dermanyssidae, Ereynetidae and Cytoditidae)","9-27","","Records of the Western Australian Museum","","","","<!--MARK--><a href='null47af9d25-44f9-4c83-b6eb-b5736e67ee60' class='mouseoverHref'>Fain, A. & Lukoschus, F.S. 1979. Parasites of Western Australia. II. Nasal mites from birds (Acarina : Rhinonyssidae, Dermanyssidae, Ereynetidae and Cytoditidae).</a> <!--MARK--><!--MARK--><a href='nulla2cbd1fb-97d5-493a-a1d7-c2b99709890b' class='mouseoverHref'><em>Records of the Western Australian Museum</em></a> <strong>7</strong>: 9-27<!--MARK-->","","Article in Journal","47af9d25-44f9-4c83-b6eb-b5736e67ee60","20081009T05:11:37.000+0000","a2cbd1fb-97d5-493a-a1d7-c2b99709890b"
"Fain, A. & Lukoschus, F.S.","1979","Two new parasitic mites (Acari, Astigmata) from the skin of Australian vertebrates","387-393","","Mitteilungen aus dem Hamburgischen Zoologischen Museum und Institut","","","","<!--MARK--><a href='null9ee59003-41ba-4bd7-936a-f63c0fe1a1fd' class='mouseoverHref'>Fain, A. & Lukoschus, F.S. 1979. Two new parasitic mites (Acari, Astigmata) from the skin of Australian vertebrates.</a> <!--MARK--><!--MARK--><a href='null171ccd89-642b-4041-beef-26bac3a726db' class='mouseoverHref'><em>Mitteilungen aus dem Hamburgischen Zoologischen Museum und Institut</em></a> <strong>76</strong>: 387-393<!--MARK-->","","Article in Journal","9ee59003-41ba-4bd7-936a-f63c0fe1a1fd","20081009T05:11:37.000+0000","171ccd89-642b-4041-beef-26bac3a726db"
"Fain, A. & MacFarlane, D. in Fain, A. & Elsen, P.","1967","Les acariens de la famille Knemidokoptidae producteurs de gale chez les oiseaux","1-142","","Acta Zoologica et Pathologica Antverpiensia","","","","<!--MARK--><a href='null1758da8b-d3a8-42e2-85e4-84c2de196b28' class='mouseoverHref'>Fain, A. & MacFarlane, D. <i>in</i> Fain, A. & Elsen, P. 1967. Les acariens de la famille Knemidokoptidae producteurs de gale chez les oiseaux.</a> <!--MARK--><!--MARK--><a href='nullde341f7b-7cd3-4752-aea1-101d8d83514f' class='mouseoverHref'><em>Acta Zoologica et Pathologica Antverpiensia</em></a> <strong>45</strong>: 1-142<!--MARK-->","","Article in Journal","1758da8b-d3a8-42e2-85e4-84c2de196b28","20081009T05:11:37.000+0000","de341f7b-7cd3-4752-aea1-101d8d83514f"
"Fürstenberg, M.H.F.","1870","Die Krätzmilben der Hühner","56-74 pl. I","","Mittheilungen des Naturwissenschaftlichen Vereines für Neu-Vorpommern und Rügen. Greifswald","","","","<!--MARK--><a href='null10cea85c-3af3-4638-a5b9-5038290d78bb' class='mouseoverHref'>Fürstenberg, M.H.F. 1870. Die Krätzmilben der Hühner.</a> <!--MARK--><!--MARK--><a href='nulla40ea120-e28a-412f-a8b1-6a6414a8571f' class='mouseoverHref'><em>Mittheilungen des Naturwissenschaftlichen Vereines für Neu-Vorpommern und Rügen. Greifswald</em></a> <strong>2</strong>: 56-74 pl. I<!--MARK-->","","Article in Journal","10cea85c-3af3-4638-a5b9-5038290d78bb","20081009T05:11:37.000+0000","a40ea120-e28a-412f-a8b1-6a6414a8571f"
"Gaud, J.","1957","Acariens plumicoles (Analgesoidea) parasites des oiseaux du Maroc","105-136","","Bulletin de la Société des Sciences Naturelles et Physiques du Maroc","","","","<!--MARK--><a href='null844fee9a-1853-4b95-b87f-239b745dec88' class='mouseoverHref'>Gaud, J. 1957. Acariens plumicoles (Analgesoidea) parasites des oiseaux du Maroc.</a> <!--MARK--><!--MARK--><a href='nullcddd9bc8-d1c5-44f4-a955-62a707e08b8a' class='mouseoverHref'><em>Bulletin de la Société des Sciences Naturelles et Physiques du Maroc</em></a> <strong>37</strong>: 105-136<!--MARK-->","","Article in Journal","844fee9a-1853-4b95-b87f-239b745dec88","20081009T05:11:37.000+0000","cddd9bc8-d1c5-44f4-a955-62a707e08b8a"
"Gaud, J.","1958","Acariens plumicoles (Analgesoidea) parasites des oiseaux du Maroc. II. Analgesidae","27-49","","Bulletin de la Société de Sciences Naturelles et Physiques du Maroc","","","","<!--MARK--><a href='null043623af-c323-4fe4-a4d0-e17b71752218' class='mouseoverHref'>Gaud, J. 1958. Acariens plumicoles (Analgesoidea) parasites des oiseaux du Maroc. II. Analgesidae.</a> <!--MARK--><!--MARK--><a href='nullfde36f49-2ce0-4963-9756-e6ee14ccf47b' class='mouseoverHref'><em>Bulletin de la Société de Sciences Naturelles et Physiques du Maroc</em></a> <strong>38</strong>: 27-49<!--MARK-->","","Article in Journal","043623af-c323-4fe4-a4d0-e17b71752218","20100928T06:01:16.145+0000","fde36f49-2ce0-4963-9756-e6ee14ccf47b"
"Gaud, J.","1961","Six genres nouveaux de Sarcoptifirmes plumicoles (Analgesoidea).","78-95","","Acarologia","","","","<!--MARK--><a href='null014c16ce-7081-4a10-a97e-38a9145dee7a' class='mouseoverHref'>Gaud, J. 1961. Six genres nouveaux de Sarcoptifirmes plumicoles (Analgesoidea).</a> <!--MARK--><!--MARK--><a href='nullca52b0dd-4050-4ed0-b7a9-fad0329897d3' class='mouseoverHref'><em>Acarologia</em></a> <strong>3</strong>: 78-95<!--MARK-->","","Article in Journal","014c16ce-7081-4a10-a97e-38a9145dee7a","20110310T19:52:46.145+0000","ca52b0dd-4050-4ed0-b7a9-fad0329897d3"
"Gaud, J.","1962","Sarcoptiformes plumicoles (Analgesoidea) parasites d'oiseaux de l'Ile Rennell","31-51","","Natural History of Rennell Island, British Solomon Islands","","","","<!--MARK--><a href='null6234ecb4-5436-4109-881f-1d2180bd6475' class='mouseoverHref'>Gaud, J. 1962. Sarcoptiformes plumicoles (Analgesoidea) parasites d'oiseaux de l'Ile Rennell.</a> <!--MARK--><!--MARK--><a href='null417d6d28-ca57-44be-b6ab-2c81c06a65be' class='mouseoverHref'><em>Natural History of Rennell Island, British Solomon Islands</em></a> <strong>4</strong>: 31-51<!--MARK-->","","Article in Journal","6234ecb4-5436-4109-881f-1d2180bd6475","20081009T05:11:37.000+0000","417d6d28-ca57-44be-b6ab-2c81c06a65be"
"Gaud, J.","1968","Sarcoptiformes plumicoles (Analgoidea) parasites d'oiseaux de l'Ile Rennell. (Deuxième note)","121-151 pl. 5","","Natural History of Rennell Island, British Solomon Islands","","","","<!--MARK--><a href='null3e5c74c7-343a-4e35-afa9-673972155342' class='mouseoverHref'>Gaud, J. 1968. Sarcoptiformes plumicoles (Analgoidea) parasites d'oiseaux de l'Ile Rennell. (Deuxième note).</a> <!--MARK--><!--MARK--><a href='null417d6d28-ca57-44be-b6ab-2c81c06a65be' class='mouseoverHref'><em>Natural History of Rennell Island, British Solomon Islands</em></a> <strong>5</strong>: 121-151 pl. 5<!--MARK-->","","Article in Journal","3e5c74c7-343a-4e35-afa9-673972155342","20081009T05:11:37.000+0000","417d6d28-ca57-44be-b6ab-2c81c06a65be"
"Gaud, J.","1975","Une espèce nouvelle du genre <i>Megninia</i> (Analgidae) trouvée sous la peau d'un poulet domestique en Australie","325-330","","Acarologia","","","","<!--MARK--><a href='nullfc80e6e2-b670-4b03-9bac-b24b66f2413c' class='mouseoverHref'>Gaud, J. 1975. Une espèce nouvelle du genre <i>Megninia</i> (Analgidae) trouvée sous la peau d'un poulet domestique en Australie.</a> <!--MARK--><!--MARK--><a href='nullca52b0dd-4050-4ed0-b7a9-fad0329897d3' class='mouseoverHref'><em>Acarologia</em></a> <strong>16</strong>: 325-330<!--MARK-->","","Article in Journal","fc80e6e2-b670-4b03-9bac-b24b66f2413c","20081009T05:11:37.000+0000","ca52b0dd-4050-4ed0-b7a9-fad0329897d3"
"Gaud, J.","1980","Acariens Sarcoptiformes plumicoles parasites sur les oiseaux Psittaciformes, Strigiformes et Caprimulgiformes en Afrique","1-106","","Annales du Musée Royal de l'Afrique Centrale Tervuren Belgique","","","","<!--MARK--><a href='null456f6fd4-47c6-463f-8b0b-79cb671693eb' class='mouseoverHref'>Gaud, J. 1980. Acariens Sarcoptiformes plumicoles parasites sur les oiseaux Psittaciformes, Strigiformes et Caprimulgiformes en Afrique.</a> <!--MARK--><!--MARK--><a href='null67ebf567-c3fe-47a3-8c95-fc520694b6e2' class='mouseoverHref'><em>Annales du Musée Royal de l'Afrique Centrale Tervuren Belgique</em></a> <strong>230</strong>: 1-106<!--MARK-->","","Article in Journal","456f6fd4-47c6-463f-8b0b-79cb671693eb","20081009T05:11:37.000+0000","67ebf567-c3fe-47a3-8c95-fc520694b6e2"
