"PUB_AUTHOR","PUB_YEAR","PUB_TITLE","PUB_PAGES","PUB_PARENT_BOOK_TITLE","PUB_PARENT_JOURNAL_TITLE","PUB_PARENT_ARTICLE_TITLE","PUB_PUBLICATION_DATE","PUB_PUBLISHER","PUB_FORMATTED","PUB_QUALIFICATION","PUB_TYPE","PUBLICATION_GUID","PUBLICATION_LAST_UPDATE","PARENT_PUBLICATION_GUID"
"Jordan, D.S. & Seale, A.","1905","List of fishes collected by Dr Bashford Dean on the island of Negros, Philippines","769-803 figs 1-20","","Proceedings of the United States National Museum","","","","<!--MARK--><a href='null625a167a-20c3-4b48-8770-ba300ccf545e' class='mouseoverHref'>Jordan, D.S. & Seale, A. 1905. List of fishes collected by Dr Bashford Dean on the island of Negros, Philippines.</a> <!--MARK--><!--MARK--><a href='null0e32c453-4bc6-48a2-a3a2-d40281874533' class='mouseoverHref'><em>Proceedings of the United States National Museum</em></a> <strong>28</strong>(1407): 769-803 figs 1-20<!--MARK-->","","Article in Journal","625a167a-20c3-4b48-8770-ba300ccf545e","20081009T05:11:37.000+0000","0e32c453-4bc6-48a2-a3a2-d40281874533"
"Jordan, D.S. & Seale, A.","1906","The fishes of Samoa. Description of the species found in the Archipelago, with a provisional checklist of the fishes of Oceania","173-455 figs 1-111 pls 33-53","","Bulletin of the Bureau of Fisheries (U.S.) for 1905","","","","<!--MARK--><a href='null6f1637c3-3af3-4f3d-b234-674be4fe4f36' class='mouseoverHref'>Jordan, D.S. & Seale, A. 1906. The fishes of Samoa. Description of the species found in the Archipelago, with a provisional checklist of the fishes of Oceania.</a> <!--MARK--><!--MARK--><a href='null3ac8a6e7-352f-4f46-a510-6de9e7bf61cb' class='mouseoverHref'><em>Bulletin of the Bureau of Fisheries (U.S.) for 1905</em></a> <strong>25</strong>: 173-455 figs 1-111 pls 33-53<!--MARK-->","","Article in Journal","6f1637c3-3af3-4f3d-b234-674be4fe4f36","20081009T05:11:37.000+0000","3ac8a6e7-352f-4f46-a510-6de9e7bf61cb"
"Jordan, D.S. & Seale, A.","1907","Fishes of the islands of Luzon and Panay","1-48 figs 1-20","","Bulletin of the Bureau of Fisheries (U.S.) for 1906","","","","<!--MARK--><a href='nullfb2982c7-92f4-4407-bfb9-611c061eaa9e' class='mouseoverHref'>Jordan, D.S. & Seale, A. 1907. Fishes of the islands of Luzon and Panay.</a> <!--MARK--><!--MARK--><a href='null85b66d19-0202-40b4-b87d-6e7abd63f112' class='mouseoverHref'><em>Bulletin of the Bureau of Fisheries (U.S.) for 1906</em></a> <strong>26</strong>: 1-48 figs 1-20<!--MARK-->","","Article in Journal","fb2982c7-92f4-4407-bfb9-611c061eaa9e","20081009T05:11:37.000+0000","85b66d19-0202-40b4-b87d-6e7abd63f112"
"Jordan, D.S. & Snyder, J.O.","1901","A review of the cardinal fishes of Japan","891-913 figs 1-10 pls 43-44","","Proceedings of the United States National Museum","","","","<!--MARK--><a href='null43510ae4-9439-498f-b43a-5cdff796a9d1' class='mouseoverHref'>Jordan, D.S. & Snyder, J.O. 1901. A review of the cardinal fishes of Japan.</a> <!--MARK--><!--MARK--><a href='null0e32c453-4bc6-48a2-a3a2-d40281874533' class='mouseoverHref'><em>Proceedings of the United States National Museum</em></a> <strong>23</strong>(1240): 891-913 figs 1-10 pls 43-44<!--MARK-->","","Article in Journal","43510ae4-9439-498f-b43a-5cdff796a9d1","20081009T05:11:37.000+0000","0e32c453-4bc6-48a2-a3a2-d40281874533"
"Jordan, D.S. & Snyder, J.O.","1904","Description of a new species of fish (<i>Apogon evermanni</i>) from the Hawaiian Islands, with notes on other species","123-126","","Proceedings of the United States National Museum","","","","<!--MARK--><a href='null8fc37b48-4e70-4245-91f2-f84c8a27fa02' class='mouseoverHref'>Jordan, D.S. & Snyder, J.O. 1904. Description of a new species of fish (<i>Apogon evermanni</i>) from the Hawaiian Islands, with notes on other species.</a> <!--MARK--><!--MARK--><a href='null0e32c453-4bc6-48a2-a3a2-d40281874533' class='mouseoverHref'><em>Proceedings of the United States National Museum</em></a> <strong>28</strong>(1386): 123-126<!--MARK-->","","Article in Journal","8fc37b48-4e70-4245-91f2-f84c8a27fa02","20081009T05:11:37.000+0000","0e32c453-4bc6-48a2-a3a2-d40281874533"
"Jordan, D.S. & Starks, E.C. in Jordan, D.S. & Seale, A.","1906","The fishes of Samoa. Description of the species found in the Archipelago, with a provisional checklist of the fishes of Oceania","173-455 figs 1-111 pls 33-53","","Bulletin of the Bureau of Fisheries (U.S.) for 1905","","","","<!--MARK--><a href='null7dbc071e-7754-4be8-950a-083c5160ebb5' class='mouseoverHref'>Jordan, D.S. & Starks, E.C. <i>in</i> Jordan, D.S. & Seale, A. 1906. The fishes of Samoa. Description of the species found in the Archipelago, with a provisional checklist of the fishes of Oceania.</a> <!--MARK--><!--MARK--><a href='null3ac8a6e7-352f-4f46-a510-6de9e7bf61cb' class='mouseoverHref'><em>Bulletin of the Bureau of Fisheries (U.S.) for 1905</em></a> <strong>25</strong>: 173-455 figs 1-111 pls 33-53<!--MARK-->","","Article in Journal","7dbc071e-7754-4be8-950a-083c5160ebb5","20081009T05:11:37.000+0000","3ac8a6e7-352f-4f46-a510-6de9e7bf61cb"
"Kailola, P.J.","1976","A new species of cardinalfish (Apogonidae) from northern Queensland and Papua New Guinea","129-136 figs 1-2","","Records of the Australian Museum","","","","<!--MARK--><a href='nullefc2a2d9-9763-4c55-ab21-4b72beeae133' class='mouseoverHref'>Kailola, P.J. 1976. A new species of cardinalfish (Apogonidae) from northern Queensland and Papua New Guinea.</a> <!--MARK--><!--MARK--><a href='null7c07530b-0b38-44f5-8f95-368da97d6ac2' class='mouseoverHref'><em>Records of the Australian Museum</em></a> <strong>30</strong>(8): 129-136 figs 1-2<!--MARK-->","","Article in Journal","efc2a2d9-9763-4c55-ab21-4b72beeae133","20081009T05:11:37.000+0000","7c07530b-0b38-44f5-8f95-368da97d6ac2"
"Klunzinger, C.B.","1870","Synopsis der Fische des Rothen Meeres, 1","669-834","","Verhandlungen der Zoologisch-Botanischen Gesellschaft in Wien","","","","<!--MARK--><a href='null5e0c5557-9b29-4017-9763-3f220c822ada' class='mouseoverHref'>Klunzinger, C.B. 1870. Synopsis der Fische des Rothen Meeres, 1.</a> <!--MARK--><!--MARK--><a href='null14e4d839-6bc2-42e9-ae1b-979730866002' class='mouseoverHref'><em>Verhandlungen der Zoologisch-Botanischen Gesellschaft in Wien</em></a> <strong>20</strong>: 669-834<!--MARK-->","","Article in Journal","5e0c5557-9b29-4017-9763-3f220c822ada","20081009T05:11:37.000+0000","14e4d839-6bc2-42e9-ae1b-979730866002"
"Klunzinger, C.B.","1872","Zur Fische-fauna von Süd Australien","17-47 pl. 2","","Archiv für Naturgeschichte","","","","<!--MARK--><a href='nullbcc9da0c-58c2-43fb-9d29-aca970e10073' class='mouseoverHref'>Klunzinger, C.B. 1872. Zur Fische-fauna von Süd Australien.</a> <!--MARK--><!--MARK--><a href='nullf5b5f7c7-fc53-4502-951d-1c96b680d874' class='mouseoverHref'><em>Archiv für Naturgeschichte</em></a> <strong>38</strong>(1): 17-47 pl. 2<!--MARK-->","","Article in Journal","bcc9da0c-58c2-43fb-9d29-aca970e10073","20081009T05:11:37.000+0000","f5b5f7c7-fc53-4502-951d-1c96b680d874"
"Klunzinger, C.B.","1879","Die v. Müller'sche Sammlung Australischer Fische","254-261","","Anzeiger der Kaiserlichen Akademie der Wissenschaften. Mathematisch-Naturwissenschaftliche Klasse, Wien","","","","<!--MARK--><a href='nullb22a1fa6-80af-4346-89ee-cb7b7de3334c' class='mouseoverHref'>Klunzinger, C.B. 1879. Die v. Müller'sche Sammlung Australischer Fische.</a> <!--MARK--><!--MARK--><a href='nulld6529158-4f0c-4c4b-8e4b-27cbfac24477' class='mouseoverHref'><em>Anzeiger der Kaiserlichen Akademie der Wissenschaften. Mathematisch-Naturwissenschaftliche Klasse, Wien</em></a> <strong>16</strong>(22): 254-261<!--MARK-->","","Article in Journal","b22a1fa6-80af-4346-89ee-cb7b7de3334c","20081009T05:11:37.000+0000","d6529158-4f0c-4c4b-8e4b-27cbfac24477"
"Krefft, G.","1868","Descriptions of some new Australian freshwater fishes","942-944","","Proceedings of the Zoological Society of London","","","","<!--MARK--><a href='nulldc5d211b-bebb-4ea5-9f3c-3c177ed64fae' class='mouseoverHref'>Krefft, G. 1868. Descriptions of some new Australian freshwater fishes.</a> <!--MARK--><!--MARK--><a href='null511f299d-99ec-413c-bc4c-04a380829c96' class='mouseoverHref'><em>Proceedings of the Zoological Society of London</em></a> <strong>1867</strong>: 942-944<!--MARK--> [for publication date McCulloch, A.R. 1930. A check-list of the fishes recorded from Australia. <em>Memoirs of the Australian Museum</em> <strong>5</strong>(1-4): 1-534 [47, 141]]","for publication date McCulloch, A.R. 1930. A check-list of the fishes recorded from Australia. <em>Memoirs of the Australian Museum</em> <strong>5</strong>(1-4): 1-534 [47, 141]","Article in Journal","dc5d211b-bebb-4ea5-9f3c-3c177ed64fae","20081009T05:11:37.000+0000","511f299d-99ec-413c-bc4c-04a380829c96"
"Kuiter, R.H.","1992","Tropical Reef-Fishes of the Western Pacific, Indonesia and Adjacent Waters","314 pp. pls","","","","","PT Gramedia Pustaka Utama","<!--MARK--><a href='null956baf97-d8d9-464e-9071-f6cfe11d2dff' class='mouseoverHref'>Kuiter, R.H. 1992. <em>Tropical Reef-Fishes of the Western Pacific, Indonesia and Adjacent Waters</em>. Jakarta : PT Gramedia Pustaka Utama 314 pp. pls.</a><!--MARK-->","","Book","956baf97-d8d9-464e-9071-f6cfe11d2dff","20081009T05:11:37.000+0000",""
"Kuiter, R.H.","1993","Coastal Fishes of South-eastern Australia","437 pp.","","","","","Crawford House Press","<!--MARK--><a href='nulld0313ee8-4b77-440f-9cba-b7a89fb90f15' class='mouseoverHref'>Kuiter, R.H. 1993. <em>Coastal Fishes of South-eastern Australia</em>. Bathurst : Crawford House Press 437 pp.</a><!--MARK-->","","Book","d0313ee8-4b77-440f-9cba-b7a89fb90f15","20081009T05:11:37.000+0000",""
"Kuiter, R.H.","1996","Guide to Sea Fishes of Australia. A comprehensive reference for divers and fishermen","xvii, 434 pp.","","","","","New Holland Publishers","<!--MARK--><a href='null3e132861-4e89-4685-b0ff-66a6638b481f' class='mouseoverHref'>Kuiter, R.H. 1996. <em>Guide to Sea Fishes of Australia. A comprehensive reference for divers and fishermen</em>. Sydney, NSW, Australia : New Holland Publishers xvii, 434 pp.</a><!--MARK-->","","Book","3e132861-4e89-4685-b0ff-66a6638b481f","20130130T04:31:40.772+0000",""
"Kuiter, R.H. & Tonozuka, T.","2001","Indonesian Reef Fishes. Part 1","1-302","","","","","Zoonetics","<!--MARK--><a href='nullb8e77643-ce25-4e30-876d-4f73a2508303' class='mouseoverHref'>Kuiter, R.H. & Tonozuka, T. 2001. <em>Indonesian Reef Fishes. Part 1</em>. Australia : Zoonetics pp. 1-302.</a><!--MARK-->","","Book","b8e77643-ce25-4e30-876d-4f73a2508303","20110511T09:09:09.060+0000",""
"Lacépède, B.G.","1801","Histoire Naturelle des Poissons","558 pp. 34 pls","","","","","chez Plassan","<!--MARK--><a href='null358767d6-f911-4963-915f-4dab40cb09ef' class='mouseoverHref'>Lacépède, B.G. 1801. <em>Histoire Naturelle des Poissons</em>. Paris : chez Plassan Vol. 3 558 pp. 34 pls.</a><!--MARK-->","","Book","358767d6-f911-4963-915f-4dab40cb09ef","20081009T05:11:37.000+0000",""
"Lacépède, B.G.","1802","Histoire Naturelle des Poissons","728 pp. 16 pls","","","","","chez Plassan","<!--MARK--><a href='nullbf93e779-23f4-4640-bae7-a5b97040b1c1' class='mouseoverHref'>Lacépède, B.G. 1802. <em>Histoire Naturelle des Poissons</em>. Paris : chez Plassan Vol. 4 728 pp. 16 pls.</a><!--MARK-->","","Book","bf93e779-23f4-4640-bae7-a5b97040b1c1","20131015T00:12:34.308+0000",""
"Lachner, E.A.","1953","Family Apogonidae : cardinal fishes","pp. 412-498 figs 69-84 pls 33-43","","Bulletin of the United States National Museum","Fishes of the Marshall and Marianas Islands. Vol. 1. Families Asymmetrontidae through Siganidae","","","<!--MARK--><a href='null2cee46c8-5bb4-487f-8627-76f3c3925c4f' class='mouseoverHref'>Lachner, E.A. 1953. Family Apogonidae : cardinal fishes. pp. 412-498 figs 69-84 pls 33-43</a> <!--MARK--><em>in</em> <!--MARK--><a href='null54792999-2b7f-4fcf-a1c7-a0a00216ec38' class='mouseoverHref'>Schultz, L.P., Herald, E.S., Lachner, E.A., Welander, A.D. & Woods, L.P. (eds). Fishes of the Marshall and Marianas Islands. Vol. 1. Families Asymmetrontidae through Siganidae.</a> <!--MARK--><!--MARK--><a href='nulld62694e9-c583-45e9-aa41-f40b5d5fc778' class='mouseoverHref'><em>Bulletin of the United States National Museum</em></a> <strong>202</strong>(1): 1-685, figs 1-90, pls 1-74<!--MARK-->","","Section in Article","2cee46c8-5bb4-487f-8627-76f3c3925c4f","20081009T05:11:37.000+0000","54792999-2b7f-4fcf-a1c7-a0a00216ec38"
"Lachner, E.A.","1953","Family Apogonidae : cardinal fishes","pp. 412-498 figs 69-84 pls 33-43","","Bulletin of the United States National Museum","Fishes of the Marshall and Marianas Islands. Vol. 1. Families Asymmetrontidae through Siganidae","","","<!--MARK--><a href='null047bdccd-7ae5-4c17-9bd3-d960a103ab47' class='mouseoverHref'>Lachner, E.A. 1953. Family Apogonidae : cardinal fishes. pp. 412-498 figs 69-84 pls 33-43</a> <!--MARK--><em>in</em> <!--MARK--><a href='null54792999-2b7f-4fcf-a1c7-a0a00216ec38' class='mouseoverHref'>Schultz, L.P., Herald, E.S., Lachner, E.A., Welander, A.D. & Woods, L.P. (eds). Fishes of the Marshall and Marianas Islands. Vol. 1. Families Asymmetrontidae through Siganidae.</a> <!--MARK--><!--MARK--><a href='nulld62694e9-c583-45e9-aa41-f40b5d5fc778' class='mouseoverHref'><em>Bulletin of the United States National Museum</em></a> <strong>202</strong>(1): 1-685, figs 1-90, pls 1-74<!--MARK-->","","Section in Article","047bdccd-7ae5-4c17-9bd3-d960a103ab47","20170502T04:18:12.044+0000","54792999-2b7f-4fcf-a1c7-a0a00216ec38"
"Lachner, E.A. & Taylor, W.R.","1960","A new cardinal fish of the genus <i>Archamia</i> from northern Australia","29-34 fig. 1","","Proceedings of the Biological Society of Washington","","","","<!--MARK--><a href='null13653bfe-db03-451d-868c-554b97dcf94c' class='mouseoverHref'>Lachner, E.A. & Taylor, W.R. 1960. A new cardinal fish of the genus <i>Archamia</i> from northern Australia.</a> <!--MARK--><!--MARK--><a href='null4153f314-120d-40d7-987b-b5ba47399aec' class='mouseoverHref'><em>Proceedings of the Biological Society of Washington</em></a> <strong>73</strong>: 29-34 fig. 1<!--MARK-->","","Article in Journal","13653bfe-db03-451d-868c-554b97dcf94c","20081009T05:11:37.000+0000","4153f314-120d-40d7-987b-b5ba47399aec"
"Lake, J.S.","1978","Australian Freshwater Fishes","160 pp. 140 figs","","","","","Thomas Nelson","<!--MARK--><a href='null6cb5e3d6-01d0-449f-abc3-a074b371dadb' class='mouseoverHref'>Lake, J.S. 1978. <em>Australian Freshwater Fishes</em>. Melbourne : Thomas Nelson 160 pp. 140 figs.</a><!--MARK-->","","Book","6cb5e3d6-01d0-449f-abc3-a074b371dadb","20081009T05:11:37.000+0000",""
"Larson, H.K., Williams, R.S. & Hammer, M.P.","2013","An annotated checklist of the fishes of the Northern Territory, Australia","1-293","","Zootaxa","","","","<!--MARK--><a href='null1ac91e46-d382-4d33-8ec4-82b25fc128d5' class='mouseoverHref'>Larson, H.K., Williams, R.S. & Hammer, M.P. 2013. An annotated checklist of the fishes of the Northern Territory, Australia.</a> <!--MARK--><!--MARK--><a href='null96466227-221c-4922-ac97-1ac2dd946d0a' class='mouseoverHref'><em>Zootaxa</em></a> <strong>3696</strong>(1): 1-293<!--MARK-->","","Article in Journal","1ac91e46-d382-4d33-8ec4-82b25fc128d5","20130813T04:03:39.085+0000","96466227-221c-4922-ac97-1ac2dd946d0a"
"Larson, H.K. & Martin, K.C.","1990","Freshwater Fishes of the Northern Territory. <i>Northern Territory Museum of Arts and Sciences Handbook Series Number 1</i>","102 pp. 73 figs","","","","","Northern Territory Museum of Arts and Sciences","<!--MARK--><a href='null1a43303c-0683-4b7c-9e19-147d153c3c47' class='mouseoverHref'>Larson, H.K. & Martin, K.C. 1990. <em>Freshwater Fishes of the Northern Territory. <i>Northern Territory Museum of Arts and Sciences Handbook Series Number 1</i></em>. Darwin : Northern Territory Museum of Arts and Sciences 102 pp. 73 figs.</a><!--MARK-->","","Book","1a43303c-0683-4b7c-9e19-147d153c3c47","20081009T05:11:37.000+0000",""
"Larson, H.K. & Williams, R.S.","1997","Darwin Harbour fishes: a survey and annotated checklist","339-380","The Marine Flora and Fauna of Darwin Harbour, Northern Territory, Australia. Proceedings of the Sixth International  Marine Biology Workshop","","","","","<!--MARK--><a href='null1b8d3fea-59b5-484f-a6af-993735c3ea30' class='mouseoverHref'>Larson, H.K. & Williams, R.S. 1997. Darwin Harbour fishes: a survey and annotated checklist. pp. 339-380</a> <!--MARK--><em>in</em> <!--MARK--><a href='null70752299-3f11-4a85-baa1-80f42f74ab4c' class='mouseoverHref'>Hanley, H.R., Caswell, G., Megirian, D. & Larson, H.K. (eds). <em>The Marine Flora and Fauna of Darwin Harbour, Northern Territory, Australia. Proceedings of the Sixth International  Marine Biology Workshop</em>. Darwin : Museum and Art Gallery of the Northern Territory 466 pp.</a><!--MARK-->","","Chapter in Book","1b8d3fea-59b5-484f-a6af-993735c3ea30","20081009T05:11:37.000+0000","70752299-3f11-4a85-baa1-80f42f74ab4c"
"Lowe, G.R. & Russell, B.C.","1990","Additions and revisions to the checklist of fishes of the Capricorn-Bunker Group, Great Barrier Reef, Australia","1-27","","Great Barrier Reef Marine Park Authority. Special Publication Series","","","","<!--MARK--><a href='nullf9c8c8e0-70f6-4bb5-bdbb-0ea003b1bad9' class='mouseoverHref'>Lowe, G.R. & Russell, B.C. 1990. Additions and revisions to the checklist of fishes of the Capricorn-Bunker Group, Great Barrier Reef, Australia.</a> <!--MARK--><!--MARK--><a href='null3843314e-4138-4512-9c4b-37e7537df8db' class='mouseoverHref'><em>Great Barrier Reef Marine Park Authority. Special Publication Series</em></a> <strong>19</strong>: 1-27<!--MARK-->","","Article in Journal","f9c8c8e0-70f6-4bb5-bdbb-0ea003b1bad9","20081009T05:11:37.000+0000","3843314e-4138-4512-9c4b-37e7537df8db"
"Mabuchi, K., Fraser, T.H., Song, H., Azuma, Y. & Nishida, M.","2014","Revision of the systematics of the cardinalfishes (Percomorpha: Apogonidae) based on molecular analyses and comparative reevaluation of morphological characters.","151-203","","Zootaxa","","","","<!--MARK--><a href='null2deb13af-9347-4e47-adaa-245aca321a08' class='mouseoverHref'>Mabuchi, K., Fraser, T.H., Song, H., Azuma, Y. & Nishida, M. 2014. Revision of the systematics of the cardinalfishes (Percomorpha: Apogonidae) based on molecular analyses and comparative reevaluation of morphological characters.</a> <!--MARK--><!--MARK--><a href='null96466227-221c-4922-ac97-1ac2dd946d0a' class='mouseoverHref'><em>Zootaxa</em></a> <strong>3846</strong>(2): 151-203<!--MARK-->","","Article in Journal","2deb13af-9347-4e47-adaa-245aca321a08","20141223T06:40:57.487+0000","96466227-221c-4922-ac97-1ac2dd946d0a"
"Mabuchi, K., Okuda, N. & Nishida, M.","2006","Molecular phylogeny and stripe pattern evolution in the cardinalfish genus <I>Apogon</I>.","90-99","","Molecular Phylogenetics and Evolution","","","","<!--MARK--><a href='null015dda40-45ba-493f-ab73-912c2b90336c' class='mouseoverHref'>Mabuchi, K., Okuda, N. & Nishida, M. 2006. Molecular phylogeny and stripe pattern evolution in the cardinalfish genus <I>Apogon</I>.</a> <!--MARK--><!--MARK--><a href='nulldb034f3c-0160-42a2-a6c9-84156be3b7b8' class='mouseoverHref'><em>Molecular Phylogenetics and Evolution</em></a> <strong>38</strong>: 90-99<!--MARK-->","","Article in Journal","015dda40-45ba-493f-ab73-912c2b90336c","20120414T15:23:33.778+0000","db034f3c-0160-42a2-a6c9-84156be3b7b8"
"Macleay, W.J.","1878","The fishes of Port Darwin","344-367 pls 7-10","","Proceedings of the Linnean Society of New South Wales","","","","<!--MARK--><a href='null0f7f06c3-0d40-4d0d-a5e6-2f61c1fabd77' class='mouseoverHref'>Macleay, W.J. 1878. The fishes of Port Darwin.</a> <!--MARK--><!--MARK--><a href='nullc12cd779-adb5-41ea-bd2c-75f6864cf22e' class='mouseoverHref'><em>Proceedings of the Linnean Society of New South Wales</em></a> 1 <strong>2</strong>(4): 344-367 pls 7-10<!--MARK-->","","Article in Journal","0f7f06c3-0d40-4d0d-a5e6-2f61c1fabd77","20081009T05:11:37.000+0000","c12cd779-adb5-41ea-bd2c-75f6864cf22e"
"Macleay, W.J.","1881","Descriptive catalogue of the fishes of Australia. Part 1","302-444","","Proceedings of the Linnean Society of New South Wales","","","","<!--MARK--><a href='null1a2a93c1-ce64-48d6-8fb6-27e5140e8c5b' class='mouseoverHref'>Macleay, W.J. 1881. Descriptive catalogue of the fishes of Australia. Part 1.</a> <!--MARK--><!--MARK--><a href='nullc12cd779-adb5-41ea-bd2c-75f6864cf22e' class='mouseoverHref'><em>Proceedings of the Linnean Society of New South Wales</em></a> 1 <strong>5</strong>(3): 302-444<!--MARK-->","","Article in Journal","1a2a93c1-ce64-48d6-8fb6-27e5140e8c5b","20081009T05:11:37.000+0000","c12cd779-adb5-41ea-bd2c-75f6864cf22e"
"Macleay, W.J.","1884","Supplement to the descriptive catalogue of the fishes of Australia","2-64","","Proceedings of the Linnean Society of New South Wales","","","","<!--MARK--><a href='nullbb65542b-330d-43ab-9bd6-d712d09b9e96' class='mouseoverHref'>Macleay, W.J. 1884. Supplement to the descriptive catalogue of the fishes of Australia.</a> <!--MARK--><!--MARK--><a href='nullc12cd779-adb5-41ea-bd2c-75f6864cf22e' class='mouseoverHref'><em>Proceedings of the Linnean Society of New South Wales</em></a> 1 <strong>9</strong>(1): 2-64<!--MARK-->","","Article in Journal","bb65542b-330d-43ab-9bd6-d712d09b9e96","20081009T05:11:37.000+0000","c12cd779-adb5-41ea-bd2c-75f6864cf22e"
"Matsubara, K. & Iwai, T.","1958","Results of the Amami Islands Expedition No. 2. A new apogonid fish, <i>Siphamia majimai</i>","603-608 figs 1-3","","Annals and Magazine of Natural History","","","","<!--MARK--><a href='nulldf912b25-3965-42b1-9bb4-76f627dd6326' class='mouseoverHref'>Matsubara, K. & Iwai, T. 1958. Results of the Amami Islands Expedition No. 2. A new apogonid fish, <i>Siphamia majimai</i>.</a> <!--MARK--><!--MARK--><a href='nullefa8de69-3a29-4a43-8ef2-cbefda205976' class='mouseoverHref'><em>Annals and Magazine of Natural History</em></a> 13 <strong>1</strong>(9): 603-608 figs 1-3<!--MARK-->","","Article in Journal","df912b25-3965-42b1-9bb4-76f627dd6326","20081009T05:11:37.000+0000","efa8de69-3a29-4a43-8ef2-cbefda205976"
"McCulloch, A.R.","1915","Report on some fishes obtained by the F.I.S. <i>Endeavour</i> on the coasts of Queensland, New South Wales, Victoria, Tasmania, South and South-Western Australia. Part 3","97-170 figs 1-3 pls 13-37","","Biological Results of the Fishing Experiments carried on by the F.I.S. Endeavour 1909-1914","","","","<!--MARK--><a href='null183ff5d0-9ef2-4e6a-8665-b235f0edc3ab' class='mouseoverHref'>McCulloch, A.R. 1915. Report on some fishes obtained by the F.I.S. <i>Endeavour</i> on the coasts of Queensland, New South Wales, Victoria, Tasmania, South and South-Western Australia. Part 3.</a> <!--MARK--><!--MARK--><a href='nulle1921535-dd4c-4b46-b4c7-76a17a70fc08' class='mouseoverHref'><em>Biological Results of the Fishing Experiments carried on by the F.I.S. Endeavour 1909-1914</em></a> <strong>3</strong>(3): 97-170 figs 1-3 pls 13-37<!--MARK-->","","Article in Journal","183ff5d0-9ef2-4e6a-8665-b235f0edc3ab","20081009T05:11:37.000+0000","e1921535-dd4c-4b46-b4c7-76a17a70fc08"
"McCulloch, A.R.","1921","Studies in Australian fishes, No. 7","123-142 pls 21-24","","Records of the Australian Museum","","","","<!--MARK--><a href='null46c29b0a-cc7f-40ad-af9a-00387c5e0db1' class='mouseoverHref'>McCulloch, A.R. 1921. Studies in Australian fishes, No. 7.</a> <!--MARK--><!--MARK--><a href='null7c07530b-0b38-44f5-8f95-368da97d6ac2' class='mouseoverHref'><em>Records of the Australian Museum</em></a> <strong>13</strong>(4): 123-142 pls 21-24<!--MARK-->","","Article in Journal","46c29b0a-cc7f-40ad-af9a-00387c5e0db1","20081009T05:11:37.000+0000","7c07530b-0b38-44f5-8f95-368da97d6ac2"
"McCulloch, A.R.","1929","A check-list of the fishes recorded from Australia. Part II","145-329","","Memoirs of the Australian Museum","","","","<!--MARK--><a href='nullf27925fa-c0dd-461b-95a4-9f80faed76bf' class='mouseoverHref'>McCulloch, A.R. 1929. A check-list of the fishes recorded from Australia. Part II.</a> <!--MARK--><!--MARK--><a href='null272826c2-c2bf-425b-bd6f-11ddaf2aaeaa' class='mouseoverHref'><em>Memoirs of the Australian Museum</em></a> <strong>5</strong>: 145-329<!--MARK-->","","Article in Journal","f27925fa-c0dd-461b-95a4-9f80faed76bf","20110331T13:51:19.162+0000","272826c2-c2bf-425b-bd6f-11ddaf2aaeaa"
"McDowall, R.M. (ed.)","1980","Freshwater Fishes of South-eastern Australia","208 pp., figs, 32 pls","","","","","A.H. & A.W. Reed","<!--MARK--><a href='null33362281-f2a0-4be5-8362-8cb349399c0c' class='mouseoverHref'>McDowall, R.M. (ed.) 1980. <em>Freshwater Fishes of South-eastern Australia</em>. Sydney : A.H. & A.W. Reed 208 pp., figs, 32 pls.</a><!--MARK-->","","Book","33362281-f2a0-4be5-8362-8cb349399c0c","20130716T08:46:02.636+0000",""
"Mees, G.F.","1966","A new fish of the family Apogonidae from tropical Western Australia","83-84 fig. 1","","Journal of the Royal Society of Western Australia","","","","<!--MARK--><a href='null83d1a812-10df-4109-9658-d8e43f4c304b' class='mouseoverHref'>Mees, G.F. 1966. A new fish of the family Apogonidae from tropical Western Australia.</a> <!--MARK--><!--MARK--><a href='null666efb8f-4a3f-4a3d-ae40-e9ab98f3cdf5' class='mouseoverHref'><em>Journal of the Royal Society of Western Australia</em></a> <strong>49</strong>(3): 83-84 fig. 1<!--MARK-->","","Article in Journal","83d1a812-10df-4109-9658-d8e43f4c304b","20081009T05:11:37.000+0000","666efb8f-4a3f-4a3d-ae40-e9ab98f3cdf5"
"Merrick, J.R. & Schmida, G.E.","1984","Australian Freshwater Fishes Biology and Management","409 pp. figs 280 col. figs","","","","","J.R. Merrick","<!--MARK--><a href='null6324890d-686a-4aef-9a8f-98a4f31eb4b6' class='mouseoverHref'>Merrick, J.R. & Schmida, G.E. 1984. <em>Australian Freshwater Fishes Biology and Management</em>. Sydney : J.R. Merrick 409 pp. figs 280 col. figs.</a><!--MARK-->","","Book","6324890d-686a-4aef-9a8f-98a4f31eb4b6","20081009T05:11:37.000+0000",""
