"PUB_AUTHOR","PUB_YEAR","PUB_TITLE","PUB_PAGES","PUB_PARENT_BOOK_TITLE","PUB_PARENT_JOURNAL_TITLE","PUB_PARENT_ARTICLE_TITLE","PUB_PUBLICATION_DATE","PUB_PUBLISHER","PUB_FORMATTED","PUB_QUALIFICATION","PUB_TYPE","PUBLICATION_GUID","PUBLICATION_LAST_UPDATE","PARENT_PUBLICATION_GUID"
"Morgan, D.L., Allen, G.R., Pusey, B.J. & Burrows, D.W.","2011","A review of the freshwater fishes of the Kimberley region of Western Australia","1-64","","Zootaxa","","","","<!--MARK--><a href='nullfff863db-c898-4bbd-b64a-48c7eded00ee' class='mouseoverHref'>Morgan, D.L., Allen, G.R., Pusey, B.J. & Burrows, D.W. 2011. A review of the freshwater fishes of the Kimberley region of Western Australia.</a> <!--MARK--><!--MARK--><a href='null96466227-221c-4922-ac97-1ac2dd946d0a' class='mouseoverHref'><em>Zootaxa</em></a> <strong>2816</strong>: 1-64<!--MARK-->","","Article in Journal","fff863db-c898-4bbd-b64a-48c7eded00ee","20130911T02:58:37.636+0000","96466227-221c-4922-ac97-1ac2dd946d0a"
"Morgan, D.L., Allen, M.G., Bedford, P. & Horstman, M.","2004","Fish fauna of the Fitzroy River in the Kimberley region of Western Australia - including the Bunuba, Gooniyandi, Ngarinyin, Nyikina and Walmajarii Aboriginal names","147-161","","Records of the Western Australian Museum","","","","<!--MARK--><a href='null80699286-7812-457b-a3b1-d09d33d6eafc' class='mouseoverHref'>Morgan, D.L., Allen, M.G., Bedford, P. & Horstman, M. 2004. Fish fauna of the Fitzroy River in the Kimberley region of Western Australia - including the Bunuba, Gooniyandi, Ngarinyin, Nyikina and Walmajarii Aboriginal names.</a> <!--MARK--><!--MARK--><a href='nulla2cbd1fb-97d5-493a-a1d7-c2b99709890b' class='mouseoverHref'><em>Records of the Western Australian Museum</em></a> <strong>22</strong>: 147-161<!--MARK-->","","Article in Journal","80699286-7812-457b-a3b1-d09d33d6eafc","20110502T02:06:52.679+0000","a2cbd1fb-97d5-493a-a1d7-c2b99709890b"
"Munro, I.S.R.","1961","Handbook of Australian fishes. Nos 1-42","1-172","","Australian Fisheries Newsletter","","","","<!--MARK--><a href='null491ef0a6-f49a-47db-88f2-19568e8d909e' class='mouseoverHref'>Munro, I.S.R. 1961. Handbook of Australian fishes. Nos 1-42.</a> <!--MARK--><!--MARK--><a href='null28aefeee-b072-40a1-94e1-6904271d8511' class='mouseoverHref'><em>Australian Fisheries Newsletter</em></a> <strong>15-17, 19, 20</strong>: 1-172<!--MARK--> [published as separates 1956-1961]","published as separates 1956-1961","Article in Journal","491ef0a6-f49a-47db-88f2-19568e8d909e","20081009T05:11:37.000+0000","28aefeee-b072-40a1-94e1-6904271d8511"
"Myers, R.F.","1999","Micronesian Reef Fishes. <i>A comprehensive guide to the coral reef fishes of Micronesia</i>","vi 330 pp. 192 pls","","","","","Coral Graphics","<!--MARK--><a href='nullb72f249f-9cce-4c73-a2e7-7238f88d259c' class='mouseoverHref'>Myers, R.F. 1999. <em>Micronesian Reef Fishes. <i>A comprehensive guide to the coral reef fishes of Micronesia</i></em>. Guam : Coral Graphics vi 330 pp. 192 pls.</a><!--MARK-->","","Book","b72f249f-9cce-4c73-a2e7-7238f88d259c","20081009T05:11:37.000+0000",""
"Ogilby, J.D.","1886","Exhibition of <i>Apogon (Apogonichthys) roseigaster</i> sp. nov","viii","","Abstracts of the Proceedings of the Linnean Society of New South Wales","","","","<!--MARK--><a href='null1be7e66e-8ebf-4f31-a18e-ab4edf3bbf76' class='mouseoverHref'>Ogilby, J.D. 1886. Exhibition of <i>Apogon (Apogonichthys) roseigaster</i> sp. nov.</a> <!--MARK--><!--MARK--><a href='null21706253-8101-4c67-8ea7-e411159543c4' class='mouseoverHref'><em>Abstracts of the Proceedings of the Linnean Society of New South Wales</em></a> <strong>1886</strong>: viii<!--MARK--> [Oct. 27]","Oct. 27","Article in Journal","1be7e66e-8ebf-4f31-a18e-ab4edf3bbf76","20081009T05:11:37.000+0000","21706253-8101-4c67-8ea7-e411159543c4"
"Ogilby, J.D.","1888","On a small zoological collection from Norfolk Island. Fishes","990-993","","Proceedings of the Linnean Society of New South Wales","","","","<!--MARK--><a href='null58d83951-f755-4358-804a-87880c2e8e91' class='mouseoverHref'>Ogilby, J.D. 1888. On a small zoological collection from Norfolk Island. Fishes.</a> <!--MARK--><!--MARK--><a href='nullc12cd779-adb5-41ea-bd2c-75f6864cf22e' class='mouseoverHref'><em>Proceedings of the Linnean Society of New South Wales</em></a> 2 <strong>2</strong>(4): 990-993<!--MARK-->","","Article in Journal","58d83951-f755-4358-804a-87880c2e8e91","20081009T05:11:37.000+0000","c12cd779-adb5-41ea-bd2c-75f6864cf22e"
"Ogilby, J.D.","1889","The reptiles and fishes of Lord Howe Island","51-74 pls 2-3","","Memoirs of the Australian Museum","","","","<!--MARK--><a href='null01d8f5cd-f12c-4636-9a38-cab7de05e1b7' class='mouseoverHref'>Ogilby, J.D. 1889. The reptiles and fishes of Lord Howe Island.</a> <!--MARK--><!--MARK--><a href='null272826c2-c2bf-425b-bd6f-11ddaf2aaeaa' class='mouseoverHref'><em>Memoirs of the Australian Museum</em></a> <strong>2</strong>(3): 51-74 pls 2-3<!--MARK-->","","Article in Journal","01d8f5cd-f12c-4636-9a38-cab7de05e1b7","20081009T05:11:37.000+0000","272826c2-c2bf-425b-bd6f-11ddaf2aaeaa"
"Ogilby, J.D.","1908","On new genera and species of fishes","1-26","","Proceedings of the Royal Society of Queensland","","","","<!--MARK--><a href='nulla3c42a69-6d23-48ce-aac3-e1f6d1cd567e' class='mouseoverHref'>Ogilby, J.D. 1908. On new genera and species of fishes.</a> <!--MARK--><!--MARK--><a href='null642ab613-813a-48d0-8bc0-42c78157f7b0' class='mouseoverHref'><em>Proceedings of the Royal Society of Queensland</em></a> <strong>21</strong>: 1-26<!--MARK-->","","Article in Journal","a3c42a69-6d23-48ce-aac3-e1f6d1cd567e","20081009T05:11:37.000+0000","642ab613-813a-48d0-8bc0-42c78157f7b0"
"Ogilby, J.D.","1911","Descriptions of new or insufficiently described fishes from Queensland waters","36-58 figs 5-6","","Annals of the Queensland Museum","","","","<!--MARK--><a href='null69385f28-2a2a-4fb6-a374-870ecd9d747d' class='mouseoverHref'>Ogilby, J.D. 1911. Descriptions of new or insufficiently described fishes from Queensland waters.</a> <!--MARK--><!--MARK--><a href='nulle992938b-40e3-4f55-97a8-868219a55b45' class='mouseoverHref'><em>Annals of the Queensland Museum</em></a> <strong>10</strong>: 36-58 figs 5-6<!--MARK-->","","Article in Journal","69385f28-2a2a-4fb6-a374-870ecd9d747d","20081009T05:11:37.000+0000","e992938b-40e3-4f55-97a8-868219a55b45"
"Ogilby, J.D.","1913","On six new or rare Queensland fishes","81-89 figs 21-23","","Memoirs of the Queensland Museum","","","","<!--MARK--><a href='null9128ee5c-c877-477b-8a21-0dbc5c5c77cc' class='mouseoverHref'>Ogilby, J.D. 1913. On six new or rare Queensland fishes.</a> <!--MARK--><!--MARK--><a href='null1a0a2982-9f30-43e1-a641-b0379699837c' class='mouseoverHref'><em>Memoirs of the Queensland Museum</em></a> <strong>2</strong>: 81-89 figs 21-23<!--MARK-->","","Article in Journal","9128ee5c-c877-477b-8a21-0dbc5c5c77cc","20081009T05:11:37.000+0000","1a0a2982-9f30-43e1-a641-b0379699837c"
"Ogilby, J.D.","1916","Note on <i>Amia nigripes</i>, Ogilby","116","","Proceedings of the Royal Society of Queensland","","","","<!--MARK--><a href='null06d85f01-a9af-4945-9ac9-a79539ef4f99' class='mouseoverHref'>Ogilby, J.D. 1916. Note on <i>Amia nigripes</i>, Ogilby.</a> <!--MARK--><!--MARK--><a href='null642ab613-813a-48d0-8bc0-42c78157f7b0' class='mouseoverHref'><em>Proceedings of the Royal Society of Queensland</em></a> <strong>28</strong>: 116<!--MARK-->","","Article in Journal","06d85f01-a9af-4945-9ac9-a79539ef4f99","20081009T05:11:37.000+0000","642ab613-813a-48d0-8bc0-42c78157f7b0"
"Oxley, W.G., Ayling, A.M., Cheal, A.J. & Osborne, K.","2004","Marine surveys undertaken in the Elizabeth and Middleton Reefs Marine National Nature Reserve, December 2003","64","","","","","Australian Institute of Marine Sciences","<!--MARK--><a href='null7ed6298b-c91f-4319-b98f-896da8be9d11' class='mouseoverHref'>Oxley, W.G., Ayling, A.M., Cheal, A.J. & Osborne, K. 2004. <em>Marine surveys undertaken in the Elizabeth and Middleton Reefs Marine National Nature Reserve, December 2003</em>. Townsville : Australian Institute of Marine Sciences 64 pp.</a><!--MARK-->","","Book","7ed6298b-c91f-4319-b98f-896da8be9d11","20081009T05:11:37.000+0000",""
"Oxley, W.G., Ayling, A.M., Cheal, A.J. & Thompson, A.A.","2003","Marine surveys undertaken in the Coringa-Herald National Nature Reserve, March-April 2003","59 pp.","","","","","Australian Institute of Marine Science","<!--MARK--><a href='nulla3f24cdd-d280-45eb-a690-c0df31a3f859' class='mouseoverHref'>Oxley, W.G., Ayling, A.M., Cheal, A.J. & Thompson, A.A. 2003. <em>Marine surveys undertaken in the Coringa-Herald National Nature Reserve, March-April 2003</em>. Townsville : Australian Institute of Marine Science 59 pp.</a><!--MARK-->","","Book","a3f24cdd-d280-45eb-a690-c0df31a3f859","20121203T02:09:59.621+0000",""
"Oxley, W.G., Emslie, M., Muir, P. & Thompson, A.A.","2004","Marine surveys undertaken in the Lihou Reef National Nature Reserve, March 2004","i-vii, 1-67 pp.","","","","","Australian Institute of Marine Science","<!--MARK--><a href='null582681dd-61e5-4139-bba5-ec519f4c6ad7' class='mouseoverHref'>Oxley, W.G., Emslie, M., Muir, P. & Thompson, A.A. 2004. <em>Marine surveys undertaken in the Lihou Reef National Nature Reserve, March 2004</em>. Townsville : Australian Institute of Marine Science i-vii, 1-67 pp.</a><!--MARK-->","","Book","582681dd-61e5-4139-bba5-ec519f4c6ad7","20121203T02:15:44.167+0000",""
"Paxton, J.R., Hoese, D.F., Allen, G.R. & Hanley, J.E. (eds)","1989","Zoological Catalogue of Australia. Pisces: Petromyzontidae to Carangidae","665 pp.","","","","","Australian Government Publishing Service","<!--MARK--><a href='nullcfef21f5-ff30-40b6-968c-37f5d1b0fcb4' class='mouseoverHref'>Paxton, J.R., Hoese, D.F., Allen, G.R. & Hanley, J.E. (eds) 1989. <em>Zoological Catalogue of Australia. Pisces: Petromyzontidae to Carangidae</em>. Canberra : Australian Government Publishing Service Vol. 7 665 pp.</a><!--MARK-->","","Book","cfef21f5-ff30-40b6-968c-37f5d1b0fcb4","20081009T05:11:37.000+0000",""
"Peters, W.C.H.","1876","Übersicht der von Hrn. Prof. Dr. K. Möbius in Mauritius und bei den Seychellen gesammelten Fische","435-447","","Monatsberichte der Königlichen Preussischen Akademie der Wissenschaften zu Berlin","","","","<!--MARK--><a href='nullad0bfb3a-cefb-49d0-976a-8535894826f0' class='mouseoverHref'>Peters, W.C.H. 1876. Übersicht der von Hrn. Prof. Dr. K. Möbius in Mauritius und bei den Seychellen gesammelten Fische.</a> <!--MARK--><!--MARK--><a href='nullc55e435f-2529-4caf-8a6b-76e58b9412c8' class='mouseoverHref'><em>Monatsberichte der Königlichen Preussischen Akademie der Wissenschaften zu Berlin</em></a> <strong>1876</strong>: 435-447<!--MARK-->","","Article in Journal","ad0bfb3a-cefb-49d0-976a-8535894826f0","20081009T05:11:37.000+0000","c55e435f-2529-4caf-8a6b-76e58b9412c8"
"Pollard, D.A.","1996","Family Apogonidae","pp. 181-182","Freshwater Fishes of South-eastern Australia","","","","","<!--MARK--><a href='nullb1064d61-15cc-42c6-8a2c-3efc0ace9898' class='mouseoverHref'>Pollard, D.A. 1996. Family Apogonidae. pp. 181-182</a> <!--MARK--><em>in</em> <!--MARK--><a href='null67ff2ab4-cd78-47b7-8a56-0b9412a172c5' class='mouseoverHref'>McDowall, R.M. (ed.). <em>Freshwater Fishes of South-eastern Australia</em>. Sydney : Reed Books 247 pp.</a><!--MARK-->","","Chapter in Book","b1064d61-15cc-42c6-8a2c-3efc0ace9898","20120322T05:58:50.502+0000","67ff2ab4-cd78-47b7-8a56-0b9412a172c5"
"Pollard, J. (ed.)","1980","G.P. Whitley's Handbook of Australian Fishes","629 pp.","","","","","Jack Pollard Publishing Pty Ltd","<!--MARK--><a href='null50d19202-a17e-4885-bb5b-2932e8413206' class='mouseoverHref'>Pollard, J. (ed.) 1980. <em>G.P. Whitley's Handbook of Australian Fishes</em>. North Sydney : Jack Pollard Publishing Pty Ltd 629 pp.</a><!--MARK-->","","Book","50d19202-a17e-4885-bb5b-2932e8413206","20081009T05:11:37.000+0000",""
"Prokop, F.","2002","Australian Fish Guide","256 pp.","","","","","Australian Fishing Network","<!--MARK--><a href='null1eece4ac-1178-4f82-91e2-d1c0b64b0841' class='mouseoverHref'>Prokop, F. 2002. <em>Australian Fish Guide</em>. Croydon South, Victoria : Australian Fishing Network 256 pp.</a><!--MARK-->","","Book","1eece4ac-1178-4f82-91e2-d1c0b64b0841","20081009T05:11:37.000+0000",""
"Pusey, B.J., Kennard, M.J. & Arthington, A.H.","2004","Freshwater Fishes of North-eastern Australia","684 pp.","","","","","CSIRO Publishing","<!--MARK--><a href='null1f897ed6-3fe4-4dce-b9a9-cb6f89eb7df6' class='mouseoverHref'>Pusey, B.J., Kennard, M.J. & Arthington, A.H. 2004. <em>Freshwater Fishes of North-eastern Australia</em>. Collingwood, Victoria : CSIRO Publishing 684 pp.</a><!--MARK-->","","Book","1f897ed6-3fe4-4dce-b9a9-cb6f89eb7df6","20081009T05:11:37.000+0000",""
"Pusey, B.J., Kennard, M.J. & Bird, J.","2000","Fishes of the dune fields of Cape Flattery, northern Queensland and other dune systems in north-eastern Australia","65-74","","Ichthyological Explorations of Freshwater","","","","<!--MARK--><a href='nullaf83e5f0-ebad-46c6-bda7-57c3bcd70bc7' class='mouseoverHref'>Pusey, B.J., Kennard, M.J. & Bird, J. 2000. Fishes of the dune fields of Cape Flattery, northern Queensland and other dune systems in north-eastern Australia.</a> <!--MARK--><!--MARK--><a href='null47ae911d-cd5a-4aba-b6c8-bc4cb06267b9' class='mouseoverHref'><em>Ichthyological Explorations of Freshwater</em></a> <strong>11</strong>(1): 65-74<!--MARK-->","","Article in Journal","af83e5f0-ebad-46c6-bda7-57c3bcd70bc7","20081009T05:11:37.000+0000","47ae911d-cd5a-4aba-b6c8-bc4cb06267b9"
"Quoy, J.R.C. & Gaimard, J.P.","1825","Chapter 9. Poissons","pp. 329-401 pls 43-65","Voyage Autour du Monde, entrepris par orde du Roi, sous le Ministère et conformément aux instructions de S. Exc. M. le Vicomte de Boucharge, secrétaire d'État au Département de la Marine exécuté sur les corvettes de S.M. <i>l'Uranie</i> et <i>la Physicienne</i>, pendent les années 1817, 1818, 1819 et 1820; publié sous les auspices de S.E.M. le Conte Corbière, secrétaire d'État de l'Intérieur, pour la partie historique et les sciences naturelles, et de S.E.M. le Marquis de Clermont-Tonnerre, Secrétaire d'État de la Marine et des Colonies, pour la partie nautique; par M. Louis Freycinet, etc","","","","","<!--MARK--><a href='nulldf2f065b-6c01-4d6b-8e13-391539b676cb' class='mouseoverHref'>Quoy, J.R.C. & Gaimard, J.P. 1825. Chapter 9. Poissons. pp. 329-401 pls 43-65</a> <!--MARK--><em>in</em> <!--MARK--><a href='null001eb0ce-7926-4f26-b407-bd8db2a72f65' class='mouseoverHref'>Freycinet, L.C.D. de (ed.). <em>Voyage Autour du Monde, entrepris par orde du Roi, sous le Ministère et conformément aux instructions de S. Exc. M. le Vicomte de Boucharge, secrétaire d'État au Département de la Marine exécuté sur les corvettes de S.M. <i>l'Uranie</i> et <i>la Physicienne</i>, pendent les années 1817, 1818, 1819 et 1820; publié sous les auspices de S.E.M. le Conte Corbière, secrétaire d'État de l'Intérieur, pour la partie historique et les sciences naturelles, et de S.E.M. le Marquis de Clermont-Tonnerre, Secrétaire d'État de la Marine et des Colonies, pour la partie nautique; par M. Louis Freycinet, etc</em>. Paris : Pillet Aîné Vol. 1 + atlas iv 712 pp.</a><!--MARK--><!--MARK--> [published in parts Sherborn, C.D. & Woodward, B.B. 1901. Notes on the dates of publication of the natural history portions of some French voyages. Part I. Amérique meridionale; Indes orientales; Pôle Sud (<I>Astrolabe </I>and <I>Zélée</I>); <I>La Bonite</I>; <I>La Coquille</I>; and <I>L'Uranie </I>et <I>La Physcienne</I>. <em>Annals and Magazine of Natural History</em> <strong>7</strong>(7): 388-392 [392]]","published in parts Sherborn, C.D. & Woodward, B.B. 1901. Notes on the dates of publication of the natural history portions of some French voyages. Part I. Amérique meridionale; Indes orientales; Pôle Sud (<I>Astrolabe </I>and <I>Zélée</I>); <I>La Bonite</I>; <I>La Coquille</I>; and <I>L'Uranie </I>et <I>La Physcienne</I>. <em>Annals and Magazine of Natural History</em> <strong>7</strong>(7): 388-392 [392]","Chapter in Book","df2f065b-6c01-4d6b-8e13-391539b676cb","20150408T22:12:04.470+0000","001eb0ce-7926-4f26-b407-bd8db2a72f65"
"Ramsay, E.P. & Ogilby, J.D.","1887","Description of a new Australian Fish. Notes from the Australian Museum","1101-1102","","Proceedings of the Linnean Society of New South Wales","","22 Feb. 1887","","<!--MARK--><a href='nullaaa95b35-fd42-42c4-a766-01bbfbd333f7' class='mouseoverHref'>Ramsay, E.P. & Ogilby, J.D. 1887. Description of a new Australian Fish. Notes from the Australian Museum.</a> <!--MARK--><!--MARK--><a href='nullc12cd779-adb5-41ea-bd2c-75f6864cf22e' class='mouseoverHref'><em>Proceedings of the Linnean Society of New South Wales</em></a> 2 <strong>1</strong>: 1101-1102<!--MARK--> [Date published 22 Feb. 1887]","","Article in Journal","aaa95b35-fd42-42c4-a766-01bbfbd333f7","20081009T05:11:37.000+0000","c12cd779-adb5-41ea-bd2c-75f6864cf22e"
"Randall, J.E.","1995","Coastal Fishes of Oman","439 pp.","","","","","Crawford House Publishing","<!--MARK--><a href='null6497dfc9-3dd7-474c-9233-f1468756aed7' class='mouseoverHref'>Randall, J.E. 1995. <em>Coastal Fishes of Oman</em>. Bathurst : Crawford House Publishing 439 pp.</a><!--MARK-->","","Book","6497dfc9-3dd7-474c-9233-f1468756aed7","20081009T05:11:37.000+0000",""
"Randall, J.E.","1998","Review of the cardinalfishes (Apogonidae) of the Hawaiian Islands, with descriptions of two new species","25-38","","Aqua, Journal of Ichthyology and Aquatic Biology","","","","<!--MARK--><a href='null9406bef6-c10b-406d-bd21-8650e2a280e9' class='mouseoverHref'>Randall, J.E. 1998. Review of the cardinalfishes (Apogonidae) of the Hawaiian Islands, with descriptions of two new species.</a> <!--MARK--><!--MARK--><a href='null18ef42ff-f4e9-4fef-b478-d5db6753e0f1' class='mouseoverHref'><em>Aqua, Journal of Ichthyology and Aquatic Biology</em></a> <strong>3</strong>(1): 25-38<!--MARK-->","","Article in Journal","9406bef6-c10b-406d-bd21-8650e2a280e9","20081009T05:11:37.000+0000","18ef42ff-f4e9-4fef-b478-d5db6753e0f1"
"Randall, J.E.","2005","Reef and shore fishes of the South Pacific. New Caledonia to Tahiti and the Pitcairn Islands","707","","","","","University of Hawaii Press","<!--MARK--><a href='null571a982f-3e61-41bc-a958-ecb6f2206fa9' class='mouseoverHref'>Randall, J.E. 2005. <em>Reef and shore fishes of the South Pacific. New Caledonia to Tahiti and the Pitcairn Islands</em>. Honolulu : University of Hawaii Press 707 pp.</a><!--MARK-->","","Book","571a982f-3e61-41bc-a958-ecb6f2206fa9","20110630T01:28:14.087+0000",""
"Randall, J.E.","2007","Reef and shore fishes of the Hawaiian Islands.","546 pp.","","","","","University of Hawai'i","<!--MARK--><a href='nullb931ca58-3027-42e8-92d5-276e1b616df8' class='mouseoverHref'>Randall, J.E. 2007. <em>Reef and shore fishes of the Hawaiian Islands</em>. Honolulu : University of Hawai'i 546 pp.</a><!--MARK-->","","Book","b931ca58-3027-42e8-92d5-276e1b616df8","20120122T06:57:55.718+0000",""
"Randall, J.E., Allen, G.R. & Steene, R.","1990","Fishes of the Great Barrier Reef and Coral Sea","507 pp. figs","","","","","Crawford House Press","<!--MARK--><a href='null08d31a5e-6d62-4e5d-adea-178df860e12b' class='mouseoverHref'>Randall, J.E., Allen, G.R. & Steene, R. 1990. <em>Fishes of the Great Barrier Reef and Coral Sea</em>. Bathurst : Crawford House Press 507 pp. figs.</a><!--MARK-->","","Book","08d31a5e-6d62-4e5d-adea-178df860e12b","20081009T05:11:37.000+0000",""
"Randall, J.E., Allen, G.R. & Steene, R.","1997","Fishes of the Great Barrier Reef and Coral Sea","557 pp. figs","","","","","Crawford House Press","<!--MARK--><a href='nullcb0f1f78-3a73-429d-9ff3-b0223426e4a5' class='mouseoverHref'>Randall, J.E., Allen, G.R. & Steene, R. 1997. <em>Fishes of the Great Barrier Reef and Coral Sea</em>. Bathurst : Crawford House Press 557 pp. figs.</a><!--MARK-->","","Book","cb0f1f78-3a73-429d-9ff3-b0223426e4a5","20081009T05:11:37.000+0000",""
"Randall, J.E., Fraser, T.H. & Lachner, E.A.","1990","On the validity of the Indo-Pacific cardinalfishes <i>Apogon aureus</i> (Lacépède) and <i>A. fleurieu</i> (Lacepède), with description of a related new species from the Red Sea","39-62","","Proceedings of the Biological Society of Washington","","","","<!--MARK--><a href='null0ec925b9-f0c7-4801-b917-4c5bb29071cf' class='mouseoverHref'>Randall, J.E., Fraser, T.H. & Lachner, E.A. 1990. On the validity of the Indo-Pacific cardinalfishes <i>Apogon aureus</i> (Lacépède) and <i>A. fleurieu</i> (Lacepède), with description of a related new species from the Red Sea.</a> <!--MARK--><!--MARK--><a href='null4153f314-120d-40d7-987b-b5ba47399aec' class='mouseoverHref'><em>Proceedings of the Biological Society of Washington</em></a> <strong>103</strong>(1): 39-62<!--MARK-->","","Article in Journal","0ec925b9-f0c7-4801-b917-4c5bb29071cf","20081009T05:11:37.000+0000","4153f314-120d-40d7-987b-b5ba47399aec"
"Randall, J.E., Lachner, E.A. & Fraser, T.H.","1985","A revision of the Indo-Pacific apogonid fish genus <i>Pseudamia</i>, with descriptions of three new species","1-23 pl. 1","","Indo-Pacific Fishes","","","","<!--MARK--><a href='null0646015f-f2f7-46bc-a472-01acc69fba89' class='mouseoverHref'>Randall, J.E., Lachner, E.A. & Fraser, T.H. 1985. A revision of the Indo-Pacific apogonid fish genus <i>Pseudamia</i>, with descriptions of three new species.</a> <!--MARK--><!--MARK--><a href='null83fffb81-8750-4f13-8456-f3958ae86fa4' class='mouseoverHref'><em>Indo-Pacific Fishes</em></a> <strong>6</strong>: 1-23 pl. 1<!--MARK-->","","Article in Journal","0646015f-f2f7-46bc-a472-01acc69fba89","20081009T05:11:37.000+0000","83fffb81-8750-4f13-8456-f3958ae86fa4"
"Randall, J.E. & C.L. Smith","1988","Two new species and a new genus of cardinalfishes (Perciformes: Apogonidae) from Rapa, South Pacific Ocean","1-9","","American Museum Novitates","","","","<!--MARK--><a href='null85f8dda4-b530-41cd-8a2a-b930775ef44b' class='mouseoverHref'>Randall, J.E. & C.L. Smith 1988. Two new species and a new genus of cardinalfishes (Perciformes: Apogonidae) from Rapa, South Pacific Ocean.</a> <!--MARK--><!--MARK--><a href='null6502b0bb-309f-414e-9d7f-4cb7a3619a03' class='mouseoverHref'><em>American Museum Novitates</em></a> <strong>2926</strong>: 1-9<!--MARK-->","","Article in Journal","85f8dda4-b530-41cd-8a2a-b930775ef44b","20081009T05:11:37.000+0000","6502b0bb-309f-414e-9d7f-4cb7a3619a03"
"Randall, J.E. & Fraser, T.H.","1999","Clarification of the western Pacific cardinalfish species <i>Apogon trimculatus</i> and <i>A. rhodopterus</i>, with description of a similar new species","617-633 figs 1-5 pls 1-3","","Raffles Bulletin of Zoology","","","","<!--MARK--><a href='null79f462a8-5646-42f8-8d89-ae4fe7d7d502' class='mouseoverHref'>Randall, J.E. & Fraser, T.H. 1999. Clarification of the western Pacific cardinalfish species <i>Apogon trimculatus</i> and <i>A. rhodopterus</i>, with description of a similar new species.</a> <!--MARK--><!--MARK--><a href='null3c03026c-b1e6-4f12-ab66-78ad1150b627' class='mouseoverHref'><em>Raffles Bulletin of Zoology</em></a> <strong>47</strong>(2): 617-633 figs 1-5 pls 1-3<!--MARK-->","","Article in Journal","79f462a8-5646-42f8-8d89-ae4fe7d7d502","20081009T05:11:37.000+0000","3c03026c-b1e6-4f12-ab66-78ad1150b627"
"Randall, J.E. & Hayashi, M.","1990","<i>Apogon selas</i>, a new cardinalfish from the western Pacific","399-403","","Japanese Journal of Ichthyology","","","","<!--MARK--><a href='null4f5665b3-bafa-4897-b1da-d7d80c9f57d7' class='mouseoverHref'>Randall, J.E. & Hayashi, M. 1990. <i>Apogon selas</i>, a new cardinalfish from the western Pacific.</a> <!--MARK--><!--MARK--><a href='null781f1ceb-ad10-4775-80b6-40acb3197155' class='mouseoverHref'><em>Japanese Journal of Ichthyology</em></a> <strong>36</strong>(4): 399-403<!--MARK-->","","Article in Journal","4f5665b3-bafa-4897-b1da-d7d80c9f57d7","20081009T05:11:37.000+0000","781f1ceb-ad10-4775-80b6-40acb3197155"
"Randall, J.E. & Hoese, D.F.","1988","<i>Apogon limenus</i>, a new species of cardinalfish (Perciformes: Apogonidae) from New South Wales","359-364","","Records of the Australian Museum","","","","<!--MARK--><a href='nullf4097e38-dee7-4f8b-a06e-38e860b1a939' class='mouseoverHref'>Randall, J.E. & Hoese, D.F. 1988. <i>Apogon limenus</i>, a new species of cardinalfish (Perciformes: Apogonidae) from New South Wales.</a> <!--MARK--><!--MARK--><a href='null7c07530b-0b38-44f5-8f95-368da97d6ac2' class='mouseoverHref'><em>Records of the Australian Museum</em></a> <strong>40</strong>: 359-364<!--MARK-->","","Article in Journal","f4097e38-dee7-4f8b-a06e-38e860b1a939","20081009T05:11:37.000+0000","7c07530b-0b38-44f5-8f95-368da97d6ac2"
"Randall, J.E. & Kulbicki, M.","1998","Two new cardinalfishes (Perciformes: Apogonidae) of the <i>Apogon cyanosoma</i> complex from the western Pacific, with notes on the status of <i>A. wassinki</i> Bleeker","31-39","","Revue Française d'Aquariologie et Herpétologie","","","","<!--MARK--><a href='null81db5475-e460-422a-8a86-d51298938290' class='mouseoverHref'>Randall, J.E. & Kulbicki, M. 1998. Two new cardinalfishes (Perciformes: Apogonidae) of the <i>Apogon cyanosoma</i> complex from the western Pacific, with notes on the status of <i>A. wassinki</i> Bleeker.</a> <!--MARK--><!--MARK--><a href='nullbb9f1b45-3680-4962-91e4-f26c029236ec' class='mouseoverHref'><em>Revue Française d'Aquariologie et Herpétologie</em></a> <strong>1-2</strong>: 31-39<!--MARK-->","","Article in Journal","81db5475-e460-422a-8a86-d51298938290","20081009T05:11:37.000+0000","bb9f1b45-3680-4962-91e4-f26c029236ec"
