"PUB_AUTHOR","PUB_YEAR","PUB_TITLE","PUB_PAGES","PUB_PARENT_BOOK_TITLE","PUB_PARENT_JOURNAL_TITLE","PUB_PARENT_ARTICLE_TITLE","PUB_PUBLICATION_DATE","PUB_PUBLISHER","PUB_FORMATTED","PUB_QUALIFICATION","PUB_TYPE","PUBLICATION_GUID","PUBLICATION_LAST_UPDATE","PARENT_PUBLICATION_GUID"
"Fowler, H.W. & Bean, B.A.","1930","Contributions to the biology of the Philippine Archipelago and adjacent regions. The fishes of the families Amiidae, Chandidae, Duleidae and Serranidae, obtained by the United States Bureau of Fisheries Steamer <i>Albatross</i>, in 1907 to 1910, chiefly in the Philippine Islands and adjacent seas","1-334 figs 1-27","","Bulletin of the United States National Museum","","","","<!--MARK--><a href='nullc23f9533-c7b2-4b09-82f6-4b504ae7484e' class='mouseoverHref'>Fowler, H.W. & Bean, B.A. 1930. Contributions to the biology of the Philippine Archipelago and adjacent regions. The fishes of the families Amiidae, Chandidae, Duleidae and Serranidae, obtained by the United States Bureau of Fisheries Steamer <i>Albatross</i>, in 1907 to 1910, chiefly in the Philippine Islands and adjacent seas.</a> <!--MARK--><!--MARK--><a href='nulld62694e9-c583-45e9-aa41-f40b5d5fc778' class='mouseoverHref'><em>Bulletin of the United States National Museum</em></a> <strong>100</strong>(10): 1-334 figs 1-27<!--MARK-->","","Article in Journal","c23f9533-c7b2-4b09-82f6-4b504ae7484e","20081009T05:11:37.000+0000","d62694e9-c583-45e9-aa41-f40b5d5fc778"
"Francis, M.","1993","Checklist of the coastal fishes of Lord Howe, Norfolk, and Kermadec Islands, southwest Pacific Ocean","136-170 figs 1-2","","Pacific Science","","","","<!--MARK--><a href='nullce4078fc-e165-4867-83e4-a1a48dd29d6a' class='mouseoverHref'>Francis, M. 1993. Checklist of the coastal fishes of Lord Howe, Norfolk, and Kermadec Islands, southwest Pacific Ocean.</a> <!--MARK--><!--MARK--><a href='nullcc032c8b-89bc-474b-8046-90fbdaad884c' class='mouseoverHref'><em>Pacific Science</em></a> <strong>47</strong>(2): 136-170 figs 1-2<!--MARK-->","","Article in Journal","ce4078fc-e165-4867-83e4-a1a48dd29d6a","20081009T05:11:37.000+0000","cc032c8b-89bc-474b-8046-90fbdaad884c"
"Fraser, T.","2006","A new species of cardinalfish (Perciformes: Apogonidae: <i>Apogon</i>) from New Caledonia, with comments and a key to related species","137-142","","Proceedings of the Biological Society of Washington","","","","<!--MARK--><a href='null57e37c83-8368-4e0a-a88e-1e9baab27c15' class='mouseoverHref'>Fraser, T. 2006. A new species of cardinalfish (Perciformes: Apogonidae: <i>Apogon</i>) from New Caledonia, with comments and a key to related species.</a> <!--MARK--><!--MARK--><a href='null4153f314-120d-40d7-987b-b5ba47399aec' class='mouseoverHref'><em>Proceedings of the Biological Society of Washington</em></a> <strong>119</strong>(1): 137-142<!--MARK-->","","Article in Journal","57e37c83-8368-4e0a-a88e-1e9baab27c15","20081009T05:11:37.000+0000","4153f314-120d-40d7-987b-b5ba47399aec"
"Fraser, T.H.","1972","Comparative osteology of the shallow water cardinal fishes (Perciformes : Apogonidae) with reference to the systematics and evolution of the family","1-105 44 pls","","Ichthyological Bulletin of the J.L.B. Smith Institute, Grahamstown","","","","<!--MARK--><a href='null0546ff65-f84a-4baa-b2b4-a679eaf4bd5b' class='mouseoverHref'>Fraser, T.H. 1972. Comparative osteology of the shallow water cardinal fishes (Perciformes : Apogonidae) with reference to the systematics and evolution of the family.</a> <!--MARK--><!--MARK--><a href='null5284a2b9-8a72-4f17-ad2d-ed17f7048e0a' class='mouseoverHref'><em>Ichthyological Bulletin of the J.L.B. Smith Institute, Grahamstown</em></a> <strong>34</strong>: 1-105 44 pls<!--MARK-->","","Article in Journal","0546ff65-f84a-4baa-b2b4-a679eaf4bd5b","20081009T05:11:37.000+0000","5284a2b9-8a72-4f17-ad2d-ed17f7048e0a"
"Fraser, T.H.","1998","A new species of cardinalfish (Apogonidae) from the Philippines, with comments on species of <i>Apogon</i> with six first dorsal spines","986-991","","Proceedings of the Biological Society of Washington","","","","<!--MARK--><a href='nullda61c8e0-034c-437e-b4e5-fa2b18b80a95' class='mouseoverHref'>Fraser, T.H. 1998. A new species of cardinalfish (Apogonidae) from the Philippines, with comments on species of <i>Apogon</i> with six first dorsal spines.</a> <!--MARK--><!--MARK--><a href='null4153f314-120d-40d7-987b-b5ba47399aec' class='mouseoverHref'><em>Proceedings of the Biological Society of Washington</em></a> <strong>111</strong>(4): 986-991<!--MARK-->","","Article in Journal","da61c8e0-034c-437e-b4e5-fa2b18b80a95","20081009T05:11:37.000+0000","4153f314-120d-40d7-987b-b5ba47399aec"
"Fraser, T.H.","2005","A review of the species in the <i>Apogon fasciatus</i> group with a description of a new species of Cardinalfish from the Indo-West Pacific (Perciformes: Apogonidae)","1-30","","Zootaxa","","","","<!--MARK--><a href='null8f2cc67d-eb2a-49c2-8932-d639f15d57dd' class='mouseoverHref'>Fraser, T.H. 2005. A review of the species in the <i>Apogon fasciatus</i> group with a description of a new species of Cardinalfish from the Indo-West Pacific (Perciformes: Apogonidae).</a> <!--MARK--><!--MARK--><a href='null96466227-221c-4922-ac97-1ac2dd946d0a' class='mouseoverHref'><em>Zootaxa</em></a> <strong>924</strong>: 1-30<!--MARK-->","","Article in Journal","8f2cc67d-eb2a-49c2-8932-d639f15d57dd","20081009T05:11:37.000+0000","96466227-221c-4922-ac97-1ac2dd946d0a"
"Fraser, T.H.","2008","Cardinalfishes of the genus <i>Nectamia</i> (Apogonidae, Perciformes) from the Indo-Pacific region with descriptions of four new species","1-52","","Zootaxa","","","","<!--MARK--><a href='null56d8063c-6adb-4cb3-8a66-d0337e21d9f2' class='mouseoverHref'>Fraser, T.H. 2008. Cardinalfishes of the genus <i>Nectamia</i> (Apogonidae, Perciformes) from the Indo-Pacific region with descriptions of four new species.</a> <!--MARK--><!--MARK--><a href='null96466227-221c-4922-ac97-1ac2dd946d0a' class='mouseoverHref'><em>Zootaxa</em></a> <strong>1691</strong>: 1-52<!--MARK-->","","Article in Journal","56d8063c-6adb-4cb3-8a66-d0337e21d9f2","20081009T05:11:37.000+0000","96466227-221c-4922-ac97-1ac2dd946d0a"
"Fraser, T.H.","2010","A new deepwater species of the genus <i>Apogonichthyoides</i> (Apodonidae) from the Timor Sea, north-western Australia","93-100","","Aqua, Journal of Ichthyology and Aquatic Biology","","","","<!--MARK--><a href='null9db9c796-30d6-4cac-9942-baee70ebf5f6' class='mouseoverHref'>Fraser, T.H. 2010. A new deepwater species of the genus <i>Apogonichthyoides</i> (Apodonidae) from the Timor Sea, north-western Australia.</a> <!--MARK--><!--MARK--><a href='null18ef42ff-f4e9-4fef-b478-d5db6753e0f1' class='mouseoverHref'><em>Aqua, Journal of Ichthyology and Aquatic Biology</em></a> <strong>16</strong>: 93-100<!--MARK-->","","Article in Journal","9db9c796-30d6-4cac-9942-baee70ebf5f6","20110112T22:55:59.676+0000","18ef42ff-f4e9-4fef-b478-d5db6753e0f1"
"Fraser, T.H.","2012","A new species of deeper dwelling West Pacific cardinalfish (Percomorpha: Apogonidae) with a redescription of <I>Ostorhinchus atrogaster</I>","77-84","","Zootaxa","","","","<!--MARK--><a href='null07d6681c-d00f-4dc2-9f8e-6ff488a7ad7d' class='mouseoverHref'>Fraser, T.H. 2012. A new species of deeper dwelling West Pacific cardinalfish (Percomorpha: Apogonidae) with a redescription of <I>Ostorhinchus atrogaster</I>.</a> <!--MARK--><!--MARK--><a href='null96466227-221c-4922-ac97-1ac2dd946d0a' class='mouseoverHref'><em>Zootaxa</em></a> <strong>3492</strong>: 77-84<!--MARK-->","","Article in Journal","07d6681c-d00f-4dc2-9f8e-6ff488a7ad7d","20130923T03:01:49.600+0000","96466227-221c-4922-ac97-1ac2dd946d0a"
"Fraser, T.H.","2013","A new genus of cardinalfish (Apogonidae: Percomorpha), redescription of <I>Archamia</I> and resemblances and relationships with <I>Kurtus</I> (Kurtidae: Percomorpha).","1-63","","Zootaxa","","","","<!--MARK--><a href='nullb9b7b069-4514-4c19-bd87-75bb372417ab' class='mouseoverHref'>Fraser, T.H. 2013. A new genus of cardinalfish (Apogonidae: Percomorpha), redescription of <I>Archamia</I> and resemblances and relationships with <I>Kurtus</I> (Kurtidae: Percomorpha).</a> <!--MARK--><!--MARK--><a href='null96466227-221c-4922-ac97-1ac2dd946d0a' class='mouseoverHref'><em>Zootaxa</em></a> <strong>3714</strong>(1): 1-63<!--MARK-->","","Article in Journal","b9b7b069-4514-4c19-bd87-75bb372417ab","20131112T06:36:50.326+0000","96466227-221c-4922-ac97-1ac2dd946d0a"
"Fraser, T.H.","2014","<I>Foa yamba</I>, a new species of cardinalfish (Percomorpha: Apogonidae: Apogonichthyini) from the tidal region of the Clarence River, Australia and redescriptions of the West Pacific <I>Foa longimana</I> and <I>Foa hyalina</I>.","167-178","","Zootaxa","","","","<!--MARK--><a href='null417ea6ca-69dd-4306-bee5-67eef9f4bd79' class='mouseoverHref'>Fraser, T.H. 2014. <I>Foa yamba</I>, a new species of cardinalfish (Percomorpha: Apogonidae: Apogonichthyini) from the tidal region of the Clarence River, Australia and redescriptions of the West Pacific <I>Foa longimana</I> and <I>Foa hyalina</I>.</a> <!--MARK--><!--MARK--><a href='null96466227-221c-4922-ac97-1ac2dd946d0a' class='mouseoverHref'><em>Zootaxa</em></a> <strong>3878</strong>(2): 167-178<!--MARK-->","","Article in Journal","417ea6ca-69dd-4306-bee5-67eef9f4bd79","20141025T05:12:03.579+0000","96466227-221c-4922-ac97-1ac2dd946d0a"
"Fraser, T.H.","2014","A new genus of cardinalfish from tropical Australia and southern New Guinea (Percomorpha: Apogonidae).","283-293","","Zootaxa","","","","<!--MARK--><a href='nullcc059891-a63a-4519-8ec6-3bf11c4f795c' class='mouseoverHref'>Fraser, T.H. 2014. A new genus of cardinalfish from tropical Australia and southern New Guinea (Percomorpha: Apogonidae).</a> <!--MARK--><!--MARK--><a href='null96466227-221c-4922-ac97-1ac2dd946d0a' class='mouseoverHref'><em>Zootaxa</em></a> <strong>3852</strong>(2): 283-293<!--MARK-->","","Article in Journal","cc059891-a63a-4519-8ec6-3bf11c4f795c","20140814T05:59:30.613+0000","96466227-221c-4922-ac97-1ac2dd946d0a"
"Fraser, T.H., Randall, J.E. & Allen, G.R.","2002","Clarification of the cardinalfishes (Apogonidae) previously confused with <i>Apogon moluccensis</i> Valenciennes, with a description of a related new species","175-184","","The Raffles Bulletin of Zoology","","","","<!--MARK--><a href='nullcc8e1d5a-3cd6-45b0-86e9-54c57bf83ca2' class='mouseoverHref'>Fraser, T.H., Randall, J.E. & Allen, G.R. 2002. Clarification of the cardinalfishes (Apogonidae) previously confused with <i>Apogon moluccensis</i> Valenciennes, with a description of a related new species.</a> <!--MARK--><!--MARK--><a href='null2e626e3d-6486-4e24-9722-dfb77c193e90' class='mouseoverHref'><em>The Raffles Bulletin of Zoology</em></a> <strong>50</strong>(1): 175-184<!--MARK-->","","Article in Journal","cc8e1d5a-3cd6-45b0-86e9-54c57bf83ca2","20190130T03:48:11.205+0000","2e626e3d-6486-4e24-9722-dfb77c193e90"
"Fraser, T.H., Randall, J.E. & Lachner, E.A.","1999","A review of the Red Sea cardinalfishes of the <i>Apogon bandanensis</i> complex, with a description of a new species","1-13","","Special Publication J.L.B. Smith Institute of Ichthyology","","","","<!--MARK--><a href='null6e920f82-744a-4a86-8944-012178fa8031' class='mouseoverHref'>Fraser, T.H., Randall, J.E. & Lachner, E.A. 1999. A review of the Red Sea cardinalfishes of the <i>Apogon bandanensis</i> complex, with a description of a new species.</a> <!--MARK--><!--MARK--><a href='nullb3739602-3683-4a0a-be4a-81fca2c13c7b' class='mouseoverHref'><em>Special Publication J.L.B. Smith Institute of Ichthyology</em></a> <strong>63</strong>: 1-13<!--MARK-->","","Article in Journal","6e920f82-744a-4a86-8944-012178fa8031","20081009T05:11:37.000+0000","b3739602-3683-4a0a-be4a-81fca2c13c7b"
"Fraser, T.H. & Allen, G.R.","2001","A new species of cardinalfish in <i>Neamia</i> (Apogonidae, Perciformes) from Mauritius, Indian Ocean, with a review of <i>Neamia octospina</i>","159-165","","Records of the Western Australian Museum","","","","<!--MARK--><a href='nullb251558e-b29c-46cb-a2d0-25dba2a87ba6' class='mouseoverHref'>Fraser, T.H. & Allen, G.R. 2001. A new species of cardinalfish in <i>Neamia</i> (Apogonidae, Perciformes) from Mauritius, Indian Ocean, with a review of <i>Neamia octospina</i>.</a> <!--MARK--><!--MARK--><a href='nulla2cbd1fb-97d5-493a-a1d7-c2b99709890b' class='mouseoverHref'><em>Records of the Western Australian Museum</em></a> <strong>20</strong>: 159-165<!--MARK-->","","Article in Journal","b251558e-b29c-46cb-a2d0-25dba2a87ba6","20081009T05:11:37.000+0000","a2cbd1fb-97d5-493a-a1d7-c2b99709890b"
"Fraser, T.H. & Allen, G.R.","2006","A new species of <i>Neamia</i> (Perciformes: Apogonidae) from the West Pacific Ocean","1-5","","Memoirs of Museum Victoria","","","","<!--MARK--><a href='null846fb2a5-574a-4d99-b999-8244da47af97' class='mouseoverHref'>Fraser, T.H. & Allen, G.R. 2006. A new species of <i>Neamia</i> (Perciformes: Apogonidae) from the West Pacific Ocean.</a> <!--MARK--><!--MARK--><a href='null5c22a8d1-7456-4f8c-9384-1246ecbf15a6' class='mouseoverHref'><em>Memoirs of Museum Victoria</em></a> <strong>63</strong>(1): 1-5<!--MARK-->","","Article in Journal","846fb2a5-574a-4d99-b999-8244da47af97","20081009T05:11:37.000+0000","5c22a8d1-7456-4f8c-9384-1246ecbf15a6"
"Fraser, T.H. & Allen, G.R.","2010","Cardinalfish of the genus <i>Apogonichthyoides</i> Smith, 1949 (Apogonidae) with a description of a new species from the West-Pacific region","40-56","","Zootaxa","","","","<!--MARK--><a href='null1c64cd4f-ba1a-46e8-9eac-dea071e2afba' class='mouseoverHref'>Fraser, T.H. & Allen, G.R. 2010. Cardinalfish of the genus <i>Apogonichthyoides</i> Smith, 1949 (Apogonidae) with a description of a new species from the West-Pacific region.</a> <!--MARK--><!--MARK--><a href='null96466227-221c-4922-ac97-1ac2dd946d0a' class='mouseoverHref'><em>Zootaxa</em></a> <strong>2348</strong>: 40-56<!--MARK-->","","Article in Journal","1c64cd4f-ba1a-46e8-9eac-dea071e2afba","20121211T00:26:09.401+0000","96466227-221c-4922-ac97-1ac2dd946d0a"
"Fraser, T.H. & Lachner, E.A.","1985","A revision of the cardinalfish subgenera <i>Pristiapogon</i> and <i>Zoramia</i> (genus <i>Apogon</i>) of the Indo-Pacific region (Teleostei: Apogonidae)","1-47","","Smithsonian Contributions to Zoology","","","","<!--MARK--><a href='null8b612c6f-122c-489f-a037-e54a4ddd91c1' class='mouseoverHref'>Fraser, T.H. & Lachner, E.A. 1985. A revision of the cardinalfish subgenera <i>Pristiapogon</i> and <i>Zoramia</i> (genus <i>Apogon</i>) of the Indo-Pacific region (Teleostei: Apogonidae).</a> <!--MARK--><!--MARK--><a href='nullcf8b640e-574a-4713-8a6f-74b8ef9e2f2c' class='mouseoverHref'><em>Smithsonian Contributions to Zoology</em></a> <strong>412</strong>: 1-47<!--MARK-->","","Article in Journal","8b612c6f-122c-489f-a037-e54a4ddd91c1","20081009T05:11:37.000+0000","cf8b640e-574a-4713-8a6f-74b8ef9e2f2c"
"Fraser, T.H. & Mabuchi, K.","2014","Various new subfamilies, tribes genera.","pp. 175-191","","Zootaxa","Revision of the systematics of the cardinalfishes (Percomorpha: Apogonidae) based on molecular analyses and comparative reevaluation of morphological characters.","","","<!--MARK--><a href='null1a732925-a1fb-4510-9f20-0b296e07418e' class='mouseoverHref'>Fraser, T.H. & Mabuchi, K. 2014. Various new subfamilies, tribes genera. pp. 175-191</a> <!--MARK--><em>in</em> <!--MARK--><a href='null2deb13af-9347-4e47-adaa-245aca321a08' class='mouseoverHref'>Mabuchi, K., Fraser, T.H., Song, H., Azuma, Y. & Nishida, M. Revision of the systematics of the cardinalfishes (Percomorpha: Apogonidae) based on molecular analyses and comparative reevaluation of morphological characters.</a> <!--MARK--><!--MARK--><a href='null96466227-221c-4922-ac97-1ac2dd946d0a' class='mouseoverHref'><em>Zootaxa</em></a> <strong>3846</strong>(2): 151-203<!--MARK-->","","Section in Article","1a732925-a1fb-4510-9f20-0b296e07418e","20141223T06:40:57.487+0000","2deb13af-9347-4e47-adaa-245aca321a08"
"Fraser, T.H. & Randall, J.E.","1976","Two new Indo-West Pacific cardinalfishes of the genus <I>Apogon</I>.","503-508","","Proceedings of the Biological Society of Washington","","","","<!--MARK--><a href='nullf296dd05-9783-44b2-82df-18a0b83c4ea4' class='mouseoverHref'>Fraser, T.H. & Randall, J.E. 1976. Two new Indo-West Pacific cardinalfishes of the genus <I>Apogon</I>.</a> <!--MARK--><!--MARK--><a href='null4153f314-120d-40d7-987b-b5ba47399aec' class='mouseoverHref'><em>Proceedings of the Biological Society of Washington</em></a> <strong>88</strong>(47): 503-508<!--MARK-->","","Article in Journal","f296dd05-9783-44b2-82df-18a0b83c4ea4","20131117T08:36:50.138+0000","4153f314-120d-40d7-987b-b5ba47399aec"
"Fraser, T.H. & Randall, J.E.","2002","<I>Apogon dianthus</I>, a new species of cardinalfish (Perciformes: Apogonidae) from Palau, western Pacific Ocean with comments on other species of the subgenus <I>Apogon</I>.","25-31","","Proceedings of the Biological Society of Washington","","","","<!--MARK--><a href='null6ad8da21-0822-4f76-ae14-d5fbfc2532fe' class='mouseoverHref'>Fraser, T.H. & Randall, J.E. 2002. <I>Apogon dianthus</I>, a new species of cardinalfish (Perciformes: Apogonidae) from Palau, western Pacific Ocean with comments on other species of the subgenus <I>Apogon</I>.</a> <!--MARK--><!--MARK--><a href='null4153f314-120d-40d7-987b-b5ba47399aec' class='mouseoverHref'><em>Proceedings of the Biological Society of Washington</em></a> <strong>115</strong>(1): 25-31<!--MARK-->","","Article in Journal","6ad8da21-0822-4f76-ae14-d5fbfc2532fe","20120302T05:39:25.731+0000","4153f314-120d-40d7-987b-b5ba47399aec"
"Fraser, T.H. & Randall, J.E.","2011","Two new species of <I>Foa</I> (Apogonidae) from the Pacific Plate, with redescriptions of <I>Foa brachygramma</I> and <I>Foa fo</I>.","1-27","","Zootaxa","","","","<!--MARK--><a href='null00c8e664-f85b-4107-889d-ea1d7e456793' class='mouseoverHref'>Fraser, T.H. & Randall, J.E. 2011. Two new species of <I>Foa</I> (Apogonidae) from the Pacific Plate, with redescriptions of <I>Foa brachygramma</I> and <I>Foa fo</I>.</a> <!--MARK--><!--MARK--><a href='null96466227-221c-4922-ac97-1ac2dd946d0a' class='mouseoverHref'><em>Zootaxa</em></a> <strong>2988</strong>: 1-27<!--MARK-->","","Article in Journal","00c8e664-f85b-4107-889d-ea1d7e456793","20120304T13:20:13.857+0000","96466227-221c-4922-ac97-1ac2dd946d0a"
"Fraser, T.H. &  Struhsaker, P.J.","1991","A new genus and species of cardinalfish (Apogonidae) from the Indo-West Pacific, with a key to Apogonine genera.","718-722","","Copeia","","","","<!--MARK--><a href='null4eb1a040-ee7a-4e0e-b99a-8946d04c4ee2' class='mouseoverHref'>Fraser, T.H. &  Struhsaker, P.J. 1991. A new genus and species of cardinalfish (Apogonidae) from the Indo-West Pacific, with a key to Apogonine genera.</a> <!--MARK--><!--MARK--><a href='nullf65f55ee-d862-41a2-8c61-e252ae15bcf7' class='mouseoverHref'><em>Copeia</em></a> <strong>1991</strong>(3): 718-722<!--MARK-->","","Article in Journal","4eb1a040-ee7a-4e0e-b99a-8946d04c4ee2","20120305T09:02:22.100+0000","f65f55ee-d862-41a2-8c61-e252ae15bcf7"
"Fraser, T. in Hoese, D.F., Bray, D.J., Paxton, J.R. & Allen, G.R.","2006","Fishes","","","","","","","<!--MARK--><a href='null82c80999-0f0a-4d36-9b04-0753e5c7575f' class='mouseoverHref'>Fraser, T. <i>in</i> Hoese, D.F., Bray, D.J., Paxton, J.R. & Allen, G.R. 2006. Fishes. <I>In</I>, Beesley, P.L. & Wells, A. (eds) <I>Zoological Catalogue of Australia. Volume 35.</I> ABRS & CSIRO Publishing : Australia Part 1, pp. xxiv 1-670; Part 2, pp. xxi 671-1472; Part 3, pp. xxi 1473-2178.</a>","","Miscellaneous","82c80999-0f0a-4d36-9b04-0753e5c7575f","20081009T05:11:37.000+0000",""
"Fricke, R.","1999","Fishes of the Mascarene Islands (Réunion, Mauritius, Rodriguez). An annotated checklist with descriptions of new species","1-759 figs 1-9","","Theses Zoologicae","","","","<!--MARK--><a href='null74c44c97-a7b3-4f02-a899-87de59d97154' class='mouseoverHref'>Fricke, R. 1999. Fishes of the Mascarene Islands (Réunion, Mauritius, Rodriguez). An annotated checklist with descriptions of new species.</a> <!--MARK--><!--MARK--><a href='nulld336bffc-542c-41be-b2df-a5f613e23882' class='mouseoverHref'><em>Theses Zoologicae</em></a> <strong>31</strong>: 1-759 figs 1-9<!--MARK-->","","Article in Journal","74c44c97-a7b3-4f02-a899-87de59d97154","20081009T05:11:37.000+0000","d336bffc-542c-41be-b2df-a5f613e23882"
"Fricke, R., Kulbicki, M. & Wantiez, L.","2011","Checklist of the fishes of New Caledonia, and their distribution in the Southwest Pacific Ocean (Pisces).","341-463","","Stuttgarter Beiträge zur Naturkunde. Serie A (Biologie)","","","","<!--MARK--><a href='nulld6198548-fd65-4ada-aa4c-f2dba1f65ae5' class='mouseoverHref'>Fricke, R., Kulbicki, M. & Wantiez, L. 2011. Checklist of the fishes of New Caledonia, and their distribution in the Southwest Pacific Ocean (Pisces).</a> <!--MARK--><!--MARK--><a href='nullb9131741-2c94-4d33-a7c2-d35f26c72527' class='mouseoverHref'><em>Stuttgarter Beiträge zur Naturkunde. Serie A (Biologie)</em></a> Neue Serie <strong>4</strong>: 341-463<!--MARK-->","","Article in Journal","d6198548-fd65-4ada-aa4c-f2dba1f65ae5","20110721T07:41:31.308+0000","b9131741-2c94-4d33-a7c2-d35f26c72527"
"Garman, S.","1903","Some fishes from Australasia","229-241 pls 1-5","","Bulletin of the Museum of Comparative Zoology, Harvard","","","","<!--MARK--><a href='nullf26efd24-efb1-4e00-af60-51d065196162' class='mouseoverHref'>Garman, S. 1903. Some fishes from Australasia.</a> <!--MARK--><!--MARK--><a href='nullb2447030-bd13-4a45-9402-157082169a3d' class='mouseoverHref'><em>Bulletin of the Museum of Comparative Zoology, Harvard</em></a> <strong>39</strong>(8): 229-241 pls 1-5<!--MARK-->","","Article in Journal","f26efd24-efb1-4e00-af60-51d065196162","20081009T05:11:37.000+0000","b2447030-bd13-4a45-9402-157082169a3d"
"Gill, A.C. & Reader, S.E.","1992","Fishes","90-93, 193-228","Reef Biology. A Survey of Elizabeth and Middleton Reefs, South Pacific","","","","","<!--MARK--><a href='null5b61cac6-436c-4f9a-87e9-82dd5b26a54a' class='mouseoverHref'>Gill, A.C. & Reader, S.E. 1992. Fishes. pp. 90-93, 193-228</a> <!--MARK--><em>in</em> <!--MARK--><a href='nulld692f000-d07f-4efe-bbc2-3ec1053016eb' class='mouseoverHref'>Hutchings, P. (ed.). <em>Reef Biology. A Survey of Elizabeth and Middleton Reefs, South Pacific</em>. Canberra : Australian National Parks Vol. 3, Kowari 230 pp.</a><!--MARK-->","","Chapter in Book","5b61cac6-436c-4f9a-87e9-82dd5b26a54a","20160402T04:46:41.892+0000","d692f000-d07f-4efe-bbc2-3ec1053016eb"
"Gill, T.N.","1863","Catalogue of the fishes of lower California, in the Smithsonian Institution, collected by Mr. J. Xantus","80-88","","Proceedings of the Academy of Natural Sciences, Philadelphia","","","","<!--MARK--><a href='nullfa669a48-0013-42f0-8af9-c1f526d484b5' class='mouseoverHref'>Gill, T.N. 1863. Catalogue of the fishes of lower California, in the Smithsonian Institution, collected by Mr. J. Xantus.</a> <!--MARK--><!--MARK--><a href='null9dfe7fba-63cc-4968-b0be-a8904006864b' class='mouseoverHref'><em>Proceedings of the Academy of Natural Sciences, Philadelphia</em></a> <strong>15</strong>(2): 80-88<!--MARK-->","","Article in Journal","fa669a48-0013-42f0-8af9-c1f526d484b5","20081009T05:11:37.000+0000","9dfe7fba-63cc-4968-b0be-a8904006864b"
"Gloerfelt-Tarp, T. & Kailola, P.J.","1984","Trawled Fishes of Southern Indonesia and Northwest Australia","406 pp.","","","","","Dir. Gen. Fish. (Indonesia), German Tech. Coop., Aust. Dev. Ass. Bur.","<!--MARK--><a href='nulle0f952f4-1d07-468b-8407-518da340647b' class='mouseoverHref'>Gloerfelt-Tarp, T. & Kailola, P.J. 1984. <em>Trawled Fishes of Southern Indonesia and Northwest Australia</em>. Jakarta : Dir. Gen. Fish. (Indonesia), German Tech. Coop., Aust. Dev. Ass. Bur. 406 pp.</a><!--MARK-->","","Book","e0f952f4-1d07-468b-8407-518da340647b","20081009T05:11:37.000+0000",""
"Golani, D. & Bogorodsky, S.V.","2010","The fishes of the Red Sea--reappraisal and updated checklist.","1-135","","Zootaxa","","","","<!--MARK--><a href='null2e63fc2d-ebf7-4ec5-882f-8c09d64ce116' class='mouseoverHref'>Golani, D. & Bogorodsky, S.V. 2010. The fishes of the Red Sea--reappraisal and updated checklist.</a> <!--MARK--><!--MARK--><a href='null96466227-221c-4922-ac97-1ac2dd946d0a' class='mouseoverHref'><em>Zootaxa</em></a> <strong>2463</strong>: 1-135<!--MARK-->","","Article in Journal","2e63fc2d-ebf7-4ec5-882f-8c09d64ce116","20120415T13:29:13.499+0000","96466227-221c-4922-ac97-1ac2dd946d0a"
"Gomon, M.F.","1994","Family Apogonidae","562-571 figs 499-506","The Fishes of Australia's South Coast","","","","","<!--MARK--><a href='nullefd7222b-94c6-4738-b59f-72ee975bea02' class='mouseoverHref'>Gomon, M.F. 1994. Family Apogonidae. pp. 562-571 figs 499-506</a> <!--MARK--><em>in</em> <!--MARK--><a href='null1f91592f-8cd6-43ff-9f42-01bb5a146e7f' class='mouseoverHref'>Gomon, M.F., Glover, C.J.M. & Kuiter, R.H. (eds). <em>The Fishes of Australia's South Coast</em>. Adelaide : State Printer 992 pp. 810 figs.</a><!--MARK-->","","Chapter in Book","efd7222b-94c6-4738-b59f-72ee975bea02","20081009T05:11:37.000+0000","1f91592f-8cd6-43ff-9f42-01bb5a146e7f"
"Gomon, M.F., Glover, C.J.M. & Kuiter, R.H. (eds)","1994","The Fishes of Australia's South Coast","992 pp. 810 figs","","","","","State Printer","<!--MARK--><a href='null1f91592f-8cd6-43ff-9f42-01bb5a146e7f' class='mouseoverHref'>Gomon, M.F., Glover, C.J.M. & Kuiter, R.H. (eds) 1994. <em>The Fishes of Australia's South Coast</em>. Adelaide : State Printer 992 pp. 810 figs.</a><!--MARK-->","","Book","1f91592f-8cd6-43ff-9f42-01bb5a146e7f","20150615T02:18:44.797+0000",""
