"PUB_AUTHOR","PUB_YEAR","PUB_TITLE","PUB_PAGES","PUB_PARENT_BOOK_TITLE","PUB_PARENT_JOURNAL_TITLE","PUB_PARENT_ARTICLE_TITLE","PUB_PUBLICATION_DATE","PUB_PUBLISHER","PUB_FORMATTED","PUB_QUALIFICATION","PUB_TYPE","PUBLICATION_GUID","PUBLICATION_LAST_UPDATE","PARENT_PUBLICATION_GUID"
"Allen, G.R.","1982","Inland Fishes of Western Australia","86 pp. 6 figs 20 pls","","","","","Western Australian Museum","<!--MARK--><a href='null9ab3219a-b894-4968-aa72-4de42e7d4f7b' class='mouseoverHref'>Allen, G.R. 1982. <em>Inland Fishes of Western Australia</em>. Perth : Western Australian Museum 86 pp. 6 figs 20 pls.</a><!--MARK-->","","Book","9ab3219a-b894-4968-aa72-4de42e7d4f7b","20081009T05:11:37.000+0000",""
"Allen, G.R.","1985","A new species of cardinalfish (Apogonidae) from northern Australia and the Aru Islands","11-15 figs 1-3","","The Beagle. Occasional Papers of the Northern Territory Museum of Arts and Sciences","","","","<!--MARK--><a href='nullc6a77d62-f96a-4402-b2de-c0961537060f' class='mouseoverHref'>Allen, G.R. 1985. A new species of cardinalfish (Apogonidae) from northern Australia and the Aru Islands.</a> <!--MARK--><!--MARK--><a href='null9414bab1-e41b-40fb-a995-7d01490d14e4' class='mouseoverHref'><em>The Beagle. Occasional Papers of the Northern Territory Museum of Arts and Sciences</em></a> <strong>2</strong>(1): 11-15 figs 1-3<!--MARK-->","","Article in Journal","c6a77d62-f96a-4402-b2de-c0961537060f","20081009T05:11:37.000+0000","9414bab1-e41b-40fb-a995-7d01490d14e4"
"Allen, G.R.","1985","Fishes of Western Australia. Book 9","pp. 2207-2534 526 pls","Pacific Marine Fishes","","","","","<!--MARK--><a href='nullc3686361-b2fc-4d35-9505-006c28241530' class='mouseoverHref'>Allen, G.R. 1985. Fishes of Western Australia. Book 9. pp. 2207-2534 526 pls</a> <!--MARK--><em>in</em> <!--MARK--><a href='null959bf1bf-89c9-43a7-9331-12b4e68f3854' class='mouseoverHref'>Burgess, W.E. & Axelrod, H.R. (eds). <em>Pacific Marine Fishes</em>. Neptune, New Jersey : T.F.H. Publications.</a><!--MARK-->","","Chapter in Book","c3686361-b2fc-4d35-9505-006c28241530","20150426T08:24:37.141+0000","959bf1bf-89c9-43a7-9331-12b4e68f3854"
"Allen, G.R.","1987","New Australian Fishes. Part 2. Four new species of Apogonidae","3-8","","Memoirs of Museum Victoria","","","","<!--MARK--><a href='nulle1e03e93-272b-41cd-90ad-4800ca8295cf' class='mouseoverHref'>Allen, G.R. 1987. New Australian Fishes. Part 2. Four new species of Apogonidae.</a> <!--MARK--><!--MARK--><a href='null5c22a8d1-7456-4f8c-9384-1246ecbf15a6' class='mouseoverHref'><em>Memoirs of Museum Victoria</em></a> <strong>48</strong>(1): 3-8<!--MARK-->","","Article in Journal","e1e03e93-272b-41cd-90ad-4800ca8295cf","20081009T05:11:37.000+0000","5c22a8d1-7456-4f8c-9384-1246ecbf15a6"
"Allen, G.R.","1989","Freshwater Fishes of Australia","240 pp., 63 pls","","","","","T.F.H. Publications","<!--MARK--><a href='nullb1884062-ecdb-4a2a-8784-a91de5e9a265' class='mouseoverHref'>Allen, G.R. 1989. <em>Freshwater Fishes of Australia</em>. Neptune, New Jersey : T.F.H. Publications 240 pp., 63 pls.</a><!--MARK-->","","Book","b1884062-ecdb-4a2a-8784-a91de5e9a265","20081010T05:31:17.993+0000",""
"Allen, G.R.","1991","Field Guide to the Freshwater Fishes of New Guinea","268 pp.","","","","","Christensen Research Institute","<!--MARK--><a href='nulld311506b-dc08-41ee-9f11-6efda5bf42ba' class='mouseoverHref'>Allen, G.R. 1991. <em>Field Guide to the Freshwater Fishes of New Guinea</em>. Madang : Christensen Research Institute 268 pp.</a><!--MARK--> [Publication No. 9 of the Christensen Research Institute]","Publication No. 9 of the Christensen Research Institute","Book","d311506b-dc08-41ee-9f11-6efda5bf42ba","20081009T05:11:37.000+0000",""
"Allen, G.R.","1992","A new species of cardinalfish (Apogonidae) from northern Australia","697-701","","Records of the Western Australian Museum","","","","<!--MARK--><a href='nullaa81013b-2808-43e8-b9b8-90e6288fa8d8' class='mouseoverHref'>Allen, G.R. 1992. A new species of cardinalfish (Apogonidae) from northern Australia.</a> <!--MARK--><!--MARK--><a href='nulla2cbd1fb-97d5-493a-a1d7-c2b99709890b' class='mouseoverHref'><em>Records of the Western Australian Museum</em></a> <strong>15</strong>(4): 697-701<!--MARK-->","","Article in Journal","aa81013b-2808-43e8-b9b8-90e6288fa8d8","20081009T05:11:37.000+0000","a2cbd1fb-97d5-493a-a1d7-c2b99709890b"
"Allen, G.R.","1993","Cardinalfishes (Apogonidae) of Madang Province, Papua New Guinea, with descriptions of three new species","9-20","","Revue Française d'Aquariologie et Herpétologie","","","","<!--MARK--><a href='nulle8d8638c-3b53-48f4-8ac0-02b417bdb017' class='mouseoverHref'>Allen, G.R. 1993. Cardinalfishes (Apogonidae) of Madang Province, Papua New Guinea, with descriptions of three new species.</a> <!--MARK--><!--MARK--><a href='nullbb9f1b45-3680-4962-91e4-f26c029236ec' class='mouseoverHref'><em>Revue Française d'Aquariologie et Herpétologie</em></a> <strong>20</strong>(1): 9-20<!--MARK-->","","Article in Journal","e8d8638c-3b53-48f4-8ac0-02b417bdb017","20081009T05:11:37.000+0000","bb9f1b45-3680-4962-91e4-f26c029236ec"
"Allen, G.R.","1993","Fishes of Ashmore Reef and Cartier Island","67-91","","Records of the Western Australian Museum, Supplement","","","","<!--MARK--><a href='null3d03d71c-2a25-4fef-a695-4fa354ef055e' class='mouseoverHref'>Allen, G.R. 1993. Fishes of Ashmore Reef and Cartier Island.</a> <!--MARK--><!--MARK--><a href='null841f1546-1bce-4548-adc9-7b08f6ca73a0' class='mouseoverHref'><em>Records of the Western Australian Museum, Supplement</em></a> <strong>44</strong>: 67-91<!--MARK-->","","Article in Journal","3d03d71c-2a25-4fef-a695-4fa354ef055e","20130220T01:11:47.149+0000","841f1546-1bce-4548-adc9-7b08f6ca73a0"
"Allen, G.R.","1995","A new species of cardinalfish (<i>Apogon</i> : Apogonidae) from northwestern Australia","177-180","","Records of the Western Australian Museum","","","","<!--MARK--><a href='nullf5182ab8-3735-4252-aa34-b2169df50b62' class='mouseoverHref'>Allen, G.R. 1995. A new species of cardinalfish (<i>Apogon</i> : Apogonidae) from northwestern Australia.</a> <!--MARK--><!--MARK--><a href='nulla2cbd1fb-97d5-493a-a1d7-c2b99709890b' class='mouseoverHref'><em>Records of the Western Australian Museum</em></a> <strong>17</strong>: 177-180<!--MARK-->","","Article in Journal","f5182ab8-3735-4252-aa34-b2169df50b62","20081009T05:11:37.000+0000","a2cbd1fb-97d5-493a-a1d7-c2b99709890b"
"Allen, G.R.","1996","New records of reef and shore fishes from northwestern Australia","109-112","","Records of the Western Australian Museum","","","","<!--MARK--><a href='nullaaa05e09-8821-48f2-a83c-c8bf57c1b079' class='mouseoverHref'>Allen, G.R. 1996. New records of reef and shore fishes from northwestern Australia.</a> <!--MARK--><!--MARK--><a href='nulla2cbd1fb-97d5-493a-a1d7-c2b99709890b' class='mouseoverHref'><em>Records of the Western Australian Museum</em></a> <strong>18</strong>: 109-112<!--MARK-->","","Article in Journal","aaa05e09-8821-48f2-a83c-c8bf57c1b079","20081009T05:11:37.000+0000","a2cbd1fb-97d5-493a-a1d7-c2b99709890b"
"Allen, G.R.","1997","Marine Fishes of Tropical Australia and South-east Asia","292 pp. 106 pls","","","","","Western Australian Museum","<!--MARK--><a href='null4f61c4f6-5604-4752-9552-6f9bd9fdfa99' class='mouseoverHref'>Allen, G.R. 1997. <em>Marine Fishes of Tropical Australia and South-east Asia</em>. Perth : Western Australian Museum 292 pp. 106 pls.</a><!--MARK-->","","Book","4f61c4f6-5604-4752-9552-6f9bd9fdfa99","20081009T05:11:37.000+0000",""
"Allen, G.R.","1999","Apogonidae","2602-2610","The Living Marine Resources of the Western Central Pacific. FAO Species Identification Guide for Fisheries Purposes","","","","","<!--MARK--><a href='null13c3321e-ff97-4784-b7be-0673e69e28cf' class='mouseoverHref'>Allen, G.R. 1999. Apogonidae. pp. 2602-2610</a> <!--MARK--><em>in</em> <!--MARK--><a href='null8f27054e-9c9c-491c-832f-d426ca0e3808' class='mouseoverHref'>Carpenter, K.E. & Niem, T.H. (eds). <em>The Living Marine Resources of the Western Central Pacific. FAO Species Identification Guide for Fisheries Purposes</em>. Rome : FAO Vol. 4 pp. 2069-2790.</a><!--MARK-->","","Chapter in Book","13c3321e-ff97-4784-b7be-0673e69e28cf","20081009T05:11:37.000+0000","8f27054e-9c9c-491c-832f-d426ca0e3808"
"Allen, G.R.","2001","Two new species of cardinalfishes (Apogonidae) from the Raja Ampat Islands, Indonesia","143-149","","Aqua, Journal of Ichthyology and Aquatic Biology","","","","<!--MARK--><a href='null61472e46-05b4-45e6-b9e3-f1297950b723' class='mouseoverHref'>Allen, G.R. 2001. Two new species of cardinalfishes (Apogonidae) from the Raja Ampat Islands, Indonesia.</a> <!--MARK--><!--MARK--><a href='null18ef42ff-f4e9-4fef-b478-d5db6753e0f1' class='mouseoverHref'><em>Aqua, Journal of Ichthyology and Aquatic Biology</em></a> <strong>4</strong>(4): 143-149<!--MARK-->","","Article in Journal","61472e46-05b4-45e6-b9e3-f1297950b723","20081009T05:11:37.000+0000","18ef42ff-f4e9-4fef-b478-d5db6753e0f1"
"Allen, G.R.","2009","Field Guide to Marine Fishes of Tropical Australia and South-East Asia","pp. 287","","","","","Western Australian Museum","<!--MARK--><a href='null419baffc-5dce-4a2f-8e48-01e60ca8f811' class='mouseoverHref'>Allen, G.R. 2009. <em>Field Guide to Marine Fishes of Tropical Australia and South-East Asia</em>. Welshpool : Western Australian Museum Edn. 4, pp. 287.</a><!--MARK-->","","Book","419baffc-5dce-4a2f-8e48-01e60ca8f811","20131008T02:15:46.915+0000",""
"Allen, G.R.","","The Australian Faunal Directory","","","","","","","<!--MARK--><a href='nullfb2f73a7-aaa4-41a4-a416-25014727a1fa' class='mouseoverHref'>Allen, G.R. The Australian Faunal Directory,</a> <!--MARK--><a href=http://biodiversity.org.au/afd>http://biodiversity.org.au/afd</a>","","This Work","fb2f73a7-aaa4-41a4-a416-25014727a1fa","20200430T12:38:02.584+0000",""
"Allen, G.R., Cross, N.J. & Hoese, D.F.","2006","Family Apogonidae","pp. 1081-1112","Fishes. <em>In</em>, Beesley, P.L. & Wells, A. (eds) Zoological Catalogue of Australia. Vol. 35","","","","","<!--MARK--><a href='null7639324b-f61f-41fc-91d6-4ad719bb6c52' class='mouseoverHref'>Allen, G.R., Cross, N.J. & Hoese, D.F. 2006. Family Apogonidae. pp. 1081-1112</a> <!--MARK--><em>in</em> <!--MARK--><a href='null0a6a2902-cbfa-4849-8a10-a529af8fee7d' class='mouseoverHref'>Hoese, D.F., Bray, D.J., Paxton, J.R. & Allen, G.R. <em>Fishes. <em>In</em>, Beesley, P.L. & Wells, A. (eds) Zoological Catalogue of Australia. Vol. 35</em>. <em>Volume 35</em> Australia : ABRS & CSIRO Publishing Parts 1-3, 2178 pp.</a><!--MARK-->","","Chapter in Book","7639324b-f61f-41fc-91d6-4ad719bb6c52","20121218T01:57:03.543+0000","0a6a2902-cbfa-4849-8a10-a529af8fee7d"
"Allen, G.R., Hoese, D.F., Paxton, J.R., Randall, J.E., Russell, B.C., Starck, W.A., Talbot, F.H. & Whitley, G.P.","1976","Annotated checklist of the fishes of Lord Howe Island","365-454 figs 1-2","","Records of the Australian Museum","","","","<!--MARK--><a href='nullc5519b9b-f9c1-42fb-84d0-fc66ab5ccea8' class='mouseoverHref'>Allen, G.R., Hoese, D.F., Paxton, J.R., Randall, J.E., Russell, B.C., Starck, W.A., Talbot, F.H. & Whitley, G.P. 1976. Annotated checklist of the fishes of Lord Howe Island.</a> <!--MARK--><!--MARK--><a href='null7c07530b-0b38-44f5-8f95-368da97d6ac2' class='mouseoverHref'><em>Records of the Australian Museum</em></a> <strong>30</strong>(15): 365-454 figs 1-2<!--MARK-->","","Article in Journal","c5519b9b-f9c1-42fb-84d0-fc66ab5ccea8","20081009T05:11:37.000+0000","7c07530b-0b38-44f5-8f95-368da97d6ac2"
"Allen, G.R., Hortle, K.G. & Renyaan, S.J.","2000","Freshwater fishes of the Timika region, New Guinea.","175 pp.","","","","","P.T. Freeport Indonesia","<!--MARK--><a href='null8fe4a7f8-efa1-4cc1-a0aa-c3ec928863b2' class='mouseoverHref'>Allen, G.R., Hortle, K.G. & Renyaan, S.J. 2000. <em>Freshwater fishes of the Timika region, New Guinea</em>. Timinka, Indonesia : P.T. Freeport Indonesia 175 pp.</a><!--MARK-->","","Book","8fe4a7f8-efa1-4cc1-a0aa-c3ec928863b2","20120212T04:05:12.997+0000",""
"Allen, G.R., Kuiter, R.H. & Randall, J.E.","1994","Descriptions of five new species of cardinalfishes (Apogonidae: <i>Apogon</i>) from Maumere Bay, Flores, Indonesia and surrounding regions","27-38","","Revue Française d'Aquariologie et Herpétologie","","","","<!--MARK--><a href='null090e3616-bb8c-4600-94be-72a1f1726fcb' class='mouseoverHref'>Allen, G.R., Kuiter, R.H. & Randall, J.E. 1994. Descriptions of five new species of cardinalfishes (Apogonidae: <i>Apogon</i>) from Maumere Bay, Flores, Indonesia and surrounding regions.</a> <!--MARK--><!--MARK--><a href='nullbb9f1b45-3680-4962-91e4-f26c029236ec' class='mouseoverHref'><em>Revue Française d'Aquariologie et Herpétologie</em></a> <strong>21</strong>(1-2): 27-38<!--MARK-->","","Article in Journal","090e3616-bb8c-4600-94be-72a1f1726fcb","20081009T05:11:37.000+0000","bb9f1b45-3680-4962-91e4-f26c029236ec"
"Allen, G.R., Midgley, S.H. & Allen, M.","2002","Field Guide to the Freshwater Fishes of Australia","394 pp.","","","","","Western Australian Museum","<!--MARK--><a href='nulle5d27b08-bccb-4a5b-a782-ac02de6311f3' class='mouseoverHref'>Allen, G.R., Midgley, S.H. & Allen, M. 2002. <em>Field Guide to the Freshwater Fishes of Australia</em>. Perth : Western Australian Museum 394 pp.</a><!--MARK-->","","Book","e5d27b08-bccb-4a5b-a782-ac02de6311f3","20081009T05:11:37.000+0000",""
"Allen, G.R., Steene, R.C. & Orchard, M.","2007","Fishes of Christmas Island","284 pp.","","","","","Christmas Island Natural History Association","<!--MARK--><a href='nullb399df76-bf46-4e0c-a0b0-b4a20be3acbb' class='mouseoverHref'>Allen, G.R., Steene, R.C. & Orchard, M. 2007. <em>Fishes of Christmas Island</em>. Christmas Island : Christmas Island Natural History Association 2 edn, 284 pp.</a><!--MARK-->","","Book","b399df76-bf46-4e0c-a0b0-b4a20be3acbb","20121218T00:01:46.100+0000",""
"Allen, G.R., Storey, A.W. & Yarrao, M.","2008","Freshwater Fishes of the Fly River Papua New Guinea.","216 pp.","","","","","Ok Tedi Mining","<!--MARK--><a href='null319426ea-306f-45d3-99e2-ca7e5b47c717' class='mouseoverHref'>Allen, G.R., Storey, A.W. & Yarrao, M. 2008. <em>Freshwater Fishes of the Fly River Papua New Guinea</em>. Tabubil, Papua New Guinea : Ok Tedi Mining 216 pp.</a><!--MARK-->","","Book","319426ea-306f-45d3-99e2-ca7e5b47c717","20130909T04:45:49.073+0000",""
"Allen, G.R. & Erdmann, M.V.","2012","Reef fishes of the East Indies.","1260 pp.","","","","","Tropical Reef Research","<!--MARK--><a href='nullfd187523-2c9e-40d9-a6f4-d1ea86eae140' class='mouseoverHref'>Allen, G.R. & Erdmann, M.V. 2012. <em>Reef fishes of the East Indies</em>. Perth : Tropical Reef Research 3 vols, 1260 pp.</a><!--MARK-->","","Book","fd187523-2c9e-40d9-a6f4-d1ea86eae140","20121207T02:41:51.002+0000",""
"Allen, G.R. & Gomon, M.F.","2008","Family Apogonidae","pp. 557-561","Fishes of Australia's Southern Coast","","","","","<!--MARK--><a href='nullac12c2c6-277b-46a6-8c71-4bea78467da6' class='mouseoverHref'>Allen, G.R. & Gomon, M.F. 2008. Family Apogonidae. pp. 557-561</a> <!--MARK--><em>in</em> <!--MARK--><a href='nulle205665c-ad46-4029-8a08-5245bd53edce' class='mouseoverHref'>Gomon, M.F., Bray, D.J. & Kuiter, R.H. (eds). <em>Fishes of Australia's Southern Coast</em>. Sydney : Reed New Holland 928 pp.</a><!--MARK-->","","Chapter in Book","ac12c2c6-277b-46a6-8c71-4bea78467da6","20130206T06:23:38.108+0000","e205665c-ad46-4029-8a08-5245bd53edce"
"Allen, G.R. & Leggett, R.","1990","A collection of freshwater fishes from the Kimberley region of Western Australia","527-545 fig. 1","","Records of the Western Australian Museum","","","","<!--MARK--><a href='null5b9d769a-803e-4fb0-bdb7-e3cf92d9b3b4' class='mouseoverHref'>Allen, G.R. & Leggett, R. 1990. A collection of freshwater fishes from the Kimberley region of Western Australia.</a> <!--MARK--><!--MARK--><a href='nulla2cbd1fb-97d5-493a-a1d7-c2b99709890b' class='mouseoverHref'><em>Records of the Western Australian Museum</em></a> <strong>14</strong>(4): 527-545 fig. 1<!--MARK-->","","Article in Journal","5b9d769a-803e-4fb0-bdb7-e3cf92d9b3b4","20081009T05:11:37.000+0000","a2cbd1fb-97d5-493a-a1d7-c2b99709890b"
"Allen, G.R. & Morrison, S.","1996","A new species of cardinalfish (Apogonidae) from northern Australia","439-442","","Records of the Western Australian Museum","","","","<!--MARK--><a href='null41542cd7-6371-47e8-8f80-d1e768825c1b' class='mouseoverHref'>Allen, G.R. & Morrison, S. 1996. A new species of cardinalfish (Apogonidae) from northern Australia.</a> <!--MARK--><!--MARK--><a href='nulla2cbd1fb-97d5-493a-a1d7-c2b99709890b' class='mouseoverHref'><em>Records of the Western Australian Museum</em></a> <strong>17</strong>: 439-442<!--MARK-->","","Article in Journal","41542cd7-6371-47e8-8f80-d1e768825c1b","20081009T05:11:37.000+0000","a2cbd1fb-97d5-493a-a1d7-c2b99709890b"
"Allen, G.R. & Randall, J.E.","1993","Three new species of cardinalfishes (Apogonidae) from Australia and adjacent seas","107-114","","Revue Française d'Aquariologie et Herpétologie","","","","<!--MARK--><a href='null09e7a3bc-e584-4858-800c-4b9807831d79' class='mouseoverHref'>Allen, G.R. & Randall, J.E. 1993. Three new species of cardinalfishes (Apogonidae) from Australia and adjacent seas.</a> <!--MARK--><!--MARK--><a href='nullbb9f1b45-3680-4962-91e4-f26c029236ec' class='mouseoverHref'><em>Revue Française d'Aquariologie et Herpétologie</em></a> <strong>19</strong>(4): 107-114<!--MARK-->","","Article in Journal","09e7a3bc-e584-4858-800c-4b9807831d79","20081009T05:11:37.000+0000","bb9f1b45-3680-4962-91e4-f26c029236ec"
"Allen, G.R. & Randall, J.E.","1995","<i>Apogon virgulatus</i> Allen et Randall, a junior synonym of <i>Apogon cavitiensis</i> (Jordan et Seale)","10","","Revue Française d'Aquariologie et Herpétologie","","","","<!--MARK--><a href='null8d985d3e-4fd7-4a99-8627-290714d57a83' class='mouseoverHref'>Allen, G.R. & Randall, J.E. 1995. <i>Apogon virgulatus</i> Allen et Randall, a junior synonym of <i>Apogon cavitiensis</i> (Jordan et Seale).</a> <!--MARK--><!--MARK--><a href='nullbb9f1b45-3680-4962-91e4-f26c029236ec' class='mouseoverHref'><em>Revue Française d'Aquariologie et Herpétologie</em></a> <strong>22</strong>(1/2): 10<!--MARK-->","","Article in Journal","8d985d3e-4fd7-4a99-8627-290714d57a83","20081009T05:11:37.000+0000","bb9f1b45-3680-4962-91e4-f26c029236ec"
"Allen, G.R. & Randall, J.E.","2002","Four new Indo-Pacific species of cardinalfishes (Apogonidae)","115-126","","Aqua, Journal of Ichthyology and Aquatic Biology","","","","<!--MARK--><a href='null1c0e3dc0-8b3e-407a-a86a-f6a156a461d3' class='mouseoverHref'>Allen, G.R. & Randall, J.E. 2002. Four new Indo-Pacific species of cardinalfishes (Apogonidae).</a> <!--MARK--><!--MARK--><a href='null18ef42ff-f4e9-4fef-b478-d5db6753e0f1' class='mouseoverHref'><em>Aqua, Journal of Ichthyology and Aquatic Biology</em></a> <strong>5</strong>(3): 115-126<!--MARK-->","","Article in Journal","1c0e3dc0-8b3e-407a-a86a-f6a156a461d3","20081009T05:11:37.000+0000","18ef42ff-f4e9-4fef-b478-d5db6753e0f1"
"Allen, G.R. & Russell, B.C.","1986","Part VII Fishes","pp. 79-103","","Records of the Western Australian Museum, Supplement","Faunal Surveys of the Rowley Shoals, Scott Reef and Seringapatam Reef, northwestern Australia","","","<!--MARK--><a href='null479cfa1d-a10c-4ff6-96a7-a0f1f2ac1d59' class='mouseoverHref'>Allen, G.R. & Russell, B.C. 1986. Part VII Fishes. pp. 79-103</a> <!--MARK--><em>in</em> <!--MARK--><a href='null5209abd4-8a29-4ec1-b62e-893b05ac485b' class='mouseoverHref'>Berry, P.F. (ed.). Faunal Surveys of the Rowley Shoals, Scott Reef and Seringapatam Reef, northwestern Australia.</a> <!--MARK--><!--MARK--><a href='null841f1546-1bce-4548-adc9-7b08f6ca73a0' class='mouseoverHref'><em>Records of the Western Australian Museum, Supplement</em></a> <strong>25</strong>: 1-106<!--MARK-->","","Section in Article","479cfa1d-a10c-4ff6-96a7-a0f1f2ac1d59","20160601T03:21:10.537+0000","5209abd4-8a29-4ec1-b62e-893b05ac485b"
"Allen, G.R. & Smith-Vaniz, W.F.","1994","Fishes of Cocos (Keeling) Islands","1-21","","Atoll Research Bulletin","","","","<!--MARK--><a href='null61e4b3b1-043a-42c9-949f-201d6cd9e4d9' class='mouseoverHref'>Allen, G.R. & Smith-Vaniz, W.F. 1994. Fishes of Cocos (Keeling) Islands.</a> <!--MARK--><!--MARK--><a href='nulle8af906e-85ad-460a-8ffc-f90b6e844394' class='mouseoverHref'><em>Atoll Research Bulletin</em></a> <strong>412</strong>: 1-21<!--MARK-->","","Article in Journal","61e4b3b1-043a-42c9-949f-201d6cd9e4d9","20111113T22:11:16.842+0000","e8af906e-85ad-460a-8ffc-f90b6e844394"
"Allen, G.R. & Steene, R.C.","1979","<i>The Fishes of Christmas Island, Indian Ocean</i>","","","","","","","<!--MARK--><a href='nullfbf896a6-219e-4ad1-b868-504edb4242c6' class='mouseoverHref'>Allen, G.R. & Steene, R.C. 1979. <i>The Fishes of Christmas Island, Indian Ocean</i>. Aust. Natl. Parks Wldlf. Ser. Spec. Publ. 2. Canberra : Australian Government Publishing Service 81 pp. 15 pls.</a>","","Miscellaneous","fbf896a6-219e-4ad1-b868-504edb4242c6","20081009T05:11:37.000+0000",""
"Allen, G.R. & Steene, R.C.","1988","Fishes of Christmas Island Indian Ocean","197 pp.","","","","","Christmas Island Natural History Association","<!--MARK--><a href='nullce4c22a4-3185-4aea-84be-a5e5653912fc' class='mouseoverHref'>Allen, G.R. & Steene, R.C. 1988. <em>Fishes of Christmas Island Indian Ocean</em>. Christmas Island : Christmas Island Natural History Association 197 pp.</a><!--MARK-->","","Book","ce4c22a4-3185-4aea-84be-a5e5653912fc","20130606T06:28:28.462+0000",""
"Allen, G.R. & Swainston, R.","1988","The Marine Fishes of North-Western Australia. A field guide for anglers and divers","vi 201 pp., 70 pls","","","","","Western Australian Museum","<!--MARK--><a href='null370d86f7-c121-49b9-9b97-511231fd781f' class='mouseoverHref'>Allen, G.R. & Swainston, R. 1988. <em>The Marine Fishes of North-Western Australia. A field guide for anglers and divers</em>. Perth, WA : Western Australian Museum vi 201 pp., 70 pls.</a><!--MARK-->","","Book","370d86f7-c121-49b9-9b97-511231fd781f","20111021T02:50:26.431+0000",""
"Alleyne, H.G. & Macleay, W.J.","1877","The ichthyology of the <i>Chevert</i> Expedition","261-281, 321-359, pls 3-9, 10-17","","Proceedings of the Linnean Society of New South Wales","","","","<!--MARK--><a href='nulla73b41de-e2c9-4e9b-94be-6e834192270f' class='mouseoverHref'>Alleyne, H.G. & Macleay, W.J. 1877. The ichthyology of the <i>Chevert</i> Expedition.</a> <!--MARK--><!--MARK--><a href='nullc12cd779-adb5-41ea-bd2c-75f6864cf22e' class='mouseoverHref'><em>Proceedings of the Linnean Society of New South Wales</em></a> <strong>1</strong>(3-4): 261-281, 321-359, pls 3-9, 10-17<!--MARK--> [pp. 261-281, pls 3-9 published Feb 1877; pp. 321-359, pls 10-17 published Mar 1877]","pp. 261-281, pls 3-9 published Feb 1877; pp. 321-359, pls 10-17 published Mar 1877","Article in Journal","a73b41de-e2c9-4e9b-94be-6e834192270f","20121213T04:29:24.029+0000","c12cd779-adb5-41ea-bd2c-75f6864cf22e"
"Baldwin, C.C. & Johnson, G.D.","1999","<i>Paxton concilians</i>: a new genus and species of pseudamine apogonid (Teleostei: Percoidei) from northwestern Australia: The sister group of the enigmatic <i>Gymnapogon</i>","1050-1071","","Copeia","","","","<!--MARK--><a href='null875db02c-f572-41d2-8c32-a6c3ac02d852' class='mouseoverHref'>Baldwin, C.C. & Johnson, G.D. 1999. <i>Paxton concilians</i>: a new genus and species of pseudamine apogonid (Teleostei: Percoidei) from northwestern Australia: The sister group of the enigmatic <i>Gymnapogon</i>.</a> <!--MARK--><!--MARK--><a href='nullf65f55ee-d862-41a2-8c61-e252ae15bcf7' class='mouseoverHref'><em>Copeia</em></a> <strong>1999</strong>(4): 1050-1071<!--MARK-->","","Article in Journal","875db02c-f572-41d2-8c32-a6c3ac02d852","20081009T05:11:37.000+0000","f65f55ee-d862-41a2-8c61-e252ae15bcf7"
"Bennett, E.T.","1836","Characters of several fishes from the Isle of France.","206-208","","Proceedings of the General Meetings for Scientific Business of the Zoological Society of London","","","","<!--MARK--><a href='nulle3819eb8-ef59-401b-bdca-c8e05987d07a' class='mouseoverHref'>Bennett, E.T. 1836. Characters of several fishes from the Isle of France.</a> <!--MARK--><!--MARK--><a href='nullaa3598c2-8bec-411e-ad76-c294b8f21426' class='mouseoverHref'><em>Proceedings of the General Meetings for Scientific Business of the Zoological Society of London</em></a> <strong>1835</strong>(3): 206-208<!--MARK-->","","Article in Journal","e3819eb8-ef59-401b-bdca-c8e05987d07a","20111029T07:28:58.880+0000","aa3598c2-8bec-411e-ad76-c294b8f21426"
"Bleeker, P.","1848","A contribution to the knowledge of the ichthyological fauna of Sumbawa","632-639","","Journal of the Indian Archipelago & Eastern Asia","","","","<!--MARK--><a href='nullb513c128-9ded-4ae9-ac0a-7b3b24ff899a' class='mouseoverHref'>Bleeker, P. 1848. A contribution to the knowledge of the ichthyological fauna of Sumbawa.</a> <!--MARK--><!--MARK--><a href='nulld72ea92d-81ab-47e2-bbb4-1eed852f0369' class='mouseoverHref'><em>Journal of the Indian Archipelago & Eastern Asia</em></a> <strong>2</strong>(9): 632-639<!--MARK-->","","Article in Journal","b513c128-9ded-4ae9-ac0a-7b3b24ff899a","20081009T05:11:37.000+0000","d72ea92d-81ab-47e2-bbb4-1eed852f0369"
