"PUB_AUTHOR","PUB_YEAR","PUB_TITLE","PUB_PAGES","PUB_PARENT_BOOK_TITLE","PUB_PARENT_JOURNAL_TITLE","PUB_PARENT_ARTICLE_TITLE","PUB_PUBLICATION_DATE","PUB_PUBLISHER","PUB_FORMATTED","PUB_QUALIFICATION","PUB_TYPE","PUBLICATION_GUID","PUBLICATION_LAST_UPDATE","PARENT_PUBLICATION_GUID"
"Taylor, R.W.","1991","Nomenclature and ditribution of some Australasian ants of the Myrmicinae (Hymenoptera: Formicidae)","599-614","","Memoirs of the Queensland Museum","","","","<!--MARK--><a href='nullfb787cbc-f7b8-4de5-8e4c-20e02b3f3f69' class='mouseoverHref'>Taylor, R.W. 1991. Nomenclature and ditribution of some Australasian ants of the Myrmicinae (Hymenoptera: Formicidae).</a> <!--MARK--><!--MARK--><a href='null1a0a2982-9f30-43e1-a641-b0379699837c' class='mouseoverHref'><em>Memoirs of the Queensland Museum</em></a> <strong>30</strong>: 599-614<!--MARK-->","","Article in Journal","fb787cbc-f7b8-4de5-8e4c-20e02b3f3f69","20081009T05:11:37.000+0000","1a0a2982-9f30-43e1-a641-b0379699837c"
"Viehmeyer, H.","1914","Neue und unvollständig bekannte Ameisen der Alten Welt","24-60","","Archiv für Naturgeschichte","","","","<!--MARK--><a href='nullc8329eb1-1eb7-4c0c-b810-00b19c390b93' class='mouseoverHref'>Viehmeyer, H. 1914. Neue und unvollständig bekannte Ameisen der Alten Welt.</a> <!--MARK--><!--MARK--><a href='nullf5b5f7c7-fc53-4502-951d-1c96b680d874' class='mouseoverHref'><em>Archiv für Naturgeschichte</em></a> <strong>79A [1913]</strong>(12): 24-60<!--MARK-->","","Article in Journal","c8329eb1-1eb7-4c0c-b810-00b19c390b93","20140430T23:24:28.232+0000","f5b5f7c7-fc53-4502-951d-1c96b680d874"
"Viehmeyer, H.","1924","Formiciden der australischen Faunenregion","310-319","","Entomologische Mitteilungen. Berlin-Dahlem","","","","<!--MARK--><a href='null865f42b5-ca42-471f-8c3f-1c0a5d232182' class='mouseoverHref'>Viehmeyer, H. 1924. Formiciden der australischen Faunenregion.</a> <!--MARK--><!--MARK--><a href='nullac06ba2d-be9d-4dfe-91bb-bb21ae357dec' class='mouseoverHref'><em>Entomologische Mitteilungen. Berlin-Dahlem</em></a> <strong>13</strong>: 310-319<!--MARK-->","","Article in Journal","865f42b5-ca42-471f-8c3f-1c0a5d232182","20081009T05:11:37.000+0000","ac06ba2d-be9d-4dfe-91bb-bb21ae357dec"
"Viehmeyer, H.","1925","Formiciden der australischen Faunenregion","25-39","","Entomologische Mitteilungen. Berlin-Dahlem","","","","<!--MARK--><a href='null54a0ffd9-d1cd-4ca2-8055-f007cf34498f' class='mouseoverHref'>Viehmeyer, H. 1925. Formiciden der australischen Faunenregion.</a> <!--MARK--><!--MARK--><a href='nullac06ba2d-be9d-4dfe-91bb-bb21ae357dec' class='mouseoverHref'><em>Entomologische Mitteilungen. Berlin-Dahlem</em></a> <strong>14</strong>: 25-39<!--MARK-->","","Article in Journal","54a0ffd9-d1cd-4ca2-8055-f007cf34498f","20081009T05:11:37.000+0000","ac06ba2d-be9d-4dfe-91bb-bb21ae357dec"
"Ward, P.S., Brady, S.G., Fisher, B.L. & Schultz, T.R.","2015","The evolution of myrmicine ants: phylogeny and biogeography of a hyperdiverse ant clade (Hymenoptera: Formicidae)","61-81","","Systematic Entomology","","January 2015","","<!--MARK--><a href='nullf7ee81d7-22e1-48eb-9175-63f024bb267c' class='mouseoverHref'>Ward, P.S., Brady, S.G., Fisher, B.L. & Schultz, T.R. 2015. The evolution of myrmicine ants: phylogeny and biogeography of a hyperdiverse ant clade (Hymenoptera: Formicidae).</a> <!--MARK--><!--MARK--><a href='null129a4a7d-1c4c-4650-87ea-27d58ad726d5' class='mouseoverHref'><em>Systematic Entomology</em></a> <strong>40</strong>(1): 61-81<!--MARK--> [Date published January 2015: Published online (Early View) on 23 July 2014. However, the ZooBank registration entry for this article does not give the name and internet address of an organization other than the publisher that is intended to permanently archive the work. Under ICZN Article 8.5.3.1 the online (Early View) version of this paper does not meet the ICZN criteria for electronic publication and therefore the publication date for nomenclatural purposes is January 2015, the date of print publication.]","Published online (Early View) on 23 July 2014. However, the ZooBank registration entry for this article does not give the name and internet address of an organization other than the publisher that is intended to permanently archive the work. Under ICZN Article 8.5.3.1 the online (Early View) version of this paper does not meet the ICZN criteria for electronic publication and therefore the publication date for nomenclatural purposes is January 2015, the date of print publication.","Article in Journal","f7ee81d7-22e1-48eb-9175-63f024bb267c","20181212T05:27:15.206+0000","129a4a7d-1c4c-4650-87ea-27d58ad726d5"
"Westwood, J.O.","1841","Observations on the genus <i>Typhlopone</i>, with descriptions of several exotic species of ants","81-89","","Annals and Magazine of Natural History","","","","<!--MARK--><a href='nullea88341e-580e-43b1-8a81-b358135b1590' class='mouseoverHref'>Westwood, J.O. 1841. Observations on the genus <i>Typhlopone</i>, with descriptions of several exotic species of ants.</a> <!--MARK--><!--MARK--><a href='nullefa8de69-3a29-4a43-8ef2-cbefda205976' class='mouseoverHref'><em>Annals and Magazine of Natural History</em></a> 1 <strong>6</strong>: 81-89<!--MARK-->","","Article in Journal","ea88341e-580e-43b1-8a81-b358135b1590","20081009T05:11:37.000+0000","efa8de69-3a29-4a43-8ef2-cbefda205976"
"Wheeler, W.M.","1915","Two new genera of myrmicine ants from Brazil","483-491","","Bulletin of the Museum of Comparative Zoology, Harvard","","","","<!--MARK--><a href='nullc9bce4b9-b3bd-47fc-8394-2153ddd58654' class='mouseoverHref'>Wheeler, W.M. 1915. Two new genera of myrmicine ants from Brazil.</a> <!--MARK--><!--MARK--><a href='nullb2447030-bd13-4a45-9402-157082169a3d' class='mouseoverHref'><em>Bulletin of the Museum of Comparative Zoology, Harvard</em></a> <strong>59</strong>: 483-491<!--MARK-->","","Article in Journal","c9bce4b9-b3bd-47fc-8394-2153ddd58654","20081009T05:11:37.000+0000","b2447030-bd13-4a45-9402-157082169a3d"
"Wheeler, W.M.","1916","The Australian ants of the genus <i>Aphaenogaster</i> Mayr","213-223 pls 21-22","","Transactions of the Royal Society of South Australia","","","","<!--MARK--><a href='nullaa188fb8-6746-48a7-8213-088621085d8e' class='mouseoverHref'>Wheeler, W.M. 1916. The Australian ants of the genus <i>Aphaenogaster</i> Mayr.</a> <!--MARK--><!--MARK--><a href='null8b48b0a3-dd7a-4aea-be0d-10a223710ebc' class='mouseoverHref'><em>Transactions of the Royal Society of South Australia</em></a> <strong>40</strong>: 213-223 pls 21-22<!--MARK--> [23 Dec. 1916]","23 Dec. 1916","Article in Journal","aa188fb8-6746-48a7-8213-088621085d8e","20081009T05:11:37.000+0000","8b48b0a3-dd7a-4aea-be0d-10a223710ebc"
"Wheeler, W.M.","1927","Ants collected by Professor F. Silvestri in Indochina","83-106","","Bollettino del Laboratorio di Zoologia Generale e Agraria della Facoltà Agraria in Portici","","","","<!--MARK--><a href='nullda06fe9c-c717-462e-98e4-1688d9eee119' class='mouseoverHref'>Wheeler, W.M. 1927. Ants collected by Professor F. Silvestri in Indochina.</a> <!--MARK--><!--MARK--><a href='null42089d4a-282f-4e49-931e-0fa8d2595891' class='mouseoverHref'><em>Bollettino del Laboratorio di Zoologia Generale e Agraria della Facoltà Agraria in Portici</em></a> <strong>20</strong>: 83-106<!--MARK--> [6 May 1927]","6 May 1927","Article in Journal","da06fe9c-c717-462e-98e4-1688d9eee119","20081009T05:11:37.000+0000","42089d4a-282f-4e49-931e-0fa8d2595891"
"Wheeler, W.M.","1927","The ants of Lord Howe Island and Norfolk Island","121-153","","Proceedings of the American Academy of Arts and Sciences","","","","<!--MARK--><a href='null0dfbfe71-fac4-437f-bd40-2cec5f3d2000' class='mouseoverHref'>Wheeler, W.M. 1927. The ants of Lord Howe Island and Norfolk Island.</a> <!--MARK--><!--MARK--><a href='nullf2b4781b-5420-4d64-8c37-1e2f1df0a1e3' class='mouseoverHref'><em>Proceedings of the American Academy of Arts and Sciences</em></a> <strong>62</strong>: 121-153<!--MARK-->","","Article in Journal","0dfbfe71-fac4-437f-bd40-2cec5f3d2000","20081009T05:11:37.000+0000","f2b4781b-5420-4d64-8c37-1e2f1df0a1e3"
"Wheeler, W.M.","1927","The physiognomy of insects","1-36","","Quarterly Review of Biology","","","","<!--MARK--><a href='nullbef28a02-227e-46a7-a8ec-be7341d27477' class='mouseoverHref'>Wheeler, W.M. 1927. The physiognomy of insects.</a> <!--MARK--><!--MARK--><a href='null8d554478-3acf-44e6-a7e5-c053c3c9c1ef' class='mouseoverHref'><em>Quarterly Review of Biology</em></a> <strong>2</strong>: 1-36<!--MARK-->","","Article in Journal","bef28a02-227e-46a7-a8ec-be7341d27477","20081009T05:11:37.000+0000","8d554478-3acf-44e6-a7e5-c053c3c9c1ef"
