"PUB_AUTHOR","PUB_YEAR","PUB_TITLE","PUB_PAGES","PUB_PARENT_BOOK_TITLE","PUB_PARENT_JOURNAL_TITLE","PUB_PARENT_ARTICLE_TITLE","PUB_PUBLICATION_DATE","PUB_PUBLISHER","PUB_FORMATTED","PUB_QUALIFICATION","PUB_TYPE","PUBLICATION_GUID","PUBLICATION_LAST_UPDATE","PARENT_PUBLICATION_GUID"
"Emery, C.","1914","Formiche d'Australia e di Samoa raccolte dal Prof. Silvestri nel 1913","179-186","","Bollettino del Laboratorio di Zoologia Generale e Agraria della Facoltà Agraria in Portici","","","","<!--MARK--><a href='null10b5adae-a753-400b-9029-28db37c06341' class='mouseoverHref'>Emery, C. 1914. Formiche d'Australia e di Samoa raccolte dal Prof. Silvestri nel 1913.</a> <!--MARK--><!--MARK--><a href='null42089d4a-282f-4e49-931e-0fa8d2595891' class='mouseoverHref'><em>Bollettino del Laboratorio di Zoologia Generale e Agraria della Facoltà Agraria in Portici</em></a> <strong>8</strong>: 179-186<!--MARK--> [30 Jan. 1914]","30 Jan. 1914","Article in Journal","10b5adae-a753-400b-9029-28db37c06341","20081009T05:11:37.000+0000","42089d4a-282f-4e49-931e-0fa8d2595891"
"Emery, C.","1922","Hymenoptera Fam. Formicidae Subfam. Myrmicinae. <i>In</i> Wytsman, P. (ed.) <i>Genera Insectorum.</i> Fasc. 174B pp. 95-206","","","","","","","<!--MARK--><a href='null271cad85-d6db-4e14-916d-540a507871b6' class='mouseoverHref'>Emery, C. 1922. Hymenoptera Fam. Formicidae Subfam. Myrmicinae. <i>In</i> Wytsman, P. (ed.) <i>Genera Insectorum.</i> Fasc. 174B pp. 95-206.</a>","","Miscellaneous","271cad85-d6db-4e14-916d-540a507871b6","20081009T05:11:37.000+0000",""
"Ettershank, G.","1966","A generic revision of the world Myrmicinae related to <i>Solenopsis</i> and <i>Pheidologeton</i> (Hymenoptera: Formicidae)","73-171","","Australian Journal of Zoology","","","","<!--MARK--><a href='nullda0ee5d3-55a9-4b4e-b1c7-69c9af18d2b4' class='mouseoverHref'>Ettershank, G. 1966. A generic revision of the world Myrmicinae related to <i>Solenopsis</i> and <i>Pheidologeton</i> (Hymenoptera: Formicidae).</a> <!--MARK--><!--MARK--><a href='null53c3abd8-0254-4532-a73e-d9ef6b7ac2ef' class='mouseoverHref'><em>Australian Journal of Zoology</em></a> <strong>14</strong>: 73-171<!--MARK-->","","Article in Journal","da0ee5d3-55a9-4b4e-b1c7-69c9af18d2b4","20081009T05:11:37.000+0000","53c3abd8-0254-4532-a73e-d9ef6b7ac2ef"
"Fabricius, J.C.","1793","Entomologia Systematica Emendata et Aucta. Secundum, Classes, Ordines, Genera, Species, adjectis synonimis [sic], locis, observationibus, descriptionibus","viii 519 pp.","","","","","Christ. Gottl. Proft.","<!--MARK--><a href='nullb9ebeabd-b7a9-4e75-92a6-9fac4e6c76ab' class='mouseoverHref'>Fabricius, J.C. 1793. <em>Entomologia Systematica Emendata et Aucta. Secundum, Classes, Ordines, Genera, Species, adjectis synonimis [sic], locis, observationibus, descriptionibus</em>. Hafniae : Christ. Gottl. Proft. Vol. 2 viii 519 pp.</a><!--MARK-->","","Book","b9ebeabd-b7a9-4e75-92a6-9fac4e6c76ab","20150716T00:40:13.644+0000",""
"Forel, A.","1893","Formicides de l'Antille St. Vincent, récoltées par Mons. H. H. Smith","333-418","","Transactions of the Entomological Society of London","","","","<!--MARK--><a href='null60bb7b03-88c0-49e2-b18a-804727e6c15e' class='mouseoverHref'>Forel, A. 1893. Formicides de l'Antille St. Vincent, récoltées par Mons. H. H. Smith.</a> <!--MARK--><!--MARK--><a href='null5cf355b3-abc5-451e-9abc-ed3282d7811a' class='mouseoverHref'><em>Transactions of the Entomological Society of London</em></a> <strong>1893</strong>: 333-418<!--MARK-->","","Article in Journal","60bb7b03-88c0-49e2-b18a-804727e6c15e","20110117T03:31:59.897+0000","5cf355b3-abc5-451e-9abc-ed3282d7811a"
"Forel, A.","1893","Nouvelles fourmis d'Australie et des Canaries","454-466","","Annales de la Société Entomologique de Belgique (Comptes-rendus)","","","","<!--MARK--><a href='nulleb32586e-d135-415b-b3f8-6345633d7c19' class='mouseoverHref'>Forel, A. 1893. Nouvelles fourmis d'Australie et des Canaries.</a> <!--MARK--><!--MARK--><a href='nullacc7fcdb-707a-4cbe-8f70-d7595ac25c58' class='mouseoverHref'><em>Annales de la Société Entomologique de Belgique (Comptes-rendus)</em></a> <strong>37</strong>: 454-466<!--MARK-->","","Article in Journal","eb32586e-d135-415b-b3f8-6345633d7c19","20081009T05:11:37.000+0000","acc7fcdb-707a-4cbe-8f70-d7595ac25c58"
"Forel, A.","1895","Nouvelles fourmis d'Australie, récoltée à The Ridge, Mackay, Queensland par M. Gilbert Turner","417-428","","Annales de la Société Entomologique de Belgique (Comptes-rendus)","","","","<!--MARK--><a href='null9c0e99b7-8d18-4c87-9cd0-57b34e688e09' class='mouseoverHref'>Forel, A. 1895. Nouvelles fourmis d'Australie, récoltée à The Ridge, Mackay, Queensland par M. Gilbert Turner.</a> <!--MARK--><!--MARK--><a href='nullacc7fcdb-707a-4cbe-8f70-d7595ac25c58' class='mouseoverHref'><em>Annales de la Société Entomologique de Belgique (Comptes-rendus)</em></a> <strong>39</strong>: 417-428<!--MARK-->","","Article in Journal","9c0e99b7-8d18-4c87-9cd0-57b34e688e09","20081009T05:11:37.000+0000","acc7fcdb-707a-4cbe-8f70-d7595ac25c58"
"Forel, A.","1902","Fourmis nouvelles d'Australie","405-548","","Revue Suisse de Zoologie","","","","<!--MARK--><a href='nullea03fd29-80e8-4730-ab7b-ce0c94fa3353' class='mouseoverHref'>Forel, A. 1902. Fourmis nouvelles d'Australie.</a> <!--MARK--><!--MARK--><a href='nulldd4d5125-6d92-411c-86c0-7181702e62a5' class='mouseoverHref'><em>Revue Suisse de Zoologie</em></a> <strong>10</strong>: 405-548<!--MARK-->","","Article in Journal","ea03fd29-80e8-4730-ab7b-ce0c94fa3353","20081009T05:11:37.000+0000","dd4d5125-6d92-411c-86c0-7181702e62a5"
"Forel, A.","1907","Formicidae. pp. 263-310 <i>in</i> Michaelsen, W. & Hartmeyer, R. (eds) <i>Die Fauna Südwest-Australiens.</i> Jena : G. Fischer Vol. 1","","","","","","","<!--MARK--><a href='null00c4217b-e151-49b9-a71e-11cb85cb3930' class='mouseoverHref'>Forel, A. 1907. Formicidae. pp. 263-310 <i>in</i> Michaelsen, W. & Hartmeyer, R. (eds) <i>Die Fauna Südwest-Australiens.</i> Jena : G. Fischer Vol. 1.</a>","","Miscellaneous","00c4217b-e151-49b9-a71e-11cb85cb3930","20081009T05:11:37.000+0000",""
"Forel, A.","1910","Formicides australiens reçus de M. M. Froggatt et Rowland Turner","1-94","","Revue Suisse de Zoologie","","","","<!--MARK--><a href='null001b5384-1ce0-4e72-b79a-151ab261df31' class='mouseoverHref'>Forel, A. 1910. Formicides australiens reçus de M. M. Froggatt et Rowland Turner.</a> <!--MARK--><!--MARK--><a href='nulldd4d5125-6d92-411c-86c0-7181702e62a5' class='mouseoverHref'><em>Revue Suisse de Zoologie</em></a> <strong>18</strong>: 1-94<!--MARK-->","","Article in Journal","001b5384-1ce0-4e72-b79a-151ab261df31","20081009T05:11:37.000+0000","dd4d5125-6d92-411c-86c0-7181702e62a5"
"Forel, A.","1913","Fourmis de Tasmanie et d'Australie récoltées par MM. Lea, Froggatt etc","173-196 pl. 2","","Bulletin de la Société Vaudoise des Sciences Naturelles","","","","<!--MARK--><a href='null10ac0741-b1e9-4104-9b2d-2bdd161ee945' class='mouseoverHref'>Forel, A. 1913. Fourmis de Tasmanie et d'Australie récoltées par MM. Lea, Froggatt etc.</a> <!--MARK--><!--MARK--><a href='null7cc7ca27-1066-4ebf-a5b4-4631f8d94eb6' class='mouseoverHref'><em>Bulletin de la Société Vaudoise des Sciences Naturelles</em></a> <strong>49</strong>: 173-196 pl. 2<!--MARK-->","","Article in Journal","10ac0741-b1e9-4104-9b2d-2bdd161ee945","20081009T05:11:37.000+0000","7cc7ca27-1066-4ebf-a5b4-4631f8d94eb6"
"Forel, A.","1913","Wissenschaftliche Ergebnisse einer Forschungsreise nach Ostindien ausgeführt im Auftrage der Kgl. Preuss. Akademie der Wissenschaften zu Berlin von H. v. Buttel-Reepen. II. Ameisen aus Sumatra, Java, Malacca und Ceylon. Gesammelt von Herrn Prof. Dr. v. Buttel-Reepen in den Jahren 1911-1912","1-148","","Zoologische Jahrbücher. Abteilung für Systematik, Geographie und Biologie der Tiere","","","","<!--MARK--><a href='null7c57663d-45e3-4d7d-a5b7-018f2cde347f' class='mouseoverHref'>Forel, A. 1913. Wissenschaftliche Ergebnisse einer Forschungsreise nach Ostindien ausgeführt im Auftrage der Kgl. Preuss. Akademie der Wissenschaften zu Berlin von H. v. Buttel-Reepen. II. Ameisen aus Sumatra, Java, Malacca und Ceylon. Gesammelt von Herrn Prof. Dr. v. Buttel-Reepen in den Jahren 1911-1912.</a> <!--MARK--><!--MARK--><a href='null8510249c-347d-4bba-83dd-820829fb4260' class='mouseoverHref'><em>Zoologische Jahrbücher. Abteilung für Systematik, Geographie und Biologie der Tiere</em></a> <strong>36</strong>: 1-148<!--MARK-->","","Article in Journal","7c57663d-45e3-4d7d-a5b7-018f2cde347f","20181129T01:24:18.398+0000","8510249c-347d-4bba-83dd-820829fb4260"
"Forel, A.","1914","Einige amerikanische Ameisen","615-620","","Deutsche Entomologische Zeitschrift","","","","<!--MARK--><a href='nulle5ad2edc-ef5f-4827-93c0-53abb6331b5f' class='mouseoverHref'>Forel, A. 1914. Einige amerikanische Ameisen.</a> <!--MARK--><!--MARK--><a href='nullbdeb8163-7175-47c9-be9b-28f797c57745' class='mouseoverHref'><em>Deutsche Entomologische Zeitschrift</em></a> <strong>1914</strong>: 615-620<!--MARK--> [10 Dec. 1914]","10 Dec. 1914","Article in Journal","e5ad2edc-ef5f-4827-93c0-53abb6331b5f","20081009T05:11:37.000+0000","bdeb8163-7175-47c9-be9b-28f797c57745"
"Forel, A.","1915","Results of Dr. E. Mjöbergs Swedish Scientific Expeditions to Australia 1910-1913. 2. Ameisen","1-119, pls 1-3","","Arkiv för Zoologi","","4 Dec. 1915","","<!--MARK--><a href='null754605fe-9d76-4139-a599-27700cd29d6c' class='mouseoverHref'>Forel, A. 1915. Results of Dr. E. Mjöbergs Swedish Scientific Expeditions to Australia 1910-1913. 2. Ameisen.</a> <!--MARK--><!--MARK--><a href='nullea0f28cc-317a-4542-aaf0-5fa8122b7a93' class='mouseoverHref'><em>Arkiv för Zoologi</em></a> <strong>9</strong>(no.16): 1-119, pls 1-3<!--MARK--> [Date published 4 Dec. 1915]","","Article in Journal","754605fe-9d76-4139-a599-27700cd29d6c","20170119T05:38:42.679+0000","ea0f28cc-317a-4542-aaf0-5fa8122b7a93"
"Framenau, V.W. & Thomas, M.L.","2008","Ants (Hymenoptera: Formicidae) of Christmas Island (Indian Ocean): identification and distribution.","45-85","","Records of the Western Australian Museum","","","","<!--MARK--><a href='nulla69c0f66-cdca-4741-8b6a-2fb97e2379bd' class='mouseoverHref'>Framenau, V.W. & Thomas, M.L. 2008. Ants (Hymenoptera: Formicidae) of Christmas Island (Indian Ocean): identification and distribution.</a> <!--MARK--><!--MARK--><a href='nulla2cbd1fb-97d5-493a-a1d7-c2b99709890b' class='mouseoverHref'><em>Records of the Western Australian Museum</em></a> <strong>25</strong>: 45-85<!--MARK-->","","Article in Journal","a69c0f66-cdca-4741-8b6a-2fb97e2379bd","20150310T00:29:15.918+0000","a2cbd1fb-97d5-493a-a1d7-c2b99709890b"
"Heterick, B.E.","2013","A taxonomic overview and key to the ants of Barrow Island, Western Australia","375-404","","Records of the Western Australian Museum, Supplement","","","","<!--MARK--><a href='null8c43a6c0-7d42-43ad-8b7c-97dad42f2bf6' class='mouseoverHref'>Heterick, B.E. 2013. A taxonomic overview and key to the ants of Barrow Island, Western Australia.</a> <!--MARK--><!--MARK--><a href='null841f1546-1bce-4548-adc9-7b08f6ca73a0' class='mouseoverHref'><em>Records of the Western Australian Museum, Supplement</em></a> <strong>83</strong>: 375-404<!--MARK-->","","Article in Journal","8c43a6c0-7d42-43ad-8b7c-97dad42f2bf6","20140327T02:14:35.059+0000","841f1546-1bce-4548-adc9-7b08f6ca73a0"
"Jennings, J.T. & Austin, A.D.","2015","Synopsis of the hymenopteran fauna of Lord Howe Island with a preliminary checklist of species.","423-432","","Zootaxa","","","","<!--MARK--><a href='null2ba1ece5-913c-4e62-84d8-2d2a7283491a' class='mouseoverHref'>Jennings, J.T. & Austin, A.D. 2015. Synopsis of the hymenopteran fauna of Lord Howe Island with a preliminary checklist of species.</a> <!--MARK--><!--MARK--><a href='null96466227-221c-4922-ac97-1ac2dd946d0a' class='mouseoverHref'><em>Zootaxa</em></a> <strong>3931</strong>(3): 423-432<!--MARK-->","","Article in Journal","2ba1ece5-913c-4e62-84d8-2d2a7283491a","20150317T00:48:53.218+0000","96466227-221c-4922-ac97-1ac2dd946d0a"
"Lowery, B.B.","1967","A new ant of the dacetine genus <i>Orectognathus</i> (Hymenoptera: Formicidae)","137-140","","Journal of the Australian Entomological Society","","","","<!--MARK--><a href='null23608120-d240-48f9-932b-f5cbd1ededad' class='mouseoverHref'>Lowery, B.B. 1967. A new ant of the dacetine genus <i>Orectognathus</i> (Hymenoptera: Formicidae).</a> <!--MARK--><!--MARK--><a href='nullc2544f9f-3978-4f18-846d-a1fd3122c9c4' class='mouseoverHref'><em>Journal of the Australian Entomological Society</em></a> <strong>6</strong>: 137-140<!--MARK--> [31 Dec. 1967]","31 Dec. 1967","Article in Journal","23608120-d240-48f9-932b-f5cbd1ededad","20081009T05:11:37.000+0000","c2544f9f-3978-4f18-846d-a1fd3122c9c4"
"Mayr, G.","1886","Notizen über die Formiciden-Sammlung des British Museum in London. Verhandlungen der Kaiserlich-Koniglichen Zoologisch-Botanischen Gesellschaft in Wien","353-368","","Verhandlungen der Kaiserlich-Königlichen Zoologisch-Botanischen Gesellschaft in Wien","","","","<!--MARK--><a href='nullc52e155e-555b-4dfa-86b0-753edd57d1c1' class='mouseoverHref'>Mayr, G. 1886. Notizen über die Formiciden-Sammlung des British Museum in London. Verhandlungen der Kaiserlich-Koniglichen Zoologisch-Botanischen Gesellschaft in Wien.</a> <!--MARK--><!--MARK--><a href='null04643168-c24d-442d-a674-92644cd7d4ae' class='mouseoverHref'><em>Verhandlungen der Kaiserlich-Königlichen Zoologisch-Botanischen Gesellschaft in Wien</em></a> <strong>36</strong>: 353-368<!--MARK-->","","Article in Journal","c52e155e-555b-4dfa-86b0-753edd57d1c1","20140624T01:13:02.696+0000","04643168-c24d-442d-a674-92644cd7d4ae"
"Mayr, G.L.","1866","Myrmecologische Beiträge","484-517","","Sitzungsberichte der Akademie der Wissenschaften in Wien","","","","<!--MARK--><a href='null490d944d-e86d-4a27-b529-b1e1e0d33e69' class='mouseoverHref'>Mayr, G.L. 1866. Myrmecologische Beiträge.</a> <!--MARK--><!--MARK--><a href='null0f062e5b-29e5-4a6a-b0d9-9bcdad1024c9' class='mouseoverHref'><em>Sitzungsberichte der Akademie der Wissenschaften in Wien</em></a> <strong>53</strong>(1): 484-517<!--MARK-->","","Article in Journal","490d944d-e86d-4a27-b529-b1e1e0d33e69","20081009T05:11:37.000+0000","0f062e5b-29e5-4a6a-b0d9-9bcdad1024c9"
"Mayr, G.L.","1870","Formicidae Novogranadenses","370-417 pl.","","Sitzungsberichte der Akademie der Wissenschaften in Wien","","","","<!--MARK--><a href='nullf099efdd-5ee3-459b-a37a-20c37157f3d0' class='mouseoverHref'>Mayr, G.L. 1870. Formicidae Novogranadenses.</a> <!--MARK--><!--MARK--><a href='null0f062e5b-29e5-4a6a-b0d9-9bcdad1024c9' class='mouseoverHref'><em>Sitzungsberichte der Akademie der Wissenschaften in Wien</em></a> 1 <strong>61</strong>: 370-417 pl.<!--MARK-->","","Article in Journal","f099efdd-5ee3-459b-a37a-20c37157f3d0","20081009T05:11:37.000+0000","0f062e5b-29e5-4a6a-b0d9-9bcdad1024c9"
"Mayr, G.L.","1876","Die australischen Formiciden","56-115","","Journal des Museum Godeffroy, Hamburg","","","","<!--MARK--><a href='null670b4945-3376-478b-9cd3-c0553d5a3421' class='mouseoverHref'>Mayr, G.L. 1876. Die australischen Formiciden.</a> <!--MARK--><!--MARK--><a href='null28313c9a-6bca-4375-9643-f488f6e53c98' class='mouseoverHref'><em>Journal des Museum Godeffroy, Hamburg</em></a> <strong>5</strong>: 56-115<!--MARK-->","","Article in Journal","670b4945-3376-478b-9cd3-c0553d5a3421","20081009T05:11:37.000+0000","28313c9a-6bca-4375-9643-f488f6e53c98"
"Mercovich, T.C.","1958","A new species of the genus <i>Orectognathus</i>","195-198","","Memoirs of the Queensland Museum","","","","<!--MARK--><a href='null86fa5218-5ec5-419f-b461-17d7b38d9aea' class='mouseoverHref'>Mercovich, T.C. 1958. A new species of the genus <i>Orectognathus</i>.</a> <!--MARK--><!--MARK--><a href='null1a0a2982-9f30-43e1-a641-b0379699837c' class='mouseoverHref'><em>Memoirs of the Queensland Museum</em></a> <strong>13</strong>: 195-198<!--MARK--> [28 July 1958]","28 July 1958","Article in Journal","86fa5218-5ec5-419f-b461-17d7b38d9aea","20081009T05:11:37.000+0000","1a0a2982-9f30-43e1-a641-b0379699837c"
"Pettit, M.J. & Andersen, A.N.","2021","A new species of <i>Epopostruma</i> (Hymenoptera: Formicidae) from monsoonal Australia","141-144","","Zootaxa","","","","<!--MARK--><a href='null9136eb67-989e-4789-a3e6-ae2022bdc9b1' class='mouseoverHref'>Pettit, M.J. & Andersen, A.N. 2021. A new species of <i>Epopostruma</i> (Hymenoptera: Formicidae) from monsoonal Australia.</a> <!--MARK--><!--MARK--><a href='null96466227-221c-4922-ac97-1ac2dd946d0a' class='mouseoverHref'><em>Zootaxa</em></a> <strong>5048</strong>(1): 141-144<!--MARK-->","","Article in Journal","9136eb67-989e-4789-a3e6-ae2022bdc9b1","20220409T06:20:47.260+0000","96466227-221c-4922-ac97-1ac2dd946d0a"
"Roger, J.","1862","Einige neue exotische Ameisen - Gattungen und Arten","233-254 pl. 1","","Berliner Entomologische Zeitschrift","","","","<!--MARK--><a href='null98742787-beaf-4ea9-8753-67bec6b0f2dd' class='mouseoverHref'>Roger, J. 1862. Einige neue exotische Ameisen - Gattungen und Arten.</a> <!--MARK--><!--MARK--><a href='null9cb53f48-ac05-481f-9276-81372f651531' class='mouseoverHref'><em>Berliner Entomologische Zeitschrift</em></a> <strong>6</strong>: 233-254 pl. 1<!--MARK-->","","Article in Journal","98742787-beaf-4ea9-8753-67bec6b0f2dd","20081009T05:11:37.000+0000","9cb53f48-ac05-481f-9276-81372f651531"
"Roger, J.","1863","Die neu aufgeführten Gattungen und Arten meines Formiciden-Verzeichnisses","129-214","","Berliner Entomologische Zeitschrift","","","","<!--MARK--><a href='null849f6b1a-9d85-4caf-b9ee-2d5dafd37b66' class='mouseoverHref'>Roger, J. 1863. Die neu aufgeführten Gattungen und Arten meines Formiciden-Verzeichnisses.</a> <!--MARK--><!--MARK--><a href='null9cb53f48-ac05-481f-9276-81372f651531' class='mouseoverHref'><em>Berliner Entomologische Zeitschrift</em></a> <strong>7</strong>: 129-214<!--MARK--> [June 1863]","June 1863","Article in Journal","849f6b1a-9d85-4caf-b9ee-2d5dafd37b66","20081009T05:11:37.000+0000","9cb53f48-ac05-481f-9276-81372f651531"
"Shattuck, S.O.","2000","The epopostrumiform genus group","30-67","","Memoirs of the American Entomological Institute","","","","<!--MARK--><a href='nullaaa04aa9-55a8-4524-a294-59cc356a98e5' class='mouseoverHref'>Shattuck, S.O. 2000. The epopostrumiform genus group.</a> <!--MARK--><!--MARK--><a href='null68c5f11e-7ef5-44e0-8361-2a9052a673b6' class='mouseoverHref'><em>Memoirs of the American Entomological Institute</em></a> <strong>65</strong>: 30-67<!--MARK-->","","Article in Journal","aaa04aa9-55a8-4524-a294-59cc356a98e5","20110113T03:11:49.872+0000","68c5f11e-7ef5-44e0-8361-2a9052a673b6"
"Shattuck, S.O.","2007","New species of Myrmicine ants from Western Australia (Hymenoptera: Formicidae)","47-53","","Zootaxa","","","","<!--MARK--><a href='nulla17b0bf9-1e60-4f48-9b42-1783e5a7fdd3' class='mouseoverHref'>Shattuck, S.O. 2007. New species of Myrmicine ants from Western Australia (Hymenoptera: Formicidae).</a> <!--MARK--><!--MARK--><a href='null96466227-221c-4922-ac97-1ac2dd946d0a' class='mouseoverHref'><em>Zootaxa</em></a> <strong>1661</strong>: 47-53<!--MARK-->","","Article in Journal","a17b0bf9-1e60-4f48-9b42-1783e5a7fdd3","20110113T04:16:22.198+0000","96466227-221c-4922-ac97-1ac2dd946d0a"
"Smith, F.","1854","Monograph of the genus <i>Cryptocerus</i>, belonging to the group Cryptoceridae-Family Myrmicidae - Division Hymenoptera Heterogyna","213-228 pls 19-21","","Transactions of the Royal Entomological Society of London","","","","<!--MARK--><a href='nullf50e131f-38d4-4e67-8c11-9ba68ddf5520' class='mouseoverHref'>Smith, F. 1854. Monograph of the genus <i>Cryptocerus</i>, belonging to the group Cryptoceridae-Family Myrmicidae - Division Hymenoptera Heterogyna.</a> <!--MARK--><!--MARK--><a href='nullaa458993-1b17-4c34-bd31-d6f8224d9b7d' class='mouseoverHref'><em>Transactions of the Royal Entomological Society of London</em></a> <strong>7</strong>: 213-228 pls 19-21<!--MARK-->","","Article in Journal","f50e131f-38d4-4e67-8c11-9ba68ddf5520","20081009T05:11:37.000+0000","aa458993-1b17-4c34-bd31-d6f8224d9b7d"
"Smith, F.","1858","Catalogue of hymenopterous insects in the collection of the British Museum. Part 6. Formicidae","216 pp. 14 pls","","","","","British Museum","<!--MARK--><a href='nullcccdfbf9-49f7-41b8-ae7d-090d5affdfb1' class='mouseoverHref'>Smith, F. 1858. <em>Catalogue of hymenopterous insects in the collection of the British Museum. Part 6. Formicidae</em>. London : British Museum 216 pp. 14 pls.</a><!--MARK--> [27 Mar. 1858]","27 Mar. 1858","Book","cccdfbf9-49f7-41b8-ae7d-090d5affdfb1","20081009T05:11:37.000+0000",""
"Smith, F.","1860","Descriptions of new genera and species of exotic hymenoptera","65-84","","Journal of Entomology","","","","<!--MARK--><a href='nullf2bc8924-5ab4-4704-b52a-19b8aa786365' class='mouseoverHref'>Smith, F. 1860. Descriptions of new genera and species of exotic hymenoptera.</a> <!--MARK--><!--MARK--><a href='null594ca738-5ec4-4752-84d7-686b8074e352' class='mouseoverHref'><em>Journal of Entomology</em></a> <strong>1</strong>: 65-84<!--MARK-->","","Article in Journal","f2bc8924-5ab4-4704-b52a-19b8aa786365","20081009T05:11:37.000+0000","594ca738-5ec4-4752-84d7-686b8074e352"
"Smith, F.","1876","Descriptions of three new species of Hymenoptera (Formicidae) from New Zealand","489-492","","Transactions of the Royal Entomological Society of London","","","","<!--MARK--><a href='nulld0f33f0d-87a3-4c60-8e52-585b298fd8c9' class='mouseoverHref'>Smith, F. 1876. Descriptions of three new species of Hymenoptera (Formicidae) from New Zealand.</a> <!--MARK--><!--MARK--><a href='nullaa458993-1b17-4c34-bd31-d6f8224d9b7d' class='mouseoverHref'><em>Transactions of the Royal Entomological Society of London</em></a> <strong>24</strong>: 489-492<!--MARK-->","","Article in Journal","d0f33f0d-87a3-4c60-8e52-585b298fd8c9","20081009T05:11:37.000+0000","aa458993-1b17-4c34-bd31-d6f8224d9b7d"
"Taylor, R.W.","1962","New Australian dacetine ants of the genera <i>Mesostruma</i> Brown and <i>Codiomyrmex</i> Wheeler (Hymenoptera: Formicidae)","1-10","","Breviora. Museum of Comparative Zoology","","","","<!--MARK--><a href='null3a18fd8e-53a4-4a42-891b-bb4cfb2b39a3' class='mouseoverHref'>Taylor, R.W. 1962. New Australian dacetine ants of the genera <i>Mesostruma</i> Brown and <i>Codiomyrmex</i> Wheeler (Hymenoptera: Formicidae).</a> <!--MARK--><!--MARK--><a href='nullb5aca245-716d-4330-9421-57e8fe2d73d8' class='mouseoverHref'><em>Breviora. Museum of Comparative Zoology</em></a> <strong>152</strong>: 1-10<!--MARK--> [15 Jan. 1962]","15 Jan. 1962","Article in Journal","3a18fd8e-53a4-4a42-891b-bb4cfb2b39a3","20081009T05:11:37.000+0000","b5aca245-716d-4330-9421-57e8fe2d73d8"
"Taylor, R.W.","1968","Notes on the Indo-Australian basicerotine ants (Hymenoptera: Formicidae)","333-348","","Australian Journal of Zoology","","","","<!--MARK--><a href='null3c77a6f7-e9b8-451e-963d-e4ac8eb21c7a' class='mouseoverHref'>Taylor, R.W. 1968. Notes on the Indo-Australian basicerotine ants (Hymenoptera: Formicidae).</a> <!--MARK--><!--MARK--><a href='null53c3abd8-0254-4532-a73e-d9ef6b7ac2ef' class='mouseoverHref'><em>Australian Journal of Zoology</em></a> <strong>16</strong>: 333-348<!--MARK-->","","Article in Journal","3c77a6f7-e9b8-451e-963d-e4ac8eb21c7a","20081009T05:11:37.000+0000","53c3abd8-0254-4532-a73e-d9ef6b7ac2ef"
"Taylor, R.W.","1973","Ants of the Australian genus <i>Mesostruma</i> Brown (Hymenoptera: Formicidae)","24-38","","Journal of the Australian Entomological Society","","","","<!--MARK--><a href='nulla10b6edd-33f8-4fc6-b108-5357b74def87' class='mouseoverHref'>Taylor, R.W. 1973. Ants of the Australian genus <i>Mesostruma</i> Brown (Hymenoptera: Formicidae).</a> <!--MARK--><!--MARK--><a href='nullc2544f9f-3978-4f18-846d-a1fd3122c9c4' class='mouseoverHref'><em>Journal of the Australian Entomological Society</em></a> <strong>12</strong>: 24-38<!--MARK-->","","Article in Journal","a10b6edd-33f8-4fc6-b108-5357b74def87","20081009T05:11:37.000+0000","c2544f9f-3978-4f18-846d-a1fd3122c9c4"
"Taylor, R.W.","1977","New ants of the Australasian genus <i>Orectognathus</i>, with a key to the known species (Hymenoptera: Formicidae)","581-612","","Australian Journal of Zoology","","","","<!--MARK--><a href='nullc5c9fd8c-d86a-4657-a7a7-b9a4925a0c55' class='mouseoverHref'>Taylor, R.W. 1977. New ants of the Australasian genus <i>Orectognathus</i>, with a key to the known species (Hymenoptera: Formicidae).</a> <!--MARK--><!--MARK--><a href='null53c3abd8-0254-4532-a73e-d9ef6b7ac2ef' class='mouseoverHref'><em>Australian Journal of Zoology</em></a> <strong>25</strong>: 581-612<!--MARK--> [5 Aug. 1977]","5 Aug. 1977","Article in Journal","c5c9fd8c-d86a-4657-a7a7-b9a4925a0c55","20081009T05:11:37.000+0000","53c3abd8-0254-4532-a73e-d9ef6b7ac2ef"
"Taylor, R.W.","1980","New Australian ants of the genus <i>Orectognathus</i>, with summary description of the twenty-nine known species (Hymenoptera: Formicidae)","773-788","","Australian Journal of Zoology","","","","<!--MARK--><a href='null4669474c-ac4a-425d-9529-d4430feece10' class='mouseoverHref'>Taylor, R.W. 1980. New Australian ants of the genus <i>Orectognathus</i>, with summary description of the twenty-nine known species (Hymenoptera: Formicidae).</a> <!--MARK--><!--MARK--><a href='null53c3abd8-0254-4532-a73e-d9ef6b7ac2ef' class='mouseoverHref'><em>Australian Journal of Zoology</em></a> <strong>27</strong>: 773-788<!--MARK--> [15 Feb. 1980]","15 Feb. 1980","Article in Journal","4669474c-ac4a-425d-9529-d4430feece10","20081009T05:11:37.000+0000","53c3abd8-0254-4532-a73e-d9ef6b7ac2ef"
