"PUB_AUTHOR","PUB_YEAR","PUB_TITLE","PUB_PAGES","PUB_PARENT_BOOK_TITLE","PUB_PARENT_JOURNAL_TITLE","PUB_PARENT_ARTICLE_TITLE","PUB_PUBLICATION_DATE","PUB_PUBLISHER","PUB_FORMATTED","PUB_QUALIFICATION","PUB_TYPE","PUBLICATION_GUID","PUBLICATION_LAST_UPDATE","PARENT_PUBLICATION_GUID"
"André, E.","1896","Fourmis nouvelles d'Asie et d'Australie","251-265","","Revue Française d'Entomologie","","","","<!--MARK--><a href='nulld1c2b1f6-d253-4e17-9b05-d14c13724488' class='mouseoverHref'>André, E. 1896. Fourmis nouvelles d'Asie et d'Australie.</a> <!--MARK--><!--MARK--><a href='nulle9f809d1-b273-4f37-ae15-92e14dc5b13b' class='mouseoverHref'><em>Revue Française d'Entomologie</em></a> <strong>15</strong>: 251-265<!--MARK-->","","Article in Journal","d1c2b1f6-d253-4e17-9b05-d14c13724488","20090807T02:41:05.828+0000","e9f809d1-b273-4f37-ae15-92e14dc5b13b"
"Bolton, B.","2000","The ant tribe Dacetini","1-1028","","Memoirs of the American Entomological Institute","","","","<!--MARK--><a href='null0cfb888b-42fc-4774-af2b-8fd92f10bd79' class='mouseoverHref'>Bolton, B. 2000. The ant tribe Dacetini.</a> <!--MARK--><!--MARK--><a href='null68c5f11e-7ef5-44e0-8361-2a9052a673b6' class='mouseoverHref'><em>Memoirs of the American Entomological Institute</em></a> <strong>65</strong>: 1-1028<!--MARK-->","","Article in Journal","0cfb888b-42fc-4774-af2b-8fd92f10bd79","20110117T00:59:01.068+0000","68c5f11e-7ef5-44e0-8361-2a9052a673b6"
"Brown, W.L.,Jr","1988","<i>Strumigenys anetes</i> species nov","1-2","","Pilot Register of Zoology","","","","<!--MARK--><a href='nullf9778bb1-ceba-4717-8e53-de06dcd357b0' class='mouseoverHref'>Brown, W.L.,Jr 1988. <i>Strumigenys anetes</i> species nov.</a> <!--MARK--><!--MARK--><a href='null327b747d-2b62-4d68-a175-d188ad304db8' class='mouseoverHref'><em>Pilot Register of Zoology</em></a> <strong>42</strong>: 1-2<!--MARK-->","","Article in Journal","f9778bb1-ceba-4717-8e53-de06dcd357b0","20111101T00:32:02.567+0000","327b747d-2b62-4d68-a175-d188ad304db8"
"Brown, W.L., Jr & Kempf, W.W.","1961","The type species of the ant genus <i>Eurhopalothrix</i>","44","","Psyche (Cambridge)","","","","<!--MARK--><a href='null5c03cd98-3ad3-4ac6-ae81-daa8cb64501f' class='mouseoverHref'>Brown, W.L., Jr & Kempf, W.W. 1961. The type species of the ant genus <i>Eurhopalothrix</i>.</a> <!--MARK--><!--MARK--><a href='nulle5075c07-9cfd-4699-a945-bae664d3a3e2' class='mouseoverHref'><em>Psyche (Cambridge)</em></a> <strong>67</strong>: 44<!--MARK--> [16 Feb. 1961]","16 Feb. 1961","Article in Journal","5c03cd98-3ad3-4ac6-ae81-daa8cb64501f","20111101T00:31:57.976+0000","e5075c07-9cfd-4699-a945-bae664d3a3e2"
"Brown, W.L. jr","1948","<i>Strumigenys karawajewi</i>, new name for a Sumatran ant","44","","Entomological News","","","","<!--MARK--><a href='null5cae1d9c-c646-442e-b520-ae27065d1d27' class='mouseoverHref'>Brown, W.L. jr 1948. <i>Strumigenys karawajewi</i>, new name for a Sumatran ant.</a> <!--MARK--><!--MARK--><a href='null5d005da8-9486-4c74-aff9-355663c15a73' class='mouseoverHref'><em>Entomological News</em></a> <strong>59</strong>: 44<!--MARK-->","","Article in Journal","5cae1d9c-c646-442e-b520-ae27065d1d27","20081009T05:11:37.000+0000","5d005da8-9486-4c74-aff9-355663c15a73"
"Brown, W.L. jr","1948","A preliminary generic revision of the higher Dacetini (Hymenoptera: Formicidae)","101-129","","Transactions of the American Entomological Society","","","","<!--MARK--><a href='null63aacb4c-ddd8-41ae-9a38-4d99068ab5db' class='mouseoverHref'>Brown, W.L. jr 1948. A preliminary generic revision of the higher Dacetini (Hymenoptera: Formicidae).</a> <!--MARK--><!--MARK--><a href='nullab463570-432f-4c53-bc7c-2254ed8f75b1' class='mouseoverHref'><em>Transactions of the American Entomological Society</em></a> <strong>74</strong>: 101-129<!--MARK--> [27 July 1948]","27 July 1948","Article in Journal","63aacb4c-ddd8-41ae-9a38-4d99068ab5db","20081009T05:11:37.000+0000","ab463570-432f-4c53-bc7c-2254ed8f75b1"
"Brown, W.L. jr","1949","Revision of the ant tribe Dacetini: 3. <i>Epitritus</i> Emery and <i>Quadristruma</i> new genus (Hymenoptera: Formicidae)","43-51","","Transactions of the American Entomological Society","","","","<!--MARK--><a href='null7661f65f-d8c5-4531-8d0f-400fb7cfa6a6' class='mouseoverHref'>Brown, W.L. jr 1949. Revision of the ant tribe Dacetini: 3. <i>Epitritus</i> Emery and <i>Quadristruma</i> new genus (Hymenoptera: Formicidae).</a> <!--MARK--><!--MARK--><a href='nullab463570-432f-4c53-bc7c-2254ed8f75b1' class='mouseoverHref'><em>Transactions of the American Entomological Society</em></a> <strong>75</strong>: 43-51<!--MARK--> [6 July 1949]","6 July 1949","Article in Journal","7661f65f-d8c5-4531-8d0f-400fb7cfa6a6","20081009T05:11:37.000+0000","ab463570-432f-4c53-bc7c-2254ed8f75b1"
"Brown, W.L. jr","1952","The dacetine ant genus <i>Mesostruma</i> Brown","9-13","","Transactions of the Royal Society of South Australia","","","","<!--MARK--><a href='nullec140cc0-e41f-49e8-aa03-fc841fcd4ced' class='mouseoverHref'>Brown, W.L. jr 1952. The dacetine ant genus <i>Mesostruma</i> Brown.</a> <!--MARK--><!--MARK--><a href='null8b48b0a3-dd7a-4aea-be0d-10a223710ebc' class='mouseoverHref'><em>Transactions of the Royal Society of South Australia</em></a> <strong>75</strong>: 9-13<!--MARK-->","","Article in Journal","ec140cc0-e41f-49e8-aa03-fc841fcd4ced","20081009T05:11:37.000+0000","8b48b0a3-dd7a-4aea-be0d-10a223710ebc"
"Brown, W.L. jr","1953","A revision of the dacetine ant genus <i>Orectognathus</i>","84-104","","Memoirs of the Queensland Museum","","","","<!--MARK--><a href='null48e2b397-6428-48bf-918a-ea2efa2d3381' class='mouseoverHref'>Brown, W.L. jr 1953. A revision of the dacetine ant genus <i>Orectognathus</i>.</a> <!--MARK--><!--MARK--><a href='null1a0a2982-9f30-43e1-a641-b0379699837c' class='mouseoverHref'><em>Memoirs of the Queensland Museum</em></a> <strong>13</strong>: 84-104<!--MARK--> [14 Dec. 1953]","14 Dec. 1953","Article in Journal","48e2b397-6428-48bf-918a-ea2efa2d3381","20081009T05:11:37.000+0000","1a0a2982-9f30-43e1-a641-b0379699837c"
"Brown, W.L. jr","1953","Revisionary studies in the ant tribe Dacetini","1-137","","American Midland Naturalist","","","","<!--MARK--><a href='null3e769e22-f6c5-4b7b-8ddc-ffb02af87ed0' class='mouseoverHref'>Brown, W.L. jr 1953. Revisionary studies in the ant tribe Dacetini.</a> <!--MARK--><!--MARK--><a href='null237c7881-6751-4190-bdcf-92d6cc83f147' class='mouseoverHref'><em>American Midland Naturalist</em></a> <strong>50</strong>: 1-137<!--MARK-->","","Article in Journal","3e769e22-f6c5-4b7b-8ddc-ffb02af87ed0","20081009T05:11:37.000+0000","237c7881-6751-4190-bdcf-92d6cc83f147"
"Brown, W.L. jr","1954","The Indo-Australian species of the ant genus <i>Strumigenys</i> Fr. Smith: <i>S. wallaci</i> Emery and relatives","85-89","","Psyche (Cambridge)","","","","<!--MARK--><a href='null5b53e591-0c2d-40c4-b455-b91ddacb919b' class='mouseoverHref'>Brown, W.L. jr 1954. The Indo-Australian species of the ant genus <i>Strumigenys</i> Fr. Smith: <i>S. wallaci</i> Emery and relatives.</a> <!--MARK--><!--MARK--><a href='nulle5075c07-9cfd-4699-a945-bae664d3a3e2' class='mouseoverHref'><em>Psyche (Cambridge)</em></a> <strong>60</strong>: 85-89<!--MARK--> [8 Jan. 1954]","8 Jan. 1954","Article in Journal","5b53e591-0c2d-40c4-b455-b91ddacb919b","20081009T05:11:37.000+0000","e5075c07-9cfd-4699-a945-bae664d3a3e2"
"Brown, W.L. jr","1955","The first social parasite in the ant tribe Dacetini","181-186","","Insectes Sociaux","","","","<!--MARK--><a href='null653a7236-8a9b-4177-9458-150b761a76dc' class='mouseoverHref'>Brown, W.L. jr 1955. The first social parasite in the ant tribe Dacetini.</a> <!--MARK--><!--MARK--><a href='nullefe5b121-c808-4063-a667-9a1a7bec4bea' class='mouseoverHref'><em>Insectes Sociaux</em></a> <strong>2</strong>: 181-186<!--MARK-->","","Article in Journal","653a7236-8a9b-4177-9458-150b761a76dc","20081009T05:11:37.000+0000","efe5b121-c808-4063-a667-9a1a7bec4bea"
"Brown, W.L. jr","1958","A review of the ants of New Zealand (Hymenoptera)","1-50","","Acta Hymenopterologica","","","","<!--MARK--><a href='nullb94c79ed-767f-4346-80c5-a8475c15ccd2' class='mouseoverHref'>Brown, W.L. jr 1958. A review of the ants of New Zealand (Hymenoptera).</a> <!--MARK--><!--MARK--><a href='nullb79fc8c3-ed4d-49f9-90d9-dcb4f5314913' class='mouseoverHref'><em>Acta Hymenopterologica</em></a> <strong>1</strong>: 1-50<!--MARK-->","","Article in Journal","b94c79ed-767f-4346-80c5-a8475c15ccd2","20081009T05:11:37.000+0000","b79fc8c3-ed4d-49f9-90d9-dcb4f5314913"
"Brown, W.L. jr","1958","A supplement to the revisions of the dacetine ant genera <i>Orectognathus</i> and <i>Arnoldidris</i>, with keys to the species","17-29","","Psyche (Cambridge)","","","","<!--MARK--><a href='nulle5019276-39b4-4194-9c62-881d0d4707b0' class='mouseoverHref'>Brown, W.L. jr 1958. A supplement to the revisions of the dacetine ant genera <i>Orectognathus</i> and <i>Arnoldidris</i>, with keys to the species.</a> <!--MARK--><!--MARK--><a href='nulle5075c07-9cfd-4699-a945-bae664d3a3e2' class='mouseoverHref'><em>Psyche (Cambridge)</em></a> <strong>64</strong>: 17-29<!--MARK--> [10 Jan. 1958]","10 Jan. 1958","Article in Journal","e5019276-39b4-4194-9c62-881d0d4707b0","20081009T05:11:37.000+0000","e5075c07-9cfd-4699-a945-bae664d3a3e2"
"Brown, W.L. jr","1959","Some new species of dacetine ants","1-11","","Breviora. Museum of Comparative Zoology","","","","<!--MARK--><a href='nullb281db17-cca1-4be1-b3cc-68d445bc4b32' class='mouseoverHref'>Brown, W.L. jr 1959. Some new species of dacetine ants.</a> <!--MARK--><!--MARK--><a href='nullb5aca245-716d-4330-9421-57e8fe2d73d8' class='mouseoverHref'><em>Breviora. Museum of Comparative Zoology</em></a> <strong>108</strong>: 1-11<!--MARK--> [7 May 1959]","7 May 1959","Article in Journal","b281db17-cca1-4be1-b3cc-68d445bc4b32","20081009T05:11:37.000+0000","b5aca245-716d-4330-9421-57e8fe2d73d8"
"Brown, W.L. jr","1965","<i>Colobostruma nancyae</i> species nov. Pilot Register of Zoology, Cornell University, Ithaca, New York, Card no. 22","","","","","","","<!--MARK--><a href='nullbc788a89-a112-4b17-8a97-9eb8d0ce61fd' class='mouseoverHref'>Brown, W.L. jr 1965. <i>Colobostruma nancyae</i> species nov. Pilot Register of Zoology, Cornell University, Ithaca, New York, Card no. 22.</a> <!--MARK--> [5 Apr. 1965]","5 Apr. 1965","Miscellaneous","bc788a89-a112-4b17-8a97-9eb8d0ce61fd","20081009T05:11:37.000+0000",""
"Brown, W.L. jr","1965","<i>Colobostruma papulata</i> species nov. Insecta: Hymenoptera: Formicidae. Pilot Register of Zoology, Cornell. University, Ithaca, New York, Card no. 21","","","","","","","<!--MARK--><a href='null9be3ac4a-1c33-4a66-8034-346185ffb2b0' class='mouseoverHref'>Brown, W.L. jr 1965. <i>Colobostruma papulata</i> species nov. Insecta: Hymenoptera: Formicidae. Pilot Register of Zoology, Cornell. University, Ithaca, New York, Card no. 21.</a> <!--MARK--> [5 Apr. 1965]","5 Apr. 1965","Miscellaneous","9be3ac4a-1c33-4a66-8034-346185ffb2b0","20081009T05:11:37.000+0000",""
"Brown, W.L. jr","1971","The identity and synonymy of <i>Pheidoleye vigilans</i> (Hymenoptera: Formicidae)","13-14","","Australian Journal of Zoology","","","","<!--MARK--><a href='nullea1321a5-f4f0-4b32-b916-9d33b2a68f34' class='mouseoverHref'>Brown, W.L. jr 1971. The identity and synonymy of <i>Pheidoleye vigilans</i> (Hymenoptera: Formicidae).</a> <!--MARK--><!--MARK--><a href='null53c3abd8-0254-4532-a73e-d9ef6b7ac2ef' class='mouseoverHref'><em>Australian Journal of Zoology</em></a> <strong>10</strong>: 13-14<!--MARK-->","","Article in Journal","ea1321a5-f4f0-4b32-b916-9d33b2a68f34","20081009T05:11:37.000+0000","53c3abd8-0254-4532-a73e-d9ef6b7ac2ef"
"Brown, W.L. jr","1972","The Indo-Australian species of the ant genus <i>Strumigenys</i>: group of <i>szalayi</i> (Hymenoptera: Formicidae)","73-86","Entomological Essays to Commemorate the Retirement of Professor K. Yasumatsu 1971","","","","","<!--MARK--><a href='nulla8e6cbaf-f966-45f6-8dda-b90b72c26d53' class='mouseoverHref'>Brown, W.L. jr 1972. The Indo-Australian species of the ant genus <i>Strumigenys</i>: group of <i>szalayi</i> (Hymenoptera: Formicidae). pp. 73-86</a> <!--MARK--><em>in</em> <!--MARK--><a href='null4b4e22a4-d5a1-4337-9974-c5c466e469f9' class='mouseoverHref'>Asahina, S., Gressitt, J.L., Hikada, Z., Mishida, T. & Namura, K. (eds). <em>Entomological Essays to Commemorate the Retirement of Professor K. Yasumatsu 1971</em>. Tokyo : Hokuryukan Publishing Co. Ltd vi 389 pp.</a><!--MARK-->","","Chapter in Book","a8e6cbaf-f966-45f6-8dda-b90b72c26d53","20120111T22:58:45.364+0000","4b4e22a4-d5a1-4337-9974-c5c466e469f9"
"Brown, W.L. jr","1973","A comparison of the Hylean and Congo-West African rain forest ant faunas. pp. 161-185 <i>in</i> Meggers, B.J., Ayensu, E.S. & Duckworth, W.D. (eds) <i>Tropical forest ecosystems in Africa and South America: a comparative review.</i> Washington : Smithsonian Institution Press","","","","","","","<!--MARK--><a href='null4532561f-402c-48e7-a6ee-c757dab82a0c' class='mouseoverHref'>Brown, W.L. jr 1973. A comparison of the Hylean and Congo-West African rain forest ant faunas. pp. 161-185 <i>in</i> Meggers, B.J., Ayensu, E.S. & Duckworth, W.D. (eds) <i>Tropical forest ecosystems in Africa and South America: a comparative review.</i> Washington : Smithsonian Institution Press.</a>","","Miscellaneous","4532561f-402c-48e7-a6ee-c757dab82a0c","20081009T05:11:37.000+0000",""
"Brown, W.L. jr","1973","The Indo-Australian species of the ant genus, <i>Strumigenys</i>: groups of <i>horvathi</i>, <i>mayri</i> and <i>wallacei</i>","259-269","","Pacific Insects Monographs","","","","<!--MARK--><a href='nullfde25cee-05fa-4cea-abbd-4bb67509a4ad' class='mouseoverHref'>Brown, W.L. jr 1973. The Indo-Australian species of the ant genus, <i>Strumigenys</i>: groups of <i>horvathi</i>, <i>mayri</i> and <i>wallacei</i>.</a> <!--MARK--><!--MARK--><a href='null33de6356-e704-4b81-9355-402b75b14c14' class='mouseoverHref'><em>Pacific Insects Monographs</em></a> <strong>15</strong>: 259-269<!--MARK--> [20 July 1973]","20 July 1973","Article in Journal","fde25cee-05fa-4cea-abbd-4bb67509a4ad","20081009T05:11:37.000+0000","33de6356-e704-4b81-9355-402b75b14c14"
"Brown, W.L. jr","1988","<i>Strumigenys yaleopleura</i> species nov","1-2","","Pilot Register of Zoology","","","","<!--MARK--><a href='null15d11931-5f94-4cde-81e0-0fd4e53c3127' class='mouseoverHref'>Brown, W.L. jr 1988. <i>Strumigenys yaleopleura</i> species nov.</a> <!--MARK--><!--MARK--><a href='null327b747d-2b62-4d68-a175-d188ad304db8' class='mouseoverHref'><em>Pilot Register of Zoology</em></a> <strong>42</strong>: 1-2<!--MARK-->","","Article in Journal","15d11931-5f94-4cde-81e0-0fd4e53c3127","20081009T05:11:37.000+0000","327b747d-2b62-4d68-a175-d188ad304db8"
"Brown, W.L. jr","1988","Strumigenys buleru species nov","1-2","","Pilot Register of Zoology","","","","<!--MARK--><a href='nullf1a8ce72-6840-426a-ae04-995164cc8e2e' class='mouseoverHref'>Brown, W.L. jr 1988. Strumigenys buleru species nov.</a> <!--MARK--><!--MARK--><a href='null327b747d-2b62-4d68-a175-d188ad304db8' class='mouseoverHref'><em>Pilot Register of Zoology</em></a> <strong>39</strong>: 1-2<!--MARK-->","","Article in Journal","f1a8ce72-6840-426a-ae04-995164cc8e2e","20081009T05:11:37.000+0000","327b747d-2b62-4d68-a175-d188ad304db8"
"Brown, W.L. jr","1988","Strumigenys cochlearis species nov","1-2","","Pilot Register of Zoology","","","","<!--MARK--><a href='nulle8582586-a745-4c07-aba2-b9998e4065e6' class='mouseoverHref'>Brown, W.L. jr 1988. Strumigenys cochlearis species nov.</a> <!--MARK--><!--MARK--><a href='null327b747d-2b62-4d68-a175-d188ad304db8' class='mouseoverHref'><em>Pilot Register of Zoology</em></a> <strong>40</strong>: 1-2<!--MARK-->","","Article in Journal","e8582586-a745-4c07-aba2-b9998e4065e6","20081009T05:11:37.000+0000","327b747d-2b62-4d68-a175-d188ad304db8"
"Brown, W.L. jr","1988","Strumigenys paranetes species nov","1-2","","Pilot Register of Zoology","","","","<!--MARK--><a href='null42d1065b-16ab-40e5-b36e-df0afa7819ee' class='mouseoverHref'>Brown, W.L. jr 1988. Strumigenys paranetes species nov.</a> <!--MARK--><!--MARK--><a href='null327b747d-2b62-4d68-a175-d188ad304db8' class='mouseoverHref'><em>Pilot Register of Zoology</em></a> <strong>43</strong>: 1-2<!--MARK-->","","Article in Journal","42d1065b-16ab-40e5-b36e-df0afa7819ee","20081009T05:11:37.000+0000","327b747d-2b62-4d68-a175-d188ad304db8"
"Brown, W.L. jr","1988","Strumigenys philiporum species nov","1-2","","Pilot Register of Zoology","","","","<!--MARK--><a href='nullf1b98147-0976-4c8f-8207-12b50c74bbaa' class='mouseoverHref'>Brown, W.L. jr 1988. Strumigenys philiporum species nov.</a> <!--MARK--><!--MARK--><a href='null327b747d-2b62-4d68-a175-d188ad304db8' class='mouseoverHref'><em>Pilot Register of Zoology</em></a> <strong>38</strong>: 1-2<!--MARK-->","","Article in Journal","f1b98147-0976-4c8f-8207-12b50c74bbaa","20081009T05:11:37.000+0000","327b747d-2b62-4d68-a175-d188ad304db8"
"Brown, W.L. jr & Kempf, W.W.","1960","A world revision of the ant tribe Basicerotini (Hym. Formicidae)","161-250","","Studia Entomologica","","","","<!--MARK--><a href='null7ad561a6-a8ee-4cb0-be81-9785d18086a6' class='mouseoverHref'>Brown, W.L. jr & Kempf, W.W. 1960. A world revision of the ant tribe Basicerotini (Hym. Formicidae).</a> <!--MARK--><!--MARK--><a href='nullc8d94c7c-ab66-4087-89dc-2561fe72cf9a' class='mouseoverHref'><em>Studia Entomologica</em></a> <strong>3</strong>: 161-250<!--MARK-->","","Article in Journal","7ad561a6-a8ee-4cb0-be81-9785d18086a6","20081009T05:11:37.000+0000","c8d94c7c-ab66-4087-89dc-2561fe72cf9a"
"Clark, J.","1928","Entomological Reports. Formicidae. <i>In</i> Report of the Victorian Field Naturalists' expedition through the Western District of Victoria","39-44","","Victorian Naturalist","","","","<!--MARK--><a href='null20f7cb5c-3a59-4180-a6a1-bd52fbbef1c4' class='mouseoverHref'>Clark, J. 1928. Entomological Reports. Formicidae. <i>In</i> Report of the Victorian Field Naturalists' expedition through the Western District of Victoria.</a> <!--MARK--><!--MARK--><a href='null97b8093b-d60f-43a6-94fc-97de34f03b6b' class='mouseoverHref'><em>Victorian Naturalist</em></a> suppl. <strong>45</strong>: 39-44<!--MARK-->","","Article in Journal","20f7cb5c-3a59-4180-a6a1-bd52fbbef1c4","20081009T05:11:37.000+0000","97b8093b-d60f-43a6-94fc-97de34f03b6b"
"Clark, J.","1934","Ants from the Otway Ranges","48-73","","Memoirs of the National Museum of Victoria, Melbourne","","","","<!--MARK--><a href='null7b9a23ad-5a84-4230-ad20-6eae8211b21e' class='mouseoverHref'>Clark, J. 1934. Ants from the Otway Ranges.</a> <!--MARK--><!--MARK--><a href='null6d019674-04b0-4fab-8903-0612d147ec4d' class='mouseoverHref'><em>Memoirs of the National Museum of Victoria, Melbourne</em></a> <strong>8</strong>: 48-73<!--MARK-->","","Article in Journal","7b9a23ad-5a84-4230-ad20-6eae8211b21e","20081009T05:11:37.000+0000","6d019674-04b0-4fab-8903-0612d147ec4d"
"Clark, J.","1938","Reports of the McCoy Society for Field Investigation and Research. No. 2. Sir Joseph Bank Islands. Part I. Formicidae (Hymenoptera)","356-382","","Proceedings of the Royal Society of Victoria","","","","<!--MARK--><a href='nullfa353c35-1515-4402-99e3-d809edda65cc' class='mouseoverHref'>Clark, J. 1938. Reports of the McCoy Society for Field Investigation and Research. No. 2. Sir Joseph Bank Islands. Part I. Formicidae (Hymenoptera).</a> <!--MARK--><!--MARK--><a href='nullce333794-3a02-427f-ba27-346079f1efa0' class='mouseoverHref'><em>Proceedings of the Royal Society of Victoria</em></a> <strong>50</strong>: 356-382<!--MARK-->","","Article in Journal","fa353c35-1515-4402-99e3-d809edda65cc","20081009T05:11:37.000+0000","ce333794-3a02-427f-ba27-346079f1efa0"
"Crawley, W.C.","1915","Ants from north and south-west Australia (G.F. Hill, Rowland Turner) and Christmas Island, Straits Settlements. Part II","232-239","","Annals and Magazine of Natural History","","","","<!--MARK--><a href='null7a89c605-713e-4b39-a683-f1fbf4f896b1' class='mouseoverHref'>Crawley, W.C. 1915. Ants from north and south-west Australia (G.F. Hill, Rowland Turner) and Christmas Island, Straits Settlements. Part II.</a> <!--MARK--><!--MARK--><a href='nullefa8de69-3a29-4a43-8ef2-cbefda205976' class='mouseoverHref'><em>Annals and Magazine of Natural History</em></a> 8 <strong>15</strong>: 232-239<!--MARK-->","","Article in Journal","7a89c605-713e-4b39-a683-f1fbf4f896b1","20081009T05:11:37.000+0000","efa8de69-3a29-4a43-8ef2-cbefda205976"
"Crawley, W.C.","1922","New ants from Australia","16-36","","Annals and Magazine of Natural History","","","","<!--MARK--><a href='nullfbb0b61e-3c36-4843-9167-529ce2ea9d9b' class='mouseoverHref'>Crawley, W.C. 1922. New ants from Australia.</a> <!--MARK--><!--MARK--><a href='nullefa8de69-3a29-4a43-8ef2-cbefda205976' class='mouseoverHref'><em>Annals and Magazine of Natural History</em></a> 9 <strong>10</strong>: 16-36<!--MARK-->","","Article in Journal","fbb0b61e-3c36-4843-9167-529ce2ea9d9b","20081009T05:11:37.000+0000","efa8de69-3a29-4a43-8ef2-cbefda205976"
"Crawley, W.C.","1923","Myrmecological notes - new Australian Formicidae","177-179","","Entomologist's Record and Journal of Variation","","","","<!--MARK--><a href='null0b5d098e-91ad-4758-af21-d38fafe4baf0' class='mouseoverHref'>Crawley, W.C. 1923. Myrmecological notes - new Australian Formicidae.</a> <!--MARK--><!--MARK--><a href='null02bf89d0-56c4-40f9-a931-cb69f6b85eb2' class='mouseoverHref'><em>Entomologist's Record and Journal of Variation</em></a> <strong>35</strong>: 177-179<!--MARK-->","","Article in Journal","0b5d098e-91ad-4758-af21-d38fafe4baf0","20081009T05:11:37.000+0000","02bf89d0-56c4-40f9-a931-cb69f6b85eb2"
"Donisthorpe, H.","1940","Descriptions of new species of ants (Hym. Formicidae) from various localities","39-48","","Annals and Magazine of Natural History","","","","<!--MARK--><a href='nullf7619dd7-f732-4eec-852a-6673c7058d75' class='mouseoverHref'>Donisthorpe, H. 1940. Descriptions of new species of ants (Hym. Formicidae) from various localities.</a> <!--MARK--><!--MARK--><a href='nullefa8de69-3a29-4a43-8ef2-cbefda205976' class='mouseoverHref'><em>Annals and Magazine of Natural History</em></a> 11 <strong>5</strong>: 39-48<!--MARK-->","","Article in Journal","f7619dd7-f732-4eec-852a-6673c7058d75","20081009T05:11:37.000+0000","efa8de69-3a29-4a43-8ef2-cbefda205976"
"Emery, C.","1869","Enumerazione dei formicidi che rinvengonsi nei contorni di Napoli con descrizionn di specie nuove o meno conosciute","1-26","","Annali dell'Accademia degli Aspiranti Naturalisti, Napoli","","","","<!--MARK--><a href='nullde0435fa-abad-42d4-892a-898d412cd5f9' class='mouseoverHref'>Emery, C. 1869. Enumerazione dei formicidi che rinvengonsi nei contorni di Napoli con descrizionn di specie nuove o meno conosciute.</a> <!--MARK--><!--MARK--><a href='null9e2fe772-ca4a-405c-883a-49c600b5b61a' class='mouseoverHref'><em>Annali dell'Accademia degli Aspiranti Naturalisti, Napoli</em></a> era 2 <strong>2</strong>: 1-26<!--MARK-->","","Article in Journal","de0435fa-abad-42d4-892a-898d412cd5f9","20081009T05:11:37.000+0000","9e2fe772-ca4a-405c-883a-49c600b5b61a"
"Emery, C.","1890","Studii sulle formiche della fauna neotropica","38-80 pls 5-9","","Bollettino della Società Entomologica Italiana","","","","<!--MARK--><a href='nulld7371dac-efd6-4a41-acdd-cdb4b6898da3' class='mouseoverHref'>Emery, C. 1890. Studii sulle formiche della fauna neotropica.</a> <!--MARK--><!--MARK--><a href='null97b2190f-c3d9-47f5-a348-20c26559e7d6' class='mouseoverHref'><em>Bollettino della Società Entomologica Italiana</em></a> <strong>22</strong>: 38-80 pls 5-9<!--MARK-->","","Article in Journal","d7371dac-efd6-4a41-acdd-cdb4b6898da3","20081009T05:11:37.000+0000","97b2190f-c3d9-47f5-a348-20c26559e7d6"
"Emery, C.","1897","Formicidarum species novae vel minus cognitae in collectione Musaei Nationalis Hungarici, quas in Nova-Guinea, Colonia Germanica, collegit L. Biró","571-599 pl. 14-15","","Természetrajzi Füzetek","","","","<!--MARK--><a href='nullaac169fe-5041-4167-8eb6-31c941afca46' class='mouseoverHref'>Emery, C. 1897. Formicidarum species novae vel minus cognitae in collectione Musaei Nationalis Hungarici, quas in Nova-Guinea, Colonia Germanica, collegit L. Biró.</a> <!--MARK--><!--MARK--><a href='null090d36a9-98bf-46b0-9011-f30bd8af3030' class='mouseoverHref'><em>Természetrajzi Füzetek</em></a> <strong>20</strong>: 571-599 pl. 14-15<!--MARK-->","","Article in Journal","aac169fe-5041-4167-8eb6-31c941afca46","20081009T05:11:37.000+0000","090d36a9-98bf-46b0-9011-f30bd8af3030"
"Emery, C.","1897","Viaggio di Lamberto Loria nella Papuasia orientale. XVIII. - Formiche raccolte nella Nuova Guinea dal Dott. Lamberto Loria","546-594 pl. 1","","Annali del Museo Civico di Storia Naturale, Genova","","","","<!--MARK--><a href='nullc988d325-470d-40ac-accb-5ec4a6b923c7' class='mouseoverHref'>Emery, C. 1897. Viaggio di Lamberto Loria nella Papuasia orientale. XVIII. - Formiche raccolte nella Nuova Guinea dal Dott. Lamberto Loria.</a> <!--MARK--><!--MARK--><a href='null461059ea-ead7-4f6d-83f4-52913f06d09f' class='mouseoverHref'><em>Annali del Museo Civico di Storia Naturale, Genova</em></a> 2 <strong>38</strong>: 546-594 pl. 1<!--MARK--> [22 Nov. 1897]","22 Nov. 1897","Article in Journal","c988d325-470d-40ac-accb-5ec4a6b923c7","20170721T02:22:14.921+0000","461059ea-ead7-4f6d-83f4-52913f06d09f"
