"PUB_AUTHOR","PUB_YEAR","PUB_TITLE","PUB_PAGES","PUB_PARENT_BOOK_TITLE","PUB_PARENT_JOURNAL_TITLE","PUB_PARENT_ARTICLE_TITLE","PUB_PUBLICATION_DATE","PUB_PUBLISHER","PUB_FORMATTED","PUB_QUALIFICATION","PUB_TYPE","PUBLICATION_GUID","PUBLICATION_LAST_UPDATE","PARENT_PUBLICATION_GUID"
"Angas, G.F.","1847","South Australia Illustrated","60 pls, in colour, with descriptive text","","","","","Thomas McLean","<!--MARK--><a href='../../../../publication/a51a2653-f5e5-4ced-81f1-a219ebcb9016' class='mouseoverHref'>Angas, G.F. 1847. <em>South Australia Illustrated</em>. London : Thomas McLean 60 pls, in colour, with descriptive text.</a><!--MARK-->","","Book","a51a2653-f5e5-4ced-81f1-a219ebcb9016","20081009T05:11:37.000+0000",""
"Asahina, S.","1980","Taxonomic notes on non-domiciliary <i>Periplaneta</i> species from the Ryukyus, Taiwan, Hong Kong and Thailand","103-115","","Japanese Journal of Sanitary Zoology","","","","<!--MARK--><a href='../../../../publication/2aca99dd-2d0b-4a9e-8f21-b297c894d69f' class='mouseoverHref'>Asahina, S. 1980. Taxonomic notes on non-domiciliary <i>Periplaneta</i> species from the Ryukyus, Taiwan, Hong Kong and Thailand.</a> <!--MARK--><!--MARK--><a href='../../../../publication/1e1e6f6d-2498-46f6-b141-8cbd870333c1' class='mouseoverHref'><em>Japanese Journal of Sanitary Zoology</em></a> <strong>31</strong>: 103-115<!--MARK-->","","Article in Journal","2aca99dd-2d0b-4a9e-8f21-b297c894d69f","20081009T05:11:37.000+0000","1e1e6f6d-2498-46f6-b141-8cbd870333c1"
"Audinet-Serville, J.G.","1839","Histoire Naturelle des Insectes. Orthoptères","i-xviii, 1-776, Atlas pls 1-14","","","","","Librairie Encyclopédique de Roret","<!--MARK--><a href='../../../../publication/697e41aa-54ca-44af-b5d8-943e2fefd8d0' class='mouseoverHref'>Audinet-Serville, J.G. 1839. <em>Histoire Naturelle des Insectes. Orthoptères</em>. Paris : Librairie Encyclopédique de Roret i-xviii, 1-776, Atlas pls 1-14.</a><!--MARK--> [dated 1838]","dated 1838","Book","697e41aa-54ca-44af-b5d8-943e2fefd8d0","20081009T05:11:37.000+0000",""
"Baccaloni, G.W. & Eggleton, P.","2011","Order Blattodea Brunner von Wattenwyl, 1882","pp. 199-200","","Zootaxa","Animal biodiversity: An outline of higher-level classification and survey of taxonomic richness","","","<!--MARK--><a href='../../../../publication/4e1a4198-77ad-4cee-8e08-79bbb644355d' class='mouseoverHref'>Baccaloni, G.W. & Eggleton, P. 2011. Order Blattodea Brunner von Wattenwyl, 1882. pp. 199-200</a> <!--MARK--><em>in</em> <!--MARK--><a href='../../../../publication/f6b55724-c8f7-47fe-aacc-05dfd963743e' class='mouseoverHref'>Zhang, Z.-Q. (Ed.). Animal biodiversity: An outline of higher-level classification and survey of taxonomic richness.</a> <!--MARK--><!--MARK--><a href='../../../../publication/96466227-221c-4922-ac97-1ac2dd946d0a' class='mouseoverHref'><em>Zootaxa</em></a> <strong>3148</strong><!--MARK-->","","Section in Article","4e1a4198-77ad-4cee-8e08-79bbb644355d","20180201T02:34:06.005+0000","f6b55724-c8f7-47fe-aacc-05dfd963743e"
"Bacchus, S.","1987","A taxonomic and biometric study of the genus <i>Cryptotermes</i> (Isoptera: Kalotermitidae)","iv 1-91","","Tropical Pest Bulletin","","","","<!--MARK--><a href='../../../../publication/5773275c-1bda-451f-8453-8fea175c5eb7' class='mouseoverHref'>Bacchus, S. 1987. A taxonomic and biometric study of the genus <i>Cryptotermes</i> (Isoptera: Kalotermitidae).</a> <!--MARK--><!--MARK--><a href='../../../../publication/4e6d1ccc-e507-4d46-b957-3f90a0a86b8f' class='mouseoverHref'><em>Tropical Pest Bulletin</em></a> <strong>7</strong>: iv 1-91<!--MARK-->","","Article in Journal","5773275c-1bda-451f-8453-8fea175c5eb7","20081009T05:11:37.000+0000","4e6d1ccc-e507-4d46-b957-3f90a0a86b8f"
"Bain, J. & Jenkin, M.J.","1983","<i>Kalotermes banksiae</i>, <i>Glyptotermes brevicornis</i>, and other termites (Isoptera) in New Zealand","365-370","","New Zealand Entomologist","","","","<!--MARK--><a href='../../../../publication/b90ad674-13d7-47c4-a3e9-9e90d5c91b49' class='mouseoverHref'>Bain, J. & Jenkin, M.J. 1983. <i>Kalotermes banksiae</i>, <i>Glyptotermes brevicornis</i>, and other termites (Isoptera) in New Zealand.</a> <!--MARK--><!--MARK--><a href='../../../../publication/f86f120b-5516-4822-b304-3d5a1520c2e2' class='mouseoverHref'><em>New Zealand Entomologist</em></a> <strong>7</strong>: 365-370<!--MARK-->","","Article in Journal","b90ad674-13d7-47c4-a3e9-9e90d5c91b49","20081009T05:11:37.000+0000","f86f120b-5516-4822-b304-3d5a1520c2e2"
"Banks, N.","1906","Two new termites","336-337","","Entomological News","","","","<!--MARK--><a href='../../../../publication/6bf61bba-6cb2-4359-b839-326e4374c6d0' class='mouseoverHref'>Banks, N. 1906. Two new termites.</a> <!--MARK--><!--MARK--><a href='../../../../publication/5d005da8-9486-4c74-aff9-355663c15a73' class='mouseoverHref'><em>Entomological News</em></a> <strong>17</strong>: 336-337<!--MARK-->","","Article in Journal","6bf61bba-6cb2-4359-b839-326e4374c6d0","20081009T05:11:37.000+0000","5d005da8-9486-4c74-aff9-355663c15a73"
"Banks, N.","1918","The termites of Panama and British Guiana","659-667 pl. LI","","Bulletin of the American Museum of Natural History","","","","<!--MARK--><a href='../../../../publication/d0832e36-6337-4d98-8029-7d0476c59074' class='mouseoverHref'>Banks, N. 1918. The termites of Panama and British Guiana.</a> <!--MARK--><!--MARK--><a href='../../../../publication/fb7ce990-e955-4634-bf04-a37f265e0778' class='mouseoverHref'><em>Bulletin of the American Museum of Natural History</em></a> <strong>38</strong>: 659-667 pl. LI<!--MARK-->","","Article in Journal","d0832e36-6337-4d98-8029-7d0476c59074","20081009T05:11:37.000+0000","fb7ce990-e955-4634-bf04-a37f265e0778"
"Banks, N. & Snyder, T.E.","1920","A revision of the Nearctic termites with notes on biology and geographic distribution","viii 1-228","","Bulletin of the United States National Museum","","","","<!--MARK--><a href='../../../../publication/99159b67-f461-4df1-a92d-3474ee92403e' class='mouseoverHref'>Banks, N. & Snyder, T.E. 1920. A revision of the Nearctic termites with notes on biology and geographic distribution.</a> <!--MARK--><!--MARK--><a href='../../../../publication/d62694e9-c583-45e9-aa41-f40b5d5fc778' class='mouseoverHref'><em>Bulletin of the United States National Museum</em></a> <strong>108</strong>: viii 1-228<!--MARK-->","","Article in Journal","99159b67-f461-4df1-a92d-3474ee92403e","20081009T05:11:37.000+0000","d62694e9-c583-45e9-aa41-f40b5d5fc778"
"Beccaloni, G.W. & Eggleton, P.","2011","Order Blattodea","199-200","","Zootaxa","","","","<!--MARK--><a href='../../../../publication/92b18f08-def1-4646-a3bc-716ed4031073' class='mouseoverHref'>Beccaloni, G.W. & Eggleton, P. 2011. Order Blattodea.</a> <!--MARK--><!--MARK--><a href='../../../../publication/96466227-221c-4922-ac97-1ac2dd946d0a' class='mouseoverHref'><em>Zootaxa</em></a> <strong>3148</strong>: 199-200<!--MARK-->","","Article in Journal","92b18f08-def1-4646-a3bc-716ed4031073","20120102T22:11:06.409+0000","96466227-221c-4922-ac97-1ac2dd946d0a"
"Brancsik, C.","1897","Series Orthopterorum novorum","52-85, tabs i-ii","","Jahresheft Naturwissenscheftlichen Vereins des Trencsiner Comitat","","","","<!--MARK--><a href='../../../../publication/2cb688ff-8565-4b49-813b-113b24e1c43c' class='mouseoverHref'>Brancsik, C. 1897. Series Orthopterorum novorum.</a> <!--MARK--><!--MARK--><a href='../../../../publication/8768144a-f15d-4e5a-9db1-530f3300cdf0' class='mouseoverHref'><em>Jahresheft Naturwissenscheftlichen Vereins des Trencsiner Comitat</em></a> <strong>19-20</strong>: 52-85, tabs i-ii<!--MARK--> [dated 1897]","dated 1897","Article in Journal","2cb688ff-8565-4b49-813b-113b24e1c43c","20140522T03:32:11.581+0000","8768144a-f15d-4e5a-9db1-530f3300cdf0"
"Brauer, F.","1865","Fünfter Bericht über die auf der Weltfahrt der kais. Fregatte Novara gesammelten Neuropteren","975-978","","Verhandlungen der Zoologisch-Botanischen Gesellschaft in Wien","","","","<!--MARK--><a href='../../../../publication/3cf0abe8-924d-4d3e-af00-dde539eba76d' class='mouseoverHref'>Brauer, F. 1865. Fünfter Bericht über die auf der Weltfahrt der kais. Fregatte Novara gesammelten Neuropteren.</a> <!--MARK--><!--MARK--><a href='../../../../publication/14e4d839-6bc2-42e9-ae1b-979730866002' class='mouseoverHref'><em>Verhandlungen der Zoologisch-Botanischen Gesellschaft in Wien</em></a> <strong>15</strong>: 975-978<!--MARK--> [see, Hill, G.F. 1942. <em>Termites (Isoptera) from the Australian Region</em>. Melbourne : Council for Scientific and Industrial Research 479 pp. 24 pls. (218)]","see, Hill, G.F. 1942. <em>Termites (Isoptera) from the Australian Region</em>. Melbourne : Council for Scientific and Industrial Research 479 pp. 24 pls. (218)","Article in Journal","3cf0abe8-924d-4d3e-af00-dde539eba76d","20081009T05:11:37.000+0000","14e4d839-6bc2-42e9-ae1b-979730866002"
"Brown, W.V., Watson, J.A.L., Carter, F.L., Lacey, M.J., Barrett, R.A. & McDaniel, C.A.","1990","Preliminary examination of cuticular hydrocarbons of worker termites as chemotaxonomic characters for some Australian species of <i>Coptotermes</i> (Isoptera: Rhinotermitidae)","305-328","","Sociobiology","","","","<!--MARK--><a href='../../../../publication/0143e8a8-fad4-4983-b933-140968c919f4' class='mouseoverHref'>Brown, W.V., Watson, J.A.L., Carter, F.L., Lacey, M.J., Barrett, R.A. & McDaniel, C.A. 1990. Preliminary examination of cuticular hydrocarbons of worker termites as chemotaxonomic characters for some Australian species of <i>Coptotermes</i> (Isoptera: Rhinotermitidae).</a> <!--MARK--><!--MARK--><a href='../../../../publication/5887c153-8987-495b-9107-99c2246a05af' class='mouseoverHref'><em>Sociobiology</em></a> <strong>16</strong>: 305-328<!--MARK-->","","Article in Journal","0143e8a8-fad4-4983-b933-140968c919f4","20081009T05:11:37.000+0000","5887c153-8987-495b-9107-99c2246a05af"
"Bruijning, C.F.A.","1948","Studies on Malayan Blattidae","1-174","","Zoologische Mededelingen (Leiden)","","","","<!--MARK--><a href='../../../../publication/e803e1b4-223d-445e-b9c1-d2ee43e7c132' class='mouseoverHref'>Bruijning, C.F.A. 1948. Studies on Malayan Blattidae.</a> <!--MARK--><!--MARK--><a href='../../../../publication/42ce8f11-9401-4dfc-ae20-52feb2a315f5' class='mouseoverHref'><em>Zoologische Mededelingen (Leiden)</em></a> <strong>29</strong>: 1-174<!--MARK-->","","Article in Journal","e803e1b4-223d-445e-b9c1-d2ee43e7c132","20081009T05:11:37.000+0000","42ce8f11-9401-4dfc-ae20-52feb2a315f5"
"Brunner von Wattenwyl, C.","1865","Nouveau système des Blattaires","426 pp. 13 pls","","","","","G. Braumüller","<!--MARK--><a href='../../../../publication/5cb06a74-a9cb-4e80-83a3-d04fc63165d6' class='mouseoverHref'>Brunner von Wattenwyl, C. 1865. <em>Nouveau système des Blattaires</em>. Vienna : G. Braumüller 426 pp. 13 pls.</a><!--MARK-->","","Book","5cb06a74-a9cb-4e80-83a3-d04fc63165d6","20081009T05:11:37.000+0000",""
"Brunner von Wattenwyl, C.","1893","Révision du système des Orthoptères et description des espèces rapportées par M. Leonardo Fea de Birmanie","1-230","","Annali del Museo Civico di Storia Naturale, Genova","","","","<!--MARK--><a href='../../../../publication/69354bd6-3f22-41be-b540-eda7d4201b51' class='mouseoverHref'>Brunner von Wattenwyl, C. 1893. Révision du système des Orthoptères et description des espèces rapportées par M. Leonardo Fea de Birmanie.</a> <!--MARK--><!--MARK--><a href='../../../../publication/461059ea-ead7-4f6d-83f4-52913f06d09f' class='mouseoverHref'><em>Annali del Museo Civico di Storia Naturale, Genova</em></a> 2a <strong>13</strong>: 1-230<!--MARK--> [published September]","published September","Article in Journal","69354bd6-3f22-41be-b540-eda7d4201b51","20150317T23:38:22.915+0000","461059ea-ead7-4f6d-83f4-52913f06d09f"
"Burmeister, H.","1838","Handbuch der Entomologie","1050 pp.","","","","","T.C.F. Enslin","<!--MARK--><a href='../../../../publication/90a2557c-05cc-470e-9c8f-df5181def5cf' class='mouseoverHref'>Burmeister, H. 1838. <em>Handbuch der Entomologie</em>. Berlin : T.C.F. Enslin Vol. 2(2) 1050 pp.</a><!--MARK-->","","Book","90a2557c-05cc-470e-9c8f-df5181def5cf","20081009T05:11:37.000+0000",""
"Calaby, J.H.","1956","The distribution and biology of the genus <i>Ahamitermes</i> (Isoptera)","111-124 pl. 1","","Australian Journal of Zoology","","","","<!--MARK--><a href='../../../../publication/a4271865-2a16-4c58-bc2e-cab82e60900e' class='mouseoverHref'>Calaby, J.H. 1956. The distribution and biology of the genus <i>Ahamitermes</i> (Isoptera).</a> <!--MARK--><!--MARK--><a href='../../../../publication/53c3abd8-0254-4532-a73e-d9ef6b7ac2ef' class='mouseoverHref'><em>Australian Journal of Zoology</em></a> <strong>4</strong>: 111-124 pl. 1<!--MARK-->","","Article in Journal","a4271865-2a16-4c58-bc2e-cab82e60900e","20081009T05:11:37.000+0000","53c3abd8-0254-4532-a73e-d9ef6b7ac2ef"
"Calaby, J.H. & Gay, F.J.","1956","The distribution and biology of the genus <i>Coptotermes</i> (Isoptera) in Western Australia","19-39","","Australian Journal of Zoology","","","","<!--MARK--><a href='../../../../publication/0bbed6c0-510c-423e-a7ba-e14b984b2ee7' class='mouseoverHref'>Calaby, J.H. & Gay, F.J. 1956. The distribution and biology of the genus <i>Coptotermes</i> (Isoptera) in Western Australia.</a> <!--MARK--><!--MARK--><a href='../../../../publication/53c3abd8-0254-4532-a73e-d9ef6b7ac2ef' class='mouseoverHref'><em>Australian Journal of Zoology</em></a> <strong>4</strong>: 19-39<!--MARK-->","","Article in Journal","0bbed6c0-510c-423e-a7ba-e14b984b2ee7","20081009T05:11:37.000+0000","53c3abd8-0254-4532-a73e-d9ef6b7ac2ef"
"Calaby, J.H. & Gay, F.J.","1959","Aspects of the distribution and ecology of Australian termites","211-223","Biogeography and Ecology in Australia","","","","","<!--MARK--><a href='../../../../publication/19a2df84-a184-45c1-80a8-da2c8b876444' class='mouseoverHref'>Calaby, J.H. & Gay, F.J. 1959. Aspects of the distribution and ecology of Australian termites. pp. 211-223</a> <!--MARK--><em>in</em> <!--MARK--><a href='../../../../publication/1c1bce30-9de7-44d1-901e-0b7f6c29b646' class='mouseoverHref'>Keast, A., Crocker, R.L. & Christian, C.S. (eds). <em>Biogeography and Ecology in Australia</em>. The Hague : Dr. W. Junk.</a><!--MARK-->","","Chapter in Book","19a2df84-a184-45c1-80a8-da2c8b876444","20081009T05:11:37.000+0000","1c1bce30-9de7-44d1-901e-0b7f6c29b646"
"Chhotani, O.B.","1970","Taxonomy, zoogeography and phylogeny of the genus <i>Cryptotermes</i> (Isoptera: Kalotermitidae) from the Oriental Region","i 1-81","","Memoirs of the Zoological Survey of India","","","","<!--MARK--><a href='../../../../publication/5427a1da-7041-4529-8921-2aa9f1248786' class='mouseoverHref'>Chhotani, O.B. 1970. Taxonomy, zoogeography and phylogeny of the genus <i>Cryptotermes</i> (Isoptera: Kalotermitidae) from the Oriental Region.</a> <!--MARK--><!--MARK--><a href='../../../../publication/15057797-4db4-42a6-8723-109743b0b4ac' class='mouseoverHref'><em>Memoirs of the Zoological Survey of India</em></a> <strong>15</strong>(1): i 1-81<!--MARK-->","","Article in Journal","5427a1da-7041-4529-8921-2aa9f1248786","20081009T05:11:37.000+0000","15057797-4db4-42a6-8723-109743b0b4ac"
"Creffield, J.W.","1991","Wood Destroying Insects. Wood borers and termites. East","vi 44 pp.","","","","","Commonwealth Scientific and Industrial Research Organisation","<!--MARK--><a href='../../../../publication/4e88e343-d524-448c-81dc-1552ee02bb58' class='mouseoverHref'>Creffield, J.W. 1991. <em>Wood Destroying Insects. Wood borers and termites. East</em>. Melbourne : Commonwealth Scientific and Industrial Research Organisation vi 44 pp.</a><!--MARK-->","","Book","4e88e343-d524-448c-81dc-1552ee02bb58","20081009T05:11:37.000+0000",""
"Dahms, E.","1972","Type-specimens of cockroaches (Blattodea) in the Queensland Museum","273-289","","Memoirs of the Queensland Museum","","","","<!--MARK--><a href='../../../../publication/5be3a7a8-5ae1-4947-9000-69fa56a3bfa0' class='mouseoverHref'>Dahms, E. 1972. Type-specimens of cockroaches (Blattodea) in the Queensland Museum.</a> <!--MARK--><!--MARK--><a href='../../../../publication/1a0a2982-9f30-43e1-a641-b0379699837c' class='mouseoverHref'><em>Memoirs of the Queensland Museum</em></a> <strong>16</strong>: 273-289<!--MARK-->","","Article in Journal","5be3a7a8-5ae1-4947-9000-69fa56a3bfa0","20081009T05:11:37.000+0000","1a0a2982-9f30-43e1-a641-b0379699837c"
"Desneux, J.","1905","Isoptera of New Guinea collected by L. Biró","367-377","","Annales Musei Nationalis Hungarici","","","","<!--MARK--><a href='../../../../publication/bfe43205-89bf-408d-8efc-3c77ca2355b3' class='mouseoverHref'>Desneux, J. 1905. Isoptera of New Guinea collected by L. Biró.</a> <!--MARK--><!--MARK--><a href='../../../../publication/8db75db5-93e9-4d46-8107-771c60f716c8' class='mouseoverHref'><em>Annales Musei Nationalis Hungarici</em></a> <strong>3</strong>: 367-377<!--MARK-->","","Article in Journal","bfe43205-89bf-408d-8efc-3c77ca2355b3","20081009T05:11:37.000+0000","8db75db5-93e9-4d46-8107-771c60f716c8"
"Dudley, P.H. in Dudley, P.H. & Beaumont, J.","1890","Termites of the isthmus of Panama. Part ii","157-180","","Transactions of the New York Academy of Sciences","","","","<!--MARK--><a href='../../../../publication/63f29639-aa79-4c43-89e9-ab8a14f66943' class='mouseoverHref'>Dudley, P.H. <i>in</i> Dudley, P.H. & Beaumont, J. 1890. Termites of the isthmus of Panama. Part ii.</a> <!--MARK--><!--MARK--><a href='../../../../publication/c0ca59a3-f08b-4426-b53f-10b3c5cc1875' class='mouseoverHref'><em>Transactions of the New York Academy of Sciences</em></a> <strong>9</strong>: 157-180<!--MARK-->","","Article in Journal","63f29639-aa79-4c43-89e9-ab8a14f66943","20081009T05:11:37.000+0000","c0ca59a3-f08b-4426-b53f-10b3c5cc1875"
"Eldridge, R.H.","1991","Studies on the Australian <i>Glyptotermes</i> (Isoptera: Kalotermitidae). Unpub. M.Sc. Thesis","xii 163 pp.","","","","","University of Sydney","<!--MARK--><a href='../../../../publication/806b16cd-211d-4d3d-9633-434f7a3b989f' class='mouseoverHref'>Eldridge, R.H. 1991. <em>Studies on the Australian <i>Glyptotermes</i> (Isoptera: Kalotermitidae). Unpub. M.Sc. Thesis</em>. Sydney : University of Sydney xii 163 pp.</a><!--MARK-->","","Book","806b16cd-211d-4d3d-9633-434f7a3b989f","20081009T05:11:37.000+0000",""
"Eldridge, R.H.","1996","<i>Revision of Australian</i> Glyptotermes <i>Froggatt (Isoptera: Kalotermitidae)</i>","165-176","","Australian Journal of Entomology","","","","<!--MARK--><a href='../../../../publication/bc0a3502-f335-45b0-9001-b55d4a8ac0bc' class='mouseoverHref'>Eldridge, R.H. 1996. <i>Revision of Australian</i> Glyptotermes <i>Froggatt (Isoptera: Kalotermitidae)</i>.</a> <!--MARK--><!--MARK--><a href='../../../../publication/77b15fe9-6d88-4390-b074-3a3a6d3683a6' class='mouseoverHref'><em>Australian Journal of Entomology</em></a> <strong>35</strong>: 165-176<!--MARK-->","","Article in Journal","bc0a3502-f335-45b0-9001-b55d4a8ac0bc","20081009T05:11:37.000+0000","77b15fe9-6d88-4390-b074-3a3a6d3683a6"
"Emerson, A.E.","1955","Geographical origins and dispersions of termite genera","465-521","","Fieldiana Zoology","","","","<!--MARK--><a href='../../../../publication/b40ed029-3b55-43b3-ab1f-cb99e6fa0e39' class='mouseoverHref'>Emerson, A.E. 1955. Geographical origins and dispersions of termite genera.</a> <!--MARK--><!--MARK--><a href='../../../../publication/a366ee6e-7db7-4c32-b8ee-def78eea2aab' class='mouseoverHref'><em>Fieldiana Zoology</em></a> <strong>37</strong>: 465-521<!--MARK-->","","Article in Journal","b40ed029-3b55-43b3-ab1f-cb99e6fa0e39","20081009T05:11:37.000+0000","a366ee6e-7db7-4c32-b8ee-def78eea2aab"
"Emerson, A.E.","1960","New genera of termites related to <i>Subulitermes</i> from the Oriental, Malagasy, and Australian regions (Isoptera, Termitidae, Nasutitermitinae)","1-28","","American Museum Novitates","","","","<!--MARK--><a href='../../../../publication/4c88bc8d-77d3-4682-a49c-8a77e7a970b4' class='mouseoverHref'>Emerson, A.E. 1960. New genera of termites related to <i>Subulitermes</i> from the Oriental, Malagasy, and Australian regions (Isoptera, Termitidae, Nasutitermitinae).</a> <!--MARK--><!--MARK--><a href='../../../../publication/6502b0bb-309f-414e-9d7f-4cb7a3619a03' class='mouseoverHref'><em>American Museum Novitates</em></a> <strong>1986</strong>: 1-28<!--MARK-->","","Article in Journal","4c88bc8d-77d3-4682-a49c-8a77e7a970b4","20081009T05:11:37.000+0000","6502b0bb-309f-414e-9d7f-4cb7a3619a03"
"Emerson, A.E. in Kirby, H.","1949","Devescovinid flagellates of termites V. The genus <i>Hyperdevescovina</i>, the genus <i>Bullanympha</i>, and undescribed or unrecorded species","319-421","","University of California Publications in Zoology","","","","<!--MARK--><a href='../../../../publication/c607f235-ad69-40e1-b4ec-1a9b1cab37f9' class='mouseoverHref'>Emerson, A.E. <i>in</i> Kirby, H. 1949. Devescovinid flagellates of termites V. The genus <i>Hyperdevescovina</i>, the genus <i>Bullanympha</i>, and undescribed or unrecorded species.</a> <!--MARK--><!--MARK--><a href='../../../../publication/a1d894b9-6896-4b27-a352-f01214bd467e' class='mouseoverHref'><em>University of California Publications in Zoology</em></a> <strong>45</strong>: 319-421<!--MARK-->","","Article in Journal","c607f235-ad69-40e1-b4ec-1a9b1cab37f9","20081009T05:11:37.000+0000","a1d894b9-6896-4b27-a352-f01214bd467e"
"Emerson, A.E. in Snyder, T.","1949","Catalog of the termites (Isoptera) of the world","1-490","","Smithsonian Miscellaneous Collections","","","","<!--MARK--><a href='../../../../publication/135d8922-e987-4062-83d1-d889da36d57a' class='mouseoverHref'>Emerson, A.E. <i>in</i> Snyder, T. 1949. Catalog of the termites (Isoptera) of the world.</a> <!--MARK--><!--MARK--><a href='../../../../publication/2ad18d4c-326c-454e-bf1d-5321aee079b3' class='mouseoverHref'><em>Smithsonian Miscellaneous Collections</em></a> <strong>112</strong>: 1-490<!--MARK-->","","Article in Journal","135d8922-e987-4062-83d1-d889da36d57a","20081009T05:11:37.000+0000","2ad18d4c-326c-454e-bf1d-5321aee079b3"
"Erichson, W.F.","1842","Beitrag zur Insecten-fauna von Vandiemensland, mit besonderer Berucksichtigung der geographischen Verbreitung der Insecten","83-287, pls 4, 5","","Archiv für Naturgeschichte","","","","<!--MARK--><a href='../../../../publication/2ae5a27f-fd1b-4bb9-b72e-a5997ccf96b3' class='mouseoverHref'>Erichson, W.F. 1842. Beitrag zur Insecten-fauna von Vandiemensland, mit besonderer Berucksichtigung der geographischen Verbreitung der Insecten.</a> <!--MARK--><!--MARK--><a href='../../../../publication/f5b5f7c7-fc53-4502-951d-1c96b680d874' class='mouseoverHref'><em>Archiv für Naturgeschichte</em></a> <strong>8</strong>(1): 83-287, pls 4, 5<!--MARK-->","","Article in Journal","2ae5a27f-fd1b-4bb9-b72e-a5997ccf96b3","20120514T22:59:43.847+0000","f5b5f7c7-fc53-4502-951d-1c96b680d874"
"Ernst, E. & Araujo, R.L.","1986","A Bibliography of Termite Literature 1966-1978","vi 903 pp.","","","","","John Wiley & Sons","<!--MARK--><a href='../../../../publication/9e610099-9473-4abc-b6c4-2e079f7bebed' class='mouseoverHref'>Ernst, E. & Araujo, R.L. 1986. <em>A Bibliography of Termite Literature 1966-1978</em>. Chichester : John Wiley & Sons vi 903 pp.</a><!--MARK-->","","Book","9e610099-9473-4abc-b6c4-2e079f7bebed","20081009T05:11:37.000+0000",""
"Fabricius, J.C.","1775","Systema Entomologiae, sistens Insectorum Classes, Ordines, Genera, Species, adiectis Synonymis, Locis, Descriptionibus, Observationibus","xxxii 832 pp.","","","","17 April","Kortii","<!--MARK--><a href='../../../../publication/da77a1b5-cdfa-4c8b-a4fa-3ba1ead48929' class='mouseoverHref'>Fabricius, J.C. 1775. <em>Systema Entomologiae, sistens Insectorum Classes, Ordines, Genera, Species, adiectis Synonymis, Locis, Descriptionibus, Observationibus</em>. Flensburgi et Lipsiae [= Flensburg & Leipzig] : Kortii xxxii 832 pp.</a><!--MARK--> [Date published 17 April]","","Book","da77a1b5-cdfa-4c8b-a4fa-3ba1ead48929","20110508T01:53:06.371+0000",""
"Ferrar, P. & Watson, J.A.L.","1970","Termites (Isoptera) associated with dung in Australia","100-102","","Journal of the Australian Entomological Society","","","","<!--MARK--><a href='../../../../publication/18c41236-2cc1-431b-94eb-cbca4cdd991e' class='mouseoverHref'>Ferrar, P. & Watson, J.A.L. 1970. Termites (Isoptera) associated with dung in Australia.</a> <!--MARK--><!--MARK--><a href='../../../../publication/c2544f9f-3978-4f18-846d-a1fd3122c9c4' class='mouseoverHref'><em>Journal of the Australian Entomological Society</em></a> <strong>9</strong>: 100-102<!--MARK-->","","Article in Journal","18c41236-2cc1-431b-94eb-cbca4cdd991e","20081009T05:11:37.000+0000","c2544f9f-3978-4f18-846d-a1fd3122c9c4"
"Fischer, J.E.","1853","Orthoptera Europaea","xx 454 pp., 18 pls","","","","","Engelmann","<!--MARK--><a href='../../../../publication/88fcdd21-d6cb-4395-86cb-1bf0f9d99f98' class='mouseoverHref'>Fischer, J.E. 1853. <em>Orthoptera Europaea</em>. Lipsiae : Engelmann xx 454 pp., 18 pls.</a><!--MARK-->","","Book","88fcdd21-d6cb-4395-86cb-1bf0f9d99f98","20140715T01:16:09.765+0000",""
"Fischer von Waldheim, G.","1833","Conspectus orthopterorum rossicorum","341-390","","Bulletin de la Société Impériale des Naturalistes de Moscou","","","","<!--MARK--><a href='../../../../publication/6ed671ac-1b9b-4768-9a64-7582b8620eb5' class='mouseoverHref'>Fischer von Waldheim, G. 1833. Conspectus orthopterorum rossicorum.</a> <!--MARK--><!--MARK--><a href='../../../../publication/a7cbc93a-fdd0-40a5-9cc8-35de71b7d18a' class='mouseoverHref'><em>Bulletin de la Société Impériale des Naturalistes de Moscou</em></a> <strong>6</strong>: 341-390<!--MARK-->","","Article in Journal","6ed671ac-1b9b-4768-9a64-7582b8620eb5","20081009T05:11:37.000+0000","a7cbc93a-fdd0-40a5-9cc8-35de71b7d18a"
