"PUB_AUTHOR","PUB_YEAR","PUB_TITLE","PUB_PAGES","PUB_PARENT_BOOK_TITLE","PUB_PARENT_JOURNAL_TITLE","PUB_PARENT_ARTICLE_TITLE","PUB_PUBLICATION_DATE","PUB_PUBLISHER","PUB_FORMATTED","PUB_QUALIFICATION","PUB_TYPE","PUBLICATION_GUID","PUBLICATION_LAST_UPDATE","PARENT_PUBLICATION_GUID"
"Hill, G.F.","1922","A new Australian termite","275-277","","Proceedings of the Linnean Society of New South Wales","","","","<!--MARK--><a href='../../../../publication/c0c3ddb8-4916-467b-b38b-454d878a405c' class='mouseoverHref'>Hill, G.F. 1922. A new Australian termite.</a> <!--MARK--><!--MARK--><a href='../../../../publication/c12cd779-adb5-41ea-bd2c-75f6864cf22e' class='mouseoverHref'><em>Proceedings of the Linnean Society of New South Wales</em></a> <strong>47</strong>: 275-277<!--MARK-->","","Article in Journal","c0c3ddb8-4916-467b-b38b-454d878a405c","20081009T05:11:37.000+0000","c12cd779-adb5-41ea-bd2c-75f6864cf22e"
"Hill, G.F.","1922","Descriptions and biology of some north Australian termites","142-160 pls xxiii-xxv","","Proceedings of the Linnean Society of New South Wales","","","","<!--MARK--><a href='../../../../publication/654e90f1-6cc0-49aa-9d6c-1857a9ddb025' class='mouseoverHref'>Hill, G.F. 1922. Descriptions and biology of some north Australian termites.</a> <!--MARK--><!--MARK--><a href='../../../../publication/c12cd779-adb5-41ea-bd2c-75f6864cf22e' class='mouseoverHref'><em>Proceedings of the Linnean Society of New South Wales</em></a> <strong>47</strong>: 142-160 pls xxiii-xxv<!--MARK-->","","Article in Journal","654e90f1-6cc0-49aa-9d6c-1857a9ddb025","20081009T05:11:37.000+0000","c12cd779-adb5-41ea-bd2c-75f6864cf22e"
"Hill, G.F.","1922","On some Australian termites of the genera <i>Drepanotermes</i>, <i>Hamitermes</i> and <i>Leucotermes</i>","363-399 pls ix-xii","","Bulletin of Entomological Research","","","","<!--MARK--><a href='../../../../publication/0cb873ca-89f7-43d5-8bf1-e0a96d2aecb3' class='mouseoverHref'>Hill, G.F. 1922. On some Australian termites of the genera <i>Drepanotermes</i>, <i>Hamitermes</i> and <i>Leucotermes</i>.</a> <!--MARK--><!--MARK--><a href='../../../../publication/ef0b7d10-3b2d-4f9f-affe-9a3dc2101d9f' class='mouseoverHref'><em>Bulletin of Entomological Research</em></a> <strong>12</strong>: 363-399 pls ix-xii<!--MARK-->","","Article in Journal","0cb873ca-89f7-43d5-8bf1-e0a96d2aecb3","20081009T05:11:37.000+0000","ef0b7d10-3b2d-4f9f-affe-9a3dc2101d9f"
"Hill, G.F.","1923","New termites from central and south-east Australia","40-48","","Proceedings of the Linnean Society of New South Wales","","","","<!--MARK--><a href='../../../../publication/a15a15ee-87cf-49a4-beec-18a4e415acf5' class='mouseoverHref'>Hill, G.F. 1923. New termites from central and south-east Australia.</a> <!--MARK--><!--MARK--><a href='../../../../publication/c12cd779-adb5-41ea-bd2c-75f6864cf22e' class='mouseoverHref'><em>Proceedings of the Linnean Society of New South Wales</em></a> <strong>48</strong>: 40-48<!--MARK-->","","Article in Journal","a15a15ee-87cf-49a4-beec-18a4e415acf5","20081009T05:11:37.000+0000","c12cd779-adb5-41ea-bd2c-75f6864cf22e"
"Hill, G.F.","1925","Termites from the Australian region: descriptions of new species and hitherto undescribed castes","206-229 pls xxiii-xxvi","","Proceedings of the Royal Society of Victoria","","","","<!--MARK--><a href='../../../../publication/c8aa4476-c811-4bc2-9d8e-d5f033aadf18' class='mouseoverHref'>Hill, G.F. 1925. Termites from the Australian region: descriptions of new species and hitherto undescribed castes.</a> <!--MARK--><!--MARK--><a href='../../../../publication/ce333794-3a02-427f-ba27-346079f1efa0' class='mouseoverHref'><em>Proceedings of the Royal Society of Victoria</em></a> ns <strong>37</strong>: 206-229 pls xxiii-xxvi<!--MARK-->","","Article in Journal","c8aa4476-c811-4bc2-9d8e-d5f033aadf18","20081009T05:11:37.000+0000","ce333794-3a02-427f-ba27-346079f1efa0"
"Hill, G.F.","1926","Australian termites (Isoptera). Notes on <i>Stolotermes</i>, <i>Calotermes</i>, and <i>Coptotermes</i>, with descriptions of new species","192-214","","Proceedings of the Royal Society of Victoria","","","","<!--MARK--><a href='../../../../publication/9a77660f-c0a1-4141-a445-78e72fc72590' class='mouseoverHref'>Hill, G.F. 1926. Australian termites (Isoptera). Notes on <i>Stolotermes</i>, <i>Calotermes</i>, and <i>Coptotermes</i>, with descriptions of new species.</a> <!--MARK--><!--MARK--><a href='../../../../publication/ce333794-3a02-427f-ba27-346079f1efa0' class='mouseoverHref'><em>Proceedings of the Royal Society of Victoria</em></a> ns <strong>38</strong>: 192-214<!--MARK-->","","Article in Journal","9a77660f-c0a1-4141-a445-78e72fc72590","20081009T05:11:37.000+0000","ce333794-3a02-427f-ba27-346079f1efa0"
"Hill, G.F.","1926","New termites from Samoan Islands","296-300","","The Entomologist","","","","<!--MARK--><a href='../../../../publication/af7a5a7b-2ffe-4b75-941a-f37bcb723ffd' class='mouseoverHref'>Hill, G.F. 1926. New termites from Samoan Islands.</a> <!--MARK--><!--MARK--><a href='../../../../publication/f3b5bc68-9fcf-42d6-b01d-f490d96af7e9' class='mouseoverHref'><em>The Entomologist</em></a> <strong>59</strong>: 296-300<!--MARK-->","","Article in Journal","af7a5a7b-2ffe-4b75-941a-f37bcb723ffd","20081009T05:11:37.000+0000","f3b5bc68-9fcf-42d6-b01d-f490d96af7e9"
"Hill, G.F.","1927","Termites from the Australian region. Part I","5-120 pls i-ix","","Memoirs of the National Museum of Victoria, Melbourne","","","","<!--MARK--><a href='../../../../publication/91fe1892-cd7e-4fa9-b1ad-e0382880dddc' class='mouseoverHref'>Hill, G.F. 1927. Termites from the Australian region. Part I.</a> <!--MARK--><!--MARK--><a href='../../../../publication/6d019674-04b0-4fab-8903-0612d147ec4d' class='mouseoverHref'><em>Memoirs of the National Museum of Victoria, Melbourne</em></a> <strong>7</strong>: 5-120 pls i-ix<!--MARK-->","","Article in Journal","91fe1892-cd7e-4fa9-b1ad-e0382880dddc","20081009T05:11:37.000+0000","6d019674-04b0-4fab-8903-0612d147ec4d"
"Hill, G.F.","1929","Notes on Australian termites (Isoptera). Descriptions of new species","85-96 pl. xiv","","Proceedings of the Royal Society of Victoria","","","","<!--MARK--><a href='../../../../publication/dc46ecc9-f253-4b64-b43d-874e5f6bcbb6' class='mouseoverHref'>Hill, G.F. 1929. Notes on Australian termites (Isoptera). Descriptions of new species.</a> <!--MARK--><!--MARK--><a href='../../../../publication/ce333794-3a02-427f-ba27-346079f1efa0' class='mouseoverHref'><em>Proceedings of the Royal Society of Victoria</em></a> ns <strong>41</strong>: 85-96 pl. xiv<!--MARK-->","","Article in Journal","dc46ecc9-f253-4b64-b43d-874e5f6bcbb6","20081009T05:11:37.000+0000","ce333794-3a02-427f-ba27-346079f1efa0"
"Hill, G.F.","1932","Australian termites (Isoptera). Biological notes and descriptions of new species","134-154","","Proceedings of the Royal Society of Victoria","","","","<!--MARK--><a href='../../../../publication/00741560-fbc6-492d-9095-a4b3c6f7814f' class='mouseoverHref'>Hill, G.F. 1932. Australian termites (Isoptera). Biological notes and descriptions of new species.</a> <!--MARK--><!--MARK--><a href='../../../../publication/ce333794-3a02-427f-ba27-346079f1efa0' class='mouseoverHref'><em>Proceedings of the Royal Society of Victoria</em></a> ns <strong>44</strong>: 134-154<!--MARK-->","","Article in Journal","00741560-fbc6-492d-9095-a4b3c6f7814f","20081009T05:11:37.000+0000","ce333794-3a02-427f-ba27-346079f1efa0"
"Hill, G.F.","1933","Australian <i>Rhinotermes</i> (Isoptera)","2-17 pls I-IV","","Proceedings of the Royal Society of Victoria","","","","<!--MARK--><a href='../../../../publication/db44ad45-f678-4b21-ac9f-454a3ffe6864' class='mouseoverHref'>Hill, G.F. 1933. Australian <i>Rhinotermes</i> (Isoptera).</a> <!--MARK--><!--MARK--><a href='../../../../publication/ce333794-3a02-427f-ba27-346079f1efa0' class='mouseoverHref'><em>Proceedings of the Royal Society of Victoria</em></a> ns <strong>45</strong>: 2-17 pls I-IV<!--MARK-->","","Article in Journal","db44ad45-f678-4b21-ac9f-454a3ffe6864","20081009T05:11:37.000+0000","ce333794-3a02-427f-ba27-346079f1efa0"
"Hill, G.F.","1933","Notes on <i>Porotermes</i> and <i>Calotermes</i> (Isoptera) from the Australian region, with descriptions of new species","36-50 pls I-II","","Proceedings of the Royal Society of Victoria","","","","<!--MARK--><a href='../../../../publication/27f42fe9-19f0-4130-8381-92d94290c989' class='mouseoverHref'>Hill, G.F. 1933. Notes on <i>Porotermes</i> and <i>Calotermes</i> (Isoptera) from the Australian region, with descriptions of new species.</a> <!--MARK--><!--MARK--><a href='../../../../publication/ce333794-3a02-427f-ba27-346079f1efa0' class='mouseoverHref'><em>Proceedings of the Royal Society of Victoria</em></a> ns <strong>46</strong>: 36-50 pls I-II<!--MARK-->","","Article in Journal","27f42fe9-19f0-4130-8381-92d94290c989","20081009T05:11:37.000+0000","ce333794-3a02-427f-ba27-346079f1efa0"
"Hill, G.F.","1935","Australian <i>Hamitermes</i> (Isoptera), with descriptions of new species and hitherto undescribed castes","13-31 pls 1-3","","Pamphlet, Council for Scientific and Industrial Research, Australia","","","","<!--MARK--><a href='../../../../publication/476a5cf3-7182-44f0-b82f-30d81f47bec6' class='mouseoverHref'>Hill, G.F. 1935. Australian <i>Hamitermes</i> (Isoptera), with descriptions of new species and hitherto undescribed castes.</a> <!--MARK--><!--MARK--><a href='../../../../publication/c5371cc2-5b2f-4cce-a8d5-d5ea46e12df8' class='mouseoverHref'><em>Pamphlet, Council for Scientific and Industrial Research, Australia</em></a> <strong>52</strong>: 13-31 pls 1-3<!--MARK-->","","Article in Journal","476a5cf3-7182-44f0-b82f-30d81f47bec6","20081009T05:11:37.000+0000","c5371cc2-5b2f-4cce-a8d5-d5ea46e12df8"
"Hill, G.F.","1942","Termites (Isoptera) from the Australian Region","479 pp. 24 pls","","","","","Council for Scientific and Industrial Research","<!--MARK--><a href='../../../../publication/74ffc211-a6e0-43b4-be86-a3bde296db29' class='mouseoverHref'>Hill, G.F. 1942. <em>Termites (Isoptera) from the Australian Region</em>. Melbourne : Council for Scientific and Industrial Research 479 pp. 24 pls.</a><!--MARK-->","","Book","74ffc211-a6e0-43b4-be86-a3bde296db29","20081009T05:11:37.000+0000",""
"Holmgren, N.","1910","Isoptera. The Percy Sladen Trust Expedition to the Indian Ocean in 1905, under the leadership of Mr J. Stanley Gardiner, M.A. Vol. III","135-148","","Transactions of the Linnean Society of London","","","","<!--MARK--><a href='../../../../publication/4ac71dde-61d1-419f-bbac-c0b6347ef9cf' class='mouseoverHref'>Holmgren, N. 1910. Isoptera. The Percy Sladen Trust Expedition to the Indian Ocean in 1905, under the leadership of Mr J. Stanley Gardiner, M.A. Vol. III.</a> <!--MARK--><!--MARK--><a href='../../../../publication/a6b0ca4d-471d-4666-96a2-8fee5114bc35' class='mouseoverHref'><em>Transactions of the Linnean Society of London</em></a> Ser. 2 <strong>14</strong>: 135-148<!--MARK-->","","Article in Journal","4ac71dde-61d1-419f-bbac-c0b6347ef9cf","20081009T05:11:37.000+0000","a6b0ca4d-471d-4666-96a2-8fee5114bc35"
"Holmgren, N.","1910b","Das System der Termiten","284-286","","Zoologischer Anzeiger","","","","<!--MARK--><a href='../../../../publication/e3557f39-d36b-47ee-836f-51d5678e1683' class='mouseoverHref'>Holmgren, N. 1910b. Das System der Termiten.</a> <!--MARK--><!--MARK--><a href='../../../../publication/4b894062-2782-48ef-bf96-6997840d9060' class='mouseoverHref'><em>Zoologischer Anzeiger</em></a> <strong>35</strong>: 284-286<!--MARK-->","","Article in Journal","e3557f39-d36b-47ee-836f-51d5678e1683","20140602T23:36:20.753+0000","4b894062-2782-48ef-bf96-6997840d9060"
"Holmgren, N.","1911","Termitenstudien 2. Systematik der Termiten Die Familien Mastotermitidae, Protermitidae und Mesotermitidae","1-86 pls1-6","","Kongliga Svenska Vetenskaps-Academiens Nya Handlingar, Stockholm","","","","<!--MARK--><a href='../../../../publication/d074fe30-43ef-4f1a-89c5-0f9d9d719d58' class='mouseoverHref'>Holmgren, N. 1911. Termitenstudien 2. Systematik der Termiten Die Familien Mastotermitidae, Protermitidae und Mesotermitidae.</a> <!--MARK--><!--MARK--><a href='../../../../publication/f145f16a-592b-484d-8689-ce403bec0970' class='mouseoverHref'><em>Kongliga Svenska Vetenskaps-Academiens Nya Handlingar, Stockholm</em></a> <strong>46</strong>(6): 1-86 pls1-6<!--MARK-->","","Article in Journal","d074fe30-43ef-4f1a-89c5-0f9d9d719d58","20081009T05:11:37.000+0000","f145f16a-592b-484d-8689-ce403bec0970"
"Holmgren, N.","1912","Neue Termiten aus dem Deutschen Entomologischen Museum","280-282","","Entomologische Mitteilungen. Berlin-Dahlem","","","","<!--MARK--><a href='../../../../publication/5c91e8a9-afaf-4b67-8494-bb2f76c5b8f0' class='mouseoverHref'>Holmgren, N. 1912. Neue Termiten aus dem Deutschen Entomologischen Museum.</a> <!--MARK--><!--MARK--><a href='../../../../publication/ac06ba2d-be9d-4dfe-91bb-bb21ae357dec' class='mouseoverHref'><em>Entomologische Mitteilungen. Berlin-Dahlem</em></a> <strong>1</strong>: 280-282<!--MARK-->","","Article in Journal","5c91e8a9-afaf-4b67-8494-bb2f76c5b8f0","20081009T05:11:37.000+0000","ac06ba2d-be9d-4dfe-91bb-bb21ae357dec"
"Holmgren, N.","1912","Termitenstudien 3. Systematik der Termiten Die Familie Metatermitidae","1-166 pls 1-4","","Kongliga Svenska Vetenskaps-Academiens Nya Handlingar, Stockholm","","","","<!--MARK--><a href='../../../../publication/6b933b7b-503e-447c-b1af-83e9437a8e9e' class='mouseoverHref'>Holmgren, N. 1912. Termitenstudien 3. Systematik der Termiten Die Familie Metatermitidae.</a> <!--MARK--><!--MARK--><a href='../../../../publication/f145f16a-592b-484d-8689-ce403bec0970' class='mouseoverHref'><em>Kongliga Svenska Vetenskaps-Academiens Nya Handlingar, Stockholm</em></a> <strong>48</strong>(4): 1-166 pls 1-4<!--MARK-->","","Article in Journal","6b933b7b-503e-447c-b1af-83e9437a8e9e","20081009T05:11:37.000+0000","f145f16a-592b-484d-8689-ce403bec0970"
"Huang Fu-sheng, Li Gui-xiang & Zhu Shi-mo","1989","The Taxonomy and Biology of Chinese Termites -- Isoptera","ii 605 pp.","","","","","Tianze Press","<!--MARK--><a href='../../../../publication/6cfa2bcb-5dd3-4cbe-9ce3-6f422c119754' class='mouseoverHref'>Huang Fu-sheng, Li Gui-xiang & Zhu Shi-mo 1989. <em>The Taxonomy and Biology of Chinese Termites -- Isoptera</em>. Xian : Tianze Press ii 605 pp.</a><!--MARK--> [in Chinese]","in Chinese","Book","6cfa2bcb-5dd3-4cbe-9ce3-6f422c119754","20100224T23:10:57.383+0000",""
"ICZN","2014","Opinion 2330 (Case 3548). <i>Termes serratus</i> Froggatt, 1898 (currently <i>Microcerotermes serratus</i>) and <i>Termes serrula</i> Desneux, 1904 (currently <i>Microcerotermes serrula</i> (Insecta, Isoptera, TERMITINAE): specific names conserved.","46-47","","Bulletin of Zoological Nomenclature","","","","<!--MARK--><a href='../../../../publication/3bed5ce0-e5ab-4e03-af1a-6bdcc92af75a' class='mouseoverHref'>ICZN 2014. Opinion 2330 (Case 3548). <i>Termes serratus</i> Froggatt, 1898 (currently <i>Microcerotermes serratus</i>) and <i>Termes serrula</i> Desneux, 1904 (currently <i>Microcerotermes serrula</i> (Insecta, Isoptera, TERMITINAE): specific names conserved.</a> <!--MARK--><!--MARK--><a href='../../../../publication/a4cf2b4b-baae-48a9-9e16-867e582bfbcc' class='mouseoverHref'><em>Bulletin of Zoological Nomenclature</em></a> <strong>71</strong>(1): 46-47<!--MARK-->","","Article in Journal","3bed5ce0-e5ab-4e03-af1a-6bdcc92af75a","20140914T22:54:20.920+0000","a4cf2b4b-baae-48a9-9e16-867e582bfbcc"
"Inward, D., Beccaloni , G & Eggleton, P.","2007","Death of an order: phylogenetic study confirms that termites are eusocial cockroaches","331-335","","Biology Letters","","","","<!--MARK--><a href='../../../../publication/3edece90-23fe-4122-8140-1c9d5cbc51a1' class='mouseoverHref'>Inward, D., Beccaloni , G & Eggleton, P. 2007. Death of an order: phylogenetic study confirms that termites are eusocial cockroaches.</a> <!--MARK--><!--MARK--><a href='../../../../publication/4ef0435d-5a90-40d4-87b0-5bb8e3d5d039' class='mouseoverHref'><em>Biology Letters</em></a> <strong>3</strong>: 331-335<!--MARK-->","","Article in Journal","3edece90-23fe-4122-8140-1c9d5cbc51a1","20170209T21:42:14.678+0000","4ef0435d-5a90-40d4-87b0-5bb8e3d5d039"
"Jacklyn, P.M.","1992","Magnetic termite mound surfaces are oriented to suit wind and shade conditions","385-395","","Oecologia (Berlin)","","","","<!--MARK--><a href='../../../../publication/de51fac8-f4e8-4691-9286-f9ec096eef0b' class='mouseoverHref'>Jacklyn, P.M. 1992. Magnetic termite mound surfaces are oriented to suit wind and shade conditions.</a> <!--MARK--><!--MARK--><a href='../../../../publication/71d68980-bc9a-413a-a641-e2f3c6f49392' class='mouseoverHref'><em>Oecologia (Berlin)</em></a> <strong>91</strong>: 385-395<!--MARK-->","","Article in Journal","de51fac8-f4e8-4691-9286-f9ec096eef0b","20081009T05:11:37.000+0000","71d68980-bc9a-413a-a641-e2f3c6f49392"
"Jacobson, G.","1924","Annotationes synonymicae et systematicae de Coleopteris","237-244","","Entomologicheskoe Obozrenie (English translation as Entomological Reviews)","","","","<!--MARK--><a href='../../../../publication/9b0c56df-cc89-4db0-99f8-6271b477018e' class='mouseoverHref'>Jacobson, G. 1924. Annotationes synonymicae et systematicae de Coleopteris.</a> <!--MARK--><!--MARK--><a href='../../../../publication/f0f3c73b-0eee-4d43-8239-b4de88ed3ef3' class='mouseoverHref'><em>Entomologicheskoe Obozrenie (English translation as Entomological Reviews)</em></a> <strong>18</strong>: 237-244<!--MARK-->","","Article in Journal","9b0c56df-cc89-4db0-99f8-6271b477018e","20081009T05:11:37.000+0000","f0f3c73b-0eee-4d43-8239-b4de88ed3ef3"
"Johns, P.M.","1966","The cockroaches of New Zealand","93-136","","Records of the Canterbury Museum","","","","<!--MARK--><a href='../../../../publication/d454c213-8fa1-48c3-8c87-b0fb04722bef' class='mouseoverHref'>Johns, P.M. 1966. The cockroaches of New Zealand.</a> <!--MARK--><!--MARK--><a href='../../../../publication/b3dbc25b-123f-406f-b40d-94d6c8a77fbd' class='mouseoverHref'><em>Records of the Canterbury Museum</em></a> <strong>8</strong>: 93-136<!--MARK-->","","Article in Journal","d454c213-8fa1-48c3-8c87-b0fb04722bef","20081009T05:11:37.000+0000","b3dbc25b-123f-406f-b40d-94d6c8a77fbd"
"Jones, D.T.","2013","The termites of Barrow Island.","241-144","","Records of the Western Australian Museum, Supplement","","","","<!--MARK--><a href='../../../../publication/4dc74c38-8a83-41a5-8174-d7a16657ad63' class='mouseoverHref'>Jones, D.T. 2013. The termites of Barrow Island.</a> <!--MARK--><!--MARK--><a href='../../../../publication/841f1546-1bce-4548-adc9-7b08f6ca73a0' class='mouseoverHref'><em>Records of the Western Australian Museum, Supplement</em></a> <strong>83</strong>: 241-144<!--MARK-->","","Article in Journal","4dc74c38-8a83-41a5-8174-d7a16657ad63","20150105T21:57:09.107+0000","841f1546-1bce-4548-adc9-7b08f6ca73a0"
"Kirby, W.F.","1903","Notes on Blattidae etc., with descriptions of new genera and species in the collection of the British Museum, South Kensington. No. III","373-381","","Annals and Magazine of Natural History","","","","<!--MARK--><a href='../../../../publication/8f399d52-8a24-45a2-99be-e9d48f371628' class='mouseoverHref'>Kirby, W.F. 1903. Notes on Blattidae etc., with descriptions of new genera and species in the collection of the British Museum, South Kensington. No. III.</a> <!--MARK--><!--MARK--><a href='../../../../publication/efa8de69-3a29-4a43-8ef2-cbefda205976' class='mouseoverHref'><em>Annals and Magazine of Natural History</em></a> <strong>12</strong>: 373-381<!--MARK-->","","Article in Journal","8f399d52-8a24-45a2-99be-e9d48f371628","20081009T05:11:37.000+0000","efa8de69-3a29-4a43-8ef2-cbefda205976"
"Kirby, W.F.","1904","A Synonymic Catalogue of Orthoptera","501","","","","","British Museum (Natural History)","<!--MARK--><a href='../../../../publication/d03a25aa-d547-4f5b-a9a8-9e8f429e975f' class='mouseoverHref'>Kirby, W.F. 1904. <em>A Synonymic Catalogue of Orthoptera</em>. London : British Museum (Natural History) Vol. 1 501 pp.</a><!--MARK-->","","Book","d03a25aa-d547-4f5b-a9a8-9e8f429e975f","20081009T05:11:37.000+0000",""
"Kirby, W.F.","1904","A Synonymic Catalogue of Orthoptera. Orthoptera, Euplexoptera, Cursoria, et Gressoria (Forficulidae, Hemimeridae, Blattidae, Mantidae, Phasmidae)","x 501 pp.","","","","","Longmans & Co.","<!--MARK--><a href='../../../../publication/3c88f3a1-1247-4cc6-81ba-4dcfb6ab5498' class='mouseoverHref'>Kirby, W.F. 1904. <em>A Synonymic Catalogue of Orthoptera. Orthoptera, Euplexoptera, Cursoria, et Gressoria (Forficulidae, Hemimeridae, Blattidae, Mantidae, Phasmidae)</em>. London : Longmans & Co. Vol. 1 x 501 pp.</a><!--MARK-->","","Book","3c88f3a1-1247-4cc6-81ba-4dcfb6ab5498","20081009T05:11:37.000+0000",""
"Kirby, W.F.","1910","A Synonymic Catalogue of Orthoptera","562","","","","","British Museum (Natural History)","<!--MARK--><a href='../../../../publication/db053956-235c-4f26-84de-11a44d743ada' class='mouseoverHref'>Kirby, W.F. 1910. <em>A Synonymic Catalogue of Orthoptera</em>. London : British Museum (Natural History) Vol. 3 562 pp.</a><!--MARK-->","","Book","db053956-235c-4f26-84de-11a44d743ada","20081009T05:11:37.000+0000",""
"Kovoor, J.","1969","Anatomie comparée du tube digestif des termites. II. Sous-famille des Nasutitermitinae","195-234","","Insectes Sociaux","","","","<!--MARK--><a href='../../../../publication/f1e060df-ee23-4c94-9dc1-8e670edd4106' class='mouseoverHref'>Kovoor, J. 1969. Anatomie comparée du tube digestif des termites. II. Sous-famille des Nasutitermitinae.</a> <!--MARK--><!--MARK--><a href='../../../../publication/efe5b121-c808-4063-a667-9a1a7bec4bea' class='mouseoverHref'><em>Insectes Sociaux</em></a> <strong>3</strong>: 195-234<!--MARK-->","","Article in Journal","f1e060df-ee23-4c94-9dc1-8e670edd4106","20081009T05:11:37.000+0000","efe5b121-c808-4063-a667-9a1a7bec4bea"
"Krauss, H.A.","1903","Orthopteren aus Australien und den Malayischen Archipel, gesammelt von Professor Dr Richard Semon","745-755","","Denkschriften der Medizinisch-Naturwissenschaftlichen Gesellschaft zu Jena","","","","<!--MARK--><a href='../../../../publication/e787f610-4ba6-4f01-8dee-0842a1f9c8e8' class='mouseoverHref'>Krauss, H.A. 1903. Orthopteren aus Australien und den Malayischen Archipel, gesammelt von Professor Dr Richard Semon.</a> <!--MARK--><!--MARK--><a href='../../../../publication/555269c9-af5f-4ce8-bf5a-0dff833494c7' class='mouseoverHref'><em>Denkschriften der Medizinisch-Naturwissenschaftlichen Gesellschaft zu Jena</em></a> <strong>8</strong>: 745-755<!--MARK-->","","Article in Journal","e787f610-4ba6-4f01-8dee-0842a1f9c8e8","20081009T05:11:37.000+0000","555269c9-af5f-4ce8-bf5a-0dff833494c7"
"Krishna, K.","1961","A generic revision and phylogenetic study of the family Kalotermitidae (Isoptera)","303-408","","Bulletin of the American Museum of Natural History","","","","<!--MARK--><a href='../../../../publication/6e1e62da-bf3d-426b-acff-e7f1c4f029ab' class='mouseoverHref'>Krishna, K. 1961. A generic revision and phylogenetic study of the family Kalotermitidae (Isoptera).</a> <!--MARK--><!--MARK--><a href='../../../../publication/fb7ce990-e955-4634-bf04-a37f265e0778' class='mouseoverHref'><em>Bulletin of the American Museum of Natural History</em></a> <strong>122</strong>: 303-408<!--MARK-->","","Article in Journal","6e1e62da-bf3d-426b-acff-e7f1c4f029ab","20081009T05:11:37.000+0000","fb7ce990-e955-4634-bf04-a37f265e0778"
"Krishna, K.","1968","Phylogeny and generic reclassification of the <i>Capritermes</i> complex (Isoptera, Termitidae)","261-324","","Bulletin of the American Museum of Natural History","","","","<!--MARK--><a href='../../../../publication/a18fd06c-2e84-4dc9-b5c4-5322f9e2a1f4' class='mouseoverHref'>Krishna, K. 1968. Phylogeny and generic reclassification of the <i>Capritermes</i> complex (Isoptera, Termitidae).</a> <!--MARK--><!--MARK--><a href='../../../../publication/fb7ce990-e955-4634-bf04-a37f265e0778' class='mouseoverHref'><em>Bulletin of the American Museum of Natural History</em></a> <strong>138</strong>: 261-324<!--MARK-->","","Article in Journal","a18fd06c-2e84-4dc9-b5c4-5322f9e2a1f4","20081009T05:11:37.000+0000","fb7ce990-e955-4634-bf04-a37f265e0778"
"Krishna, K., Grimaldi, D.A., Krishna, V. & Engel, M.S.","2013","Treatise on the Isoptera of the World","2704 pp.","","Bulletin of the American Museum of Natural History","","","","<!--MARK--><a href='../../../../publication/b92419be-a273-42e5-ab05-53cc46c655b2' class='mouseoverHref'>Krishna, K., Grimaldi, D.A., Krishna, V. & Engel, M.S. 2013. Treatise on the Isoptera of the World.</a> <!--MARK--><!--MARK--><a href='../../../../publication/fb7ce990-e955-4634-bf04-a37f265e0778' class='mouseoverHref'><em>Bulletin of the American Museum of Natural History</em></a> <strong>377</strong>(1-7): 2704 pp.<!--MARK-->","","Article in Journal","b92419be-a273-42e5-ab05-53cc46c655b2","20140324T07:22:20.582+0000","fb7ce990-e955-4634-bf04-a37f265e0778"
"Kukalová-Peck, J.","1991","Fossil history and the evolution of hexapod structures","141-179","The Insects of Australia.  A textbook for students and research workers","","","","","<!--MARK--><a href='../../../../publication/a3ae67bc-e2c8-4b4f-9eab-c54b8cc140bd' class='mouseoverHref'>Kukalová-Peck, J. 1991. Fossil history and the evolution of hexapod structures. pp. 141-179</a> <!--MARK--><em>in</em> <!--MARK--><a href='../../../../publication/71904f0e-b130-4e08-be15-3b1a7a27d4a1' class='mouseoverHref'>CSIRO (ed.). <em>The Insects of Australia.  A textbook for students and research workers</em>. Melbourne : Melbourne University Press Vol. 1 xiii  542 pp.</a><!--MARK-->","","Chapter in Book","a3ae67bc-e2c8-4b4f-9eab-c54b8cc140bd","20081009T05:11:37.000+0000","71904f0e-b130-4e08-be15-3b1a7a27d4a1"
