"PUB_AUTHOR","PUB_YEAR","PUB_TITLE","PUB_PAGES","PUB_PARENT_BOOK_TITLE","PUB_PARENT_JOURNAL_TITLE","PUB_PARENT_ARTICLE_TITLE","PUB_PUBLICATION_DATE","PUB_PUBLISHER","PUB_FORMATTED","PUB_QUALIFICATION","PUB_TYPE","PUBLICATION_GUID","PUBLICATION_LAST_UPDATE","PARENT_PUBLICATION_GUID"
"Pope, P.","1953","Studies of the life histories of some Queensland Blattidae (Orthoptera). Part 2. Some native species","47-59","","Proceedings of the Royal Society of Queensland","","","","<!--MARK--><a href='../../../../publication/47f012b7-a5dd-4902-bbc1-e5cbd8284361' class='mouseoverHref'>Pope, P. 1953. Studies of the life histories of some Queensland Blattidae (Orthoptera). Part 2. Some native species.</a> <!--MARK--><!--MARK--><a href='../../../../publication/642ab613-813a-48d0-8bc0-42c78157f7b0' class='mouseoverHref'><em>Proceedings of the Royal Society of Queensland</em></a> <strong>63</strong>: 47-59<!--MARK-->","","Article in Journal","47f012b7-a5dd-4902-bbc1-e5cbd8284361","20081009T05:11:37.000+0000","642ab613-813a-48d0-8bc0-42c78157f7b0"
"Postle, A. & Abbott, I.","1991","Termites of economic significance in suburban Perth, Western Australia: a preliminary study of their distribution and association with types of wood (Isoptera)","183-186","","Journal of the Australian Entomological Society","","","","<!--MARK--><a href='../../../../publication/72d69e01-b3bc-4bf7-a5c9-b9bad1ce709b' class='mouseoverHref'>Postle, A. & Abbott, I. 1991. Termites of economic significance in suburban Perth, Western Australia: a preliminary study of their distribution and association with types of wood (Isoptera).</a> <!--MARK--><!--MARK--><a href='../../../../publication/c2544f9f-3978-4f18-846d-a1fd3122c9c4' class='mouseoverHref'><em>Journal of the Australian Entomological Society</em></a> <strong>30</strong>: 183-186<!--MARK-->","","Article in Journal","72d69e01-b3bc-4bf7-a5c9-b9bad1ce709b","20081009T05:11:37.000+0000","c2544f9f-3978-4f18-846d-a1fd3122c9c4"
"Princis, K.","1951","Neue und wenig Bekannte Blattarien ans dem Zoologischen Museum, Kopenhagen","5-72","","Spolia Zoologica Musei Hauniensis","","","","<!--MARK--><a href='../../../../publication/c62bff33-63e8-4281-96ec-da7d1a5831f2' class='mouseoverHref'>Princis, K. 1951. Neue und wenig Bekannte Blattarien ans dem Zoologischen Museum, Kopenhagen.</a> <!--MARK--><!--MARK--><a href='../../../../publication/2278e45f-38a7-4273-ab76-5536bd37c86a' class='mouseoverHref'><em>Spolia Zoologica Musei Hauniensis</em></a> <strong>12</strong>: 5-72<!--MARK-->","","Article in Journal","c62bff33-63e8-4281-96ec-da7d1a5831f2","20081009T05:11:37.000+0000","2278e45f-38a7-4273-ab76-5536bd37c86a"
"Princis, K.","1954","Report from Professor T. Gislén's Expedition to Australia in 1951-1952. 10. Australian Blattariae","1-49","","Acta Universitatis Lundensis","","","","<!--MARK--><a href='../../../../publication/9637011c-d110-4817-b4c5-173d6e8de703' class='mouseoverHref'>Princis, K. 1954. Report from Professor T. Gislén's Expedition to Australia in 1951-1952. 10. Australian Blattariae.</a> <!--MARK--><!--MARK--><a href='../../../../publication/7259cb89-c196-4294-a6ac-aa37b974efa6' class='mouseoverHref'><em>Acta Universitatis Lundensis</em></a> <strong>50</strong>: 1-49<!--MARK-->","","Article in Journal","9637011c-d110-4817-b4c5-173d6e8de703","20081009T05:11:37.000+0000","7259cb89-c196-4294-a6ac-aa37b974efa6"
"Princis, K.","1957","Revision der Walker'schen und Kirby'schen Blattarientypen im British Museum of Natural History, London","87-96, 97-116","","Opuscula Entomologica. Lund","","","","<!--MARK--><a href='../../../../publication/8bed5b42-6a8a-4548-9582-1320b8d02315' class='mouseoverHref'>Princis, K. 1957. Revision der Walker'schen und Kirby'schen Blattarientypen im British Museum of Natural History, London.</a> <!--MARK--><!--MARK--><a href='../../../../publication/ce78610a-5b37-4cbb-920f-1f7d3e2284ec' class='mouseoverHref'><em>Opuscula Entomologica. Lund</em></a> <strong>22</strong>: 87-96, 97-116<!--MARK-->","","Article in Journal","8bed5b42-6a8a-4548-9582-1320b8d02315","20081009T05:11:37.000+0000","ce78610a-5b37-4cbb-920f-1f7d3e2284ec"
"Princis, K.","1965","Kleine beiträge zur kenntnis der Blattarien und ihrer verbreitung. VIII (Orthoptera)","135-156","","Environmental Entomology","","","","<!--MARK--><a href='../../../../publication/4aec7201-b685-42ce-a6dd-53269d41ec53' class='mouseoverHref'>Princis, K. 1965. Kleine beiträge zur kenntnis der Blattarien und ihrer verbreitung. VIII (Orthoptera).</a> <!--MARK--><!--MARK--><a href='../../../../publication/fd84dda1-7304-4b19-bd23-bb855429029c' class='mouseoverHref'><em>Environmental Entomology</em></a> <strong>41</strong>: 135-156<!--MARK-->","","Article in Journal","4aec7201-b685-42ce-a6dd-53269d41ec53","20081009T05:11:37.000+0000","fd84dda1-7304-4b19-bd23-bb855429029c"
"Princis, K.","1966","Kleine beiträge zur kenntnis der Blattarien und ihrer verbreitung. IX","43-60","","Opuscula Entomologica. Lund","","","","<!--MARK--><a href='../../../../publication/0e7caebf-312d-4c24-8a75-914617c65326' class='mouseoverHref'>Princis, K. 1966. Kleine beiträge zur kenntnis der Blattarien und ihrer verbreitung. IX.</a> <!--MARK--><!--MARK--><a href='../../../../publication/ce78610a-5b37-4cbb-920f-1f7d3e2284ec' class='mouseoverHref'><em>Opuscula Entomologica. Lund</em></a> <strong>31</strong>: 43-60<!--MARK-->","","Article in Journal","0e7caebf-312d-4c24-8a75-914617c65326","20081009T05:11:37.000+0000","ce78610a-5b37-4cbb-920f-1f7d3e2284ec"
"Princis, K.","1966","Pars 8: Blattariae: Blattoidea: Blattidae, Nocticolidae","402-614","Orthopterorum Catalogus","","","","","<!--MARK--><a href='../../../../publication/3a03f704-4f9c-47a7-b22d-c29bc03a80b1' class='mouseoverHref'>Princis, K. 1966. Pars 8: Blattariae: Blattoidea: Blattidae, Nocticolidae. pp. 402-614</a> <!--MARK--><em>in</em> <!--MARK--><a href='../../../../publication/ba25c686-c975-4a4a-aa6b-6121c5578911' class='mouseoverHref'>Beier, M. (ed.). <em>Orthopterorum Catalogus</em>. 's-Gravenhage : Dr. W. Junk.</a><!--MARK-->","","Chapter in Book","3a03f704-4f9c-47a7-b22d-c29bc03a80b1","20081009T05:11:37.000+0000","ba25c686-c975-4a4a-aa6b-6121c5578911"
"Princis, K.","1971","Pars 14: Blattariae: Subordo Epilamproidea, Fam. Ectobiidae","1041-1224","Orthopterorum Catalogus","","","","","<!--MARK--><a href='../../../../publication/ec7f5c23-1d5c-4bdf-8399-8ff078103e27' class='mouseoverHref'>Princis, K. 1971. Pars 14: Blattariae: Subordo Epilamproidea, Fam. Ectobiidae. pp. 1041-1224</a> <!--MARK--><em>in</em> <!--MARK--><a href='../../../../publication/9a0aefbc-c33a-4271-a271-684f965621a0' class='mouseoverHref'>Beier, M. (ed.). <em>Orthopterorum Catalogus</em>. 's-Gravenhage : Dr. W. Junk.</a><!--MARK-->","","Chapter in Book","ec7f5c23-1d5c-4bdf-8399-8ff078103e27","20081009T05:11:37.000+0000","9a0aefbc-c33a-4271-a271-684f965621a0"
"Ratcliffe, F.N., Gay, F.J. & Greaves, T.","1952","Australian Termites. The biology, recognition, and economic importance of the common species","124 pp.","","","","","Commonwealth Scientific and Industrial Research Organization","<!--MARK--><a href='../../../../publication/ed08615e-34b1-4cdf-8fa1-5890b73e7a0d' class='mouseoverHref'>Ratcliffe, F.N., Gay, F.J. & Greaves, T. 1952. <em>Australian Termites. The biology, recognition, and economic importance of the common species</em>. Melbourne : Commonwealth Scientific and Industrial Research Organization 124 pp.</a><!--MARK-->","","Book","ed08615e-34b1-4cdf-8fa1-5890b73e7a0d","20081009T05:11:37.000+0000",""
"Rentz, D.C.F.","1988","The Orthopteroid insects of Norfolk Island, with descriptions and records of some related species from Lord Howe, Island, South Pacific","1013-1077","","Invertebrate Taxonomy","","","","<!--MARK--><a href='../../../../publication/deddf0cc-5fc7-4a6d-a4aa-fe18fe87353b' class='mouseoverHref'>Rentz, D.C.F. 1988. The Orthopteroid insects of Norfolk Island, with descriptions and records of some related species from Lord Howe, Island, South Pacific.</a> <!--MARK--><!--MARK--><a href='../../../../publication/9846f41b-d755-4682-9049-5e59d363951b' class='mouseoverHref'><em>Invertebrate Taxonomy</em></a> <strong>2</strong>: 1013-1077<!--MARK-->","","Article in Journal","deddf0cc-5fc7-4a6d-a4aa-fe18fe87353b","20081009T05:11:37.000+0000","9846f41b-d755-4682-9049-5e59d363951b"
"Rentz, D.C.F. & Cameron, H.M.","1983","Catalogue of Australian Cockroaches","1-37","","CSIRO Australia. Division of Entomology Technical Paper","","","","<!--MARK--><a href='../../../../publication/950d0bfa-e996-416d-90f9-cee6614cac6c' class='mouseoverHref'>Rentz, D.C.F. & Cameron, H.M. 1983. Catalogue of Australian Cockroaches.</a> <!--MARK--><!--MARK--><a href='../../../../publication/6db4085a-4da5-4bdc-b78a-f2789eb50b53' class='mouseoverHref'><em>CSIRO Australia. Division of Entomology Technical Paper</em></a> <strong>21</strong>: 1-37<!--MARK-->","","Article in Journal","950d0bfa-e996-416d-90f9-cee6614cac6c","20081009T05:11:37.000+0000","6db4085a-4da5-4bdc-b78a-f2789eb50b53"
"Richards, A.M.","1967","Cockroaches (Blattodea) from Australian Caves","35-44","","Helictite, Journal of Australasian Cave Research","","","","<!--MARK--><a href='../../../../publication/40c17a14-7ad6-4b1a-90bc-1808c3010343' class='mouseoverHref'>Richards, A.M. 1967. Cockroaches (Blattodea) from Australian Caves.</a> <!--MARK--><!--MARK--><a href='../../../../publication/4ee9652e-e552-4b33-a031-036eb2641a9f' class='mouseoverHref'><em>Helictite, Journal of Australasian Cave Research</em></a> <strong>5</strong>(2): 35-44<!--MARK-->","","Article in Journal","40c17a14-7ad6-4b1a-90bc-1808c3010343","20081009T05:11:37.000+0000","4ee9652e-e552-4b33-a031-036eb2641a9f"
"Richards, A.M.","1971","An ecological study of the cavernicolous fauna of the Nullarbor Plain Southern Australia","1-60","","Journal of Zoology, London","","","","<!--MARK--><a href='../../../../publication/bb57fed9-b325-4a60-a4bf-8cad8e7a8c6f' class='mouseoverHref'>Richards, A.M. 1971. An ecological study of the cavernicolous fauna of the Nullarbor Plain Southern Australia.</a> <!--MARK--><!--MARK--><a href='../../../../publication/e9fd3ce8-3d30-4401-bcd5-058de8d17ad6' class='mouseoverHref'><em>Journal of Zoology, London</em></a> <strong>164</strong>: 1-60<!--MARK-->","","Article in Journal","bb57fed9-b325-4a60-a4bf-8cad8e7a8c6f","20081009T05:11:37.000+0000","e9fd3ce8-3d30-4401-bcd5-058de8d17ad6"
"Riek, E.F.","1970","Fossil history","168-186","The Insects of Australia. A textbook for students and research workers","","","","","<!--MARK--><a href='../../../../publication/c3d3aae5-6b3e-4f03-8a09-6ecf56d91c05' class='mouseoverHref'>Riek, E.F. 1970. Fossil history. pp. 168-186</a> <!--MARK--><em>in</em> <!--MARK--><a href='../../../../publication/9bbd5296-249d-4227-b980-aeb018c7fff1' class='mouseoverHref'>CSIRO (ed.). <em>The Insects of Australia. A textbook for students and research workers</em>. Carlton : Melbourne University Press 1029 pp.</a><!--MARK-->","","Chapter in Book","c3d3aae5-6b3e-4f03-8a09-6ecf56d91c05","20081009T05:11:37.000+0000","9bbd5296-249d-4227-b980-aeb018c7fff1"
"Roach, A.M.E. & Rentz, D.C.F.","1998","Blattodea","21-162","Zoological Catalogue of Australia. Archaeognatha, Zygentoma, Blattodea, Isoptera, Mantodea, Dermaptera, Phasmatodea, Embioptera, Zoraptera","","","","","<!--MARK--><a href='../../../../publication/33538c49-1d03-4d70-90c9-184060e53bf0' class='mouseoverHref'>Roach, A.M.E. & Rentz, D.C.F. 1998. Blattodea. pp. 21-162</a> <!--MARK--><em>in</em> <!--MARK--><a href='../../../../publication/7607080e-8493-4330-9c79-f610a5769e79' class='mouseoverHref'>Houston, W.W.K. & Wells, A. (eds). <em>Zoological Catalogue of Australia. Archaeognatha, Zygentoma, Blattodea, Isoptera, Mantodea, Dermaptera, Phasmatodea, Embioptera, Zoraptera</em>. Melbourne : CSIRO Publishing, Australia Vol. 23 xiii 464 pp.</a><!--MARK-->","","Chapter in Book","33538c49-1d03-4d70-90c9-184060e53bf0","20081009T05:11:37.000+0000","7607080e-8493-4330-9c79-f610a5769e79"
"Roach, A.M.E. in Roach, A.M.E. & Rentz, D.C.F.","1998","Blattodea","21-162, 400 (App. III), 407-426","Zoological Catalogue of Australia. Archaeognatha, Zygentoma, Blattodea, Isoptera, Mantodea, Dermaptera, Phasmatodea, Embioptera, Zoraptera","","","","","<!--MARK--><a href='../../../../publication/1a997aa0-0488-4669-8a0c-2765a9028eab' class='mouseoverHref'>Roach, A.M.E. <i>in</i> Roach, A.M.E. & Rentz, D.C.F. 1998. Blattodea. 21-162, 400 (App. III), 407-426</a> <!--MARK--><em>in</em> <!--MARK--><a href='../../../../publication/7607080e-8493-4330-9c79-f610a5769e79' class='mouseoverHref'>Houston, W.W.K. & Wells, A. (eds). <em>Zoological Catalogue of Australia. Archaeognatha, Zygentoma, Blattodea, Isoptera, Mantodea, Dermaptera, Phasmatodea, Embioptera, Zoraptera</em>. Melbourne : CSIRO Publishing, Australia Vol. 23 xiii 464 pp.</a><!--MARK-->","","Chapter in Book","1a997aa0-0488-4669-8a0c-2765a9028eab","20081009T05:11:37.000+0000","7607080e-8493-4330-9c79-f610a5769e79"
"Roisin, Y.","1988","Morphology, development and evolutionary significance of the working stages in the caste system of <i>Prorhinotermes</i> (Insecta, Isoptera)","339-347","","Zoomorphology (Berlin)","","","","<!--MARK--><a href='../../../../publication/09c6c02a-a266-4d32-85f6-6e08b88fedca' class='mouseoverHref'>Roisin, Y. 1988. Morphology, development and evolutionary significance of the working stages in the caste system of <i>Prorhinotermes</i> (Insecta, Isoptera).</a> <!--MARK--><!--MARK--><a href='../../../../publication/8f9ca9f9-91ac-487b-9c81-7d779e6253fa' class='mouseoverHref'><em>Zoomorphology (Berlin)</em></a> <strong>107</strong>: 339-347<!--MARK-->","","Article in Journal","09c6c02a-a266-4d32-85f6-6e08b88fedca","20081009T05:11:37.000+0000","8f9ca9f9-91ac-487b-9c81-7d779e6253fa"
"Roisin, Y.","1990","The termite genus <i>Amitermes</i> Silvestri in Papua New Guinea","185-194","","Indo-Malayan Zoology","","","","<!--MARK--><a href='../../../../publication/0329a26b-ed57-4ae2-bd66-61bd75f16cd2' class='mouseoverHref'>Roisin, Y. 1990. The termite genus <i>Amitermes</i> Silvestri in Papua New Guinea.</a> <!--MARK--><!--MARK--><a href='../../../../publication/ffcc365a-d626-4c90-bd2a-325ba113eacb' class='mouseoverHref'><em>Indo-Malayan Zoology</em></a> <strong>6</strong>: 185-194<!--MARK-->","","Article in Journal","0329a26b-ed57-4ae2-bd66-61bd75f16cd2","20081009T05:11:37.000+0000","ffcc365a-d626-4c90-bd2a-325ba113eacb"
"Roisin, Y. & Pasteels, J.M.","1985","Imaginal polymorphism and polygyny in the Neo-Guinean termite <i>Nasutitermes princeps</i> (Desneux)","140-157","","Insectes Sociaux","","","","<!--MARK--><a href='../../../../publication/73e3e60d-ca95-4d19-80ff-371263d539ca' class='mouseoverHref'>Roisin, Y. & Pasteels, J.M. 1985. Imaginal polymorphism and polygyny in the Neo-Guinean termite <i>Nasutitermes princeps</i> (Desneux).</a> <!--MARK--><!--MARK--><a href='../../../../publication/efe5b121-c808-4063-a667-9a1a7bec4bea' class='mouseoverHref'><em>Insectes Sociaux</em></a> <strong>32</strong>: 140-157<!--MARK-->","","Article in Journal","73e3e60d-ca95-4d19-80ff-371263d539ca","20081009T05:11:37.000+0000","efe5b121-c808-4063-a667-9a1a7bec4bea"
"Roisin, Y. & Pasteels, J.M.","1986","Replacement of reproductives in <i>Nasutitermes princeps</i> (Desneux) (Isoptera: Termitidae)","437-442","","Behavioral Ecology and Sociobiology","","","","<!--MARK--><a href='../../../../publication/7e791657-af5a-4210-803f-ad04c8fd90fe' class='mouseoverHref'>Roisin, Y. & Pasteels, J.M. 1986. Replacement of reproductives in <i>Nasutitermes princeps</i> (Desneux) (Isoptera: Termitidae).</a> <!--MARK--><!--MARK--><a href='../../../../publication/25f6454e-6534-43e3-93bb-45caf4eceb28' class='mouseoverHref'><em>Behavioral Ecology and Sociobiology</em></a> <strong>18</strong>: 437-442<!--MARK-->","","Article in Journal","7e791657-af5a-4210-803f-ad04c8fd90fe","20081009T05:11:37.000+0000","25f6454e-6534-43e3-93bb-45caf4eceb28"
"Roisin, Y. & Pasteels, J.M.","1996","The nasute termites (Isoptera: Nasutitermitinae) of Papua New Guinea","507-616","","Invertebrate Taxonomy","","","","<!--MARK--><a href='../../../../publication/e7cdb6a5-47ed-4ed3-9546-380c2ebe3653' class='mouseoverHref'>Roisin, Y. & Pasteels, J.M. 1996. The nasute termites (Isoptera: Nasutitermitinae) of Papua New Guinea.</a> <!--MARK--><!--MARK--><a href='../../../../publication/9846f41b-d755-4682-9049-5e59d363951b' class='mouseoverHref'><em>Invertebrate Taxonomy</em></a> <strong>10</strong>(3): 507-616<!--MARK-->","","Article in Journal","e7cdb6a5-47ed-4ed3-9546-380c2ebe3653","20140324T07:31:46.046+0000","9846f41b-d755-4682-9049-5e59d363951b"
"Roisin, Y. & Pasteels, J.M.","2000","The genus <i>Microcerotermes</i> in New Guinea and the Solomon Islands","137-174","","Invertebrate Taxonomy","","","","<!--MARK--><a href='../../../../publication/9a10df26-f18a-463c-8132-9d1d0d86f7f7' class='mouseoverHref'>Roisin, Y. & Pasteels, J.M. 2000. The genus <i>Microcerotermes</i> in New Guinea and the Solomon Islands.</a> <!--MARK--><!--MARK--><a href='../../../../publication/9846f41b-d755-4682-9049-5e59d363951b' class='mouseoverHref'><em>Invertebrate Taxonomy</em></a> <strong>14</strong>(2): 137-174<!--MARK-->","","Article in Journal","9a10df26-f18a-463c-8132-9d1d0d86f7f7","20140325T01:22:45.212+0000","9846f41b-d755-4682-9049-5e59d363951b"
"Rosen, K. v.","1912","Neue Termiten aus der zoologischen Staatssammlung in München sowie einigen anderen Sammlungen","221-232 figs 1-9","","Zoologischer Anzeiger","","","","<!--MARK--><a href='../../../../publication/06e50dc5-77f2-4279-8568-efc1b33d910f' class='mouseoverHref'>Rosen, K. v. 1912. Neue Termiten aus der zoologischen Staatssammlung in München sowie einigen anderen Sammlungen.</a> <!--MARK--><!--MARK--><a href='../../../../publication/4b894062-2782-48ef-bf96-6997840d9060' class='mouseoverHref'><em>Zoologischer Anzeiger</em></a> <strong>39</strong>: 221-232 figs 1-9<!--MARK-->","","Article in Journal","06e50dc5-77f2-4279-8568-efc1b33d910f","20081009T05:11:37.000+0000","4b894062-2782-48ef-bf96-6997840d9060"
"Roth, L.M.","1987","The genus <i>Tryonicus</i> Shaw from Australia and New Caledonia (Dictyoptera: Blattaria: Blattellidae: Tryonicinae)","151-167","","Memoirs of the Queensland Museum","","","","<!--MARK--><a href='../../../../publication/cf11ea39-95c4-49dc-96c8-302e7cb7e27a' class='mouseoverHref'>Roth, L.M. 1987. The genus <i>Tryonicus</i> Shaw from Australia and New Caledonia (Dictyoptera: Blattaria: Blattellidae: Tryonicinae).</a> <!--MARK--><!--MARK--><a href='../../../../publication/1a0a2982-9f30-43e1-a641-b0379699837c' class='mouseoverHref'><em>Memoirs of the Queensland Museum</em></a> <strong>25</strong>: 151-167<!--MARK-->","","Article in Journal","cf11ea39-95c4-49dc-96c8-302e7cb7e27a","20081009T05:11:37.000+0000","1a0a2982-9f30-43e1-a641-b0379699837c"
"Roth, L.M.","1990","A revision of the Australian Parcoblattini (Blattaria: Blattellidae: Blattellinae)","531-596","","Memoirs of the Queensland Museum","","","","<!--MARK--><a href='../../../../publication/811c1c50-92e0-40e1-b570-ca32874d5d19' class='mouseoverHref'>Roth, L.M. 1990. A revision of the Australian Parcoblattini (Blattaria: Blattellidae: Blattellinae).</a> <!--MARK--><!--MARK--><a href='../../../../publication/1a0a2982-9f30-43e1-a641-b0379699837c' class='mouseoverHref'><em>Memoirs of the Queensland Museum</em></a> <strong>28</strong>: 531-596<!--MARK-->","","Article in Journal","811c1c50-92e0-40e1-b570-ca32874d5d19","20081009T05:11:37.000+0000","1a0a2982-9f30-43e1-a641-b0379699837c"
"Roth, L.M.","1991","Blattodea","320-329","The Insects of Australia.  A textbook for students and research workers","","","","","<!--MARK--><a href='../../../../publication/b5717d60-2ade-4b0f-8946-66b75557b2f5' class='mouseoverHref'>Roth, L.M. 1991. Blattodea. pp. 320-329</a> <!--MARK--><em>in</em> <!--MARK--><a href='../../../../publication/71904f0e-b130-4e08-be15-3b1a7a27d4a1' class='mouseoverHref'>CSIRO (ed.). <em>The Insects of Australia.  A textbook for students and research workers</em>. Melbourne : Melbourne University Press Vol. 1 xiii  542 pp.</a><!--MARK-->","","Chapter in Book","b5717d60-2ade-4b0f-8946-66b75557b2f5","20081009T05:11:37.000+0000","71904f0e-b130-4e08-be15-3b1a7a27d4a1"
"Roth, L.M.","1993","The genus <i>Macrocerca</i> Hanitsch with descriptions of new species (Blattaria, Blattidae: Macrocercinae, subfam. n.)","343-360","","Entomologica Scandinavica","","","","<!--MARK--><a href='../../../../publication/78f28029-84a6-4f3d-a3e0-ca5aec6264b8' class='mouseoverHref'>Roth, L.M. 1993. The genus <i>Macrocerca</i> Hanitsch with descriptions of new species (Blattaria, Blattidae: Macrocercinae, subfam. n.).</a> <!--MARK--><!--MARK--><a href='../../../../publication/bb9374e3-b7d9-4c48-a5cd-2fb7a1185a84' class='mouseoverHref'><em>Entomologica Scandinavica</em></a> <strong>24</strong>: 343-360<!--MARK-->","","Article in Journal","78f28029-84a6-4f3d-a3e0-ca5aec6264b8","20081009T05:11:37.000+0000","bb9374e3-b7d9-4c48-a5cd-2fb7a1185a84"
"Roth, L.M.","1994","New Queensland cockroaches of <i>Macrocerca</i> Hanitsch and <i>Periplaneta</i> Burmeister (Blattidae)","225-233","","Memoirs of the Queensland Museum","","","","<!--MARK--><a href='../../../../publication/d623e735-b350-436b-aa34-94b186dd0992' class='mouseoverHref'>Roth, L.M. 1994. New Queensland cockroaches of <i>Macrocerca</i> Hanitsch and <i>Periplaneta</i> Burmeister (Blattidae).</a> <!--MARK--><!--MARK--><a href='../../../../publication/1a0a2982-9f30-43e1-a641-b0379699837c' class='mouseoverHref'><em>Memoirs of the Queensland Museum</em></a> <strong>35</strong>: 225-233<!--MARK-->","","Article in Journal","d623e735-b350-436b-aa34-94b186dd0992","20081009T05:11:37.000+0000","1a0a2982-9f30-43e1-a641-b0379699837c"
"Roth, L.M.","1995","New species and records of cockroaches from Western Australia (Blattaria)","153-161","","Records of the Western Australian Museum","","","","<!--MARK--><a href='../../../../publication/a71992ad-1b39-45eb-bf8f-5f83f88b9002' class='mouseoverHref'>Roth, L.M. 1995. New species and records of cockroaches from Western Australia (Blattaria).</a> <!--MARK--><!--MARK--><a href='../../../../publication/a2cbd1fb-97d5-493a-a1d7-c2b99709890b' class='mouseoverHref'><em>Records of the Western Australian Museum</em></a> <strong>17</strong>: 153-161<!--MARK-->","","Article in Journal","a71992ad-1b39-45eb-bf8f-5f83f88b9002","20081009T05:11:37.000+0000","a2cbd1fb-97d5-493a-a1d7-c2b99709890b"
"Roth, L.M.","1999","New cockroach species, redescriptions, and records, mostly from Australia, and a description of <I>Metanocticola</I> gen. nov., sp. nov., from Christmas Island (Blattaria)","327-364","","Records of the Western Australian Museum","","","","<!--MARK--><a href='../../../../publication/c21d8ea2-5b0b-4912-b4ca-9a1005ee54d5' class='mouseoverHref'>Roth, L.M. 1999. New cockroach species, redescriptions, and records, mostly from Australia, and a description of <I>Metanocticola</I> gen. nov., sp. nov., from Christmas Island (Blattaria).</a> <!--MARK--><!--MARK--><a href='../../../../publication/a2cbd1fb-97d5-493a-a1d7-c2b99709890b' class='mouseoverHref'><em>Records of the Western Australian Museum</em></a> <strong>19</strong>: 327-364<!--MARK-->","","Article in Journal","c21d8ea2-5b0b-4912-b4ca-9a1005ee54d5","20110228T03:17:20.202+0000","a2cbd1fb-97d5-493a-a1d7-c2b99709890b"
"Roth, L.M.","2003","Systematics and phylogeny of cockroaches (Dictyoptera: Blattaria)","1-186","","Oriental Insects","","","","<!--MARK--><a href='../../../../publication/8d58178f-4cb1-4176-b977-af8405e7fde3' class='mouseoverHref'>Roth, L.M. 2003. Systematics and phylogeny of cockroaches (Dictyoptera: Blattaria).</a> <!--MARK--><!--MARK--><a href='../../../../publication/ef3aab0f-7ae6-4f96-9daa-2bbc105b9abc' class='mouseoverHref'><em>Oriental Insects</em></a> <strong>37</strong>: 1-186<!--MARK-->","","Article in Journal","8d58178f-4cb1-4176-b977-af8405e7fde3","20120605T03:32:36.658+0000","ef3aab0f-7ae6-4f96-9daa-2bbc105b9abc"
"Saussure, H. de","1863","Mélanges orthoptérologiques. Ier Fascicule, Blattides","129-170","","Mémoires de la Société de Physique et d'Histoire Naturelle de Genève","","","","<!--MARK--><a href='../../../../publication/5c01e4f3-74fa-4d7f-8b95-102e468e5c0b' class='mouseoverHref'>Saussure, H. de 1863. Mélanges orthoptérologiques. Ier Fascicule, Blattides.</a> <!--MARK--><!--MARK--><a href='../../../../publication/d6c7ec49-57da-4fd1-90e5-1bf9a801e844' class='mouseoverHref'><em>Mémoires de la Société de Physique et d'Histoire Naturelle de Genève</em></a> <strong>17</strong>: 129-170<!--MARK-->","","Article in Journal","5c01e4f3-74fa-4d7f-8b95-102e468e5c0b","20081009T05:11:37.000+0000","d6c7ec49-57da-4fd1-90e5-1bf9a801e844"
"Saussure, H. de","1864","Blattarum novarum species aliquot","305-326","","Revue et Magasin de Zoologie (Paris)","","","","<!--MARK--><a href='../../../../publication/a3d89391-131c-4bf5-a5ef-7aa05c9d3da2' class='mouseoverHref'>Saussure, H. de 1864. Blattarum novarum species aliquot.</a> <!--MARK--><!--MARK--><a href='../../../../publication/db688e1b-7165-434e-a1c0-eec6a75c5f67' class='mouseoverHref'><em>Revue et Magasin de Zoologie (Paris)</em></a> 2 <strong>16</strong>: 305-326<!--MARK-->","","Article in Journal","a3d89391-131c-4bf5-a5ef-7aa05c9d3da2","20081009T05:11:37.000+0000","db688e1b-7165-434e-a1c0-eec6a75c5f67"
"Saussure, H. de","1864","Orthoptères de l'Amerique Moyenne","279","","","","","publisher unknown","<!--MARK--><a href='../../../../publication/f457d663-142a-4f57-a14f-156b152d52bb' class='mouseoverHref'>Saussure, H. de 1864. <em>Orthoptères de l'Amerique Moyenne</em>. Geneva : publisher unknown 279 pp.</a><!--MARK-->","","Book","f457d663-142a-4f57-a14f-156b152d52bb","20081009T05:11:37.000+0000",""
