"PUB_AUTHOR","PUB_YEAR","PUB_TITLE","PUB_PAGES","PUB_PARENT_BOOK_TITLE","PUB_PARENT_JOURNAL_TITLE","PUB_PARENT_ARTICLE_TITLE","PUB_PUBLICATION_DATE","PUB_PUBLISHER","PUB_FORMATTED","PUB_QUALIFICATION","PUB_TYPE","PUBLICATION_GUID","PUBLICATION_LAST_UPDATE","PARENT_PUBLICATION_GUID"
"La Fage, J.P. & Nutting, W.L.","1978","Nutrient dynamics of termites","165-232","Production Ecology of Ants and Termites","","","","","<!--MARK--><a href='../../../../publication/1e9d1bdd-a2d1-4c51-b0b0-c098fa61cfd6' class='mouseoverHref'>La Fage, J.P. & Nutting, W.L. 1978. Nutrient dynamics of termites. pp. 165-232</a> <!--MARK--><em>in</em> <!--MARK--><a href='../../../../publication/fa16f168-30f4-40b0-a5ca-419a09e92ff0' class='mouseoverHref'>Brian, M.V. (ed.). <em>Production Ecology of Ants and Termites</em>. Cambridge : Cambridge University Press.</a><!--MARK-->","","Chapter in Book","1e9d1bdd-a2d1-4c51-b0b0-c098fa61cfd6","20081009T05:11:37.000+0000","fa16f168-30f4-40b0-a5ca-419a09e92ff0"
"Lee, K.E. & Wood, T.G.","1971","Termites and Soils","x 251 pp.","","","","","Academic Press","<!--MARK--><a href='../../../../publication/298e4f07-b8e8-44d7-9b3b-31a07e6b8a58' class='mouseoverHref'>Lee, K.E. & Wood, T.G. 1971. <em>Termites and Soils</em>. London : Academic Press x 251 pp.</a><!--MARK-->","","Book","298e4f07-b8e8-44d7-9b3b-31a07e6b8a58","20081009T05:11:37.000+0000",""
"Lee, T.R.C., Evans, T.A., Cameron, S.L., Ho, S.Y.W., Namyatova, A.A. & Lo, N.","2017","A review of the status of <i>Coptotermes</i> (Isoptera : Rhinotermitidae) species in Australia with the description of two new small termite species from northern and eastern Australia","180-190","","Invertebrate Systematics","","","","<!--MARK--><a href='../../../../publication/e9695932-2c08-4d82-841a-5805096d046c' class='mouseoverHref'>Lee, T.R.C., Evans, T.A., Cameron, S.L., Ho, S.Y.W., Namyatova, A.A. & Lo, N. 2017. A review of the status of <i>Coptotermes</i> (Isoptera : Rhinotermitidae) species in Australia with the description of two new small termite species from northern and eastern Australia.</a> <!--MARK--><!--MARK--><a href='../../../../publication/7ef62e6c-73cc-4912-8ea7-5752f95e8e8a' class='mouseoverHref'><em>Invertebrate Systematics</em></a> <strong>31</strong>: 180-190<!--MARK-->","","Article in Journal","e9695932-2c08-4d82-841a-5805096d046c","20170607T00:11:56.376+0000","7ef62e6c-73cc-4912-8ea7-5752f95e8e8a"
"Lenz, M.","1985","Is inter- and intraspecific variability of lower termite neotenic numbers due to adaptive thresholds for neotenic elimination? - considerations from studies on <i>Porotermes adamsoni</i> (Froggatt) (Isoptera: Termopsidae)","125-145","Caste Differentiation in Social Insects","","","","","<!--MARK--><a href='../../../../publication/bee1b022-425f-4da2-a3c0-9c5d86668d17' class='mouseoverHref'>Lenz, M. 1985. Is inter- and intraspecific variability of lower termite neotenic numbers due to adaptive thresholds for neotenic elimination? - considerations from studies on <i>Porotermes adamsoni</i> (Froggatt) (Isoptera: Termopsidae). pp. 125-145</a> <!--MARK--><em>in</em> <!--MARK--><a href='../../../../publication/aa3a7e16-7e02-4d2f-8ae1-b6b67b739c08' class='mouseoverHref'>Watson, J.A.L., Okot-Kotber, B.M. & Noirot, C. (eds). <em>Caste Differentiation in Social Insects</em>. Oxford : Pergamon Press.</a><!--MARK-->","","Chapter in Book","bee1b022-425f-4da2-a3c0-9c5d86668d17","20081009T05:11:37.000+0000","aa3a7e16-7e02-4d2f-8ae1-b6b67b739c08"
"Light, S.F.","1921","Notes on Philippine termites, II","23-63 pls 1-6","","Philippine Journal of Science","","","","<!--MARK--><a href='../../../../publication/5d1d2ee9-befd-4704-a97a-f89e797c3cbf' class='mouseoverHref'>Light, S.F. 1921. Notes on Philippine termites, II.</a> <!--MARK--><!--MARK--><a href='../../../../publication/0347b709-e2f0-4679-8749-33668856b97f' class='mouseoverHref'><em>Philippine Journal of Science</em></a> <strong>19</strong>: 23-63 pls 1-6<!--MARK-->","","Article in Journal","5d1d2ee9-befd-4704-a97a-f89e797c3cbf","20131004T00:00:21.065+0000","0347b709-e2f0-4679-8749-33668856b97f"
"Linnaeus, C.","1758","Systema naturae per regna tria naturae, secundem classes, ordines, genera, species, cum characteribus, differentis, synonymis, locis. Editio decima, reformata","824","","","","","Laurentii Salvii","<!--MARK--><a href='../../../../publication/95f7aebe-acdc-4241-a7a8-403bf099042e' class='mouseoverHref'>Linnaeus, C. 1758. <em>Systema naturae per regna tria naturae, secundem classes, ordines, genera, species, cum characteribus, differentis, synonymis, locis. Editio decima, reformata</em>. Holmiae : Laurentii Salvii Tomus I 824 pp.</a><!--MARK-->","","Book","95f7aebe-acdc-4241-a7a8-403bf099042e","20171116T23:58:37.127+0000",""
"Mackerras, M.J.","1965","Australian Blattidae (Blattodea). I. General remarks and revision of the genus <i>Polyzosteria</i> Burmeister","841-882","","Australian Journal of Zoology","","","","<!--MARK--><a href='../../../../publication/e046a85d-3d46-4f4e-a048-918c9adac5f6' class='mouseoverHref'>Mackerras, M.J. 1965. Australian Blattidae (Blattodea). I. General remarks and revision of the genus <i>Polyzosteria</i> Burmeister.</a> <!--MARK--><!--MARK--><a href='../../../../publication/53c3abd8-0254-4532-a73e-d9ef6b7ac2ef' class='mouseoverHref'><em>Australian Journal of Zoology</em></a> <strong>13</strong>: 841-882<!--MARK-->","","Article in Journal","e046a85d-3d46-4f4e-a048-918c9adac5f6","20081009T05:11:37.000+0000","53c3abd8-0254-4532-a73e-d9ef6b7ac2ef"
"Mackerras, M.J.","1965","Australian Blattidae (Blattodea). II. Revision of the genus <i>Euzosteria</i> Shelford","883-902","","Australian Journal of Zoology","","","","<!--MARK--><a href='../../../../publication/116cf34b-2bd2-434e-b00f-3ee270ddf808' class='mouseoverHref'>Mackerras, M.J. 1965. Australian Blattidae (Blattodea). II. Revision of the genus <i>Euzosteria</i> Shelford.</a> <!--MARK--><!--MARK--><a href='../../../../publication/53c3abd8-0254-4532-a73e-d9ef6b7ac2ef' class='mouseoverHref'><em>Australian Journal of Zoology</em></a> <strong>13</strong>: 883-902<!--MARK-->","","Article in Journal","116cf34b-2bd2-434e-b00f-3ee270ddf808","20081009T05:11:37.000+0000","53c3abd8-0254-4532-a73e-d9ef6b7ac2ef"
"Mackerras, M.J.","1965","Australian Blattidae (Blattodea). III. Revision of the genera <i>Zonioploca</i> Stål and <i>Eppertia</i> Shaw","903-927","","Australian Journal of Zoology","","","","<!--MARK--><a href='../../../../publication/520a6727-1c45-44dc-b3b7-7f03d528538e' class='mouseoverHref'>Mackerras, M.J. 1965. Australian Blattidae (Blattodea). III. Revision of the genera <i>Zonioploca</i> Stål and <i>Eppertia</i> Shaw.</a> <!--MARK--><!--MARK--><a href='../../../../publication/53c3abd8-0254-4532-a73e-d9ef6b7ac2ef' class='mouseoverHref'><em>Australian Journal of Zoology</em></a> <strong>13</strong>: 903-927<!--MARK-->","","Article in Journal","520a6727-1c45-44dc-b3b7-7f03d528538e","20081009T05:11:37.000+0000","53c3abd8-0254-4532-a73e-d9ef6b7ac2ef"
"Mackerras, M.J.","1966","Australian Blattidae (Blattodea). IV. <i>Megazosteria</i>, gen. nov., and revision of the genus <i>Desmozosteria</i> Shelford","305-334","","Australian Journal of Zoology","","","","<!--MARK--><a href='../../../../publication/1d775178-6b4a-42b9-84cd-21b6da99895d' class='mouseoverHref'>Mackerras, M.J. 1966. Australian Blattidae (Blattodea). IV. <i>Megazosteria</i>, gen. nov., and revision of the genus <i>Desmozosteria</i> Shelford.</a> <!--MARK--><!--MARK--><a href='../../../../publication/53c3abd8-0254-4532-a73e-d9ef6b7ac2ef' class='mouseoverHref'><em>Australian Journal of Zoology</em></a> <strong>14</strong>: 305-334<!--MARK-->","","Article in Journal","1d775178-6b4a-42b9-84cd-21b6da99895d","20081009T05:11:37.000+0000","53c3abd8-0254-4532-a73e-d9ef6b7ac2ef"
"Mackerras, M.J.","1966","Australian Blattidae (Blattodea). V. Revision of the genera <i>Anamesia</i> Tepper and <i>Pseudolampra</i> Tepper","335-363","","Australian Journal of Zoology","","","","<!--MARK--><a href='../../../../publication/0aed38d0-17c8-458f-91fb-4106e2ecec77' class='mouseoverHref'>Mackerras, M.J. 1966. Australian Blattidae (Blattodea). V. Revision of the genera <i>Anamesia</i> Tepper and <i>Pseudolampra</i> Tepper.</a> <!--MARK--><!--MARK--><a href='../../../../publication/53c3abd8-0254-4532-a73e-d9ef6b7ac2ef' class='mouseoverHref'><em>Australian Journal of Zoology</em></a> <strong>14</strong>: 335-363<!--MARK-->","","Article in Journal","0aed38d0-17c8-458f-91fb-4106e2ecec77","20081009T05:11:37.000+0000","53c3abd8-0254-4532-a73e-d9ef6b7ac2ef"
"Mackerras, M.J.","1967","Australian Blattidae (Blattodea). VI. Revision of the genus <i>Cosmozosteria</i> Stål","593-618","","Australian Journal of Zoology","","","","<!--MARK--><a href='../../../../publication/1b790c85-8cc9-4ec9-9e84-8e577398e627' class='mouseoverHref'>Mackerras, M.J. 1967. Australian Blattidae (Blattodea). VI. Revision of the genus <i>Cosmozosteria</i> Stål.</a> <!--MARK--><!--MARK--><a href='../../../../publication/53c3abd8-0254-4532-a73e-d9ef6b7ac2ef' class='mouseoverHref'><em>Australian Journal of Zoology</em></a> <strong>15</strong>: 593-618<!--MARK-->","","Article in Journal","1b790c85-8cc9-4ec9-9e84-8e577398e627","20081009T05:11:37.000+0000","53c3abd8-0254-4532-a73e-d9ef6b7ac2ef"
"Mackerras, M.J.","1967","Australian Blattidae (Blattodea). VII. The <i>Platyzosteria</i> group: general remarks and revision of the subgenera <i>Platyzosteria</i> Brunner and <i>Leptozosteria</i> Tepper","1207-1298","","Australian Journal of Zoology","","","","<!--MARK--><a href='../../../../publication/f70e86be-ee32-407a-abce-a833d7fe299a' class='mouseoverHref'>Mackerras, M.J. 1967. Australian Blattidae (Blattodea). VII. The <i>Platyzosteria</i> group: general remarks and revision of the subgenera <i>Platyzosteria</i> Brunner and <i>Leptozosteria</i> Tepper.</a> <!--MARK--><!--MARK--><a href='../../../../publication/53c3abd8-0254-4532-a73e-d9ef6b7ac2ef' class='mouseoverHref'><em>Australian Journal of Zoology</em></a> <strong>15</strong>: 1207-1298<!--MARK-->","","Article in Journal","f70e86be-ee32-407a-abce-a833d7fe299a","20081009T05:11:37.000+0000","53c3abd8-0254-4532-a73e-d9ef6b7ac2ef"
"Mackerras, M.J.","1968","Australian Blattidae (Blattodea). IX. Revision of Polyzosteriinae tribe Methanini, Tryonicinae, and Blattinae","511-575","","Australian Journal of Zoology","","","","<!--MARK--><a href='../../../../publication/53d9574c-c3c9-41f3-a5f0-fdfdd4a6e76d' class='mouseoverHref'>Mackerras, M.J. 1968. Australian Blattidae (Blattodea). IX. Revision of Polyzosteriinae tribe Methanini, Tryonicinae, and Blattinae.</a> <!--MARK--><!--MARK--><a href='../../../../publication/53c3abd8-0254-4532-a73e-d9ef6b7ac2ef' class='mouseoverHref'><em>Australian Journal of Zoology</em></a> <strong>16</strong>: 511-575<!--MARK-->","","Article in Journal","53d9574c-c3c9-41f3-a5f0-fdfdd4a6e76d","20081009T05:11:37.000+0000","53c3abd8-0254-4532-a73e-d9ef6b7ac2ef"
"Mackerras, M.J.","1968","Australian Blattidae (Blattodea). VIII. The <i>Platyzosteria</i> group: subgenus <i>Melanozosteria</i> Stål","237-331","","Australian Journal of Zoology","","","","<!--MARK--><a href='../../../../publication/f578014e-fdfa-4f30-bda4-29d974ab8bef' class='mouseoverHref'>Mackerras, M.J. 1968. Australian Blattidae (Blattodea). VIII. The <i>Platyzosteria</i> group: subgenus <i>Melanozosteria</i> Stål.</a> <!--MARK--><!--MARK--><a href='../../../../publication/53c3abd8-0254-4532-a73e-d9ef6b7ac2ef' class='mouseoverHref'><em>Australian Journal of Zoology</em></a> <strong>16</strong>: 237-331<!--MARK-->","","Article in Journal","f578014e-fdfa-4f30-bda4-29d974ab8bef","20081009T05:11:37.000+0000","53c3abd8-0254-4532-a73e-d9ef6b7ac2ef"
"Mackerras, M.J.","1970","Blattodea","262-274","The Insects of Australia. A textbook for students and research workers","","","","","<!--MARK--><a href='../../../../publication/4660ef63-88b6-4b09-b7d5-af09c695bb6c' class='mouseoverHref'>Mackerras, M.J. 1970. Blattodea. pp. 262-274</a> <!--MARK--><em>in</em> <!--MARK--><a href='../../../../publication/9bbd5296-249d-4227-b980-aeb018c7fff1' class='mouseoverHref'>CSIRO (ed.). <em>The Insects of Australia. A textbook for students and research workers</em>. Carlton : Melbourne University Press 1029 pp.</a><!--MARK-->","","Chapter in Book","4660ef63-88b6-4b09-b7d5-af09c695bb6c","20081009T05:11:37.000+0000","9bbd5296-249d-4227-b980-aeb018c7fff1"
"Marshall, J.A.","1983","The orthopteroid insects described by Linnaeus, with notes on the Linnaean collection","375-396","","Journal of the Linnean Society of London, Zoology","","","","<!--MARK--><a href='../../../../publication/dbb2af29-a1a9-41cc-b6cb-f5574a4492c9' class='mouseoverHref'>Marshall, J.A. 1983. The orthopteroid insects described by Linnaeus, with notes on the Linnaean collection.</a> <!--MARK--><!--MARK--><a href='../../../../publication/9da0901d-c795-4d2c-b9ad-d6a85cdf1cce' class='mouseoverHref'><em>Journal of the Linnean Society of London, Zoology</em></a> <strong>78</strong>: 375-396<!--MARK-->","","Article in Journal","dbb2af29-a1a9-41cc-b6cb-f5574a4492c9","20081009T05:11:37.000+0000","9da0901d-c795-4d2c-b9ad-d6a85cdf1cce"
"McKittrick, F.A. & Mackerras, M.J.","1965","Phyletic relationships within the Blattidae","224-330","","Annals of the Entomological Society of America","","","","<!--MARK--><a href='../../../../publication/d8f668ef-6916-40a8-84f0-1449ac638fe3' class='mouseoverHref'>McKittrick, F.A. & Mackerras, M.J. 1965. Phyletic relationships within the Blattidae.</a> <!--MARK--><!--MARK--><a href='../../../../publication/b7b6f278-10eb-4f96-9e6e-2ff500adc08f' class='mouseoverHref'><em>Annals of the Entomological Society of America</em></a> <strong>58</strong>: 224-330<!--MARK-->","","Article in Journal","d8f668ef-6916-40a8-84f0-1449ac638fe3","20081009T05:11:37.000+0000","b7b6f278-10eb-4f96-9e6e-2ff500adc08f"
"Miller, L.R.","1981","The nest of the termite <i>Schedorhinotermes breinli</i> (Hill) (Isoptera: Rhinotermitidae), and a description of the primary queen","130","","Journal of the Australian Entomological Society","","","","<!--MARK--><a href='../../../../publication/cf6b9c41-cfaa-4f29-a4f9-d29632509332' class='mouseoverHref'>Miller, L.R. 1981. The nest of the termite <i>Schedorhinotermes breinli</i> (Hill) (Isoptera: Rhinotermitidae), and a description of the primary queen.</a> <!--MARK--><!--MARK--><a href='../../../../publication/c2544f9f-3978-4f18-846d-a1fd3122c9c4' class='mouseoverHref'><em>Journal of the Australian Entomological Society</em></a> <strong>20</strong>: 130<!--MARK-->","","Article in Journal","cf6b9c41-cfaa-4f29-a4f9-d29632509332","20081009T05:11:37.000+0000","c2544f9f-3978-4f18-846d-a1fd3122c9c4"
"Miller, L.R.","1984","<i>Invasitermes</i>, a new genus of soldierless termites from northern Australia (Isoptera: Termitidae)","33-37","","Journal of the Australian Entomological Society","","","","<!--MARK--><a href='../../../../publication/a8d4ef77-0d55-4299-9691-70752436d5f3' class='mouseoverHref'>Miller, L.R. 1984. <i>Invasitermes</i>, a new genus of soldierless termites from northern Australia (Isoptera: Termitidae).</a> <!--MARK--><!--MARK--><a href='../../../../publication/c2544f9f-3978-4f18-846d-a1fd3122c9c4' class='mouseoverHref'><em>Journal of the Australian Entomological Society</em></a> <strong>23</strong>: 33-37<!--MARK-->","","Article in Journal","a8d4ef77-0d55-4299-9691-70752436d5f3","20081009T05:11:37.000+0000","c2544f9f-3978-4f18-846d-a1fd3122c9c4"
"Miller, L.R.","1984","The Australian genera of the <i>Subulitermes</i> branch of the Nasutitermitinae (Isoptera: Termitidae)","119-125","","Journal of the Australian Entomological Society","","","","<!--MARK--><a href='../../../../publication/1ab191f7-9827-465c-af07-2b43760fff57' class='mouseoverHref'>Miller, L.R. 1984. The Australian genera of the <i>Subulitermes</i> branch of the Nasutitermitinae (Isoptera: Termitidae).</a> <!--MARK--><!--MARK--><a href='../../../../publication/c2544f9f-3978-4f18-846d-a1fd3122c9c4' class='mouseoverHref'><em>Journal of the Australian Entomological Society</em></a> <strong>23</strong>: 119-125<!--MARK-->","","Article in Journal","1ab191f7-9827-465c-af07-2b43760fff57","20081009T05:11:37.000+0000","c2544f9f-3978-4f18-846d-a1fd3122c9c4"
"Miller, L.R.","1987","Trimorphic soldiers in <i>Schedorhinotermes seclusus</i> (Hill) (Isoptera: Rhinotermitidae) and notes on biology","235-236","","Journal of the Australian Entomological Society","","","","<!--MARK--><a href='../../../../publication/301298b7-f45d-4ed3-8902-db9e89538903' class='mouseoverHref'>Miller, L.R. 1987. Trimorphic soldiers in <i>Schedorhinotermes seclusus</i> (Hill) (Isoptera: Rhinotermitidae) and notes on biology.</a> <!--MARK--><!--MARK--><a href='../../../../publication/c2544f9f-3978-4f18-846d-a1fd3122c9c4' class='mouseoverHref'><em>Journal of the Australian Entomological Society</em></a> <strong>26</strong>: 235-236<!--MARK-->","","Article in Journal","301298b7-f45d-4ed3-8902-db9e89538903","20081009T05:11:37.000+0000","c2544f9f-3978-4f18-846d-a1fd3122c9c4"
"Miller, L.R.","1991","A revision of the <i>Termes-Capritermes</i> branch of the Termitinae in Australia (Isoptera: Termitidae)","1147-1282","","Invertebrate Taxonomy","","","","<!--MARK--><a href='../../../../publication/8af4a199-9fb2-4718-9646-2279eee0051c' class='mouseoverHref'>Miller, L.R. 1991. A revision of the <i>Termes-Capritermes</i> branch of the Termitinae in Australia (Isoptera: Termitidae).</a> <!--MARK--><!--MARK--><a href='../../../../publication/9846f41b-d755-4682-9049-5e59d363951b' class='mouseoverHref'><em>Invertebrate Taxonomy</em></a> <strong>4</strong>: 1147-1282<!--MARK-->","","Article in Journal","8af4a199-9fb2-4718-9646-2279eee0051c","20081009T05:11:37.000+0000","9846f41b-d755-4682-9049-5e59d363951b"
"Miller, L.R.","1994","Dimorphic minor soldiers in  <i>Schedorhinotermes breinli</i> (Hill) (Isoptera: Rhinotermitidae)","319-320","","Journal of the Australian Entomological Society","","","","<!--MARK--><a href='../../../../publication/0b0b9bde-b7bf-4eca-a661-9c63e380e4d8' class='mouseoverHref'>Miller, L.R. 1994. Dimorphic minor soldiers in  <i>Schedorhinotermes breinli</i> (Hill) (Isoptera: Rhinotermitidae).</a> <!--MARK--><!--MARK--><a href='../../../../publication/c2544f9f-3978-4f18-846d-a1fd3122c9c4' class='mouseoverHref'><em>Journal of the Australian Entomological Society</em></a> <strong>33</strong>: 319-320<!--MARK-->","","Article in Journal","0b0b9bde-b7bf-4eca-a661-9c63e380e4d8","20081009T05:11:37.000+0000","c2544f9f-3978-4f18-846d-a1fd3122c9c4"
"Miller, L.R.","1994","Nests and queen migration in <i>Schedorhinotermes actuosus</i> (Hill), <i>Schedorhinotermes breinli</i> (Hill) and <i>Coptotermes acinaciformis</i> (Froggatt) (Isoptera: Rhinotermitidae)","317-318","","Journal of the Australian Entomological Society","","","","<!--MARK--><a href='../../../../publication/a2cc8e7a-99cc-4e80-b819-57e6fcb5c745' class='mouseoverHref'>Miller, L.R. 1994. Nests and queen migration in <i>Schedorhinotermes actuosus</i> (Hill), <i>Schedorhinotermes breinli</i> (Hill) and <i>Coptotermes acinaciformis</i> (Froggatt) (Isoptera: Rhinotermitidae).</a> <!--MARK--><!--MARK--><a href='../../../../publication/c2544f9f-3978-4f18-846d-a1fd3122c9c4' class='mouseoverHref'><em>Journal of the Australian Entomological Society</em></a> <strong>33</strong>: 317-318<!--MARK-->","","Article in Journal","a2cc8e7a-99cc-4e80-b819-57e6fcb5c745","20081009T05:11:37.000+0000","c2544f9f-3978-4f18-846d-a1fd3122c9c4"
"Miller, L.R.","1994","The occurrence of <i>Amitermes arboreus</i> Roisin in Australia, with notes on its biology (Isoptera: Termitidae)","305-308","","Journal of the Australian Entomological Society","","","","<!--MARK--><a href='../../../../publication/936d0c94-2329-4841-b96d-9f554a25d9be' class='mouseoverHref'>Miller, L.R. 1994. The occurrence of <i>Amitermes arboreus</i> Roisin in Australia, with notes on its biology (Isoptera: Termitidae).</a> <!--MARK--><!--MARK--><a href='../../../../publication/c2544f9f-3978-4f18-846d-a1fd3122c9c4' class='mouseoverHref'><em>Journal of the Australian Entomological Society</em></a> <strong>33</strong>: 305-308<!--MARK-->","","Article in Journal","936d0c94-2329-4841-b96d-9f554a25d9be","20081009T05:11:37.000+0000","c2544f9f-3978-4f18-846d-a1fd3122c9c4"
"Mjöberg, E.","1920","Results of Dr. E. Mjöberg's Swedish scientific expeditions to Australia 1910-1913. 19. Isoptera","1-128 pls 1-6","","Arkiv för Zoologi","","","","<!--MARK--><a href='../../../../publication/1b186081-f729-48da-ae08-e11b0bc4038f' class='mouseoverHref'>Mjöberg, E. 1920. Results of Dr. E. Mjöberg's Swedish scientific expeditions to Australia 1910-1913. 19. Isoptera.</a> <!--MARK--><!--MARK--><a href='../../../../publication/ea0f28cc-317a-4542-aaf0-5fa8122b7a93' class='mouseoverHref'><em>Arkiv för Zoologi</em></a> <strong>12</strong>(15): 1-128 pls 1-6<!--MARK-->","","Article in Journal","1b186081-f729-48da-ae08-e11b0bc4038f","20081009T05:11:37.000+0000","ea0f28cc-317a-4542-aaf0-5fa8122b7a93"
"Nawa, U.","1911","Two termite species from Taiwan.","413-417","","Insect World","","","","<!--MARK--><a href='../../../../publication/17d00a16-1bf9-4442-8e75-f219ac4642cf' class='mouseoverHref'>Nawa, U. 1911. Two termite species from Taiwan.</a> <!--MARK--><!--MARK--><a href='../../../../publication/5a0b80b4-a33d-4acb-9018-1bd401a598f8' class='mouseoverHref'><em>Insect World</em></a> <strong>15</strong>: 413-417<!--MARK--> [in Japanese]","in Japanese","Article in Journal","17d00a16-1bf9-4442-8e75-f219ac4642cf","20140707T22:45:26.502+0000","5a0b80b4-a33d-4acb-9018-1bd401a598f8"
"Nicholls, A.G.","1929","A new species of termite from the Eastern Goldfields Region of Western Australia","19-23","","Journal of the Royal Society of Western Australia","","","","<!--MARK--><a href='../../../../publication/2b2b57b5-b324-49fc-9590-7400b21a8f00' class='mouseoverHref'>Nicholls, A.G. 1929. A new species of termite from the Eastern Goldfields Region of Western Australia.</a> <!--MARK--><!--MARK--><a href='../../../../publication/666efb8f-4a3f-4a3d-ae40-e9ab98f3cdf5' class='mouseoverHref'><em>Journal of the Royal Society of Western Australia</em></a> <strong>15</strong>: 19-23<!--MARK-->","","Article in Journal","2b2b57b5-b324-49fc-9590-7400b21a8f00","20081009T05:11:37.000+0000","666efb8f-4a3f-4a3d-ae40-e9ab98f3cdf5"
"Oshima, M.","1913","Notes on the termites of Japan with description of one new species.","271-280","","Philippine Journal of Science","","","","<!--MARK--><a href='../../../../publication/4a59c1b1-58f7-4aea-b34d-7a1667dc087c' class='mouseoverHref'>Oshima, M. 1913. Notes on the termites of Japan with description of one new species.</a> <!--MARK--><!--MARK--><a href='../../../../publication/0347b709-e2f0-4679-8749-33668856b97f' class='mouseoverHref'><em>Philippine Journal of Science</em></a> <strong>8</strong>: 271-280<!--MARK-->","","Article in Journal","4a59c1b1-58f7-4aea-b34d-7a1667dc087c","20140707T22:51:44.504+0000","0347b709-e2f0-4679-8749-33668856b97f"
"Perry, D.H., Watson, J.A.L., Bunn, S.E. & Black, R.","1985","Guide to the termites (Isoptera) from the extreme south-west of Western Australia","66-78","","Journal of the Royal Society of Western Australia","","","","<!--MARK--><a href='../../../../publication/b7bbb92e-bddb-4f63-9f73-29ec6191a1db' class='mouseoverHref'>Perry, D.H., Watson, J.A.L., Bunn, S.E. & Black, R. 1985. Guide to the termites (Isoptera) from the extreme south-west of Western Australia.</a> <!--MARK--><!--MARK--><a href='../../../../publication/666efb8f-4a3f-4a3d-ae40-e9ab98f3cdf5' class='mouseoverHref'><em>Journal of the Royal Society of Western Australia</em></a> <strong>67</strong>: 66-78<!--MARK-->","","Article in Journal","b7bbb92e-bddb-4f63-9f73-29ec6191a1db","20081009T05:11:37.000+0000","666efb8f-4a3f-4a3d-ae40-e9ab98f3cdf5"
"Peters, B.C., Perkins, L.E., Cochrane, G.H. & Zalucki, M.P.","2016","Subterranean termite (Blattodea: Termitoidae) pests in metropolitan Brisbane, Australia, 1997-2006: patterns and implications","218-224","","Austral Entomology","","","","<!--MARK--><a href='../../../../publication/e05ddd5a-dd67-4ea3-80b4-f04a8287c8b1' class='mouseoverHref'>Peters, B.C., Perkins, L.E., Cochrane, G.H. & Zalucki, M.P. 2016. Subterranean termite (Blattodea: Termitoidae) pests in metropolitan Brisbane, Australia, 1997-2006: patterns and implications.</a> <!--MARK--><!--MARK--><a href='../../../../publication/a3a01091-89c3-445b-a732-dbb79862123d' class='mouseoverHref'><em>Austral Entomology</em></a> <strong>56</strong>(2): 218-224<!--MARK-->","","Article in Journal","e05ddd5a-dd67-4ea3-80b4-f04a8287c8b1","20171102T22:36:24.692+0000","a3a01091-89c3-445b-a732-dbb79862123d"
"Pope, P.","1953","Studies of the life histories of some Queensland Blattidae (Orthoptera). Part 1. The domestic species","23-46","","Proceedings of the Royal Society of Queensland","","","","<!--MARK--><a href='../../../../publication/5023d6f8-192c-4a03-89ff-e391ca6865f0' class='mouseoverHref'>Pope, P. 1953. Studies of the life histories of some Queensland Blattidae (Orthoptera). Part 1. The domestic species.</a> <!--MARK--><!--MARK--><a href='../../../../publication/642ab613-813a-48d0-8bc0-42c78157f7b0' class='mouseoverHref'><em>Proceedings of the Royal Society of Queensland</em></a> <strong>63</strong>: 23-46<!--MARK-->","","Article in Journal","5023d6f8-192c-4a03-89ff-e391ca6865f0","20081009T05:11:37.000+0000","642ab613-813a-48d0-8bc0-42c78157f7b0"
