"PUB_AUTHOR","PUB_YEAR","PUB_TITLE","PUB_PAGES","PUB_PARENT_BOOK_TITLE","PUB_PARENT_JOURNAL_TITLE","PUB_PARENT_ARTICLE_TITLE","PUB_PUBLICATION_DATE","PUB_PUBLISHER","PUB_FORMATTED","PUB_QUALIFICATION","PUB_TYPE","PUBLICATION_GUID","PUBLICATION_LAST_UPDATE","PARENT_PUBLICATION_GUID"
"Adolphson, H. & Kinnear, A.","2008","Acari (mite) assemblages under plantations of bluegum, <I>Eucalyptus globulus</I>, in southwestern Australia.","427-437","","Pedobiologia","","","","<!--MARK--><a href='../../../../publication/64b4b961-fae1-46e9-b7e0-1d5ed992fb05' class='mouseoverHref'>Adolphson, H. & Kinnear, A. 2008. Acari (mite) assemblages under plantations of bluegum, <I>Eucalyptus globulus</I>, in southwestern Australia.</a> <!--MARK--><!--MARK--><a href='../../../../publication/eba6b973-a2e0-493c-89d0-36c63da98a0c' class='mouseoverHref'><em>Pedobiologia</em></a> <strong>51</strong>: 427-437<!--MARK-->","","Article in Journal","64b4b961-fae1-46e9-b7e0-1d5ed992fb05","20110211T07:18:36.350+0000","eba6b973-a2e0-493c-89d0-36c63da98a0c"
"Balogh, J.","1943","Magyarország Páncélosatkái (Conspectus Oribateorum Hungariae).","pp.","","","","","Magyar Tudományos Akadémia Kiadása","<!--MARK--><a href='../../../../publication/62d9c32f-ff85-40fa-a61b-1331db154276' class='mouseoverHref'>Balogh, J. 1943. <em>Magyarország Páncélosatkái (Conspectus Oribateorum Hungariae)</em>. Budapest : Magyar Tudományos Akadémia Kiadása Part 202. pp.</a><!--MARK-->","","Book","62d9c32f-ff85-40fa-a61b-1331db154276","20110321T22:54:41.233+0000",""
"Balogh, J. & Balogh, P.","2002","Identification Keys to the Oribatid Mites of the Extra-Holarctic Regions","","","","","","Well-Press Publishing","<!--MARK--><a href='../../../../publication/15eed8f9-cd76-4aa5-907b-435804b515ff' class='mouseoverHref'>Balogh, J. & Balogh, P. 2002. <em>Identification Keys to the Oribatid Mites of the Extra-Holarctic Regions</em>. Miskolc. : Well-Press Publishing Vol. 1, 453 pp. + Vol. 2, 504 pp.</a><!--MARK-->","","Book","15eed8f9-cd76-4aa5-907b-435804b515ff","20110810T03:40:43.718+0000",""
"Berlese, A.","1910","Acari nuovi. Manipulus V, VI","199-234 pls XVIII-XXI","","Redia. Giornale di entomologia, Firenze","","","","<!--MARK--><a href='../../../../publication/9b7d68c0-dad5-42f7-8f0a-f2ffa291cf9f' class='mouseoverHref'>Berlese, A. 1910. Acari nuovi. Manipulus V, VI.</a> <!--MARK--><!--MARK--><a href='../../../../publication/116966a8-7c23-4f72-a4e3-de1b7b90f1ca' class='mouseoverHref'><em>Redia. Giornale di entomologia, Firenze</em></a> <strong>6</strong>: 199-234 pls XVIII-XXI<!--MARK-->","","Article in Journal","9b7d68c0-dad5-42f7-8f0a-f2ffa291cf9f","20081009T05:11:37.000+0000","116966a8-7c23-4f72-a4e3-de1b7b90f1ca"
"Colloff, M.J. & Halliday, R.B.","1998","Oribatid Mites: A Catalogue of the Australian Genera and Species","","","","","","CSIRO Publications","<!--MARK--><a href='../../../../publication/2a4418b3-bef9-4b85-83b3-672bf69f3e48' class='mouseoverHref'>Colloff, M.J. & Halliday, R.B. 1998. <em>Oribatid Mites: A Catalogue of the Australian Genera and Species</em>. Melbourne : CSIRO Publications.</a><!--MARK-->","","Book","2a4418b3-bef9-4b85-83b3-672bf69f3e48","20081009T05:11:37.000+0000",""
"Evans, G.O.","1952","British mites of the genus <i>Brachychthonius</i> Berl., 1910","227-239","","Annals and Magazine of Natural History","","","","<!--MARK--><a href='../../../../publication/a8f32285-7864-4c90-a96c-4cc6db72e647' class='mouseoverHref'>Evans, G.O. 1952. British mites of the genus <i>Brachychthonius</i> Berl., 1910.</a> <!--MARK--><!--MARK--><a href='../../../../publication/efa8de69-3a29-4a43-8ef2-cbefda205976' class='mouseoverHref'><em>Annals and Magazine of Natural History</em></a> 12 <strong>5</strong>: 227-239<!--MARK-->","","Article in Journal","a8f32285-7864-4c90-a96c-4cc6db72e647","20081009T05:11:37.000+0000","efa8de69-3a29-4a43-8ef2-cbefda205976"
"Forsslund, K.H.","1942","Schwedische Oribatei (Acari). I","1-11","","Arkiv för Zoologi","","","","<!--MARK--><a href='../../../../publication/9ebbb4c8-0fe6-423c-9301-6d27bc822674' class='mouseoverHref'>Forsslund, K.H. 1942. Schwedische Oribatei (Acari). I.</a> <!--MARK--><!--MARK--><a href='../../../../publication/ea0f28cc-317a-4542-aaf0-5fa8122b7a93' class='mouseoverHref'><em>Arkiv för Zoologi</em></a> <strong>34A</strong>(10): 1-11<!--MARK-->","","Article in Journal","9ebbb4c8-0fe6-423c-9301-6d27bc822674","20081009T05:11:37.000+0000","ea0f28cc-317a-4542-aaf0-5fa8122b7a93"
"Hammen, L. van der","1959","Berlese's primitive oribatid mites","1-93","","Zoologische Verhandelingen (Leiden)","","","","<!--MARK--><a href='../../../../publication/c0732cff-86c9-4e62-8343-22ba114c4726' class='mouseoverHref'>Hammen, L. van der 1959. Berlese's primitive oribatid mites.</a> <!--MARK--><!--MARK--><a href='../../../../publication/ef9c29c7-02e1-45c1-816e-05f980b8b1fd' class='mouseoverHref'><em>Zoologische Verhandelingen (Leiden)</em></a> <strong>40</strong>: 1-93<!--MARK-->","","Article in Journal","c0732cff-86c9-4e62-8343-22ba114c4726","20081009T05:11:37.000+0000","ef9c29c7-02e1-45c1-816e-05f980b8b1fd"
"Hammer, M.","1958","Investigations on the Oribatid fauna of the Andes Mountains. I. The Argentine and Bolivia","1-129 pls I-XXXIV","","Biologiske Skrifter Kongelige Danske Videnskabernes Selskab","","","","<!--MARK--><a href='../../../../publication/bb081314-67cb-4cdb-9c4f-756b1401848c' class='mouseoverHref'>Hammer, M. 1958. Investigations on the Oribatid fauna of the Andes Mountains. I. The Argentine and Bolivia.</a> <!--MARK--><!--MARK--><a href='../../../../publication/f972ce1b-96be-4636-ba91-4c593f351846' class='mouseoverHref'><em>Biologiske Skrifter Kongelige Danske Videnskabernes Selskab</em></a> <strong>10</strong>(1): 1-129 pls I-XXXIV<!--MARK-->","","Article in Journal","bb081314-67cb-4cdb-9c4f-756b1401848c","20081009T05:11:37.000+0000","f972ce1b-96be-4636-ba91-4c593f351846"
"Hammer, M.","1962","Investigations on the Oribatid fauna of the Andes Mountains. III. Chile","1-96 pls I-XXX","","Biologiske Skrifter Kongelige Danske Videnskabernes Selskab","","","","<!--MARK--><a href='../../../../publication/36eb98d9-d2e5-49ee-9436-d464d20b9831' class='mouseoverHref'>Hammer, M. 1962. Investigations on the Oribatid fauna of the Andes Mountains. III. Chile.</a> <!--MARK--><!--MARK--><a href='../../../../publication/f972ce1b-96be-4636-ba91-4c593f351846' class='mouseoverHref'><em>Biologiske Skrifter Kongelige Danske Videnskabernes Selskab</em></a> <strong>13</strong>(2): 1-96 pls I-XXX<!--MARK-->","","Article in Journal","36eb98d9-d2e5-49ee-9436-d464d20b9831","20081009T05:11:37.000+0000","f972ce1b-96be-4636-ba91-4c593f351846"
"Hammer, M.","1962","Investigations on the Oribatid fauna of the Andes Mountains. IV. Patagonia","1-37 pls I-XI","","Biologiske Skrifter Kongelige Danske Videnskabernes Selskab","","","","<!--MARK--><a href='../../../../publication/74f87397-fdf9-4dfa-a4c4-d5e1582fc4ba' class='mouseoverHref'>Hammer, M. 1962. Investigations on the Oribatid fauna of the Andes Mountains. IV. Patagonia.</a> <!--MARK--><!--MARK--><a href='../../../../publication/f972ce1b-96be-4636-ba91-4c593f351846' class='mouseoverHref'><em>Biologiske Skrifter Kongelige Danske Videnskabernes Selskab</em></a> <strong>13</strong>(3): 1-37 pls I-XI<!--MARK-->","","Article in Journal","74f87397-fdf9-4dfa-a4c4-d5e1582fc4ba","20081009T05:11:37.000+0000","f972ce1b-96be-4636-ba91-4c593f351846"
"Hammer, M.","1966","Investigations on the Oribatid fauna of New Zealand. Part I","1-108 pls I-XLV","","Biologiske Skrifter Kongelige Danske Videnskabernes Selskab","","","","<!--MARK--><a href='../../../../publication/6a47e1ac-5746-4b27-a61d-bb19e0bc970c' class='mouseoverHref'>Hammer, M. 1966. Investigations on the Oribatid fauna of New Zealand. Part I.</a> <!--MARK--><!--MARK--><a href='../../../../publication/f972ce1b-96be-4636-ba91-4c593f351846' class='mouseoverHref'><em>Biologiske Skrifter Kongelige Danske Videnskabernes Selskab</em></a> <strong>15</strong>(2): 1-108 pls I-XLV<!--MARK-->","","Article in Journal","6a47e1ac-5746-4b27-a61d-bb19e0bc970c","20110407T04:14:54.566+0000","f972ce1b-96be-4636-ba91-4c593f351846"
"Harvey, M.S., Gray, M.R., Hunt, G.S. & Lee, D.C.","1993","The cavernicolous Arachnida and Myriapoda of Cape Range, Western Australia","pp. 129-144","","Records of the Western Australian Museum","The Biogeography of Cape Range Western Australia","","","<!--MARK--><a href='../../../../publication/fd6ce049-68cb-4eef-898e-175dd3abd976' class='mouseoverHref'>Harvey, M.S., Gray, M.R., Hunt, G.S. & Lee, D.C. 1993. The cavernicolous Arachnida and Myriapoda of Cape Range, Western Australia. pp. 129-144</a> <!--MARK--><em>in</em> <!--MARK--><a href='../../../../publication/17cd7e8b-34fe-4639-a420-7d7fbb965dbb' class='mouseoverHref'>Humphreys, W.F. The Biogeography of Cape Range Western Australia.</a> <!--MARK--><!--MARK--><a href='../../../../publication/a2cbd1fb-97d5-493a-a1d7-c2b99709890b' class='mouseoverHref'><em>Records of the Western Australian Museum</em></a> <strong>45</strong>(Supplement)<!--MARK-->","","Section in Article","fd6ce049-68cb-4eef-898e-175dd3abd976","20081009T05:11:37.000+0000","17cd7e8b-34fe-4639-a420-7d7fbb965dbb"
"Heatwole, H., Done, T. & Cameron, E.","1981","Community Ecology of a Coral Cay: A study of One-Tree Island, Great Barrier Reef, Australia","379 pp.","","","","","W. Junk","<!--MARK--><a href='../../../../publication/caf46063-5883-4591-83e1-f4e008c0e3db' class='mouseoverHref'>Heatwole, H., Done, T. & Cameron, E. 1981. <em>Community Ecology of a Coral Cay: A study of One-Tree Island, Great Barrier Reef, Australia</em>. The Hague : W. Junk 379 pp.</a><!--MARK-->","","Book","caf46063-5883-4591-83e1-f4e008c0e3db","20081009T05:11:37.000+0000",""
"Krivolutsky, D.A.","1964","<I>Sellnickochthonius</I> gen. n. - new genus of oribatid mites from the family Brachychthonidae Balogh, 1943 (Acariformes, Oribatei).","935-936","","Zoologicheskii Zhurnal","","","","<!--MARK--><a href='../../../../publication/18dea740-9a85-44a2-8ad8-ed9b6b03a3d9' class='mouseoverHref'>Krivolutsky, D.A. 1964. <I>Sellnickochthonius</I> gen. n. - new genus of oribatid mites from the family Brachychthonidae Balogh, 1943 (Acariformes, Oribatei).</a> <!--MARK--><!--MARK--><a href='../../../../publication/9ca52805-abf8-43a8-bbd5-8b91ddb0efd4' class='mouseoverHref'><em>Zoologicheskii Zhurnal</em></a> <strong>43</strong>: 935-936<!--MARK-->","","Article in Journal","18dea740-9a85-44a2-8ad8-ed9b6b03a3d9","20110617T03:52:57.991+0000","9ca52805-abf8-43a8-bbd5-8b91ddb0efd4"
"Lee, D.C.","1982","Sarcoptiformes (Acari) of South Australian soils. 3. Arthronotina (Cryptostigmata)","327-359","","Records of the South Australian Museum (Adelaide)","","","","<!--MARK--><a href='../../../../publication/e705bae3-048b-4212-8979-58a8eabd78be' class='mouseoverHref'>Lee, D.C. 1982. Sarcoptiformes (Acari) of South Australian soils. 3. Arthronotina (Cryptostigmata).</a> <!--MARK--><!--MARK--><a href='../../../../publication/f7f76869-b0b8-4c0e-a1bc-1d8c43cc0f89' class='mouseoverHref'><em>Records of the South Australian Museum (Adelaide)</em></a> <strong>18</strong>: 327-359<!--MARK-->","","Article in Journal","e705bae3-048b-4212-8979-58a8eabd78be","20081009T05:11:37.000+0000","f7f76869-b0b8-4c0e-a1bc-1d8c43cc0f89"
"Longstaff, B.C., Greenslade, P.J.M., Colloff, M., Reid, I., Hart, P. & Packer, I.","1999","Managing Soils in Agriculture. The Impact of Soil Tillage Practices on Soil Fauna.","pp. 65","","","","","Rural Industries Research and Development Corporation Publication No 99/18.","<!--MARK--><a href='../../../../publication/ebcf9d9f-110d-45da-82cb-dd9489f383d5' class='mouseoverHref'>Longstaff, B.C., Greenslade, P.J.M., Colloff, M., Reid, I., Hart, P. & Packer, I. 1999. <em>Managing Soils in Agriculture. The Impact of Soil Tillage Practices on Soil Fauna</em>. Canberra, Australia : Rural Industries Research and Development Corporation Publication No 99/18. pp. 65.</a><!--MARK-->","","Book","ebcf9d9f-110d-45da-82cb-dd9489f383d5","20110306T04:13:45.053+0000",""
"Marshall, V.G., Reeves, R.M. & Norton, R.A.","1987","Catalogue of the Oribatida (Acari) of continental United States and Canada","1-418","","Memoirs of the Entomological Society of Canada","","","","<!--MARK--><a href='../../../../publication/13a6efc9-7e57-4215-9189-ff6ba2754a0e' class='mouseoverHref'>Marshall, V.G., Reeves, R.M. & Norton, R.A. 1987. Catalogue of the Oribatida (Acari) of continental United States and Canada.</a> <!--MARK--><!--MARK--><a href='../../../../publication/23f5bd49-4593-4dfc-b05e-0b6f53a17e77' class='mouseoverHref'><em>Memoirs of the Entomological Society of Canada</em></a> <strong>139</strong>: 1-418<!--MARK-->","","Article in Journal","13a6efc9-7e57-4215-9189-ff6ba2754a0e","20081009T05:11:37.000+0000","23f5bd49-4593-4dfc-b05e-0b6f53a17e77"
"Michael, A.D.","1888","British Oribatidae.","pp. i-xi + 337-657 + Plates XXV-LIV","","","","","Ray Society","<!--MARK--><a href='../../../../publication/0cf0ff5f-1b76-4b06-9038-52c4b7211438' class='mouseoverHref'>Michael, A.D. 1888. <em>British Oribatidae</em>. London : Ray Society Vol. II pp. i-xi + 337-657 + Plates XXV-LIV.</a><!--MARK-->","","Book","0cf0ff5f-1b76-4b06-9038-52c4b7211438","20110301T00:22:34.172+0000",""
"Moritz, M.","1976","Revision der Europäischen gattungen und arten der familie Brachychthoniidae (Acari, Oribatei)","27-136","","Mitteilungen aus dem Zoologischen Museum in Berlin","","","","<!--MARK--><a href='../../../../publication/e2b80c4f-271f-4851-9a13-dc0afefd6d84' class='mouseoverHref'>Moritz, M. 1976. Revision der Europäischen gattungen und arten der familie Brachychthoniidae (Acari, Oribatei).</a> <!--MARK--><!--MARK--><a href='../../../../publication/580e0309-5e8f-49f6-a6bf-bf2b69fb9a4a' class='mouseoverHref'><em>Mitteilungen aus dem Zoologischen Museum in Berlin</em></a> <strong>52</strong>: 27-136<!--MARK-->","","Article in Journal","e2b80c4f-271f-4851-9a13-dc0afefd6d84","20081009T05:11:37.000+0000","580e0309-5e8f-49f6-a6bf-bf2b69fb9a4a"
"Moritz, M.","1976","Revision der Europäischen gattungen und arten der familie Brachychthoniidae (Acari, Oribatei). Teil 2. <i>Mixochthonius</i> Niedbala, 1972, <i>Neobrachychthonius</i> nov. gen., <i>Synchthonius</i> v. d. Hammen, 1952, <i>Poecilochthonius</i> Balogh, 19","227-319","","Mitteilungen aus dem Zoologischen Museum in Berlin","","","","<!--MARK--><a href='../../../../publication/c7383a47-591f-4ae1-89c4-db39afb586ec' class='mouseoverHref'>Moritz, M. 1976. Revision der Europäischen gattungen und arten der familie Brachychthoniidae (Acari, Oribatei). Teil 2. <i>Mixochthonius</i> Niedbala, 1972, <i>Neobrachychthonius</i> nov. gen., <i>Synchthonius</i> v. d. Hammen, 1952, <i>Poecilochthonius</i> Balogh, 19.</a> <!--MARK--><!--MARK--><a href='../../../../publication/580e0309-5e8f-49f6-a6bf-bf2b69fb9a4a' class='mouseoverHref'><em>Mitteilungen aus dem Zoologischen Museum in Berlin</em></a> <strong>52</strong>: 227-319<!--MARK-->","","Article in Journal","c7383a47-591f-4ae1-89c4-db39afb586ec","20081009T05:11:37.000+0000","580e0309-5e8f-49f6-a6bf-bf2b69fb9a4a"
"Moulton, T.M.","1982","The effect of prescribed burning and simulated burning on soil and litter arthropods in open forest at Cordeaux, N.S.W. Australia","","","","","","","<!--MARK--><a href='../../../../publication/9f08119e-ce6a-4eef-a176-f38e9b6fe121' class='mouseoverHref'>Moulton, T.M. 1982. The effect of prescribed burning and simulated burning on soil and litter arthropods in open forest at Cordeaux, N.S.W. Australia. PhD Thesis, School of Biological Sciences, Macquarie University.</a>","","Miscellaneous","9f08119e-ce6a-4eef-a176-f38e9b6fe121","20081009T05:11:37.000+0000",""
"Noble, J.C., Whitford, W.G. & Kaliszewski, M.","1996","Soil and litter microarthropod populations from two contrasting ecosystems in semi-arid eastern Australia","329-346","","Journal of Arid Environments","","","","<!--MARK--><a href='../../../../publication/4141c080-a71f-47d0-9cf9-8af62d688c79' class='mouseoverHref'>Noble, J.C., Whitford, W.G. & Kaliszewski, M. 1996. Soil and litter microarthropod populations from two contrasting ecosystems in semi-arid eastern Australia.</a> <!--MARK--><!--MARK--><a href='../../../../publication/95182fac-40d5-479c-a9e6-2330c04db410' class='mouseoverHref'><em>Journal of Arid Environments</em></a> <strong>32</strong>: 329-346<!--MARK-->","","Article in Journal","4141c080-a71f-47d0-9cf9-8af62d688c79","20081009T05:11:37.000+0000","95182fac-40d5-479c-a9e6-2330c04db410"
"Norton, R.A. & Behan-Pelletier, V.M.","2009","Suborder Oribatida.","pp. 430-564","A Manual of Acarology","","","","","<!--MARK--><a href='../../../../publication/25239596-a779-446d-babf-2dd7bd756ae3' class='mouseoverHref'>Norton, R.A. & Behan-Pelletier, V.M. 2009. Suborder Oribatida. pp. 430-564</a> <!--MARK--><em>in</em> <!--MARK--><a href='../../../../publication/4adea5fa-3e8b-4daf-bac9-2ec7aa45d0fd' class='mouseoverHref'>Krantz, G.W. & Walter, D.E. (eds). <em>A Manual of Acarology</em>. Lubbock, Texas : Texas Tech University Press Third edition, 807 pp.</a><!--MARK-->","","Chapter in Book","25239596-a779-446d-babf-2dd7bd756ae3","20110815T06:42:01.810+0000","4adea5fa-3e8b-4daf-bac9-2ec7aa45d0fd"
"Schatz, H., Behan-Pelletier, V.M., OConnor, B.M. & Norton, R.A.","2011","Suborder Oribatida van der Hammen, 1968","pp. 141-148","Animal Biodiversity: An Outline of Higher-level Classification and Survey of Taxonomic Richness","","","","","<!--MARK--><a href='../../../../publication/4d709354-1aeb-4a05-b77e-512f9f88d767' class='mouseoverHref'>Schatz, H., Behan-Pelletier, V.M., OConnor, B.M. & Norton, R.A. 2011. Suborder Oribatida van der Hammen, 1968. pp. 141-148</a> <!--MARK--><em>in</em> <!--MARK--><a href='../../../../publication/e1a8af56-51e3-45d8-b610-999291d8a4b3' class='mouseoverHref'>Zhang, Z.-Q. <em>Animal Biodiversity: An Outline of Higher-level Classification and Survey of Taxonomic Richness</em>. Auckland : Magnolia Press.</a><!--MARK-->","","Chapter in Book","4d709354-1aeb-4a05-b77e-512f9f88d767","20120104T21:43:40.185+0000","e1a8af56-51e3-45d8-b610-999291d8a4b3"
"Sellnick, M.","1960","Formenkreis: Hornmilben, Oribátai. Band III","45-132","","Die Tierwelt Mitteleuropas","","","","<!--MARK--><a href='../../../../publication/79871aeb-5542-4c7b-ab86-c47518ec78e8' class='mouseoverHref'>Sellnick, M. 1960. Formenkreis: Hornmilben, Oribátai. Band III.</a> <!--MARK--><!--MARK--><a href='../../../../publication/d9029d7a-16a7-4031-bf74-214a3c82f36f' class='mouseoverHref'><em>Die Tierwelt Mitteleuropas</em></a> <strong>4</strong>: 45-132<!--MARK-->","","Article in Journal","79871aeb-5542-4c7b-ab86-c47518ec78e8","20081009T05:11:37.000+0000","d9029d7a-16a7-4031-bf74-214a3c82f36f"
"Springett, J.A.","1976","The effect of planting <i>Pinus pinaster</i> Ait. on populations of soil microarthropods and on litter decomposition at Gnangara, Western Australia","83-87","","Australian Journal of Ecology","","","","<!--MARK--><a href='../../../../publication/050abe4d-cfc4-4218-b8dc-768196011592' class='mouseoverHref'>Springett, J.A. 1976. The effect of planting <i>Pinus pinaster</i> Ait. on populations of soil microarthropods and on litter decomposition at Gnangara, Western Australia.</a> <!--MARK--><!--MARK--><a href='../../../../publication/c2d5de56-8bc2-47c2-9f41-e41be2d99516' class='mouseoverHref'><em>Australian Journal of Ecology</em></a> <strong>1</strong>: 83-87<!--MARK-->","","Article in Journal","050abe4d-cfc4-4218-b8dc-768196011592","20081009T05:11:37.000+0000","c2d5de56-8bc2-47c2-9f41-e41be2d99516"
"Springett, J.A.","1979","The effects of a single hot summer fire on soil fauna and on litter decomposition in jarrah (<i>Eucalyptus marginata</i>) forest in Western Australia","279-291","","Australian Journal of Ecology","","","","<!--MARK--><a href='../../../../publication/02b21c44-87a5-44ba-a32f-cef1750a750f' class='mouseoverHref'>Springett, J.A. 1979. The effects of a single hot summer fire on soil fauna and on litter decomposition in jarrah (<i>Eucalyptus marginata</i>) forest in Western Australia.</a> <!--MARK--><!--MARK--><a href='../../../../publication/c2d5de56-8bc2-47c2-9f41-e41be2d99516' class='mouseoverHref'><em>Australian Journal of Ecology</em></a> <strong>4</strong>: 279-291<!--MARK-->","","Article in Journal","02b21c44-87a5-44ba-a32f-cef1750a750f","20081009T05:11:37.000+0000","c2d5de56-8bc2-47c2-9f41-e41be2d99516"
"Subias, L.S","February 2011","Listado sistemático, sinonímico y biogeográfico de los ácaros oribátidos (Acariformes: Oribatida) del mundo (excepto fósiles)","","","","","","","<!--MARK--><a href='../../../../publication/455b98a8-2d80-48c8-802d-d3bb671a43a2' class='mouseoverHref'>Subias, L.S February 2011. Listado sistemático, sinonímico y biogeográfico de los ácaros oribátidos (Acariformes: Oribatida) del mundo (excepto fósiles). Departamento de Zoología, Facultad de Biología, Universidad Complutense, Madrid, Spain.</a> <!--MARK--><a href=http://www.ucm.es/info/zoo/Artropodos/Catalogo.pdf>http://www.ucm.es/info/zoo/Artropodos/Catalogo.pdf</a><!--MARK--> [date of access 1 October 2011]","date of access 1 October 2011","URL","455b98a8-2d80-48c8-802d-d3bb671a43a2","20130506T22:20:34.110+0000",""
"Subias, L.S.","2004","Listado sistemático, sinonímico y biogeográfico de los ácaros oribátidos (Acariformes, Oribatida) del mundo (1758-2002)","3-305","","Graellsia","","","","<!--MARK--><a href='../../../../publication/1025f857-904c-4217-82fc-6f20ce369867' class='mouseoverHref'>Subias, L.S. 2004. Listado sistemático, sinonímico y biogeográfico de los ácaros oribátidos (Acariformes, Oribatida) del mundo (1758-2002).</a> <!--MARK--><!--MARK--><a href='../../../../publication/c9daaa4a-6f88-40d8-bc44-a8d2e4313ed3' class='mouseoverHref'><em>Graellsia</em></a> <strong>60 (Supplement)</strong>: 3-305<!--MARK-->","","Article in Journal","1025f857-904c-4217-82fc-6f20ce369867","20130506T05:01:31.443+0000","c9daaa4a-6f88-40d8-bc44-a8d2e4313ed3"
"Thor, S.","1934","Neue Beiträge zur Kenntnis der invertebraten Fauna von Svalbard","114-139","","Zoologischer Anzeiger","","","","<!--MARK--><a href='../../../../publication/b52ebe34-169b-4420-beff-8534add85cf9' class='mouseoverHref'>Thor, S. 1934. Neue Beiträge zur Kenntnis der invertebraten Fauna von Svalbard.</a> <!--MARK--><!--MARK--><a href='../../../../publication/4b894062-2782-48ef-bf96-6997840d9060' class='mouseoverHref'><em>Zoologischer Anzeiger</em></a> <strong>107</strong>: 114-139<!--MARK-->","","Article in Journal","b52ebe34-169b-4420-beff-8534add85cf9","20081009T05:11:37.000+0000","4b894062-2782-48ef-bf96-6997840d9060"
"Van der Hammen, L.","1952","The Oribatei (Acari) of the Netherlands.","1-139","","Zoologische Verhandelingen (Leiden)","","","","<!--MARK--><a href='../../../../publication/2756b8c7-3230-4769-84fe-cd94ef3e7168' class='mouseoverHref'>Van der Hammen, L. 1952. The Oribatei (Acari) of the Netherlands.</a> <!--MARK--><!--MARK--><a href='../../../../publication/ef9c29c7-02e1-45c1-816e-05f980b8b1fd' class='mouseoverHref'><em>Zoologische Verhandelingen (Leiden)</em></a> <strong>17</strong>: 1-139<!--MARK-->","","Article in Journal","2756b8c7-3230-4769-84fe-cd94ef3e7168","20171011T05:35:05.380+0000","ef9c29c7-02e1-45c1-816e-05f980b8b1fd"
"Walter, D.E.","1995","Dancing on the head of a pin: mites in the rainforest canopy","pp. 49-53","","Records of the Western Australian Museum","Australasian Spiders and their Relatives: Papers Honouring Barbara York Main","","","<!--MARK--><a href='../../../../publication/36742305-8c58-4d05-85b1-bc35d56a899a' class='mouseoverHref'>Walter, D.E. 1995. Dancing on the head of a pin: mites in the rainforest canopy. pp. 49-53</a> <!--MARK--><em>in</em> <!--MARK--><a href='../../../../publication/0f384557-4c45-4b31-8213-a09d034dca8e' class='mouseoverHref'>M.S. Harvey (ed.). Australasian Spiders and their Relatives: Papers Honouring Barbara York Main.</a> <!--MARK--><!--MARK--><a href='../../../../publication/a2cbd1fb-97d5-493a-a1d7-c2b99709890b' class='mouseoverHref'><em>Records of the Western Australian Museum</em></a> <strong>52</strong>(Supplement)<!--MARK-->","","Section in Article","36742305-8c58-4d05-85b1-bc35d56a899a","20120130T23:24:50.065+0000","0f384557-4c45-4b31-8213-a09d034dca8e"
"Walter, D.E.","1999","Living on leaves: adaptations of Australian rainforest mites","pp. 73-78","Acarology IX. Volume 2. Symposia.","","","","","<!--MARK--><a href='../../../../publication/67d91486-25c1-4794-a0f1-f3035959531e' class='mouseoverHref'>Walter, D.E. 1999. Living on leaves: adaptations of Australian rainforest mites. pp. 73-78</a> <!--MARK--><em>in</em> <!--MARK--><a href='../../../../publication/48a56339-0827-472b-a2ad-98b518ac942b' class='mouseoverHref'>Needham, G.R., Mitchell, R., Horn, D.J. & Welbourn, W.C. <em>Acarology IX. Volume 2. Symposia</em>. Columbus, Ohio : Ohio Biological Survey.</a><!--MARK-->","","Chapter in Book","67d91486-25c1-4794-a0f1-f3035959531e","20120202T00:17:52.705+0000","48a56339-0827-472b-a2ad-98b518ac942b"
"Weigmann, G.","2006","Hornmilben (Oribatida).","pp. 520","","","","","Goecke & Evers","<!--MARK--><a href='../../../../publication/f670d665-5dc9-4e7e-a9ec-1e72ed79ef3d' class='mouseoverHref'>Weigmann, G. 2006. <em>Hornmilben (Oribatida)</em>. Keltern : Goecke & Evers pp. 520.</a><!--MARK-->","","Book","f670d665-5dc9-4e7e-a9ec-1e72ed79ef3d","20110608T09:11:07.349+0000",""
