"PUB_AUTHOR","PUB_YEAR","PUB_TITLE","PUB_PAGES","PUB_PARENT_BOOK_TITLE","PUB_PARENT_JOURNAL_TITLE","PUB_PARENT_ARTICLE_TITLE","PUB_PUBLICATION_DATE","PUB_PUBLISHER","PUB_FORMATTED","PUB_QUALIFICATION","PUB_TYPE","PUBLICATION_GUID","PUBLICATION_LAST_UPDATE","PARENT_PUBLICATION_GUID"
"Marsh, P.M. & Austin, A.D.","1994","<i>In</i>: Austin, A.D., Quicke, D.L.J.  & Marsh, P.M. The hymenopterous parasitoids of eucalypt longicorn beetles, <i>Phoracantha</i> spp. (Coleoptera: Cerambycidae) in Australia","145-174","","Bulletin of Entomological Research","","","","<!--MARK--><a href='../../../../publication/fd9222b7-d75a-4557-a88a-afb76dd0f4e9' class='mouseoverHref'>Marsh, P.M. & Austin, A.D. 1994. <i>In</i>: Austin, A.D., Quicke, D.L.J.  & Marsh, P.M. The hymenopterous parasitoids of eucalypt longicorn beetles, <i>Phoracantha</i> spp. (Coleoptera: Cerambycidae) in Australia.</a> <!--MARK--><!--MARK--><a href='../../../../publication/ef0b7d10-3b2d-4f9f-affe-9a3dc2101d9f' class='mouseoverHref'><em>Bulletin of Entomological Research</em></a> <strong>84</strong>: 145-174<!--MARK-->","","Article in Journal","fd9222b7-d75a-4557-a88a-afb76dd0f4e9","20081009T05:11:37.000+0000","ef0b7d10-3b2d-4f9f-affe-9a3dc2101d9f"
"Parrott, A.W.","1953","A systematic catalogue of Australian Braconidae","193-218","","Pacific Science","","","","<!--MARK--><a href='../../../../publication/6054feba-8b46-400b-b71e-9bf77a9e672f' class='mouseoverHref'>Parrott, A.W. 1953. A systematic catalogue of Australian Braconidae.</a> <!--MARK--><!--MARK--><a href='../../../../publication/cc032c8b-89bc-474b-8046-90fbdaad884c' class='mouseoverHref'><em>Pacific Science</em></a> <strong>7</strong>: 193-218<!--MARK-->","","Article in Journal","6054feba-8b46-400b-b71e-9bf77a9e672f","20081009T05:11:37.000+0000","cc032c8b-89bc-474b-8046-90fbdaad884c"
"Quicke, D.L.J.","1984","Three new genera of Indo-Australian Braconinae (Hymenoptera: Braconidae)","73-79","","Entomologist's Monthly Magazine","","","","<!--MARK--><a href='../../../../publication/8d77513d-0156-4758-9fa1-b697cf794455' class='mouseoverHref'>Quicke, D.L.J. 1984. Three new genera of Indo-Australian Braconinae (Hymenoptera: Braconidae).</a> <!--MARK--><!--MARK--><a href='../../../../publication/cbd5c497-64d0-4fae-97ee-22719c3ca286' class='mouseoverHref'><em>Entomologist's Monthly Magazine</em></a> <strong>120</strong>: 73-79<!--MARK-->","","Article in Journal","8d77513d-0156-4758-9fa1-b697cf794455","20081009T05:11:37.000+0000","cbd5c497-64d0-4fae-97ee-22719c3ca286"
"Quicke, D.L.J.","1986","A revision of the Adeshini van Achterberg with description of three new genera from the Palaeotropics (Insecta, Hymenoptera, Braconidae)","265-274","","Zoologica Scripta","","","","<!--MARK--><a href='../../../../publication/8ebf360a-0881-4c20-9fae-23f309584e25' class='mouseoverHref'>Quicke, D.L.J. 1986. A revision of the Adeshini van Achterberg with description of three new genera from the Palaeotropics (Insecta, Hymenoptera, Braconidae).</a> <!--MARK--><!--MARK--><a href='../../../../publication/b73ec244-df8b-4acd-858a-ffc326386b1e' class='mouseoverHref'><em>Zoologica Scripta</em></a> <strong>15</strong>: 265-274<!--MARK-->","","Article in Journal","8ebf360a-0881-4c20-9fae-23f309584e25","20081009T05:11:37.000+0000","b73ec244-df8b-4acd-858a-ffc326386b1e"
"Quicke, D.L.J.","1986","Seven new genera and species of Braconinae (Hym., Braconidae) from Australia and Indonesia","9-29","","Entomologist's Monthly Magazine","","","","<!--MARK--><a href='../../../../publication/e6cb2e12-762f-4d52-9e8b-c1241536a911' class='mouseoverHref'>Quicke, D.L.J. 1986. Seven new genera and species of Braconinae (Hym., Braconidae) from Australia and Indonesia.</a> <!--MARK--><!--MARK--><a href='../../../../publication/cbd5c497-64d0-4fae-97ee-22719c3ca286' class='mouseoverHref'><em>Entomologist's Monthly Magazine</em></a> <strong>122</strong>: 9-29<!--MARK-->","","Article in Journal","e6cb2e12-762f-4d52-9e8b-c1241536a911","20081009T05:11:37.000+0000","cbd5c497-64d0-4fae-97ee-22719c3ca286"
"Quicke, D.L.J.","1986","Three new genera of Braconini from the Afrotropical and Australian regions (Insecta, Hymenoptera, Braconidae)","181-187","","Zoologica Scripta","","","","<!--MARK--><a href='../../../../publication/42816ef2-b537-4194-bd04-d5fda0417ff6' class='mouseoverHref'>Quicke, D.L.J. 1986. Three new genera of Braconini from the Afrotropical and Australian regions (Insecta, Hymenoptera, Braconidae).</a> <!--MARK--><!--MARK--><a href='../../../../publication/b73ec244-df8b-4acd-858a-ffc326386b1e' class='mouseoverHref'><em>Zoologica Scripta</em></a> <strong>15</strong>: 181-187<!--MARK-->","","Article in Journal","42816ef2-b537-4194-bd04-d5fda0417ff6","20081009T05:11:37.000+0000","b73ec244-df8b-4acd-858a-ffc326386b1e"
"Quicke, D.L.J.","1987","The Old World genera of braconine wasps (Hymenoptera: Braconidae)","43-157","","Journal of Natural History","","","","<!--MARK--><a href='../../../../publication/88e39d37-9008-4a3f-8e95-9b65eab589bd' class='mouseoverHref'>Quicke, D.L.J. 1987. The Old World genera of braconine wasps (Hymenoptera: Braconidae).</a> <!--MARK--><!--MARK--><a href='../../../../publication/ad79edeb-4c47-4124-a7ea-9bcbbce0efa4' class='mouseoverHref'><em>Journal of Natural History</em></a> <strong>21</strong>: 43-157<!--MARK-->","","Article in Journal","88e39d37-9008-4a3f-8e95-9b65eab589bd","20081009T05:11:37.000+0000","ad79edeb-4c47-4124-a7ea-9bcbbce0efa4"
"Quicke, D.L.J.","1988","A new genus and species of Braconinae from Australia (Insecta, Hymenoptera, Braconidae)","285-287","","Zoologica Scripta","","","","<!--MARK--><a href='../../../../publication/0bc84757-a040-4cce-aa3d-eaff8d58e224' class='mouseoverHref'>Quicke, D.L.J. 1988. A new genus and species of Braconinae from Australia (Insecta, Hymenoptera, Braconidae).</a> <!--MARK--><!--MARK--><a href='../../../../publication/b73ec244-df8b-4acd-858a-ffc326386b1e' class='mouseoverHref'><em>Zoologica Scripta</em></a> <strong>17</strong>: 285-287<!--MARK-->","","Article in Journal","0bc84757-a040-4cce-aa3d-eaff8d58e224","20081009T05:11:37.000+0000","b73ec244-df8b-4acd-858a-ffc326386b1e"
"Quicke, D.L.J.","1988","Four new genera of the <i>Plesiobracon</i> Cameron group (Insecta, Hymenoptera, Braconinae)","411-418","","Zoologica Scripta","","","","<!--MARK--><a href='../../../../publication/3555d85c-12ba-4840-8b95-6cbd86734742' class='mouseoverHref'>Quicke, D.L.J. 1988. Four new genera of the <i>Plesiobracon</i> Cameron group (Insecta, Hymenoptera, Braconinae).</a> <!--MARK--><!--MARK--><a href='../../../../publication/b73ec244-df8b-4acd-858a-ffc326386b1e' class='mouseoverHref'><em>Zoologica Scripta</em></a> <strong>17</strong>: 411-418<!--MARK-->","","Article in Journal","3555d85c-12ba-4840-8b95-6cbd86734742","20081009T05:11:37.000+0000","b73ec244-df8b-4acd-858a-ffc326386b1e"
"Quicke, D.L.J.","1988","Reclassification of some Braconinae described by Fabricius (Hym., Braconidae).","201-202","","Entomologist's Monthly Magazine","","","","<!--MARK--><a href='../../../../publication/4848c77c-4080-4447-8e51-69ea25646eed' class='mouseoverHref'>Quicke, D.L.J. 1988. Reclassification of some Braconinae described by Fabricius (Hym., Braconidae).</a> <!--MARK--><!--MARK--><a href='../../../../publication/cbd5c497-64d0-4fae-97ee-22719c3ca286' class='mouseoverHref'><em>Entomologist's Monthly Magazine</em></a> <strong>124</strong>: 201-202<!--MARK-->","","Article in Journal","4848c77c-4080-4447-8e51-69ea25646eed","20110803T03:38:44.114+0000","cbd5c497-64d0-4fae-97ee-22719c3ca286"
"Quicke, D.L.J.","1989","The Indo-Australian and E. Palaearctic braconine wasp genus <i>Euurobracon</i> (Hymenoptera: Braconidae)","775-802","","Journal of Natural History","","","","<!--MARK--><a href='../../../../publication/88586ff3-7e16-4a0d-86c2-9e064a7b1436' class='mouseoverHref'>Quicke, D.L.J. 1989. The Indo-Australian and E. Palaearctic braconine wasp genus <i>Euurobracon</i> (Hymenoptera: Braconidae).</a> <!--MARK--><!--MARK--><a href='../../../../publication/ad79edeb-4c47-4124-a7ea-9bcbbce0efa4' class='mouseoverHref'><em>Journal of Natural History</em></a> <strong>23</strong>: 775-802<!--MARK-->","","Article in Journal","88586ff3-7e16-4a0d-86c2-9e064a7b1436","20081009T05:11:37.000+0000","ad79edeb-4c47-4124-a7ea-9bcbbce0efa4"
"Quicke, D.L.J.","1989","Three new genera of Braconini from Australasia and Malaysia (Insecta, Hymenoptera, Braconidae)","295-302","","Zoologica Scripta","","","","<!--MARK--><a href='../../../../publication/d45a5ef7-4df1-49df-8f7e-85cf432ea37f' class='mouseoverHref'>Quicke, D.L.J. 1989. Three new genera of Braconini from Australasia and Malaysia (Insecta, Hymenoptera, Braconidae).</a> <!--MARK--><!--MARK--><a href='../../../../publication/b73ec244-df8b-4acd-858a-ffc326386b1e' class='mouseoverHref'><em>Zoologica Scripta</em></a> <strong>18</strong>: 295-302<!--MARK-->","","Article in Journal","d45a5ef7-4df1-49df-8f7e-85cf432ea37f","20081009T05:11:37.000+0000","b73ec244-df8b-4acd-858a-ffc326386b1e"
"Quicke, D.L.J.","1991","A revision of the Australian species of <i>Iphiaulax</i> Foerster and <i>Chaoilta</i> Cameron (Insecta: Hymenoptera: Braconidae)","63-84","","Records of the Australian Museum","","","","<!--MARK--><a href='../../../../publication/a20908f0-3fca-4722-ad26-9693be2fa1fb' class='mouseoverHref'>Quicke, D.L.J. 1991. A revision of the Australian species of <i>Iphiaulax</i> Foerster and <i>Chaoilta</i> Cameron (Insecta: Hymenoptera: Braconidae).</a> <!--MARK--><!--MARK--><a href='../../../../publication/7c07530b-0b38-44f5-8f95-368da97d6ac2' class='mouseoverHref'><em>Records of the Australian Museum</em></a> <strong>43</strong>: 63-84<!--MARK-->","","Article in Journal","a20908f0-3fca-4722-ad26-9693be2fa1fb","20081009T05:11:37.000+0000","7c07530b-0b38-44f5-8f95-368da97d6ac2"
"Quicke, D.L.J.","1991","The non-European Braconinae types of Szépligeti housed in Budapest (Hymenoptera, Braconidae).","169-186","","Annales Historico-Naturales Musei Nationalis Hungarici (Zoologica)","","","","<!--MARK--><a href='../../../../publication/25b00bbd-f5e9-4111-aa1c-258d734c211b' class='mouseoverHref'>Quicke, D.L.J. 1991. The non-European Braconinae types of Szépligeti housed in Budapest (Hymenoptera, Braconidae).</a> <!--MARK--><!--MARK--><a href='../../../../publication/e6f35874-0423-4fa1-bf45-655b9047e0c2' class='mouseoverHref'><em>Annales Historico-Naturales Musei Nationalis Hungarici (Zoologica)</em></a> <strong>83</strong>: 169-186<!--MARK-->","","Article in Journal","25b00bbd-f5e9-4111-aa1c-258d734c211b","20110803T06:35:32.811+0000","e6f35874-0423-4fa1-bf45-655b9047e0c2"
"Quicke, D.L.J., Villemant, C. & Butcher, B.A.","2019","The Afrotropical braconine genus <i>Dioxybracon</i> Granger with descriptions of four new species and new generic synonymy","27-28","","Journal of Natural History","","","","<!--MARK--><a href='../../../../publication/30357a16-b5dd-40e7-a929-d5c9ee0a1f8f' class='mouseoverHref'>Quicke, D.L.J., Villemant, C. & Butcher, B.A. 2019. The Afrotropical braconine genus <i>Dioxybracon</i> Granger with descriptions of four new species and new generic synonymy.</a> <!--MARK--><!--MARK--><a href='../../../../publication/ad79edeb-4c47-4124-a7ea-9bcbbce0efa4' class='mouseoverHref'><em>Journal of Natural History</em></a> <strong>53</strong>: 27-28<!--MARK-->","","Article in Journal","30357a16-b5dd-40e7-a929-d5c9ee0a1f8f","20200728T04:52:34.174+0000","ad79edeb-4c47-4124-a7ea-9bcbbce0efa4"
"Quicke, D.L.J. & Ingram, S.N.","1993","Braconine wasps of Australia","299-336","","Memoirs of the Queensland Museum","","","","<!--MARK--><a href='../../../../publication/7635dbe9-8739-4d16-b991-b2567838d388' class='mouseoverHref'>Quicke, D.L.J. & Ingram, S.N. 1993. Braconine wasps of Australia.</a> <!--MARK--><!--MARK--><a href='../../../../publication/1a0a2982-9f30-43e1-a641-b0379699837c' class='mouseoverHref'><em>Memoirs of the Queensland Museum</em></a> <strong>33</strong>: 299-336<!--MARK-->","","Article in Journal","7635dbe9-8739-4d16-b991-b2567838d388","20081009T05:11:37.000+0000","1a0a2982-9f30-43e1-a641-b0379699837c"
"Quicke, D.L.J. in Quicke, D.L.J. & Tobias, V.I.","1990","New genera of braconid wasps of the subfamily Braconinae (Hymenoptera, Braconidae) from Australia","164-180","","Entomologicheskoe Obozrenie (English translation as Entomological Reviews)","","","","<!--MARK--><a href='../../../../publication/461d1dbb-315a-4358-8a87-d76bb4483074' class='mouseoverHref'>Quicke, D.L.J. <i>in</i> Quicke, D.L.J. & Tobias, V.I. 1990. New genera of braconid wasps of the subfamily Braconinae (Hymenoptera, Braconidae) from Australia.</a> <!--MARK--><!--MARK--><a href='../../../../publication/f0f3c73b-0eee-4d43-8239-b4de88ed3ef3' class='mouseoverHref'><em>Entomologicheskoe Obozrenie (English translation as Entomological Reviews)</em></a> <strong>59</strong>: 164-180<!--MARK-->","","Article in Journal","461d1dbb-315a-4358-8a87-d76bb4483074","20081009T05:11:37.000+0000","f0f3c73b-0eee-4d43-8239-b4de88ed3ef3"
"Ramakrishna Ayyar, T.V.","1928","A contribution to our knowledge of south Indian Braconidae. Part I. Vipioninae.","29-60","","Memoirs of the Department of Agriculture, India","","","","<!--MARK--><a href='../../../../publication/ce6d0403-d4ca-4b98-abde-af85c587432b' class='mouseoverHref'>Ramakrishna Ayyar, T.V. 1928. A contribution to our knowledge of south Indian Braconidae. Part I. Vipioninae.</a> <!--MARK--><!--MARK--><a href='../../../../publication/5f3cc5bb-9b57-49a9-adca-f77655ae35c8' class='mouseoverHref'><em>Memoirs of the Department of Agriculture, India</em></a> <strong>10</strong>(3): 29-60<!--MARK-->","","Article in Journal","ce6d0403-d4ca-4b98-abde-af85c587432b","20110803T04:26:35.671+0000","5f3cc5bb-9b57-49a9-adca-f77655ae35c8"
"Roman, A.","1910","Notizen zur Schlupfwespensammlug des Schwedischen Reichsmuseums","109-196","","Entomologisk Tidskrift","","","","<!--MARK--><a href='../../../../publication/fa45c0f4-4f36-48eb-bdb6-03a3702d072d' class='mouseoverHref'>Roman, A. 1910. Notizen zur Schlupfwespensammlug des Schwedischen Reichsmuseums.</a> <!--MARK--><!--MARK--><a href='../../../../publication/ba33b082-f69d-4d6a-a319-837886ef96ce' class='mouseoverHref'><em>Entomologisk Tidskrift</em></a> <strong>31</strong>: 109-196<!--MARK-->","","Article in Journal","fa45c0f4-4f36-48eb-bdb6-03a3702d072d","20081009T05:11:37.000+0000","ba33b082-f69d-4d6a-a319-837886ef96ce"
"Roman, A.","1912","Die Ichneumonidentypen C.P. Thunbergs.","229-293","","Zoologiska Bidrag Från Uppsala","","","","<!--MARK--><a href='../../../../publication/c64b89f8-90b8-4dc5-b271-e9cf4f234164' class='mouseoverHref'>Roman, A. 1912. Die Ichneumonidentypen C.P. Thunbergs.</a> <!--MARK--><!--MARK--><a href='../../../../publication/a6c1d740-f01c-495f-b534-a4b100beca5a' class='mouseoverHref'><em>Zoologiska Bidrag Från Uppsala</em></a> <strong>1</strong>: 229-293<!--MARK-->","","Article in Journal","c64b89f8-90b8-4dc5-b271-e9cf4f234164","20110729T02:47:32.604+0000","a6c1d740-f01c-495f-b534-a4b100beca5a"
"Roman, A.","1915","Results of Dr E. Mjöberg's Swedish scientific expeditions to Australia 1910-13. 1. Schulpfwespen","1-18","","Arkiv för Zoologi","","","","<!--MARK--><a href='../../../../publication/0fc22a81-9a76-4752-a7d5-59e8c8928aff' class='mouseoverHref'>Roman, A. 1915. Results of Dr E. Mjöberg's Swedish scientific expeditions to Australia 1910-13. 1. Schulpfwespen.</a> <!--MARK--><!--MARK--><a href='../../../../publication/ea0f28cc-317a-4542-aaf0-5fa8122b7a93' class='mouseoverHref'><em>Arkiv för Zoologi</em></a> <strong>9</strong>: 1-18<!--MARK-->","","Article in Journal","0fc22a81-9a76-4752-a7d5-59e8c8928aff","20081009T05:11:37.000+0000","ea0f28cc-317a-4542-aaf0-5fa8122b7a93"
"Say, T.","1836","Descriptions of new species of North American Hymenoptera, and observation on some already described","209-305","","Boston Journal of Natural History","","","","<!--MARK--><a href='../../../../publication/b00df96a-b3c3-48de-8ecd-4fe0ac37f7ec' class='mouseoverHref'>Say, T. 1836. Descriptions of new species of North American Hymenoptera, and observation on some already described.</a> <!--MARK--><!--MARK--><a href='../../../../publication/49d84cfc-7719-47f2-875d-1398df05ef05' class='mouseoverHref'><em>Boston Journal of Natural History</em></a> <strong>1</strong>: 209-305<!--MARK-->","","Article in Journal","b00df96a-b3c3-48de-8ecd-4fe0ac37f7ec","20081009T05:11:37.000+0000","49d84cfc-7719-47f2-875d-1398df05ef05"
"Shenefelt, R.D.","1978","Braconidae 10, Braconinae, Gnathobraconinae, Mesostoinae, Pseudodicrogeniinae, Telengainae, Ypsistocerinae plus Braconidae in General, Major Groups, Unplaced Genera and Species. Part 15","1424-1872","Hymenopterorum Catalogus","","","","","<!--MARK--><a href='../../../../publication/bf0a46a0-72e1-44a8-baec-6d0cdfa2b88f' class='mouseoverHref'>Shenefelt, R.D. 1978. Braconidae 10, Braconinae, Gnathobraconinae, Mesostoinae, Pseudodicrogeniinae, Telengainae, Ypsistocerinae plus Braconidae in General, Major Groups, Unplaced Genera and Species. Part 15. pp. 1424-1872</a> <!--MARK--><em>in</em> <!--MARK--><a href='../../../../publication/4f310546-28e4-4d51-acd8-29b0533f3000' class='mouseoverHref'>van Achterberg, C. & Shenefelt, R.D. (eds). <em>Hymenopterorum Catalogus</em>. The Hague : Dr. W. Junk.</a><!--MARK-->","","Chapter in Book","bf0a46a0-72e1-44a8-baec-6d0cdfa2b88f","20081009T05:11:37.000+0000","4f310546-28e4-4d51-acd8-29b0533f3000"
"Szépligeti, G.V.","1900","Braconiden aus Neu-Guinea in der sammlung des Ungarischen National-Museums","49-65","","Természetrajzi Füzetek","","","","<!--MARK--><a href='../../../../publication/c4f9d7d3-62c9-4f9b-8376-c7cba83108c8' class='mouseoverHref'>Szépligeti, G.V. 1900. Braconiden aus Neu-Guinea in der sammlung des Ungarischen National-Museums.</a> <!--MARK--><!--MARK--><a href='../../../../publication/090d36a9-98bf-46b0-9011-f30bd8af3030' class='mouseoverHref'><em>Természetrajzi Füzetek</em></a> <strong>23</strong>: 49-65<!--MARK-->","","Article in Journal","c4f9d7d3-62c9-4f9b-8376-c7cba83108c8","20081009T05:11:37.000+0000","090d36a9-98bf-46b0-9011-f30bd8af3030"
"Szépligeti, G.V.","1901","Tropische Cenocoelioniden und Braconiden aus der sammlung des ungarischen national-museums","353-402","","Természetrajzi Füzetek","","","","<!--MARK--><a href='../../../../publication/334f94f6-2150-4045-af74-1866420a5505' class='mouseoverHref'>Szépligeti, G.V. 1901. Tropische Cenocoelioniden und Braconiden aus der sammlung des ungarischen national-museums.</a> <!--MARK--><!--MARK--><a href='../../../../publication/090d36a9-98bf-46b0-9011-f30bd8af3030' class='mouseoverHref'><em>Természetrajzi Füzetek</em></a> <strong>24</strong>: 353-402<!--MARK-->","","Article in Journal","334f94f6-2150-4045-af74-1866420a5505","20081009T05:11:37.000+0000","090d36a9-98bf-46b0-9011-f30bd8af3030"
"Szépligeti, G.V.","1902","Tropische Cenocoelioniden und Braconiden aus der sammlung des ungarischen national-museums","39-84","","Természetrajzi Füzetek","","","","<!--MARK--><a href='../../../../publication/42719077-364e-4c70-84d1-aee7df45a6a2' class='mouseoverHref'>Szépligeti, G.V. 1902. Tropische Cenocoelioniden und Braconiden aus der sammlung des ungarischen national-museums.</a> <!--MARK--><!--MARK--><a href='../../../../publication/090d36a9-98bf-46b0-9011-f30bd8af3030' class='mouseoverHref'><em>Természetrajzi Füzetek</em></a> <strong>25</strong>: 39-84<!--MARK-->","","Article in Journal","42719077-364e-4c70-84d1-aee7df45a6a2","20081009T05:11:37.000+0000","090d36a9-98bf-46b0-9011-f30bd8af3030"
"Szépligeti, G.V.","1904","Braconidae","xxiii 253","","","","","P. Wytsman","<!--MARK--><a href='../../../../publication/4709bf05-1d94-443b-a603-0a08e0865b63' class='mouseoverHref'>Szépligeti, G.V. 1904. <em>Braconidae</em>. Bruxelles : P. Wytsman Vol. 22 xxiii 253 pp.</a><!--MARK-->","","Book","4709bf05-1d94-443b-a603-0a08e0865b63","20081009T05:11:37.000+0000",""
"Szépligeti, G.V.","1905","Exotische Braconiden aus den Aethopischen, Orientalischen und Australischen Regionen","25-55","","Annales Historico-Naturales Musei Nationalis Hungarici (Zoologica)","","","","<!--MARK--><a href='../../../../publication/76685cd4-3a52-443e-9ea6-ba99a93878b0' class='mouseoverHref'>Szépligeti, G.V. 1905. Exotische Braconiden aus den Aethopischen, Orientalischen und Australischen Regionen.</a> <!--MARK--><!--MARK--><a href='../../../../publication/e6f35874-0423-4fa1-bf45-655b9047e0c2' class='mouseoverHref'><em>Annales Historico-Naturales Musei Nationalis Hungarici (Zoologica)</em></a> <strong>3</strong>: 25-55<!--MARK-->","","Article in Journal","76685cd4-3a52-443e-9ea6-ba99a93878b0","20081009T05:11:37.000+0000","e6f35874-0423-4fa1-bf45-655b9047e0c2"
"Szépligeti, G.V.","1906","Braconiden aus der sammlung des ungarischen National-Museums I","547-618","","Annales Historico-Naturales Musei Nationalis Hungarici (Zoologica)","","","","<!--MARK--><a href='../../../../publication/51fb4e6e-7ace-43ff-bdb0-118c402a8432' class='mouseoverHref'>Szépligeti, G.V. 1906. Braconiden aus der sammlung des ungarischen National-Museums I.</a> <!--MARK--><!--MARK--><a href='../../../../publication/e6f35874-0423-4fa1-bf45-655b9047e0c2' class='mouseoverHref'><em>Annales Historico-Naturales Musei Nationalis Hungarici (Zoologica)</em></a> <strong>4</strong>: 547-618<!--MARK-->","","Article in Journal","51fb4e6e-7ace-43ff-bdb0-118c402a8432","20081009T05:11:37.000+0000","e6f35874-0423-4fa1-bf45-655b9047e0c2"
"Szépligeti, G.V.","1908","Braconidae und Ichneumonidae","317-324","","Fauna Südwest-Australiens. Herausgegeben Von W. Michaelsen. Jena","","","","<!--MARK--><a href='../../../../publication/2b15817e-f308-4946-a38d-b8fb308828dc' class='mouseoverHref'>Szépligeti, G.V. 1908. Braconidae und Ichneumonidae.</a> <!--MARK--><!--MARK--><a href='../../../../publication/65d77daa-4f48-41d2-b744-9765eee39550' class='mouseoverHref'><em>Fauna Südwest-Australiens. Herausgegeben Von W. Michaelsen. Jena</em></a> <strong>1</strong>: 317-324<!--MARK-->","","Article in Journal","2b15817e-f308-4946-a38d-b8fb308828dc","20081009T05:11:37.000+0000","65d77daa-4f48-41d2-b744-9765eee39550"
"Taylor, G.S., Austin, A.D. & Davies, K.A.","1996","Biology of the eucalypt gall-forming fly <i>Fergusonina flavicornis</i> Malloch (Diptera: Fergusoninidae), and its associated Hymenoptera in South Australia, with a description of a new species of <i>Bracon</i> (Hymenoptera: Braconidae)","131-146","","Transactions of the Royal Society of South Australia","","","","<!--MARK--><a href='../../../../publication/688d610d-a53f-4706-85cd-394f9d180244' class='mouseoverHref'>Taylor, G.S., Austin, A.D. & Davies, K.A. 1996. Biology of the eucalypt gall-forming fly <i>Fergusonina flavicornis</i> Malloch (Diptera: Fergusoninidae), and its associated Hymenoptera in South Australia, with a description of a new species of <i>Bracon</i> (Hymenoptera: Braconidae).</a> <!--MARK--><!--MARK--><a href='../../../../publication/8b48b0a3-dd7a-4aea-be0d-10a223710ebc' class='mouseoverHref'><em>Transactions of the Royal Society of South Australia</em></a> <strong>120</strong>: 131-146<!--MARK-->","","Article in Journal","688d610d-a53f-4706-85cd-394f9d180244","20081009T05:11:37.000+0000","8b48b0a3-dd7a-4aea-be0d-10a223710ebc"
"Thomson, C.G.","1892","XLVII. Bidrag till Braconidernas Kännedom. I. Cyclostomi.","1777-1861","","Opuscula Entomologica","","","","<!--MARK--><a href='../../../../publication/79810406-6071-4e54-965b-ae991ca5589b' class='mouseoverHref'>Thomson, C.G. 1892. XLVII. Bidrag till Braconidernas Kännedom. I. Cyclostomi.</a> <!--MARK--><!--MARK--><a href='../../../../publication/a1d2a54e-e179-4996-86f9-0c0911eef64b' class='mouseoverHref'><em>Opuscula Entomologica</em></a> <strong>XVII</strong>: 1777-1861<!--MARK-->","","Article in Journal","79810406-6071-4e54-965b-ae991ca5589b","20110804T03:58:39.149+0000","a1d2a54e-e179-4996-86f9-0c0911eef64b"
"Thomson, C.G.","1894","Bidrag till Braconidernas kännedom","1777-1861","","Opuscula Entomologica. Lund","","","","<!--MARK--><a href='../../../../publication/695ca2eb-a439-43de-8f8b-8924a8dda454' class='mouseoverHref'>Thomson, C.G. 1894. Bidrag till Braconidernas kännedom.</a> <!--MARK--><!--MARK--><a href='../../../../publication/ce78610a-5b37-4cbb-920f-1f7d3e2284ec' class='mouseoverHref'><em>Opuscula Entomologica. Lund</em></a> <strong>17</strong>: 1777-1861<!--MARK-->","","Article in Journal","695ca2eb-a439-43de-8f8b-8924a8dda454","20081009T05:11:37.000+0000","ce78610a-5b37-4cbb-920f-1f7d3e2284ec"
"Tobias, V.I. in  Quicke, D.L.J. & Tobias, V.I.","1990","New genera of braconid wasps of the subfamily Braconinae (Hymenoptera, Braconidae) from Australia","164-180","","Entomologicheskoe Obozrenie (English translation as Entomological Reviews)","","","","<!--MARK--><a href='../../../../publication/86fbb671-f37b-4ed4-a257-c1707f5edaa1' class='mouseoverHref'>Tobias, V.I. <i>in</i>  Quicke, D.L.J. & Tobias, V.I. 1990. New genera of braconid wasps of the subfamily Braconinae (Hymenoptera, Braconidae) from Australia.</a> <!--MARK--><!--MARK--><a href='../../../../publication/f0f3c73b-0eee-4d43-8239-b4de88ed3ef3' class='mouseoverHref'><em>Entomologicheskoe Obozrenie (English translation as Entomological Reviews)</em></a> <strong>59</strong>: 164-180<!--MARK-->","","Article in Journal","86fbb671-f37b-4ed4-a257-c1707f5edaa1","20081009T05:11:37.000+0000","f0f3c73b-0eee-4d43-8239-b4de88ed3ef3"
