"PUB_AUTHOR","PUB_YEAR","PUB_TITLE","PUB_PAGES","PUB_PARENT_BOOK_TITLE","PUB_PARENT_JOURNAL_TITLE","PUB_PARENT_ARTICLE_TITLE","PUB_PUBLICATION_DATE","PUB_PUBLISHER","PUB_FORMATTED","PUB_QUALIFICATION","PUB_TYPE","PUBLICATION_GUID","PUBLICATION_LAST_UPDATE","PARENT_PUBLICATION_GUID"
"Turner, R.E.","1918","III. Australian Braconidae in the British Museum","91-114","","Transactions of the Royal Entomological Society of London","","","","<!--MARK--><a href='../../../../publication/e254444c-e65d-409a-9a9a-bf6a80ee5134' class='mouseoverHref'>Turner, R.E. 1918. III. Australian Braconidae in the British Museum.</a> <!--MARK--><!--MARK--><a href='../../../../publication/aa458993-1b17-4c34-bd31-d6f8224d9b7d' class='mouseoverHref'><em>Transactions of the Royal Entomological Society of London</em></a> <strong>1918</strong>: 91-114<!--MARK-->","","Article in Journal","e254444c-e65d-409a-9a9a-bf6a80ee5134","20081009T05:11:37.000+0000","aa458993-1b17-4c34-bd31-d6f8224d9b7d"
"Turner, R.E.","1919","On the Hymenoptera collected in New Caledonia by P.D. Montague in 1914.","229-240","","Annals and Magazine of Natural History","","","","<!--MARK--><a href='../../../../publication/faf35856-57fc-4a3f-9b01-dd264d5f67da' class='mouseoverHref'>Turner, R.E. 1919. On the Hymenoptera collected in New Caledonia by P.D. Montague in 1914.</a> <!--MARK--><!--MARK--><a href='../../../../publication/efa8de69-3a29-4a43-8ef2-cbefda205976' class='mouseoverHref'><em>Annals and Magazine of Natural History</em></a> <strong>3</strong>(9): 229-240<!--MARK-->","","Article in Journal","faf35856-57fc-4a3f-9b01-dd264d5f67da","20110803T03:35:41.691+0000","efa8de69-3a29-4a43-8ef2-cbefda205976"
"van Achterberg, C.","1984","Revision of the genera of Braconini with first and second metasomal tergites immovably joined (Hymenoptera: Braconidae: Braconinae)","137-164","","Tijdschrift voor Entomologie","","","","<!--MARK--><a href='../../../../publication/7315c522-9d17-4497-a756-1abb1b220852' class='mouseoverHref'>van Achterberg, C. 1984. Revision of the genera of Braconini with first and second metasomal tergites immovably joined (Hymenoptera: Braconidae: Braconinae).</a> <!--MARK--><!--MARK--><a href='../../../../publication/6b0f0fc0-01fc-4ed4-aae0-c8b621477f01' class='mouseoverHref'><em>Tijdschrift voor Entomologie</em></a> <strong>127</strong>: 137-164<!--MARK-->","","Article in Journal","7315c522-9d17-4497-a756-1abb1b220852","20081009T05:11:37.000+0000","6b0f0fc0-01fc-4ed4-aae0-c8b621477f01"
"van Achterberg, C.","1989","Four new genera of Braconinae and Rogadinae from the Oriental region (Hymenoptera: Braconidae)","79-95","","Zoologische Mededelingen (Leiden)","","","","<!--MARK--><a href='../../../../publication/0ccf2267-de33-4dbc-83cf-5f62ea57c678' class='mouseoverHref'>van Achterberg, C. 1989. Four new genera of Braconinae and Rogadinae from the Oriental region (Hymenoptera: Braconidae).</a> <!--MARK--><!--MARK--><a href='../../../../publication/42ce8f11-9401-4dfc-ae20-52feb2a315f5' class='mouseoverHref'><em>Zoologische Mededelingen (Leiden)</em></a> <strong>63</strong>: 79-95<!--MARK-->","","Article in Journal","0ccf2267-de33-4dbc-83cf-5f62ea57c678","20081009T05:11:37.000+0000","42ce8f11-9401-4dfc-ae20-52feb2a315f5"
"van Achterberg, C. & Polaszek, A.","1996","The parasites of cereal stem borers (Lepidoptera: Cossidae, Crambidae, Noctuidae, Pyralidae) in Africa, belonging to the family Braconidae (Hymenoptera: Ichneumonoidea).","1-123","","Zoologische Verhandelingen (Leiden)","","","","<!--MARK--><a href='../../../../publication/5940d2a6-3645-4b9a-87da-38d9ed89c658' class='mouseoverHref'>van Achterberg, C. & Polaszek, A. 1996. The parasites of cereal stem borers (Lepidoptera: Cossidae, Crambidae, Noctuidae, Pyralidae) in Africa, belonging to the family Braconidae (Hymenoptera: Ichneumonoidea).</a> <!--MARK--><!--MARK--><a href='../../../../publication/ef9c29c7-02e1-45c1-816e-05f980b8b1fd' class='mouseoverHref'><em>Zoologische Verhandelingen (Leiden)</em></a> <strong>304</strong>: 1-123<!--MARK-->","","Article in Journal","5940d2a6-3645-4b9a-87da-38d9ed89c658","20110517T02:32:02.003+0000","ef9c29c7-02e1-45c1-816e-05f980b8b1fd"
"Viereck, H.L.","1911","Descriptions of one new genus and eight new species of Ichneumon flies.","475-480","","Proceedings of the United States National Museum","","","","<!--MARK--><a href='../../../../publication/72712015-79de-46d7-96a5-590415b5dc70' class='mouseoverHref'>Viereck, H.L. 1911. Descriptions of one new genus and eight new species of Ichneumon flies.</a> <!--MARK--><!--MARK--><a href='../../../../publication/0e32c453-4bc6-48a2-a3a2-d40281874533' class='mouseoverHref'><em>Proceedings of the United States National Museum</em></a> <strong>40</strong>(1832): 475-480<!--MARK-->","","Article in Journal","72712015-79de-46d7-96a5-590415b5dc70","20110902T03:00:36.185+0000","0e32c453-4bc6-48a2-a3a2-d40281874533"
"Viereck, H.L.","1912","Contributions to our knowledge of bees and Ichneumon-flies including descriptions of twenty one new genera and fifty seven new species of Ichneumon-flies","613-648","","Proceedings of the United States National Museum","","","","<!--MARK--><a href='../../../../publication/e5c8e5b6-a904-47a9-befe-7c4f7997a062' class='mouseoverHref'>Viereck, H.L. 1912. Contributions to our knowledge of bees and Ichneumon-flies including descriptions of twenty one new genera and fifty seven new species of Ichneumon-flies.</a> <!--MARK--><!--MARK--><a href='../../../../publication/0e32c453-4bc6-48a2-a3a2-d40281874533' class='mouseoverHref'><em>Proceedings of the United States National Museum</em></a> <strong>42</strong>: 613-648<!--MARK-->","","Article in Journal","e5c8e5b6-a904-47a9-befe-7c4f7997a062","20110817T02:16:07.519+0000","0e32c453-4bc6-48a2-a3a2-d40281874533"
"Viereck, H.L.","1913","Descriptions of six new genera and twelve new species of Ichneumon-flies.","639-648","","Proceedings of the United States National Museum","","","","<!--MARK--><a href='../../../../publication/a4774579-c2c3-47af-9449-e8e7e0796ece' class='mouseoverHref'>Viereck, H.L. 1913. Descriptions of six new genera and twelve new species of Ichneumon-flies.</a> <!--MARK--><!--MARK--><a href='../../../../publication/0e32c453-4bc6-48a2-a3a2-d40281874533' class='mouseoverHref'><em>Proceedings of the United States National Museum</em></a> <strong>44</strong>: 639-648<!--MARK-->","","Article in Journal","a4774579-c2c3-47af-9449-e8e7e0796ece","20110517T02:45:52.625+0000","0e32c453-4bc6-48a2-a3a2-d40281874533"
"Viereck, H.L.","1913","Descriptions of ten new genera and twenty-three new species of ichneumon flies.","555-568","","Proceedings of the United States National Museum","","","","<!--MARK--><a href='../../../../publication/2e86622b-e9d2-4bde-98d8-c9a47087388d' class='mouseoverHref'>Viereck, H.L. 1913. Descriptions of ten new genera and twenty-three new species of ichneumon flies.</a> <!--MARK--><!--MARK--><a href='../../../../publication/0e32c453-4bc6-48a2-a3a2-d40281874533' class='mouseoverHref'><em>Proceedings of the United States National Museum</em></a> <strong>44</strong>: 555-568<!--MARK-->","","Article in Journal","2e86622b-e9d2-4bde-98d8-c9a47087388d","20110524T01:56:43.639+0000","0e32c453-4bc6-48a2-a3a2-d40281874533"
"Wood, J.G.","1874","Insects Abroad. Being a popular account of foreign insects, their structure, habits, and transformations.","780 pp.","","","","","Routledge","<!--MARK--><a href='../../../../publication/fcf121b6-6574-4fe9-945a-cc9b2ea39c47' class='mouseoverHref'>Wood, J.G. 1874. <em>Insects Abroad. Being a popular account of foreign insects, their structure, habits, and transformations</em>. New York : Routledge 780 pp.</a><!--MARK-->","","Book","fcf121b6-6574-4fe9-945a-cc9b2ea39c47","20110517T03:06:33.303+0000",""
