"PUB_AUTHOR","PUB_YEAR","PUB_TITLE","PUB_PAGES","PUB_PARENT_BOOK_TITLE","PUB_PARENT_JOURNAL_TITLE","PUB_PARENT_ARTICLE_TITLE","PUB_PUBLICATION_DATE","PUB_PUBLISHER","PUB_FORMATTED","PUB_QUALIFICATION","PUB_TYPE","PUBLICATION_GUID","PUBLICATION_LAST_UPDATE","PARENT_PUBLICATION_GUID"
"Cockerell, T.D.A.","1913","Descriptions and records of bees. LI","387-394","","Annals and Magazine of Natural History","","31/12/1913","","<!--MARK--><a href='../../../../publication/159e6cdd-11f9-4c36-b522-236a85001e6a' class='mouseoverHref'>Cockerell, T.D.A. 1913. Descriptions and records of bees. LI.</a> <!--MARK--><!--MARK--><a href='../../../../publication/efa8de69-3a29-4a43-8ef2-cbefda205976' class='mouseoverHref'><em>Annals and Magazine of Natural History</em></a> 8 <strong>11</strong>: 387-394<!--MARK--> [Date published 31/12/1913]","","Article in Journal","159e6cdd-11f9-4c36-b522-236a85001e6a","20081009T05:11:37.000+0000","efa8de69-3a29-4a43-8ef2-cbefda205976"
"Cockerell, T.D.A.","1914","Descriptions and records of bees. LX","1-13","","Annals and Magazine of Natural History","","31/12/1914","","<!--MARK--><a href='../../../../publication/94e3b62b-e748-4596-8b7c-4679724ef2db' class='mouseoverHref'>Cockerell, T.D.A. 1914. Descriptions and records of bees. LX.</a> <!--MARK--><!--MARK--><a href='../../../../publication/efa8de69-3a29-4a43-8ef2-cbefda205976' class='mouseoverHref'><em>Annals and Magazine of Natural History</em></a> 8 <strong>14</strong>: 1-13<!--MARK--> [Date published 31/12/1914]","","Article in Journal","94e3b62b-e748-4596-8b7c-4679724ef2db","20081009T05:11:37.000+0000","efa8de69-3a29-4a43-8ef2-cbefda205976"
"Cockerell, T.D.A.","1916","Descriptions and records of bees. LXXII","428-435","","Annals and Magazine of Natural History","","31/12/1916","","<!--MARK--><a href='../../../../publication/8e7602ec-2c35-4c02-9021-36b08b7848e3' class='mouseoverHref'>Cockerell, T.D.A. 1916. Descriptions and records of bees. LXXII.</a> <!--MARK--><!--MARK--><a href='../../../../publication/efa8de69-3a29-4a43-8ef2-cbefda205976' class='mouseoverHref'><em>Annals and Magazine of Natural History</em></a> 8 <strong>17</strong>: 428-435<!--MARK--> [Date published 31/12/1916]","","Article in Journal","8e7602ec-2c35-4c02-9021-36b08b7848e3","20081009T05:11:37.000+0000","efa8de69-3a29-4a43-8ef2-cbefda205976"
"Cockerell, T.D.A.","1922","Australian bees in the Queensland Museum","257-279","","Memoirs of the Queensland Museum","","31/12/1922","","<!--MARK--><a href='../../../../publication/4d0f47ce-896a-4c8b-bad9-b43cb25ae482' class='mouseoverHref'>Cockerell, T.D.A. 1922. Australian bees in the Queensland Museum.</a> <!--MARK--><!--MARK--><a href='../../../../publication/1a0a2982-9f30-43e1-a641-b0379699837c' class='mouseoverHref'><em>Memoirs of the Queensland Museum</em></a> <strong>7</strong>: 257-279<!--MARK--> [Date published 31/12/1922]","","Article in Journal","4d0f47ce-896a-4c8b-bad9-b43cb25ae482","20081009T05:11:37.000+0000","1a0a2982-9f30-43e1-a641-b0379699837c"
"Exley, E.M.","1968","Revision of the genus <i>Brachyhesma</i> Michener (Apoidea: Colletidae)","167-201","","Australian Journal of Zoology","","31/12/1968","","<!--MARK--><a href='../../../../publication/8821b00f-bbb4-4d25-9a64-1965acd5a681' class='mouseoverHref'>Exley, E.M. 1968. Revision of the genus <i>Brachyhesma</i> Michener (Apoidea: Colletidae).</a> <!--MARK--><!--MARK--><a href='../../../../publication/53c3abd8-0254-4532-a73e-d9ef6b7ac2ef' class='mouseoverHref'><em>Australian Journal of Zoology</em></a> <strong>16</strong>: 167-201<!--MARK--> [Date published 31/12/1968]","","Article in Journal","8821b00f-bbb4-4d25-9a64-1965acd5a681","20081009T05:11:37.000+0000","53c3abd8-0254-4532-a73e-d9ef6b7ac2ef"
"Exley, E.M.","1968","Three new species of <i>Brachyhesma</i> (Apoidea: Colletidae)","135-141","","Journal of the Australian Entomological Society","","31/12/1968","","<!--MARK--><a href='../../../../publication/44b0e918-0992-44e1-9604-1cea9136331d' class='mouseoverHref'>Exley, E.M. 1968. Three new species of <i>Brachyhesma</i> (Apoidea: Colletidae).</a> <!--MARK--><!--MARK--><a href='../../../../publication/c2544f9f-3978-4f18-846d-a1fd3122c9c4' class='mouseoverHref'><em>Journal of the Australian Entomological Society</em></a> <strong>7</strong>: 135-141<!--MARK--> [Date published 31/12/1968]","","Article in Journal","44b0e918-0992-44e1-9604-1cea9136331d","20081009T05:11:37.000+0000","c2544f9f-3978-4f18-846d-a1fd3122c9c4"
"Exley, E.M.","1969","A new species of <i>Brachyhesma</i> (Apoidea: Colletidae)","134-136","","Journal of the Australian Entomological Society","","31/12/1969","","<!--MARK--><a href='../../../../publication/5c9e6d41-f3cf-42d2-9d86-d8d59197f438' class='mouseoverHref'>Exley, E.M. 1969. A new species of <i>Brachyhesma</i> (Apoidea: Colletidae).</a> <!--MARK--><!--MARK--><a href='../../../../publication/c2544f9f-3978-4f18-846d-a1fd3122c9c4' class='mouseoverHref'><em>Journal of the Australian Entomological Society</em></a> <strong>8</strong>: 134-136<!--MARK--> [Date published 31/12/1969]","","Article in Journal","5c9e6d41-f3cf-42d2-9d86-d8d59197f438","20081009T05:11:37.000+0000","c2544f9f-3978-4f18-846d-a1fd3122c9c4"
"Exley, E.M.","1974","A contribution to our knowledge of the bee fauna (Colletidae: Euryglossinae) of remote areas of Australia with descriptions of new species","95-110","","Proceedings of the Royal Society of Queensland","","31/12/1974","","<!--MARK--><a href='../../../../publication/deb2714c-9f2c-4758-aca1-5bcaed8411be' class='mouseoverHref'>Exley, E.M. 1974. A contribution to our knowledge of the bee fauna (Colletidae: Euryglossinae) of remote areas of Australia with descriptions of new species.</a> <!--MARK--><!--MARK--><a href='../../../../publication/642ab613-813a-48d0-8bc0-42c78157f7b0' class='mouseoverHref'><em>Proceedings of the Royal Society of Queensland</em></a> <strong>85</strong>: 95-110<!--MARK--> [Date published 31/12/1974]","","Article in Journal","deb2714c-9f2c-4758-aca1-5bcaed8411be","20081009T05:11:37.000+0000","642ab613-813a-48d0-8bc0-42c78157f7b0"
"Exley, E.M.","1975","New species and records of <i>Brachyhesma</i> Michener (Apoidea: Colletidae: Euryglossinae)","139-144","","Journal of the Australian Entomological Society","","31/12/1975","","<!--MARK--><a href='../../../../publication/902333cd-9488-472d-9e02-441df717af47' class='mouseoverHref'>Exley, E.M. 1975. New species and records of <i>Brachyhesma</i> Michener (Apoidea: Colletidae: Euryglossinae).</a> <!--MARK--><!--MARK--><a href='../../../../publication/c2544f9f-3978-4f18-846d-a1fd3122c9c4' class='mouseoverHref'><em>Journal of the Australian Entomological Society</em></a> <strong>14</strong>: 139-144<!--MARK--> [Date published 31/12/1975]","","Article in Journal","902333cd-9488-472d-9e02-441df717af47","20081009T05:11:37.000+0000","c2544f9f-3978-4f18-846d-a1fd3122c9c4"
"Exley, E.M.","1977","The Australian genus <i>Brachyhesma</i> (Apoidea: Colletidae) revised and reviewed","1-54","","Australian Journal of Zoology Supplementary Series","","31/12/1977","","<!--MARK--><a href='../../../../publication/b68d035c-3487-4f0e-867b-49cb75288e68' class='mouseoverHref'>Exley, E.M. 1977. The Australian genus <i>Brachyhesma</i> (Apoidea: Colletidae) revised and reviewed.</a> <!--MARK--><!--MARK--><a href='../../../../publication/0cf8bdc8-2852-42c3-824a-7d9a708d9672' class='mouseoverHref'><em>Australian Journal of Zoology Supplementary Series</em></a> <strong>53</strong>: 1-54<!--MARK--> [Date published 31/12/1977]","","Article in Journal","b68d035c-3487-4f0e-867b-49cb75288e68","20081009T05:11:37.000+0000","0cf8bdc8-2852-42c3-824a-7d9a708d9672"
"Houston, T.F.","1969","Observations on the nests and behaviour of some euryglossine bees (Hymenoptera: Colletidae)","1-10","","Journal of the Australian Entomological Society","","31/12/1969","","<!--MARK--><a href='../../../../publication/ecfff990-1f92-41d6-b22b-4a06c2d6b33b' class='mouseoverHref'>Houston, T.F. 1969. Observations on the nests and behaviour of some euryglossine bees (Hymenoptera: Colletidae).</a> <!--MARK--><!--MARK--><a href='../../../../publication/c2544f9f-3978-4f18-846d-a1fd3122c9c4' class='mouseoverHref'><em>Journal of the Australian Entomological Society</em></a> <strong>8</strong>: 1-10<!--MARK--> [Date published 31/12/1969]","","Article in Journal","ecfff990-1f92-41d6-b22b-4a06c2d6b33b","20081009T05:11:37.000+0000","c2544f9f-3978-4f18-846d-a1fd3122c9c4"
"Michener, C.D.","1965","A classification of the bees of the Australian and South Pacific regions","1-362","","Bulletin of the American Museum of Natural History","","31/12/1965","","<!--MARK--><a href='../../../../publication/7aa6a188-fe74-475e-bafa-0d2be2f3da97' class='mouseoverHref'>Michener, C.D. 1965. A classification of the bees of the Australian and South Pacific regions.</a> <!--MARK--><!--MARK--><a href='../../../../publication/fb7ce990-e955-4634-bf04-a37f265e0778' class='mouseoverHref'><em>Bulletin of the American Museum of Natural History</em></a> <strong>130</strong>: 1-362<!--MARK--> [Date published 31/12/1965]","","Article in Journal","7aa6a188-fe74-475e-bafa-0d2be2f3da97","20081009T05:11:37.000+0000","fb7ce990-e955-4634-bf04-a37f265e0778"
"Michener, C.D.","1992","Sexual dimorphism in the glossa of Colletidae (Hymenoptera, Apoidea)","1-9","","Journal of the Kansas Entomological Society","","31/12/1992","","<!--MARK--><a href='../../../../publication/a836d807-86e2-4aaa-b2b1-20c008aa5528' class='mouseoverHref'>Michener, C.D. 1992. Sexual dimorphism in the glossa of Colletidae (Hymenoptera, Apoidea).</a> <!--MARK--><!--MARK--><a href='../../../../publication/8f5f2114-1781-49c1-8d11-d45a29514f22' class='mouseoverHref'><em>Journal of the Kansas Entomological Society</em></a> <strong>65</strong>: 1-9<!--MARK--> [Date published 31/12/1992]","","Article in Journal","a836d807-86e2-4aaa-b2b1-20c008aa5528","20081009T05:11:37.000+0000","8f5f2114-1781-49c1-8d11-d45a29514f22"
"Michener, C.D. & Brooks, R.W.","1984","A comparative study of the glossae of bees (Apoidea)","1-73","","Contributions of the American Entomological Institute","","31/12/1984","","<!--MARK--><a href='../../../../publication/e5244f95-645f-488d-b93c-6bc0453c3882' class='mouseoverHref'>Michener, C.D. & Brooks, R.W. 1984. A comparative study of the glossae of bees (Apoidea).</a> <!--MARK--><!--MARK--><a href='../../../../publication/8c1fb8e6-94de-469a-8245-eca2d021ea10' class='mouseoverHref'><em>Contributions of the American Entomological Institute</em></a> <strong>22</strong>: 1-73<!--MARK--> [Date published 31/12/1984]","","Article in Journal","e5244f95-645f-488d-b93c-6bc0453c3882","20081009T05:11:37.000+0000","8c1fb8e6-94de-469a-8245-eca2d021ea10"
"Rayment, T.","1928","A new prosopoid bee","97-98","","Victorian Naturalist","","31/12/1928","","<!--MARK--><a href='../../../../publication/e4da7253-8bb3-462f-a6af-a6cd43f4e0e3' class='mouseoverHref'>Rayment, T. 1928. A new prosopoid bee.</a> <!--MARK--><!--MARK--><a href='../../../../publication/97b8093b-d60f-43a6-94fc-97de34f03b6b' class='mouseoverHref'><em>Victorian Naturalist</em></a> <strong>45</strong>: 97-98<!--MARK--> [Date published 31/12/1928]","","Article in Journal","e4da7253-8bb3-462f-a6af-a6cd43f4e0e3","20081009T05:11:37.000+0000","97b8093b-d60f-43a6-94fc-97de34f03b6b"
"Rayment, T.","1934","Contributions to the fauna of Rottnest Island. VIII. Apoidea. With description of new species","201-212","","Journal and Proceedings of the Royal Society of Western Australia","","31/12/1934","","<!--MARK--><a href='../../../../publication/c722288d-0ecb-4015-9b40-77a841b37c97' class='mouseoverHref'>Rayment, T. 1934. Contributions to the fauna of Rottnest Island. VIII. Apoidea. With description of new species.</a> <!--MARK--><!--MARK--><a href='../../../../publication/6d0a243e-835c-41cd-8202-41a5fa2dd983' class='mouseoverHref'><em>Journal and Proceedings of the Royal Society of Western Australia</em></a> <strong>20</strong>: 201-212<!--MARK--> [Date published 31/12/1934]","","Article in Journal","c722288d-0ecb-4015-9b40-77a841b37c97","20081009T05:11:37.000+0000","6d0a243e-835c-41cd-8202-41a5fa2dd983"
"Rayment, T.","1935","<i>A Cluster of Bees.</i> Sixty essays on the life-histories of Australian bees, with specific descriptions of over 100 new species, and an introduction by Professor E.F. Phillips, D.Ph., Cornell University, U.S.A","752 pp.","","","","31/12/1935","","<!--MARK--><a href='../../../../publication/77c31cc2-9b14-4f83-a536-4d7b783fdfb8' class='mouseoverHref'>Rayment, T. 1935. <i>A Cluster of Bees.</i> Sixty essays on the life-histories of Australian bees, with specific descriptions of over 100 new species, and an introduction by Professor E.F. Phillips, D.Ph., Cornell University, U.S.A. Sydney : Endeavour Press. 752 pp.</a>","","Miscellaneous","77c31cc2-9b14-4f83-a536-4d7b783fdfb8","20081009T05:11:37.000+0000",""
