"PUB_AUTHOR","PUB_YEAR","PUB_TITLE","PUB_PAGES","PUB_PARENT_BOOK_TITLE","PUB_PARENT_JOURNAL_TITLE","PUB_PARENT_ARTICLE_TITLE","PUB_PUBLICATION_DATE","PUB_PUBLISHER","PUB_FORMATTED","PUB_QUALIFICATION","PUB_TYPE","PUBLICATION_GUID","PUBLICATION_LAST_UPDATE","PARENT_PUBLICATION_GUID"
"Ashton, D.","1975","Studies of flowering behaviour in <i>Eucalyptus regnans</i> F. Muell","399-411","","Australian Journal of Botany","","31/12/1975","","<!--MARK--><a href='../../../../publication/a39bb414-db92-43da-9b1a-008087acbacb' class='mouseoverHref'>Ashton, D. 1975. Studies of flowering behaviour in <i>Eucalyptus regnans</i> F. Muell.</a> <!--MARK--><!--MARK--><a href='../../../../publication/e54121fc-9302-40bf-b981-7140f31d7a05' class='mouseoverHref'><em>Australian Journal of Botany</em></a> <strong>23</strong>: 399-411<!--MARK--> [Date published 31/12/1975]","","Article in Journal","a39bb414-db92-43da-9b1a-008087acbacb","20081009T05:11:37.000+0000","e54121fc-9302-40bf-b981-7140f31d7a05"
"Bernhardt, P.","1987","A comparison of the diversity, density, and foraging behavior of bees and wasps on Australian <i>Acacia</i>","42-50","","Annals of the Missouri Botanical Gardens","","31/12/1987","","<!--MARK--><a href='../../../../publication/981a2bae-c4e6-49eb-987d-84e45233080a' class='mouseoverHref'>Bernhardt, P. 1987. A comparison of the diversity, density, and foraging behavior of bees and wasps on Australian <i>Acacia</i>.</a> <!--MARK--><!--MARK--><a href='../../../../publication/9edd03b0-3de4-4590-b257-3e1d5345ab7c' class='mouseoverHref'><em>Annals of the Missouri Botanical Gardens</em></a> <strong>74</strong>: 42-50<!--MARK--> [Date published 31/12/1987]","","Article in Journal","981a2bae-c4e6-49eb-987d-84e45233080a","20081009T05:11:37.000+0000","9edd03b0-3de4-4590-b257-3e1d5345ab7c"
"Cockerell, T.D.A.","1905","Descriptions and records of bees. II","292-301","","Annals and Magazine of Natural History","","31/12/1905","","<!--MARK--><a href='../../../../publication/56669b47-5316-4677-a0c1-1b4b85d574db' class='mouseoverHref'>Cockerell, T.D.A. 1905. Descriptions and records of bees. II.</a> <!--MARK--><!--MARK--><a href='../../../../publication/efa8de69-3a29-4a43-8ef2-cbefda205976' class='mouseoverHref'><em>Annals and Magazine of Natural History</em></a> 7 <strong>16</strong>: 292-301<!--MARK--> [Date published 31/12/1905]","","Article in Journal","56669b47-5316-4677-a0c1-1b4b85d574db","20081009T05:11:37.000+0000","efa8de69-3a29-4a43-8ef2-cbefda205976"
"Cockerell, T.D.A.","1905","Notes on some bees in the British Museum","309-364","","Transactions of the American Entomological Society","","31/12/1905","","<!--MARK--><a href='../../../../publication/e0b8ebe1-06ae-404f-ad4d-2a3230c1354e' class='mouseoverHref'>Cockerell, T.D.A. 1905. Notes on some bees in the British Museum.</a> <!--MARK--><!--MARK--><a href='../../../../publication/ab463570-432f-4c53-bc7c-2254ed8f75b1' class='mouseoverHref'><em>Transactions of the American Entomological Society</em></a> <strong>31</strong>: 309-364<!--MARK--> [Date published 31/12/1905]","","Article in Journal","e0b8ebe1-06ae-404f-ad4d-2a3230c1354e","20081009T05:11:37.000+0000","ab463570-432f-4c53-bc7c-2254ed8f75b1"
"Cockerell, T.D.A.","1907","On a collection of Australian and Asiatic bees","221-236","","Bulletin of the American Museum of Natural History","","31/12/1907","","<!--MARK--><a href='../../../../publication/7844e451-00ea-4b6b-846d-867240d4b310' class='mouseoverHref'>Cockerell, T.D.A. 1907. On a collection of Australian and Asiatic bees.</a> <!--MARK--><!--MARK--><a href='../../../../publication/fb7ce990-e955-4634-bf04-a37f265e0778' class='mouseoverHref'><em>Bulletin of the American Museum of Natural History</em></a> <strong>23</strong>: 221-236<!--MARK--> [Date published 31/12/1907]","","Article in Journal","7844e451-00ea-4b6b-846d-867240d4b310","20081009T05:11:37.000+0000","fb7ce990-e955-4634-bf04-a37f265e0778"
"Cockerell, T.D.A.","1910","Descriptions and records of bees. XXXIII","356-366","","Annals and Magazine of Natural History","","31/12/1910","","<!--MARK--><a href='../../../../publication/b788414e-60a5-4113-84a7-892ded319fbb' class='mouseoverHref'>Cockerell, T.D.A. 1910. Descriptions and records of bees. XXXIII.</a> <!--MARK--><!--MARK--><a href='../../../../publication/efa8de69-3a29-4a43-8ef2-cbefda205976' class='mouseoverHref'><em>Annals and Magazine of Natural History</em></a> 8 <strong>6</strong>: 356-366<!--MARK--> [Date published 31/12/1910]","","Article in Journal","b788414e-60a5-4113-84a7-892ded319fbb","20081009T05:11:37.000+0000","efa8de69-3a29-4a43-8ef2-cbefda205976"
"Cockerell, T.D.A.","1910","Some Australian bees in the Berlin Museum","98-114","","Journal of the New York Entomological Society","","31/12/1910","","<!--MARK--><a href='../../../../publication/ca478cf8-6e7f-4ec1-9026-2ad5b29a71ec' class='mouseoverHref'>Cockerell, T.D.A. 1910. Some Australian bees in the Berlin Museum.</a> <!--MARK--><!--MARK--><a href='../../../../publication/0d6a7797-deb7-4a30-94e8-5146f853482d' class='mouseoverHref'><em>Journal of the New York Entomological Society</em></a> <strong>18</strong>: 98-114<!--MARK--> [Date published 31/12/1910]","","Article in Journal","ca478cf8-6e7f-4ec1-9026-2ad5b29a71ec","20081009T05:11:37.000+0000","0d6a7797-deb7-4a30-94e8-5146f853482d"
"Cockerell, T.D.A.","1914","New Australian bees","197-201","","The Entomologist","","31/12/1914","","<!--MARK--><a href='../../../../publication/075b375b-5555-4219-8101-69ec1fc46469' class='mouseoverHref'>Cockerell, T.D.A. 1914. New Australian bees.</a> <!--MARK--><!--MARK--><a href='../../../../publication/f3b5bc68-9fcf-42d6-b01d-f490d96af7e9' class='mouseoverHref'><em>The Entomologist</em></a> <strong>47</strong>: 197-201<!--MARK--> [Date published 31/12/1914]","","Article in Journal","075b375b-5555-4219-8101-69ec1fc46469","20081009T05:11:37.000+0000","f3b5bc68-9fcf-42d6-b01d-f490d96af7e9"
"Cockerell, T.D.A.","1914","Some Tasmanian bees","305-308","","The Entomologist","","31/12/1914","","<!--MARK--><a href='../../../../publication/98b51b99-a6a5-4178-9215-c9620eca4c2a' class='mouseoverHref'>Cockerell, T.D.A. 1914. Some Tasmanian bees.</a> <!--MARK--><!--MARK--><a href='../../../../publication/f3b5bc68-9fcf-42d6-b01d-f490d96af7e9' class='mouseoverHref'><em>The Entomologist</em></a> <strong>47</strong>: 305-308<!--MARK--> [Date published 31/12/1914]","","Article in Journal","98b51b99-a6a5-4178-9215-c9620eca4c2a","20081009T05:11:37.000+0000","f3b5bc68-9fcf-42d6-b01d-f490d96af7e9"
"Cockerell, T.D.A.","1915","Descriptions and records of bees. LXVI","341-350","","Annals and Magazine of Natural History","","31/12/1915","","<!--MARK--><a href='../../../../publication/5fc0d85e-c0d7-4927-a0a8-be34bff27a39' class='mouseoverHref'>Cockerell, T.D.A. 1915. Descriptions and records of bees. LXVI.</a> <!--MARK--><!--MARK--><a href='../../../../publication/efa8de69-3a29-4a43-8ef2-cbefda205976' class='mouseoverHref'><em>Annals and Magazine of Natural History</em></a> 8 <strong>15</strong>: 341-350<!--MARK--> [Date published 31/12/1915]","","Article in Journal","5fc0d85e-c0d7-4927-a0a8-be34bff27a39","20081009T05:11:37.000+0000","efa8de69-3a29-4a43-8ef2-cbefda205976"
"Cockerell, T.D.A.","1916","Some bees from Australia, Tasmania and the New Hebrides","360-375","","Proceedings of the Academy of Natural Sciences, Philadelphia","","31/12/1916","","<!--MARK--><a href='../../../../publication/8a8e0c12-f862-448c-9c07-64a6f7135737' class='mouseoverHref'>Cockerell, T.D.A. 1916. Some bees from Australia, Tasmania and the New Hebrides.</a> <!--MARK--><!--MARK--><a href='../../../../publication/9dfe7fba-63cc-4968-b0be-a8904006864b' class='mouseoverHref'><em>Proceedings of the Academy of Natural Sciences, Philadelphia</em></a> <strong>68</strong>: 360-375<!--MARK--> [Date published 31/12/1916]","","Article in Journal","8a8e0c12-f862-448c-9c07-64a6f7135737","20081009T05:11:37.000+0000","9dfe7fba-63cc-4968-b0be-a8904006864b"
"Cockerell, T.D.A.","1918","Descriptions and records of bees. LXXIX","158-167","","Annals and Magazine of Natural History","","31/12/1918","","<!--MARK--><a href='../../../../publication/9fc19387-78da-4e0c-a443-716b699cfd12' class='mouseoverHref'>Cockerell, T.D.A. 1918. Descriptions and records of bees. LXXIX.</a> <!--MARK--><!--MARK--><a href='../../../../publication/efa8de69-3a29-4a43-8ef2-cbefda205976' class='mouseoverHref'><em>Annals and Magazine of Natural History</em></a> 9 <strong>1</strong>: 158-167<!--MARK--> [Date published 31/12/1918]","","Article in Journal","9fc19387-78da-4e0c-a443-716b699cfd12","20081009T05:11:37.000+0000","efa8de69-3a29-4a43-8ef2-cbefda205976"
"Cockerell, T.D.A.","1921","Australian bees in the Queensland Museum","81-98","","Memoirs of the Queensland Museum","","31/12/1921","","<!--MARK--><a href='../../../../publication/80580cab-ee78-48ae-a279-96cea557f069' class='mouseoverHref'>Cockerell, T.D.A. 1921. Australian bees in the Queensland Museum.</a> <!--MARK--><!--MARK--><a href='../../../../publication/1a0a2982-9f30-43e1-a641-b0379699837c' class='mouseoverHref'><em>Memoirs of the Queensland Museum</em></a> <strong>7</strong>: 81-98<!--MARK--> [Date published 31/12/1921]","","Article in Journal","80580cab-ee78-48ae-a279-96cea557f069","20081009T05:11:37.000+0000","1a0a2982-9f30-43e1-a641-b0379699837c"
"Cockerell, T.D.A.","1922","Australian bees in the Queensland Museum","257-279","","Memoirs of the Queensland Museum","","31/12/1922","","<!--MARK--><a href='../../../../publication/4d0f47ce-896a-4c8b-bad9-b43cb25ae482' class='mouseoverHref'>Cockerell, T.D.A. 1922. Australian bees in the Queensland Museum.</a> <!--MARK--><!--MARK--><a href='../../../../publication/1a0a2982-9f30-43e1-a641-b0379699837c' class='mouseoverHref'><em>Memoirs of the Queensland Museum</em></a> <strong>7</strong>: 257-279<!--MARK--> [Date published 31/12/1922]","","Article in Journal","4d0f47ce-896a-4c8b-bad9-b43cb25ae482","20081009T05:11:37.000+0000","1a0a2982-9f30-43e1-a641-b0379699837c"
"Cockerell, T.D.A.","1929","Bees, chiefly Australian species, described or determined by Dr. H. Friese","1-20","","American Museum Novitates","","31/12/1929","","<!--MARK--><a href='../../../../publication/9c14799e-bbd5-44fe-969e-1d8d4f8bec2b' class='mouseoverHref'>Cockerell, T.D.A. 1929. Bees, chiefly Australian species, described or determined by Dr. H. Friese.</a> <!--MARK--><!--MARK--><a href='../../../../publication/6502b0bb-309f-414e-9d7f-4cb7a3619a03' class='mouseoverHref'><em>American Museum Novitates</em></a> <strong>343</strong>: 1-20<!--MARK--> [Date published 31/12/1929: publication date Cockerell, T.D.A. 1929. Bees in the Australian Museum collection. <em>Records of the Australian Museum</em> <strong>17</strong>: 199-243 [211]]","publication date Cockerell, T.D.A. 1929. Bees in the Australian Museum collection. <em>Records of the Australian Museum</em> <strong>17</strong>: 199-243 [211]","Article in Journal","9c14799e-bbd5-44fe-969e-1d8d4f8bec2b","20081009T05:11:37.000+0000","6502b0bb-309f-414e-9d7f-4cb7a3619a03"
"Cockerell, T.D.A.","1929","Bees from the Australian region","1-18","","American Museum Novitates","","31/12/1929","","<!--MARK--><a href='../../../../publication/f190d4dd-6979-47e8-b8fd-8b7737a94dc9' class='mouseoverHref'>Cockerell, T.D.A. 1929. Bees from the Australian region.</a> <!--MARK--><!--MARK--><a href='../../../../publication/6502b0bb-309f-414e-9d7f-4cb7a3619a03' class='mouseoverHref'><em>American Museum Novitates</em></a> <strong>346</strong>: 1-18<!--MARK--> [Date published 31/12/1929]","","Article in Journal","f190d4dd-6979-47e8-b8fd-8b7737a94dc9","20081009T05:11:37.000+0000","6502b0bb-309f-414e-9d7f-4cb7a3619a03"
"Friese, H.","1924","Ueber die Bienen Australiens","216-249","","Konowia","","31/12/1924","","<!--MARK--><a href='../../../../publication/dab2ebc1-7d79-4bf0-a537-953e1e6c871c' class='mouseoverHref'>Friese, H. 1924. Ueber die Bienen Australiens.</a> <!--MARK--><!--MARK--><a href='../../../../publication/9df36453-5359-4047-a0f8-0f14546f9508' class='mouseoverHref'><em>Konowia</em></a> <strong>3</strong>: 216-249<!--MARK--> [Date published 31/12/1924]","","Article in Journal","dab2ebc1-7d79-4bf0-a537-953e1e6c871c","20081009T05:11:37.000+0000","9df36453-5359-4047-a0f8-0f14546f9508"
"Hingston, A.B.","1998","Temporal and spatial variation in abundances of native bee species on an altitudinal gradient in southern Tasmania","497-507","","Australian Journal of Zoology","","","","<!--MARK--><a href='../../../../publication/7418c1d7-ea01-4453-8f14-9796ade90212' class='mouseoverHref'>Hingston, A.B. 1998. Temporal and spatial variation in abundances of native bee species on an altitudinal gradient in southern Tasmania.</a> <!--MARK--><!--MARK--><a href='../../../../publication/53c3abd8-0254-4532-a73e-d9ef6b7ac2ef' class='mouseoverHref'><em>Australian Journal of Zoology</em></a> <strong>46</strong>: 497-507<!--MARK-->","","Article in Journal","7418c1d7-ea01-4453-8f14-9796ade90212","20081009T05:11:37.000+0000","53c3abd8-0254-4532-a73e-d9ef6b7ac2ef"
"Hingston, A.B.","1999","Affinities between southern Tasmanian plants in native bee visitor profiles","361-384","","Australian Journal of Zoology","","","","<!--MARK--><a href='../../../../publication/df301b4e-fd58-45d7-9529-cac4b4a12cdc' class='mouseoverHref'>Hingston, A.B. 1999. Affinities between southern Tasmanian plants in native bee visitor profiles.</a> <!--MARK--><!--MARK--><a href='../../../../publication/53c3abd8-0254-4532-a73e-d9ef6b7ac2ef' class='mouseoverHref'><em>Australian Journal of Zoology</em></a> <strong>47</strong>: 361-384<!--MARK-->","","Article in Journal","df301b4e-fd58-45d7-9529-cac4b4a12cdc","20081009T05:11:37.000+0000","53c3abd8-0254-4532-a73e-d9ef6b7ac2ef"
"Michener, C.D.","1965","A classification of the bees of the Australian and South Pacific regions","1-362","","Bulletin of the American Museum of Natural History","","31/12/1965","","<!--MARK--><a href='../../../../publication/7aa6a188-fe74-475e-bafa-0d2be2f3da97' class='mouseoverHref'>Michener, C.D. 1965. A classification of the bees of the Australian and South Pacific regions.</a> <!--MARK--><!--MARK--><a href='../../../../publication/fb7ce990-e955-4634-bf04-a37f265e0778' class='mouseoverHref'><em>Bulletin of the American Museum of Natural History</em></a> <strong>130</strong>: 1-362<!--MARK--> [Date published 31/12/1965]","","Article in Journal","7aa6a188-fe74-475e-bafa-0d2be2f3da97","20081009T05:11:37.000+0000","fb7ce990-e955-4634-bf04-a37f265e0778"
"Michener, C.D.","1992","Sexual dimorphism in the glossa of Colletidae (Hymenoptera, Apoidea)","1-9","","Journal of the Kansas Entomological Society","","31/12/1992","","<!--MARK--><a href='../../../../publication/a836d807-86e2-4aaa-b2b1-20c008aa5528' class='mouseoverHref'>Michener, C.D. 1992. Sexual dimorphism in the glossa of Colletidae (Hymenoptera, Apoidea).</a> <!--MARK--><!--MARK--><a href='../../../../publication/8f5f2114-1781-49c1-8d11-d45a29514f22' class='mouseoverHref'><em>Journal of the Kansas Entomological Society</em></a> <strong>65</strong>: 1-9<!--MARK--> [Date published 31/12/1992]","","Article in Journal","a836d807-86e2-4aaa-b2b1-20c008aa5528","20081009T05:11:37.000+0000","8f5f2114-1781-49c1-8d11-d45a29514f22"
"Michener, C.D. & Fraser, A.","1978","A comparative anatomical study of mandibular structure in bees","463-482","","University of Kansas Science Bulletin","","31/12/1978","","<!--MARK--><a href='../../../../publication/20c10120-79e5-49bc-bf1d-3f18c72b2f6e' class='mouseoverHref'>Michener, C.D. & Fraser, A. 1978. A comparative anatomical study of mandibular structure in bees.</a> <!--MARK--><!--MARK--><a href='../../../../publication/7c07be04-00d9-4cee-8f3f-6928daa83699' class='mouseoverHref'><em>University of Kansas Science Bulletin</em></a> <strong>51</strong>: 463-482<!--MARK--> [Date published 31/12/1978]","","Article in Journal","20c10120-79e5-49bc-bf1d-3f18c72b2f6e","20081009T05:11:37.000+0000","7c07be04-00d9-4cee-8f3f-6928daa83699"
"Rayment, T.","1929","Bees from East Gippsland","124-129","","Victorian Naturalist","","31/12/1929","","<!--MARK--><a href='../../../../publication/e729c940-ce8c-4ddc-9a9a-9e1fffc852c3' class='mouseoverHref'>Rayment, T. 1929. Bees from East Gippsland.</a> <!--MARK--><!--MARK--><a href='../../../../publication/97b8093b-d60f-43a6-94fc-97de34f03b6b' class='mouseoverHref'><em>Victorian Naturalist</em></a> <strong>46</strong>: 124-129<!--MARK--> [Date published 31/12/1929]","","Article in Journal","e729c940-ce8c-4ddc-9a9a-9e1fffc852c3","20081009T05:11:37.000+0000","97b8093b-d60f-43a6-94fc-97de34f03b6b"
"Rayment, T.","1929","Studies of Australian bees. The red bees","240-243","","Victorian Naturalist","","31/12/1929","","<!--MARK--><a href='../../../../publication/04c60647-e203-468a-87a5-f3156a27ef70' class='mouseoverHref'>Rayment, T. 1929. Studies of Australian bees. The red bees.</a> <!--MARK--><!--MARK--><a href='../../../../publication/97b8093b-d60f-43a6-94fc-97de34f03b6b' class='mouseoverHref'><em>Victorian Naturalist</em></a> <strong>45</strong>: 240-243<!--MARK--> [Date published 31/12/1929]","","Article in Journal","04c60647-e203-468a-87a5-f3156a27ef70","20081009T05:11:37.000+0000","97b8093b-d60f-43a6-94fc-97de34f03b6b"
"Rayment, T.","1935","<i>A Cluster of Bees.</i> Sixty essays on the life-histories of Australian bees, with specific descriptions of over 100 new species, and an introduction by Professor E.F. Phillips, D.Ph., Cornell University, U.S.A","752 pp.","","","","31/12/1935","","<!--MARK--><a href='../../../../publication/77c31cc2-9b14-4f83-a536-4d7b783fdfb8' class='mouseoverHref'>Rayment, T. 1935. <i>A Cluster of Bees.</i> Sixty essays on the life-histories of Australian bees, with specific descriptions of over 100 new species, and an introduction by Professor E.F. Phillips, D.Ph., Cornell University, U.S.A. Sydney : Endeavour Press. 752 pp.</a>","","Miscellaneous","77c31cc2-9b14-4f83-a536-4d7b783fdfb8","20081009T05:11:37.000+0000",""
"Rayment, T.","1949","New bees and wasps--Part XII. A new blue bee and an old white-ant","147-151","","Victorian Naturalist","","31/12/1949","","<!--MARK--><a href='../../../../publication/ef0608bb-52b9-41f3-b3dc-4656634d727c' class='mouseoverHref'>Rayment, T. 1949. New bees and wasps--Part XII. A new blue bee and an old white-ant.</a> <!--MARK--><!--MARK--><a href='../../../../publication/97b8093b-d60f-43a6-94fc-97de34f03b6b' class='mouseoverHref'><em>Victorian Naturalist</em></a> <strong>66</strong>: 147-151<!--MARK--> [Date published 31/12/1949]","","Article in Journal","ef0608bb-52b9-41f3-b3dc-4656634d727c","20081009T05:11:37.000+0000","97b8093b-d60f-43a6-94fc-97de34f03b6b"
"Rayment, T.","1953","Bees of the Portland District","39 pp.","","","","31/12/1953","Portland Field Naturalist's Club","<!--MARK--><a href='../../../../publication/0fbf8d91-fa7c-4525-ad5f-5b7cd2cbb58a' class='mouseoverHref'>Rayment, T. 1953. <em>Bees of the Portland District</em>. Victoria : Portland Field Naturalist's Club 39 pp.</a><!--MARK--> [Date published 31/12/1953]","","Book","0fbf8d91-fa7c-4525-ad5f-5b7cd2cbb58a","20081009T05:11:37.000+0000",""
"Rayment, T.","1954","Remarkable bees from a rain forest","46-56","","The Australian Zoologist","","31/12/1954","","<!--MARK--><a href='../../../../publication/cccd94f8-ec20-4b56-ac47-5b2e16391181' class='mouseoverHref'>Rayment, T. 1954. Remarkable bees from a rain forest.</a> <!--MARK--><!--MARK--><a href='../../../../publication/48148530-5362-4b4a-a304-7ea21fe0d6b7' class='mouseoverHref'><em>The Australian Zoologist</em></a> <strong>12</strong>: 46-56<!--MARK--> [Date published 31/12/1954]","","Article in Journal","cccd94f8-ec20-4b56-ac47-5b2e16391181","20081009T05:11:37.000+0000","48148530-5362-4b4a-a304-7ea21fe0d6b7"
"Sichel, J.","1865","Révision monographique, critique et synonymique du genre mellifère <i>Sphecodes</i> Latr., basé sur la méthode numérique; avec des remarques sur les moeurs des Sphécodes comme insectes nidifiants et non parasites","397-466","","Annales de la Société Entomologique de France","","31/12/1865","","<!--MARK--><a href='../../../../publication/0a096e7b-93ca-4c1b-8f22-03c2b904287a' class='mouseoverHref'>Sichel, J. 1865. Révision monographique, critique et synonymique du genre mellifère <i>Sphecodes</i> Latr., basé sur la méthode numérique; avec des remarques sur les moeurs des Sphécodes comme insectes nidifiants et non parasites.</a> <!--MARK--><!--MARK--><a href='../../../../publication/6462279b-2aaf-46a3-a434-cab7d8a2c33d' class='mouseoverHref'><em>Annales de la Société Entomologique de France</em></a> 4 <strong>5</strong>: 397-466<!--MARK--> [Date published 31/12/1865]","","Article in Journal","0a096e7b-93ca-4c1b-8f22-03c2b904287a","20081009T05:11:37.000+0000","6462279b-2aaf-46a3-a434-cab7d8a2c33d"
"Smith, F.","1853","Catalogue of Hymenopterous Insects in the Collection of the British Museum. <i>Part I. Andrenidae and Apidae</i>","197 pp.","","","","31/12/1853","British Museum","<!--MARK--><a href='../../../../publication/d09c1015-0a70-4acb-8eac-ba1d7d2319ec' class='mouseoverHref'>Smith, F. 1853. <em>Catalogue of Hymenopterous Insects in the Collection of the British Museum. <i>Part I. Andrenidae and Apidae</i></em>. London : British Museum 197 pp.</a><!--MARK--> [Date published 31/12/1853]","","Book","d09c1015-0a70-4acb-8eac-ba1d7d2319ec","20081009T05:11:37.000+0000",""
"Williams, G.A. & Adam, P.","1997","The composition of the bee (Apoidea: Hymenoptera) fauna visiting flowering trees in New South Wales lowland subtropical rainforest remnants","69-95","","Proceedings of the Linnean Society of New South Wales","","","","<!--MARK--><a href='../../../../publication/9286513a-9c20-4cdc-b305-27aa5af6bc25' class='mouseoverHref'>Williams, G.A. & Adam, P. 1997. The composition of the bee (Apoidea: Hymenoptera) fauna visiting flowering trees in New South Wales lowland subtropical rainforest remnants.</a> <!--MARK--><!--MARK--><a href='../../../../publication/c12cd779-adb5-41ea-bd2c-75f6864cf22e' class='mouseoverHref'><em>Proceedings of the Linnean Society of New South Wales</em></a> <strong>118</strong>: 69-95<!--MARK-->","","Article in Journal","9286513a-9c20-4cdc-b305-27aa5af6bc25","20081009T05:11:37.000+0000","c12cd779-adb5-41ea-bd2c-75f6864cf22e"
