"PUB_AUTHOR","PUB_YEAR","PUB_TITLE","PUB_PAGES","PUB_PARENT_BOOK_TITLE","PUB_PARENT_JOURNAL_TITLE","PUB_PARENT_ARTICLE_TITLE","PUB_PUBLICATION_DATE","PUB_PUBLISHER","PUB_FORMATTED","PUB_QUALIFICATION","PUB_TYPE","PUBLICATION_GUID","PUBLICATION_LAST_UPDATE","PARENT_PUBLICATION_GUID"
"Common, I.F.B.","1997","Oecophorine genera of Australia. II. The <i>Chezala, Philobota</i> and <i>Eulechria</i> groups (Lepidoptera: Oecophoridae)","i-xvi, 1-407","","Monographs on Australian Lepidoptera","","","","<!--MARK--><a href='null09020d1e-f6aa-4c39-a11a-cb313ac5ba68' class='mouseoverHref'>Common, I.F.B. 1997. Oecophorine genera of Australia. II. The <i>Chezala, Philobota</i> and <i>Eulechria</i> groups (Lepidoptera: Oecophoridae).</a> <!--MARK--><!--MARK--><a href='null3820f42d-af14-449e-a37e-97e94dd8d1ce' class='mouseoverHref'><em>Monographs on Australian Lepidoptera</em></a> <strong>5</strong>: i-xvi, 1-407<!--MARK-->","","Article in Journal","09020d1e-f6aa-4c39-a11a-cb313ac5ba68","20081009T05:11:37.000+0000","3820f42d-af14-449e-a37e-97e94dd8d1ce"
"Meyrick, E.","1913","<i>Exotic Microlepidoptera</i>","","","","","","","<!--MARK--><a href='null20afeedc-f697-4154-968a-7a132af53b09' class='mouseoverHref'>Meyrick, E. 1913. <i>Exotic Microlepidoptera</i>. Vol. <B>1</B>(3-5): 65-96, 97-128, 129-160.</a>","","Miscellaneous","20afeedc-f697-4154-968a-7a132af53b09","20130729T03:22:22.333+0000",""
"Meyrick, E.","1920","<i>Exotic Microlepidoptera</i>","","","","","","","<!--MARK--><a href='null01c7fc63-39ec-439f-b66b-5a7cd1933107' class='mouseoverHref'>Meyrick, E. 1920. <i>Exotic Microlepidoptera</i>. Vol. <B>2</B>(10-12): 189-384.</a>","","Miscellaneous","01c7fc63-39ec-439f-b66b-5a7cd1933107","20120306T21:57:05.942+0000",""
"Turner, A.J.","1938","Revision of Australian Lepidoptera. Oecophoridae. VII","27-54","","Proceedings of the Linnean Society of New South Wales","","","","<!--MARK--><a href='nulla2974da8-882d-450d-95be-2ee4b90b8ae8' class='mouseoverHref'>Turner, A.J. 1938. Revision of Australian Lepidoptera. Oecophoridae. VII.</a> <!--MARK--><!--MARK--><a href='nullc12cd779-adb5-41ea-bd2c-75f6864cf22e' class='mouseoverHref'><em>Proceedings of the Linnean Society of New South Wales</em></a> <strong>63</strong>: 27-54<!--MARK-->","","Article in Journal","a2974da8-882d-450d-95be-2ee4b90b8ae8","20081009T05:11:37.000+0000","c12cd779-adb5-41ea-bd2c-75f6864cf22e"
"Turner, A.J.","1944","Revision of the Australian Lepidoptera. Oecophoridae. XII","253-273","","Proceedings of the Linnean Society of New South Wales","","","","<!--MARK--><a href='nullc8ee731b-91bc-4144-82f6-9f2a0917661a' class='mouseoverHref'>Turner, A.J. 1944. Revision of the Australian Lepidoptera. Oecophoridae. XII.</a> <!--MARK--><!--MARK--><a href='nullc12cd779-adb5-41ea-bd2c-75f6864cf22e' class='mouseoverHref'><em>Proceedings of the Linnean Society of New South Wales</em></a> <strong>69</strong>: 253-273<!--MARK-->","","Article in Journal","c8ee731b-91bc-4144-82f6-9f2a0917661a","20081009T05:11:37.000+0000","c12cd779-adb5-41ea-bd2c-75f6864cf22e"
