"PUB_AUTHOR","PUB_YEAR","PUB_TITLE","PUB_PAGES","PUB_PARENT_BOOK_TITLE","PUB_PARENT_JOURNAL_TITLE","PUB_PARENT_ARTICLE_TITLE","PUB_PUBLICATION_DATE","PUB_PUBLISHER","PUB_FORMATTED","PUB_QUALIFICATION","PUB_TYPE","PUBLICATION_GUID","PUBLICATION_LAST_UPDATE","PARENT_PUBLICATION_GUID"
"Bellamy, C.L.","2002","Coleoptera: Buprestoidea","pp. XII 491 +4 colour pls","","","","","","<!--MARK--><a href='null7a4e3958-14a2-4a1e-88bb-eed7ba49876c' class='mouseoverHref'>Bellamy, C.L. 2002. Coleoptera: Buprestoidea. <I>In </I>Houston, W.W.K. (ed.) <I>Zoological Catalogue of Australia. Volume 29.5</I>. Melbourne : CSIRO Publishing, Australia. pp. XII 491 +4 colour pls</a>","","Miscellaneous","7a4e3958-14a2-4a1e-88bb-eed7ba49876c","20100921T22:47:14.466+0000",""
"Bellamy, C.L., Williams, G.A., Hasenpusch, J. & Sundholm, A.","2013","A summary of the published data on host plants and morphology of immature stages of Australian jewel beetles (Coleoptera: Buprestidae), with additional new records","1-172","","Insecta Mundi","","","","<!--MARK--><a href='null4a53ce12-d067-4403-b97f-113bbc37be8f' class='mouseoverHref'>Bellamy, C.L., Williams, G.A., Hasenpusch, J. & Sundholm, A. 2013. A summary of the published data on host plants and morphology of immature stages of Australian jewel beetles (Coleoptera: Buprestidae), with additional new records.</a> <!--MARK--><!--MARK--><a href='null21f84ce0-1a36-4082-a807-ecacc5afb744' class='mouseoverHref'><em>Insecta Mundi</em></a> <strong>0293</strong>: 1-172<!--MARK-->","","Article in Journal","4a53ce12-d067-4403-b97f-113bbc37be8f","20170308T07:19:55.274+0000","21f84ce0-1a36-4082-a807-ecacc5afb744"
"Blackburn, T.","1895","Further notes on Australian Coleoptera with descriptions of new genera and species. Part XVII","27-60","","Transactions of the Royal Society of South Australia","","Jul., 1895","","<!--MARK--><a href='null0a432953-84ea-43ae-8307-ce4ca8f6cd14' class='mouseoverHref'>Blackburn, T. 1895. Further notes on Australian Coleoptera with descriptions of new genera and species. Part XVII.</a> <!--MARK--><!--MARK--><a href='null8b48b0a3-dd7a-4aea-be0d-10a223710ebc' class='mouseoverHref'><em>Transactions of the Royal Society of South Australia</em></a> <strong>19</strong>: 27-60<!--MARK--> [Date published Jul., 1895]","","Article in Journal","0a432953-84ea-43ae-8307-ce4ca8f6cd14","20081009T05:11:37.000+0000","8b48b0a3-dd7a-4aea-be0d-10a223710ebc"
"Britton, E.B. & Stanbury, P.J.","1981","Type specimens in the Macleay Museum, University of Sydney. VIII. Insects: Beetles (Insecta: Coleoptera)","241-293","","Proceedings of the Linnean Society of New South Wales","","","","<!--MARK--><a href='null48e6cf4c-3337-471e-8fbd-33e72df05a22' class='mouseoverHref'>Britton, E.B. & Stanbury, P.J. 1981. Type specimens in the Macleay Museum, University of Sydney. VIII. Insects: Beetles (Insecta: Coleoptera).</a> <!--MARK--><!--MARK--><a href='nullc12cd779-adb5-41ea-bd2c-75f6864cf22e' class='mouseoverHref'><em>Proceedings of the Linnean Society of New South Wales</em></a> <strong>105</strong>(4): 241-293<!--MARK-->","","Article in Journal","48e6cf4c-3337-471e-8fbd-33e72df05a22","20081009T05:11:37.000+0000","c12cd779-adb5-41ea-bd2c-75f6864cf22e"
"Burns, G.G. & Burns, A.J.","1992","The distribution of Victorian jewel beetles (Coleoptera: Buprestidae) - an ENTRECS project","1-53","","Occasional Papers of the Museum of Victoria","","","","<!--MARK--><a href='null7371027d-6bd2-49ec-be53-37556124ece2' class='mouseoverHref'>Burns, G.G. & Burns, A.J. 1992. The distribution of Victorian jewel beetles (Coleoptera: Buprestidae) - an ENTRECS project.</a> <!--MARK--><!--MARK--><a href='nullcdd01b00-8de7-4463-89a2-450d27bc4256' class='mouseoverHref'><em>Occasional Papers of the Museum of Victoria</em></a> <strong>5</strong>: 1-53<!--MARK-->","","Article in Journal","7371027d-6bd2-49ec-be53-37556124ece2","20081009T05:11:37.000+0000","cdd01b00-8de7-4463-89a2-450d27bc4256"
"Carter, H.J.","1925","Revision of the Australian species of <i>Chrysobothris</i> (Fam. Buprestidae), together with notes and descriptions of new species of Coleoptera","225-244","","Proceedings of the Linnean Society of New South Wales","","","","<!--MARK--><a href='null1950eebf-c010-4d3d-9fa5-1abbf12c7877' class='mouseoverHref'>Carter, H.J. 1925. Revision of the Australian species of <i>Chrysobothris</i> (Fam. Buprestidae), together with notes and descriptions of new species of Coleoptera.</a> <!--MARK--><!--MARK--><a href='nullc12cd779-adb5-41ea-bd2c-75f6864cf22e' class='mouseoverHref'><em>Proceedings of the Linnean Society of New South Wales</em></a> <strong>50</strong>: 225-244<!--MARK-->","","Article in Journal","1950eebf-c010-4d3d-9fa5-1abbf12c7877","","c12cd779-adb5-41ea-bd2c-75f6864cf22e"
"Carter, H.J.","1927","Australian Coleoptera: Notes and new species. No. v","222-234","","Proceedings of the Linnean Society of New South Wales","","","","<!--MARK--><a href='nullb1dbb0c4-583c-4f9f-9c21-bdbcea661a38' class='mouseoverHref'>Carter, H.J. 1927. Australian Coleoptera: Notes and new species. No. v.</a> <!--MARK--><!--MARK--><a href='nullc12cd779-adb5-41ea-bd2c-75f6864cf22e' class='mouseoverHref'><em>Proceedings of the Linnean Society of New South Wales</em></a> <strong>52</strong>(2): 222-234<!--MARK-->","","Article in Journal","b1dbb0c4-583c-4f9f-9c21-bdbcea661a38","20130319T03:04:29.048+0000","c12cd779-adb5-41ea-bd2c-75f6864cf22e"
"Carter, H.J.","1929","A check list of the Australian Buprestidae. With tables and keys to sub-families, tribes, and genera (by A. Théry)","265-304","","The Australian Zoologist","","24 Mar 1929","","<!--MARK--><a href='nullffb0f112-a5c2-465a-9d40-0c596d20a3f9' class='mouseoverHref'>Carter, H.J. 1929. A check list of the Australian Buprestidae. With tables and keys to sub-families, tribes, and genera (by A. Théry).</a> <!--MARK--><!--MARK--><a href='null48148530-5362-4b4a-a304-7ea21fe0d6b7' class='mouseoverHref'><em>The Australian Zoologist</em></a> <strong>5</strong>(4): 265-304<!--MARK--> [Date published 24 Mar 1929]","","Article in Journal","ffb0f112-a5c2-465a-9d40-0c596d20a3f9","20130319T03:02:12.553+0000","48148530-5362-4b4a-a304-7ea21fe0d6b7"
"Carter, H.J.","1932","New Guinea and Australian Coleoptera. Notes and new species. No. 2","101-115","","Proceedings of the Linnean Society of New South Wales","","","","<!--MARK--><a href='nulle8d4073f-4a66-42c2-b5a6-6be5666f0d1d' class='mouseoverHref'>Carter, H.J. 1932. New Guinea and Australian Coleoptera. Notes and new species. No. 2.</a> <!--MARK--><!--MARK--><a href='nullc12cd779-adb5-41ea-bd2c-75f6864cf22e' class='mouseoverHref'><em>Proceedings of the Linnean Society of New South Wales</em></a> <strong>57</strong>(3-4): 101-115<!--MARK-->","","Article in Journal","e8d4073f-4a66-42c2-b5a6-6be5666f0d1d","20081009T05:11:37.000+0000","c12cd779-adb5-41ea-bd2c-75f6864cf22e"
"Carter, H.J.","1940","Australian Buprestidae and the Junk Catalogue","380-389","","Annals and Magazine of Natural History","","","","<!--MARK--><a href='nullee6b67f8-5ab7-42bb-b1fd-2e6221c5ec62' class='mouseoverHref'>Carter, H.J. 1940. Australian Buprestidae and the Junk Catalogue.</a> <!--MARK--><!--MARK--><a href='nullefa8de69-3a29-4a43-8ef2-cbefda205976' class='mouseoverHref'><em>Annals and Magazine of Natural History</em></a> 11 <strong>6</strong>: 380-389<!--MARK-->","","Article in Journal","ee6b67f8-5ab7-42bb-b1fd-2e6221c5ec62","20081009T05:11:37.000+0000","efa8de69-3a29-4a43-8ef2-cbefda205976"
"Eschscholtz, J.F.","1829","Abbildungen und Beschreibungen neuer Theierarten, während des Flottcapitains v. Kotzebue zweiter Reise um die Welt, auf der Russisch-Kaiserlichen Kriegsschlupp Predpriaetië in den Jahren 1823-1826","1-17","","Zoologischer Atlas","","","","<!--MARK--><a href='null54f52900-35bd-46fb-aed8-02e0e913dc34' class='mouseoverHref'>Eschscholtz, J.F. 1829. Abbildungen und Beschreibungen neuer Theierarten, während des Flottcapitains v. Kotzebue zweiter Reise um die Welt, auf der Russisch-Kaiserlichen Kriegsschlupp Predpriaetië in den Jahren 1823-1826.</a> <!--MARK--><!--MARK--><a href='nullad1e272b-7ce8-4f43-856e-8db7be9f1aaa' class='mouseoverHref'><em>Zoologischer Atlas</em></a> <strong>1</strong>: 1-17<!--MARK-->","","Article in Journal","54f52900-35bd-46fb-aed8-02e0e913dc34","20081009T05:11:37.000+0000","ad1e272b-7ce8-4f43-856e-8db7be9f1aaa"
"Gory, H.L.","1841","Histoire naturelle et iconographie des insectes Coléoptères. Supplement aux Buprestides. genera: <i>Melanophila</i> (pp. 73-77), <i>Buprestis</i> (pp. 107-111, 126), pp. 127-356, <i>Stigmodera, Colobogaster, Chrysobothris, Belionota, Castalia, Poecilonota, Zemina, Stenogaster, Agrilus, Amorphosoma, Eumerus, Coraebus, Anthaxia, Evagora, Sphenoptera, Sponsor, Brachys, Trachys, Aphanisticus</i>","73-356 pp.","","","","","P. Duménil","<!--MARK--><a href='null92cdcea9-26ed-4f3d-8b85-004c6f9bf218' class='mouseoverHref'>Gory, H.L. 1841. <em>Histoire naturelle et iconographie des insectes Coléoptères. Supplement aux Buprestides. genera: <i>Melanophila</i> (pp. 73-77), <i>Buprestis</i> (pp. 107-111, 126), pp. 127-356, <i>Stigmodera, Colobogaster, Chrysobothris, Belionota, Castalia, Poecilonota, Zemina, Stenogaster, Agrilus, Amorphosoma, Eumerus, Coraebus, Anthaxia, Evagora, Sphenoptera, Sponsor, Brachys, Trachys, Aphanisticus</i></em>. Paris : P. Duménil Vol. 4(43-52) 73-356 pp.</a><!--MARK-->","","Book","92cdcea9-26ed-4f3d-8b85-004c6f9bf218","20110124T05:31:46.025+0000",""
"Gory, H.L. & Laporte de Castelnau, F.L.","1837","Histoire naturelle et iconographie des insectes Coléoptères. Monographie des buprestides. genera: <i>Colobogaster, Chrysobothris, Agrilus</i>; (genera paged separately)","","","","","","P. Duménil","<!--MARK--><a href='nulla39b1663-3522-4e24-8f67-e273f6b0d1ca' class='mouseoverHref'>Gory, H.L. & Laporte de Castelnau, F.L. 1837. <em>Histoire naturelle et iconographie des insectes Coléoptères. Monographie des buprestides. genera: <i>Colobogaster, Chrysobothris, Agrilus</i>; (genera paged separately)</em>. Paris : P. Duménil Vol. 2(12-16).</a><!--MARK-->","","Book","a39b1663-3522-4e24-8f67-e273f6b0d1ca","20100208T23:04:48.208+0000",""
"Hawkeswood, T.J.","1986","A new species of <i>Chrysobothris</i> (Coleoptera, Buprestidae, Chrysobothrinae) from Townsville, northern Queensland, Australia","167-172","","Giornale Italiano di Entomologia","","","","<!--MARK--><a href='nullbb0de85c-8b97-4c08-9570-5d5ce18ad6d9' class='mouseoverHref'>Hawkeswood, T.J. 1986. A new species of <i>Chrysobothris</i> (Coleoptera, Buprestidae, Chrysobothrinae) from Townsville, northern Queensland, Australia.</a> <!--MARK--><!--MARK--><a href='null782d12b6-572a-4d6a-825c-7fa2ab71ae79' class='mouseoverHref'><em>Giornale Italiano di Entomologia</em></a> <strong>3</strong>: 167-172<!--MARK--> [30 Apr. 1986]","30 Apr. 1986","Article in Journal","bb0de85c-8b97-4c08-9570-5d5ce18ad6d9","","782d12b6-572a-4d6a-825c-7fa2ab71ae79"
"Hawkeswood, T.J.","1986","New larval host records for eight Australian jewel beetles (Coleoptera: Buprestidae)","173-177","","Giornale Italiano di Entomologia","","","","<!--MARK--><a href='null54a5e48f-b443-4c11-8d1c-f5b6204fc50b' class='mouseoverHref'>Hawkeswood, T.J. 1986. New larval host records for eight Australian jewel beetles (Coleoptera: Buprestidae).</a> <!--MARK--><!--MARK--><a href='null782d12b6-572a-4d6a-825c-7fa2ab71ae79' class='mouseoverHref'><em>Giornale Italiano di Entomologia</em></a> <strong>3</strong>: 173-177<!--MARK-->","","Article in Journal","54a5e48f-b443-4c11-8d1c-f5b6204fc50b","20081009T05:11:37.000+0000","782d12b6-572a-4d6a-825c-7fa2ab71ae79"
"Hawkeswood, T.J.","1988","A review of larval host records for twelve Australian Buprestidae (Coleoptera)","81-88","","Giornale Italiano di Entomologia","","","","<!--MARK--><a href='null36e4683a-62ad-49e6-bf21-a685f76ecf77' class='mouseoverHref'>Hawkeswood, T.J. 1988. A review of larval host records for twelve Australian Buprestidae (Coleoptera).</a> <!--MARK--><!--MARK--><a href='null782d12b6-572a-4d6a-825c-7fa2ab71ae79' class='mouseoverHref'><em>Giornale Italiano di Entomologia</em></a> <strong>4</strong>: 81-88<!--MARK-->","","Article in Journal","36e4683a-62ad-49e6-bf21-a685f76ecf77","20081009T05:11:37.000+0000","782d12b6-572a-4d6a-825c-7fa2ab71ae79"
"Hawkeswood, T. J.","1988","A review of larval host records for twelve Australian Buprestidae (Coleoptera)","81-88","","Giornale Italiano di Entomologia","","","","<!--MARK--><a href='null0c831da2-88ad-467a-b458-14ec88f50f72' class='mouseoverHref'>Hawkeswood, T. J. 1988. A review of larval host records for twelve Australian Buprestidae (Coleoptera).</a> <!--MARK--><!--MARK--><a href='null782d12b6-572a-4d6a-825c-7fa2ab71ae79' class='mouseoverHref'><em>Giornale Italiano di Entomologia</em></a> <strong>4</strong>: 81-88<!--MARK-->","","Article in Journal","0c831da2-88ad-467a-b458-14ec88f50f72","20130405T06:01:05.840+0000","782d12b6-572a-4d6a-825c-7fa2ab71ae79"
"Hawkeswood, T.J.","1990","A survey of the jewel beetles (Coleoptera: Buprestidae) from the Townsville district, northern Queensland, Australia","23-30","","Giornale Italiano di Entomologia","","","","<!--MARK--><a href='null38fd7eac-d1ea-48ae-934f-393b25490be8' class='mouseoverHref'>Hawkeswood, T.J. 1990. A survey of the jewel beetles (Coleoptera: Buprestidae) from the Townsville district, northern Queensland, Australia.</a> <!--MARK--><!--MARK--><a href='null782d12b6-572a-4d6a-825c-7fa2ab71ae79' class='mouseoverHref'><em>Giornale Italiano di Entomologia</em></a> <strong>5</strong>: 23-30<!--MARK-->","","Article in Journal","38fd7eac-d1ea-48ae-934f-393b25490be8","20081009T05:11:37.000+0000","782d12b6-572a-4d6a-825c-7fa2ab71ae79"
"Hawkeswood, T.J.","1997","A new species of the genus <i>Chrysobothris</i> Eschscholtz (Coleoptera: Buprestidae) from Australia","345-349","","Giornale Italiano di Entomologia","","","","<!--MARK--><a href='null61fd6cdd-509e-4299-b76c-c623e8486a09' class='mouseoverHref'>Hawkeswood, T.J. 1997. A new species of the genus <i>Chrysobothris</i> Eschscholtz (Coleoptera: Buprestidae) from Australia.</a> <!--MARK--><!--MARK--><a href='null782d12b6-572a-4d6a-825c-7fa2ab71ae79' class='mouseoverHref'><em>Giornale Italiano di Entomologia</em></a> <strong>7</strong>: 345-349<!--MARK-->","","Article in Journal","61fd6cdd-509e-4299-b76c-c623e8486a09","20081009T05:11:37.000+0000","782d12b6-572a-4d6a-825c-7fa2ab71ae79"
"Hawkeswood, T.J.","2006","Review of the biology of four Australian species of the genus <i>Chrysobothris</i> Eschscholtz, 1829 (Coleoptera: Buprestidae)","42-44","","Calodema","","","","<!--MARK--><a href='null1347c08d-79fa-4d49-90d0-000923a756bb' class='mouseoverHref'>Hawkeswood, T.J. 2006. Review of the biology of four Australian species of the genus <i>Chrysobothris</i> Eschscholtz, 1829 (Coleoptera: Buprestidae).</a> <!--MARK--><!--MARK--><a href='null6719e256-cd44-4cc2-9b3c-586abb3e7b54' class='mouseoverHref'><em>Calodema</em></a> <strong>8</strong>: 42-44<!--MARK-->","","Article in Journal","1347c08d-79fa-4d49-90d0-000923a756bb","20130610T04:34:32.762+0000","6719e256-cd44-4cc2-9b3c-586abb3e7b54"
"Hawkeswood, T.J. & Peterson, M.","1982","A review of larval host records for Australian jewel beetles (Coleoptera: Buprestidae)","240-251","","Victorian Naturalist","","","","<!--MARK--><a href='nullda6a34d2-69cb-4654-a3e0-a2cdeb35be31' class='mouseoverHref'>Hawkeswood, T.J. & Peterson, M. 1982. A review of larval host records for Australian jewel beetles (Coleoptera: Buprestidae).</a> <!--MARK--><!--MARK--><a href='null97b8093b-d60f-43a6-94fc-97de34f03b6b' class='mouseoverHref'><em>Victorian Naturalist</em></a> <strong>99</strong>: 240-251<!--MARK-->","","Article in Journal","da6a34d2-69cb-4654-a3e0-a2cdeb35be31","20081009T05:11:37.000+0000","97b8093b-d60f-43a6-94fc-97de34f03b6b"
"Hawkeswood, T.J. & Turner, J.R.","1997","The taxonomy, biology and distribution of the Australian jewel beetle <i>Chrysobothris saundersi</i> Macleay (Insecta, Coleoptera, Buprestidae)","141-149","","Spixiana (Munich)","","","","<!--MARK--><a href='null3abcd318-2298-4c08-bb8a-cbbaf3459a8c' class='mouseoverHref'>Hawkeswood, T.J. & Turner, J.R. 1997. The taxonomy, biology and distribution of the Australian jewel beetle <i>Chrysobothris saundersi</i> Macleay (Insecta, Coleoptera, Buprestidae).</a> <!--MARK--><!--MARK--><a href='nullce825dec-bfed-4bd4-81bc-3368e292b581' class='mouseoverHref'><em>Spixiana (Munich)</em></a> <strong>20</strong>(2): 141-149<!--MARK-->","","Article in Journal","3abcd318-2298-4c08-bb8a-cbbaf3459a8c","20081009T05:11:37.000+0000","ce825dec-bfed-4bd4-81bc-3368e292b581"
"Hope, F.W.","1846","Descriptions of new species of Buprestidae from New Holland","62-65","","Annals and Magazine of Natural History","","","","<!--MARK--><a href='nullf01817b0-573a-46d1-98b9-e502ad45645d' class='mouseoverHref'>Hope, F.W. 1846. Descriptions of new species of Buprestidae from New Holland.</a> <!--MARK--><!--MARK--><a href='nullefa8de69-3a29-4a43-8ef2-cbefda205976' class='mouseoverHref'><em>Annals and Magazine of Natural History</em></a> <strong>17</strong>: 62-65<!--MARK-->","","Article in Journal","f01817b0-573a-46d1-98b9-e502ad45645d","20081009T05:11:37.000+0000","efa8de69-3a29-4a43-8ef2-cbefda205976"
"Hope, F.W.","1846","Descriptions of new species of Buprestidae from New Holland, chiefly collected by D. E. Fortnum, Esq","208-220","","Transactions of the Entomological Society of London","","2 Mar. 1846","","<!--MARK--><a href='nulla9f3eed5-1c80-4380-90d2-c3d100474eb9' class='mouseoverHref'>Hope, F.W. 1846. Descriptions of new species of Buprestidae from New Holland, chiefly collected by D. E. Fortnum, Esq.</a> <!--MARK--><!--MARK--><a href='null5cf355b3-abc5-451e-9abc-ed3282d7811a' class='mouseoverHref'><em>Transactions of the Entomological Society of London</em></a> <strong>4</strong>: 208-220<!--MARK--> [Date published 2 Mar. 1846]","","Article in Journal","a9f3eed5-1c80-4380-90d2-c3d100474eb9","20140119T22:44:24.307+0000","5cf355b3-abc5-451e-9abc-ed3282d7811a"
"Kerremans, C.","1898","Buprestides nouveaux de l'Australie et des régiones voisines","113-182","","Annales de la Société Entomologique de Belgique (Comptes-rendus)","","","","<!--MARK--><a href='nulle0159bb7-9a8b-408a-b38a-f424f3e9549b' class='mouseoverHref'>Kerremans, C. 1898. Buprestides nouveaux de l'Australie et des régiones voisines.</a> <!--MARK--><!--MARK--><a href='nullacc7fcdb-707a-4cbe-8f70-d7595ac25c58' class='mouseoverHref'><em>Annales de la Société Entomologique de Belgique (Comptes-rendus)</em></a> <strong>42</strong>: 113-182<!--MARK-->","","Article in Journal","e0159bb7-9a8b-408a-b38a-f424f3e9549b","20081009T05:11:37.000+0000","acc7fcdb-707a-4cbe-8f70-d7595ac25c58"
"Kerremans, C.","1903","Coleoptera, Fam. Buprestidae","49-338","Genera Insectorum","","","","","<!--MARK--><a href='nullfcf35f5e-ca2e-44ee-ae82-df28a819535b' class='mouseoverHref'>Kerremans, C. 1903. Coleoptera, Fam. Buprestidae. pp. 49-338</a> <!--MARK--><em>in</em> <!--MARK--><a href='null0b34e01e-8aba-4388-921b-d1e59fba4cde' class='mouseoverHref'>Wytsman, P. (ed.). <em>Genera Insectorum</em>. Bruxelles : Verteneuil & Desmet Vol. 12b-d.</a><!--MARK-->","","Chapter in Book","fcf35f5e-ca2e-44ee-ae82-df28a819535b","20081009T05:11:37.000+0000","0b34e01e-8aba-4388-921b-d1e59fba4cde"
"Lacordaire, J.T.","1857","Histoire naturelle des insectes. Genera des Coléoptères ou exposé méthodique de critique de tous les genres proposés jusqu'ici dans cet ordre d'insectes","554 pp.","","","","","Roret","<!--MARK--><a href='null3412cf36-8641-4715-a108-ca35170b1bf3' class='mouseoverHref'>Lacordaire, J.T. 1857. <em>Histoire naturelle des insectes. Genera des Coléoptères ou exposé méthodique de critique de tous les genres proposés jusqu'ici dans cet ordre d'insectes</em>. Paris : Roret Vol. 4 554 pp.</a><!--MARK-->","","Book","3412cf36-8641-4715-a108-ca35170b1bf3","20081009T05:11:37.000+0000",""
"Laporte de Castelnau, F.L. & Gory, H.L.","1835","Histoire Naturelle et Iconographie des Insectes Coléoptères. Monographie des Buprestides. Sternocera, Julodis, Acmaeodera, Chrysochroa, Chrysodema, Ptosima","","","","","","P. Duménil","<!--MARK--><a href='null948da16c-2591-49ab-bfc5-d19c55c2a9fe' class='mouseoverHref'>Laporte de Castelnau, F.L. & Gory, H.L. 1835. <em>Histoire Naturelle et Iconographie des Insectes Coléoptères. Monographie des Buprestides. Sternocera, Julodis, Acmaeodera, Chrysochroa, Chrysodema, Ptosima</em>. Paris : P. Duménil Vol. 1(1-7).</a><!--MARK-->","","Book","948da16c-2591-49ab-bfc5-d19c55c2a9fe","20190124T04:48:10.072+0000",""
"Laporte de Castelnau, F.L. & Gory, H.L.","1836","Histoire Naturelle et Iconographie des Insectes Coléoptères. Monographie des Buprestides. Histoire naturelle de iconographie des insectes Coléoptères. Monographie des buprestides. Bubastes, Aurigena, Capnodis, Buprestis","64 pp.","","","","","P. Duménil","<!--MARK--><a href='nulld7a81efb-d1d2-4816-b742-3d9345233217' class='mouseoverHref'>Laporte de Castelnau, F.L. & Gory, H.L. 1836. <em>Histoire Naturelle et Iconographie des Insectes Coléoptères. Monographie des Buprestides. Histoire naturelle de iconographie des insectes Coléoptères. Monographie des buprestides. Bubastes, Aurigena, Capnodis, Buprestis</em>. Paris : P. Duménil Vol. 1(8-11) 64 pp.</a><!--MARK-->","","Book","d7a81efb-d1d2-4816-b742-3d9345233217","20190124T04:47:55.059+0000",""
"Laporte de Castelnau, F.L. & Gory, H.L.","1837","Histoire Naturelle et Iconographie des Insectes Coléoptères. Monographie des Buprestides. Histoire naturelle de iconographie des insectes Coléoptères. Monographie des buprestides. Buprestis, Nascio, Acherusia, Asthraeus, Bulis, Acantha, Apatura","65-160 pp.","","","","","P. Duménil","<!--MARK--><a href='null7cab1195-4505-4d83-8462-323d19f9acca' class='mouseoverHref'>Laporte de Castelnau, F.L. & Gory, H.L. 1837. <em>Histoire Naturelle et Iconographie des Insectes Coléoptères. Monographie des Buprestides. Histoire naturelle de iconographie des insectes Coléoptères. Monographie des buprestides. Buprestis, Nascio, Acherusia, Asthraeus, Bulis, Acantha, Apatura</em>. Paris : P. Duménil Vol. 1(12-16) 65-160 pp.</a><!--MARK-->","","Book","7cab1195-4505-4d83-8462-323d19f9acca","20190124T04:47:41.987+0000",""
"Macleay, W.J.","1872","Notes on a collection of insects from Gayndah. Second paper","239-318","","Transactions of the Entomological Society of New South Wales","","","","<!--MARK--><a href='null6319486a-42f4-4129-aaae-8d90903d90a2' class='mouseoverHref'>Macleay, W.J. 1872. Notes on a collection of insects from Gayndah. Second paper.</a> <!--MARK--><!--MARK--><a href='null69b821b6-f09d-44b0-ae3f-0e6c294b532e' class='mouseoverHref'><em>Transactions of the Entomological Society of New South Wales</em></a> <strong>2</strong>(4): 239-318<!--MARK-->","","Article in Journal","6319486a-42f4-4129-aaae-8d90903d90a2","20081009T05:11:37.000+0000","69b821b6-f09d-44b0-ae3f-0e6c294b532e"
"Macleay, W.J.","1888","The insects of the vicinity of King's Sound, N.W. Australia. Part III.-The Sternoxes, Family Buprestidae","1227-1246","","Proceedings of the Linnean Society of New South Wales","","Dec. 7, 1888","","<!--MARK--><a href='null03e6bd85-4787-4fff-874e-b196239d1296' class='mouseoverHref'>Macleay, W.J. 1888. The insects of the vicinity of King's Sound, N.W. Australia. Part III.-The Sternoxes, Family Buprestidae.</a> <!--MARK--><!--MARK--><a href='nullc12cd779-adb5-41ea-bd2c-75f6864cf22e' class='mouseoverHref'><em>Proceedings of the Linnean Society of New South Wales</em></a> 2 <strong>3</strong>(3): 1227-1246<!--MARK--> [Date published Dec. 7, 1888]","","Article in Journal","03e6bd85-4787-4fff-874e-b196239d1296","20130410T22:02:04.789+0000","c12cd779-adb5-41ea-bd2c-75f6864cf22e"
"Masters, G.","1886","Catalogue of the described Coleoptera of Australia. Part III. Lucanidae and Scarabaeidae","21-126","","Proceedings of the Linnean Society of New South Wales","","","","<!--MARK--><a href='null10ac3176-1b8b-40d1-9acd-fee3dc68231e' class='mouseoverHref'>Masters, G. 1886. Catalogue of the described Coleoptera of Australia. Part III. Lucanidae and Scarabaeidae.</a> <!--MARK--><!--MARK--><a href='nullc12cd779-adb5-41ea-bd2c-75f6864cf22e' class='mouseoverHref'><em>Proceedings of the Linnean Society of New South Wales</em></a> 2 <strong>1</strong>: 21-126<!--MARK-->","","Article in Journal","10ac3176-1b8b-40d1-9acd-fee3dc68231e","20081009T05:11:37.000+0000","c12cd779-adb5-41ea-bd2c-75f6864cf22e"
"Matthews, E.G.","1985","A guide to the genera of beetles of South Australia, Part 4 Polyphaga: Byrrhoidea, Buprestoidea, Dyropoidea, Elateroidea, Cantharoidea, Derodontoidea, and Bostrichoidea","1-68","","South Australian Museum, Special Education Bulletin","","","","<!--MARK--><a href='null1cada913-5d73-4659-b387-14403f1a717d' class='mouseoverHref'>Matthews, E.G. 1985. A guide to the genera of beetles of South Australia, Part 4 Polyphaga: Byrrhoidea, Buprestoidea, Dyropoidea, Elateroidea, Cantharoidea, Derodontoidea, and Bostrichoidea.</a> <!--MARK--><!--MARK--><a href='null9048d040-9473-4180-92f2-49518e3cd950' class='mouseoverHref'><em>South Australian Museum, Special Education Bulletin</em></a> <strong>7</strong>: 1-68<!--MARK-->","","Article in Journal","1cada913-5d73-4659-b387-14403f1a717d","20081009T05:11:37.000+0000","9048d040-9473-4180-92f2-49518e3cd950"
"Obenberger, J.","1923","Description of new Australian Buprestidae","72-81","","Acta Entomologica Musei Nationalis Pragae","","","","<!--MARK--><a href='null9b04afb4-1f49-40c9-8a92-1f896d02a8e9' class='mouseoverHref'>Obenberger, J. 1923. Description of new Australian Buprestidae.</a> <!--MARK--><!--MARK--><a href='null800acc84-1853-4834-bb99-26053db41072' class='mouseoverHref'><em>Acta Entomologica Musei Nationalis Pragae</em></a> <strong>1</strong>: 72-81<!--MARK-->","","Article in Journal","9b04afb4-1f49-40c9-8a92-1f896d02a8e9","20081009T05:11:37.000+0000","800acc84-1853-4834-bb99-26053db41072"
