"PUB_AUTHOR","PUB_YEAR","PUB_TITLE","PUB_PAGES","PUB_PARENT_BOOK_TITLE","PUB_PARENT_JOURNAL_TITLE","PUB_PARENT_ARTICLE_TITLE","PUB_PUBLICATION_DATE","PUB_PUBLISHER","PUB_FORMATTED","PUB_QUALIFICATION","PUB_TYPE","PUBLICATION_GUID","PUBLICATION_LAST_UPDATE","PARENT_PUBLICATION_GUID"
"Obenberger, J.","1928","Opuscula Buprestologica I. Beiträge zur Kenntnis der Buprestiden (Col.)","1-350","","Archiv für Naturgeschichte","","","","<!--MARK--><a href='null10629a92-83b4-4b6d-a2df-b5d589aea388' class='mouseoverHref'>Obenberger, J. 1928. Opuscula Buprestologica I. Beiträge zur Kenntnis der Buprestiden (Col.).</a> <!--MARK--><!--MARK--><a href='nullf5b5f7c7-fc53-4502-951d-1c96b680d874' class='mouseoverHref'><em>Archiv für Naturgeschichte</em></a> <strong>92</strong>(9-11): 1-350<!--MARK-->","","Article in Journal","10629a92-83b4-4b6d-a2df-b5d589aea388","20081009T05:11:37.000+0000","f5b5f7c7-fc53-4502-951d-1c96b680d874"
"Obenberger, J.","1931","Meine Antwort auf die Kritiken des Herrn H.J. Carter","77-83","","Entomologische Blätter","","","","<!--MARK--><a href='null4f9f10df-15c0-4e1f-9472-bd44d3438d9b' class='mouseoverHref'>Obenberger, J. 1931. Meine Antwort auf die Kritiken des Herrn H.J. Carter.</a> <!--MARK--><!--MARK--><a href='nulla4ae2141-5f28-40ed-8d5f-f1e9aebf1631' class='mouseoverHref'><em>Entomologische Blätter</em></a> <strong>27</strong>: 77-83<!--MARK-->","","Article in Journal","4f9f10df-15c0-4e1f-9472-bd44d3438d9b","20081009T05:11:37.000+0000","a4ae2141-5f28-40ed-8d5f-f1e9aebf1631"
"Obenberger, J.","1934","Buprestidae 3","569-781","Coleopterorum Catalogus","","","","","<!--MARK--><a href='nullacefaf80-122e-429e-865b-c22992738af8' class='mouseoverHref'>Obenberger, J. 1934. Buprestidae 3. pp. 569-781</a> <!--MARK--><em>in</em> <!--MARK--><a href='nullc3a32984-0ef4-4ee3-bd74-a73eb52d0b95' class='mouseoverHref'>Junk, W. & Schenkling, S. (eds). <em>Coleopterorum Catalogus</em>. Berlin : W. Junk Vol. 132.</a><!--MARK-->","","Chapter in Book","acefaf80-122e-429e-865b-c22992738af8","20081009T05:11:37.000+0000","c3a32984-0ef4-4ee3-bd74-a73eb52d0b95"
"Saunders, E.","1868","A revision of the Australian Buprestidae described by the Rev. F. W. Hope","1-67","","Transactions of the Royal Entomological Society of London","","April 1868","","<!--MARK--><a href='nulla8978335-b648-4540-9eb1-c23630681ec7' class='mouseoverHref'>Saunders, E. 1868. A revision of the Australian Buprestidae described by the Rev. F. W. Hope.</a> <!--MARK--><!--MARK--><a href='nullaa458993-1b17-4c34-bd31-d6f8224d9b7d' class='mouseoverHref'><em>Transactions of the Royal Entomological Society of London</em></a> <strong>16</strong>: 1-67<!--MARK--> [Date published April 1868]","","Article in Journal","a8978335-b648-4540-9eb1-c23630681ec7","20081009T05:11:37.000+0000","aa458993-1b17-4c34-bd31-d6f8224d9b7d"
"Théry, A.","1929","Classification","pp. 266-275","","The Australian Zoologist","A check list of the Australian Buprestidae. With tables and keys to sub-families, tribes, and genera (by A. Théry)","","","<!--MARK--><a href='nulle01689db-380f-418e-aad5-0d65adcca6db' class='mouseoverHref'>Théry, A. 1929. Classification. pp. 266-275</a> <!--MARK--><em>in</em> <!--MARK--><a href='nullffb0f112-a5c2-465a-9d40-0c596d20a3f9' class='mouseoverHref'>Carter, H.J. A check list of the Australian Buprestidae. With tables and keys to sub-families, tribes, and genera (by A. Théry).</a> <!--MARK--><!--MARK--><a href='null48148530-5362-4b4a-a304-7ea21fe0d6b7' class='mouseoverHref'><em>The Australian Zoologist</em></a> <strong>5</strong>(4): 265-304<!--MARK--> [Date published 24 Mar 1929]","","Section in Article","e01689db-380f-418e-aad5-0d65adcca6db","20130319T03:02:02.580+0000","ffb0f112-a5c2-465a-9d40-0c596d20a3f9"
"Thomson, J.","1879","Typi Buprestidarum Musaei Thomsoniani, <i>Appendix 1a</i>","87","","","","","E. Deyrolle","<!--MARK--><a href='null27086592-0682-4500-9cce-5d7947fdf246' class='mouseoverHref'>Thomson, J. 1879. <em>Typi Buprestidarum Musaei Thomsoniani, <i>Appendix 1a</i></em>. Paris : E. Deyrolle 87 pp.</a><!--MARK-->","","Book","27086592-0682-4500-9cce-5d7947fdf246","20081009T05:11:37.000+0000",""
"Williams, G.A.","1985","New larval food plants for some Australian Buprestidae and Cerambycidae (Coleoptera)","41-46","","Australian Entomological Magazine","","","","<!--MARK--><a href='null250918e6-5bc5-4407-aad0-69adc4f4deeb' class='mouseoverHref'>Williams, G.A. 1985. New larval food plants for some Australian Buprestidae and Cerambycidae (Coleoptera).</a> <!--MARK--><!--MARK--><a href='null33d99a92-3718-4094-b6bd-af8f9b31885d' class='mouseoverHref'><em>Australian Entomological Magazine</em></a> <strong>12</strong>(3, 4): 41-46<!--MARK-->","","Article in Journal","250918e6-5bc5-4407-aad0-69adc4f4deeb","20081009T05:11:37.000+0000","33d99a92-3718-4094-b6bd-af8f9b31885d"
