"PUB_AUTHOR","PUB_YEAR","PUB_TITLE","PUB_PAGES","PUB_PARENT_BOOK_TITLE","PUB_PARENT_JOURNAL_TITLE","PUB_PARENT_ARTICLE_TITLE","PUB_PUBLICATION_DATE","PUB_PUBLISHER","PUB_FORMATTED","PUB_QUALIFICATION","PUB_TYPE","PUBLICATION_GUID","PUBLICATION_LAST_UPDATE","PARENT_PUBLICATION_GUID"
"Blackburn, T.","1902","Further notes on Australian Coleoptera with descriptions of new genera and species. Part XXXI","288-321","","Transactions of the Royal Society of South Australia","","","","<!--MARK--><a href='../../../../publication/9215f422-9fbd-4881-8634-707b74a3586e' class='mouseoverHref'>Blackburn, T. 1902. Further notes on Australian Coleoptera with descriptions of new genera and species. Part XXXI.</a> <!--MARK--><!--MARK--><a href='../../../../publication/8b48b0a3-dd7a-4aea-be0d-10a223710ebc' class='mouseoverHref'><em>Transactions of the Royal Society of South Australia</em></a> <strong>26</strong>: 288-321<!--MARK-->","","Article in Journal","9215f422-9fbd-4881-8634-707b74a3586e","20081009T05:11:37.000+0000","8b48b0a3-dd7a-4aea-be0d-10a223710ebc"
"Blackburn, T.","1903","Further notes on Australian Coleoptera, with descriptions of new genera and species. Part XXXII","91-182","","Transactions of the Royal Society of South Australia","","","","<!--MARK--><a href='../../../../publication/5b593325-4f60-4f87-9fdc-e63555fbd6ef' class='mouseoverHref'>Blackburn, T. 1903. Further notes on Australian Coleoptera, with descriptions of new genera and species. Part XXXII.</a> <!--MARK--><!--MARK--><a href='../../../../publication/8b48b0a3-dd7a-4aea-be0d-10a223710ebc' class='mouseoverHref'><em>Transactions of the Royal Society of South Australia</em></a> <strong>27</strong>: 91-182<!--MARK-->","","Article in Journal","5b593325-4f60-4f87-9fdc-e63555fbd6ef","20130318T00:07:47.541+0000","8b48b0a3-dd7a-4aea-be0d-10a223710ebc"
"Broun, T.","1886","Manual of the New Zealand Coleoptera","xvii + 745-973 pp.","","","","","Colonial Museum and Geological Survey Department","<!--MARK--><a href='../../../../publication/3691d57e-9db3-4394-b649-b406a9e1daf7' class='mouseoverHref'>Broun, T. 1886. <em>Manual of the New Zealand Coleoptera</em>. Wellington : Colonial Museum and Geological Survey Department Part 3 & 4 xvii + 745-973 pp.</a><!--MARK-->","","Book","3691d57e-9db3-4394-b649-b406a9e1daf7","20100114T07:38:20.049+0000",""
"Crowson, R.A.","1960","The phylogeny of the Coleoptera.","111-134","","Annual Review of Entomology","","","","<!--MARK--><a href='../../../../publication/ef663dc8-85c8-4a83-b9e7-69ffd3527fbc' class='mouseoverHref'>Crowson, R.A. 1960. The phylogeny of the Coleoptera.</a> <!--MARK--><!--MARK--><a href='../../../../publication/cc85b9ce-6e1b-4ac5-8838-d0eb402d4a9e' class='mouseoverHref'><em>Annual Review of Entomology</em></a> <strong>5</strong>: 111-134<!--MARK-->","","Article in Journal","ef663dc8-85c8-4a83-b9e7-69ffd3527fbc","","cc85b9ce-6e1b-4ac5-8838-d0eb402d4a9e"
"Crowson, R.A.","1979","Observations on Clambidae (Coleoptera), with descriptions of a new genus and species and of several larvae","611-623","","Revue Suisse de Zoologie","","","","<!--MARK--><a href='../../../../publication/7ab0e3ce-1154-4ebc-94fe-edf4e6582d6b' class='mouseoverHref'>Crowson, R.A. 1979. Observations on Clambidae (Coleoptera), with descriptions of a new genus and species and of several larvae.</a> <!--MARK--><!--MARK--><a href='../../../../publication/dd4d5125-6d92-411c-86c0-7181702e62a5' class='mouseoverHref'><em>Revue Suisse de Zoologie</em></a> <strong>86</strong>(3): 611-623<!--MARK-->","","Article in Journal","7ab0e3ce-1154-4ebc-94fe-edf4e6582d6b","20081009T05:11:37.000+0000","dd4d5125-6d92-411c-86c0-7181702e62a5"
"Crowson, R.A. & Crowson, E.A.","1955","Some observations on beetles of the family Clambidae","205-206","","The Glasgow Naturalist","","","","<!--MARK--><a href='../../../../publication/0af6e4cb-7e1e-42e4-8466-101795e5a5d4' class='mouseoverHref'>Crowson, R.A. & Crowson, E.A. 1955. Some observations on beetles of the family Clambidae.</a> <!--MARK--><!--MARK--><a href='../../../../publication/182179f7-1e63-4531-804b-90290615ee1d' class='mouseoverHref'><em>The Glasgow Naturalist</em></a> <strong>17</strong>(4): 205-206<!--MARK-->","","Article in Journal","0af6e4cb-7e1e-42e4-8466-101795e5a5d4","20081009T05:11:37.000+0000","182179f7-1e63-4531-804b-90290615ee1d"
"Endrödy-Younga, S.","1959","Systematischer Überblick über die Familie Clambidae (Col.)","81-116","","Opuscula Entomologica. Lund","","","","<!--MARK--><a href='../../../../publication/fda49c5e-4e32-4325-82c4-9deac9a2baa7' class='mouseoverHref'>Endrödy-Younga, S. 1959. Systematischer Überblick über die Familie Clambidae (Col.).</a> <!--MARK--><!--MARK--><a href='../../../../publication/ce78610a-5b37-4cbb-920f-1f7d3e2284ec' class='mouseoverHref'><em>Opuscula Entomologica. Lund</em></a> <strong>24</strong>: 81-116<!--MARK-->","","Article in Journal","fda49c5e-4e32-4325-82c4-9deac9a2baa7","20081009T05:11:37.000+0000","ce78610a-5b37-4cbb-920f-1f7d3e2284ec"
"Endrödy-Younga, S.","1960","Monographie der Paläarktischen Arten der Gattung <i>Clambus</i> (Col. Clambidae)","257-303","","Acta Zoologica Academiae Scientiarum Hungaricae","","","","<!--MARK--><a href='../../../../publication/f10d1c6c-148e-4613-80a0-f5f605367c7a' class='mouseoverHref'>Endrödy-Younga, S. 1960. Monographie der Paläarktischen Arten der Gattung <i>Clambus</i> (Col. Clambidae).</a> <!--MARK--><!--MARK--><a href='../../../../publication/50d7b97e-899c-4373-8ab9-28aa9e24e2c8' class='mouseoverHref'><em>Acta Zoologica Academiae Scientiarum Hungaricae</em></a> <strong>6</strong>: 257-303<!--MARK-->","","Article in Journal","f10d1c6c-148e-4613-80a0-f5f605367c7a","20081009T05:11:37.000+0000","50d7b97e-899c-4373-8ab9-28aa9e24e2c8"
"Endrödy-Younga, S.","1960","Neue Angaben zur Klärung des Systems der Familie Clambidae under Beschreibung einer neuen Liodiden-Gattung (Coleoptera)","239-245","","Annales Historico-Naturales Musei Nationalis Hungarici (Zoologica)","","","","<!--MARK--><a href='../../../../publication/719b574a-bc6d-4441-a584-32a1db232f31' class='mouseoverHref'>Endrödy-Younga, S. 1960. Neue Angaben zur Klärung des Systems der Familie Clambidae under Beschreibung einer neuen Liodiden-Gattung (Coleoptera).</a> <!--MARK--><!--MARK--><a href='../../../../publication/e6f35874-0423-4fa1-bf45-655b9047e0c2' class='mouseoverHref'><em>Annales Historico-Naturales Musei Nationalis Hungarici (Zoologica)</em></a> <strong>52</strong>: 239-245<!--MARK-->","","Article in Journal","719b574a-bc6d-4441-a584-32a1db232f31","20081009T05:11:37.000+0000","e6f35874-0423-4fa1-bf45-655b9047e0c2"
"Endrödy-Younga, S.","1961","Eine neue <i>Clambus</i>-Art aus Südamerika (Col. Clambidae)","325-326","","Annales Historico-Naturales Musei Nationalis Hungarici (Zoologica)","","","","<!--MARK--><a href='../../../../publication/5810a28a-c0dd-4db0-9a98-3b2ba2a5df69' class='mouseoverHref'>Endrödy-Younga, S. 1961. Eine neue <i>Clambus</i>-Art aus Südamerika (Col. Clambidae).</a> <!--MARK--><!--MARK--><a href='../../../../publication/e6f35874-0423-4fa1-bf45-655b9047e0c2' class='mouseoverHref'><em>Annales Historico-Naturales Musei Nationalis Hungarici (Zoologica)</em></a> <strong>54</strong>: 325-326<!--MARK-->","","Article in Journal","5810a28a-c0dd-4db0-9a98-3b2ba2a5df69","20081009T05:11:37.000+0000","e6f35874-0423-4fa1-bf45-655b9047e0c2"
"Endrödy-Younga, S.","1961","Revision der aethiopischen Arten der Gattung <i>Clambus</i> Fischer von Waldheim (Coleoptera, Clambidae)","313-323","","Annales Historico-Naturales Musei Nationalis Hungarici (Zoologica)","","","","<!--MARK--><a href='../../../../publication/bd8cbedd-3fb7-4d5b-ab4b-bed7d41b4cae' class='mouseoverHref'>Endrödy-Younga, S. 1961. Revision der aethiopischen Arten der Gattung <i>Clambus</i> Fischer von Waldheim (Coleoptera, Clambidae).</a> <!--MARK--><!--MARK--><a href='../../../../publication/e6f35874-0423-4fa1-bf45-655b9047e0c2' class='mouseoverHref'><em>Annales Historico-Naturales Musei Nationalis Hungarici (Zoologica)</em></a> <strong>53</strong>: 313-323<!--MARK-->","","Article in Journal","bd8cbedd-3fb7-4d5b-ab4b-bed7d41b4cae","20081009T05:11:37.000+0000","e6f35874-0423-4fa1-bf45-655b9047e0c2"
"Endrödy-Younga, S.","1961","Revision der Gattung <i>Calyptomerus</i> Redtb. (Col. Clambidae)","401-412","","Acta Zoologica Academiae Scientiarum Hungaricae","","","","<!--MARK--><a href='../../../../publication/c08828a3-7cec-4a02-95fc-efa8cd9731ed' class='mouseoverHref'>Endrödy-Younga, S. 1961. Revision der Gattung <i>Calyptomerus</i> Redtb. (Col. Clambidae).</a> <!--MARK--><!--MARK--><a href='../../../../publication/50d7b97e-899c-4373-8ab9-28aa9e24e2c8' class='mouseoverHref'><em>Acta Zoologica Academiae Scientiarum Hungaricae</em></a> <strong>7</strong>: 401-412<!--MARK-->","","Article in Journal","c08828a3-7cec-4a02-95fc-efa8cd9731ed","20081009T05:11:37.000+0000","50d7b97e-899c-4373-8ab9-28aa9e24e2c8"
"Endrödy-Younga, S.","1965","Clambiden-Studien (Coleoptera)","259-265","","Annales Historico-Naturales Musei Nationalis Hungarici (Zoologica)","","","","<!--MARK--><a href='../../../../publication/2c5e7b2d-825d-4128-bd81-103d3ace5c39' class='mouseoverHref'>Endrödy-Younga, S. 1965. Clambiden-Studien (Coleoptera).</a> <!--MARK--><!--MARK--><a href='../../../../publication/e6f35874-0423-4fa1-bf45-655b9047e0c2' class='mouseoverHref'><em>Annales Historico-Naturales Musei Nationalis Hungarici (Zoologica)</em></a> <strong>57</strong>: 259-265<!--MARK-->","","Article in Journal","2c5e7b2d-825d-4128-bd81-103d3ace5c39","20081009T05:11:37.000+0000","e6f35874-0423-4fa1-bf45-655b9047e0c2"
"Endrödy-Younga, S.","1974","A revision of the described Australian and New Zealand species of the family Clambidae (Coleoptera) with description of a new species","1-10","","Records of the South Australian Museum (Adelaide)","","13/08/74","","<!--MARK--><a href='../../../../publication/fc5823f4-18bc-40ba-a4bb-233fa7c5bce2' class='mouseoverHref'>Endrödy-Younga, S. 1974. A revision of the described Australian and New Zealand species of the family Clambidae (Coleoptera) with description of a new species.</a> <!--MARK--><!--MARK--><a href='../../../../publication/f7f76869-b0b8-4c0e-a1bc-1d8c43cc0f89' class='mouseoverHref'><em>Records of the South Australian Museum (Adelaide)</em></a> <strong>17</strong>(1): 1-10<!--MARK--> [Date published 13/08/74]","","Article in Journal","fc5823f4-18bc-40ba-a4bb-233fa7c5bce2","20081009T05:11:37.000+0000","f7f76869-b0b8-4c0e-a1bc-1d8c43cc0f89"
"Endrödy-Younga, S.","1978","A revision of the Oriental Clambidae with references to the Papua and Hawaiian species (Coleoptera)","67-84","","Pacific Insects","","","","<!--MARK--><a href='../../../../publication/a93acb9e-7ba6-48ae-8202-e4d811253e72' class='mouseoverHref'>Endrödy-Younga, S. 1978. A revision of the Oriental Clambidae with references to the Papua and Hawaiian species (Coleoptera).</a> <!--MARK--><!--MARK--><a href='../../../../publication/f8876116-72f2-47c6-b8af-6b514f4719b7' class='mouseoverHref'><em>Pacific Insects</em></a> <strong>18</strong>: 67-84<!--MARK-->","","Article in Journal","a93acb9e-7ba6-48ae-8202-e4d811253e72","20081009T05:11:37.000+0000","f8876116-72f2-47c6-b8af-6b514f4719b7"
"Endrödy-Younga, S.","1981","The American species of the family Clambidae (Coleoptera: Eucinetoidea)","33-67","","Entomologia Generalis","","","","<!--MARK--><a href='../../../../publication/c5461dde-569d-4d4f-960b-14d6b4368a8b' class='mouseoverHref'>Endrödy-Younga, S. 1981. The American species of the family Clambidae (Coleoptera: Eucinetoidea).</a> <!--MARK--><!--MARK--><a href='../../../../publication/bb76445d-70ca-4344-8797-71f5459ed8d8' class='mouseoverHref'><em>Entomologia Generalis</em></a> <strong>7</strong>(1): 33-67<!--MARK-->","","Article in Journal","c5461dde-569d-4d4f-960b-14d6b4368a8b","20081009T05:11:37.000+0000","bb76445d-70ca-4344-8797-71f5459ed8d8"
"Endrödy-Younga, S.","1990","A revision of the Australian Clambidae (Coleoptera: Eucinetoidea)","247-280","","Invertebrate Taxonomy","","","","<!--MARK--><a href='../../../../publication/d57dfe92-7eac-4007-b004-8c5932d1b05f' class='mouseoverHref'>Endrödy-Younga, S. 1990. A revision of the Australian Clambidae (Coleoptera: Eucinetoidea).</a> <!--MARK--><!--MARK--><a href='../../../../publication/9846f41b-d755-4682-9049-5e59d363951b' class='mouseoverHref'><em>Invertebrate Taxonomy</em></a> <strong>4</strong>(2): 247-280<!--MARK-->","","Article in Journal","d57dfe92-7eac-4007-b004-8c5932d1b05f","20081009T05:11:37.000+0000","9846f41b-d755-4682-9049-5e59d363951b"
"Fairmaire, L. & Laboulbene, A.","1854","Faune Entomologique Française. Coleoptera","665 pp.","","","","","Deyrolle","<!--MARK--><a href='../../../../publication/740830ec-c321-48b1-a0e0-446721821bb4' class='mouseoverHref'>Fairmaire, L. & Laboulbene, A. 1854. <em>Faune Entomologique Française. Coleoptera</em>. Paris : Deyrolle Vol. 1 665 pp.</a><!--MARK-->","","Book","740830ec-c321-48b1-a0e0-446721821bb4","20081009T05:11:37.000+0000",""
"Fauvel, A.","1861","Sur les genres <i>Calyptomerus</i> et <i>Comazus</i>","573-577","","Annales de la Société Entomologique de France","","","","<!--MARK--><a href='../../../../publication/180b9a2b-c734-45de-84b7-5ef512ed8df7' class='mouseoverHref'>Fauvel, A. 1861. Sur les genres <i>Calyptomerus</i> et <i>Comazus</i>.</a> <!--MARK--><!--MARK--><a href='../../../../publication/6462279b-2aaf-46a3-a434-cab7d8a2c33d' class='mouseoverHref'><em>Annales de la Société Entomologique de France</em></a> 4 <strong>1</strong>: 573-577<!--MARK-->","","Article in Journal","180b9a2b-c734-45de-84b7-5ef512ed8df7","20081009T05:11:37.000+0000","6462279b-2aaf-46a3-a434-cab7d8a2c33d"
"Fischer von Waldheim, G.","1820","Entomographia imperii russici. Genera Insectorum systematice exposita et analysi iconographica instructa","xi 104 pp.","","","","","Société Impériale des Naturalistes","<!--MARK--><a href='../../../../publication/36237a30-e73a-4791-85f3-463da88bb181' class='mouseoverHref'>Fischer von Waldheim, G. 1820. <em>Entomographia imperii russici. Genera Insectorum systematice exposita et analysi iconographica instructa</em>. Mosquae : Société Impériale des Naturalistes Vol. 1 xi 104 pp.</a><!--MARK-->","","Book","36237a30-e73a-4791-85f3-463da88bb181","20100120T22:49:44.225+0000",""
"Johnson, C.","1966","<i>Handbooks for the identification of British insects, Clambidae, Coleoptera</i>","1-13","","","","","","<!--MARK--><a href='../../../../publication/f47fa2ae-1c87-465f-95b7-d8ac3bd41088' class='mouseoverHref'>Johnson, C. 1966. <i>Handbooks for the identification of British insects, Clambidae, Coleoptera</i>. Royal Entomological Society, London Vol. 4, Part 6a. 1-13 pp.</a>","","Miscellaneous","f47fa2ae-1c87-465f-95b7-d8ac3bd41088","20081009T05:11:37.000+0000",""
"Lawrence, J.F.","1982","Coleoptera","482-553","Synopsis and Classification of Living Organisms","","","","","<!--MARK--><a href='../../../../publication/9195371d-372d-41d4-8fe4-f243c9cebfb1' class='mouseoverHref'>Lawrence, J.F. 1982. Coleoptera. pp. 482-553</a> <!--MARK--><em>in</em> <!--MARK--><a href='../../../../publication/a974e260-3e40-4d35-9866-5c97c0c49b2c' class='mouseoverHref'>Parker, S.P. (ed.). <em>Synopsis and Classification of Living Organisms</em>. New York : McGraw Hill Vol. 2 vii 1232 pp.</a><!--MARK-->","","Chapter in Book","9195371d-372d-41d4-8fe4-f243c9cebfb1","20161017T04:10:08.666+0000","a974e260-3e40-4d35-9866-5c97c0c49b2c"
"Lawrence, J.F. & Britton, E.B.","1994","Australian Beetles","x 192 pp.","","","","","Melbourne University Press","<!--MARK--><a href='../../../../publication/5b9b6e97-52bd-4772-a414-468b0dc89336' class='mouseoverHref'>Lawrence, J.F. & Britton, E.B. 1994. <em>Australian Beetles</em>. Melbourne : Melbourne University Press x 192 pp.</a><!--MARK-->","","Book","5b9b6e97-52bd-4772-a414-468b0dc89336","20090819T04:34:31.325+0000",""
"Lea, A.M.","1910","Australian and Tasmanian Coleoptera inhabiting or resorting to the nests of ants, bees, and termites","116-230 pls XXV-XXVII","","Proceedings of the Royal Society of Victoria","","Aug. 1910","","<!--MARK--><a href='../../../../publication/b0d9adaa-bb69-41b4-bdb2-edb008d55ea3' class='mouseoverHref'>Lea, A.M. 1910. Australian and Tasmanian Coleoptera inhabiting or resorting to the nests of ants, bees, and termites.</a> <!--MARK--><!--MARK--><a href='../../../../publication/ce333794-3a02-427f-ba27-346079f1efa0' class='mouseoverHref'><em>Proceedings of the Royal Society of Victoria</em></a> n.s. <strong>23</strong>(1): 116-230 pls XXV-XXVII<!--MARK--> [Date published Aug. 1910]","","Article in Journal","b0d9adaa-bb69-41b4-bdb2-edb008d55ea3","20111219T03:28:18.834+0000","ce333794-3a02-427f-ba27-346079f1efa0"
"Lea, A.M.","1912","Descriptions of new species of Australian Coleoptera. Part IX","426-478, pl. XVII","","Proceedings of the Linnean Society of New South Wales","","8 Feb. 1912","","<!--MARK--><a href='../../../../publication/692450dc-5dec-48ae-9854-ba6a227bc0ca' class='mouseoverHref'>Lea, A.M. 1912. Descriptions of new species of Australian Coleoptera. Part IX.</a> <!--MARK--><!--MARK--><a href='../../../../publication/c12cd779-adb5-41ea-bd2c-75f6864cf22e' class='mouseoverHref'><em>Proceedings of the Linnean Society of New South Wales</em></a> <strong>36</strong>: 426-478, pl. XVII<!--MARK--> [Date published 8 Feb. 1912]","","Article in Journal","692450dc-5dec-48ae-9854-ba6a227bc0ca","20081009T05:11:37.000+0000","c12cd779-adb5-41ea-bd2c-75f6864cf22e"
"Marsham, T.","1802","Entomologia Britannica, sistens insecta Britanniae indigena secundum methodum Linnaeanam disposita","xxxi 548 pp.","","","","","J. White","<!--MARK--><a href='../../../../publication/bc796111-ba14-446f-9ca5-bed9599e85de' class='mouseoverHref'>Marsham, T. 1802. <em>Entomologia Britannica, sistens insecta Britanniae indigena secundum methodum Linnaeanam disposita</em>. London : J. White Vol. 1 (Coleoptera) xxxi 548 pp.</a><!--MARK-->","","Book","bc796111-ba14-446f-9ca5-bed9599e85de","20081009T05:11:37.000+0000",""
"Redtenbacher, L.","1849","Fauna Austriaca. Die Käfer, nach der analytischen Methode bearbeitet","xxvii 883 pp.","","","","","Karl Gerold","<!--MARK--><a href='../../../../publication/69853844-c222-4343-b5be-4ed09f7df1af' class='mouseoverHref'>Redtenbacher, L. 1849. <em>Fauna Austriaca. Die Käfer, nach der analytischen Methode bearbeitet</em>. Wien : Karl Gerold xxvii 883 pp.</a><!--MARK-->","","Book","69853844-c222-4343-b5be-4ed09f7df1af","20081009T05:11:37.000+0000",""
"Stephens, J.F.","1828","Illustrations of British Entomology; <i>or a synopsis of indigenous insects containing their generic and specific distinctions......</i> Mandibulata","1-112 pls 10-14","","","","","Baldwin & Craddock","<!--MARK--><a href='../../../../publication/19e310e9-c8bc-4628-ad29-cb771d078994' class='mouseoverHref'>Stephens, J.F. 1828. <em>Illustrations of British Entomology; <i>or a synopsis of indigenous insects containing their generic and specific distinctions......</i> Mandibulata</em>. London : Baldwin & Craddock Vol. 2 1-112 pls 10-14.</a><!--MARK-->","","Book","19e310e9-c8bc-4628-ad29-cb771d078994","20081009T05:11:37.000+0000",""
