"PUB_AUTHOR","PUB_YEAR","PUB_TITLE","PUB_PAGES","PUB_PARENT_BOOK_TITLE","PUB_PARENT_JOURNAL_TITLE","PUB_PARENT_ARTICLE_TITLE","PUB_PUBLICATION_DATE","PUB_PUBLISHER","PUB_FORMATTED","PUB_QUALIFICATION","PUB_TYPE","PUBLICATION_GUID","PUBLICATION_LAST_UPDATE","PARENT_PUBLICATION_GUID"
"Bock, P.E.","1982","Bryozoans (Phylum Bryozoa)","319-394","Marine Invertebrates of Southern Australia","","","","","<!--MARK--><a href='nullb1fadf94-7264-494c-b91d-0003f41a7e0a' class='mouseoverHref'>Bock, P.E. 1982. Bryozoans (Phylum Bryozoa). pp. 319-394</a> <!--MARK--><em>in</em> <!--MARK--><a href='null0676c3be-3d74-4dae-a465-d7b1bde01087' class='mouseoverHref'>Shepherd, S.A. & Thomas, I.M. (eds). <em>Marine Invertebrates of Southern Australia</em>. <em>Handbook of the Flora and Fauna of South Australia</em> Adelaide : Government Printer Part 1 491 pp.</a><!--MARK-->","","Chapter in Book","b1fadf94-7264-494c-b91d-0003f41a7e0a","20170816T03:56:11.713+0000","0676c3be-3d74-4dae-a465-d7b1bde01087"
"Brown, D.A.","1952","The Tertiary cheilostomatous Polyzoa of New Zealand","405 pp.","","","","","Trustees of the British Museum (Natural History)","<!--MARK--><a href='nullde3a62f9-e8a2-4961-9378-b6d8057f448d' class='mouseoverHref'>Brown, D.A. 1952. <em>The Tertiary cheilostomatous Polyzoa of New Zealand</em>. London : Trustees of the British Museum (Natural History) 405 pp.</a><!--MARK-->","","Book","de3a62f9-e8a2-4961-9378-b6d8057f448d","",""
"Canu, F., & Bassler, R.S.","1929","Bryozoa of the Philippine region","1-685","","United States National Museum Bulletin","","","","<!--MARK--><a href='null1517bb61-a1d6-45bc-adb2-c307cd5780ef' class='mouseoverHref'>Canu, F., & Bassler, R.S. 1929. Bryozoa of the Philippine region.</a> <!--MARK--><!--MARK--><a href='nullaeaf76dd-a2f8-4bdf-b582-e911ff8a7df3' class='mouseoverHref'><em>United States National Museum Bulletin</em></a> <strong>100</strong>: 1-685<!--MARK-->","","Article in Journal","1517bb61-a1d6-45bc-adb2-c307cd5780ef","","aeaf76dd-a2f8-4bdf-b582-e911ff8a7df3"
"Hincks, T.","1884","Contributions towards a general history of the marine Polyzoa. XIII. Polyzoa from Victoria and Western Australia","363-369; 14: 276-285","","Annals and Magazine of Natural History","","","","<!--MARK--><a href='null79c7c6ca-6d74-4dc8-90fb-c12dab5c23b9' class='mouseoverHref'>Hincks, T. 1884. Contributions towards a general history of the marine Polyzoa. XIII. Polyzoa from Victoria and Western Australia.</a> <!--MARK--><!--MARK--><a href='nullefa8de69-3a29-4a43-8ef2-cbefda205976' class='mouseoverHref'><em>Annals and Magazine of Natural History</em></a> 5 <strong>13</strong>: 363-369; 14: 276-285<!--MARK-->","","Article in Journal","79c7c6ca-6d74-4dc8-90fb-c12dab5c23b9","","efa8de69-3a29-4a43-8ef2-cbefda205976"
"Macgillivray, P.H.","1883","Descriptions of new or little-known Polyzoa. Part 2","130-138","","Transactions and Proceedings of the Royal Society of Victoria","","","","<!--MARK--><a href='nulle62f8d5f-4f62-49ab-b472-617346ff0679' class='mouseoverHref'>Macgillivray, P.H. 1883. Descriptions of new or little-known Polyzoa. Part 2.</a> <!--MARK--><!--MARK--><a href='nulle82a2ac5-2fe4-497f-a85c-8c3cf8a636ad' class='mouseoverHref'><em>Transactions and Proceedings of the Royal Society of Victoria</em></a> <strong>19</strong>: 130-138<!--MARK-->","","Article in Journal","e62f8d5f-4f62-49ab-b472-617346ff0679","","e82a2ac5-2fe4-497f-a85c-8c3cf8a636ad"
"Macgillivray, P.H.","1886","Polyzoa","63-73, pls 116-118","Prodromus of the Zoology of Victoria Decade 12","","","","","<!--MARK--><a href='null6521c18a-339a-4dbe-8ba4-faca97e9f349' class='mouseoverHref'>Macgillivray, P.H. 1886. Polyzoa. 63-73, pls 116-118</a> <!--MARK--><em>in</em> <!--MARK--><a href='null5997562a-056b-4235-ab6c-64316596b9b6' class='mouseoverHref'>McCoy, F. (ed.). <em>Prodromus of the Zoology of Victoria Decade 12</em>. Melbourne : George Robertson.</a><!--MARK-->","","Chapter in Book","6521c18a-339a-4dbe-8ba4-faca97e9f349","","5997562a-056b-4235-ab6c-64316596b9b6"
"Osburn, R.C.","1952","Bryozoa of the Pacific coast of America, Part 2. Cheilostomata - Ascophora","271-611","","Report of the Allan Hancock Pacific Expeditions","","","","<!--MARK--><a href='null4926a8e5-25c6-47ba-ae92-da206636ced8' class='mouseoverHref'>Osburn, R.C. 1952. Bryozoa of the Pacific coast of America, Part 2. Cheilostomata - Ascophora.</a> <!--MARK--><!--MARK--><a href='null9d1a4af5-3b2c-4bba-b749-2f036c604a20' class='mouseoverHref'><em>Report of the Allan Hancock Pacific Expeditions</em></a> <strong>14</strong>: 271-611<!--MARK-->","","Article in Journal","4926a8e5-25c6-47ba-ae92-da206636ced8","","9d1a4af5-3b2c-4bba-b749-2f036c604a20"
