"PUB_AUTHOR","PUB_YEAR","PUB_TITLE","PUB_PAGES","PUB_PARENT_BOOK_TITLE","PUB_PARENT_JOURNAL_TITLE","PUB_PARENT_ARTICLE_TITLE","PUB_PUBLICATION_DATE","PUB_PUBLISHER","PUB_FORMATTED","PUB_QUALIFICATION","PUB_TYPE","PUBLICATION_GUID","PUBLICATION_LAST_UPDATE","PARENT_PUBLICATION_GUID"
"Siebert, D.J.","1987","Interrelationships among families of the order Cypriniformes (Teleostei)","380","","","","","","<!--MARK--><a href='../../../../publication/8b30cc96-7fd4-4bd3-84c5-274d1a2cf08c' class='mouseoverHref'>Siebert, D.J. 1987. Interrelationships among families of the order Cypriniformes (Teleostei). Unpubl. PhD. Diss. City University of New York. 380 pp.</a>","","Miscellaneous","8b30cc96-7fd4-4bd3-84c5-274d1a2cf08c","20081009T05:11:37.000+0000",""
"Simons, A.M. & Gidmark, N.J.","2010","Systematics and Phylogenetic Relationships of Cypriniformes","pp. 409-440","Gonorynchiformes and Ostariophysan Relationships: A Comprehensive Review.","","","","","<!--MARK--><a href='../../../../publication/0f81b5c0-fa72-4a38-89c4-f0151078b70d' class='mouseoverHref'>Simons, A.M. & Gidmark, N.J. 2010. Systematics and Phylogenetic Relationships of Cypriniformes. pp. 409-440</a> <!--MARK--><em>in</em> <!--MARK--><a href='../../../../publication/070ed55b-4475-469b-859f-9297544c46c2' class='mouseoverHref'>T. Grande, Poyato-Ariza, F.J. & R. Diogo (eds.). <em>Gonorynchiformes and Ostariophysan Relationships: A Comprehensive Review</em>. Enfield, NH, U.S.A. : Science Publishers 600 pp.</a><!--MARK--> [Date published 1 January 2010]","","Chapter in Book","0f81b5c0-fa72-4a38-89c4-f0151078b70d","20110428T07:46:17.049+0000","070ed55b-4475-469b-859f-9297544c46c2"
"?lechtová, V., Bohlen, J. & Tan, H.H.","2007","Families of Cobitoidea (Teleostei; Cypriniformes) as revealed from nuclear genetic data and the position of the mysterious genera <I>Barbucca</I>, <I>Psilorhynchus</I>, <I>Serpenticobitis</I> and <I>Vaillantella</I>.","1358-1365","","Molecular Phylogenetics and Evolution","","","","<!--MARK--><a href='../../../../publication/75d6c0d8-ec8a-4e3f-8f17-5fd87ab063ad' class='mouseoverHref'>?lechtová, V., Bohlen, J. & Tan, H.H. 2007. Families of Cobitoidea (Teleostei; Cypriniformes) as revealed from nuclear genetic data and the position of the mysterious genera <I>Barbucca</I>, <I>Psilorhynchus</I>, <I>Serpenticobitis</I> and <I>Vaillantella</I>.</a> <!--MARK--><!--MARK--><a href='../../../../publication/db034f3c-0160-42a2-a6c9-84156be3b7b8' class='mouseoverHref'><em>Molecular Phylogenetics and Evolution</em></a> <strong>44</strong>: 1358-1365<!--MARK-->","","Article in Journal","75d6c0d8-ec8a-4e3f-8f17-5fd87ab063ad","20110428T08:06:06.626+0000","db034f3c-0160-42a2-a6c9-84156be3b7b8"
"Smith, B","2005","The state of the art: a synopsis of information on common carp (<I>Cyprinus carpio</I>) in Australia.","","","","","","","<!--MARK--><a href='../../../../publication/0e0a6800-ceb6-42bc-96b4-257148dd9192' class='mouseoverHref'>Smith, B 2005. The state of the art: a synopsis of information on common carp (<I>Cyprinus carpio</I>) in Australia. Final Technical Report, SARDI Aquatic Sciences Publication No. RDO4/0064-2; SARDI Research Report Series No. 77, Adelaide.</a>","","Miscellaneous","0e0a6800-ceb6-42bc-96b4-257148dd9192","20120427T16:05:24.744+0000",""
"Smith, B.B. & Hammer, M.","2006","Mapping the current distribution of native and exotic fishes within the South Australian Murray Darling Basin.","pp. 60","","","","","","<!--MARK--><a href='../../../../publication/119d8c5f-e536-42cf-9ebe-c4d31ccd6452' class='mouseoverHref'>Smith, B.B. & Hammer, M. 2006. Mapping the current distribution of native and exotic fishes within the South Australian Murray Darling Basin. Final Report to PIRSA Rural Solutions (Animal and Plant Control Board). Primary Industries and Resources South Australia, SARDI Aquatic Sciences, Adelaide. 60 pp. pp. 60</a>","","Miscellaneous","119d8c5f-e536-42cf-9ebe-c4d31ccd6452","20120603T11:05:03.968+0000",""
"Stoessel, D.","2007","Population biology of roach (<I>Rutilis rutilus</I> L.) in Lake Eildon, Australia.","","","","","","","<!--MARK--><a href='../../../../publication/7fff8db3-fdc9-46a0-a8e9-a4d64479ff78' class='mouseoverHref'>Stoessel, D. 2007. Population biology of roach (<I>Rutilis rutilus</I> L.) in Lake Eildon, Australia. M.Sc. thesis, School of Life and Environmental Sciences, Deakin University.</a>","","Miscellaneous","7fff8db3-fdc9-46a0-a8e9-a4d64479ff78","20120603T12:56:48.431+0000",""
"Wager, R. & Unmack, P.J.","2000","Fishes of the Lake Eyre Catchment of Central Australia","88 pp.","","","","","Department of Primary Industries and Queensland Fisheries Service","<!--MARK--><a href='../../../../publication/ee1838c4-1e36-4542-911e-772cec79a197' class='mouseoverHref'>Wager, R. & Unmack, P.J. 2000. <em>Fishes of the Lake Eyre Catchment of Central Australia</em>. Brisbane : Department of Primary Industries and Queensland Fisheries Service 88 pp.</a><!--MARK-->","","Book","ee1838c4-1e36-4542-911e-772cec79a197","20081009T05:11:37.000+0000",""
"Ward, A.","2009","Distribution and Ecology of <I>Gambusia holbrooki</I> and <I>Tanichthys albonubes</I> throughout the Gosford Local Government Area, Gosford Council 2008/2009.","31 pp.","","","","","","<!--MARK--><a href='../../../../publication/73f794e2-00bf-40ec-8f44-ed4ed44874c8' class='mouseoverHref'>Ward, A. 2009. Distribution and Ecology of <I>Gambusia holbrooki</I> and <I>Tanichthys albonubes</I> throughout the Gosford Local Government Area, Gosford Council 2008/2009. Gosford Council Ecological Research Grant Progra. 31 pp.</a>","","Miscellaneous","73f794e2-00bf-40ec-8f44-ed4ed44874c8","20130507T02:07:15.922+0000",""
"Weatherley, A.J. & Lake, J.S.","1967","Introduced fish species in Australian waters.","pp.","Australian Inland Waters and their Fauna: Eleven Studies","","","","","<!--MARK--><a href='../../../../publication/66f7fe10-b5e0-41a9-aa0f-5bbfcf5158e4' class='mouseoverHref'>Weatherley, A.J. & Lake, J.S. 1967. Introduced fish species in Australian waters. pp.</a> <!--MARK--><em>in</em> <!--MARK--><a href='../../../../publication/6b992862-d1f3-43db-98a0-6a98d4d701d3' class='mouseoverHref'>Weatherley, A.H. (ed.). <em>Australian Inland Waters and their Fauna: Eleven Studies</em>. Canberra : A.N.U. Press.</a><!--MARK-->","","Chapter in Book","66f7fe10-b5e0-41a9-aa0f-5bbfcf5158e4","20150907T23:01:58.701+0000","6b992862-d1f3-43db-98a0-6a98d4d701d3"
"Whitley, G.P.","1964","A survey of Australian Ichthyology","11-127","","Proceedings of the Linnean Society of New South Wales","","","","<!--MARK--><a href='../../../../publication/f3980983-16bf-4fca-b2ea-83255a9ca6e2' class='mouseoverHref'>Whitley, G.P. 1964. A survey of Australian Ichthyology.</a> <!--MARK--><!--MARK--><a href='../../../../publication/c12cd779-adb5-41ea-bd2c-75f6864cf22e' class='mouseoverHref'><em>Proceedings of the Linnean Society of New South Wales</em></a> <strong>89</strong>(1): 11-127<!--MARK-->","","Article in Journal","f3980983-16bf-4fca-b2ea-83255a9ca6e2","20081009T05:11:37.000+0000","c12cd779-adb5-41ea-bd2c-75f6864cf22e"
"Wiley, E.O. & Johnson, G.D.","2010","A teleost classification based on monophyletic groups","pp. 123-182","Origin and Phylogenetic Interrelationships of Teleosts","","","","","<!--MARK--><a href='../../../../publication/3b5337b6-20e1-4099-8305-94be97d34520' class='mouseoverHref'>Wiley, E.O. & Johnson, G.D. 2010. A teleost classification based on monophyletic groups. pp. 123-182</a> <!--MARK--><em>in</em> <!--MARK--><a href='../../../../publication/9e08b8c3-6b84-49ca-9254-0b33e4301f18' class='mouseoverHref'>Nelson, J.S., Schultze, H.-P. & Wilson, M.V.H. <em>Origin and Phylogenetic Interrelationships of Teleosts</em>. München, Germany : Verlag Dr. Friedrich Pfeil 480 pp.</a><!--MARK-->","","Chapter in Book","3b5337b6-20e1-4099-8305-94be97d34520","20110428T23:54:31.129+0000","9e08b8c3-6b84-49ca-9254-0b33e4301f18"
"Yearsley, G.K., Last, P.R. & Morris, G.B.","1997","Codes for Australian Aquatic Biota (CAAB): an upgraded and expanded species coding system for Australian fisheries databases","15 pp. + appendices","","","","","","<!--MARK--><a href='../../../../publication/d0a1bd97-d100-402f-a9a7-22eeba8e3f36' class='mouseoverHref'>Yearsley, G.K., Last, P.R. & Morris, G.B. 1997. Codes for Australian Aquatic Biota (CAAB): an upgraded and expanded species coding system for Australian fisheries databases. CSIRO Marine Laboratories Report No. 224. 15 pp. + appendices</a>","","Miscellaneous","d0a1bd97-d100-402f-a9a7-22eeba8e3f36","20081009T05:11:37.000+0000",""
"Yearsley, G.K., Last, P.R. & Ward, R.D. (eds)","1999","Australian Seafood Handbook","460 pp.","","","","","CSIRO Marine Research","<!--MARK--><a href='../../../../publication/7aba7d26-f58b-44a0-9a6e-288ca449690a' class='mouseoverHref'>Yearsley, G.K., Last, P.R. & Ward, R.D. (eds) 1999. <em>Australian Seafood Handbook</em>. Hobart : CSIRO Marine Research 460 pp.</a><!--MARK-->","","Book","7aba7d26-f58b-44a0-9a6e-288ca449690a","20081009T05:11:37.000+0000",""
"","","Cypriniformes Tree of Life","","","","","","","<!--MARK--><a href='../../../../publication/b8605632-56de-42ae-adc5-b2e86e461ddf' class='mouseoverHref'>Cypriniformes Tree of Life.</a> <!--MARK--><a href=http://bio.slu.edu/mayden/cypriniformes/home.html>http://bio.slu.edu/mayden/cypriniformes/home.html</a>","","URL","b8605632-56de-42ae-adc5-b2e86e461ddf","20120427T12:03:36.635+0000",""
