"PUB_AUTHOR","PUB_YEAR","PUB_TITLE","PUB_PAGES","PUB_PARENT_BOOK_TITLE","PUB_PARENT_JOURNAL_TITLE","PUB_PARENT_ARTICLE_TITLE","PUB_PUBLICATION_DATE","PUB_PUBLISHER","PUB_FORMATTED","PUB_QUALIFICATION","PUB_TYPE","PUBLICATION_GUID","PUBLICATION_LAST_UPDATE","PARENT_PUBLICATION_GUID"
"Hutchins, J.B.","2001","Checklist of the fishes of Western Australia","9-50","","Records of the Western Australian Museum, Supplement","","","","<!--MARK--><a href='../../../../publication/278be340-3f8b-4cdb-abde-b0b2939af34a' class='mouseoverHref'>Hutchins, J.B. 2001. Checklist of the fishes of Western Australia.</a> <!--MARK--><!--MARK--><a href='../../../../publication/841f1546-1bce-4548-adc9-7b08f6ca73a0' class='mouseoverHref'><em>Records of the Western Australian Museum, Supplement</em></a> <strong>63</strong>: 9-50<!--MARK-->","","Article in Journal","278be340-3f8b-4cdb-abde-b0b2939af34a","20081009T05:11:37.000+0000","841f1546-1bce-4548-adc9-7b08f6ca73a0"
"Kailola, P.J., Williams, M.J., Stewart, P.C., Reichelt, R.E., McNee, A. & Grieve, C.","1993","Australian Fisheries Resources","422 pp.","","","","","Bureau of Resource Sciences and the Fisheries Research and Development Corporation","<!--MARK--><a href='../../../../publication/322030ad-8de5-49ac-898e-cf7f9256f111' class='mouseoverHref'>Kailola, P.J., Williams, M.J., Stewart, P.C., Reichelt, R.E., McNee, A. & Grieve, C. 1993. <em>Australian Fisheries Resources</em>. Canberra : Bureau of Resource Sciences and the Fisheries Research and Development Corporation 422 pp.</a><!--MARK-->","","Book","322030ad-8de5-49ac-898e-cf7f9256f111","20081009T05:11:37.000+0000",""
"Keller, R.P. & Lake, P.S.","2007","Potential impacts of a recent and rapidly spreading coloniser of Australian freshwaters: Oriental weatherloach (<I>Misgurnus anguillicaudatus</I>).","124-132","","Ecology of Freshwater Fish","","","","<!--MARK--><a href='../../../../publication/3d4a7281-0af6-478b-84ee-23201c102b69' class='mouseoverHref'>Keller, R.P. & Lake, P.S. 2007. Potential impacts of a recent and rapidly spreading coloniser of Australian freshwaters: Oriental weatherloach (<I>Misgurnus anguillicaudatus</I>).</a> <!--MARK--><!--MARK--><a href='../../../../publication/cfb30cb7-b187-4954-828e-de7b36405df6' class='mouseoverHref'><em>Ecology of Freshwater Fish</em></a> <strong>16</strong>: 124-132<!--MARK-->","","Article in Journal","3d4a7281-0af6-478b-84ee-23201c102b69","20110525T07:25:30.312+0000","cfb30cb7-b187-4954-828e-de7b36405df6"
"Koehn, J., Brumley, A. & Gehrke, P.","2000","Managing the impacts of Carp.","","","","","","","<!--MARK--><a href='../../../../publication/53722adf-45c1-47fe-b78f-a3834f0ca290' class='mouseoverHref'>Koehn, J., Brumley, A. & Gehrke, P. 2000. Managing the impacts of Carp. Bureau of Rural Sciences (Department of Agriculture, Fisheries and Forestry, Australia), Canberra.</a>","","Miscellaneous","53722adf-45c1-47fe-b78f-a3834f0ca290","20120603T23:41:58.011+0000",""
"Koehn, J.D.","2004","Carp (<I>Cyprinus carpio</I>) as a powerful invader in Australian waterways.","882-894","","Freshwater Biology","","","","<!--MARK--><a href='../../../../publication/4a913f33-ecd1-4e6d-be80-156ddb20e0af' class='mouseoverHref'>Koehn, J.D. 2004. Carp (<I>Cyprinus carpio</I>) as a powerful invader in Australian waterways.</a> <!--MARK--><!--MARK--><a href='../../../../publication/66368b3b-2c41-4710-a418-1baa273c6da7' class='mouseoverHref'><em>Freshwater Biology</em></a> <strong>49</strong>(7): 882-894<!--MARK-->","","Article in Journal","4a913f33-ecd1-4e6d-be80-156ddb20e0af","20120427T14:25:36.102+0000","66368b3b-2c41-4710-a418-1baa273c6da7"
"Koster, W.M., Raadik, T.A. & Clunie, P.","2002","Scoping study of the potential spread and impact of the exotic fish Oriental weatherloach in the Murray-Darling Basin, Australia: a draft management strategy.","pp. 15","","","","","","<!--MARK--><a href='../../../../publication/05c9af60-6ab7-47b1-a51d-dd576784d319' class='mouseoverHref'>Koster, W.M., Raadik, T.A. & Clunie, P. 2002. Scoping study of the potential spread and impact of the exotic fish Oriental weatherloach in the Murray-Darling Basin, Australia: a draft management strategy. Arthur Rylah Institute for Environmental Research, Melbourne. pp. 15</a>","","Miscellaneous","05c9af60-6ab7-47b1-a51d-dd576784d319","20110525T07:30:27.905+0000",""
"Koster, W.M., Raadik, T.A. & Clunie, P.","2002","Scoping study of the potential spread and impact of the exotic fish Oriental weatherloach in the Murray-Darling Basin, Australia: a resource document.","pp. 78","","","","","","<!--MARK--><a href='../../../../publication/22731727-bcf9-487d-80a8-7670b2c14ec2' class='mouseoverHref'>Koster, W.M., Raadik, T.A. & Clunie, P. 2002. Scoping study of the potential spread and impact of the exotic fish Oriental weatherloach in the Murray-Darling Basin, Australia: a resource document. Report to Agriculture, Fisheries, Forestry, Australia under Murray-Darling 2001 FishRehab Program. Victoria, Freshwater Ecology, Arthur Rylah Institute for Environmental Research. pp. 78</a>","","Miscellaneous","22731727-bcf9-487d-80a8-7670b2c14ec2","20110527T04:02:01.491+0000",""
"Lacépède, B.G.","1803","Histoire Naturelle des Poissons","803 pp. 21 pls","","","","","chez Plassan","<!--MARK--><a href='../../../../publication/0d5f1fd9-2110-41fe-9b28-b17111fc92f6' class='mouseoverHref'>Lacépède, B.G. 1803. <em>Histoire Naturelle des Poissons</em>. Paris : chez Plassan Vol. 5 803 pp. 21 pls.</a><!--MARK-->","","Book","0d5f1fd9-2110-41fe-9b28-b17111fc92f6","20081009T05:11:37.000+0000",""
"Larson, H.K. & Martin, K.C.","1990","Freshwater Fishes of the Northern Territory. <i>Northern Territory Museum of Arts and Sciences Handbook Series Number 1</i>","102 pp. 73 figs","","","","","Northern Territory Museum of Arts and Sciences","<!--MARK--><a href='../../../../publication/1a43303c-0683-4b7c-9e19-147d153c3c47' class='mouseoverHref'>Larson, H.K. & Martin, K.C. 1990. <em>Freshwater Fishes of the Northern Territory. <i>Northern Territory Museum of Arts and Sciences Handbook Series Number 1</i></em>. Darwin : Northern Territory Museum of Arts and Sciences 102 pp. 73 figs.</a><!--MARK-->","","Book","1a43303c-0683-4b7c-9e19-147d153c3c47","20081009T05:11:37.000+0000",""
"Lin, S.-Y.","1932","New cyprinid fishes from White Cloud Mountain, Canton","379-383","","Lingnan Science Journal","","","","<!--MARK--><a href='../../../../publication/971842de-4290-4982-842e-80985ee9d0f9' class='mouseoverHref'>Lin, S.-Y. 1932. New cyprinid fishes from White Cloud Mountain, Canton.</a> <!--MARK--><!--MARK--><a href='../../../../publication/c2425300-28b0-4887-b631-ba225f1c4503' class='mouseoverHref'><em>Lingnan Science Journal</em></a> <strong>11</strong>(3): 379-383<!--MARK-->","","Article in Journal","971842de-4290-4982-842e-80985ee9d0f9","20081009T05:11:37.000+0000","c2425300-28b0-4887-b631-ba225f1c4503"
"Linnaeus, C.","1758","Systema naturae per regna tria naturae, secundem classes, ordines, genera, species, cum characteribus, differentis, synonymis, locis. Editio decima, reformata","824","","","","","Laurentii Salvii","<!--MARK--><a href='../../../../publication/95f7aebe-acdc-4241-a7a8-403bf099042e' class='mouseoverHref'>Linnaeus, C. 1758. <em>Systema naturae per regna tria naturae, secundem classes, ordines, genera, species, cum characteribus, differentis, synonymis, locis. Editio decima, reformata</em>. Holmiae : Laurentii Salvii Tomus I 824 pp.</a><!--MARK-->","","Book","95f7aebe-acdc-4241-a7a8-403bf099042e","20171116T23:58:37.127+0000",""
"Lintermans, M.","2004","Human-assisted dispersal of alien freshwater fish in Australia.","481-501","","New Zealand Journal of Marine and Freshwater Research","","","","<!--MARK--><a href='../../../../publication/86bf10fd-a4cc-456a-9f06-eb7a42c6363e' class='mouseoverHref'>Lintermans, M. 2004. Human-assisted dispersal of alien freshwater fish in Australia.</a> <!--MARK--><!--MARK--><a href='../../../../publication/686c064a-68fc-4942-84e9-39f077c7e74e' class='mouseoverHref'><em>New Zealand Journal of Marine and Freshwater Research</em></a> <strong>38</strong>(3): 481-501<!--MARK-->","","Article in Journal","86bf10fd-a4cc-456a-9f06-eb7a42c6363e","20120322T12:36:11.120+0000","686c064a-68fc-4942-84e9-39f077c7e74e"
"Lintermans, M.","2009","Fishes of the Murray-Darling Basin -- An Introductory Guide","157 pp.","","","","","Murray-Darling Basin Commission","<!--MARK--><a href='../../../../publication/c390c7d1-95b8-433c-a143-493503e0b9c4' class='mouseoverHref'>Lintermans, M. 2009. <em>Fishes of the Murray-Darling Basin -- An Introductory Guide</em>. Canberra : Murray-Darling Basin Commission 157 pp.</a><!--MARK--> [MDBC Publication Number 10/07]","MDBC Publication Number 10/07","Book","c390c7d1-95b8-433c-a143-493503e0b9c4","20140416T00:08:14.260+0000",""
"Lintermans, M. & J. Burchmore","1996","Cobitidae","p. 114","Freshwater Fishes of South-eastern Australia","","","","","<!--MARK--><a href='../../../../publication/c683bddd-a543-42ce-8c3b-42db38b89458' class='mouseoverHref'>Lintermans, M. & J. Burchmore 1996. Cobitidae. p. 114</a> <!--MARK--><em>in</em> <!--MARK--><a href='../../../../publication/67ff2ab4-cd78-47b7-8a56-0b9412a172c5' class='mouseoverHref'>McDowall, R.M. (ed.). <em>Freshwater Fishes of South-eastern Australia</em>. Sydney : Reed Books 247 pp.</a><!--MARK-->","","Chapter in Book","c683bddd-a543-42ce-8c3b-42db38b89458","20110525T06:48:47.432+0000","67ff2ab4-cd78-47b7-8a56-0b9412a172c5"
"Mayden, R.L., Chen, W-J., Bart, H.L., Doosey, M.H., Simons, A.M., Tang, K.L., Wood, R.R., Agnew, M.K., Yang, L., Hirt, M.V., Clements, M.D., Saitoh, K., Sado, T., Miya, M. & Nishida, M.","2009","Reconstructing the phylogenetic relationships of the earth's most diverse clade of freshwater fishes--order Cypriniformes (Actinopterygii: Ostariophysi): A case study using multiple nuclear loci and the mitochondrial genome.","500-514","","Molecular Phylogenetics and Evolution","","","","<!--MARK--><a href='../../../../publication/2d7d7f91-954c-4700-a859-28017ce08253' class='mouseoverHref'>Mayden, R.L., Chen, W-J., Bart, H.L., Doosey, M.H., Simons, A.M., Tang, K.L., Wood, R.R., Agnew, M.K., Yang, L., Hirt, M.V., Clements, M.D., Saitoh, K., Sado, T., Miya, M. & Nishida, M. 2009. Reconstructing the phylogenetic relationships of the earth's most diverse clade of freshwater fishes--order Cypriniformes (Actinopterygii: Ostariophysi): A case study using multiple nuclear loci and the mitochondrial genome.</a> <!--MARK--><!--MARK--><a href='../../../../publication/db034f3c-0160-42a2-a6c9-84156be3b7b8' class='mouseoverHref'><em>Molecular Phylogenetics and Evolution</em></a> <strong>51</strong>: 500-514<!--MARK-->","","Article in Journal","2d7d7f91-954c-4700-a859-28017ce08253","20110428T08:15:36.355+0000","db034f3c-0160-42a2-a6c9-84156be3b7b8"
"McCulloch, A.R.","1930","A check-list of the fishes recorded from Australia","1-534","","Memoirs of the Australian Museum","","","","<!--MARK--><a href='../../../../publication/ebe64e89-159f-42c3-8b08-52b49ff1a082' class='mouseoverHref'>McCulloch, A.R. 1930. A check-list of the fishes recorded from Australia.</a> <!--MARK--><!--MARK--><a href='../../../../publication/272826c2-c2bf-425b-bd6f-11ddaf2aaeaa' class='mouseoverHref'><em>Memoirs of the Australian Museum</em></a> <strong>5</strong>(1-4): 1-534<!--MARK-->","","Article in Journal","ebe64e89-159f-42c3-8b08-52b49ff1a082","20081009T05:11:37.000+0000","272826c2-c2bf-425b-bd6f-11ddaf2aaeaa"
"McDowall, R.M. (ed.)","1980","Freshwater Fishes of South-eastern Australia","208 pp., figs, 32 pls","","","","","A.H. & A.W. Reed","<!--MARK--><a href='../../../../publication/33362281-f2a0-4be5-8362-8cb349399c0c' class='mouseoverHref'>McDowall, R.M. (ed.) 1980. <em>Freshwater Fishes of South-eastern Australia</em>. Sydney : A.H. & A.W. Reed 208 pp., figs, 32 pls.</a><!--MARK-->","","Book","33362281-f2a0-4be5-8362-8cb349399c0c","20130716T08:46:02.636+0000",""
"McDowall, R.M. (ed.)","1996","Freshwater Fishes of South-eastern Australia","247 pp.","","","","","Reed Books","<!--MARK--><a href='../../../../publication/67ff2ab4-cd78-47b7-8a56-0b9412a172c5' class='mouseoverHref'>McDowall, R.M. (ed.) 1996. <em>Freshwater Fishes of South-eastern Australia</em>. Sydney : Reed Books 247 pp.</a><!--MARK-->","","Book","67ff2ab4-cd78-47b7-8a56-0b9412a172c5","20151124T02:20:10.589+0000",""
"McKay, R.J.","1984","Introductions of exotic fishes in Australia","177-199","Distribution, Biology and Management of Exotic Fishes","","","","","<!--MARK--><a href='../../../../publication/34900dcb-ef33-4e23-981c-57b061aa271a' class='mouseoverHref'>McKay, R.J. 1984. Introductions of exotic fishes in Australia. pp. 177-199</a> <!--MARK--><em>in</em> <!--MARK--><a href='../../../../publication/2e8f414f-5b6b-4bf0-a308-06df54c51297' class='mouseoverHref'>Courtnay, W.R. Jr & Staffer, J.R. Jr (eds). <em>Distribution, Biology and Management of Exotic Fishes</em>. Baltimore : John Hopkins University Press.</a><!--MARK-->","","Chapter in Book","34900dcb-ef33-4e23-981c-57b061aa271a","20081009T05:11:37.000+0000","2e8f414f-5b6b-4bf0-a308-06df54c51297"
"McKay, R.J.","1989","Exotic and translocated freshwater fishes in Australia","21-34","Exotic aquatic organisms in Asia: Proceedings of the workshop on introduction of exotic aquatic organisms in Asia","","","","","<!--MARK--><a href='../../../../publication/de9de99d-a927-4418-a11c-93c46ea16a07' class='mouseoverHref'>McKay, R.J. 1989. Exotic and translocated freshwater fishes in Australia. pp. 21-34</a> <!--MARK--><em>in</em> <!--MARK--><a href='../../../../publication/b8fee0de-5cc2-4e25-b142-770dfd1cb18e' class='mouseoverHref'>De Silva, S.S. (ed.). <em>Exotic aquatic organisms in Asia: Proceedings of the workshop on introduction of exotic aquatic organisms in Asia</em>. Manila, Philippines : Asian Fisheries Society Asian Fish. Soc. Spec. Publ. 3. 154 pp.</a><!--MARK-->","","Chapter in Book","de9de99d-a927-4418-a11c-93c46ea16a07","20081009T05:11:37.000+0000","b8fee0de-5cc2-4e25-b142-770dfd1cb18e"
"McLeod, R.","2004","Counting the cost: Impact of invasive animals in Australia 2004.","pp. 79","","","","","","<!--MARK--><a href='../../../../publication/4a80a6d4-dc27-4106-ab67-3576976d277b' class='mouseoverHref'>McLeod, R. 2004. Counting the cost: Impact of invasive animals in Australia 2004. Cooperative Research Centre for Pest Animal Control, Canberra. pp. 79</a>","","Miscellaneous","4a80a6d4-dc27-4106-ab67-3576976d277b","20120427T16:17:02.843+0000",""
"Merrick, J.R. & Schmida, G.E.","1984","Australian Freshwater Fishes Biology and Management","409 pp. figs 280 col. figs","","","","","J.R. Merrick","<!--MARK--><a href='../../../../publication/6324890d-686a-4aef-9a8f-98a4f31eb4b6' class='mouseoverHref'>Merrick, J.R. & Schmida, G.E. 1984. <em>Australian Freshwater Fishes Biology and Management</em>. Sydney : J.R. Merrick 409 pp. figs 280 col. figs.</a><!--MARK-->","","Book","6324890d-686a-4aef-9a8f-98a4f31eb4b6","20081009T05:11:37.000+0000",""
"Mitchel, B.D.","1979","Aspects of growth and feeding in golden carp, <I>Carassius auratus</I>, from South Australia.","137-144","","Transactions of the Royal Society of South Australia","","","","<!--MARK--><a href='../../../../publication/668c8dba-26d1-4f68-80fc-036307240363' class='mouseoverHref'>Mitchel, B.D. 1979. Aspects of growth and feeding in golden carp, <I>Carassius auratus</I>, from South Australia.</a> <!--MARK--><!--MARK--><a href='../../../../publication/8b48b0a3-dd7a-4aea-be0d-10a223710ebc' class='mouseoverHref'><em>Transactions of the Royal Society of South Australia</em></a> <strong>103</strong>(6): 137-144<!--MARK-->","","Article in Journal","668c8dba-26d1-4f68-80fc-036307240363","20120603T22:41:12.403+0000","8b48b0a3-dd7a-4aea-be0d-10a223710ebc"
"Morgan, D. & Beatty, S.","2008","Shame File: Alien Creature Feature (No. 3): Rosy Barb <i>Puntius conchonius</i> (Hamilton, 1822) (Pisces: Cyprinidae).","85-87","","Australian Society for Fish Biology Newsletter","","","","<!--MARK--><a href='../../../../publication/1521549e-80a0-45b8-8d58-e47df44b71e2' class='mouseoverHref'>Morgan, D. & Beatty, S. 2008. Shame File: Alien Creature Feature (No. 3): Rosy Barb <i>Puntius conchonius</i> (Hamilton, 1822) (Pisces: Cyprinidae).</a> <!--MARK--><!--MARK--><a href='../../../../publication/ef2346b6-b729-4e19-a378-6f1a5ac7d0f2' class='mouseoverHref'><em>Australian Society for Fish Biology Newsletter</em></a> <strong>38</strong>(1): 85-87<!--MARK-->","","Article in Journal","1521549e-80a0-45b8-8d58-e47df44b71e2","20130124T03:41:06.744+0000","ef2346b6-b729-4e19-a378-6f1a5ac7d0f2"
"Morgan, D.L., Gill, H.S., Maddern, M.G. & Beatty, S.J.","2004","Distribution and impacts of introduced freshwater fishes in Western Australia","511-523","","New Zealand Journal of Marine and Freshwater Research","","","","<!--MARK--><a href='../../../../publication/78aa47eb-6eec-4d46-8788-0ca1c8ac64d0' class='mouseoverHref'>Morgan, D.L., Gill, H.S., Maddern, M.G. & Beatty, S.J. 2004. Distribution and impacts of introduced freshwater fishes in Western Australia.</a> <!--MARK--><!--MARK--><a href='../../../../publication/686c064a-68fc-4942-84e9-39f077c7e74e' class='mouseoverHref'><em>New Zealand Journal of Marine and Freshwater Research</em></a> <strong>38</strong>: 511-523<!--MARK-->","","Article in Journal","78aa47eb-6eec-4d46-8788-0ca1c8ac64d0","20130129T03:19:14.665+0000","686c064a-68fc-4942-84e9-39f077c7e74e"
"Morgan, D.L. & Beatty, S.J.","2007","Feral Goldfish (<I>Carassius auratus</I>) in Western Australia: a case study from the Vasse River","151-156","","Journal of the Royal Society of Western Australia","","","","<!--MARK--><a href='../../../../publication/95e5d806-1cda-4fdc-9113-df2976c76fc1' class='mouseoverHref'>Morgan, D.L. & Beatty, S.J. 2007. Feral Goldfish (<I>Carassius auratus</I>) in Western Australia: a case study from the Vasse River.</a> <!--MARK--><!--MARK--><a href='../../../../publication/666efb8f-4a3f-4a3d-ae40-e9ab98f3cdf5' class='mouseoverHref'><em>Journal of the Royal Society of Western Australia</em></a> <strong>90</strong>: 151-156<!--MARK-->","","Article in Journal","95e5d806-1cda-4fdc-9113-df2976c76fc1","20120603T22:38:21.891+0000","666efb8f-4a3f-4a3d-ae40-e9ab98f3cdf5"
"Morison, A. & Humes, D.","1990","Carp (Cyprinus carpio L.) in Australia","pp. 110-113","Australian Society for Fish Biology Workshop: Introduced and translocated fishes and their ecological effects. Bureau of Rural Resources Proceedings No.8.","","","","","<!--MARK--><a href='../../../../publication/99ee36f1-2a80-4032-a981-bf549cd098c9' class='mouseoverHref'>Morison, A. & Humes, D. 1990. Carp (Cyprinus carpio L.) in Australia. pp. 110-113</a> <!--MARK--><em>in</em> <!--MARK--><a href='../../../../publication/a906247c-e8c4-4c67-8a00-7c4fe8692cb4' class='mouseoverHref'>Pollard, D.A. <em>Australian Society for Fish Biology Workshop: Introduced and translocated fishes and their ecological effects. Bureau of Rural Resources Proceedings No.8</em>. Canberra, ACT : Australian Government Publishing Service pp.</a><!--MARK-->","","Chapter in Book","99ee36f1-2a80-4032-a981-bf549cd098c9","20111107T05:01:55.076+0000","a906247c-e8c4-4c67-8a00-7c4fe8692cb4"
"Nelson, J.S.","2006","Fishes of the World","601 pp.","","","","","John Wiley & Sons, Inc.","<!--MARK--><a href='../../../../publication/1779d514-b8ea-4031-8b5b-d668b33699cd' class='mouseoverHref'>Nelson, J.S. 2006. <em>Fishes of the World</em>. Hoboken, New Jersey : John Wiley & Sons, Inc. 601 pp.</a><!--MARK-->","","Book","1779d514-b8ea-4031-8b5b-d668b33699cd","20081009T05:11:37.000+0000",""
"Nilsson, S.","1832","<i>Prodromus Ichthyologiae</i>","","","","","","","<!--MARK--><a href='../../../../publication/96922319-5757-4e70-a892-a865f73900e7' class='mouseoverHref'>Nilsson, S. 1832. <i>Prodromus Ichthyologiae</i>. Scandinaviae. Lundae Vol. 4 124 pp.</a>","","Miscellaneous","96922319-5757-4e70-a892-a865f73900e7","20081009T05:11:37.000+0000",""
"Paxton, J.R., Hoese, D.F., Allen, G.R. & Hanley, J.E. (eds)","1989","Zoological Catalogue of Australia. Pisces: Petromyzontidae to Carangidae","665 pp.","","","","","Australian Government Publishing Service","<!--MARK--><a href='../../../../publication/cfef21f5-ff30-40b6-968c-37f5d1b0fcb4' class='mouseoverHref'>Paxton, J.R., Hoese, D.F., Allen, G.R. & Hanley, J.E. (eds) 1989. <em>Zoological Catalogue of Australia. Pisces: Petromyzontidae to Carangidae</em>. Canberra : Australian Government Publishing Service Vol. 7 665 pp.</a><!--MARK-->","","Book","cfef21f5-ff30-40b6-968c-37f5d1b0fcb4","20081009T05:11:37.000+0000",""
"Prokop, F.","2002","Australian Fish Guide","256 pp.","","","","","Australian Fishing Network","<!--MARK--><a href='../../../../publication/1eece4ac-1178-4f82-91e2-d1c0b64b0841' class='mouseoverHref'>Prokop, F. 2002. <em>Australian Fish Guide</em>. Croydon South, Victoria : Australian Fishing Network 256 pp.</a><!--MARK-->","","Book","1eece4ac-1178-4f82-91e2-d1c0b64b0841","20081009T05:11:37.000+0000",""
"Raadik, T.A., Koster, W. & Lintermans, M.","2005","Shame file: alien creature feature No. 1, Oriental weatherloach <I>Misgurnus anguillicaudatus</I> (Cantor, 1842) (Pisces: Cobitidae).","55-58","","Australian Society for Fish Biology Newsletter","","","","<!--MARK--><a href='../../../../publication/7db353ef-5b9c-4ca6-babf-c197174dc2d1' class='mouseoverHref'>Raadik, T.A., Koster, W. & Lintermans, M. 2005. Shame file: alien creature feature No. 1, Oriental weatherloach <I>Misgurnus anguillicaudatus</I> (Cantor, 1842) (Pisces: Cobitidae).</a> <!--MARK--><!--MARK--><a href='../../../../publication/ef2346b6-b729-4e19-a378-6f1a5ac7d0f2' class='mouseoverHref'><em>Australian Society for Fish Biology Newsletter</em></a> <strong>35</strong>(1): 55-58<!--MARK-->","","Article in Journal","7db353ef-5b9c-4ca6-babf-c197174dc2d1","20110525T07:46:57.825+0000","ef2346b6-b729-4e19-a378-6f1a5ac7d0f2"
"Rafinesque, C.S.","1820","Description of the silures or catfishes of the river Ohio","48-52","","Quarterly Journal of Science, Literature and the Arts","","","","<!--MARK--><a href='../../../../publication/4b73d8a3-bc3a-4922-a3ea-21849e1987b7' class='mouseoverHref'>Rafinesque, C.S. 1820. Description of the silures or catfishes of the river Ohio.</a> <!--MARK--><!--MARK--><a href='../../../../publication/b6001d82-7f4a-43d4-b500-21562be67214' class='mouseoverHref'><em>Quarterly Journal of Science, Literature and the Arts</em></a> <strong>9</strong>: 48-52<!--MARK-->","","Article in Journal","4b73d8a3-bc3a-4922-a3ea-21849e1987b7","20081009T05:11:37.000+0000","b6001d82-7f4a-43d4-b500-21562be67214"
"Rowe, D.K., Moore, A., Giorgetti, A., Maclean, C., Grace, P., Wadhwa, S., & Cooke, J.","2008","Review of the impacts of gambusia, redfin perch, tench, roach, yellowfin goby and streaked goby in Australia","pp. 241","","","","","","<!--MARK--><a href='../../../../publication/2fcd4cf4-be25-495d-9fbe-a37d658965cb' class='mouseoverHref'>Rowe, D.K., Moore, A., Giorgetti, A., Maclean, C., Grace, P., Wadhwa, S., & Cooke, J. 2008. Review of the impacts of gambusia, redfin perch, tench, roach, yellowfin goby and streaked goby in Australia. Australian Government Department of the Environment, Water, Heritage and the Arts. pp. 241</a>","","Miscellaneous","2fcd4cf4-be25-495d-9fbe-a37d658965cb","20111110T23:36:44.766+0000",""
"Saitoh, K., Sado, T., Mayden, R.L., Hanzawa, N., Nakamura, K., Nishida, M. & Miya, M.","2006","Mitogenomic evolution and interrelationships of the Cypriniformes (Actinopterygii: Ostariophysi): the first evidence towards resolution of higher-level relationships of the world's largest freshwater-fish clade based on 59 whole mitogenome sequences.","826-841","","Journal of Molecular Evolution","","","","<!--MARK--><a href='../../../../publication/12b33c1e-8365-40e5-8281-dc9b4ad9e061' class='mouseoverHref'>Saitoh, K., Sado, T., Mayden, R.L., Hanzawa, N., Nakamura, K., Nishida, M. & Miya, M. 2006. Mitogenomic evolution and interrelationships of the Cypriniformes (Actinopterygii: Ostariophysi): the first evidence towards resolution of higher-level relationships of the world's largest freshwater-fish clade based on 59 whole mitogenome sequences.</a> <!--MARK--><!--MARK--><a href='../../../../publication/39e03dc8-dabf-4230-91c5-e9bf107ec56b' class='mouseoverHref'><em>Journal of Molecular Evolution</em></a> <strong>63</strong>: 826-841<!--MARK-->","","Article in Journal","12b33c1e-8365-40e5-8281-dc9b4ad9e061","20110428T07:59:58.110+0000","39e03dc8-dabf-4230-91c5-e9bf107ec56b"
"Seafood Services Australia","2008","Australian Fish Names Standard","","","","","","","<!--MARK--><a href='../../../../publication/4be1ce0c-a18a-4795-a6c0-b9ecb91bb936' class='mouseoverHref'>Seafood Services Australia 2008. Australian Fish Names Standard. http://www.fishnames.com.au/.</a>","","Miscellaneous","4be1ce0c-a18a-4795-a6c0-b9ecb91bb936","20081009T05:11:37.000+0000",""
"Shearer, K.D. & Mulley, J.C.","1978","The introduction and Distribution of Carp, <I>Cyprinus carpio</I> Linnaeus, in Australia.","551-563","","Australian Journal of Marine and Freshwater Research","","","","<!--MARK--><a href='../../../../publication/a2309f8e-2e11-432f-b94c-17a9ed4d1677' class='mouseoverHref'>Shearer, K.D. & Mulley, J.C. 1978. The introduction and Distribution of Carp, <I>Cyprinus carpio</I> Linnaeus, in Australia.</a> <!--MARK--><!--MARK--><a href='../../../../publication/49bc154d-4235-4d59-880a-13ca80a86982' class='mouseoverHref'><em>Australian Journal of Marine and Freshwater Research</em></a> <strong>29</strong>: 551-563<!--MARK-->","","Article in Journal","a2309f8e-2e11-432f-b94c-17a9ed4d1677","20120427T16:09:33.034+0000","49bc154d-4235-4d59-880a-13ca80a86982"
