"PUB_AUTHOR","PUB_YEAR","PUB_TITLE","PUB_PAGES","PUB_PARENT_BOOK_TITLE","PUB_PARENT_JOURNAL_TITLE","PUB_PARENT_ARTICLE_TITLE","PUB_PUBLICATION_DATE","PUB_PUBLISHER","PUB_FORMATTED","PUB_QUALIFICATION","PUB_TYPE","PUBLICATION_GUID","PUBLICATION_LAST_UPDATE","PARENT_PUBLICATION_GUID"
"Chan, T.-Y.","1998","Lobsters","973-1043","The Living Marine Resources of the Western Central Pacific. FAO Species Identification Guide for Fisheries Purposes","","","","","<!--MARK--><a href='null19046a8c-557f-4728-b778-cd706b889d80' class='mouseoverHref'>Chan, T.-Y. 1998. Lobsters. pp. 973-1043</a> <!--MARK--><em>in</em> <!--MARK--><a href='nullf0e41cda-715f-4001-afae-c1ac8388b849' class='mouseoverHref'>Carpenter, K.E. & Niem, V.H. (eds). <em>The Living Marine Resources of the Western Central Pacific. FAO Species Identification Guide for Fisheries Purposes</em>. Rome : FAO Vol. 2 687-1396 pp.</a><!--MARK-->","","Chapter in Book","19046a8c-557f-4728-b778-cd706b889d80","20081009T05:11:37.000+0000","f0e41cda-715f-4001-afae-c1ac8388b849"
"Chan, T.Y. & Yu, H.P.","1998","A new reef lobster of the genus <em>Enoplometopus</em> A. Milne Edwards, 1862 (Decapoda, Nephropoidea) from the western and southern Pacific","183-192","","Zoosystema","","","","<!--MARK--><a href='nullb4ee80e2-0ce7-40d7-a9ba-125cf35f9945' class='mouseoverHref'>Chan, T.Y. & Yu, H.P. 1998. A new reef lobster of the genus <em>Enoplometopus</em> A. Milne Edwards, 1862 (Decapoda, Nephropoidea) from the western and southern Pacific.</a> <!--MARK--><!--MARK--><a href='null242db326-4ab2-44e1-b6fc-f07fd38c0136' class='mouseoverHref'><em>Zoosystema</em></a> <strong>20</strong>(2): 183-192<!--MARK-->","","Article in Journal","b4ee80e2-0ce7-40d7-a9ba-125cf35f9945","20170726T07:52:19.289+0000","242db326-4ab2-44e1-b6fc-f07fd38c0136"
"Chan, T.-Y. & Yu, H.-P.","1998","A new reef lobster of the genus <i>Enoplometopus</i> A. Milne Edwards, 1862 (Decapoda, Nephropoidea) from the western and southern Pacific","183-192","","Zoosystematica Rossica","","","","<!--MARK--><a href='null1005cd10-270c-474a-b0ca-d9a74f09597a' class='mouseoverHref'>Chan, T.-Y. & Yu, H.-P. 1998. A new reef lobster of the genus <i>Enoplometopus</i> A. Milne Edwards, 1862 (Decapoda, Nephropoidea) from the western and southern Pacific.</a> <!--MARK--><!--MARK--><a href='null4ebbb65b-72bd-47a8-bad5-f2d860f38d08' class='mouseoverHref'><em>Zoosystematica Rossica</em></a> <strong>20</strong>(2): 183-192<!--MARK-->","","Article in Journal","1005cd10-270c-474a-b0ca-d9a74f09597a","20081009T05:11:37.000+0000","4ebbb65b-72bd-47a8-bad5-f2d860f38d08"
"de Saint Laurent, M.","1988","Enoplometopoidea, nouvelle superfamille de crustacés decapodes Astacidea","59-62","","Comptes Rendus (Hebdomadaires) des Séances de l'Academie des Sciences. Série D. Sciences Naturelles","","","","<!--MARK--><a href='nullc6e66275-33fb-4bce-98e4-3b3f2f044b72' class='mouseoverHref'>de Saint Laurent, M. 1988. Enoplometopoidea, nouvelle superfamille de crustacés decapodes Astacidea.</a> <!--MARK--><!--MARK--><a href='null77294646-7b61-4cee-974d-0ed045692670' class='mouseoverHref'><em>Comptes Rendus (Hebdomadaires) des Séances de l'Academie des Sciences. Série D. Sciences Naturelles</em></a> Ser. III. Sci. Vie <strong>307</strong>(2): 59-62<!--MARK-->","","Article in Journal","c6e66275-33fb-4bce-98e4-3b3f2f044b72","20081009T05:11:37.000+0000","77294646-7b61-4cee-974d-0ed045692670"
"Holthuis, L.B.","1983","Notes on the genus <i>Enoplometopus</i>, with descriptions of a new subgenus and two new species (Crustacea Decapoda, Axiidae)","281-298","","Zoologische Mededelingen (Leiden)","","","","<!--MARK--><a href='nulle72ad58f-250e-4fc6-9ed2-efa2dbfd9b65' class='mouseoverHref'>Holthuis, L.B. 1983. Notes on the genus <i>Enoplometopus</i>, with descriptions of a new subgenus and two new species (Crustacea Decapoda, Axiidae).</a> <!--MARK--><!--MARK--><a href='null42ce8f11-9401-4dfc-ae20-52feb2a315f5' class='mouseoverHref'><em>Zoologische Mededelingen (Leiden)</em></a> <strong>56</strong>(22): 281-298<!--MARK-->","","Article in Journal","e72ad58f-250e-4fc6-9ed2-efa2dbfd9b65","20081009T05:11:37.000+0000","42ce8f11-9401-4dfc-ae20-52feb2a315f5"
"Ng, P.K.L. & Naruse, T.","2014","The lobsters of Christmas Island and Cocos (Keeling) Islands, with new records of <em>Palinurellus wieneckii</em> (De Man, 1881) and <em>Enoplometopus voigtmanni</em> Türkay, 1989 (Crustacea: Decapoda: Palinuridae, Scyllaridae, Enoplometopidae)","305-312","","Raffles Bulletin of Zoology Supplement","","25 Dec 2014","","<!--MARK--><a href='null93188fa5-614d-4fca-9a51-17cc2a36b14b' class='mouseoverHref'>Ng, P.K.L. & Naruse, T. 2014. The lobsters of Christmas Island and Cocos (Keeling) Islands, with new records of <em>Palinurellus wieneckii</em> (De Man, 1881) and <em>Enoplometopus voigtmanni</em> Türkay, 1989 (Crustacea: Decapoda: Palinuridae, Scyllaridae, Enoplometopidae).</a> <!--MARK--><!--MARK--><a href='null458effa2-0b95-4b61-828b-0ad320cfe4d4' class='mouseoverHref'><em>Raffles Bulletin of Zoology Supplement</em></a> <strong>30</strong>: 305-312<!--MARK--> [Date published 25 Dec 2014]","","Article in Journal","93188fa5-614d-4fca-9a51-17cc2a36b14b","20170726T08:04:34.340+0000","458effa2-0b95-4b61-828b-0ad320cfe4d4"
"Randall, J.W.","1840","Catalogue of the Crustacea brought by Thomas Nuttall and J.K. Townsend, from the West Coast of North America and the Sandwich Islands, with descriptions of such species as are apparently new, among which are included several species of different localities, previously existing in the Collection of the Academy","106-147 pls 3-7","","Journal of the Academy of Natural Sciences of Philadelphia","","","","<!--MARK--><a href='nullc1bbb247-d539-4d25-9e8c-399d9a4cca4c' class='mouseoverHref'>Randall, J.W. 1840. Catalogue of the Crustacea brought by Thomas Nuttall and J.K. Townsend, from the West Coast of North America and the Sandwich Islands, with descriptions of such species as are apparently new, among which are included several species of different localities, previously existing in the Collection of the Academy.</a> <!--MARK--><!--MARK--><a href='nullc98f5950-b6d0-4241-b463-5dd7337af662' class='mouseoverHref'><em>Journal of the Academy of Natural Sciences of Philadelphia</em></a> <strong>8</strong>(1): 106-147 pls 3-7<!--MARK-->","","Article in Journal","c1bbb247-d539-4d25-9e8c-399d9a4cca4c","20081009T05:11:37.000+0000","c98f5950-b6d0-4241-b463-5dd7337af662"
"Türkay, M.","1989","<em>Enoplometopus (Hoplometopus) voigtmanni</em> n. sp., ein neuter Riffhummer von den Malediven","225-235","","Senckenbergiana Maritima","","","","<!--MARK--><a href='null1712664d-4935-4858-a879-df3da3d5381a' class='mouseoverHref'>Türkay, M. 1989. <em>Enoplometopus (Hoplometopus) voigtmanni</em> n. sp., ein neuter Riffhummer von den Malediven.</a> <!--MARK--><!--MARK--><a href='nulleba96385-3a02-4e07-82a2-1441553b8007' class='mouseoverHref'><em>Senckenbergiana Maritima</em></a> <strong>20</strong>(5/6): 225-235<!--MARK-->","","Article in Journal","1712664d-4935-4858-a879-df3da3d5381a","20170726T07:58:20.546+0000","eba96385-3a02-4e07-82a2-1441553b8007"
