"PUB_AUTHOR","PUB_YEAR","PUB_TITLE","PUB_PAGES","PUB_PARENT_BOOK_TITLE","PUB_PARENT_JOURNAL_TITLE","PUB_PARENT_ARTICLE_TITLE","PUB_PUBLICATION_DATE","PUB_PUBLISHER","PUB_FORMATTED","PUB_QUALIFICATION","PUB_TYPE","PUBLICATION_GUID","PUBLICATION_LAST_UPDATE","PARENT_PUBLICATION_GUID"
"Busk, G.","1852","An account of the Polyzoa and Sertularian Zoophytes, collected in the voyage of the Rattlesnake on the coast of Australia and the Louisade Archipelago, etc.  Appendix no. IV","343-402","Narrative of the Voyage of H.M.S. Rattlesnake","","","","","<!--MARK--><a href='../publication/e333cb92-39c5-4ecf-84b0-6ec3a204ef32' class='mouseoverHref'>Busk, G. 1852. An account of the Polyzoa and Sertularian Zoophytes, collected in the voyage of the Rattlesnake on the coast of Australia and the Louisade Archipelago, etc.  Appendix no. IV. pp. 343-402</a> <!--MARK--><em>in</em> <!--MARK--><a href='../publication/eebf44ec-6e45-47a7-b6a9-0601d679eda6' class='mouseoverHref'>MacGillivray, J. (ed.). <em>Narrative of the Voyage of H.M.S. Rattlesnake</em>. London : T. & W. Boone Vol. 1.</a><!--MARK-->","","Chapter in Book","e333cb92-39c5-4ecf-84b0-6ec3a204ef32","","eebf44ec-6e45-47a7-b6a9-0601d679eda6"
"Busk, G.","1852","Catalogue of marine Polyzoa in the collection of the British Museum, Part 1","1-54","","","","","Trustees of the British Museum","<!--MARK--><a href='../publication/4571990f-3bec-4e1b-83b9-31f03576551e' class='mouseoverHref'>Busk, G. 1852. <em>Catalogue of marine Polyzoa in the collection of the British Museum, Part 1</em>. London : Trustees of the British Museum pp. 1-54.</a><!--MARK-->","","Book","4571990f-3bec-4e1b-83b9-31f03576551e","",""
"Gordon, D.P.","1989","The marine fauna of New Zealand: Bryozoa: Gymnolaemata (Cheilostomida Ascophorina) from the western south Island continental shelf and slope","1-158","","New Zealand Oceanographic Institute Memoir","","","","<!--MARK--><a href='../publication/5258e7cd-fb27-4b2b-9ac5-ad401bda7dcf' class='mouseoverHref'>Gordon, D.P. 1989. The marine fauna of New Zealand: Bryozoa: Gymnolaemata (Cheilostomida Ascophorina) from the western south Island continental shelf and slope.</a> <!--MARK--><!--MARK--><a href='../publication/d93e6e19-4ad3-4ffb-852b-1ed8062fa3f3' class='mouseoverHref'><em>New Zealand Oceanographic Institute Memoir</em></a> <strong>97</strong>: 1-158<!--MARK-->","","Article in Journal","5258e7cd-fb27-4b2b-9ac5-ad401bda7dcf","","d93e6e19-4ad3-4ffb-852b-1ed8062fa3f3"
"Harmer, S.F.","1902","On the morphology of the Cheilostomata","263-350","","Quarterly Journal of Microscopical Science","","","","<!--MARK--><a href='../publication/1b39b3da-4bb5-463b-bd15-4ae80e503655' class='mouseoverHref'>Harmer, S.F. 1902. On the morphology of the Cheilostomata.</a> <!--MARK--><!--MARK--><a href='../publication/0f162f90-df4f-47f1-908a-687f940ac834' class='mouseoverHref'><em>Quarterly Journal of Microscopical Science</em></a> <strong>46</strong>: 263-350<!--MARK-->","","Article in Journal","1b39b3da-4bb5-463b-bd15-4ae80e503655","","0f162f90-df4f-47f1-908a-687f940ac834"
"Levinsen, G.M.R.","1909","Morphological and systematic studies on the cheilostomatous Bryozoa","431","","","","","Nationale Forfatteres Forlag","<!--MARK--><a href='../publication/9d938d62-ca5d-4ac2-a76f-ac0d0ecd27b0' class='mouseoverHref'>Levinsen, G.M.R. 1909. <em>Morphological and systematic studies on the cheilostomatous Bryozoa</em>. Copenhagen : Nationale Forfatteres Forlag 431 pp.</a><!--MARK-->","","Book","9d938d62-ca5d-4ac2-a76f-ac0d0ecd27b0","",""
