"PUB_AUTHOR","PUB_YEAR","PUB_TITLE","PUB_PAGES","PUB_PARENT_BOOK_TITLE","PUB_PARENT_JOURNAL_TITLE","PUB_PARENT_ARTICLE_TITLE","PUB_PUBLICATION_DATE","PUB_PUBLISHER","PUB_FORMATTED","PUB_QUALIFICATION","PUB_TYPE","PUBLICATION_GUID","PUBLICATION_LAST_UPDATE","PARENT_PUBLICATION_GUID"
"Curtiss, A.","1938","A Short Zoology of Tahiti in the Society Islands","i-xvi, 193 pp.","","","","","Self-published","<!--MARK--><a href='../../../../publication/b64c4c2f-4562-4419-a674-4e97b6d9e462' class='mouseoverHref'>Curtiss, A. 1938. <em>A Short Zoology of Tahiti in the Society Islands</em>. New York : Self-published i-xvi, 193 pp.</a><!--MARK-->","","Book","b64c4c2f-4562-4419-a674-4e97b6d9e462","20100201T01:43:07.529+0000",""
"Dana, J.D.","1851","Crustacea Grapsoidea, (Cyclometopa, Edwardsii): Conspectus Crustacearum quae in Orbis Terrarum circumnavigatione, Carolo Wilkes e classe Reipublicae Foederatae Duce, lexit et descriptsit J.D. Dana","247-254","","Proceedings of the Academy of Natural Sciences, Philadelphia","","","","<!--MARK--><a href='../../../../publication/7e046a96-427e-4389-af76-fe7c4e95af65' class='mouseoverHref'>Dana, J.D. 1851. Crustacea Grapsoidea, (Cyclometopa, Edwardsii): Conspectus Crustacearum quae in Orbis Terrarum circumnavigatione, Carolo Wilkes e classe Reipublicae Foederatae Duce, lexit et descriptsit J.D. Dana.</a> <!--MARK--><!--MARK--><a href='../../../../publication/9dfe7fba-63cc-4968-b0be-a8904006864b' class='mouseoverHref'><em>Proceedings of the Academy of Natural Sciences, Philadelphia</em></a> <strong>5</strong>: 247-254<!--MARK-->","","Article in Journal","7e046a96-427e-4389-af76-fe7c4e95af65","20081009T05:11:37.000+0000","9dfe7fba-63cc-4968-b0be-a8904006864b"
"de Man, J.G.","1879","On some new or imperfectly known Podophthalmous Crustacea of the Leyden Museum","53-73","","Notes from the Leyden Museum","","","","<!--MARK--><a href='../../../../publication/da39541e-480f-420e-ba8b-d926150c59db' class='mouseoverHref'>de Man, J.G. 1879. On some new or imperfectly known Podophthalmous Crustacea of the Leyden Museum.</a> <!--MARK--><!--MARK--><a href='../../../../publication/01b3815f-6454-4d5d-aa9d-e7b82f1ddee9' class='mouseoverHref'><em>Notes from the Leyden Museum</em></a> <strong>1</strong>: 53-73<!--MARK-->","","Article in Journal","da39541e-480f-420e-ba8b-d926150c59db","20081009T05:11:37.000+0000","01b3815f-6454-4d5d-aa9d-e7b82f1ddee9"
"Gray, H.S.","1981","Christmas Island -- Naturally","133 pp.","","","","","Self-Published","<!--MARK--><a href='../../../../publication/9128f61b-ece3-4031-898f-57d666fda3f1' class='mouseoverHref'>Gray, H.S. 1981. <em>Christmas Island -- Naturally</em>. Geraldton,WA : Self-Published 133 pp.</a><!--MARK-->","","Book","9128f61b-ece3-4031-898f-57d666fda3f1","20100210T07:08:57.496+0000",""
"Guinot, D., Ng, N.K. & Rodríguez Moreno, P.A.","2018","Review of grapsoid families for the establishment of a new family for <i>Leptograpsodes</i> Montgomery, 1931, and a new genus of Gecarcinidae H. Milne Edwards, 1837 (Crustacea, Decapoda, Brachyura, Grapsoidea MacLeay, 1838)","547-604","","Zoosystema","","","","<!--MARK--><a href='../../../../publication/5239cc43-f898-41fc-9e4d-79f8e02db451' class='mouseoverHref'>Guinot, D., Ng, N.K. & Rodríguez Moreno, P.A. 2018. Review of grapsoid families for the establishment of a new family for <i>Leptograpsodes</i> Montgomery, 1931, and a new genus of Gecarcinidae H. Milne Edwards, 1837 (Crustacea, Decapoda, Brachyura, Grapsoidea MacLeay, 1838).</a> <!--MARK--><!--MARK--><a href='../../../../publication/242db326-4ab2-44e1-b6fc-f07fd38c0136' class='mouseoverHref'><em>Zoosystema</em></a> <strong>40</strong>(26): 547-604<!--MARK-->","","Article in Journal","5239cc43-f898-41fc-9e4d-79f8e02db451","20200714T00:13:52.081+0000","242db326-4ab2-44e1-b6fc-f07fd38c0136"
"Heller, C.","1862","Neue Crustaceen, gesammelt während der Weltumseglung der k.k. Fregatte Novarra: Zweiter vorläufiger Bericht","519-528","","Verhandlungen der Zoologisch-Botanischen Gesellschaft in Wien","","","","<!--MARK--><a href='../../../../publication/f99dd12c-77f6-48ab-8c1d-6f83938a7242' class='mouseoverHref'>Heller, C. 1862. Neue Crustaceen, gesammelt während der Weltumseglung der k.k. Fregatte Novarra: Zweiter vorläufiger Bericht.</a> <!--MARK--><!--MARK--><a href='../../../../publication/14e4d839-6bc2-42e9-ae1b-979730866002' class='mouseoverHref'><em>Verhandlungen der Zoologisch-Botanischen Gesellschaft in Wien</em></a> <strong>12</strong>: 519-528<!--MARK-->","","Article in Journal","f99dd12c-77f6-48ab-8c1d-6f83938a7242","20081009T05:11:37.000+0000","14e4d839-6bc2-42e9-ae1b-979730866002"
"Herbst, J.F.W.","1796","<i>Versuch einer Naturgeschichte der Krabben und Krebse nebst einer Systematischen Beischreibung ihrer Verschieden Arten</i>","","","","","","","<!--MARK--><a href='../../../../publication/7e285798-e694-4d2d-867b-fbdbb4c70ccf' class='mouseoverHref'>Herbst, J.F.W. 1796. <i>Versuch einer Naturgeschichte der Krabben und Krebse nebst einer Systematischen Beischreibung ihrer Verschieden Arten</i>. Berlin & Stralsund Vol. 2 Pt 6 pp. 163-226 pls 41-46.</a> <!--MARK--> [published from 1782-1804]","published from 1782-1804","Miscellaneous","7e285798-e694-4d2d-867b-fbdbb4c70ccf","20110124T05:12:09.960+0000",""
"Hicks, J., Rumpff, H. & Yorkston, H.","1984","Christmas Crabs","","","","","","Christmas Island Natural History Association","<!--MARK--><a href='../../../../publication/edbe30ee-dc8a-426c-80e8-d566b85dc274' class='mouseoverHref'>Hicks, J., Rumpff, H. & Yorkston, H. 1984. <em>Christmas Crabs</em>. Christmas Island : Christmas Island Natural History Association.</a><!--MARK-->","","Book","edbe30ee-dc8a-426c-80e8-d566b85dc274","20081009T05:11:37.000+0000",""
"Kossmann, R.","1878","Kurze Notizen über einige neue Crustaceen sowie über neue Fundorte einiger bereits beschriebenen","251-258","","Archiv für Naturgeschichte","","","","<!--MARK--><a href='../../../../publication/e24c14bd-f2db-4971-ba5f-c27f1f1c299b' class='mouseoverHref'>Kossmann, R. 1878. Kurze Notizen über einige neue Crustaceen sowie über neue Fundorte einiger bereits beschriebenen.</a> <!--MARK--><!--MARK--><a href='../../../../publication/f5b5f7c7-fc53-4502-951d-1c96b680d874' class='mouseoverHref'><em>Archiv für Naturgeschichte</em></a> <strong>44</strong>(1): 251-258<!--MARK-->","","Article in Journal","e24c14bd-f2db-4971-ba5f-c27f1f1c299b","20081009T05:11:37.000+0000","f5b5f7c7-fc53-4502-951d-1c96b680d874"
"Lai, J.C.Y., Shih, H.T. & Ng, P.K.L.","2017","The systematics of land crabs of the genus <em>Gecarcoidea</em> and recognition of a pseudocryptic species, <em>G. humei</em>, from the eastern Indian Ocean (Crustacea: Decapoda: Gecarcinidae)","406-426","","Invertebrate Systematics","","","","<!--MARK--><a href='../../../../publication/9055da5a-c348-4801-9fe9-f42a848dbd27' class='mouseoverHref'>Lai, J.C.Y., Shih, H.T. & Ng, P.K.L. 2017. The systematics of land crabs of the genus <em>Gecarcoidea</em> and recognition of a pseudocryptic species, <em>G. humei</em>, from the eastern Indian Ocean (Crustacea: Decapoda: Gecarcinidae).</a> <!--MARK--><!--MARK--><a href='../../../../publication/7ef62e6c-73cc-4912-8ea7-5752f95e8e8a' class='mouseoverHref'><em>Invertebrate Systematics</em></a> <strong>31</strong>(4): 406-426<!--MARK-->","","Article in Journal","9055da5a-c348-4801-9fe9-f42a848dbd27","20170731T06:26:45.457+0000","7ef62e6c-73cc-4912-8ea7-5752f95e8e8a"
"Latreille, P.A.","1828","Encyclopédie Méthodique. Histoire Naturelle. Entomologie, ou Histoire naturelle des Crustacés, des Arachnides et des Insectes","345-852 pp.","","","","","Le Peletier de St-Fargeau","<!--MARK--><a href='../../../../publication/b210c895-e7a0-426f-a270-321d60ec5335' class='mouseoverHref'>Latreille, P.A. 1828. <em>Encyclopédie Méthodique. Histoire Naturelle. Entomologie, ou Histoire naturelle des Crustacés, des Arachnides et des Insectes</em>. Serville et Guérin : Le Peletier de St-Fargeau Vol. 10(2) 345-852 pp.</a><!--MARK-->","","Book","b210c895-e7a0-426f-a270-321d60ec5335","20081009T05:11:37.000+0000",""
"MacLeay, W.S.","1838","On the Brachyurous Decapod Crustacea brought from the Cape by Dr Smith","75 pp. 4 pls","","","","","","<!--MARK--><a href='../../../../publication/9b64cfc2-6861-4f91-87d2-e4e6ec3634d2' class='mouseoverHref'>MacLeay, W.S. 1838. On the Brachyurous Decapod Crustacea brought from the Cape by Dr Smith. pp. 53-71 pl. 3 <I>in, Illustrations of the Annulosa of South Africa</I>; being a portion of the objects of natural history collected during an expedition into the interior of South Africa, under the direction of Dr Andrew Smith, in the years 1834, 1835, and 1836; fitted out by The Cape of Good Hope Association for Exploring Central Africa. London. 75 pp. 4 pls</a>","","Miscellaneous","9b64cfc2-6861-4f91-87d2-e4e6ec3634d2","20081009T05:11:37.000+0000",""
"Manning, R.B. & Holthuis, L.B.","1981","West African Brachyuran Crabs (Crustacea: Decapoda)","i-xii, 1-379 figs 1-88, 2 appendices","","Smithsonian Contributions to Zoology","","","","<!--MARK--><a href='../../../../publication/e26d6150-04f7-4b04-b228-b1763c36442e' class='mouseoverHref'>Manning, R.B. & Holthuis, L.B. 1981. West African Brachyuran Crabs (Crustacea: Decapoda).</a> <!--MARK--><!--MARK--><a href='../../../../publication/cf8b640e-574a-4713-8a6f-74b8ef9e2f2c' class='mouseoverHref'><em>Smithsonian Contributions to Zoology</em></a> <strong>No. 306</strong>: i-xii, 1-379 figs 1-88, 2 appendices<!--MARK-->","","Article in Journal","e26d6150-04f7-4b04-b228-b1763c36442e","20081009T05:11:37.000+0000","cf8b640e-574a-4713-8a6f-74b8ef9e2f2c"
"Miers, E.J.","1886","Report on the Brachyura collected by H.M.S. <i>Challenger</i> during the Years 1873-76","i-xlix 1-362 pls 1-29","","Report on the Scientific Results of the Voyage of H.M.S. Challenger 1873-1876, Zoology","","","","<!--MARK--><a href='../../../../publication/58f10b16-251d-4c61-9489-c861448ce232' class='mouseoverHref'>Miers, E.J. 1886. Report on the Brachyura collected by H.M.S. <i>Challenger</i> during the Years 1873-76.</a> <!--MARK--><!--MARK--><a href='../../../../publication/1db4d8a3-1c27-4eff-aef5-d93514e06c4f' class='mouseoverHref'><em>Report on the Scientific Results of the Voyage of H.M.S. Challenger 1873-1876, Zoology</em></a> <strong>17</strong>(49): i-xlix 1-362 pls 1-29<!--MARK-->","","Article in Journal","58f10b16-251d-4c61-9489-c861448ce232","20130124T04:31:49.403+0000","1db4d8a3-1c27-4eff-aef5-d93514e06c4f"
"Milne Edwards, A.","1890","Notes sur les Crustacés du genre <i>Pelocarcinus</i>","169-176 pls 12-13","","Nouvelles Archives du Muséum d'Histoire Naturelle. Paris","","","","<!--MARK--><a href='../../../../publication/94c508bd-03f7-40ca-b0dd-2d2052814ea3' class='mouseoverHref'>Milne Edwards, A. 1890. Notes sur les Crustacés du genre <i>Pelocarcinus</i>.</a> <!--MARK--><!--MARK--><a href='../../../../publication/32f9675c-85d3-47c1-9d80-ec0519ac2c6d' class='mouseoverHref'><em>Nouvelles Archives du Muséum d'Histoire Naturelle. Paris</em></a> 3e <strong>II</strong>(2e): 169-176 pls 12-13<!--MARK-->","","Article in Journal","94c508bd-03f7-40ca-b0dd-2d2052814ea3","20190307T05:31:03.351+0000","32f9675c-85d3-47c1-9d80-ec0519ac2c6d"
"Milne Edwards, H.","1837","Histoire Naturelle des Crustacés, comprenant l'anatomie, la physiologie et la classification de ces animaux","532 pp., Atlas 32 pp., 42 pls","","","","","Libraire Encyclopedique de Roret","<!--MARK--><a href='../../../../publication/0d954e54-4a0f-4c7d-8c90-e03cdfed791a' class='mouseoverHref'>Milne Edwards, H. 1837. <em>Histoire Naturelle des Crustacés, comprenant l'anatomie, la physiologie et la classification de ces animaux</em>. Paris : Libraire Encyclopedique de Roret Vol. 2 532 pp., Atlas 32 pp., 42 pls.</a><!--MARK-->","","Book","0d954e54-4a0f-4c7d-8c90-e03cdfed791a","20081009T05:11:37.000+0000",""
"Milne Edwards, H.","1853","Mémoires sur la famille des Ocypodiens, suite","163-228 pls 6-11","","Annales des Sciences Naturelles, Paris","","","","<!--MARK--><a href='../../../../publication/a958ff03-2998-4b52-9be8-a8e1cb14870f' class='mouseoverHref'>Milne Edwards, H. 1853. Mémoires sur la famille des Ocypodiens, suite.</a> <!--MARK--><!--MARK--><a href='../../../../publication/8728aca1-f2e1-4662-b5b6-40183f95151b' class='mouseoverHref'><em>Annales des Sciences Naturelles, Paris</em></a> Zoology 3 <strong>20</strong>: 163-228 pls 6-11<!--MARK-->","","Article in Journal","a958ff03-2998-4b52-9be8-a8e1cb14870f","20120508T01:25:21.606+0000","8728aca1-f2e1-4662-b5b6-40183f95151b"
"Nauck, E.","1880","Das Kaugerüst der Brachyuren","1-69 pl. 1","","Zeitschrift für Wissenschaftliche Zoologie","","","","<!--MARK--><a href='../../../../publication/2bfe1610-447b-4fc8-b9e0-2744434f8059' class='mouseoverHref'>Nauck, E. 1880. Das Kaugerüst der Brachyuren.</a> <!--MARK--><!--MARK--><a href='../../../../publication/d8df55e6-ffed-4756-acd5-061bda3ce3ac' class='mouseoverHref'><em>Zeitschrift für Wissenschaftliche Zoologie</em></a> <strong>34</strong>: 1-69 pl. 1<!--MARK-->","","Article in Journal","2bfe1610-447b-4fc8-b9e0-2744434f8059","20081009T05:11:37.000+0000","d8df55e6-ffed-4756-acd5-061bda3ce3ac"
"Ng, P.K.L, Guinot, D. & Davie, P.J.F.","2008","Systema Brachyurorum: Part I.  An annotated checklist of extant brachyuran crabs of the world","1-286","","The Raffles Bulletin of Zoology","","31 January 2008","","<!--MARK--><a href='../../../../publication/f4499baa-d692-45fe-b807-28423a518733' class='mouseoverHref'>Ng, P.K.L, Guinot, D. & Davie, P.J.F. 2008. Systema Brachyurorum: Part I.  An annotated checklist of extant brachyuran crabs of the world.</a> <!--MARK--><!--MARK--><a href='../../../../publication/2e626e3d-6486-4e24-9722-dfb77c193e90' class='mouseoverHref'><em>The Raffles Bulletin of Zoology</em></a> <strong>17</strong>: 1-286<!--MARK--> [Date published 31 January 2008]","","Article in Journal","f4499baa-d692-45fe-b807-28423a518733","20101205T22:51:26.947+0000","2e626e3d-6486-4e24-9722-dfb77c193e90"
"Ng, P.K.L., Eldredge, L.G. & Evenhuis, N.L.","2011","The names of decapod and stomatopod Crustacea from Tahiti, French Polynesia, established by Anthony Curtis in 1938 and 1944","43-56","","Zootaxa","","","","<!--MARK--><a href='../../../../publication/166013cb-d281-468b-af1f-5e8897c7b755' class='mouseoverHref'>Ng, P.K.L., Eldredge, L.G. & Evenhuis, N.L. 2011. The names of decapod and stomatopod Crustacea from Tahiti, French Polynesia, established by Anthony Curtis in 1938 and 1944.</a> <!--MARK--><!--MARK--><a href='../../../../publication/96466227-221c-4922-ac97-1ac2dd946d0a' class='mouseoverHref'><em>Zootaxa</em></a> <strong>3099</strong>: 43-56<!--MARK-->","","Article in Journal","166013cb-d281-468b-af1f-5e8897c7b755","20120508T04:09:30.611+0000","96466227-221c-4922-ac97-1ac2dd946d0a"
"Ng, P.K.L., Liu, H.-C. & Wang, C.-H","1998","A newly recorded land crab, <i>Epigrapsus notatus</i> (Heller, 1865) (Crustacea: Decapoda: Brachyura: Gecarcinidae) from Taiwan","71-82","","Journal of the Taiwan Museum","","","","<!--MARK--><a href='../../../../publication/10d8ff0a-2c7a-41a6-a14d-9ed530334b84' class='mouseoverHref'>Ng, P.K.L., Liu, H.-C. & Wang, C.-H 1998. A newly recorded land crab, <i>Epigrapsus notatus</i> (Heller, 1865) (Crustacea: Decapoda: Brachyura: Gecarcinidae) from Taiwan.</a> <!--MARK--><!--MARK--><a href='../../../../publication/49d5caa0-41ed-4ee0-ad6f-37a046a15250' class='mouseoverHref'><em>Journal of the Taiwan Museum</em></a> <strong>51</strong>(2): 71-82<!--MARK-->","","Article in Journal","10d8ff0a-2c7a-41a6-a14d-9ed530334b84","20081009T05:11:37.000+0000","49d5caa0-41ed-4ee0-ad6f-37a046a15250"
"Ng, P.K.L., Nakasone, Y. & Kosuge, T.","2000","Presence of the land crab, <i>Epigrapsus politus</i> Heller (Decapoda, Brachyura, Gecarcinidae) in Japan and Christmas Island, with a key to the Japanese Gecarcinidae","379-381","","Crustaceana","","","","<!--MARK--><a href='../../../../publication/af3cc5d1-9679-4e9e-861e-61c004b0c632' class='mouseoverHref'>Ng, P.K.L., Nakasone, Y. & Kosuge, T. 2000. Presence of the land crab, <i>Epigrapsus politus</i> Heller (Decapoda, Brachyura, Gecarcinidae) in Japan and Christmas Island, with a key to the Japanese Gecarcinidae.</a> <!--MARK--><!--MARK--><a href='../../../../publication/b3bd1331-ba54-4715-8a3e-f79237a8af84' class='mouseoverHref'><em>Crustaceana</em></a> <strong>73</strong>(3): 379-381<!--MARK-->","","Article in Journal","af3cc5d1-9679-4e9e-861e-61c004b0c632","20081009T05:11:37.000+0000","b3bd1331-ba54-4715-8a3e-f79237a8af84"
"Ng, P.K.L. & Davie, P.J.F.","2012","The blue crab of Christmas Island, <i>Discoplax celeste</i> new species (Crustacea: Decapoda: Brachyura: Gecarcinidae)","89-100","","The Raffles Bulletin of Zoology","","","","<!--MARK--><a href='../../../../publication/651b672e-ca71-405f-ad4f-e7295656ccfc' class='mouseoverHref'>Ng, P.K.L. & Davie, P.J.F. 2012. The blue crab of Christmas Island, <i>Discoplax celeste</i> new species (Crustacea: Decapoda: Brachyura: Gecarcinidae).</a> <!--MARK--><!--MARK--><a href='../../../../publication/2e626e3d-6486-4e24-9722-dfb77c193e90' class='mouseoverHref'><em>The Raffles Bulletin of Zoology</em></a> <strong>60</strong>(1): 89-100<!--MARK-->","","Article in Journal","651b672e-ca71-405f-ad4f-e7295656ccfc","20120301T06:35:07.055+0000","2e626e3d-6486-4e24-9722-dfb77c193e90"
"Pocock, R.I.","1889","On the Arachnida, Myriopoda and Land-Crustacea of Christmas Island","556-564","","Proceedings of the Zoological Society of London","","","","<!--MARK--><a href='../../../../publication/02b6a970-c964-455a-90bb-3c9a150ee13e' class='mouseoverHref'>Pocock, R.I. 1889. On the Arachnida, Myriopoda and Land-Crustacea of Christmas Island.</a> <!--MARK--><!--MARK--><a href='../../../../publication/511f299d-99ec-413c-bc4c-04a380829c96' class='mouseoverHref'><em>Proceedings of the Zoological Society of London</em></a> <strong>38</strong>: 556-564<!--MARK-->","","Article in Journal","02b6a970-c964-455a-90bb-3c9a150ee13e","20101015T01:01:14.326+0000","511f299d-99ec-413c-bc4c-04a380829c96"
"Quinn, N.J., Diele, K. & Meischner, U.","1991","Reproductive behaviour of <i>Cardisoma carnifex</i> (Herbst, 1794) (Brachyura: Gecarcinidae) at Lizard Island, Great Barrier Reef","399","","Memoirs of the Queensland Museum","","","","<!--MARK--><a href='../../../../publication/6b62ba37-efc1-4aa4-bebd-890ee3c96655' class='mouseoverHref'>Quinn, N.J., Diele, K. & Meischner, U. 1991. Reproductive behaviour of <i>Cardisoma carnifex</i> (Herbst, 1794) (Brachyura: Gecarcinidae) at Lizard Island, Great Barrier Reef.</a> <!--MARK--><!--MARK--><a href='../../../../publication/1a0a2982-9f30-43e1-a641-b0379699837c' class='mouseoverHref'><em>Memoirs of the Queensland Museum</em></a> <strong>31</strong>(1): 399<!--MARK-->","","Article in Journal","6b62ba37-efc1-4aa4-bebd-890ee3c96655","20081009T05:11:37.000+0000","1a0a2982-9f30-43e1-a641-b0379699837c"
"Quoy, J.R.C. & Gaimard, P.","1824","Zoologie","","","","","","","<!--MARK--><a href='../../../../publication/1457d310-8722-4c6d-8d94-a829e2946688' class='mouseoverHref'>Quoy, J.R.C. & Gaimard, P. 1824. Zoologie. pp. 497-516 <I>in, Le voyage autour du Monde, ? sur les corvettes de S.M.</I> l'Uranie<I> et</I> la Physicienne<I> ? 1817-1820</I>. Paris : Pilet Ainé.</a>","","Miscellaneous","1457d310-8722-4c6d-8d94-a829e2946688","20081009T05:11:37.000+0000",""
"Smith, S.I.","1869","Notice of the Crustacea collected by Prof. C.F. Hartt on the coast of Brazil in 1867","1-42 pl. 1","","Transactions of the Connecticut Academy of Arts and Sciences","","","","<!--MARK--><a href='../../../../publication/29c6beae-7833-4a8f-bd47-5a23a431c984' class='mouseoverHref'>Smith, S.I. 1869. Notice of the Crustacea collected by Prof. C.F. Hartt on the coast of Brazil in 1867.</a> <!--MARK--><!--MARK--><a href='../../../../publication/ceaf787a-0f1d-4c3a-9891-586659609e1d' class='mouseoverHref'><em>Transactions of the Connecticut Academy of Arts and Sciences</em></a> <strong>2</strong>: 1-42 pl. 1<!--MARK-->","","Article in Journal","29c6beae-7833-4a8f-bd47-5a23a431c984","20081009T05:11:37.000+0000","ceaf787a-0f1d-4c3a-9891-586659609e1d"
"Türkay, M.","1974","Die Gecarcinidae Asiens und Ozeaniens (Crustacea: Decapoda)","223-259 figs 1-19","","Senckenbergiana Biologica","","","","<!--MARK--><a href='../../../../publication/7119bc9b-92c6-4e24-b4db-4d50c01053c6' class='mouseoverHref'>Türkay, M. 1974. Die Gecarcinidae Asiens und Ozeaniens (Crustacea: Decapoda).</a> <!--MARK--><!--MARK--><a href='../../../../publication/615d3f19-8058-4573-b7c3-e2c6cfe1a875' class='mouseoverHref'><em>Senckenbergiana Biologica</em></a> <strong>55</strong>(4/6): 223-259 figs 1-19<!--MARK-->","","Article in Journal","7119bc9b-92c6-4e24-b4db-4d50c01053c6","20081009T05:11:37.000+0000","615d3f19-8058-4573-b7c3-e2c6cfe1a875"
"Wood-Mason, J.","1873","On a new genus and species (<i>Hylaeocarcinus humei</i>) of land crabs from the Nicobar Island","258-262 pls 15-16","","Journal of the Asiatic Society of Bengal","","","","<!--MARK--><a href='../../../../publication/46008492-1168-4e02-9883-e63a62e5ac91' class='mouseoverHref'>Wood-Mason, J. 1873. On a new genus and species (<i>Hylaeocarcinus humei</i>) of land crabs from the Nicobar Island.</a> <!--MARK--><!--MARK--><a href='../../../../publication/d16b9dfb-88f3-4e8f-aa43-b64265b2b69a' class='mouseoverHref'><em>Journal of the Asiatic Society of Bengal</em></a> <strong>42</strong>(2): 258-262 pls 15-16<!--MARK-->","","Article in Journal","46008492-1168-4e02-9883-e63a62e5ac91","20081009T05:11:37.000+0000","d16b9dfb-88f3-4e8f-aa43-b64265b2b69a"
"Wood-Mason, J.","1874","Blind Crustacea","180-181","","Journal of the Asiatic Society of Bengal","","","","<!--MARK--><a href='../../../../publication/3947bd9d-b5ec-4387-99a1-27f15ec52ec7' class='mouseoverHref'>Wood-Mason, J. 1874. Blind Crustacea.</a> <!--MARK--><!--MARK--><a href='../../../../publication/d16b9dfb-88f3-4e8f-aa43-b64265b2b69a' class='mouseoverHref'><em>Journal of the Asiatic Society of Bengal</em></a> <strong>1874</strong>: 180-181<!--MARK-->","","Article in Journal","3947bd9d-b5ec-4387-99a1-27f15ec52ec7","20081009T05:11:37.000+0000","d16b9dfb-88f3-4e8f-aa43-b64265b2b69a"
