"PUB_AUTHOR","PUB_YEAR","PUB_TITLE","PUB_PAGES","PUB_PARENT_BOOK_TITLE","PUB_PARENT_JOURNAL_TITLE","PUB_PARENT_ARTICLE_TITLE","PUB_PUBLICATION_DATE","PUB_PUBLISHER","PUB_FORMATTED","PUB_QUALIFICATION","PUB_TYPE","PUBLICATION_GUID","PUBLICATION_LAST_UPDATE","PARENT_PUBLICATION_GUID"
"Adolphson, H. & Kinnear, A.","2008","Acari (mite) assemblages under plantations of bluegum, <I>Eucalyptus globulus</I>, in southwestern Australia.","427-437","","Pedobiologia","","","","<!--MARK--><a href='../../../../publication/64b4b961-fae1-46e9-b7e0-1d5ed992fb05' class='mouseoverHref'>Adolphson, H. & Kinnear, A. 2008. Acari (mite) assemblages under plantations of bluegum, <I>Eucalyptus globulus</I>, in southwestern Australia.</a> <!--MARK--><!--MARK--><a href='../../../../publication/eba6b973-a2e0-493c-89d0-36c63da98a0c' class='mouseoverHref'><em>Pedobiologia</em></a> <strong>51</strong>: 427-437<!--MARK-->","","Article in Journal","64b4b961-fae1-46e9-b7e0-1d5ed992fb05","20110211T07:18:36.350+0000","eba6b973-a2e0-493c-89d0-36c63da98a0c"
"Aoki, J.","1961","Eeschreibungen von neuen Oribatiden Japans","64-69","","Japanese Journal of Applied Entomology and Zoology","","","","<!--MARK--><a href='../../../../publication/70e78812-6f40-4765-abde-25a55f82683b' class='mouseoverHref'>Aoki, J. 1961. Eeschreibungen von neuen Oribatiden Japans.</a> <!--MARK--><!--MARK--><a href='../../../../publication/a87d6c74-64c2-452a-a2c6-c1009e263615' class='mouseoverHref'><em>Japanese Journal of Applied Entomology and Zoology</em></a> <strong>5</strong>: 64-69<!--MARK-->","","Article in Journal","70e78812-6f40-4765-abde-25a55f82683b","20081009T05:11:37.000+0000","a87d6c74-64c2-452a-a2c6-c1009e263615"
"Balogh, J.","1943","Systematische studien über Siebenbürgische moosmilben","32-42","","Annales Historico-Naturales Musei Nationalis Hungarici (Zoologica)","","","","<!--MARK--><a href='../../../../publication/d90d14e0-478b-4e4a-a002-c01c04ececa4' class='mouseoverHref'>Balogh, J. 1943. Systematische studien über Siebenbürgische moosmilben.</a> <!--MARK--><!--MARK--><a href='../../../../publication/e6f35874-0423-4fa1-bf45-655b9047e0c2' class='mouseoverHref'><em>Annales Historico-Naturales Musei Nationalis Hungarici (Zoologica)</em></a> <strong>36</strong>: 32-42<!--MARK-->","","Article in Journal","d90d14e0-478b-4e4a-a002-c01c04ececa4","20081009T05:11:37.000+0000","e6f35874-0423-4fa1-bf45-655b9047e0c2"
"Balogh, J.","1961","Identification keys of world oribatid (Acari) families and genera","243-344","","Acta Zoologica Hungarica","","","","<!--MARK--><a href='../../../../publication/b95a32d5-1d4f-4709-b781-805d3158ec96' class='mouseoverHref'>Balogh, J. 1961. Identification keys of world oribatid (Acari) families and genera.</a> <!--MARK--><!--MARK--><a href='../../../../publication/a9328cd7-1131-4e41-8965-d8a5d06616d5' class='mouseoverHref'><em>Acta Zoologica Hungarica</em></a> <strong>7</strong>: 243-344<!--MARK-->","","Article in Journal","b95a32d5-1d4f-4709-b781-805d3158ec96","20081009T05:11:37.000+0000","a9328cd7-1131-4e41-8965-d8a5d06616d5"
"Balogh, J.","1972","The Oribatid Genera of the World","188 pp. 71 pls","","","","","Akadémiai Kiadó","<!--MARK--><a href='../../../../publication/e1e26bbb-5acb-48d9-9ade-e3ee19a22193' class='mouseoverHref'>Balogh, J. 1972. <em>The Oribatid Genera of the World</em>. Budapest : Akadémiai Kiadó 188 pp. 71 pls.</a><!--MARK-->","","Book","e1e26bbb-5acb-48d9-9ade-e3ee19a22193","20081009T05:11:37.000+0000",""
"Balogh, J. & Balogh, P.","1983","Data to the Oribatid fauna of Australia (Acari). II","283-301","","Acta Zoologica Academiae Scientiarum Hungaricae","","","","<!--MARK--><a href='../../../../publication/f9d2199d-9f78-4f81-8198-cbdbc028b083' class='mouseoverHref'>Balogh, J. & Balogh, P. 1983. Data to the Oribatid fauna of Australia (Acari). II.</a> <!--MARK--><!--MARK--><a href='../../../../publication/50d7b97e-899c-4373-8ab9-28aa9e24e2c8' class='mouseoverHref'><em>Acta Zoologica Academiae Scientiarum Hungaricae</em></a> <strong>29</strong>: 283-301<!--MARK-->","","Article in Journal","f9d2199d-9f78-4f81-8198-cbdbc028b083","20081009T05:11:37.000+0000","50d7b97e-899c-4373-8ab9-28aa9e24e2c8"
"Balogh, J. & Balogh, P.","1983","New Oribatid mites from Australia (Acari : Oribatei)","81-105","","Acta Zoologica Academiae Scientiarum Hungaricae","","","","<!--MARK--><a href='../../../../publication/42ffbbeb-95ac-471b-a897-a65f7cdbcced' class='mouseoverHref'>Balogh, J. & Balogh, P. 1983. New Oribatid mites from Australia (Acari : Oribatei).</a> <!--MARK--><!--MARK--><a href='../../../../publication/50d7b97e-899c-4373-8ab9-28aa9e24e2c8' class='mouseoverHref'><em>Acta Zoologica Academiae Scientiarum Hungaricae</em></a> <strong>29</strong>: 81-105<!--MARK-->","","Article in Journal","42ffbbeb-95ac-471b-a897-a65f7cdbcced","20081009T05:11:37.000+0000","50d7b97e-899c-4373-8ab9-28aa9e24e2c8"
"Balogh, J. & Balogh, P.","1992","<em>The Oribatid Mites Genera of the World</em>","","","","","","","<!--MARK--><a href='../../../../publication/d7bcb9e6-e402-43e4-a9ca-b50d7b0e0be0' class='mouseoverHref'>Balogh, J. & Balogh, P. 1992. <em>The Oribatid Mites Genera of the World</em>. Hungarian Natural History Museum : Budapest Vol. I pp. 1-263 Vol. II pp. 1-375.</a>","","Miscellaneous","d7bcb9e6-e402-43e4-a9ca-b50d7b0e0be0","20110711T02:57:54.000+0000",""
"Balogh, J. & Balogh, P.","2002","Identification Keys to the Oribatid Mites of the Extra-Holarctic Regions","","","","","","Well-Press Publishing","<!--MARK--><a href='../../../../publication/15eed8f9-cd76-4aa5-907b-435804b515ff' class='mouseoverHref'>Balogh, J. & Balogh, P. 2002. <em>Identification Keys to the Oribatid Mites of the Extra-Holarctic Regions</em>. Miskolc. : Well-Press Publishing Vol. 1, 453 pp. + Vol. 2, 504 pp.</a><!--MARK-->","","Book","15eed8f9-cd76-4aa5-907b-435804b515ff","20110810T03:40:43.718+0000",""
"Balogh, J. & Mahunka, S.","1966","New Oribatids (Acari) from Australian soils","553-568","","Folia Entomologica Hungarica","","","","<!--MARK--><a href='../../../../publication/0762c0e3-7a05-450a-9fc8-0edf0f89276b' class='mouseoverHref'>Balogh, J. & Mahunka, S. 1966. New Oribatids (Acari) from Australian soils.</a> <!--MARK--><!--MARK--><a href='../../../../publication/585e47d1-1182-450c-915d-26bcc8f8c26b' class='mouseoverHref'><em>Folia Entomologica Hungarica</em></a> <strong>19</strong>: 553-568<!--MARK-->","","Article in Journal","0762c0e3-7a05-450a-9fc8-0edf0f89276b","20081009T05:11:37.000+0000","585e47d1-1182-450c-915d-26bcc8f8c26b"
"Berlese, A.","1908","Elenco di generi e specie nuove di acari","1-15","","Redia. Giornale di entomologia, Firenze","","","","<!--MARK--><a href='../../../../publication/0ef99021-1156-4186-800f-37cf2223762f' class='mouseoverHref'>Berlese, A. 1908. Elenco di generi e specie nuove di acari.</a> <!--MARK--><!--MARK--><a href='../../../../publication/116966a8-7c23-4f72-a4e3-de1b7b90f1ca' class='mouseoverHref'><em>Redia. Giornale di entomologia, Firenze</em></a> <strong>5</strong>: 1-15<!--MARK-->","","Article in Journal","0ef99021-1156-4186-800f-37cf2223762f","20081009T05:11:37.000+0000","116966a8-7c23-4f72-a4e3-de1b7b90f1ca"
"Colloff, M.J. & Halliday, R.B.","1998","Oribatid Mites: A Catalogue of the Australian Genera and Species","","","","","","CSIRO Publications","<!--MARK--><a href='../../../../publication/2a4418b3-bef9-4b85-83b3-672bf69f3e48' class='mouseoverHref'>Colloff, M.J. & Halliday, R.B. 1998. <em>Oribatid Mites: A Catalogue of the Australian Genera and Species</em>. Melbourne : CSIRO Publications.</a><!--MARK-->","","Book","2a4418b3-bef9-4b85-83b3-672bf69f3e48","20081009T05:11:37.000+0000",""
"Halliday, R.B.","1998","Mites of Australia : A Checklist and Bibliography","317 pp.","","","","","CSIRO Publishing","<!--MARK--><a href='../../../../publication/85ed32b0-49f4-4c7d-9ce8-4ba0d44b721f' class='mouseoverHref'>Halliday, R.B. 1998. <em>Mites of Australia : A Checklist and Bibliography</em>. Melbourne : CSIRO Publishing 317 pp.</a><!--MARK-->","","Book","85ed32b0-49f4-4c7d-9ce8-4ba0d44b721f","20081009T05:11:37.000+0000",""
"Hammer, M.","1958","Investigations on the Oribatid fauna of the Andes Mountains. I. The Argentine and Bolivia","1-129 pls I-XXXIV","","Biologiske Skrifter Kongelige Danske Videnskabernes Selskab","","","","<!--MARK--><a href='../../../../publication/bb081314-67cb-4cdb-9c4f-756b1401848c' class='mouseoverHref'>Hammer, M. 1958. Investigations on the Oribatid fauna of the Andes Mountains. I. The Argentine and Bolivia.</a> <!--MARK--><!--MARK--><a href='../../../../publication/f972ce1b-96be-4636-ba91-4c593f351846' class='mouseoverHref'><em>Biologiske Skrifter Kongelige Danske Videnskabernes Selskab</em></a> <strong>10</strong>(1): 1-129 pls I-XXXIV<!--MARK-->","","Article in Journal","bb081314-67cb-4cdb-9c4f-756b1401848c","20081009T05:11:37.000+0000","f972ce1b-96be-4636-ba91-4c593f351846"
"Hammer, M.","1966","Investigations on the Oribatid fauna of New Zealand. Part I","1-108 pls I-XLV","","Biologiske Skrifter Kongelige Danske Videnskabernes Selskab","","","","<!--MARK--><a href='../../../../publication/6a47e1ac-5746-4b27-a61d-bb19e0bc970c' class='mouseoverHref'>Hammer, M. 1966. Investigations on the Oribatid fauna of New Zealand. Part I.</a> <!--MARK--><!--MARK--><a href='../../../../publication/f972ce1b-96be-4636-ba91-4c593f351846' class='mouseoverHref'><em>Biologiske Skrifter Kongelige Danske Videnskabernes Selskab</em></a> <strong>15</strong>(2): 1-108 pls I-XLV<!--MARK-->","","Article in Journal","6a47e1ac-5746-4b27-a61d-bb19e0bc970c","20110407T04:14:54.566+0000","f972ce1b-96be-4636-ba91-4c593f351846"
"Hammer, M.","1967","Investigations on the Oribatid fauna of New Zealand. Part II","1-64 pls I-XL","","Biologiske Skrifter Kongelige Danske Videnskabernes Selskab","","","","<!--MARK--><a href='../../../../publication/114f6cf5-98c5-4281-82d3-2ccb496bc00d' class='mouseoverHref'>Hammer, M. 1967. Investigations on the Oribatid fauna of New Zealand. Part II.</a> <!--MARK--><!--MARK--><a href='../../../../publication/f972ce1b-96be-4636-ba91-4c593f351846' class='mouseoverHref'><em>Biologiske Skrifter Kongelige Danske Videnskabernes Selskab</em></a> <strong>15</strong>(4): 1-64 pls I-XL<!--MARK-->","","Article in Journal","114f6cf5-98c5-4281-82d3-2ccb496bc00d","20081009T05:11:37.000+0000","f972ce1b-96be-4636-ba91-4c593f351846"
"Hammer, M.","1971","On some Oribatids from Viti Levu, the Fiji Islands","1-60 pls I-XXXV","","Biologiske Skrifter Kongelige Danske Videnskabernes Selskab","","","","<!--MARK--><a href='../../../../publication/744feabc-3323-47bf-8848-8640a03abda3' class='mouseoverHref'>Hammer, M. 1971. On some Oribatids from Viti Levu, the Fiji Islands.</a> <!--MARK--><!--MARK--><a href='../../../../publication/f972ce1b-96be-4636-ba91-4c593f351846' class='mouseoverHref'><em>Biologiske Skrifter Kongelige Danske Videnskabernes Selskab</em></a> <strong>16</strong>(6): 1-60 pls I-XXXV<!--MARK-->","","Article in Journal","744feabc-3323-47bf-8848-8640a03abda3","20081009T05:11:37.000+0000","f972ce1b-96be-4636-ba91-4c593f351846"
"Heatwole, H., Done, T. & Cameron, E.","1981","Community Ecology of a Coral Cay: A study of One-Tree Island, Great Barrier Reef, Australia","379 pp.","","","","","W. Junk","<!--MARK--><a href='../../../../publication/caf46063-5883-4591-83e1-f4e008c0e3db' class='mouseoverHref'>Heatwole, H., Done, T. & Cameron, E. 1981. <em>Community Ecology of a Coral Cay: A study of One-Tree Island, Great Barrier Reef, Australia</em>. The Hague : W. Junk 379 pp.</a><!--MARK-->","","Book","caf46063-5883-4591-83e1-f4e008c0e3db","20081009T05:11:37.000+0000",""
"Hunt, G.S., Colloff, M.J., Dallwitz, M. & Walter, D.E.","1998","An Interactive Key to Oribatid Mites of Australia (CD-ROM)","","","","","","CSIRO Publishing","<!--MARK--><a href='../../../../publication/1d65dff2-89d7-46e4-8f3e-92b14dce5cb6' class='mouseoverHref'>Hunt, G.S., Colloff, M.J., Dallwitz, M. & Walter, D.E. 1998. <em>An Interactive Key to Oribatid Mites of Australia (CD-ROM)</em>. Melbourne : CSIRO Publishing.</a><!--MARK-->","","Book","1d65dff2-89d7-46e4-8f3e-92b14dce5cb6","20081009T05:11:37.000+0000",""
"Lee, D.C.","1986","Taxonomy and Distribution of Sarcoptiform Mites (Cryptostigmata and Astigmata: Acari) in South Australian Soils","272","","","","","","<!--MARK--><a href='../../../../publication/ff1a84bf-de24-4754-9591-73ec27a399b4' class='mouseoverHref'>Lee, D.C. 1986. Taxonomy and Distribution of Sarcoptiform Mites (Cryptostigmata and Astigmata: Acari) in South Australian Soils. PhD Thesis, University of Queensland, Brisbane. 272 pp.</a>","","Miscellaneous","ff1a84bf-de24-4754-9591-73ec27a399b4","20081009T05:11:37.000+0000",""
"Luxton, M.","1985","Cryptostigmata (Arachnida: Acari) - a concise review","1-106","","Fauna of New Zealand","","","","<!--MARK--><a href='../../../../publication/56fef714-ff00-40ba-b6ea-b582544f7608' class='mouseoverHref'>Luxton, M. 1985. Cryptostigmata (Arachnida: Acari) - a concise review.</a> <!--MARK--><!--MARK--><a href='../../../../publication/9a9e30f2-8e04-49ff-b629-4f9b8a3edcf7' class='mouseoverHref'><em>Fauna of New Zealand</em></a> <strong>7</strong>: 1-106<!--MARK-->","","Article in Journal","56fef714-ff00-40ba-b6ea-b582544f7608","20081009T05:11:37.000+0000","9a9e30f2-8e04-49ff-b629-4f9b8a3edcf7"
"Michael, A.D.","1898","Oribatidae.","1-93","","Das Tierreich","","","","<!--MARK--><a href='../../../../publication/a55781e7-58de-4630-b5dd-0c2595ebf852' class='mouseoverHref'>Michael, A.D. 1898. Oribatidae.</a> <!--MARK--><!--MARK--><a href='../../../../publication/fcb2b75c-eb8d-4868-89bd-d2fd1a2779ad' class='mouseoverHref'><em>Das Tierreich</em></a> <strong>3</strong>: 1-93<!--MARK-->","","Article in Journal","a55781e7-58de-4630-b5dd-0c2595ebf852","20130130T05:40:25.265+0000","fcb2b75c-eb8d-4868-89bd-d2fd1a2779ad"
"Nicolet, H.","1855","Histoire naturelle des Acariens qui se trouvent aux environs de Paris","381-482 + plates 1-10","","Archives du Muséum National d'Histoire Naturelle, Paris","","","","<!--MARK--><a href='../../../../publication/18d2a0a2-7d38-4566-aac5-81442a0d2018' class='mouseoverHref'>Nicolet, H. 1855. Histoire naturelle des Acariens qui se trouvent aux environs de Paris.</a> <!--MARK--><!--MARK--><a href='../../../../publication/415842f0-b116-430f-8ead-a7523014f1f5' class='mouseoverHref'><em>Archives du Muséum National d'Histoire Naturelle, Paris</em></a> <strong>7</strong>: 381-482 + plates 1-10<!--MARK-->","","Article in Journal","18d2a0a2-7d38-4566-aac5-81442a0d2018","20160807T23:07:52.060+0000","415842f0-b116-430f-8ead-a7523014f1f5"
"Norton, R.A. & Behan-Pelletier, V.M.","2009","Suborder Oribatida.","pp. 430-564","A Manual of Acarology","","","","","<!--MARK--><a href='../../../../publication/25239596-a779-446d-babf-2dd7bd756ae3' class='mouseoverHref'>Norton, R.A. & Behan-Pelletier, V.M. 2009. Suborder Oribatida. pp. 430-564</a> <!--MARK--><em>in</em> <!--MARK--><a href='../../../../publication/4adea5fa-3e8b-4daf-bac9-2ec7aa45d0fd' class='mouseoverHref'>Krantz, G.W. & Walter, D.E. (eds). <em>A Manual of Acarology</em>. Lubbock, Texas : Texas Tech University Press Third edition, 807 pp.</a><!--MARK-->","","Chapter in Book","25239596-a779-446d-babf-2dd7bd756ae3","20110815T06:42:01.810+0000","4adea5fa-3e8b-4daf-bac9-2ec7aa45d0fd"
"Norton, R.A. & Ermilov, S.G.","2019","<I>Anderemaeus</I> (Acari, Oribatida)--overview, three new species from South America and reassessment of Anderemaeidae supported by ontogeny.","241-289.","","Zootaxa","","","","<!--MARK--><a href='../../../../publication/e914cfca-2d05-438d-a22a-36f4b779f313' class='mouseoverHref'>Norton, R.A. & Ermilov, S.G. 2019. <I>Anderemaeus</I> (Acari, Oribatida)--overview, three new species from South America and reassessment of Anderemaeidae supported by ontogeny.</a> <!--MARK--><!--MARK--><a href='../../../../publication/96466227-221c-4922-ac97-1ac2dd946d0a' class='mouseoverHref'><em>Zootaxa</em></a> <strong>4647</strong>(1): 241-289.<!--MARK-->","","Article in Journal","e914cfca-2d05-438d-a22a-36f4b779f313","20190727T06:02:26.612+0000","96466227-221c-4922-ac97-1ac2dd946d0a"
"Osler, G.H.R.","1997","Factors Contributing to the Structure of Soil Mite Communities","212","","","","","","<!--MARK--><a href='../../../../publication/25d4feb7-b9ed-409a-a458-29b1615b37ff' class='mouseoverHref'>Osler, G.H.R. 1997. Factors Contributing to the Structure of Soil Mite Communities. PhD thesis, Department of Biological Sciences, Macquarie University. 212 pp.</a>","","Miscellaneous","25d4feb7-b9ed-409a-a458-29b1615b37ff","20081009T05:11:37.000+0000",""
"Oudemans, A.C.","1900","Remarks on the denomination of the genera and higher groups in 'Das Tierreich, Oribatidae'","140-149","","Tijdschrift voor Entomologie","","","","<!--MARK--><a href='../../../../publication/69463940-acc8-4b63-af74-a41732df89db' class='mouseoverHref'>Oudemans, A.C. 1900. Remarks on the denomination of the genera and higher groups in 'Das Tierreich, Oribatidae'.</a> <!--MARK--><!--MARK--><a href='../../../../publication/6b0f0fc0-01fc-4ed4-aae0-c8b621477f01' class='mouseoverHref'><em>Tijdschrift voor Entomologie</em></a> <strong>43</strong>: 140-149<!--MARK-->","","Article in Journal","69463940-acc8-4b63-af74-a41732df89db","20081009T05:11:37.000+0000","6b0f0fc0-01fc-4ed4-aae0-c8b621477f01"
"Perdomo, G., Evans, A., Maraun, M., Sunnucks, P. & Thompson, R.","2012","Mouthpart morphology and trophic position of microarthropods from soils and mosses are strongly correlated.","56-63","","Soil Biology and Biochemistry","","","","<!--MARK--><a href='../../../../publication/26f1691d-0c54-44f3-a633-c72f229aca3c' class='mouseoverHref'>Perdomo, G., Evans, A., Maraun, M., Sunnucks, P. & Thompson, R. 2012. Mouthpart morphology and trophic position of microarthropods from soils and mosses are strongly correlated.</a> <!--MARK--><!--MARK--><a href='../../../../publication/c5448dca-7128-4c41-b52b-50215ab5c893' class='mouseoverHref'><em>Soil Biology and Biochemistry</em></a> <strong>53</strong>: 56-63<!--MARK-->","","Article in Journal","26f1691d-0c54-44f3-a633-c72f229aca3c","20130330T05:27:53.198+0000","c5448dca-7128-4c41-b52b-50215ab5c893"
"Schatz, H., Behan-Pelletier, V.M., OConnor, B.M. & Norton, R.A.","2011","Suborder Oribatida van der Hammen, 1968","pp. 141-148","Animal Biodiversity: An Outline of Higher-level Classification and Survey of Taxonomic Richness","","","","","<!--MARK--><a href='../../../../publication/4d709354-1aeb-4a05-b77e-512f9f88d767' class='mouseoverHref'>Schatz, H., Behan-Pelletier, V.M., OConnor, B.M. & Norton, R.A. 2011. Suborder Oribatida van der Hammen, 1968. pp. 141-148</a> <!--MARK--><em>in</em> <!--MARK--><a href='../../../../publication/e1a8af56-51e3-45d8-b610-999291d8a4b3' class='mouseoverHref'>Zhang, Z.-Q. <em>Animal Biodiversity: An Outline of Higher-level Classification and Survey of Taxonomic Richness</em>. Auckland : Magnolia Press.</a><!--MARK-->","","Chapter in Book","4d709354-1aeb-4a05-b77e-512f9f88d767","20120104T21:43:40.185+0000","e1a8af56-51e3-45d8-b610-999291d8a4b3"
"Sellnick, M.","1928","Formenkreis : Hornmilben, Oribatei","ix 1-42","","Die Tierwelt Mitteleuropas","","","","<!--MARK--><a href='../../../../publication/d30c505d-4b3a-4123-aa24-68381de5ade1' class='mouseoverHref'>Sellnick, M. 1928. Formenkreis : Hornmilben, Oribatei.</a> <!--MARK--><!--MARK--><a href='../../../../publication/d9029d7a-16a7-4031-bf74-214a3c82f36f' class='mouseoverHref'><em>Die Tierwelt Mitteleuropas</em></a> <strong>4</strong>(3): ix 1-42<!--MARK-->","","Article in Journal","d30c505d-4b3a-4123-aa24-68381de5ade1","20081009T05:11:37.000+0000","d9029d7a-16a7-4031-bf74-214a3c82f36f"
"Stone, C. & Simpson, J.A.","1990","Species associations in <em>Ips grandicollis</em> galleries in <em>Pinus taeda</em>.","75-96.","","New Zealand Journal of Forestry Science","","","","<!--MARK--><a href='../../../../publication/7c82f051-8137-4d86-94c5-5d862fc6f296' class='mouseoverHref'>Stone, C. & Simpson, J.A. 1990. Species associations in <em>Ips grandicollis</em> galleries in <em>Pinus taeda</em>.</a> <!--MARK--><!--MARK--><a href='../../../../publication/6b5ba59f-5e4d-499b-9721-8815042e9505' class='mouseoverHref'><em>New Zealand Journal of Forestry Science</em></a> <strong>20</strong>: 75-96.<!--MARK-->","","Article in Journal","7c82f051-8137-4d86-94c5-5d862fc6f296","20161218T08:42:48.129+0000","6b5ba59f-5e4d-499b-9721-8815042e9505"
"Subias, L.S","February 2011","Listado sistemático, sinonímico y biogeográfico de los ácaros oribátidos (Acariformes: Oribatida) del mundo (excepto fósiles)","","","","","","","<!--MARK--><a href='../../../../publication/455b98a8-2d80-48c8-802d-d3bb671a43a2' class='mouseoverHref'>Subias, L.S February 2011. Listado sistemático, sinonímico y biogeográfico de los ácaros oribátidos (Acariformes: Oribatida) del mundo (excepto fósiles). Departamento de Zoología, Facultad de Biología, Universidad Complutense, Madrid, Spain.</a> <!--MARK--><a href=http://www.ucm.es/info/zoo/Artropodos/Catalogo.pdf>http://www.ucm.es/info/zoo/Artropodos/Catalogo.pdf</a><!--MARK--> [date of access 1 October 2011]","date of access 1 October 2011","URL","455b98a8-2d80-48c8-802d-d3bb671a43a2","20130506T22:20:34.110+0000",""
"Subias, L.S.","2004","Listado sistemático, sinonímico y biogeográfico de los ácaros oribátidos (Acariformes, Oribatida) del mundo (1758-2002)","3-305","","Graellsia","","","","<!--MARK--><a href='../../../../publication/1025f857-904c-4217-82fc-6f20ce369867' class='mouseoverHref'>Subias, L.S. 2004. Listado sistemático, sinonímico y biogeográfico de los ácaros oribátidos (Acariformes, Oribatida) del mundo (1758-2002).</a> <!--MARK--><!--MARK--><a href='../../../../publication/c9daaa4a-6f88-40d8-bc44-a8d2e4313ed3' class='mouseoverHref'><em>Graellsia</em></a> <strong>60 (Supplement)</strong>: 3-305<!--MARK-->","","Article in Journal","1025f857-904c-4217-82fc-6f20ce369867","20130506T05:01:31.443+0000","c9daaa4a-6f88-40d8-bc44-a8d2e4313ed3"
"Tryon, H.","1889","Report on Insect and Fungus Pests No. 1","238","","","","","Queensland Department of Agriculture","<!--MARK--><a href='../../../../publication/3b37541e-fd82-4a0e-8514-257ade2ec77a' class='mouseoverHref'>Tryon, H. 1889. <em>Report on Insect and Fungus Pests No. 1</em>. Brisbane : Queensland Department of Agriculture 238 pp.</a><!--MARK-->","","Book","3b37541e-fd82-4a0e-8514-257ade2ec77a","20081009T05:11:37.000+0000",""
"Walter, D.E.","1995","Dancing on the head of a pin: mites in the rainforest canopy","pp. 49-53","","Records of the Western Australian Museum","Australasian Spiders and their Relatives: Papers Honouring Barbara York Main","","","<!--MARK--><a href='../../../../publication/36742305-8c58-4d05-85b1-bc35d56a899a' class='mouseoverHref'>Walter, D.E. 1995. Dancing on the head of a pin: mites in the rainforest canopy. pp. 49-53</a> <!--MARK--><em>in</em> <!--MARK--><a href='../../../../publication/0f384557-4c45-4b31-8213-a09d034dca8e' class='mouseoverHref'>M.S. Harvey (ed.). Australasian Spiders and their Relatives: Papers Honouring Barbara York Main.</a> <!--MARK--><!--MARK--><a href='../../../../publication/a2cbd1fb-97d5-493a-a1d7-c2b99709890b' class='mouseoverHref'><em>Records of the Western Australian Museum</em></a> <strong>52</strong>(Supplement)<!--MARK-->","","Section in Article","36742305-8c58-4d05-85b1-bc35d56a899a","20120130T23:24:50.065+0000","0f384557-4c45-4b31-8213-a09d034dca8e"
"Walter, D.E.","1999","Living on leaves: adaptations of Australian rainforest mites","pp. 73-78","Acarology IX. Volume 2. Symposia.","","","","","<!--MARK--><a href='../../../../publication/67d91486-25c1-4794-a0f1-f3035959531e' class='mouseoverHref'>Walter, D.E. 1999. Living on leaves: adaptations of Australian rainforest mites. pp. 73-78</a> <!--MARK--><em>in</em> <!--MARK--><a href='../../../../publication/48a56339-0827-472b-a2ad-98b518ac942b' class='mouseoverHref'>Needham, G.R., Mitchell, R., Horn, D.J. & Welbourn, W.C. <em>Acarology IX. Volume 2. Symposia</em>. Columbus, Ohio : Ohio Biological Survey.</a><!--MARK-->","","Chapter in Book","67d91486-25c1-4794-a0f1-f3035959531e","20120202T00:17:52.705+0000","48a56339-0827-472b-a2ad-98b518ac942b"
"Walter, D.E. & Behan-Pelletier, V.M.","1993","Systematics and ecology of <i>Adhaesozetes polyphyllos</i> sp. nov. (Acari: Oribatida: Licneremaeoidea), a leaf-inhabiting mite from Australian rainforests","1024-1040","","Canadian Journal of Zoology","","","","<!--MARK--><a href='../../../../publication/694ae6b6-b73c-4f19-8dfc-16febe818a4f' class='mouseoverHref'>Walter, D.E. & Behan-Pelletier, V.M. 1993. Systematics and ecology of <i>Adhaesozetes polyphyllos</i> sp. nov. (Acari: Oribatida: Licneremaeoidea), a leaf-inhabiting mite from Australian rainforests.</a> <!--MARK--><!--MARK--><a href='../../../../publication/6b4ad741-4e78-4504-8644-852d01ad47bb' class='mouseoverHref'><em>Canadian Journal of Zoology</em></a> <strong>71</strong>: 1024-1040<!--MARK-->","","Article in Journal","694ae6b6-b73c-4f19-8dfc-16febe818a4f","20081009T05:11:37.000+0000","6b4ad741-4e78-4504-8644-852d01ad47bb"
