"PUB_AUTHOR","PUB_YEAR","PUB_TITLE","PUB_PAGES","PUB_PARENT_BOOK_TITLE","PUB_PARENT_JOURNAL_TITLE","PUB_PARENT_ARTICLE_TITLE","PUB_PUBLICATION_DATE","PUB_PUBLISHER","PUB_FORMATTED","PUB_QUALIFICATION","PUB_TYPE","PUBLICATION_GUID","PUBLICATION_LAST_UPDATE","PARENT_PUBLICATION_GUID"
"Armstrong, J.W.T.","1948","On Australian Coleoptera. Part I","292-298","","Proceedings of the Linnean Society of New South Wales","","15/Jan/1948","","<!--MARK--><a href='../../../../publication/d627168c-7ef5-44e7-b32b-6f50bc5d8096' class='mouseoverHref'>Armstrong, J.W.T. 1948. On Australian Coleoptera. Part I.</a> <!--MARK--><!--MARK--><a href='../../../../publication/c12cd779-adb5-41ea-bd2c-75f6864cf22e' class='mouseoverHref'><em>Proceedings of the Linnean Society of New South Wales</em></a> <strong>72</strong>(5-6): 292-298<!--MARK--> [Date published 15/Jan/1948]","","Article in Journal","d627168c-7ef5-44e7-b32b-6f50bc5d8096","20081009T05:11:37.000+0000","c12cd779-adb5-41ea-bd2c-75f6864cf22e"
"Auzat, V.","1916","Description d'un <i>Saprinus</i> nouveau d'Australie (Col. Histeridae)","132-133","","Bulletin de la Société Entomologique de France","","","","<!--MARK--><a href='../../../../publication/15d291b1-ee54-47fc-84c9-77dea51c89a3' class='mouseoverHref'>Auzat, V. 1916. Description d'un <i>Saprinus</i> nouveau d'Australie (Col. Histeridae).</a> <!--MARK--><!--MARK--><a href='../../../../publication/7853f77c-aa1b-42ec-bc2c-9758f7ff72c7' class='mouseoverHref'><em>Bulletin de la Société Entomologique de France</em></a> <strong>1917</strong>: 132-133<!--MARK-->","","Article in Journal","15d291b1-ee54-47fc-84c9-77dea51c89a3","20081009T05:11:37.000+0000","7853f77c-aa1b-42ec-bc2c-9758f7ff72c7"
"Bickhardt, H.","1909","Beitrag zur Kenntnis der Histeriden. III.","240-246","","Entomologische Blätter","","","","<!--MARK--><a href='../../../../publication/8a12c5ca-a629-49d1-b8cc-9f34839bb7a6' class='mouseoverHref'>Bickhardt, H. 1909. Beitrag zur Kenntnis der Histeriden. III.</a> <!--MARK--><!--MARK--><a href='../../../../publication/a4ae2141-5f28-40ed-8d5f-f1e9aebf1631' class='mouseoverHref'><em>Entomologische Blätter</em></a> <strong>5</strong>: 240-246<!--MARK-->","","Article in Journal","8a12c5ca-a629-49d1-b8cc-9f34839bb7a6","20180618T02:29:27.183+0000","a4ae2141-5f28-40ed-8d5f-f1e9aebf1631"
"Bickhardt, H.","1910","Histeridae","3-137","Coleopterorum Catalogus auspiciis et auxilio W. Junk","","","","","<!--MARK--><a href='../../../../publication/0db1d284-9e0b-4ddc-8c28-4696c43c42e0' class='mouseoverHref'>Bickhardt, H. 1910. Histeridae. pp. 3-137</a> <!--MARK--><em>in</em> <!--MARK--><a href='../../../../publication/4cca7c21-3fb9-47f6-8fe4-f729a35a2959' class='mouseoverHref'>Schenkling, S. (ed.). <em>Coleopterorum Catalogus auspiciis et auxilio W. Junk</em>. Berlin : W. Junk Vol. 8 Pars 24.</a><!--MARK--> [Date published 20/Dec/1910]","","Chapter in Book","0db1d284-9e0b-4ddc-8c28-4696c43c42e0","20081009T05:11:37.000+0000","4cca7c21-3fb9-47f6-8fe4-f729a35a2959"
"Bickhardt, H.","1913","Histeridenstudien","696-701","","Deutsche Entomologische Zeitschrift","","","","<!--MARK--><a href='../../../../publication/8b256999-6936-4bb5-86c8-120daa00fab5' class='mouseoverHref'>Bickhardt, H. 1913. Histeridenstudien.</a> <!--MARK--><!--MARK--><a href='../../../../publication/bdeb8163-7175-47c9-be9b-28f797c57745' class='mouseoverHref'><em>Deutsche Entomologische Zeitschrift</em></a> <strong>1913</strong>: 696-701<!--MARK-->","","Article in Journal","8b256999-6936-4bb5-86c8-120daa00fab5","20081009T05:11:37.000+0000","bdeb8163-7175-47c9-be9b-28f797c57745"
"Bickhardt, H.","1913","Zoological results of the Abor Expedition, 1911-1912. VIII. Coleoptera, III: Histeridae","121-125","","Records of the Indian Museum","","","","<!--MARK--><a href='../../../../publication/324dd940-012c-4d6d-b2ed-f5557c03410a' class='mouseoverHref'>Bickhardt, H. 1913. Zoological results of the Abor Expedition, 1911-1912. VIII. Coleoptera, III: Histeridae.</a> <!--MARK--><!--MARK--><a href='../../../../publication/6c35e896-740a-4f0a-9785-d35f1fc27b0d' class='mouseoverHref'><em>Records of the Indian Museum</em></a> <strong>8</strong>: 121-125<!--MARK-->","","Article in Journal","324dd940-012c-4d6d-b2ed-f5557c03410a","20081009T05:11:37.000+0000","6c35e896-740a-4f0a-9785-d35f1fc27b0d"
"Bickhardt, H.","1917","Coleoptera. Fam. Histeridae","113-302","<i>Genera Insectorum</i>","","","","","<!--MARK--><a href='../../../../publication/cba8e0d7-7bc2-491c-8409-306ca4efae14' class='mouseoverHref'>Bickhardt, H. 1917. Coleoptera. Fam. Histeridae. pp. 113-302</a> <!--MARK--><em>in</em> <!--MARK--><a href='../../../../publication/81da98dd-3bd4-4212-a699-33c775baefab' class='mouseoverHref'>Wytsman, P. (ed.). <em><i>Genera Insectorum</i></em>. The Hague : M. Nijhoff Vol. Fasc. 166b.</a><!--MARK-->","","Chapter in Book","cba8e0d7-7bc2-491c-8409-306ca4efae14","20081009T05:11:37.000+0000","81da98dd-3bd4-4212-a699-33c775baefab"
"Bickhardt, H.","1918","Neue exotische Histeriden und Notizen zu bekannten Arten (36. Beitrag zur Kenntnis der Histeriden.)","233-244","","Entomologische Blätter für Biologie und Systematik der Käfer","","","","<!--MARK--><a href='../../../../publication/b1532d4f-ab95-4f09-9116-3544483c1a0c' class='mouseoverHref'>Bickhardt, H. 1918. Neue exotische Histeriden und Notizen zu bekannten Arten (36. Beitrag zur Kenntnis der Histeriden.).</a> <!--MARK--><!--MARK--><a href='../../../../publication/abedc245-6835-4ecc-82d0-a0ac81426af9' class='mouseoverHref'><em>Entomologische Blätter für Biologie und Systematik der Käfer</em></a> <strong>14</strong>: 233-244<!--MARK-->","","Article in Journal","b1532d4f-ab95-4f09-9116-3544483c1a0c","20081009T05:11:37.000+0000","abedc245-6835-4ecc-82d0-a0ac81426af9"
"Bickhardt, H.","1920","Eine neue indomalayische Histeridengattung (40. Beitrag zur Kenntnis der Histeriden)","213-217","","Entomologische Blätter für Biologie und Systematik der Käfer","","","","<!--MARK--><a href='../../../../publication/c939c511-4d08-4f54-a9dc-81c04586885b' class='mouseoverHref'>Bickhardt, H. 1920. Eine neue indomalayische Histeridengattung (40. Beitrag zur Kenntnis der Histeriden).</a> <!--MARK--><!--MARK--><a href='../../../../publication/abedc245-6835-4ecc-82d0-a0ac81426af9' class='mouseoverHref'><em>Entomologische Blätter für Biologie und Systematik der Käfer</em></a> <strong>15</strong>: 213-217<!--MARK-->","","Article in Journal","c939c511-4d08-4f54-a9dc-81c04586885b","20081009T05:11:37.000+0000","abedc245-6835-4ecc-82d0-a0ac81426af9"
"Bickhardt, H.","1921","Die Histeriden des aethiopischen Faungebiets. Tiel I, II","43-208","","Archiv für Naturgeschichte","","","","<!--MARK--><a href='../../../../publication/c3f16122-2aff-48ca-a6c0-92873834829f' class='mouseoverHref'>Bickhardt, H. 1921. Die Histeriden des aethiopischen Faungebiets. Tiel I, II.</a> <!--MARK--><!--MARK--><a href='../../../../publication/f5b5f7c7-fc53-4502-951d-1c96b680d874' class='mouseoverHref'><em>Archiv für Naturgeschichte</em></a> <strong>87A</strong>(6): 43-208<!--MARK-->","","Article in Journal","c3f16122-2aff-48ca-a6c0-92873834829f","20081009T05:11:37.000+0000","f5b5f7c7-fc53-4502-951d-1c96b680d874"
"Blackburn, T.","1891","Further notes on Australian Coleoptera, with descriptions of new genera and species","65-153","","Transactions of the Royal Society of South Australia","","July 1891","","<!--MARK--><a href='../../../../publication/b9aaf5b8-f04d-4fac-b16b-af37102c7e46' class='mouseoverHref'>Blackburn, T. 1891. Further notes on Australian Coleoptera, with descriptions of new genera and species.</a> <!--MARK--><!--MARK--><a href='../../../../publication/8b48b0a3-dd7a-4aea-be0d-10a223710ebc' class='mouseoverHref'><em>Transactions of the Royal Society of South Australia</em></a> <strong>14</strong>: 65-153<!--MARK--> [Date published July 1891]","","Article in Journal","b9aaf5b8-f04d-4fac-b16b-af37102c7e46","20081009T05:11:37.000+0000","8b48b0a3-dd7a-4aea-be0d-10a223710ebc"
"Blackburn, T.","1892","Further notes on Australian Coleoptera with descriptions of new genera and species. Part XI","20-73","","Transactions of the Royal Society of South Australia","","July 1892","","<!--MARK--><a href='../../../../publication/9d396cf6-3248-4caf-9f5c-114c43249402' class='mouseoverHref'>Blackburn, T. 1892. Further notes on Australian Coleoptera with descriptions of new genera and species. Part XI.</a> <!--MARK--><!--MARK--><a href='../../../../publication/8b48b0a3-dd7a-4aea-be0d-10a223710ebc' class='mouseoverHref'><em>Transactions of the Royal Society of South Australia</em></a> <strong>15</strong>(1): 20-73<!--MARK--> [Date published July 1892]","","Article in Journal","9d396cf6-3248-4caf-9f5c-114c43249402","20111219T20:58:00.395+0000","8b48b0a3-dd7a-4aea-be0d-10a223710ebc"
"Blackburn, T.","1900","On some new genera and species of Australian Coleoptera","206-233","","Proceedings of the Royal Society of Victoria","","Apr. 30, 1900","","<!--MARK--><a href='../../../../publication/0b581920-11f7-4e48-b42e-f6e848b6cdac' class='mouseoverHref'>Blackburn, T. 1900. On some new genera and species of Australian Coleoptera.</a> <!--MARK--><!--MARK--><a href='../../../../publication/ce333794-3a02-427f-ba27-346079f1efa0' class='mouseoverHref'><em>Proceedings of the Royal Society of Victoria</em></a> <strong>12</strong>: 206-233<!--MARK--> [Date published Apr. 30, 1900]","","Article in Journal","0b581920-11f7-4e48-b42e-f6e848b6cdac","20081009T05:11:37.000+0000","ce333794-3a02-427f-ba27-346079f1efa0"
"Blackburn, T.","1901","Further notes on Australian Coleoptera with descriptions of new genera and species. Part XXIX","99-131","","Transactions of the Royal Society of South Australia","","","","<!--MARK--><a href='../../../../publication/7bb17739-7198-43ec-9e9e-3f121b871b6d' class='mouseoverHref'>Blackburn, T. 1901. Further notes on Australian Coleoptera with descriptions of new genera and species. Part XXIX.</a> <!--MARK--><!--MARK--><a href='../../../../publication/8b48b0a3-dd7a-4aea-be0d-10a223710ebc' class='mouseoverHref'><em>Transactions of the Royal Society of South Australia</em></a> <strong>25</strong>: 99-131<!--MARK-->","","Article in Journal","7bb17739-7198-43ec-9e9e-3f121b871b6d","20081009T05:11:37.000+0000","8b48b0a3-dd7a-4aea-be0d-10a223710ebc"
"Blackburn, T.","1903","Further notes on Australian Coleoptera, with descriptions of new genera and species. Part XXXII","91-182","","Transactions of the Royal Society of South Australia","","","","<!--MARK--><a href='../../../../publication/5b593325-4f60-4f87-9fdc-e63555fbd6ef' class='mouseoverHref'>Blackburn, T. 1903. Further notes on Australian Coleoptera, with descriptions of new genera and species. Part XXXII.</a> <!--MARK--><!--MARK--><a href='../../../../publication/8b48b0a3-dd7a-4aea-be0d-10a223710ebc' class='mouseoverHref'><em>Transactions of the Royal Society of South Australia</em></a> <strong>27</strong>: 91-182<!--MARK-->","","Article in Journal","5b593325-4f60-4f87-9fdc-e63555fbd6ef","20130318T00:07:47.541+0000","8b48b0a3-dd7a-4aea-be0d-10a223710ebc"
"Blanchard, C.E.","1853","Description des Insectes","1-422","Voyage au Pole Sud et dans l'Océanie sur les corvettes l'<i>Astrolabe</i> et la <i>Zélée</i> pendant les années 1837-1840, sous le commandement de M.J. Dumont-d'Urville Capitaine de vaisseau. Atlas, Zoologie","","","","","<!--MARK--><a href='../../../../publication/0f266222-c6b7-4a49-869b-2df799b52822' class='mouseoverHref'>Blanchard, C.E. 1853. Description des Insectes. pp. 1-422</a> <!--MARK--><em>in</em> <!--MARK--><a href='../../../../publication/d73867fe-1441-4373-85fe-65819644bde8' class='mouseoverHref'>Dumont-d'Urville, J. <em>Voyage au Pole Sud et dans l'Océanie sur les corvettes l'<i>Astrolabe</i> et la <i>Zélée</i> pendant les années 1837-1840, sous le commandement de M.J. Dumont-d'Urville Capitaine de vaisseau. Atlas, Zoologie</em>. Paris : Gide et Cie et J. Baudry Vol. 4 422 pp.</a><!--MARK--> [published between 1842-1853]","","Chapter in Book","0f266222-c6b7-4a49-869b-2df799b52822","20081009T05:11:37.000+0000","d73867fe-1441-4373-85fe-65819644bde8"
"Boisduval","1835","Faune entomologique de l'Océan pacifique, avec l'illustration des insectes nouveaux recueillis pendant le voyage. Deuxième partie. Coléoptères et autres ordres. <i>In</i>: <i>Voyage de découvertes de L'</i>Astrolabe <i>exécuté par ordre du Roi, pendant les années 1826-1827-1828-1829, sous le commandement de M.J. Dumont d'Urville</i>.","vii + 716 pp","","","","before 3 June","J. Tastu","<!--MARK--><a href='../../../../publication/eec051f9-a04f-4e79-b415-8c4486bd84ff' class='mouseoverHref'>Boisduval 1835. <em>Faune entomologique de l'Océan pacifique, avec l'illustration des insectes nouveaux recueillis pendant le voyage. Deuxième partie. Coléoptères et autres ordres. <i>In</i>: <i>Voyage de découvertes de L'</i>Astrolabe <i>exécuté par ordre du Roi, pendant les années 1826-1827-1828-1829, sous le commandement de M.J. Dumont d'Urville</i></em>. Paris : J. Tastu vii + 716 pp.</a><!--MARK--> [Date published before 3 June]","","Book","eec051f9-a04f-4e79-b415-8c4486bd84ff","20141118T02:24:06.267+0000",""
"Boisduval, J.A.","1835","Voyage de Découvertes de l'<i>Astrolabe</i> exécuté par ordre du Roi, pendant les années 1826-1827-1828-1829, sous le commandement de M.J. Dumont d'Urville. Faune Entomologique de l'Océan Pacifique, avec l'illustration des insectes nouveaux recueillis pendant le voyage. 2me Partie. Coléoptères et autres Ordres","vii 716 pp.","","","","27-III-1835","J. Tastu","<!--MARK--><a href='../../../../publication/f3f620b1-a19c-439c-88b6-243e5593b6bf' class='mouseoverHref'>Boisduval, J.A. 1835. <em>Voyage de Découvertes de l'<i>Astrolabe</i> exécuté par ordre du Roi, pendant les années 1826-1827-1828-1829, sous le commandement de M.J. Dumont d'Urville. Faune Entomologique de l'Océan Pacifique, avec l'illustration des insectes nouveaux recueillis pendant le voyage. 2me Partie. Coléoptères et autres Ordres</em>. Paris : J. Tastu vii 716 pp.</a><!--MARK--> [Date published 27-III-1835]","","Book","f3f620b1-a19c-439c-88b6-243e5593b6bf","20110901T05:19:23.377+0000",""
"Bornemissza, G.F.","1968","Studies on the histerid beetle <i>Pachylister chinensis</i> in Fiji, and its possible value in the control of buffalo-fly in Australia","673-688","","Australian Journal of Zoology","","","","<!--MARK--><a href='../../../../publication/a69dd3ce-2262-4cdd-82f8-dd3070b8a3cd' class='mouseoverHref'>Bornemissza, G.F. 1968. Studies on the histerid beetle <i>Pachylister chinensis</i> in Fiji, and its possible value in the control of buffalo-fly in Australia.</a> <!--MARK--><!--MARK--><a href='../../../../publication/53c3abd8-0254-4532-a73e-d9ef6b7ac2ef' class='mouseoverHref'><em>Australian Journal of Zoology</em></a> <strong>16</strong>(4): 673-688<!--MARK-->","","Article in Journal","a69dd3ce-2262-4cdd-82f8-dd3070b8a3cd","20081009T05:11:37.000+0000","53c3abd8-0254-4532-a73e-d9ef6b7ac2ef"
"Brethès, J.","1924","Description de deux nouveaux Coléoptères du Chili. II. Rehabilitation d'une espèce Latreillienne","39-43","","Revista Chilena de Historia Natural","","","","<!--MARK--><a href='../../../../publication/211fc97e-64ee-4270-8aa9-3e7ad76d600b' class='mouseoverHref'>Brethès, J. 1924. Description de deux nouveaux Coléoptères du Chili. II. Rehabilitation d'une espèce Latreillienne.</a> <!--MARK--><!--MARK--><a href='../../../../publication/89f4ed58-fd6b-4f2a-becf-ae336facd552' class='mouseoverHref'><em>Revista Chilena de Historia Natural</em></a> <strong>27</strong>: 39-43<!--MARK-->","","Article in Journal","211fc97e-64ee-4270-8aa9-3e7ad76d600b","20081009T05:11:37.000+0000","89f4ed58-fd6b-4f2a-becf-ae336facd552"
"Casey, T.L.","1893","Coleopterological notices. V","533-578","","Annals of the New York Academy of Sciences","","","","<!--MARK--><a href='../../../../publication/bc88bcc9-1589-4db0-ab40-8dc2c3610d6c' class='mouseoverHref'>Casey, T.L. 1893. Coleopterological notices. V.</a> <!--MARK--><!--MARK--><a href='../../../../publication/afd3dcfe-f2ab-4f0c-be4b-718fed82e4d8' class='mouseoverHref'><em>Annals of the New York Academy of Sciences</em></a> <strong>7</strong>: 533-578<!--MARK-->","","Article in Journal","bc88bcc9-1589-4db0-ab40-8dc2c3610d6c","20081009T05:11:37.000+0000","afd3dcfe-f2ab-4f0c-be4b-718fed82e4d8"
"Casey, T.L.","1894","Coleopterological notices, V.","281-606, pl.1","","Annals of the New York Academy of Sciences","","","","<!--MARK--><a href='../../../../publication/2c9eb4ac-15cf-4928-abfd-5fcf2c7babbe' class='mouseoverHref'>Casey, T.L. 1894. Coleopterological notices, V.</a> <!--MARK--><!--MARK--><a href='../../../../publication/afd3dcfe-f2ab-4f0c-be4b-718fed82e4d8' class='mouseoverHref'><em>Annals of the New York Academy of Sciences</em></a> <strong>7</strong>: 281-606, pl.1<!--MARK-->","","Article in Journal","2c9eb4ac-15cf-4928-abfd-5fcf2c7babbe","20110921T22:28:11.294+0000","afd3dcfe-f2ab-4f0c-be4b-718fed82e4d8"
"Casey, T.L.","1916","Some random studies among the Clavicornia","35-283","","Memoirs on the Coleoptera","","","","<!--MARK--><a href='../../../../publication/294d8d0c-b6f3-4e24-863c-0b04d0508dd5' class='mouseoverHref'>Casey, T.L. 1916. Some random studies among the Clavicornia.</a> <!--MARK--><!--MARK--><a href='../../../../publication/272fc486-d1ff-4832-ba4c-7936ac5c78d8' class='mouseoverHref'><em>Memoirs on the Coleoptera</em></a> <strong>7</strong>: 35-283<!--MARK-->","","Article in Journal","294d8d0c-b6f3-4e24-863c-0b04d0508dd5","20081009T05:11:37.000+0000","272fc486-d1ff-4832-ba4c-7936ac5c78d8"
"Caterino, M.S.","2003","New species of <i>Chlamydopsis</i> (Histeridae: Chlamydopsinae), with a review and phylogenetic analysis of all known species","159-235","","Memoirs of the Queensland Museum","","","","<!--MARK--><a href='../../../../publication/3fbdb879-c323-4d6a-ab85-b779c7c3ed35' class='mouseoverHref'>Caterino, M.S. 2003. New species of <i>Chlamydopsis</i> (Histeridae: Chlamydopsinae), with a review and phylogenetic analysis of all known species.</a> <!--MARK--><!--MARK--><a href='../../../../publication/1a0a2982-9f30-43e1-a641-b0379699837c' class='mouseoverHref'><em>Memoirs of the Queensland Museum</em></a> <strong>49</strong>: 159-235<!--MARK-->","","Article in Journal","3fbdb879-c323-4d6a-ab85-b779c7c3ed35","20081009T05:11:37.000+0000","1a0a2982-9f30-43e1-a641-b0379699837c"
"Caterino, M.S.","2007","Two new species of <i>Chlamydopsis</i> Westwood (Coleoptera: Histeridae)","327-333","","The Coleopterists Bulletin","","","","<!--MARK--><a href='../../../../publication/000e1a4e-c5e1-4f41-88f5-cda0f0c8fde9' class='mouseoverHref'>Caterino, M.S. 2007. Two new species of <i>Chlamydopsis</i> Westwood (Coleoptera: Histeridae).</a> <!--MARK--><!--MARK--><a href='../../../../publication/bfb4ceb5-9a22-44a0-9c17-ce86881f04b2' class='mouseoverHref'><em>The Coleopterists Bulletin</em></a> <strong>61</strong>(3): 327-333<!--MARK-->","","Article in Journal","000e1a4e-c5e1-4f41-88f5-cda0f0c8fde9","20170301T04:48:58.834+0000","bfb4ceb5-9a22-44a0-9c17-ce86881f04b2"
"Caterino, M. S. & Degallier, N.","2007","A review of the biology and systematics of Chlamydopsinae (Coleoptera: Histeridae).","1-28","","Invertebrate Systematics","","Mar 2007","","<!--MARK--><a href='../../../../publication/1b18c28a-49b2-452e-b820-89933874f7f7' class='mouseoverHref'>Caterino, M. S. & Degallier, N. 2007. A review of the biology and systematics of Chlamydopsinae (Coleoptera: Histeridae).</a> <!--MARK--><!--MARK--><a href='../../../../publication/7ef62e6c-73cc-4912-8ea7-5752f95e8e8a' class='mouseoverHref'><em>Invertebrate Systematics</em></a> <strong>21</strong>(1): 1-28<!--MARK--> [Date published Mar 2007]","","Article in Journal","1b18c28a-49b2-452e-b820-89933874f7f7","20110925T22:06:01.240+0000","7ef62e6c-73cc-4912-8ea7-5752f95e8e8a"
"Caterino, M.S. & Vogler, A.P.","2002","The phylogeny of the Histeroidea (Coleoptera: Staphyliniformia)","394-415","","Cladistics","","","","<!--MARK--><a href='../../../../publication/19789b68-0d35-4e7b-8d90-b57b0bfc8753' class='mouseoverHref'>Caterino, M.S. & Vogler, A.P. 2002. The phylogeny of the Histeroidea (Coleoptera: Staphyliniformia).</a> <!--MARK--><!--MARK--><a href='../../../../publication/5fce340d-5163-4796-a5f1-192ae181af59' class='mouseoverHref'><em>Cladistics</em></a> <strong>18</strong>(4): 394-415<!--MARK-->","","Article in Journal","19789b68-0d35-4e7b-8d90-b57b0bfc8753","20081009T05:11:37.000+0000","5fce340d-5163-4796-a5f1-192ae181af59"
"Cooman, A.","1937","Etude sur les genres <i>Paromalus</i> Er. et <i>Eulomalus</i> n.g. (Col. Histeridae), avec descriptions d'espèces nouvelles","89-167","","Notes d'Entomologie Chinoise","","","","<!--MARK--><a href='../../../../publication/87901f61-fce6-4918-a833-8556dd19630f' class='mouseoverHref'>Cooman, A. 1937. Etude sur les genres <i>Paromalus</i> Er. et <i>Eulomalus</i> n.g. (Col. Histeridae), avec descriptions d'espèces nouvelles.</a> <!--MARK--><!--MARK--><a href='../../../../publication/669957b8-abfe-4b3e-a99b-22548c54630c' class='mouseoverHref'><em>Notes d'Entomologie Chinoise</em></a> <strong>4</strong>: 89-167<!--MARK-->","","Article in Journal","87901f61-fce6-4918-a833-8556dd19630f","20081009T05:11:37.000+0000","669957b8-abfe-4b3e-a99b-22548c54630c"
"Cooman, A.","1941","Coléoptères Histeridae d'Extrême-Orient, principalement du Tonkin","291-333","","Notes d'Entomologie Chinoise","","","","<!--MARK--><a href='../../../../publication/7e5c3002-4420-43d3-8d78-6dc93d8b0932' class='mouseoverHref'>Cooman, A. 1941. Coléoptères Histeridae d'Extrême-Orient, principalement du Tonkin.</a> <!--MARK--><!--MARK--><a href='../../../../publication/669957b8-abfe-4b3e-a99b-22548c54630c' class='mouseoverHref'><em>Notes d'Entomologie Chinoise</em></a> <strong>11</strong>: 291-333<!--MARK-->","","Article in Journal","7e5c3002-4420-43d3-8d78-6dc93d8b0932","20081009T05:11:37.000+0000","669957b8-abfe-4b3e-a99b-22548c54630c"
"Cooman, A.","1947","Coléoptères Histeridae d'Extrême-Orient","421-428","","Notes d'Entomologie Chinoise","","","","<!--MARK--><a href='../../../../publication/f9a593b4-747c-4df9-928c-b8beb7f072cd' class='mouseoverHref'>Cooman, A. 1947. Coléoptères Histeridae d'Extrême-Orient.</a> <!--MARK--><!--MARK--><a href='../../../../publication/669957b8-abfe-4b3e-a99b-22548c54630c' class='mouseoverHref'><em>Notes d'Entomologie Chinoise</em></a> <strong>11</strong>: 421-428<!--MARK-->","","Article in Journal","f9a593b4-747c-4df9-928c-b8beb7f072cd","20081009T05:11:37.000+0000","669957b8-abfe-4b3e-a99b-22548c54630c"
"Cooman, A.","1948","Coléoptères Histeridae d'Extrême-Orient","123-141","","Notes d'Entomologie Chinoise","","","","<!--MARK--><a href='../../../../publication/17a1ad89-458e-48b4-8450-c0aa4d5fbbb3' class='mouseoverHref'>Cooman, A. 1948. Coléoptères Histeridae d'Extrême-Orient.</a> <!--MARK--><!--MARK--><a href='../../../../publication/669957b8-abfe-4b3e-a99b-22548c54630c' class='mouseoverHref'><em>Notes d'Entomologie Chinoise</em></a> <strong>12</strong>: 123-141<!--MARK-->","","Article in Journal","17a1ad89-458e-48b4-8450-c0aa4d5fbbb3","20081009T05:11:37.000+0000","669957b8-abfe-4b3e-a99b-22548c54630c"
"Cristofori, J. de","1832","Catalogus in IV. Sectiones divisus rerum naturalium in Museo exstantium Josephi de Cristofori et Georgii Jan : Sectio III.a Entomologia, Pars I.a Conspectus methodicus insectorum, Fasc. I.us Coleoptera","xvi 111 pp.","","","","","Parmae","<!--MARK--><a href='../../../../publication/32adc432-fe8a-40cb-bd98-ddc6e38f4fea' class='mouseoverHref'>Cristofori, J. de 1832. <em>Catalogus in IV. Sectiones divisus rerum naturalium in Museo exstantium Josephi de Cristofori et Georgii Jan : Sectio III.a Entomologia, Pars I.a Conspectus methodicus insectorum, Fasc. I.us Coleoptera</em>. Milano : Parmae xvi 111 pp.</a><!--MARK-->","","Book","32adc432-fe8a-40cb-bd98-ddc6e38f4fea","20081009T05:11:37.000+0000",""
"Dahlgren, G.","1967","Beiträge zur Kenntnis der Gattung <i>Saprinus</i> (Col. Histeridae)","213-224","","Opuscula Entomologica. Lund","","","","<!--MARK--><a href='../../../../publication/84d66c23-2a86-4400-a7cb-18e19d0b016d' class='mouseoverHref'>Dahlgren, G. 1967. Beiträge zur Kenntnis der Gattung <i>Saprinus</i> (Col. Histeridae).</a> <!--MARK--><!--MARK--><a href='../../../../publication/ce78610a-5b37-4cbb-920f-1f7d3e2284ec' class='mouseoverHref'><em>Opuscula Entomologica. Lund</em></a> <strong>32</strong>: 213-224<!--MARK-->","","Article in Journal","84d66c23-2a86-4400-a7cb-18e19d0b016d","20081009T05:11:37.000+0000","ce78610a-5b37-4cbb-920f-1f7d3e2284ec"
"Dahlgren, G.","1968","Beiträge zur Kenntnis der Gattung <i>Saprinus</i> (Col. Histeridae) III","255-268","","Entomologisk Tidskrift","","","","<!--MARK--><a href='../../../../publication/80e3554b-1fff-475f-b0da-6efe28554431' class='mouseoverHref'>Dahlgren, G. 1968. Beiträge zur Kenntnis der Gattung <i>Saprinus</i> (Col. Histeridae) III.</a> <!--MARK--><!--MARK--><a href='../../../../publication/ba33b082-f69d-4d6a-a319-837886ef96ce' class='mouseoverHref'><em>Entomologisk Tidskrift</em></a> <strong>89</strong>: 255-268<!--MARK-->","","Article in Journal","80e3554b-1fff-475f-b0da-6efe28554431","20081009T05:11:37.000+0000","ba33b082-f69d-4d6a-a319-837886ef96ce"
"Dahlgren, G.","1971","Zur Taxonomie der Gattungen <i>Saprinus</i>, <i>Hypocaccus</i> und <i>Zorius</i> (Col. Histeridae)","43-53","","Entomologisk Tidskrift","","","","<!--MARK--><a href='../../../../publication/09876698-49d8-4131-a7b8-ef7c19a3579d' class='mouseoverHref'>Dahlgren, G. 1971. Zur Taxonomie der Gattungen <i>Saprinus</i>, <i>Hypocaccus</i> und <i>Zorius</i> (Col. Histeridae).</a> <!--MARK--><!--MARK--><a href='../../../../publication/ba33b082-f69d-4d6a-a319-837886ef96ce' class='mouseoverHref'><em>Entomologisk Tidskrift</em></a> <strong>92</strong>(1-2): 43-53<!--MARK-->","","Article in Journal","09876698-49d8-4131-a7b8-ef7c19a3579d","20081009T05:11:37.000+0000","ba33b082-f69d-4d6a-a319-837886ef96ce"
