"PUB_AUTHOR","PUB_YEAR","PUB_TITLE","PUB_PAGES","PUB_PARENT_BOOK_TITLE","PUB_PARENT_JOURNAL_TITLE","PUB_PARENT_ARTICLE_TITLE","PUB_PUBLICATION_DATE","PUB_PUBLISHER","PUB_FORMATTED","PUB_QUALIFICATION","PUB_TYPE","PUBLICATION_GUID","PUBLICATION_LAST_UPDATE","PARENT_PUBLICATION_GUID"
"Houlbert, C. & Monnot, E.","1923","Faune entomologique armoricaine. Coléoptères. 42e Famille. Histérides (Escarbots)","17-75","","Bulletin de la Société Scientifique Mediterranée Ouest","","","","<!--MARK--><a href='../../../../publication/cd9a38a5-5990-44a3-8165-93a468249991' class='mouseoverHref'>Houlbert, C. & Monnot, E. 1923. Faune entomologique armoricaine. Coléoptères. 42e Famille. Histérides (Escarbots).</a> <!--MARK--><!--MARK--><a href='../../../../publication/9d13ae10-7479-4917-8486-2c3e7f5a8006' class='mouseoverHref'><em>Bulletin de la Société Scientifique Mediterranée Ouest</em></a> <strong>32</strong>: 17-75<!--MARK-->","","Article in Journal","cd9a38a5-5990-44a3-8165-93a468249991","20081009T05:11:37.000+0000","9d13ae10-7479-4917-8486-2c3e7f5a8006"
"Illiger, J.C.W.","1807","Portugiesische Käfer (Fortsetzung)","28-80","","Magazin für Insektenkunde (Illiger)","","","","<!--MARK--><a href='../../../../publication/0d1fd838-2e26-4dad-925a-45e868690108' class='mouseoverHref'>Illiger, J.C.W. 1807. Portugiesische Käfer (Fortsetzung).</a> <!--MARK--><!--MARK--><a href='../../../../publication/6bc1edb7-155c-4080-af62-c3b8d119adb7' class='mouseoverHref'><em>Magazin für Insektenkunde (Illiger)</em></a> <strong>6</strong>: 28-80<!--MARK-->","","Article in Journal","0d1fd838-2e26-4dad-925a-45e868690108","20081009T05:11:37.000+0000","6bc1edb7-155c-4080-af62-c3b8d119adb7"
"Jacquelin du Val, P.N.C.","1858","Genera des Coléoptères d'Europe, comprenant leur classification en familles naturelles, la description de tous les genres, des Tableaux synoptiques destines à faciliter l'étude. Catalogue de toutes les espèces de nombreux dessins au trait de characters","285 pp.","","","","","A. Deyrolle","<!--MARK--><a href='../../../../publication/d8ffd185-e7bd-4584-9dd4-b119e8ab854d' class='mouseoverHref'>Jacquelin du Val, P.N.C. 1858. <em>Genera des Coléoptères d'Europe, comprenant leur classification en familles naturelles, la description de tous les genres, des Tableaux synoptiques destines à faciliter l'étude. Catalogue de toutes les espèces de nombreux dessins au trait de characters</em>. Paris : A. Deyrolle Vol. 2 285 pp.</a><!--MARK-->","","Book","d8ffd185-e7bd-4584-9dd4-b119e8ab854d","20100226T00:34:39.205+0000",""
"Joy, N.H.","1907","<i>Gnathoncus nidicola</i>, sp. nov., a coleopterous inhabitant of birds' nests","133-136","","Entomologist's Record and Journal of Variation","","","","<!--MARK--><a href='../../../../publication/c90d39b4-38be-4788-b619-b729d38ffb65' class='mouseoverHref'>Joy, N.H. 1907. <i>Gnathoncus nidicola</i>, sp. nov., a coleopterous inhabitant of birds' nests.</a> <!--MARK--><!--MARK--><a href='../../../../publication/02bf89d0-56c4-40f9-a931-cb69f6b85eb2' class='mouseoverHref'><em>Entomologist's Record and Journal of Variation</em></a> <strong>19</strong>: 133-136<!--MARK-->","","Article in Journal","c90d39b4-38be-4788-b619-b729d38ffb65","20081009T05:11:37.000+0000","02bf89d0-56c4-40f9-a931-cb69f6b85eb2"
"Kanaar, P.","2003","Revision of the genus <i>Trypeticus</i> Marseul (Coleoptera: Histeridae)","1-318","","Zoologische Verhandelingen (Leiden)","","","","<!--MARK--><a href='../../../../publication/5d895042-f48d-4533-8695-9238a4e0e39a' class='mouseoverHref'>Kanaar, P. 2003. Revision of the genus <i>Trypeticus</i> Marseul (Coleoptera: Histeridae).</a> <!--MARK--><!--MARK--><a href='../../../../publication/ef9c29c7-02e1-45c1-816e-05f980b8b1fd' class='mouseoverHref'><em>Zoologische Verhandelingen (Leiden)</em></a> <strong>342</strong>: 1-318<!--MARK--> [25 Apr. 2003]","25 Apr. 2003","Article in Journal","5d895042-f48d-4533-8695-9238a4e0e39a","20171011T05:35:05.380+0000","ef9c29c7-02e1-45c1-816e-05f980b8b1fd"
"King, R.L.","1869","On the Byrrhides of Australia","71-75","","Transactions of the Entomological Society of New South Wales","","","","<!--MARK--><a href='../../../../publication/c16aea65-2a92-4234-8e14-3bc2e15eedb1' class='mouseoverHref'>King, R.L. 1869. On the Byrrhides of Australia.</a> <!--MARK--><!--MARK--><a href='../../../../publication/69b821b6-f09d-44b0-ae3f-0e6c294b532e' class='mouseoverHref'><em>Transactions of the Entomological Society of New South Wales</em></a> <strong>2</strong>(1): 71-75<!--MARK-->","","Article in Journal","c16aea65-2a92-4234-8e14-3bc2e15eedb1","","69b821b6-f09d-44b0-ae3f-0e6c294b532e"
"Koch, K.","1989","Die Käfer Mitteleuropas. Ökologie","440 pp.","","","","","Goecke & Evers","<!--MARK--><a href='../../../../publication/f2115ea4-8a52-44f0-bea4-3df7742ab0bd' class='mouseoverHref'>Koch, K. 1989. <em>Die Käfer Mitteleuropas. Ökologie</em>. Krefeld : Goecke & Evers Vol. 1 440 pp.</a><!--MARK-->","","Book","f2115ea4-8a52-44f0-bea4-3df7742ab0bd","20100321T23:15:32.636+0000",""
"Kryzhanovskij, O.L.","1972","On the taxonomy of the extra-Palaearctic Histeridae (Coleoptera)","19-25","","Entomologica Scandinavica","","","","<!--MARK--><a href='../../../../publication/62f1de35-52bd-4af6-8bcd-b310b57f3b98' class='mouseoverHref'>Kryzhanovskij, O.L. 1972. On the taxonomy of the extra-Palaearctic Histeridae (Coleoptera).</a> <!--MARK--><!--MARK--><a href='../../../../publication/bb9374e3-b7d9-4c48-a5cd-2fb7a1185a84' class='mouseoverHref'><em>Entomologica Scandinavica</em></a> <strong>3</strong>: 19-25<!--MARK-->","","Article in Journal","62f1de35-52bd-4af6-8bcd-b310b57f3b98","20081009T05:11:37.000+0000","bb9374e3-b7d9-4c48-a5cd-2fb7a1185a84"
"Kryzhanovskij, O.L.","1989","O sisteme zhiznennykh form zhukov semeitsva Histeridae (Coleoptera)","87-105","","Trudy Zoologicheskogo Instituta, Akademiya Nauk SSSR","","","","<!--MARK--><a href='../../../../publication/fb7253eb-7efc-4cbf-88de-af157c1af18e' class='mouseoverHref'>Kryzhanovskij, O.L. 1989. O sisteme zhiznennykh form zhukov semeitsva Histeridae (Coleoptera).</a> <!--MARK--><!--MARK--><a href='../../../../publication/2a1ca156-64c7-4d07-a82d-60f795213426' class='mouseoverHref'><em>Trudy Zoologicheskogo Instituta, Akademiya Nauk SSSR</em></a> <strong>202</strong>: 87-105<!--MARK-->","","Article in Journal","fb7253eb-7efc-4cbf-88de-af157c1af18e","20081009T05:11:37.000+0000","2a1ca156-64c7-4d07-a82d-60f795213426"
"Kugelann, J.G.","1792","Verzeichniss der in einigen Gegenden Preussens bis jetzt entdeckten Käfer-arten, nebst kurzen Nachrichten von denselben","257-306","","Neuestes Magazin für die Liebhaber der Entomologie (Schneider)","","","","<!--MARK--><a href='../../../../publication/d7e0698e-f8d3-4f79-98c3-c7c44de22ef9' class='mouseoverHref'>Kugelann, J.G. 1792. Verzeichniss der in einigen Gegenden Preussens bis jetzt entdeckten Käfer-arten, nebst kurzen Nachrichten von denselben.</a> <!--MARK--><!--MARK--><a href='../../../../publication/40279e77-bbbb-4d5a-8c35-503853d18f70' class='mouseoverHref'><em>Neuestes Magazin für die Liebhaber der Entomologie (Schneider)</em></a> <strong>1</strong>(Heft 3): 257-306<!--MARK-->","","Article in Journal","d7e0698e-f8d3-4f79-98c3-c7c44de22ef9","20081009T05:11:37.000+0000","40279e77-bbbb-4d5a-8c35-503853d18f70"
"Kuschel, G.","1987","A New Zealand histerid beetle of Fabricius mistakenly described from Australia (Coleoptera: Histeridae)","56-57","","New Zealand Entomologist","","","","<!--MARK--><a href='../../../../publication/d2bbd7a0-63bb-4c9e-86f6-4d99042e3beb' class='mouseoverHref'>Kuschel, G. 1987. A New Zealand histerid beetle of Fabricius mistakenly described from Australia (Coleoptera: Histeridae).</a> <!--MARK--><!--MARK--><a href='../../../../publication/f86f120b-5516-4822-b304-3d5a1520c2e2' class='mouseoverHref'><em>New Zealand Entomologist</em></a> <strong>9</strong>: 56-57<!--MARK-->","","Article in Journal","d2bbd7a0-63bb-4c9e-86f6-4d99042e3beb","20081009T05:11:37.000+0000","f86f120b-5516-4822-b304-3d5a1520c2e2"
"Küster, H.C.","1848","Die Käfer Europa's. Nach der Natur beschrieben","100 pp., 2 pls","","","","","Bauer & Raspe","<!--MARK--><a href='../../../../publication/1fd892da-77c4-4fc5-8746-10bb76c7fcdc' class='mouseoverHref'>Küster, H.C. 1848. <em>Die Käfer Europa's. Nach der Natur beschrieben</em>. Nürnberg : Bauer & Raspe 100 pp., 2 pls.</a><!--MARK-->","","Book","1fd892da-77c4-4fc5-8746-10bb76c7fcdc","20081009T05:11:37.000+0000",""
"Lackner, T. & Leschen, R.A.B.","2017","A monograph of the Australopacific Saprininae (Coleoptera, Histeridae)","1-263","","ZooKeys","","","","<!--MARK--><a href='../../../../publication/5f87a5f5-5e87-48a9-b761-8a36c1c0a996' class='mouseoverHref'>Lackner, T. & Leschen, R.A.B. 2017. A monograph of the Australopacific Saprininae (Coleoptera, Histeridae).</a> <!--MARK--><!--MARK--><a href='../../../../publication/8cb7bef9-51f4-441c-a060-649dc8095e71' class='mouseoverHref'><em>ZooKeys</em></a> <strong>689</strong>: 1-263<!--MARK-->","","Article in Journal","5f87a5f5-5e87-48a9-b761-8a36c1c0a996","20180618T02:02:10.030+0000","8cb7bef9-51f4-441c-a060-649dc8095e71"
"Lawrence, J.F. & Britton, E.B.","1994","Australian Beetles","x 192 pp.","","","","","Melbourne University Press","<!--MARK--><a href='../../../../publication/5b9b6e97-52bd-4772-a414-468b0dc89336' class='mouseoverHref'>Lawrence, J.F. & Britton, E.B. 1994. <em>Australian Beetles</em>. Melbourne : Melbourne University Press x 192 pp.</a><!--MARK-->","","Book","5b9b6e97-52bd-4772-a414-468b0dc89336","20090819T04:34:31.325+0000",""
"Lea, A.M.","1910","Australian and Tasmanian Coleoptera inhabiting or resorting to the nests of ants, bees, and termites","116-230 pls XXV-XXVII","","Proceedings of the Royal Society of Victoria","","Aug. 1910","","<!--MARK--><a href='../../../../publication/b0d9adaa-bb69-41b4-bdb2-edb008d55ea3' class='mouseoverHref'>Lea, A.M. 1910. Australian and Tasmanian Coleoptera inhabiting or resorting to the nests of ants, bees, and termites.</a> <!--MARK--><!--MARK--><a href='../../../../publication/ce333794-3a02-427f-ba27-346079f1efa0' class='mouseoverHref'><em>Proceedings of the Royal Society of Victoria</em></a> n.s. <strong>23</strong>(1): 116-230 pls XXV-XXVII<!--MARK--> [Date published Aug. 1910]","","Article in Journal","b0d9adaa-bb69-41b4-bdb2-edb008d55ea3","20111219T03:28:18.834+0000","ce333794-3a02-427f-ba27-346079f1efa0"
"Lea, A.M.","1912","Australian and Tasmanian Coleoptera inhabiting or resorting to the nests of ants, bees, and termites. Supplement","31-78 pl. II","","Proceedings of the Royal Society of Victoria","","Aug. 1912","","<!--MARK--><a href='../../../../publication/5097ebda-e64d-4bac-a00a-bccabae2a673' class='mouseoverHref'>Lea, A.M. 1912. Australian and Tasmanian Coleoptera inhabiting or resorting to the nests of ants, bees, and termites. Supplement.</a> <!--MARK--><!--MARK--><a href='../../../../publication/ce333794-3a02-427f-ba27-346079f1efa0' class='mouseoverHref'><em>Proceedings of the Royal Society of Victoria</em></a> n.s. <strong>25</strong>(1): 31-78 pl. II<!--MARK--> [Date published Aug. 1912]","","Article in Journal","5097ebda-e64d-4bac-a00a-bccabae2a673","20111219T03:27:57.671+0000","ce333794-3a02-427f-ba27-346079f1efa0"
"Lea, A.M.","1914","Notes on some miscellaneous Coleoptera, with descriptions of new species","249-344, pl. 16","","Transactions of the Royal Society of South Australia","","","","<!--MARK--><a href='../../../../publication/ddbc2ec0-ea7a-4ad1-b132-8b5a81872279' class='mouseoverHref'>Lea, A.M. 1914. Notes on some miscellaneous Coleoptera, with descriptions of new species.</a> <!--MARK--><!--MARK--><a href='../../../../publication/8b48b0a3-dd7a-4aea-be0d-10a223710ebc' class='mouseoverHref'><em>Transactions of the Royal Society of South Australia</em></a> <strong>38</strong>: 249-344, pl. 16<!--MARK-->","","Article in Journal","ddbc2ec0-ea7a-4ad1-b132-8b5a81872279","20110926T23:45:47.582+0000","8b48b0a3-dd7a-4aea-be0d-10a223710ebc"
"Lea, A.M.","1914","On Australian and Tasmanian Coleoptera with descriptions of new species. Part II","211-227, pl. 22","","Proceedings of the Royal Society of Victoria","","","","<!--MARK--><a href='../../../../publication/ad5cbf55-22fe-429b-992f-b58c445726e0' class='mouseoverHref'>Lea, A.M. 1914. On Australian and Tasmanian Coleoptera with descriptions of new species. Part II.</a> <!--MARK--><!--MARK--><a href='../../../../publication/ce333794-3a02-427f-ba27-346079f1efa0' class='mouseoverHref'><em>Proceedings of the Royal Society of Victoria</em></a> n.s. <strong>26</strong>: 211-227, pl. 22<!--MARK-->","","Article in Journal","ad5cbf55-22fe-429b-992f-b58c445726e0","20121030T00:49:54.627+0000","ce333794-3a02-427f-ba27-346079f1efa0"
"Lea, A.M.","1918","On Australian Coleoptera. Part I","83-104","","Records of the South Australian Museum (Adelaide)","","","","<!--MARK--><a href='../../../../publication/210674b8-10e8-4a93-a203-957153442bc2' class='mouseoverHref'>Lea, A.M. 1918. On Australian Coleoptera. Part I.</a> <!--MARK--><!--MARK--><a href='../../../../publication/f7f76869-b0b8-4c0e-a1bc-1d8c43cc0f89' class='mouseoverHref'><em>Records of the South Australian Museum (Adelaide)</em></a> <strong>1</strong>: 83-104<!--MARK-->","","Article in Journal","210674b8-10e8-4a93-a203-957153442bc2","20081009T05:11:37.000+0000","f7f76869-b0b8-4c0e-a1bc-1d8c43cc0f89"
"Lea, A.M.","1919","Notes on some miscellaneous Coleoptera, with descriptions of new species. Part V","166-261, pls XXV-XXVII","","Transactions of the Royal Society of South Australia","","24 Dec. 1919","","<!--MARK--><a href='../../../../publication/90157112-3fc1-4e96-b57b-f16b77996887' class='mouseoverHref'>Lea, A.M. 1919. Notes on some miscellaneous Coleoptera, with descriptions of new species. Part V.</a> <!--MARK--><!--MARK--><a href='../../../../publication/8b48b0a3-dd7a-4aea-be0d-10a223710ebc' class='mouseoverHref'><em>Transactions of the Royal Society of South Australia</em></a> <strong>43</strong>: 166-261, pls XXV-XXVII<!--MARK--> [Date published 24 Dec. 1919]","","Article in Journal","90157112-3fc1-4e96-b57b-f16b77996887","20081009T05:11:37.000+0000","8b48b0a3-dd7a-4aea-be0d-10a223710ebc"
"Lea, A.M.","1925","Descriptions of new species of Australian Coleoptera. Part XVIII","414-431","","Proceedings of the Linnean Society of New South Wales","","","","<!--MARK--><a href='../../../../publication/826c2062-8638-40ee-82a4-898f3cefe5fb' class='mouseoverHref'>Lea, A.M. 1925. Descriptions of new species of Australian Coleoptera. Part XVIII.</a> <!--MARK--><!--MARK--><a href='../../../../publication/c12cd779-adb5-41ea-bd2c-75f6864cf22e' class='mouseoverHref'><em>Proceedings of the Linnean Society of New South Wales</em></a> <strong>50</strong>(4): 414-431<!--MARK-->","","Article in Journal","826c2062-8638-40ee-82a4-898f3cefe5fb","20111208T05:36:49.915+0000","c12cd779-adb5-41ea-bd2c-75f6864cf22e"
"Lea, A.M.","1925","On Australian Histeridae (Coleoptera)","239-263","","Transactions of the Royal Entomological Society of London","","","","<!--MARK--><a href='../../../../publication/879ecf1d-29f6-4205-a880-86a4e742d519' class='mouseoverHref'>Lea, A.M. 1925. On Australian Histeridae (Coleoptera).</a> <!--MARK--><!--MARK--><a href='../../../../publication/aa458993-1b17-4c34-bd31-d6f8224d9b7d' class='mouseoverHref'><em>Transactions of the Royal Entomological Society of London</em></a> <strong>1924</strong>: 239-263<!--MARK-->","","Article in Journal","879ecf1d-29f6-4205-a880-86a4e742d519","20081009T05:11:37.000+0000","aa458993-1b17-4c34-bd31-d6f8224d9b7d"
"Lea, A.M.","1925","Results of Dr. E. Mjöberg's Swedish Scientific Expeditions to Australia 1910-1913. 42. Histeridae","1-3","","Arkiv för Zoologi","","","","<!--MARK--><a href='../../../../publication/9d6d402c-33f9-40e3-99ac-97bc8e8ffb7d' class='mouseoverHref'>Lea, A.M. 1925. Results of Dr. E. Mjöberg's Swedish Scientific Expeditions to Australia 1910-1913. 42. Histeridae.</a> <!--MARK--><!--MARK--><a href='../../../../publication/ea0f28cc-317a-4542-aaf0-5fa8122b7a93' class='mouseoverHref'><em>Arkiv för Zoologi</em></a> <strong>17A</strong>(17): 1-3<!--MARK-->","","Article in Journal","9d6d402c-33f9-40e3-99ac-97bc8e8ffb7d","20081009T05:11:37.000+0000","ea0f28cc-317a-4542-aaf0-5fa8122b7a93"
"Leach, W.E.","1817","A sketch of the characters of the stirpes and genera of the family Histeridea","76-79","<i>The Zoological Miscellany</i>; being descriptions of new or interesting animals","","","","","<!--MARK--><a href='../../../../publication/78b9cd9e-4844-4c5a-9833-d91eb427956c' class='mouseoverHref'>Leach, W.E. 1817. A sketch of the characters of the stirpes and genera of the family Histeridea. pp. 76-79</a> <!--MARK--><em>in</em> <!--MARK--><a href='../../../../publication/235df76e-78c2-4696-a99b-e6abf9e27d69' class='mouseoverHref'>Leach, W.E. (ed.). <em><i>The Zoological Miscellany</i>; being descriptions of new or interesting animals</em>. London : R.P. Nodder Vol. 3 v 151 pp. pls 121-150.</a><!--MARK-->","","Chapter in Book","78b9cd9e-4844-4c5a-9833-d91eb427956c","20140211T21:24:20.170+0000","235df76e-78c2-4696-a99b-e6abf9e27d69"
"LeConte, J.E.","1844","Monograph of American Histeroides.","185-187","","Proceedings of the Boston Society of Natural History","","","","<!--MARK--><a href='../../../../publication/0660733f-464e-48a1-961c-df37a4b37b82' class='mouseoverHref'>LeConte, J.E. 1844. Monograph of American Histeroides.</a> <!--MARK--><!--MARK--><a href='../../../../publication/4dec46d1-64ba-46f3-ad36-0b8115f9dba6' class='mouseoverHref'><em>Proceedings of the Boston Society of Natural History</em></a> <strong>1</strong>: 185-187<!--MARK-->","","Article in Journal","0660733f-464e-48a1-961c-df37a4b37b82","20111101T22:00:30.437+0000","4dec46d1-64ba-46f3-ad36-0b8115f9dba6"
"LeConte, J.E.","1845","A monography of the North American Histeroides","32-86, pls 1-6","","Boston Journal of Natural History","","","","<!--MARK--><a href='../../../../publication/dc1c1560-c03f-4c5b-b1f2-4f8cd5826e5f' class='mouseoverHref'>LeConte, J.E. 1845. A monography of the North American Histeroides.</a> <!--MARK--><!--MARK--><a href='../../../../publication/49d84cfc-7719-47f2-875d-1398df05ef05' class='mouseoverHref'><em>Boston Journal of Natural History</em></a> <strong>5</strong>(1845-1847): 32-86, pls 1-6<!--MARK-->","","Article in Journal","dc1c1560-c03f-4c5b-b1f2-4f8cd5826e5f","20110718T02:26:38.480+0000","49d84cfc-7719-47f2-875d-1398df05ef05"
"LeConte, J.L.","1853","Synopsis of the species of the histeroid genus <i>Abraeus</i> (Leach) inhabiting the United States, with descriptions of two nearly allied new genera","287-292","","Proceedings of the Academy of Natural Sciences, Philadelphia","","","","<!--MARK--><a href='../../../../publication/bbc2c645-11a5-4f31-b4c4-58364b4a2cae' class='mouseoverHref'>LeConte, J.L. 1853. Synopsis of the species of the histeroid genus <i>Abraeus</i> (Leach) inhabiting the United States, with descriptions of two nearly allied new genera.</a> <!--MARK--><!--MARK--><a href='../../../../publication/9dfe7fba-63cc-4968-b0be-a8904006864b' class='mouseoverHref'><em>Proceedings of the Academy of Natural Sciences, Philadelphia</em></a> <strong>6</strong>: 287-292<!--MARK-->","","Article in Journal","bbc2c645-11a5-4f31-b4c4-58364b4a2cae","20081009T05:11:37.000+0000","9dfe7fba-63cc-4968-b0be-a8904006864b"
"Leconte, J.L.","1878","Additional descriptions of new species","373-434","","Proceedings of the American Philosophical Society","","","","<!--MARK--><a href='../../../../publication/ca08dc42-7ff2-41c7-b884-06ae3d163ce5' class='mouseoverHref'>Leconte, J.L. 1878. Additional descriptions of new species.</a> <!--MARK--><!--MARK--><a href='../../../../publication/404f350f-cee2-4ecd-9efc-956d451539f6' class='mouseoverHref'><em>Proceedings of the American Philosophical Society</em></a> <strong>17</strong>(101): 373-434<!--MARK-->","","Article in Journal","ca08dc42-7ff2-41c7-b884-06ae3d163ce5","20081009T05:11:37.000+0000","404f350f-cee2-4ecd-9efc-956d451539f6"
"LeGuillou, E.J.F.","1844","Description de vingt insectes Coléoptères recueillis pendant le voyage autour du monde de l'Astrolabe et la Zélée","220-225","","Revue Zoologique par la Société Cuvierienne","","","","<!--MARK--><a href='../../../../publication/4221bcb8-585e-413c-b021-c7de44568991' class='mouseoverHref'>LeGuillou, E.J.F. 1844. Description de vingt insectes Coléoptères recueillis pendant le voyage autour du monde de l'Astrolabe et la Zélée.</a> <!--MARK--><!--MARK--><a href='../../../../publication/2d75227a-a231-4534-858c-74752fbeceab' class='mouseoverHref'><em>Revue Zoologique par la Société Cuvierienne</em></a> <strong>7</strong>: 220-225<!--MARK-->","","Article in Journal","4221bcb8-585e-413c-b021-c7de44568991","20081009T05:11:37.000+0000","2d75227a-a231-4534-858c-74752fbeceab"
"Lewis, G.","1885","New species of Histeridae, with synonymical notes","456-473","","Annals and Magazine of Natural History","","","","<!--MARK--><a href='../../../../publication/ab7da1e5-ac39-4811-881f-d68d5ab25d08' class='mouseoverHref'>Lewis, G. 1885. New species of Histeridae, with synonymical notes.</a> <!--MARK--><!--MARK--><a href='../../../../publication/efa8de69-3a29-4a43-8ef2-cbefda205976' class='mouseoverHref'><em>Annals and Magazine of Natural History</em></a> 5 <strong>15</strong>: 456-473<!--MARK-->","","Article in Journal","ab7da1e5-ac39-4811-881f-d68d5ab25d08","20081009T05:11:37.000+0000","efa8de69-3a29-4a43-8ef2-cbefda205976"
"Lewis, G.","1885","On a new genus of Histeridae","331-334","","Transactions of the Entomological Society of London","","","","<!--MARK--><a href='../../../../publication/2a732ed6-28a9-4903-85a7-7cd5e92ed29a' class='mouseoverHref'>Lewis, G. 1885. On a new genus of Histeridae.</a> <!--MARK--><!--MARK--><a href='../../../../publication/5cf355b3-abc5-451e-9abc-ed3282d7811a' class='mouseoverHref'><em>Transactions of the Entomological Society of London</em></a> <strong>1885</strong>: 331-334<!--MARK-->","","Article in Journal","2a732ed6-28a9-4903-85a7-7cd5e92ed29a","20081009T05:11:37.000+0000","5cf355b3-abc5-451e-9abc-ed3282d7811a"
"Lewis, G.","1888","Viaggio di Leonardo Fea in Birmania e regioni vicine. XII. Histeridae","630-645","","Annali del Museo Civico di Storia Naturale, Genova","","","","<!--MARK--><a href='../../../../publication/217419af-1eab-46c3-9250-a892dc2ad5b6' class='mouseoverHref'>Lewis, G. 1888. Viaggio di Leonardo Fea in Birmania e regioni vicine. XII. Histeridae.</a> <!--MARK--><!--MARK--><a href='../../../../publication/461059ea-ead7-4f6d-83f4-52913f06d09f' class='mouseoverHref'><em>Annali del Museo Civico di Storia Naturale, Genova</em></a> 2 <strong>6</strong>(26): 630-645<!--MARK-->","","Article in Journal","217419af-1eab-46c3-9250-a892dc2ad5b6","20081009T05:11:37.000+0000","461059ea-ead7-4f6d-83f4-52913f06d09f"
"Lewis, G.","1889","On new species of Histeridae","277-287","","Annals and Magazine of Natural History","","","","<!--MARK--><a href='../../../../publication/2e95b00b-9d70-4a55-953d-f083dd4be7a3' class='mouseoverHref'>Lewis, G. 1889. On new species of Histeridae.</a> <!--MARK--><!--MARK--><a href='../../../../publication/efa8de69-3a29-4a43-8ef2-cbefda205976' class='mouseoverHref'><em>Annals and Magazine of Natural History</em></a> 6 <strong>3</strong>: 277-287<!--MARK-->","","Article in Journal","2e95b00b-9d70-4a55-953d-f083dd4be7a3","20081009T05:11:37.000+0000","efa8de69-3a29-4a43-8ef2-cbefda205976"
"Lewis, G.","1891","A new genus of Histeridae","319-320","","Entomologist's Monthly Magazine","","","","<!--MARK--><a href='../../../../publication/5b3c78e8-04dd-4676-9309-4d1a68e9fab9' class='mouseoverHref'>Lewis, G. 1891. A new genus of Histeridae.</a> <!--MARK--><!--MARK--><a href='../../../../publication/cbd5c497-64d0-4fae-97ee-22719c3ca286' class='mouseoverHref'><em>Entomologist's Monthly Magazine</em></a> 2 <strong>2</strong>: 319-320<!--MARK-->","","Article in Journal","5b3c78e8-04dd-4676-9309-4d1a68e9fab9","20081009T05:11:37.000+0000","cbd5c497-64d0-4fae-97ee-22719c3ca286"
"Lewis, G.","1891","On new species of Histeridae","380-405","","Annals and Magazine of Natural History","","","","<!--MARK--><a href='../../../../publication/73649c07-4978-4b33-a22b-1a0e4b921f96' class='mouseoverHref'>Lewis, G. 1891. On new species of Histeridae.</a> <!--MARK--><!--MARK--><a href='../../../../publication/efa8de69-3a29-4a43-8ef2-cbefda205976' class='mouseoverHref'><em>Annals and Magazine of Natural History</em></a> 6 <strong>8</strong>: 380-405<!--MARK-->","","Article in Journal","73649c07-4978-4b33-a22b-1a0e4b921f96","20081009T05:11:37.000+0000","efa8de69-3a29-4a43-8ef2-cbefda205976"
"Lewis, G.","1892","On some new species of Histeridae","341-357","","Annals and Magazine of Natural History","","","","<!--MARK--><a href='../../../../publication/c7aef7c4-1539-483e-a538-07fa07e36ae2' class='mouseoverHref'>Lewis, G. 1892. On some new species of Histeridae.</a> <!--MARK--><!--MARK--><a href='../../../../publication/efa8de69-3a29-4a43-8ef2-cbefda205976' class='mouseoverHref'><em>Annals and Magazine of Natural History</em></a> 6 <strong>9</strong>: 341-357<!--MARK-->","","Article in Journal","c7aef7c4-1539-483e-a538-07fa07e36ae2","","efa8de69-3a29-4a43-8ef2-cbefda205976"
"Lewis, G.","1892","On some new species of Histeridae, and one new genus","102-104","","Entomologist's Monthly Magazine","","","","<!--MARK--><a href='../../../../publication/b7fc6c08-f45b-4e68-9f84-3ce010c3c8a4' class='mouseoverHref'>Lewis, G. 1892. On some new species of Histeridae, and one new genus.</a> <!--MARK--><!--MARK--><a href='../../../../publication/cbd5c497-64d0-4fae-97ee-22719c3ca286' class='mouseoverHref'><em>Entomologist's Monthly Magazine</em></a> <strong>28</strong>: 102-104<!--MARK-->","","Article in Journal","b7fc6c08-f45b-4e68-9f84-3ce010c3c8a4","20110928T01:09:44.856+0000","cbd5c497-64d0-4fae-97ee-22719c3ca286"
