"PUB_AUTHOR","PUB_YEAR","PUB_TITLE","PUB_PAGES","PUB_PARENT_BOOK_TITLE","PUB_PARENT_JOURNAL_TITLE","PUB_PARENT_ARTICLE_TITLE","PUB_PUBLICATION_DATE","PUB_PUBLISHER","PUB_FORMATTED","PUB_QUALIFICATION","PUB_TYPE","PUBLICATION_GUID","PUBLICATION_LAST_UPDATE","PARENT_PUBLICATION_GUID"
"Mazur, S.","1997","A world catalogue of Histeridae (Coleoptera: Histeroidea)","1-373","","Genus Supplement","","Nov/1997","","<!--MARK--><a href='../../../../publication/bf9095a1-b138-4b70-b9f4-7d6ea4ef7235' class='mouseoverHref'>Mazur, S. 1997. A world catalogue of Histeridae (Coleoptera: Histeroidea).</a> <!--MARK--><!--MARK--><a href='../../../../publication/952ed2b2-e755-40d7-85f1-fc003b9011b7' class='mouseoverHref'><em>Genus Supplement</em></a> <strong>1997</strong>: 1-373<!--MARK--> [Date published Nov/1997]","","Article in Journal","bf9095a1-b138-4b70-b9f4-7d6ea4ef7235","20081009T05:11:37.000+0000","952ed2b2-e755-40d7-85f1-fc003b9011b7"
"Mazur, S.","1997","New species of histerid beetles (Coleoptera, Histeridae)","27-32","","Annales Zoologici, Warszawa","","","","<!--MARK--><a href='../../../../publication/453f7d6a-6451-4ccc-8016-df138af927a6' class='mouseoverHref'>Mazur, S. 1997. New species of histerid beetles (Coleoptera, Histeridae).</a> <!--MARK--><!--MARK--><a href='../../../../publication/45d6cf5f-cfa8-4561-85c5-8cdf0d2982bf' class='mouseoverHref'><em>Annales Zoologici, Warszawa</em></a> <strong>38</strong>(1-2): 27-32<!--MARK-->","","Article in Journal","453f7d6a-6451-4ccc-8016-df138af927a6","20081009T05:11:37.000+0000","45d6cf5f-cfa8-4561-85c5-8cdf0d2982bf"
"Mazur, S.","1999","Preliminary studies upon the <i>Platysoma</i> complex (Col. Histeridae)","3-29","","Annals of Warsaw Agricultural University","","","","<!--MARK--><a href='../../../../publication/ee6b7929-b623-47e6-a1e2-61fc67920b68' class='mouseoverHref'>Mazur, S. 1999. Preliminary studies upon the <i>Platysoma</i> complex (Col. Histeridae).</a> <!--MARK--><!--MARK--><a href='../../../../publication/14eb0f49-c34c-4b21-8596-645f886bad98' class='mouseoverHref'><em>Annals of Warsaw Agricultural University</em></a> <strong>49</strong>: 3-29<!--MARK-->","","Article in Journal","ee6b7929-b623-47e6-a1e2-61fc67920b68","20120301T01:42:14.093+0000","14eb0f49-c34c-4b21-8596-645f886bad98"
"Mazur, S.","2008","Remarks upon some African Histerini (Coleoptera: Histeridae).","135-144","","Studies and Reports of District Museum Prague East Taxonomical Series","","1 Sep 2008","","<!--MARK--><a href='../../../../publication/8fef58aa-a507-4350-9d50-2f23343e678d' class='mouseoverHref'>Mazur, S. 2008. Remarks upon some African Histerini (Coleoptera: Histeridae).</a> <!--MARK--><!--MARK--><a href='../../../../publication/30d74989-845f-4886-873d-40653f74048f' class='mouseoverHref'><em>Studies and Reports of District Museum Prague East Taxonomical Series</em></a> <strong>4</strong>(1-2): 135-144<!--MARK--> [Date published 1 Sep 2008]","","Article in Journal","8fef58aa-a507-4350-9d50-2f23343e678d","20110926T02:28:41.490+0000","30d74989-845f-4886-873d-40653f74048f"
"Mazur, S. & Ohara, M.","2009","Notes on the genus <i>Eblisia</i> Lewis, 1889 in relation to Platysomatini, with descriptions of four new genera (Coleoptera: Histeridae)","233-248","","Studies and Reports of District Museum Prague East Taxonomical Series","","","","<!--MARK--><a href='../../../../publication/5d053d66-ec9d-4f8e-b9ba-88128206a11a' class='mouseoverHref'>Mazur, S. & Ohara, M. 2009. Notes on the genus <i>Eblisia</i> Lewis, 1889 in relation to Platysomatini, with descriptions of four new genera (Coleoptera: Histeridae).</a> <!--MARK--><!--MARK--><a href='../../../../publication/30d74989-845f-4886-873d-40653f74048f' class='mouseoverHref'><em>Studies and Reports of District Museum Prague East Taxonomical Series</em></a> <strong>5</strong>(1-2): 233-248<!--MARK-->","","Article in Journal","5d053d66-ec9d-4f8e-b9ba-88128206a11a","20110623T05:02:17.729+0000","30d74989-845f-4886-873d-40653f74048f"
"Mazur, S. & Wegrzynowicz, P.","2008","Notes on the genus <i>Santalus</i> Lewis, 1906 and <i>Pachylister</i> Lewis, 1904, with the description of <i>Nasaltus</i> gen. n. (Coleoptera, Histeridae)","185-197","","Deutsche Entomologische Zeitschrift","","","","<!--MARK--><a href='../../../../publication/058d8cf0-7f72-4c85-88d4-8b753fa603a7' class='mouseoverHref'>Mazur, S. & Wegrzynowicz, P. 2008. Notes on the genus <i>Santalus</i> Lewis, 1906 and <i>Pachylister</i> Lewis, 1904, with the description of <i>Nasaltus</i> gen. n. (Coleoptera, Histeridae).</a> <!--MARK--><!--MARK--><a href='../../../../publication/bdeb8163-7175-47c9-be9b-28f797c57745' class='mouseoverHref'><em>Deutsche Entomologische Zeitschrift</em></a> <strong>55</strong>(1): 185-197<!--MARK-->","","Article in Journal","058d8cf0-7f72-4c85-88d4-8b753fa603a7","20120305T00:38:41.132+0000","bdeb8163-7175-47c9-be9b-28f797c57745"
"Mjöberg, E.","1912","On a new termitophilous genus of the family Histeridae","121-124","","Entomologisk Tidskrift","","","","<!--MARK--><a href='../../../../publication/764792b0-1377-4801-be09-0f774e2f551c' class='mouseoverHref'>Mjöberg, E. 1912. On a new termitophilous genus of the family Histeridae.</a> <!--MARK--><!--MARK--><a href='../../../../publication/ba33b082-f69d-4d6a-a319-837886ef96ce' class='mouseoverHref'><em>Entomologisk Tidskrift</em></a> <strong>33</strong>: 121-124<!--MARK-->","","Article in Journal","764792b0-1377-4801-be09-0f774e2f551c","20081009T05:11:37.000+0000","ba33b082-f69d-4d6a-a319-837886ef96ce"
"Müller, G.","1937","Histeriden-Studien","97-112","","Entomologische Blätter für Biologie und Systematik der Käfer","","","","<!--MARK--><a href='../../../../publication/9a0aa715-2aa0-45a4-b72e-a3edbf2815bc' class='mouseoverHref'>Müller, G. 1937. Histeriden-Studien.</a> <!--MARK--><!--MARK--><a href='../../../../publication/abedc245-6835-4ecc-82d0-a0ac81426af9' class='mouseoverHref'><em>Entomologische Blätter für Biologie und Systematik der Käfer</em></a> <strong>33</strong>: 97-112<!--MARK-->","","Article in Journal","9a0aa715-2aa0-45a4-b72e-a3edbf2815bc","20081009T05:11:37.000+0000","abedc245-6835-4ecc-82d0-a0ac81426af9"
"Müller, G.","1937","Namensänderung","337","","Entomologische Blätter","","","","<!--MARK--><a href='../../../../publication/844164c8-149c-47f3-a30d-43fdeca23416' class='mouseoverHref'>Müller, G. 1937. Namensänderung.</a> <!--MARK--><!--MARK--><a href='../../../../publication/a4ae2141-5f28-40ed-8d5f-f1e9aebf1631' class='mouseoverHref'><em>Entomologische Blätter</em></a> <strong>33</strong>: 337<!--MARK-->","","Article in Journal","844164c8-149c-47f3-a30d-43fdeca23416","20081009T05:11:37.000+0000","a4ae2141-5f28-40ed-8d5f-f1e9aebf1631"
"Müller, G.","1944","Nuovi Coleotteri dell'Africa orientale. Terza serie","131-145","","Atti del Museo Civico di Storia Naturale di Trieste","","","","<!--MARK--><a href='../../../../publication/61dd806a-9e3a-458a-9738-72ef44400179' class='mouseoverHref'>Müller, G. 1944. Nuovi Coleotteri dell'Africa orientale. Terza serie.</a> <!--MARK--><!--MARK--><a href='../../../../publication/78772a2b-5fe5-4fb0-a78c-22c539c71ca8' class='mouseoverHref'><em>Atti del Museo Civico di Storia Naturale di Trieste</em></a> <strong>15</strong>: 131-145<!--MARK-->","","Article in Journal","61dd806a-9e3a-458a-9738-72ef44400179","20081009T05:11:37.000+0000","78772a2b-5fe5-4fb0-a78c-22c539c71ca8"
"Newton, A.F.","1991","Histeridae (Hydrophiloidea) (including Niponiidae)","361-364","Immature Insects. Coleoptera and Diptera","","","","","<!--MARK--><a href='../../../../publication/3c7ff660-7df0-4c78-b264-7c6a3d09f6a3' class='mouseoverHref'>Newton, A.F. 1991. Histeridae (Hydrophiloidea) (including Niponiidae). pp. 361-364</a> <!--MARK--><em>in</em> <!--MARK--><a href='../../../../publication/99840ce5-324a-4610-b0d0-881efe111868' class='mouseoverHref'>Stehr, F.W. (ed.). <em>Immature Insects. Coleoptera and Diptera</em>. Dubuque, Iowa : Kendall-Hunt Vol. 2 xvi 975 pp.</a><!--MARK-->","","Chapter in Book","3c7ff660-7df0-4c78-b264-7c6a3d09f6a3","20130802T02:54:24.914+0000","99840ce5-324a-4610-b0d0-881efe111868"
"Normand, H. & Thérond, J.","1952","Nouveaux Histérides (Saprinini) d'Afrique du Nord","175-178","","Revue Française d'Entomologie","","","","<!--MARK--><a href='../../../../publication/7d160939-e55c-44c1-8680-a2f454bb6441' class='mouseoverHref'>Normand, H. & Thérond, J. 1952. Nouveaux Histérides (Saprinini) d'Afrique du Nord.</a> <!--MARK--><!--MARK--><a href='../../../../publication/e9f809d1-b273-4f37-ae15-92e14dc5b13b' class='mouseoverHref'><em>Revue Française d'Entomologie</em></a> <strong>19</strong>: 175-178<!--MARK-->","","Article in Journal","7d160939-e55c-44c1-8680-a2f454bb6441","20081009T05:11:37.000+0000","e9f809d1-b273-4f37-ae15-92e14dc5b13b"
"Ôhara, M.","1989","On the species of the genus <i>Margarinotus</i> from Japan (Coleoptera: Histeridae)","1-50","","Insecta Matsumurana","","","","<!--MARK--><a href='../../../../publication/df941db6-794e-44d2-83a5-95f073de83e8' class='mouseoverHref'>Ôhara, M. 1989. On the species of the genus <i>Margarinotus</i> from Japan (Coleoptera: Histeridae).</a> <!--MARK--><!--MARK--><a href='../../../../publication/ee98a19d-8f14-4966-84fe-0688bb1a97f5' class='mouseoverHref'><em>Insecta Matsumurana</em></a> n.s. <strong>41</strong>: 1-50<!--MARK-->","","Article in Journal","df941db6-794e-44d2-83a5-95f073de83e8","20081009T05:11:37.000+0000","ee98a19d-8f14-4966-84fe-0688bb1a97f5"
"Ôhara, M.","1994","A revision of the superfamily Histeroidea of Japan (Coleoptera)","1-283","","Insecta Matsumurana","","","","<!--MARK--><a href='../../../../publication/d52bd895-400e-4950-9482-5f69ac360b4f' class='mouseoverHref'>Ôhara, M. 1994. A revision of the superfamily Histeroidea of Japan (Coleoptera).</a> <!--MARK--><!--MARK--><a href='../../../../publication/ee98a19d-8f14-4966-84fe-0688bb1a97f5' class='mouseoverHref'><em>Insecta Matsumurana</em></a> n.s. <strong>51</strong>: 1-283<!--MARK-->","","Article in Journal","d52bd895-400e-4950-9482-5f69ac360b4f","20081009T05:11:37.000+0000","ee98a19d-8f14-4966-84fe-0688bb1a97f5"
"Oke, C.","1923","Notes on the Victorian Chlamydopsini (Coleoptera), with descriptions of new species","152-162","","Victorian Naturalist","","","","<!--MARK--><a href='../../../../publication/320b752e-6a5c-4dfa-8514-2f74f0f894f4' class='mouseoverHref'>Oke, C. 1923. Notes on the Victorian Chlamydopsini (Coleoptera), with descriptions of new species.</a> <!--MARK--><!--MARK--><a href='../../../../publication/97b8093b-d60f-43a6-94fc-97de34f03b6b' class='mouseoverHref'><em>Victorian Naturalist</em></a> <strong>40</strong>(8): 152-162<!--MARK-->","","Article in Journal","320b752e-6a5c-4dfa-8514-2f74f0f894f4","20081009T05:11:37.000+0000","97b8093b-d60f-43a6-94fc-97de34f03b6b"
"Paykull, G. von","1811","<i>Monographia Histeroidum</i>","iv 114 pp.","","","","","Palmblad","<!--MARK--><a href='../../../../publication/a19b6ade-6d69-4a2b-bdf2-954eb2f496e4' class='mouseoverHref'>Paykull, G. von 1811. <em><i>Monographia Histeroidum</i></em>. Upsaliae : Palmblad iv 114 pp.</a><!--MARK-->","","Book","a19b6ade-6d69-4a2b-bdf2-954eb2f496e4","20081009T05:11:37.000+0000",""
"Pic, M.","1918","Nouveautés diverses","7-24","","Mélanges Exotico-Entomologiques, Moulins","","","","<!--MARK--><a href='../../../../publication/3d4ec309-89d0-4c70-8a7c-e93292b57020' class='mouseoverHref'>Pic, M. 1918. Nouveautés diverses.</a> <!--MARK--><!--MARK--><a href='../../../../publication/0f348a34-317a-45aa-9637-cd0e1dc5ec5f' class='mouseoverHref'><em>Mélanges Exotico-Entomologiques, Moulins</em></a> <strong>29</strong>: 7-24<!--MARK-->","","Article in Journal","3d4ec309-89d0-4c70-8a7c-e93292b57020","20081009T05:11:37.000+0000","0f348a34-317a-45aa-9637-cd0e1dc5ec5f"
"Quensel, C. in Schoenherr, C.J.","1806","Synonymia Insectorum <i>oder Versuch einer Synonymie aller bisher bekannten Insecten nach Fabricius Syst. Eleutheratorum geordnet, mit Berichtigungen und Anmerkungen, wie auch Beschreibungen neuer Arten und illuminirten Kupfern. Erster Band : Eleutherata oder Kafer. Erster Theil</i>. Lethrus - Scolytus","xxii pp. 1-289-3 pls","","","","","Nordstroem","<!--MARK--><a href='../../../../publication/b731a09e-72ac-4760-ac80-834d80c09aa9' class='mouseoverHref'>Quensel, C. <i>in</i> Schoenherr, C.J. 1806. <em>Synonymia Insectorum <i>oder Versuch einer Synonymie aller bisher bekannten Insecten nach Fabricius Syst. Eleutheratorum geordnet, mit Berichtigungen und Anmerkungen, wie auch Beschreibungen neuer Arten und illuminirten Kupfern. Erster Band : Eleutherata oder Kafer. Erster Theil</i>. Lethrus - Scolytus</em>. Stockholm : Nordstroem Vol. 1 xxii pp. 1-289-3 pls.</a><!--MARK-->","","Book","b731a09e-72ac-4760-ac80-834d80c09aa9","20081009T05:11:37.000+0000",""
"Reichardt, A.N.","1926","Über die mit <i>Pachylopus</i> Er. verwandten Arten","12-18","","Entomologische Blätter für Biologie und Systematik der Käfer","","","","<!--MARK--><a href='../../../../publication/2ff457f6-e365-4a84-b2d2-8a5232e7538c' class='mouseoverHref'>Reichardt, A.N. 1926. Über die mit <i>Pachylopus</i> Er. verwandten Arten.</a> <!--MARK--><!--MARK--><a href='../../../../publication/abedc245-6835-4ecc-82d0-a0ac81426af9' class='mouseoverHref'><em>Entomologische Blätter für Biologie und Systematik der Käfer</em></a> <strong>22</strong>: 12-18<!--MARK-->","","Article in Journal","2ff457f6-e365-4a84-b2d2-8a5232e7538c","","abedc245-6835-4ecc-82d0-a0ac81426af9"
"Reichardt, A.N.","1932","Beiträge zu einer Monographie der Saprininae (Coleoptera, Histeridae)","1-164","","Mitteilungen aus dem Zoologischen Museum in Berlin","","","","<!--MARK--><a href='../../../../publication/73a70547-8e83-4fcf-aa0e-8c4a7c84e190' class='mouseoverHref'>Reichardt, A.N. 1932. Beiträge zu einer Monographie der Saprininae (Coleoptera, Histeridae).</a> <!--MARK--><!--MARK--><a href='../../../../publication/580e0309-5e8f-49f6-a6bf-bf2b69fb9a4a' class='mouseoverHref'><em>Mitteilungen aus dem Zoologischen Museum in Berlin</em></a> <strong>18</strong>(1): 1-164<!--MARK-->","","Article in Journal","73a70547-8e83-4fcf-aa0e-8c4a7c84e190","20081009T05:11:37.000+0000","580e0309-5e8f-49f6-a6bf-bf2b69fb9a4a"
"Reichardt, A.N.","1933","Über einige exotische Histeriden (Col.)","82-86","","Acta Entomologica Musei Nationalis Pragae","","","","<!--MARK--><a href='../../../../publication/f473e460-bcaa-407d-88fb-9490eefc600c' class='mouseoverHref'>Reichardt, A.N. 1933. Über einige exotische Histeriden (Col.).</a> <!--MARK--><!--MARK--><a href='../../../../publication/800acc84-1853-4834-bb99-26053db41072' class='mouseoverHref'><em>Acta Entomologica Musei Nationalis Pragae</em></a> <strong>11</strong>: 82-86<!--MARK-->","","Article in Journal","f473e460-bcaa-407d-88fb-9490eefc600c","20081009T05:11:37.000+0000","800acc84-1853-4834-bb99-26053db41072"
"Reitter, E.","1877","Coleopterologische Ergebnisse einer Reise nach Südungarn und in die Transsylvanischen Alpen.","3-30, pl.1","","Verhandlungen des Naturforschenden Vereines in Brünn","","","","<!--MARK--><a href='../../../../publication/53a38e6e-1655-4f70-829f-43d12c5827e0' class='mouseoverHref'>Reitter, E. 1877. Coleopterologische Ergebnisse einer Reise nach Südungarn und in die Transsylvanischen Alpen.</a> <!--MARK--><!--MARK--><a href='../../../../publication/97f32cab-6200-4538-9ea1-859ed7cf87f0' class='mouseoverHref'><em>Verhandlungen des Naturforschenden Vereines in Brünn</em></a> <strong>15</strong>(1): 3-30, pl.1<!--MARK-->","","Article in Journal","53a38e6e-1655-4f70-829f-43d12c5827e0","20110921T22:25:30.724+0000","97f32cab-6200-4538-9ea1-859ed7cf87f0"
"Reitter, E.","1894","Elfter Beitrag zur Coleopteren-Fauna des russischen Reiches","238-248","","Wiener Entomologische Zeitung","","","","<!--MARK--><a href='../../../../publication/44a69fae-7e22-435b-ba67-155b68fe99b2' class='mouseoverHref'>Reitter, E. 1894. Elfter Beitrag zur Coleopteren-Fauna des russischen Reiches.</a> <!--MARK--><!--MARK--><a href='../../../../publication/9b6f9f14-04ca-437e-a5d2-714ac39f9aa0' class='mouseoverHref'><em>Wiener Entomologische Zeitung</em></a> <strong>13</strong>: 238-248<!--MARK-->","","Article in Journal","44a69fae-7e22-435b-ba67-155b68fe99b2","20081009T05:11:37.000+0000","9b6f9f14-04ca-437e-a5d2-714ac39f9aa0"
"Reitter, E.","1896","Uebersicht der mir bekannten <i>Gnathoncus</i> Arten der palaearctischen Fauna.","306-308","","Entomologische Nachrichten","","Oct 1896","","<!--MARK--><a href='../../../../publication/81ac6b83-9d2b-4fc3-822d-a15944602057' class='mouseoverHref'>Reitter, E. 1896. Uebersicht der mir bekannten <i>Gnathoncus</i> Arten der palaearctischen Fauna.</a> <!--MARK--><!--MARK--><a href='../../../../publication/7972b7d4-33b2-48eb-a87e-be50b3e991d0' class='mouseoverHref'><em>Entomologische Nachrichten</em></a> <strong>22</strong>(20): 306-308<!--MARK--> [Date published Oct 1896]","","Article in Journal","81ac6b83-9d2b-4fc3-822d-a15944602057","20111101T22:26:41.962+0000","7972b7d4-33b2-48eb-a87e-be50b3e991d0"
"Roth, J.R.","1851","Diagnosen neuer Coleopteren aus Abyssinien","115-133","","Archiv für Naturgeschichte","","","","<!--MARK--><a href='../../../../publication/7bb1172e-7957-486b-b58c-4ac383be8d9e' class='mouseoverHref'>Roth, J.R. 1851. Diagnosen neuer Coleopteren aus Abyssinien.</a> <!--MARK--><!--MARK--><a href='../../../../publication/f5b5f7c7-fc53-4502-951d-1c96b680d874' class='mouseoverHref'><em>Archiv für Naturgeschichte</em></a> <strong>17</strong>(1): 115-133<!--MARK-->","","Article in Journal","7bb1172e-7957-486b-b58c-4ac383be8d9e","20081009T05:11:37.000+0000","f5b5f7c7-fc53-4502-951d-1c96b680d874"
"Schaufuss, L.W.","1882","Zoologische Ergebnisse von Excursionen auf den Balearen. III. Addenda und Fortsetzung","527-552","","Nunquam Otiosus (Dresden)","","","","<!--MARK--><a href='../../../../publication/db9a5ae6-0a95-47ea-bf83-c375e345aa76' class='mouseoverHref'>Schaufuss, L.W. 1882. Zoologische Ergebnisse von Excursionen auf den Balearen. III. Addenda und Fortsetzung.</a> <!--MARK--><!--MARK--><a href='../../../../publication/904ed5af-278e-49bd-8079-d654e7b448a6' class='mouseoverHref'><em>Nunquam Otiosus (Dresden)</em></a> <strong>3</strong>: 527-552<!--MARK-->","","Article in Journal","db9a5ae6-0a95-47ea-bf83-c375e345aa76","20081009T05:11:37.000+0000","904ed5af-278e-49bd-8079-d654e7b448a6"
"Schmidt, J.","1885","Bestimmungs-Tabellen der europäischen Coleopteren. XIV. Histeridae","279-330","","Berliner Entomologische Zeitschrift","","","","<!--MARK--><a href='../../../../publication/ccd9596f-23cc-4ddc-adf5-45c992486f77' class='mouseoverHref'>Schmidt, J. 1885. Bestimmungs-Tabellen der europäischen Coleopteren. XIV. Histeridae.</a> <!--MARK--><!--MARK--><a href='../../../../publication/9cb53f48-ac05-481f-9276-81372f651531' class='mouseoverHref'><em>Berliner Entomologische Zeitschrift</em></a> <strong>29</strong>: 279-330<!--MARK-->","","Article in Journal","ccd9596f-23cc-4ddc-adf5-45c992486f77","20081009T05:11:37.000+0000","9cb53f48-ac05-481f-9276-81372f651531"
"Schmidt, J.","1889","Neue Histeriden (Coleoptera)","329-341","","Entomologische Nachrichten. Berlin","","","","<!--MARK--><a href='../../../../publication/d5235ef9-ce3b-49d1-b04b-5cbe4394c7e9' class='mouseoverHref'>Schmidt, J. 1889. Neue Histeriden (Coleoptera).</a> <!--MARK--><!--MARK--><a href='../../../../publication/9aa60663-d523-4536-bdb7-fdec3d17fdf6' class='mouseoverHref'><em>Entomologische Nachrichten. Berlin</em></a> <strong>15</strong>(21): 329-341<!--MARK-->","","Article in Journal","d5235ef9-ce3b-49d1-b04b-5cbe4394c7e9","20110718T02:24:14.532+0000","9aa60663-d523-4536-bdb7-fdec3d17fdf6"
"Schmidt, J.","1890","Neue Histeriden (Coleoptera)","39-46, 50-57","","Entomologische Nachrichten. Berlin","","","","<!--MARK--><a href='../../../../publication/50d17ae2-6d1d-47f0-880e-67b24f006067' class='mouseoverHref'>Schmidt, J. 1890. Neue Histeriden (Coleoptera).</a> <!--MARK--><!--MARK--><a href='../../../../publication/9aa60663-d523-4536-bdb7-fdec3d17fdf6' class='mouseoverHref'><em>Entomologische Nachrichten. Berlin</em></a> <strong>16</strong>: 39-46, 50-57<!--MARK-->","","Article in Journal","50d17ae2-6d1d-47f0-880e-67b24f006067","20081009T05:11:37.000+0000","9aa60663-d523-4536-bdb7-fdec3d17fdf6"
"Schmidt, J.","1890","Neun neue <i>Saprinus</i> aus der Gruppe des <i>metallescens</i> und <i>rufipes</i>","81-87","","Deutsche Entomologische Zeitschrift","","","","<!--MARK--><a href='../../../../publication/1933af18-9670-41ce-aeb2-0bbc61ee4fde' class='mouseoverHref'>Schmidt, J. 1890. Neun neue <i>Saprinus</i> aus der Gruppe des <i>metallescens</i> und <i>rufipes</i>.</a> <!--MARK--><!--MARK--><a href='../../../../publication/bdeb8163-7175-47c9-be9b-28f797c57745' class='mouseoverHref'><em>Deutsche Entomologische Zeitschrift</em></a> <strong>1890</strong>: 81-87<!--MARK-->","","Article in Journal","1933af18-9670-41ce-aeb2-0bbc61ee4fde","20081009T05:11:37.000+0000","bdeb8163-7175-47c9-be9b-28f797c57745"
"Schmidt, J.","1892","Neue Histeriden (Coleoptera)","17-30","","Entomologische Nachrichten. Dresden","","","","<!--MARK--><a href='../../../../publication/31fd8fa6-0b73-4313-927c-6b526759a8ef' class='mouseoverHref'>Schmidt, J. 1892. Neue Histeriden (Coleoptera).</a> <!--MARK--><!--MARK--><a href='../../../../publication/1e6c0731-d812-4979-8931-a375ad8ba1ab' class='mouseoverHref'><em>Entomologische Nachrichten. Dresden</em></a> <strong>18</strong>: 17-30<!--MARK-->","","Article in Journal","31fd8fa6-0b73-4313-927c-6b526759a8ef","20081009T05:11:37.000+0000","1e6c0731-d812-4979-8931-a375ad8ba1ab"
"Schmidt, J.","1893","Histeridae des îles Séchelles","xcix-ciii","","Bulletin de la Société Entomologique de France","","","","<!--MARK--><a href='../../../../publication/2cf3e913-478e-4822-ad16-528d716f23c2' class='mouseoverHref'>Schmidt, J. 1893. Histeridae des îles Séchelles.</a> <!--MARK--><!--MARK--><a href='../../../../publication/7853f77c-aa1b-42ec-bc2c-9758f7ff72c7' class='mouseoverHref'><em>Bulletin de la Société Entomologique de France</em></a> <strong>1893</strong>: xcix-ciii<!--MARK-->","","Article in Journal","2cf3e913-478e-4822-ad16-528d716f23c2","20081009T05:11:37.000+0000","7853f77c-aa1b-42ec-bc2c-9758f7ff72c7"
"Schmidt, J.","1893","Viaggio di Lamberto Loria nella Papuasia Orientale. VIII. Histeridae","231--240","","Annali del Museo Civico di Storia Naturale, Genova","","","","<!--MARK--><a href='../../../../publication/dde13815-d439-4d2e-8dad-108fd1eb17c7' class='mouseoverHref'>Schmidt, J. 1893. Viaggio di Lamberto Loria nella Papuasia Orientale. VIII. Histeridae.</a> <!--MARK--><!--MARK--><a href='../../../../publication/461059ea-ead7-4f6d-83f4-52913f06d09f' class='mouseoverHref'><em>Annali del Museo Civico di Storia Naturale, Genova</em></a> 2 <strong>13</strong>: 231--240<!--MARK-->","","Article in Journal","dde13815-d439-4d2e-8dad-108fd1eb17c7","20081009T05:11:37.000+0000","461059ea-ead7-4f6d-83f4-52913f06d09f"
"Scriba, L.G.","1790","Verzeichniss der Insekten in der Darmstädter Gegend.","40-73","","Journal für die Liebhaber der Entomologie","","","","<!--MARK--><a href='../../../../publication/b443ca30-c6e9-4c58-8cfc-abe1f929617e' class='mouseoverHref'>Scriba, L.G. 1790. Verzeichniss der Insekten in der Darmstädter Gegend.</a> <!--MARK--><!--MARK--><a href='../../../../publication/3a72283e-af54-4aea-9490-31b12112ed24' class='mouseoverHref'><em>Journal für die Liebhaber der Entomologie</em></a> <strong>1</strong>(1): 40-73<!--MARK-->","","Article in Journal","b443ca30-c6e9-4c58-8cfc-abe1f929617e","20111101T22:46:14.486+0000","3a72283e-af54-4aea-9490-31b12112ed24"
"Sharp, D.","1876","Descriptions of some new genera and species of New Zealand Coleoptera","20-28","","Entomologist's Monthly Magazine","","Jun. 1876","","<!--MARK--><a href='../../../../publication/8a9aa56a-f3a0-4bdb-b8d1-ada7bbaa44fd' class='mouseoverHref'>Sharp, D. 1876. Descriptions of some new genera and species of New Zealand Coleoptera.</a> <!--MARK--><!--MARK--><a href='../../../../publication/cbd5c497-64d0-4fae-97ee-22719c3ca286' class='mouseoverHref'><em>Entomologist's Monthly Magazine</em></a> <strong>13</strong>: 20-28<!--MARK--> [Date published Jun. 1876]","","Article in Journal","8a9aa56a-f3a0-4bdb-b8d1-ada7bbaa44fd","20120103T21:54:38.898+0000","cbd5c497-64d0-4fae-97ee-22719c3ca286"
"?lipi?ski, S.A. & Mazur, S.","1999","<i>Epuraeosoma</i>, a new genus of Histerinae and phylogeny of the family Histeridae (Coleoptera, Histeroidea)","209-230","","Annales Zoologici, Warszawa","","","","<!--MARK--><a href='../../../../publication/95a092db-d41f-4cb5-8da4-73589a2a7ad0' class='mouseoverHref'>?lipi?ski, S.A. & Mazur, S. 1999. <i>Epuraeosoma</i>, a new genus of Histerinae and phylogeny of the family Histeridae (Coleoptera, Histeroidea).</a> <!--MARK--><!--MARK--><a href='../../../../publication/45d6cf5f-cfa8-4561-85c5-8cdf0d2982bf' class='mouseoverHref'><em>Annales Zoologici, Warszawa</em></a> <strong>49</strong>(3): 209-230<!--MARK-->","","Article in Journal","95a092db-d41f-4cb5-8da4-73589a2a7ad0","20170706T04:36:11.803+0000","45d6cf5f-cfa8-4561-85c5-8cdf0d2982bf"
"Stephens, J.F.","1835","Illustrations of British Entomology; <i>or a synopsis of indigenous insects containing their generic and specific distinctions</i>...... Mandibulata","369-447 pl. 24-27","","","","","Baldwin & Cradock","<!--MARK--><a href='../../../../publication/f0190bf9-223a-429b-b667-3a295e646d9c' class='mouseoverHref'>Stephens, J.F. 1835. <em>Illustrations of British Entomology; <i>or a synopsis of indigenous insects containing their generic and specific distinctions</i>...... Mandibulata</em>. London : Baldwin & Cradock Vol. 5 369-447 pl. 24-27.</a><!--MARK-->","","Book","f0190bf9-223a-429b-b667-3a295e646d9c","20091206T22:29:12.826+0000",""
