"PUB_AUTHOR","PUB_YEAR","PUB_TITLE","PUB_PAGES","PUB_PARENT_BOOK_TITLE","PUB_PARENT_JOURNAL_TITLE","PUB_PARENT_ARTICLE_TITLE","PUB_PUBLICATION_DATE","PUB_PUBLISHER","PUB_FORMATTED","PUB_QUALIFICATION","PUB_TYPE","PUBLICATION_GUID","PUBLICATION_LAST_UPDATE","PARENT_PUBLICATION_GUID"
"Lowry, J.W.J.","1980","Ecological Relationships of Western Australian Cavernicoles","Vol. 1 367 pp., Vol. 2 204 pp. + appendices","","","","","","<!--MARK--><a href='../../../../publication/9bc68327-87c6-4b1c-a687-1bf85dad9b23' class='mouseoverHref'>Lowry, J.W.J. 1980. Ecological Relationships of Western Australian Cavernicoles. MSc. Thesis, School of Zoology, University of New South Wales. Vol. 1 367 pp., Vol. 2 204 pp. + appendices</a>","","Miscellaneous","9bc68327-87c6-4b1c-a687-1bf85dad9b23","20081009T05:11:37.000+0000",""
"Mahunka, S.","1975","Neue und auf Insekten lebende Milben aus Australien und Neu-Guinea (Acari : Acarida, Tarsonemida)","317-325","","Annales Historico-Naturales Musei Nationalis Hungarici (Zoologica)","","","","<!--MARK--><a href='../../../../publication/5721a9ac-7593-40bb-b1c2-86caa03804e7' class='mouseoverHref'>Mahunka, S. 1975. Neue und auf Insekten lebende Milben aus Australien und Neu-Guinea (Acari : Acarida, Tarsonemida).</a> <!--MARK--><!--MARK--><a href='../../../../publication/e6f35874-0423-4fa1-bf45-655b9047e0c2' class='mouseoverHref'><em>Annales Historico-Naturales Musei Nationalis Hungarici (Zoologica)</em></a> <strong>67</strong>: 317-325<!--MARK-->","","Article in Journal","5721a9ac-7593-40bb-b1c2-86caa03804e7","20081009T05:11:37.000+0000","e6f35874-0423-4fa1-bf45-655b9047e0c2"
"Monteith, G.B. & Storey, R.I.","1981","The biology of <i>Cephalodesmius</i>, a genus of dung beetles which synthesizes 'dung' from plant material (Coleoptera : Scarabaeidae : Scarabaeinae)","253-271 pls 1-3","","Memoirs of the Queensland Museum","","","","<!--MARK--><a href='../../../../publication/985152ff-4384-46df-8a5a-5f5247dde0b6' class='mouseoverHref'>Monteith, G.B. & Storey, R.I. 1981. The biology of <i>Cephalodesmius</i>, a genus of dung beetles which synthesizes 'dung' from plant material (Coleoptera : Scarabaeidae : Scarabaeinae).</a> <!--MARK--><!--MARK--><a href='../../../../publication/1a0a2982-9f30-43e1-a641-b0379699837c' class='mouseoverHref'><em>Memoirs of the Queensland Museum</em></a> <strong>20</strong>: 253-271 pls 1-3<!--MARK-->","","Article in Journal","985152ff-4384-46df-8a5a-5f5247dde0b6","20081009T05:11:37.000+0000","1a0a2982-9f30-43e1-a641-b0379699837c"
"OConnor, B.M.","2009","Cohort Astigmatina","pp. 565-657","A Manual of Acarology","","","","","<!--MARK--><a href='../../../../publication/ab762d1c-2c17-438a-8324-4d77429d9bfe' class='mouseoverHref'>OConnor, B.M. 2009. Cohort Astigmatina. pp. 565-657</a> <!--MARK--><em>in</em> <!--MARK--><a href='../../../../publication/4adea5fa-3e8b-4daf-bac9-2ec7aa45d0fd' class='mouseoverHref'>Krantz, G.W. & Walter, D.E. (eds). <em>A Manual of Acarology</em>. Lubbock, Texas : Texas Tech University Press Third edition, 807 pp.</a><!--MARK-->","","Chapter in Book","ab762d1c-2c17-438a-8324-4d77429d9bfe","20120130T21:29:57.061+0000","4adea5fa-3e8b-4daf-bac9-2ec7aa45d0fd"
"Oudemans, A.C.","1904","Acarologische aanteekeningen XIV","190-195","","Entomologische Berichten (Amsterdam)","","","","<!--MARK--><a href='../../../../publication/3a99ab77-6baf-4773-9f2a-4e5292d723dd' class='mouseoverHref'>Oudemans, A.C. 1904. Acarologische aanteekeningen XIV.</a> <!--MARK--><!--MARK--><a href='../../../../publication/64444303-afa9-4ecc-b061-09541c96dc49' class='mouseoverHref'><em>Entomologische Berichten (Amsterdam)</em></a> <strong>1</strong>(20): 190-195<!--MARK-->","","Article in Journal","3a99ab77-6baf-4773-9f2a-4e5292d723dd","20081009T05:11:37.000+0000","64444303-afa9-4ecc-b061-09541c96dc49"
"Oudemans, A.C.","1905","Acarologische aanteekeningen. XVIII","236-241","","Entomologische Berichten (Amsterdam)","","","","<!--MARK--><a href='../../../../publication/b423c82f-2c81-4dee-b470-50d0b310749e' class='mouseoverHref'>Oudemans, A.C. 1905. Acarologische aanteekeningen. XVIII.</a> <!--MARK--><!--MARK--><a href='../../../../publication/64444303-afa9-4ecc-b061-09541c96dc49' class='mouseoverHref'><em>Entomologische Berichten (Amsterdam)</em></a> <strong>1</strong>(24): 236-241<!--MARK-->","","Article in Journal","b423c82f-2c81-4dee-b470-50d0b310749e","20081009T05:11:37.000+0000","64444303-afa9-4ecc-b061-09541c96dc49"
"Oudemans, A.C.","1924","Acarologische aanteekeningen. LXXVI","300-310","","Entomologische Berichten (Amsterdam)","","","","<!--MARK--><a href='../../../../publication/26156fcc-605f-4cef-8f30-124ef760aef9' class='mouseoverHref'>Oudemans, A.C. 1924. Acarologische aanteekeningen. LXXVI.</a> <!--MARK--><!--MARK--><a href='../../../../publication/64444303-afa9-4ecc-b061-09541c96dc49' class='mouseoverHref'><em>Entomologische Berichten (Amsterdam)</em></a> <strong>6</strong>(139): 300-310<!--MARK-->","","Article in Journal","26156fcc-605f-4cef-8f30-124ef760aef9","20081009T05:11:37.000+0000","64444303-afa9-4ecc-b061-09541c96dc49"
"Oudemans, A.C.","1924","Acarologische aanteekeningen. LXXVII","317-336","","Entomologische Berichten (Amsterdam)","","","","<!--MARK--><a href='../../../../publication/ad7149bf-6ee3-4639-ab3a-f68440520504' class='mouseoverHref'>Oudemans, A.C. 1924. Acarologische aanteekeningen. LXXVII.</a> <!--MARK--><!--MARK--><a href='../../../../publication/64444303-afa9-4ecc-b061-09541c96dc49' class='mouseoverHref'><em>Entomologische Berichten (Amsterdam)</em></a> <strong>6</strong>(140): 317-336<!--MARK-->","","Article in Journal","ad7149bf-6ee3-4639-ab3a-f68440520504","20081009T05:11:37.000+0000","64444303-afa9-4ecc-b061-09541c96dc49"
"Oudemans, A.C.","1929","Acarologische aanteekeningen. XCVII","448-455","","Entomologische Berichten (Amsterdam)","","","","<!--MARK--><a href='../../../../publication/a2504f46-1e1d-4ca6-b50e-69e3f8dc3c7f' class='mouseoverHref'>Oudemans, A.C. 1929. Acarologische aanteekeningen. XCVII.</a> <!--MARK--><!--MARK--><a href='../../../../publication/64444303-afa9-4ecc-b061-09541c96dc49' class='mouseoverHref'><em>Entomologische Berichten (Amsterdam)</em></a> <strong>7</strong>(167): 448-455<!--MARK-->","","Article in Journal","a2504f46-1e1d-4ca6-b50e-69e3f8dc3c7f","20081009T05:11:37.000+0000","64444303-afa9-4ecc-b061-09541c96dc49"
"Oudemans, A.C.","1932","Opus 550","202-210","","Tijdschrift voor Entomologie","","","","<!--MARK--><a href='../../../../publication/dc670f16-3700-4fe8-92c8-1c58fb4f899a' class='mouseoverHref'>Oudemans, A.C. 1932. Opus 550.</a> <!--MARK--><!--MARK--><a href='../../../../publication/6b0f0fc0-01fc-4ed4-aae0-c8b621477f01' class='mouseoverHref'><em>Tijdschrift voor Entomologie</em></a> <strong>75</strong>(Supplement): 202-210<!--MARK-->","","Article in Journal","dc670f16-3700-4fe8-92c8-1c58fb4f899a","20081009T05:11:37.000+0000","6b0f0fc0-01fc-4ed4-aae0-c8b621477f01"
"Philips, J.R.","2009","The mite (Acarina) fauna of trogid beetles (Coleoptera: Trogidae)","1-17","","International Journal of Acarology","","","","<!--MARK--><a href='../../../../publication/280f9c77-b682-41f3-8580-c79a9e5333dc' class='mouseoverHref'>Philips, J.R. 2009. The mite (Acarina) fauna of trogid beetles (Coleoptera: Trogidae).</a> <!--MARK--><!--MARK--><a href='../../../../publication/faec4fc9-a979-4ddf-985e-e23330b3c030' class='mouseoverHref'><em>International Journal of Acarology</em></a> <strong>35</strong>: 1-17<!--MARK-->","","Article in Journal","280f9c77-b682-41f3-8580-c79a9e5333dc","20100823T04:27:09.067+0000","faec4fc9-a979-4ddf-985e-e23330b3c030"
"Proctor, H., Kanowski, J., Catterall, C.P., Wardell-Johnson, G. & Reis, T.","2011","Rainforest-restoration success as judged by assemblages of soil- and litter-dwelling mites (Arachnida: Acari).","234-254","","Zoosymposia","","","","<!--MARK--><a href='../../../../publication/21def376-53f4-4862-aa67-7eeaa772a567' class='mouseoverHref'>Proctor, H., Kanowski, J., Catterall, C.P., Wardell-Johnson, G. & Reis, T. 2011. Rainforest-restoration success as judged by assemblages of soil- and litter-dwelling mites (Arachnida: Acari).</a> <!--MARK--><!--MARK--><a href='../../../../publication/415b326a-b277-4eb2-807a-dc5308a7a1ce' class='mouseoverHref'><em>Zoosymposia</em></a> <strong>6</strong>: 234-254<!--MARK-->","","Article in Journal","21def376-53f4-4862-aa67-7eeaa772a567","20130117T07:09:34.061+0000","415b326a-b277-4eb2-807a-dc5308a7a1ce"
"Rayment, T.","1954","Incidence of acarid mites on the biology of bees","26-38","","The Australian Zoologist","","","","<!--MARK--><a href='../../../../publication/ffe478ff-3bf9-4676-a950-53c2f50a8916' class='mouseoverHref'>Rayment, T. 1954. Incidence of acarid mites on the biology of bees.</a> <!--MARK--><!--MARK--><a href='../../../../publication/48148530-5362-4b4a-a304-7ea21fe0d6b7' class='mouseoverHref'><em>The Australian Zoologist</em></a> <strong>12</strong>: 26-38<!--MARK-->","","Article in Journal","ffe478ff-3bf9-4676-a950-53c2f50a8916","20110510T06:26:42.885+0000","48148530-5362-4b4a-a304-7ea21fe0d6b7"
"Richards, A.M.","1971","An ecological study of the cavernicolous fauna of the Nullarbor Plain southern Australia","1-60 pls I-V","","Journal of Zoology, London","","","","<!--MARK--><a href='../../../../publication/ce4b8288-be78-4a31-a252-1d25ab24b252' class='mouseoverHref'>Richards, A.M. 1971. An ecological study of the cavernicolous fauna of the Nullarbor Plain southern Australia.</a> <!--MARK--><!--MARK--><a href='../../../../publication/e9fd3ce8-3d30-4401-bcd5-058de8d17ad6' class='mouseoverHref'><em>Journal of Zoology, London</em></a> <strong>164</strong>: 1-60 pls I-V<!--MARK-->","","Article in Journal","ce4b8288-be78-4a31-a252-1d25ab24b252","20081009T05:11:37.000+0000","e9fd3ce8-3d30-4401-bcd5-058de8d17ad6"
"Stone, C. & Simpson, J.A.","1990","Species associations in <em>Ips grandicollis</em> galleries in <em>Pinus taeda</em>.","75-96.","","New Zealand Journal of Forestry Science","","","","<!--MARK--><a href='../../../../publication/7c82f051-8137-4d86-94c5-5d862fc6f296' class='mouseoverHref'>Stone, C. & Simpson, J.A. 1990. Species associations in <em>Ips grandicollis</em> galleries in <em>Pinus taeda</em>.</a> <!--MARK--><!--MARK--><a href='../../../../publication/6b5ba59f-5e4d-499b-9721-8815042e9505' class='mouseoverHref'><em>New Zealand Journal of Forestry Science</em></a> <strong>20</strong>: 75-96.<!--MARK-->","","Article in Journal","7c82f051-8137-4d86-94c5-5d862fc6f296","20161218T08:42:48.129+0000","6b5ba59f-5e4d-499b-9721-8815042e9505"
"Stone, C. & Simpson, J.A.","1991","Effect of six chemicals on the insects, mites, nematodes and fungi associated with <i>Ips grandicollis</i> (Eichhoff) (Coleoptera : Scolytidae) in northeastern New South Wales","21-28","","Journal of the Australian Entomological Society","","","","<!--MARK--><a href='../../../../publication/ec331f99-daa1-4b26-863d-33487382901a' class='mouseoverHref'>Stone, C. & Simpson, J.A. 1991. Effect of six chemicals on the insects, mites, nematodes and fungi associated with <i>Ips grandicollis</i> (Eichhoff) (Coleoptera : Scolytidae) in northeastern New South Wales.</a> <!--MARK--><!--MARK--><a href='../../../../publication/c2544f9f-3978-4f18-846d-a1fd3122c9c4' class='mouseoverHref'><em>Journal of the Australian Entomological Society</em></a> <strong>30</strong>: 21-28<!--MARK-->","","Article in Journal","ec331f99-daa1-4b26-863d-33487382901a","20081009T05:11:37.000+0000","c2544f9f-3978-4f18-846d-a1fd3122c9c4"
"Vitzthum, H.G.","1927","Die Acarofauna der Harzflusse","98-103","","Sitzungsberichte der Gesellschaft Naturforschender Freunde zu Berlin","","","","<!--MARK--><a href='../../../../publication/6689b73d-c01b-476c-ba1f-2e539c5d5e75' class='mouseoverHref'>Vitzthum, H.G. 1927. Die Acarofauna der Harzflusse.</a> <!--MARK--><!--MARK--><a href='../../../../publication/9f4f8fa8-8553-4807-a483-541b14e86c37' class='mouseoverHref'><em>Sitzungsberichte der Gesellschaft Naturforschender Freunde zu Berlin</em></a> <strong>1</strong>: 98-103<!--MARK-->","","Article in Journal","6689b73d-c01b-476c-ba1f-2e539c5d5e75","20081009T05:11:37.000+0000","9f4f8fa8-8553-4807-a483-541b14e86c37"
"Walter, D.E.","1995","Dancing on the head of a pin: mites in the rainforest canopy","pp. 49-53","","Records of the Western Australian Museum","Australasian Spiders and their Relatives: Papers Honouring Barbara York Main","","","<!--MARK--><a href='../../../../publication/36742305-8c58-4d05-85b1-bc35d56a899a' class='mouseoverHref'>Walter, D.E. 1995. Dancing on the head of a pin: mites in the rainforest canopy. pp. 49-53</a> <!--MARK--><em>in</em> <!--MARK--><a href='../../../../publication/0f384557-4c45-4b31-8213-a09d034dca8e' class='mouseoverHref'>M.S. Harvey (ed.). Australasian Spiders and their Relatives: Papers Honouring Barbara York Main.</a> <!--MARK--><!--MARK--><a href='../../../../publication/a2cbd1fb-97d5-493a-a1d7-c2b99709890b' class='mouseoverHref'><em>Records of the Western Australian Museum</em></a> <strong>52</strong>(Supplement)<!--MARK-->","","Section in Article","36742305-8c58-4d05-85b1-bc35d56a899a","20120130T23:24:50.065+0000","0f384557-4c45-4b31-8213-a09d034dca8e"
"Walter, D.E., Beard, J.J., Walker, K.L. & Sparks, K.","2002","Of mites and bees: A review of mite-bee associations in Australia and a revision of <i>Raymentia</i> Womersley (Acari: Mesostigmata: Laelapidae), with the description of two new species of mites from <i>Lasioglossum (Paraspechodes)</i> spp. (Hymenoptera: Halictidae)","128-148","","Australian Journal of Entomology","","","","<!--MARK--><a href='../../../../publication/7b9fb646-b15e-450c-a683-75e37f2ee7b4' class='mouseoverHref'>Walter, D.E., Beard, J.J., Walker, K.L. & Sparks, K. 2002. Of mites and bees: A review of mite-bee associations in Australia and a revision of <i>Raymentia</i> Womersley (Acari: Mesostigmata: Laelapidae), with the description of two new species of mites from <i>Lasioglossum (Paraspechodes)</i> spp. (Hymenoptera: Halictidae).</a> <!--MARK--><!--MARK--><a href='../../../../publication/77b15fe9-6d88-4390-b074-3a3a6d3683a6' class='mouseoverHref'><em>Australian Journal of Entomology</em></a> <strong>41</strong>: 128-148<!--MARK-->","","Article in Journal","7b9fb646-b15e-450c-a683-75e37f2ee7b4","20101222T06:19:30.445+0000","77b15fe9-6d88-4390-b074-3a3a6d3683a6"
"Womersley, H.","1941","Studies in Australian Acarina. (2). Tyroglyphidae (s. l.)","451-488","","Records of the South Australian Museum (Adelaide)","","","","<!--MARK--><a href='../../../../publication/d66fa338-2683-45a0-8bf9-756d3fed9117' class='mouseoverHref'>Womersley, H. 1941. Studies in Australian Acarina. (2). Tyroglyphidae (s. l.).</a> <!--MARK--><!--MARK--><a href='../../../../publication/f7f76869-b0b8-4c0e-a1bc-1d8c43cc0f89' class='mouseoverHref'><em>Records of the South Australian Museum (Adelaide)</em></a> <strong>6</strong>: 451-488<!--MARK-->","","Article in Journal","d66fa338-2683-45a0-8bf9-756d3fed9117","20081009T05:11:37.000+0000","f7f76869-b0b8-4c0e-a1bc-1d8c43cc0f89"
"Womersley, H.","1942","Miscellaneous additions to the acarine fauna of Australia","85-92 pl. III","","Transactions of the Royal Society of South Australia","","","","<!--MARK--><a href='../../../../publication/b6e42ce2-3f3a-4d9e-9bb2-dcc6bda188a9' class='mouseoverHref'>Womersley, H. 1942. Miscellaneous additions to the acarine fauna of Australia.</a> <!--MARK--><!--MARK--><a href='../../../../publication/8b48b0a3-dd7a-4aea-be0d-10a223710ebc' class='mouseoverHref'><em>Transactions of the Royal Society of South Australia</em></a> <strong>66</strong>: 85-92 pl. III<!--MARK-->","","Article in Journal","b6e42ce2-3f3a-4d9e-9bb2-dcc6bda188a9","20081009T05:11:37.000+0000","8b48b0a3-dd7a-4aea-be0d-10a223710ebc"
"Woodring, J.P. & Moser, J.C.","1970","Six new species of anoetid mites associated with North American Scolytidae","1237-1257","","The Canadian Entomologist","","","","<!--MARK--><a href='../../../../publication/ee1ff114-00b3-48eb-8138-2990eae339aa' class='mouseoverHref'>Woodring, J.P. & Moser, J.C. 1970. Six new species of anoetid mites associated with North American Scolytidae.</a> <!--MARK--><!--MARK--><a href='../../../../publication/afc223f8-7d5d-4661-8292-b6784e1d5f5c' class='mouseoverHref'><em>The Canadian Entomologist</em></a> <strong>102</strong>: 1237-1257<!--MARK-->","","Article in Journal","ee1ff114-00b3-48eb-8138-2990eae339aa","20190111T01:51:16.447+0000","afc223f8-7d5d-4661-8292-b6784e1d5f5c"
"Yousuf, F., Gurr, G., Carnegie, A.J., Bedding, R.A., Bashford, R. & Gitau, C.","2014","Biology of the bark beetle <em>Ips grandicollis</em> Eichoff (Coleoptera: Scolytinae) and its arthropod, nematode and microbial associates: a review of management opportunities from Australia.","298-316.","","Austral Entomology","","","","<!--MARK--><a href='../../../../publication/ee8b9334-6c41-463f-ab34-7d16ab0295e4' class='mouseoverHref'>Yousuf, F., Gurr, G., Carnegie, A.J., Bedding, R.A., Bashford, R. & Gitau, C. 2014. Biology of the bark beetle <em>Ips grandicollis</em> Eichoff (Coleoptera: Scolytinae) and its arthropod, nematode and microbial associates: a review of management opportunities from Australia.</a> <!--MARK--><!--MARK--><a href='../../../../publication/a3a01091-89c3-445b-a732-dbb79862123d' class='mouseoverHref'><em>Austral Entomology</em></a> <strong>53</strong>: 298-316.<!--MARK-->","","Article in Journal","ee8b9334-6c41-463f-ab34-7d16ab0295e4","20170122T00:04:00.948+0000","a3a01091-89c3-445b-a732-dbb79862123d"
