"PUB_AUTHOR","PUB_YEAR","PUB_TITLE","PUB_PAGES","PUB_PARENT_BOOK_TITLE","PUB_PARENT_JOURNAL_TITLE","PUB_PARENT_ARTICLE_TITLE","PUB_PUBLICATION_DATE","PUB_PUBLISHER","PUB_FORMATTED","PUB_QUALIFICATION","PUB_TYPE","PUBLICATION_GUID","PUBLICATION_LAST_UPDATE","PARENT_PUBLICATION_GUID"
"Dahlgren, G.","1974","Über die Verbreitung der <i>Saprinus</i>-Arten der Alten Welt (Col. Histeridae)","95-99","","Entomologisk Tidskrift","","","","<!--MARK--><a href='../../../../publication/0ddef6f4-8361-4e62-865b-cdc7afc4c626' class='mouseoverHref'>Dahlgren, G. 1974. Über die Verbreitung der <i>Saprinus</i>-Arten der Alten Welt (Col. Histeridae).</a> <!--MARK--><!--MARK--><a href='../../../../publication/ba33b082-f69d-4d6a-a319-837886ef96ce' class='mouseoverHref'><em>Entomologisk Tidskrift</em></a> <strong>95</strong>: 95-99<!--MARK-->","","Article in Journal","0ddef6f4-8361-4e62-865b-cdc7afc4c626","20081009T05:11:37.000+0000","ba33b082-f69d-4d6a-a319-837886ef96ce"
"Dahlgren, G.","1976","The neglected genus <i>Tomogenius</i> Marseul (Coleoptera: Histeridae)","407-411","","Journal of the Royal Society of New Zealand","","","","<!--MARK--><a href='../../../../publication/d220bb1c-ce9a-4a8b-b591-51e664b3858f' class='mouseoverHref'>Dahlgren, G. 1976. The neglected genus <i>Tomogenius</i> Marseul (Coleoptera: Histeridae).</a> <!--MARK--><!--MARK--><a href='../../../../publication/b8a8c012-8655-4040-ae8c-704472bfcb39' class='mouseoverHref'><em>Journal of the Royal Society of New Zealand</em></a> <strong>6</strong>(4): 407-411<!--MARK-->","","Article in Journal","d220bb1c-ce9a-4a8b-b591-51e664b3858f","20081009T05:11:37.000+0000","b8a8c012-8655-4040-ae8c-704472bfcb39"
"Deane, C.","1932","New species of Corylophidae (Coleoptera)","332-337","","Proceedings of the Linnean Society of New South Wales","","","","<!--MARK--><a href='../../../../publication/808484f0-f852-425c-950e-77f197164c57' class='mouseoverHref'>Deane, C. 1932. New species of Corylophidae (Coleoptera).</a> <!--MARK--><!--MARK--><a href='../../../../publication/c12cd779-adb5-41ea-bd2c-75f6864cf22e' class='mouseoverHref'><em>Proceedings of the Linnean Society of New South Wales</em></a> <strong>57</strong>(5-6): 332-337<!--MARK-->","","Article in Journal","808484f0-f852-425c-950e-77f197164c57","20081009T05:11:37.000+0000","c12cd779-adb5-41ea-bd2c-75f6864cf22e"
"Dégallier, N.","1993","Description des <i>Saprinodes distinctus</i> sp. nov., designation d'un lectotype pour <i>S. falcifer</i> Lewis, 1891 et notes sur un autre Histeridae (Coleoptera) d'Australie","47-53","","Nouvelle Revue d'Entomologie","","","","<!--MARK--><a href='../../../../publication/7ace127f-e3ab-4691-86b2-25a9193b9c43' class='mouseoverHref'>Dégallier, N. 1993. Description des <i>Saprinodes distinctus</i> sp. nov., designation d'un lectotype pour <i>S. falcifer</i> Lewis, 1891 et notes sur un autre Histeridae (Coleoptera) d'Australie.</a> <!--MARK--><!--MARK--><a href='../../../../publication/02e334cf-17fa-446e-b2c9-52fdfe158ff6' class='mouseoverHref'><em>Nouvelle Revue d'Entomologie</em></a> n.s. <strong>10</strong>: 47-53<!--MARK-->","","Article in Journal","7ace127f-e3ab-4691-86b2-25a9193b9c43","20081009T05:11:37.000+0000","02e334cf-17fa-446e-b2c9-52fdfe158ff6"
"Degallier, N. & Caterino, M. S.","2005","Notes taxonomiques sur les Chlamydopsinae et descriptions d'espèces nouvelles. I. Genres <i>Ceratohister</i> Reichensperger, <i>Eucurtiopsis</i> Silvestri et <i>Orectoscelis</i> Lewis (Coleoptera, Histeridae).","299-326","","Bulletin de la Société Entomologique de France","","8 Sep 2005","","<!--MARK--><a href='../../../../publication/6a604c67-d647-408d-b9e5-42783f749c81' class='mouseoverHref'>Degallier, N. & Caterino, M. S. 2005. Notes taxonomiques sur les Chlamydopsinae et descriptions d'espèces nouvelles. I. Genres <i>Ceratohister</i> Reichensperger, <i>Eucurtiopsis</i> Silvestri et <i>Orectoscelis</i> Lewis (Coleoptera, Histeridae).</a> <!--MARK--><!--MARK--><a href='../../../../publication/7853f77c-aa1b-42ec-bc2c-9758f7ff72c7' class='mouseoverHref'><em>Bulletin de la Société Entomologique de France</em></a> <strong>110</strong>(3): 299-326<!--MARK--> [Date published 8 Sep 2005]","","Article in Journal","6a604c67-d647-408d-b9e5-42783f749c81","20110926T00:53:39.299+0000","7853f77c-aa1b-42ec-bc2c-9758f7ff72c7"
"Dégallier, N. & M. S. Caterino.","2005","Notes taxonomiques sur les Chlamydopsinae et descriptions d'espèces nouvelles. II. Genre <i>Pheidoliphila</i> Lea (Coleoptera, Histeridae)","463-494","","Bulletin de la Société Entomologique de France","","16 December 2005","","<!--MARK--><a href='../../../../publication/5b59963e-013f-4b75-89d6-4b5b6a261f70' class='mouseoverHref'>Dégallier, N. & M. S. Caterino. 2005. Notes taxonomiques sur les Chlamydopsinae et descriptions d'espèces nouvelles. II. Genre <i>Pheidoliphila</i> Lea (Coleoptera, Histeridae).</a> <!--MARK--><!--MARK--><a href='../../../../publication/7853f77c-aa1b-42ec-bc2c-9758f7ff72c7' class='mouseoverHref'><em>Bulletin de la Société Entomologique de France</em></a> <strong>110</strong>(4/5): 463-494<!--MARK--> [Date published 16 December 2005]","","Article in Journal","5b59963e-013f-4b75-89d6-4b5b6a261f70","20110714T07:02:59.820+0000","7853f77c-aa1b-42ec-bc2c-9758f7ff72c7"
"Dejean, P.F.M.A.","1821","Catalogue de la Collection de Coléoptères de M. le Baron Dejean","viii 136 pp.","","","","","Crevot, Libraire","<!--MARK--><a href='../../../../publication/c5981f53-318a-4e58-988f-e9131223490f' class='mouseoverHref'>Dejean, P.F.M.A. 1821. <em>Catalogue de la Collection de Coléoptères de M. le Baron Dejean</em>. Paris : Crevot, Libraire viii 136 pp.</a><!--MARK-->","","Book","c5981f53-318a-4e58-988f-e9131223490f","20081009T05:11:37.000+0000",""
"Dejean, P.F.M.A.","1833","Catalogue des coléoptères de la collection de M. le Comte Dejean","livr. 1 pp. 1-96. livr. 2 pp. 97-176","","","","","Méquignon Marvis","<!--MARK--><a href='../../../../publication/5d01c400-92bf-4356-a06b-7ff992d4b4fe' class='mouseoverHref'>Dejean, P.F.M.A. 1833. <em>Catalogue des coléoptères de la collection de M. le Comte Dejean</em>. Paris : Méquignon Marvis Vol. Livr. 1 & 2 livr. 1 pp. 1-96. livr. 2 pp. 97-176.</a><!--MARK-->","","Book","5d01c400-92bf-4356-a06b-7ff992d4b4fe","20110207T21:57:57.477+0000",""
"Dejean, P.F.M.A.","1836","Catalogue des Coléoptères de la collection de M. le comte Dejean","384 pp.","","","","","Méquignon-Marvis, Father & Sons","<!--MARK--><a href='../../../../publication/35b46fa3-af14-45b4-b656-c2dc62547ba7' class='mouseoverHref'>Dejean, P.F.M.A. 1836. <em>Catalogue des Coléoptères de la collection de M. le comte Dejean</em>. Paris : Méquignon-Marvis, Father & Sons Vol. 1-4 3, 384 pp.</a><!--MARK-->","","Book","35b46fa3-af14-45b4-b656-c2dc62547ba7","20120321T03:36:00.201+0000",""
"Dejean, P.F.M.A.","1837","Catalogue des Coléoptères de la Collection de M. le Comte Dejean. Troisièeme édition, revue, corrigée et augmentée","xiv 385-503 pp.","","","","","Méquignon Marvis Fasc.","<!--MARK--><a href='../../../../publication/c9a77a09-7db4-4146-b57b-496abebbd8fb' class='mouseoverHref'>Dejean, P.F.M.A. 1837. <em>Catalogue des Coléoptères de la Collection de M. le Comte Dejean. Troisièeme édition, revue, corrigée et augmentée</em>. Paris : Méquignon Marvis Fasc. Vol. 5 xiv 385-503 pp.</a><!--MARK-->","","Book","c9a77a09-7db4-4146-b57b-496abebbd8fb","20140602T23:51:02.186+0000",""
"Desbordes, H.","1917","Contribution à la connaissance des Histérides. 3e mémoire. Synopsis de divers groupes d'Histeridae.","165-192","","Annales de la Société Entomologique de France","","","","<!--MARK--><a href='../../../../publication/a05c9011-442b-4157-827a-2eb16cb016b5' class='mouseoverHref'>Desbordes, H. 1917. Contribution à la connaissance des Histérides. 3e mémoire. Synopsis de divers groupes d'Histeridae.</a> <!--MARK--><!--MARK--><a href='../../../../publication/6462279b-2aaf-46a3-a434-cab7d8a2c33d' class='mouseoverHref'><em>Annales de la Société Entomologique de France</em></a> <strong>86</strong>: 165-192<!--MARK-->","","Article in Journal","a05c9011-442b-4157-827a-2eb16cb016b5","20110926T02:19:51.293+0000","6462279b-2aaf-46a3-a434-cab7d8a2c33d"
"Erichson, W.F.","1834","Uebersicht der Histeroides der Sammlung","83-208","","Jahrbüch der Insectenkunde. Berlin","","","","<!--MARK--><a href='../../../../publication/067c10e6-d4d5-4c25-9be1-3d602c32b570' class='mouseoverHref'>Erichson, W.F. 1834. Uebersicht der Histeroides der Sammlung.</a> <!--MARK--><!--MARK--><a href='../../../../publication/0ca919ed-dcb5-4fab-a61c-05cd5ee3a869' class='mouseoverHref'><em>Jahrbüch der Insectenkunde. Berlin</em></a> <strong>1</strong>: 83-208<!--MARK-->","","Article in Journal","067c10e6-d4d5-4c25-9be1-3d602c32b570","","0ca919ed-dcb5-4fab-a61c-05cd5ee3a869"
"Erichson, W.F.","1842","Beitrag zur Insecten-fauna von Vandiemensland, mit besonderer Berucksichtigung der geographischen Verbreitung der Insecten","83-287, pls 4, 5","","Archiv für Naturgeschichte","","","","<!--MARK--><a href='../../../../publication/2ae5a27f-fd1b-4bb9-b72e-a5997ccf96b3' class='mouseoverHref'>Erichson, W.F. 1842. Beitrag zur Insecten-fauna von Vandiemensland, mit besonderer Berucksichtigung der geographischen Verbreitung der Insecten.</a> <!--MARK--><!--MARK--><a href='../../../../publication/f5b5f7c7-fc53-4502-951d-1c96b680d874' class='mouseoverHref'><em>Archiv für Naturgeschichte</em></a> <strong>8</strong>(1): 83-287, pls 4, 5<!--MARK-->","","Article in Journal","2ae5a27f-fd1b-4bb9-b72e-a5997ccf96b3","20120514T22:59:43.847+0000","f5b5f7c7-fc53-4502-951d-1c96b680d874"
"Fabricius, J.C.","1775","Systema Entomologiae, sistens Insectorum Classes, Ordines, Genera, Species, adiectis Synonymis, Locis, Descriptionibus, Observationibus","xxxii 832 pp.","","","","17 April","Kortii","<!--MARK--><a href='../../../../publication/da77a1b5-cdfa-4c8b-a4fa-3ba1ead48929' class='mouseoverHref'>Fabricius, J.C. 1775. <em>Systema Entomologiae, sistens Insectorum Classes, Ordines, Genera, Species, adiectis Synonymis, Locis, Descriptionibus, Observationibus</em>. Flensburgi et Lipsiae [= Flensburg & Leipzig] : Kortii xxxii 832 pp.</a><!--MARK--> [Date published 17 April]","","Book","da77a1b5-cdfa-4c8b-a4fa-3ba1ead48929","20110508T01:53:06.371+0000",""
"Fahraeus, O.J. in Boheman, C.H.","1851","Insecta Caffrariae annis 1838-1845 a J.A. Wahlberg collecta. Coleoptera","299-625","","","","","Fritze & Norstedt","<!--MARK--><a href='../../../../publication/4cd1904d-03ab-4020-b060-b5742f087355' class='mouseoverHref'>Fahraeus, O.J. <i>in</i> Boheman, C.H. 1851. <em>Insecta Caffrariae annis 1838-1845 a J.A. Wahlberg collecta. Coleoptera</em>. Holmiae : Fritze & Norstedt Vol. 1 pp. 299-625.</a><!--MARK-->","","Book","4cd1904d-03ab-4020-b060-b5742f087355","20081009T05:11:37.000+0000",""
"Fuss, H.","1869","Eine neue deutsche Acritus-Art.","312","","Berliner Entomologische Zeitschrift","","1868","","<!--MARK--><a href='../../../../publication/0161ad76-1c5c-4717-9fd3-819484d039a6' class='mouseoverHref'>Fuss, H. 1869. Eine neue deutsche Acritus-Art.</a> <!--MARK--><!--MARK--><a href='../../../../publication/9cb53f48-ac05-481f-9276-81372f651531' class='mouseoverHref'><em>Berliner Entomologische Zeitschrift</em></a> <strong>12</strong>(3-4): 312<!--MARK--> [Date published 1868]","","Article in Journal","0161ad76-1c5c-4717-9fd3-819484d039a6","20110921T22:20:59.388+0000","9cb53f48-ac05-481f-9276-81372f651531"
"Gahan, C.J. in Waterhouse, C.O., Gahan, C.J. & Arrow, G.J.","1900","Order 4.-Coleoptera. New species descriptions","89-127","A Monograph of Christmas Island (Indian Ocean): physical features and geology; with descriptions of the fauna and flora by numerous contributors","","","","","<!--MARK--><a href='../../../../publication/75f7592f-8451-466c-92dd-5e5e31e73e24' class='mouseoverHref'>Gahan, C.J. <i>in</i> Waterhouse, C.O., Gahan, C.J. & Arrow, G.J. 1900. Order 4.-Coleoptera. New species descriptions. pp. 89-127</a> <!--MARK--><em>in</em> <!--MARK--><a href='../../../../publication/57813ba9-0a9a-466d-a644-d9d62e6fee70' class='mouseoverHref'>Andrews, C.W. (ed.). <em>A Monograph of Christmas Island (Indian Ocean): physical features and geology; with descriptions of the fauna and flora by numerous contributors</em>. London : British Museum (Natural History) xiii 337 pp.</a><!--MARK-->","","Chapter in Book","75f7592f-8451-466c-92dd-5e5e31e73e24","","57813ba9-0a9a-466d-a644-d9d62e6fee70"
"Ganglbauer, L.","1899","Die Käfer von Mitteleuropa","1046","","","","","Carl Gerold's Sohn","<!--MARK--><a href='../../../../publication/8ba9b34f-55fc-461c-aa8f-c6052868ed9b' class='mouseoverHref'>Ganglbauer, L. 1899. <em>Die Käfer von Mitteleuropa</em>. Wien : Carl Gerold's Sohn Vol. 3 1046 pp.</a><!--MARK-->","","Book","8ba9b34f-55fc-461c-aa8f-c6052868ed9b","20101222T05:50:16.658+0000",""
"Gerhardt, J.","1900","Neuheiten der schlesischen Käferfauna aus dem Jahre 1899.","69-71","","Deutsche Entomologische Zeitschrift","","July 1900","","<!--MARK--><a href='../../../../publication/13c1eead-ddf0-47ec-a2cf-f12a8e631b5a' class='mouseoverHref'>Gerhardt, J. 1900. Neuheiten der schlesischen Käferfauna aus dem Jahre 1899.</a> <!--MARK--><!--MARK--><a href='../../../../publication/bdeb8163-7175-47c9-be9b-28f797c57745' class='mouseoverHref'><em>Deutsche Entomologische Zeitschrift</em></a> <strong>1900</strong>(1): 69-71<!--MARK--> [Date published July 1900]","","Article in Journal","13c1eead-ddf0-47ec-a2cf-f12a8e631b5a","20110922T03:33:59.123+0000","bdeb8163-7175-47c9-be9b-28f797c57745"
"Gomy, Y.","1977","Histeridae nouveaux de la faune orientale et de la Nouvelle-Guinée (Coleoptera)","101-115","","Annales Historico-Naturales Musei Nationalis Hungarici (Zoologica)","","","","<!--MARK--><a href='../../../../publication/fbc3b992-964e-45fc-ac7f-33fbac723ec7' class='mouseoverHref'>Gomy, Y. 1977. Histeridae nouveaux de la faune orientale et de la Nouvelle-Guinée (Coleoptera).</a> <!--MARK--><!--MARK--><a href='../../../../publication/e6f35874-0423-4fa1-bf45-655b9047e0c2' class='mouseoverHref'><em>Annales Historico-Naturales Musei Nationalis Hungarici (Zoologica)</em></a> <strong>69</strong>: 101-115<!--MARK-->","","Article in Journal","fbc3b992-964e-45fc-ac7f-33fbac723ec7","20081009T05:11:37.000+0000","e6f35874-0423-4fa1-bf45-655b9047e0c2"
"Gomy, Y.","1984","Révision des Acritini d'Australie et de Tasmanie (Coleoptera, Histeridae)","171-201","","Annales de la Société Entomologique de France","","","","<!--MARK--><a href='../../../../publication/2acd9bb6-ea99-4447-8fea-6d910c78728e' class='mouseoverHref'>Gomy, Y. 1984. Révision des Acritini d'Australie et de Tasmanie (Coleoptera, Histeridae).</a> <!--MARK--><!--MARK--><a href='../../../../publication/6462279b-2aaf-46a3-a434-cab7d8a2c33d' class='mouseoverHref'><em>Annales de la Société Entomologique de France</em></a> n.s. <strong>20</strong>(2): 171-201<!--MARK-->","","Article in Journal","2acd9bb6-ea99-4447-8fea-6d910c78728e","20081009T05:11:37.000+0000","6462279b-2aaf-46a3-a434-cab7d8a2c33d"
"Gomy, Y.","1992","Description de deux nouveaux <i>Bacanius</i> LeConte de la faune Australienne (I.) (Coleoptera, Histeridae)","75-81","","Nouvelle Revue d'Entomologie","","","","<!--MARK--><a href='../../../../publication/63d9c7f1-84fa-499a-a974-637954fe083b' class='mouseoverHref'>Gomy, Y. 1992. Description de deux nouveaux <i>Bacanius</i> LeConte de la faune Australienne (I.) (Coleoptera, Histeridae).</a> <!--MARK--><!--MARK--><a href='../../../../publication/02e334cf-17fa-446e-b2c9-52fdfe158ff6' class='mouseoverHref'><em>Nouvelle Revue d'Entomologie</em></a> <strong>9</strong>(1): 75-81<!--MARK-->","","Article in Journal","63d9c7f1-84fa-499a-a974-637954fe083b","20081009T05:11:37.000+0000","02e334cf-17fa-446e-b2c9-52fdfe158ff6"
"Gomy, Y.","1995","Contribution à la connaissance des Micro-Histeridae australiens (Coleoptera)","373-380","","Bulletin Mensuel de la Société Linnéenne de Lyon","","","","<!--MARK--><a href='../../../../publication/ec9a18bb-50fc-4a25-9ae4-858f5e704867' class='mouseoverHref'>Gomy, Y. 1995. Contribution à la connaissance des Micro-Histeridae australiens (Coleoptera).</a> <!--MARK--><!--MARK--><a href='../../../../publication/42b10df1-9459-410d-a4bd-11c4398e43a5' class='mouseoverHref'><em>Bulletin Mensuel de la Société Linnéenne de Lyon</em></a> <strong>64</strong>(8): 373-380<!--MARK-->","","Article in Journal","ec9a18bb-50fc-4a25-9ae4-858f5e704867","20081009T05:11:37.000+0000","42b10df1-9459-410d-a4bd-11c4398e43a5"
"Gomy, Y.","2009","Un nouveau genre et trois nouvelles espèces d'Histeridae Bacaniini d'Australie (Coleoptera).","189-193","","Bulletin de la Société Entomologique de France","","Jun 2009","","<!--MARK--><a href='../../../../publication/c2f1c600-f82a-42b7-8912-6c886ca7b054' class='mouseoverHref'>Gomy, Y. 2009. Un nouveau genre et trois nouvelles espèces d'Histeridae Bacaniini d'Australie (Coleoptera).</a> <!--MARK--><!--MARK--><a href='../../../../publication/7853f77c-aa1b-42ec-bc2c-9758f7ff72c7' class='mouseoverHref'><em>Bulletin de la Société Entomologique de France</em></a> <strong>114</strong>(2): 189-193<!--MARK--> [Date published Jun 2009]","","Article in Journal","c2f1c600-f82a-42b7-8912-6c886ca7b054","20110925T21:42:19.130+0000","7853f77c-aa1b-42ec-bc2c-9758f7ff72c7"
"Guérin-Méneville, F.É.","1844","Iconographie du Règne animal de G. Cuvier, ou représentation d'après nature de l'une des espèces les plus remarquables, et souvent non figurées, de chaque genre d'animaux. Avec un text descriptif mis au courant de la science. Ouvrage pouvant servir d'atlas à tous les traités de zoologie. 450 plates in 45 livraisons. Crustacea","48 pp., 36 pls","","","","","J.B. Baillière","<!--MARK--><a href='../../../../publication/68c688cf-056b-4fdf-8113-4110c262668d' class='mouseoverHref'>Guérin-Méneville, F.É. 1844. <em>Iconographie du Règne animal de G. Cuvier, ou représentation d'après nature de l'une des espèces les plus remarquables, et souvent non figurées, de chaque genre d'animaux. Avec un text descriptif mis au courant de la science. Ouvrage pouvant servir d'atlas à tous les traités de zoologie. 450 plates in 45 livraisons. Crustacea</em>. Paris : J.B. Baillière 48 pp., 36 pls.</a><!--MARK--> [published from1829-1844]","published from1829-1844","Book","68c688cf-056b-4fdf-8113-4110c262668d","20081009T05:11:37.000+0000",""
"Halstead, D.G.H.","1963","Coleoptera, Histeroidea","16 pp.","","Handbooks for the Identification of British Insects","","","","<!--MARK--><a href='../../../../publication/15ab4225-aa9a-4bf6-aa55-e2db0a33edb8' class='mouseoverHref'>Halstead, D.G.H. 1963. Coleoptera, Histeroidea.</a> <!--MARK--><!--MARK--><a href='../../../../publication/0add51d5-87a9-42ea-b7dd-bba53a988966' class='mouseoverHref'><em>Handbooks for the Identification of British Insects</em></a> <strong>4</strong>(10): 16 pp.<!--MARK-->","","Article in Journal","15ab4225-aa9a-4bf6-aa55-e2db0a33edb8","20081009T05:11:37.000+0000","0add51d5-87a9-42ea-b7dd-bba53a988966"
"Hansen, M.","1997","Evolutionary trends in 'staphyliniform' beetles (Coleoptera)","1-52","","Steenstrupia","","","","<!--MARK--><a href='../../../../publication/68f1a11b-3277-4b15-a924-44ad78ab7a3b' class='mouseoverHref'>Hansen, M. 1997. Evolutionary trends in 'staphyliniform' beetles (Coleoptera).</a> <!--MARK--><!--MARK--><a href='../../../../publication/e157ad4b-814b-4a04-a551-d45283aa23e2' class='mouseoverHref'><em>Steenstrupia</em></a> <strong>23</strong>: 1-52<!--MARK-->","","Article in Journal","68f1a11b-3277-4b15-a924-44ad78ab7a3b","20081009T05:11:37.000+0000","e157ad4b-814b-4a04-a551-d45283aa23e2"
"Hansen, M.","1997","Phylogeny and classification of the staphyliniform beetle families (Coleoptera)","1-339","","Kongelige Danske Videnskabernes. Selskabs Skrifter. Kjøbenhavn","","","","<!--MARK--><a href='../../../../publication/20795511-4224-4779-807e-d1056c88dd85' class='mouseoverHref'>Hansen, M. 1997. Phylogeny and classification of the staphyliniform beetle families (Coleoptera).</a> <!--MARK--><!--MARK--><a href='../../../../publication/59c8ba79-104f-475e-a29d-924448f56688' class='mouseoverHref'><em>Kongelige Danske Videnskabernes. Selskabs Skrifter. Kjøbenhavn</em></a> <strong>48</strong>: 1-339<!--MARK-->","","Article in Journal","20795511-4224-4779-807e-d1056c88dd85","20081009T05:11:37.000+0000","59c8ba79-104f-475e-a29d-924448f56688"
"Hatch, M.H.","1938","Records of Histeridae from Iowa","17-20","","Journal of the Kansas Entomological Society","","","","<!--MARK--><a href='../../../../publication/ce65903e-dc36-4a66-b44b-b65529ad1303' class='mouseoverHref'>Hatch, M.H. 1938. Records of Histeridae from Iowa.</a> <!--MARK--><!--MARK--><a href='../../../../publication/8f5f2114-1781-49c1-8d11-d45a29514f22' class='mouseoverHref'><em>Journal of the Kansas Entomological Society</em></a> <strong>11</strong>: 17-20<!--MARK-->","","Article in Journal","ce65903e-dc36-4a66-b44b-b65529ad1303","20081009T05:11:37.000+0000","8f5f2114-1781-49c1-8d11-d45a29514f22"
"Helava, J. & Howden, H.F.","1977","The genus <i>Onthophilus</i> Leach in Australia, with description of a new species (Coleoptera: Histeridae)","83-86","","Journal of the Australian Entomological Society","","","","<!--MARK--><a href='../../../../publication/02173fa4-69cc-4dc5-9873-96c3daae6f46' class='mouseoverHref'>Helava, J. & Howden, H.F. 1977. The genus <i>Onthophilus</i> Leach in Australia, with description of a new species (Coleoptera: Histeridae).</a> <!--MARK--><!--MARK--><a href='../../../../publication/c2544f9f-3978-4f18-846d-a1fd3122c9c4' class='mouseoverHref'><em>Journal of the Australian Entomological Society</em></a> <strong>16</strong>(1): 83-86<!--MARK-->","","Article in Journal","02173fa4-69cc-4dc5-9873-96c3daae6f46","20081009T05:11:37.000+0000","c2544f9f-3978-4f18-846d-a1fd3122c9c4"
"Helava, J.V.T., Howden, H.F. & Ritchie, A.J.","1985","A review of the New World genera of the myrmecophilous and termitophilous subfamily Hetaeriinae","127-386","","Sociobiology","","","","<!--MARK--><a href='../../../../publication/65be4283-4dc3-4119-8993-d8507e168f83' class='mouseoverHref'>Helava, J.V.T., Howden, H.F. & Ritchie, A.J. 1985. A review of the New World genera of the myrmecophilous and termitophilous subfamily Hetaeriinae.</a> <!--MARK--><!--MARK--><a href='../../../../publication/5887c153-8987-495b-9107-99c2246a05af' class='mouseoverHref'><em>Sociobiology</em></a> <strong>10</strong>: 127-386<!--MARK-->","","Article in Journal","65be4283-4dc3-4119-8993-d8507e168f83","20081009T05:11:37.000+0000","5887c153-8987-495b-9107-99c2246a05af"
"Herbst, J.F.W.","1791","Natursystem aller bekannten in- und ausländischen Insekten, als eine Forsetzung der von Büffonschen Naturgeschichte. Der Käfer vierter.","1-112","","","","","B. J. Pauli","<!--MARK--><a href='../../../../publication/8eb4f84a-0cb5-47fb-90ff-b687fce83f96' class='mouseoverHref'>Herbst, J.F.W. 1791. <em>Natursystem aller bekannten in- und ausländischen Insekten, als eine Forsetzung der von Büffonschen Naturgeschichte. Der Käfer vierter</em>. Berlin : B. J. Pauli Vol. 1 pp. 1-112.</a><!--MARK-->","","Book","8eb4f84a-0cb5-47fb-90ff-b687fce83f96","20110921T22:00:29.024+0000",""
"Hinton, H.E.","1945","The Histeridae associated with stored products","309-340","","Bulletin of Entomological Research","","","","<!--MARK--><a href='../../../../publication/67b7745c-3f58-43c4-b881-a03d4ed9fab2' class='mouseoverHref'>Hinton, H.E. 1945. The Histeridae associated with stored products.</a> <!--MARK--><!--MARK--><a href='../../../../publication/ef0b7d10-3b2d-4f9f-affe-9a3dc2101d9f' class='mouseoverHref'><em>Bulletin of Entomological Research</em></a> <strong>35</strong>: 309-340<!--MARK-->","","Article in Journal","67b7745c-3f58-43c4-b881-a03d4ed9fab2","20081009T05:11:37.000+0000","ef0b7d10-3b2d-4f9f-affe-9a3dc2101d9f"
"Hoffmann, J.J.","1803","Monographie der von Verfassern in dem Departamente vom Donnersberge, und den angegrenzenden Gegenden der Departamente von der Saar, und von Rhein und Mosel einheimisch beobachteten Stutzkäfer (Hister). Nachtrag","120-130","","Entomologische Hefte, Frankfurt am Main","","","","<!--MARK--><a href='../../../../publication/d92c6fff-06ee-4534-8926-243a3994ab66' class='mouseoverHref'>Hoffmann, J.J. 1803. Monographie der von Verfassern in dem Departamente vom Donnersberge, und den angegrenzenden Gegenden der Departamente von der Saar, und von Rhein und Mosel einheimisch beobachteten Stutzkäfer (Hister). Nachtrag.</a> <!--MARK--><!--MARK--><a href='../../../../publication/867dbff9-f918-43a4-b0f9-73abc88b10f0' class='mouseoverHref'><em>Entomologische Hefte, Frankfurt am Main</em></a> <strong>2</strong>: 120-130<!--MARK-->","","Article in Journal","d92c6fff-06ee-4534-8926-243a3994ab66","20081009T05:11:37.000+0000","867dbff9-f918-43a4-b0f9-73abc88b10f0"
"Horn, G.","1873","Synopsis of the Histeridae of the United States","273-357","","Proceedings of the American Philosophical Society","","","","<!--MARK--><a href='../../../../publication/62235769-e289-48d8-a9f1-a8244422a487' class='mouseoverHref'>Horn, G. 1873. Synopsis of the Histeridae of the United States.</a> <!--MARK--><!--MARK--><a href='../../../../publication/404f350f-cee2-4ecd-9efc-956d451539f6' class='mouseoverHref'><em>Proceedings of the American Philosophical Society</em></a> <strong>13</strong>: 273-357<!--MARK-->","","Article in Journal","62235769-e289-48d8-a9f1-a8244422a487","20081009T05:11:37.000+0000","404f350f-cee2-4ecd-9efc-956d451539f6"
