"PUB_AUTHOR","PUB_YEAR","PUB_TITLE","PUB_PAGES","PUB_PARENT_BOOK_TITLE","PUB_PARENT_JOURNAL_TITLE","PUB_PARENT_ARTICLE_TITLE","PUB_PUBLICATION_DATE","PUB_PUBLISHER","PUB_FORMATTED","PUB_QUALIFICATION","PUB_TYPE","PUBLICATION_GUID","PUBLICATION_LAST_UPDATE","PARENT_PUBLICATION_GUID"
"Bouchet, P. & Rocroi, J.-P.","2005","Classification and nomenclator of gastropod families","1-397","","Malacologia","","","","<!--MARK--><a href='../../../../publication/fcc0b136-722c-45c2-9867-538af65fb836' class='mouseoverHref'>Bouchet, P. & Rocroi, J.-P. 2005. Classification and nomenclator of gastropod families.</a> <!--MARK--><!--MARK--><a href='../../../../publication/dc6c3842-79e3-48c5-8fb7-b8b17765f58f' class='mouseoverHref'><em>Malacologia</em></a> <strong>47</strong>: 1-397<!--MARK-->","","Article in Journal","fcc0b136-722c-45c2-9867-538af65fb836","20171019T02:34:42.723+0000","dc6c3842-79e3-48c5-8fb7-b8b17765f58f"
"Menke, C.T.","1843","Molluscorum Novae Hollandiae Specimen in Libraria Aulica Hahniana","pp. 1-46. [Apr. 1843]","","","","","Libraria Aulica Hahniana","<!--MARK--><a href='../../../../publication/c4974a5e-46c1-46ec-a9db-be24ec9b6780' class='mouseoverHref'>Menke, C.T. 1843. <em>Molluscorum Novae Hollandiae Specimen in Libraria Aulica Hahniana</em>. Hannoverae : Libraria Aulica Hahniana pp. 1-46. [Apr. 1843].</a><!--MARK-->","","Book","c4974a5e-46c1-46ec-a9db-be24ec9b6780","20140516T05:22:12.152+0000",""
"Petterd, W.F.","1889","Contributions for a systematic catalogue of the aquatic shells of Tasmania","60-82 pls 1-4","","Papers and Proceedings of the Royal Society of Tasmania","","","","<!--MARK--><a href='../../../../publication/b6d0d091-14b2-49f1-86ad-1fad9033da27' class='mouseoverHref'>Petterd, W.F. 1889. Contributions for a systematic catalogue of the aquatic shells of Tasmania.</a> <!--MARK--><!--MARK--><a href='../../../../publication/db793adc-ebf2-40c5-9d92-48a121ea03ae' class='mouseoverHref'><em>Papers and Proceedings of the Royal Society of Tasmania</em></a> <strong>1888</strong>: 60-82 pls 1-4<!--MARK-->","","Article in Journal","b6d0d091-14b2-49f1-86ad-1fad9033da27","","db793adc-ebf2-40c5-9d92-48a121ea03ae"
"Ponder, W.F.","1982","The anatomy and relationships of <em>Hydrococcus brazieri</em> (T. Woods)","64-79","","Journal of Molluscan Studies","","","","<!--MARK--><a href='../../../../publication/09982d78-867d-43d7-ac6d-3c3e663a53c5' class='mouseoverHref'>Ponder, W.F. 1982. The anatomy and relationships of <em>Hydrococcus brazieri</em> (T. Woods).</a> <!--MARK--><!--MARK--><a href='../../../../publication/ab2dcbf4-69d4-4856-a216-1b3b84e3501e' class='mouseoverHref'><em>Journal of Molluscan Studies</em></a> <strong>48</strong>(1): 64-79<!--MARK-->","","Article in Journal","09982d78-867d-43d7-ac6d-3c3e663a53c5","20120301T01:17:45.605+0000","ab2dcbf4-69d4-4856-a216-1b3b84e3501e"
"Ponder, W.F. & de Keyzer, R.G.","1998","Family Hydrococcidae","pp. 763","Mollusca: The Southern Synthesis. Fauna of Australia","","","","","<!--MARK--><a href='../../../../publication/cc000f4e-2ed9-4d84-ac91-1599d31525ea' class='mouseoverHref'>Ponder, W.F. & de Keyzer, R.G. 1998. Family Hydrococcidae. pp. 763</a> <!--MARK--><em>in</em> <!--MARK--><a href='../../../../publication/87d98901-6c1b-4f4e-a93b-4a39a8d24574' class='mouseoverHref'>Beesley, P.L., Ross, G.J.B. & Wells, A. (eds). <em>Mollusca: The Southern Synthesis. Fauna of Australia</em>. Melbourne : CSIRO Publishing Vol. 5(Part B) pp. vi-viii, 565-1234.</a><!--MARK-->","","Chapter in Book","cc000f4e-2ed9-4d84-ac91-1599d31525ea","20120208T23:07:41.683+0000","87d98901-6c1b-4f4e-a93b-4a39a8d24574"
"Smith, B.J.","1992","Non-Marine Mollusca","","Zoological Catalogue of Australia. Non-marine Mollusca","","","","","<!--MARK--><a href='../../../../publication/f13cacb9-41e4-4483-b65a-152b69675868' class='mouseoverHref'>Smith, B.J. 1992. Non-Marine Mollusca.</a> <!--MARK--><em>In,</em> <!--MARK--><a href='../../../../publication/e4f01bff-8661-43ef-bddd-e8ae1f29113f' class='mouseoverHref'>Houston, W.W.K. (ed.). <em>Zoological Catalogue of Australia. Non-marine Mollusca</em>. Canberra : Australian Government Publishing Service Vol. 8 xii 408 pp.</a><!--MARK-->","","Chapter in Book","f13cacb9-41e4-4483-b65a-152b69675868","20081009T05:11:37.000+0000","e4f01bff-8661-43ef-bddd-e8ae1f29113f"
"Tenison-Woods, J.E.","1876","Description of new Tasmanian shells.","131-159","","Papers and Proceedings of the Royal Society of Tasmania","","21 Mar 1876","","<!--MARK--><a href='../../../../publication/b6559fb8-7204-4c41-a89b-3a38cc561683' class='mouseoverHref'>Tenison-Woods, J.E. 1876. Description of new Tasmanian shells.</a> <!--MARK--><!--MARK--><a href='../../../../publication/db793adc-ebf2-40c5-9d92-48a121ea03ae' class='mouseoverHref'><em>Papers and Proceedings of the Royal Society of Tasmania</em></a> <strong>1875</strong>: 131-159<!--MARK--> [Date published 21 Mar 1876]","","Article in Journal","b6559fb8-7204-4c41-a89b-3a38cc561683","20171102T22:22:12.422+0000","db793adc-ebf2-40c5-9d92-48a121ea03ae"
"Tenison-Woods, J.E.","1877","On some new Tasmanian marine shells.","131-159","","Papers and Proceedings of the Royal Society of Tasmania","","27 Feb 1877","","<!--MARK--><a href='../../../../publication/a416f07d-e3b3-4f45-98ec-de6326327d58' class='mouseoverHref'>Tenison-Woods, J.E. 1877. On some new Tasmanian marine shells.</a> <!--MARK--><!--MARK--><a href='../../../../publication/db793adc-ebf2-40c5-9d92-48a121ea03ae' class='mouseoverHref'><em>Papers and Proceedings of the Royal Society of Tasmania</em></a> <strong>1876</strong>: 131-159<!--MARK--> [Date published 27 Feb 1877]","","Article in Journal","a416f07d-e3b3-4f45-98ec-de6326327d58","20171102T22:23:32.575+0000","db793adc-ebf2-40c5-9d92-48a121ea03ae"
"Thiele, J.","1928","Revision des systèms der Hydrobiiden und Melaniiden","351-402","","Zoologische Jahrbücher (Systematik)","","","","<!--MARK--><a href='../../../../publication/2f602344-e2e1-494f-af73-37b50a5912be' class='mouseoverHref'>Thiele, J. 1928. Revision des systèms der Hydrobiiden und Melaniiden.</a> <!--MARK--><!--MARK--><a href='../../../../publication/08f80f2a-f250-4bbd-9e7e-34ca5f002034' class='mouseoverHref'><em>Zoologische Jahrbücher (Systematik)</em></a> <strong>55</strong>: 351-402<!--MARK-->","","Article in Journal","2f602344-e2e1-494f-af73-37b50a5912be","20120301T01:03:04.870+0000","08f80f2a-f250-4bbd-9e7e-34ca5f002034"
"Wilke, T., Haase, M., Hershler, R., Liu, H.-P., Misof, B. & Ponder, W.","2013","Pushing short DNA fragments to the limit: Phylogenetic relationships of ?hydrobioid? gastropods (Caenogastropoda: Rissooidea)","715-736","","Molecular Phylogenetics and Evolution","","","","<!--MARK--><a href='../../../../publication/23a86594-41d2-4280-84d1-8e262676e4f6' class='mouseoverHref'>Wilke, T., Haase, M., Hershler, R., Liu, H.-P., Misof, B. & Ponder, W. 2013. Pushing short DNA fragments to the limit: Phylogenetic relationships of ?hydrobioid? gastropods (Caenogastropoda: Rissooidea).</a> <!--MARK--><!--MARK--><a href='../../../../publication/db034f3c-0160-42a2-a6c9-84156be3b7b8' class='mouseoverHref'><em>Molecular Phylogenetics and Evolution</em></a> <strong>66</strong>(3): 715-736<!--MARK-->","","Article in Journal","23a86594-41d2-4280-84d1-8e262676e4f6","20190321T05:36:08.197+0000","db034f3c-0160-42a2-a6c9-84156be3b7b8"
