"PUB_AUTHOR","PUB_YEAR","PUB_TITLE","PUB_PAGES","PUB_PARENT_BOOK_TITLE","PUB_PARENT_JOURNAL_TITLE","PUB_PARENT_ARTICLE_TITLE","PUB_PUBLICATION_DATE","PUB_PUBLISHER","PUB_FORMATTED","PUB_QUALIFICATION","PUB_TYPE","PUBLICATION_GUID","PUBLICATION_LAST_UPDATE","PARENT_PUBLICATION_GUID"
"Common, I.F.B.","1997","Oecophorine genera of Australia. II. The <i>Chezala, Philobota</i> and <i>Eulechria</i> groups (Lepidoptera: Oecophoridae)","i-xvi, 1-407","","Monographs on Australian Lepidoptera","","","","<!--MARK--><a href='null09020d1e-f6aa-4c39-a11a-cb313ac5ba68' class='mouseoverHref'>Common, I.F.B. 1997. Oecophorine genera of Australia. II. The <i>Chezala, Philobota</i> and <i>Eulechria</i> groups (Lepidoptera: Oecophoridae).</a> <!--MARK--><!--MARK--><a href='null3820f42d-af14-449e-a37e-97e94dd8d1ce' class='mouseoverHref'><em>Monographs on Australian Lepidoptera</em></a> <strong>5</strong>: i-xvi, 1-407<!--MARK-->","","Article in Journal","09020d1e-f6aa-4c39-a11a-cb313ac5ba68","20081009T05:11:37.000+0000","3820f42d-af14-449e-a37e-97e94dd8d1ce"
"Meyrick, E.","1883","Descriptions of Australian Micro-lepidoptera. VIII. Oecophoridae","415-547","","Proceedings of the Linnean Society of New South Wales","","","","<!--MARK--><a href='null6d57f0e6-51f8-414b-8397-964ace50e1e8' class='mouseoverHref'>Meyrick, E. 1883. Descriptions of Australian Micro-lepidoptera. VIII. Oecophoridae.</a> <!--MARK--><!--MARK--><a href='nullc12cd779-adb5-41ea-bd2c-75f6864cf22e' class='mouseoverHref'><em>Proceedings of the Linnean Society of New South Wales</em></a> 1 <strong>7</strong>(4): 415-547<!--MARK-->","","Article in Journal","6d57f0e6-51f8-414b-8397-964ace50e1e8","20081009T05:11:37.000+0000","c12cd779-adb5-41ea-bd2c-75f6864cf22e"
"Meyrick, E.","1884","Descriptions of Australian Micro-lepidoptera. XI. Oecophoridae","721-792","","Proceedings of the Linnean Society of New South Wales","","","","<!--MARK--><a href='nullbddbabb9-bbc4-46d1-92f2-f924990ade17' class='mouseoverHref'>Meyrick, E. 1884. Descriptions of Australian Micro-lepidoptera. XI. Oecophoridae.</a> <!--MARK--><!--MARK--><a href='nullc12cd779-adb5-41ea-bd2c-75f6864cf22e' class='mouseoverHref'><em>Proceedings of the Linnean Society of New South Wales</em></a> 1 <strong>9</strong>(3): 721-792<!--MARK-->","","Article in Journal","bddbabb9-bbc4-46d1-92f2-f924990ade17","20081009T05:11:37.000+0000","c12cd779-adb5-41ea-bd2c-75f6864cf22e"
"Meyrick, E.","1889","Descriptions of Australian Micro-lepidoptera. XV. Oecophoridae","1565-1703","","Proceedings of the Linnean Society of New South Wales","","","","<!--MARK--><a href='nullf0266d5d-4da9-4daf-89f0-6ad20477b0c3' class='mouseoverHref'>Meyrick, E. 1889. Descriptions of Australian Micro-lepidoptera. XV. Oecophoridae.</a> <!--MARK--><!--MARK--><a href='nullc12cd779-adb5-41ea-bd2c-75f6864cf22e' class='mouseoverHref'><em>Proceedings of the Linnean Society of New South Wales</em></a> 2-n.s. <strong>3</strong>(4): 1565-1703<!--MARK--> [year of publication not confirmed]","year of publication not confirmed","Article in Journal","f0266d5d-4da9-4daf-89f0-6ad20477b0c3","20110330T02:11:25.371+0000","c12cd779-adb5-41ea-bd2c-75f6864cf22e"
"Meyrick, E.","1913","<i>Exotic Microlepidoptera</i>","","","","","","","<!--MARK--><a href='null20afeedc-f697-4154-968a-7a132af53b09' class='mouseoverHref'>Meyrick, E. 1913. <i>Exotic Microlepidoptera</i>. Vol. <B>1</B>(3-5): 65-96, 97-128, 129-160.</a>","","Miscellaneous","20afeedc-f697-4154-968a-7a132af53b09","20130729T03:22:22.333+0000",""
"Meyrick, E.","1920","<i>Exotic Microlepidoptera</i>","","","","","","","<!--MARK--><a href='null01c7fc63-39ec-439f-b66b-5a7cd1933107' class='mouseoverHref'>Meyrick, E. 1920. <i>Exotic Microlepidoptera</i>. Vol. <B>2</B>(10-12): 189-384.</a>","","Miscellaneous","01c7fc63-39ec-439f-b66b-5a7cd1933107","20120306T21:57:05.942+0000",""
"Turner, A.J.","1917","Studies in Australian Lepidoptera","57-120","","Transactions of the Royal Society of South Australia","","","","<!--MARK--><a href='nulld19f5034-426e-49f3-92da-f2fd5bc71714' class='mouseoverHref'>Turner, A.J. 1917. Studies in Australian Lepidoptera.</a> <!--MARK--><!--MARK--><a href='null8b48b0a3-dd7a-4aea-be0d-10a223710ebc' class='mouseoverHref'><em>Transactions of the Royal Society of South Australia</em></a> <strong>41</strong>: 57-120<!--MARK-->","","Article in Journal","d19f5034-426e-49f3-92da-f2fd5bc71714","20081009T05:11:37.000+0000","8b48b0a3-dd7a-4aea-be0d-10a223710ebc"
"Turner, A.J.","1944","Revision of Australian Lepidoptera. Oecophoridae. XI","49-61","","Proceedings of the Linnean Society of New South Wales","","","","<!--MARK--><a href='null3c18905b-0021-437b-86c6-c15c8530c04c' class='mouseoverHref'>Turner, A.J. 1944. Revision of Australian Lepidoptera. Oecophoridae. XI.</a> <!--MARK--><!--MARK--><a href='nullc12cd779-adb5-41ea-bd2c-75f6864cf22e' class='mouseoverHref'><em>Proceedings of the Linnean Society of New South Wales</em></a> <strong>69</strong>: 49-61<!--MARK-->","","Article in Journal","3c18905b-0021-437b-86c6-c15c8530c04c","20081009T05:11:37.000+0000","c12cd779-adb5-41ea-bd2c-75f6864cf22e"
"Turner, A.J.","1944","Revision of the Australian Lepidoptera. Oecophoridae. XII","253-273","","Proceedings of the Linnean Society of New South Wales","","","","<!--MARK--><a href='nullc8ee731b-91bc-4144-82f6-9f2a0917661a' class='mouseoverHref'>Turner, A.J. 1944. Revision of the Australian Lepidoptera. Oecophoridae. XII.</a> <!--MARK--><!--MARK--><a href='nullc12cd779-adb5-41ea-bd2c-75f6864cf22e' class='mouseoverHref'><em>Proceedings of the Linnean Society of New South Wales</em></a> <strong>69</strong>: 253-273<!--MARK-->","","Article in Journal","c8ee731b-91bc-4144-82f6-9f2a0917661a","20081009T05:11:37.000+0000","c12cd779-adb5-41ea-bd2c-75f6864cf22e"
