"PUB_AUTHOR","PUB_YEAR","PUB_TITLE","PUB_PAGES","PUB_PARENT_BOOK_TITLE","PUB_PARENT_JOURNAL_TITLE","PUB_PARENT_ARTICLE_TITLE","PUB_PUBLICATION_DATE","PUB_PUBLISHER","PUB_FORMATTED","PUB_QUALIFICATION","PUB_TYPE","PUBLICATION_GUID","PUBLICATION_LAST_UPDATE","PARENT_PUBLICATION_GUID"
"Austin, A.D. & Dangerfield, P.C.","1998","Biology of the <i>Mesostoa kerri</i> Austin and Wharton (Insecta: Hymenoptera: Braconidae: Mesostoinae), an endemic Australian wasp that causes stem galls on <i>Banksia marginata</i> Cav","559-569","","Australian Journal of Botany","","","","<!--MARK--><a href='publication/6961294a-6b9e-4f72-8dc1-98daa56703e9' class='mouseoverHref'>Austin, A.D. & Dangerfield, P.C. 1998. Biology of the <i>Mesostoa kerri</i> Austin and Wharton (Insecta: Hymenoptera: Braconidae: Mesostoinae), an endemic Australian wasp that causes stem galls on <i>Banksia marginata</i> Cav.</a> <!--MARK--><!--MARK--><a href='publication/e54121fc-9302-40bf-b981-7140f31d7a05' class='mouseoverHref'><em>Australian Journal of Botany</em></a> <strong>46</strong>: 559-569<!--MARK-->","","Article in Journal","6961294a-6b9e-4f72-8dc1-98daa56703e9","20081009T05:11:37.000+0000","e54121fc-9302-40bf-b981-7140f31d7a05"
"Austin, A.D. & Wharton, R.A.","1992","New records of subfamilies, tribes and genera of Braconidae (Insecta: Hymenoptera) from Australia, with description of seven new species","41-61","","Transactions of the Royal Society of South Australia","","","","<!--MARK--><a href='publication/2ed141c8-295f-4ecc-bcde-0b91ec859c2e' class='mouseoverHref'>Austin, A.D. & Wharton, R.A. 1992. New records of subfamilies, tribes and genera of Braconidae (Insecta: Hymenoptera) from Australia, with description of seven new species.</a> <!--MARK--><!--MARK--><a href='publication/8b48b0a3-dd7a-4aea-be0d-10a223710ebc' class='mouseoverHref'><em>Transactions of the Royal Society of South Australia</em></a> <strong>116</strong>: 41-61<!--MARK-->","","Article in Journal","2ed141c8-295f-4ecc-bcde-0b91ec859c2e","20081009T05:11:37.000+0000","8b48b0a3-dd7a-4aea-be0d-10a223710ebc"
"Belokobylskij, S.A.","1989","Braconids of the tribe Hormiini (Hymenoptera: Braconidae) of Australia","376-392","","Entomologicheskoe Obozrenie (English translation as Entomological Reviews)","","","","<!--MARK--><a href='publication/a02703f0-a29c-40ea-ad3e-c02c6a94a11f' class='mouseoverHref'>Belokobylskij, S.A. 1989. Braconids of the tribe Hormiini (Hymenoptera: Braconidae) of Australia.</a> <!--MARK--><!--MARK--><a href='publication/f0f3c73b-0eee-4d43-8239-b4de88ed3ef3' class='mouseoverHref'><em>Entomologicheskoe Obozrenie (English translation as Entomological Reviews)</em></a> <strong>68</strong>: 376-392<!--MARK-->","","Article in Journal","a02703f0-a29c-40ea-ad3e-c02c6a94a11f","20081009T05:11:37.000+0000","f0f3c73b-0eee-4d43-8239-b4de88ed3ef3"
"Papp, J.","1993","New braconid wasps (Hymenoptera: Braconidae) in the Hungarian Natural History Museum, 4","155-180","","Annales Historico-Naturales Musei Nationalis Hungarici (Zoologica)","","","","<!--MARK--><a href='publication/ca61385b-ecde-46bb-b687-e1879b85ed23' class='mouseoverHref'>Papp, J. 1993. New braconid wasps (Hymenoptera: Braconidae) in the Hungarian Natural History Museum, 4.</a> <!--MARK--><!--MARK--><a href='publication/e6f35874-0423-4fa1-bf45-655b9047e0c2' class='mouseoverHref'><em>Annales Historico-Naturales Musei Nationalis Hungarici (Zoologica)</em></a> <strong>84</strong>: 155-180<!--MARK-->","","Article in Journal","ca61385b-ecde-46bb-b687-e1879b85ed23","20081009T05:11:37.000+0000","e6f35874-0423-4fa1-bf45-655b9047e0c2"
"Papp, J.","1999","Two new species of <em>Proavga</em> Belokobylskij from Australia (Insecta: Hymenoptera: Braconidae: Hormiinae).","283-288","","Entomologische Abhandlungen. Staatliches Museum für Tierkunde Dresden","","","","<!--MARK--><a href='publication/4907a2bc-bacb-4e48-a7db-3b4a4f3ca8c9' class='mouseoverHref'>Papp, J. 1999. Two new species of <em>Proavga</em> Belokobylskij from Australia (Insecta: Hymenoptera: Braconidae: Hormiinae).</a> <!--MARK--><!--MARK--><a href='publication/6bfb47a9-49a8-491a-9bf4-c7e3b5ba3bc9' class='mouseoverHref'><em>Entomologische Abhandlungen. Staatliches Museum für Tierkunde Dresden</em></a> <strong>58</strong>: 283-288<!--MARK-->","","Article in Journal","4907a2bc-bacb-4e48-a7db-3b4a4f3ca8c9","20130123T05:22:53.576+0000","6bfb47a9-49a8-491a-9bf4-c7e3b5ba3bc9"
"Quicke, D.L. & Huddleston, T.","1989","The Australian braconid wasp subfamily Mesostoinae (Hymenoptera: Braconidae) with the description of a new species of <i>Mesostoa</i>","1309-1317","","Journal of Natural History","","","","<!--MARK--><a href='publication/5fa386bd-2bc3-4640-b389-c7770a11b3fc' class='mouseoverHref'>Quicke, D.L. & Huddleston, T. 1989. The Australian braconid wasp subfamily Mesostoinae (Hymenoptera: Braconidae) with the description of a new species of <i>Mesostoa</i>.</a> <!--MARK--><!--MARK--><a href='publication/ad79edeb-4c47-4124-a7ea-9bcbbce0efa4' class='mouseoverHref'><em>Journal of Natural History</em></a> <strong>23</strong>: 1309-1317<!--MARK-->","","Article in Journal","5fa386bd-2bc3-4640-b389-c7770a11b3fc","20081009T05:11:37.000+0000","ad79edeb-4c47-4124-a7ea-9bcbbce0efa4"
"Tobias, V.I.","1988","A new subfamily of braconids (Hymenoptera: Braconidae) from Australia","644-648","","Entomologicheskoe Obozrenie (English translation as Entomological Reviews)","","","","<!--MARK--><a href='publication/caf20628-6a23-48dc-8e43-280aaa9f8bd6' class='mouseoverHref'>Tobias, V.I. 1988. A new subfamily of braconids (Hymenoptera: Braconidae) from Australia.</a> <!--MARK--><!--MARK--><a href='publication/f0f3c73b-0eee-4d43-8239-b4de88ed3ef3' class='mouseoverHref'><em>Entomologicheskoe Obozrenie (English translation as Entomological Reviews)</em></a> <strong>67</strong>: 644-648<!--MARK-->","","Article in Journal","caf20628-6a23-48dc-8e43-280aaa9f8bd6","20081009T05:11:37.000+0000","f0f3c73b-0eee-4d43-8239-b4de88ed3ef3"
"van Achterberg, C.","1975","A new genus, <i>Mesostoa</i> gen. nov., from W. Australia, belonging to a new subfamily (Hymenoptera: Braconidae)","158-160","","Entomologische Berichten (Amsterdam)","","","","<!--MARK--><a href='publication/a434c054-01e9-471b-bb19-b164a5a520d4' class='mouseoverHref'>van Achterberg, C. 1975. A new genus, <i>Mesostoa</i> gen. nov., from W. Australia, belonging to a new subfamily (Hymenoptera: Braconidae).</a> <!--MARK--><!--MARK--><a href='publication/64444303-afa9-4ecc-b061-09541c96dc49' class='mouseoverHref'><em>Entomologische Berichten (Amsterdam)</em></a> <strong>35</strong>: 158-160<!--MARK-->","","Article in Journal","a434c054-01e9-471b-bb19-b164a5a520d4","20081009T05:11:37.000+0000","64444303-afa9-4ecc-b061-09541c96dc49"
