"PUB_AUTHOR","PUB_YEAR","PUB_TITLE","PUB_PAGES","PUB_PARENT_BOOK_TITLE","PUB_PARENT_JOURNAL_TITLE","PUB_PARENT_ARTICLE_TITLE","PUB_PUBLICATION_DATE","PUB_PUBLISHER","PUB_FORMATTED","PUB_QUALIFICATION","PUB_TYPE","PUBLICATION_GUID","PUBLICATION_LAST_UPDATE","PARENT_PUBLICATION_GUID"
"Carter, H.J.","1929","A check list of the Australian Buprestidae. With tables and keys to sub-families, tribes, and genera (by A. Théry)","265-304","","The Australian Zoologist","","24 Mar 1929","","<!--MARK--><a href='nullffb0f112-a5c2-465a-9d40-0c596d20a3f9' class='mouseoverHref'>Carter, H.J. 1929. A check list of the Australian Buprestidae. With tables and keys to sub-families, tribes, and genera (by A. Théry).</a> <!--MARK--><!--MARK--><a href='null48148530-5362-4b4a-a304-7ea21fe0d6b7' class='mouseoverHref'><em>The Australian Zoologist</em></a> <strong>5</strong>(4): 265-304<!--MARK--> [Date published 24 Mar 1929]","","Article in Journal","ffb0f112-a5c2-465a-9d40-0c596d20a3f9","20130319T03:02:12.553+0000","48148530-5362-4b4a-a304-7ea21fe0d6b7"
"Kerremans, C.","1919","Descriptions de Buprestides nouveaux","41-62","","Annales de la Société Entomologique de Belgique (Comptes-rendus)","","","","<!--MARK--><a href='null9ccbc283-7a40-4af6-9c28-a369d7dcc710' class='mouseoverHref'>Kerremans, C. 1919. Descriptions de Buprestides nouveaux.</a> <!--MARK--><!--MARK--><a href='nullacc7fcdb-707a-4cbe-8f70-d7595ac25c58' class='mouseoverHref'><em>Annales de la Société Entomologique de Belgique (Comptes-rendus)</em></a> <strong>59</strong>: 41-62<!--MARK-->","","Article in Journal","9ccbc283-7a40-4af6-9c28-a369d7dcc710","20081009T05:11:37.000+0000","acc7fcdb-707a-4cbe-8f70-d7595ac25c58"
"Masters, G.","1886","Catalogue of the described Coleoptera of Australia. Part III. Lucanidae and Scarabaeidae","21-126","","Proceedings of the Linnean Society of New South Wales","","","","<!--MARK--><a href='null10ac3176-1b8b-40d1-9acd-fee3dc68231e' class='mouseoverHref'>Masters, G. 1886. Catalogue of the described Coleoptera of Australia. Part III. Lucanidae and Scarabaeidae.</a> <!--MARK--><!--MARK--><a href='nullc12cd779-adb5-41ea-bd2c-75f6864cf22e' class='mouseoverHref'><em>Proceedings of the Linnean Society of New South Wales</em></a> 2 <strong>1</strong>: 21-126<!--MARK-->","","Article in Journal","10ac3176-1b8b-40d1-9acd-fee3dc68231e","20081009T05:11:37.000+0000","c12cd779-adb5-41ea-bd2c-75f6864cf22e"
"Obenberger, J.","1926","Buprestidae 1","1-212","Coleopterorum Catalogus","","","","","<!--MARK--><a href='nullce4c7e37-4680-4c0a-a7c2-37b1ee2dbb8d' class='mouseoverHref'>Obenberger, J. 1926. Buprestidae 1. pp. 1-212</a> <!--MARK--><em>in</em> <!--MARK--><a href='nullb17d5eba-8a82-4bd9-9615-318c36274622' class='mouseoverHref'>W. Junk & S. Schenkling (eds). <em>Coleopterorum Catalogus</em>. Berlin : W. Junk Vol. 84.</a><!--MARK-->","","Chapter in Book","ce4c7e37-4680-4c0a-a7c2-37b1ee2dbb8d","20081009T05:11:37.000+0000","b17d5eba-8a82-4bd9-9615-318c36274622"
"Obenberger, J.","1928","Opuscula Buprestologica I. Beiträge zur Kenntnis der Buprestiden (Col.)","1-350","","Archiv für Naturgeschichte","","","","<!--MARK--><a href='null10629a92-83b4-4b6d-a2df-b5d589aea388' class='mouseoverHref'>Obenberger, J. 1928. Opuscula Buprestologica I. Beiträge zur Kenntnis der Buprestiden (Col.).</a> <!--MARK--><!--MARK--><a href='nullf5b5f7c7-fc53-4502-951d-1c96b680d874' class='mouseoverHref'><em>Archiv für Naturgeschichte</em></a> <strong>92</strong>(9-11): 1-350<!--MARK-->","","Article in Journal","10629a92-83b4-4b6d-a2df-b5d589aea388","20081009T05:11:37.000+0000","f5b5f7c7-fc53-4502-951d-1c96b680d874"
"Saunders, E.","1869","Descriptions of ten new species of <i>Paracupta</i>, H. Deyrolle, and of ten new species of <i>Conognatha</i>, Eschscholtz","311-341","","Journal of the Linnean Society of London, Zoology","","","","<!--MARK--><a href='null1c22a5a3-9e54-482f-84ee-79e2c52520eb' class='mouseoverHref'>Saunders, E. 1869. Descriptions of ten new species of <i>Paracupta</i>, H. Deyrolle, and of ten new species of <i>Conognatha</i>, Eschscholtz.</a> <!--MARK--><!--MARK--><a href='null9da0901d-c795-4d2c-b9ad-d6a85cdf1cce' class='mouseoverHref'><em>Journal of the Linnean Society of London, Zoology</em></a> <strong>10</strong>: 311-341<!--MARK-->","","Article in Journal","1c22a5a3-9e54-482f-84ee-79e2c52520eb","20081009T05:11:37.000+0000","9da0901d-c795-4d2c-b9ad-d6a85cdf1cce"
"Théry, A.","1923","Études sur les Buprestides. (Troisième partie)","193-270","","Annales de la Société Entomologique de Belgique (Comptes-rendus)","","","","<!--MARK--><a href='nulld92c146b-9fcd-4dc4-b5d2-f21457a8371b' class='mouseoverHref'>Théry, A. 1923. Études sur les Buprestides. (Troisième partie).</a> <!--MARK--><!--MARK--><a href='nullacc7fcdb-707a-4cbe-8f70-d7595ac25c58' class='mouseoverHref'><em>Annales de la Société Entomologique de Belgique (Comptes-rendus)</em></a> <strong>52</strong>: 193-270<!--MARK-->","","Article in Journal","d92c146b-9fcd-4dc4-b5d2-f21457a8371b","20081009T05:11:37.000+0000","acc7fcdb-707a-4cbe-8f70-d7595ac25c58"
"Théry, A.","1930","Recherches synonymiques sur les Buprestides et notes diverses. III. A propos de Opuscula Buprestologica","35-53","","Bulletin de la Société des Sciences Naturelles du Maroc (Rabat)","","","","<!--MARK--><a href='null5fdcba8a-ff0b-415d-817a-afc597865958' class='mouseoverHref'>Théry, A. 1930. Recherches synonymiques sur les Buprestides et notes diverses. III. A propos de Opuscula Buprestologica.</a> <!--MARK--><!--MARK--><a href='nullc7d68ece-65db-4be1-8c83-36d84bf458e5' class='mouseoverHref'><em>Bulletin de la Société des Sciences Naturelles du Maroc (Rabat)</em></a> <strong>10</strong>(1-6): 35-53<!--MARK-->","","Article in Journal","5fdcba8a-ff0b-415d-817a-afc597865958","20081009T05:11:37.000+0000","c7d68ece-65db-4be1-8c83-36d84bf458e5"
