"PUB_AUTHOR","PUB_YEAR","PUB_TITLE","PUB_PAGES","PUB_PARENT_BOOK_TITLE","PUB_PARENT_JOURNAL_TITLE","PUB_PARENT_ARTICLE_TITLE","PUB_PUBLICATION_DATE","PUB_PUBLISHER","PUB_FORMATTED","PUB_QUALIFICATION","PUB_TYPE","PUBLICATION_GUID","PUBLICATION_LAST_UPDATE","PARENT_PUBLICATION_GUID"
"Balogh, J. & Mahunka, S.","1969","The zoological results of the Hungarian soil zoological expeditions to South America. 11. Acari: Oribatids from the material of the second expedition, II.","31-69","","Opuscula Zoologica. Budapest","","","","<!--MARK--><a href='null1ebe372c-f7e0-4f48-acd4-9fd56261e4b4' class='mouseoverHref'>Balogh, J. & Mahunka, S. 1969. The zoological results of the Hungarian soil zoological expeditions to South America. 11. Acari: Oribatids from the material of the second expedition, II.</a> <!--MARK--><!--MARK--><a href='nulld4ebd52c-d1ef-4bd2-985a-271b69cc6e8c' class='mouseoverHref'><em>Opuscula Zoologica. Budapest</em></a> <strong>9</strong>: 31-69<!--MARK-->","","Article in Journal","1ebe372c-f7e0-4f48-acd4-9fd56261e4b4","20110306T20:06:55.705+0000","d4ebd52c-d1ef-4bd2-985a-271b69cc6e8c"
"Berlese, A.","1913","Acari nuovi. Manipoli VII-VIII","77-111 pls I-VIII","","Redia. Giornale di entomologia, Firenze","","","","<!--MARK--><a href='null90b09984-20e9-495e-a16b-96382cd79db9' class='mouseoverHref'>Berlese, A. 1913. Acari nuovi. Manipoli VII-VIII.</a> <!--MARK--><!--MARK--><a href='null116966a8-7c23-4f72-a4e3-de1b7b90f1ca' class='mouseoverHref'><em>Redia. Giornale di entomologia, Firenze</em></a> <strong>9</strong>: 77-111 pls I-VIII<!--MARK-->","","Article in Journal","90b09984-20e9-495e-a16b-96382cd79db9","20081009T05:11:37.000+0000","116966a8-7c23-4f72-a4e3-de1b7b90f1ca"
"Beyer, S., Kinnear, A., Hutley, L.B., McGuiness, K. & Gibb, K.","2011","Assessing the relationship between fire and grazing on soil characteristics and mite communities in a semi-arid savanna of northern Australia.","195-200","","Pedobiologia","","","","<!--MARK--><a href='null05b03855-615d-4d65-8e45-cd97634d4887' class='mouseoverHref'>Beyer, S., Kinnear, A., Hutley, L.B., McGuiness, K. & Gibb, K. 2011. Assessing the relationship between fire and grazing on soil characteristics and mite communities in a semi-arid savanna of northern Australia.</a> <!--MARK--><!--MARK--><a href='nulleba6b973-a2e0-493c-89d0-36c63da98a0c' class='mouseoverHref'><em>Pedobiologia</em></a> <strong>54</strong>: 195-200<!--MARK-->","","Article in Journal","05b03855-615d-4d65-8e45-cd97634d4887","20110822T22:41:46.839+0000","eba6b973-a2e0-493c-89d0-36c63da98a0c"
"Colloff, M.J. & Halliday, R.B.","1998","Oribatid Mites: A Catalogue of the Australian Genera and Species","","","","","","CSIRO Publications","<!--MARK--><a href='null2a4418b3-bef9-4b85-83b3-672bf69f3e48' class='mouseoverHref'>Colloff, M.J. & Halliday, R.B. 1998. <em>Oribatid Mites: A Catalogue of the Australian Genera and Species</em>. Melbourne : CSIRO Publications.</a><!--MARK-->","","Book","2a4418b3-bef9-4b85-83b3-672bf69f3e48","20081009T05:11:37.000+0000",""
"Grandjean, F.","1936","<i>Microzetes auxiliaris</i> n. sp. (Oribates)","138-145","","Bulletin du Muséum National d'Histoire Naturelle, Paris","","","","<!--MARK--><a href='nullebc9b88e-9b3c-44b4-a920-6abb9c502cf8' class='mouseoverHref'>Grandjean, F. 1936. <i>Microzetes auxiliaris</i> n. sp. (Oribates).</a> <!--MARK--><!--MARK--><a href='null796711f5-67db-4504-bf92-fda69a7bdc27' class='mouseoverHref'><em>Bulletin du Muséum National d'Histoire Naturelle, Paris</em></a><!--MARK--> [published 1907-1971] <strong>8</strong>: 138-145<!--MARK-->","","Article in Journal","ebc9b88e-9b3c-44b4-a920-6abb9c502cf8","20081009T05:11:37.000+0000","796711f5-67db-4504-bf92-fda69a7bdc27"
"Grandjean, F.","1936","Les Microzetidae n. fam. (Oribates)","60-145","","Bulletin de la Société Zoologique de France","","","","<!--MARK--><a href='null206bc73a-50b6-4a04-a69b-31908dfa2cac' class='mouseoverHref'>Grandjean, F. 1936. Les Microzetidae n. fam. (Oribates).</a> <!--MARK--><!--MARK--><a href='null8dec2bf0-72c6-4775-b21a-2bd0ec166210' class='mouseoverHref'><em>Bulletin de la Société Zoologique de France</em></a> <strong>61</strong>: 60-145<!--MARK-->","","Article in Journal","206bc73a-50b6-4a04-a69b-31908dfa2cac","20081009T05:11:37.000+0000","8dec2bf0-72c6-4775-b21a-2bd0ec166210"
"Hammer, M.","1966","Investigations on the Oribatid fauna of New Zealand. Part I","1-108 pls I-XLV","","Biologiske Skrifter Kongelige Danske Videnskabernes Selskab","","","","<!--MARK--><a href='null6a47e1ac-5746-4b27-a61d-bb19e0bc970c' class='mouseoverHref'>Hammer, M. 1966. Investigations on the Oribatid fauna of New Zealand. Part I.</a> <!--MARK--><!--MARK--><a href='nullf972ce1b-96be-4636-ba91-4c593f351846' class='mouseoverHref'><em>Biologiske Skrifter Kongelige Danske Videnskabernes Selskab</em></a> <strong>15</strong>(2): 1-108 pls I-XLV<!--MARK-->","","Article in Journal","6a47e1ac-5746-4b27-a61d-bb19e0bc970c","20110407T04:14:54.566+0000","f972ce1b-96be-4636-ba91-4c593f351846"
"Heatwole, H., Done, T. & Cameron, E.","1981","Community Ecology of a Coral Cay: A study of One-Tree Island, Great Barrier Reef, Australia","379 pp.","","","","","W. Junk","<!--MARK--><a href='nullcaf46063-5883-4591-83e1-f4e008c0e3db' class='mouseoverHref'>Heatwole, H., Done, T. & Cameron, E. 1981. <em>Community Ecology of a Coral Cay: A study of One-Tree Island, Great Barrier Reef, Australia</em>. The Hague : W. Junk 379 pp.</a><!--MARK-->","","Book","caf46063-5883-4591-83e1-f4e008c0e3db","20081009T05:11:37.000+0000",""
"Hunt, G.S., Colloff, M.J., Dallwitz, M. & Walter, D.E.","1998","An Interactive Key to Oribatid Mites of Australia (CD-ROM)","","","","","","CSIRO Publishing","<!--MARK--><a href='null1d65dff2-89d7-46e4-8f3e-92b14dce5cb6' class='mouseoverHref'>Hunt, G.S., Colloff, M.J., Dallwitz, M. & Walter, D.E. 1998. <em>An Interactive Key to Oribatid Mites of Australia (CD-ROM)</em>. Melbourne : CSIRO Publishing.</a><!--MARK-->","","Book","1d65dff2-89d7-46e4-8f3e-92b14dce5cb6","20081009T05:11:37.000+0000",""
"Longstaff, B.C., Greenslade, P.J.M., Colloff, M., Reid, I., Hart, P. & Packer, I.","1999","Managing Soils in Agriculture. The Impact of Soil Tillage Practices on Soil Fauna.","pp. 65","","","","","Rural Industries Research and Development Corporation Publication No 99/18.","<!--MARK--><a href='nullebcf9d9f-110d-45da-82cb-dd9489f383d5' class='mouseoverHref'>Longstaff, B.C., Greenslade, P.J.M., Colloff, M., Reid, I., Hart, P. & Packer, I. 1999. <em>Managing Soils in Agriculture. The Impact of Soil Tillage Practices on Soil Fauna</em>. Canberra, Australia : Rural Industries Research and Development Corporation Publication No 99/18. pp. 65.</a><!--MARK-->","","Book","ebcf9d9f-110d-45da-82cb-dd9489f383d5","20110306T04:13:45.053+0000",""
"Mahunka, S.","1980","Data to the knowledge of mites preserved in the Berlese Collection (Acari : Tarsonemina, Oribatida). I","377-399","","Acta Zoologica Hungarica","","","","<!--MARK--><a href='null6a38f809-b490-443d-8d06-b95d314c6cf7' class='mouseoverHref'>Mahunka, S. 1980. Data to the knowledge of mites preserved in the Berlese Collection (Acari : Tarsonemina, Oribatida). I.</a> <!--MARK--><!--MARK--><a href='nulla9328cd7-1131-4e41-8965-d8a5d06616d5' class='mouseoverHref'><em>Acta Zoologica Hungarica</em></a> <strong>26</strong>: 377-399<!--MARK-->","","Article in Journal","6a38f809-b490-443d-8d06-b95d314c6cf7","20081009T05:11:37.000+0000","a9328cd7-1131-4e41-8965-d8a5d06616d5"
"Norton, R.A. & Behan-Pelletier, V.M.","2009","Suborder Oribatida.","pp. 430-564","A Manual of Acarology","","","","","<!--MARK--><a href='null25239596-a779-446d-babf-2dd7bd756ae3' class='mouseoverHref'>Norton, R.A. & Behan-Pelletier, V.M. 2009. Suborder Oribatida. pp. 430-564</a> <!--MARK--><em>in</em> <!--MARK--><a href='null4adea5fa-3e8b-4daf-bac9-2ec7aa45d0fd' class='mouseoverHref'>Krantz, G.W. & Walter, D.E. (eds). <em>A Manual of Acarology</em>. Lubbock, Texas : Texas Tech University Press Third edition, 807 pp.</a><!--MARK-->","","Chapter in Book","25239596-a779-446d-babf-2dd7bd756ae3","20110815T06:42:01.810+0000","4adea5fa-3e8b-4daf-bac9-2ec7aa45d0fd"
"Osler, G.H.R.","1997","Factors Contributing to the Structure of Soil Mite Communities","212","","","","","","<!--MARK--><a href='null25d4feb7-b9ed-409a-a458-29b1615b37ff' class='mouseoverHref'>Osler, G.H.R. 1997. Factors Contributing to the Structure of Soil Mite Communities. PhD thesis, Department of Biological Sciences, Macquarie University. 212 pp.</a>","","Miscellaneous","25d4feb7-b9ed-409a-a458-29b1615b37ff","20081009T05:11:37.000+0000",""
"Osler, G.H.R. & Beattie, A.J.","2001","Contribution of oribatid and mesostigmatid soil mites in ecologically based estimates of global species richness.","70-79","","Austral Ecology","","","","<!--MARK--><a href='nullb2504096-727a-407f-a7cc-59223388d7b7' class='mouseoverHref'>Osler, G.H.R. & Beattie, A.J. 2001. Contribution of oribatid and mesostigmatid soil mites in ecologically based estimates of global species richness.</a> <!--MARK--><!--MARK--><a href='nullea6a3d41-24bf-4bfd-a004-5655a7766f60' class='mouseoverHref'><em>Austral Ecology</em></a> <strong>26</strong>: 70-79<!--MARK-->","","Article in Journal","b2504096-727a-407f-a7cc-59223388d7b7","20110512T03:29:02.063+0000","ea6a3d41-24bf-4bfd-a004-5655a7766f60"
"Schatz, H., Behan-Pelletier, V.M., OConnor, B.M. & Norton, R.A.","2011","Suborder Oribatida van der Hammen, 1968","pp. 141-148","Animal Biodiversity: An Outline of Higher-level Classification and Survey of Taxonomic Richness","","","","","<!--MARK--><a href='null4d709354-1aeb-4a05-b77e-512f9f88d767' class='mouseoverHref'>Schatz, H., Behan-Pelletier, V.M., OConnor, B.M. & Norton, R.A. 2011. Suborder Oribatida van der Hammen, 1968. pp. 141-148</a> <!--MARK--><em>in</em> <!--MARK--><a href='nulle1a8af56-51e3-45d8-b610-999291d8a4b3' class='mouseoverHref'>Zhang, Z.-Q. <em>Animal Biodiversity: An Outline of Higher-level Classification and Survey of Taxonomic Richness</em>. Auckland : Magnolia Press.</a><!--MARK-->","","Chapter in Book","4d709354-1aeb-4a05-b77e-512f9f88d767","20120104T21:43:40.185+0000","e1a8af56-51e3-45d8-b610-999291d8a4b3"
"Subias, L.S","February 2011","Listado sistemático, sinonímico y biogeográfico de los ácaros oribátidos (Acariformes: Oribatida) del mundo (excepto fósiles)","","","","","","","<!--MARK--><a href='null455b98a8-2d80-48c8-802d-d3bb671a43a2' class='mouseoverHref'>Subias, L.S February 2011. Listado sistemático, sinonímico y biogeográfico de los ácaros oribátidos (Acariformes: Oribatida) del mundo (excepto fósiles). Departamento de Zoología, Facultad de Biología, Universidad Complutense, Madrid, Spain.</a> <!--MARK--><a href=http://www.ucm.es/info/zoo/Artropodos/Catalogo.pdf>http://www.ucm.es/info/zoo/Artropodos/Catalogo.pdf</a><!--MARK--> [date of access 1 October 2011]","date of access 1 October 2011","URL","455b98a8-2d80-48c8-802d-d3bb671a43a2","20130506T22:20:34.110+0000",""
"Subias, L.S.","2004","Listado sistemático, sinonímico y biogeográfico de los ácaros oribátidos (Acariformes, Oribatida) del mundo (1758-2002)","3-305","","Graellsia","","","","<!--MARK--><a href='null1025f857-904c-4217-82fc-6f20ce369867' class='mouseoverHref'>Subias, L.S. 2004. Listado sistemático, sinonímico y biogeográfico de los ácaros oribátidos (Acariformes, Oribatida) del mundo (1758-2002).</a> <!--MARK--><!--MARK--><a href='nullc9daaa4a-6f88-40d8-bc44-a8d2e4313ed3' class='mouseoverHref'><em>Graellsia</em></a> <strong>60 (Supplement)</strong>: 3-305<!--MARK-->","","Article in Journal","1025f857-904c-4217-82fc-6f20ce369867","20130506T05:01:31.443+0000","c9daaa4a-6f88-40d8-bc44-a8d2e4313ed3"
"Walter, D.E. & Stirling, G.R.","2018","Microarthropods in Australian sugarcane soils: A survey with emphasis on the Mesostigmata as potential regulators of nematode populations.","673-682.","","Acarologia","","","","<!--MARK--><a href='null548c11c4-d3b1-44b4-8972-9ea6cc81104a' class='mouseoverHref'>Walter, D.E. & Stirling, G.R. 2018. Microarthropods in Australian sugarcane soils: A survey with emphasis on the Mesostigmata as potential regulators of nematode populations.</a> <!--MARK--><!--MARK--><a href='nullca52b0dd-4050-4ed0-b7a9-fad0329897d3' class='mouseoverHref'><em>Acarologia</em></a> <strong>58</strong>: 673-682.<!--MARK-->","","Article in Journal","548c11c4-d3b1-44b4-8972-9ea6cc81104a","20190806T20:45:47.120+0000","ca52b0dd-4050-4ed0-b7a9-fad0329897d3"
