"PUB_AUTHOR","PUB_YEAR","PUB_TITLE","PUB_PAGES","PUB_PARENT_BOOK_TITLE","PUB_PARENT_JOURNAL_TITLE","PUB_PARENT_ARTICLE_TITLE","PUB_PUBLICATION_DATE","PUB_PUBLISHER","PUB_FORMATTED","PUB_QUALIFICATION","PUB_TYPE","PUBLICATION_GUID","PUBLICATION_LAST_UPDATE","PARENT_PUBLICATION_GUID"
"Hoffmann, A.","1958","Coléoptères Curculionides (Troisième Partie).","1209-1839","","Faune de France","","31-XII-1958","","<!--MARK--><a href='nulld56d7434-789d-48f8-950f-c918204a20ba' class='mouseoverHref'>Hoffmann, A. 1958. Coléoptères Curculionides (Troisième Partie).</a> <!--MARK--><!--MARK--><a href='null61be3d3c-669c-4c21-834d-9c4a47182fc0' class='mouseoverHref'><em>Faune de France</em></a> <strong>62</strong>: 1209-1839<!--MARK--> [Date published 31-XII-1958]","","Article in Journal","d56d7434-789d-48f8-950f-c918204a20ba","20120403T05:16:38.764+0000","61be3d3c-669c-4c21-834d-9c4a47182fc0"
"Hombron, J.B. & Jacquinot, H.","1847","Voyage au Pole Sud et dans l'Océanie sur les corvettes l'Astrolabe et la Zélée; exécuté par ordre du Roi pendant les années 1837-1828-1839-1840, sous le commandement de M. J. Dumont d'Urville, capitaine de vaisseau; publié par ordre du government, sous la direction supérieure de M. Jacquinot, capitaine de vasseau, commandant de la Zélée. Vingt-deuxième livraison. Atlas d'Histoire Naturelle.","[total page number not cited]","","","","","Gide & Baudry","<!--MARK--><a href='null52ab166d-0760-45d8-a62c-8339ac2c6cc8' class='mouseoverHref'>Hombron, J.B. & Jacquinot, H. 1847. <em>Voyage au Pole Sud et dans l'Océanie sur les corvettes l'Astrolabe et la Zélée; exécuté par ordre du Roi pendant les années 1837-1828-1839-1840, sous le commandement de M. J. Dumont d'Urville, capitaine de vaisseau; publié par ordre du government, sous la direction supérieure de M. Jacquinot, capitaine de vasseau, commandant de la Zélée. Vingt-deuxième livraison. Atlas d'Histoire Naturelle</em>. Paris : Gide & Baudry [total page number not cited].</a><!--MARK-->","","Book","52ab166d-0760-45d8-a62c-8339ac2c6cc8","20150408T01:26:59.103+0000",""
"Hsiao, Y., & Oberprieler, R.","2021","A review of <i>Paratranes</i> Zimmerman, 1994, Xanthorrhoea-associated weevils of the <i>Tranes</i> group (Coleoptera, Curculionidae, Molytinae), with description of a new species","117-141","","European Journal of Taxonomy","","","","<!--MARK--><a href='null6e883711-a549-4ee1-87c1-a6fbe552084d' class='mouseoverHref'>Hsiao, Y., & Oberprieler, R. 2021. A review of <i>Paratranes</i> Zimmerman, 1994, Xanthorrhoea-associated weevils of the <i>Tranes</i> group (Coleoptera, Curculionidae, Molytinae), with description of a new species.</a> <!--MARK--><!--MARK--><a href='null6dbc3a34-1a0d-48d3-b2f8-fce03fe08895' class='mouseoverHref'><em>European Journal of Taxonomy</em></a> <strong>767</strong>: 117-141<!--MARK-->","","Article in Journal","6e883711-a549-4ee1-87c1-a6fbe552084d","20220607T00:19:56.721+0000","6dbc3a34-1a0d-48d3-b2f8-fce03fe08895"
"Hubenthal, W.","1917","Beiträge zur Kenntnis der Curculioniden-Gattung <I>Acicnemis </I>Lacordaire (Col.).","92-160; 9: 53-155","","Arkiv für Naturgeschichte, Berlin","","","","<!--MARK--><a href='null6f45de93-0b3a-4b80-ad00-8a2fdd87cec5' class='mouseoverHref'>Hubenthal, W. 1917. Beiträge zur Kenntnis der Curculioniden-Gattung <I>Acicnemis </I>Lacordaire (Col.).</a> <!--MARK--><!--MARK--><a href='nullef787a14-3fdb-4a11-80b3-ff5fa376524e' class='mouseoverHref'><em>Arkiv für Naturgeschichte, Berlin</em></a> <strong>83</strong>((A)8): 92-160; 9: 53-155<!--MARK-->","","Article in Journal","6f45de93-0b3a-4b80-ad00-8a2fdd87cec5","","ef787a14-3fdb-4a11-80b3-ff5fa376524e"
"Hustache, A.","1934","Un Curculionide [Col.] nouveau de l'Ile de Elbe","250-253","","Bulletin de la Société Entomologique de France","","","","<!--MARK--><a href='nullcd55f67c-81a1-44b9-99a1-d02c821cfede' class='mouseoverHref'>Hustache, A. 1934. Un Curculionide [Col.] nouveau de l'Ile de Elbe.</a> <!--MARK--><!--MARK--><a href='null7853f77c-aa1b-42ec-bc2c-9758f7ff72c7' class='mouseoverHref'><em>Bulletin de la Société Entomologique de France</em></a> <strong>39</strong>: 250-253<!--MARK-->","","Article in Journal","cd55f67c-81a1-44b9-99a1-d02c821cfede","20121210T03:42:34.968+0000","7853f77c-aa1b-42ec-bc2c-9758f7ff72c7"
"Hustache, A.","1936","Curculionidae: Cryptorrhynchinae.","1-317","","Coleopterorum Catalogus","","15-XII-1936","","<!--MARK--><a href='null431b37db-730f-415d-85de-9bde549f6a4f' class='mouseoverHref'>Hustache, A. 1936. Curculionidae: Cryptorrhynchinae.</a> <!--MARK--><!--MARK--><a href='null2e5a4d68-569d-431e-a9a7-382557a2d5cb' class='mouseoverHref'><em>Coleopterorum Catalogus</em></a> <strong>151</strong>: 1-317<!--MARK--> [Date published 15-XII-1936]","","Article in Journal","431b37db-730f-415d-85de-9bde549f6a4f","20120117T05:59:49.998+0000","2e5a4d68-569d-431e-a9a7-382557a2d5cb"
"Hustache, A.","1937","Curculionides du Congo.","181-260","","Revue de Zoologie et de Botanique Africaines","","23-XII-1937","","<!--MARK--><a href='nullfb92220c-961c-4c4b-b3c5-d476809f5ada' class='mouseoverHref'>Hustache, A. 1937. Curculionides du Congo.</a> <!--MARK--><!--MARK--><a href='null1d82d934-7b0c-4e56-93e8-eb7594a06062' class='mouseoverHref'><em>Revue de Zoologie et de Botanique Africaines</em></a> <strong>30</strong>(2): 181-260<!--MARK--> [Date published 23-XII-1937]","","Article in Journal","fb92220c-961c-4c4b-b3c5-d476809f5ada","20110914T04:01:19.583+0000","1d82d934-7b0c-4e56-93e8-eb7594a06062"
"Hustache, A.","1937","Magdalinae (Coleoptera, Curculionidae) de l'Amérique meridionale.","198-248","","Annals and Magazine of Natural History","","","","<!--MARK--><a href='null85bdd2ac-eb5c-4b9b-9322-248058f8190a' class='mouseoverHref'>Hustache, A. 1937. Magdalinae (Coleoptera, Curculionidae) de l'Amérique meridionale.</a> <!--MARK--><!--MARK--><a href='nullefa8de69-3a29-4a43-8ef2-cbefda205976' class='mouseoverHref'><em>Annals and Magazine of Natural History</em></a> X <strong>19</strong>: 198-248<!--MARK-->","","Article in Journal","85bdd2ac-eb5c-4b9b-9322-248058f8190a","","efa8de69-3a29-4a43-8ef2-cbefda205976"
"Janczyk, F.","1957","Neue Curculioniden der Zoologischen sammlung des Naturhistorischen Museums.","241-248, figs 1-7","","Annalen des Naturhistorischen Museums in Wien","","","","<!--MARK--><a href='null252872dc-9220-418a-b39c-d8cdeb1f6e3f' class='mouseoverHref'>Janczyk, F. 1957. Neue Curculioniden der Zoologischen sammlung des Naturhistorischen Museums.</a> <!--MARK--><!--MARK--><a href='null023544c0-c209-4238-9c74-43207e27f1ce' class='mouseoverHref'><em>Annalen des Naturhistorischen Museums in Wien</em></a> <strong>61</strong>: 241-248, figs 1-7<!--MARK-->","","Article in Journal","252872dc-9220-418a-b39c-d8cdeb1f6e3f","20111129T23:51:26.331+0000","023544c0-c209-4238-9c74-43207e27f1ce"
"Janczyk, F.","1959","Neue Curculioniden der Zoologischen Abteilung des Naturhistorischen Museums.","430-435","","Annalen des Naturhistorischen Museums in Wien","","","","<!--MARK--><a href='nulla20dd578-90e3-476a-9b67-ecead4742cba' class='mouseoverHref'>Janczyk, F. 1959. Neue Curculioniden der Zoologischen Abteilung des Naturhistorischen Museums.</a> <!--MARK--><!--MARK--><a href='null023544c0-c209-4238-9c74-43207e27f1ce' class='mouseoverHref'><em>Annalen des Naturhistorischen Museums in Wien</em></a> <strong>63</strong>: 430-435<!--MARK-->","","Article in Journal","a20dd578-90e3-476a-9b67-ecead4742cba","20111129T23:50:47.807+0000","023544c0-c209-4238-9c74-43207e27f1ce"
"Janczyk, F.","1966","Ein neuer <I>Laemosaccus </I>aus Neu-SudWales (Australien).","213-214, figs 1-2","","Annalen des Naturhistorischen Museums in Wien","","","","<!--MARK--><a href='nullf66bf0ff-7908-41f5-8103-1183dd5ed4ed' class='mouseoverHref'>Janczyk, F. 1966. Ein neuer <I>Laemosaccus </I>aus Neu-SudWales (Australien).</a> <!--MARK--><!--MARK--><a href='null023544c0-c209-4238-9c74-43207e27f1ce' class='mouseoverHref'><em>Annalen des Naturhistorischen Museums in Wien</em></a> <strong>63</strong>: 213-214, figs 1-2<!--MARK-->","","Article in Journal","f66bf0ff-7908-41f5-8103-1183dd5ed4ed","20111129T23:51:42.358+0000","023544c0-c209-4238-9c74-43207e27f1ce"
"Jekel, H.","1873","Coleoptera Jekeliana, adjecta eleutheratorum bibliotheca. Énumeration systématique & synonymique des Coléoptères européens & exotiques composant la collection de Henri Jekel. Observations critiques, descriptions d'espèces nouvelles.","96 pp.","","","","","E. Deyrolle fils","<!--MARK--><a href='null4868f79f-9d4d-4ceb-bc3a-cc94a083e502' class='mouseoverHref'>Jekel, H. 1873. <em>Coleoptera Jekeliana, adjecta eleutheratorum bibliotheca. Énumeration systématique & synonymique des Coléoptères européens & exotiques composant la collection de Henri Jekel. Observations critiques, descriptions d'espèces nouvelles</em>. Paris : E. Deyrolle fils 96 pp.</a><!--MARK-->","","Book","4868f79f-9d4d-4ceb-bc3a-cc94a083e502","20111003T23:20:33.259+0000",""
"Kirsch, Th.","1877","Beitrag zur Kenntniss der Coleopteren-fauna von Neu Guinea.","137-161","","Mitteilungen aus dem K. Zoologischen museum zu Dresden","","","","<!--MARK--><a href='nullf630bee2-3976-4bc8-bb6f-44469de57662' class='mouseoverHref'>Kirsch, Th. 1877. Beitrag zur Kenntniss der Coleopteren-fauna von Neu Guinea.</a> <!--MARK--><!--MARK--><a href='null482f45ab-7e29-4a8a-8185-6a9976041289' class='mouseoverHref'><em>Mitteilungen aus dem K. Zoologischen museum zu Dresden</em></a> <strong>2</strong>: 137-161<!--MARK-->","","Article in Journal","f630bee2-3976-4bc8-bb6f-44469de57662","","482f45ab-7e29-4a8a-8185-6a9976041289"
"Klima, A.","1934","Gymnetrinae","1-68","","Coleopterorum Catalogus","","30-V-1934","","<!--MARK--><a href='nulld151f6f2-5ff6-4c12-85ad-58127159212d' class='mouseoverHref'>Klima, A. 1934. Gymnetrinae.</a> <!--MARK--><!--MARK--><a href='null2e5a4d68-569d-431e-a9a7-382557a2d5cb' class='mouseoverHref'><em>Coleopterorum Catalogus</em></a> <strong>135</strong>(Gymnetrinae): 1-68<!--MARK--> [Date published 30-V-1934]","","Article in Journal","d151f6f2-5ff6-4c12-85ad-58127159212d","20120329T20:49:39.310+0000","2e5a4d68-569d-431e-a9a7-382557a2d5cb"
"Kôno, H.","1929","Die Cleoninen Japans (Col., Curc.)","49-63","","Insecta Matsumurana","","","","<!--MARK--><a href='null98828cad-3222-4c40-bcdb-d73314248fe5' class='mouseoverHref'>Kôno, H. 1929. Die Cleoninen Japans (Col., Curc.).</a> <!--MARK--><!--MARK--><a href='nullee98a19d-8f14-4966-84fe-0688bb1a97f5' class='mouseoverHref'><em>Insecta Matsumurana</em></a> <strong>4</strong>(1-2): 49-63<!--MARK-->","","Article in Journal","98828cad-3222-4c40-bcdb-d73314248fe5","20120905T03:33:47.090+0000","ee98a19d-8f14-4966-84fe-0688bb1a97f5"
"Kuschel, G.","1972","The Australian Phrynixinae.","209-231, figs 1-53","","New Zealand Journal of Science","","","","<!--MARK--><a href='null3aab83d1-2321-4116-bbfc-ebb6f34704cb' class='mouseoverHref'>Kuschel, G. 1972. The Australian Phrynixinae.</a> <!--MARK--><!--MARK--><a href='null7ed29f42-7cc6-4afd-8b74-710847db4a17' class='mouseoverHref'><em>New Zealand Journal of Science</em></a> <strong>15</strong>(2): 209-231, figs 1-53<!--MARK-->","","Article in Journal","3aab83d1-2321-4116-bbfc-ebb6f34704cb","","7ed29f42-7cc6-4afd-8b74-710847db4a17"
"Kuschel, G.","1972","The foreign Curculionoidea established in New Zealand (Insecta: Coleoptera)","273-289","","New Zealand Journal of Science","","Sept. 1972","","<!--MARK--><a href='nullb54fd619-57ef-4685-9dd3-5bc79e3490f5' class='mouseoverHref'>Kuschel, G. 1972. The foreign Curculionoidea established in New Zealand (Insecta: Coleoptera).</a> <!--MARK--><!--MARK--><a href='null7ed29f42-7cc6-4afd-8b74-710847db4a17' class='mouseoverHref'><em>New Zealand Journal of Science</em></a> <strong>15</strong>(3): 273-289<!--MARK--> [Date published Sept. 1972]","","Article in Journal","b54fd619-57ef-4685-9dd3-5bc79e3490f5","20110921T22:56:25.285+0000","7ed29f42-7cc6-4afd-8b74-710847db4a17"
"Kuschel, G.","2008","Curculionoidea (weevils) of New Caledonia and Vanuatu: basal families and some Curculionidae.","pp. 99-249","","Mémoires du Muséum national d'Histoire naturelle, Paris","Zoologia Neocaledonica 6. Biodiversity studies in New Caledonia.","","","<!--MARK--><a href='null84b82367-c506-4da2-8602-153cae7d8f93' class='mouseoverHref'>Kuschel, G. 2008. Curculionoidea (weevils) of New Caledonia and Vanuatu: basal families and some Curculionidae. pp. 99-249</a> <!--MARK--><em>in</em> <!--MARK--><a href='null32cd27f6-238f-4f51-83d3-ab5786046295' class='mouseoverHref'>Grandcolas, P. (ed.). Zoologia Neocaledonica 6. Biodiversity studies in New Caledonia.</a> <!--MARK--><!--MARK--><a href='null93c2cf00-5323-4c6b-85b2-9b9ff8e2dfb9' class='mouseoverHref'><em>Mémoires du Muséum national d'Histoire naturelle, Paris</em></a><!--MARK--> [1936-1950] <strong>197.</strong><!--MARK-->","","Section in Article","84b82367-c506-4da2-8602-153cae7d8f93","20111019T06:50:51.790+0000","32cd27f6-238f-4f51-83d3-ab5786046295"
"Lacordaire, T.","1863","Histoire naturelle des insectes. Genera des Coléoptères ou exposé méthodique et critique de tous les genres proposés jusqu'ici dans cet ordre d'insectes.","637 pp.","","","","","Roret","<!--MARK--><a href='null110e2184-bf64-43f0-b8d5-75dd9c1174b8' class='mouseoverHref'>Lacordaire, T. 1863. <em>Histoire naturelle des insectes. Genera des Coléoptères ou exposé méthodique et critique de tous les genres proposés jusqu'ici dans cet ordre d'insectes</em>. Paris : Roret Vol. 6 637 pp.</a><!--MARK-->","","Book","110e2184-bf64-43f0-b8d5-75dd9c1174b8","20110920T00:39:15.512+0000",""
"Latreille, P.A.","1804","Histoire naturelle, Générale et Particulière, des Crustacés et des Insectes. Ouvrage faisant suite aux ?uvres de Leclerc de Buffon et partie du cours complet d'Histoire naturelle rédigé p. C.S. Sonnini","422 pp., pls 91-93","","","","","Dufart","<!--MARK--><a href='null08fe3ca3-7270-4c3d-a62a-b4153239cfdc' class='mouseoverHref'>Latreille, P.A. 1804. <em>Histoire naturelle, Générale et Particulière, des Crustacés et des Insectes. Ouvrage faisant suite aux ?uvres de Leclerc de Buffon et partie du cours complet d'Histoire naturelle rédigé p. C.S. Sonnini</em>. Paris : Dufart Vol. 11 422 pp., pls 91-93.</a><!--MARK-->","","Book","08fe3ca3-7270-4c3d-a62a-b4153239cfdc","20120905T03:26:40.374+0000",""
"Lea, A.M.","1896","Descriptions of new species of Australian Coleoptera. Part III","284-319","","Proceedings of the Linnean Society of New South Wales","","","","<!--MARK--><a href='nullb42981f9-9327-4ac8-8c53-70bf4bdd2d44' class='mouseoverHref'>Lea, A.M. 1896. Descriptions of new species of Australian Coleoptera. Part III.</a> <!--MARK--><!--MARK--><a href='nullc12cd779-adb5-41ea-bd2c-75f6864cf22e' class='mouseoverHref'><em>Proceedings of the Linnean Society of New South Wales</em></a> <strong>21</strong>: 284-319<!--MARK-->","","Article in Journal","b42981f9-9327-4ac8-8c53-70bf4bdd2d44","","c12cd779-adb5-41ea-bd2c-75f6864cf22e"
"Lea, A.M.","1898","Descriptions of new species of Australian Coleoptera. Part IV","584-638","","Proceedings of the Linnean Society of New South Wales","","11 February 1898","","<!--MARK--><a href='null5afe376c-8d2e-46ec-92db-4d24247df7a8' class='mouseoverHref'>Lea, A.M. 1898. Descriptions of new species of Australian Coleoptera. Part IV.</a> <!--MARK--><!--MARK--><a href='nullc12cd779-adb5-41ea-bd2c-75f6864cf22e' class='mouseoverHref'><em>Proceedings of the Linnean Society of New South Wales</em></a> <strong>22[1897]</strong>: 584-638<!--MARK--> [Date published 11 February 1898]","","Article in Journal","5afe376c-8d2e-46ec-92db-4d24247df7a8","20140211T04:06:26.196+0000","c12cd779-adb5-41ea-bd2c-75f6864cf22e"
"Lea, A.M.","1899","Descriptions of new species of Australian Coleoptera. Part V","521-645","","Proceedings of the Linnean Society of New South Wales","","19 May, 1899","","<!--MARK--><a href='null66883ae1-9a29-4e7d-b46b-212452a918d4' class='mouseoverHref'>Lea, A.M. 1899. Descriptions of new species of Australian Coleoptera. Part V.</a> <!--MARK--><!--MARK--><a href='nullc12cd779-adb5-41ea-bd2c-75f6864cf22e' class='mouseoverHref'><em>Proceedings of the Linnean Society of New South Wales</em></a> <strong>23</strong>(4): 521-645<!--MARK--> [Date published 19 May, 1899: dated 1898]","dated 1898","Article in Journal","66883ae1-9a29-4e7d-b46b-212452a918d4","20150126T21:41:02.944+0000","c12cd779-adb5-41ea-bd2c-75f6864cf22e"
"Lea, A.M.","1899","Revision of the Australian Curculionidae belonging to the subfamily Cryptorhynchides. Part III","200-270","","Proceedings of the Linnean Society of New South Wales","","","","<!--MARK--><a href='nullcf20f1da-ed26-4f3f-9214-6b88ed3346a9' class='mouseoverHref'>Lea, A.M. 1899. Revision of the Australian Curculionidae belonging to the subfamily Cryptorhynchides. Part III.</a> <!--MARK--><!--MARK--><a href='nullc12cd779-adb5-41ea-bd2c-75f6864cf22e' class='mouseoverHref'><em>Proceedings of the Linnean Society of New South Wales</em></a> <strong>24</strong>: 200-270<!--MARK-->","","Article in Journal","cf20f1da-ed26-4f3f-9214-6b88ed3346a9","20111115T00:17:00.897+0000","c12cd779-adb5-41ea-bd2c-75f6864cf22e"
"Lea, A.M.","1900","Revision of the Australian Curculionidae belonging to the subfamily Cryptorhynchides. Part IV","522-546","","Proceedings of the Linnean Society of New South Wales","","7 April 1900","","<!--MARK--><a href='nulladde4e3e-81e7-4673-b391-8be1f6b203d2' class='mouseoverHref'>Lea, A.M. 1900. Revision of the Australian Curculionidae belonging to the subfamily Cryptorhynchides. Part IV.</a> <!--MARK--><!--MARK--><a href='nullc12cd779-adb5-41ea-bd2c-75f6864cf22e' class='mouseoverHref'><em>Proceedings of the Linnean Society of New South Wales</em></a> <strong>24</strong>(4): 522-546<!--MARK--> [Date published 7 April 1900]","","Article in Journal","adde4e3e-81e7-4673-b391-8be1f6b203d2","20111115T00:17:28.160+0000","c12cd779-adb5-41ea-bd2c-75f6864cf22e"
"Lea, A.M.","1905","Descriptions of Australian Curculionidae, with notes on previously described species. Part III.","209-236","","Transactions of the Royal Society of South Australia","","","","<!--MARK--><a href='null9b14be63-2c03-4b48-a0db-4dea105bd221' class='mouseoverHref'>Lea, A.M. 1905. Descriptions of Australian Curculionidae, with notes on previously described species. Part III.</a> <!--MARK--><!--MARK--><a href='null8b48b0a3-dd7a-4aea-be0d-10a223710ebc' class='mouseoverHref'><em>Transactions of the Royal Society of South Australia</em></a> <strong>29</strong>: 209-236<!--MARK-->","","Article in Journal","9b14be63-2c03-4b48-a0db-4dea105bd221","20120111T23:52:08.480+0000","8b48b0a3-dd7a-4aea-be0d-10a223710ebc"
"Lea, A.M.","1906","Descriptions of Australian Curculionidae, with notes on previously described species. Part IV.","71-103","","Transactions of the Royal Society of South Australia","","","","<!--MARK--><a href='null212334f0-fbdc-4348-ae5e-2c37f6a90d38' class='mouseoverHref'>Lea, A.M. 1906. Descriptions of Australian Curculionidae, with notes on previously described species. Part IV.</a> <!--MARK--><!--MARK--><a href='null8b48b0a3-dd7a-4aea-be0d-10a223710ebc' class='mouseoverHref'><em>Transactions of the Royal Society of South Australia</em></a> <strong>30</strong>: 71-103<!--MARK-->","","Article in Journal","212334f0-fbdc-4348-ae5e-2c37f6a90d38","","8b48b0a3-dd7a-4aea-be0d-10a223710ebc"
"Lea, A.M.","1907","Revision of the Australian Curculionidae belonging to the subfamily Cryptorhynchides. Part VIII.","400-430","","Proceedings of the Linnean Society of New South Wales","","","","<!--MARK--><a href='null585a78fd-c49f-42b9-bb1e-aaaa1116fc5a' class='mouseoverHref'>Lea, A.M. 1907. Revision of the Australian Curculionidae belonging to the subfamily Cryptorhynchides. Part VIII.</a> <!--MARK--><!--MARK--><a href='nullc12cd779-adb5-41ea-bd2c-75f6864cf22e' class='mouseoverHref'><em>Proceedings of the Linnean Society of New South Wales</em></a> <strong>32</strong>: 400-430<!--MARK-->","","Article in Journal","585a78fd-c49f-42b9-bb1e-aaaa1116fc5a","","c12cd779-adb5-41ea-bd2c-75f6864cf22e"
"Lea, A.M.","1908","Notes on the Australian Curculionidae in the Belgian Museum with descriptions of new species. Part I.","127-186","","Mémoires de la Société Entomologique de Belgique","","","","<!--MARK--><a href='null378aab9e-b23a-42ff-918d-3907f2d33aff' class='mouseoverHref'>Lea, A.M. 1908. Notes on the Australian Curculionidae in the Belgian Museum with descriptions of new species. Part I.</a> <!--MARK--><!--MARK--><a href='null919e8bdf-0a87-4070-9049-04f444aeaa06' class='mouseoverHref'><em>Mémoires de la Société Entomologique de Belgique</em></a> <strong>16</strong>: 127-186<!--MARK-->","","Article in Journal","378aab9e-b23a-42ff-918d-3907f2d33aff","","919e8bdf-0a87-4070-9049-04f444aeaa06"
"Lea, A.M.","1908","The Coleoptera of King Island, Bass Strait","143-207","","Proceedings of the Royal Society of Victoria","","March 31, 1908","","<!--MARK--><a href='nullaca8db12-97f7-4def-a94b-a5753851df67' class='mouseoverHref'>Lea, A.M. 1908. The Coleoptera of King Island, Bass Strait.</a> <!--MARK--><!--MARK--><a href='nullce333794-3a02-427f-ba27-346079f1efa0' class='mouseoverHref'><em>Proceedings of the Royal Society of Victoria</em></a> n.s. <strong>20</strong>(2): 143-207<!--MARK--> [Date published March 31, 1908]","","Article in Journal","aca8db12-97f7-4def-a94b-a5753851df67","20120515T22:43:08.476+0000","ce333794-3a02-427f-ba27-346079f1efa0"
"Lea, A.M.","1909","Curculionidae from various parts of Australia.","193-203","","Mitteilungen aus dem Naturhistorischen Museum in Hamburg","","","","<!--MARK--><a href='null360e4d00-774c-446a-bca8-e04f4b8cbe0c' class='mouseoverHref'>Lea, A.M. 1909. Curculionidae from various parts of Australia.</a> <!--MARK--><!--MARK--><a href='null4cda25cf-3a79-4c6d-9438-24f6cf8a82de' class='mouseoverHref'><em>Mitteilungen aus dem Naturhistorischen Museum in Hamburg</em></a> <strong>26</strong>(2. Beiheft): 193-203<!--MARK-->","","Article in Journal","360e4d00-774c-446a-bca8-e04f4b8cbe0c","","4cda25cf-3a79-4c6d-9438-24f6cf8a82de"
"Lea, A.M.","1909","Descriptions of Australian Curculionidae, with notes on previously described species. Part VII","145-196","","Transactions of the Royal Society of South Australia","","","","<!--MARK--><a href='null3a150afb-e961-47ef-9c1c-403c2297e86b' class='mouseoverHref'>Lea, A.M. 1909. Descriptions of Australian Curculionidae, with notes on previously described species. Part VII.</a> <!--MARK--><!--MARK--><a href='null8b48b0a3-dd7a-4aea-be0d-10a223710ebc' class='mouseoverHref'><em>Transactions of the Royal Society of South Australia</em></a> <strong>33</strong>: 145-196<!--MARK-->","","Article in Journal","3a150afb-e961-47ef-9c1c-403c2297e86b","20120111T23:17:08.885+0000","8b48b0a3-dd7a-4aea-be0d-10a223710ebc"
"Lea, A.M.","1909","Revision of the Australian Curculionidae belonging to the subfamily Cryptorhynchides. Part IX.","701-732","","Proceedings of the Linnean Society of New South Wales","","11 March 1909","","<!--MARK--><a href='nullf675e600-6ded-4a9b-a84b-e9975a940a5a' class='mouseoverHref'>Lea, A.M. 1909. Revision of the Australian Curculionidae belonging to the subfamily Cryptorhynchides. Part IX.</a> <!--MARK--><!--MARK--><a href='nullc12cd779-adb5-41ea-bd2c-75f6864cf22e' class='mouseoverHref'><em>Proceedings of the Linnean Society of New South Wales</em></a> <strong>33</strong>: 701-732<!--MARK--> [Date published 11 March 1909]","","Article in Journal","f675e600-6ded-4a9b-a84b-e9975a940a5a","20110928T01:06:23.010+0000","c12cd779-adb5-41ea-bd2c-75f6864cf22e"
"Lea, A.M.","1910","Notes on Australian Curculionidae in the collection of the German Entomological National Museum of Berlin (Col.).","153-172; 505-526","","Deutsche Entomologische Zeitschrift","","","","<!--MARK--><a href='null5d6a1b78-9af3-416c-94a0-c27e8aac3fb4' class='mouseoverHref'>Lea, A.M. 1910. Notes on Australian Curculionidae in the collection of the German Entomological National Museum of Berlin (Col.).</a> <!--MARK--><!--MARK--><a href='nullbdeb8163-7175-47c9-be9b-28f797c57745' class='mouseoverHref'><em>Deutsche Entomologische Zeitschrift</em></a> <strong>1910</strong>: 153-172; 505-526<!--MARK-->","","Article in Journal","5d6a1b78-9af3-416c-94a0-c27e8aac3fb4","","bdeb8163-7175-47c9-be9b-28f797c57745"
"Lea, A.M.","1911","Descriptions of Australian Curculionidae, with notes on previously described species. Part IX","62-88","","Transactions of the Royal Society of South Australia","","","","<!--MARK--><a href='null314c7efe-1c94-43d8-b890-b3c186d063c4' class='mouseoverHref'>Lea, A.M. 1911. Descriptions of Australian Curculionidae, with notes on previously described species. Part IX.</a> <!--MARK--><!--MARK--><a href='null8b48b0a3-dd7a-4aea-be0d-10a223710ebc' class='mouseoverHref'><em>Transactions of the Royal Society of South Australia</em></a> <strong>35</strong>: 62-88<!--MARK-->","","Article in Journal","314c7efe-1c94-43d8-b890-b3c186d063c4","20120111T23:54:28.691+0000","8b48b0a3-dd7a-4aea-be0d-10a223710ebc"
"Lea, A.M.","1911","Notes on Australian Curculionidae in the Belgian Museum, with descriptions of new species. Part 2","61-127","","Mémoires de la Société Entomologique de Belgique","","","","<!--MARK--><a href='null187c8673-68d1-41d2-a6d5-9d49c0ae6943' class='mouseoverHref'>Lea, A.M. 1911. Notes on Australian Curculionidae in the Belgian Museum, with descriptions of new species. Part 2.</a> <!--MARK--><!--MARK--><a href='null919e8bdf-0a87-4070-9049-04f444aeaa06' class='mouseoverHref'><em>Mémoires de la Société Entomologique de Belgique</em></a> <strong>18</strong>: 61-127<!--MARK-->","","Article in Journal","187c8673-68d1-41d2-a6d5-9d49c0ae6943","20120524T05:37:52.418+0000","919e8bdf-0a87-4070-9049-04f444aeaa06"
