"PUB_AUTHOR","PUB_YEAR","PUB_TITLE","PUB_PAGES","PUB_PARENT_BOOK_TITLE","PUB_PARENT_JOURNAL_TITLE","PUB_PARENT_ARTICLE_TITLE","PUB_PUBLICATION_DATE","PUB_PUBLISHER","PUB_FORMATTED","PUB_QUALIFICATION","PUB_TYPE","PUBLICATION_GUID","PUBLICATION_LAST_UPDATE","PARENT_PUBLICATION_GUID"
"Pascoe, F.P.","1870","Contributions towards a knowledge of the Curculionidae.","434-493, pls 17-19","","Journal of the Linnean Society of London, Zoology","","","","<!--MARK--><a href='null561395cc-5bb6-4354-afc5-fce440bf838b' class='mouseoverHref'>Pascoe, F.P. 1870. Contributions towards a knowledge of the Curculionidae.</a> <!--MARK--><!--MARK--><a href='null9da0901d-c795-4d2c-b9ad-d6a85cdf1cce' class='mouseoverHref'><em>Journal of the Linnean Society of London, Zoology</em></a> <strong>10</strong>: 434-493, pls 17-19<!--MARK-->","","Article in Journal","561395cc-5bb6-4354-afc5-fce440bf838b","","9da0901d-c795-4d2c-b9ad-d6a85cdf1cce"
"Pascoe, F.P.","1870","Descriptions of some genera and species of Australian Curculionidae","181-209, pl. 5; 445-484, pl. 7","","Transactions of the Entomological Society of London","","","","<!--MARK--><a href='null5fc381a7-a6c5-40b0-8b50-9fc7553ec3bf' class='mouseoverHref'>Pascoe, F.P. 1870. Descriptions of some genera and species of Australian Curculionidae.</a> <!--MARK--><!--MARK--><a href='null5cf355b3-abc5-451e-9abc-ed3282d7811a' class='mouseoverHref'><em>Transactions of the Entomological Society of London</em></a> <strong>18</strong>(2): 181-209, pl. 5; 445-484, pl. 7<!--MARK-->","","Article in Journal","5fc381a7-a6c5-40b0-8b50-9fc7553ec3bf","20150316T20:32:18.762+0000","5cf355b3-abc5-451e-9abc-ed3282d7811a"
"Pascoe, F.P.","1870","Further descriptions of Australian Curculionidae.","209-212","","Transactions of the Entomological Society of London","","","","<!--MARK--><a href='null86e56108-09c2-42c5-9fb0-e48bc4bc18c5' class='mouseoverHref'>Pascoe, F.P. 1870. Further descriptions of Australian Curculionidae.</a> <!--MARK--><!--MARK--><a href='null5cf355b3-abc5-451e-9abc-ed3282d7811a' class='mouseoverHref'><em>Transactions of the Entomological Society of London</em></a> <strong>18</strong>(2): 209-212<!--MARK-->","","Article in Journal","86e56108-09c2-42c5-9fb0-e48bc4bc18c5","20150303T23:39:44.346+0000","5cf355b3-abc5-451e-9abc-ed3282d7811a"
"Pascoe, F.P.","1871","Contributions towards a knowledge of the Curculionidae. Part II.","154-218, pls 6-9","","Journal of the Linnean Society of London, Zoology","","8 June 1871","","<!--MARK--><a href='null9f00bed0-21d2-4584-b15c-8b4f6047d918' class='mouseoverHref'>Pascoe, F.P. 1871. Contributions towards a knowledge of the Curculionidae. Part II.</a> <!--MARK--><!--MARK--><a href='null9da0901d-c795-4d2c-b9ad-d6a85cdf1cce' class='mouseoverHref'><em>Journal of the Linnean Society of London, Zoology</em></a> <strong>11</strong>(51): 154-218, pls 6-9<!--MARK--> [Date published 8 June 1871]","","Article in Journal","9f00bed0-21d2-4584-b15c-8b4f6047d918","20150303T23:37:32.761+0000","9da0901d-c795-4d2c-b9ad-d6a85cdf1cce"
"Pascoe, F.P.","1872","Additions to the Australian Curculionidae. Part II","132-142","","Annals and Magazine of Natural History","","Feb. 1872","","<!--MARK--><a href='null48992269-2f4a-4a1f-9c2d-7d2b63f0380f' class='mouseoverHref'>Pascoe, F.P. 1872. Additions to the Australian Curculionidae. Part II.</a> <!--MARK--><!--MARK--><a href='nullefa8de69-3a29-4a43-8ef2-cbefda205976' class='mouseoverHref'><em>Annals and Magazine of Natural History</em></a> iv <strong>9</strong>(50): 132-142<!--MARK--> [Date published Feb. 1872]","","Article in Journal","48992269-2f4a-4a1f-9c2d-7d2b63f0380f","20111004T03:59:18.494+0000","efa8de69-3a29-4a43-8ef2-cbefda205976"
"Pascoe, F.P.","1872","Additions to the Australian Curculionidae. Part III.","84-101, pl. 1","","Annals and Magazine of Natural History","","Aug. 1872","","<!--MARK--><a href='nullbf69562e-44bf-466b-b1cd-daa3e9874649' class='mouseoverHref'>Pascoe, F.P. 1872. Additions to the Australian Curculionidae. Part III.</a> <!--MARK--><!--MARK--><a href='nullefa8de69-3a29-4a43-8ef2-cbefda205976' class='mouseoverHref'><em>Annals and Magazine of Natural History</em></a> 4 <strong>10</strong>(56): 84-101, pl. 1<!--MARK--> [Date published Aug. 1872]","","Article in Journal","bf69562e-44bf-466b-b1cd-daa3e9874649","20111003T23:19:51.379+0000","efa8de69-3a29-4a43-8ef2-cbefda205976"
"Pascoe, F.P.","1872","Contributions towards a knowledge of the Curculionidae. Part III","440-492, pls 10-13","","Journal of the Linnean Society of London, Zoology","","","","<!--MARK--><a href='nullcfdc7127-0b2b-4cbb-94a4-d254ad59c46d' class='mouseoverHref'>Pascoe, F.P. 1872. Contributions towards a knowledge of the Curculionidae. Part III.</a> <!--MARK--><!--MARK--><a href='null9da0901d-c795-4d2c-b9ad-d6a85cdf1cce' class='mouseoverHref'><em>Journal of the Linnean Society of London, Zoology</em></a> <strong>11</strong>: 440-492, pls 10-13<!--MARK-->","","Article in Journal","cfdc7127-0b2b-4cbb-94a4-d254ad59c46d","20120206T21:02:40.834+0000","9da0901d-c795-4d2c-b9ad-d6a85cdf1cce"
"Pascoe, F.P.","1873","Additions to the Australian Curculionidae. Part IV","178-199","","Annals and Magazine of Natural History","","Mar. 1873","","<!--MARK--><a href='nulle07632b9-36ad-433d-9b20-92462f80947d' class='mouseoverHref'>Pascoe, F.P. 1873. Additions to the Australian Curculionidae. Part IV.</a> <!--MARK--><!--MARK--><a href='nullefa8de69-3a29-4a43-8ef2-cbefda205976' class='mouseoverHref'><em>Annals and Magazine of Natural History</em></a> iv <strong>11</strong>: 178-199<!--MARK--> [Date published Mar. 1873]","","Article in Journal","e07632b9-36ad-433d-9b20-92462f80947d","20111004T03:46:40.033+0000","efa8de69-3a29-4a43-8ef2-cbefda205976"
"Pascoe, F.P.","1873","Additions to the Australian Curculionidae. Part V [continued]","278-286","","Annals and Magazine of Natural History","","Oct. 1873","","<!--MARK--><a href='null77d07507-4212-4a7d-b97e-528686f89cc4' class='mouseoverHref'>Pascoe, F.P. 1873. Additions to the Australian Curculionidae. Part V [continued].</a> <!--MARK--><!--MARK--><a href='nullefa8de69-3a29-4a43-8ef2-cbefda205976' class='mouseoverHref'><em>Annals and Magazine of Natural History</em></a> iv <strong>12</strong>(70): 278-286<!--MARK--> [Date published Oct. 1873]","","Article in Journal","77d07507-4212-4a7d-b97e-528686f89cc4","20111122T01:51:05.607+0000","efa8de69-3a29-4a43-8ef2-cbefda205976"
"Pascoe, F.P.","1874","Additions to the Australian Curculionidae. Part VI","383-389","","Annals and Magazine of Natural History","","May 1874","","<!--MARK--><a href='nulld48e2174-3291-451e-9cda-c3dd4490fdfb' class='mouseoverHref'>Pascoe, F.P. 1874. Additions to the Australian Curculionidae. Part VI.</a> <!--MARK--><!--MARK--><a href='nullefa8de69-3a29-4a43-8ef2-cbefda205976' class='mouseoverHref'><em>Annals and Magazine of Natural History</em></a> iv <strong>12</strong>(77): 383-389<!--MARK--> [Date published May 1874]","","Article in Journal","d48e2174-3291-451e-9cda-c3dd4490fdfb","20111004T03:51:59.058+0000","efa8de69-3a29-4a43-8ef2-cbefda205976"
"Pascoe, F.P.","1874","Additions to the Australian Curculionidae. Part VII","412-419","","Annals and Magazine of Natural History","","June 1874","","<!--MARK--><a href='null43774e0e-14e1-424f-b119-42e6074fb36f' class='mouseoverHref'>Pascoe, F.P. 1874. Additions to the Australian Curculionidae. Part VII.</a> <!--MARK--><!--MARK--><a href='nullefa8de69-3a29-4a43-8ef2-cbefda205976' class='mouseoverHref'><em>Annals and Magazine of Natural History</em></a> iv <strong>12</strong>(78): 412-419<!--MARK--> [Date published June 1874]","","Article in Journal","43774e0e-14e1-424f-b119-42e6074fb36f","20111004T03:56:22.329+0000","efa8de69-3a29-4a43-8ef2-cbefda205976"
"Pascoe, F.P.","1874","Contributions towards a knowledge of the Curculionidae. Part IV.","1-99, pls 1-4","","Journal of the Linnean Society of London, Zoology","","","","<!--MARK--><a href='null86b46847-f475-4689-b4b0-b40399c9957f' class='mouseoverHref'>Pascoe, F.P. 1874. Contributions towards a knowledge of the Curculionidae. Part IV.</a> <!--MARK--><!--MARK--><a href='null9da0901d-c795-4d2c-b9ad-d6a85cdf1cce' class='mouseoverHref'><em>Journal of the Linnean Society of London, Zoology</em></a> <strong>12</strong>: 1-99, pls 1-4<!--MARK-->","","Article in Journal","86b46847-f475-4689-b4b0-b40399c9957f","","9da0901d-c795-4d2c-b9ad-d6a85cdf1cce"
"Pascoe, F.P.","1875","Additions to the Australian Curculionidae. Part VIII.","55-67, pl.  1","","Annals and Magazine of Natural History","","July 1875","","<!--MARK--><a href='nulle9bd0f91-5ce4-4b85-b995-cf1a3cbe4325' class='mouseoverHref'>Pascoe, F.P. 1875. Additions to the Australian Curculionidae. Part VIII.</a> <!--MARK--><!--MARK--><a href='nullefa8de69-3a29-4a43-8ef2-cbefda205976' class='mouseoverHref'><em>Annals and Magazine of Natural History</em></a> iv <strong>16</strong>(91): 55-67, pl.  1<!--MARK--> [Date published July 1875]","","Article in Journal","e9bd0f91-5ce4-4b85-b995-cf1a3cbe4325","20111004T03:57:00.668+0000","efa8de69-3a29-4a43-8ef2-cbefda205976"
"Pascoe, F.P.","1880","New Neotropical Curculionidae.- Part III.","176-184","","Annals and Magazine of Natural History","","","","<!--MARK--><a href='null770951de-3276-44e7-be7e-678a8a1dff59' class='mouseoverHref'>Pascoe, F.P. 1880. New Neotropical Curculionidae.- Part III.</a> <!--MARK--><!--MARK--><a href='nullefa8de69-3a29-4a43-8ef2-cbefda205976' class='mouseoverHref'><em>Annals and Magazine of Natural History</em></a> 5 <strong>6</strong>(33): 176-184<!--MARK-->","","Article in Journal","770951de-3276-44e7-be7e-678a8a1dff59","20150317T03:48:29.630+0000","efa8de69-3a29-4a43-8ef2-cbefda205976"
"Pascoe, F.P.","1881","New Neotropical Curculionidae.- Part V.","299-308","","Annals and Magazine of Natural History","","","","<!--MARK--><a href='null71b20c15-0fda-4d4c-85f0-877d0f973e01' class='mouseoverHref'>Pascoe, F.P. 1881. New Neotropical Curculionidae.- Part V.</a> <!--MARK--><!--MARK--><a href='nullefa8de69-3a29-4a43-8ef2-cbefda205976' class='mouseoverHref'><em>Annals and Magazine of Natural History</em></a> 5 <strong>7</strong>(40): 299-308<!--MARK-->","","Article in Journal","71b20c15-0fda-4d4c-85f0-877d0f973e01","20150317T03:51:47.156+0000","efa8de69-3a29-4a43-8ef2-cbefda205976"
"Pascoe, F.P.","1882","Additions to the Australian Curculionidae. Part IX.","374-383","","Annals and Magazine of Natural History","","May 1882","","<!--MARK--><a href='nulled3d767d-13db-4cd6-b93d-8f636d6f9c5e' class='mouseoverHref'>Pascoe, F.P. 1882. Additions to the Australian Curculionidae. Part IX.</a> <!--MARK--><!--MARK--><a href='nullefa8de69-3a29-4a43-8ef2-cbefda205976' class='mouseoverHref'><em>Annals and Magazine of Natural History</em></a> v <strong>9</strong>(53): 374-383<!--MARK--> [Date published May 1882]","","Article in Journal","ed3d767d-13db-4cd6-b93d-8f636d6f9c5e","20111004T03:58:47.468+0000","efa8de69-3a29-4a43-8ef2-cbefda205976"
"Pascoe, F.P.","1882","Descriptions of some new genera and species of Curculionidae, mostly Asiatic.","443-455","","Annals and Magazine of Natural History","","","","<!--MARK--><a href='null76441295-4170-4242-93c0-8205c3d3f1f6' class='mouseoverHref'>Pascoe, F.P. 1882. Descriptions of some new genera and species of Curculionidae, mostly Asiatic.</a> <!--MARK--><!--MARK--><a href='nullefa8de69-3a29-4a43-8ef2-cbefda205976' class='mouseoverHref'><em>Annals and Magazine of Natural History</em></a> 5 <strong>10</strong>(60): 443-455<!--MARK-->","","Article in Journal","76441295-4170-4242-93c0-8205c3d3f1f6","20150408T02:05:27.387+0000","efa8de69-3a29-4a43-8ef2-cbefda205976"
"Pascoe, F.P.","1885","List of the Curculionidae of the Malay Archipelago collected by Dr. Odoardo Beccari, L.M. d'Albertis, and others","201-332, pls 1-3","","Annali del Museo Civico di Storia Naturale, Genova","","","","<!--MARK--><a href='null8ec81b71-1676-41bf-b3cf-c549642b27e0' class='mouseoverHref'>Pascoe, F.P. 1885. List of the Curculionidae of the Malay Archipelago collected by Dr. Odoardo Beccari, L.M. d'Albertis, and others.</a> <!--MARK--><!--MARK--><a href='null461059ea-ead7-4f6d-83f4-52913f06d09f' class='mouseoverHref'><em>Annali del Museo Civico di Storia Naturale, Genova</em></a> 2 <strong>22</strong>: 201-332, pls 1-3<!--MARK-->","","Article in Journal","8ec81b71-1676-41bf-b3cf-c549642b27e0","20170407T02:06:27.416+0000","461059ea-ead7-4f6d-83f4-52913f06d09f"
"Pascoe, F.P.","1887","Descriptions of some new genera and species of Curculionidae, mostly Asiatic. Part IV.","348-361","","Annals and Magazine of Natural History","","Nov. 1887","","<!--MARK--><a href='null6193fa67-405a-451d-9e2c-38c36bfaf6ed' class='mouseoverHref'>Pascoe, F.P. 1887. Descriptions of some new genera and species of Curculionidae, mostly Asiatic. Part IV.</a> <!--MARK--><!--MARK--><a href='nullefa8de69-3a29-4a43-8ef2-cbefda205976' class='mouseoverHref'><em>Annals and Magazine of Natural History</em></a> v <strong>20</strong>(109): 348-361<!--MARK--> [Date published Nov. 1887]","","Article in Journal","6193fa67-405a-451d-9e2c-38c36bfaf6ed","20111012T03:46:55.199+0000","efa8de69-3a29-4a43-8ef2-cbefda205976"
"Pascoe, F.P.","1889","On the weevil genus <i>Centrinus</i> and its allies.","321-330","","Annals and Magazine of Natural History","","","","<!--MARK--><a href='nulldcde46af-3fb5-43d0-b3fa-f58932bb888a' class='mouseoverHref'>Pascoe, F.P. 1889. On the weevil genus <i>Centrinus</i> and its allies.</a> <!--MARK--><!--MARK--><a href='nullefa8de69-3a29-4a43-8ef2-cbefda205976' class='mouseoverHref'><em>Annals and Magazine of Natural History</em></a> 6 <strong>4</strong>(22): 321-330<!--MARK-->","","Article in Journal","dcde46af-3fb5-43d0-b3fa-f58932bb888a","20150317T03:54:39.358+0000","efa8de69-3a29-4a43-8ef2-cbefda205976"
"Petri, K.","1904","Bestimmungs-Tabelle der mir bekannt gewordenen Arten der Gattung Lixus Fab. aus Europa und den angrenzenden Gebieten.","183-198","","Wiener Entomologische Zeitung","","30 Nov. 1904","","<!--MARK--><a href='nullaeab13d5-3ffa-428e-8826-84db499be560' class='mouseoverHref'>Petri, K. 1904. Bestimmungs-Tabelle der mir bekannt gewordenen Arten der Gattung Lixus Fab. aus Europa und den angrenzenden Gebieten.</a> <!--MARK--><!--MARK--><a href='null9b6f9f14-04ca-437e-a5d2-714ac39f9aa0' class='mouseoverHref'><em>Wiener Entomologische Zeitung</em></a> <strong>23</strong>(9): 183-198<!--MARK--> [Date published 30 Nov. 1904]","","Article in Journal","aeab13d5-3ffa-428e-8826-84db499be560","20111012T01:48:24.332+0000","9b6f9f14-04ca-437e-a5d2-714ac39f9aa0"
"Petri, K.","1914","Beiträge zur Käferfauna.","1-23","","Verhandlungen und Mitteilungen des Siebenbürgischen Vereins für Naturwissenschaften zu Hermannstadt","","","","<!--MARK--><a href='nulle9bffbdb-3dd9-49a7-92fc-fec94b4d24c0' class='mouseoverHref'>Petri, K. 1914. Beiträge zur Käferfauna.</a> <!--MARK--><!--MARK--><a href='nulld4d1717b-696d-482a-9a87-d92bf2b8cc08' class='mouseoverHref'><em>Verhandlungen und Mitteilungen des Siebenbürgischen Vereins für Naturwissenschaften zu Hermannstadt</em></a> <strong>65</strong>(Festschrift): 1-23<!--MARK-->","","Article in Journal","e9bffbdb-3dd9-49a7-92fc-fec94b4d24c0","20120403T05:29:08.565+0000","d4d1717b-696d-482a-9a87-d92bf2b8cc08"
"Pinzón-Navarro, S.V., Jennings, D. & Oberprieler, R.G.","2017","Host associations of <i>Melanterius</i> Erichson (Coleoptera: Curculionidae: Cleogonini), with a diagnosis and delimitation of the genus and description of five new species","1-77","","Zootaxa","","","","<!--MARK--><a href='null89eb413f-c447-4a21-9f2a-1f339985e9a2' class='mouseoverHref'>Pinzón-Navarro, S.V., Jennings, D. & Oberprieler, R.G. 2017. Host associations of <i>Melanterius</i> Erichson (Coleoptera: Curculionidae: Cleogonini), with a diagnosis and delimitation of the genus and description of five new species.</a> <!--MARK--><!--MARK--><a href='null96466227-221c-4922-ac97-1ac2dd946d0a' class='mouseoverHref'><em>Zootaxa</em></a> <strong>4298</strong>(1): 1-77<!--MARK-->","","Article in Journal","89eb413f-c447-4a21-9f2a-1f339985e9a2","20171025T23:12:10.663+0000","96466227-221c-4922-ac97-1ac2dd946d0a"
"Pullen, K.R., Jennings, D. & Oberprieler, R.G.","2014","Annotated catalogue of Australian weevils (Coleoptera: Curculionoidea)","1-481","","Zootaxa","","","","<!--MARK--><a href='null6ad89c32-5a10-449f-b213-92f4917f13b4' class='mouseoverHref'>Pullen, K.R., Jennings, D. & Oberprieler, R.G. 2014. Annotated catalogue of Australian weevils (Coleoptera: Curculionoidea).</a> <!--MARK--><!--MARK--><a href='null96466227-221c-4922-ac97-1ac2dd946d0a' class='mouseoverHref'><em>Zootaxa</em></a> <strong>3896</strong>(1): 1-481<!--MARK-->","","Article in Journal","6ad89c32-5a10-449f-b213-92f4917f13b4","20150120T05:00:38.021+0000","96466227-221c-4922-ac97-1ac2dd946d0a"
"Radford, W.P.K.","1981","The Fabrician types of the Australian and New Zealand Coleoptera in the Banks Collection at the British Museum (Natural History).","155-197","","Records of the South Australian Museum (Adelaide)","","","","<!--MARK--><a href='nullc4d40a3c-373c-47a6-879a-956610458f38' class='mouseoverHref'>Radford, W.P.K. 1981. The Fabrician types of the Australian and New Zealand Coleoptera in the Banks Collection at the British Museum (Natural History).</a> <!--MARK--><!--MARK--><a href='nullf7f76869-b0b8-4c0e-a1bc-1d8c43cc0f89' class='mouseoverHref'><em>Records of the South Australian Museum (Adelaide)</em></a> <strong>18</strong>(8): 155-197<!--MARK-->","","Article in Journal","c4d40a3c-373c-47a6-879a-956610458f38","","f7f76869-b0b8-4c0e-a1bc-1d8c43cc0f89"
"Reitter, E.","1916","Fauna Germanica. Die Käfer des Deutschen Reiches. Nach der analytischen Methode bearbeitet","pp. 1-343 + pls 153-168","","","","","K.G. Lutz","<!--MARK--><a href='nullaf27b16f-6541-4aee-b66d-e5a24f5a4658' class='mouseoverHref'>Reitter, E. 1916. <em>Fauna Germanica. Die Käfer des Deutschen Reiches. Nach der analytischen Methode bearbeitet</em>. Stuttgart : K.G. Lutz Vol. 5 pp. 1-343 + pls 153-168.</a><!--MARK-->","","Book","af27b16f-6541-4aee-b66d-e5a24f5a4658","20120514T23:16:34.592+0000",""
"Rossi, P.","1794","Mantissa Insectorum, <i>exhibens species nuper in Etruria collectas, adjectis faunae Etruscae illustrationibus ac emendationibus</i>","154 pp. 8 colour pls","","","","","Polloni","<!--MARK--><a href='nullaf0951d4-d98f-48c9-9408-0e23a503c024' class='mouseoverHref'>Rossi, P. 1794. <em>Mantissa Insectorum, <i>exhibens species nuper in Etruria collectas, adjectis faunae Etruscae illustrationibus ac emendationibus</i></em>. Pisa : Polloni 154 pp. 8 colour pls.</a><!--MARK-->","","Book","af0951d4-d98f-48c9-9408-0e23a503c024","20081009T05:11:37.000+0000",""
"Sahlberg, C.R.","1823","Periculi entomographici, species Insectorum nondum descriptas proposituri, fasciculus.","pp. 33-48","","","","14-VI-1823","Typis Frenckelliorum","<!--MARK--><a href='null3909c137-eca8-4ed3-910d-59f826364a6e' class='mouseoverHref'>Sahlberg, C.R. 1823. <em>Periculi entomographici, species Insectorum nondum descriptas proposituri, fasciculus</em>. Aboae : Typis Frenckelliorum Vol. 3 pp. 33-48.</a><!--MARK--> [Date published 14-VI-1823]","","Book","3909c137-eca8-4ed3-910d-59f826364a6e","20120321T04:06:08.280+0000",""
"Saunders, W.W. & Jekel, H.","1855","Descriptions de quelques curculionites.","289-306, col. pl. 15","","Annales de la Société Entomologique de France","","","","<!--MARK--><a href='nullcaeac075-546a-4064-a2a2-d32362b3dfd3' class='mouseoverHref'>Saunders, W.W. & Jekel, H. 1855. Descriptions de quelques curculionites.</a> <!--MARK--><!--MARK--><a href='null6462279b-2aaf-46a3-a434-cab7d8a2c33d' class='mouseoverHref'><em>Annales de la Société Entomologique de France</em></a> III <strong>3</strong>: 289-306, col. pl. 15<!--MARK-->","","Article in Journal","caeac075-546a-4064-a2a2-d32362b3dfd3","","6462279b-2aaf-46a3-a434-cab7d8a2c33d"
"Schoenherr, C.J.","1825","Continuatio tabulae synopticae familiae curculionidum.","581-588","","Isis von Oken","","","","<!--MARK--><a href='null96754b44-2d20-4ed3-9af8-438d632a72c9' class='mouseoverHref'>Schoenherr, C.J. 1825. Continuatio tabulae synopticae familiae curculionidum.</a> <!--MARK--><!--MARK--><a href='null8c6c1811-e289-4280-abc3-68c2b2da3975' class='mouseoverHref'><em>Isis von Oken</em></a> <strong>1825</strong>(5): 581-588<!--MARK-->","","Article in Journal","96754b44-2d20-4ed3-9af8-438d632a72c9","20111017T00:29:27.559+0000","8c6c1811-e289-4280-abc3-68c2b2da3975"
"Schoenherr, C.J.","1835","Genera et species curculionidum, cum synonymia hujus familiae. Species novae aut hactenus minus cognitae, descriptionibus a Dom. Leonardo Gyllenhal, C.H. Boheman, et entomologis aliis illustratae","1-505","","","","","Roret","<!--MARK--><a href='nullb72ea9e1-f36c-4032-9895-7488b483d966' class='mouseoverHref'>Schoenherr, C.J. 1835. <em>Genera et species curculionidum, cum synonymia hujus familiae. Species novae aut hactenus minus cognitae, descriptionibus a Dom. Leonardo Gyllenhal, C.H. Boheman, et entomologis aliis illustratae</em>. Paris : Roret Vol. 3(1) pp. 1-505.</a><!--MARK-->","","Book","b72ea9e1-f36c-4032-9895-7488b483d966","20120213T02:51:25.177+0000",""
"Schoenherr, C.J.","1836","Genera et species curculionidum, cum synonymia hujus familiae. Species novae aut hactenus minus cognitae, descriptionibus a Dom. Leonardo Gyllenhal, C.H. Boheman, et entomologis aliis illustratae","506-858","","","","","Roret","<!--MARK--><a href='nullf30fb604-072e-43ca-b19b-551da13947f7' class='mouseoverHref'>Schoenherr, C.J. 1836. <em>Genera et species curculionidum, cum synonymia hujus familiae. Species novae aut hactenus minus cognitae, descriptionibus a Dom. Leonardo Gyllenhal, C.H. Boheman, et entomologis aliis illustratae</em>. Paris : Roret Vol. 3(2) pp. 506-858.</a><!--MARK-->","","Book","f30fb604-072e-43ca-b19b-551da13947f7","20111115T00:24:49.115+0000",""
"Schoenherr, C.J.","1837","Genera et species curculionidum, cum synonymia hujus familiae. Species novae aut hactenus minus cognitae, descriptionibus a Dom. Leonardo Gyllenhal, C.H. Boheman, et entomologis aliis illustratae","1-600","","","","","Roret","<!--MARK--><a href='null306c86dc-67a2-4868-95d5-b364e9a1d7a6' class='mouseoverHref'>Schoenherr, C.J. 1837. <em>Genera et species curculionidum, cum synonymia hujus familiae. Species novae aut hactenus minus cognitae, descriptionibus a Dom. Leonardo Gyllenhal, C.H. Boheman, et entomologis aliis illustratae</em>. Paris : Roret Vol. 4(1) pp. 1-600.</a><!--MARK-->","","Book","306c86dc-67a2-4868-95d5-b364e9a1d7a6","20140102T23:07:22.940+0000",""
"Schoenherr, C.J.","1843","Genera et species curculionidum, cum synonymia hujus familiae. Species novae aut hactenus minus cognitae, descriptionibus a Dom. Leonardo Gyllenhal, C.H. Boheman, et entomologis aliis illustratae","1-461","","","","","Roret","<!--MARK--><a href='null99dc09e5-27b9-493b-82a5-692a56257d07' class='mouseoverHref'>Schoenherr, C.J. 1843. <em>Genera et species curculionidum, cum synonymia hujus familiae. Species novae aut hactenus minus cognitae, descriptionibus a Dom. Leonardo Gyllenhal, C.H. Boheman, et entomologis aliis illustratae</em>. Paris : Roret Vol. 7(2) pp. 1-461.</a><!--MARK-->","","Book","99dc09e5-27b9-493b-82a5-692a56257d07","20120522T22:12:10.943+0000",""
"Schoenherr, C.J.","1844","Genera et species curculionidum, cum synonymia hujus familiae. Species novae aut hactenus minus cognitae, descriptionibus a Dom. Leonardo Gyllenhal, C.H. Boheman, et entomologis aliis illustratae","1-442","","","","","Roret","<!--MARK--><a href='null34c74561-3c3b-490a-ad6f-aa065c43b73c' class='mouseoverHref'>Schoenherr, C.J. 1844. <em>Genera et species curculionidum, cum synonymia hujus familiae. Species novae aut hactenus minus cognitae, descriptionibus a Dom. Leonardo Gyllenhal, C.H. Boheman, et entomologis aliis illustratae</em>. Paris : Roret Vol. 8(1) pp. 1-442.</a><!--MARK-->","","Book","34c74561-3c3b-490a-ad6f-aa065c43b73c","20120515T21:15:30.871+0000",""
"Schoenherr, C.J.","1847","Mantissa secunda familiae curculionidum seu descriptiones novorum quorundam generum curculionidum.","pp. 1-86","","","","","","<!--MARK--><a href='null2fa833d4-b4d1-439a-a775-6317e01be03a' class='mouseoverHref'>Schoenherr, C.J. 1847. <em>Mantissa secunda familiae curculionidum seu descriptiones novorum quorundam generum curculionidum</em>. Holmiae pp. 1-86.</a><!--MARK-->","","Book","2fa833d4-b4d1-439a-a775-6317e01be03a","20111017T04:30:43.358+0000",""
"Shuckard, W.E.","1838","Descriptions of some new genera of Coleoptera in the author's collection.","505-513","","The Entomological Magazine","","","","<!--MARK--><a href='null4c2698b5-3c92-407a-8850-e8f69bd53a23' class='mouseoverHref'>Shuckard, W.E. 1838. Descriptions of some new genera of Coleoptera in the author's collection.</a> <!--MARK--><!--MARK--><a href='nulld7e8a658-7aeb-4ebf-972a-a0fff58c7db9' class='mouseoverHref'><em>The Entomological Magazine</em></a> <strong>5</strong>(5): 505-513<!--MARK-->","","Article in Journal","4c2698b5-3c92-407a-8850-e8f69bd53a23","","d7e8a658-7aeb-4ebf-972a-a0fff58c7db9"
"Swirepik, A., Turner, P. & Briese, D.T.","2008","Evaluation of the biological control agent, <i>Lixus cardui</i>, on <i>Onopordum</i> thistles: establishment and initial field impact","108-114","","Biological Control","","","","<!--MARK--><a href='nulld615968c-defa-49a9-9413-02cb1e3efd92' class='mouseoverHref'>Swirepik, A., Turner, P. & Briese, D.T. 2008. Evaluation of the biological control agent, <i>Lixus cardui</i>, on <i>Onopordum</i> thistles: establishment and initial field impact.</a> <!--MARK--><!--MARK--><a href='null09653e18-e7a3-41ba-b1a8-09853477b149' class='mouseoverHref'><em>Biological Control</em></a> <strong>47</strong>: 108-114<!--MARK-->","","Article in Journal","d615968c-defa-49a9-9413-02cb1e3efd92","20120515T21:20:11.604+0000","09653e18-e7a3-41ba-b1a8-09853477b149"
