"PUB_AUTHOR","PUB_YEAR","PUB_TITLE","PUB_PAGES","PUB_PARENT_BOOK_TITLE","PUB_PARENT_JOURNAL_TITLE","PUB_PARENT_ARTICLE_TITLE","PUB_PUBLICATION_DATE","PUB_PUBLISHER","PUB_FORMATTED","PUB_QUALIFICATION","PUB_TYPE","PUBLICATION_GUID","PUBLICATION_LAST_UPDATE","PARENT_PUBLICATION_GUID"
"Alonso-Zarazaga, M.A. & Lyal, C.H.C.","1999","A world catalogue of families and genera of Curculionoidea (Insecta: Coleoptera) (excepting Scolytidae and Platypodidae)","315 pp.","","","","27-XII-1999","Entomopraxis","<!--MARK--><a href='null6b6a3cac-3b20-4867-9b8d-30726c343b7f' class='mouseoverHref'>Alonso-Zarazaga, M.A. & Lyal, C.H.C. 1999. <em>A world catalogue of families and genera of Curculionoidea (Insecta: Coleoptera) (excepting Scolytidae and Platypodidae)</em>. Barcelona : Entomopraxis 315 pp.</a><!--MARK--> [Date published 27-XII-1999]","","Book","6b6a3cac-3b20-4867-9b8d-30726c343b7f","20120515T02:53:02.353+0000",""
"Ancey, C.F.","1881","Diagnoses de curculionides nouveaux","372","","Le Naturaliste","","","","<!--MARK--><a href='null1fff7d86-9388-497f-accf-cc89df3fb563' class='mouseoverHref'>Ancey, C.F. 1881. Diagnoses de curculionides nouveaux.</a> <!--MARK--><!--MARK--><a href='null935bd092-231d-423d-a0dd-e2a01756fcfa' class='mouseoverHref'><em>Le Naturaliste</em></a> <strong>1</strong>: 372<!--MARK-->","","Article in Journal","1fff7d86-9388-497f-accf-cc89df3fb563","","935bd092-231d-423d-a0dd-e2a01756fcfa"
"Anderson, R.S.","2008","The identity of <i>Chaleponotus elusus</i> Casey 1892 (Curculionidae: Molytinae: Conotrachelini)","42-44","","The Coleopterists Bulletin","","","","<!--MARK--><a href='null7e778436-a37f-4e7b-9c24-a5f5bdb15c21' class='mouseoverHref'>Anderson, R.S. 2008. The identity of <i>Chaleponotus elusus</i> Casey 1892 (Curculionidae: Molytinae: Conotrachelini).</a> <!--MARK--><!--MARK--><a href='nullbfb4ceb5-9a22-44a0-9c17-ce86881f04b2' class='mouseoverHref'><em>The Coleopterists Bulletin</em></a> <strong>62</strong>(1): 42-44<!--MARK-->","","Article in Journal","7e778436-a37f-4e7b-9c24-a5f5bdb15c21","20170301T04:49:34.392+0000","bfb4ceb5-9a22-44a0-9c17-ce86881f04b2"
"Anderson,R.S., Oberprieler, R.G. & Setliff, G.P.","2018","A Review of the <i>Araucaria</i>-Associated Weevils of the Tribe Orthorhinini (Coleoptera: Curculionidae: Molytinae), with Description of New Species of <i>Ilacuris</i> Pascoe, 1865 and <i>Notopissodes</i> Zimmerman & Oberprieler, 2014 and a New Genus, <i>Kuschelorhinus</i> Anderson & Setliff","54","","Diversity","","","","<!--MARK--><a href='null0a4942f2-1a73-460c-94dd-0a12d1c940ef' class='mouseoverHref'>Anderson,R.S., Oberprieler, R.G. & Setliff, G.P. 2018. A Review of the <i>Araucaria</i>-Associated Weevils of the Tribe Orthorhinini (Coleoptera: Curculionidae: Molytinae), with Description of New Species of <i>Ilacuris</i> Pascoe, 1865 and <i>Notopissodes</i> Zimmerman & Oberprieler, 2014 and a New Genus, <i>Kuschelorhinus</i> Anderson & Setliff.</a> <!--MARK--><!--MARK--><a href='null5821cc21-9b16-46d3-8ca3-45c9e2562348' class='mouseoverHref'><em>Diversity</em></a> 2018 <strong>10</strong>: 54<!--MARK-->","","Article in Journal","0a4942f2-1a73-460c-94dd-0a12d1c940ef","20190517T02:33:01.309+0000","5821cc21-9b16-46d3-8ca3-45c9e2562348"
"Andrew, J.P. & Ramamurthy, V.V.","2010","A checklist of weevils of the tribe Mecysolobini (Coleoptera: Curculionidae: Molytinae).","271-336","","Oriental Insects","","","","<!--MARK--><a href='null25de04b5-9434-41ff-ab92-6e289f219704' class='mouseoverHref'>Andrew, J.P. & Ramamurthy, V.V. 2010. A checklist of weevils of the tribe Mecysolobini (Coleoptera: Curculionidae: Molytinae).</a> <!--MARK--><!--MARK--><a href='nullef3aab0f-7ae6-4f96-9daa-2bbc105b9abc' class='mouseoverHref'><em>Oriental Insects</em></a> <strong>44</strong>: 271-336<!--MARK-->","","Article in Journal","25de04b5-9434-41ff-ab92-6e289f219704","20120403T13:31:27.891+0000","ef3aab0f-7ae6-4f96-9daa-2bbc105b9abc"
"Arrow, G.J.","1913","[Taxonomic action]","","","Transactions of the Royal Society of South Australia","Descriptions of Australian Curculionidae, with notes on previously described species. Part XI.","","","<!--MARK--><a href='nullde1a2d72-15d7-45d5-8859-5269ef46bf1f' class='mouseoverHref'>Arrow, G.J. 1913. [Taxonomic action].</a> <!--MARK--><em>In,</em> <!--MARK--><a href='null492c2e67-ef28-49e4-b4b9-8c1707b948e5' class='mouseoverHref'>Lea, A.M. Descriptions of Australian Curculionidae, with notes on previously described species. Part XI.</a> <!--MARK--><!--MARK--><a href='null8b48b0a3-dd7a-4aea-be0d-10a223710ebc' class='mouseoverHref'><em>Transactions of the Royal Society of South Australia</em></a> <strong>37</strong>: 301-445<!--MARK-->","","Section in Article","de1a2d72-15d7-45d5-8859-5269ef46bf1f","20120521T04:01:26.774+0000","492c2e67-ef28-49e4-b4b9-8c1707b948e5"
"Billberg, G.J.","1820","Enumeratio Insectorum in Museo Gustave Johann Billberg","4 unnumbered + 138 pp.","","","","","Typis Gadelianis","<!--MARK--><a href='nullc7391556-8e0f-4b95-952b-9c4a79d59be8' class='mouseoverHref'>Billberg, G.J. 1820. <em>Enumeratio Insectorum in Museo Gustave Johann Billberg</em>. Stockholm : Typis Gadelianis 4 unnumbered + 138 pp.</a><!--MARK--> [In Latin]","In Latin","Book","c7391556-8e0f-4b95-952b-9c4a79d59be8","20120105T00:04:48.969+0000",""
"Blackburn, T.","1892","Notes on Australian Coleoptera, with descriptions of new species. Part XI.","65-151","","Proceedings of the Linnean Society of New South Wales","","","","<!--MARK--><a href='nullf1a03978-9bfc-4785-b8d7-9880fe4badeb' class='mouseoverHref'>Blackburn, T. 1892. Notes on Australian Coleoptera, with descriptions of new species. Part XI.</a> <!--MARK--><!--MARK--><a href='nullc12cd779-adb5-41ea-bd2c-75f6864cf22e' class='mouseoverHref'><em>Proceedings of the Linnean Society of New South Wales</em></a> 2 <strong>7</strong>(I): 65-151<!--MARK-->","","Article in Journal","f1a03978-9bfc-4785-b8d7-9880fe4badeb","20111219T20:59:06.127+0000","c12cd779-adb5-41ea-bd2c-75f6864cf22e"
"Blackburn, T.","1893","Scientific results of the Elder exploring expedition: Coleoptera (continued)","177-202","","Transactions of the Royal Society of South Australia","","","","<!--MARK--><a href='nullfc57cdcd-d0f4-470d-929f-1c7b205bc67e' class='mouseoverHref'>Blackburn, T. 1893. Scientific results of the Elder exploring expedition: Coleoptera (continued).</a> <!--MARK--><!--MARK--><a href='null8b48b0a3-dd7a-4aea-be0d-10a223710ebc' class='mouseoverHref'><em>Transactions of the Royal Society of South Australia</em></a> <strong>16</strong>: 177-202<!--MARK-->","","Article in Journal","fc57cdcd-d0f4-470d-929f-1c7b205bc67e","","8b48b0a3-dd7a-4aea-be0d-10a223710ebc"
"Blackburn, T.","1900","Further notes on Australian Coleoptera, with descriptions of new genera and species. Part XXVII","113-169","","Transactions of the Royal Society of South Australia","","Dec. 31, 1900","","<!--MARK--><a href='null5878c9f7-392f-4716-853d-06aa77818449' class='mouseoverHref'>Blackburn, T. 1900. Further notes on Australian Coleoptera, with descriptions of new genera and species. Part XXVII.</a> <!--MARK--><!--MARK--><a href='null8b48b0a3-dd7a-4aea-be0d-10a223710ebc' class='mouseoverHref'><em>Transactions of the Royal Society of South Australia</em></a> <strong>24</strong>: 113-169<!--MARK--> [Date published Dec. 31, 1900]","","Article in Journal","5878c9f7-392f-4716-853d-06aa77818449","20110825T03:06:47.262+0000","8b48b0a3-dd7a-4aea-be0d-10a223710ebc"
"Blatchley, W.S. & Leng, C.W.","1916","Rhynchophora or weevils of north eastern America.","pp. 1-682","","","","","The Nature Publishing Company.","<!--MARK--><a href='null028d8674-300e-45a5-9b4a-f9a7fd7bcc79' class='mouseoverHref'>Blatchley, W.S. & Leng, C.W. 1916. <em>Rhynchophora or weevils of north eastern America</em>. Indianapolis, Indiana : The Nature Publishing Company. pp. 1-682.</a><!--MARK-->","","Book","028d8674-300e-45a5-9b4a-f9a7fd7bcc79","20120325T22:53:47.110+0000",""
"Boheman, C.H.","1837","[taxonomic descriptions]","","Genera et species curculionidum, cum synonymia hujus familiae. Species novae aut hactenus minus cognitae, descriptionibus a Dom. Leonardo Gyllenhal, C.H. Boheman, et entomologis aliis illustratae","","","","","<!--MARK--><a href='null77641058-6194-41a3-8190-f8980baaad20' class='mouseoverHref'>Boheman, C.H. 1837. [taxonomic descriptions].</a> <!--MARK--><em>In,</em> <!--MARK--><a href='null306c86dc-67a2-4868-95d5-b364e9a1d7a6' class='mouseoverHref'>Schoenherr, C.J. <em>Genera et species curculionidum, cum synonymia hujus familiae. Species novae aut hactenus minus cognitae, descriptionibus a Dom. Leonardo Gyllenhal, C.H. Boheman, et entomologis aliis illustratae</em>. Paris : Roret Vol. 4(1) pp. 1-600.</a><!--MARK-->","","Chapter in Book","77641058-6194-41a3-8190-f8980baaad20","20120109T03:06:18.370+0000","306c86dc-67a2-4868-95d5-b364e9a1d7a6"
"Boheman, C.H.","1843","[Taxonomic descriptions]","","Genera et species curculionidum, cum synonymia hujus familiae. Species novae aut hactenus minus cognitae, descriptionibus a Dom. Leonardo Gyllenhal, C.H. Boheman, et entomologis aliis illustratae","","","","","<!--MARK--><a href='nullc9daea58-5e15-4cae-b1a0-33b4debd7c77' class='mouseoverHref'>Boheman, C.H. 1843. [Taxonomic descriptions].</a> <!--MARK--><em>In,</em> <!--MARK--><a href='null99dc09e5-27b9-493b-82a5-692a56257d07' class='mouseoverHref'>Schoenherr, C.J. <em>Genera et species curculionidum, cum synonymia hujus familiae. Species novae aut hactenus minus cognitae, descriptionibus a Dom. Leonardo Gyllenhal, C.H. Boheman, et entomologis aliis illustratae</em>. Paris : Roret Vol. 7(2) pp. 1-461.</a><!--MARK-->","","Chapter in Book","c9daea58-5e15-4cae-b1a0-33b4debd7c77","20120522T22:12:10.943+0000","99dc09e5-27b9-493b-82a5-692a56257d07"
"Boheman, C.H.","1859","Coleoptera","1-217","Kongliga Svenska Fregatten Eugenies Resa omkring jorden under befäl af C.A. Virgin Åhren 1851-1853. Vettenskapliga iakttagelser på H.M. Konung Oscar Den Förstes befallning.","","","","","<!--MARK--><a href='null33f415a0-0310-4bb9-a2e5-f1883ea2bca8' class='mouseoverHref'>Boheman, C.H. 1859. Coleoptera. pp. 1-217</a> <!--MARK--><em>in</em> <!--MARK--><a href='nulle05a44bb-9473-4518-ae28-8e75af4604df' class='mouseoverHref'>Virgin, C.A. <em>Kongliga Svenska Fregatten Eugenies Resa omkring jorden under befäl af C.A. Virgin Åhren 1851-1853. Vettenskapliga iakttagelser på H.M. Konung Oscar Den Förstes befallning</em>. Stockholm : P.A. Norstedt & Söner 1-617, pl. I-IX.</a><!--MARK-->","","Chapter in Book","33f415a0-0310-4bb9-a2e5-f1883ea2bca8","20111117T23:21:29.803+0000","e05a44bb-9473-4518-ae28-8e75af4604df"
"Boheman, C.H. in Schoenherr, C.J.","1843","<i>Genera et species curculionidum, cum synonymia hujus familiae. Species novae aut hactenus minus cognitae, descriptionibus a Dom. Leonardo Gyllenhal, C.H. Boheman, et entomologis aliis illustratae</i>","pp. 1-461","","","","","","<!--MARK--><a href='nulld7031bf6-c3ef-4098-bc0d-0e1224246924' class='mouseoverHref'>Boheman, C.H. <i>in</i> Schoenherr, C.J. 1843. <i>Genera et species curculionidum, cum synonymia hujus familiae. Species novae aut hactenus minus cognitae, descriptionibus a Dom. Leonardo Gyllenhal, C.H. Boheman, et entomologis aliis illustratae</i>. Paris : Roret Vol. 7(2). pp. 1-461</a>","","Miscellaneous","d7031bf6-c3ef-4098-bc0d-0e1224246924","20120529T02:47:15.225+0000",""
"Boisduval, J.A.","1835","Voyage de Découvertes de l'<i>Astrolabe</i> exécuté par ordre du Roi, pendant les années 1826-1827-1828-1829, sous le commandement de M.J. Dumont d'Urville. Faune Entomologique de l'Océan Pacifique, avec l'illustration des insectes nouveaux recueillis pendant le voyage. 2me Partie. Coléoptères et autres Ordres","vii 716 pp.","","","","27-III-1835","J. Tastu","<!--MARK--><a href='nullf3f620b1-a19c-439c-88b6-243e5593b6bf' class='mouseoverHref'>Boisduval, J.A. 1835. <em>Voyage de Découvertes de l'<i>Astrolabe</i> exécuté par ordre du Roi, pendant les années 1826-1827-1828-1829, sous le commandement de M.J. Dumont d'Urville. Faune Entomologique de l'Océan Pacifique, avec l'illustration des insectes nouveaux recueillis pendant le voyage. 2me Partie. Coléoptères et autres Ordres</em>. Paris : J. Tastu vii 716 pp.</a><!--MARK--> [Date published 27-III-1835]","","Book","f3f620b1-a19c-439c-88b6-243e5593b6bf","20110901T05:19:23.377+0000",""
"Briese, D.T.","1996","Life history of the <i>Onopordum capitulum</i> weevil <i>Larinus latus</i> (Coleoptera: Curculionidae)","454-463","","Oecologia","","","","<!--MARK--><a href='null668f2051-30f8-48b6-b3c6-5a5b473fa45b' class='mouseoverHref'>Briese, D.T. 1996. Life history of the <i>Onopordum capitulum</i> weevil <i>Larinus latus</i> (Coleoptera: Curculionidae).</a> <!--MARK--><!--MARK--><a href='null2aae1467-c9ac-4702-b7ca-207b01cb06b2' class='mouseoverHref'><em>Oecologia</em></a> <strong>105</strong>(4): 454-463<!--MARK-->","","Article in Journal","668f2051-30f8-48b6-b3c6-5a5b473fa45b","20120515T21:16:26.956+0000","2aae1467-c9ac-4702-b7ca-207b01cb06b2"
"Briese, D.T.","1996","Potential impact of the stem-boring weevil <i>Lixus cardui</i> on the growth and reproductive capacity of <i>Onopordum</i> spp. thistles","251-261","","Biocontrol Science and Technology","","","","<!--MARK--><a href='null1f078397-26e0-43cb-9629-72cc91b4a32a' class='mouseoverHref'>Briese, D.T. 1996. Potential impact of the stem-boring weevil <i>Lixus cardui</i> on the growth and reproductive capacity of <i>Onopordum</i> spp. thistles.</a> <!--MARK--><!--MARK--><a href='null1dd722ba-2bb2-4982-8c54-021987e76f94' class='mouseoverHref'><em>Biocontrol Science and Technology</em></a> <strong>6</strong>: 251-261<!--MARK-->","","Article in Journal","1f078397-26e0-43cb-9629-72cc91b4a32a","20120515T21:17:07.693+0000","1dd722ba-2bb2-4982-8c54-021987e76f94"
"Briese, D.T.","2000","Impact of the <i>Onopordum capitulum</i> weevil <i>Larinus latus</i> on seed production by its host plant","238-246","","Journal of Applied Ecology","","","","<!--MARK--><a href='null514f054c-cea4-4a1c-8ad7-07369b71fc24' class='mouseoverHref'>Briese, D.T. 2000. Impact of the <i>Onopordum capitulum</i> weevil <i>Larinus latus</i> on seed production by its host plant.</a> <!--MARK--><!--MARK--><a href='null04985cb5-8335-4f3e-8c08-ca66cd4a30cd' class='mouseoverHref'><em>Journal of Applied Ecology</em></a> <strong>37</strong>: 238-246<!--MARK-->","","Article in Journal","514f054c-cea4-4a1c-8ad7-07369b71fc24","20120515T21:17:53.001+0000","04985cb5-8335-4f3e-8c08-ca66cd4a30cd"
"Briese, D.T., Pettit, W. & Walker, A.","2004","Evaluation of the biological control agent, <i>Lixus cardui</i>, on <i>Onopordum thistles</i>: experimental studies on agent demography and impact","165-171","","Biological Control","","","","<!--MARK--><a href='nullf0911825-2788-4284-aa6b-9317e92cc2a7' class='mouseoverHref'>Briese, D.T., Pettit, W. & Walker, A. 2004. Evaluation of the biological control agent, <i>Lixus cardui</i>, on <i>Onopordum thistles</i>: experimental studies on agent demography and impact.</a> <!--MARK--><!--MARK--><a href='null09653e18-e7a3-41ba-b1a8-09853477b149' class='mouseoverHref'><em>Biological Control</em></a> <strong>31</strong>: 165-171<!--MARK-->","","Article in Journal","f0911825-2788-4284-aa6b-9317e92cc2a7","20120515T21:18:32.121+0000","09653e18-e7a3-41ba-b1a8-09853477b149"
"Brookes, A.E.","1951","The Coleoptera of the Auckland and Campbell Islands.","1-68","","Cape Expedition Series Bulletin. Department of Scientific and Industrial Research","","","","<!--MARK--><a href='null5dfcb839-d8da-4a91-ad07-9ab48d48fb4f' class='mouseoverHref'>Brookes, A.E. 1951. The Coleoptera of the Auckland and Campbell Islands.</a> <!--MARK--><!--MARK--><a href='null2f8bf17c-7da6-4e3d-ae1c-255c73c49113' class='mouseoverHref'><em>Cape Expedition Series Bulletin. Department of Scientific and Industrial Research</em></a> <strong>5</strong>: 1-68<!--MARK-->","","Article in Journal","5dfcb839-d8da-4a91-ad07-9ab48d48fb4f","20110829T05:06:38.632+0000","2f8bf17c-7da6-4e3d-ae1c-255c73c49113"
"Broun, T.","1880","Manual of the New Zealand Coleoptera","651 pp.","","","","","Colonial Museum and Geological Survey Department","<!--MARK--><a href='null21bb9254-a05b-446e-a24b-86800246a4fb' class='mouseoverHref'>Broun, T. 1880. <em>Manual of the New Zealand Coleoptera</em>. Wellington : Colonial Museum and Geological Survey Department Part 1 651 pp.</a><!--MARK-->","","Book","21bb9254-a05b-446e-a24b-86800246a4fb","20120319T21:07:58.417+0000",""
"Broun, T.","1893","Manual of the New Zealand Coleoptera","xvii 975-1504 pp.","","","","","New Zealand Institute","<!--MARK--><a href='nullf5a52841-2530-4c27-938e-1829b92149d4' class='mouseoverHref'>Broun, T. 1893. <em>Manual of the New Zealand Coleoptera</em>. Wellington : New Zealand Institute Part 5 - 7 xvii 975-1504 pp.</a><!--MARK-->","","Book","f5a52841-2530-4c27-938e-1829b92149d4","20100114T07:16:14.993+0000",""
"Broun, T.","1914","Descriptions of new genera and species of Coleoptera (Part II).","79-142","","Bulletin of the New Zealand Institute","","29-V-1914","","<!--MARK--><a href='null85cdc9ad-e7e8-43ee-8d08-709ec7e5bd3e' class='mouseoverHref'>Broun, T. 1914. Descriptions of new genera and species of Coleoptera (Part II).</a> <!--MARK--><!--MARK--><a href='null322c5156-5761-4fa2-868d-6010bc02d207' class='mouseoverHref'><em>Bulletin of the New Zealand Institute</em></a> <strong>1</strong>: 79-142<!--MARK--> [Date published 29-V-1914]","","Article in Journal","85cdc9ad-e7e8-43ee-8d08-709ec7e5bd3e","20110829T06:20:25.409+0000","322c5156-5761-4fa2-868d-6010bc02d207"
"Capiomont, G.","1873","Monographie des Rhinocyllides","273-296","","Annales de la Société Entomologique de France","","","","<!--MARK--><a href='null1bb1229a-bda3-4c4c-893d-fcdddf58e284' class='mouseoverHref'>Capiomont, G. 1873. Monographie des Rhinocyllides.</a> <!--MARK--><!--MARK--><a href='null6462279b-2aaf-46a3-a434-cab7d8a2c33d' class='mouseoverHref'><em>Annales de la Société Entomologique de France</em></a> 5 <strong>3</strong>: 273-296<!--MARK-->","","Article in Journal","1bb1229a-bda3-4c4c-893d-fcdddf58e284","20120529T02:50:29.234+0000","6462279b-2aaf-46a3-a434-cab7d8a2c33d"
"Casey, T.L.","1892","Coleopterological notices. IV","359-712","","Annals of the New York Academy of Sciences","","","","<!--MARK--><a href='null52c9cc87-e632-4664-85d7-f7c5344c8f45' class='mouseoverHref'>Casey, T.L. 1892. Coleopterological notices. IV.</a> <!--MARK--><!--MARK--><a href='nullafd3dcfe-f2ab-4f0c-be4b-718fed82e4d8' class='mouseoverHref'><em>Annals of the New York Academy of Sciences</em></a> <strong>6</strong>: 359-712<!--MARK-->","","Article in Journal","52c9cc87-e632-4664-85d7-f7c5344c8f45","20120813T22:03:00.201+0000","afd3dcfe-f2ab-4f0c-be4b-718fed82e4d8"
"Casey, T.L.","1910","On some new species of Balaninini, Tychiini and related tribes.","114-144","","The Canadian Entomologist","","IV-1910","","<!--MARK--><a href='null082238e4-d3e9-4c1e-baad-ddd29e5b20f3' class='mouseoverHref'>Casey, T.L. 1910. On some new species of Balaninini, Tychiini and related tribes.</a> <!--MARK--><!--MARK--><a href='nullafc223f8-7d5d-4661-8292-b6784e1d5f5c' class='mouseoverHref'><em>The Canadian Entomologist</em></a> <strong>42</strong>(4): 114-144<!--MARK--> [Date published IV-1910]","","Article in Journal","082238e4-d3e9-4c1e-baad-ddd29e5b20f3","20110829T07:21:52.348+0000","afc223f8-7d5d-4661-8292-b6784e1d5f5c"
"Champion, G.C.","1910","Insecta. Coleoptera. Rhynchophora. Curculionidae. Curculioninae (concluded) and Calandrinae.","pp. 151-221","Biologia Centrali-Americana","","","","","<!--MARK--><a href='nullfd6bf57c-a30e-4492-933b-4f2d6be4bc3c' class='mouseoverHref'>Champion, G.C. 1910. Insecta. Coleoptera. Rhynchophora. Curculionidae. Curculioninae (concluded) and Calandrinae. pp. 151-221</a> <!--MARK--><em>in</em> <!--MARK--><a href='nulleadd4ad1-a142-4689-b873-8ec49c21a898' class='mouseoverHref'>Champion, G.C. <em>Biologia Centrali-Americana</em>. London : F.D. Godman & O. Salvin Vol. 4(7) vi + 221 pp.</a><!--MARK--> [Date published X-1910]","","Chapter in Book","fd6bf57c-a30e-4492-933b-4f2d6be4bc3c","20110830T00:37:22.739+0000","eadd4ad1-a142-4689-b873-8ec49c21a898"
"Chevrolat, L.A.A.","1871","Description de six coléoptères exotiques éclos a Paris","5-8","","Annales de la Société Entomologique de Belgique","","","","<!--MARK--><a href='null7b941dbd-42a4-43ef-a2f4-4bfac644cc57' class='mouseoverHref'>Chevrolat, L.A.A. 1871. Description de six coléoptères exotiques éclos a Paris.</a> <!--MARK--><!--MARK--><a href='null2880594b-9c24-4bbb-a9a9-e57974e121a1' class='mouseoverHref'><em>Annales de la Société Entomologique de Belgique</em></a> <strong>14</strong>: 5-8<!--MARK-->","","Article in Journal","7b941dbd-42a4-43ef-a2f4-4bfac644cc57","20120523T21:41:51.969+0000","2880594b-9c24-4bbb-a9a9-e57974e121a1"
"Csiki, E.","1934","Cleoninae.","1-152","","Coleopterorum Catalogus","","20-V-1934","","<!--MARK--><a href='nulld9b40cca-9426-4bce-a5d3-e87c5633911a' class='mouseoverHref'>Csiki, E. 1934. Cleoninae.</a> <!--MARK--><!--MARK--><a href='null2e5a4d68-569d-431e-a9a7-382557a2d5cb' class='mouseoverHref'><em>Coleopterorum Catalogus</em></a> <strong>134</strong>: 1-152<!--MARK--> [Date published 20-V-1934]","","Article in Journal","d9b40cca-9426-4bce-a5d3-e87c5633911a","20120326T06:49:24.903+0000","2e5a4d68-569d-431e-a9a7-382557a2d5cb"
"Cullen, J.M. & Sheppard, A.W.","2012","<i>Carduus nutans</i> L. -- nodding thistle","pp. 118-130","Biological control of weeds in Australia.","","","","","<!--MARK--><a href='null95560d8c-860b-45fe-8e57-7a0e3f90d12e' class='mouseoverHref'>Cullen, J.M. & Sheppard, A.W. 2012. <i>Carduus nutans</i> L. -- nodding thistle. pp. 118-130</a> <!--MARK--><em>in</em> <!--MARK--><a href='nulle9ffefc6-9b6a-414b-ad0e-61c0c645be91' class='mouseoverHref'>Julien, M.H., McFadyen, R.E.C. & Cullen, J.M. (eds). <em>Biological control of weeds in Australia</em>. Collingwood, Vic. : CSIRO Publishing. pp. i-xviii, 1-620.</a><!--MARK-->","","Chapter in Book","95560d8c-860b-45fe-8e57-7a0e3f90d12e","20120522T03:35:47.361+0000","e9ffefc6-9b6a-414b-ad0e-61c0c645be91"
"Dejean, P.F.M.A.","1821","Catalogue de la Collection de Coléoptères de M. le Baron Dejean","viii 136 pp.","","","","","Crevot, Libraire","<!--MARK--><a href='nullc5981f53-318a-4e58-988f-e9131223490f' class='mouseoverHref'>Dejean, P.F.M.A. 1821. <em>Catalogue de la Collection de Coléoptères de M. le Baron Dejean</em>. Paris : Crevot, Libraire viii 136 pp.</a><!--MARK-->","","Book","c5981f53-318a-4e58-988f-e9131223490f","20081009T05:11:37.000+0000",""
"Dejean, P.F.M.A.","1835","Catalogue des coléoptères de la collection de M. le comte Dejean","257-360","","","","22-VIII-1835","Méquignon-Marvis","<!--MARK--><a href='nulle3520e8c-9e87-44d0-8aec-ee3267337444' class='mouseoverHref'>Dejean, P.F.M.A. 1835. <em>Catalogue des coléoptères de la collection de M. le comte Dejean</em>. Paris : Méquignon-Marvis Part 4 2nd edn, pp. 257-360.</a><!--MARK--> [Date published 22-VIII-1835]","","Book","e3520e8c-9e87-44d0-8aec-ee3267337444","20150317T04:04:48.186+0000",""
"Desbrochers, J.","1891","Curculionides et Brenthides du Bengale occidental recueillis par le R.P. Cardon avec description d'espèces nouvelles.","CCCL-CCCLXI","","Annales de la Société Entomologique de Belgique (Comptes-rendus)","","","","<!--MARK--><a href='nullfee57459-7453-415c-925e-4a669559d4e5' class='mouseoverHref'>Desbrochers, J. 1891. Curculionides et Brenthides du Bengale occidental recueillis par le R.P. Cardon avec description d'espèces nouvelles.</a> <!--MARK--><!--MARK--><a href='nullacc7fcdb-707a-4cbe-8f70-d7595ac25c58' class='mouseoverHref'><em>Annales de la Société Entomologique de Belgique (Comptes-rendus)</em></a> <strong>35</strong>: CCCL-CCCLXI<!--MARK-->","","Article in Journal","fee57459-7453-415c-925e-4a669559d4e5","20120103T05:26:04.542+0000","acc7fcdb-707a-4cbe-8f70-d7595ac25c58"
"Desbrochers, J.","1893","Espèces inédites de Curculionides de l'Ancien Monde III.","9-14","","Le Frelon","","2-XII-1893","","<!--MARK--><a href='null5d052347-e729-46f9-90d0-acb7655d3bf4' class='mouseoverHref'>Desbrochers, J. 1893. Espèces inédites de Curculionides de l'Ancien Monde III.</a> <!--MARK--><!--MARK--><a href='nullf7621968-ed26-4cb3-ad03-4f2e372a7483' class='mouseoverHref'><em>Le Frelon</em></a> <strong>3</strong>(5): 9-14<!--MARK--> [Date published 2-XII-1893]","","Article in Journal","5d052347-e729-46f9-90d0-acb7655d3bf4","20120403T05:22:43.869+0000","f7621968-ed26-4cb3-ad03-4f2e372a7483"
"Desbrochers, J.","1904","Étude sur les Curculionides de la faune européenne et des bassins de la Méditerranée, en Afrique et en Asie, suivies de tableaux synoptiques.","65-80","","Le Frelon","","28-III-1904","","<!--MARK--><a href='null93233a32-a090-4a84-938c-be52174f2b54' class='mouseoverHref'>Desbrochers, J. 1904. Étude sur les Curculionides de la faune européenne et des bassins de la Méditerranée, en Afrique et en Asie, suivies de tableaux synoptiques.</a> <!--MARK--><!--MARK--><a href='nullf7621968-ed26-4cb3-ad03-4f2e372a7483' class='mouseoverHref'><em>Le Frelon</em></a> <strong>12</strong>(5): 65-80<!--MARK--> [Date published 28-III-1904]","","Article in Journal","93233a32-a090-4a84-938c-be52174f2b54","20120403T05:38:57.196+0000","f7621968-ed26-4cb3-ad03-4f2e372a7483"
