"PUB_AUTHOR","PUB_YEAR","PUB_TITLE","PUB_PAGES","PUB_PARENT_BOOK_TITLE","PUB_PARENT_JOURNAL_TITLE","PUB_PARENT_ARTICLE_TITLE","PUB_PUBLICATION_DATE","PUB_PUBLISHER","PUB_FORMATTED","PUB_QUALIFICATION","PUB_TYPE","PUBLICATION_GUID","PUBLICATION_LAST_UPDATE","PARENT_PUBLICATION_GUID"
"Desbrochers des Loges, J.","1904","Études sur les Curculionides de la faune européenne et des bassins de la Méditerranée, en Afrique et en Asie, suivies de tableaux synoptiques.","81-96","","Le Frelon","","","","<!--MARK--><a href='null61bd4ea5-1a02-4879-9767-1384334711b8' class='mouseoverHref'>Desbrochers des Loges, J. 1904. Études sur les Curculionides de la faune européenne et des bassins de la Méditerranée, en Afrique et en Asie, suivies de tableaux synoptiques.</a> <!--MARK--><!--MARK--><a href='nullf7621968-ed26-4cb3-ad03-4f2e372a7483' class='mouseoverHref'><em>Le Frelon</em></a> <strong>12</strong>(6): 81-96<!--MARK-->","","Article in Journal","61bd4ea5-1a02-4879-9767-1384334711b8","20150407T07:22:21.362+0000","f7621968-ed26-4cb3-ad03-4f2e372a7483"
"Donovan, E.","1805","An Epitome of the Natural History of the Insects of New Holland, New Zealand, New Guinea, Otaheite, and other Islands in the Indian, Southern, and Pacific Oceans: including Figures and Descriptions of One Hundred and Fifty-three Species of the more Splendid, Beautiful, and Interesting Insects, hitherto Discovered in those Countries, and which for the most Part have not appeared in the Works of any Preceding Author.","iv + [167] pp. + [41] pls","","","","January","Rivington","<!--MARK--><a href='null2a5de61b-c80e-4b9b-8705-937135fbc75b' class='mouseoverHref'>Donovan, E. 1805. <em>An Epitome of the Natural History of the Insects of New Holland, New Zealand, New Guinea, Otaheite, and other Islands in the Indian, Southern, and Pacific Oceans: including Figures and Descriptions of One Hundred and Fifty-three Species of the more Splendid, Beautiful, and Interesting Insects, hitherto Discovered in those Countries, and which for the most Part have not appeared in the Works of any Preceding Author</em>. London : Rivington iv + [167] pp. + [41] pls.</a><!--MARK--> [Date published January]","","Book","2a5de61b-c80e-4b9b-8705-937135fbc75b","20150408T01:26:08.794+0000",""
"Donovan, E.","1811","The Natural History of British Insects; Explaining them in their Several States, with the Periods of their Transformations, their Food, Oeconomy, &c., together with History of such Minute Insects as require Investigation by the Microscope, the Whole Illustrated by Coloured Figures, designed and executed from Living Specimens. Vol. XV.","83 pp., pls dv-dxl","","","","","The Author, F. C. and J. Rivington","<!--MARK--><a href='null81959d0c-0db7-4ff5-88ed-4ee2eedaff96' class='mouseoverHref'>Donovan, E. 1811. <em>The Natural History of British Insects; Explaining them in their Several States, with the Periods of their Transformations, their Food, Oeconomy, &c., together with History of such Minute Insects as require Investigation by the Microscope, the Whole Illustrated by Coloured Figures, designed and executed from Living Specimens. Vol. XV</em>. London : The Author, F. C. and J. Rivington 83 pp., pls dv-dxl.</a><!--MARK-->","","Book","81959d0c-0db7-4ff5-88ed-4ee2eedaff96","20150407T23:54:13.367+0000",""
"Elston, A.H.","1919","Australian Coleoptera - Part 1 Paussidae","342-348","","Transactions of the Royal Society of South Australia","","","","<!--MARK--><a href='null2b0e87a6-1f83-42c6-ad73-e3f9d8e948c7' class='mouseoverHref'>Elston, A.H. 1919. Australian Coleoptera - Part 1 Paussidae.</a> <!--MARK--><!--MARK--><a href='null8b48b0a3-dd7a-4aea-be0d-10a223710ebc' class='mouseoverHref'><em>Transactions of the Royal Society of South Australia</em></a> <strong>43</strong>: 342-348<!--MARK-->","","Article in Journal","2b0e87a6-1f83-42c6-ad73-e3f9d8e948c7","20081009T05:11:37.000+0000","8b48b0a3-dd7a-4aea-be0d-10a223710ebc"
"Erbey, M. & Candan, S.","2010","Description of surface morphology in male and female genitals of <i>Lixus cardui</i> Olivier, 1807 (Coleoptera: Curculionidae: Lixinae): a scanning electron microscope study","321-329","","Acta Zoologica Bulgarica","","XII-2010","","<!--MARK--><a href='nulle4c902f1-1d69-431d-8ca5-758b8891f16e' class='mouseoverHref'>Erbey, M. & Candan, S. 2010. Description of surface morphology in male and female genitals of <i>Lixus cardui</i> Olivier, 1807 (Coleoptera: Curculionidae: Lixinae): a scanning electron microscope study.</a> <!--MARK--><!--MARK--><a href='null30810c8c-0568-494b-992a-0be4926198b8' class='mouseoverHref'><em>Acta Zoologica Bulgarica</em></a> <strong>62</strong>(3): 321-329<!--MARK--> [Date published XII-2010]","","Article in Journal","e4c902f1-1d69-431d-8ca5-758b8891f16e","20120515T21:40:41.394+0000","30810c8c-0568-494b-992a-0be4926198b8"
"Erichson, W.F.","1842","Beitrag zur Insecten-fauna von Vandiemensland, mit besonderer Berucksichtigung der geographischen Verbreitung der Insecten","83-287, pls 4, 5","","Archiv für Naturgeschichte","","","","<!--MARK--><a href='null2ae5a27f-fd1b-4bb9-b72e-a5997ccf96b3' class='mouseoverHref'>Erichson, W.F. 1842. Beitrag zur Insecten-fauna von Vandiemensland, mit besonderer Berucksichtigung der geographischen Verbreitung der Insecten.</a> <!--MARK--><!--MARK--><a href='nullf5b5f7c7-fc53-4502-951d-1c96b680d874' class='mouseoverHref'><em>Archiv für Naturgeschichte</em></a> <strong>8</strong>(1): 83-287, pls 4, 5<!--MARK-->","","Article in Journal","2ae5a27f-fd1b-4bb9-b72e-a5997ccf96b3","20120514T22:59:43.847+0000","f5b5f7c7-fc53-4502-951d-1c96b680d874"
"Fabricius, J.C.","1775","Systema Entomologiae, sistens Insectorum Classes, Ordines, Genera, Species, adiectis Synonymis, Locis, Descriptionibus, Observationibus","xxxii 832 pp.","","","","17 April","Kortii","<!--MARK--><a href='nullda77a1b5-cdfa-4c8b-a4fa-3ba1ead48929' class='mouseoverHref'>Fabricius, J.C. 1775. <em>Systema Entomologiae, sistens Insectorum Classes, Ordines, Genera, Species, adiectis Synonymis, Locis, Descriptionibus, Observationibus</em>. Flensburgi et Lipsiae [= Flensburg & Leipzig] : Kortii xxxii 832 pp.</a><!--MARK--> [Date published 17 April]","","Book","da77a1b5-cdfa-4c8b-a4fa-3ba1ead48929","20110508T01:53:06.371+0000",""
"Fabricius, J.C.","1801","Systema Eleutheratorum secundum ordines, genera, species: adiectis synonymis, locis, observationibus, descriptionibus","687 pp.","","","","","Bibliopolii Academici Novi","<!--MARK--><a href='nulla5a52414-6888-4275-bd26-dc03741a5960' class='mouseoverHref'>Fabricius, J.C. 1801. <em>Systema Eleutheratorum secundum ordines, genera, species: adiectis synonymis, locis, observationibus, descriptionibus</em>. Kiliae : Bibliopolii Academici Novi Vol. II 687 pp.</a><!--MARK-->","","Book","a5a52414-6888-4275-bd26-dc03741a5960","20150309T23:18:09.399+0000",""
"Fairmaire, L.","1849","Essai sur les Coléoptères de la Polynesie","227-291, 352-365, 410-422, 445-460, 504-516, 550-559","","Revue et Magasin de Zoologie (Paris)","","","","<!--MARK--><a href='null15ba9f73-0bff-4a61-9808-665302969ae2' class='mouseoverHref'>Fairmaire, L. 1849. Essai sur les Coléoptères de la Polynesie.</a> <!--MARK--><!--MARK--><a href='nulldb688e1b-7165-434e-a1c0-eec6a75c5f67' class='mouseoverHref'><em>Revue et Magasin de Zoologie (Paris)</em></a> 2 <strong>1</strong>: 227-291, 352-365, 410-422, 445-460, 504-516, 550-559<!--MARK-->","","Article in Journal","15ba9f73-0bff-4a61-9808-665302969ae2","20110121T01:01:21.839+0000","db688e1b-7165-434e-a1c0-eec6a75c5f67"
"Fairmaire, L.","1878","Diagnoses de Coléoptères des Iles Viti, Samoa, etc. (suite)","282","","Petites Nouvelles Entomologiques","","","","<!--MARK--><a href='null4eb45a0f-9bf1-4d88-9005-6f3f5d54ab87' class='mouseoverHref'>Fairmaire, L. 1878. Diagnoses de Coléoptères des Iles Viti, Samoa, etc. (suite).</a> <!--MARK--><!--MARK--><a href='null0f4a0caa-1da0-4af1-bdee-a55f4114ea2f' class='mouseoverHref'><em>Petites Nouvelles Entomologiques</em></a> <strong>2</strong>(209): 282<!--MARK-->","","Article in Journal","4eb45a0f-9bf1-4d88-9005-6f3f5d54ab87","20190125T03:42:38.793+0000","0f4a0caa-1da0-4af1-bdee-a55f4114ea2f"
"Fairmaire, L.","1881","Essai sur les Coléoptères des îles Viti (Fidgi)","242-318","","Annales de la Société Entomologique de France","","","","<!--MARK--><a href='nullfba0620d-6973-4ed3-965d-e8d0953f4008' class='mouseoverHref'>Fairmaire, L. 1881. Essai sur les Coléoptères des îles Viti (Fidgi).</a> <!--MARK--><!--MARK--><a href='null6462279b-2aaf-46a3-a434-cab7d8a2c33d' class='mouseoverHref'><em>Annales de la Société Entomologique de France</em></a> 6 <strong>1</strong>: 242-318<!--MARK-->","","Article in Journal","fba0620d-6973-4ed3-965d-e8d0953f4008","","6462279b-2aaf-46a3-a434-cab7d8a2c33d"
"Fairmaire, L.","1883","Essai sur les Coléoptères de l'archipel de la Nouvelle-Bretagne","1-58","","Annales de la Société Entomologique de Belgique (Comptes-rendus)","","","","<!--MARK--><a href='nullbfe2b8ba-a4bc-4d74-92ff-e51b42da2b25' class='mouseoverHref'>Fairmaire, L. 1883. Essai sur les Coléoptères de l'archipel de la Nouvelle-Bretagne.</a> <!--MARK--><!--MARK--><a href='nullacc7fcdb-707a-4cbe-8f70-d7595ac25c58' class='mouseoverHref'><em>Annales de la Société Entomologique de Belgique (Comptes-rendus)</em></a> <strong>27</strong>(2): 1-58<!--MARK-->","","Article in Journal","bfe2b8ba-a4bc-4d74-92ff-e51b42da2b25","20081009T05:11:37.000+0000","acc7fcdb-707a-4cbe-8f70-d7595ac25c58"
"Faust, J.","1892","Notizen über Rüsselkäfer.","44-52","","Stettiner Entomologische Zeitung","","","","<!--MARK--><a href='nulla5b5f0d6-5541-4ae4-b574-b2e87b403f74' class='mouseoverHref'>Faust, J. 1892. Notizen über Rüsselkäfer.</a> <!--MARK--><!--MARK--><a href='null465e4fb4-3888-447c-909a-af4f7a23b95d' class='mouseoverHref'><em>Stettiner Entomologische Zeitung</em></a> <strong>53</strong>: 44-52<!--MARK-->","","Article in Journal","a5b5f0d6-5541-4ae4-b574-b2e87b403f74","","465e4fb4-3888-447c-909a-af4f7a23b95d"
"Faust, J.","1898","Curculioniden aus dem Malayischen und Polynesichen Inselgebiet II.","140-214","","Stettiner Entomologische Zeitung","","","","<!--MARK--><a href='null491d7c1e-425e-47fb-816e-7e0ae6c76147' class='mouseoverHref'>Faust, J. 1898. Curculioniden aus dem Malayischen und Polynesichen Inselgebiet II.</a> <!--MARK--><!--MARK--><a href='null465e4fb4-3888-447c-909a-af4f7a23b95d' class='mouseoverHref'><em>Stettiner Entomologische Zeitung</em></a> <strong>59</strong>: 140-214<!--MARK-->","","Article in Journal","491d7c1e-425e-47fb-816e-7e0ae6c76147","","465e4fb4-3888-447c-909a-af4f7a23b95d"
"Faust, J.","1899","Viaggio di Lamberto Loria nella Papuasia Orientale xxiii. Curculionidae [Curculionidae von Neu Guinea]","1-130","","Annali del Museo Civico di Storia Naturale, Genova","","","","<!--MARK--><a href='null19dedd1c-b78f-459e-b97f-7ee7b3dd7d4a' class='mouseoverHref'>Faust, J. 1899. Viaggio di Lamberto Loria nella Papuasia Orientale xxiii. Curculionidae [Curculionidae von Neu Guinea].</a> <!--MARK--><!--MARK--><a href='null461059ea-ead7-4f6d-83f4-52913f06d09f' class='mouseoverHref'><em>Annali del Museo Civico di Storia Naturale, Genova</em></a> 2 <strong>20</strong>: 1-130<!--MARK-->","","Article in Journal","19dedd1c-b78f-459e-b97f-7ee7b3dd7d4a","20170407T02:06:27.416+0000","461059ea-ead7-4f6d-83f4-52913f06d09f"
"Fauvel, A.","1862","Coléoptères de la Nouvelle-Calédonie, recueillis par M.E. Déplanche, chirugien de la marine impériale (1858-59-60). Notices entomologiques, premiere partie.","120-185, pls 9-10, 10bis","","Bulletin de la Société Linnéenne de Normandie","","","","<!--MARK--><a href='null1667cadd-9291-4ae3-a224-d70d87dbb8b5' class='mouseoverHref'>Fauvel, A. 1862. Coléoptères de la Nouvelle-Calédonie, recueillis par M.E. Déplanche, chirugien de la marine impériale (1858-59-60). Notices entomologiques, premiere partie.</a> <!--MARK--><!--MARK--><a href='nullee1e2e0c-7d8d-41c9-b98c-b6fda2d5b0c0' class='mouseoverHref'><em>Bulletin de la Société Linnéenne de Normandie</em></a> <strong>7</strong>: 120-185, pls 9-10, 10bis<!--MARK-->","","Article in Journal","1667cadd-9291-4ae3-a224-d70d87dbb8b5","","ee1e2e0c-7d8d-41c9-b98c-b6fda2d5b0c0"
"Fiedler, C.","1940","Monograph of the South American Weevils of the Genus Conotrachelus","v + 365 pp.","","","","","British Museum (Natural History)","<!--MARK--><a href='nullbdc040f8-cc1b-41ea-bd04-7a4611cbaa5b' class='mouseoverHref'>Fiedler, C. 1940. <em>Monograph of the South American Weevils of the Genus Conotrachelus</em>. London : British Museum (Natural History) v + 365 pp.</a><!--MARK-->","","Book","bdc040f8-cc1b-41ea-bd04-7a4611cbaa5b","20150317T04:07:30.693+0000",""
"Froggatt, W.W.","1901","Entomological work and notes for 1900.","794-805, 2 pls","","Agricultural Gazette of New South Wales","","","","<!--MARK--><a href='null34977677-d3d0-495d-8028-cd031711368f' class='mouseoverHref'>Froggatt, W.W. 1901. Entomological work and notes for 1900.</a> <!--MARK--><!--MARK--><a href='null4197a935-3630-406b-b88e-759e63272a02' class='mouseoverHref'><em>Agricultural Gazette of New South Wales</em></a> <strong>12</strong>: 794-805, 2 pls<!--MARK-->","","Article in Journal","34977677-d3d0-495d-8028-cd031711368f","20120326T06:38:48.905+0000","4197a935-3630-406b-b88e-759e63272a02"
"Frölich, J.A.","1792","Bermerkungen über einige seltene Käfer aus der Insecten-Sammlung des Hr. Rudolph in Erlangen","68-165","","Der Naturforscher","","","","<!--MARK--><a href='nulla3ae8f76-0cbb-40fb-a0ed-79f60ad61ecb' class='mouseoverHref'>Frölich, J.A. 1792. Bermerkungen über einige seltene Käfer aus der Insecten-Sammlung des Hr. Rudolph in Erlangen.</a> <!--MARK--><!--MARK--><a href='null228eb187-da2a-44c9-8b4f-200db8a76bde' class='mouseoverHref'><em>Der Naturforscher</em></a> <strong>26</strong>: 68-165<!--MARK-->","","Article in Journal","a3ae8f76-0cbb-40fb-a0ed-79f60ad61ecb","20120529T01:47:04.216+0000","228eb187-da2a-44c9-8b4f-200db8a76bde"
"Gahan, C.J.","1900","Order 4. Coleoptera","89-127","A Monograph of Christmas Island (Indian Ocean): physical features and geology; with descriptions of the fauna and flora by numerous contributors","","","","","<!--MARK--><a href='null4ce51608-f786-4224-9820-6734c3d82253' class='mouseoverHref'>Gahan, C.J. 1900. Order 4. Coleoptera. pp. 89-127</a> <!--MARK--><em>in</em> <!--MARK--><a href='null57813ba9-0a9a-466d-a644-d9d62e6fee70' class='mouseoverHref'>Andrews, C.W. (ed.). <em>A Monograph of Christmas Island (Indian Ocean): physical features and geology; with descriptions of the fauna and flora by numerous contributors</em>. London : British Museum (Natural History) xiii 337 pp.</a><!--MARK-->","","Chapter in Book","4ce51608-f786-4224-9820-6734c3d82253","20081009T05:11:37.000+0000","57813ba9-0a9a-466d-a644-d9d62e6fee70"
"Gemminger, M. & Harold, E. von","1871","Catalogus Coleopterorum hucusque descriptorum synonymicus et systematicus.","pp. 2181-2668 + Index Generum 10 pp.","","","","","E.H. Gummi","<!--MARK--><a href='nullc9ec1e66-a47d-4838-86dc-2805884ae976' class='mouseoverHref'>Gemminger, M. & Harold, E. von 1871. <em>Catalogus Coleopterorum hucusque descriptorum synonymicus et systematicus</em>. Monachii [Munich] : E.H. Gummi Vol. 8. Curculionidae pp. 2181-2668 + Index Generum 10 pp.</a><!--MARK-->","","Book","c9ec1e66-a47d-4838-86dc-2805884ae976","20120723T04:32:24.406+0000",""
"Gerbi, R.","1794","Storia naturale di un nuovo insetto","pp.","","","","","","<!--MARK--><a href='nulle6c23175-24f0-414e-a3fa-e0faf0be1594' class='mouseoverHref'>Gerbi, R. 1794. <em>Storia naturale di un nuovo insetto</em>. Firenze pp.</a><!--MARK-->","","Book","e6c23175-24f0-414e-a3fa-e0faf0be1594","20120529T01:48:35.090+0000",""
"Germain, E.F.","1848","Beiträge zur Insektenfauna von Adelaide.","153-247","","Linnaea Entomologica","","","","<!--MARK--><a href='nulla30fc011-fd68-429c-846c-c82e2462c71b' class='mouseoverHref'>Germain, E.F. 1848. Beiträge zur Insektenfauna von Adelaide.</a> <!--MARK--><!--MARK--><a href='null1bd3bf76-d7c0-4a57-98cf-a1c6278fdaac' class='mouseoverHref'><em>Linnaea Entomologica</em></a> <strong>3</strong>: 153-247<!--MARK-->","","Article in Journal","a30fc011-fd68-429c-846c-c82e2462c71b","20190123T02:22:23.790+0000","1bd3bf76-d7c0-4a57-98cf-a1c6278fdaac"
"Germar, E.F.","1817","Miscellen und Correspondenz-Nachrichten.","339-341","","Magazin der Entomologie","","","","<!--MARK--><a href='null8f8e17c6-6c71-48d6-8f31-67c7f8ff94c1' class='mouseoverHref'>Germar, E.F. 1817. Miscellen und Correspondenz-Nachrichten.</a> <!--MARK--><!--MARK--><a href='null606b902f-5fbe-4db8-a10d-aa67e8250a8f' class='mouseoverHref'><em>Magazin der Entomologie</em></a> <strong>2</strong>: 339-341<!--MARK-->","","Article in Journal","8f8e17c6-6c71-48d6-8f31-67c7f8ff94c1","20110909T00:55:04.897+0000","606b902f-5fbe-4db8-a10d-aa67e8250a8f"
"Germar, E.F.","1817","Reise nach Dalmatien und in das Gebiet von Ragusa. Mit 9 illum. Kupfern und 2 Charten.","xii + 323 pp.","","","","","F. A. Brockhaus","<!--MARK--><a href='null8713eaba-33a7-46be-bb82-1f3413eb7d8c' class='mouseoverHref'>Germar, E.F. 1817. <em>Reise nach Dalmatien und in das Gebiet von Ragusa. Mit 9 illum. Kupfern und 2 Charten</em>. Leipzig und Altenburg : F. A. Brockhaus xii + 323 pp.</a><!--MARK-->","","Book","8713eaba-33a7-46be-bb82-1f3413eb7d8c","20150407T23:42:27.382+0000",""
"Germar, E.F.","1819","Versuch einer Eintheilung der Horde der Rüsselkäfer in mehrere Gattungen.","116-139","","Annalen der Wetterauischen Gesellschaft fur die Gesampte Naturkunde","","","","<!--MARK--><a href='nulleae73042-669a-4f50-b60c-88ba25c6622f' class='mouseoverHref'>Germar, E.F. 1819. Versuch einer Eintheilung der Horde der Rüsselkäfer in mehrere Gattungen.</a> <!--MARK--><!--MARK--><a href='nullc13ffc47-41d0-4231-9c14-89a0f1296d40' class='mouseoverHref'><em>Annalen der Wetterauischen Gesellschaft fur die Gesampte Naturkunde</em></a> <strong>4</strong>: 116-139<!--MARK-->","","Article in Journal","eae73042-669a-4f50-b60c-88ba25c6622f","","c13ffc47-41d0-4231-9c14-89a0f1296d40"
"Gistel, J.","1848","Naturgeschichte des Thierreichs für höhere schulen bearbeitet","xvi 216 pp., 32 pls","","","","","","<!--MARK--><a href='nullba7c0e60-5b8b-4422-aed4-9003721a7d38' class='mouseoverHref'>Gistel, J. 1848. <em>Naturgeschichte des Thierreichs für höhere schulen bearbeitet</em>. Stuttgart xvi 216 pp., 32 pls.</a><!--MARK-->","","Book","ba7c0e60-5b8b-4422-aed4-9003721a7d38","20110915T01:47:52.336+0000",""
"Gültekin, L. & Perrin, H.","2011","Study of a part of the A.G. Olivier Lixini collection (Coleoptera: Curculionidae): lectotype designations, new synonymies and nomenclatural acts.","45-57","","Zootaxa","","7-VII-2011","","<!--MARK--><a href='null43199aa3-42b0-4ad5-81eb-3982ab1100be' class='mouseoverHref'>Gültekin, L. & Perrin, H. 2011. Study of a part of the A.G. Olivier Lixini collection (Coleoptera: Curculionidae): lectotype designations, new synonymies and nomenclatural acts.</a> <!--MARK--><!--MARK--><a href='null96466227-221c-4922-ac97-1ac2dd946d0a' class='mouseoverHref'><em>Zootaxa</em></a> <strong>2943</strong>: 45-57<!--MARK--> [Date published 7-VII-2011]","","Article in Journal","43199aa3-42b0-4ad5-81eb-3982ab1100be","20120412T01:11:51.962+0000","96466227-221c-4922-ac97-1ac2dd946d0a"
"Günther, K.","1937","Über einige Curculioniden von den Salomon-Inseln (Col.).","37-43","","Mitteilungen der Deutschen Entomologischen Gesellschaft","","","","<!--MARK--><a href='null9a2bca37-4f30-4ca2-bbbf-96cb8433c3aa' class='mouseoverHref'>Günther, K. 1937. Über einige Curculioniden von den Salomon-Inseln (Col.).</a> <!--MARK--><!--MARK--><a href='nulldfcc29cb-9481-49f7-82df-84a188988db3' class='mouseoverHref'><em>Mitteilungen der Deutschen Entomologischen Gesellschaft</em></a> <strong>8</strong>(3): 37-43<!--MARK-->","","Article in Journal","9a2bca37-4f30-4ca2-bbbf-96cb8433c3aa","20120125T05:06:17.697+0000","dfcc29cb-9481-49f7-82df-84a188988db3"
"Gyllenhal,  L.in Schoenherr, C.J.","1835","Genera et species curculionidum, cum synonymia hujus familiae. Species novae aut hactenus minus cognitae, descriptionibus a Dom. Leonardo Gyllenhal, C.H. Boheman, et entomologis aliis illustratae","pp. 1-505","","","","","Roret","<!--MARK--><a href='null416d5681-f1a0-4bda-8708-279c64d4c176' class='mouseoverHref'>Gyllenhal,  L.in Schoenherr, C.J. 1835. <em>Genera et species curculionidum, cum synonymia hujus familiae. Species novae aut hactenus minus cognitae, descriptionibus a Dom. Leonardo Gyllenhal, C.H. Boheman, et entomologis aliis illustratae</em>. Paris : Roret Vol. 3(1) pp. 1-505.</a><!--MARK-->","","Book","416d5681-f1a0-4bda-8708-279c64d4c176","20120529T02:55:32.203+0000",""
"Hawkeswood, T.J.","1987","Beetles of Australia","248 pp.","","","","","Angus & Robertson","<!--MARK--><a href='null3c69e15b-d5e6-4995-9e8f-07aa967d5004' class='mouseoverHref'>Hawkeswood, T.J. 1987. <em>Beetles of Australia</em>. North Ryde, NSW : Angus & Robertson 248 pp.</a><!--MARK-->","","Book","3c69e15b-d5e6-4995-9e8f-07aa967d5004","20111128T05:57:22.061+0000",""
"Heard, T.A., Forno, I.W. & Burcher, J.A.","1999","<i>Chalcodermus serripes</i> (Coleoptera: Curculionidae) for biological control of <i>Mimosa pigra</i>: host relations and life cycle","1-9","","Biological Control","","","","<!--MARK--><a href='null05e066a5-5f68-45f3-9f18-9c8841354037' class='mouseoverHref'>Heard, T.A., Forno, I.W. & Burcher, J.A. 1999. <i>Chalcodermus serripes</i> (Coleoptera: Curculionidae) for biological control of <i>Mimosa pigra</i>: host relations and life cycle.</a> <!--MARK--><!--MARK--><a href='null09653e18-e7a3-41ba-b1a8-09853477b149' class='mouseoverHref'><em>Biological Control</em></a> <strong>15</strong>: 1-9<!--MARK-->","","Article in Journal","05e066a5-5f68-45f3-9f18-9c8841354037","20120515T21:53:11.106+0000","09653e18-e7a3-41ba-b1a8-09853477b149"
"Heller, K.M.","1893","Zygopiden-Studien mit besonderer Beru?cksichtigung der Gattung <i>Mecopus</i>","1-48, 1 pl.","","Abhandlungen und Berichte des Königlichen Zoologischen und Anthropologische-Ethnographischen Museums zu Dresden","","","","<!--MARK--><a href='null59f553c4-0a2f-4ecd-94ef-be72cde6e26e' class='mouseoverHref'>Heller, K.M. 1893. Zygopiden-Studien mit besonderer Beru?cksichtigung der Gattung <i>Mecopus</i>.</a> <!--MARK--><!--MARK--><a href='null7888a1f2-a75a-4a2f-a157-e192509a63bb' class='mouseoverHref'><em>Abhandlungen und Berichte des Königlichen Zoologischen und Anthropologische-Ethnographischen Museums zu Dresden</em></a> <strong>4</strong>(2): 1-48, 1 pl.<!--MARK-->","","Article in Journal","59f553c4-0a2f-4ecd-94ef-be72cde6e26e","20120515T21:53:40.514+0000","7888a1f2-a75a-4a2f-a157-e192509a63bb"
"Heller, K.M.","1917","Die Philippinischen Arten der Rüsselkäfergattung <I>Alcides </I>Schoen.","209-245","","Stettiner Entomologische Zeitung","","","","<!--MARK--><a href='null0f654ae1-6174-41e6-95a9-4579c7c24d22' class='mouseoverHref'>Heller, K.M. 1917. Die Philippinischen Arten der Rüsselkäfergattung <I>Alcides </I>Schoen.</a> <!--MARK--><!--MARK--><a href='null465e4fb4-3888-447c-909a-af4f7a23b95d' class='mouseoverHref'><em>Stettiner Entomologische Zeitung</em></a> <strong>78</strong>: 209-245<!--MARK-->","","Article in Journal","0f654ae1-6174-41e6-95a9-4579c7c24d22","","465e4fb4-3888-447c-909a-af4f7a23b95d"
"Heller, K.M.","1922","New Philippine Coleoptera","523-627, pls 1-3","","Philippine Journal of Science","","15 February 1922","","<!--MARK--><a href='null40124684-5e57-43ec-9950-9d1062ac5da2' class='mouseoverHref'>Heller, K.M. 1922. New Philippine Coleoptera.</a> <!--MARK--><!--MARK--><a href='null0347b709-e2f0-4679-8749-33668856b97f' class='mouseoverHref'><em>Philippine Journal of Science</em></a> <strong>19</strong>(5): 523-627, pls 1-3<!--MARK--> [Date published 15 February 1922]","","Article in Journal","40124684-5e57-43ec-9950-9d1062ac5da2","20131004T00:00:21.065+0000","0347b709-e2f0-4679-8749-33668856b97f"
"Heller, K.M.","1941","<I>Peribleptus</I> Schönh. und <I>Carcilia</I> Roelofs (Coleoptera Curculionidae, Hylobiinae)","78-83","","Entomologische Blätter","","","","<!--MARK--><a href='nullfdc1d0d9-a502-4fc6-a8e4-a04ce951f306' class='mouseoverHref'>Heller, K.M. 1941. <I>Peribleptus</I> Schönh. und <I>Carcilia</I> Roelofs (Coleoptera Curculionidae, Hylobiinae).</a> <!--MARK--><!--MARK--><a href='nulla4ae2141-5f28-40ed-8d5f-f1e9aebf1631' class='mouseoverHref'><em>Entomologische Blätter</em></a> <strong>37</strong>(2): 78-83<!--MARK-->","","Article in Journal","fdc1d0d9-a502-4fc6-a8e4-a04ce951f306","20120117T00:34:43.369+0000","a4ae2141-5f28-40ed-8d5f-f1e9aebf1631"
"Herbst, J.F.W.","1783","Kritisches Verzeichniss meiner Insektensammlung.","1-72","","Archiv der Insectengeschichte","","","","<!--MARK--><a href='nulldf9db69d-e0ad-4e10-bcc0-6735c546c817' class='mouseoverHref'>Herbst, J.F.W. 1783. Kritisches Verzeichniss meiner Insektensammlung.</a> <!--MARK--><!--MARK--><a href='nulla848a01d-8ad8-4abb-95aa-f9454be4c779' class='mouseoverHref'><em>Archiv der Insectengeschichte</em></a> <strong>4</strong>: 1-72<!--MARK-->","","Article in Journal","df9db69d-e0ad-4e10-bcc0-6735c546c817","20120411T03:04:09.788+0000","a848a01d-8ad8-4abb-95aa-f9454be4c779"
"Herbst, J.F.W.","1795","Natursystem aller bekannten in- und ausländischen Insekten, als eine Fortsetzung der von Büffonschen naturgeschichte. Der Käfer.","pp. i-xxiv, 1-520, pl. LX-XCV","","","","","Pauli.","<!--MARK--><a href='null560f58f7-3bb0-4f80-aa9b-5ac339bd9084' class='mouseoverHref'>Herbst, J.F.W. 1795. <em>Natursystem aller bekannten in- und ausländischen Insekten, als eine Fortsetzung der von Büffonschen naturgeschichte. Der Käfer</em>. Berlin : Pauli. Vol. 6 pp. i-xxiv, 1-520, pl. LX-XCV.</a><!--MARK-->","","Book","560f58f7-3bb0-4f80-aa9b-5ac339bd9084","20110914T02:16:12.646+0000",""
