"PUB_AUTHOR","PUB_YEAR","PUB_TITLE","PUB_PAGES","PUB_PARENT_BOOK_TITLE","PUB_PARENT_JOURNAL_TITLE","PUB_PARENT_ARTICLE_TITLE","PUB_PUBLICATION_DATE","PUB_PUBLISHER","PUB_FORMATTED","PUB_QUALIFICATION","PUB_TYPE","PUBLICATION_GUID","PUBLICATION_LAST_UPDATE","PARENT_PUBLICATION_GUID"
"Böving, A.G.","1914","Notes on the larva of <i>Hydroscapha</i> and some other aquatic larvae from Arizona","55-61","","Proceedings of the Entomological Society of Washington","","","","<!--MARK--><a href='../publication/b7cfa86d-b3ef-46af-9291-45459bb50bb2' class='mouseoverHref'>Böving, A.G. 1914. Notes on the larva of <i>Hydroscapha</i> and some other aquatic larvae from Arizona.</a> <!--MARK--><!--MARK--><a href='../publication/4ba9cd44-fd2a-4a01-b171-da890c5efd6b' class='mouseoverHref'><em>Proceedings of the Entomological Society of Washington</em></a> <strong>16</strong>: 55-61<!--MARK-->","","Article in Journal","b7cfa86d-b3ef-46af-9291-45459bb50bb2","20081009T05:11:37.000+0000","4ba9cd44-fd2a-4a01-b171-da890c5efd6b"
"Britton, E.B.","1966","On the larva of <i>Sphaerius</i> and the systematic position of the Sphaeriidae (Coleoptera)","1193-1198","","Australian Journal of Zoology","","","","<!--MARK--><a href='../publication/74673e5a-c866-4a4a-863f-41c240f16f4b' class='mouseoverHref'>Britton, E.B. 1966. On the larva of <i>Sphaerius</i> and the systematic position of the Sphaeriidae (Coleoptera).</a> <!--MARK--><!--MARK--><a href='../publication/53c3abd8-0254-4532-a73e-d9ef6b7ac2ef' class='mouseoverHref'><em>Australian Journal of Zoology</em></a> <strong>14</strong>: 1193-1198<!--MARK-->","","Article in Journal","74673e5a-c866-4a4a-863f-41c240f16f4b","20081009T05:11:37.000+0000","53c3abd8-0254-4532-a73e-d9ef6b7ac2ef"
"Crowson, R.A.","1955","The Natural Classification of the Families of Coleoptera","187 pp.","","","","","Nathaniel Lloyd & Co.","<!--MARK--><a href='../publication/1c45f48d-0c8a-4a26-8e92-a2fcb22b8cfa' class='mouseoverHref'>Crowson, R.A. 1955. <em>The Natural Classification of the Families of Coleoptera</em>. London : Nathaniel Lloyd & Co. 187 pp.</a><!--MARK-->","","Book","1c45f48d-0c8a-4a26-8e92-a2fcb22b8cfa","20081009T05:11:37.000+0000",""
"Crowson, R.A.","1960","The phylogeny of the Coleoptera.","111-134","","Annual Review of Entomology","","","","<!--MARK--><a href='../publication/ef663dc8-85c8-4a83-b9e7-69ffd3527fbc' class='mouseoverHref'>Crowson, R.A. 1960. The phylogeny of the Coleoptera.</a> <!--MARK--><!--MARK--><a href='../publication/cc85b9ce-6e1b-4ac5-8838-d0eb402d4a9e' class='mouseoverHref'><em>Annual Review of Entomology</em></a> <strong>5</strong>: 111-134<!--MARK-->","","Article in Journal","ef663dc8-85c8-4a83-b9e7-69ffd3527fbc","","cc85b9ce-6e1b-4ac5-8838-d0eb402d4a9e"
"Csiki, E.","1910","Platypsyllidae, Orthoperiidae, Phaenocephalidae, Discolominidae, Sphaeriidae","","Coleopterorum Catalogus auspiciis et auxilio W. Junk","","","","","<!--MARK--><a href='../publication/79043ac6-3a2e-4918-9cd0-c3ab11e62502' class='mouseoverHref'>Csiki, E. 1910. Platypsyllidae, Orthoperiidae, Phaenocephalidae, Discolominidae, Sphaeriidae.</a> <!--MARK--><em>In,</em> <!--MARK--><a href='../publication/97342ba1-6856-4630-93de-6b277f50cd60' class='mouseoverHref'>Schenkling, S. (ed.). <em>Coleopterorum Catalogus auspiciis et auxilio W. Junk</em>. Berlin : W. Junk Vol. 8 Pars 18 pp. 1-35.</a><!--MARK--> [15 Aug. 1910]","","Chapter in Book","79043ac6-3a2e-4918-9cd0-c3ab11e62502","20110414T05:13:09.730+0000","97342ba1-6856-4630-93de-6b277f50cd60"
"Forbes, W.T.M.","1926","The wing folding patterns of the Coleoptera","42-68, 91-139","","Journal of the New York Entomological Society","","","","<!--MARK--><a href='../publication/78091c47-c5ab-46a6-9da8-1b575bbf8f3c' class='mouseoverHref'>Forbes, W.T.M. 1926. The wing folding patterns of the Coleoptera.</a> <!--MARK--><!--MARK--><a href='../publication/0d6a7797-deb7-4a30-94e8-5146f853482d' class='mouseoverHref'><em>Journal of the New York Entomological Society</em></a> <strong>34</strong>: 42-68, 91-139<!--MARK-->","","Article in Journal","78091c47-c5ab-46a6-9da8-1b575bbf8f3c","20081009T05:11:37.000+0000","0d6a7797-deb7-4a30-94e8-5146f853482d"
"Hinton, H.E.","1967","On the spiracles of the larvae of the suborder Myxophaga (Coleoptera)","955-959","","Australian Journal of Zoology","","","","<!--MARK--><a href='../publication/bd4c30fb-3163-4a3e-871c-4c42294b506c' class='mouseoverHref'>Hinton, H.E. 1967. On the spiracles of the larvae of the suborder Myxophaga (Coleoptera).</a> <!--MARK--><!--MARK--><a href='../publication/53c3abd8-0254-4532-a73e-d9ef6b7ac2ef' class='mouseoverHref'><em>Australian Journal of Zoology</em></a> <strong>15</strong>: 955-959<!--MARK-->","","Article in Journal","bd4c30fb-3163-4a3e-871c-4c42294b506c","20081009T05:11:37.000+0000","53c3abd8-0254-4532-a73e-d9ef6b7ac2ef"
"International Commission on Zoological Nomenclarure","1985","Opinion 1331. Sphaeriidae Jeffreys, 1862 (1820) (Mollusca, Bivalvia) and Microsporidae Reichardt, 1976 (Insecta, Coleoptera): Placed on the Official List","230-232","","Bulletin of Zoological Nomenclature","","","","<!--MARK--><a href='../publication/d33fdd47-ecc0-44ef-bcd2-8838e0d32a2d' class='mouseoverHref'>International Commission on Zoological Nomenclarure 1985. Opinion 1331. Sphaeriidae Jeffreys, 1862 (1820) (Mollusca, Bivalvia) and Microsporidae Reichardt, 1976 (Insecta, Coleoptera): Placed on the Official List.</a> <!--MARK--><!--MARK--><a href='../publication/a4cf2b4b-baae-48a9-9e16-867e582bfbcc' class='mouseoverHref'><em>Bulletin of Zoological Nomenclature</em></a> <strong>42</strong>: 230-232<!--MARK-->","","Article in Journal","d33fdd47-ecc0-44ef-bcd2-8838e0d32a2d","20181220T00:31:27.212+0000","a4cf2b4b-baae-48a9-9e16-867e582bfbcc"
"International Commission on Zoological Nomenclature","2000","Opinion 1957. <i>Sphaerius</i> Waltl, 1838 (Insecta, Coleoptera): conserved; and Sphaeriidae Erichson, 1845 (Coleoptera): spelling emended to Sphaeriusidae, so removing the homonymy with Sphaeriidae Deshayes, 1854 (1820) (Mollusca, Bivalvia)","182-184","","Bulletin of Zoological Nomenclature","","","","<!--MARK--><a href='../publication/a508c9cd-bfa1-45aa-832a-7dfec2642e67' class='mouseoverHref'>International Commission on Zoological Nomenclature 2000. Opinion 1957. <i>Sphaerius</i> Waltl, 1838 (Insecta, Coleoptera): conserved; and Sphaeriidae Erichson, 1845 (Coleoptera): spelling emended to Sphaeriusidae, so removing the homonymy with Sphaeriidae Deshayes, 1854 (1820) (Mollusca, Bivalvia).</a> <!--MARK--><!--MARK--><a href='../publication/a4cf2b4b-baae-48a9-9e16-867e582bfbcc' class='mouseoverHref'><em>Bulletin of Zoological Nomenclature</em></a> <strong>57</strong>(3): 182-184<!--MARK-->","","Article in Journal","a508c9cd-bfa1-45aa-832a-7dfec2642e67","20081009T05:11:37.000+0000","a4cf2b4b-baae-48a9-9e16-867e582bfbcc"
"Kolenati, F.A.","1846","<i>Meletemata Entomologica.</i> Petropoli, Typ. Acad. 5. 170 pp. 3 pl","","","","","","","<!--MARK--><a href='../publication/cc1dba9c-127f-4c98-9830-6724bfaffc72' class='mouseoverHref'>Kolenati, F.A. 1846. <i>Meletemata Entomologica.</i> Petropoli, Typ. Acad. 5. 170 pp. 3 pl.</a>","","Miscellaneous","cc1dba9c-127f-4c98-9830-6724bfaffc72","20081009T05:11:37.000+0000",""
"Lawrence, J.F.","1982","Coleoptera","482-553","Synopsis and Classification of Living Organisms","","","","","<!--MARK--><a href='../publication/9195371d-372d-41d4-8fe4-f243c9cebfb1' class='mouseoverHref'>Lawrence, J.F. 1982. Coleoptera. pp. 482-553</a> <!--MARK--><em>in</em> <!--MARK--><a href='../publication/a974e260-3e40-4d35-9866-5c97c0c49b2c' class='mouseoverHref'>Parker, S.P. (ed.). <em>Synopsis and Classification of Living Organisms</em>. New York : McGraw Hill Vol. 2 vii 1232 pp.</a><!--MARK-->","","Chapter in Book","9195371d-372d-41d4-8fe4-f243c9cebfb1","20161017T04:10:08.666+0000","a974e260-3e40-4d35-9866-5c97c0c49b2c"
"Lawrence, J.F., Weir, T.A. & Pyke, J.E.","1987","Suborder Myxophaga","13-16","Zoological Catalogue of Australia. Coleoptera: Archostemata, Myxophaga and Adephaga","","","","","<!--MARK--><a href='../publication/1637afd5-7835-4129-ac72-b46f8ad83ac2' class='mouseoverHref'>Lawrence, J.F., Weir, T.A. & Pyke, J.E. 1987. Suborder Myxophaga. pp. 13-16</a> <!--MARK--><em>in</em> <!--MARK--><a href='../publication/bd74a387-ac31-4a80-8ac1-c19387a1eb98' class='mouseoverHref'>Houston, W.W.K. & Richardson, B.J.R. (eds). <em>Zoological Catalogue of Australia. Coleoptera: Archostemata, Myxophaga and Adephaga</em>. Canberra : Australian Government Publishing Service Vol. 4 viii 444 pp.</a><!--MARK-->","","Chapter in Book","1637afd5-7835-4129-ac72-b46f8ad83ac2","20081009T05:11:37.000+0000","bd74a387-ac31-4a80-8ac1-c19387a1eb98"
"Lawrence, J.F. & Newton, A.F., Jr","1982","Evolution and classification of beetles","261-290","","Annual Review of Ecology and Systematics","","","","<!--MARK--><a href='../publication/48b3a0d3-1bc0-40ef-922c-012707c860ab' class='mouseoverHref'>Lawrence, J.F. & Newton, A.F., Jr 1982. Evolution and classification of beetles.</a> <!--MARK--><!--MARK--><a href='../publication/bd9ecda2-fbab-4229-a693-cd8f31fbb0be' class='mouseoverHref'><em>Annual Review of Ecology and Systematics</em></a> <strong>13</strong>: 261-290<!--MARK-->","","Article in Journal","48b3a0d3-1bc0-40ef-922c-012707c860ab","20081009T05:11:37.000+0000","bd9ecda2-fbab-4229-a693-cd8f31fbb0be"
"Lawrence, J.F. & Reichardt, H.","1991","Sphaeriidae (Myxophaga)","302-303","Immature Insects. Coleoptera and Diptera","","","","","<!--MARK--><a href='../publication/be8aab42-7bae-4c20-8d44-dcbd6ef1522b' class='mouseoverHref'>Lawrence, J.F. & Reichardt, H. 1991. Sphaeriidae (Myxophaga). pp. 302-303</a> <!--MARK--><em>in</em> <!--MARK--><a href='../publication/99840ce5-324a-4610-b0d0-881efe111868' class='mouseoverHref'>Stehr, F.W. (ed.). <em>Immature Insects. Coleoptera and Diptera</em>. Dubuque, Iowa : Kendall-Hunt Vol. 2 xvi 975 pp.</a><!--MARK-->","","Chapter in Book","be8aab42-7bae-4c20-8d44-dcbd6ef1522b","20130802T02:56:01.583+0000","99840ce5-324a-4610-b0d0-881efe111868"
"Oke, C.G.","1954","Australian species of Sphaeriidae","57-59","","Proceedings of the Royal Society of Victoria","","","","<!--MARK--><a href='../publication/8590e1ea-4aea-4e67-963f-256a7cfd6174' class='mouseoverHref'>Oke, C.G. 1954. Australian species of Sphaeriidae.</a> <!--MARK--><!--MARK--><a href='../publication/ce333794-3a02-427f-ba27-346079f1efa0' class='mouseoverHref'><em>Proceedings of the Royal Society of Victoria</em></a> <strong>65</strong>: 57-59<!--MARK-->","","Article in Journal","8590e1ea-4aea-4e67-963f-256a7cfd6174","20081009T05:11:37.000+0000","ce333794-3a02-427f-ba27-346079f1efa0"
"Ponomarenko, A.G.","1969","Historical development of the Coleoptera-Archostemata. <i>Trudy Paleontol. Inst. <B>125</B></i>:1-240 pls 1-15","","","","","","","<!--MARK--><a href='../publication/3a33d89b-c6de-4686-816f-74451d299b2b' class='mouseoverHref'>Ponomarenko, A.G. 1969. Historical development of the Coleoptera-Archostemata. <i>Trudy Paleontol. Inst. <B>125</B></i>:1-240 pls 1-15.</a> <!--MARK--> [in Russian]","in Russian","Miscellaneous","3a33d89b-c6de-4686-816f-74451d299b2b","20081009T05:11:37.000+0000",""
"Ponomarenko, A.G.","1971","The geological history and evolution of beetles","281","","Proceedings of the 13th International Congress of Entomology, Moscow 1968","","","","<!--MARK--><a href='../publication/b52c0471-4301-4958-bb5a-ea4ce990da56' class='mouseoverHref'>Ponomarenko, A.G. 1971. The geological history and evolution of beetles.</a> <!--MARK--><!--MARK--><a href='../publication/bd4e1f5b-1290-4027-8563-63bfc448210f' class='mouseoverHref'><em>Proceedings of the 13th International Congress of Entomology, Moscow 1968</em></a> <strong>1</strong>: 281<!--MARK-->","","Article in Journal","b52c0471-4301-4958-bb5a-ea4ce990da56","20081009T05:11:37.000+0000","bd4e1f5b-1290-4027-8563-63bfc448210f"
"Reichardt, H.","1973","A critical study of the suborder Myxophaga, with a taxonomic revision of the Brazilian Torridincolidae and Hydroscaphidae (Coleoptera). <i>Arq. Zool. (Sao Paulo) <B>24</B></i>:73-162","","","","","","","<!--MARK--><a href='../publication/7f72689f-49c9-4e42-a873-23a5171abf72' class='mouseoverHref'>Reichardt, H. 1973. A critical study of the suborder Myxophaga, with a taxonomic revision of the Brazilian Torridincolidae and Hydroscaphidae (Coleoptera). <i>Arq. Zool. (Sao Paulo) <B>24</B></i>:73-162.</a>","","Miscellaneous","7f72689f-49c9-4e42-a873-23a5171abf72","20081009T05:11:37.000+0000",""
"Sato, M.","1982","Discovery of Torridincolidae (Coleoptera) in Japan","276-283","","Annotationes Zoologicae Japonenses","","","","<!--MARK--><a href='../publication/8ff4c7e3-18d4-4cf6-8fca-630e6b3b9fe0' class='mouseoverHref'>Sato, M. 1982. Discovery of Torridincolidae (Coleoptera) in Japan.</a> <!--MARK--><!--MARK--><a href='../publication/63aa1e35-6011-46f2-8dcf-b65432c911c3' class='mouseoverHref'><em>Annotationes Zoologicae Japonenses</em></a> <strong>55</strong>(4): 276-283<!--MARK-->","","Article in Journal","8ff4c7e3-18d4-4cf6-8fca-630e6b3b9fe0","20081009T05:11:37.000+0000","63aa1e35-6011-46f2-8dcf-b65432c911c3"
"Spangler, P.J.","1980","A new species of <i>Ytu</i> from Brazil (Coleoptera: Torridincolidae)","145-158","","The Coleopterists Bulletin","","","","<!--MARK--><a href='../publication/49d13028-acb7-43e8-a5e9-baed7975af25' class='mouseoverHref'>Spangler, P.J. 1980. A new species of <i>Ytu</i> from Brazil (Coleoptera: Torridincolidae).</a> <!--MARK--><!--MARK--><a href='../publication/bfb4ceb5-9a22-44a0-9c17-ce86881f04b2' class='mouseoverHref'><em>The Coleopterists Bulletin</em></a> <strong>34</strong>(2): 145-158<!--MARK-->","","Article in Journal","49d13028-acb7-43e8-a5e9-baed7975af25","20170301T04:48:58.834+0000","bfb4ceb5-9a22-44a0-9c17-ce86881f04b2"
"Steffan, W.","1964","Torridincolidae, coleopterorum nova familia eregione aethiopica","193-200","","Entomologische Zeitschrift","","","","<!--MARK--><a href='../publication/42a6d6d5-4153-4d68-a5f6-516cdf3ec9cb' class='mouseoverHref'>Steffan, W. 1964. Torridincolidae, coleopterorum nova familia eregione aethiopica.</a> <!--MARK--><!--MARK--><a href='../publication/4986b67e-4b2b-48cd-abaa-a47c9fc2678a' class='mouseoverHref'><em>Entomologische Zeitschrift</em></a> <strong>74</strong>: 193-200<!--MARK-->","","Article in Journal","42a6d6d5-4153-4d68-a5f6-516cdf3ec9cb","20081009T05:11:37.000+0000","4986b67e-4b2b-48cd-abaa-a47c9fc2678a"
"Waltl, J.","1838","Bemerkungen über einige Insecten; Verzeichnis von schädlichen Lepidopteren um Magdeburg","277-279","","Isis","","","","<!--MARK--><a href='../publication/79d81818-4df6-4004-b213-1b5e487ad538' class='mouseoverHref'>Waltl, J. 1838. Bemerkungen über einige Insecten; Verzeichnis von schädlichen Lepidopteren um Magdeburg.</a> <!--MARK--><!--MARK--><a href='../publication/fab1499c-99da-4005-8e3c-33622f675131' class='mouseoverHref'><em>Isis</em></a> <strong>4</strong>: 277-279<!--MARK--> [dated 1837]","dated 1837","Article in Journal","79d81818-4df6-4004-b213-1b5e487ad538","20111115T21:08:55.402+0000","fab1499c-99da-4005-8e3c-33622f675131"
"Yavorskaya, M.I., Anton, E., Ja?oszynski, P., Polilov, A. & Beutel, R.G.","2018","Cephalic anatomy of Sphaeriusidae and a morphology-based phylogeny of the suborder Myxophaga (Coleoptera)","777-797","","Systematic Entomology","","","","<!--MARK--><a href='../publication/a13f7a23-3f0c-4daa-a36c-cd0b8ce19fad' class='mouseoverHref'>Yavorskaya, M.I., Anton, E., Ja?oszynski, P., Polilov, A. & Beutel, R.G. 2018. Cephalic anatomy of Sphaeriusidae and a morphology-based phylogeny of the suborder Myxophaga (Coleoptera).</a> <!--MARK--><!--MARK--><a href='../publication/129a4a7d-1c4c-4650-87ea-27d58ad726d5' class='mouseoverHref'><em>Systematic Entomology</em></a> <strong>43</strong>(4): 777-797<!--MARK-->","","Article in Journal","a13f7a23-3f0c-4daa-a36c-cd0b8ce19fad","20181123T03:51:03.249+0000","129a4a7d-1c4c-4650-87ea-27d58ad726d5"
