"PUB_AUTHOR","PUB_YEAR","PUB_TITLE","PUB_PAGES","PUB_PARENT_BOOK_TITLE","PUB_PARENT_JOURNAL_TITLE","PUB_PARENT_ARTICLE_TITLE","PUB_PUBLICATION_DATE","PUB_PUBLISHER","PUB_FORMATTED","PUB_QUALIFICATION","PUB_TYPE","PUBLICATION_GUID","PUBLICATION_LAST_UPDATE","PARENT_PUBLICATION_GUID"
"Andrewes, H.E.","1919","On the types of Oriental Carabidae in the British Museum, and in the Hope Dept. of the Oxford University Museum","119-217","","Transactions of the Entomological Society of London","","","","<!--MARK--><a href='null03cf368e-4dab-478b-bac4-ad81c1fa08d0' class='mouseoverHref'>Andrewes, H.E. 1919. On the types of Oriental Carabidae in the British Museum, and in the Hope Dept. of the Oxford University Museum.</a> <!--MARK--><!--MARK--><a href='null5cf355b3-abc5-451e-9abc-ed3282d7811a' class='mouseoverHref'><em>Transactions of the Entomological Society of London</em></a> <strong>1919</strong>: 119-217<!--MARK-->","","Article in Journal","03cf368e-4dab-478b-bac4-ad81c1fa08d0","20081009T05:11:37.000+0000","5cf355b3-abc5-451e-9abc-ed3282d7811a"
"Andrewes, H.E.","1940","Papers on Oriental Carabidae - XXXVI","536","","Annals and Magazine of Natural History","","","","<!--MARK--><a href='null4d99212b-c8e8-45b7-a23d-78bdce5016ef' class='mouseoverHref'>Andrewes, H.E. 1940. Papers on Oriental Carabidae - XXXVI.</a> <!--MARK--><!--MARK--><a href='nullefa8de69-3a29-4a43-8ef2-cbefda205976' class='mouseoverHref'><em>Annals and Magazine of Natural History</em></a> 11 <strong>5</strong>: 536<!--MARK-->","","Article in Journal","4d99212b-c8e8-45b7-a23d-78bdce5016ef","20081009T05:11:37.000+0000","efa8de69-3a29-4a43-8ef2-cbefda205976"
"Bates, H.W.","1873","On the geodephagus Coleoptera of Japan","219-322","","Transactions of the Entomological Society of London","","","","<!--MARK--><a href='nulleeaa9792-7fbf-49cb-9886-eee307a9a62e' class='mouseoverHref'>Bates, H.W. 1873. On the geodephagus Coleoptera of Japan.</a> <!--MARK--><!--MARK--><a href='null5cf355b3-abc5-451e-9abc-ed3282d7811a' class='mouseoverHref'><em>Transactions of the Entomological Society of London</em></a> <strong>1873</strong>: 219-322<!--MARK-->","","Article in Journal","eeaa9792-7fbf-49cb-9886-eee307a9a62e","20081009T05:11:37.000+0000","5cf355b3-abc5-451e-9abc-ed3282d7811a"
"Bonelli, F.A.","1810","Observations Entomologique. Première partie (cicindélètes et portion des carabiques) [with the ?Tabula synoptica exhibens genera carabicorum in sectiones et stirpes disposita?]","58 pp., 1 table","","","","","F. Galletti","<!--MARK--><a href='null4b6778a3-0468-4108-af01-9b3dbd73da31' class='mouseoverHref'>Bonelli, F.A. 1810. <em>Observations Entomologique. Première partie (cicindélètes et portion des carabiques) [with the ?Tabula synoptica exhibens genera carabicorum in sectiones et stirpes disposita?]</em>. Torino/Turin (Italy) : F. Galletti 58 pp., 1 table.</a><!--MARK--> [reissued in 1812, without the «Tabula Synoptica», in Mem. R. Accad. Sci. Torino 18: 21-78]","reissued in 1812, without the «Tabula Synoptica», in Mem. R. Accad. Sci. Torino 18: 21-78","Book","4b6778a3-0468-4108-af01-9b3dbd73da31","20190116T04:06:59.598+0000",""
"Castelnau, F.L. Laporte de","1840","Histoire Naturelle des Insectes, Animaux articulés. Coléoptères","cxxv 24 pp.","","","","","Duménil","<!--MARK--><a href='nullff9614cc-e927-49b9-bb47-a988b08d2ef0' class='mouseoverHref'>Castelnau, F.L. Laporte de 1840. <em>Histoire Naturelle des Insectes, Animaux articulés. Coléoptères</em>. Paris : Duménil Vol. 1 cxxv 24 pp.</a><!--MARK-->","","Book","ff9614cc-e927-49b9-bb47-a988b08d2ef0","20081009T05:11:37.000+0000",""
"Chaudoir, M. de","1846","Note sur le groupe des Stomides et description d'un nouveau genre de celuis des Somoplatides","511-542","","Bulletin de la Société Impériale des Naturalistes de Moscou","","","","<!--MARK--><a href='null1163afc7-e9ba-49c1-ad46-4b3e2be67508' class='mouseoverHref'>Chaudoir, M. de 1846. Note sur le groupe des Stomides et description d'un nouveau genre de celuis des Somoplatides.</a> <!--MARK--><!--MARK--><a href='nulla7cbc93a-fdd0-40a5-9cc8-35de71b7d18a' class='mouseoverHref'><em>Bulletin de la Société Impériale des Naturalistes de Moscou</em></a> <strong>19</strong>(4): 511-542<!--MARK-->","","Article in Journal","1163afc7-e9ba-49c1-ad46-4b3e2be67508","20081009T05:11:37.000+0000","a7cbc93a-fdd0-40a5-9cc8-35de71b7d18a"
"Chaudoir, M. de","1850","Mémoire sur la famille des Carabiques. 2e partie","3-85 and 349-460","","Bulletin de la Société Impériale des Naturalistes de Moscou","","","","<!--MARK--><a href='nullef925dac-c013-4347-877a-216613d75acb' class='mouseoverHref'>Chaudoir, M. de 1850. Mémoire sur la famille des Carabiques. 2e partie.</a> <!--MARK--><!--MARK--><a href='nulla7cbc93a-fdd0-40a5-9cc8-35de71b7d18a' class='mouseoverHref'><em>Bulletin de la Société Impériale des Naturalistes de Moscou</em></a> <strong>23</strong>(1): 3-85 and 349-460<!--MARK-->","","Article in Journal","ef925dac-c013-4347-877a-216613d75acb","20081009T05:11:37.000+0000","a7cbc93a-fdd0-40a5-9cc8-35de71b7d18a"
"Chaudoir, M. de","1861","Révision des espèces qui rentrent dans l'ancien genre","335-360","","Journal of the Asiatic Society of Bengal","","","","<!--MARK--><a href='null31f6a0c1-fec2-496d-b07b-c46ca993ecb7' class='mouseoverHref'>Chaudoir, M. de 1861. Révision des espèces qui rentrent dans l'ancien genre.</a> <!--MARK--><!--MARK--><a href='nulld16b9dfb-88f3-4e8f-aa43-b64265b2b69a' class='mouseoverHref'><em>Journal of the Asiatic Society of Bengal</em></a> <strong>34</strong>(2): 335-360<!--MARK-->","","Article in Journal","31f6a0c1-fec2-496d-b07b-c46ca993ecb7","20081009T05:11:37.000+0000","d16b9dfb-88f3-4e8f-aa43-b64265b2b69a"
"Chaudoir, M. de","1879","Essai monographique sur les Panagéides","83-186 (pp. 83-84 published in 1878)","","Annales de la Société Entomologique de Belgique (Comptes-rendus)","","","","<!--MARK--><a href='null93a74181-c5b9-4b5c-b120-b253d2cf0a9e' class='mouseoverHref'>Chaudoir, M. de 1879. Essai monographique sur les Panagéides.</a> <!--MARK--><!--MARK--><a href='nullacc7fcdb-707a-4cbe-8f70-d7595ac25c58' class='mouseoverHref'><em>Annales de la Société Entomologique de Belgique (Comptes-rendus)</em></a> <strong>21</strong>: 83-186 (pp. 83-84 published in 1878)<!--MARK-->","","Article in Journal","93a74181-c5b9-4b5c-b120-b253d2cf0a9e","20081009T05:11:37.000+0000","acc7fcdb-707a-4cbe-8f70-d7595ac25c58"
"Csiki, E.","1907","Coleoptera nova in Museo Nationali Hungarici","574-578","","Annales Historico-Naturales Musei Nationalis Hungarici (Zoologica)","","","","<!--MARK--><a href='nullcdcf7186-3d58-4769-afcf-1edd78bbcc45' class='mouseoverHref'>Csiki, E. 1907. Coleoptera nova in Museo Nationali Hungarici.</a> <!--MARK--><!--MARK--><a href='nulle6f35874-0423-4fa1-bf45-655b9047e0c2' class='mouseoverHref'><em>Annales Historico-Naturales Musei Nationalis Hungarici (Zoologica)</em></a> <strong>5</strong>: 574-578<!--MARK-->","","Article in Journal","cdcf7186-3d58-4769-afcf-1edd78bbcc45","20081009T05:11:37.000+0000","e6f35874-0423-4fa1-bf45-655b9047e0c2"
"Csiki, E.","1929","Carabidae II: Harpalinae III","347-528","Coleopterorum Catalogus auspiciis et auxilio W. Junk","","","","","<!--MARK--><a href='null0bdfece6-43f8-4a41-9ad6-5d5d72f36911' class='mouseoverHref'>Csiki, E. 1929. Carabidae II: Harpalinae III. pp. 347-528</a> <!--MARK--><em>in</em> <!--MARK--><a href='null1eb1917a-b7ee-4122-b7a3-dd564b35249d' class='mouseoverHref'>Schenkling, S. (ed.). <em>Coleopterorum Catalogus auspiciis et auxilio W. Junk</em>. Berlin : W. Junk Vol. 1 Pars 104.</a><!--MARK--> [Date published 20/Mar/1929]","","Chapter in Book","0bdfece6-43f8-4a41-9ad6-5d5d72f36911","20081009T05:11:37.000+0000","1eb1917a-b7ee-4122-b7a3-dd564b35249d"
"Darlington, P.J. Jr","1962","The carabid beetles of New Guinea Part I. Cicindelinae, Carabinae, Harpalinae through Pterostichini","321-564 pls 4","","Bulletin of the Museum of Comparative Zoology, Harvard","","","","<!--MARK--><a href='nulla4efed5f-c627-412e-98b3-7462d5f90d4c' class='mouseoverHref'>Darlington, P.J. Jr 1962. The carabid beetles of New Guinea Part I. Cicindelinae, Carabinae, Harpalinae through Pterostichini.</a> <!--MARK--><!--MARK--><a href='nullb2447030-bd13-4a45-9402-157082169a3d' class='mouseoverHref'><em>Bulletin of the Museum of Comparative Zoology, Harvard</em></a> <strong>126</strong>: 321-564 pls 4<!--MARK-->","","Article in Journal","a4efed5f-c627-412e-98b3-7462d5f90d4c","20081009T05:11:37.000+0000","b2447030-bd13-4a45-9402-157082169a3d"
"Darlington, P.J. Jr","1971","The carabid beetles of New Guinea. Part IV. General considerations; analysis and history of fauna; taxonomic supplement","129-337","","Bulletin of the Museum of Comparative Zoology, Harvard","","","","<!--MARK--><a href='null272e3f0a-ebd8-431b-8d1a-dd201f3e6618' class='mouseoverHref'>Darlington, P.J. Jr 1971. The carabid beetles of New Guinea. Part IV. General considerations; analysis and history of fauna; taxonomic supplement.</a> <!--MARK--><!--MARK--><a href='nullb2447030-bd13-4a45-9402-157082169a3d' class='mouseoverHref'><em>Bulletin of the Museum of Comparative Zoology, Harvard</em></a> <strong>142</strong>: 129-337<!--MARK-->","","Article in Journal","272e3f0a-ebd8-431b-8d1a-dd201f3e6618","20081009T05:11:37.000+0000","b2447030-bd13-4a45-9402-157082169a3d"
"Dejean, P.F.M.A.","1831","Spécies général des Coléoptères de la collection de M. le Compte Dejean","viii 883 pp.","","","","","Méquignon-Marvis","<!--MARK--><a href='null7ab25a74-931b-4cbb-b560-358f89184c85' class='mouseoverHref'>Dejean, P.F.M.A. 1831. <em>Spécies général des Coléoptères de la collection de M. le Compte Dejean</em>. Paris : Méquignon-Marvis Vol. V viii 883 pp.</a><!--MARK-->","","Book","7ab25a74-931b-4cbb-b560-358f89184c85","20081009T05:11:37.000+0000",""
"Fabricius, J.C.","1801","Systema Eleutheratorum secundum ordines, genera, species adiectis synonymis, locis, observationibus, descriptionibus","xxiv 506 pp.","","","","","Bibliopol. Acad.","<!--MARK--><a href='nulld842a4c0-18ed-4d13-b4ca-7d6c86a74d73' class='mouseoverHref'>Fabricius, J.C. 1801. <em>Systema Eleutheratorum secundum ordines, genera, species adiectis synonymis, locis, observationibus, descriptionibus</em>. Kiliae : Bibliopol. Acad. Vol. 1 xxiv 506 pp.</a><!--MARK-->","","Book","d842a4c0-18ed-4d13-b4ca-7d6c86a74d73","20081009T05:11:37.000+0000",""
"Hope, F.W.","1838","The Coleopterist's Manual, containing the predaceous and water beetles of Linneus and Fabricius","xvi 168 pp. 4 pls","","","","","Henry G. Bohn","<!--MARK--><a href='nulle7e10ca8-f572-40c6-80fd-8810fce8ac20' class='mouseoverHref'>Hope, F.W. 1838. <em>The Coleopterist's Manual, containing the predaceous and water beetles of Linneus and Fabricius</em>. London : Henry G. Bohn Vol. 2 xvi 168 pp. 4 pls.</a><!--MARK-->","","Book","e7e10ca8-f572-40c6-80fd-8810fce8ac20","20081009T05:11:37.000+0000",""
"La Ferté-Sénectère, F.T. de","1851","Révision de la tribu des Patellimanes de Dejean, Coléoptères pentamères de la famille des Carabiques","209-294","","Annales de la Société Entomologique de France","","","","<!--MARK--><a href='null29433a45-fa56-4bc2-a203-b98f82d381f9' class='mouseoverHref'>La Ferté-Sénectère, F.T. de 1851. Révision de la tribu des Patellimanes de Dejean, Coléoptères pentamères de la famille des Carabiques.</a> <!--MARK--><!--MARK--><a href='null6462279b-2aaf-46a3-a434-cab7d8a2c33d' class='mouseoverHref'><em>Annales de la Société Entomologique de France</em></a> 2 <strong>9</strong>: 209-294<!--MARK-->","","Article in Journal","29433a45-fa56-4bc2-a203-b98f82d381f9","20081009T05:11:37.000+0000","6462279b-2aaf-46a3-a434-cab7d8a2c33d"
"Laporte, F.L. [de Castelnau]","1867","Notes on Australian Coleoptera","139 pp.","","","","","Royal Society of Victoria","<!--MARK--><a href='null24775344-c4a6-4169-a50c-6b5559f88a2a' class='mouseoverHref'>Laporte, F.L. [de Castelnau] 1867. <em>Notes on Australian Coleoptera</em>. Melbourne : Royal Society of Victoria 139 pp.</a><!--MARK--> [separates available prior to republication in <I>Trans. R. Soc. Vict. </I><B>8</B>: 30-38 (1867), 95-225 (1868)]","separates available prior to republication in <I>Trans. R. Soc. Vict. </I><B>8</B>: 30-38 (1867), 95-225 (1868)","Book","24775344-c4a6-4169-a50c-6b5559f88a2a","20201207T05:24:03.432+0000",""
"Macleay, W.J.","1864","Descriptions of new genera and species of Coleoptera from Port Denison","106-130, pl. IX","","Transactions of the Entomological Society of New South Wales","","","","<!--MARK--><a href='null0faf71d8-e7ac-4888-bcce-7db38d1da638' class='mouseoverHref'>Macleay, W.J. 1864. Descriptions of new genera and species of Coleoptera from Port Denison.</a> <!--MARK--><!--MARK--><a href='null69b821b6-f09d-44b0-ae3f-0e6c294b532e' class='mouseoverHref'><em>Transactions of the Entomological Society of New South Wales</em></a> <strong>1</strong>: 106-130, pl. IX<!--MARK-->","","Article in Journal","0faf71d8-e7ac-4888-bcce-7db38d1da638","20081009T05:11:37.000+0000","69b821b6-f09d-44b0-ae3f-0e6c294b532e"
"Macleay, W.J.","1888","The insects of King's Sound and its vicinity","443-480","","Proceedings of the Linnean Society of New South Wales","","","","<!--MARK--><a href='nulldf6698ef-207f-422c-9694-7c4693c4f229' class='mouseoverHref'>Macleay, W.J. 1888. The insects of King's Sound and its vicinity.</a> <!--MARK--><!--MARK--><a href='nullc12cd779-adb5-41ea-bd2c-75f6864cf22e' class='mouseoverHref'><em>Proceedings of the Linnean Society of New South Wales</em></a> 2 <strong>3</strong>: 443-480<!--MARK-->","","Article in Journal","df6698ef-207f-422c-9694-7c4693c4f229","20081009T05:11:37.000+0000","c12cd779-adb5-41ea-bd2c-75f6864cf22e"
"Moore, B.P.","1979","Chemical defense in Carabids and its bearing on phylogeny","193-203","Carabid beetles: Their evolution, natural history, and classification","","","","","<!--MARK--><a href='null6488b883-bbc8-41c5-95bf-93354766b44e' class='mouseoverHref'>Moore, B.P. 1979. Chemical defense in Carabids and its bearing on phylogeny. pp. 193-203</a> <!--MARK--><em>in</em> <!--MARK--><a href='nulle364904b-0a23-44c0-9003-f6954883a0aa' class='mouseoverHref'>Erwin, T.L., Ball, G.E., Whitehead, D.R. & Halpern, A.L. (eds). <em>Carabid beetles: Their evolution, natural history, and classification</em>. The Hague : W. Junk vii 635 pp.</a><!--MARK-->","","Chapter in Book","6488b883-bbc8-41c5-95bf-93354766b44e","20081009T05:11:37.000+0000","e364904b-0a23-44c0-9003-f6954883a0aa"
"Moore, B.P.","1987","Suborder Adephaga","17-366","Zoological Catalogue of Australia. Coleoptera: Archostemata, Myxophaga and Adephaga","","","","","<!--MARK--><a href='null1f267174-3770-4e86-a2a6-fe1e8fdf52d2' class='mouseoverHref'>Moore, B.P. 1987. Suborder Adephaga. pp. 17-366</a> <!--MARK--><em>in</em> <!--MARK--><a href='nullbd74a387-ac31-4a80-8ac1-c19387a1eb98' class='mouseoverHref'>Houston, W.W.K. & Richardson, B.J.R. (eds). <em>Zoological Catalogue of Australia. Coleoptera: Archostemata, Myxophaga and Adephaga</em>. Canberra : Australian Government Publishing Service Vol. 4 viii 444 pp.</a><!--MARK-->","","Chapter in Book","1f267174-3770-4e86-a2a6-fe1e8fdf52d2","20081009T05:11:37.000+0000","bd74a387-ac31-4a80-8ac1-c19387a1eb98"
"Motschulsky, V.","1864","Énumération des nouvelles espèces de Coléoptères rapportés de ses voyages. 4-ème article (Suite)","297-355","","Bulletin de la Société Impériale des Naturalistes de Moscou","","","","<!--MARK--><a href='nullb9d41b99-56cf-43d2-a7f6-22ddd8079758' class='mouseoverHref'>Motschulsky, V. 1864. Énumération des nouvelles espèces de Coléoptères rapportés de ses voyages. 4-ème article (Suite).</a> <!--MARK--><!--MARK--><a href='nulla7cbc93a-fdd0-40a5-9cc8-35de71b7d18a' class='mouseoverHref'><em>Bulletin de la Société Impériale des Naturalistes de Moscou</em></a> <strong>37</strong>: 297-355<!--MARK-->","","Article in Journal","b9d41b99-56cf-43d2-a7f6-22ddd8079758","20081009T05:11:37.000+0000","a7cbc93a-fdd0-40a5-9cc8-35de71b7d18a"
"Schaum, H.R.","1853","Quelques observations sur le groupe des Panagéites et description de sept nouvelle espèces","429-441","","Annales de la Société Entomologique de France","","","","<!--MARK--><a href='nullb3509bc1-7853-4a77-a54d-00291c92400e' class='mouseoverHref'>Schaum, H.R. 1853. Quelques observations sur le groupe des Panagéites et description de sept nouvelle espèces.</a> <!--MARK--><!--MARK--><a href='null6462279b-2aaf-46a3-a434-cab7d8a2c33d' class='mouseoverHref'><em>Annales de la Société Entomologique de France</em></a> 3 <strong>1</strong>: 429-441<!--MARK-->","","Article in Journal","b3509bc1-7853-4a77-a54d-00291c92400e","20081009T05:11:37.000+0000","6462279b-2aaf-46a3-a434-cab7d8a2c33d"
"Sloane, T.G.","1903","Studies in Australian Entomology. No XII New Carabidae (Panageini, Bembidiini, Pogonini, Platysmatini, Platynini, Lebiini, with revisional lists of genera and speecis [<i>sic</i>], some notes on synonymy, etc.)","566-642","","Proceedings of the Linnean Society of New South Wales","","","","<!--MARK--><a href='null2e67762d-d5e3-4c1f-baa9-1c3510585d81' class='mouseoverHref'>Sloane, T.G. 1903. Studies in Australian Entomology. No XII New Carabidae (Panageini, Bembidiini, Pogonini, Platysmatini, Platynini, Lebiini, with revisional lists of genera and speecis [<i>sic</i>], some notes on synonymy, etc.).</a> <!--MARK--><!--MARK--><a href='nullc12cd779-adb5-41ea-bd2c-75f6864cf22e' class='mouseoverHref'><em>Proceedings of the Linnean Society of New South Wales</em></a> <strong>28</strong>: 566-642<!--MARK-->","","Article in Journal","2e67762d-d5e3-4c1f-baa9-1c3510585d81","20081009T05:11:37.000+0000","c12cd779-adb5-41ea-bd2c-75f6864cf22e"
"Sloane, T.G.","1923","Studies in Australian Entomology. No. XVIII New genera and species of Carabidae. (Scaritini, Pterostichini, Merizodini, Bembidiini, Trechini, Odacanthini, Panagaeini, Licinini, and Lebiini)","17-39","","Proceedings of the Linnean Society of New South Wales","","","","<!--MARK--><a href='nullc233b83a-3576-4512-80ce-16baacc4510a' class='mouseoverHref'>Sloane, T.G. 1923. Studies in Australian Entomology. No. XVIII New genera and species of Carabidae. (Scaritini, Pterostichini, Merizodini, Bembidiini, Trechini, Odacanthini, Panagaeini, Licinini, and Lebiini).</a> <!--MARK--><!--MARK--><a href='nullc12cd779-adb5-41ea-bd2c-75f6864cf22e' class='mouseoverHref'><em>Proceedings of the Linnean Society of New South Wales</em></a> <strong>48</strong>: 17-39<!--MARK-->","","Article in Journal","c233b83a-3576-4512-80ce-16baacc4510a","20081009T05:11:37.000+0000","c12cd779-adb5-41ea-bd2c-75f6864cf22e"
"Strand, E.","1936","Miscellanea nomenclatorica zoologica et palaeontologica","167-170","","Journal of Entomological Science","","","","<!--MARK--><a href='null589aa6a7-04e0-4008-b8af-b2d08059ecd5' class='mouseoverHref'>Strand, E. 1936. Miscellanea nomenclatorica zoologica et palaeontologica.</a> <!--MARK--><!--MARK--><a href='null43e4f0f4-1c3a-4a5a-b8d6-87e359c5a62b' class='mouseoverHref'><em>Journal of Entomological Science</em></a> <strong>6</strong>: 167-170<!--MARK-->","","Article in Journal","589aa6a7-04e0-4008-b8af-b2d08059ecd5","20081009T05:11:37.000+0000","43e4f0f4-1c3a-4a5a-b8d6-87e359c5a62b"
