"PUB_AUTHOR","PUB_YEAR","PUB_TITLE","PUB_PAGES","PUB_PARENT_BOOK_TITLE","PUB_PARENT_JOURNAL_TITLE","PUB_PARENT_ARTICLE_TITLE","PUB_PUBLICATION_DATE","PUB_PUBLISHER","PUB_FORMATTED","PUB_QUALIFICATION","PUB_TYPE","PUBLICATION_GUID","PUBLICATION_LAST_UPDATE","PARENT_PUBLICATION_GUID"
"Sloane, T.G.","1903","Studies in Australian Entomology. No XII New Carabidae (Panageini, Bembidiini, Pogonini, Platysmatini, Platynini, Lebiini, with revisional lists of genera and speecis [<i>sic</i>], some notes on synonymy, etc.)","566-642","","Proceedings of the Linnean Society of New South Wales","","","","<!--MARK--><a href='null2e67762d-d5e3-4c1f-baa9-1c3510585d81' class='mouseoverHref'>Sloane, T.G. 1903. Studies in Australian Entomology. No XII New Carabidae (Panageini, Bembidiini, Pogonini, Platysmatini, Platynini, Lebiini, with revisional lists of genera and speecis [<i>sic</i>], some notes on synonymy, etc.).</a> <!--MARK--><!--MARK--><a href='nullc12cd779-adb5-41ea-bd2c-75f6864cf22e' class='mouseoverHref'><em>Proceedings of the Linnean Society of New South Wales</em></a> <strong>28</strong>: 566-642<!--MARK-->","","Article in Journal","2e67762d-d5e3-4c1f-baa9-1c3510585d81","20081009T05:11:37.000+0000","c12cd779-adb5-41ea-bd2c-75f6864cf22e"
"Sloane, T.G.","1907","New Carabidae from German New Guinea and its dependencies. (Col.)","177-185","","Deutsche Entomologische Zeitschrift","","","","<!--MARK--><a href='null6e624b5e-f7ab-4d20-aa03-1f40b637fac7' class='mouseoverHref'>Sloane, T.G. 1907. New Carabidae from German New Guinea and its dependencies. (Col.).</a> <!--MARK--><!--MARK--><a href='nullbdeb8163-7175-47c9-be9b-28f797c57745' class='mouseoverHref'><em>Deutsche Entomologische Zeitschrift</em></a> <strong>1907</strong>: 177-185<!--MARK-->","","Article in Journal","6e624b5e-f7ab-4d20-aa03-1f40b637fac7","20081009T05:11:37.000+0000","bdeb8163-7175-47c9-be9b-28f797c57745"
"Sloane, T.G.","1910","Revisional notes on Australian Carabidae. Part iii","435-458","","Proceedings of the Linnean Society of New South Wales","","","","<!--MARK--><a href='null87b0ba78-f167-4922-8678-c96b08ca8884' class='mouseoverHref'>Sloane, T.G. 1910. Revisional notes on Australian Carabidae. Part iii.</a> <!--MARK--><!--MARK--><a href='nullc12cd779-adb5-41ea-bd2c-75f6864cf22e' class='mouseoverHref'><em>Proceedings of the Linnean Society of New South Wales</em></a> <strong>35</strong>: 435-458<!--MARK-->","","Article in Journal","87b0ba78-f167-4922-8678-c96b08ca8884","20081009T05:11:37.000+0000","c12cd779-adb5-41ea-bd2c-75f6864cf22e"
"Sloane, T.G.","1920","A list of the species of Australian Carabidae which range beyond Australia and its dependent islands","320-323","","Proceedings of the Linnean Society of New South Wales","","","","<!--MARK--><a href='null72f42958-e3e2-4b09-92ae-c85bb609409b' class='mouseoverHref'>Sloane, T.G. 1920. A list of the species of Australian Carabidae which range beyond Australia and its dependent islands.</a> <!--MARK--><!--MARK--><a href='nullc12cd779-adb5-41ea-bd2c-75f6864cf22e' class='mouseoverHref'><em>Proceedings of the Linnean Society of New South Wales</em></a> <strong>45</strong>: 320-323<!--MARK-->","","Article in Journal","72f42958-e3e2-4b09-92ae-c85bb609409b","","c12cd779-adb5-41ea-bd2c-75f6864cf22e"
"White, A.","1846","Insects","1-24 pls I-X","The Zoology of the Voyage of H.M.S. <i>Erebus</i> and <i>Terror</i> under the Command of Captain Sir James Clark Ross, R.N., F.R.S., during the years 1839-43","","","","","<!--MARK--><a href='nullab1d46db-3b79-4d64-bd44-df07d2884bf8' class='mouseoverHref'>White, A. 1846. Insects. 1-24 pls I-X</a> <!--MARK--><em>in</em> <!--MARK--><a href='nulldda137df-917c-475a-8591-8dceb183c76e' class='mouseoverHref'>Richardson, J. & Gray, J.E. (eds). <em>The Zoology of the Voyage of H.M.S. <i>Erebus</i> and <i>Terror</i> under the Command of Captain Sir James Clark Ross, R.N., F.R.S., during the years 1839-43</em>. London : E.W. Janson Vol. 2 139 pp.</a><!--MARK-->","","Chapter in Book","ab1d46db-3b79-4d64-bd44-df07d2884bf8","20110106T00:05:11.928+0000","dda137df-917c-475a-8591-8dceb183c76e"
