"PUB_AUTHOR","PUB_YEAR","PUB_TITLE","PUB_PAGES","PUB_PARENT_BOOK_TITLE","PUB_PARENT_JOURNAL_TITLE","PUB_PARENT_ARTICLE_TITLE","PUB_PUBLICATION_DATE","PUB_PUBLISHER","PUB_FORMATTED","PUB_QUALIFICATION","PUB_TYPE","PUBLICATION_GUID","PUBLICATION_LAST_UPDATE","PARENT_PUBLICATION_GUID"
"Baehr, M.","2000","Some genera and species of ground beetles new to Australia (Coleoptera: Carabidae)","9-14","","Memoirs of the Queensland Museum","","31 Dec. 2000","","<!--MARK--><a href='null7881e714-ab5c-49b4-af78-cccf71de4bc2' class='mouseoverHref'>Baehr, M. 2000. Some genera and species of ground beetles new to Australia (Coleoptera: Carabidae).</a> <!--MARK--><!--MARK--><a href='null1a0a2982-9f30-43e1-a641-b0379699837c' class='mouseoverHref'><em>Memoirs of the Queensland Museum</em></a> <strong>46</strong>(1): 9-14<!--MARK--> [Date published 31 Dec. 2000]","","Article in Journal","7881e714-ab5c-49b4-af78-cccf71de4bc2","20101118T23:14:53.883+0000","1a0a2982-9f30-43e1-a641-b0379699837c"
"Blackburn, T.","1888","Notes on Australian Coleoptera, with descriptions of new genera and species","805-875","","Proceedings of the Linnean Society of New South Wales","","","","<!--MARK--><a href='null050e21d6-6439-4054-a848-2f328a5e0a38' class='mouseoverHref'>Blackburn, T. 1888. Notes on Australian Coleoptera, with descriptions of new genera and species.</a> <!--MARK--><!--MARK--><a href='nullc12cd779-adb5-41ea-bd2c-75f6864cf22e' class='mouseoverHref'><em>Proceedings of the Linnean Society of New South Wales</em></a> 2 <strong>3</strong>: 805-875<!--MARK-->","","Article in Journal","050e21d6-6439-4054-a848-2f328a5e0a38","20130318T02:02:39.380+0000","c12cd779-adb5-41ea-bd2c-75f6864cf22e"
"Blackburn, T.","1890","Notes on Australian Coleoptera, with descriptions of new species. Part IV","707-746","","Proceedings of the Linnean Society of New South Wales","","","","<!--MARK--><a href='null0f49cf6b-ed5d-4e09-8e72-58faa33d70c8' class='mouseoverHref'>Blackburn, T. 1890. Notes on Australian Coleoptera, with descriptions of new species. Part IV.</a> <!--MARK--><!--MARK--><a href='nullc12cd779-adb5-41ea-bd2c-75f6864cf22e' class='mouseoverHref'><em>Proceedings of the Linnean Society of New South Wales</em></a> 2 <strong>4</strong>: 707-746<!--MARK-->","","Article in Journal","0f49cf6b-ed5d-4e09-8e72-58faa33d70c8","20081009T05:11:37.000+0000","c12cd779-adb5-41ea-bd2c-75f6864cf22e"
"Bonelli, F.A.","1810","Observations Entomologique. Première partie (cicindélètes et portion des carabiques) [with the ?Tabula synoptica exhibens genera carabicorum in sectiones et stirpes disposita?]","58 pp., 1 table","","","","","F. Galletti","<!--MARK--><a href='null4b6778a3-0468-4108-af01-9b3dbd73da31' class='mouseoverHref'>Bonelli, F.A. 1810. <em>Observations Entomologique. Première partie (cicindélètes et portion des carabiques) [with the ?Tabula synoptica exhibens genera carabicorum in sectiones et stirpes disposita?]</em>. Torino/Turin (Italy) : F. Galletti 58 pp., 1 table.</a><!--MARK--> [reissued in 1812, without the «Tabula Synoptica», in Mem. R. Accad. Sci. Torino 18: 21-78]","reissued in 1812, without the «Tabula Synoptica», in Mem. R. Accad. Sci. Torino 18: 21-78","Book","4b6778a3-0468-4108-af01-9b3dbd73da31","20190116T04:06:59.598+0000",""
"Bonelli, F.A.","1812","Observations Entomologique. Première partie (cicindélètes et portion des carabiques)","21-78, + Tabula Synoptica","","Mémoires de l'Académie des Sciences, Turin","","","","<!--MARK--><a href='nulla16283c9-de28-4523-aec0-abaad51e5e8f' class='mouseoverHref'>Bonelli, F.A. 1812. Observations Entomologique. Première partie (cicindélètes et portion des carabiques).</a> <!--MARK--><!--MARK--><a href='null31e36579-7bc3-41e9-a93e-e5eb3d049c7c' class='mouseoverHref'><em>Mémoires de l'Académie des Sciences, Turin</em></a> <strong>XVIII</strong>: 21-78, + Tabula Synoptica<!--MARK--> [reprinted version from Bonelli 1810, but without the ?Tabula synoptica exhibens genera carabicorum in sectiones et stirpes disposita?]","reprinted version from Bonelli 1810, but without the ?Tabula synoptica exhibens genera carabicorum in sectiones et stirpes disposita?","Article in Journal","a16283c9-de28-4523-aec0-abaad51e5e8f","20190116T04:51:26.401+0000","31e36579-7bc3-41e9-a93e-e5eb3d049c7c"
"Britton, E.B.","1938","Carabidae of the Society Islands and Rapa (Coleoptera)","103-110","","Occasional Papers of the Bernice P. Bishop Museum","","","","<!--MARK--><a href='null4a6f241a-3fb5-4d05-a209-ed83c87f55b2' class='mouseoverHref'>Britton, E.B. 1938. Carabidae of the Society Islands and Rapa (Coleoptera).</a> <!--MARK--><!--MARK--><a href='null03e996fa-9f03-40cc-9067-f4fcb8b052a8' class='mouseoverHref'><em>Occasional Papers of the Bernice P. Bishop Museum</em></a> <strong>14</strong>: 103-110<!--MARK-->","","Article in Journal","4a6f241a-3fb5-4d05-a209-ed83c87f55b2","20081009T05:11:37.000+0000","03e996fa-9f03-40cc-9067-f4fcb8b052a8"
"Broun, T.","1880","Manual of the New Zealand Coleoptera","651 pp.","","","","","Colonial Museum and Geological Survey Department","<!--MARK--><a href='null21bb9254-a05b-446e-a24b-86800246a4fb' class='mouseoverHref'>Broun, T. 1880. <em>Manual of the New Zealand Coleoptera</em>. Wellington : Colonial Museum and Geological Survey Department Part 1 651 pp.</a><!--MARK-->","","Book","21bb9254-a05b-446e-a24b-86800246a4fb","20120319T21:07:58.417+0000",""
"Chaudoir, M. de","1850","Mémoire sur la famille des Carabiques. 2e partie","3-85 and 349-460","","Bulletin de la Société Impériale des Naturalistes de Moscou","","","","<!--MARK--><a href='nullef925dac-c013-4347-877a-216613d75acb' class='mouseoverHref'>Chaudoir, M. de 1850. Mémoire sur la famille des Carabiques. 2e partie.</a> <!--MARK--><!--MARK--><a href='nulla7cbc93a-fdd0-40a5-9cc8-35de71b7d18a' class='mouseoverHref'><em>Bulletin de la Société Impériale des Naturalistes de Moscou</em></a> <strong>23</strong>(1): 3-85 and 349-460<!--MARK-->","","Article in Journal","ef925dac-c013-4347-877a-216613d75acb","20081009T05:11:37.000+0000","a7cbc93a-fdd0-40a5-9cc8-35de71b7d18a"
"Chaudoir, M. de","1859","Monographie du genre <i>Colpodes</i> Macleay","287-364","","Annales de la Société Entomologique de France","","","","<!--MARK--><a href='null04695f56-c292-4434-8c50-db078249c7a0' class='mouseoverHref'>Chaudoir, M. de 1859. Monographie du genre <i>Colpodes</i> Macleay.</a> <!--MARK--><!--MARK--><a href='null6462279b-2aaf-46a3-a434-cab7d8a2c33d' class='mouseoverHref'><em>Annales de la Société Entomologique de France</em></a> 3 <strong>7</strong>: 287-364<!--MARK-->","","Article in Journal","04695f56-c292-4434-8c50-db078249c7a0","20081009T05:11:37.000+0000","6462279b-2aaf-46a3-a434-cab7d8a2c33d"
"Csiki, E.","1931","Carabidae II: Harpalinae V","739-1022","Coelopterorum Catalogus auspiciis et auxilio W. Junk","","","","","<!--MARK--><a href='null53f8dd75-6d44-4684-a2d2-92f8b4f519c4' class='mouseoverHref'>Csiki, E. 1931. Carabidae II: Harpalinae V. pp. 739-1022</a> <!--MARK--><em>in</em> <!--MARK--><a href='null8149855f-7fbf-474f-8f6a-62437cbfc3f8' class='mouseoverHref'>Schenkling, S. (ed.). <em>Coelopterorum Catalogus auspiciis et auxilio W. Junk</em>. Berlin : W. Junk Vol. 2 Pars 115.</a><!--MARK--> [Date published 12/Feb/1931]","","Chapter in Book","53f8dd75-6d44-4684-a2d2-92f8b4f519c4","20081009T05:11:37.000+0000","8149855f-7fbf-474f-8f6a-62437cbfc3f8"
"Darlington, P.J. Jr","1952","The carabid beetles of New Guinea. Part 2. The Agonini","89-252 pls 1-4","","Bulletin of the Museum of Comparative Zoology, Harvard","","","","<!--MARK--><a href='nullb66d7b3b-493a-4062-af88-898c22d3cd8f' class='mouseoverHref'>Darlington, P.J. Jr 1952. The carabid beetles of New Guinea. Part 2. The Agonini.</a> <!--MARK--><!--MARK--><a href='nullb2447030-bd13-4a45-9402-157082169a3d' class='mouseoverHref'><em>Bulletin of the Museum of Comparative Zoology, Harvard</em></a> <strong>107</strong>: 89-252 pls 1-4<!--MARK-->","","Article in Journal","b66d7b3b-493a-4062-af88-898c22d3cd8f","20081009T05:11:37.000+0000","b2447030-bd13-4a45-9402-157082169a3d"
"Darlington, P.J. Jr","1956","Australian carabid beetles III. Notes on the Agonini","1-10","","Psyche (Cambridge)","","","","<!--MARK--><a href='null87a0f309-df89-4b91-95b4-e751aa44d660' class='mouseoverHref'>Darlington, P.J. Jr 1956. Australian carabid beetles III. Notes on the Agonini.</a> <!--MARK--><!--MARK--><a href='nulle5075c07-9cfd-4699-a945-bae664d3a3e2' class='mouseoverHref'><em>Psyche (Cambridge)</em></a> Camb. <strong>63</strong>: 1-10<!--MARK-->","","Article in Journal","87a0f309-df89-4b91-95b4-e751aa44d660","20081009T05:11:37.000+0000","e5075c07-9cfd-4699-a945-bae664d3a3e2"
"Darlington, P.J. Jr","1963","Australian carabid beetles XIII. Further notes on Agonini, and a genus of Licinini new to Australia","1-10","","Breviora. Museum of Comparative Zoology","","","","<!--MARK--><a href='null3104d1e6-a757-4ec4-9eca-236d82018eb3' class='mouseoverHref'>Darlington, P.J. Jr 1963. Australian carabid beetles XIII. Further notes on Agonini, and a genus of Licinini new to Australia.</a> <!--MARK--><!--MARK--><a href='nullb5aca245-716d-4330-9421-57e8fe2d73d8' class='mouseoverHref'><em>Breviora. Museum of Comparative Zoology</em></a> <strong>183</strong>: 1-10<!--MARK-->","","Article in Journal","3104d1e6-a757-4ec4-9eca-236d82018eb3","20081009T05:11:37.000+0000","b5aca245-716d-4330-9421-57e8fe2d73d8"
"Darlington, P.J. Jr","1970","Insects of Micronesia. Coleoptera: Carabidae including Cicindelinae","1-49","","Insects of Micronesia","","","","<!--MARK--><a href='null4dbf0166-18b9-4e10-981c-98d213753173' class='mouseoverHref'>Darlington, P.J. Jr 1970. Insects of Micronesia. Coleoptera: Carabidae including Cicindelinae.</a> <!--MARK--><!--MARK--><a href='null81c8d16e-16d3-4bb5-b13a-12081d9d084f' class='mouseoverHref'><em>Insects of Micronesia</em></a> <strong>15</strong>: 1-49<!--MARK-->","","Article in Journal","4dbf0166-18b9-4e10-981c-98d213753173","20081009T05:11:37.000+0000","81c8d16e-16d3-4bb5-b13a-12081d9d084f"
"Darlington, P.J. Jr","1971","The carabid beetles of New Guinea. Part IV. General considerations; analysis and history of fauna; taxonomic supplement","129-337","","Bulletin of the Museum of Comparative Zoology, Harvard","","","","<!--MARK--><a href='null272e3f0a-ebd8-431b-8d1a-dd201f3e6618' class='mouseoverHref'>Darlington, P.J. Jr 1971. The carabid beetles of New Guinea. Part IV. General considerations; analysis and history of fauna; taxonomic supplement.</a> <!--MARK--><!--MARK--><a href='nullb2447030-bd13-4a45-9402-157082169a3d' class='mouseoverHref'><em>Bulletin of the Museum of Comparative Zoology, Harvard</em></a> <strong>142</strong>: 129-337<!--MARK-->","","Article in Journal","272e3f0a-ebd8-431b-8d1a-dd201f3e6618","20081009T05:11:37.000+0000","b2447030-bd13-4a45-9402-157082169a3d"
"Dejean, P.F.M.A.","1828","Spécies général des Coléoptères de la Collection de M. le Compte Dejean","vii 556 pp.","","","","","Méquignon-Marvis","<!--MARK--><a href='nulled097151-fd0d-4521-9a92-3099b9fea0dc' class='mouseoverHref'>Dejean, P.F.M.A. 1828. <em>Spécies général des Coléoptères de la Collection de M. le Compte Dejean</em>. Paris : Méquignon-Marvis Vol. III vii 556 pp.</a><!--MARK-->","","Book","ed097151-fd0d-4521-9a92-3099b9fea0dc","20081009T05:11:37.000+0000",""
"Dejean, P.F.M.A.","1831","Spécies général des Coléoptères de la collection de M. le Compte Dejean","viii 883 pp.","","","","","Méquignon-Marvis","<!--MARK--><a href='null7ab25a74-931b-4cbb-b560-358f89184c85' class='mouseoverHref'>Dejean, P.F.M.A. 1831. <em>Spécies général des Coléoptères de la collection de M. le Compte Dejean</em>. Paris : Méquignon-Marvis Vol. V viii 883 pp.</a><!--MARK-->","","Book","7ab25a74-931b-4cbb-b560-358f89184c85","20081009T05:11:37.000+0000",""
"Erichson, W.F.","1842","Beitrag zur Insecten-fauna von Vandiemensland, mit besonderer Berucksichtigung der geographischen Verbreitung der Insecten","83-287, pls 4, 5","","Archiv für Naturgeschichte","","","","<!--MARK--><a href='null2ae5a27f-fd1b-4bb9-b72e-a5997ccf96b3' class='mouseoverHref'>Erichson, W.F. 1842. Beitrag zur Insecten-fauna von Vandiemensland, mit besonderer Berucksichtigung der geographischen Verbreitung der Insecten.</a> <!--MARK--><!--MARK--><a href='nullf5b5f7c7-fc53-4502-951d-1c96b680d874' class='mouseoverHref'><em>Archiv für Naturgeschichte</em></a> <strong>8</strong>(1): 83-287, pls 4, 5<!--MARK-->","","Article in Journal","2ae5a27f-fd1b-4bb9-b72e-a5997ccf96b3","20120514T22:59:43.847+0000","f5b5f7c7-fc53-4502-951d-1c96b680d874"
"Fairmaire, L.","1881","Diagnoses de Coléoptères de la Mélanésie","348-349, 372-373, 381-382, 389, 406-407","","Le Naturaliste","","","","<!--MARK--><a href='null932dacaf-b3b9-4bc2-87b3-57142e7f4ca6' class='mouseoverHref'>Fairmaire, L. 1881. Diagnoses de Coléoptères de la Mélanésie.</a> <!--MARK--><!--MARK--><a href='null935bd092-231d-423d-a0dd-e2a01756fcfa' class='mouseoverHref'><em>Le Naturaliste</em></a> <strong>1</strong>: 348-349, 372-373, 381-382, 389, 406-407<!--MARK-->","","Article in Journal","932dacaf-b3b9-4bc2-87b3-57142e7f4ca6","20081009T05:11:37.000+0000","935bd092-231d-423d-a0dd-e2a01756fcfa"
"Fairmaire, L.","1881","Essai sur les Coléoptères des îles Viti (Fidgi)","242-318","","Annales de la Société Entomologique de France","","","","<!--MARK--><a href='nullfba0620d-6973-4ed3-965d-e8d0953f4008' class='mouseoverHref'>Fairmaire, L. 1881. Essai sur les Coléoptères des îles Viti (Fidgi).</a> <!--MARK--><!--MARK--><a href='null6462279b-2aaf-46a3-a434-cab7d8a2c33d' class='mouseoverHref'><em>Annales de la Société Entomologique de France</em></a> 6 <strong>1</strong>: 242-318<!--MARK-->","","Article in Journal","fba0620d-6973-4ed3-965d-e8d0953f4008","","6462279b-2aaf-46a3-a434-cab7d8a2c33d"
"Gemminger, M. & Harold, E. von","1868","Catalogus Coleopterorum hucusque descriptorum synonymicus et systematicus autoribus. Cicindelidae, Carabidae","xxxvi 424 pp.","","","","","E.H. Gummi","<!--MARK--><a href='null73fdf828-3f05-4d53-9e49-fd84b57b3c1a' class='mouseoverHref'>Gemminger, M. & Harold, E. von 1868. <em>Catalogus Coleopterorum hucusque descriptorum synonymicus et systematicus autoribus. Cicindelidae, Carabidae</em>. Monachii : E.H. Gummi Vol. 1 xxxvi 424 pp.</a><!--MARK-->","","Book","73fdf828-3f05-4d53-9e49-fd84b57b3c1a","20081009T05:11:37.000+0000",""
"Hinton, H.E.","1945","A Monograph of the Beetles Associated with Stored Products","viii 443 pp.","","","","","British Museum (Natural History)","<!--MARK--><a href='null6e6c5dc1-9961-4d66-b29f-f6b18d91198c' class='mouseoverHref'>Hinton, H.E. 1945. <em>A Monograph of the Beetles Associated with Stored Products</em>. London : British Museum (Natural History) Vol. 1 viii 443 pp.</a><!--MARK-->","","Book","6e6c5dc1-9961-4d66-b29f-f6b18d91198c","20090818T23:51:01.957+0000",""
"Macleay, W.J.","1871","Notes on a collection of insects from Gayndah","79-205","","Transactions of the Entomological Society of New South Wales","","","","<!--MARK--><a href='null9e91362c-6ac4-452a-8ef5-9d82e451f0de' class='mouseoverHref'>Macleay, W.J. 1871. Notes on a collection of insects from Gayndah.</a> <!--MARK--><!--MARK--><a href='null69b821b6-f09d-44b0-ae3f-0e6c294b532e' class='mouseoverHref'><em>Transactions of the Entomological Society of New South Wales</em></a> <strong>2</strong>: 79-205<!--MARK-->","","Article in Journal","9e91362c-6ac4-452a-8ef5-9d82e451f0de","20081009T05:11:37.000+0000","69b821b6-f09d-44b0-ae3f-0e6c294b532e"
"Macleay, W.J.","1887","The insects of the Cairns district, northern Queensland. Part II","213-238","","Proceedings of the Linnean Society of New South Wales","","August 31, 1887","","<!--MARK--><a href='null56ca28cb-f634-4a47-abed-b9ff4c972cda' class='mouseoverHref'>Macleay, W.J. 1887. The insects of the Cairns district, northern Queensland. Part II.</a> <!--MARK--><!--MARK--><a href='nullc12cd779-adb5-41ea-bd2c-75f6864cf22e' class='mouseoverHref'><em>Proceedings of the Linnean Society of New South Wales</em></a> 2 <strong>2</strong>(2): 213-238<!--MARK--> [Date published August 31, 1887: Second Series commenced 1886-87]","Second Series commenced 1886-87","Article in Journal","56ca28cb-f634-4a47-abed-b9ff4c972cda","20210624T08:51:11.973+0000","c12cd779-adb5-41ea-bd2c-75f6864cf22e"
"Macleay, W.S.","1825","Annulosa Javanica<i>, or an attempt to illustrate the natural affinities and analogies of the insects collected in Java by Thomas Horsfield, M.D. F.L. & G.S. and deposited by him in the Museum of the Honourable East-India Company</i>","52 pp. 1 pl.","","","","","Kingsbury, Parbury & Allen","<!--MARK--><a href='null4e7c0447-d687-4bad-969a-9a2037cfdb29' class='mouseoverHref'>Macleay, W.S. 1825. <em>Annulosa Javanica<i>, or an attempt to illustrate the natural affinities and analogies of the insects collected in Java by Thomas Horsfield, M.D. F.L. & G.S. and deposited by him in the Museum of the Honourable East-India Company</i></em>. London : Kingsbury, Parbury & Allen 52 pp. 1 pl.</a><!--MARK-->","","Book","4e7c0447-d687-4bad-969a-9a2037cfdb29","20081009T05:11:37.000+0000",""
"Montrouzier, P.","1860","Essai sur la faune entomologique de la Nouvelle-Calédonie (Balade) et des îles des Pins, Art, Lifui etc","233-308","","Annales de la Société Entomologique de France","","","","<!--MARK--><a href='null48b5d2b2-2c00-4640-abb6-843779cc8472' class='mouseoverHref'>Montrouzier, P. 1860. Essai sur la faune entomologique de la Nouvelle-Calédonie (Balade) et des îles des Pins, Art, Lifui etc.</a> <!--MARK--><!--MARK--><a href='null6462279b-2aaf-46a3-a434-cab7d8a2c33d' class='mouseoverHref'><em>Annales de la Société Entomologique de France</em></a> 3 <strong>8</strong>: 233-308<!--MARK-->","","Article in Journal","48b5d2b2-2c00-4640-abb6-843779cc8472","20081009T05:11:37.000+0000","6462279b-2aaf-46a3-a434-cab7d8a2c33d"
"Moore, B.P.","1979","Chemical defense in Carabids and its bearing on phylogeny","193-203","Carabid beetles: Their evolution, natural history, and classification","","","","","<!--MARK--><a href='null6488b883-bbc8-41c5-95bf-93354766b44e' class='mouseoverHref'>Moore, B.P. 1979. Chemical defense in Carabids and its bearing on phylogeny. pp. 193-203</a> <!--MARK--><em>in</em> <!--MARK--><a href='nulle364904b-0a23-44c0-9003-f6954883a0aa' class='mouseoverHref'>Erwin, T.L., Ball, G.E., Whitehead, D.R. & Halpern, A.L. (eds). <em>Carabid beetles: Their evolution, natural history, and classification</em>. The Hague : W. Junk vii 635 pp.</a><!--MARK-->","","Chapter in Book","6488b883-bbc8-41c5-95bf-93354766b44e","20081009T05:11:37.000+0000","e364904b-0a23-44c0-9003-f6954883a0aa"
"Moore, B.P.","1985","The Carabidae of Norfolk Island","237-256","Taxonomy, Phylogeny and Zoogeography of Beetles and Ants. A Volume Dedicated to the Memory of Philip Jackson Darlington, Jr 1904-1983 (Series Entomologia 33)","","","","","<!--MARK--><a href='null1a2927ee-2df2-4faf-8460-5544c76003c5' class='mouseoverHref'>Moore, B.P. 1985. The Carabidae of Norfolk Island. pp. 237-256</a> <!--MARK--><em>in</em> <!--MARK--><a href='null0c90641d-e6f1-4a42-b6d1-1ee60f7c7344' class='mouseoverHref'>Ball, G.E. (ed.). <em>Taxonomy, Phylogeny and Zoogeography of Beetles and Ants. A Volume Dedicated to the Memory of Philip Jackson Darlington, Jr 1904-1983 (Series Entomologia 33)</em>. Dordrecht : Dr W. Junk.</a><!--MARK-->","","Chapter in Book","1a2927ee-2df2-4faf-8460-5544c76003c5","20081009T05:11:37.000+0000","0c90641d-e6f1-4a42-b6d1-1ee60f7c7344"
"Moore, B.P.","1987","Suborder Adephaga","17-366","Zoological Catalogue of Australia. Coleoptera: Archostemata, Myxophaga and Adephaga","","","","","<!--MARK--><a href='null1f267174-3770-4e86-a2a6-fe1e8fdf52d2' class='mouseoverHref'>Moore, B.P. 1987. Suborder Adephaga. pp. 17-366</a> <!--MARK--><em>in</em> <!--MARK--><a href='nullbd74a387-ac31-4a80-8ac1-c19387a1eb98' class='mouseoverHref'>Houston, W.W.K. & Richardson, B.J.R. (eds). <em>Zoological Catalogue of Australia. Coleoptera: Archostemata, Myxophaga and Adephaga</em>. Canberra : Australian Government Publishing Service Vol. 4 viii 444 pp.</a><!--MARK-->","","Chapter in Book","1f267174-3770-4e86-a2a6-fe1e8fdf52d2","20081009T05:11:37.000+0000","bd74a387-ac31-4a80-8ac1-c19387a1eb98"
"Moore, B.P.","1992","The Carabidae of Lord Howe Island (Coleoptera: Carabidae)","159-173","The Biogeography of Ground Beetles of Mountains and Islands","","","","","<!--MARK--><a href='null0e483ed0-186f-498a-a10f-8b1544aa2e4c' class='mouseoverHref'>Moore, B.P. 1992. The Carabidae of Lord Howe Island (Coleoptera: Carabidae). pp. 159-173</a> <!--MARK--><em>in</em> <!--MARK--><a href='nulld1c2151d-e0ac-4c4d-9cb3-d1175d948893' class='mouseoverHref'>Noonan, G.R., Ball, G.E. & Stork, N.E. (eds). <em>The Biogeography of Ground Beetles of Mountains and Islands</em>. Andover, Hampshire, UK : Intercept 256 pp.</a><!--MARK-->","","Chapter in Book","0e483ed0-186f-498a-a10f-8b1544aa2e4c","20081009T05:11:37.000+0000","d1c2151d-e0ac-4c4d-9cb3-d1175d948893"
"Motschulsky, V.","1864","Énumération des nouvelles espèces de Coléoptères rapportés de ses voyages. 4-ème article (Suite)","297-355","","Bulletin de la Société Impériale des Naturalistes de Moscou","","","","<!--MARK--><a href='nullb9d41b99-56cf-43d2-a7f6-22ddd8079758' class='mouseoverHref'>Motschulsky, V. 1864. Énumération des nouvelles espèces de Coléoptères rapportés de ses voyages. 4-ème article (Suite).</a> <!--MARK--><!--MARK--><a href='nulla7cbc93a-fdd0-40a5-9cc8-35de71b7d18a' class='mouseoverHref'><em>Bulletin de la Société Impériale des Naturalistes de Moscou</em></a> <strong>37</strong>: 297-355<!--MARK-->","","Article in Journal","b9d41b99-56cf-43d2-a7f6-22ddd8079758","20081009T05:11:37.000+0000","a7cbc93a-fdd0-40a5-9cc8-35de71b7d18a"
"Newman, E.","1842","List of insects collected at Port Phillip, New South Wales, by Edmund Thomas Higgins, Esq. (continued)","401-405","","The Entomologist","","Oct. 1842","","<!--MARK--><a href='nulla3400700-fa6b-4bb1-9631-19dabc7930fc' class='mouseoverHref'>Newman, E. 1842. List of insects collected at Port Phillip, New South Wales, by Edmund Thomas Higgins, Esq. (continued).</a> <!--MARK--><!--MARK--><a href='nullf3b5bc68-9fcf-42d6-b01d-f490d96af7e9' class='mouseoverHref'><em>The Entomologist</em></a> <strong>1</strong>(24): 401-405<!--MARK--> [Date published Oct. 1842]","","Article in Journal","a3400700-fa6b-4bb1-9631-19dabc7930fc","20160922T06:52:52.527+0000","f3b5bc68-9fcf-42d6-b01d-f490d96af7e9"
"Olliff, A.S.","1889","The insect fauna of Lord Howe Island","75-98 pl vi","","Memoirs of the Australian Museum","","","","<!--MARK--><a href='null34fd1990-25a2-4e3a-a7d0-23a5281b7ca9' class='mouseoverHref'>Olliff, A.S. 1889. The insect fauna of Lord Howe Island.</a> <!--MARK--><!--MARK--><a href='null272826c2-c2bf-425b-bd6f-11ddaf2aaeaa' class='mouseoverHref'><em>Memoirs of the Australian Museum</em></a> <strong>ii</strong>(4): 75-98 pl vi<!--MARK-->","","Article in Journal","34fd1990-25a2-4e3a-a7d0-23a5281b7ca9","20081009T05:11:37.000+0000","272826c2-c2bf-425b-bd6f-11ddaf2aaeaa"
"Redtenbacher, L.","1867","Reise der Österreichischen Fregatte <i>Novara</i> um die Erde in den Jahren 1857, 1858, 1859 unter den befehlen des Commodore B. von Wüllerstorf-Urbair. Zoologischer Theil. Coleoptera","iv 249 pp. 5 pls","","","","","Karl Gerold's Sohn","<!--MARK--><a href='nullaec2c387-549f-4c48-8aca-ae209e2c300a' class='mouseoverHref'>Redtenbacher, L. 1867. <em>Reise der Österreichischen Fregatte <i>Novara</i> um die Erde in den Jahren 1857, 1858, 1859 unter den befehlen des Commodore B. von Wüllerstorf-Urbair. Zoologischer Theil. Coleoptera</em>. Wien : Karl Gerold's Sohn Vol. 2(1) iv 249 pp. 5 pls.</a><!--MARK-->","","Book","aec2c387-549f-4c48-8aca-ae209e2c300a","20081009T05:11:37.000+0000",""
"Schmidt-Goebel, H.M.","1846","Faunula Coleopterorum Birmaniae, adjectis nonullis Bengaliae indiginis Med. Dr. Johann Wilhelm Halfer´s hinterlassene Sammlungen aus Vorder- und Hinter-Indien. Nach seinem Tode in Aufrage des böhm. National-Museums unter Mitwirkung Mehrerer","94 pp. 3 pls","","","","","G. Haase Söhne","<!--MARK--><a href='null6d8ddcbc-d9da-4596-b154-89ac6454fbf1' class='mouseoverHref'>Schmidt-Goebel, H.M. 1846. <em>Faunula Coleopterorum Birmaniae, adjectis nonullis Bengaliae indiginis Med. Dr. Johann Wilhelm Halfer´s hinterlassene Sammlungen aus Vorder- und Hinter-Indien. Nach seinem Tode in Aufrage des böhm. National-Museums unter Mitwirkung Mehrerer</em>. Prague : G. Haase Söhne 94 pp. 3 pls.</a><!--MARK-->","","Book","6d8ddcbc-d9da-4596-b154-89ac6454fbf1","20160522T23:47:00.534+0000",""
"Sloane, T.G.","1895","Studies in Australian Entomology. No. VII New genera and species of Carabidae (including some notes on previously described species, and synoptic lists of genera and species)","393-455","","Proceedings of the Linnean Society of New South Wales","","","","<!--MARK--><a href='null1268401f-7018-4856-9fe3-0a0b6085c99c' class='mouseoverHref'>Sloane, T.G. 1895. Studies in Australian Entomology. No. VII New genera and species of Carabidae (including some notes on previously described species, and synoptic lists of genera and species).</a> <!--MARK--><!--MARK--><a href='nullc12cd779-adb5-41ea-bd2c-75f6864cf22e' class='mouseoverHref'><em>Proceedings of the Linnean Society of New South Wales</em></a> 2 <strong>9</strong>: 393-455<!--MARK-->","","Article in Journal","1268401f-7018-4856-9fe3-0a0b6085c99c","20081009T05:11:37.000+0000","c12cd779-adb5-41ea-bd2c-75f6864cf22e"
