"PUB_AUTHOR","PUB_YEAR","PUB_TITLE","PUB_PAGES","PUB_PARENT_BOOK_TITLE","PUB_PARENT_JOURNAL_TITLE","PUB_PARENT_ARTICLE_TITLE","PUB_PUBLICATION_DATE","PUB_PUBLISHER","PUB_FORMATTED","PUB_QUALIFICATION","PUB_TYPE","PUBLICATION_GUID","PUBLICATION_LAST_UPDATE","PARENT_PUBLICATION_GUID"
"Chace, F.A., Jr","1992","On the classification of the Caridea","70-80","","Crustaceana","","","","<!--MARK--><a href='nullef7d005b-f9eb-4913-a42b-2c4cf4d57d54' class='mouseoverHref'>Chace, F.A., Jr 1992. On the classification of the Caridea.</a> <!--MARK--><!--MARK--><a href='nullb3bd1331-ba54-4715-8a3e-f79237a8af84' class='mouseoverHref'><em>Crustaceana</em></a> <strong>63</strong>(1): 70-80<!--MARK-->","","Article in Journal","ef7d005b-f9eb-4913-a42b-2c4cf4d57d54","20081009T05:11:37.000+0000","b3bd1331-ba54-4715-8a3e-f79237a8af84"
"De Grave, S. & Fransen, C.H.J.M.","2011","Carideorum Catalogus: The recent species of the Dendrobrachiate, Stenopodidean, Procarididean and Caridean shrimps (Crustacea: Decapoda)","195-589, figs 1-59","","Zoologische Mededelingen (Leiden)","","","","<!--MARK--><a href='nulld3191c95-45df-44e4-bd2b-9d22ce5e3ef5' class='mouseoverHref'>De Grave, S. & Fransen, C.H.J.M. 2011. Carideorum Catalogus: The recent species of the Dendrobrachiate, Stenopodidean, Procarididean and Caridean shrimps (Crustacea: Decapoda).</a> <!--MARK--><!--MARK--><a href='null42ce8f11-9401-4dfc-ae20-52feb2a315f5' class='mouseoverHref'><em>Zoologische Mededelingen (Leiden)</em></a> <strong>85</strong>(9): 195-589, figs 1-59<!--MARK-->","","Article in Journal","d3191c95-45df-44e4-bd2b-9d22ce5e3ef5","20180809T06:05:04.839+0000","42ce8f11-9401-4dfc-ae20-52feb2a315f5"
"Huys, R., Low, M.E.Y., de Grave, S., Ng, P.K.L. & Clark, P.F.","2014","On two reports associated with James Wood-Mason and Alfred William Alcock published by the Indian Museum and the Indian Marine Survey between 1890 and 1891: implications for malacostracan nomenclature","1-78","","Zootaxa","","","","<!--MARK--><a href='nullf4391b8f-bfe9-444a-a2d5-08525cc9178d' class='mouseoverHref'>Huys, R., Low, M.E.Y., de Grave, S., Ng, P.K.L. & Clark, P.F. 2014. On two reports associated with James Wood-Mason and Alfred William Alcock published by the Indian Museum and the Indian Marine Survey between 1890 and 1891: implications for malacostracan nomenclature.</a> <!--MARK--><!--MARK--><a href='null96466227-221c-4922-ac97-1ac2dd946d0a' class='mouseoverHref'><em>Zootaxa</em></a> <strong>3757</strong>(1): 1-78<!--MARK-->","","Article in Journal","f4391b8f-bfe9-444a-a2d5-08525cc9178d","20140223T22:00:53.928+0000","96466227-221c-4922-ac97-1ac2dd946d0a"
"International Commission on Zoological Nomenclature","1957","Opinion 470. Additions to the <i>Official List of Family-Group Names in Zoology</i> of the names of one hundred and two genera of Caridea (Class Crustacea, Order Decapoda) and use of the Plenary Powers for various purposes in connection therewith","129-202","","Opinions and Declarations rendered by the International Commission on Zoological Nomenclature","","","","<!--MARK--><a href='null4a7009ce-6422-4652-a34e-fb11fdf42085' class='mouseoverHref'>International Commission on Zoological Nomenclature 1957. Opinion 470. Additions to the <i>Official List of Family-Group Names in Zoology</i> of the names of one hundred and two genera of Caridea (Class Crustacea, Order Decapoda) and use of the Plenary Powers for various purposes in connection therewith.</a> <!--MARK--><!--MARK--><a href='null92d3cf78-df7b-46c8-b176-c7b0ac287b5d' class='mouseoverHref'><em>Opinions and Declarations rendered by the International Commission on Zoological Nomenclature</em></a> <strong>16</strong>: 129-202<!--MARK-->","","Article in Journal","4a7009ce-6422-4652-a34e-fb11fdf42085","20081009T05:11:37.000+0000","92d3cf78-df7b-46c8-b176-c7b0ac287b5d"
"Kubo, I.","1952","On two rare species of Psalidopodidae and Nephropsidae","91-100","","Journal of the Tokyo University of Fisheries","","","","<!--MARK--><a href='nullac40b6d2-1cd0-422b-9aa8-e63ac4a21c58' class='mouseoverHref'>Kubo, I. 1952. On two rare species of Psalidopodidae and Nephropsidae.</a> <!--MARK--><!--MARK--><a href='nullb55d2c13-3523-4652-9993-81f1874810b9' class='mouseoverHref'><em>Journal of the Tokyo University of Fisheries</em></a><!--MARK--> [formerly <i>Journal of the Tokyo College of Fisheries</i>] <strong>39</strong>: 91-100<!--MARK-->","","Article in Journal","ac40b6d2-1cd0-422b-9aa8-e63ac4a21c58","20120103T04:38:35.771+0000","b55d2c13-3523-4652-9993-81f1874810b9"
"Wadley, V. & Evans, D.","1991","Crustaceans from the Deepwater Trawl Fisheries of Western Australia","44","","","","","CSIRO Division of Fisheries","<!--MARK--><a href='null27ba19ba-2479-4153-a1bf-14a1b2eb8ead' class='mouseoverHref'>Wadley, V. & Evans, D. 1991. <em>Crustaceans from the Deepwater Trawl Fisheries of Western Australia</em>. Hobart, Australia : CSIRO Division of Fisheries 44 pp.</a><!--MARK-->","","Book","27ba19ba-2479-4153-a1bf-14a1b2eb8ead","20081009T05:11:37.000+0000",""
"Wood-Mason, J. & Alcock, A.","1892","Natural history notes from H.M. Indian Marine Survey Steamer Investigator, Commander R.F. Hoskyn, R.N., commanding. Series II., No. 1. On the results of deep-sea dredging during the season 1890-91","265-275, 358-370 figs 1-6 pls 14, 15","","Annals and Magazine of Natural History","","","","<!--MARK--><a href='nullc5d5b34a-e01f-495f-9385-b909a53c7e9a' class='mouseoverHref'>Wood-Mason, J. & Alcock, A. 1892. Natural history notes from H.M. Indian Marine Survey Steamer Investigator, Commander R.F. Hoskyn, R.N., commanding. Series II., No. 1. On the results of deep-sea dredging during the season 1890-91.</a> <!--MARK--><!--MARK--><a href='nullefa8de69-3a29-4a43-8ef2-cbefda205976' class='mouseoverHref'><em>Annals and Magazine of Natural History</em></a> 6 <strong>9</strong>: 265-275, 358-370 figs 1-6 pls 14, 15<!--MARK-->","","Article in Journal","c5d5b34a-e01f-495f-9385-b909a53c7e9a","20081009T05:11:37.000+0000","efa8de69-3a29-4a43-8ef2-cbefda205976"
"Wood-Mason, J. in Anonymous","1891","Appendix No. XIII.","pp. 52-57","","","","","","<!--MARK--><a href='null67260ae0-3f43-4338-ab31-9da97f499aa7' class='mouseoverHref'>Wood-Mason, J. <i>in</i> Anonymous 1891. Appendix No. XIII. <i>In</i>, Administration Report of the Indian Marine for the Official Year 1890-91. The Government Central Press, Bombay. pp. 52-57</a>","","Miscellaneous","67260ae0-3f43-4338-ab31-9da97f499aa7","20140223T22:18:10.182+0000",""
