"PUB_AUTHOR","PUB_YEAR","PUB_TITLE","PUB_PAGES","PUB_PARENT_BOOK_TITLE","PUB_PARENT_JOURNAL_TITLE","PUB_PARENT_ARTICLE_TITLE","PUB_PUBLICATION_DATE","PUB_PUBLISHER","PUB_FORMATTED","PUB_QUALIFICATION","PUB_TYPE","PUBLICATION_GUID","PUBLICATION_LAST_UPDATE","PARENT_PUBLICATION_GUID"
"Bertrand, H.","1972","Larves et Nymphes des Coléoptères Aquatiques du Globe","804 pp.","","","","12/31/1972","Paillart","<!--MARK--><a href='null2bf0ecfa-a556-4cf5-aaf0-97a5eb5d7db7' class='mouseoverHref'>Bertrand, H. 1972. <em>Larves et Nymphes des Coléoptères Aquatiques du Globe</em>. Paris : Paillart 804 pp.</a><!--MARK--> [Date published 12/31/1972]","","Book","2bf0ecfa-a556-4cf5-aaf0-97a5eb5d7db7","20100105T23:57:39.126+0000",""
"Bertrand, H. & Watts, C.","1965","Les premiers états des <i>Sclerocyphon</i> Blackb. (Col. Eubriidae)","412-435","","Bulletin du Muséum National d'Histoire Naturelle, Paris","","","","<!--MARK--><a href='null81367c34-eb3e-44a7-bf34-165bccaf2190' class='mouseoverHref'>Bertrand, H. & Watts, C. 1965. Les premiers états des <i>Sclerocyphon</i> Blackb. (Col. Eubriidae).</a> <!--MARK--><!--MARK--><a href='null796711f5-67db-4504-bf92-fda69a7bdc27' class='mouseoverHref'><em>Bulletin du Muséum National d'Histoire Naturelle, Paris</em></a><!--MARK--> [published 1907-1971] 2 <strong>37</strong>(3): 412-435<!--MARK-->","","Article in Journal","81367c34-eb3e-44a7-bf34-165bccaf2190","20081009T05:11:37.000+0000","796711f5-67db-4504-bf92-fda69a7bdc27"
"Blackburn, T.","1892","Notes on Australian Coleoptera, with descriptions of new species. Part X","479-550","","Proceedings of the Linnean Society of New South Wales","","May 23, 1892","","<!--MARK--><a href='nullb5617928-442e-49d5-8086-e89085a1f2ba' class='mouseoverHref'>Blackburn, T. 1892. Notes on Australian Coleoptera, with descriptions of new species. Part X.</a> <!--MARK--><!--MARK--><a href='nullc12cd779-adb5-41ea-bd2c-75f6864cf22e' class='mouseoverHref'><em>Proceedings of the Linnean Society of New South Wales</em></a> 2 <strong>6</strong>(3): 479-550<!--MARK--> [Date published May 23, 1892]","","Article in Journal","b5617928-442e-49d5-8086-e89085a1f2ba","20081009T05:11:37.000+0000","c12cd779-adb5-41ea-bd2c-75f6864cf22e"
"Brown, H.P.","1981","A distributional survey of the world genera of aquatic dryopoid beetles (Coleoptera: Dryopidae, Elmidae and Psephenidae <i>sens. lat.</i>)","133-148","","Pan-Pacific Entomologist","","","","<!--MARK--><a href='null425ea273-cbd8-42d0-b10c-83188e1aea1a' class='mouseoverHref'>Brown, H.P. 1981. A distributional survey of the world genera of aquatic dryopoid beetles (Coleoptera: Dryopidae, Elmidae and Psephenidae <i>sens. lat.</i>).</a> <!--MARK--><!--MARK--><a href='null3639cdfb-95c3-41b3-a402-0ec253289de8' class='mouseoverHref'><em>Pan-Pacific Entomologist</em></a> <strong>57</strong>: 133-148<!--MARK-->","","Article in Journal","425ea273-cbd8-42d0-b10c-83188e1aea1a","20081009T05:11:37.000+0000","3639cdfb-95c3-41b3-a402-0ec253289de8"
"Carter, H.J.","1935","Australian Coleoptera. Notes and new species. No. IX","179-193","","Proceedings of the Linnean Society of New South Wales","","","","<!--MARK--><a href='null814f1018-4066-404e-8f7f-10dda90bf2dc' class='mouseoverHref'>Carter, H.J. 1935. Australian Coleoptera. Notes and new species. No. IX.</a> <!--MARK--><!--MARK--><a href='nullc12cd779-adb5-41ea-bd2c-75f6864cf22e' class='mouseoverHref'><em>Proceedings of the Linnean Society of New South Wales</em></a> <strong>60</strong>: 179-193<!--MARK-->","","Article in Journal","814f1018-4066-404e-8f7f-10dda90bf2dc","20081009T05:11:37.000+0000","c12cd779-adb5-41ea-bd2c-75f6864cf22e"
"Davis, J.A.","1986","Revision of the Australian Psephenidae (Coleoptera): Systematics, phylogeny and historical biogeography","1-97","","Australian Journal of Zoology Supplementary Series","","","","<!--MARK--><a href='nulla0ba07ac-4b94-4916-ab33-abc16970940c' class='mouseoverHref'>Davis, J.A. 1986. Revision of the Australian Psephenidae (Coleoptera): Systematics, phylogeny and historical biogeography.</a> <!--MARK--><!--MARK--><a href='null0cf8bdc8-2852-42c3-824a-7d9a708d9672' class='mouseoverHref'><em>Australian Journal of Zoology Supplementary Series</em></a> <strong>119</strong>: 1-97<!--MARK-->","","Article in Journal","a0ba07ac-4b94-4916-ab33-abc16970940c","20081009T05:11:37.000+0000","0cf8bdc8-2852-42c3-824a-7d9a708d9672"
"Fabricius, J.C.","1775","Systema Entomologiae, sistens Insectorum Classes, Ordines, Genera, Species, adiectis Synonymis, Locis, Descriptionibus, Observationibus","xxxii 832 pp.","","","","17 April","Kortii","<!--MARK--><a href='nullda77a1b5-cdfa-4c8b-a4fa-3ba1ead48929' class='mouseoverHref'>Fabricius, J.C. 1775. <em>Systema Entomologiae, sistens Insectorum Classes, Ordines, Genera, Species, adiectis Synonymis, Locis, Descriptionibus, Observationibus</em>. Flensburgi et Lipsiae [= Flensburg & Leipzig] : Kortii xxxii 832 pp.</a><!--MARK--> [Date published 17 April]","","Book","da77a1b5-cdfa-4c8b-a4fa-3ba1ead48929","20110508T01:53:06.371+0000",""
"Hinton, H.E.","1955","On the respiratory adaptations, biology and taxonomy of the Psephenidae with notes on some related families (Coleoptera)","543-568","","Proceedings of the Zoological Society of London","","","","<!--MARK--><a href='null1bcd431c-94c7-4da1-ab20-73a355dd1713' class='mouseoverHref'>Hinton, H.E. 1955. On the respiratory adaptations, biology and taxonomy of the Psephenidae with notes on some related families (Coleoptera).</a> <!--MARK--><!--MARK--><a href='null511f299d-99ec-413c-bc4c-04a380829c96' class='mouseoverHref'><em>Proceedings of the Zoological Society of London</em></a> <strong>125</strong>: 543-568<!--MARK-->","","Article in Journal","1bcd431c-94c7-4da1-ab20-73a355dd1713","20081009T05:11:37.000+0000","511f299d-99ec-413c-bc4c-04a380829c96"
"Hinton, H.E.","1966","Respiratory adaptations of the pupae of beetles in the family Psephenidae","211-245","","Philosophical Transactions of the Royal Society of London","","","","<!--MARK--><a href='null9f8d6829-768e-4758-a637-4fafbcb439c7' class='mouseoverHref'>Hinton, H.E. 1966. Respiratory adaptations of the pupae of beetles in the family Psephenidae.</a> <!--MARK--><!--MARK--><a href='null9869065b-3961-4043-9902-80787f2b3b87' class='mouseoverHref'><em>Philosophical Transactions of the Royal Society of London</em></a> B <strong>251</strong>: 211-245<!--MARK-->","","Article in Journal","9f8d6829-768e-4758-a637-4fafbcb439c7","20081009T05:11:37.000+0000","9869065b-3961-4043-9902-80787f2b3b87"
"Lawrence, J.F.","1982","Coleoptera","482-553","Synopsis and Classification of Living Organisms","","","","","<!--MARK--><a href='null9195371d-372d-41d4-8fe4-f243c9cebfb1' class='mouseoverHref'>Lawrence, J.F. 1982. Coleoptera. pp. 482-553</a> <!--MARK--><em>in</em> <!--MARK--><a href='nulla974e260-3e40-4d35-9866-5c97c0c49b2c' class='mouseoverHref'>Parker, S.P. (ed.). <em>Synopsis and Classification of Living Organisms</em>. New York : McGraw Hill Vol. 2 vii 1232 pp.</a><!--MARK-->","","Chapter in Book","9195371d-372d-41d4-8fe4-f243c9cebfb1","20161017T04:10:08.666+0000","a974e260-3e40-4d35-9866-5c97c0c49b2c"
"Lawrence, J.F. & Britton, E.B.","1994","Australian Beetles","x 192 pp.","","","","","Melbourne University Press","<!--MARK--><a href='null5b9b6e97-52bd-4772-a414-468b0dc89336' class='mouseoverHref'>Lawrence, J.F. & Britton, E.B. 1994. <em>Australian Beetles</em>. Melbourne : Melbourne University Press x 192 pp.</a><!--MARK-->","","Book","5b9b6e97-52bd-4772-a414-468b0dc89336","20090819T04:34:31.325+0000",""
"Lea, A.M.","1895","Descriptions of new species of Australian Coleoptera","589-634","","Proceedings of the Linnean Society of New South Wales","","Mar. 28, 1895","","<!--MARK--><a href='null74141549-4930-4fcf-a212-58f877227478' class='mouseoverHref'>Lea, A.M. 1895. Descriptions of new species of Australian Coleoptera.</a> <!--MARK--><!--MARK--><a href='nullc12cd779-adb5-41ea-bd2c-75f6864cf22e' class='mouseoverHref'><em>Proceedings of the Linnean Society of New South Wales</em></a> 2 <strong>9</strong>: 589-634<!--MARK--> [Date published Mar. 28, 1895]","","Article in Journal","74141549-4930-4fcf-a212-58f877227478","20081009T05:11:37.000+0000","c12cd779-adb5-41ea-bd2c-75f6864cf22e"
"Lea, A.M.","1919","Notes on some miscellaneous Coleoptera, with descriptions of new species. Part V","166-261, pls XXV-XXVII","","Transactions of the Royal Society of South Australia","","24 Dec. 1919","","<!--MARK--><a href='null90157112-3fc1-4e96-b57b-f16b77996887' class='mouseoverHref'>Lea, A.M. 1919. Notes on some miscellaneous Coleoptera, with descriptions of new species. Part V.</a> <!--MARK--><!--MARK--><a href='null8b48b0a3-dd7a-4aea-be0d-10a223710ebc' class='mouseoverHref'><em>Transactions of the Royal Society of South Australia</em></a> <strong>43</strong>: 166-261, pls XXV-XXVII<!--MARK--> [Date published 24 Dec. 1919]","","Article in Journal","90157112-3fc1-4e96-b57b-f16b77996887","20081009T05:11:37.000+0000","8b48b0a3-dd7a-4aea-be0d-10a223710ebc"
"Lee, C.-F. & Jäch, M.A.","1995","Psephenidae: 1. Check list of the Psephenidae of China (Coleoptera)","349-354","Water Beetles of China","","","","","<!--MARK--><a href='null52b3629e-4120-41b9-83d4-898855e8a6ef' class='mouseoverHref'>Lee, C.-F. & Jäch, M.A. 1995. Psephenidae: 1. Check list of the Psephenidae of China (Coleoptera). pp. 349-354</a> <!--MARK--><em>in</em> <!--MARK--><a href='null26bab632-0036-48fb-b8db-cbbd8062c4e2' class='mouseoverHref'>Jäch, M.A. & Ji, L. (eds). <em>Water Beetles of China</em>. Wien : Zoologisch-Botanische Gesellschaft in Österreich and Wiener Coleopterologenverein Vol. 1 410 pp.</a><!--MARK-->","","Chapter in Book","52b3629e-4120-41b9-83d4-898855e8a6ef","20081009T05:11:37.000+0000","26bab632-0036-48fb-b8db-cbbd8062c4e2"
"Pic, M.","1924","Nouveautés diverses","1-32","","Mélanges Exotico-Entomologiques, Moulins","","","","<!--MARK--><a href='nullf8e58d94-38fd-4240-a9ca-b448be056e43' class='mouseoverHref'>Pic, M. 1924. Nouveautés diverses.</a> <!--MARK--><!--MARK--><a href='null0f348a34-317a-45aa-9637-cd0e1dc5ec5f' class='mouseoverHref'><em>Mélanges Exotico-Entomologiques, Moulins</em></a> <strong>42</strong>: 1-32<!--MARK-->","","Article in Journal","f8e58d94-38fd-4240-a9ca-b448be056e43","20081009T05:11:37.000+0000","0f348a34-317a-45aa-9637-cd0e1dc5ec5f"
"Smith, J.A.","1981","Two Tasmanian species of <i>Sclerocyphon</i> Blackburn (Coleoptera: Psephenidae) with notes on their life history and distribution","277-288","","Journal of the Australian Entomological Society","","","","<!--MARK--><a href='null48fdcdda-8dd9-4c17-bc6d-758cb14dffd4' class='mouseoverHref'>Smith, J.A. 1981. Two Tasmanian species of <i>Sclerocyphon</i> Blackburn (Coleoptera: Psephenidae) with notes on their life history and distribution.</a> <!--MARK--><!--MARK--><a href='nullc2544f9f-3978-4f18-846d-a1fd3122c9c4' class='mouseoverHref'><em>Journal of the Australian Entomological Society</em></a> <strong>20</strong>(4): 277-288<!--MARK-->","","Article in Journal","48fdcdda-8dd9-4c17-bc6d-758cb14dffd4","20081009T05:11:37.000+0000","c2544f9f-3978-4f18-846d-a1fd3122c9c4"
"Smith, J.A. & Dartnall, A.J.","1980","Boundary layer control by water pennies (Coleoptera: Psephenidae)","65-72","","Aquatic Insects","","","","<!--MARK--><a href='null40fc0782-1e3d-4575-a3f8-9d109c77eb56' class='mouseoverHref'>Smith, J.A. & Dartnall, A.J. 1980. Boundary layer control by water pennies (Coleoptera: Psephenidae).</a> <!--MARK--><!--MARK--><a href='nulle04a5ea2-9b29-46e9-8d76-97528a814aa7' class='mouseoverHref'><em>Aquatic Insects</em></a> <strong>2</strong>: 65-72<!--MARK-->","","Article in Journal","40fc0782-1e3d-4575-a3f8-9d109c77eb56","20081009T05:11:37.000+0000","e04a5ea2-9b29-46e9-8d76-97528a814aa7"
"Wiggins, G.B.","1966","The critical problems of systematics in stream ecology","52-58","","Special Publications of the Pymatuning Laboratory of Field Biology","","","","<!--MARK--><a href='null1b78b149-5ade-4e83-9d47-b4d0a1b4bc8b' class='mouseoverHref'>Wiggins, G.B. 1966. The critical problems of systematics in stream ecology.</a> <!--MARK--><!--MARK--><a href='null456d6732-1f9d-413b-8f5f-05041f5d729d' class='mouseoverHref'><em>Special Publications of the Pymatuning Laboratory of Field Biology</em></a> <strong>4</strong>: 52-58<!--MARK-->","","Article in Journal","1b78b149-5ade-4e83-9d47-b4d0a1b4bc8b","20081009T05:11:37.000+0000","456d6732-1f9d-413b-8f5f-05041f5d729d"
