"PUB_AUTHOR","PUB_YEAR","PUB_TITLE","PUB_PAGES","PUB_PARENT_BOOK_TITLE","PUB_PARENT_JOURNAL_TITLE","PUB_PARENT_ARTICLE_TITLE","PUB_PUBLICATION_DATE","PUB_PUBLISHER","PUB_FORMATTED","PUB_QUALIFICATION","PUB_TYPE","PUBLICATION_GUID","PUBLICATION_LAST_UPDATE","PARENT_PUBLICATION_GUID"
"Darlington, P.J. Jr","1961","Australian carabid beetles VI. The tropical and some subtropical species of <i>Pamborus</i>, <i>Mystropomus</i>, and <i>Nurus</i>.","1-13","","Breviora. Museum of Comparative Zoology","","","","<!--MARK--><a href='../../../../publication/7fc3c105-89d6-4b12-90af-ba339278c74b' class='mouseoverHref'>Darlington, P.J. Jr 1961. Australian carabid beetles VI. The tropical and some subtropical species of <i>Pamborus</i>, <i>Mystropomus</i>, and <i>Nurus</i>.</a> <!--MARK--><!--MARK--><a href='../../../../publication/b5aca245-716d-4330-9421-57e8fe2d73d8' class='mouseoverHref'><em>Breviora. Museum of Comparative Zoology</em></a> <strong>142</strong>: 1-13<!--MARK-->","","Article in Journal","7fc3c105-89d6-4b12-90af-ba339278c74b","20150909T23:21:47.871+0000","b5aca245-716d-4330-9421-57e8fe2d73d8"
"Darlington, P.J. Jr","1961","Australian carabid beetles VIII. <i>Leiradira</i>, especially the tropical species.","1-12","","Breviora. Museum of Comparative Zoology","","","","<!--MARK--><a href='../../../../publication/937074c2-f7ed-4ee5-b800-8cf87011153c' class='mouseoverHref'>Darlington, P.J. Jr 1961. Australian carabid beetles VIII. <i>Leiradira</i>, especially the tropical species.</a> <!--MARK--><!--MARK--><a href='../../../../publication/b5aca245-716d-4330-9421-57e8fe2d73d8' class='mouseoverHref'><em>Breviora. Museum of Comparative Zoology</em></a> <strong>147</strong>: 1-12<!--MARK-->","","Article in Journal","937074c2-f7ed-4ee5-b800-8cf87011153c","20150909T23:19:03.052+0000","b5aca245-716d-4330-9421-57e8fe2d73d8"
"Darlington, P.J. Jr","1962","Australian carabid beetles VII. <i>Trichosternus</i>, especially the tropical species","113-130","","Psyche (Cambridge)","","","","<!--MARK--><a href='../../../../publication/502eb9e5-69e0-44c7-be13-75a58c2f8892' class='mouseoverHref'>Darlington, P.J. Jr 1962. Australian carabid beetles VII. <i>Trichosternus</i>, especially the tropical species.</a> <!--MARK--><!--MARK--><a href='../../../../publication/e5075c07-9cfd-4699-a945-bae664d3a3e2' class='mouseoverHref'><em>Psyche (Cambridge)</em></a> 1961 <strong>68</strong>: 113-130<!--MARK-->","","Article in Journal","502eb9e5-69e0-44c7-be13-75a58c2f8892","20081009T05:11:37.000+0000","e5075c07-9cfd-4699-a945-bae664d3a3e2"
"Darlington, P.J. Jr","1962","The carabid beetles of New Guinea Part I. Cicindelinae, Carabinae, Harpalinae through Pterostichini","321-564 pls 4","","Bulletin of the Museum of Comparative Zoology, Harvard","","","","<!--MARK--><a href='../../../../publication/a4efed5f-c627-412e-98b3-7462d5f90d4c' class='mouseoverHref'>Darlington, P.J. Jr 1962. The carabid beetles of New Guinea Part I. Cicindelinae, Carabinae, Harpalinae through Pterostichini.</a> <!--MARK--><!--MARK--><a href='../../../../publication/b2447030-bd13-4a45-9402-157082169a3d' class='mouseoverHref'><em>Bulletin of the Museum of Comparative Zoology, Harvard</em></a> <strong>126</strong>: 321-564 pls 4<!--MARK-->","","Article in Journal","a4efed5f-c627-412e-98b3-7462d5f90d4c","20081009T05:11:37.000+0000","b2447030-bd13-4a45-9402-157082169a3d"
"Dejean, P.F.M.A.","1828","Spécies général des Coléoptères de la Collection de M. le Compte Dejean","vii 556 pp.","","","","","Méquignon-Marvis","<!--MARK--><a href='../../../../publication/ed097151-fd0d-4521-9a92-3099b9fea0dc' class='mouseoverHref'>Dejean, P.F.M.A. 1828. <em>Spécies général des Coléoptères de la Collection de M. le Compte Dejean</em>. Paris : Méquignon-Marvis Vol. III vii 556 pp.</a><!--MARK-->","","Book","ed097151-fd0d-4521-9a92-3099b9fea0dc","20081009T05:11:37.000+0000",""
"Dejean, P.F.M.A.","1829","Species général des Coléoptères de la Collection de M. le Compte Dejean","vii 520 pp.","","","","","Méquignon-Marvis","<!--MARK--><a href='../../../../publication/e4b64df1-a959-464f-906e-99b13e4803ff' class='mouseoverHref'>Dejean, P.F.M.A. 1829. <em>Species général des Coléoptères de la Collection de M. le Compte Dejean</em>. Paris : Méquignon-Marvis Vol. IV vii 520 pp.</a><!--MARK--> [Nov. 1829]","Nov. 1829","Book","e4b64df1-a959-464f-906e-99b13e4803ff","20081009T05:11:37.000+0000",""
"Erichson, W.F.","1842","Beitrag zur Insecten-fauna von Vandiemensland, mit besonderer Berucksichtigung der geographischen Verbreitung der Insecten","83-287, pls 4, 5","","Archiv für Naturgeschichte","","","","<!--MARK--><a href='../../../../publication/2ae5a27f-fd1b-4bb9-b72e-a5997ccf96b3' class='mouseoverHref'>Erichson, W.F. 1842. Beitrag zur Insecten-fauna von Vandiemensland, mit besonderer Berucksichtigung der geographischen Verbreitung der Insecten.</a> <!--MARK--><!--MARK--><a href='../../../../publication/f5b5f7c7-fc53-4502-951d-1c96b680d874' class='mouseoverHref'><em>Archiv für Naturgeschichte</em></a> <strong>8</strong>(1): 83-287, pls 4, 5<!--MARK-->","","Article in Journal","2ae5a27f-fd1b-4bb9-b72e-a5997ccf96b3","20120514T22:59:43.847+0000","f5b5f7c7-fc53-4502-951d-1c96b680d874"
"Garetto, R. & Giachino, P.M.","2003","A new species of <em>Cratoferonia</em> Tschitschérine, 1902 (Coleoptera, Carabidae) from New South Wales.","85-98","Results of the Zoological Missions to Australia of the Regional Museum of Natural Sciences of Turin, Italy. I.","","","","","<!--MARK--><a href='../../../../publication/7bb81fa5-5a17-4c4e-af91-469131232695' class='mouseoverHref'>Garetto, R. & Giachino, P.M. 2003. A new species of <em>Cratoferonia</em> Tschitschérine, 1902 (Coleoptera, Carabidae) from New South Wales. pp. 85-98</a> <!--MARK--><em>in</em> <!--MARK--><a href='../../../../publication/69aaad0f-c2ba-451a-8ed2-bf274c04c49c' class='mouseoverHref'>Daccordi, M. & Giachino, P.M. (eds). <em>Results of the Zoological Missions to Australia of the Regional Museum of Natural Sciences of Turin, Italy. I</em>. Monografie del Museo Regionale di Scienze Naturali, Torino, 35, 565 pp.</a><!--MARK-->","","Chapter in Book","7bb81fa5-5a17-4c4e-af91-469131232695","20170323T01:07:57.819+0000","69aaad0f-c2ba-451a-8ed2-bf274c04c49c"
"Germain, E.F.","1848","Beiträge zur Insektenfauna von Adelaide.","153-247","","Linnaea Entomologica","","","","<!--MARK--><a href='../../../../publication/a30fc011-fd68-429c-846c-c82e2462c71b' class='mouseoverHref'>Germain, E.F. 1848. Beiträge zur Insektenfauna von Adelaide.</a> <!--MARK--><!--MARK--><a href='../../../../publication/1bd3bf76-d7c0-4a57-98cf-a1c6278fdaac' class='mouseoverHref'><em>Linnaea Entomologica</em></a> <strong>3</strong>: 153-247<!--MARK-->","","Article in Journal","a30fc011-fd68-429c-846c-c82e2462c71b","20190123T02:22:23.790+0000","1bd3bf76-d7c0-4a57-98cf-a1c6278fdaac"
"Giachino, P.M.","2003","Some data on the genus <i>Delinius</i> Westwood, 1864 (Coleoptera, Carabidae) with the description of a new species from the Northern Territory","73-84","Results of the Zoological Missions to Australia of the Regional Museum of Natural Sciences of Turin, Italy. I.","","","","","<!--MARK--><a href='../../../../publication/876703e4-f9f1-4e37-bc8e-b0a69b539a0e' class='mouseoverHref'>Giachino, P.M. 2003. Some data on the genus <i>Delinius</i> Westwood, 1864 (Coleoptera, Carabidae) with the description of a new species from the Northern Territory. pp. 73-84</a> <!--MARK--><em>in</em> <!--MARK--><a href='../../../../publication/69aaad0f-c2ba-451a-8ed2-bf274c04c49c' class='mouseoverHref'>Daccordi, M. & Giachino, P.M. (eds). <em>Results of the Zoological Missions to Australia of the Regional Museum of Natural Sciences of Turin, Italy. I</em>. Monografie del Museo Regionale di Scienze Naturali, Torino, 35, 565 pp.</a><!--MARK-->","","Chapter in Book","876703e4-f9f1-4e37-bc8e-b0a69b539a0e","20081009T05:11:37.000+0000","69aaad0f-c2ba-451a-8ed2-bf274c04c49c"
"Giachino, P.M.","2005","Notes on the genus <i>Pseudoceneus</i> Sloane, 1903, with the description of a new species from Tasmania (Coleoptera, Carabidae)","295-316","Results of the Zoological Missions to Australia of the Regional Museum of Natural Sciences of Turin, Italy. II.","","","","","<!--MARK--><a href='../../../../publication/02e92841-f2d4-45a2-8a17-a0af10751f56' class='mouseoverHref'>Giachino, P.M. 2005. Notes on the genus <i>Pseudoceneus</i> Sloane, 1903, with the description of a new species from Tasmania (Coleoptera, Carabidae). pp. 295-316</a> <!--MARK--><em>in</em> <!--MARK--><a href='../../../../publication/c63672bf-42fe-4e56-a695-fa8642e0230f' class='mouseoverHref'>Daccordi, M. & Giachino, P.M. (eds). <em>Results of the Zoological Missions to Australia of the Regional Museum of Natural Sciences of Turin, Italy. II</em>. Monografie del Museo Regionale di Scienze Naturali, Torino, 42, 644 pp.</a><!--MARK-->","","Chapter in Book","02e92841-f2d4-45a2-8a17-a0af10751f56","20081009T05:11:37.000+0000","c63672bf-42fe-4e56-a695-fa8642e0230f"
"Giachino, P.M.","2005","Revision of the genus <i>Rhabdotus</i> Chaudoir, 1865 and description of the larva of <i>R. reflexus</i> (Chaudoir, 1865) (Coleoptera, Carabidae)","279-294","Results of the Zoological Missions to Australia of the Regional Museum of Natural Sciences of Turin, Italy. II.","","","","","<!--MARK--><a href='../../../../publication/c4e5b0c2-2cda-44bf-beca-b2311d212b02' class='mouseoverHref'>Giachino, P.M. 2005. Revision of the genus <i>Rhabdotus</i> Chaudoir, 1865 and description of the larva of <i>R. reflexus</i> (Chaudoir, 1865) (Coleoptera, Carabidae). pp. 279-294</a> <!--MARK--><em>in</em> <!--MARK--><a href='../../../../publication/c63672bf-42fe-4e56-a695-fa8642e0230f' class='mouseoverHref'>Daccordi, M. & Giachino, P.M. (eds). <em>Results of the Zoological Missions to Australia of the Regional Museum of Natural Sciences of Turin, Italy. II</em>. Monografie del Museo Regionale di Scienze Naturali, Torino, 42, 644 pp.</a><!--MARK-->","","Chapter in Book","c4e5b0c2-2cda-44bf-beca-b2311d212b02","20081009T05:11:37.000+0000","c63672bf-42fe-4e56-a695-fa8642e0230f"
"Giachino, P.M. & Picciau, L.","2005","A new <i>Delinius</i> species from the Northern Territory, Australia (Coleoptera, Carabidae)","269-278","Results of the Zoological Missions to Australia of the Regional Museum of Natural Sciences of Turin, Italy. II.","","","","","<!--MARK--><a href='../../../../publication/bfdd32a2-0328-405f-bb27-ba74556fb9fd' class='mouseoverHref'>Giachino, P.M. & Picciau, L. 2005. A new <i>Delinius</i> species from the Northern Territory, Australia (Coleoptera, Carabidae). pp. 269-278</a> <!--MARK--><em>in</em> <!--MARK--><a href='../../../../publication/c63672bf-42fe-4e56-a695-fa8642e0230f' class='mouseoverHref'>Daccordi, M. & Giachino, P.M. (eds). <em>Results of the Zoological Missions to Australia of the Regional Museum of Natural Sciences of Turin, Italy. II</em>. Monografie del Museo Regionale di Scienze Naturali, Torino, 42, 644 pp.</a><!--MARK-->","","Chapter in Book","bfdd32a2-0328-405f-bb27-ba74556fb9fd","20081009T05:11:37.000+0000","c63672bf-42fe-4e56-a695-fa8642e0230f"
"Gory, H.L.","1833","Centurie de Carabiques nouveaux","168-247","","Annales de la Société Entomologique de France","","","","<!--MARK--><a href='../../../../publication/2a061268-369c-420f-94bd-b5d4ae62b895' class='mouseoverHref'>Gory, H.L. 1833. Centurie de Carabiques nouveaux.</a> <!--MARK--><!--MARK--><a href='../../../../publication/6462279b-2aaf-46a3-a434-cab7d8a2c33d' class='mouseoverHref'><em>Annales de la Société Entomologique de France</em></a> <strong>2</strong>: 168-247<!--MARK-->","","Article in Journal","2a061268-369c-420f-94bd-b5d4ae62b895","20081009T05:11:37.000+0000","6462279b-2aaf-46a3-a434-cab7d8a2c33d"
"Guérin-Méneville, F.É.","1830","Planches 1-21","","Voyage autour du monde, exécuté par ordre du Roi, sur la corvette de S. M. La Coquille, pendant les années 1822-25","","","","","<!--MARK--><a href='../../../../publication/60277f42-a413-4ca3-a5ab-84f9cc8aabec' class='mouseoverHref'>Guérin-Méneville, F.É. 1830. Planches 1-21.</a> <!--MARK--><em>In,</em> <!--MARK--><a href='../../../../publication/0614e5d6-a587-4957-bdd7-25cb72a0fb4d' class='mouseoverHref'>Duperrey, L.I. (ed.). <em>Voyage autour du monde, exécuté par ordre du Roi, sur la corvette de S. M. La Coquille, pendant les années 1822-25</em>. Paris : Arthus Bertrand, Libraire 1828 pp.</a><!--MARK-->","","Chapter in Book","60277f42-a413-4ca3-a5ab-84f9cc8aabec","20081009T05:11:37.000+0000","0614e5d6-a587-4957-bdd7-25cb72a0fb4d"
"Hope, F.W.","1841","Descriptions of various coleopterous insects from New Holland","42-47","","Proceedings of the Entomological Society of London","","","","<!--MARK--><a href='../../../../publication/fbc777e9-d362-4447-b46c-cd3d5e1e1705' class='mouseoverHref'>Hope, F.W. 1841. Descriptions of various coleopterous insects from New Holland.</a> <!--MARK--><!--MARK--><a href='../../../../publication/8018f016-c83e-4d81-b1a7-9f2edc8b846c' class='mouseoverHref'><em>Proceedings of the Entomological Society of London</em></a> <strong>4</strong>: 42-47<!--MARK-->","","Article in Journal","fbc777e9-d362-4447-b46c-cd3d5e1e1705","20081009T05:11:37.000+0000","8018f016-c83e-4d81-b1a7-9f2edc8b846c"
"Hope, F.W.","1841","Observations on the Coleoptera of Port Essington, in Australia with descriptions of the following new species","43-50","","Journal and Proceedings of the Entomological Society of London","","","","<!--MARK--><a href='../../../../publication/c950d2b0-4c4c-4194-9815-7be1c781b0e9' class='mouseoverHref'>Hope, F.W. 1841. Observations on the Coleoptera of Port Essington, in Australia with descriptions of the following new species.</a> <!--MARK--><!--MARK--><a href='../../../../publication/6f9e51f4-179a-4995-a083-703b80c9d0f7' class='mouseoverHref'><em>Journal and Proceedings of the Entomological Society of London</em></a> <strong>1841-1846</strong>: 43-50<!--MARK--> [pp.43-48 (1841), pp. 49-50 (1842)]","pp.43-48 (1841), pp. 49-50 (1842)","Article in Journal","c950d2b0-4c4c-4194-9815-7be1c781b0e9","20140119T22:55:09.640+0000","6f9e51f4-179a-4995-a083-703b80c9d0f7"
"Hope, F.W.","1842","Observations on the Coleoptera of Port Essington, in Australia","423-430","","Annals and Magazine of Natural History","","1 Jul. 1842","","<!--MARK--><a href='../../../../publication/57111391-589c-4234-9e94-e5291bb1b508' class='mouseoverHref'>Hope, F.W. 1842. Observations on the Coleoptera of Port Essington, in Australia.</a> <!--MARK--><!--MARK--><a href='../../../../publication/efa8de69-3a29-4a43-8ef2-cbefda205976' class='mouseoverHref'><em>Annals and Magazine of Natural History</em></a> 1 <strong>9</strong>: 423-430<!--MARK--> [Date published 1 Jul. 1842]","","Article in Journal","57111391-589c-4234-9e94-e5291bb1b508","20110420T01:57:36.925+0000","efa8de69-3a29-4a43-8ef2-cbefda205976"
"Hope, F.W.","1845","Descriptions of some new species of Coleoptera from Adelaide in New Holland","100-113, pls VI-VII","","Transactions of the Entomological Society of London","","","","<!--MARK--><a href='../../../../publication/8923a964-716e-47e5-84fa-8d58965bd2e9' class='mouseoverHref'>Hope, F.W. 1845. Descriptions of some new species of Coleoptera from Adelaide in New Holland.</a> <!--MARK--><!--MARK--><a href='../../../../publication/5cf355b3-abc5-451e-9abc-ed3282d7811a' class='mouseoverHref'><em>Transactions of the Entomological Society of London</em></a> <strong>4</strong>: 100-113, pls VI-VII<!--MARK-->","","Article in Journal","8923a964-716e-47e5-84fa-8d58965bd2e9","20081009T05:11:37.000+0000","5cf355b3-abc5-451e-9abc-ed3282d7811a"
"Horne, P.A.","1990","Parental care in <i>Notonomus</i> Chaudoir (Coleoptera: Carabidae: Pterostichinae)","65-69","","Australian Entomological Magazine","","28/Jun/1990","","<!--MARK--><a href='../../../../publication/40a6e950-f476-4a13-9c1f-71d67f85eb13' class='mouseoverHref'>Horne, P.A. 1990. Parental care in <i>Notonomus</i> Chaudoir (Coleoptera: Carabidae: Pterostichinae).</a> <!--MARK--><!--MARK--><a href='../../../../publication/33d99a92-3718-4094-b6bd-af8f9b31885d' class='mouseoverHref'><em>Australian Entomological Magazine</em></a> <strong>17</strong>(2): 65-69<!--MARK--> [Date published 28/Jun/1990]","","Article in Journal","40a6e950-f476-4a13-9c1f-71d67f85eb13","20081009T05:11:37.000+0000","33d99a92-3718-4094-b6bd-af8f9b31885d"
"Laporte, F.L. [de Castelnau]","1867","Notes on Australian Coleoptera","139 pp.","","","","","Royal Society of Victoria","<!--MARK--><a href='../../../../publication/24775344-c4a6-4169-a50c-6b5559f88a2a' class='mouseoverHref'>Laporte, F.L. [de Castelnau] 1867. <em>Notes on Australian Coleoptera</em>. Melbourne : Royal Society of Victoria 139 pp.</a><!--MARK--> [separates available prior to republication in <I>Trans. R. Soc. Vict. </I><B>8</B>: 30-38 (1867), 95-225 (1868)]","separates available prior to republication in <I>Trans. R. Soc. Vict. </I><B>8</B>: 30-38 (1867), 95-225 (1868)","Book","24775344-c4a6-4169-a50c-6b5559f88a2a","20201207T05:24:03.432+0000",""
"Lutshnik, V.","1915","Sur quelques Platysmatini de la faune Australienne (Coleoptera, Carabidae)","418-421","","Revue Russe d'Entomologie","","","","<!--MARK--><a href='../../../../publication/58e44a74-4587-4669-bd39-7f60a19af2f8' class='mouseoverHref'>Lutshnik, V. 1915. Sur quelques Platysmatini de la faune Australienne (Coleoptera, Carabidae).</a> <!--MARK--><!--MARK--><a href='../../../../publication/ae560f66-598c-4d76-93c4-8b4f7ffba25b' class='mouseoverHref'><em>Revue Russe d'Entomologie</em></a> <strong>14</strong>: 418-421<!--MARK-->","","Article in Journal","58e44a74-4587-4669-bd39-7f60a19af2f8","20081009T05:11:37.000+0000","ae560f66-598c-4d76-93c4-8b4f7ffba25b"
"Lutshnik, V.","1922","On the Platysmatina","67-79","","Acta Instituti agronomici stauropolitani","","","","<!--MARK--><a href='../../../../publication/227c673e-a852-47ec-8863-ddedced899b6' class='mouseoverHref'>Lutshnik, V. 1922. On the Platysmatina.</a> <!--MARK--><!--MARK--><a href='../../../../publication/fa7b62de-82d0-49d7-9d28-6c7edd38454a' class='mouseoverHref'><em>Acta Instituti agronomici stauropolitani</em></a> <strong>1</strong>: 67-79<!--MARK-->","","Article in Journal","227c673e-a852-47ec-8863-ddedced899b6","20081009T05:11:37.000+0000","fa7b62de-82d0-49d7-9d28-6c7edd38454a"
"Macleay, W.J.","1871","Notes on a collection of insects from Gayndah","79-205","","Transactions of the Entomological Society of New South Wales","","","","<!--MARK--><a href='../../../../publication/9e91362c-6ac4-452a-8ef5-9d82e451f0de' class='mouseoverHref'>Macleay, W.J. 1871. Notes on a collection of insects from Gayndah.</a> <!--MARK--><!--MARK--><a href='../../../../publication/69b821b6-f09d-44b0-ae3f-0e6c294b532e' class='mouseoverHref'><em>Transactions of the Entomological Society of New South Wales</em></a> <strong>2</strong>: 79-205<!--MARK-->","","Article in Journal","9e91362c-6ac4-452a-8ef5-9d82e451f0de","20081009T05:11:37.000+0000","69b821b6-f09d-44b0-ae3f-0e6c294b532e"
"Macleay, W.J.","1873","Miscellanea entomologica","319-370","","Transactions of the Entomological Society of New South Wales","","","","<!--MARK--><a href='../../../../publication/f5126e53-9323-4b2c-9985-55e574efeb10' class='mouseoverHref'>Macleay, W.J. 1873. Miscellanea entomologica.</a> <!--MARK--><!--MARK--><a href='../../../../publication/69b821b6-f09d-44b0-ae3f-0e6c294b532e' class='mouseoverHref'><em>Transactions of the Entomological Society of New South Wales</em></a> <strong>2</strong>: 319-370<!--MARK-->","","Article in Journal","f5126e53-9323-4b2c-9985-55e574efeb10","20081009T05:11:37.000+0000","69b821b6-f09d-44b0-ae3f-0e6c294b532e"
"Macleay, W.J.","1878","On some new Carabidae from Port Darwin","213-217","","Proceedings of the Linnean Society of New South Wales","","","","<!--MARK--><a href='../../../../publication/22073e2e-5560-448b-92e3-05a6548f3a6c' class='mouseoverHref'>Macleay, W.J. 1878. On some new Carabidae from Port Darwin.</a> <!--MARK--><!--MARK--><a href='../../../../publication/c12cd779-adb5-41ea-bd2c-75f6864cf22e' class='mouseoverHref'><em>Proceedings of the Linnean Society of New South Wales</em></a> <strong>2</strong>: 213-217<!--MARK-->","","Article in Journal","22073e2e-5560-448b-92e3-05a6548f3a6c","20081009T05:11:37.000+0000","c12cd779-adb5-41ea-bd2c-75f6864cf22e"
"Macleay, W.J.","1883","Notices of some undescribed species of Coleoptera in the Brisbane Museum","409-416","","Proceedings of the Linnean Society of New South Wales","","","","<!--MARK--><a href='../../../../publication/eaa17a40-c212-4183-821e-de87e7ae561a' class='mouseoverHref'>Macleay, W.J. 1883. Notices of some undescribed species of Coleoptera in the Brisbane Museum.</a> <!--MARK--><!--MARK--><a href='../../../../publication/c12cd779-adb5-41ea-bd2c-75f6864cf22e' class='mouseoverHref'><em>Proceedings of the Linnean Society of New South Wales</em></a> <strong>8</strong>: 409-416<!--MARK-->","","Article in Journal","eaa17a40-c212-4183-821e-de87e7ae561a","20130408T23:42:26.965+0000","c12cd779-adb5-41ea-bd2c-75f6864cf22e"
"Macleay, W.J.","1887","The insects of the Cairns district, northern Queensland. Part II","213-238","","Proceedings of the Linnean Society of New South Wales","","August 31, 1887","","<!--MARK--><a href='../../../../publication/56ca28cb-f634-4a47-abed-b9ff4c972cda' class='mouseoverHref'>Macleay, W.J. 1887. The insects of the Cairns district, northern Queensland. Part II.</a> <!--MARK--><!--MARK--><a href='../../../../publication/c12cd779-adb5-41ea-bd2c-75f6864cf22e' class='mouseoverHref'><em>Proceedings of the Linnean Society of New South Wales</em></a> 2 <strong>2</strong>(2): 213-238<!--MARK--> [Date published August 31, 1887: Second Series commenced 1886-87]","Second Series commenced 1886-87","Article in Journal","56ca28cb-f634-4a47-abed-b9ff4c972cda","20210624T08:51:11.973+0000","c12cd779-adb5-41ea-bd2c-75f6864cf22e"
"Macleay, W.J.","1888","The insects of King's Sound and its vicinity","443-480","","Proceedings of the Linnean Society of New South Wales","","","","<!--MARK--><a href='../../../../publication/df6698ef-207f-422c-9694-7c4693c4f229' class='mouseoverHref'>Macleay, W.J. 1888. The insects of King's Sound and its vicinity.</a> <!--MARK--><!--MARK--><a href='../../../../publication/c12cd779-adb5-41ea-bd2c-75f6864cf22e' class='mouseoverHref'><em>Proceedings of the Linnean Society of New South Wales</em></a> 2 <strong>3</strong>: 443-480<!--MARK-->","","Article in Journal","df6698ef-207f-422c-9694-7c4693c4f229","20081009T05:11:37.000+0000","c12cd779-adb5-41ea-bd2c-75f6864cf22e"
"Macleay, W.S.","1825","Annulosa Javanica<i>, or an attempt to illustrate the natural affinities and analogies of the insects collected in Java by Thomas Horsfield, M.D. F.L. & G.S. and deposited by him in the Museum of the Honourable East-India Company</i>","52 pp. 1 pl.","","","","","Kingsbury, Parbury & Allen","<!--MARK--><a href='../../../../publication/4e7c0447-d687-4bad-969a-9a2037cfdb29' class='mouseoverHref'>Macleay, W.S. 1825. <em>Annulosa Javanica<i>, or an attempt to illustrate the natural affinities and analogies of the insects collected in Java by Thomas Horsfield, M.D. F.L. & G.S. and deposited by him in the Museum of the Honourable East-India Company</i></em>. London : Kingsbury, Parbury & Allen 52 pp. 1 pl.</a><!--MARK-->","","Book","4e7c0447-d687-4bad-969a-9a2037cfdb29","20081009T05:11:37.000+0000",""
"Macleay, W.S.","1826","Annulosa, Catalogue of Insects, collected by Captain King, R.N. pp. 438-469 <i>in</i> King, P.P. <i>Narrative of a Survey of the Intertropical and Western Coasts of Australia performed between the years</i> 1818 <i>and</i> 1822. Vol. 2 App. B","","","","","","","<!--MARK--><a href='../../../../publication/7eb7856d-441d-414f-9a35-ef7e4e26c89b' class='mouseoverHref'>Macleay, W.S. 1826. Annulosa, Catalogue of Insects, collected by Captain King, R.N. pp. 438-469 <i>in</i> King, P.P. <i>Narrative of a Survey of the Intertropical and Western Coasts of Australia performed between the years</i> 1818 <i>and</i> 1822. Vol. 2 App. B.</a>","","Miscellaneous","7eb7856d-441d-414f-9a35-ef7e4e26c89b","20081009T05:11:37.000+0000",""
"Montrouzier, P.","1860","Essai sur la faune entomologique de la Nouvelle-Calédonie (Balade) et des îles des Pins, Art, Lifui etc","233-308","","Annales de la Société Entomologique de France","","","","<!--MARK--><a href='../../../../publication/48b5d2b2-2c00-4640-abb6-843779cc8472' class='mouseoverHref'>Montrouzier, P. 1860. Essai sur la faune entomologique de la Nouvelle-Calédonie (Balade) et des îles des Pins, Art, Lifui etc.</a> <!--MARK--><!--MARK--><a href='../../../../publication/6462279b-2aaf-46a3-a434-cab7d8a2c33d' class='mouseoverHref'><em>Annales de la Société Entomologique de France</em></a> 3 <strong>8</strong>: 233-308<!--MARK-->","","Article in Journal","48b5d2b2-2c00-4640-abb6-843779cc8472","20081009T05:11:37.000+0000","6462279b-2aaf-46a3-a434-cab7d8a2c33d"
"Moore, B.P.","1960","Studies on Australian Carabidae (Coleoptera) 1. New species of the tribes Agonicini, Trechini and Pterostichini","165-169","","Proceedings of the Royal Entomological Society of London","","","","<!--MARK--><a href='../../../../publication/58525761-1300-42e9-91dc-9de6836e5646' class='mouseoverHref'>Moore, B.P. 1960. Studies on Australian Carabidae (Coleoptera) 1. New species of the tribes Agonicini, Trechini and Pterostichini.</a> <!--MARK--><!--MARK--><a href='../../../../publication/6ca99b2d-b4f7-49d4-8f5c-8db6ec2f5294' class='mouseoverHref'><em>Proceedings of the Royal Entomological Society of London</em></a> B <strong>29</strong>: 165-169<!--MARK-->","","Article in Journal","58525761-1300-42e9-91dc-9de6836e5646","20081009T05:11:37.000+0000","6ca99b2d-b4f7-49d4-8f5c-8db6ec2f5294"
