"PUB_AUTHOR","PUB_YEAR","PUB_TITLE","PUB_PAGES","PUB_PARENT_BOOK_TITLE","PUB_PARENT_JOURNAL_TITLE","PUB_PARENT_ARTICLE_TITLE","PUB_PUBLICATION_DATE","PUB_PUBLISHER","PUB_FORMATTED","PUB_QUALIFICATION","PUB_TYPE","PUBLICATION_GUID","PUBLICATION_LAST_UPDATE","PARENT_PUBLICATION_GUID"
"Moore, B.P.","1961","Notes on Australian Carabidae (Col.). II <i>Notonomus atridermis</i> Sloane","134-136","","Entomologist's Monthly Magazine","","","","<!--MARK--><a href='../../../../publication/8047a900-7a2f-4b44-84e3-fe254e89c915' class='mouseoverHref'>Moore, B.P. 1961. Notes on Australian Carabidae (Col.). II <i>Notonomus atridermis</i> Sloane.</a> <!--MARK--><!--MARK--><a href='../../../../publication/cbd5c497-64d0-4fae-97ee-22719c3ca286' class='mouseoverHref'><em>Entomologist's Monthly Magazine</em></a> <strong>96</strong>: 134-136<!--MARK-->","","Article in Journal","8047a900-7a2f-4b44-84e3-fe254e89c915","20110124T04:04:53.010+0000","cbd5c497-64d0-4fae-97ee-22719c3ca286"
"Moore, B.P.","1962","Notes on Australian Carabidae (Col.). IV: A new genus of the Pterostichinae from the Victorian Alps","234-236","","Entomologist's Monthly Magazine","","","","<!--MARK--><a href='../../../../publication/188008c3-408c-4b4e-8ec7-79963a6b7fa6' class='mouseoverHref'>Moore, B.P. 1962. Notes on Australian Carabidae (Col.). IV: A new genus of the Pterostichinae from the Victorian Alps.</a> <!--MARK--><!--MARK--><a href='../../../../publication/cbd5c497-64d0-4fae-97ee-22719c3ca286' class='mouseoverHref'><em>Entomologist's Monthly Magazine</em></a> <strong>97</strong>: 234-236<!--MARK-->","","Article in Journal","188008c3-408c-4b4e-8ec7-79963a6b7fa6","20081009T05:11:37.000+0000","cbd5c497-64d0-4fae-97ee-22719c3ca286"
"Moore, B.P.","1963","New or little known Australian Carabidae in the Frey Museum (Col.)","435-444","","Entomologischen Arbeiten aus dem Museum Georg Frey","","","","<!--MARK--><a href='../../../../publication/8d6adcd3-0096-462d-9770-dafdc4580b40' class='mouseoverHref'>Moore, B.P. 1963. New or little known Australian Carabidae in the Frey Museum (Col.).</a> <!--MARK--><!--MARK--><a href='../../../../publication/d9967b1d-fa66-4d5e-9c04-910b53ebb9b3' class='mouseoverHref'><em>Entomologischen Arbeiten aus dem Museum Georg Frey</em></a> <strong>14</strong>: 435-444<!--MARK-->","","Article in Journal","8d6adcd3-0096-462d-9770-dafdc4580b40","20121105T00:42:44.234+0000","d9967b1d-fa66-4d5e-9c04-910b53ebb9b3"
"Moore, B.P.","1965","Studies on Australian Carabidae (Coleoptera). 4. The Pterostichinae","1-32","","Transactions of the Royal Entomological Society of London","","","","<!--MARK--><a href='../../../../publication/bbc933ba-9679-4a0c-bac9-d0f57b33789f' class='mouseoverHref'>Moore, B.P. 1965. Studies on Australian Carabidae (Coleoptera). 4. The Pterostichinae.</a> <!--MARK--><!--MARK--><a href='../../../../publication/aa458993-1b17-4c34-bd31-d6f8224d9b7d' class='mouseoverHref'><em>Transactions of the Royal Entomological Society of London</em></a> <strong>117</strong>: 1-32<!--MARK-->","","Article in Journal","bbc933ba-9679-4a0c-bac9-d0f57b33789f","20081009T05:11:37.000+0000","aa458993-1b17-4c34-bd31-d6f8224d9b7d"
"Moore, B.P.","1976","A new genus and species of Pterostichini (Coleoptera: Carabidae) from Cape York Peninsula","425-427","","Journal of the Australian Entomological Society","","","","<!--MARK--><a href='../../../../publication/96573e29-f7de-4403-90bf-6fc322f034ff' class='mouseoverHref'>Moore, B.P. 1976. A new genus and species of Pterostichini (Coleoptera: Carabidae) from Cape York Peninsula.</a> <!--MARK--><!--MARK--><a href='../../../../publication/c2544f9f-3978-4f18-846d-a1fd3122c9c4' class='mouseoverHref'><em>Journal of the Australian Entomological Society</em></a> <strong>14</strong>(1975): 425-427<!--MARK-->","","Article in Journal","96573e29-f7de-4403-90bf-6fc322f034ff","20081009T05:11:37.000+0000","c2544f9f-3978-4f18-846d-a1fd3122c9c4"
"Moore, B.P.","1979","Chemical defense in Carabids and its bearing on phylogeny","193-203","Carabid beetles: Their evolution, natural history, and classification","","","","","<!--MARK--><a href='../../../../publication/6488b883-bbc8-41c5-95bf-93354766b44e' class='mouseoverHref'>Moore, B.P. 1979. Chemical defense in Carabids and its bearing on phylogeny. pp. 193-203</a> <!--MARK--><em>in</em> <!--MARK--><a href='../../../../publication/e364904b-0a23-44c0-9003-f6954883a0aa' class='mouseoverHref'>Erwin, T.L., Ball, G.E., Whitehead, D.R. & Halpern, A.L. (eds). <em>Carabid beetles: Their evolution, natural history, and classification</em>. The Hague : W. Junk vii 635 pp.</a><!--MARK-->","","Chapter in Book","6488b883-bbc8-41c5-95bf-93354766b44e","20081009T05:11:37.000+0000","e364904b-0a23-44c0-9003-f6954883a0aa"
"Moore, B.P.","1985","The Carabidae of Norfolk Island","237-256","Taxonomy, Phylogeny and Zoogeography of Beetles and Ants. A Volume Dedicated to the Memory of Philip Jackson Darlington, Jr 1904-1983 (Series Entomologia 33)","","","","","<!--MARK--><a href='../../../../publication/1a2927ee-2df2-4faf-8460-5544c76003c5' class='mouseoverHref'>Moore, B.P. 1985. The Carabidae of Norfolk Island. pp. 237-256</a> <!--MARK--><em>in</em> <!--MARK--><a href='../../../../publication/0c90641d-e6f1-4a42-b6d1-1ee60f7c7344' class='mouseoverHref'>Ball, G.E. (ed.). <em>Taxonomy, Phylogeny and Zoogeography of Beetles and Ants. A Volume Dedicated to the Memory of Philip Jackson Darlington, Jr 1904-1983 (Series Entomologia 33)</em>. Dordrecht : Dr W. Junk.</a><!--MARK-->","","Chapter in Book","1a2927ee-2df2-4faf-8460-5544c76003c5","20081009T05:11:37.000+0000","0c90641d-e6f1-4a42-b6d1-1ee60f7c7344"
"Moore, B.P.","1987","Suborder Adephaga","17-366","Zoological Catalogue of Australia. Coleoptera: Archostemata, Myxophaga and Adephaga","","","","","<!--MARK--><a href='../../../../publication/1f267174-3770-4e86-a2a6-fe1e8fdf52d2' class='mouseoverHref'>Moore, B.P. 1987. Suborder Adephaga. pp. 17-366</a> <!--MARK--><em>in</em> <!--MARK--><a href='../../../../publication/bd74a387-ac31-4a80-8ac1-c19387a1eb98' class='mouseoverHref'>Houston, W.W.K. & Richardson, B.J.R. (eds). <em>Zoological Catalogue of Australia. Coleoptera: Archostemata, Myxophaga and Adephaga</em>. Canberra : Australian Government Publishing Service Vol. 4 viii 444 pp.</a><!--MARK-->","","Chapter in Book","1f267174-3770-4e86-a2a6-fe1e8fdf52d2","20081009T05:11:37.000+0000","bd74a387-ac31-4a80-8ac1-c19387a1eb98"
"Moore, B.P.","1992","The Carabidae of Lord Howe Island (Coleoptera: Carabidae)","159-173","The Biogeography of Ground Beetles of Mountains and Islands","","","","","<!--MARK--><a href='../../../../publication/0e483ed0-186f-498a-a10f-8b1544aa2e4c' class='mouseoverHref'>Moore, B.P. 1992. The Carabidae of Lord Howe Island (Coleoptera: Carabidae). pp. 159-173</a> <!--MARK--><em>in</em> <!--MARK--><a href='../../../../publication/d1c2151d-e0ac-4c4d-9cb3-d1175d948893' class='mouseoverHref'>Noonan, G.R., Ball, G.E. & Stork, N.E. (eds). <em>The Biogeography of Ground Beetles of Mountains and Islands</em>. Andover, Hampshire, UK : Intercept 256 pp.</a><!--MARK-->","","Chapter in Book","0e483ed0-186f-498a-a10f-8b1544aa2e4c","20081009T05:11:37.000+0000","d1c2151d-e0ac-4c4d-9cb3-d1175d948893"
"Moore, B.P., Weir, T.A. & Pyke, J.E.","1987","Rhysodidae and Carabidae","pp. 17-320","Zoological Catalogue of Australia. Coleoptera: Archostemata, Myxophaga and Adephaga","","","","","<!--MARK--><a href='../../../../publication/8edb5d5f-8e0e-45c6-b6c0-16919527a9fd' class='mouseoverHref'>Moore, B.P., Weir, T.A. & Pyke, J.E. 1987. Rhysodidae and Carabidae. pp. 17-320</a> <!--MARK--><em>in</em> <!--MARK--><a href='../../../../publication/bd74a387-ac31-4a80-8ac1-c19387a1eb98' class='mouseoverHref'>Houston, W.W.K. & Richardson, B.J.R. (eds). <em>Zoological Catalogue of Australia. Coleoptera: Archostemata, Myxophaga and Adephaga</em>. Canberra : Australian Government Publishing Service Vol. 4 viii 444 pp.</a><!--MARK-->","","Chapter in Book","8edb5d5f-8e0e-45c6-b6c0-16919527a9fd","20160330T05:34:40.121+0000","bd74a387-ac31-4a80-8ac1-c19387a1eb98"
"Moore, B.P. & Wallbank, B.E.","1968","Chemical composition of the defensive secretion in carabid beetles and its importance as a taxonomic character","62-72","","Proceedings of the Royal Entomological Society of London","","","","<!--MARK--><a href='../../../../publication/e84db0f1-2bda-440b-863b-5aa2a3f63cf1' class='mouseoverHref'>Moore, B.P. & Wallbank, B.E. 1968. Chemical composition of the defensive secretion in carabid beetles and its importance as a taxonomic character.</a> <!--MARK--><!--MARK--><a href='../../../../publication/6ca99b2d-b4f7-49d4-8f5c-8db6ec2f5294' class='mouseoverHref'><em>Proceedings of the Royal Entomological Society of London</em></a> <strong>37</strong>(5-6): 62-72<!--MARK-->","","Article in Journal","e84db0f1-2bda-440b-863b-5aa2a3f63cf1","20081009T05:11:37.000+0000","6ca99b2d-b4f7-49d4-8f5c-8db6ec2f5294"
"Motschulsky, V.","1860","Insectes des Indies orientales, et de contrées analogues","25-118 (1859)","","Études Entomologiques","","","","<!--MARK--><a href='../../../../publication/51a85d7f-ad83-4def-ad70-dbe7060ff03e' class='mouseoverHref'>Motschulsky, V. 1860. Insectes des Indies orientales, et de contrées analogues.</a> <!--MARK--><!--MARK--><a href='../../../../publication/6679f524-66cb-4865-97fa-a2e68e8161ba' class='mouseoverHref'><em>Études Entomologiques</em></a> <strong>8</strong>: 25-118 (1859)<!--MARK-->","","Article in Journal","51a85d7f-ad83-4def-ad70-dbe7060ff03e","20081009T05:11:37.000+0000","6679f524-66cb-4865-97fa-a2e68e8161ba"
"Motschulsky, V.","1865","Énumération des nouvelles espèces de Coléoptères rapportés de ses voyages. 4-ème article (Suite)","227-313","","Bulletin de la Société Impériale des Naturalistes de Moscou","","","","<!--MARK--><a href='../../../../publication/121d58cd-6d31-4917-953e-867f46d218df' class='mouseoverHref'>Motschulsky, V. 1865. Énumération des nouvelles espèces de Coléoptères rapportés de ses voyages. 4-ème article (Suite).</a> <!--MARK--><!--MARK--><a href='../../../../publication/a7cbc93a-fdd0-40a5-9cc8-35de71b7d18a' class='mouseoverHref'><em>Bulletin de la Société Impériale des Naturalistes de Moscou</em></a> <strong>38</strong>: 227-313<!--MARK-->","","Article in Journal","121d58cd-6d31-4917-953e-867f46d218df","20081009T05:11:37.000+0000","a7cbc93a-fdd0-40a5-9cc8-35de71b7d18a"
"Newman, E.","1842","List of insects collected at Port Phillip, New South Wales, by Edmund Thomas Higgins, Esq. (continued)","401-405","","The Entomologist","","Oct. 1842","","<!--MARK--><a href='../../../../publication/a3400700-fa6b-4bb1-9631-19dabc7930fc' class='mouseoverHref'>Newman, E. 1842. List of insects collected at Port Phillip, New South Wales, by Edmund Thomas Higgins, Esq. (continued).</a> <!--MARK--><!--MARK--><a href='../../../../publication/f3b5bc68-9fcf-42d6-b01d-f490d96af7e9' class='mouseoverHref'><em>The Entomologist</em></a> <strong>1</strong>(24): 401-405<!--MARK--> [Date published Oct. 1842]","","Article in Journal","a3400700-fa6b-4bb1-9631-19dabc7930fc","20160922T06:52:52.527+0000","f3b5bc68-9fcf-42d6-b01d-f490d96af7e9"
"Rainbow, W.J.","1899","Descriptions of two beetles from Mount Kosciusko","147-149","","Records of the Australian Museum","","","","<!--MARK--><a href='../../../../publication/46309072-2cef-4c00-8dc1-013f970732c8' class='mouseoverHref'>Rainbow, W.J. 1899. Descriptions of two beetles from Mount Kosciusko.</a> <!--MARK--><!--MARK--><a href='../../../../publication/7c07530b-0b38-44f5-8f95-368da97d6ac2' class='mouseoverHref'><em>Records of the Australian Museum</em></a> <strong>3</strong>: 147-149<!--MARK-->","","Article in Journal","46309072-2cef-4c00-8dc1-013f970732c8","20081009T05:11:37.000+0000","7c07530b-0b38-44f5-8f95-368da97d6ac2"
"Schaufuss, L.W.","1867","Entomologische notizen. (Über einige Rüsselkäfer aus Spanien)","62-67","","Coleopterologische Hefte","","","","<!--MARK--><a href='../../../../publication/b01933d7-f895-40ed-bb5b-0cc63d52da6b' class='mouseoverHref'>Schaufuss, L.W. 1867. Entomologische notizen. (Über einige Rüsselkäfer aus Spanien).</a> <!--MARK--><!--MARK--><a href='../../../../publication/4fb89356-2059-40de-b6cc-f72f3fc806d7' class='mouseoverHref'><em>Coleopterologische Hefte</em></a> <strong>1</strong>: 62-67<!--MARK-->","","Article in Journal","b01933d7-f895-40ed-bb5b-0cc63d52da6b","20081009T05:11:37.000+0000","4fb89356-2059-40de-b6cc-f72f3fc806d7"
"Sloane, T.G.","1889","Studies in Australian Entomology. No. I Review of the genus <i>Sarticus</i> (Carabidae)","501-512","","Proceedings of the Linnean Society of New South Wales","","","","<!--MARK--><a href='../../../../publication/4e137ab4-7b8d-4269-8232-278ef38ee4df' class='mouseoverHref'>Sloane, T.G. 1889. Studies in Australian Entomology. No. I Review of the genus <i>Sarticus</i> (Carabidae).</a> <!--MARK--><!--MARK--><a href='../../../../publication/c12cd779-adb5-41ea-bd2c-75f6864cf22e' class='mouseoverHref'><em>Proceedings of the Linnean Society of New South Wales</em></a> 2 <strong>3</strong>: 501-512<!--MARK-->","","Article in Journal","4e137ab4-7b8d-4269-8232-278ef38ee4df","20081009T05:11:37.000+0000","c12cd779-adb5-41ea-bd2c-75f6864cf22e"
"Sloane, T.G.","1890","Studies in Australian Entomology. No. II Six new species of Carabidae","1288-1296","","Proceedings of the Linnean Society of New South Wales","","","","<!--MARK--><a href='../../../../publication/4c416806-212b-44f9-954f-2fef85b8e240' class='mouseoverHref'>Sloane, T.G. 1890. Studies in Australian Entomology. No. II Six new species of Carabidae.</a> <!--MARK--><!--MARK--><a href='../../../../publication/c12cd779-adb5-41ea-bd2c-75f6864cf22e' class='mouseoverHref'><em>Proceedings of the Linnean Society of New South Wales</em></a> 2 <strong>4</strong>: 1288-1296<!--MARK-->","","Article in Journal","4c416806-212b-44f9-954f-2fef85b8e240","20081009T05:11:37.000+0000","c12cd779-adb5-41ea-bd2c-75f6864cf22e"
"Sloane, T.G.","1890","Studies in Australian Entomology. No. IV New genera and species of Carabidae","641-653","","Proceedings of the Linnean Society of New South Wales","","","","<!--MARK--><a href='../../../../publication/b58a1783-eb91-4282-92ff-8b7da1868b26' class='mouseoverHref'>Sloane, T.G. 1890. Studies in Australian Entomology. No. IV New genera and species of Carabidae.</a> <!--MARK--><!--MARK--><a href='../../../../publication/c12cd779-adb5-41ea-bd2c-75f6864cf22e' class='mouseoverHref'><em>Proceedings of the Linnean Society of New South Wales</em></a> 2 <strong>5</strong>: 641-653<!--MARK-->","","Article in Journal","b58a1783-eb91-4282-92ff-8b7da1868b26","20081009T05:11:37.000+0000","c12cd779-adb5-41ea-bd2c-75f6864cf22e"
"Sloane, T.G.","1895","Notes on Carabidae from Lake Callabonna, Central Australia","124-137","","Transactions of the Royal Society of South Australia","","","","<!--MARK--><a href='../../../../publication/d0590373-1497-4b06-b942-eccfeb42c5ef' class='mouseoverHref'>Sloane, T.G. 1895. Notes on Carabidae from Lake Callabonna, Central Australia.</a> <!--MARK--><!--MARK--><a href='../../../../publication/8b48b0a3-dd7a-4aea-be0d-10a223710ebc' class='mouseoverHref'><em>Transactions of the Royal Society of South Australia</em></a> <strong>19</strong>: 124-137<!--MARK-->","","Article in Journal","d0590373-1497-4b06-b942-eccfeb42c5ef","20081009T05:11:37.000+0000","8b48b0a3-dd7a-4aea-be0d-10a223710ebc"
"Sloane, T.G.","1895","Studies in Australian Entomology. No. VII New genera and species of Carabidae (including some notes on previously described species, and synoptic lists of genera and species)","393-455","","Proceedings of the Linnean Society of New South Wales","","","","<!--MARK--><a href='../../../../publication/1268401f-7018-4856-9fe3-0a0b6085c99c' class='mouseoverHref'>Sloane, T.G. 1895. Studies in Australian Entomology. No. VII New genera and species of Carabidae (including some notes on previously described species, and synoptic lists of genera and species).</a> <!--MARK--><!--MARK--><a href='../../../../publication/c12cd779-adb5-41ea-bd2c-75f6864cf22e' class='mouseoverHref'><em>Proceedings of the Linnean Society of New South Wales</em></a> 2 <strong>9</strong>: 393-455<!--MARK-->","","Article in Journal","1268401f-7018-4856-9fe3-0a0b6085c99c","20081009T05:11:37.000+0000","c12cd779-adb5-41ea-bd2c-75f6864cf22e"
"Sloane, T.G.","1896","Carabidae. pp. 380-384 <i>in</i> B. Spencer (ed.) <i>Report of the Work of the Horn Scientific Expedition to Central Australia.</i> Pt II, Zoology Melbourne : Melville, Mullin & Slade","","","","","","","<!--MARK--><a href='../../../../publication/b7d45c7f-eaa1-41f4-833b-6c6a1552b23a' class='mouseoverHref'>Sloane, T.G. 1896. Carabidae. pp. 380-384 <i>in</i> B. Spencer (ed.) <i>Report of the Work of the Horn Scientific Expedition to Central Australia.</i> Pt II, Zoology Melbourne : Melville, Mullin & Slade.</a>","","Miscellaneous","b7d45c7f-eaa1-41f4-833b-6c6a1552b23a","20081009T05:11:37.000+0000",""
"Sloane, T.G.","1898","On Carabidae from West Australia, sent by Mr. A.M. Lea (with descriptions of new genera and species, synoptic tables etc.)","444-520","","Proceedings of the Linnean Society of New South Wales","","","","<!--MARK--><a href='../../../../publication/703f4731-a143-4da9-a327-483a0f47f698' class='mouseoverHref'>Sloane, T.G. 1898. On Carabidae from West Australia, sent by Mr. A.M. Lea (with descriptions of new genera and species, synoptic tables etc.).</a> <!--MARK--><!--MARK--><a href='../../../../publication/c12cd779-adb5-41ea-bd2c-75f6864cf22e' class='mouseoverHref'><em>Proceedings of the Linnean Society of New South Wales</em></a> <strong>23</strong>: 444-520<!--MARK-->","","Article in Journal","703f4731-a143-4da9-a327-483a0f47f698","20081009T05:11:37.000+0000","c12cd779-adb5-41ea-bd2c-75f6864cf22e"
"Sloane, T.G.","1900","Studies in Australian Entomology. No IX New species of Carabidae (with notes on some previously described species, and synoptic lists of species)","553-584","","Proceedings of the Linnean Society of New South Wales","","","","<!--MARK--><a href='../../../../publication/2e3f3473-f7a9-4d52-a151-846e0e9a7d93' class='mouseoverHref'>Sloane, T.G. 1900. Studies in Australian Entomology. No IX New species of Carabidae (with notes on some previously described species, and synoptic lists of species).</a> <!--MARK--><!--MARK--><a href='../../../../publication/c12cd779-adb5-41ea-bd2c-75f6864cf22e' class='mouseoverHref'><em>Proceedings of the Linnean Society of New South Wales</em></a> <strong>24</strong>: 553-584<!--MARK-->","","Article in Journal","2e3f3473-f7a9-4d52-a151-846e0e9a7d93","20081009T05:11:37.000+0000","c12cd779-adb5-41ea-bd2c-75f6864cf22e"
"Sloane, T.G.","1902","A revision of the genus <i>Notonomus</i> (Family Carabidae; sub-family Feronini)","252-325","","Proceedings of the Linnean Society of New South Wales","","","","<!--MARK--><a href='../../../../publication/4f44401a-89f0-4a07-a55d-45d1e547359b' class='mouseoverHref'>Sloane, T.G. 1902. A revision of the genus <i>Notonomus</i> (Family Carabidae; sub-family Feronini).</a> <!--MARK--><!--MARK--><a href='../../../../publication/c12cd779-adb5-41ea-bd2c-75f6864cf22e' class='mouseoverHref'><em>Proceedings of the Linnean Society of New South Wales</em></a> <strong>27</strong>: 252-325<!--MARK-->","","Article in Journal","4f44401a-89f0-4a07-a55d-45d1e547359b","20081009T05:11:37.000+0000","c12cd779-adb5-41ea-bd2c-75f6864cf22e"
"Sloane, T.G.","1902","Studies in Australian Entomology. No. XI Description of a new ground beetle from Victoria","672-673","","Proceedings of the Linnean Society of New South Wales","","","","<!--MARK--><a href='../../../../publication/85ed3e87-6dc6-4807-b578-2b3b28bb7aeb' class='mouseoverHref'>Sloane, T.G. 1902. Studies in Australian Entomology. No. XI Description of a new ground beetle from Victoria.</a> <!--MARK--><!--MARK--><a href='../../../../publication/c12cd779-adb5-41ea-bd2c-75f6864cf22e' class='mouseoverHref'><em>Proceedings of the Linnean Society of New South Wales</em></a> <strong>26</strong>: 672-673<!--MARK-->","","Article in Journal","85ed3e87-6dc6-4807-b578-2b3b28bb7aeb","20081009T05:11:37.000+0000","c12cd779-adb5-41ea-bd2c-75f6864cf22e"
"Sloane, T.G.","1903","Studies in Australian Entomology. No XII New Carabidae (Panageini, Bembidiini, Pogonini, Platysmatini, Platynini, Lebiini, with revisional lists of genera and speecis [<i>sic</i>], some notes on synonymy, etc.)","566-642","","Proceedings of the Linnean Society of New South Wales","","","","<!--MARK--><a href='../../../../publication/2e67762d-d5e3-4c1f-baa9-1c3510585d81' class='mouseoverHref'>Sloane, T.G. 1903. Studies in Australian Entomology. No XII New Carabidae (Panageini, Bembidiini, Pogonini, Platysmatini, Platynini, Lebiini, with revisional lists of genera and speecis [<i>sic</i>], some notes on synonymy, etc.).</a> <!--MARK--><!--MARK--><a href='../../../../publication/c12cd779-adb5-41ea-bd2c-75f6864cf22e' class='mouseoverHref'><em>Proceedings of the Linnean Society of New South Wales</em></a> <strong>28</strong>: 566-642<!--MARK-->","","Article in Journal","2e67762d-d5e3-4c1f-baa9-1c3510585d81","20081009T05:11:37.000+0000","c12cd779-adb5-41ea-bd2c-75f6864cf22e"
"Sloane, T.G.","1907","Studies in Australian Entomology. No. XV New genera and species of Carabidae, with some notes of synonymy (Clivinini, Scaritini, Cuneipectini, Trigonotomini and Lebiini)","346-381","","Proceedings of the Linnean Society of New South Wales","","","","<!--MARK--><a href='../../../../publication/fd2149cb-d97a-474a-a51f-361b58b17b67' class='mouseoverHref'>Sloane, T.G. 1907. Studies in Australian Entomology. No. XV New genera and species of Carabidae, with some notes of synonymy (Clivinini, Scaritini, Cuneipectini, Trigonotomini and Lebiini).</a> <!--MARK--><!--MARK--><a href='../../../../publication/c12cd779-adb5-41ea-bd2c-75f6864cf22e' class='mouseoverHref'><em>Proceedings of the Linnean Society of New South Wales</em></a> <strong>32</strong>: 346-381<!--MARK-->","","Article in Journal","fd2149cb-d97a-474a-a51f-361b58b17b67","20081009T05:11:37.000+0000","c12cd779-adb5-41ea-bd2c-75f6864cf22e"
"Sloane, T.G.","1910","Studies in Australian Entomology. No. XVI New species of Carabidae","378-406","","Proceedings of the Linnean Society of New South Wales","","","","<!--MARK--><a href='../../../../publication/355d4bde-82ff-4077-8b39-cb3c7e70df04' class='mouseoverHref'>Sloane, T.G. 1910. Studies in Australian Entomology. No. XVI New species of Carabidae.</a> <!--MARK--><!--MARK--><a href='../../../../publication/c12cd779-adb5-41ea-bd2c-75f6864cf22e' class='mouseoverHref'><em>Proceedings of the Linnean Society of New South Wales</em></a> <strong>35</strong>: 378-406<!--MARK-->","","Article in Journal","355d4bde-82ff-4077-8b39-cb3c7e70df04","20081009T05:11:37.000+0000","c12cd779-adb5-41ea-bd2c-75f6864cf22e"
"Sloane, T.G.","1911","Carabidae from Dorrigo, N.S.W","823-843","","Proceedings of the Linnean Society of New South Wales","","","","<!--MARK--><a href='../../../../publication/57e28523-c9f0-4680-8fd8-e36945efa076' class='mouseoverHref'>Sloane, T.G. 1911. Carabidae from Dorrigo, N.S.W.</a> <!--MARK--><!--MARK--><a href='../../../../publication/c12cd779-adb5-41ea-bd2c-75f6864cf22e' class='mouseoverHref'><em>Proceedings of the Linnean Society of New South Wales</em></a> <strong>35</strong>: 823-843<!--MARK-->","","Article in Journal","57e28523-c9f0-4680-8fd8-e36945efa076","20081009T05:11:37.000+0000","c12cd779-adb5-41ea-bd2c-75f6864cf22e"
"Sloane, T.G.","1913","Revisional notes on Australian Carabidae. Part iv. The genus <i>Notonomus</i>","404-449","","Proceedings of the Linnean Society of New South Wales","","","","<!--MARK--><a href='../../../../publication/f2f77e20-4ec7-4f5a-ac20-b7c9587cfda0' class='mouseoverHref'>Sloane, T.G. 1913. Revisional notes on Australian Carabidae. Part iv. The genus <i>Notonomus</i>.</a> <!--MARK--><!--MARK--><a href='../../../../publication/c12cd779-adb5-41ea-bd2c-75f6864cf22e' class='mouseoverHref'><em>Proceedings of the Linnean Society of New South Wales</em></a> <strong>38</strong>: 404-449<!--MARK-->","","Article in Journal","f2f77e20-4ec7-4f5a-ac20-b7c9587cfda0","20081009T05:11:37.000+0000","c12cd779-adb5-41ea-bd2c-75f6864cf22e"
"Sloane, T.G.","1915","Studies in Australian Entomology. No. XVII New genera and species of Carabidae. (Pamborini, Migadopini, Broscini, Cunepectini, Nomoni, Pterostichini, Platynini, Oodini, Harpalini, Lebiini)","438-473","","Proceedings of the Linnean Society of New South Wales","","","","<!--MARK--><a href='../../../../publication/cb216199-e565-46cd-b4a9-1989fec386ef' class='mouseoverHref'>Sloane, T.G. 1915. Studies in Australian Entomology. No. XVII New genera and species of Carabidae. (Pamborini, Migadopini, Broscini, Cunepectini, Nomoni, Pterostichini, Platynini, Oodini, Harpalini, Lebiini).</a> <!--MARK--><!--MARK--><a href='../../../../publication/c12cd779-adb5-41ea-bd2c-75f6864cf22e' class='mouseoverHref'><em>Proceedings of the Linnean Society of New South Wales</em></a> <strong>40</strong>: 438-473<!--MARK-->","","Article in Journal","cb216199-e565-46cd-b4a9-1989fec386ef","20081009T05:11:37.000+0000","c12cd779-adb5-41ea-bd2c-75f6864cf22e"
"Sloane, T.G.","1916","Carabidae from the Upper Williams River, N.S.W. [Coleoptera]","196-208","","Proceedings of the Linnean Society of New South Wales","","","","<!--MARK--><a href='../../../../publication/f479ce0a-d2c6-420a-a125-60ec60e730a3' class='mouseoverHref'>Sloane, T.G. 1916. Carabidae from the Upper Williams River, N.S.W. [Coleoptera].</a> <!--MARK--><!--MARK--><a href='../../../../publication/c12cd779-adb5-41ea-bd2c-75f6864cf22e' class='mouseoverHref'><em>Proceedings of the Linnean Society of New South Wales</em></a> <strong>41</strong>: 196-208<!--MARK-->","","Article in Journal","f479ce0a-d2c6-420a-a125-60ec60e730a3","20081009T05:11:37.000+0000","c12cd779-adb5-41ea-bd2c-75f6864cf22e"
