"PUB_AUTHOR","PUB_YEAR","PUB_TITLE","PUB_PAGES","PUB_PARENT_BOOK_TITLE","PUB_PARENT_JOURNAL_TITLE","PUB_PARENT_ARTICLE_TITLE","PUB_PUBLICATION_DATE","PUB_PUBLISHER","PUB_FORMATTED","PUB_QUALIFICATION","PUB_TYPE","PUBLICATION_GUID","PUBLICATION_LAST_UPDATE","PARENT_PUBLICATION_GUID"
"Sloane, T.G.","1920","A list of the species of Australian Carabidae which range beyond Australia and its dependent islands","320-323","","Proceedings of the Linnean Society of New South Wales","","","","<!--MARK--><a href='../../../../publication/72f42958-e3e2-4b09-92ae-c85bb609409b' class='mouseoverHref'>Sloane, T.G. 1920. A list of the species of Australian Carabidae which range beyond Australia and its dependent islands.</a> <!--MARK--><!--MARK--><a href='../../../../publication/c12cd779-adb5-41ea-bd2c-75f6864cf22e' class='mouseoverHref'><em>Proceedings of the Linnean Society of New South Wales</em></a> <strong>45</strong>: 320-323<!--MARK-->","","Article in Journal","72f42958-e3e2-4b09-92ae-c85bb609409b","","c12cd779-adb5-41ea-bd2c-75f6864cf22e"
"Sloane, T.G.","1920","The Carabidae of Tasmania","113-178","","Proceedings of the Linnean Society of New South Wales","","","","<!--MARK--><a href='../../../../publication/1cff59a8-7400-4fc0-847d-f25536e376b2' class='mouseoverHref'>Sloane, T.G. 1920. The Carabidae of Tasmania.</a> <!--MARK--><!--MARK--><a href='../../../../publication/c12cd779-adb5-41ea-bd2c-75f6864cf22e' class='mouseoverHref'><em>Proceedings of the Linnean Society of New South Wales</em></a> <strong>45</strong>: 113-178<!--MARK-->","","Article in Journal","1cff59a8-7400-4fc0-847d-f25536e376b2","20081009T05:11:37.000+0000","c12cd779-adb5-41ea-bd2c-75f6864cf22e"
"Sloane, T.G.","1923","Studies in Australian Entomology. No. XVIII New genera and species of Carabidae. (Scaritini, Pterostichini, Merizodini, Bembidiini, Trechini, Odacanthini, Panagaeini, Licinini, and Lebiini)","17-39","","Proceedings of the Linnean Society of New South Wales","","","","<!--MARK--><a href='../../../../publication/c233b83a-3576-4512-80ce-16baacc4510a' class='mouseoverHref'>Sloane, T.G. 1923. Studies in Australian Entomology. No. XVIII New genera and species of Carabidae. (Scaritini, Pterostichini, Merizodini, Bembidiini, Trechini, Odacanthini, Panagaeini, Licinini, and Lebiini).</a> <!--MARK--><!--MARK--><a href='../../../../publication/c12cd779-adb5-41ea-bd2c-75f6864cf22e' class='mouseoverHref'><em>Proceedings of the Linnean Society of New South Wales</em></a> <strong>48</strong>: 17-39<!--MARK-->","","Article in Journal","c233b83a-3576-4512-80ce-16baacc4510a","20081009T05:11:37.000+0000","c12cd779-adb5-41ea-bd2c-75f6864cf22e"
"Straneo, S.L.","1936","Sui tipi dei Platysmatini (Coleopt. Carabid.) Australiani della collezione Castelnau, nel Museo Civico di Genova","246-259","","Annali del Museo Civico di Storia Naturale Giacomo Doria, Genova","","","","<!--MARK--><a href='../../../../publication/3db9d529-3692-4390-ab50-e21607b4f8dd' class='mouseoverHref'>Straneo, S.L. 1936. Sui tipi dei Platysmatini (Coleopt. Carabid.) Australiani della collezione Castelnau, nel Museo Civico di Genova.</a> <!--MARK--><!--MARK--><a href='../../../../publication/d85b9f36-d289-41ce-a8b6-f50087483d67' class='mouseoverHref'><em>Annali del Museo Civico di Storia Naturale Giacomo Doria, Genova</em></a> <strong>59</strong>: 246-259<!--MARK-->","","Article in Journal","3db9d529-3692-4390-ab50-e21607b4f8dd","20170407T01:45:20.772+0000","d85b9f36-d289-41ce-a8b6-f50087483d67"
"Straneo, S.L.","1937","Sui tipi dei Platysmatini (Coleop. Carabid.) Australiani della collezione Castelnau, nel Museo Civico di Genova. II","461-475","","Annali del Museo Civico di Storia Naturale Giacomo Doria, Genova","","","","<!--MARK--><a href='../../../../publication/ded2a119-44d6-4ab3-a319-f5e32b5bff0b' class='mouseoverHref'>Straneo, S.L. 1937. Sui tipi dei Platysmatini (Coleop. Carabid.) Australiani della collezione Castelnau, nel Museo Civico di Genova. II.</a> <!--MARK--><!--MARK--><a href='../../../../publication/d85b9f36-d289-41ce-a8b6-f50087483d67' class='mouseoverHref'><em>Annali del Museo Civico di Storia Naturale Giacomo Doria, Genova</em></a> <strong>59</strong>: 461-475<!--MARK-->","","Article in Journal","ded2a119-44d6-4ab3-a319-f5e32b5bff0b","20170407T01:46:03.430+0000","d85b9f36-d289-41ce-a8b6-f50087483d67"
"Straneo, S.L.","1938","Nuovi Pterostichini (Coleopt. Carab.)","226-231","","Memorie della Società Entomologica Italiana. Genova","","","","<!--MARK--><a href='../../../../publication/8545007a-4a40-408d-a72c-9cca1ebeb1f2' class='mouseoverHref'>Straneo, S.L. 1938. Nuovi Pterostichini (Coleopt. Carab.).</a> <!--MARK--><!--MARK--><a href='../../../../publication/2b4020b8-372e-4058-b982-84e9d80d225f' class='mouseoverHref'><em>Memorie della Società Entomologica Italiana. Genova</em></a> <strong>16</strong>: 226-231<!--MARK-->","","Article in Journal","8545007a-4a40-408d-a72c-9cca1ebeb1f2","20081009T05:11:37.000+0000","2b4020b8-372e-4058-b982-84e9d80d225f"
"Straneo, S.L.","1938","Studi sulle specie orientali del genere <i>Caelastomus</i> Macl. (Coleopt. Carabid.)","5-100","","Annali del Museo Civico di Storia Naturale Giacomo Doria, Genova","","","","<!--MARK--><a href='../../../../publication/a546ec1b-1dea-44e6-be34-3da665a3ed17' class='mouseoverHref'>Straneo, S.L. 1938. Studi sulle specie orientali del genere <i>Caelastomus</i> Macl. (Coleopt. Carabid.).</a> <!--MARK--><!--MARK--><a href='../../../../publication/d85b9f36-d289-41ce-a8b6-f50087483d67' class='mouseoverHref'><em>Annali del Museo Civico di Storia Naturale Giacomo Doria, Genova</em></a> <strong>60</strong>: 5-100<!--MARK-->","","Article in Journal","a546ec1b-1dea-44e6-be34-3da665a3ed17","20170407T01:48:24.009+0000","d85b9f36-d289-41ce-a8b6-f50087483d67"
"Straneo, S.L.","1939","Nuovi Pterostichini. Nota II","117-123","","Memorie della Società Entomologica Italiana. Genova","","","","<!--MARK--><a href='../../../../publication/16f7a0f1-d9f3-408e-ba22-dad51a648675' class='mouseoverHref'>Straneo, S.L. 1939. Nuovi Pterostichini. Nota II.</a> <!--MARK--><!--MARK--><a href='../../../../publication/2b4020b8-372e-4058-b982-84e9d80d225f' class='mouseoverHref'><em>Memorie della Società Entomologica Italiana. Genova</em></a> <strong>18</strong>: 117-123<!--MARK-->","","Article in Journal","16f7a0f1-d9f3-408e-ba22-dad51a648675","20081009T05:11:37.000+0000","2b4020b8-372e-4058-b982-84e9d80d225f"
"Straneo, S.L.","1941","Sui tipi dei Pterostichini (Coleopt. Carabid.) Australiani della collezione Castelnau nel Museo Civico di Genova Nota III","83-94","","Annali del Museo Civico di Storia Naturale Giacomo Doria, Genova","","","","<!--MARK--><a href='../../../../publication/7a562aa4-581f-4f3e-8238-362c6529afc7' class='mouseoverHref'>Straneo, S.L. 1941. Sui tipi dei Pterostichini (Coleopt. Carabid.) Australiani della collezione Castelnau nel Museo Civico di Genova Nota III.</a> <!--MARK--><!--MARK--><a href='../../../../publication/d85b9f36-d289-41ce-a8b6-f50087483d67' class='mouseoverHref'><em>Annali del Museo Civico di Storia Naturale Giacomo Doria, Genova</em></a> <strong>61</strong>: 83-94<!--MARK-->","","Article in Journal","7a562aa4-581f-4f3e-8238-362c6529afc7","20170407T01:48:39.297+0000","d85b9f36-d289-41ce-a8b6-f50087483d67"
"Straneo, S.L.","1953","Nuovi Pterostichini VII","1-12","","Doriana. Supplemento agli Annali del Museo Civico di Storia Naturale G. Doria, Genova","","","","<!--MARK--><a href='../../../../publication/e58bc497-400a-47f5-aab1-7a325cb749d9' class='mouseoverHref'>Straneo, S.L. 1953. Nuovi Pterostichini VII.</a> <!--MARK--><!--MARK--><a href='../../../../publication/64b794cc-e48d-4196-b327-74e084b3fc92' class='mouseoverHref'><em>Doriana. Supplemento agli Annali del Museo Civico di Storia Naturale G. Doria, Genova</em></a> <strong>1</strong>(36): 1-12<!--MARK-->","","Article in Journal","e58bc497-400a-47f5-aab1-7a325cb749d9","20081009T05:11:37.000+0000","64b794cc-e48d-4196-b327-74e084b3fc92"
"Straneo, S.L.","1960","Elenco di Carabidi entrati recentemente nella collezioni del Museo Frey","416-432","","Entomologischen Arbeiten aus dem Museum Georg Frey","","","","<!--MARK--><a href='../../../../publication/ab234970-8c4f-48e0-bde0-69f37729d6ed' class='mouseoverHref'>Straneo, S.L. 1960. Elenco di Carabidi entrati recentemente nella collezioni del Museo Frey.</a> <!--MARK--><!--MARK--><a href='../../../../publication/d9967b1d-fa66-4d5e-9c04-910b53ebb9b3' class='mouseoverHref'><em>Entomologischen Arbeiten aus dem Museum Georg Frey</em></a> <strong>7</strong>: 416-432<!--MARK-->","","Article in Journal","ab234970-8c4f-48e0-bde0-69f37729d6ed","20081009T05:11:37.000+0000","d9967b1d-fa66-4d5e-9c04-910b53ebb9b3"
"Tschitschérine, T.","1890","Quelques additions à l'Essai sur les Féronies de l'Australie et de la Nouvelle Zélande du Baron Chaudoir","160-171","","Horae Societatis Entomologicae Rossicae","","","","<!--MARK--><a href='../../../../publication/2cba7ee5-2bdd-4ce1-8f59-3647bb48efcc' class='mouseoverHref'>Tschitschérine, T. 1890. Quelques additions à l'Essai sur les Féronies de l'Australie et de la Nouvelle Zélande du Baron Chaudoir.</a> <!--MARK--><!--MARK--><a href='../../../../publication/4170ee18-5d62-4bf0-9475-603bf65de2cc' class='mouseoverHref'><em>Horae Societatis Entomologicae Rossicae</em></a> <strong>25</strong>: 160-171<!--MARK-->","","Article in Journal","2cba7ee5-2bdd-4ce1-8f59-3647bb48efcc","20081009T05:11:37.000+0000","4170ee18-5d62-4bf0-9475-603bf65de2cc"
"Tschitschérine, T.","1897","Matériaux pour servir à l'étude des Féroniens III","250-351","","Horae Societatis Entomologicae Rossicae","","","","<!--MARK--><a href='../../../../publication/1dbc7d0e-f14c-4150-beaf-ee7519775a52' class='mouseoverHref'>Tschitschérine, T. 1897. Matériaux pour servir à l'étude des Féroniens III.</a> <!--MARK--><!--MARK--><a href='../../../../publication/4170ee18-5d62-4bf0-9475-603bf65de2cc' class='mouseoverHref'><em>Horae Societatis Entomologicae Rossicae</em></a> <strong>30</strong>(1895-1896): 250-351<!--MARK-->","","Article in Journal","1dbc7d0e-f14c-4150-beaf-ee7519775a52","20081009T05:11:37.000+0000","4170ee18-5d62-4bf0-9475-603bf65de2cc"
"Tschitschérine, T.","1898","Matériaux pour servir à l'étude des Féroniens IV","1-224","","Horae Societatis Entomologicae Rossicae","","","","<!--MARK--><a href='../../../../publication/075f6791-74a9-4f28-b780-ec52c46cd6ed' class='mouseoverHref'>Tschitschérine, T. 1898. Matériaux pour servir à l'étude des Féroniens IV.</a> <!--MARK--><!--MARK--><a href='../../../../publication/4170ee18-5d62-4bf0-9475-603bf65de2cc' class='mouseoverHref'><em>Horae Societatis Entomologicae Rossicae</em></a> <strong>32</strong>: 1-224<!--MARK-->","","Article in Journal","075f6791-74a9-4f28-b780-ec52c46cd6ed","20081009T05:11:37.000+0000","4170ee18-5d62-4bf0-9475-603bf65de2cc"
"Tschitschérine, T.","1901","Description de quelques nouvelles espèces de la tribu des Platysmatini","1-16","","Horae Societatis Entomologicae Rossicae","","","","<!--MARK--><a href='../../../../publication/78abdf17-9536-48e1-bcdf-6d1a2dad6441' class='mouseoverHref'>Tschitschérine, T. 1901. Description de quelques nouvelles espèces de la tribu des Platysmatini.</a> <!--MARK--><!--MARK--><a href='../../../../publication/4170ee18-5d62-4bf0-9475-603bf65de2cc' class='mouseoverHref'><em>Horae Societatis Entomologicae Rossicae</em></a> <strong>35</strong>: 1-16<!--MARK-->","","Article in Journal","78abdf17-9536-48e1-bcdf-6d1a2dad6441","20081009T05:11:37.000+0000","4170ee18-5d62-4bf0-9475-603bf65de2cc"
"Tschitschérine, T.","1902","Notes sur les Platysmatini de l'Australie","502-534","","Horae Societatis Entomologicae Rossicae","","","","<!--MARK--><a href='../../../../publication/b42cd006-032b-4229-b845-8283cfef8fb2' class='mouseoverHref'>Tschitschérine, T. 1902. Notes sur les Platysmatini de l'Australie.</a> <!--MARK--><!--MARK--><a href='../../../../publication/4170ee18-5d62-4bf0-9475-603bf65de2cc' class='mouseoverHref'><em>Horae Societatis Entomologicae Rossicae</em></a> <strong>35</strong>: 502-534<!--MARK-->","","Article in Journal","b42cd006-032b-4229-b845-8283cfef8fb2","20081009T05:11:37.000+0000","4170ee18-5d62-4bf0-9475-603bf65de2cc"
"Tschitschérine, T.","1902","Platysmatini (Coleoptera, Carabidae) nouveaux ou peu connus de l?Asie orientale","494-501","","Horae Societatis Entomologicae Rossicae","","","","<!--MARK--><a href='../../../../publication/564e6370-0ced-46a1-abc6-5c97a1adb2ec' class='mouseoverHref'>Tschitschérine, T. 1902. Platysmatini (Coleoptera, Carabidae) nouveaux ou peu connus de l?Asie orientale.</a> <!--MARK--><!--MARK--><a href='../../../../publication/4170ee18-5d62-4bf0-9475-603bf65de2cc' class='mouseoverHref'><em>Horae Societatis Entomologicae Rossicae</em></a> <strong>35</strong>: 494-501<!--MARK-->","","Article in Journal","564e6370-0ced-46a1-abc6-5c97a1adb2ec","20190131T22:40:30.719+0000","4170ee18-5d62-4bf0-9475-603bf65de2cc"
"Tschitschérine, T.","1903","Zu Dr. K. Daniel's kritischem Nachtgraben","39-40","","Revue Russe d'Entomologie","","","","<!--MARK--><a href='../../../../publication/0830cae6-2c8e-4e0d-919e-5c53272cdf4e' class='mouseoverHref'>Tschitschérine, T. 1903. Zu Dr. K. Daniel's kritischem Nachtgraben.</a> <!--MARK--><!--MARK--><a href='../../../../publication/ae560f66-598c-4d76-93c4-8b4f7ffba25b' class='mouseoverHref'><em>Revue Russe d'Entomologie</em></a> <strong>3</strong>: 39-40<!--MARK-->","","Article in Journal","0830cae6-2c8e-4e0d-919e-5c53272cdf4e","20081009T05:11:37.000+0000","ae560f66-598c-4d76-93c4-8b4f7ffba25b"
"Westwood, J.O.","1864","Descriptions of two anomalous Carabideous beetles","iii","","Transactions of the Entomological Society of London","","","","<!--MARK--><a href='../../../../publication/3a929e04-8ee2-4b89-a475-d812515b867f' class='mouseoverHref'>Westwood, J.O. 1864. Descriptions of two anomalous Carabideous beetles.</a> <!--MARK--><!--MARK--><a href='../../../../publication/5cf355b3-abc5-451e-9abc-ed3282d7811a' class='mouseoverHref'><em>Transactions of the Entomological Society of London</em></a> Proc. <strong>1864</strong>: iii<!--MARK-->","","Article in Journal","3a929e04-8ee2-4b89-a475-d812515b867f","20081009T05:11:37.000+0000","5cf355b3-abc5-451e-9abc-ed3282d7811a"
"White, A.","1859","Descriptions of unrecorded species of Australian Coleoptera of the families Carabidae, Buprestidae, Lamellicornia, Longicornia, etc","117-123 pls 58-59","","Proceedings of the Zoological Society of London","","","","<!--MARK--><a href='../../../../publication/b6fbdfa7-0f76-4f4e-875f-a5c36764fb97' class='mouseoverHref'>White, A. 1859. Descriptions of unrecorded species of Australian Coleoptera of the families Carabidae, Buprestidae, Lamellicornia, Longicornia, etc.</a> <!--MARK--><!--MARK--><a href='../../../../publication/511f299d-99ec-413c-bc4c-04a380829c96' class='mouseoverHref'><em>Proceedings of the Zoological Society of London</em></a> <strong>1859</strong>: 117-123 pls 58-59<!--MARK-->","","Article in Journal","b6fbdfa7-0f76-4f4e-875f-a5c36764fb97","","511f299d-99ec-413c-bc4c-04a380829c96"
"Will, K.","2015","A multigene phylogenetic analysis results in a redefinition of the genus <i>Notonomus</i> Chaudoir (Coleoptera, Carabidae) and descriptions of new species of the subgenus <i>Leiradira</i> Castelnau.","313-344","","Invertebrate Systematics","","","","<!--MARK--><a href='../../../../publication/dc8492f1-e4d9-48e3-8cec-f602c491864d' class='mouseoverHref'>Will, K. 2015. A multigene phylogenetic analysis results in a redefinition of the genus <i>Notonomus</i> Chaudoir (Coleoptera, Carabidae) and descriptions of new species of the subgenus <i>Leiradira</i> Castelnau.</a> <!--MARK--><!--MARK--><a href='../../../../publication/7ef62e6c-73cc-4912-8ea7-5752f95e8e8a' class='mouseoverHref'><em>Invertebrate Systematics</em></a> <strong>29</strong>: 313-344<!--MARK-->","","Article in Journal","dc8492f1-e4d9-48e3-8cec-f602c491864d","20150907T23:13:57.464+0000","7ef62e6c-73cc-4912-8ea7-5752f95e8e8a"
"Will, K.","2015","A taxonomic review, new species and a key to species of <i>Platycoelus</i> Blanchard, 1843 (Coleoptera: Carabidae: Pterostichini)","291-308","","Zootaxa","","","","<!--MARK--><a href='../../../../publication/7fbd7d9a-eec5-4adf-a3e0-fa2af88bcfa3' class='mouseoverHref'>Will, K. 2015. A taxonomic review, new species and a key to species of <i>Platycoelus</i> Blanchard, 1843 (Coleoptera: Carabidae: Pterostichini).</a> <!--MARK--><!--MARK--><a href='../../../../publication/96466227-221c-4922-ac97-1ac2dd946d0a' class='mouseoverHref'><em>Zootaxa</em></a> <strong>4034</strong>(2): 291-308<!--MARK-->","","Article in Journal","7fbd7d9a-eec5-4adf-a3e0-fa2af88bcfa3","20151201T20:46:52.165+0000","96466227-221c-4922-ac97-1ac2dd946d0a"
"Will, K.","2015","Resolution of taxonomic problems in Australian Harpalini, Abacetini, Pterostichini, and Oodini (Coleoptera, Carabidae)","131-137","","ZooKeys","","","","<!--MARK--><a href='../../../../publication/0022e2b2-b5d1-4957-8ebd-2c84a67e4644' class='mouseoverHref'>Will, K. 2015. Resolution of taxonomic problems in Australian Harpalini, Abacetini, Pterostichini, and Oodini (Coleoptera, Carabidae).</a> <!--MARK--><!--MARK--><a href='../../../../publication/8cb7bef9-51f4-441c-a060-649dc8095e71' class='mouseoverHref'><em>ZooKeys</em></a> <strong>545</strong>: 131-137<!--MARK-->","","Article in Journal","0022e2b2-b5d1-4957-8ebd-2c84a67e4644","20160525T03:48:17.625+0000","8cb7bef9-51f4-441c-a060-649dc8095e71"
"Will, K. & Monteith, G.B.","2018","Multi-locus phylogeny, taxonomic review and description of new species of Australian '<em>Nurus</em>' (Sensu Stricto) Motschulsky, 1865 (Coleoptera: Carabidae: Pterostichini)","353-388","","Australian Entomologist","","","","<!--MARK--><a href='../../../../publication/14b67cf2-896e-459c-a544-243c614c2916' class='mouseoverHref'>Will, K. & Monteith, G.B. 2018. Multi-locus phylogeny, taxonomic review and description of new species of Australian '<em>Nurus</em>' (Sensu Stricto) Motschulsky, 1865 (Coleoptera: Carabidae: Pterostichini).</a> <!--MARK--><!--MARK--><a href='../../../../publication/3ffa056e-e79b-45d8-a5e0-27f16422b74e' class='mouseoverHref'><em>Australian Entomologist</em></a> <strong>45</strong>(4): 353-388<!--MARK-->","","Article in Journal","14b67cf2-896e-459c-a544-243c614c2916","20190125T05:27:48.877+0000","3ffa056e-e79b-45d8-a5e0-27f16422b74e"
