"PUB_AUTHOR","PUB_YEAR","PUB_TITLE","PUB_PAGES","PUB_PARENT_BOOK_TITLE","PUB_PARENT_JOURNAL_TITLE","PUB_PARENT_ARTICLE_TITLE","PUB_PUBLICATION_DATE","PUB_PUBLISHER","PUB_FORMATTED","PUB_QUALIFICATION","PUB_TYPE","PUBLICATION_GUID","PUBLICATION_LAST_UPDATE","PARENT_PUBLICATION_GUID"
"Andrewes, H.E.","1919","On the types of Oriental Carabidae in the British Museum, and in the Hope Dept. of the Oxford University Museum","119-217","","Transactions of the Entomological Society of London","","","","<!--MARK--><a href='../../../../publication/03cf368e-4dab-478b-bac4-ad81c1fa08d0' class='mouseoverHref'>Andrewes, H.E. 1919. On the types of Oriental Carabidae in the British Museum, and in the Hope Dept. of the Oxford University Museum.</a> <!--MARK--><!--MARK--><a href='../../../../publication/5cf355b3-abc5-451e-9abc-ed3282d7811a' class='mouseoverHref'><em>Transactions of the Entomological Society of London</em></a> <strong>1919</strong>: 119-217<!--MARK-->","","Article in Journal","03cf368e-4dab-478b-bac4-ad81c1fa08d0","20081009T05:11:37.000+0000","5cf355b3-abc5-451e-9abc-ed3282d7811a"
"Andrewes, H.E.","1926","A catalogue of the Philippine Carabidae","345-361","","Philippine Journal of Science","","","","<!--MARK--><a href='../../../../publication/9afd2866-2bb7-4cbb-a6c0-22781422dc72' class='mouseoverHref'>Andrewes, H.E. 1926. A catalogue of the Philippine Carabidae.</a> <!--MARK--><!--MARK--><a href='../../../../publication/0347b709-e2f0-4679-8749-33668856b97f' class='mouseoverHref'><em>Philippine Journal of Science</em></a> <strong>31</strong>: 345-361<!--MARK-->","","Article in Journal","9afd2866-2bb7-4cbb-a6c0-22781422dc72","20131004T00:00:21.065+0000","0347b709-e2f0-4679-8749-33668856b97f"
"Baehr, M.","2008","A review of the genus <i>Delinius</i> Westwood from northern Australia, with description of five new species. (Insecta, Coleoptera, Carabidae, Pterostichini)","227-240","","Coleoptera","","","","<!--MARK--><a href='../../../../publication/bcbbb259-1335-4684-8a3e-47614a68f866' class='mouseoverHref'>Baehr, M. 2008. A review of the genus <i>Delinius</i> Westwood from northern Australia, with description of five new species. (Insecta, Coleoptera, Carabidae, Pterostichini).</a> <!--MARK--><!--MARK--><a href='../../../../publication/9342afce-9da6-4f8a-8003-72d7c0938838' class='mouseoverHref'><em>Coleoptera</em></a> <strong>12</strong>: 227-240<!--MARK-->","","Article in Journal","bcbbb259-1335-4684-8a3e-47614a68f866","20101007T01:03:27.726+0000","9342afce-9da6-4f8a-8003-72d7c0938838"
"Bates, H.W.","1874","On the geodephagous Coleoptera of New Zealand","233-246, 270-277","","Annals and Magazine of Natural History","","","","<!--MARK--><a href='../../../../publication/99e78a93-cd4b-46f9-bbdf-f242da36616f' class='mouseoverHref'>Bates, H.W. 1874. On the geodephagous Coleoptera of New Zealand.</a> <!--MARK--><!--MARK--><a href='../../../../publication/efa8de69-3a29-4a43-8ef2-cbefda205976' class='mouseoverHref'><em>Annals and Magazine of Natural History</em></a> 4 <strong>13</strong>: 233-246, 270-277<!--MARK-->","","Article in Journal","99e78a93-cd4b-46f9-bbdf-f242da36616f","20081009T05:11:37.000+0000","efa8de69-3a29-4a43-8ef2-cbefda205976"
"Bates, H.W.","1878","New genera and species of Carabidae from Tasmania","317-326","","Cistula Entomologica","","","","<!--MARK--><a href='../../../../publication/0b37df1c-d2f0-4578-ae56-b87efb8162ce' class='mouseoverHref'>Bates, H.W. 1878. New genera and species of Carabidae from Tasmania.</a> <!--MARK--><!--MARK--><a href='../../../../publication/6d769ad4-3958-459c-9047-dfb75cc3158f' class='mouseoverHref'><em>Cistula Entomologica</em></a> <strong>2</strong>: 317-326<!--MARK-->","","Article in Journal","0b37df1c-d2f0-4578-ae56-b87efb8162ce","20081009T05:11:37.000+0000","6d769ad4-3958-459c-9047-dfb75cc3158f"
"Blackburn, T.","1888","Notes on Australian Coleoptera, with descriptions of new genera and species","805-875","","Proceedings of the Linnean Society of New South Wales","","","","<!--MARK--><a href='../../../../publication/050e21d6-6439-4054-a848-2f328a5e0a38' class='mouseoverHref'>Blackburn, T. 1888. Notes on Australian Coleoptera, with descriptions of new genera and species.</a> <!--MARK--><!--MARK--><a href='../../../../publication/c12cd779-adb5-41ea-bd2c-75f6864cf22e' class='mouseoverHref'><em>Proceedings of the Linnean Society of New South Wales</em></a> 2 <strong>3</strong>: 805-875<!--MARK-->","","Article in Journal","050e21d6-6439-4054-a848-2f328a5e0a38","20130318T02:02:39.380+0000","c12cd779-adb5-41ea-bd2c-75f6864cf22e"
"Blackburn, T.","1890","Notes on Australian Coleoptera, with descriptions of new species. Part IV","707-746","","Proceedings of the Linnean Society of New South Wales","","","","<!--MARK--><a href='../../../../publication/0f49cf6b-ed5d-4e09-8e72-58faa33d70c8' class='mouseoverHref'>Blackburn, T. 1890. Notes on Australian Coleoptera, with descriptions of new species. Part IV.</a> <!--MARK--><!--MARK--><a href='../../../../publication/c12cd779-adb5-41ea-bd2c-75f6864cf22e' class='mouseoverHref'><em>Proceedings of the Linnean Society of New South Wales</em></a> 2 <strong>4</strong>: 707-746<!--MARK-->","","Article in Journal","0f49cf6b-ed5d-4e09-8e72-58faa33d70c8","20081009T05:11:37.000+0000","c12cd779-adb5-41ea-bd2c-75f6864cf22e"
"Blackburn, T.","1892","Notes on Australian Coleoptera, with descriptions of new species. Part XI.","65-151","","Proceedings of the Linnean Society of New South Wales","","","","<!--MARK--><a href='../../../../publication/f1a03978-9bfc-4785-b8d7-9880fe4badeb' class='mouseoverHref'>Blackburn, T. 1892. Notes on Australian Coleoptera, with descriptions of new species. Part XI.</a> <!--MARK--><!--MARK--><a href='../../../../publication/c12cd779-adb5-41ea-bd2c-75f6864cf22e' class='mouseoverHref'><em>Proceedings of the Linnean Society of New South Wales</em></a> 2 <strong>7</strong>(I): 65-151<!--MARK-->","","Article in Journal","f1a03978-9bfc-4785-b8d7-9880fe4badeb","20111219T20:59:06.127+0000","c12cd779-adb5-41ea-bd2c-75f6864cf22e"
"Blackburn, T.","1892","Scientific results of the Elder Exploring Expedition: Coleoptera","16-61","","Transactions of the Royal Society of South Australia","","","","<!--MARK--><a href='../../../../publication/ba71de0a-2eeb-44cd-ba52-66f547e74fc3' class='mouseoverHref'>Blackburn, T. 1892. Scientific results of the Elder Exploring Expedition: Coleoptera.</a> <!--MARK--><!--MARK--><a href='../../../../publication/8b48b0a3-dd7a-4aea-be0d-10a223710ebc' class='mouseoverHref'><em>Transactions of the Royal Society of South Australia</em></a> <strong>16</strong>: 16-61<!--MARK-->","","Article in Journal","ba71de0a-2eeb-44cd-ba52-66f547e74fc3","20081009T05:11:37.000+0000","8b48b0a3-dd7a-4aea-be0d-10a223710ebc"
"Blanchard, C.E.","1842","Planches I-XVII.","","Voyage au Pôle Sud et dans l'Océanie sur les Corvettes l'Astrolabe et la Zélée; pendant les années, 1837-40, par Hombron et Jacquinot. Atlas of 140 plates","","","","","<!--MARK--><a href='../../../../publication/8dfd65ef-be0a-4806-9133-8087baf6c348' class='mouseoverHref'>Blanchard, C.E. 1842. Planches I-XVII.</a> <!--MARK--><em>In,</em> <!--MARK--><a href='../../../../publication/65eb1d5e-c460-4f88-98da-885aaae82ac3' class='mouseoverHref'>Dumont-d'Urville, J. S. C. <em>Voyage au Pôle Sud et dans l'Océanie sur les Corvettes l'Astrolabe et la Zélée; pendant les années, 1837-40, par Hombron et Jacquinot. Atlas of 140 plates</em>. Paris pp.</a><!--MARK-->","","Chapter in Book","8dfd65ef-be0a-4806-9133-8087baf6c348","20151118T21:02:26.972+0000","65eb1d5e-c460-4f88-98da-885aaae82ac3"
"Blanchard, C.E.","1853","Description des Insectes","1-422","Voyage au Pole Sud et dans l'Océanie sur les corvettes l'<i>Astrolabe</i> et la <i>Zélée</i> pendant les années 1837-1840, sous le commandement de M.J. Dumont-d'Urville Capitaine de vaisseau. Atlas, Zoologie","","","","","<!--MARK--><a href='../../../../publication/0f266222-c6b7-4a49-869b-2df799b52822' class='mouseoverHref'>Blanchard, C.E. 1853. Description des Insectes. pp. 1-422</a> <!--MARK--><em>in</em> <!--MARK--><a href='../../../../publication/d73867fe-1441-4373-85fe-65819644bde8' class='mouseoverHref'>Dumont-d'Urville, J. <em>Voyage au Pole Sud et dans l'Océanie sur les corvettes l'<i>Astrolabe</i> et la <i>Zélée</i> pendant les années 1837-1840, sous le commandement de M.J. Dumont-d'Urville Capitaine de vaisseau. Atlas, Zoologie</em>. Paris : Gide et Cie et J. Baudry Vol. 4 422 pp.</a><!--MARK--> [published between 1842-1853]","","Chapter in Book","0f266222-c6b7-4a49-869b-2df799b52822","20081009T05:11:37.000+0000","d73867fe-1441-4373-85fe-65819644bde8"
"Boheman, C.H.","1858","Coleoptera, species novas descripsit. Kongliga Svenska Fregatten Eugenies resa Omkring Jorden ?1851-1853. Zoologi. 1. Insecta","1-112","","","","","P.A. Norstedt","<!--MARK--><a href='../../../../publication/1977f7f2-3a65-4696-9fa7-c5bee3ad212b' class='mouseoverHref'>Boheman, C.H. 1858. <em>Coleoptera, species novas descripsit. Kongliga Svenska Fregatten Eugenies resa Omkring Jorden ?1851-1853. Zoologi. 1. Insecta</em>. Stockholm : P.A. Norstedt pp. 1-112.</a><!--MARK--> [1-112 pp. (1858), 113-218 (1859)]","1-112 pp. (1858), 113-218 (1859)","Book","1977f7f2-3a65-4696-9fa7-c5bee3ad212b","20081009T05:11:37.000+0000",""
"Boisduval, J.A.","1835","Voyage de Découvertes de l'<i>Astrolabe</i> exécuté par ordre du Roi, pendant les années 1826-1827-1828-1829, sous le commandement de M.J. Dumont d'Urville. Faune Entomologique de l'Océan Pacifique, avec l'illustration des insectes nouveaux recueillis pendant le voyage. 2me Partie. Coléoptères et autres Ordres","vii 716 pp.","","","","27-III-1835","J. Tastu","<!--MARK--><a href='../../../../publication/f3f620b1-a19c-439c-88b6-243e5593b6bf' class='mouseoverHref'>Boisduval, J.A. 1835. <em>Voyage de Découvertes de l'<i>Astrolabe</i> exécuté par ordre du Roi, pendant les années 1826-1827-1828-1829, sous le commandement de M.J. Dumont d'Urville. Faune Entomologique de l'Océan Pacifique, avec l'illustration des insectes nouveaux recueillis pendant le voyage. 2me Partie. Coléoptères et autres Ordres</em>. Paris : J. Tastu vii 716 pp.</a><!--MARK--> [Date published 27-III-1835]","","Book","f3f620b1-a19c-439c-88b6-243e5593b6bf","20110901T05:19:23.377+0000",""
"Bonelli, F.A.","1810","Observations Entomologique. Première partie (cicindélètes et portion des carabiques) [with the ?Tabula synoptica exhibens genera carabicorum in sectiones et stirpes disposita?]","58 pp., 1 table","","","","","F. Galletti","<!--MARK--><a href='../../../../publication/4b6778a3-0468-4108-af01-9b3dbd73da31' class='mouseoverHref'>Bonelli, F.A. 1810. <em>Observations Entomologique. Première partie (cicindélètes et portion des carabiques) [with the ?Tabula synoptica exhibens genera carabicorum in sectiones et stirpes disposita?]</em>. Torino/Turin (Italy) : F. Galletti 58 pp., 1 table.</a><!--MARK--> [reissued in 1812, without the «Tabula Synoptica», in Mem. R. Accad. Sci. Torino 18: 21-78]","reissued in 1812, without the «Tabula Synoptica», in Mem. R. Accad. Sci. Torino 18: 21-78","Book","4b6778a3-0468-4108-af01-9b3dbd73da31","20190116T04:06:59.598+0000",""
"Britton, E.B.","1940","The Carabidae (Coloeoptera) of New Zealand, Part 1, Pterostichini","473-508","","Transactions of the Royal Society of New Zealand","","","","<!--MARK--><a href='../../../../publication/b50ea9a5-ecdb-498c-b90c-697de6a20b9b' class='mouseoverHref'>Britton, E.B. 1940. The Carabidae (Coloeoptera) of New Zealand, Part 1, Pterostichini.</a> <!--MARK--><!--MARK--><a href='../../../../publication/5f8e26d3-bf1c-462a-9219-30e63cf563ef' class='mouseoverHref'><em>Transactions of the Royal Society of New Zealand</em></a> <strong>69</strong>: 473-508<!--MARK-->","","Article in Journal","b50ea9a5-ecdb-498c-b90c-697de6a20b9b","20081009T05:11:37.000+0000","5f8e26d3-bf1c-462a-9219-30e63cf563ef"
"Castelnau, F.L. Laporte de","1840","Histoire Naturelle des Insectes, Animaux articulés. Coléoptères","cxxv 24 pp.","","","","","Duménil","<!--MARK--><a href='../../../../publication/ff9614cc-e927-49b9-bb47-a988b08d2ef0' class='mouseoverHref'>Castelnau, F.L. Laporte de 1840. <em>Histoire Naturelle des Insectes, Animaux articulés. Coléoptères</em>. Paris : Duménil Vol. 1 cxxv 24 pp.</a><!--MARK-->","","Book","ff9614cc-e927-49b9-bb47-a988b08d2ef0","20081009T05:11:37.000+0000",""
"Charley, D. & Andren, M.","2018","The distribution and conservation of the endangered Atlas Rainforest Ground-beetle, <I>Nurus atlas</I> (Laporte, 1867) (Coleoptera: Carabidae) in northeast New South Wales","389-402","","Australian Entomologist","","","","<!--MARK--><a href='../../../../publication/af194e98-a8fa-441b-a0c2-a366a1015676' class='mouseoverHref'>Charley, D. & Andren, M. 2018. The distribution and conservation of the endangered Atlas Rainforest Ground-beetle, <I>Nurus atlas</I> (Laporte, 1867) (Coleoptera: Carabidae) in northeast New South Wales.</a> <!--MARK--><!--MARK--><a href='../../../../publication/3ffa056e-e79b-45d8-a5e0-27f16422b74e' class='mouseoverHref'><em>Australian Entomologist</em></a> <strong>45</strong>(4): 389-402<!--MARK-->","","Article in Journal","af194e98-a8fa-441b-a0c2-a366a1015676","20190131T22:49:51.103+0000","3ffa056e-e79b-45d8-a5e0-27f16422b74e"
"Chaudoir, M. de","1843","Carabiques nouveaux","671-791","","Bulletin de la Société Impériale des Naturalistes de Moscou","","","","<!--MARK--><a href='../../../../publication/92470b6a-0b48-4764-99c1-7dc53046ce0c' class='mouseoverHref'>Chaudoir, M. de 1843. Carabiques nouveaux.</a> <!--MARK--><!--MARK--><a href='../../../../publication/a7cbc93a-fdd0-40a5-9cc8-35de71b7d18a' class='mouseoverHref'><em>Bulletin de la Société Impériale des Naturalistes de Moscou</em></a> <strong>16</strong>(4): 671-791<!--MARK-->","","Article in Journal","92470b6a-0b48-4764-99c1-7dc53046ce0c","20081009T05:11:37.000+0000","a7cbc93a-fdd0-40a5-9cc8-35de71b7d18a"
"Chaudoir, M. de","1843","Genres nouveaux de la famille des Carabiques. (Continuation)","383-427","","Bulletin de la Société Impériale des Naturalistes de Moscou","","","","<!--MARK--><a href='../../../../publication/0b08ce5c-9c92-452e-886a-be2935d990f7' class='mouseoverHref'>Chaudoir, M. de 1843. Genres nouveaux de la famille des Carabiques. (Continuation).</a> <!--MARK--><!--MARK--><a href='../../../../publication/a7cbc93a-fdd0-40a5-9cc8-35de71b7d18a' class='mouseoverHref'><em>Bulletin de la Société Impériale des Naturalistes de Moscou</em></a> <strong>16</strong>(3): 383-427<!--MARK-->","","Article in Journal","0b08ce5c-9c92-452e-886a-be2935d990f7","20081009T05:11:37.000+0000","a7cbc93a-fdd0-40a5-9cc8-35de71b7d18a"
"Chaudoir, M. de","1852","Mémoire sur la famille des Carabiques. 3e partie","3-104","","Bulletin de la Société Impériale des Naturalistes de Moscou","","","","<!--MARK--><a href='../../../../publication/88bbd080-2cfd-4730-9c7d-70e6ba6e5660' class='mouseoverHref'>Chaudoir, M. de 1852. Mémoire sur la famille des Carabiques. 3e partie.</a> <!--MARK--><!--MARK--><a href='../../../../publication/a7cbc93a-fdd0-40a5-9cc8-35de71b7d18a' class='mouseoverHref'><em>Bulletin de la Société Impériale des Naturalistes de Moscou</em></a> <strong>25</strong>(1): 3-104<!--MARK-->","","Article in Journal","88bbd080-2cfd-4730-9c7d-70e6ba6e5660","20081009T05:11:37.000+0000","a7cbc93a-fdd0-40a5-9cc8-35de71b7d18a"
"Chaudoir, M. de","1865","Essai sur les Féronides de l'Australie et de la Nouvelle-Zélande","65-112","","Bulletin de la Société Impériale des Naturalistes de Moscou","","","","<!--MARK--><a href='../../../../publication/ee484426-3bf5-4fe3-9bb8-fbe1c0ba14b6' class='mouseoverHref'>Chaudoir, M. de 1865. Essai sur les Féronides de l'Australie et de la Nouvelle-Zélande.</a> <!--MARK--><!--MARK--><a href='../../../../publication/a7cbc93a-fdd0-40a5-9cc8-35de71b7d18a' class='mouseoverHref'><em>Bulletin de la Société Impériale des Naturalistes de Moscou</em></a> <strong>38</strong>(3-4): 65-112<!--MARK-->","","Article in Journal","ee484426-3bf5-4fe3-9bb8-fbe1c0ba14b6","20190206T04:05:23.411+0000","a7cbc93a-fdd0-40a5-9cc8-35de71b7d18a"
"Chaudoir, M. de","1868","Révision des Trigonotomides","151-164","","Annales de la Société Entomologique de Belgique (Comptes-rendus)","","","","<!--MARK--><a href='../../../../publication/8c22c544-5c51-4c35-8043-8728397a511b' class='mouseoverHref'>Chaudoir, M. de 1868. Révision des Trigonotomides.</a> <!--MARK--><!--MARK--><a href='../../../../publication/acc7fcdb-707a-4cbe-8f70-d7595ac25c58' class='mouseoverHref'><em>Annales de la Société Entomologique de Belgique (Comptes-rendus)</em></a> <strong>11</strong>: 151-164<!--MARK-->","","Article in Journal","8c22c544-5c51-4c35-8043-8728397a511b","20081009T05:11:37.000+0000","acc7fcdb-707a-4cbe-8f70-d7595ac25c58"
"Chaudoir, M. de","1870","Essai monographique sur le genre <i>Abacetus</i>, Dejean","355-410","","Bulletin de la Société Impériale des Naturalistes de Moscou","","","","<!--MARK--><a href='../../../../publication/51f41a2d-133b-4c7b-93dc-bd129fff92b8' class='mouseoverHref'>Chaudoir, M. de 1870. Essai monographique sur le genre <i>Abacetus</i>, Dejean.</a> <!--MARK--><!--MARK--><a href='../../../../publication/a7cbc93a-fdd0-40a5-9cc8-35de71b7d18a' class='mouseoverHref'><em>Bulletin de la Société Impériale des Naturalistes de Moscou</em></a> <strong>42</strong>(1): 355-410<!--MARK-->","","Article in Journal","51f41a2d-133b-4c7b-93dc-bd129fff92b8","20081009T05:11:37.000+0000","a7cbc93a-fdd0-40a5-9cc8-35de71b7d18a"
"Chaudoir, M. de","1872","Essai monographique sur les Drimostomides et les Cratocérides et description d'un genre nouveau de Morionides","5-24","","Annales de la Société Entomologique de Belgique (Comptes-rendus)","","","","<!--MARK--><a href='../../../../publication/32aa4ab7-db59-40fd-8529-ab0acfa790bd' class='mouseoverHref'>Chaudoir, M. de 1872. Essai monographique sur les Drimostomides et les Cratocérides et description d'un genre nouveau de Morionides.</a> <!--MARK--><!--MARK--><a href='../../../../publication/acc7fcdb-707a-4cbe-8f70-d7595ac25c58' class='mouseoverHref'><em>Annales de la Société Entomologique de Belgique (Comptes-rendus)</em></a> <strong>15</strong>: 5-24<!--MARK-->","","Article in Journal","32aa4ab7-db59-40fd-8529-ab0acfa790bd","20081009T05:11:37.000+0000","acc7fcdb-707a-4cbe-8f70-d7595ac25c58"
"Chaudoir, M. de","1873","Matériaux pour servir à l'étude des Féroniens","85-116","","Bulletin de la Société Impériale des Naturalistes de Moscou","","","","<!--MARK--><a href='../../../../publication/fc52723b-1bc9-4e97-850d-9a5b4e94f560' class='mouseoverHref'>Chaudoir, M. de 1873. Matériaux pour servir à l'étude des Féroniens.</a> <!--MARK--><!--MARK--><a href='../../../../publication/a7cbc93a-fdd0-40a5-9cc8-35de71b7d18a' class='mouseoverHref'><em>Bulletin de la Société Impériale des Naturalistes de Moscou</em></a> <strong>46</strong>(2): 85-116<!--MARK-->","","Article in Journal","fc52723b-1bc9-4e97-850d-9a5b4e94f560","20081009T05:11:37.000+0000","a7cbc93a-fdd0-40a5-9cc8-35de71b7d18a"
"Chaudoir, M. de","1874","Matériaux pour servir à l'étude des Féroniens. Suite","1-34","","Bulletin de la Société Impériale des Naturalistes de Moscou","","","","<!--MARK--><a href='../../../../publication/2e21cf12-80bf-485f-a26f-284201278741' class='mouseoverHref'>Chaudoir, M. de 1874. Matériaux pour servir à l'étude des Féroniens. Suite.</a> <!--MARK--><!--MARK--><a href='../../../../publication/a7cbc93a-fdd0-40a5-9cc8-35de71b7d18a' class='mouseoverHref'><em>Bulletin de la Société Impériale des Naturalistes de Moscou</em></a> <strong>48</strong>: 1-34<!--MARK-->","","Article in Journal","2e21cf12-80bf-485f-a26f-284201278741","20081009T05:11:37.000+0000","a7cbc93a-fdd0-40a5-9cc8-35de71b7d18a"
"Chaudoir, M. de","1874","Supplément à l'essai sur les Féronies de l'Australie publié dans le Bulletin des Naturalistes de Moscou en 1865 T. ii, p. 56, Accompangé d'observations sur la synonymie","569-601","","Annali del Museo Civico di Storia Naturale, Genova","","","","<!--MARK--><a href='../../../../publication/015681ce-5643-4a7a-80e5-758d3acd4c99' class='mouseoverHref'>Chaudoir, M. de 1874. Supplément à l'essai sur les Féronies de l'Australie publié dans le Bulletin des Naturalistes de Moscou en 1865 T. ii, p. 56, Accompangé d'observations sur la synonymie.</a> <!--MARK--><!--MARK--><a href='../../../../publication/461059ea-ead7-4f6d-83f4-52913f06d09f' class='mouseoverHref'><em>Annali del Museo Civico di Storia Naturale, Genova</em></a> <strong>6</strong>: 569-601<!--MARK-->","","Article in Journal","015681ce-5643-4a7a-80e5-758d3acd4c99","20170407T02:06:27.416+0000","461059ea-ead7-4f6d-83f4-52913f06d09f"
"Chaudoir, M. de","1878","Descriptions de genres nouveaux et d'espèces inédites de la famille des Carabiques","1-80","","Bulletin de la Société Impériale des Naturalistes de Moscou","","","","<!--MARK--><a href='../../../../publication/dfa5be81-a667-4ed1-8c82-84012af303ba' class='mouseoverHref'>Chaudoir, M. de 1878. Descriptions de genres nouveaux et d'espèces inédites de la famille des Carabiques.</a> <!--MARK--><!--MARK--><a href='../../../../publication/a7cbc93a-fdd0-40a5-9cc8-35de71b7d18a' class='mouseoverHref'><em>Bulletin de la Société Impériale des Naturalistes de Moscou</em></a> <strong>53</strong>(2): 1-80<!--MARK-->","","Article in Journal","dfa5be81-a667-4ed1-8c82-84012af303ba","20081009T05:11:37.000+0000","a7cbc93a-fdd0-40a5-9cc8-35de71b7d18a"
"Chaudoir, M. de","1883","Descriptions de Carabiques nouveaux","17-39","","Coleopteriste Nov","","","","<!--MARK--><a href='../../../../publication/b8fc7ae8-d101-4524-8d13-e37afccd3797' class='mouseoverHref'>Chaudoir, M. de 1883. Descriptions de Carabiques nouveaux.</a> <!--MARK--><!--MARK--><a href='../../../../publication/31f0fdda-d24b-403a-87d4-c28b04165b2f' class='mouseoverHref'><em>Coleopteriste Nov</em></a> <strong>1</strong>: 17-39<!--MARK-->","","Article in Journal","b8fc7ae8-d101-4524-8d13-e37afccd3797","","31f0fdda-d24b-403a-87d4-c28b04165b2f"
"Csiki, E.","1929","Carabidae II: Harpalinae III","347-528","Coleopterorum Catalogus auspiciis et auxilio W. Junk","","","","","<!--MARK--><a href='../../../../publication/0bdfece6-43f8-4a41-9ad6-5d5d72f36911' class='mouseoverHref'>Csiki, E. 1929. Carabidae II: Harpalinae III. pp. 347-528</a> <!--MARK--><em>in</em> <!--MARK--><a href='../../../../publication/1eb1917a-b7ee-4122-b7a3-dd564b35249d' class='mouseoverHref'>Schenkling, S. (ed.). <em>Coleopterorum Catalogus auspiciis et auxilio W. Junk</em>. Berlin : W. Junk Vol. 1 Pars 104.</a><!--MARK--> [Date published 20/Mar/1929]","","Chapter in Book","0bdfece6-43f8-4a41-9ad6-5d5d72f36911","20081009T05:11:37.000+0000","1eb1917a-b7ee-4122-b7a3-dd564b35249d"
"Csiki, E.","1930","Carabidae II: Harpalinae IV","529-738","Coleopterorum Catalogus auspiciis et auxilio W. Junk","","","","","<!--MARK--><a href='../../../../publication/303324d0-f8b7-4bcb-9380-9b58ae5bd958' class='mouseoverHref'>Csiki, E. 1930. Carabidae II: Harpalinae IV. pp. 529-738</a> <!--MARK--><em>in</em> <!--MARK--><a href='../../../../publication/f7bea1ea-f97e-44c2-ad9b-ce24adb03011' class='mouseoverHref'>Schenkling, S. (ed.). <em>Coleopterorum Catalogus auspiciis et auxilio W. Junk</em>. Berlin : W. Junk Vol. 2 Pars 112.</a><!--MARK--> [Date published 3/Jun/1930]","","Chapter in Book","303324d0-f8b7-4bcb-9380-9b58ae5bd958","20081009T05:11:37.000+0000","f7bea1ea-f97e-44c2-ad9b-ce24adb03011"
"Csiki, E.","1931","Carabidae II: Harpalinae V","739-1022","Coelopterorum Catalogus auspiciis et auxilio W. Junk","","","","","<!--MARK--><a href='../../../../publication/53f8dd75-6d44-4684-a2d2-92f8b4f519c4' class='mouseoverHref'>Csiki, E. 1931. Carabidae II: Harpalinae V. pp. 739-1022</a> <!--MARK--><em>in</em> <!--MARK--><a href='../../../../publication/8149855f-7fbf-474f-8f6a-62437cbfc3f8' class='mouseoverHref'>Schenkling, S. (ed.). <em>Coelopterorum Catalogus auspiciis et auxilio W. Junk</em>. Berlin : W. Junk Vol. 2 Pars 115.</a><!--MARK--> [Date published 12/Feb/1931]","","Chapter in Book","53f8dd75-6d44-4684-a2d2-92f8b4f519c4","20081009T05:11:37.000+0000","8149855f-7fbf-474f-8f6a-62437cbfc3f8"
"Darlington, P.J. Jr","1953","Australian carabid beetles II. Some new Pterostichini","90-101","","Psyche (Cambridge)","","","","<!--MARK--><a href='../../../../publication/81451398-d0dd-486f-ad80-a420f8b7cb1c' class='mouseoverHref'>Darlington, P.J. Jr 1953. Australian carabid beetles II. Some new Pterostichini.</a> <!--MARK--><!--MARK--><a href='../../../../publication/e5075c07-9cfd-4699-a945-bae664d3a3e2' class='mouseoverHref'><em>Psyche (Cambridge)</em></a> Camb. <strong>60</strong>: 90-101<!--MARK-->","","Article in Journal","81451398-d0dd-486f-ad80-a420f8b7cb1c","20081009T05:11:37.000+0000","e5075c07-9cfd-4699-a945-bae664d3a3e2"
"Darlington, P.J. Jr","1961","Australian carabid beetles IX. The tropical <i>Notonomus</i>","1-114","","Breviora. Museum of Comparative Zoology","","","","<!--MARK--><a href='../../../../publication/334ec711-d940-4111-885e-c8ce814d74bf' class='mouseoverHref'>Darlington, P.J. Jr 1961. Australian carabid beetles IX. The tropical <i>Notonomus</i>.</a> <!--MARK--><!--MARK--><a href='../../../../publication/b5aca245-716d-4330-9421-57e8fe2d73d8' class='mouseoverHref'><em>Breviora. Museum of Comparative Zoology</em></a> <strong>148</strong>: 1-114<!--MARK-->","","Article in Journal","334ec711-d940-4111-885e-c8ce814d74bf","20081009T05:11:37.000+0000","b5aca245-716d-4330-9421-57e8fe2d73d8"
