"PUB_AUTHOR","PUB_YEAR","PUB_TITLE","PUB_PAGES","PUB_PARENT_BOOK_TITLE","PUB_PARENT_JOURNAL_TITLE","PUB_PARENT_ARTICLE_TITLE","PUB_PUBLICATION_DATE","PUB_PUBLISHER","PUB_FORMATTED","PUB_QUALIFICATION","PUB_TYPE","PUBLICATION_GUID","PUBLICATION_LAST_UPDATE","PARENT_PUBLICATION_GUID"
"Solem, A.","1983","Endodontoid Land Snails from Pacific Islands (Mollusca : Pulmonata : Sigmurethra). Part II. Families Punctidae and Charopidae, Zoogeography","336 pp.","","","","","Field Museum","<!--MARK--><a href='../../../../publication/4512858d-cb64-4a3c-8b11-fcd90c28248f' class='mouseoverHref'>Solem, A. 1983. <em>Endodontoid Land Snails from Pacific Islands (Mollusca : Pulmonata : Sigmurethra). Part II. Families Punctidae and Charopidae, Zoogeography</em>. Chicago : Field Museum 336 pp.</a><!--MARK-->","","Book","4512858d-cb64-4a3c-8b11-fcd90c28248f","20081009T05:11:37.000+0000",""
"Stanisic, J.","1998","Family Punctidae","1096-1097","Mollusca: The Southern Synthesis. Fauna of Australia","","","","","<!--MARK--><a href='../../../../publication/77e5924f-b65c-4bda-8990-c055c604a5b0' class='mouseoverHref'>Stanisic, J. 1998. Family Punctidae. pp. 1096-1097</a> <!--MARK--><em>in</em> <!--MARK--><a href='../../../../publication/87d98901-6c1b-4f4e-a93b-4a39a8d24574' class='mouseoverHref'>Beesley, P.L., Ross, G.J.B. & Wells, A. (eds). <em>Mollusca: The Southern Synthesis. Fauna of Australia</em>. Melbourne : CSIRO Publishing Vol. 5(Part B) pp. vi-viii, 565-1234.</a><!--MARK-->","","Chapter in Book","77e5924f-b65c-4bda-8990-c055c604a5b0","20081009T05:11:37.000+0000","87d98901-6c1b-4f4e-a93b-4a39a8d24574"
"Stanisic, J., Shea, M., Potter, D. & Griffiths, O.","2010","Australian Land Snails. A field guide to eastern Australian species","595 pp","","","","","Bioculture Press","<!--MARK--><a href='../../../../publication/37d959e7-6192-4377-8471-02992874aed5' class='mouseoverHref'>Stanisic, J., Shea, M., Potter, D. & Griffiths, O. 2010. <em>Australian Land Snails. A field guide to eastern Australian species</em>. Mauritius : Bioculture Press Vol. 1 595 pp.</a><!--MARK-->","","Book","37d959e7-6192-4377-8471-02992874aed5","20111201T01:34:04.139+0000",""
"Stanisic, J., Shea, M., Potter, D. & Griffiths, O.","2017","Australian Land Snails. Volume 2. A field guide to southern, central and western species","pp. 580","","","","","Bioculture Press","<!--MARK--><a href='../../../../publication/d73b5e2d-37ec-4d7a-aad5-81b57af16e22' class='mouseoverHref'>Stanisic, J., Shea, M., Potter, D. & Griffiths, O. 2017. <em>Australian Land Snails. Volume 2. A field guide to southern, central and western species</em>. Mauritius : Bioculture Press Vol. 2 pp. 580.</a><!--MARK--> [for nomenclature purposes, all taxa described in this volume must be dated 2018]","for nomenclature purposes, all taxa described in this volume must be dated 2018","Book","d73b5e2d-37ec-4d7a-aad5-81b57af16e22","20181101T04:01:49.630+0000",""
"Stanisic, J. in Stanisic, J., Shea, M., Potter, D. & Griffiths, O.","2010","Australian Land Snails. A field guide to eastern Australian species","595","","","","","Bioculture Press","<!--MARK--><a href='../../../../publication/5d6a2ff2-f6c6-4d87-abf0-b5ad771763c9' class='mouseoverHref'>Stanisic, J. <i>in</i> Stanisic, J., Shea, M., Potter, D. & Griffiths, O. 2010. <em>Australian Land Snails. A field guide to eastern Australian species</em>. Mauritius : Bioculture Press Vol. 1 595 pp.</a><!--MARK-->","","Book","5d6a2ff2-f6c6-4d87-abf0-b5ad771763c9","20130429T01:24:34.846+0000",""
"Suter, H.","1894","Preliminary notes on the relation between the Helicidae of New Zealand, Tasmania, and South Africa","61-65","","Annals and Magazine of Natural History","","","","<!--MARK--><a href='../../../../publication/68d27cdc-5c20-46ab-acd4-0f2b488d1c3c' class='mouseoverHref'>Suter, H. 1894. Preliminary notes on the relation between the Helicidae of New Zealand, Tasmania, and South Africa.</a> <!--MARK--><!--MARK--><a href='../../../../publication/efa8de69-3a29-4a43-8ef2-cbefda205976' class='mouseoverHref'><em>Annals and Magazine of Natural History</em></a> 6 <strong>13</strong>: 61-65<!--MARK-->","","Article in Journal","68d27cdc-5c20-46ab-acd4-0f2b488d1c3c","20081009T05:11:37.000+0000","efa8de69-3a29-4a43-8ef2-cbefda205976"
"Tate, R.","1878","Descriptions of three new species of <i>Helix</i> from South Australia","290-291","","Proceedings of the Linnean Society of New South Wales","","","","<!--MARK--><a href='../../../../publication/e798212a-21a9-4e6e-a4ce-b31877884e13' class='mouseoverHref'>Tate, R. 1878. Descriptions of three new species of <i>Helix</i> from South Australia.</a> <!--MARK--><!--MARK--><a href='../../../../publication/c12cd779-adb5-41ea-bd2c-75f6864cf22e' class='mouseoverHref'><em>Proceedings of the Linnean Society of New South Wales</em></a> <strong>2</strong>: 290-291<!--MARK--> [June 1878]","June 1878","Article in Journal","e798212a-21a9-4e6e-a4ce-b31877884e13","20081009T05:11:37.000+0000","c12cd779-adb5-41ea-bd2c-75f6864cf22e"
"Tate, R.","1894","Brief diagnoses of Mollusca from Central Australia","191-194","","Transactions of the Royal Society of South Australia","","","","<!--MARK--><a href='../../../../publication/3fc274e2-df4d-4a65-9160-e506a86f5938' class='mouseoverHref'>Tate, R. 1894. Brief diagnoses of Mollusca from Central Australia.</a> <!--MARK--><!--MARK--><a href='../../../../publication/8b48b0a3-dd7a-4aea-be0d-10a223710ebc' class='mouseoverHref'><em>Transactions of the Royal Society of South Australia</em></a> <strong>18</strong>: 191-194<!--MARK--> [Nov. 1894]","Nov. 1894","Article in Journal","3fc274e2-df4d-4a65-9160-e506a86f5938","20081009T05:11:37.000+0000","8b48b0a3-dd7a-4aea-be0d-10a223710ebc"
"Tate, R.","1896","Mollusca","181-226","Report on the Work of the Horn Scientific Expedition to Central Australia. Pt 2 Zoology","","","","","<!--MARK--><a href='../../../../publication/c9be9cce-ec19-4a00-896c-592bcacea655' class='mouseoverHref'>Tate, R. 1896. Mollusca. pp. 181-226</a> <!--MARK--><em>in</em> <!--MARK--><a href='../../../../publication/df6e5c3f-9917-409b-82b0-658a4faec337' class='mouseoverHref'>Spencer, W.B. (ed.). <em>Report on the Work of the Horn Scientific Expedition to Central Australia. Pt 2 Zoology</em>. London & Melbourne : Melville, Mullen & Slade.</a><!--MARK--><!--MARK--> [Feb. 1896]","Feb. 1896","Chapter in Book","c9be9cce-ec19-4a00-896c-592bcacea655","20081009T05:11:37.000+0000","df6e5c3f-9917-409b-82b0-658a4faec337"
"Tenison-Woods, J.E.","1877","On a new reversed Tasmanian <i>Helix, Helix weldii</i>","160-161","","Papers and Proceedings of the Royal Society of Tasmania","","","","<!--MARK--><a href='../../../../publication/0e01fa39-0796-4956-8cd5-8935413169ce' class='mouseoverHref'>Tenison-Woods, J.E. 1877. On a new reversed Tasmanian <i>Helix, Helix weldii</i>.</a> <!--MARK--><!--MARK--><a href='../../../../publication/db793adc-ebf2-40c5-9d92-48a121ea03ae' class='mouseoverHref'><em>Papers and Proceedings of the Royal Society of Tasmania</em></a> <strong>1876</strong>: 160-161<!--MARK-->","","Article in Journal","0e01fa39-0796-4956-8cd5-8935413169ce","20081009T05:11:37.000+0000","db793adc-ebf2-40c5-9d92-48a121ea03ae"
"Tenison-Woods, J.E.","1879","On two new species of land shells","123-126","","Proceedings of the Linnean Society of New South Wales","","","","<!--MARK--><a href='../../../../publication/17e981b4-d9ad-4a99-8fc8-5437f2899244' class='mouseoverHref'>Tenison-Woods, J.E. 1879. On two new species of land shells.</a> <!--MARK--><!--MARK--><a href='../../../../publication/c12cd779-adb5-41ea-bd2c-75f6864cf22e' class='mouseoverHref'><em>Proceedings of the Linnean Society of New South Wales</em></a> <strong>3</strong>(2): 123-126<!--MARK--> [27 Feb. 1877]","27 Feb. 1877","Article in Journal","17e981b4-d9ad-4a99-8fc8-5437f2899244","20081009T05:11:37.000+0000","c12cd779-adb5-41ea-bd2c-75f6864cf22e"
