"PUB_AUTHOR","PUB_YEAR","PUB_TITLE","PUB_PAGES","PUB_PARENT_BOOK_TITLE","PUB_PARENT_JOURNAL_TITLE","PUB_PARENT_ARTICLE_TITLE","PUB_PUBLICATION_DATE","PUB_PUBLISHER","PUB_FORMATTED","PUB_QUALIFICATION","PUB_TYPE","PUBLICATION_GUID","PUBLICATION_LAST_UPDATE","PARENT_PUBLICATION_GUID"
"Bonham, K.","2010","First Tasmanian record of the land snail <em>Miselaoma sinistra</em> (Gabriel, 1930) (Eupulmonata: Punctidae)","86-89","","The Tasmanian Naturalist","","","","<!--MARK--><a href='../../../../publication/a13b64a8-13de-4c2d-bb0d-7ff9c75878da' class='mouseoverHref'>Bonham, K. 2010. First Tasmanian record of the land snail <em>Miselaoma sinistra</em> (Gabriel, 1930) (Eupulmonata: Punctidae).</a> <!--MARK--><!--MARK--><a href='../../../../publication/6466bd82-a560-4484-84f4-01ffb58b8140' class='mouseoverHref'><em>The Tasmanian Naturalist</em></a> <strong>132</strong>: 86-89<!--MARK-->","","Article in Journal","a13b64a8-13de-4c2d-bb0d-7ff9c75878da","20131118T22:32:18.702+0000","6466bd82-a560-4484-84f4-01ffb58b8140"
"Bonham, K.J.","1999","Distribution, habitat and conservation status of the land snail <em>Miselaoma weldii</em> (Pulmonata: Punctidae)","2-12","","The Tasmanian Naturalist","","","","<!--MARK--><a href='../../../../publication/836994e2-6841-4911-8ef6-bf5827161a1a' class='mouseoverHref'>Bonham, K.J. 1999. Distribution, habitat and conservation status of the land snail <em>Miselaoma weldii</em> (Pulmonata: Punctidae).</a> <!--MARK--><!--MARK--><a href='../../../../publication/6466bd82-a560-4484-84f4-01ffb58b8140' class='mouseoverHref'><em>The Tasmanian Naturalist</em></a> <strong>121</strong>: 2-12<!--MARK-->","","Article in Journal","836994e2-6841-4911-8ef6-bf5827161a1a","20131118T22:44:04.372+0000","6466bd82-a560-4484-84f4-01ffb58b8140"
"Brazier, J.","1871","Descriptions of ten new species of land shells, collected by Mr W.F. Petterd, of Hobart Town, Tasmania","659-662","","Proceedings of the Zoological Society of London","","","","<!--MARK--><a href='../../../../publication/986d05f0-4397-48a0-97f6-e30504877831' class='mouseoverHref'>Brazier, J. 1871. Descriptions of ten new species of land shells, collected by Mr W.F. Petterd, of Hobart Town, Tasmania.</a> <!--MARK--><!--MARK--><a href='../../../../publication/511f299d-99ec-413c-bc4c-04a380829c96' class='mouseoverHref'><em>Proceedings of the Zoological Society of London</em></a> <strong>1870</strong>: 659-662<!--MARK--> [1 Apr. 1871]","1 Apr. 1871","Article in Journal","986d05f0-4397-48a0-97f6-e30504877831","20081009T05:11:37.000+0000","511f299d-99ec-413c-bc4c-04a380829c96"
"Brazier, J.","1877","Synonymy of and remarks upon Tasmanian and other shells, with their geographical distribution","168-172","","Papers and Proceedings of the Royal Society of Tasmania","","","","<!--MARK--><a href='../../../../publication/afaa8acf-b18e-4436-a15f-a6a42b550a6a' class='mouseoverHref'>Brazier, J. 1877. Synonymy of and remarks upon Tasmanian and other shells, with their geographical distribution.</a> <!--MARK--><!--MARK--><a href='../../../../publication/db793adc-ebf2-40c5-9d92-48a121ea03ae' class='mouseoverHref'><em>Papers and Proceedings of the Royal Society of Tasmania</em></a> <strong>1876</strong>: 168-172<!--MARK--> [27 Feb. 1877]","27 Feb. 1877","Article in Journal","afaa8acf-b18e-4436-a15f-a6a42b550a6a","20081009T05:11:37.000+0000","db793adc-ebf2-40c5-9d92-48a121ea03ae"
"Brook, F.J. & Ablett, J.D.","2019","Type material of land snails (Mollusca: Gastropoda) described from New Zealand by taxonomists in Europe and North America between 1830 and 1934, and the history of research on the New Zealand land snail fauna from 1824 to 1917","1-117","","Zootaxa","","","","<!--MARK--><a href='../../../../publication/d4220e1c-c483-4478-ab28-92975673c050' class='mouseoverHref'>Brook, F.J. & Ablett, J.D. 2019. Type material of land snails (Mollusca: Gastropoda) described from New Zealand by taxonomists in Europe and North America between 1830 and 1934, and the history of research on the New Zealand land snail fauna from 1824 to 1917.</a> <!--MARK--><!--MARK--><a href='../../../../publication/96466227-221c-4922-ac97-1ac2dd946d0a' class='mouseoverHref'><em>Zootaxa</em></a> <strong>4697</strong>: 1-117<!--MARK-->","","Article in Journal","d4220e1c-c483-4478-ab28-92975673c050","20210728T08:00:20.566+0000","96466227-221c-4922-ac97-1ac2dd946d0a"
"Climo, F.M.","1975","XI. The land snail fauna","459-492","Biogeography and Ecology of New Zealand","","","","","<!--MARK--><a href='../../../../publication/c6efff99-fec2-42d4-97d0-6b92d741a814' class='mouseoverHref'>Climo, F.M. 1975. XI. The land snail fauna. pp. 459-492</a> <!--MARK--><em>in</em> <!--MARK--><a href='../../../../publication/eeabf010-1d0c-4c27-bd9f-1b392a11558c' class='mouseoverHref'>Kuschel, G. (ed.). <em>Biogeography and Ecology of New Zealand</em>. Hague : Junk.</a><!--MARK-->","","Chapter in Book","c6efff99-fec2-42d4-97d0-6b92d741a814","20081009T05:11:37.000+0000","eeabf010-1d0c-4c27-bd9f-1b392a11558c"
"Cotton, B.C.","1939","Reports of the Expedition of the McCoy Society for Field Investigation and Research. Mollusca. Part 2: General.","159-176","","Proceedings of the Royal Society of Victoria","","","","<!--MARK--><a href='../../../../publication/357a80e0-949b-4ab7-9459-d06010296870' class='mouseoverHref'>Cotton, B.C. 1939. Reports of the Expedition of the McCoy Society for Field Investigation and Research. Mollusca. Part 2: General.</a> <!--MARK--><!--MARK--><a href='../../../../publication/ce333794-3a02-427f-ba27-346079f1efa0' class='mouseoverHref'><em>Proceedings of the Royal Society of Victoria</em></a> <strong>51</strong>(1): 159-176<!--MARK-->","","Article in Journal","357a80e0-949b-4ab7-9459-d06010296870","20140731T05:49:43.598+0000","ce333794-3a02-427f-ba27-346079f1efa0"
"Cox, J.C.","1864","Catalogue of Australian Land Shells","44 pp.","","","","","John Alex Engel","<!--MARK--><a href='../../../../publication/e053a19a-2546-409c-a36b-d6cea661589d' class='mouseoverHref'>Cox, J.C. 1864. <em>Catalogue of Australian Land Shells</em>. Sydney : John Alex Engel 44 pp.</a><!--MARK-->","","Book","e053a19a-2546-409c-a36b-d6cea661589d","20081009T05:11:37.000+0000",""
"Cox, J.C.","1868","A Monograph of Australian Land Shells","111 pp.","","","","","Maddock","<!--MARK--><a href='../../../../publication/3ae1a722-ea19-4e27-9d91-1b143ac0ebd6' class='mouseoverHref'>Cox, J.C. 1868. <em>A Monograph of Australian Land Shells</em>. Sydney : Maddock 111 pp.</a><!--MARK-->","","Book","3ae1a722-ea19-4e27-9d91-1b143ac0ebd6","20081009T05:11:37.000+0000",""
"Cox, J.C.","1868","On some new species of Australian land shells","722-726","","Proceedings of the Zoological Society of London","","","","<!--MARK--><a href='../../../../publication/90b9785b-1ee9-4e61-b4f6-ce37cd94d7eb' class='mouseoverHref'>Cox, J.C. 1868. On some new species of Australian land shells.</a> <!--MARK--><!--MARK--><a href='../../../../publication/511f299d-99ec-413c-bc4c-04a380829c96' class='mouseoverHref'><em>Proceedings of the Zoological Society of London</em></a> <strong>1867</strong>: 722-726<!--MARK--> [3 Apr. 1868]","3 Apr. 1868","Article in Journal","90b9785b-1ee9-4e61-b4f6-ce37cd94d7eb","20081009T05:11:37.000+0000","511f299d-99ec-413c-bc4c-04a380829c96"
"Cox, J.C.","1872","Descriptions of a new volute and twelve new species of land-shells from Australia","643-647, pl. 52","","Proceedings of the Zoological Society of London","","","","<!--MARK--><a href='../../../../publication/cbe8f185-de5a-48f1-9f1e-8424a216f207' class='mouseoverHref'>Cox, J.C. 1872. Descriptions of a new volute and twelve new species of land-shells from Australia.</a> <!--MARK--><!--MARK--><a href='../../../../publication/511f299d-99ec-413c-bc4c-04a380829c96' class='mouseoverHref'><em>Proceedings of the Zoological Society of London</em></a> <strong>1871</strong>: 643-647, pl. 52<!--MARK--> [2 May 1872]","2 May 1872","Article in Journal","cbe8f185-de5a-48f1-9f1e-8424a216f207","20110713T06:51:45.922+0000","511f299d-99ec-413c-bc4c-04a380829c96"
"Gabriel, C.J.","1930","Catalogue of the land shells of Victoria","62-88","","Proceedings of the Royal Society of Victoria","","","","<!--MARK--><a href='../../../../publication/8f99bd94-0620-4a89-9f20-ff436b249d4b' class='mouseoverHref'>Gabriel, C.J. 1930. Catalogue of the land shells of Victoria.</a> <!--MARK--><!--MARK--><a href='../../../../publication/ce333794-3a02-427f-ba27-346079f1efa0' class='mouseoverHref'><em>Proceedings of the Royal Society of Victoria</em></a> ns <strong>43</strong>: 62-88<!--MARK--> [11 Sept. 1930]","11 Sept. 1930","Article in Journal","8f99bd94-0620-4a89-9f20-ff436b249d4b","20081009T05:11:37.000+0000","ce333794-3a02-427f-ba27-346079f1efa0"
"Hausdorf, B.","2002","Introduced land snails and slugs in Colombia","127-131","","Journal of Molluscan Studies","","","","<!--MARK--><a href='../../../../publication/0a4aefc9-8d68-4271-a611-dadad59f1363' class='mouseoverHref'>Hausdorf, B. 2002. Introduced land snails and slugs in Colombia.</a> <!--MARK--><!--MARK--><a href='../../../../publication/ab2dcbf4-69d4-4856-a216-1b3b84e3501e' class='mouseoverHref'><em>Journal of Molluscan Studies</em></a> <strong>68</strong>(2): 127-131<!--MARK-->","","Article in Journal","0a4aefc9-8d68-4271-a611-dadad59f1363","20210729T08:38:29.148+0000","ab2dcbf4-69d4-4856-a216-1b3b84e3501e"
"Hyman, I.T. & Ponder, W.F.","2010","A morphological phylogenetic analysis and generic revision of Australian Helicarionidae (Gastropoda: Pulmonata: Stylommmatophora), and an assessment of the relationships of the family.","1-148","","Zootaxa","","8 February 2010","","<!--MARK--><a href='../../../../publication/d59d64bb-f2e6-4a54-8209-2f8b89882793' class='mouseoverHref'>Hyman, I.T. & Ponder, W.F. 2010. A morphological phylogenetic analysis and generic revision of Australian Helicarionidae (Gastropoda: Pulmonata: Stylommmatophora), and an assessment of the relationships of the family.</a> <!--MARK--><!--MARK--><a href='../../../../publication/96466227-221c-4922-ac97-1ac2dd946d0a' class='mouseoverHref'><em>Zootaxa</em></a> <strong>2462</strong>: 1-148<!--MARK--> [Date published 8 February 2010]","","Article in Journal","d59d64bb-f2e6-4a54-8209-2f8b89882793","20131024T01:19:44.614+0000","96466227-221c-4922-ac97-1ac2dd946d0a"
"Iredale, T.","1913","The land Mollusca of the Kermadec Islands","364-388","","Proceedings of the Malacological Society of London","","","","<!--MARK--><a href='../../../../publication/19b121d4-2e38-43f8-b49f-146b0be69357' class='mouseoverHref'>Iredale, T. 1913. The land Mollusca of the Kermadec Islands.</a> <!--MARK--><!--MARK--><a href='../../../../publication/872b1d84-0b1e-4517-991d-83251d3517e5' class='mouseoverHref'><em>Proceedings of the Malacological Society of London</em></a> <strong>10</strong>: 364-388<!--MARK--> [Sept. 1913]","Sept. 1913","Article in Journal","19b121d4-2e38-43f8-b49f-146b0be69357","20081009T05:11:37.000+0000","872b1d84-0b1e-4517-991d-83251d3517e5"
"Iredale, T.","1933","Systematic notes on Australian land shells","37-59","","Records of the Australian Museum","","","","<!--MARK--><a href='../../../../publication/eca944c1-2035-48a9-bcc8-fbc935b15309' class='mouseoverHref'>Iredale, T. 1933. Systematic notes on Australian land shells.</a> <!--MARK--><!--MARK--><a href='../../../../publication/7c07530b-0b38-44f5-8f95-368da97d6ac2' class='mouseoverHref'><em>Records of the Australian Museum</em></a> <strong>19</strong>: 37-59<!--MARK-->","","Article in Journal","eca944c1-2035-48a9-bcc8-fbc935b15309","20081009T05:11:37.000+0000","7c07530b-0b38-44f5-8f95-368da97d6ac2"
"Iredale, T.","1937","A basic list of the land Mollusca of Australia","287-333","","The Australian Zoologist","","","","<!--MARK--><a href='../../../../publication/7a57ba72-afcd-4b9c-b723-ba7dfec3ac9e' class='mouseoverHref'>Iredale, T. 1937. A basic list of the land Mollusca of Australia.</a> <!--MARK--><!--MARK--><a href='../../../../publication/48148530-5362-4b4a-a304-7ea21fe0d6b7' class='mouseoverHref'><em>The Australian Zoologist</em></a> <strong>8</strong>: 287-333<!--MARK--> [12 Mar. 1937]","12 Mar. 1937","Article in Journal","7a57ba72-afcd-4b9c-b723-ba7dfec3ac9e","20081009T05:11:37.000+0000","48148530-5362-4b4a-a304-7ea21fe0d6b7"
"Iredale, T.","1937","An annotated check list of the land shells of South and Central Australia","6-59","","South Australian Naturalist","","","","<!--MARK--><a href='../../../../publication/48e3d9bd-4380-4ceb-a7c0-36e885e95b95' class='mouseoverHref'>Iredale, T. 1937. An annotated check list of the land shells of South and Central Australia.</a> <!--MARK--><!--MARK--><a href='../../../../publication/04eef461-9a48-4bfd-bc8e-87cea26af753' class='mouseoverHref'><em>South Australian Naturalist</em></a> <strong>18</strong>: 6-59<!--MARK--> [30 Sept. 1937]","30 Sept. 1937","Article in Journal","48e3d9bd-4380-4ceb-a7c0-36e885e95b95","20081009T05:11:37.000+0000","04eef461-9a48-4bfd-bc8e-87cea26af753"
"Iredale, T.","1939","A review of the land Mollusca of Western Australia","1-88","","Journal of the Royal Society of Western Australia","","","","<!--MARK--><a href='../../../../publication/88a87153-5e22-4b3f-ac6a-0bbb4b343fd5' class='mouseoverHref'>Iredale, T. 1939. A review of the land Mollusca of Western Australia.</a> <!--MARK--><!--MARK--><a href='../../../../publication/666efb8f-4a3f-4a3d-ae40-e9ab98f3cdf5' class='mouseoverHref'><em>Journal of the Royal Society of Western Australia</em></a> <strong>25</strong>: 1-88<!--MARK--> [21 Aug. 1939]","21 Aug. 1939","Article in Journal","88a87153-5e22-4b3f-ac6a-0bbb4b343fd5","20081009T05:11:37.000+0000","666efb8f-4a3f-4a3d-ae40-e9ab98f3cdf5"
"Iredale, T.","1939","A review of the land Mollusca of Western Australia","1-88","","Records of the Western Australian Museum","","","","<!--MARK--><a href='../../../../publication/ee728cb1-c211-4bf3-88c0-7f1a98c83852' class='mouseoverHref'>Iredale, T. 1939. A review of the land Mollusca of Western Australia.</a> <!--MARK--><!--MARK--><a href='../../../../publication/a2cbd1fb-97d5-493a-a1d7-c2b99709890b' class='mouseoverHref'><em>Records of the Western Australian Museum</em></a> <strong>2</strong>(1): 1-88<!--MARK--> [published 1 Aug 1939; same text re-published 21 Aug.1939 in <i>Journal of the Royal Society of Western Australia</i> 25:1-88]","published 1 Aug 1939; same text re-published 21 Aug.1939 in <i>Journal of the Royal Society of Western Australia</i> 25:1-88","Article in Journal","ee728cb1-c211-4bf3-88c0-7f1a98c83852","20130108T22:06:24.141+0000","a2cbd1fb-97d5-493a-a1d7-c2b99709890b"
"Iredale, T.","1941","Guide to the land shells of New South Wales. Pt II","262-269","","Australian Naturalist","","","","<!--MARK--><a href='../../../../publication/c6294c77-a995-458d-a54f-68891f344b8d' class='mouseoverHref'>Iredale, T. 1941. Guide to the land shells of New South Wales. Pt II.</a> <!--MARK--><!--MARK--><a href='../../../../publication/3a064dc1-fa80-49dd-8964-bb1d7a6449b0' class='mouseoverHref'><em>Australian Naturalist</em></a> <strong>10</strong>: 262-269<!--MARK-->","","Article in Journal","c6294c77-a995-458d-a54f-68891f344b8d","20081009T05:11:37.000+0000","3a064dc1-fa80-49dd-8964-bb1d7a6449b0"
"Iredale, T.","1944","The land Mollusca of Lord Howe Island","299-334","","The Australian Zoologist","","","","<!--MARK--><a href='../../../../publication/f7e20047-f50a-43ae-aae5-0e3481aec3d8' class='mouseoverHref'>Iredale, T. 1944. The land Mollusca of Lord Howe Island.</a> <!--MARK--><!--MARK--><a href='../../../../publication/48148530-5362-4b4a-a304-7ea21fe0d6b7' class='mouseoverHref'><em>The Australian Zoologist</em></a> <strong>10</strong>: 299-334<!--MARK--> [10 May 1944]","10 May 1944","Article in Journal","f7e20047-f50a-43ae-aae5-0e3481aec3d8","20081009T05:11:37.000+0000","48148530-5362-4b4a-a304-7ea21fe0d6b7"
"Iredale, T.","1945","The land Mollusca of Norfolk Island","46-71","","The Australian Zoologist","","","","<!--MARK--><a href='../../../../publication/2425f2e0-2bf7-48af-ace7-4f3ceeb0c5cf' class='mouseoverHref'>Iredale, T. 1945. The land Mollusca of Norfolk Island.</a> <!--MARK--><!--MARK--><a href='../../../../publication/48148530-5362-4b4a-a304-7ea21fe0d6b7' class='mouseoverHref'><em>The Australian Zoologist</em></a> <strong>11</strong>: 46-71<!--MARK-->","","Article in Journal","2425f2e0-2bf7-48af-ace7-4f3ceeb0c5cf","20081009T05:11:37.000+0000","48148530-5362-4b4a-a304-7ea21fe0d6b7"
"Kershaw, R.C.","1957","Miscellaneous notes on land Mollusca","97-100","","Victorian Naturalist","","","","<!--MARK--><a href='../../../../publication/bfd9d8b8-eb17-4443-8f87-235266084b46' class='mouseoverHref'>Kershaw, R.C. 1957. Miscellaneous notes on land Mollusca.</a> <!--MARK--><!--MARK--><a href='../../../../publication/97b8093b-d60f-43a6-94fc-97de34f03b6b' class='mouseoverHref'><em>Victorian Naturalist</em></a> <strong>74</strong>: 97-100<!--MARK-->","","Article in Journal","bfd9d8b8-eb17-4443-8f87-235266084b46","20081009T05:11:37.000+0000","97b8093b-d60f-43a6-94fc-97de34f03b6b"
"Kershaw, R.C.","1975","A note on <i>Discocharpoa insularis</i> Cotton, 1938","65-66","","South Australian Naturalist","","","","<!--MARK--><a href='../../../../publication/fc5b116f-2e0c-4b6a-99ab-6eda618bf059' class='mouseoverHref'>Kershaw, R.C. 1975. A note on <i>Discocharpoa insularis</i> Cotton, 1938.</a> <!--MARK--><!--MARK--><a href='../../../../publication/04eef461-9a48-4bfd-bc8e-87cea26af753' class='mouseoverHref'><em>South Australian Naturalist</em></a> <strong>49</strong>: 65-66<!--MARK-->","","Article in Journal","fc5b116f-2e0c-4b6a-99ab-6eda618bf059","20081009T05:11:37.000+0000","04eef461-9a48-4bfd-bc8e-87cea26af753"
"Kershaw, R.C. & Smith, B.J.","1986","Description of two punctid snail genera from Tasmania (Mollusca : Pulmonata)","16-18","","Victorian Naturalist","","","","<!--MARK--><a href='../../../../publication/bf6026d1-cfc0-4e74-8875-40c68e28adbb' class='mouseoverHref'>Kershaw, R.C. & Smith, B.J. 1986. Description of two punctid snail genera from Tasmania (Mollusca : Pulmonata).</a> <!--MARK--><!--MARK--><a href='../../../../publication/97b8093b-d60f-43a6-94fc-97de34f03b6b' class='mouseoverHref'><em>Victorian Naturalist</em></a> <strong>103</strong>: 16-18<!--MARK-->","","Article in Journal","bf6026d1-cfc0-4e74-8875-40c68e28adbb","20081009T05:11:37.000+0000","97b8093b-d60f-43a6-94fc-97de34f03b6b"
"Legrand, W.","1871","Collections for a Monograph of Tasmanian Land Shells","","","","","","W. Legrand (without page numbers)","<!--MARK--><a href='../../../../publication/ca191c05-18ad-4472-a283-3eeb34138ce1' class='mouseoverHref'>Legrand, W. 1871. <em>Collections for a Monograph of Tasmanian Land Shells</em>. Hobart : W. Legrand (without page numbers).</a><!--MARK--> [Sept. 1871]","Sept. 1871","Book","ca191c05-18ad-4472-a283-3eeb34138ce1","20081009T05:11:37.000+0000",""
"Neubert, E. & Gosteli, M.","2003","The molluscan species described by Robert James Shuttleworth. I. Gastropoda: Pulmonata","1-123","","Contributions to Natural History, Bern","","","","<!--MARK--><a href='../../../../publication/bd2e2705-ed4d-4d08-8869-1b0a06111005' class='mouseoverHref'>Neubert, E. & Gosteli, M. 2003. The molluscan species described by Robert James Shuttleworth. I. Gastropoda: Pulmonata.</a> <!--MARK--><!--MARK--><a href='../../../../publication/9f037a26-b9dc-49fc-be12-1d2cb3dbd42f' class='mouseoverHref'><em>Contributions to Natural History, Bern</em></a> <strong>2003</strong>(1): 1-123<!--MARK-->","","Article in Journal","bd2e2705-ed4d-4d08-8869-1b0a06111005","20210728T07:45:19.200+0000","9f037a26-b9dc-49fc-be12-1d2cb3dbd42f"
"Petterd, W.F.","1879","A Monograph of the Land Shells of Tasmania","vi 55 pp.","","","","","privately published","<!--MARK--><a href='../../../../publication/88871dfc-d2c8-4a27-b501-d02ffb42b77c' class='mouseoverHref'>Petterd, W.F. 1879. <em>A Monograph of the Land Shells of Tasmania</em>. Launceston : privately published vi 55 pp.</a><!--MARK--> [Apr. 1879]","Apr. 1879","Book","88871dfc-d2c8-4a27-b501-d02ffb42b77c","20081009T05:11:37.000+0000",""
"Petterd, W.F.","1902","On some land and aquatic shells from Maria Island","1-2","","Papers and Proceedings of the Royal Society of Tasmania","","","","<!--MARK--><a href='../../../../publication/83b4fda8-c8a2-475d-8529-ab57687f3dca' class='mouseoverHref'>Petterd, W.F. 1902. On some land and aquatic shells from Maria Island.</a> <!--MARK--><!--MARK--><a href='../../../../publication/db793adc-ebf2-40c5-9d92-48a121ea03ae' class='mouseoverHref'><em>Papers and Proceedings of the Royal Society of Tasmania</em></a> <strong>1900-1901</strong>: 1-2<!--MARK--> [June 1902]","June 1902","Article in Journal","83b4fda8-c8a2-475d-8529-ab57687f3dca","20081009T05:11:37.000+0000","db793adc-ebf2-40c5-9d92-48a121ea03ae"
"Preston, H.B.","1913","Characters of new genera and species of terrestrial Mollusca from Norfolk Island","522-538","","Annals and Magazine of Natural History","","","","<!--MARK--><a href='../../../../publication/a8714759-b3cf-4e54-9e84-3a4ad7b1c727' class='mouseoverHref'>Preston, H.B. 1913. Characters of new genera and species of terrestrial Mollusca from Norfolk Island.</a> <!--MARK--><!--MARK--><a href='../../../../publication/efa8de69-3a29-4a43-8ef2-cbefda205976' class='mouseoverHref'><em>Annals and Magazine of Natural History</em></a> 8 <strong>12</strong>: 522-538<!--MARK--> [1 Dec. 1913]","1 Dec. 1913","Article in Journal","a8714759-b3cf-4e54-9e84-3a4ad7b1c727","20081009T05:11:37.000+0000","efa8de69-3a29-4a43-8ef2-cbefda205976"
"Reeve, L.A.","1851","Monograph of the genus <i>Helix</i> pls 16-62, 133","","Conchologia Iconica","","","","","<!--MARK--><a href='../../../../publication/105ad7a6-857a-40a3-95c4-dd39c8fd8a08' class='mouseoverHref'>Reeve, L.A. 1851. Monograph of the genus <i>Helix</i> pls 16-62, 133.</a> <!--MARK--><em>In,</em> <!--MARK--><a href='../../../../publication/59e33c7e-ae2e-4e28-9554-bf88be415bfb' class='mouseoverHref'>Reeve, L.A. (ed.). <em>Conchologia Iconica</em>. London : L. Reeve & Co. Vol. 7.</a><!--MARK-->","","Chapter in Book","105ad7a6-857a-40a3-95c4-dd39c8fd8a08","20081009T05:11:37.000+0000","59e33c7e-ae2e-4e28-9554-bf88be415bfb"
"Shea, M. & Griffiths, O. in Stanisic, J., Shea, M., Potter, D. & Griffiths, O.","2010","Australian Land Snails. A field guide to eastern Australian species","595","","","","","Bioculture Press","<!--MARK--><a href='../../../../publication/64b8983d-84fb-4a23-a1a6-29e24156f73a' class='mouseoverHref'>Shea, M. & Griffiths, O. <i>in</i> Stanisic, J., Shea, M., Potter, D. & Griffiths, O. 2010. <em>Australian Land Snails. A field guide to eastern Australian species</em>. Mauritius : Bioculture Press Vol. 1 595 pp.</a><!--MARK-->","","Book","64b8983d-84fb-4a23-a1a6-29e24156f73a","20111201T01:25:29.764+0000",""
"Shea, M. pers. comm.","","The Australian Faunal Directory","","","","","","","<!--MARK--><a href='../../../../publication/366c0ae9-5786-434d-89ca-3e8b957b72bd' class='mouseoverHref'>Shea, M. pers. comm. The Australian Faunal Directory,</a> <!--MARK--><a href=http://biodiversity.org.au/afd>http://biodiversity.org.au/afd</a>","","This Work","366c0ae9-5786-434d-89ca-3e8b957b72bd","20200430T12:39:05.171+0000",""
"Shuttleworth, R.J.","1852","Diagnosen einiger neuen Mollusken aus den Canarischen Inseln.","137-146","","Mittheilungen der Naturforschenden Gesellschaft in Bern","","","","<!--MARK--><a href='../../../../publication/d84880e9-47ea-49f2-9061-5b8ebf32b7eb' class='mouseoverHref'>Shuttleworth, R.J. 1852. Diagnosen einiger neuen Mollusken aus den Canarischen Inseln.</a> <!--MARK--><!--MARK--><a href='../../../../publication/73dc6fa8-9b73-4f49-93de-94cfd4cdf9c6' class='mouseoverHref'><em>Mittheilungen der Naturforschenden Gesellschaft in Bern</em></a> <strong>1852</strong>(241-242): 137-146<!--MARK-->","","Article in Journal","d84880e9-47ea-49f2-9061-5b8ebf32b7eb","20210728T05:02:36.203+0000","73dc6fa8-9b73-4f49-93de-94cfd4cdf9c6"
"Smith, B.J.","1992","Non-Marine Mollusca","","Zoological Catalogue of Australia. Non-marine Mollusca","","","","","<!--MARK--><a href='../../../../publication/f13cacb9-41e4-4483-b65a-152b69675868' class='mouseoverHref'>Smith, B.J. 1992. Non-Marine Mollusca.</a> <!--MARK--><em>In,</em> <!--MARK--><a href='../../../../publication/e4f01bff-8661-43ef-bddd-e8ae1f29113f' class='mouseoverHref'>Houston, W.W.K. (ed.). <em>Zoological Catalogue of Australia. Non-marine Mollusca</em>. Canberra : Australian Government Publishing Service Vol. 8 xii 408 pp.</a><!--MARK-->","","Chapter in Book","f13cacb9-41e4-4483-b65a-152b69675868","20081009T05:11:37.000+0000","e4f01bff-8661-43ef-bddd-e8ae1f29113f"
"Smith, B.J. & Kershaw, R.C.","1979","Field Guide to the Non-marine Molluscs of South-eastern Australia","285 pp.","","","","","A.N.U. Press","<!--MARK--><a href='../../../../publication/599da9ca-6e11-4108-84b4-4454c9d14e76' class='mouseoverHref'>Smith, B.J. & Kershaw, R.C. 1979. <em>Field Guide to the Non-marine Molluscs of South-eastern Australia</em>. Canberra : A.N.U. Press 285 pp.</a><!--MARK-->","","Book","599da9ca-6e11-4108-84b4-4454c9d14e76","20120426T04:15:40.275+0000",""
"Smith, B.J & Kershaw, R.C.","1981","Tasmanian land and freshwater molluscs.","148 pp.","","","","","University of Tasmania","<!--MARK--><a href='../../../../publication/fa274114-88aa-496d-a7f6-f66ac4aa7d99' class='mouseoverHref'>Smith, B.J & Kershaw, R.C. 1981. <em>Tasmanian land and freshwater molluscs</em>. <em>Fauna of Tasmania Handbook no. 5</em> Hobart : University of Tasmania 148 pp.</a><!--MARK-->","","Book","fa274114-88aa-496d-a7f6-f66ac4aa7d99","20131029T01:02:44.945+0000",""
