"PUB_AUTHOR","PUB_YEAR","PUB_TITLE","PUB_PAGES","PUB_PARENT_BOOK_TITLE","PUB_PARENT_JOURNAL_TITLE","PUB_PARENT_ARTICLE_TITLE","PUB_PUBLICATION_DATE","PUB_PUBLISHER","PUB_FORMATTED","PUB_QUALIFICATION","PUB_TYPE","PUBLICATION_GUID","PUBLICATION_LAST_UPDATE","PARENT_PUBLICATION_GUID"
"Cimerman, F. & Langer, M.","1991","Mediterranean foraminifera","","","","","","Slovenska Akademija Znanosti in Umetnosti","<!--MARK--><a href='../../../../publication/4dbefd03-cddf-4ec3-850d-56b3f125d70e' class='mouseoverHref'>Cimerman, F. & Langer, M. 1991. <em>Mediterranean foraminifera</em>. Ljubljana : Slovenska Akademija Znanosti in Umetnosti.</a><!--MARK-->","","Book","4dbefd03-cddf-4ec3-850d-56b3f125d70e","20160330T01:41:24.708+0000",""
"Claparède, E. & Lachmann, J.","1859","Etudes sur les infusoires et les rhizopodes.","261-482, Pl. 14-24","","Mémoires de l'Institut National Genevois","","","","<!--MARK--><a href='../../../../publication/a18da099-1ea6-4263-8599-731801ca3974' class='mouseoverHref'>Claparède, E. & Lachmann, J. 1859. Etudes sur les infusoires et les rhizopodes.</a> <!--MARK--><!--MARK--><a href='../../../../publication/7803046d-04fa-42df-a81b-b8070da7673b' class='mouseoverHref'><em>Mémoires de l'Institut National Genevois</em></a> <strong>6</strong>(1858): 261-482, Pl. 14-24<!--MARK--> [second part]","second part","Article in Journal","a18da099-1ea6-4263-8599-731801ca3974","20181018T03:01:12.188+0000","7803046d-04fa-42df-a81b-b8070da7673b"
"Collins, A.C.","1958","Foraminifera","335-437","","British Museum (Natural History) Great Barrier Reef Expedition Scientific Reports","","","","<!--MARK--><a href='../../../../publication/b6d65018-b50d-4c82-afa0-60e16dcdc762' class='mouseoverHref'>Collins, A.C. 1958. Foraminifera.</a> <!--MARK--><!--MARK--><a href='../../../../publication/6a8a313a-2a38-414f-a9cf-39ac4db5a549' class='mouseoverHref'><em>British Museum (Natural History) Great Barrier Reef Expedition Scientific Reports</em></a> <strong>6</strong>: 335-437<!--MARK-->","","Article in Journal","b6d65018-b50d-4c82-afa0-60e16dcdc762","20160111T05:40:30.536+0000","6a8a313a-2a38-414f-a9cf-39ac4db5a549"
"Collins, A.C.","1974","Port Phillip survey 1957-63. Foraminifera","1-61","","Memoirs of the National Museum of Victoria, Melbourne","","","","<!--MARK--><a href='../../../../publication/acc0f730-7fa8-48e4-baf2-2d33b4f7da4c' class='mouseoverHref'>Collins, A.C. 1974. Port Phillip survey 1957-63. Foraminifera.</a> <!--MARK--><!--MARK--><a href='../../../../publication/6d019674-04b0-4fab-8903-0612d147ec4d' class='mouseoverHref'><em>Memoirs of the National Museum of Victoria, Melbourne</em></a> <strong>35</strong>: 1-61<!--MARK-->","","Article in Journal","acc0f730-7fa8-48e4-baf2-2d33b4f7da4c","20181018T22:07:44.744+0000","6d019674-04b0-4fab-8903-0612d147ec4d"
"Cushman, J.A.","1910","A monograph of the foraminifera of the North Pacific Ocean. Part 1. Astrorhizidae and Lituolidae","1-134","","Bulletin of the United States National Museum","","","","<!--MARK--><a href='../../../../publication/76e642e7-96f2-4864-aff1-69a1b80c17e1' class='mouseoverHref'>Cushman, J.A. 1910. A monograph of the foraminifera of the North Pacific Ocean. Part 1. Astrorhizidae and Lituolidae.</a> <!--MARK--><!--MARK--><a href='../../../../publication/d62694e9-c583-45e9-aa41-f40b5d5fc778' class='mouseoverHref'><em>Bulletin of the United States National Museum</em></a> <strong>71</strong>(1): 1-134<!--MARK-->","","Article in Journal","76e642e7-96f2-4864-aff1-69a1b80c17e1","20160111T05:33:35.288+0000","d62694e9-c583-45e9-aa41-f40b5d5fc778"
"Cushman, J.A.","1915","A monograph of the foraminifera of the North Pacific Ocean. Part V: Rotaliidae","1-87","","United States National Museum Bulletin","","","","<!--MARK--><a href='../../../../publication/e0a77d17-b366-4bbe-a227-e35f942fb897' class='mouseoverHref'>Cushman, J.A. 1915. A monograph of the foraminifera of the North Pacific Ocean. Part V: Rotaliidae.</a> <!--MARK--><!--MARK--><a href='../../../../publication/aeaf76dd-a2f8-4bdf-b582-e911ff8a7df3' class='mouseoverHref'><em>United States National Museum Bulletin</em></a> <strong>71</strong>(4): 1-87<!--MARK-->","","Article in Journal","e0a77d17-b366-4bbe-a227-e35f942fb897","20181023T01:50:06.617+0000","aeaf76dd-a2f8-4bdf-b582-e911ff8a7df3"
"Cushman, J.A.","1917","A monograph of the Foraminifera of the North Pacific Ocean. Part. VI: Miliolidae.","1-108","","United States National Museum Bulletin","","","","<!--MARK--><a href='../../../../publication/459779b7-3e8c-4a37-a180-9125d9a85f71' class='mouseoverHref'>Cushman, J.A. 1917. A monograph of the Foraminifera of the North Pacific Ocean. Part. VI: Miliolidae.</a> <!--MARK--><!--MARK--><a href='../../../../publication/aeaf76dd-a2f8-4bdf-b582-e911ff8a7df3' class='mouseoverHref'><em>United States National Museum Bulletin</em></a> <strong>71</strong>(6): 1-108<!--MARK-->","","Article in Journal","459779b7-3e8c-4a37-a180-9125d9a85f71","20180911T05:12:14.694+0000","aeaf76dd-a2f8-4bdf-b582-e911ff8a7df3"
"Cushman, J.A.","1921","Foraminifera of the Philippine and adjacent seas","1-608","","Bulletin of the United States National Museum","","","","<!--MARK--><a href='../../../../publication/b9d7dbb2-644a-4a06-b89b-26f6910d0c0b' class='mouseoverHref'>Cushman, J.A. 1921. Foraminifera of the Philippine and adjacent seas.</a> <!--MARK--><!--MARK--><a href='../../../../publication/d62694e9-c583-45e9-aa41-f40b5d5fc778' class='mouseoverHref'><em>Bulletin of the United States National Museum</em></a> <strong>100</strong>: 1-608<!--MARK-->","","Article in Journal","b9d7dbb2-644a-4a06-b89b-26f6910d0c0b","20160113T04:10:11.891+0000","d62694e9-c583-45e9-aa41-f40b5d5fc778"
"Cushman, J.A.","1924","Samoan Foraminifera","pp. 1-85","","","","","","<!--MARK--><a href='../../../../publication/af1a9ac3-43f7-4414-9bd4-073871e77574' class='mouseoverHref'>Cushman, J.A. 1924. Samoan Foraminifera. Publications of the Carnegie Institution of Washington, no 342, Department of Marine Biology Papers. 21. pp. 1-85</a>","","Miscellaneous","af1a9ac3-43f7-4414-9bd4-073871e77574","20160112T02:43:57.932+0000",""
"Cushman, J.A.","1927","An outline of a re-classification of the Foraminifera","1-105","","Contributions from the Cushman Laboratory for Foraminiferal Research","","","","<!--MARK--><a href='../../../../publication/2ca2ff58-e501-48d2-9e24-5694cc0f8319' class='mouseoverHref'>Cushman, J.A. 1927. An outline of a re-classification of the Foraminifera.</a> <!--MARK--><!--MARK--><a href='../../../../publication/02c63200-f5f0-4666-a0fa-863554a0aeb2' class='mouseoverHref'><em>Contributions from the Cushman Laboratory for Foraminiferal Research</em></a> <strong>3</strong>(1): 1-105<!--MARK-->","","Article in Journal","2ca2ff58-e501-48d2-9e24-5694cc0f8319","20181011T03:39:47.763+0000","02c63200-f5f0-4666-a0fa-863554a0aeb2"
"Cushman, J.A.","1927","Some new genera of the Foraminifera","77-81","","Contributions from the Cushman Laboratory for Foraminiferal Research","","","","<!--MARK--><a href='../../../../publication/c5b2faab-0de5-417a-8fc8-4d63bc674a1c' class='mouseoverHref'>Cushman, J.A. 1927. Some new genera of the Foraminifera.</a> <!--MARK--><!--MARK--><a href='../../../../publication/02c63200-f5f0-4666-a0fa-863554a0aeb2' class='mouseoverHref'><em>Contributions from the Cushman Laboratory for Foraminiferal Research</em></a> <strong>2</strong>(4): 77-81<!--MARK-->","","Article in Journal","c5b2faab-0de5-417a-8fc8-4d63bc674a1c","20181011T03:38:32.854+0000","02c63200-f5f0-4666-a0fa-863554a0aeb2"
"Cushman, J.A.","1928","Additional genera of foraminfera","1-8","","Contributions from the Cushman Laboratory for Foraminiferal Research","","","","<!--MARK--><a href='../../../../publication/8efb7e4f-aaf4-4e7d-8c0e-f873635bc2b6' class='mouseoverHref'>Cushman, J.A. 1928. Additional genera of foraminfera.</a> <!--MARK--><!--MARK--><a href='../../../../publication/02c63200-f5f0-4666-a0fa-863554a0aeb2' class='mouseoverHref'><em>Contributions from the Cushman Laboratory for Foraminiferal Research</em></a> <strong>4</strong>(1): 1-8<!--MARK-->","","Article in Journal","8efb7e4f-aaf4-4e7d-8c0e-f873635bc2b6","20181023T01:25:15.891+0000","02c63200-f5f0-4666-a0fa-863554a0aeb2"
"Cushman, J.A.","1929","The genus <em>Trimosina</em> and its relationships to other genera of the Foraminifera","155-159","","Journal of the Washington Academy of Sciences","","","","<!--MARK--><a href='../../../../publication/d71cdb1a-7e34-4f2e-8b1e-3307dad96e2d' class='mouseoverHref'>Cushman, J.A. 1929. The genus <em>Trimosina</em> and its relationships to other genera of the Foraminifera.</a> <!--MARK--><!--MARK--><a href='../../../../publication/ba6795b3-056d-49fe-8d9a-6b51e798e280' class='mouseoverHref'><em>Journal of the Washington Academy of Sciences</em></a> <strong>19</strong>(8): 155-159<!--MARK-->","","Article in Journal","d71cdb1a-7e34-4f2e-8b1e-3307dad96e2d","20181016T05:54:15.883+0000","ba6795b3-056d-49fe-8d9a-6b51e798e280"
"Cushman, J.A.","1931","The foraminifera of the Atlantic Ocean. Part VIII. Rotaliidae, Amphisteginidae, Calcarinidae, Cymbaloporettidae, Globorotaliidae, Anomalinidae, Planorbulinidae, Rupertiidae and Homotremidae","1-179","","United States National Museum Bulletin","","","","<!--MARK--><a href='../../../../publication/b3132353-00af-4e3a-95ce-172a70b88550' class='mouseoverHref'>Cushman, J.A. 1931. The foraminifera of the Atlantic Ocean. Part VIII. Rotaliidae, Amphisteginidae, Calcarinidae, Cymbaloporettidae, Globorotaliidae, Anomalinidae, Planorbulinidae, Rupertiidae and Homotremidae.</a> <!--MARK--><!--MARK--><a href='../../../../publication/aeaf76dd-a2f8-4bdf-b582-e911ff8a7df3' class='mouseoverHref'><em>United States National Museum Bulletin</em></a> <strong>104</strong>(8): 1-179<!--MARK-->","","Article in Journal","b3132353-00af-4e3a-95ce-172a70b88550","20180914T04:55:03.410+0000","aeaf76dd-a2f8-4bdf-b582-e911ff8a7df3"
"Cushman, J.A.","1933","Some new foraminiferal genera","32-38","","Contributions from the Cushman Laboratory for Foraminiferal Research","","","","<!--MARK--><a href='../../../../publication/cf1217c7-03e0-4516-a6e4-bfaf91b698ee' class='mouseoverHref'>Cushman, J.A. 1933. Some new foraminiferal genera.</a> <!--MARK--><!--MARK--><a href='../../../../publication/02c63200-f5f0-4666-a0fa-863554a0aeb2' class='mouseoverHref'><em>Contributions from the Cushman Laboratory for Foraminiferal Research</em></a> <strong>9</strong>: 32-38<!--MARK-->","","Article in Journal","cf1217c7-03e0-4516-a6e4-bfaf91b698ee","20180911T01:02:55.599+0000","02c63200-f5f0-4666-a0fa-863554a0aeb2"
"Cushman, J.A.","1942","A report on samples obtained by the boring at Heron Island, Great Barrier Reef, Australia. In: Richards, H.C. & Hill, D. (Eds.), Great Barrier Reef bores, 1926 and 1937, descriptions, analyses and interpretations. Government Printer, Brisbane","122 pp.","","","","","","<!--MARK--><a href='../../../../publication/c78bb3b9-ea77-40a9-895b-8dcacea0ac00' class='mouseoverHref'>Cushman, J.A. 1942. A report on samples obtained by the boring at Heron Island, Great Barrier Reef, Australia. In: Richards, H.C. & Hill, D. (Eds.), Great Barrier Reef bores, 1926 and 1937, descriptions, analyses and interpretations. Government Printer, Brisbane. 122 pp.</a>","","Miscellaneous","c78bb3b9-ea77-40a9-895b-8dcacea0ac00","20181009T05:57:54.441+0000",""
"Cushman, J.A.","1944","The genus <em>Articulina</em> and its species","1-21","","Cushman Foundation for Foraminiferal Research Special Publications","","","","<!--MARK--><a href='../../../../publication/0a002cbb-62ad-4303-9c9c-a77d3e90bbb9' class='mouseoverHref'>Cushman, J.A. 1944. The genus <em>Articulina</em> and its species.</a> <!--MARK--><!--MARK--><a href='../../../../publication/3d52a75f-30ae-4982-afe7-4f50bee56908' class='mouseoverHref'><em>Cushman Foundation for Foraminiferal Research Special Publications</em></a> <strong>10</strong>: 1-21<!--MARK-->","","Article in Journal","0a002cbb-62ad-4303-9c9c-a77d3e90bbb9","20180914T04:47:02.723+0000","3d52a75f-30ae-4982-afe7-4f50bee56908"
"Cushman, J.A.","1946","The genus <em>Hauerina</em> and its species","2-15","","Contributions from the Cushman Laboratory for Foraminiferal Research","","","","<!--MARK--><a href='../../../../publication/a9c571d2-0a6e-4b1a-b4c1-59c44f26c157' class='mouseoverHref'>Cushman, J.A. 1946. The genus <em>Hauerina</em> and its species.</a> <!--MARK--><!--MARK--><a href='../../../../publication/02c63200-f5f0-4666-a0fa-863554a0aeb2' class='mouseoverHref'><em>Contributions from the Cushman Laboratory for Foraminiferal Research</em></a> <strong>22</strong>: 2-15<!--MARK-->","","Article in Journal","a9c571d2-0a6e-4b1a-b4c1-59c44f26c157","20180911T02:33:32.480+0000","02c63200-f5f0-4666-a0fa-863554a0aeb2"
"Cushman, J.A., Todd, R. & Post, R.J.","1954","Recent Foraminifera of the Marshall Islands: Bikini and Nearby Atolls, Part 2, Oceanography (Biologic)","319-379","","United States Geological Survey Professional Papers","","","","<!--MARK--><a href='../../../../publication/5936ecbc-b30f-4b7b-9496-cb5b426d0c02' class='mouseoverHref'>Cushman, J.A., Todd, R. & Post, R.J. 1954. Recent Foraminifera of the Marshall Islands: Bikini and Nearby Atolls, Part 2, Oceanography (Biologic).</a> <!--MARK--><!--MARK--><a href='../../../../publication/c1438109-06f7-46ce-965c-9dc38c85d846' class='mouseoverHref'><em>United States Geological Survey Professional Papers</em></a> <strong>260-H</strong>: 319-379<!--MARK-->","","Article in Journal","5936ecbc-b30f-4b7b-9496-cb5b426d0c02","20160113T00:32:02.577+0000","c1438109-06f7-46ce-965c-9dc38c85d846"
"Cushman, J.A. & Hanzawa, S.","1937","Notes on some of the species referred to <em>Vertebralina</em> and <em>Articulina</em>, and a new genus <em>Nodobaculariella</em>","41-46","","Contributions from the Cushman Laboratory for Foraminiferal Research","","","","<!--MARK--><a href='../../../../publication/d2a5d5d1-9814-4460-aae9-db3e785bc456' class='mouseoverHref'>Cushman, J.A. & Hanzawa, S. 1937. Notes on some of the species referred to <em>Vertebralina</em> and <em>Articulina</em>, and a new genus <em>Nodobaculariella</em>.</a> <!--MARK--><!--MARK--><a href='../../../../publication/02c63200-f5f0-4666-a0fa-863554a0aeb2' class='mouseoverHref'><em>Contributions from the Cushman Laboratory for Foraminiferal Research</em></a> <strong>13</strong>(2): 41-46<!--MARK-->","","Article in Journal","d2a5d5d1-9814-4460-aae9-db3e785bc456","20180911T01:00:02.339+0000","02c63200-f5f0-4666-a0fa-863554a0aeb2"
"Cushman, J.A. & McCulloch, I.","1939","A report on some arenaceous Foraminifera","1-113","","Allan Hancock Pacific Expeditions","","","","<!--MARK--><a href='../../../../publication/dd7d99db-4374-4bf9-a2ac-a3e5a52bd8a6' class='mouseoverHref'>Cushman, J.A. & McCulloch, I. 1939. A report on some arenaceous Foraminifera.</a> <!--MARK--><!--MARK--><a href='../../../../publication/65abe1e1-075e-4237-a31f-35f7d153ebbc' class='mouseoverHref'><em>Allan Hancock Pacific Expeditions</em></a> <strong>6</strong>: 1-113<!--MARK-->","","Article in Journal","dd7d99db-4374-4bf9-a2ac-a3e5a52bd8a6","20160112T00:39:21.756+0000","65abe1e1-075e-4237-a31f-35f7d153ebbc"
"Cushman, J.A. & Ozawa, Y.","1928","An outline of a revision of the Polymorphinidae","13-22","","Contributions from the Cushman Laboratory for Foraminiferal Research","","","","<!--MARK--><a href='../../../../publication/3664bc2d-dce3-4c0b-aff4-ec9c73c2dc81' class='mouseoverHref'>Cushman, J.A. & Ozawa, Y. 1928. An outline of a revision of the Polymorphinidae.</a> <!--MARK--><!--MARK--><a href='../../../../publication/02c63200-f5f0-4666-a0fa-863554a0aeb2' class='mouseoverHref'><em>Contributions from the Cushman Laboratory for Foraminiferal Research</em></a> <strong>4</strong>(1): 13-22<!--MARK-->","","Article in Journal","3664bc2d-dce3-4c0b-aff4-ec9c73c2dc81","20181011T03:35:13.741+0000","02c63200-f5f0-4666-a0fa-863554a0aeb2"
"Cushman, J.A. & Todd, R.","1944","The genus <em>Spiroloculina</em> and its species","1-82","","Cushman Foundation for Foraminiferal Research Special Publications","","","","<!--MARK--><a href='../../../../publication/16afd8ad-64c6-4c57-b5e9-716f4474047a' class='mouseoverHref'>Cushman, J.A. & Todd, R. 1944. The genus <em>Spiroloculina</em> and its species.</a> <!--MARK--><!--MARK--><a href='../../../../publication/3d52a75f-30ae-4982-afe7-4f50bee56908' class='mouseoverHref'><em>Cushman Foundation for Foraminiferal Research Special Publications</em></a> <strong>11</strong>: 1-82<!--MARK-->","","Article in Journal","16afd8ad-64c6-4c57-b5e9-716f4474047a","20180911T05:30:04.500+0000","3d52a75f-30ae-4982-afe7-4f50bee56908"
"d'Orbigny, A.","1826","Tableau méthodique de la classe des Céphalopodes","96-169","","Annales des Sciences Naturelles, Paris","","","","<!--MARK--><a href='../../../../publication/37727c03-88a7-4abb-8139-997d0448f11a' class='mouseoverHref'>d'Orbigny, A. 1826. Tableau méthodique de la classe des Céphalopodes.</a> <!--MARK--><!--MARK--><a href='../../../../publication/8728aca1-f2e1-4662-b5b6-40183f95151b' class='mouseoverHref'><em>Annales des Sciences Naturelles, Paris</em></a> <strong>7</strong>: 96-169<!--MARK-->","","Article in Journal","37727c03-88a7-4abb-8139-997d0448f11a","20081009T05:11:37.000+0000","8728aca1-f2e1-4662-b5b6-40183f95151b"
"d'Orbigny, A.","1826","Tableau méthodique de la classe des Céphalopodes","245-314","","Annales des Sciences Naturelles, Paris","","","","<!--MARK--><a href='../../../../publication/1eec11b5-44fb-4392-87ed-dcfc9354a494' class='mouseoverHref'>d'Orbigny, A. 1826. Tableau méthodique de la classe des Céphalopodes.</a> <!--MARK--><!--MARK--><a href='../../../../publication/8728aca1-f2e1-4662-b5b6-40183f95151b' class='mouseoverHref'><em>Annales des Sciences Naturelles, Paris</em></a> <strong>7</strong>: 245-314<!--MARK-->","","Article in Journal","1eec11b5-44fb-4392-87ed-dcfc9354a494","20180911T02:53:00.226+0000","8728aca1-f2e1-4662-b5b6-40183f95151b"
"d'Orbigny, A.","1839","Foraminifères","","Histoire physique, politique et naturelle de l'ile de Cuba","","","","","<!--MARK--><a href='../../../../publication/a89ef669-fa60-4a0e-8922-611410079288' class='mouseoverHref'>d'Orbigny, A. 1839. Foraminifères.</a> <!--MARK--><em>In,</em> <!--MARK--><a href='../../../../publication/ff587cce-4ccb-41a0-ab05-52bc000a5fb9' class='mouseoverHref'>de la Sagra, R. <em>Histoire physique, politique et naturelle de l'ile de Cuba</em>. Paris : Arthus Bertrand.</a><!--MARK-->","","Chapter in Book","a89ef669-fa60-4a0e-8922-611410079288","20180914T05:20:42.743+0000","ff587cce-4ccb-41a0-ab05-52bc000a5fb9"
"Davies G.R.","1970","Carbonate-bank sedimentation, eastern Shark Bay, Western Australia.","843","","American Association of Petroleum Geologists","","","","<!--MARK--><a href='../../../../publication/2efce562-68a2-4092-af51-42dcba01275e' class='mouseoverHref'>Davies G.R. 1970. Carbonate-bank sedimentation, eastern Shark Bay, Western Australia.</a> <!--MARK--><!--MARK--><a href='../../../../publication/8a393a34-01ab-4557-a4b2-57b9d3d35802' class='mouseoverHref'><em>American Association of Petroleum Geologists</em></a> Bulletin <strong>54</strong>: 843<!--MARK-->","","Article in Journal","2efce562-68a2-4092-af51-42dcba01275e","20150330T20:56:19.054+0000","8a393a34-01ab-4557-a4b2-57b9d3d35802"
"Defrance, J.L.M.","1824","Dictionnaire des Sciences Naturelles","1-576","","","","","","<!--MARK--><a href='../../../../publication/f9fb58b8-752b-480e-bf12-264403dba648' class='mouseoverHref'>Defrance, J.L.M. 1824. <em>Dictionnaire des Sciences Naturelles</em>. Vol. 31 pp. 1-576.</a><!--MARK-->","","Book","f9fb58b8-752b-480e-bf12-264403dba648","20160114T00:40:16.100+0000",""
"Douvillé, H.","1907","Les calcaires à fusulines de l'Indo-Chine","567-587","","Bulletin de la Société Géologique de France","","","","<!--MARK--><a href='../../../../publication/13828987-ac6f-45c2-9333-bae7e7720c42' class='mouseoverHref'>Douvillé, H. 1907. Les calcaires à fusulines de l'Indo-Chine.</a> <!--MARK--><!--MARK--><a href='../../../../publication/8583f720-c4e5-4b24-865d-391012de3577' class='mouseoverHref'><em>Bulletin de la Société Géologique de France</em></a> sér. 4 <strong>6</strong>: 567-587<!--MARK-->","","Article in Journal","13828987-ac6f-45c2-9333-bae7e7720c42","20160401T00:43:52.078+0000","8583f720-c4e5-4b24-865d-391012de3577"
"Egger, J.G.","1893","Foraminiferen aus Meeresgrundproben, gelothet von 1874 bis 1876 von S.M. Sch. Gazelle","193-458","","Abhandlungen der mathematisch-physikalischen Klasse der königlich Bayerischen Akademie der Wissenschaften","","","","<!--MARK--><a href='../../../../publication/225cf5c0-d148-49b1-8ff3-669e6a7823b9' class='mouseoverHref'>Egger, J.G. 1893. Foraminiferen aus Meeresgrundproben, gelothet von 1874 bis 1876 von S.M. Sch. Gazelle.</a> <!--MARK--><!--MARK--><a href='../../../../publication/d1cd90bc-bb40-45b6-a22e-034be8fadd37' class='mouseoverHref'><em>Abhandlungen der mathematisch-physikalischen Klasse der königlich Bayerischen Akademie der Wissenschaften</em></a> 2 <strong>18[1895]</strong>: 193-458<!--MARK-->","","Article in Journal","225cf5c0-d148-49b1-8ff3-669e6a7823b9","20180911T05:58:26.338+0000","d1cd90bc-bb40-45b6-a22e-034be8fadd37"
"Ehrenberg, C.G.","1839","Über die Bildung der Kreidefelsen und des Kreidemergels durch unsichtbare Organismen","59-147","","Physikalische Abhandlungen der Königlichen Akademie der Wissenschaften, Berlin","","","","<!--MARK--><a href='../../../../publication/474a13ac-194c-4297-a2d8-bff3d783c8f7' class='mouseoverHref'>Ehrenberg, C.G. 1839. Über die Bildung der Kreidefelsen und des Kreidemergels durch unsichtbare Organismen.</a> <!--MARK--><!--MARK--><a href='../../../../publication/8ad7bf5b-ef6b-4c42-8a2f-4dc4c6b11ee6' class='mouseoverHref'><em>Physikalische Abhandlungen der Königlichen Akademie der Wissenschaften, Berlin</em></a> <strong>1838</strong>: 59-147<!--MARK-->","","Article in Journal","474a13ac-194c-4297-a2d8-bff3d783c8f7","20181009T05:44:54.545+0000","8ad7bf5b-ef6b-4c42-8a2f-4dc4c6b11ee6"
"Ehrenberg, C.G.","1843","Verbreitung und Einfluss des mikroskopischen Lebens in Süd- und Nord-Amerika","291-446","","Physikalische Abhandlungen der Königlichen Akademie der Wissenschaften, Berlin","","","","<!--MARK--><a href='../../../../publication/fa521d94-f705-4b14-9d23-1a904235ff5f' class='mouseoverHref'>Ehrenberg, C.G. 1843. Verbreitung und Einfluss des mikroskopischen Lebens in Süd- und Nord-Amerika.</a> <!--MARK--><!--MARK--><a href='../../../../publication/8ad7bf5b-ef6b-4c42-8a2f-4dc4c6b11ee6' class='mouseoverHref'><em>Physikalische Abhandlungen der Königlichen Akademie der Wissenschaften, Berlin</em></a> <strong>1841</strong>: 291-446<!--MARK-->","","Article in Journal","fa521d94-f705-4b14-9d23-1a904235ff5f","20160331T03:32:14.372+0000","8ad7bf5b-ef6b-4c42-8a2f-4dc4c6b11ee6"
"Ehrenberg, G.C.","1840","Über die Bildung der Kreidefelsen und des Kreidemergels durch unsichtbare Organismen.","59-147","","Abhandlungen der Königliche Akademie der Wissenschaften zu Berlin (Physikalische Klasse)","","","","<!--MARK--><a href='../../../../publication/a8319934-09a4-4e77-9271-db9a23c9c4dc' class='mouseoverHref'>Ehrenberg, G.C. 1840. Über die Bildung der Kreidefelsen und des Kreidemergels durch unsichtbare Organismen.</a> <!--MARK--><!--MARK--><a href='../../../../publication/850977fb-6433-4bfd-8f8e-f0a08ec26465' class='mouseoverHref'><em>Abhandlungen der Königliche Akademie der Wissenschaften zu Berlin (Physikalische Klasse)</em></a> <strong>1838</strong>: 59-147<!--MARK-->","","Article in Journal","a8319934-09a4-4e77-9271-db9a23c9c4dc","20150303T00:38:41.758+0000","850977fb-6433-4bfd-8f8e-f0a08ec26465"
"Ellis, B.F. & Messina, A.R.","1940 <em>et seq.</em>","Catalogue of Foraminifera","","","","","","American Museum of Natural History","<!--MARK--><a href='../../../../publication/880535fb-b00c-4a93-b8bc-e5c1a5654339' class='mouseoverHref'>Ellis, B.F. & Messina, A.R. 1940 <em>et seq.</em> <em>Catalogue of Foraminifera</em>. New York : American Museum of Natural History.</a><!--MARK-->","","Book","880535fb-b00c-4a93-b8bc-e5c1a5654339","20181019T00:23:06.201+0000",""
"Fichtel, L. & Moll, J.P.C.","1798","Testacea microscopica aliaque minuta ex generibus Argonauta et Nautilis ad naturam picta et descripta","194 pp.","","","","","Camesina","<!--MARK--><a href='../../../../publication/8eb684ea-ebdb-4826-9cc1-ac17964c50a3' class='mouseoverHref'>Fichtel, L. & Moll, J.P.C. 1798. <em>Testacea microscopica aliaque minuta ex generibus Argonauta et Nautilis ad naturam picta et descripta</em>. Vienna : Camesina 194 pp.</a><!--MARK-->","","Book","8eb684ea-ebdb-4826-9cc1-ac17964c50a3","20181009T04:35:08.440+0000",""
"Forsskål, P.","1775","Descriptiones Animalium Avium, Amphibiorum, Piscium, Insectorum, Vermium; <I>quæ in Itinere Orientali observavit Petrus Forskål. Post Mortem Auctoris edidit Carsten Niebuhr. Adjuncta est Materia Medica Kakirina atque Tabula Maris Rubri Geographica</I>","1-19, i-xxxiv, 164 pp., 1 map","","","","","Mölleri","<!--MARK--><a href='../../../../publication/9cddf445-f3e8-41fe-ad40-01560452062b' class='mouseoverHref'>Forsskål, P. 1775. <em>Descriptiones Animalium Avium, Amphibiorum, Piscium, Insectorum, Vermium; <I>quæ in Itinere Orientali observavit Petrus Forskål. Post Mortem Auctoris edidit Carsten Niebuhr. Adjuncta est Materia Medica Kakirina atque Tabula Maris Rubri Geographica</I></em>. Hauniæ : Mölleri 1-19, i-xxxiv, 164 pp., 1 map.</a><!--MARK-->","","Book","9cddf445-f3e8-41fe-ad40-01560452062b","20171130T02:35:12.723+0000",""
"Gallowayay, J.J.","1933","A manual of Foraminifera","483 pp.","","","","","Principia Press","<!--MARK--><a href='../../../../publication/6752d49c-2468-4d57-8704-5e6a529381fe' class='mouseoverHref'>Gallowayay, J.J. 1933. <em>A manual of Foraminifera</em>. Bloomington : Principia Press 483 pp.</a><!--MARK-->","","Book","6752d49c-2468-4d57-8704-5e6a529381fe","20181019T04:01:54.866+0000",""
