"PUB_AUTHOR","PUB_YEAR","PUB_TITLE","PUB_PAGES","PUB_PARENT_BOOK_TITLE","PUB_PARENT_JOURNAL_TITLE","PUB_PARENT_ARTICLE_TITLE","PUB_PUBLICATION_DATE","PUB_PUBLISHER","PUB_FORMATTED","PUB_QUALIFICATION","PUB_TYPE","PUBLICATION_GUID","PUBLICATION_LAST_UPDATE","PARENT_PUBLICATION_GUID"
"Loeblich, A.R. Jr & Tappan, H.","1964","Protista 2: Sarcodinia, chiefly 'Thecamoebians' and Foraminiferida","","Treatise on Invertebrate Palaeontology","","","","","<!--MARK--><a href='../../../../publication/2e9c7162-8017-4f97-a875-f655bda77731' class='mouseoverHref'>Loeblich, A.R. Jr & Tappan, H. 1964. Protista 2: Sarcodinia, chiefly 'Thecamoebians' and Foraminiferida.</a> <!--MARK--><em>In,</em> <!--MARK--><a href='../../../../publication/72eafde4-4ae5-45ec-9d95-d9844d7a7bb5' class='mouseoverHref'>Loeblich, A.R. Jr & Tappan, H. <em>Treatise on Invertebrate Palaeontology</em>. Lawrence, Kansas : Geological Society of America and University of Kansas Press.</a><!--MARK-->","","Chapter in Book","2e9c7162-8017-4f97-a875-f655bda77731","20160112T02:33:46.648+0000","72eafde4-4ae5-45ec-9d95-d9844d7a7bb5"
"Loeblich, A.R. Jr & Tappan, H.","1985","Some new and redefined genera of agglutinated foraminifera II","175-217","","Journal of Foraminiferal Research","","","","<!--MARK--><a href='../../../../publication/26a96d3c-b12c-43f8-b565-f5aa5dc0e896' class='mouseoverHref'>Loeblich, A.R. Jr & Tappan, H. 1985. Some new and redefined genera of agglutinated foraminifera II.</a> <!--MARK--><!--MARK--><a href='../../../../publication/9a3da88f-859f-42be-8cb7-40e6d82b3894' class='mouseoverHref'><em>Journal of Foraminiferal Research</em></a> <strong>15</strong>: 175-217<!--MARK-->","","Article in Journal","26a96d3c-b12c-43f8-b565-f5aa5dc0e896","20160113T03:20:15.732+0000","9a3da88f-859f-42be-8cb7-40e6d82b3894"
"Loeblich, A.R. Jr & Tappan, H.","1987","Foraminiferal genera and their classification","","","","","","Van Nostrand Reinhold","<!--MARK--><a href='../../../../publication/80398d94-fcbf-4346-8aba-7135b2339f49' class='mouseoverHref'>Loeblich, A.R. Jr & Tappan, H. 1987. <em>Foraminiferal genera and their classification</em>. New York : Van Nostrand Reinhold.</a><!--MARK-->","","Book","80398d94-fcbf-4346-8aba-7135b2339f49","20160115T06:46:39.864+0000",""
"Loeblich, A.R. Jr & Tappan, H.","1994","Foraminifera of the Sahul Shelf","1-661","","Cushman Foundation for Foraminiferal Research Special Publications","","","","<!--MARK--><a href='../../../../publication/6dbe8320-4b77-462d-824d-ae1a8fba7ee9' class='mouseoverHref'>Loeblich, A.R. Jr & Tappan, H. 1994. Foraminifera of the Sahul Shelf.</a> <!--MARK--><!--MARK--><a href='../../../../publication/3d52a75f-30ae-4982-afe7-4f50bee56908' class='mouseoverHref'><em>Cushman Foundation for Foraminiferal Research Special Publications</em></a> <strong>31</strong>: 1-661<!--MARK-->","","Article in Journal","6dbe8320-4b77-462d-824d-ae1a8fba7ee9","20160112T01:49:17.218+0000","3d52a75f-30ae-4982-afe7-4f50bee56908"
"Mamo, B.L.","2016","Benthic Foraminifera from the Capricorn Group, Great Barrier Reef, Australia","1-123","","Zootaxa","","","","<!--MARK--><a href='../../../../publication/f135008f-e99e-43f4-8631-469f7510b417' class='mouseoverHref'>Mamo, B.L. 2016. Benthic Foraminifera from the Capricorn Group, Great Barrier Reef, Australia.</a> <!--MARK--><!--MARK--><a href='../../../../publication/96466227-221c-4922-ac97-1ac2dd946d0a' class='mouseoverHref'><em>Zootaxa</em></a> <strong>4215</strong>(1): 1-123<!--MARK-->","","Article in Journal","f135008f-e99e-43f4-8631-469f7510b417","20180904T05:17:01.414+0000","96466227-221c-4922-ac97-1ac2dd946d0a"
"Margerel, J.-P.","2009","Les foraminifères benthiques des Faluns du Miocène moyen du Blésois (Loir-et-Cher) et de Mirebeau (Vienne) dans le Centre-Ouest de la France","577-621","","Geodiversitas","","","","<!--MARK--><a href='../../../../publication/d118fcc4-0855-4abd-8840-e39889d9665e' class='mouseoverHref'>Margerel, J.-P. 2009. Les foraminifères benthiques des Faluns du Miocène moyen du Blésois (Loir-et-Cher) et de Mirebeau (Vienne) dans le Centre-Ouest de la France.</a> <!--MARK--><!--MARK--><a href='../../../../publication/9f054db6-c04f-40c1-ae25-825a6d672e91' class='mouseoverHref'><em>Geodiversitas</em></a> <strong>31</strong>(3): 577-621<!--MARK-->","","Article in Journal","d118fcc4-0855-4abd-8840-e39889d9665e","20181010T23:06:03.301+0000","9f054db6-c04f-40c1-ae25-825a6d672e91"
"Mather, P., & Bennett, I. (eds)","1993","A Coral Reef Handbook","","","","","","Surrey Beatty & Sons","<!--MARK--><a href='../../../../publication/7c44072c-9164-407f-9e1e-d0373cf36df7' class='mouseoverHref'>Mather, P., & Bennett, I. (eds) 1993. <em>A Coral Reef Handbook</em>. Chipping Norton, NSW : Surrey Beatty & Sons.</a><!--MARK-->","","Book","7c44072c-9164-407f-9e1e-d0373cf36df7","",""
"McCulloch, I.","1977","Qualitative observations on recent foraminiferal tests with emphasis on the Eastern Pacific, Parts I-III","1078 pp.","","","","","University of Southern California","<!--MARK--><a href='../../../../publication/df3b1a3d-6008-40b9-874c-313d8c303bf8' class='mouseoverHref'>McCulloch, I. 1977. <em>Qualitative observations on recent foraminiferal tests with emphasis on the Eastern Pacific, Parts I-III</em>. Los Angeles : University of Southern California 1078 pp.</a><!--MARK-->","","Book","df3b1a3d-6008-40b9-874c-313d8c303bf8","20181019T04:14:47.884+0000",""
"McCulloch, I.","1981","Qualitative observations on Recent foraminiferal tests. pt. IV: with emphasis on the Allan Hancock Atlantic Expedition Collections","","","","","","University of Southern California","<!--MARK--><a href='../../../../publication/08a2666e-b24a-43b9-b1e8-47812e944e12' class='mouseoverHref'>McCulloch, I. 1981. <em>Qualitative observations on Recent foraminiferal tests. pt. IV: with emphasis on the Allan Hancock Atlantic Expedition Collections</em>. Los Angeles : University of Southern California.</a><!--MARK-->","","Book","08a2666e-b24a-43b9-b1e8-47812e944e12","20160331T03:23:19.368+0000",""
"McEnery, M.E. & Lee, J.J.","1981","Cytological and fine structural studies of three species of symbiont-bearing larger foraminifera from the Red Sea","71-80","","Micropaleontology","","","","<!--MARK--><a href='../../../../publication/8b4ddefb-ccad-47eb-b5e4-80e5ab4b60d0' class='mouseoverHref'>McEnery, M.E. & Lee, J.J. 1981. Cytological and fine structural studies of three species of symbiont-bearing larger foraminifera from the Red Sea.</a> <!--MARK--><!--MARK--><a href='../../../../publication/5644f8bb-64d7-4db0-97fa-ea777593e25b' class='mouseoverHref'><em>Micropaleontology</em></a> <strong>27</strong>: 71-80<!--MARK-->","","Article in Journal","8b4ddefb-ccad-47eb-b5e4-80e5ab4b60d0","20160404T02:45:48.808+0000","5644f8bb-64d7-4db0-97fa-ea777593e25b"
"McKenzie, K.G.","1962","A record of foraminifera from Oyster Harbour, near Albany, Western Australia","117-132","","Journal of the Royal Society of Western Australia","","","","<!--MARK--><a href='../../../../publication/d6501044-6389-4148-85d5-ed010bbf125d' class='mouseoverHref'>McKenzie, K.G. 1962. A record of foraminifera from Oyster Harbour, near Albany, Western Australia.</a> <!--MARK--><!--MARK--><a href='../../../../publication/666efb8f-4a3f-4a3d-ae40-e9ab98f3cdf5' class='mouseoverHref'><em>Journal of the Royal Society of Western Australia</em></a> <strong>45</strong>: 117-132<!--MARK-->","","Article in Journal","d6501044-6389-4148-85d5-ed010bbf125d","20160112T03:42:09.237+0000","666efb8f-4a3f-4a3d-ae40-e9ab98f3cdf5"
"Meisterfeld, R., Holzmann, M. & Pawlowski, J.","2001","Morphological and Molecular Characterization of a New Terrestrial Allogromiid Species: <em>Edaphoallogromia australica</em> gen. et spec. nov. (Foraminifera) from Northern Queensland (Australia)","185-192","","Protist","","","","<!--MARK--><a href='../../../../publication/5882b6bf-8d10-4202-9ac4-9e1cf451d8e1' class='mouseoverHref'>Meisterfeld, R., Holzmann, M. & Pawlowski, J. 2001. Morphological and Molecular Characterization of a New Terrestrial Allogromiid Species: <em>Edaphoallogromia australica</em> gen. et spec. nov. (Foraminifera) from Northern Queensland (Australia).</a> <!--MARK--><!--MARK--><a href='../../../../publication/e9143919-b82b-4bf7-9619-d1dcf3c4465e' class='mouseoverHref'><em>Protist</em></a> <strong>152</strong>(3): 185-192<!--MARK-->","","Article in Journal","5882b6bf-8d10-4202-9ac4-9e1cf451d8e1","20181018T01:54:10.442+0000","e9143919-b82b-4bf7-9619-d1dcf3c4465e"
"Mikhalevich, V.I.","2011","The new genus <em>Olgia</em> and new family Olgiidae. Textulariana, Foraminifera)","173-182","","Micropaleontology","","","","<!--MARK--><a href='../../../../publication/52dec930-d856-466b-995e-628de0a88ec0' class='mouseoverHref'>Mikhalevich, V.I. 2011. The new genus <em>Olgia</em> and new family Olgiidae. Textulariana, Foraminifera).</a> <!--MARK--><!--MARK--><a href='../../../../publication/5644f8bb-64d7-4db0-97fa-ea777593e25b' class='mouseoverHref'><em>Micropaleontology</em></a> <strong>57</strong>(2): 173-182<!--MARK-->","","Article in Journal","52dec930-d856-466b-995e-628de0a88ec0","20180905T05:01:10.438+0000","5644f8bb-64d7-4db0-97fa-ea777593e25b"
"Mikhalevich, V.I.","2017","New name for the foraminiferal genus <em>Olgia</em>","","","Paleo-electronica","","","","<!--MARK--><a href='../../../../publication/4a40b0f9-a697-40db-92be-eacfa84b586e' class='mouseoverHref'>Mikhalevich, V.I. 2017. New name for the foraminiferal genus <em>Olgia</em>.</a> <!--MARK--><!--MARK--><a href='../../../../publication/625887a1-e251-4533-b13c-6677b03456ba' class='mouseoverHref'><em>Paleo-electronica</em></a> <strong>Article number: 20.2.1N.</strong><!--MARK--> [available online at http://palaeo-electronica.org/content/2017/1910-new-name-for-olgia]","available online at http://palaeo-electronica.org/content/2017/1910-new-name-for-olgia","Article in Journal","4a40b0f9-a697-40db-92be-eacfa84b586e","20180905T05:05:19.442+0000","625887a1-e251-4533-b13c-6677b03456ba"
"Millet, F.W.","1898","Report on the recent foraminifera of the Malay Archipelago collected by Mr A. Durrand, F.R.M.S.","258-269","","Journal of the Royal Microscopical Society, London","","","","<!--MARK--><a href='../../../../publication/cd83d842-33b1-4441-aeaf-3b31157e37a8' class='mouseoverHref'>Millet, F.W. 1898. Report on the recent foraminifera of the Malay Archipelago collected by Mr A. Durrand, F.R.M.S.</a> <!--MARK--><!--MARK--><a href='../../../../publication/27e4b17c-ade2-4bbd-bbf1-764de8cc231a' class='mouseoverHref'><em>Journal of the Royal Microscopical Society, London</em></a> <strong>1898</strong>: 258-269<!--MARK-->","","Article in Journal","cd83d842-33b1-4441-aeaf-3b31157e37a8","20150406T08:52:32.845+0000","27e4b17c-ade2-4bbd-bbf1-764de8cc231a"
"Millett, F.W.","1899","Report on the Recent foraminifera of the Malay Archipelago, collected by Mr A. Durrand; Part VI","556-564","","Journal of the Royal Microscopical Society, London","","","","<!--MARK--><a href='../../../../publication/52a23eb7-f0f6-44be-ac58-3ac4143df7c9' class='mouseoverHref'>Millett, F.W. 1899. Report on the Recent foraminifera of the Malay Archipelago, collected by Mr A. Durrand; Part VI.</a> <!--MARK--><!--MARK--><a href='../../../../publication/27e4b17c-ade2-4bbd-bbf1-764de8cc231a' class='mouseoverHref'><em>Journal of the Royal Microscopical Society, London</em></a> <strong>1899</strong>: 556-564<!--MARK-->","","Article in Journal","52a23eb7-f0f6-44be-ac58-3ac4143df7c9","20181011T01:23:38.808+0000","27e4b17c-ade2-4bbd-bbf1-764de8cc231a"
"Milne Edwards, A.","1882","Rapport sur les travaux de la Commission chargée d'étudier la faune sous-marine dans les grandes profondeurs de la Mediterranée et de l'océan Atlantique","1-59","","Archives des Missions Scientifiques et Litteraires, Paris","","","","<!--MARK--><a href='../../../../publication/276e77f4-4ccd-491f-a6a4-9d20d5e75e96' class='mouseoverHref'>Milne Edwards, A. 1882. Rapport sur les travaux de la Commission chargée d'étudier la faune sous-marine dans les grandes profondeurs de la Mediterranée et de l'océan Atlantique.</a> <!--MARK--><!--MARK--><a href='../../../../publication/d1cbaa16-d2c7-46d0-8779-a8e3e7fc0bfb' class='mouseoverHref'><em>Archives des Missions Scientifiques et Litteraires, Paris</em></a> Ser. 3 <strong>9</strong>: 1-59<!--MARK-->","","Article in Journal","276e77f4-4ccd-491f-a6a4-9d20d5e75e96","20190307T05:31:26.199+0000","d1cbaa16-d2c7-46d0-8779-a8e3e7fc0bfb"
"Montagu, G.","1808","Testacea Britannica; supplement","","","","","","J.S. Hollis.","<!--MARK--><a href='../../../../publication/c8ab827a-664f-4f50-9f79-8b7741727704' class='mouseoverHref'>Montagu, G. 1808. <em>Testacea Britannica; supplement</em>. Exeter, England : J.S. Hollis.</a><!--MARK-->","","Book","c8ab827a-664f-4f50-9f79-8b7741727704","20160112T03:40:45.157+0000",""
"Montfort, P.D. de","1808","Conchyliologie Systematique, et Classification Methodique des Coquilles","409 pp.","","","","","F. Schoell Libraire","<!--MARK--><a href='../../../../publication/d8ff90f0-c9a7-4154-ae4a-0ec34a4bf1ba' class='mouseoverHref'>Montfort, P.D. de 1808. <em>Conchyliologie Systematique, et Classification Methodique des Coquilles</em>. Paris : F. Schoell Libraire Tome 1 409 pp.</a><!--MARK-->","","Book","d8ff90f0-c9a7-4154-ae4a-0ec34a4bf1ba","20180904T05:04:50.792+0000",""
"Murray, J.W.","1971","An atlas of British foraminiferids","","","","","","Heinemann Educational Books","<!--MARK--><a href='../../../../publication/dd2c2f97-762e-4305-9bb1-fdbc3d9c7932' class='mouseoverHref'>Murray, J.W. 1971. <em>An atlas of British foraminiferids</em>. London : Heinemann Educational Books.</a><!--MARK-->","","Book","dd2c2f97-762e-4305-9bb1-fdbc3d9c7932","20160112T03:44:01.133+0000",""
"Nobes, K. & Uthicke, S.","2008","Benthic Foraminifera of the Great Barrier Reef: A guide to species potentially useful as Water Quality Indicators. Report to the Marine and Tropical Sciences Research Facility. Reef and Rainforest Research Centre Limited, Cairns","44 pp.","","","","","","<!--MARK--><a href='../../../../publication/74a909e8-11dd-4990-92a6-0c4de61aef99' class='mouseoverHref'>Nobes, K. & Uthicke, S. 2008. Benthic Foraminifera of the Great Barrier Reef: A guide to species potentially useful as Water Quality Indicators. Report to the Marine and Tropical Sciences Research Facility. Reef and Rainforest Research Centre Limited, Cairns. 44 pp.</a>","","Miscellaneous","74a909e8-11dd-4990-92a6-0c4de61aef99","20180904T03:36:29.684+0000",""
"Nomura, R.","1983","Cassidulinidae (Foraminiferida) from the uppermost Cenozoic of Japan. Part I","1-101","","Science Reports of the Tôhoku University, 2nd series (Geology)","","","","<!--MARK--><a href='../../../../publication/da50b8e7-33ef-48ac-94a2-79fd745e3263' class='mouseoverHref'>Nomura, R. 1983. Cassidulinidae (Foraminiferida) from the uppermost Cenozoic of Japan. Part I.</a> <!--MARK--><!--MARK--><a href='../../../../publication/7ff0ec76-24d0-484d-9a84-82f60e5211a1' class='mouseoverHref'><em>Science Reports of the Tôhoku University, 2nd series (Geology)</em></a> <strong>53</strong>(1): 1-101<!--MARK-->","","Article in Journal","da50b8e7-33ef-48ac-94a2-79fd745e3263","20181012T01:09:44.711+0000","7ff0ec76-24d0-484d-9a84-82f60e5211a1"
"Orpin, A.R., Haig, D.W. & Woolfe, K.J.","1999","Sedimentary and foraminiferal facies in Exmouth Gulf, in arid tropical north-western Australia","607-622","","Australian Journal of Earth Sciences","","","","<!--MARK--><a href='../../../../publication/de0a2c6c-5313-46d3-8233-29630156fb67' class='mouseoverHref'>Orpin, A.R., Haig, D.W. & Woolfe, K.J. 1999. Sedimentary and foraminiferal facies in Exmouth Gulf, in arid tropical north-western Australia.</a> <!--MARK--><!--MARK--><a href='../../../../publication/c36dc897-755a-4ebc-a7e6-e93a7a1c43bd' class='mouseoverHref'><em>Australian Journal of Earth Sciences</em></a> <strong>46</strong>: 607-622<!--MARK-->","","Article in Journal","de0a2c6c-5313-46d3-8233-29630156fb67","20160114T03:40:18.836+0000","c36dc897-755a-4ebc-a7e6-e93a7a1c43bd"
"Parker, J.H.","2009","Calcite-cemented Agglutinated Foraminifera","pp. 25-61","","Association of Australian Palaeontologists Memoir","Taxonomy of Foraminifera from Ningaloo Reef, Western Australia","","","<!--MARK--><a href='../../../../publication/fe47166d-0b16-4fa9-b963-b5e696fbde17' class='mouseoverHref'>Parker, J.H. 2009. Calcite-cemented Agglutinated Foraminifera. pp. 25-61</a> <!--MARK--><em>in</em> <!--MARK--><a href='../../../../publication/c962e8b6-8c6d-4e91-8062-ecde27d1d1ca' class='mouseoverHref'>Parker, J.H. Taxonomy of Foraminifera from Ningaloo Reef, Western Australia.</a> <!--MARK--><!--MARK--><a href='../../../../publication/1029e816-fd6b-4cc3-9946-02fcf1c81c37' class='mouseoverHref'><em>Association of Australian Palaeontologists Memoir</em></a> <strong>36</strong>: 1-810<!--MARK-->","","Section in Article","fe47166d-0b16-4fa9-b963-b5e696fbde17","20160113T01:00:11.660+0000","c962e8b6-8c6d-4e91-8062-ecde27d1d1ca"
"Parker, J.H.","2009","Miliolida","pp. 83-384","","Association of Australian Palaeontologists Memoir","Taxonomy of Foraminifera from Ningaloo Reef, Western Australia","","","<!--MARK--><a href='../../../../publication/1d053d51-07bf-43bf-a643-418d79c713a3' class='mouseoverHref'>Parker, J.H. 2009. Miliolida. pp. 83-384</a> <!--MARK--><em>in</em> <!--MARK--><a href='../../../../publication/c962e8b6-8c6d-4e91-8062-ecde27d1d1ca' class='mouseoverHref'>Parker, J.H. Taxonomy of Foraminifera from Ningaloo Reef, Western Australia.</a> <!--MARK--><!--MARK--><a href='../../../../publication/1029e816-fd6b-4cc3-9946-02fcf1c81c37' class='mouseoverHref'><em>Association of Australian Palaeontologists Memoir</em></a> <strong>36</strong>: 1-810<!--MARK-->","","Section in Article","1d053d51-07bf-43bf-a643-418d79c713a3","20160401T02:25:31.026+0000","c962e8b6-8c6d-4e91-8062-ecde27d1d1ca"
"Parker, J.H.","2009","Organic-cemented agglutinated foraminifera","pp. 13-24","","Association of Australian Palaeontologists Memoir","Taxonomy of Foraminifera from Ningaloo Reef, Western Australia","","","<!--MARK--><a href='../../../../publication/a3704872-ec01-4f7b-8e0b-fe911a62bc23' class='mouseoverHref'>Parker, J.H. 2009. Organic-cemented agglutinated foraminifera. pp. 13-24</a> <!--MARK--><em>in</em> <!--MARK--><a href='../../../../publication/c962e8b6-8c6d-4e91-8062-ecde27d1d1ca' class='mouseoverHref'>Parker, J.H. Taxonomy of Foraminifera from Ningaloo Reef, Western Australia.</a> <!--MARK--><!--MARK--><a href='../../../../publication/1029e816-fd6b-4cc3-9946-02fcf1c81c37' class='mouseoverHref'><em>Association of Australian Palaeontologists Memoir</em></a> <strong>36</strong>: 1-810<!--MARK-->","","Section in Article","a3704872-ec01-4f7b-8e0b-fe911a62bc23","20160112T02:41:57.914+0000","c962e8b6-8c6d-4e91-8062-ecde27d1d1ca"
"Parker, J.H.","2009","Spirillinida","pp. 63-81","","Association of Australian Palaeontologists Memoir","Taxonomy of Foraminifera from Ningaloo Reef, Western Australia","","","<!--MARK--><a href='../../../../publication/ecc05435-e822-4a6b-a200-69d3971b6d5a' class='mouseoverHref'>Parker, J.H. 2009. Spirillinida. pp. 63-81</a> <!--MARK--><em>in</em> <!--MARK--><a href='../../../../publication/c962e8b6-8c6d-4e91-8062-ecde27d1d1ca' class='mouseoverHref'>Parker, J.H. Taxonomy of Foraminifera from Ningaloo Reef, Western Australia.</a> <!--MARK--><!--MARK--><a href='../../../../publication/1029e816-fd6b-4cc3-9946-02fcf1c81c37' class='mouseoverHref'><em>Association of Australian Palaeontologists Memoir</em></a> <strong>36</strong>: 1-810<!--MARK-->","","Section in Article","ecc05435-e822-4a6b-a200-69d3971b6d5a","20160115T06:19:28.110+0000","c962e8b6-8c6d-4e91-8062-ecde27d1d1ca"
"Parker, J.H.","2009","Taxonomy of Foraminifera from Ningaloo Reef, Western Australia","1-810","","Association of Australian Palaeontologists Memoir","","","","<!--MARK--><a href='../../../../publication/c962e8b6-8c6d-4e91-8062-ecde27d1d1ca' class='mouseoverHref'>Parker, J.H. 2009. Taxonomy of Foraminifera from Ningaloo Reef, Western Australia.</a> <!--MARK--><!--MARK--><a href='../../../../publication/1029e816-fd6b-4cc3-9946-02fcf1c81c37' class='mouseoverHref'><em>Association of Australian Palaeontologists Memoir</em></a> <strong>36</strong>: 1-810<!--MARK-->","","Article in Journal","c962e8b6-8c6d-4e91-8062-ecde27d1d1ca","20180904T05:24:59.750+0000","1029e816-fd6b-4cc3-9946-02fcf1c81c37"
"Parker, W.K. & Jones, T.R.","1860","On the nomenclature of the Foraminifera. Part IV. The species enumerated by Lamarck","29-40","","Annals and Magazine of Natural History","","","","<!--MARK--><a href='../../../../publication/e7349a88-278e-4817-b028-0bca481252df' class='mouseoverHref'>Parker, W.K. & Jones, T.R. 1860. On the nomenclature of the Foraminifera. Part IV. The species enumerated by Lamarck.</a> <!--MARK--><!--MARK--><a href='../../../../publication/efa8de69-3a29-4a43-8ef2-cbefda205976' class='mouseoverHref'><em>Annals and Magazine of Natural History</em></a> ser. 3 <strong>6</strong>: 29-40<!--MARK--> [continued from vol. 5 p. 285]","continued from vol. 5 p. 285","Article in Journal","e7349a88-278e-4817-b028-0bca481252df","20181023T03:50:28.675+0000","efa8de69-3a29-4a43-8ef2-cbefda205976"
"Parker, W.K. & Jones, T.R.","1865","On some foraminifera from the North Atlantic and Arctic Oceans, including Davis Straits and Baffin's Bay","325-441","","Philosophical Transactions of the Royal Society of London","","","","<!--MARK--><a href='../../../../publication/7c39bfab-3db0-4b25-9813-db40df01c93d' class='mouseoverHref'>Parker, W.K. & Jones, T.R. 1865. On some foraminifera from the North Atlantic and Arctic Oceans, including Davis Straits and Baffin's Bay.</a> <!--MARK--><!--MARK--><a href='../../../../publication/9869065b-3961-4043-9902-80787f2b3b87' class='mouseoverHref'><em>Philosophical Transactions of the Royal Society of London</em></a> <strong>155</strong>: 325-441<!--MARK-->","","Article in Journal","7c39bfab-3db0-4b25-9813-db40df01c93d","20181011T03:51:04.095+0000","9869065b-3961-4043-9902-80787f2b3b87"
"Parr, W.J.","1932","Victorian and South Australian foraminifera - Part I.","1-14","","Proceedings of the Royal Society of Victoria","","","","<!--MARK--><a href='../../../../publication/f572d20e-232f-42bc-a8d9-a531f96d7859' class='mouseoverHref'>Parr, W.J. 1932. Victorian and South Australian foraminifera - Part I.</a> <!--MARK--><!--MARK--><a href='../../../../publication/ce333794-3a02-427f-ba27-346079f1efa0' class='mouseoverHref'><em>Proceedings of the Royal Society of Victoria</em></a> <strong>44</strong>: 1-14<!--MARK-->","","Article in Journal","f572d20e-232f-42bc-a8d9-a531f96d7859","20150330T21:21:54.225+0000","ce333794-3a02-427f-ba27-346079f1efa0"
"Parr, W.J.","1932","Victorian and South Australian foraminifera - Part II.","218-234","","Proceedings of the Royal Society of Victoria","","","","<!--MARK--><a href='../../../../publication/18b7178d-1dfa-41fe-b19c-e24cd2cde336' class='mouseoverHref'>Parr, W.J. 1932. Victorian and South Australian foraminifera - Part II.</a> <!--MARK--><!--MARK--><a href='../../../../publication/ce333794-3a02-427f-ba27-346079f1efa0' class='mouseoverHref'><em>Proceedings of the Royal Society of Victoria</em></a> <strong>44</strong>: 218-234<!--MARK-->","","Article in Journal","18b7178d-1dfa-41fe-b19c-e24cd2cde336","20150330T21:22:41.061+0000","ce333794-3a02-427f-ba27-346079f1efa0"
"Parr, W.J.","1941","A new genus, <em>Planulinoides</em>, and some species of foraminifera from southern Australia","305","","Mining and Geological Journal","","","","<!--MARK--><a href='../../../../publication/5ca711dd-c00e-4ed9-a5f4-a3535f62bff5' class='mouseoverHref'>Parr, W.J. 1941. A new genus, <em>Planulinoides</em>, and some species of foraminifera from southern Australia.</a> <!--MARK--><!--MARK--><a href='../../../../publication/25b8adf3-8ce6-4a3a-8298-c8cdbc4cf518' class='mouseoverHref'><em>Mining and Geological Journal</em></a> <strong>2</strong>(5): 305<!--MARK-->","","Article in Journal","5ca711dd-c00e-4ed9-a5f4-a3535f62bff5","20180914T04:08:10.296+0000","25b8adf3-8ce6-4a3a-8298-c8cdbc4cf518"
"Parr, W.J.","1950","Foraminifera","232-392","","British, Australian and New Zealand Antarctic Research Expedition Reports, Series B (Zoology and Botany)","","","","<!--MARK--><a href='../../../../publication/b00a3047-dff3-4a54-bdb6-a1d5556426f8' class='mouseoverHref'>Parr, W.J. 1950. Foraminifera.</a> <!--MARK--><!--MARK--><a href='../../../../publication/a58c8101-7af6-4383-8167-2f253098a8e9' class='mouseoverHref'><em>British, Australian and New Zealand Antarctic Research Expedition Reports, Series B (Zoology and Botany)</em></a> <strong>5</strong>: 232-392<!--MARK-->","","Article in Journal","b00a3047-dff3-4a54-bdb6-a1d5556426f8","20160114T03:18:52.873+0000","a58c8101-7af6-4383-8167-2f253098a8e9"
"Patterson, R.T.","1985","<em>Abditodendrix</em>, a new foraminiferal genus in the family Bolivinitidae","138-140","","Journal of Foraminiferal Research","","","","<!--MARK--><a href='../../../../publication/85b66af1-2718-4461-8d6e-3571479a5e49' class='mouseoverHref'>Patterson, R.T. 1985. <em>Abditodendrix</em>, a new foraminiferal genus in the family Bolivinitidae.</a> <!--MARK--><!--MARK--><a href='../../../../publication/9a3da88f-859f-42be-8cb7-40e6d82b3894' class='mouseoverHref'><em>Journal of Foraminiferal Research</em></a> <strong>15</strong>: 138-140<!--MARK-->","","Article in Journal","85b66af1-2718-4461-8d6e-3571479a5e49","20181011T01:18:08.226+0000","9a3da88f-859f-42be-8cb7-40e6d82b3894"
