"PUB_AUTHOR","PUB_YEAR","PUB_TITLE","PUB_PAGES","PUB_PARENT_BOOK_TITLE","PUB_PARENT_JOURNAL_TITLE","PUB_PARENT_ARTICLE_TITLE","PUB_PUBLICATION_DATE","PUB_PUBLISHER","PUB_FORMATTED","PUB_QUALIFICATION","PUB_TYPE","PUBLICATION_GUID","PUBLICATION_LAST_UPDATE","PARENT_PUBLICATION_GUID"
"Gronovius, L.T.","1781","Zoophylacium Gronovianum, exhibens Animalia Quadrupeda, Amphibia, Pisces, Insecta, Vermes, Mollusca, Testaceae et Zoophyta, quae in museo suo adservariat, examini subjecit, systematice disposuit atque descripsit.","1786","","","","","Lugduni","<!--MARK--><a href='../../../../publication/0d38fd65-8e94-4b23-9114-5d8506a65dc2' class='mouseoverHref'>Gronovius, L.T. 1781. <em>Zoophylacium Gronovianum, exhibens Animalia Quadrupeda, Amphibia, Pisces, Insecta, Vermes, Mollusca, Testaceae et Zoophyta, quae in museo suo adservariat, examini subjecit, systematice disposuit atque descripsit</em>. Batarorum : Lugduni Vol. 3 1786 pp.</a><!--MARK-->","","Book","0d38fd65-8e94-4b23-9114-5d8506a65dc2","",""
"Gudmundsson, G.","19994","Phylogeny, ontogeny and systematics of Recent Soritacea Ehrenberg 1839 (Foraminiferida)","101-155","","Micropaleontology","","","","<!--MARK--><a href='../../../../publication/eed2dd87-5c6d-4c63-9af4-e78c49575211' class='mouseoverHref'>Gudmundsson, G. 19994. Phylogeny, ontogeny and systematics of Recent Soritacea Ehrenberg 1839 (Foraminiferida).</a> <!--MARK--><!--MARK--><a href='../../../../publication/5644f8bb-64d7-4db0-97fa-ea777593e25b' class='mouseoverHref'><em>Micropaleontology</em></a> <strong>40</strong>: 101-155<!--MARK-->","","Article in Journal","eed2dd87-5c6d-4c63-9af4-e78c49575211","20160404T02:56:07.044+0000","5644f8bb-64d7-4db0-97fa-ea777593e25b"
"Haig, D.W.","1988","Miliolid foraminifera from inner neritic and mud facies of the Papuan Lagoon","203-236","","Journal of Foraminiferal Research","","","","<!--MARK--><a href='../../../../publication/fd1abc2b-a83a-4875-a853-57826d5096f3' class='mouseoverHref'>Haig, D.W. 1988. Miliolid foraminifera from inner neritic and mud facies of the Papuan Lagoon.</a> <!--MARK--><!--MARK--><a href='../../../../publication/9a3da88f-859f-42be-8cb7-40e6d82b3894' class='mouseoverHref'><em>Journal of Foraminiferal Research</em></a> <strong>18</strong>: 203-236<!--MARK-->","","Article in Journal","fd1abc2b-a83a-4875-a853-57826d5096f3","20160401T02:29:46.981+0000","9a3da88f-859f-42be-8cb7-40e6d82b3894"
"Haig, D.W.","1997","Foraminifera from Exmouth Gulf, Western Australia","263-280","","Journal of the Royal Society of Western Australia","","","","<!--MARK--><a href='../../../../publication/350f28ce-5ac7-406b-808d-d5e0b806671d' class='mouseoverHref'>Haig, D.W. 1997. Foraminifera from Exmouth Gulf, Western Australia.</a> <!--MARK--><!--MARK--><a href='../../../../publication/666efb8f-4a3f-4a3d-ae40-e9ab98f3cdf5' class='mouseoverHref'><em>Journal of the Royal Society of Western Australia</em></a> <strong>80</strong>: 263-280<!--MARK-->","","Article in Journal","350f28ce-5ac7-406b-808d-d5e0b806671d","20160111T05:24:17.821+0000","666efb8f-4a3f-4a3d-ae40-e9ab98f3cdf5"
"Halicz, E. & Reiss, Z.","1979","Recent Textulariidae from the Gulf of Elat (?Aqaba?), Red Sea","298-320","","Revista Espanola Micropaleontologica","","","","<!--MARK--><a href='../../../../publication/9e3ca4b5-b91d-4663-ae5f-13a1aa332531' class='mouseoverHref'>Halicz, E. & Reiss, Z. 1979. Recent Textulariidae from the Gulf of Elat (?Aqaba?), Red Sea.</a> <!--MARK--><!--MARK--><a href='../../../../publication/14944f2f-ea3f-4db1-8f41-41398717e738' class='mouseoverHref'><em>Revista Espanola Micropaleontologica</em></a> <strong>11</strong>: 298-320<!--MARK-->","","Article in Journal","9e3ca4b5-b91d-4663-ae5f-13a1aa332531","20160114T03:21:16.904+0000","14944f2f-ea3f-4db1-8f41-41398717e738"
"Hatta, A. & Ujiié, J.","1992","Benthic foraminifera from Coral Seas between Ishigaki and Iriomote Islands, Southern Ryukyu Island Arc, Northwestern Pacific, Part 2, Systematic descriptions of <em>Rotalina</em>","163-287","","Bulletin of the College of Science, University of the Ryukyus","","","","<!--MARK--><a href='../../../../publication/20a3056f-ca15-42ab-8a08-458c08e26add' class='mouseoverHref'>Hatta, A. & Ujiié, J. 1992. Benthic foraminifera from Coral Seas between Ishigaki and Iriomote Islands, Southern Ryukyu Island Arc, Northwestern Pacific, Part 2, Systematic descriptions of <em>Rotalina</em>.</a> <!--MARK--><!--MARK--><a href='../../../../publication/62ace50c-7ce6-46eb-906e-b19bcc5d00d0' class='mouseoverHref'><em>Bulletin of the College of Science, University of the Ryukyus</em></a> <strong>54</strong>: 163-287<!--MARK-->","","Article in Journal","20a3056f-ca15-42ab-8a08-458c08e26add","20160331T03:19:32.862+0000","62ace50c-7ce6-46eb-906e-b19bcc5d00d0"
"Haynes, J.R.","1973","Cardigan Bay recent Foraminifera (cruises of the R. V. Antur, 1962-1964).","1-245","","Bulletin of the British Museum (Natural History) Zoology (Supplement)","","","","<!--MARK--><a href='../../../../publication/289d17a2-cc02-4cde-bea8-6fec93545a14' class='mouseoverHref'>Haynes, J.R. 1973. Cardigan Bay recent Foraminifera (cruises of the R. V. Antur, 1962-1964).</a> <!--MARK--><!--MARK--><a href='../../../../publication/a2656aba-b85d-42c3-a248-b9dc69ac9376' class='mouseoverHref'><em>Bulletin of the British Museum (Natural History) Zoology (Supplement)</em></a> <strong>4</strong>: 1-245<!--MARK-->","","Article in Journal","289d17a2-cc02-4cde-bea8-6fec93545a14","20150330T21:19:38.127+0000","a2656aba-b85d-42c3-a248-b9dc69ac9376"
"Hayward, B.W.","1990","Taxonomy, paleobiogeography and evolutionary history of the Bolivinellidae (Foraminiferida)","1-132","","New Zealand Geological Survey Paleontological Bulletin","","","","<!--MARK--><a href='../../../../publication/b58e2e59-569d-4033-906b-051f5ed02820' class='mouseoverHref'>Hayward, B.W. 1990. Taxonomy, paleobiogeography and evolutionary history of the Bolivinellidae (Foraminiferida).</a> <!--MARK--><!--MARK--><a href='../../../../publication/4f5a9087-45b7-427e-a67a-9dcac05b7122' class='mouseoverHref'><em>New Zealand Geological Survey Paleontological Bulletin</em></a> <strong>63</strong>: 1-132<!--MARK-->","","Article in Journal","b58e2e59-569d-4033-906b-051f5ed02820","20181011T02:28:48.700+0000","4f5a9087-45b7-427e-a67a-9dcac05b7122"
"Hayward, B.W., Grenfell, H.R., Reid, C.M. & Hayward, K.A.","1999","Recent New Zealand shallow-water benthic foraminifera: taxonomy, ecologic distribution, biogeography, and use in paleoenvironmental assessment. Institute of Geological and Nuclear Sciences monographs 21, 1-264","14-249","","Institute of Geological and Nuclear Sciences monographs","","","","<!--MARK--><a href='../../../../publication/234c87bf-ca15-4cce-bcb4-0c142862e7b2' class='mouseoverHref'>Hayward, B.W., Grenfell, H.R., Reid, C.M. & Hayward, K.A. 1999. Recent New Zealand shallow-water benthic foraminifera: taxonomy, ecologic distribution, biogeography, and use in paleoenvironmental assessment. Institute of Geological and Nuclear Sciences monographs 21, 1-264.</a> <!--MARK--><!--MARK--><a href='../../../../publication/950fe944-11cd-491a-89ae-f5a9d654dca9' class='mouseoverHref'><em>Institute of Geological and Nuclear Sciences monographs</em></a> <strong>21</strong>(75): 14-249<!--MARK-->","","Article in Journal","234c87bf-ca15-4cce-bcb4-0c142862e7b2","20181019T00:35:10.439+0000","950fe944-11cd-491a-89ae-f5a9d654dca9"
"Hayward, B.W., Hollis, C.J. & Grenfell, H.R.","1997","Recent Elphidiidae (Foraminiferida) of the South-west Pacific and fossil Elphidiidae of New Zealand","1-170","","Institute of Geological and Nuclear Sciences monographs","","","","<!--MARK--><a href='../../../../publication/ff774461-8dac-439c-9327-c3fc67497ba2' class='mouseoverHref'>Hayward, B.W., Hollis, C.J. & Grenfell, H.R. 1997. Recent Elphidiidae (Foraminiferida) of the South-west Pacific and fossil Elphidiidae of New Zealand.</a> <!--MARK--><!--MARK--><a href='../../../../publication/950fe944-11cd-491a-89ae-f5a9d654dca9' class='mouseoverHref'><em>Institute of Geological and Nuclear Sciences monographs</em></a> <strong>16</strong>: 1-170<!--MARK-->","","Article in Journal","ff774461-8dac-439c-9327-c3fc67497ba2","20181026T05:09:36.585+0000","950fe944-11cd-491a-89ae-f5a9d654dca9"
"Hayward, B.W. & Brazier, R.C.","1980","Taxonomy and distribution of present-day <em>Bolivinella</em>","102-116","","Journal of Foraminiferal Research","","","","<!--MARK--><a href='../../../../publication/5f780c38-cfbf-48c3-82c4-20a644677f4d' class='mouseoverHref'>Hayward, B.W. & Brazier, R.C. 1980. Taxonomy and distribution of present-day <em>Bolivinella</em>.</a> <!--MARK--><!--MARK--><a href='../../../../publication/9a3da88f-859f-42be-8cb7-40e6d82b3894' class='mouseoverHref'><em>Journal of Foraminiferal Research</em></a> <strong>10</strong>(2): 102-116<!--MARK-->","","Article in Journal","5f780c38-cfbf-48c3-82c4-20a644677f4d","20181011T02:18:51.029+0000","9a3da88f-859f-42be-8cb7-40e6d82b3894"
"Heron-Allen, E.& Earland, A.","1915","The foraminifera of the Kerimba Archipelago (Portuguese East Africa). Part II.","543-795","","Transactions of the Zoological Society of London","","","","<!--MARK--><a href='../../../../publication/7c13613f-1be3-4384-8a41-451e34125e46' class='mouseoverHref'>Heron-Allen, E.& Earland, A. 1915. The foraminifera of the Kerimba Archipelago (Portuguese East Africa). Part II.</a> <!--MARK--><!--MARK--><a href='../../../../publication/a7ae5a31-952c-4c34-b35a-2f3e0ad65828' class='mouseoverHref'><em>Transactions of the Zoological Society of London</em></a> <strong>20</strong>: 543-795<!--MARK-->","","Article in Journal","7c13613f-1be3-4384-8a41-451e34125e46","20160114T03:32:34.397+0000","a7ae5a31-952c-4c34-b35a-2f3e0ad65828"
"Heron-Allen, E. & Earland, A.","1932","Foraminifera Part 1. The ice free area of the Falkland Islands and adjacent seas","291-460","","Discovery Reports","","","","<!--MARK--><a href='../../../../publication/527d09dc-44e4-4fb7-89f3-5d49f8a9c717' class='mouseoverHref'>Heron-Allen, E. & Earland, A. 1932. Foraminifera Part 1. The ice free area of the Falkland Islands and adjacent seas.</a> <!--MARK--><!--MARK--><a href='../../../../publication/bb017687-94d0-45a6-b008-1621f11c78da' class='mouseoverHref'><em>Discovery Reports</em></a> <strong>4</strong>: 291-460<!--MARK-->","","Article in Journal","527d09dc-44e4-4fb7-89f3-5d49f8a9c717","20160330T23:16:57.674+0000","bb017687-94d0-45a6-b008-1621f11c78da"
"Hofker, J.","1951","The foraminifera of the Siboga expedition. Part III","513 pp.","","","","","E.J. Brill","<!--MARK--><a href='../../../../publication/00e9a0fc-1963-4e97-a915-713dfd57c779' class='mouseoverHref'>Hofker, J. 1951. <em>The foraminifera of the Siboga expedition. Part III</em>. Leiden : E.J. Brill 513 pp.</a><!--MARK-->","","Book","00e9a0fc-1963-4e97-a915-713dfd57c779","20181019T00:02:24.564+0000",""
"Hofker, J.","1968","Foraminifera from the Bay of Jakarta, Java","11-59","","Bijdragen tot de Dierkunde","","","","<!--MARK--><a href='../../../../publication/1eaabec1-946f-43aa-908d-e2ba7cec72eb' class='mouseoverHref'>Hofker, J. 1968. Foraminifera from the Bay of Jakarta, Java.</a> <!--MARK--><!--MARK--><a href='../../../../publication/5ad4913a-6409-4c81-8588-a73ca3b8d7a2' class='mouseoverHref'><em>Bijdragen tot de Dierkunde</em></a> <strong>37</strong>: 11-59<!--MARK-->","","Article in Journal","1eaabec1-946f-43aa-908d-e2ba7cec72eb","20160113T03:14:00.527+0000","5ad4913a-6409-4c81-8588-a73ca3b8d7a2"
"Hofker, J.","1978","Biological Results of the Snellius Expedition XXX: The Foraminifera collected in 1929 and 1930 in the Eastern part of the Indonesian Archipelago","3-69, pls 1-10","","Zoologische Verhandelingen (Leiden)","","","","<!--MARK--><a href='../../../../publication/39bda25f-e6e5-4e18-affa-8c713de20bea' class='mouseoverHref'>Hofker, J. 1978. Biological Results of the Snellius Expedition XXX: The Foraminifera collected in 1929 and 1930 in the Eastern part of the Indonesian Archipelago.</a> <!--MARK--><!--MARK--><a href='../../../../publication/ef9c29c7-02e1-45c1-816e-05f980b8b1fd' class='mouseoverHref'><em>Zoologische Verhandelingen (Leiden)</em></a> <strong>161</strong>: 3-69, pls 1-10<!--MARK-->","","Article in Journal","39bda25f-e6e5-4e18-affa-8c713de20bea","20171011T05:35:05.380+0000","ef9c29c7-02e1-45c1-816e-05f980b8b1fd"
"Holzmann, M. & Pawlowski, J.","2017","An updated classification of rotaliid foraminifera based on ribosomal DNA phylogeny","18-34","","Marine Micropaleontology","","","","<!--MARK--><a href='../../../../publication/dffa18b8-a119-49c5-b218-c3a9e0fe088b' class='mouseoverHref'>Holzmann, M. & Pawlowski, J. 2017. An updated classification of rotaliid foraminifera based on ribosomal DNA phylogeny.</a> <!--MARK--><!--MARK--><a href='../../../../publication/6f2aebd1-4767-4e85-bc21-396593c9245a' class='mouseoverHref'><em>Marine Micropaleontology</em></a> <strong>132</strong>: 18-34<!--MARK-->","","Article in Journal","dffa18b8-a119-49c5-b218-c3a9e0fe088b","20181015T22:45:31.392+0000","6f2aebd1-4767-4e85-bc21-396593c9245a"
"Hornibrook, N. de B. & Vella, P.","1954","Notes on the generic names of some rotaliform foraminifera","24-28","","The Micropaleontologist","","","","<!--MARK--><a href='../../../../publication/caa4c267-919c-4850-a415-a99023bb4f32' class='mouseoverHref'>Hornibrook, N. de B. & Vella, P. 1954. Notes on the generic names of some rotaliform foraminifera.</a> <!--MARK--><!--MARK--><a href='../../../../publication/393d07de-6f03-4371-80c9-e73008081238' class='mouseoverHref'><em>The Micropaleontologist</em></a> <strong>8</strong>: 24-28<!--MARK-->","","Article in Journal","caa4c267-919c-4850-a415-a99023bb4f32","20181019T02:39:36.043+0000","393d07de-6f03-4371-80c9-e73008081238"
"Hottinger, L., Halicz, E. & Reiss, Z.","1993","Recent Foraminiferida from the Gulf of Aqaba, Red Sea","","","Slovenska Akademija Znanosti in Umetnosti","","","","<!--MARK--><a href='../../../../publication/11816033-5c65-4669-981e-15040dc32861' class='mouseoverHref'>Hottinger, L., Halicz, E. & Reiss, Z. 1993. Recent Foraminiferida from the Gulf of Aqaba, Red Sea.</a> <!--MARK--><!--MARK--><a href='../../../../publication/54637577-0c69-4315-bac6-c8249833a41d' class='mouseoverHref'><em>Slovenska Akademija Znanosti in Umetnosti</em></a> <!--MARK-->","","Article in Journal","11816033-5c65-4669-981e-15040dc32861","20160114T03:23:50.234+0000","54637577-0c69-4315-bac6-c8249833a41d"
"Javaux, E.J. & Scott, D.B.","2003","Illustration of modern benthic foraminifera from Bermuda and remarks on distribution in other subtropical/tropical areas","1-29","","Palaeontologia Electronica","","","","<!--MARK--><a href='../../../../publication/0e85433c-c14c-4f08-84c5-7fcb7aec529b' class='mouseoverHref'>Javaux, E.J. & Scott, D.B. 2003. Illustration of modern benthic foraminifera from Bermuda and remarks on distribution in other subtropical/tropical areas.</a> <!--MARK--><!--MARK--><a href='../../../../publication/4dfc4fc2-9cfc-4338-87e7-c42be5622d4e' class='mouseoverHref'><em>Palaeontologia Electronica</em></a> <strong>6</strong>: 1-29<!--MARK-->","","Article in Journal","0e85433c-c14c-4f08-84c5-7fcb7aec529b","20160330T01:47:45.434+0000","4dfc4fc2-9cfc-4338-87e7-c42be5622d4e"
"Jell, J., Maxwell, W. & McKellar, R.","1965","The significance of the larger foraminifera in the Heron Island Reef sediments","273-279","","Journal of Paleontology","","","","<!--MARK--><a href='../../../../publication/aa74e46a-100b-43a8-bc33-bf053486dd0e' class='mouseoverHref'>Jell, J., Maxwell, W. & McKellar, R. 1965. The significance of the larger foraminifera in the Heron Island Reef sediments.</a> <!--MARK--><!--MARK--><a href='../../../../publication/fa227542-1af1-42e7-b04c-401bebd1437f' class='mouseoverHref'><em>Journal of Paleontology</em></a> <strong>39</strong>(2): 273-279<!--MARK-->","","Article in Journal","aa74e46a-100b-43a8-bc33-bf053486dd0e","20181009T05:56:04.932+0000","fa227542-1af1-42e7-b04c-401bebd1437f"
"Jones, R.W.","1994","The Challenger Foraminifera","","","","","","Oxford University Press","<!--MARK--><a href='../../../../publication/178f5674-7a39-450e-a359-8f466ea55780' class='mouseoverHref'>Jones, R.W. 1994. <em>The Challenger Foraminifera</em>. New York : Oxford University Press.</a><!--MARK-->","","Book","178f5674-7a39-450e-a359-8f466ea55780","20160113T03:37:17.616+0000",""
"Jones, T.R.","1895","A monograph of the foraminifera of the Crag, Pt. 2.","i-vii, 73-210, pls. V-VII","","Monograph of the Palaeontographical Society, London","","","","<!--MARK--><a href='../../../../publication/e1257d73-79af-4ee6-bf3c-3bdd37b79ba0' class='mouseoverHref'>Jones, T.R. 1895. A monograph of the foraminifera of the Crag, Pt. 2.</a> <!--MARK--><!--MARK--><a href='../../../../publication/0d2b3870-5508-419d-9ad2-6411970a0c93' class='mouseoverHref'><em>Monograph of the Palaeontographical Society, London</em></a> i-vii, 73-210, pls. V-VII<!--MARK-->","","Article in Journal","e1257d73-79af-4ee6-bf3c-3bdd37b79ba0","20181010T23:16:24.273+0000","0d2b3870-5508-419d-9ad2-6411970a0c93"
"Karrer, F.","1865","Die foraminiferern-fauna des Tertiären Grünsandsteines der Orakei-Bay bei Auckland. Novara Expedition 1857-1859","69-86","","Geologisches Thiel (Vienna)","","","","<!--MARK--><a href='../../../../publication/50758370-6224-472f-ab97-40a19eafbe5b' class='mouseoverHref'>Karrer, F. 1865. Die foraminiferern-fauna des Tertiären Grünsandsteines der Orakei-Bay bei Auckland. Novara Expedition 1857-1859.</a> <!--MARK--><!--MARK--><a href='../../../../publication/5dff26cc-e4cc-410c-9520-64057603d295' class='mouseoverHref'><em>Geologisches Thiel (Vienna)</em></a> <strong>1</strong>: 69-86<!--MARK-->","","Article in Journal","50758370-6224-472f-ab97-40a19eafbe5b","20160113T01:15:14.321+0000","5dff26cc-e4cc-410c-9520-64057603d295"
"Lacroix, E.","1938","Révision du genre <em>Massilina</em>","1-11","","Bulletin de l'Institut Océanographique Monaco","","","","<!--MARK--><a href='../../../../publication/6068d3fc-69af-4dda-a73d-c92ec2c0c309' class='mouseoverHref'>Lacroix, E. 1938. Révision du genre <em>Massilina</em>.</a> <!--MARK--><!--MARK--><a href='../../../../publication/9df4671f-e0a0-49cc-b5f1-c5b125c26f94' class='mouseoverHref'><em>Bulletin de l'Institut Océanographique Monaco</em></a> <strong>754</strong>: 1-11<!--MARK-->","","Article in Journal","6068d3fc-69af-4dda-a73d-c92ec2c0c309","20180911T06:18:41.509+0000","9df4671f-e0a0-49cc-b5f1-c5b125c26f94"
"Lagoe, M.B.","1977","Recent benthic foraminifera from the Central Arctic Ocean","106-129","","Journal of Foraminiferal Research","","","","<!--MARK--><a href='../../../../publication/686ca4b3-9b2f-4dd9-b013-09e0b23ad9bf' class='mouseoverHref'>Lagoe, M.B. 1977. Recent benthic foraminifera from the Central Arctic Ocean.</a> <!--MARK--><!--MARK--><a href='../../../../publication/9a3da88f-859f-42be-8cb7-40e6d82b3894' class='mouseoverHref'><em>Journal of Foraminiferal Research</em></a> <strong>7</strong>: 106-129<!--MARK-->","","Article in Journal","686ca4b3-9b2f-4dd9-b013-09e0b23ad9bf","20160330T01:38:54.899+0000","9a3da88f-859f-42be-8cb7-40e6d82b3894"
"Langer, M.R.","1992","New Recent foraminiferal genera and species from the lagoon at Madang, Papua New Guinea","85-93","","Journal of Micropalaeontology","","","","<!--MARK--><a href='../../../../publication/bc84da06-3a82-4374-ac6a-f7d01636ef46' class='mouseoverHref'>Langer, M.R. 1992. New Recent foraminiferal genera and species from the lagoon at Madang, Papua New Guinea.</a> <!--MARK--><!--MARK--><a href='../../../../publication/c4a51b36-ff76-4e28-a65d-21217766c6c7' class='mouseoverHref'><em>Journal of Micropalaeontology</em></a> <strong>11</strong>(1): 85-93<!--MARK-->","","Article in Journal","bc84da06-3a82-4374-ac6a-f7d01636ef46","20180911T06:03:47.495+0000","c4a51b36-ff76-4e28-a65d-21217766c6c7"
"Le Calvez, Y.","1977","Révision des foraminifères de la collection d'Orbigny. II. Foraminifères de l'Île de Cuba - Tome 2","","","Cahiers de Micropaléontologie","","","","<!--MARK--><a href='../../../../publication/472d0365-47fc-4c1a-9182-d06e696bd03a' class='mouseoverHref'>Le Calvez, Y. 1977. Révision des foraminifères de la collection d'Orbigny. II. Foraminifères de l'Île de Cuba - Tome 2.</a> <!--MARK--><!--MARK--><a href='../../../../publication/ce7ffc31-f6a1-4afc-8744-c49b75ef7f2f' class='mouseoverHref'><em>Cahiers de Micropaléontologie</em></a> <strong>1977</strong>(2)<!--MARK-->","","Article in Journal","472d0365-47fc-4c1a-9182-d06e696bd03a","20160114T01:20:19.109+0000","ce7ffc31-f6a1-4afc-8744-c49b75ef7f2f"
"Lendenfeld, R.V.","1885","The Australian freshwater Rhizopoda. Part I","723-725","","Proceedings of the Linnean Society of New South Wales Supplement","","","","<!--MARK--><a href='../../../../publication/90ae5f64-f9bb-467c-8df8-4cc274315f0c' class='mouseoverHref'>Lendenfeld, R.V. 1885. The Australian freshwater Rhizopoda. Part I.</a> <!--MARK--><!--MARK--><a href='../../../../publication/feb1673a-6229-4ecf-a68f-9e7f602e5fbd' class='mouseoverHref'><em>Proceedings of the Linnean Society of New South Wales Supplement</em></a> <strong>10</strong>: 723-725<!--MARK-->","","Article in Journal","90ae5f64-f9bb-467c-8df8-4cc274315f0c","20110106T05:58:19.727+0000","feb1673a-6229-4ecf-a68f-9e7f602e5fbd"
"Lobegeier, M.","2001","Foraminiferal assemblages and their bulk contribution to carbonate sediment, Green Island Reef, Great Barrier Reef Province","425 pp.","","","","","","<!--MARK--><a href='../../../../publication/39a5f357-76b9-4d38-a059-3dda3ca90466' class='mouseoverHref'>Lobegeier, M. 2001. Foraminiferal assemblages and their bulk contribution to carbonate sediment, Green Island Reef, Great Barrier Reef Province. Unpublished Thesis. James Cook University. 425 pp.</a>","","Miscellaneous","39a5f357-76b9-4d38-a059-3dda3ca90466","20180914T06:02:41.139+0000",""
"Lobegeier, M.K.","1995","The zonation of the reef and the distribution of foraminifera at Low Isles, central Great Barrier Reef","168 pp.","","","","","","<!--MARK--><a href='../../../../publication/83a0c6c6-99fe-44d1-bcaf-cffba9db1081' class='mouseoverHref'>Lobegeier, M.K. 1995. The zonation of the reef and the distribution of foraminifera at Low Isles, central Great Barrier Reef. Honours Thesis, Department of Earth Sciences, University of Queensland, Brisbane. 168 pp.</a>","","Miscellaneous","83a0c6c6-99fe-44d1-bcaf-cffba9db1081","20181026T05:00:01.733+0000",""
"Lobegeier, M.K.","2002","Benthic Foraminifera of the family Calcarinidae from Green Island Reef, Great Barrier Reef Province","201-216","","Journal of Foraminiferal Research","","","","<!--MARK--><a href='../../../../publication/56280b8e-ad8b-4247-954d-00cfcd990f3c' class='mouseoverHref'>Lobegeier, M.K. 2002. Benthic Foraminifera of the family Calcarinidae from Green Island Reef, Great Barrier Reef Province.</a> <!--MARK--><!--MARK--><a href='../../../../publication/9a3da88f-859f-42be-8cb7-40e6d82b3894' class='mouseoverHref'><em>Journal of Foraminiferal Research</em></a> <strong>32</strong>(3): 201-216<!--MARK-->","","Article in Journal","56280b8e-ad8b-4247-954d-00cfcd990f3c","20181026T04:49:26.260+0000","9a3da88f-859f-42be-8cb7-40e6d82b3894"
"Loeblich, A.R. & Tappan, H.","1953","Studies of Arctic foraminifera","1-150","","Smithsonian Miscellaneous Collections","","","","<!--MARK--><a href='../../../../publication/3788d088-679c-4c69-bec7-25d6654a04b3' class='mouseoverHref'>Loeblich, A.R. & Tappan, H. 1953. Studies of Arctic foraminifera.</a> <!--MARK--><!--MARK--><a href='../../../../publication/2ad18d4c-326c-454e-bf1d-5321aee079b3' class='mouseoverHref'><em>Smithsonian Miscellaneous Collections</em></a> <strong>121</strong>: 1-150<!--MARK-->","","Article in Journal","3788d088-679c-4c69-bec7-25d6654a04b3","20181018T05:48:27.127+0000","2ad18d4c-326c-454e-bf1d-5321aee079b3"
"Loeblich, A.R. & Tappan, H.","1957","Eleven New Genera of Foraminifera","223-232","","United States National Museum Bulletin","","","","<!--MARK--><a href='../../../../publication/55e6b14e-f61e-4bd4-8546-3a6166ddc10f' class='mouseoverHref'>Loeblich, A.R. & Tappan, H. 1957. Eleven New Genera of Foraminifera.</a> <!--MARK--><!--MARK--><a href='../../../../publication/aeaf76dd-a2f8-4bdf-b582-e911ff8a7df3' class='mouseoverHref'><em>United States National Museum Bulletin</em></a> <strong>215</strong>: 223-232<!--MARK-->","","Article in Journal","55e6b14e-f61e-4bd4-8546-3a6166ddc10f","20181012T00:20:53.362+0000","aeaf76dd-a2f8-4bdf-b582-e911ff8a7df3"
"Loeblich, A.R. & Tappan, H.","1962","Six new generic names in the Mycetozoida (Trichiidae) and Foraminiferida (Fischerinidae, Buliminidae, Caucasinidae and Pleurostomellidae), and a redescription of <em>Loxostomum</em> (Loxostomidae, new family)","107-113","","Proceedings of the Biological Society of Washington","","","","<!--MARK--><a href='../../../../publication/aea9fd35-e18a-4c14-b0eb-61b4bb2e8a44' class='mouseoverHref'>Loeblich, A.R. & Tappan, H. 1962. Six new generic names in the Mycetozoida (Trichiidae) and Foraminiferida (Fischerinidae, Buliminidae, Caucasinidae and Pleurostomellidae), and a redescription of <em>Loxostomum</em> (Loxostomidae, new family).</a> <!--MARK--><!--MARK--><a href='../../../../publication/4153f314-120d-40d7-987b-b5ba47399aec' class='mouseoverHref'><em>Proceedings of the Biological Society of Washington</em></a> <strong>75</strong>: 107-113<!--MARK-->","","Article in Journal","aea9fd35-e18a-4c14-b0eb-61b4bb2e8a44","20181016T05:22:30.894+0000","4153f314-120d-40d7-987b-b5ba47399aec"
