"PUB_AUTHOR","PUB_YEAR","PUB_TITLE","PUB_PAGES","PUB_PARENT_BOOK_TITLE","PUB_PARENT_JOURNAL_TITLE","PUB_PARENT_ARTICLE_TITLE","PUB_PUBLICATION_DATE","PUB_PUBLISHER","PUB_FORMATTED","PUB_QUALIFICATION","PUB_TYPE","PUBLICATION_GUID","PUBLICATION_LAST_UPDATE","PARENT_PUBLICATION_GUID"
"Amyot, C.J.B. & Audinet-Serville, J.G.","1843","Histoire Naturelle des Insects. Hémiptères.","676 pp.","","","","","Librairie Encyclopédique de Roret, Rue Hautefeuille 10 B13","<!--MARK--><a href='null79cdc79d-5ec6-4f44-9cae-b6fbe63fa288' class='mouseoverHref'>Amyot, C.J.B. & Audinet-Serville, J.G. 1843. <em>Histoire Naturelle des Insects. Hémiptères</em>. Paris : Librairie Encyclopédique de Roret, Rue Hautefeuille 10 B13 676 pp.</a><!--MARK-->","","Book","79cdc79d-5ec6-4f44-9cae-b6fbe63fa288","20110810T03:55:00.196+0000",""
"Evans, J.W.","1937","Australian Leafhoppers (Jassoidea: Homoptera) Part 4. -- (Ledridae, Ulopidae and Euscelidae, Paradorydiini)","37-50","","Papers and Proceedings of the Royal Society of Tasmania","","","","<!--MARK--><a href='nulld472c44a-3924-49aa-ad34-8fc07d7f685d' class='mouseoverHref'>Evans, J.W. 1937. Australian Leafhoppers (Jassoidea: Homoptera) Part 4. -- (Ledridae, Ulopidae and Euscelidae, Paradorydiini).</a> <!--MARK--><!--MARK--><a href='nulldb793adc-ebf2-40c5-9d92-48a121ea03ae' class='mouseoverHref'><em>Papers and Proceedings of the Royal Society of Tasmania</em></a> <strong>1936</strong>: 37-50<!--MARK-->","","Article in Journal","d472c44a-3924-49aa-ad34-8fc07d7f685d","20081009T05:11:37.000+0000","db793adc-ebf2-40c5-9d92-48a121ea03ae"
"Evans, J.W.","1939","Some new Australian Leafhoppers (Homoptera: Jassoidea)","44-50","","Transactions of the Royal Society of South Australia","","","","<!--MARK--><a href='null2c190f24-7852-4820-ab07-7f4f39481825' class='mouseoverHref'>Evans, J.W. 1939. Some new Australian Leafhoppers (Homoptera: Jassoidea).</a> <!--MARK--><!--MARK--><a href='null8b48b0a3-dd7a-4aea-be0d-10a223710ebc' class='mouseoverHref'><em>Transactions of the Royal Society of South Australia</em></a> <strong>63</strong>(1): 44-50<!--MARK-->","","Article in Journal","2c190f24-7852-4820-ab07-7f4f39481825","20081009T05:11:37.000+0000","8b48b0a3-dd7a-4aea-be0d-10a223710ebc"
"Evans, J.W.","1942","New leafhoppers from Tasmania and Queensland","27-30","","Papers and Proceedings of the Royal Society of Tasmania","","","","<!--MARK--><a href='nullec02d844-4b2a-41a9-a17d-ee1c287e380a' class='mouseoverHref'>Evans, J.W. 1942. New leafhoppers from Tasmania and Queensland.</a> <!--MARK--><!--MARK--><a href='nulldb793adc-ebf2-40c5-9d92-48a121ea03ae' class='mouseoverHref'><em>Papers and Proceedings of the Royal Society of Tasmania</em></a> <strong>1941</strong>: 27-30<!--MARK-->","","Article in Journal","ec02d844-4b2a-41a9-a17d-ee1c287e380a","20081009T05:11:37.000+0000","db793adc-ebf2-40c5-9d92-48a121ea03ae"
"Evans, J.W.","1942","Some new leafhoppers from Australia and Fiji","49-51","","Proceedings of the Royal Society of Queensland","","","","<!--MARK--><a href='null3f9d7c5e-9d4a-414a-85e5-a61b37f24b9c' class='mouseoverHref'>Evans, J.W. 1942. Some new leafhoppers from Australia and Fiji.</a> <!--MARK--><!--MARK--><a href='null642ab613-813a-48d0-8bc0-42c78157f7b0' class='mouseoverHref'><em>Proceedings of the Royal Society of Queensland</em></a> <strong>54</strong>(5): 49-51<!--MARK-->","","Article in Journal","3f9d7c5e-9d4a-414a-85e5-a61b37f24b9c","20081009T05:11:37.000+0000","642ab613-813a-48d0-8bc0-42c78157f7b0"
"Evans, J.W.","1947","A natural classification of leafhoppers (Jassoidea, Homoptera) Part 3. Jassidae","105-271","","Transactions of the Royal Entomological Society of London","","","","<!--MARK--><a href='nulld51ed5a3-d2e5-49d0-860e-de6c68c3942a' class='mouseoverHref'>Evans, J.W. 1947. A natural classification of leafhoppers (Jassoidea, Homoptera) Part 3. Jassidae.</a> <!--MARK--><!--MARK--><a href='nullaa458993-1b17-4c34-bd31-d6f8224d9b7d' class='mouseoverHref'><em>Transactions of the Royal Entomological Society of London</em></a> <strong>98</strong>(6): 105-271<!--MARK-->","","Article in Journal","d51ed5a3-d2e5-49d0-860e-de6c68c3942a","20081009T05:11:37.000+0000","aa458993-1b17-4c34-bd31-d6f8224d9b7d"
"Evans, J.W.","1947","Some new Ulopinae (Homoptera: Jassidae)","140-150","","Annals and Magazine of Natural History","","","","<!--MARK--><a href='nullca71df90-8c57-499c-8fa2-37780c4769d1' class='mouseoverHref'>Evans, J.W. 1947. Some new Ulopinae (Homoptera: Jassidae).</a> <!--MARK--><!--MARK--><a href='nullefa8de69-3a29-4a43-8ef2-cbefda205976' class='mouseoverHref'><em>Annals and Magazine of Natural History</em></a> 8 <strong>14</strong>: 140-150<!--MARK-->","","Article in Journal","ca71df90-8c57-499c-8fa2-37780c4769d1","20081009T05:11:37.000+0000","efa8de69-3a29-4a43-8ef2-cbefda205976"
"Evans, J.W.","1966","The leafhoppers and froghoppers of Australia and New Zealand","1-347","","Memoirs of the Australian Museum","","","","<!--MARK--><a href='nullcf31631c-c286-4cf5-abd5-ec22b69d45f8' class='mouseoverHref'>Evans, J.W. 1966. The leafhoppers and froghoppers of Australia and New Zealand.</a> <!--MARK--><!--MARK--><a href='null272826c2-c2bf-425b-bd6f-11ddaf2aaeaa' class='mouseoverHref'><em>Memoirs of the Australian Museum</em></a> <strong>12</strong>: 1-347<!--MARK-->","","Article in Journal","cf31631c-c286-4cf5-abd5-ec22b69d45f8","20100816T04:29:34.739+0000","272826c2-c2bf-425b-bd6f-11ddaf2aaeaa"
"Evans, J.W.","1977","The leafhoppers and froghoppers of Australia and New Zealand. Part 2","83-129","","Records of the Australian Museum","","","","<!--MARK--><a href='nullccdcf7ef-771c-4b0b-95bf-e8adf211b83a' class='mouseoverHref'>Evans, J.W. 1977. The leafhoppers and froghoppers of Australia and New Zealand. Part 2.</a> <!--MARK--><!--MARK--><a href='null7c07530b-0b38-44f5-8f95-368da97d6ac2' class='mouseoverHref'><em>Records of the Australian Museum</em></a> <strong>31</strong>(3): 83-129<!--MARK-->","","Article in Journal","ccdcf7ef-771c-4b0b-95bf-e8adf211b83a","20081009T05:11:37.000+0000","7c07530b-0b38-44f5-8f95-368da97d6ac2"
"Jacobi, A.","1909","Homoptera","337-345","","Die Fauna Südwest-Australiens. Ergebnisse der Hamburger Südwest-Australischen Forschungsreise 1905","","","","<!--MARK--><a href='nullfcf3d053-9fba-429c-9fc4-d0fb584636c2' class='mouseoverHref'>Jacobi, A. 1909. Homoptera.</a> <!--MARK--><!--MARK--><a href='nulld7dceaf5-10b5-4fbd-bc2e-64d3b78f1dfc' class='mouseoverHref'><em>Die Fauna Südwest-Australiens. Ergebnisse der Hamburger Südwest-Australischen Forschungsreise 1905</em></a> <strong>2</strong>(20): 337-345<!--MARK-->","","Article in Journal","fcf3d053-9fba-429c-9fc4-d0fb584636c2","20081009T05:11:37.000+0000","d7dceaf5-10b5-4fbd-bc2e-64d3b78f1dfc"
"Kirkaldy, G.W.","1906","Leafhoppers and their natural enemies","271-479","","Bulletin of the Hawaiian Sugar Planters' Association Experimental Station Entomological Series","","","","<!--MARK--><a href='nulle8227547-7cdd-4e84-83a4-90fb28f1b8e9' class='mouseoverHref'>Kirkaldy, G.W. 1906. Leafhoppers and their natural enemies.</a> <!--MARK--><!--MARK--><a href='null434303ef-012d-4278-bb03-dfca5d1e6fec' class='mouseoverHref'><em>Bulletin of the Hawaiian Sugar Planters' Association Experimental Station Entomological Series</em></a> <strong>1</strong>(9): 271-479<!--MARK-->","","Article in Journal","e8227547-7cdd-4e84-83a4-90fb28f1b8e9","20081009T05:11:37.000+0000","434303ef-012d-4278-bb03-dfca5d1e6fec"
"Knight, W.J.","1973","Ulopinae of New Zealand (Homoptera: Cicadellidae)","971-1007","","New Zealand Journal of Science","","","","<!--MARK--><a href='nullf6673eb3-2d7b-4901-bf20-534b2c5e4896' class='mouseoverHref'>Knight, W.J. 1973. Ulopinae of New Zealand (Homoptera: Cicadellidae).</a> <!--MARK--><!--MARK--><a href='null7ed29f42-7cc6-4afd-8b74-710847db4a17' class='mouseoverHref'><em>New Zealand Journal of Science</em></a> <strong>16</strong>: 971-1007<!--MARK-->","","Article in Journal","f6673eb3-2d7b-4901-bf20-534b2c5e4896","20120319T01:57:42.288+0000","7ed29f42-7cc6-4afd-8b74-710847db4a17"
"Le Peletier de Saint-Fargeau, A.L.M. & Audinet-Serville, J.G.","1825","Tettigometre, <i>Tettigometra</i> and Tettigone, <i>Tettigonia</i>","600-613","","Olivier's Encylopédie méthodique. Histoire naturelle. Entomologie, ou histoire naturelle des Crustacés, des Arachnides et des Insectes","","","","<!--MARK--><a href='nulld0538cf8-2174-4c63-bea5-26d8269e6c21' class='mouseoverHref'>Le Peletier de Saint-Fargeau, A.L.M. & Audinet-Serville, J.G. 1825. Tettigometre, <i>Tettigometra</i> and Tettigone, <i>Tettigonia</i>.</a> <!--MARK--><!--MARK--><a href='null2ef8409e-c22a-45e0-ab2a-13de07f29fce' class='mouseoverHref'><em>Olivier's Encylopédie méthodique. Histoire naturelle. Entomologie, ou histoire naturelle des Crustacés, des Arachnides et des Insectes</em></a> <strong>10</strong>: 600-613<!--MARK-->","","Article in Journal","d0538cf8-2174-4c63-bea5-26d8269e6c21","20081009T05:11:37.000+0000","2ef8409e-c22a-45e0-ab2a-13de07f29fce"
"McKamey, S.H.","2006","Further new genus group names in the Cicadellidae (Hemiptera)","502-510","","Proceedings of the Entomological Society of Washington","","","","<!--MARK--><a href='nulla20d914e-f580-4007-b14a-8fef09211cd4' class='mouseoverHref'>McKamey, S.H. 2006. Further new genus group names in the Cicadellidae (Hemiptera).</a> <!--MARK--><!--MARK--><a href='null4ba9cd44-fd2a-4a01-b171-da890c5efd6b' class='mouseoverHref'><em>Proceedings of the Entomological Society of Washington</em></a> <strong>108</strong>(3): 502-510<!--MARK-->","","Article in Journal","a20d914e-f580-4007-b14a-8fef09211cd4","20081009T05:11:37.000+0000","4ba9cd44-fd2a-4a01-b171-da890c5efd6b"
"Moir, M.L., Majer, J.D. & Fletcher, M.J.","2003","New records for Hemiptera species in Western Australia","353-357","","Records of the Western Australian Museum","","","","<!--MARK--><a href='nulld8c53dea-5b8d-4f32-a70d-0ace8134fa50' class='mouseoverHref'>Moir, M.L., Majer, J.D. & Fletcher, M.J. 2003. New records for Hemiptera species in Western Australia.</a> <!--MARK--><!--MARK--><a href='nulla2cbd1fb-97d5-493a-a1d7-c2b99709890b' class='mouseoverHref'><em>Records of the Western Australian Museum</em></a> <strong>21</strong>(4): 353-357<!--MARK-->","","Article in Journal","d8c53dea-5b8d-4f32-a70d-0ace8134fa50","","a2cbd1fb-97d5-493a-a1d7-c2b99709890b"
"Signoret, V.A.","1880","Essai sur les Jassides Stål, Fieb, et plus particulièrement sur les Acocéphalides Puton","41-70, 189-212, 347-366","","Annales de la Société Entomologique de France","","","","<!--MARK--><a href='nullf38a9815-c39d-4d6d-8999-071ae69457cf' class='mouseoverHref'>Signoret, V.A. 1880. Essai sur les Jassides Stål, Fieb, et plus particulièrement sur les Acocéphalides Puton.</a> <!--MARK--><!--MARK--><a href='null6462279b-2aaf-46a3-a434-cab7d8a2c33d' class='mouseoverHref'><em>Annales de la Société Entomologique de France</em></a> 5 <strong>10</strong>: 41-70, 189-212, 347-366<!--MARK-->","","Article in Journal","f38a9815-c39d-4d6d-8999-071ae69457cf","20081009T05:11:37.000+0000","6462279b-2aaf-46a3-a434-cab7d8a2c33d"
"Waterhouse, G.R.","1839","Descriptions of some new species of exotic insects","188-196","","Transactions of the Royal Entomological Society of London","","","","<!--MARK--><a href='null49945ef0-d872-4f52-96dd-cad2c85d29ba' class='mouseoverHref'>Waterhouse, G.R. 1839. Descriptions of some new species of exotic insects.</a> <!--MARK--><!--MARK--><a href='nullaa458993-1b17-4c34-bd31-d6f8224d9b7d' class='mouseoverHref'><em>Transactions of the Royal Entomological Society of London</em></a> <strong>2</strong>: 188-196<!--MARK-->","","Article in Journal","49945ef0-d872-4f52-96dd-cad2c85d29ba","20081009T05:11:37.000+0000","aa458993-1b17-4c34-bd31-d6f8224d9b7d"
