"PUB_AUTHOR","PUB_YEAR","PUB_TITLE","PUB_PAGES","PUB_PARENT_BOOK_TITLE","PUB_PARENT_JOURNAL_TITLE","PUB_PARENT_ARTICLE_TITLE","PUB_PUBLICATION_DATE","PUB_PUBLISHER","PUB_FORMATTED","PUB_QUALIFICATION","PUB_TYPE","PUBLICATION_GUID","PUBLICATION_LAST_UPDATE","PARENT_PUBLICATION_GUID"
"Moore, R.C. (ed.)","1969","Treatise on Invertebrate Paleontology. Part N. Mollusca 6. Bivalvia","xxxviii + ii, 952 pp.","","","","","Geological Society of America & University of Kansas Press","<!--MARK--><a href='../../../../publication/66152c72-c3cf-44e9-aab4-2893ac3909cb' class='mouseoverHref'>Moore, R.C. (ed.) 1969. <em>Treatise on Invertebrate Paleontology. Part N. Mollusca 6. Bivalvia</em>. Boulder, Colorado & Lawrence, Kansas : Geological Society of America & University of Kansas Press Vols 1 & 2 xxxviii + ii, 952 pp.</a><!--MARK--> [Vol.1, pp. i-xxxviii + N1-N489; Vol. 2, pp. i-ii + N491-N952]","Vol.1, pp. i-xxxviii + N1-N489; Vol. 2, pp. i-ii + N491-N952","Book","66152c72-c3cf-44e9-aab4-2893ac3909cb","20130109T05:00:17.234+0000",""
"Poutiers, J. M.","1981","Mollusques : Bivalves, in Résultats des campagnes MUSORSTOM. I - Philippines (18-28 mars 1976)","325-356","","Collection Mémoires ORSTOM","","","","<!--MARK--><a href='../../../../publication/aea41111-dabf-4582-bd47-e88a99e5ed4b' class='mouseoverHref'>Poutiers, J. M. 1981. Mollusques : Bivalves, in Résultats des campagnes MUSORSTOM. I - Philippines (18-28 mars 1976).</a> <!--MARK--><!--MARK--><a href='../../../../publication/ca667856-1b42-4982-9ba9-5f58a2ff3349' class='mouseoverHref'><em>Collection Mémoires ORSTOM</em></a> <strong>91</strong>: 325-356<!--MARK-->","","Article in Journal","aea41111-dabf-4582-bd47-e88a99e5ed4b","20110816T23:26:00.197+0000","ca667856-1b42-4982-9ba9-5f58a2ff3349"
"Poutiers, J-M. & Bernard, F.R.","1995","Carnivorous bivalve molluscs (Anomalodesmata) from the tropical western Pacific Ocean, with a proposed classification and a catalogue of Recent species","pp. 107-188","","Mémoires du Muséum national d'Histoire naturelle, Paris","Résultats des Campagnes Muso","","","<!--MARK--><a href='../../../../publication/370404b1-46b6-4905-9e35-7cc7b595c62f' class='mouseoverHref'>Poutiers, J-M. & Bernard, F.R. 1995. Carnivorous bivalve molluscs (Anomalodesmata) from the tropical western Pacific Ocean, with a proposed classification and a catalogue of Recent species. pp. 107-188</a> <!--MARK--><em>in</em> <!--MARK--><a href='../../../../publication/208a3823-4c14-40ca-9822-bfd1a3d56ede' class='mouseoverHref'>Bouchet, P. (ed.). Résultats des Campagnes Muso.</a> <!--MARK--><!--MARK--><a href='../../../../publication/93c2cf00-5323-4c6b-85b2-9b9ff8e2dfb9' class='mouseoverHref'><em>Mémoires du Muséum national d'Histoire naturelle, Paris</em></a><!--MARK--> [1936-1950] <strong>167</strong>: 654<!--MARK-->","","Section in Article","370404b1-46b6-4905-9e35-7cc7b595c62f","20131028T23:09:25.035+0000","208a3823-4c14-40ca-9822-bfd1a3d56ede"
"Simone, L.R.L. & C.M. Cunha","2008","Revision of the genus <em>Spinosipella</em> (Bivalvia: Verticordiidae), with descriptions of two new species from Brazil","57-78","","Nautilus","","","","<!--MARK--><a href='../../../../publication/ff873188-8c65-4a4b-803e-fe4baf30ae60' class='mouseoverHref'>Simone, L.R.L. & C.M. Cunha 2008. Revision of the genus <em>Spinosipella</em> (Bivalvia: Verticordiidae), with descriptions of two new species from Brazil.</a> <!--MARK--><!--MARK--><a href='../../../../publication/d581b486-faa4-4bf9-8f3f-b54bfdbff9bc' class='mouseoverHref'><em>Nautilus</em></a> <strong>122</strong>(2): 57-78<!--MARK-->","","Article in Journal","ff873188-8c65-4a4b-803e-fe4baf30ae60","20131021T02:03:09.563+0000","d581b486-faa4-4bf9-8f3f-b54bfdbff9bc"
"Smith, E.A.","1885","Report on the Lamellibranchiata collected by H.M.S. Challenger during the years 1873-1876","1-341, 25 pls","","Report on the Scientific Results of the Voyage of H.M.S. Challenger 1873-1876, Zoology","","","","<!--MARK--><a href='../../../../publication/43ba8020-1a78-47e2-95c4-85887dd1d87c' class='mouseoverHref'>Smith, E.A. 1885. Report on the Lamellibranchiata collected by H.M.S. Challenger during the years 1873-1876.</a> <!--MARK--><!--MARK--><a href='../../../../publication/1db4d8a3-1c27-4eff-aef5-d93514e06c4f' class='mouseoverHref'><em>Report on the Scientific Results of the Voyage of H.M.S. Challenger 1873-1876, Zoology</em></a> <strong>13</strong>(35): 1-341, 25 pls<!--MARK-->","","Article in Journal","43ba8020-1a78-47e2-95c4-85887dd1d87c","20130131T05:12:19.414+0000","1db4d8a3-1c27-4eff-aef5-d93514e06c4f"
"Thiele, J. & Jaeckel, S.","1931","Muscheln der Deutschen Tiefsee-Expedition","161-268","","Wissenschaftliche Ergebnisse der Deutschen Tiefsee-Expedition auf dem Dampfer Valdivia 1898-1899","","","","<!--MARK--><a href='../../../../publication/fbe76338-75ad-4a3d-a18d-c0d98daef66b' class='mouseoverHref'>Thiele, J. & Jaeckel, S. 1931. Muscheln der Deutschen Tiefsee-Expedition.</a> <!--MARK--><!--MARK--><a href='../../../../publication/bea7e34d-ab38-485e-bb2e-980e4981419f' class='mouseoverHref'><em>Wissenschaftliche Ergebnisse der Deutschen Tiefsee-Expedition auf dem Dampfer Valdivia 1898-1899</em></a> <strong>21</strong>(1): 161-268<!--MARK-->","","Article in Journal","fbe76338-75ad-4a3d-a18d-c0d98daef66b","","bea7e34d-ab38-485e-bb2e-980e4981419f"
