"PUB_AUTHOR","PUB_YEAR","PUB_TITLE","PUB_PAGES","PUB_PARENT_BOOK_TITLE","PUB_PARENT_JOURNAL_TITLE","PUB_PARENT_ARTICLE_TITLE","PUB_PUBLICATION_DATE","PUB_PUBLISHER","PUB_FORMATTED","PUB_QUALIFICATION","PUB_TYPE","PUBLICATION_GUID","PUBLICATION_LAST_UPDATE","PARENT_PUBLICATION_GUID"
"Adams, A.","1862","On some new species of acelophalus Mollusca from the Sea of Japan","223-230","","Annals and Magazine of Natural History","","","","<!--MARK--><a href='../../../../publication/b41d6605-f7e3-4861-b0fe-a14cb21c1495' class='mouseoverHref'>Adams, A. 1862. On some new species of acelophalus Mollusca from the Sea of Japan.</a> <!--MARK--><!--MARK--><a href='../../../../publication/efa8de69-3a29-4a43-8ef2-cbefda205976' class='mouseoverHref'><em>Annals and Magazine of Natural History</em></a> 3 <strong>9</strong>: 223-230<!--MARK-->","","Article in Journal","b41d6605-f7e3-4861-b0fe-a14cb21c1495","","efa8de69-3a29-4a43-8ef2-cbefda205976"
"Allan, J.K.","1950","Australian shells: with related animals living in the sea, in freshwater and on the land","xix, 470 pp., 45 pls, 112 text figs","","","","","Georgian House","<!--MARK--><a href='../../../../publication/c4e311eb-d59e-424a-8ebe-323bb0b5b6e4' class='mouseoverHref'>Allan, J.K. 1950. <em>Australian shells: with related animals living in the sea, in freshwater and on the land</em>. Melbourne : Georgian House xix, 470 pp., 45 pls, 112 text figs.</a><!--MARK-->","","Book","c4e311eb-d59e-424a-8ebe-323bb0b5b6e4","20171102T21:53:38.674+0000",""
"Beesley, P.L., Ross, G.J.B. & Wells, A. (eds)","1998","Mollusca: The Southern Synthesis. Fauna of Australia.","xvi, 1-563","","","","","CSIRO Publishing","<!--MARK--><a href='../../../../publication/b5636fb5-c4f0-4ceb-85ea-bc7bd7a4c7da' class='mouseoverHref'>Beesley, P.L., Ross, G.J.B. & Wells, A. (eds) 1998. <em>Mollusca: The Southern Synthesis. Fauna of Australia</em>. Melbourne : CSIRO Publishing Vol. 5(Part A) pp. xvi, 1-563.</a><!--MARK-->","","Book","b5636fb5-c4f0-4ceb-85ea-bc7bd7a4c7da","20140627T00:52:52.318+0000",""
"Bieler, R., Carter, J.G. & Coan, E.V.","2010","Classiication of Bivalve Families","pp. 113-133","","Malacologia","Nomenclator of Bivalve Families; with a classiication of bivalve families by R. Bieler, J.G. Carter & E.V. Coan","","","<!--MARK--><a href='../../../../publication/3a43d6f3-f0e1-4896-a723-0f57a69f2b1e' class='mouseoverHref'>Bieler, R., Carter, J.G. & Coan, E.V. 2010. Classiication of Bivalve Families. pp. 113-133</a> <!--MARK--><em>in</em> <!--MARK--><a href='../../../../publication/bd776d02-96b0-434d-b97e-6b9dc0fbad01' class='mouseoverHref'>Bouchet, P. & Rocroi, J.-P. Nomenclator of Bivalve Families; with a classiication of bivalve families by R. Bieler, J.G. Carter & E.V. Coan.</a> <!--MARK--><!--MARK--><a href='../../../../publication/dc6c3842-79e3-48c5-8fb7-b8b17765f58f' class='mouseoverHref'><em>Malacologia</em></a> <strong>52</strong>(2): 1-184<!--MARK-->","","Section in Article","3a43d6f3-f0e1-4896-a723-0f57a69f2b1e","20141015T23:02:54.956+0000","bd776d02-96b0-434d-b97e-6b9dc0fbad01"
"Bouchet, P.","2009","<em>Euciroa crassa</em> Thiele & Jaeckel, 1931.","","","","","","","<!--MARK--><a href='../../../../publication/de5e9b2c-4aee-4da7-a819-c0674994878c' class='mouseoverHref'>Bouchet, P. 2009. <em>Euciroa crassa</em> Thiele & Jaeckel, 1931. World Register of Marine Species.</a> <!--MARK--><a href=http://www.marinespecies.org/aphia.php?p=taxdetails&id=406063>http://www.marinespecies.org/aphia.php?p=taxdetails&id=406063</a>","","URL","de5e9b2c-4aee-4da7-a819-c0674994878c","20150305T03:46:53.335+0000",""
"Bouchet, P.","2009","<i>Verticordia bordaensis</i> Cotton & Godfrey, 1938.","","","","","","","<!--MARK--><a href='../../../../publication/5eed13be-51bd-4454-b099-927f1a88d37b' class='mouseoverHref'>Bouchet, P. 2009. <i>Verticordia bordaensis</i> Cotton & Godfrey, 1938. World Register of Marine Species.</a> <!--MARK--><a href=http://www.marinespecies.org/aphia.php?p=taxdetails&id=403920>http://www.marinespecies.org/aphia.php?p=taxdetails&id=403920</a>","","URL","5eed13be-51bd-4454-b099-927f1a88d37b","20150114T00:59:27.155+0000",""
"Bouchet, P.","2009","<i>Vertisphaera cambrica</i> Iredale, 1930.","","","","","","","<!--MARK--><a href='../../../../publication/41763e95-dfea-4130-91a2-7b82a0b306a0' class='mouseoverHref'>Bouchet, P. 2009. <i>Vertisphaera cambrica</i> Iredale, 1930. World Register of Marine Species.</a> <!--MARK--><a href=http://www.marinespecies.org/aphia.php?p=taxdetails&id=405254>http://www.marinespecies.org/aphia.php?p=taxdetails&id=405254</a>","","URL","41763e95-dfea-4130-91a2-7b82a0b306a0","20150114T01:10:15.233+0000",""
"Bouchet, P.","2009","Lyonsiellidae Dall, 1895. In: MolluscaBase (2017).","","","","","","","<!--MARK--><a href='../../../../publication/cba212ef-a28d-42f0-8c8a-dab3b85dfd71' class='mouseoverHref'>Bouchet, P. 2009. Lyonsiellidae Dall, 1895. In: MolluscaBase (2017). World Register of Marine Species.</a> <!--MARK--><a href=http://marinespecies.org/aphia.php?p=taxdetails&id=405866>http://marinespecies.org/aphia.php?p=taxdetails&id=405866</a>","","URL","cba212ef-a28d-42f0-8c8a-dab3b85dfd71","20170526T05:47:57.839+0000",""
"Bouchet, P.","2010","<em>Spinosipella costeminens</em> (Poutiers, 1981)","","","","","","","<!--MARK--><a href='../../../../publication/edcb3792-4520-4906-be28-7dcbc01d4dd0' class='mouseoverHref'>Bouchet, P. 2010. <em>Spinosipella costeminens</em> (Poutiers, 1981). World Register of Marine Species.</a> <!--MARK--><a href=http://www.marinespecies.org/aphia.php?p=taxdetails&id=405121>http://www.marinespecies.org/aphia.php?p=taxdetails&id=405121</a><!--MARK--> [accessed on 2011-09-04]","accessed on 2011-09-04","URL","edcb3792-4520-4906-be28-7dcbc01d4dd0","20110904T23:42:01.262+0000",""
"Bouchet, P. & Huber, M.","2011","<em>Euciroa lamprelli</em> Huber, 2010.","","","","","","","<!--MARK--><a href='../../../../publication/91e465f4-d0bd-4dd6-886a-5de3e65433fd' class='mouseoverHref'>Bouchet, P. & Huber, M. 2011. <em>Euciroa lamprelli</em> Huber, 2010. World Register of Marine Species.</a> <!--MARK--><a href=http://www.marinespecies.org/aphia.php?p=taxdetails&id=508010>http://www.marinespecies.org/aphia.php?p=taxdetails&id=508010</a>","","URL","91e465f4-d0bd-4dd6-886a-5de3e65433fd","20150305T04:17:48.164+0000",""
"Checa, A.G. & Harper, E.M.","2010","Spikey bivalves: intra-periostracal crystal growth in anomalodesmatans","231-248","","Biological Bulletin","","","","<!--MARK--><a href='../../../../publication/74a755bb-4cd6-4bbe-8dc1-18a2a5ca228a' class='mouseoverHref'>Checa, A.G. & Harper, E.M. 2010. Spikey bivalves: intra-periostracal crystal growth in anomalodesmatans.</a> <!--MARK--><!--MARK--><a href='../../../../publication/672e1cb6-397e-477a-8cc5-3475c4542bb1' class='mouseoverHref'><em>Biological Bulletin</em></a> <strong>219</strong>: 231-248<!--MARK-->","","Article in Journal","74a755bb-4cd6-4bbe-8dc1-18a2a5ca228a","20110822T00:49:59.166+0000","672e1cb6-397e-477a-8cc5-3475c4542bb1"
"Coan, E.V. & Valentich-Scott, P.","2012","Bivalve seashells of tropical West America. Marine bivalve mollusks from Baja California to northern Peru.","pp.1258","","","","","Santa Barbara Museum of Natural History","<!--MARK--><a href='../../../../publication/b2e56d2e-bf3d-4050-acfd-a77002af8e15' class='mouseoverHref'>Coan, E.V. & Valentich-Scott, P. 2012. <em>Bivalve seashells of tropical West America. Marine bivalve mollusks from Baja California to northern Peru</em>. Santa Barbara : Santa Barbara Museum of Natural History 2 vols. pp.1258.</a><!--MARK-->","","Book","b2e56d2e-bf3d-4050-acfd-a77002af8e15","20150320T02:32:41.277+0000",""
"Cotton, B.C.","1961","South Australian Mollusca. Pelecypoda","363 pp.","","","","Oct","W.L. Hawes, Government Printer","<!--MARK--><a href='../../../../publication/aea40e1d-979e-4d8c-b2cb-d81265eec668' class='mouseoverHref'>Cotton, B.C. 1961. <em>South Australian Mollusca. Pelecypoda</em>. Adelaide : W.L. Hawes, Government Printer 363 pp.</a><!--MARK--> [Date published Oct: Handbook of the Flora and Fauna of South Australia Series]","Handbook of the Flora and Fauna of South Australia Series","Book","aea40e1d-979e-4d8c-b2cb-d81265eec668","20130918T01:40:20.241+0000",""
"Cotton, B.C. & Godfrey, F.K.","1938","The Molluscs of South Australia. Part 1. The Pelecypoda","314 pp.","","","","","Government Printer","<!--MARK--><a href='../../../../publication/0ca05932-f91e-4588-91a1-a73eab0c277f' class='mouseoverHref'>Cotton, B.C. & Godfrey, F.K. 1938. <em>The Molluscs of South Australia. Part 1. The Pelecypoda</em>. Adelaide : Government Printer 314 pp.</a><!--MARK--> [Handbook of the flora and fauna of South Australia]","Handbook of the flora and fauna of South Australia","Book","0ca05932-f91e-4588-91a1-a73eab0c277f","20130918T01:27:45.915+0000",""
"Dall, W.H.","1886","Reports on the results of dredging, under the supervision of Alexander Agassiz, in the Gulf of Mexico (1877-78) and in the Carribean Sea (1879-80), by the U.S. Coast Survey steamer Blake, Lieut.-Commander C.D. Sigsbee, U.S.N. and Commander J.R. Bartlett, U.S.N. commanding. XXIX. Report on the Mollusca. Part 1, Brachiopoda and Pelecypoda.","171-318","","Bulletin of the Museum of Comparative Zoology, Harvard","","","","<!--MARK--><a href='../../../../publication/1b352b77-61cc-4f26-81ce-68464977e16b' class='mouseoverHref'>Dall, W.H. 1886. Reports on the results of dredging, under the supervision of Alexander Agassiz, in the Gulf of Mexico (1877-78) and in the Carribean Sea (1879-80), by the U.S. Coast Survey steamer Blake, Lieut.-Commander C.D. Sigsbee, U.S.N. and Commander J.R. Bartlett, U.S.N. commanding. XXIX. Report on the Mollusca. Part 1, Brachiopoda and Pelecypoda.</a> <!--MARK--><!--MARK--><a href='../../../../publication/b2447030-bd13-4a45-9402-157082169a3d' class='mouseoverHref'><em>Bulletin of the Museum of Comparative Zoology, Harvard</em></a> <strong>12</strong>(6): 171-318<!--MARK-->","","Article in Journal","1b352b77-61cc-4f26-81ce-68464977e16b","20180328T23:21:21.781+0000","b2447030-bd13-4a45-9402-157082169a3d"
"Dall, W.H., Bartsch, P. & Rehder, H.A.","1938","A manual of the recent and fossil marine Pelecypod mollusks of the Hawaiian Island","3-233, pls 1-57","","Bulletin of the Bernice P. Bishop Museum","","July 25","","<!--MARK--><a href='../../../../publication/fab189ba-c355-433e-ae22-df7e7768a9b7' class='mouseoverHref'>Dall, W.H., Bartsch, P. & Rehder, H.A. 1938. A manual of the recent and fossil marine Pelecypod mollusks of the Hawaiian Island.</a> <!--MARK--><!--MARK--><a href='../../../../publication/37d2a77c-73fb-4de1-8d20-08ec15872b07' class='mouseoverHref'><em>Bulletin of the Bernice P. Bishop Museum</em></a> <strong>153</strong>: 3-233, pls 1-57<!--MARK--> [Date published July 25]","","Article in Journal","fab189ba-c355-433e-ae22-df7e7768a9b7","20081009T05:11:37.000+0000","37d2a77c-73fb-4de1-8d20-08ec15872b07"
"Dreyer, H., G. Steiner & E.M. Harper","2003","Molecular phylogeny of Anomalodesmata (Mollusca: Bivalvia) inferred from 18S rRNA sequences","229-246","","Zoological Journal of the Linnean Society","","","","<!--MARK--><a href='../../../../publication/8562130f-f3a8-4d9b-9778-373442784bad' class='mouseoverHref'>Dreyer, H., G. Steiner & E.M. Harper 2003. Molecular phylogeny of Anomalodesmata (Mollusca: Bivalvia) inferred from 18S rRNA sequences.</a> <!--MARK--><!--MARK--><a href='../../../../publication/e67d43a6-f920-4532-a90d-d3a5ee2662ea' class='mouseoverHref'><em>Zoological Journal of the Linnean Society</em></a> <strong>139</strong>: 229-246<!--MARK-->","","Article in Journal","8562130f-f3a8-4d9b-9778-373442784bad","20110817T23:45:52.477+0000","e67d43a6-f920-4532-a90d-d3a5ee2662ea"
"Fischer, P.","1862","Description d'une espèces nouvelle de Verticordia","35-36","","Journal de Conchyliologie","","","","<!--MARK--><a href='../../../../publication/2caae997-ec62-452b-ab4b-f3f8b8f930b7' class='mouseoverHref'>Fischer, P. 1862. Description d'une espèces nouvelle de Verticordia.</a> <!--MARK--><!--MARK--><a href='../../../../publication/52301b35-8099-424a-8c55-57ce4c6a0788' class='mouseoverHref'><em>Journal de Conchyliologie</em></a> <strong>10</strong>: 35-36<!--MARK-->","","Article in Journal","2caae997-ec62-452b-ab4b-f3f8b8f930b7","","52301b35-8099-424a-8c55-57ce4c6a0788"
"Gatliff, J.H. & Gabriel, C.J.","1916","Additions to the alterations in the Catalogue of the Marine Shells of Victoria","106-113","","Proceedings of the Royal Society of Victoria","","","","<!--MARK--><a href='../../../../publication/d73ee9b2-4900-4bd6-be94-9b125b24e99d' class='mouseoverHref'>Gatliff, J.H. & Gabriel, C.J. 1916. Additions to the alterations in the Catalogue of the Marine Shells of Victoria.</a> <!--MARK--><!--MARK--><a href='../../../../publication/ce333794-3a02-427f-ba27-346079f1efa0' class='mouseoverHref'><em>Proceedings of the Royal Society of Victoria</em></a> <strong>29</strong>(1): 106-113<!--MARK-->","","Article in Journal","d73ee9b2-4900-4bd6-be94-9b125b24e99d","20101222T01:58:06.208+0000","ce333794-3a02-427f-ba27-346079f1efa0"
"Grove, S.","2010","A Guide to the Seashells and other Marine Molluscs of Tasmania","","","","","","","<!--MARK--><a href='../../../../publication/3b166b59-59a7-4876-a768-af52c1ed63ee' class='mouseoverHref'>Grove, S. 2010. A Guide to the Seashells and other Marine Molluscs of Tasmania.</a> <!--MARK--><a href=http://www.molluscsoftasmania.net>http://www.molluscsoftasmania.net</a>","","URL","3b166b59-59a7-4876-a768-af52c1ed63ee","20110519T06:13:59.712+0000",""
"Habe, T.","1964","Shells of the western Pacific in color","233 pp., 66 pls","","","","","Hoikusha","<!--MARK--><a href='../../../../publication/bc4abcca-501a-44cb-9d26-53846f1fb6b2' class='mouseoverHref'>Habe, T. 1964. <em>Shells of the western Pacific in color</em>. Osaka : Hoikusha Vol. 2 233 pp., 66 pls.</a><!--MARK-->","","Book","bc4abcca-501a-44cb-9d26-53846f1fb6b2","20171103T04:58:55.475+0000",""
"Harper, E.M., Dreyer, H. & Steiner, G.","2006","Reconstructing the Anomalodesmata (Mollusca: Bivalvia): morphology and molecules","395-420","","Zoological Journal of the Linnean Society","","","","<!--MARK--><a href='../../../../publication/5903358e-be53-4939-aee3-0fbd4202f2f6' class='mouseoverHref'>Harper, E.M., Dreyer, H. & Steiner, G. 2006. Reconstructing the Anomalodesmata (Mollusca: Bivalvia): morphology and molecules.</a> <!--MARK--><!--MARK--><a href='../../../../publication/e67d43a6-f920-4532-a90d-d3a5ee2662ea' class='mouseoverHref'><em>Zoological Journal of the Linnean Society</em></a> <strong>148</strong>(3): 395-420<!--MARK-->","","Article in Journal","5903358e-be53-4939-aee3-0fbd4202f2f6","20131028T01:09:13.279+0000","e67d43a6-f920-4532-a90d-d3a5ee2662ea"
"Harper, E.M., Hide, E.A. & Morton, B.","2000","Relationships between the extant Anomalodesmata: a cladistic test","pp. 129-143","The Evolutionary Biology of the Bivalvia","","","","","<!--MARK--><a href='../../../../publication/83178e2b-2dbf-4599-abb7-af080ea1b754' class='mouseoverHref'>Harper, E.M., Hide, E.A. & Morton, B. 2000. Relationships between the extant Anomalodesmata: a cladistic test. pp. 129-143</a> <!--MARK--><em>in</em> <!--MARK--><a href='../../../../publication/a0e1a8d0-fa36-42f6-941a-4274cd6313b5' class='mouseoverHref'>Harper, E.M., Taylor, J.D. & Crame, J.A. <em>The Evolutionary Biology of the Bivalvia</em>. London : The Geological Society of London Geological Society Special Publication no. 177, 494 pp.</a><!--MARK-->","","Chapter in Book","83178e2b-2dbf-4599-abb7-af080ea1b754","20131021T23:51:34.048+0000","a0e1a8d0-fa36-42f6-941a-4274cd6313b5"
"Hedley, C.","1906","The Mollusca of Mast Head Reef, Capricorn Group, Queensland","453-479, pls 36-37","","Proceedings of the Linnean Society of New South Wales","","","","<!--MARK--><a href='../../../../publication/3bb02546-5dc9-4f68-88f7-7faf6d4b6c25' class='mouseoverHref'>Hedley, C. 1906. The Mollusca of Mast Head Reef, Capricorn Group, Queensland.</a> <!--MARK--><!--MARK--><a href='../../../../publication/c12cd779-adb5-41ea-bd2c-75f6864cf22e' class='mouseoverHref'><em>Proceedings of the Linnean Society of New South Wales</em></a> <strong>31</strong>(3): 453-479, pls 36-37<!--MARK-->","","Article in Journal","3bb02546-5dc9-4f68-88f7-7faf6d4b6c25","20081009T05:11:37.000+0000","c12cd779-adb5-41ea-bd2c-75f6864cf22e"
"Hedley, C.","1907","The results of deep sea investigation in the Tasman Sea. Mollusca from eighty fathoms off Narrabeen","283-304","","Records of the Australian Museum","","","","<!--MARK--><a href='../../../../publication/e16b8737-9e27-4b12-98e4-4eddbf9ed17a' class='mouseoverHref'>Hedley, C. 1907. The results of deep sea investigation in the Tasman Sea. Mollusca from eighty fathoms off Narrabeen.</a> <!--MARK--><!--MARK--><a href='../../../../publication/7c07530b-0b38-44f5-8f95-368da97d6ac2' class='mouseoverHref'><em>Records of the Australian Museum</em></a> <strong>6</strong>: 283-304<!--MARK-->","","Article in Journal","e16b8737-9e27-4b12-98e4-4eddbf9ed17a","20171019T23:45:44.435+0000","7c07530b-0b38-44f5-8f95-368da97d6ac2"
"Hedley, C.","1911","Report on the Mollusca obtained by the F.I.S. 'Endeavour' chiefly off Cape Wiles South Australia. Part 1","89-114","","Zoological Results of the Fisheries Experiments carried out by F.I.S. Endeavour","","","","<!--MARK--><a href='../../../../publication/d71aa685-5567-423c-bb50-460081661915' class='mouseoverHref'>Hedley, C. 1911. Report on the Mollusca obtained by the F.I.S. 'Endeavour' chiefly off Cape Wiles South Australia. Part 1.</a> <!--MARK--><!--MARK--><a href='../../../../publication/50de57cb-cbac-4120-af65-df736d857592' class='mouseoverHref'><em>Zoological Results of the Fisheries Experiments carried out by F.I.S. Endeavour</em></a> <strong>1</strong>: 89-114<!--MARK-->","","Article in Journal","d71aa685-5567-423c-bb50-460081661915","","50de57cb-cbac-4120-af65-df736d857592"
"Higo, S., Callomon, P. & Goto, Y.","1999","Catalogue and Bibliography of the Marine Shell-bearing Mollusca of Japan","749 pp.","","","","","Elle Scientific Publications","<!--MARK--><a href='../../../../publication/fbfee567-5cd7-49cf-b522-890e255303d5' class='mouseoverHref'>Higo, S., Callomon, P. & Goto, Y. 1999. <em>Catalogue and Bibliography of the Marine Shell-bearing Mollusca of Japan</em>. Japan : Elle Scientific Publications 749 pp.</a><!--MARK-->","","Book","fbfee567-5cd7-49cf-b522-890e255303d5","20081009T05:11:37.000+0000",""
"Huber, M.","2010","Compendium of Bivalves. A full-color guide to 3,300 of the world's marine bivalves. A status on Bivalvia after 250 years of research","901 pp., 1 CD-ROM","","","","","ConchBooks","<!--MARK--><a href='../../../../publication/aa37b132-e2c7-489a-acdb-31b50cd41bdf' class='mouseoverHref'>Huber, M. 2010. <em>Compendium of Bivalves. A full-color guide to 3,300 of the world's marine bivalves. A status on Bivalvia after 250 years of research</em>. Hackenheim, Germany : ConchBooks 901 pp., 1 CD-ROM.</a><!--MARK-->","","Book","aa37b132-e2c7-489a-acdb-31b50cd41bdf","20120814T04:22:03.376+0000",""
"Huber, M.","2010","Formal description and designation of holotypes for 23 bivalve species and type species for 2 bivalve genera (Mollusca: Bivalvia)","1-32","","Conchylia","","","","<!--MARK--><a href='../../../../publication/6297c788-5df3-43bf-b70a-73b9d8bd7cbb' class='mouseoverHref'>Huber, M. 2010. Formal description and designation of holotypes for 23 bivalve species and type species for 2 bivalve genera (Mollusca: Bivalvia).</a> <!--MARK--><!--MARK--><a href='../../../../publication/c2e89e79-52a1-432e-8f05-6bbcee8afa86' class='mouseoverHref'><em>Conchylia</em></a> <strong>41</strong>(1): 1-32<!--MARK-->","","Article in Journal","6297c788-5df3-43bf-b70a-73b9d8bd7cbb","20111017T03:34:26.160+0000","c2e89e79-52a1-432e-8f05-6bbcee8afa86"
"Huber, M. & Tran, B.","2010","<i>Verticordia tasmanica</i> May, 1915.","","","","","","","<!--MARK--><a href='../../../../publication/693f5419-6ab5-4941-ab18-b26018f8aff5' class='mouseoverHref'>Huber, M. & Tran, B. 2010. <i>Verticordia tasmanica</i> May, 1915. World Register of Marine Species.</a> <!--MARK--><a href=http://www.marinespecies.org/aphia.php?p=taxdetails&id=508023>http://www.marinespecies.org/aphia.php?p=taxdetails&id=508023</a>","","URL","693f5419-6ab5-4941-ab18-b26018f8aff5","20150114T01:03:56.769+0000",""
"Huber, M & Bouchet, P.","23/09/2010","<i>Verticordia australiensis</i> E. A. Smith, 1885.","","","","","","","<!--MARK--><a href='../../../../publication/ce4463d6-c043-405e-b8de-0c2e78cad85a' class='mouseoverHref'>Huber, M & Bouchet, P. 23/09/2010. <i>Verticordia australiensis</i> E. A. Smith, 1885. World Register of Marine Species.</a> <!--MARK--><a href=http://www.marinespecies.org/aphia.php?p=taxdetails&id=403919>http://www.marinespecies.org/aphia.php?p=taxdetails&id=403919</a>","","URL","ce4463d6-c043-405e-b8de-0c2e78cad85a","20150114T00:40:48.272+0000",""
"Iredale, T.","1930","More notes on the marine Mollusca of New South Wales","384-407","","Records of the Australian Museum","","27 June","","<!--MARK--><a href='../../../../publication/2fd45453-48d6-40d8-b7b2-a6d0f36b1c3b' class='mouseoverHref'>Iredale, T. 1930. More notes on the marine Mollusca of New South Wales.</a> <!--MARK--><!--MARK--><a href='../../../../publication/7c07530b-0b38-44f5-8f95-368da97d6ac2' class='mouseoverHref'><em>Records of the Australian Museum</em></a> <strong>17</strong>(9): 384-407<!--MARK--> [Date published 27 June]","","Article in Journal","2fd45453-48d6-40d8-b7b2-a6d0f36b1c3b","20140409T03:01:56.030+0000","7c07530b-0b38-44f5-8f95-368da97d6ac2"
"Iredale, T. & McMichael, D.F.","1962","A reference list of the marine Mollusca of New South Wales","1-109","","Memoirs of the Australian Museum","","","","<!--MARK--><a href='../../../../publication/0fbb8e94-a1f6-42b8-95cc-d5e7a50b79b9' class='mouseoverHref'>Iredale, T. & McMichael, D.F. 1962. A reference list of the marine Mollusca of New South Wales.</a> <!--MARK--><!--MARK--><a href='../../../../publication/272826c2-c2bf-425b-bd6f-11ddaf2aaeaa' class='mouseoverHref'><em>Memoirs of the Australian Museum</em></a> <strong>11</strong>: 1-109<!--MARK-->","","Article in Journal","0fbb8e94-a1f6-42b8-95cc-d5e7a50b79b9","20171019T23:46:28.734+0000","272826c2-c2bf-425b-bd6f-11ddaf2aaeaa"
"Kuroda, T.","1952","On the Verticordiidae from Japan","6-16, pl. 1","","Venus","","","","<!--MARK--><a href='../../../../publication/1e7e8ea5-2655-4c41-8268-2c8a8bf1d9f5' class='mouseoverHref'>Kuroda, T. 1952. On the Verticordiidae from Japan.</a> <!--MARK--><!--MARK--><a href='../../../../publication/1b55b70e-f94f-48a8-a489-027f586fd88c' class='mouseoverHref'><em>Venus</em></a> <strong>17</strong>(1): 6-16, pl. 1<!--MARK-->","","Article in Journal","1e7e8ea5-2655-4c41-8268-2c8a8bf1d9f5","","1b55b70e-f94f-48a8-a489-027f586fd88c"
"Lamprell, K. & Healy, J.","1998","Bivalves of Australia","288","","","","","Backhuys Publishers","<!--MARK--><a href='../../../../publication/97a7b588-afb9-48fb-b937-4799c551ead8' class='mouseoverHref'>Lamprell, K. & Healy, J. 1998. <em>Bivalves of Australia</em>. Leiden : Backhuys Publishers Vol. 2 288 pp.</a><!--MARK-->","","Book","97a7b588-afb9-48fb-b937-4799c551ead8","20110207T03:39:52.979+0000",""
"Lamprell, K.L. & Healy, J.M.","1997","New species of Pteriidae, Pinnidae, Veneridae, Euciroidae and Corbulidae from Australia (Mollusca: Bivalvia: Veneroida)","271-281","","Memoirs of the Queensland Museum","","","","<!--MARK--><a href='../../../../publication/f6df645a-0ebb-4393-a4c5-f53148110fa7' class='mouseoverHref'>Lamprell, K.L. & Healy, J.M. 1997. New species of Pteriidae, Pinnidae, Veneridae, Euciroidae and Corbulidae from Australia (Mollusca: Bivalvia: Veneroida).</a> <!--MARK--><!--MARK--><a href='../../../../publication/1a0a2982-9f30-43e1-a641-b0379699837c' class='mouseoverHref'><em>Memoirs of the Queensland Museum</em></a> <strong>42</strong>(1): 271-281<!--MARK-->","","Article in Journal","f6df645a-0ebb-4393-a4c5-f53148110fa7","","1a0a2982-9f30-43e1-a641-b0379699837c"
"May, W.L.","1915 [1916]","Additions to the Tasmanian Mollusca, with descriptions of new species","75-99","","Papers and Proceedings of the Royal Society of Tasmania","","","","<!--MARK--><a href='../../../../publication/dbc85531-1c03-4aae-9fc3-1c8fea6aa8be' class='mouseoverHref'>May, W.L. 1915 [1916]. Additions to the Tasmanian Mollusca, with descriptions of new species.</a> <!--MARK--><!--MARK--><a href='../../../../publication/db793adc-ebf2-40c5-9d92-48a121ea03ae' class='mouseoverHref'><em>Papers and Proceedings of the Royal Society of Tasmania</em></a> <strong>1915</strong>: 75-99<!--MARK--> [issued separately 31 December 1915]","issued separately 31 December 1915","Article in Journal","dbc85531-1c03-4aae-9fc3-1c8fea6aa8be","20131023T02:41:13.028+0000","db793adc-ebf2-40c5-9d92-48a121ea03ae"
"Mikkelsen, P.M. & Bieler, R.","2008","Seashells of southern Florida. Living marine mollusks of the Florida keys and adjacent regions","503 pp.","","","","","Princeton University Press","<!--MARK--><a href='../../../../publication/2f1d94be-29aa-4d30-aec6-e5c3dafecfb3' class='mouseoverHref'>Mikkelsen, P.M. & Bieler, R. 2008. <em>Seashells of southern Florida. Living marine mollusks of the Florida keys and adjacent regions</em>. Princeton & Oxford : Princeton University Press 503 pp.</a><!--MARK-->","","Book","2f1d94be-29aa-4d30-aec6-e5c3dafecfb3","20120808T01:38:45.518+0000",""
