"PUB_AUTHOR","PUB_YEAR","PUB_TITLE","PUB_PAGES","PUB_PARENT_BOOK_TITLE","PUB_PARENT_JOURNAL_TITLE","PUB_PARENT_ARTICLE_TITLE","PUB_PUBLICATION_DATE","PUB_PUBLISHER","PUB_FORMATTED","PUB_QUALIFICATION","PUB_TYPE","PUBLICATION_GUID","PUBLICATION_LAST_UPDATE","PARENT_PUBLICATION_GUID"
"Lower, O.B.","1897","Descriptions of new species of Australian Lepidoptera, with notes on synonymy","10-32","","Proceedings of the Linnean Society of New South Wales","","","","<!--MARK--><a href='../publication/4186fcdb-084a-4981-89e7-793a654ab092' class='mouseoverHref'>Lower, O.B. 1897. Descriptions of new species of Australian Lepidoptera, with notes on synonymy.</a> <!--MARK--><!--MARK--><a href='../publication/c12cd779-adb5-41ea-bd2c-75f6864cf22e' class='mouseoverHref'><em>Proceedings of the Linnean Society of New South Wales</em></a> <strong>22</strong>(1): 10-32<!--MARK--> [publication date: Anon. 1929. List showing dates of publication of parts of the Proceedings for each year. <I>Proc. Linn. Soc. N.S.W</I>. Index to vols 1-50 (1875-1925)]","publication date: Anon. 1929. List showing dates of publication of parts of the Proceedings for each year. <I>Proc. Linn. Soc. N.S.W</I>. Index to vols 1-50 (1875-1925)","Article in Journal","4186fcdb-084a-4981-89e7-793a654ab092","20081009T05:11:37.000+0000","c12cd779-adb5-41ea-bd2c-75f6864cf22e"
"Lower, O.B.","1903","Descriptions of new species of <i>Xysmatodoma</i>, etc","216-239","","Transactions of the Royal Society of South Australia","","","","<!--MARK--><a href='../publication/134b169f-2f56-48ef-ac3f-522a53313d36' class='mouseoverHref'>Lower, O.B. 1903. Descriptions of new species of <i>Xysmatodoma</i>, etc.</a> <!--MARK--><!--MARK--><a href='../publication/8b48b0a3-dd7a-4aea-be0d-10a223710ebc' class='mouseoverHref'><em>Transactions of the Royal Society of South Australia</em></a> <strong>27</strong>: 216-239<!--MARK-->","","Article in Journal","134b169f-2f56-48ef-ac3f-522a53313d36","20081009T05:11:37.000+0000","8b48b0a3-dd7a-4aea-be0d-10a223710ebc"
"Meyrick, E.","1883","Descriptions of Australian Micro-lepidoptera. VIII. Oecophoridae","415-547","","Proceedings of the Linnean Society of New South Wales","","","","<!--MARK--><a href='../publication/6d57f0e6-51f8-414b-8397-964ace50e1e8' class='mouseoverHref'>Meyrick, E. 1883. Descriptions of Australian Micro-lepidoptera. VIII. Oecophoridae.</a> <!--MARK--><!--MARK--><a href='../publication/c12cd779-adb5-41ea-bd2c-75f6864cf22e' class='mouseoverHref'><em>Proceedings of the Linnean Society of New South Wales</em></a> 1 <strong>7</strong>(4): 415-547<!--MARK-->","","Article in Journal","6d57f0e6-51f8-414b-8397-964ace50e1e8","20081009T05:11:37.000+0000","c12cd779-adb5-41ea-bd2c-75f6864cf22e"
"Meyrick, E.","1885","Description of Australian Micro-lepidoptera. XII. Oecophoridae","1045-1082","","Proceedings of the Linnean Society of New South Wales","","","","<!--MARK--><a href='../publication/57b54955-868a-4faf-afda-0e525b32782b' class='mouseoverHref'>Meyrick, E. 1885. Description of Australian Micro-lepidoptera. XII. Oecophoridae.</a> <!--MARK--><!--MARK--><a href='../publication/c12cd779-adb5-41ea-bd2c-75f6864cf22e' class='mouseoverHref'><em>Proceedings of the Linnean Society of New South Wales</em></a> 1 <strong>9</strong>(4): 1045-1082<!--MARK--> [year of publication not confirmed]","year of publication not confirmed","Article in Journal","57b54955-868a-4faf-afda-0e525b32782b","","c12cd779-adb5-41ea-bd2c-75f6864cf22e"
"Meyrick, E.","1888","Descriptions of Australian Micro-lepidoptera. XIV. Oecophoridae","929-966","","Proceedings of the Linnean Society of New South Wales","","","","<!--MARK--><a href='../publication/fbbcebb4-6cbc-4a23-8807-c091af1c3b34' class='mouseoverHref'>Meyrick, E. 1888. Descriptions of Australian Micro-lepidoptera. XIV. Oecophoridae.</a> <!--MARK--><!--MARK--><a href='../publication/c12cd779-adb5-41ea-bd2c-75f6864cf22e' class='mouseoverHref'><em>Proceedings of the Linnean Society of New South Wales</em></a> 2-n.s. <strong>2</strong>(4): 929-966<!--MARK--> [year of publication not confirmed]","year of publication not confirmed","Article in Journal","fbbcebb4-6cbc-4a23-8807-c091af1c3b34","","c12cd779-adb5-41ea-bd2c-75f6864cf22e"
"Meyrick, E.","1902","Descriptions of new species of Lepidoptera (Oecophoridae)","133-174","","Transactions of the Royal Society of South Australia","","","","<!--MARK--><a href='../publication/a9137de5-edab-4aab-8275-1b5f54cf82cf' class='mouseoverHref'>Meyrick, E. 1902. Descriptions of new species of Lepidoptera (Oecophoridae).</a> <!--MARK--><!--MARK--><a href='../publication/8b48b0a3-dd7a-4aea-be0d-10a223710ebc' class='mouseoverHref'><em>Transactions of the Royal Society of South Australia</em></a> <strong>26</strong>: 133-174<!--MARK-->","","Article in Journal","a9137de5-edab-4aab-8275-1b5f54cf82cf","20081009T05:11:37.000+0000","8b48b0a3-dd7a-4aea-be0d-10a223710ebc"
"Turner, A.J.","1894","Descriptions of Micro-lepidoptera from Moreton Bay","120-138","","Transactions of the Royal Society of South Australia","","","","<!--MARK--><a href='../publication/af635adc-1099-47fb-9aaa-6b11bc6ad8ac' class='mouseoverHref'>Turner, A.J. 1894. Descriptions of Micro-lepidoptera from Moreton Bay.</a> <!--MARK--><!--MARK--><a href='../publication/8b48b0a3-dd7a-4aea-be0d-10a223710ebc' class='mouseoverHref'><em>Transactions of the Royal Society of South Australia</em></a> <strong>18</strong>: 120-138<!--MARK-->","","Article in Journal","af635adc-1099-47fb-9aaa-6b11bc6ad8ac","20081009T05:11:37.000+0000","8b48b0a3-dd7a-4aea-be0d-10a223710ebc"
"Turner, A.J.","1898","Descriptions of new Microlepidoptera from Queensland","200-214","","Transactions of the Royal Society of South Australia","","","","<!--MARK--><a href='../publication/a528018e-8d5a-4ea1-afd1-7faddc04d1ce' class='mouseoverHref'>Turner, A.J. 1898. Descriptions of new Microlepidoptera from Queensland.</a> <!--MARK--><!--MARK--><a href='../publication/8b48b0a3-dd7a-4aea-be0d-10a223710ebc' class='mouseoverHref'><em>Transactions of the Royal Society of South Australia</em></a> <strong>22</strong>: 200-214<!--MARK-->","","Article in Journal","a528018e-8d5a-4ea1-afd1-7faddc04d1ce","20081009T05:11:37.000+0000","8b48b0a3-dd7a-4aea-be0d-10a223710ebc"
"Turner, A.J.","1917","Studies in Australian Lepidoptera","57-120","","Transactions of the Royal Society of South Australia","","","","<!--MARK--><a href='../publication/d19f5034-426e-49f3-92da-f2fd5bc71714' class='mouseoverHref'>Turner, A.J. 1917. Studies in Australian Lepidoptera.</a> <!--MARK--><!--MARK--><a href='../publication/8b48b0a3-dd7a-4aea-be0d-10a223710ebc' class='mouseoverHref'><em>Transactions of the Royal Society of South Australia</em></a> <strong>41</strong>: 57-120<!--MARK-->","","Article in Journal","d19f5034-426e-49f3-92da-f2fd5bc71714","20081009T05:11:37.000+0000","8b48b0a3-dd7a-4aea-be0d-10a223710ebc"
"Turner, A.J.","1939","A second revision of the Lepidoptera of Tasmania","57-115","","Papers and Proceedings of the Royal Society of Tasmania","","","","<!--MARK--><a href='../publication/ae5b616d-506e-4494-8af4-408c5d334ef8' class='mouseoverHref'>Turner, A.J. 1939. A second revision of the Lepidoptera of Tasmania.</a> <!--MARK--><!--MARK--><a href='../publication/db793adc-ebf2-40c5-9d92-48a121ea03ae' class='mouseoverHref'><em>Papers and Proceedings of the Royal Society of Tasmania</em></a> <strong>1938</strong>: 57-115<!--MARK-->","","Article in Journal","ae5b616d-506e-4494-8af4-408c5d334ef8","20110406T00:51:15.229+0000","db793adc-ebf2-40c5-9d92-48a121ea03ae"
"Turner, A.J.","1944","Revision of Australian Lepidoptera. Oecophoridae. XI","49-61","","Proceedings of the Linnean Society of New South Wales","","","","<!--MARK--><a href='../publication/3c18905b-0021-437b-86c6-c15c8530c04c' class='mouseoverHref'>Turner, A.J. 1944. Revision of Australian Lepidoptera. Oecophoridae. XI.</a> <!--MARK--><!--MARK--><a href='../publication/c12cd779-adb5-41ea-bd2c-75f6864cf22e' class='mouseoverHref'><em>Proceedings of the Linnean Society of New South Wales</em></a> <strong>69</strong>: 49-61<!--MARK-->","","Article in Journal","3c18905b-0021-437b-86c6-c15c8530c04c","20081009T05:11:37.000+0000","c12cd779-adb5-41ea-bd2c-75f6864cf22e"
"Turner, A.J.","1944","Revision of the Australian Lepidoptera. Oecophoridae. XII","253-273","","Proceedings of the Linnean Society of New South Wales","","","","<!--MARK--><a href='../publication/c8ee731b-91bc-4144-82f6-9f2a0917661a' class='mouseoverHref'>Turner, A.J. 1944. Revision of the Australian Lepidoptera. Oecophoridae. XII.</a> <!--MARK--><!--MARK--><a href='../publication/c12cd779-adb5-41ea-bd2c-75f6864cf22e' class='mouseoverHref'><em>Proceedings of the Linnean Society of New South Wales</em></a> <strong>69</strong>: 253-273<!--MARK-->","","Article in Journal","c8ee731b-91bc-4144-82f6-9f2a0917661a","20081009T05:11:37.000+0000","c12cd779-adb5-41ea-bd2c-75f6864cf22e"
"Turner, A.J.","1946","Revision of Australian Lepidoptera. Oecophoridae. XIII","93-120","","Proceedings of the Linnean Society of New South Wales","","","","<!--MARK--><a href='../publication/12bbb6c3-d894-4a0c-9ebb-d301298005b0' class='mouseoverHref'>Turner, A.J. 1946. Revision of Australian Lepidoptera. Oecophoridae. XIII.</a> <!--MARK--><!--MARK--><a href='../publication/c12cd779-adb5-41ea-bd2c-75f6864cf22e' class='mouseoverHref'><em>Proceedings of the Linnean Society of New South Wales</em></a> <strong>70</strong>: 93-120<!--MARK-->","","Article in Journal","12bbb6c3-d894-4a0c-9ebb-d301298005b0","20081009T05:11:37.000+0000","c12cd779-adb5-41ea-bd2c-75f6864cf22e"
