"PUB_AUTHOR","PUB_YEAR","PUB_TITLE","PUB_PAGES","PUB_PARENT_BOOK_TITLE","PUB_PARENT_JOURNAL_TITLE","PUB_PARENT_ARTICLE_TITLE","PUB_PUBLICATION_DATE","PUB_PUBLISHER","PUB_FORMATTED","PUB_QUALIFICATION","PUB_TYPE","PUBLICATION_GUID","PUBLICATION_LAST_UPDATE","PARENT_PUBLICATION_GUID"
"Hanson, M.L.","1955","Some digenetic trematodes of plectognath fishes of Hawaii","75-87 13 figs","","Proceedings of the Helminthological Society of Washington","","","","<!--MARK--><a href='null0589e7ed-f181-4812-a767-ee1f5b16e5ea' class='mouseoverHref'>Hanson, M.L. 1955. Some digenetic trematodes of plectognath fishes of Hawaii.</a> <!--MARK--><!--MARK--><a href='nullac26e4c4-eedb-4d31-bc72-d2296528bf60' class='mouseoverHref'><em>Proceedings of the Helminthological Society of Washington</em></a> <strong>22</strong>: 75-87 13 figs<!--MARK-->","","Article in Journal","0589e7ed-f181-4812-a767-ee1f5b16e5ea","20111021T00:19:03.606+0000","ac26e4c4-eedb-4d31-bc72-d2296528bf60"
"Harshey, K.R.","1933","On a new trematode with anus belonging to the genus <i>Opegaster</i> Ozaki 1928, from an Indian eel <i>Anguilla bengalensis</i>","113-118","","Bulletin of the National Academy of Sciences of the United Provinces of Agra and Ordh (Allahbad)","","","","<!--MARK--><a href='nullfe934a62-941d-4690-a380-d3c033275d85' class='mouseoverHref'>Harshey, K.R. 1933. On a new trematode with anus belonging to the genus <i>Opegaster</i> Ozaki 1928, from an Indian eel <i>Anguilla bengalensis</i>.</a> <!--MARK--><!--MARK--><a href='nulla817f985-9535-4951-b6bd-957a9c9475ce' class='mouseoverHref'><em>Bulletin of the National Academy of Sciences of the United Provinces of Agra and Ordh (Allahbad)</em></a> <strong>3</strong>: 113-118<!--MARK-->","","Article in Journal","fe934a62-941d-4690-a380-d3c033275d85","20120824T02:30:13.650+0000","a817f985-9535-4951-b6bd-957a9c9475ce"
"Hickman, V.V.","1955","On <i>Maritrema ornithorhynchi</i> sp. n. a new trematode from the monotreme, <i>Ornithorhynchus anatinus</i> Shaw, with a key to the genus <i>Maritrema</i> Nicoll.","pp. 181-191","","Revista Iberica de Parasitologia. Granada. (Espana).","","","","<!--MARK--><a href='null59ea9000-005c-449d-b27c-185bdbb34cec' class='mouseoverHref'>Hickman, V.V. 1955. On <i>Maritrema ornithorhynchi</i> sp. n. a new trematode from the monotreme, <i>Ornithorhynchus anatinus</i> Shaw, with a key to the genus <i>Maritrema</i> Nicoll.</a> <!--MARK--><!--MARK--><a href='null777b7e46-b8fa-47f6-84b6-98e8f8e34e40' class='mouseoverHref'><em>Revista Iberica de Parasitologia. Granada. (Espana).</em></a> <strong>Tomo extraordinairio Marzo 1955</strong>: pp. 181-191<!--MARK-->","","Article in Journal","59ea9000-005c-449d-b27c-185bdbb34cec","20130805T07:52:43.407+0000","777b7e46-b8fa-47f6-84b6-98e8f8e34e40"
"Ho, H.W., Bray, R.A., Cutmore, S.C., Ward, S. & Cribb, T.H.","2014","Two new species of <i>Phyllodistomum</i> Braun, 1899 (Trematoda: Gorgoderidae Looss, 1899) from Great Barrier Reef fishes","551-562","","Zootaxa","","","","<!--MARK--><a href='null8771d67b-834e-4d53-a0a4-8551cec48817' class='mouseoverHref'>Ho, H.W., Bray, R.A., Cutmore, S.C., Ward, S. & Cribb, T.H. 2014. Two new species of <i>Phyllodistomum</i> Braun, 1899 (Trematoda: Gorgoderidae Looss, 1899) from Great Barrier Reef fishes.</a> <!--MARK--><!--MARK--><a href='null96466227-221c-4922-ac97-1ac2dd946d0a' class='mouseoverHref'><em>Zootaxa</em></a> <strong>3779</strong>(5): 551-562<!--MARK-->","","Article in Journal","8771d67b-834e-4d53-a0a4-8551cec48817","20170308T04:29:36.888+0000","96466227-221c-4922-ac97-1ac2dd946d0a"
"Huston, D.C., Cutmore, S.C. & Cribb, T.H.","2018","<em>Isorchis cannoni</em> n. sp. (Digenea: Atractotrematidae) from Great Barrier Reef rabbitfishes and the molecular elucidation of its life cycle.","604-611","","Journal of Helminthology","","","","<!--MARK--><a href='null17e611ab-af64-4c13-8bf8-f658883c9536' class='mouseoverHref'>Huston, D.C., Cutmore, S.C. & Cribb, T.H. 2018. <em>Isorchis cannoni</em> n. sp. (Digenea: Atractotrematidae) from Great Barrier Reef rabbitfishes and the molecular elucidation of its life cycle.</a> <!--MARK--><!--MARK--><a href='null383f9aee-ddd6-4241-87d6-975797a74bed' class='mouseoverHref'><em>Journal of Helminthology</em></a> <strong>92</strong>: 604-611<!--MARK-->","","Article in Journal","17e611ab-af64-4c13-8bf8-f658883c9536","20200506T23:49:22.712+0000","383f9aee-ddd6-4241-87d6-975797a74bed"
"Hutson, K., Ernst, I., Mooney, A.J. & Whittington, I.D.","2007","Metazoan parasite assemblages of wild <i>Seriola lalandi</i> (Carangidae) from eastern and southern Australia.","95-105","","Parasitology International","","","","<!--MARK--><a href='null5bcc1d66-7b7e-41fe-8c16-d0741d1a0667' class='mouseoverHref'>Hutson, K., Ernst, I., Mooney, A.J. & Whittington, I.D. 2007. Metazoan parasite assemblages of wild <i>Seriola lalandi</i> (Carangidae) from eastern and southern Australia.</a> <!--MARK--><!--MARK--><a href='null6017549d-53bd-4a0f-b2ec-052a1d19d02c' class='mouseoverHref'><em>Parasitology International</em></a> <strong>56</strong>: 95-105<!--MARK-->","","Article in Journal","5bcc1d66-7b7e-41fe-8c16-d0741d1a0667","20120504T01:52:05.055+0000","6017549d-53bd-4a0f-b2ec-052a1d19d02c"
"Ingles, L.G.","1932","Four new species of <em>Haenatoloechus</em> (Trematoda) from <em>Rana aurora draytoni</em> from California.","189-202","","University of California Publications in Zoology","","","","<!--MARK--><a href='nullc01c65f7-175c-41ee-acab-8ba076a257ae' class='mouseoverHref'>Ingles, L.G. 1932. Four new species of <em>Haenatoloechus</em> (Trematoda) from <em>Rana aurora draytoni</em> from California.</a> <!--MARK--><!--MARK--><a href='nulla1d894b9-6896-4b27-a352-f01214bd467e' class='mouseoverHref'><em>University of California Publications in Zoology</em></a> <strong>37</strong>: 189-202<!--MARK-->","","Article in Journal","c01c65f7-175c-41ee-acab-8ba076a257ae","20181105T22:26:22.866+0000","a1d894b9-6896-4b27-a352-f01214bd467e"
"Issaitschikow, I.M.","1928","Contributions to knowledge of parasitic helminths of some groups of vertebrates in the Russian Arctic","5-79","","Trudy Morskoi Nauchnyi Institut, Moskva","","","","<!--MARK--><a href='nullce4c3695-3afa-4206-8420-d06a867909db' class='mouseoverHref'>Issaitschikow, I.M. 1928. Contributions to knowledge of parasitic helminths of some groups of vertebrates in the Russian Arctic.</a> <!--MARK--><!--MARK--><a href='nullb7ee1e9f-2330-4fab-8362-e8ce10a26663' class='mouseoverHref'><em>Trudy Morskoi Nauchnyi Institut, Moskva</em></a> <strong>3</strong>: 5-79<!--MARK-->","","Article in Journal","ce4c3695-3afa-4206-8420-d06a867909db","20120807T07:06:51.918+0000","b7ee1e9f-2330-4fab-8362-e8ce10a26663"
"Jägarskiöld, L.A. (ed.)","1911","Results of the Swedish Zoological expedition to Egypt 1907","pp. 166 Taf. 1-6","","","","","Library of the Royal University of Uppsala","<!--MARK--><a href='null6196defe-cbad-4aea-be4c-27594a2f6c58' class='mouseoverHref'>Jägarskiöld, L.A. (ed.) 1911. <em>Results of the Swedish Zoological expedition to Egypt 1907</em>. Uppsala : Library of the Royal University of Uppsala 4 No. 23A pp. 166 Taf. 1-6.</a><!--MARK-->","","Book","6196defe-cbad-4aea-be4c-27594a2f6c58","20111006T05:21:05.863+0000",""
"Johnston, S.J.","1912","On some trematode-parasites of Australian frogs","285-362","","Proceedings of the Linnean Society of New South Wales","","","","<!--MARK--><a href='nulle4dd9f5e-8970-433d-99fd-50b398a54b86' class='mouseoverHref'>Johnston, S.J. 1912. On some trematode-parasites of Australian frogs.</a> <!--MARK--><!--MARK--><a href='nullc12cd779-adb5-41ea-bd2c-75f6864cf22e' class='mouseoverHref'><em>Proceedings of the Linnean Society of New South Wales</em></a> <strong>37</strong>: 285-362<!--MARK-->","","Article in Journal","e4dd9f5e-8970-433d-99fd-50b398a54b86","","c12cd779-adb5-41ea-bd2c-75f6864cf22e"
"Johnston, S.J.","1913","On some Queensland Trematodes, with anatomical observations and descriptions of new species and genera","361-400","","Quarterly Journal of Microscopical Science","","","","<!--MARK--><a href='null21b631f9-b489-4b41-85f2-51275cef6d38' class='mouseoverHref'>Johnston, S.J. 1913. On some Queensland Trematodes, with anatomical observations and descriptions of new species and genera.</a> <!--MARK--><!--MARK--><a href='null0f162f90-df4f-47f1-908a-687f940ac834' class='mouseoverHref'><em>Quarterly Journal of Microscopical Science</em></a> <strong>59</strong>: 361-400<!--MARK-->","","Article in Journal","21b631f9-b489-4b41-85f2-51275cef6d38","20110725T01:25:48.371+0000","0f162f90-df4f-47f1-908a-687f940ac834"
"Johnston, S.J.","1917","On the trematodes of Australian birds","187-261","","Journal and Proceedings of the Royal Society of New South Wales","","","","<!--MARK--><a href='null69d12f44-d890-404c-a7ee-b4183fe1c5ac' class='mouseoverHref'>Johnston, S.J. 1917. On the trematodes of Australian birds.</a> <!--MARK--><!--MARK--><a href='nullf33c0881-c1a2-4b22-a3c1-439b32e0142f' class='mouseoverHref'><em>Journal and Proceedings of the Royal Society of New South Wales</em></a> <strong>50</strong>: 187-261<!--MARK-->","","Article in Journal","69d12f44-d890-404c-a7ee-b4183fe1c5ac","","f33c0881-c1a2-4b22-a3c1-439b32e0142f"
"Johnston, T.H.","1934","New Trematodes from South Australian Elasmobranchs","25-32 7 figs","","Australian Journal of Experimental Biology and Medical Science","","","","<!--MARK--><a href='null89c6a170-b443-44dc-8559-dc9a883bb43a' class='mouseoverHref'>Johnston, T.H. 1934. New Trematodes from South Australian Elasmobranchs.</a> <!--MARK--><!--MARK--><a href='null011d22a8-1159-4b8a-a648-7cca3349e700' class='mouseoverHref'><em>Australian Journal of Experimental Biology and Medical Science</em></a> <strong>12</strong>: 25-32 7 figs<!--MARK-->","","Article in Journal","89c6a170-b443-44dc-8559-dc9a883bb43a","20111012T00:18:46.079+0000","011d22a8-1159-4b8a-a648-7cca3349e700"
"Johnston, T.H.","1934","Some Australian Anaporrhutine trematodes","139-148","","Transactions of the Royal Society of South Australia","","","","<!--MARK--><a href='null0f490eeb-a818-4cb6-8a91-1c86db4e332b' class='mouseoverHref'>Johnston, T.H. 1934. Some Australian Anaporrhutine trematodes.</a> <!--MARK--><!--MARK--><a href='null8b48b0a3-dd7a-4aea-be0d-10a223710ebc' class='mouseoverHref'><em>Transactions of the Royal Society of South Australia</em></a> <strong>58</strong>: 139-148<!--MARK-->","","Article in Journal","0f490eeb-a818-4cb6-8a91-1c86db4e332b","20121007T04:16:26.511+0000","8b48b0a3-dd7a-4aea-be0d-10a223710ebc"
"Johnston, T.H.","1948","<i>Microphallus minutus</i>, a new trematode from the Australian water rat","93-100","","Records of the South Australian Museum (Adelaide)","","","","<!--MARK--><a href='null1fd4dd26-22a9-46b7-8f99-21f625b301f0' class='mouseoverHref'>Johnston, T.H. 1948. <i>Microphallus minutus</i>, a new trematode from the Australian water rat.</a> <!--MARK--><!--MARK--><a href='nullf7f76869-b0b8-4c0e-a1bc-1d8c43cc0f89' class='mouseoverHref'><em>Records of the South Australian Museum (Adelaide)</em></a> <strong>9</strong>(1): 93-100<!--MARK-->","","Article in Journal","1fd4dd26-22a9-46b7-8f99-21f625b301f0","20111013T00:25:06.341+0000","f7f76869-b0b8-4c0e-a1bc-1d8c43cc0f89"
"Johnston, T.H. & Angel, L.M.","1940","The morphology and life history of the trematode <em>Dolichopera macalpini</em> Nicoll.","376-387","","Transactions of the Royal Society of South Australia","","","","<!--MARK--><a href='nullf2680fd0-1696-4646-bb31-385fc459c39b' class='mouseoverHref'>Johnston, T.H. & Angel, L.M. 1940. The morphology and life history of the trematode <em>Dolichopera macalpini</em> Nicoll.</a> <!--MARK--><!--MARK--><a href='null8b48b0a3-dd7a-4aea-be0d-10a223710ebc' class='mouseoverHref'><em>Transactions of the Royal Society of South Australia</em></a> <strong>64</strong>: 376-387<!--MARK-->","","Article in Journal","f2680fd0-1696-4646-bb31-385fc459c39b","20181031T22:28:51.903+0000","8b48b0a3-dd7a-4aea-be0d-10a223710ebc"
"Johnston, T.H. & Angel, L.M.","1951","The life-history of <i>Plagiorchis jaenschi</i>, a new trematode from the Australian water rat","49-58","","Transactions of the Royal Society of South Australia","","","","<!--MARK--><a href='nulla0373399-b630-4df0-8dce-ea5441f7b96f' class='mouseoverHref'>Johnston, T.H. & Angel, L.M. 1951. The life-history of <i>Plagiorchis jaenschi</i>, a new trematode from the Australian water rat.</a> <!--MARK--><!--MARK--><a href='null8b48b0a3-dd7a-4aea-be0d-10a223710ebc' class='mouseoverHref'><em>Transactions of the Royal Society of South Australia</em></a> <strong>75</strong>: 49-58<!--MARK-->","","Article in Journal","a0373399-b630-4df0-8dce-ea5441f7b96f","20111024T23:54:42.824+0000","8b48b0a3-dd7a-4aea-be0d-10a223710ebc"
"Johnston, T.H. & Mawson, P.M.","1940","Reniferidae, type <i>Dolichopera macalpini</i> Nicoll 1914","385-387, 18 figs","","Transactions of the Royal Society of South Australia","","","","<!--MARK--><a href='nullea7e5482-988d-417d-b366-d5b87363955e' class='mouseoverHref'>Johnston, T.H. & Mawson, P.M. 1940. Reniferidae, type <i>Dolichopera macalpini</i> Nicoll 1914.</a> <!--MARK--><!--MARK--><a href='null8b48b0a3-dd7a-4aea-be0d-10a223710ebc' class='mouseoverHref'><em>Transactions of the Royal Society of South Australia</em></a> <strong>64</strong>: 385-387, 18 figs<!--MARK-->","","Article in Journal","ea7e5482-988d-417d-b366-d5b87363955e","20111011T23:37:40.182+0000","8b48b0a3-dd7a-4aea-be0d-10a223710ebc"
"Kennedy, C.R.","1995","Richness and diversity of macroparasite communities in tropical eels <i>Anguilla reinhardtii</i> in Queensland, Australia","233-245","","Parasitology","","","","<!--MARK--><a href='nulle4cfd07f-44c7-4ecf-808c-900b10d21e09' class='mouseoverHref'>Kennedy, C.R. 1995. Richness and diversity of macroparasite communities in tropical eels <i>Anguilla reinhardtii</i> in Queensland, Australia.</a> <!--MARK--><!--MARK--><a href='nullb2746c84-c004-431c-8966-2f153b82b814' class='mouseoverHref'><em>Parasitology</em></a> <strong>111</strong>: 233-245<!--MARK-->","","Article in Journal","e4cfd07f-44c7-4ecf-808c-900b10d21e09","","b2746c84-c004-431c-8966-2f153b82b814"
"Korotaeva, V.D.","1969","[Helminth infection of marine fishes of the family Berycidae in the Great Australian Bight]","1","","","","","","<!--MARK--><a href='nullb1a0c0ee-7ea5-4c2f-b72a-f4f528778976' class='mouseoverHref'>Korotaeva, V.D. 1969. [Helminth infection of marine fishes of the family Berycidae in the Great Australian Bight]. Voprosy Morskoi Biologii : Tezisy II Vsesoyuznaya Simpoziuma Molodykh Uchenykh, Sebastopol, Vols 68-70. 1 pp.</a><!--MARK--> [in Russian]","in Russian","Miscellaneous","b1a0c0ee-7ea5-4c2f-b72a-f4f528778976","",""
"Korotaeva, V.D.","1969","[Helminth infection of marine fishes of the family Berycidae in the Great Australian Bight]","1","","","","","","<!--MARK--><a href='null1aa2c343-b842-401b-b649-4a53de644a2f' class='mouseoverHref'>Korotaeva, V.D. 1969. [Helminth infection of marine fishes of the family Berycidae in the Great Australian Bight]. Voprosy Morskoi Biologii : Tezisy II Vsesoyuznaya Simpoziuma Molodykh Uchenykh, Sebastopol, Vols 68-70 (In Russian). 1 pp.</a>","","Miscellaneous","1aa2c343-b842-401b-b649-4a53de644a2f","",""
"Korotaeva, V.D.","1971","[Helminth fauna of the commercial marine fishes of sub-order Trichiuroidei in the Australia -- New Zealand region]","69-84","","Izvestiya Tikhookeanskogo Nauchno Issledovatel'skogo Instituta Rybnogo Khozyaistva i Okeanografii (TINRO)","","","","<!--MARK--><a href='null94e9b16b-ad2c-4a23-94f9-bbbd2d3a59bb' class='mouseoverHref'>Korotaeva, V.D. 1971. [Helminth fauna of the commercial marine fishes of sub-order Trichiuroidei in the Australia -- New Zealand region].</a> <!--MARK--><!--MARK--><a href='null3475d516-3c50-45dd-a6d8-05ae3f7f41dc' class='mouseoverHref'><em>Izvestiya Tikhookeanskogo Nauchno Issledovatel'skogo Instituta Rybnogo Khozyaistva i Okeanografii (TINRO)</em></a> <strong>75</strong>: 69-84<!--MARK-->","","Article in Journal","94e9b16b-ad2c-4a23-94f9-bbbd2d3a59bb","20081009T05:11:37.000+0000","3475d516-3c50-45dd-a6d8-05ae3f7f41dc"
"Korotaeva, V.D.","1972","New species of the trematode <i>Hysterogonia bychowskyi</i> sp. n. from Australian boarfish","439-440, fig.","","Parazitologiya","","","","<!--MARK--><a href='null851f740e-9df4-48d2-b97d-595b4c1b27ed' class='mouseoverHref'>Korotaeva, V.D. 1972. New species of the trematode <i>Hysterogonia bychowskyi</i> sp. n. from Australian boarfish.</a> <!--MARK--><!--MARK--><a href='null7167ef1d-6679-44d9-8a39-40f49cb120ef' class='mouseoverHref'><em>Parazitologiya</em></a> <strong>6</strong>(5): 439-440, fig.<!--MARK-->","","Article in Journal","851f740e-9df4-48d2-b97d-595b4c1b27ed","20111021T00:23:45.422+0000","7167ef1d-6679-44d9-8a39-40f49cb120ef"
"Korotaeva, V.D.","1975","[Contributions to the fauna of helminths and parasitic crustaceans of marine commercial fishes of Australian and New Zealand waters]","46-60","","Trudy Biologopochvenn'i Institut, Vladivostock","","","","<!--MARK--><a href='nulle558b05c-b534-4a47-86e1-1d20bdf7d494' class='mouseoverHref'>Korotaeva, V.D. 1975. [Contributions to the fauna of helminths and parasitic crustaceans of marine commercial fishes of Australian and New Zealand waters].</a> <!--MARK--><!--MARK--><a href='nullf2a18511-41f2-4c96-8287-f248c887e038' class='mouseoverHref'><em>Trudy Biologopochvenn'i Institut, Vladivostock</em></a> N.S. <strong>26</strong>: 46-60<!--MARK-->","","Article in Journal","e558b05c-b534-4a47-86e1-1d20bdf7d494","20130122T04:07:11.296+0000","f2a18511-41f2-4c96-8287-f248c887e038"
"Korotaeva, V.D.","1982","The fauna of trematodes in fishes of the order Zeiformes","464-468","","Parazitologiya","","","","<!--MARK--><a href='null6feb482f-6745-47e9-9053-de927e7eab4d' class='mouseoverHref'>Korotaeva, V.D. 1982. The fauna of trematodes in fishes of the order Zeiformes.</a> <!--MARK--><!--MARK--><a href='null7167ef1d-6679-44d9-8a39-40f49cb120ef' class='mouseoverHref'><em>Parazitologiya</em></a> <strong>16</strong>: 464-468<!--MARK-->","","Article in Journal","6feb482f-6745-47e9-9053-de927e7eab4d","20081009T05:11:37.000+0000","7167ef1d-6679-44d9-8a39-40f49cb120ef"
"Kossack, W.","1910","Neue Distomen","114-120","","Centralblatt für Bakteriologie Originale","","","","<!--MARK--><a href='null0811547e-13a8-4183-940c-a2698a621bce' class='mouseoverHref'>Kossack, W. 1910. Neue Distomen.</a> <!--MARK--><!--MARK--><a href='nulldea2ed2f-9c48-4138-ae75-67575efa1b43' class='mouseoverHref'><em>Centralblatt für Bakteriologie Originale</em></a> <strong>56</strong>: 114-120<!--MARK-->","","Article in Journal","0811547e-13a8-4183-940c-a2698a621bce","20111011T21:48:24.761+0000","dea2ed2f-9c48-4138-ae75-67575efa1b43"
"Kruse, G.O.W.","1979","Trematodes of marine fishes from South Australia. 6. <i>Monostephanostomum manteri</i> gen. et sp. n. (Acanthocolpidae)","921-923","","Journal of Parasitology","","","","<!--MARK--><a href='nullb69c5d0d-7f9a-44af-b2d9-8d8531c95ae1' class='mouseoverHref'>Kruse, G.O.W. 1979. Trematodes of marine fishes from South Australia. 6. <i>Monostephanostomum manteri</i> gen. et sp. n. (Acanthocolpidae).</a> <!--MARK--><!--MARK--><a href='nulle52ecfa4-7e99-4ea0-acd3-ce3d83537d01' class='mouseoverHref'><em>Journal of Parasitology</em></a> <strong>65</strong>: 921-923<!--MARK-->","","Article in Journal","b69c5d0d-7f9a-44af-b2d9-8d8531c95ae1","","e52ecfa4-7e99-4ea0-acd3-ce3d83537d01"
"Kudlai, O., Cribb, T.H. & Cutmore, S.C.","2016","A new species of microphallid (Trematoda: Digenea) infecting a novel host family, the Muraenidae, on the northern Great Barrier Reef, Australia","863-876","","Systematic Parasitology","","","","<!--MARK--><a href='null2a76f8fd-2739-425e-91c5-636730bce254' class='mouseoverHref'>Kudlai, O., Cribb, T.H. & Cutmore, S.C. 2016. A new species of microphallid (Trematoda: Digenea) infecting a novel host family, the Muraenidae, on the northern Great Barrier Reef, Australia.</a> <!--MARK--><!--MARK--><a href='nullb0bb30a0-dfa7-4cf2-bf21-216d851b8d01' class='mouseoverHref'><em>Systematic Parasitology</em></a> <strong>93</strong>: 863-876<!--MARK-->","","Article in Journal","2a76f8fd-2739-425e-91c5-636730bce254","20161111T03:03:21.802+0000","b0bb30a0-dfa7-4cf2-bf21-216d851b8d01"
"Kurochkin, Yu.V.","1970","New trematode species Discogasteroidinae (Trematoda, Fellodistomatidae) from marine fishes of Australia","111-115","","Parazitologiya","","","","<!--MARK--><a href='null3b4e1b32-e0a1-49c7-ab52-bc83d97ef7bf' class='mouseoverHref'>Kurochkin, Yu.V. 1970. New trematode species Discogasteroidinae (Trematoda, Fellodistomatidae) from marine fishes of Australia.</a> <!--MARK--><!--MARK--><a href='null7167ef1d-6679-44d9-8a39-40f49cb120ef' class='mouseoverHref'><em>Parazitologiya</em></a> <strong>4</strong>: 111-115<!--MARK-->","","Article in Journal","3b4e1b32-e0a1-49c7-ab52-bc83d97ef7bf","","7167ef1d-6679-44d9-8a39-40f49cb120ef"
"Lamothe-Argumedo, R.","1969","Tremátodos de peces IV. Registro de cuatro especies de tremátodos de peces marinos de la costa del Pacífico Mexicano","179-194","","Anales del Instituto de Biología, Universidad Nacional Autónoma de México","","","","<!--MARK--><a href='null246e82f1-e1c1-43e2-80c1-97b6e76364f6' class='mouseoverHref'>Lamothe-Argumedo, R. 1969. Tremátodos de peces IV. Registro de cuatro especies de tremátodos de peces marinos de la costa del Pacífico Mexicano.</a> <!--MARK--><!--MARK--><a href='null7efe5ce0-bbbf-4ad5-acec-2d91463a339e' class='mouseoverHref'><em>Anales del Instituto de Biología, Universidad Nacional Autónoma de México</em></a> <strong>40</strong>: 179-194<!--MARK-->","","Article in Journal","246e82f1-e1c1-43e2-80c1-97b6e76364f6","20121031T05:31:57.865+0000","7efe5ce0-bbbf-4ad5-acec-2d91463a339e"
"Layman, E.M.","1930","Parasitic worms from the fishes of Peter The Great Bay","1-120","","Bulletins of the Pacific Scientific Fishery Research Station","","","","<!--MARK--><a href='null83ec2b57-884e-45e3-a416-8a984b94c8ab' class='mouseoverHref'>Layman, E.M. 1930. Parasitic worms from the fishes of Peter The Great Bay.</a> <!--MARK--><!--MARK--><a href='null13c94177-df38-47bf-bdcf-b5e9c7588a7f' class='mouseoverHref'><em>Bulletins of the Pacific Scientific Fishery Research Station</em></a> <strong>3</strong>: 1-120<!--MARK-->","","Article in Journal","83ec2b57-884e-45e3-a416-8a984b94c8ab","20120709T03:20:14.744+0000","13c94177-df38-47bf-bdcf-b5e9c7588a7f"
"Lebedev, B.I.","1968","[Helminth fauna of carangid fish in the Pacific Ocean] (In Russian)","80-85","","Soobshcheniya Dal'nevostochnogo Filiala im. B. L. Komarova Akademii Nauk SSR","","","","<!--MARK--><a href='nullcf12c1e7-e38b-45f1-8a22-a8962ba2f093' class='mouseoverHref'>Lebedev, B.I. 1968. [Helminth fauna of carangid fish in the Pacific Ocean] (In Russian).</a> <!--MARK--><!--MARK--><a href='nullf47ac990-c7e3-4e65-b992-ba64a4d9c222' class='mouseoverHref'><em>Soobshcheniya Dal'nevostochnogo Filiala im. B. L. Komarova Akademii Nauk SSR</em></a> <strong>26</strong>: 80-85<!--MARK-->","","Article in Journal","cf12c1e7-e38b-45f1-8a22-a8962ba2f093","20120824T05:25:54.844+0000","f47ac990-c7e3-4e65-b992-ba64a4d9c222"
"Lebedev, B.I.","1968","New trematodes of pelagic fish of the order Perciformes in the Pacific Ocean Basin","56-64","[Helminths of Animals from the Pacific Ocean]","","","","","<!--MARK--><a href='null933d83e2-dc29-470d-94a2-0bbb8cf187f7' class='mouseoverHref'>Lebedev, B.I. 1968. New trematodes of pelagic fish of the order Perciformes in the Pacific Ocean Basin. pp. 56-64</a> <!--MARK--><em>in</em> <!--MARK--><a href='nulle0ac1a9c-f8c5-4da5-8cb7-8e4aeff9fdd6' class='mouseoverHref'>Skryabin, K.I. & Manaev, Yu.L. (eds). <em>[Helminths of Animals from the Pacific Ocean]</em>. Moscow : Nauka.</a><!--MARK-->","","Chapter in Book","933d83e2-dc29-470d-94a2-0bbb8cf187f7","20110816T01:57:07.274+0000","e0ac1a9c-f8c5-4da5-8cb7-8e4aeff9fdd6"
"Lester, R.J.G. & Sewell, K.B.","1990","Checklist of parasites from Heron Island, Great Barrier Reef","101-128","","Australian Journal of Zoology","","","","<!--MARK--><a href='null49289da5-6818-4dbf-a7b4-d51030415d7d' class='mouseoverHref'>Lester, R.J.G. & Sewell, K.B. 1990. Checklist of parasites from Heron Island, Great Barrier Reef.</a> <!--MARK--><!--MARK--><a href='null53c3abd8-0254-4532-a73e-d9ef6b7ac2ef' class='mouseoverHref'><em>Australian Journal of Zoology</em></a> <strong>37</strong>: 101-128<!--MARK-->","","Article in Journal","49289da5-6818-4dbf-a7b4-d51030415d7d","20081009T05:11:37.000+0000","53c3abd8-0254-4532-a73e-d9ef6b7ac2ef"
"Li, Q., Qiu, Z. & Zhang, R.","1988","Digenetic trematodes of fishes from the Bo-hai Sea, China V (Trematoda:  Opecoelidae)","329-336","","Acta Zootaxonomica Sinica","","","","<!--MARK--><a href='null0a1f6d80-22c6-4cff-9ffa-300631e17eb8' class='mouseoverHref'>Li, Q., Qiu, Z. & Zhang, R. 1988. Digenetic trematodes of fishes from the Bo-hai Sea, China V (Trematoda:  Opecoelidae).</a> <!--MARK--><!--MARK--><a href='nullc8ee3f84-73b7-4266-884c-0860d97bcdaa' class='mouseoverHref'><em>Acta Zootaxonomica Sinica</em></a> <strong>13</strong>: 329-336<!--MARK-->","","Article in Journal","0a1f6d80-22c6-4cff-9ffa-300631e17eb8","20120821T12:37:21.320+0000","c8ee3f84-73b7-4266-884c-0860d97bcdaa"
"Linton, E.","1910","Helminth fauna of the Dry Tortugas. 2. Trematodes","11-98","","Papers from the Tortugas Laboratory of the Carnegie Institute of Washington","","","","<!--MARK--><a href='null508b94fe-421c-4d5b-a879-31d7e1064eda' class='mouseoverHref'>Linton, E. 1910. Helminth fauna of the Dry Tortugas. 2. Trematodes.</a> <!--MARK--><!--MARK--><a href='nullef264906-eb7c-479d-97dd-ee7da1756332' class='mouseoverHref'><em>Papers from the Tortugas Laboratory of the Carnegie Institute of Washington</em></a> <strong>4</strong>(Publ. 133): 11-98<!--MARK-->","","Article in Journal","508b94fe-421c-4d5b-a879-31d7e1064eda","20110429T03:04:26.988+0000","ef264906-eb7c-479d-97dd-ee7da1756332"
