"PUB_AUTHOR","PUB_YEAR","PUB_TITLE","PUB_PAGES","PUB_PARENT_BOOK_TITLE","PUB_PARENT_JOURNAL_TITLE","PUB_PARENT_ARTICLE_TITLE","PUB_PUBLICATION_DATE","PUB_PUBLISHER","PUB_FORMATTED","PUB_QUALIFICATION","PUB_TYPE","PUBLICATION_GUID","PUBLICATION_LAST_UPDATE","PARENT_PUBLICATION_GUID"
"Campbell, R.A.","2008","Family Gorgoderidae Looss, 1899. Keys to the Trematoda, Volume 3","pp. 191-213","Keys to the Trematoda.","","","","","<!--MARK--><a href='nullfe62c9c4-4a2f-46b2-9578-b2b4b424c390' class='mouseoverHref'>Campbell, R.A. 2008. Family Gorgoderidae Looss, 1899. Keys to the Trematoda, Volume 3. pp. 191-213</a> <!--MARK--><em>in</em> <!--MARK--><a href='nullf5ffe325-d0e3-44b1-8ca7-4b7e84e92f3c' class='mouseoverHref'>Bray, R.A., Gibson, D.I. & Jones, A. <em>Keys to the Trematoda</em>. Wallingford : CAB International Vol. 3 824 pp.</a><!--MARK-->","","Chapter in Book","fe62c9c4-4a2f-46b2-9578-b2b4b424c390","20121007T05:26:44.960+0000","f5ffe325-d0e3-44b1-8ca7-4b7e84e92f3c"
"Canaris, A.G. & Kinsella, J.M.","1998","Helminth parasite communities in four species of shorebirds (Charadriidae) on King Island, Tasmania","49-57","","Papers and Proceedings of the Royal Society of Tasmania","","","","<!--MARK--><a href='null0ff9986b-5885-491c-8200-1df1a16fea49' class='mouseoverHref'>Canaris, A.G. & Kinsella, J.M. 1998. Helminth parasite communities in four species of shorebirds (Charadriidae) on King Island, Tasmania.</a> <!--MARK--><!--MARK--><a href='nulldb793adc-ebf2-40c5-9d92-48a121ea03ae' class='mouseoverHref'><em>Papers and Proceedings of the Royal Society of Tasmania</em></a> <strong>132</strong>: 49-57<!--MARK-->","","Article in Journal","0ff9986b-5885-491c-8200-1df1a16fea49","20081009T05:11:37.000+0000","db793adc-ebf2-40c5-9d92-48a121ea03ae"
"Canavan, W.P.N.","1937","Two new species of Trematodes, a Renifer <i>Lechriorchis secundus</i> n. sp. from <i>Natrix s. sipedon</i> and a Dicrocoelid <i>Dicrocoelium proxillicens</i> n. sp. from <i>Kakatoe sulphurea</i>","478-481 2 figs","","Journal of Parasitology","","","","<!--MARK--><a href='nullf7710c8d-9662-4247-b2e2-345c2876b4db' class='mouseoverHref'>Canavan, W.P.N. 1937. Two new species of Trematodes, a Renifer <i>Lechriorchis secundus</i> n. sp. from <i>Natrix s. sipedon</i> and a Dicrocoelid <i>Dicrocoelium proxillicens</i> n. sp. from <i>Kakatoe sulphurea</i>.</a> <!--MARK--><!--MARK--><a href='nulle52ecfa4-7e99-4ea0-acd3-ce3d83537d01' class='mouseoverHref'><em>Journal of Parasitology</em></a> <strong>23</strong>: 478-481 2 figs<!--MARK-->","","Article in Journal","f7710c8d-9662-4247-b2e2-345c2876b4db","20111011T22:33:09.686+0000","e52ecfa4-7e99-4ea0-acd3-ce3d83537d01"
"Cannon, L.R.G.","1978","Marine cercariae from the gastropod <em>Cerithium moniliferum</em> Kiener at Heron Island, Great Barrier Reef.","45-57","","Proceedings of the Royal Society of Queensland","","","","<!--MARK--><a href='nullb541c373-d214-4d38-83a4-40d548c1f5ae' class='mouseoverHref'>Cannon, L.R.G. 1978. Marine cercariae from the gastropod <em>Cerithium moniliferum</em> Kiener at Heron Island, Great Barrier Reef.</a> <!--MARK--><!--MARK--><a href='null642ab613-813a-48d0-8bc0-42c78157f7b0' class='mouseoverHref'><em>Proceedings of the Royal Society of Queensland</em></a> <strong>89</strong>: 45-57<!--MARK-->","","Article in Journal","b541c373-d214-4d38-83a4-40d548c1f5ae","20180301T08:08:09.401+0000","642ab613-813a-48d0-8bc0-42c78157f7b0"
"Chattopadhyaya, D.R.","1971","Studies on the trematode parasites of reptiles found in India. (Digenetic flukes from the marine snakes of the coast of Bombay)","35-62, 7 figs","","Helminthologia","","","","<!--MARK--><a href='null5400070d-d50d-4aa1-9c48-70f9f0788a82' class='mouseoverHref'>Chattopadhyaya, D.R. 1971. Studies on the trematode parasites of reptiles found in India. (Digenetic flukes from the marine snakes of the coast of Bombay).</a> <!--MARK--><!--MARK--><a href='null2262f69f-a923-4883-9992-47372ab3654f' class='mouseoverHref'><em>Helminthologia</em></a> <strong>11</strong>: 35-62, 7 figs<!--MARK--> [German & Russian summaries]","German & Russian summaries","Article in Journal","5400070d-d50d-4aa1-9c48-70f9f0788a82","20111012T00:01:57.957+0000","2262f69f-a923-4883-9992-47372ab3654f"
"Ching, H.L.","1990","Some helminth parasites of dunlin (<i>Calidris alpina</i>) and western willet (<i>Catoptrophorus semipalmatus inornatus</i>) from California","44-50","","Journal of the Helminthological Society, Washington","","","","<!--MARK--><a href='nulla70dd9e2-b87d-4c08-b243-a5c1570bb6ef' class='mouseoverHref'>Ching, H.L. 1990. Some helminth parasites of dunlin (<i>Calidris alpina</i>) and western willet (<i>Catoptrophorus semipalmatus inornatus</i>) from California.</a> <!--MARK--><!--MARK--><a href='null858bdc2e-06ca-42c0-b018-6b6c6c05df21' class='mouseoverHref'><em>Journal of the Helminthological Society, Washington</em></a> <strong>57</strong>: 44-50<!--MARK-->","","Article in Journal","a70dd9e2-b87d-4c08-b243-a5c1570bb6ef","20111025T00:46:02.707+0000","858bdc2e-06ca-42c0-b018-6b6c6c05df21"
"Cohn, L.","1904","Helminthological Mitteilungen. II","229-252, pl. xi","","Archiv für Naturgeschichte","","","","<!--MARK--><a href='null4ceb917f-b001-41b4-ab25-e655d3f55bd2' class='mouseoverHref'>Cohn, L. 1904. Helminthological Mitteilungen. II.</a> <!--MARK--><!--MARK--><a href='nullf5b5f7c7-fc53-4502-951d-1c96b680d874' class='mouseoverHref'><em>Archiv für Naturgeschichte</em></a> <strong>1904</strong>(i): 229-252, pl. xi<!--MARK-->","","Article in Journal","4ceb917f-b001-41b4-ab25-e655d3f55bd2","20111025T00:40:17.398+0000","f5b5f7c7-fc53-4502-951d-1c96b680d874"
"Corner, R.D., Booth, R.J. & Cutmore, S.C.","2022","<i>Plesiochorus irwinorum</i> n. sp. (Trematoda: Gorgoderidae) from the urinary bladder of the hawksbill turtle, <i>Eretmochelys imbricata</i> (Testudines: Cheloniidae), off the east coast of Australia.","","","Systematic Parasitology","","","","<!--MARK--><a href='null8dab81f3-97a6-43d8-ac36-7ff0079854bd' class='mouseoverHref'>Corner, R.D., Booth, R.J. & Cutmore, S.C. 2022. <i>Plesiochorus irwinorum</i> n. sp. (Trematoda: Gorgoderidae) from the urinary bladder of the hawksbill turtle, <i>Eretmochelys imbricata</i> (Testudines: Cheloniidae), off the east coast of Australia.</a> <!--MARK--><!--MARK--><a href='nullb0bb30a0-dfa7-4cf2-bf21-216d851b8d01' class='mouseoverHref'><em>Systematic Parasitology</em></a> <!--MARK-->","","Article in Journal","8dab81f3-97a6-43d8-ac36-7ff0079854bd","20220614T06:45:11.657+0000","b0bb30a0-dfa7-4cf2-bf21-216d851b8d01"
"Cribb, T.H.","1985","The life-cycle and biology of <i>Opecoelus variabilis</i>, sp. nov. (Digenea, Opecoelidae)","715-728","","Australian Journal of Zoology","","","","<!--MARK--><a href='null8673c305-2cea-43d7-8c83-f087f73b7e76' class='mouseoverHref'>Cribb, T.H. 1985. The life-cycle and biology of <i>Opecoelus variabilis</i>, sp. nov. (Digenea, Opecoelidae).</a> <!--MARK--><!--MARK--><a href='null53c3abd8-0254-4532-a73e-d9ef6b7ac2ef' class='mouseoverHref'><em>Australian Journal of Zoology</em></a> <strong>33</strong>(5): 715-728<!--MARK-->","","Article in Journal","8673c305-2cea-43d7-8c83-f087f73b7e76","20111023T21:25:23.659+0000","53c3abd8-0254-4532-a73e-d9ef6b7ac2ef"
"Cribb, T.H.","1987","A new species of <i>Phyllodistomum</i> (Digenea: Gorgoderidae) from Australian and New Zealand freshwater fishes with notes on the taxonomy of <i>Phyllodistomum</i> Braun, 1899","1525-1538","","Journal of Natural History","","","","<!--MARK--><a href='null85df77fd-7612-4b48-81a1-5f604b014861' class='mouseoverHref'>Cribb, T.H. 1987. A new species of <i>Phyllodistomum</i> (Digenea: Gorgoderidae) from Australian and New Zealand freshwater fishes with notes on the taxonomy of <i>Phyllodistomum</i> Braun, 1899.</a> <!--MARK--><!--MARK--><a href='nullad79edeb-4c47-4124-a7ea-9bcbbce0efa4' class='mouseoverHref'><em>Journal of Natural History</em></a> <strong>21</strong>: 1525-1538<!--MARK-->","","Article in Journal","85df77fd-7612-4b48-81a1-5f604b014861","","ad79edeb-4c47-4124-a7ea-9bcbbce0efa4"
"Cribb, T.H.","1987","Studies on gorgoderid digeneans from Australian and Asian freshwater fishes","1129-1153","","Journal of Natural History","","","","<!--MARK--><a href='nulle9f434ac-62a4-479b-b7a6-55a7028e2d36' class='mouseoverHref'>Cribb, T.H. 1987. Studies on gorgoderid digeneans from Australian and Asian freshwater fishes.</a> <!--MARK--><!--MARK--><a href='nullad79edeb-4c47-4124-a7ea-9bcbbce0efa4' class='mouseoverHref'><em>Journal of Natural History</em></a> <strong>21</strong>: 1129-1153<!--MARK-->","","Article in Journal","e9f434ac-62a4-479b-b7a6-55a7028e2d36","","ad79edeb-4c47-4124-a7ea-9bcbbce0efa4"
"Cribb, T.H.","1990","<i>Fairfaxia lethrini</i>, gen. et sp. nov. (Digenea: Opecoelidae), from <i>Lethrinus chrysostomus</i> Richardson from the southern Great Barrier Reef","37-70","","Australian Journal of Zoology","","","","<!--MARK--><a href='null71837d96-5069-4007-9d93-81b339f97b12' class='mouseoverHref'>Cribb, T.H. 1990. <i>Fairfaxia lethrini</i>, gen. et sp. nov. (Digenea: Opecoelidae), from <i>Lethrinus chrysostomus</i> Richardson from the southern Great Barrier Reef.</a> <!--MARK--><!--MARK--><a href='null53c3abd8-0254-4532-a73e-d9ef6b7ac2ef' class='mouseoverHref'><em>Australian Journal of Zoology</em></a> <strong>37</strong>(1): 37-70<!--MARK-->","","Article in Journal","71837d96-5069-4007-9d93-81b339f97b12","20111021T02:55:45.990+0000","53c3abd8-0254-4532-a73e-d9ef6b7ac2ef"
"Cribb, T.H.","2005","Family Opecoelidae Ozaki, 1925","pp. 443-531","Keys to the Trematoda. Volume 2","","","","","<!--MARK--><a href='nullbe42f5c6-3dfc-4899-aeda-e8affd832852' class='mouseoverHref'>Cribb, T.H. 2005. Family Opecoelidae Ozaki, 1925. pp. 443-531</a> <!--MARK--><em>in</em> <!--MARK--><a href='null8385bb59-924c-4d6c-865a-76b416d101ea' class='mouseoverHref'>Jones, A., Bray, R.A. & Gibson, D.I. <em>Keys to the Trematoda. Volume 2</em>. Wallingford : CAB International 745 pp.</a><!--MARK-->","","Chapter in Book","be42f5c6-3dfc-4899-aeda-e8affd832852","20120821T12:39:25.484+0000","8385bb59-924c-4d6c-865a-76b416d101ea"
"Cribb, T.H.","2005","Family Opistholebetidae Fukui, 1929","pp. 533-539","Keys to the Trematoda. Volume 2","","","","","<!--MARK--><a href='nulla7b24187-62db-49db-a8e9-7cc3916eb50b' class='mouseoverHref'>Cribb, T.H. 2005. Family Opistholebetidae Fukui, 1929. pp. 533-539</a> <!--MARK--><em>in</em> <!--MARK--><a href='null8385bb59-924c-4d6c-865a-76b416d101ea' class='mouseoverHref'>Jones, A., Bray, R.A. & Gibson, D.I. <em>Keys to the Trematoda. Volume 2</em>. Wallingford : CAB International 745 pp.</a><!--MARK-->","","Chapter in Book","a7b24187-62db-49db-a8e9-7cc3916eb50b","20120820T03:22:45.621+0000","8385bb59-924c-4d6c-865a-76b416d101ea"
"Cribb, T.H., Anderson, G.R. & Bray, R.A.","1999","Faustulid trematodes (Digenea) from marine fishes of Australia","119-138","","Systematic Parasitology","","","","<!--MARK--><a href='nullf4f8f88f-5c5d-4133-87ee-db72a8ba33ad' class='mouseoverHref'>Cribb, T.H., Anderson, G.R. & Bray, R.A. 1999. Faustulid trematodes (Digenea) from marine fishes of Australia.</a> <!--MARK--><!--MARK--><a href='nullb0bb30a0-dfa7-4cf2-bf21-216d851b8d01' class='mouseoverHref'><em>Systematic Parasitology</em></a> <strong>44</strong>: 119-138<!--MARK-->","","Article in Journal","f4f8f88f-5c5d-4133-87ee-db72a8ba33ad","20081009T05:11:37.000+0000","b0bb30a0-dfa7-4cf2-bf21-216d851b8d01"
"Cribb, T.H., Bray, R.A., Hall, K.A. & Cutmore, S.C.","2015","A review of the genus <i>Antorchis</i> Linton, 1911 (Trematoda: Faustulidae) from Indo-Pacific fishes with the description of a new species","1-11","","Systematic Parasitology","","","","<!--MARK--><a href='null1abe1d95-bd2a-4fb0-81df-f3f63cae1cfb' class='mouseoverHref'>Cribb, T.H., Bray, R.A., Hall, K.A. & Cutmore, S.C. 2015. A review of the genus <i>Antorchis</i> Linton, 1911 (Trematoda: Faustulidae) from Indo-Pacific fishes with the description of a new species.</a> <!--MARK--><!--MARK--><a href='nullb0bb30a0-dfa7-4cf2-bf21-216d851b8d01' class='mouseoverHref'><em>Systematic Parasitology</em></a> <strong>92</strong>: 1-11<!--MARK-->","","Article in Journal","1abe1d95-bd2a-4fb0-81df-f3f63cae1cfb","20160127T04:56:06.676+0000","b0bb30a0-dfa7-4cf2-bf21-216d851b8d01"
"Cribb, T.H., Bray, R.A. & Barker, S.C.","1992","Zoogonidae (Digenea) from southern Great Barrier Reef fishes with a description of <i>Steganoderma</i> (<i>Lecithostaphylus</i>) <i>gibsoni</i>  n. sp.","7-12","","Systematic Parasitology","","","","<!--MARK--><a href='null41ae3f97-37b1-410b-9e68-b6009fdb700d' class='mouseoverHref'>Cribb, T.H., Bray, R.A. & Barker, S.C. 1992. Zoogonidae (Digenea) from southern Great Barrier Reef fishes with a description of <i>Steganoderma</i> (<i>Lecithostaphylus</i>) <i>gibsoni</i>  n. sp.</a> <!--MARK--><!--MARK--><a href='nullb0bb30a0-dfa7-4cf2-bf21-216d851b8d01' class='mouseoverHref'><em>Systematic Parasitology</em></a> <strong>23</strong>: 7-12<!--MARK-->","","Article in Journal","41ae3f97-37b1-410b-9e68-b6009fdb700d","20110928T00:30:17.606+0000","b0bb30a0-dfa7-4cf2-bf21-216d851b8d01"
"Cribb, T.H., Pichelin, S.P. & Bray, R.A.","1998","<i>Pholeohedra overstreeti</i> n.g., n.sp. (Digenea : Haploporidae) from <i>Girella zebra</i> (Kyphosidae) in South Australia","95-99","","Systematic Parasitology","","","","<!--MARK--><a href='null8b11fe77-a19a-4ad0-9b11-47877d5560ca' class='mouseoverHref'>Cribb, T.H., Pichelin, S.P. & Bray, R.A. 1998. <i>Pholeohedra overstreeti</i> n.g., n.sp. (Digenea : Haploporidae) from <i>Girella zebra</i> (Kyphosidae) in South Australia.</a> <!--MARK--><!--MARK--><a href='nullb0bb30a0-dfa7-4cf2-bf21-216d851b8d01' class='mouseoverHref'><em>Systematic Parasitology</em></a> <strong>39</strong>(2): 95-99<!--MARK-->","","Article in Journal","8b11fe77-a19a-4ad0-9b11-47877d5560ca","20110802T05:08:59.998+0000","b0bb30a0-dfa7-4cf2-bf21-216d851b8d01"
"Cribb, T.H., Wright, T. & Bray, R.A.","1999","The genus <i>Deretrema</i> (Digenea: Zoogonidae) from southern Great Barrier Reef fishes with a description of <i>Deretrema woolcockae</i> n. sp.","139-144","","Systematic Parasitology","","","","<!--MARK--><a href='nulle26819b2-230a-4ac5-8c62-40c76caf96f5' class='mouseoverHref'>Cribb, T.H., Wright, T. & Bray, R.A. 1999. The genus <i>Deretrema</i> (Digenea: Zoogonidae) from southern Great Barrier Reef fishes with a description of <i>Deretrema woolcockae</i> n. sp.</a> <!--MARK--><!--MARK--><a href='nullb0bb30a0-dfa7-4cf2-bf21-216d851b8d01' class='mouseoverHref'><em>Systematic Parasitology</em></a> <strong>44</strong>: 139-144<!--MARK-->","","Article in Journal","e26819b2-230a-4ac5-8c62-40c76caf96f5","20110927T23:37:59.605+0000","b0bb30a0-dfa7-4cf2-bf21-216d851b8d01"
"Cribb, T.H. & Pearson, J.C.","1988","<i>Baiohelmins elegans</i> n. g., n. s. (Digenea: Nanophyetidae) from the Australian water rat, <i>Hydromys chrysogaster</i>","117-121","","Systematic Parasitology","","","","<!--MARK--><a href='null5f5646c9-a31c-4195-955a-07e9120f2e9a' class='mouseoverHref'>Cribb, T.H. & Pearson, J.C. 1988. <i>Baiohelmins elegans</i> n. g., n. s. (Digenea: Nanophyetidae) from the Australian water rat, <i>Hydromys chrysogaster</i>.</a> <!--MARK--><!--MARK--><a href='nullb0bb30a0-dfa7-4cf2-bf21-216d851b8d01' class='mouseoverHref'><em>Systematic Parasitology</em></a> <strong>12</strong>: 117-121<!--MARK-->","","Article in Journal","5f5646c9-a31c-4195-955a-07e9120f2e9a","20111020T21:51:38.557+0000","b0bb30a0-dfa7-4cf2-bf21-216d851b8d01"
"Cribb, T.H. & Spratt, D.M.","1990","<i>Coryphogonimus aglaos</i> n.g., n.sp. (Digenea:Prosthogonimidae) from the Australian bush rat, <i>Rattus fuscipes</i> (Rodentia:Muridae), with notes on other prosthogonimids from Australian mammals","77-83","","Systematic Parasitology","","","","<!--MARK--><a href='nullbb64417a-fad5-4481-a2a1-f9c3081938fc' class='mouseoverHref'>Cribb, T.H. & Spratt, D.M. 1990. <i>Coryphogonimus aglaos</i> n.g., n.sp. (Digenea:Prosthogonimidae) from the Australian bush rat, <i>Rattus fuscipes</i> (Rodentia:Muridae), with notes on other prosthogonimids from Australian mammals.</a> <!--MARK--><!--MARK--><a href='nullb0bb30a0-dfa7-4cf2-bf21-216d851b8d01' class='mouseoverHref'><em>Systematic Parasitology</em></a> <strong>16</strong>: 77-83<!--MARK-->","","Article in Journal","bb64417a-fad5-4481-a2a1-f9c3081938fc","20111025T00:17:14.913+0000","b0bb30a0-dfa7-4cf2-bf21-216d851b8d01"
"Cribb, T.H. & Spratt, D.M.","1992","Dicrocoeliidae (Trematoda: Digenea) of Australian mammals with description of <i>Dicrocoelium antechini</i> n.sp., <i>Athesmioides aiolos</i> n.g., n.sp. and <i>Platynosomum burrman</i> n.sp.","211-222","","Systematic Parasitology","","","","<!--MARK--><a href='null5e6a7f73-2acc-4022-bc8e-9183f79c82f1' class='mouseoverHref'>Cribb, T.H. & Spratt, D.M. 1992. Dicrocoeliidae (Trematoda: Digenea) of Australian mammals with description of <i>Dicrocoelium antechini</i> n.sp., <i>Athesmioides aiolos</i> n.g., n.sp. and <i>Platynosomum burrman</i> n.sp.</a> <!--MARK--><!--MARK--><a href='nullb0bb30a0-dfa7-4cf2-bf21-216d851b8d01' class='mouseoverHref'><em>Systematic Parasitology</em></a> <strong>21</strong>: 211-222<!--MARK-->","","Article in Journal","5e6a7f73-2acc-4022-bc8e-9183f79c82f1","20130815T02:51:58.912+0000","b0bb30a0-dfa7-4cf2-bf21-216d851b8d01"
"Crowcroft, P.W.","1945","New trematodes from Tasmanian fishes (Order Digenea. Family Allocreadiidae)","61-70, pls viii-ix","","Papers and Proceedings of the Royal Society of Tasmania","","","","<!--MARK--><a href='null1ca73d45-8426-4d5a-b3e6-50e925136c7e' class='mouseoverHref'>Crowcroft, P.W. 1945. New trematodes from Tasmanian fishes (Order Digenea. Family Allocreadiidae).</a> <!--MARK--><!--MARK--><a href='nulldb793adc-ebf2-40c5-9d92-48a121ea03ae' class='mouseoverHref'><em>Papers and Proceedings of the Royal Society of Tasmania</em></a> <strong>1944</strong>: 61-70, pls viii-ix<!--MARK-->","","Article in Journal","1ca73d45-8426-4d5a-b3e6-50e925136c7e","20110823T04:17:04.502+0000","db793adc-ebf2-40c5-9d92-48a121ea03ae"
"Crowcroft, P.W.","1947","Some digenetic trematodes from fishes of shallow Tasmanian waters","5-25","","Papers and Proceedings of the Royal Society of Tasmania","","","","<!--MARK--><a href='null354317ea-7587-4556-9bb7-fc656dd19383' class='mouseoverHref'>Crowcroft, P.W. 1947. Some digenetic trematodes from fishes of shallow Tasmanian waters.</a> <!--MARK--><!--MARK--><a href='nulldb793adc-ebf2-40c5-9d92-48a121ea03ae' class='mouseoverHref'><em>Papers and Proceedings of the Royal Society of Tasmania</em></a> <strong>81</strong>: 5-25<!--MARK-->","","Article in Journal","354317ea-7587-4556-9bb7-fc656dd19383","","db793adc-ebf2-40c5-9d92-48a121ea03ae"
"Crowcroft, P.W.","1948","The anatomy of two new digenetic trematodes from Tasmanian food fishes","108-118","","Proceedings of the Linnean Society of New South Wales","","","","<!--MARK--><a href='null369834bc-e831-4a54-961c-39c5cc27729e' class='mouseoverHref'>Crowcroft, P.W. 1948. The anatomy of two new digenetic trematodes from Tasmanian food fishes.</a> <!--MARK--><!--MARK--><a href='nullc12cd779-adb5-41ea-bd2c-75f6864cf22e' class='mouseoverHref'><em>Proceedings of the Linnean Society of New South Wales</em></a> <strong>71</strong>: 108-118<!--MARK-->","","Article in Journal","369834bc-e831-4a54-961c-39c5cc27729e","","c12cd779-adb5-41ea-bd2c-75f6864cf22e"
"Crusz, H.","1957","A new anaporrhutine trematode, <i>Staphylorchis parisi</i> sp. nov., from the shark, <i>Scoliodon walbeehmi</i>","193-195","","Ceylon Journal of Science (B)","","","","<!--MARK--><a href='null2929ad62-a503-4758-9960-f48cf8c5fe67' class='mouseoverHref'>Crusz, H. 1957. A new anaporrhutine trematode, <i>Staphylorchis parisi</i> sp. nov., from the shark, <i>Scoliodon walbeehmi</i>.</a> <!--MARK--><!--MARK--><a href='null530c9d91-62ac-47a6-a938-ecc8b41f93a4' class='mouseoverHref'><em>Ceylon Journal of Science (B)</em></a> <strong>25</strong>: 193-195<!--MARK-->","","Article in Journal","2929ad62-a503-4758-9960-f48cf8c5fe67","20121007T04:26:52.023+0000","530c9d91-62ac-47a6-a938-ecc8b41f93a4"
"Cutmore, S.C., Bennett, M.B. & Cribb, T.H.","2010","<i>Staphylorchis cymatodes</i> (Gorgoderidae Anaporrhutinae) from carcharhiniform, orectolobiform and myliobatiform elasmobranchs of Australasia: Low host specificity, wide distribution and morphological plasticity.","579-586","","Parasitology International","","","","<!--MARK--><a href='null0d99e26c-514c-4776-8a30-39bc17c9e98c' class='mouseoverHref'>Cutmore, S.C., Bennett, M.B. & Cribb, T.H. 2010. <i>Staphylorchis cymatodes</i> (Gorgoderidae Anaporrhutinae) from carcharhiniform, orectolobiform and myliobatiform elasmobranchs of Australasia: Low host specificity, wide distribution and morphological plasticity.</a> <!--MARK--><!--MARK--><a href='null6017549d-53bd-4a0f-b2ec-052a1d19d02c' class='mouseoverHref'><em>Parasitology International</em></a> <strong>59</strong>: 579-586<!--MARK-->","","Article in Journal","0d99e26c-514c-4776-8a30-39bc17c9e98c","20130724T00:34:15.052+0000","6017549d-53bd-4a0f-b2ec-052a1d19d02c"
"Cutmore, S.C., Bray, R.A. & Cribb, T.H.","2013","<EM>Peracreadium akenovae</EM> sp. nov. (Trematoda: Opecoelidae) parasitising the highfin moray eel <em>Gymnothorax pseudothyrsoideus</em> (Anguilliformes: Muraenidae) from Moreton Bay, Australia","324-327","","Acta Parasitologica","","","","<!--MARK--><a href='nulld37c542b-a2ec-4c77-a416-8600dc9eac89' class='mouseoverHref'>Cutmore, S.C., Bray, R.A. & Cribb, T.H. 2013. <EM>Peracreadium akenovae</EM> sp. nov. (Trematoda: Opecoelidae) parasitising the highfin moray eel <em>Gymnothorax pseudothyrsoideus</em> (Anguilliformes: Muraenidae) from Moreton Bay, Australia.</a> <!--MARK--><!--MARK--><a href='nullecf36501-b69a-4b49-b012-73f88f771f24' class='mouseoverHref'><em>Acta Parasitologica</em></a> <strong>58</strong>: 324-327<!--MARK-->","","Article in Journal","d37c542b-a2ec-4c77-a416-8600dc9eac89","20180316T07:34:36.096+0000","ecf36501-b69a-4b49-b012-73f88f771f24"
"Cutmore, S.C., Bray, R.A. & Cribb, T.H.","2018","Two new species of <i>Bacciger</i> Nicoll, 1914 (Trematoda: Faustulidae) in species of <i>Herklotsichthys</i> Whitley (Clupeidae) from Queensland waters.","645-654","","Systematic Parasitology","","","","<!--MARK--><a href='null3be55528-2e34-44c6-b4ed-425a72a07c82' class='mouseoverHref'>Cutmore, S.C., Bray, R.A. & Cribb, T.H. 2018. Two new species of <i>Bacciger</i> Nicoll, 1914 (Trematoda: Faustulidae) in species of <i>Herklotsichthys</i> Whitley (Clupeidae) from Queensland waters.</a> <!--MARK--><!--MARK--><a href='nullb0bb30a0-dfa7-4cf2-bf21-216d851b8d01' class='mouseoverHref'><em>Systematic Parasitology</em></a> <strong>95</strong>: 645-654<!--MARK-->","","Article in Journal","3be55528-2e34-44c6-b4ed-425a72a07c82","20190520T07:08:07.482+0000","b0bb30a0-dfa7-4cf2-bf21-216d851b8d01"
"Cutmore, S.C., Miller, T.L., Bray, R.A. & Cribb, T.H.","2014","A new species of <i>Plectognathotrema</i> Layman, 1930 (Trematoda: Zoogonidae) from an Australian monacanthid, with a molecular assessment of the phylogenetic position of the genus.","237-246","","Systematic Parasitology","","","","<!--MARK--><a href='nullfedac17e-efdf-4e23-af3e-40dcb7d05453' class='mouseoverHref'>Cutmore, S.C., Miller, T.L., Bray, R.A. & Cribb, T.H. 2014. A new species of <i>Plectognathotrema</i> Layman, 1930 (Trematoda: Zoogonidae) from an Australian monacanthid, with a molecular assessment of the phylogenetic position of the genus.</a> <!--MARK--><!--MARK--><a href='nullb0bb30a0-dfa7-4cf2-bf21-216d851b8d01' class='mouseoverHref'><em>Systematic Parasitology</em></a> <strong>89</strong>: 237-246<!--MARK-->","","Article in Journal","fedac17e-efdf-4e23-af3e-40dcb7d05453","20160111T00:01:44.118+0000","b0bb30a0-dfa7-4cf2-bf21-216d851b8d01"
"Cutmore, S.C., Miller, T.L., Curran, S.S., Bennett, M.B. & Cribb, T.H.","2013","Phylogenetic relationships of the Gorgoderidae (Platyhelminthes: Trematoda), including the proposal of a new subfamily (Degeneriinae n. subfam.).","3063-3074","","Parasitology Research","","","","<!--MARK--><a href='nullf38174e1-1a8b-467b-ba14-9349a30a4b09' class='mouseoverHref'>Cutmore, S.C., Miller, T.L., Curran, S.S., Bennett, M.B. & Cribb, T.H. 2013. Phylogenetic relationships of the Gorgoderidae (Platyhelminthes: Trematoda), including the proposal of a new subfamily (Degeneriinae n. subfam.).</a> <!--MARK--><!--MARK--><a href='null75d4c5fd-1316-4a73-9d0f-321d86aff2a5' class='mouseoverHref'><em>Parasitology Research</em></a> <strong>112</strong>: 3063-3074<!--MARK-->","","Article in Journal","f38174e1-1a8b-467b-ba14-9349a30a4b09","20180313T09:41:00.304+0000","75d4c5fd-1316-4a73-9d0f-321d86aff2a5"
"Cutmore, S.C. & Cribb, T.H.","2018","Two species of <em>Phyllodistomum</em> Braun, 1899 (Trematoda: Gorgoderidae) from Moreton Bay, Australia.","","","Systematic Parasitology","","07/02/2018","","<!--MARK--><a href='null91c4f449-bd9d-40b4-86b5-9340aae3e6b0' class='mouseoverHref'>Cutmore, S.C. & Cribb, T.H. 2018. Two species of <em>Phyllodistomum</em> Braun, 1899 (Trematoda: Gorgoderidae) from Moreton Bay, Australia.</a> <!--MARK--><!--MARK--><a href='nullb0bb30a0-dfa7-4cf2-bf21-216d851b8d01' class='mouseoverHref'><em>Systematic Parasitology</em></a> <strong>In press</strong><!--MARK--> [Date published 07/02/2018]","","Article in Journal","91c4f449-bd9d-40b4-86b5-9340aae3e6b0","20180313T09:34:50.622+0000","b0bb30a0-dfa7-4cf2-bf21-216d851b8d01"
