"PUB_AUTHOR","PUB_YEAR","PUB_TITLE","PUB_PAGES","PUB_PARENT_BOOK_TITLE","PUB_PARENT_JOURNAL_TITLE","PUB_PARENT_ARTICLE_TITLE","PUB_PUBLICATION_DATE","PUB_PUBLISHER","PUB_FORMATTED","PUB_QUALIFICATION","PUB_TYPE","PUBLICATION_GUID","PUBLICATION_LAST_UPDATE","PARENT_PUBLICATION_GUID"
"Ahmad, J.","1985","Studies on digenetic trematodes of marine fishes from the Arabian sea, off the Panjim coast, Goa, India.  Part 49.  On three new haploporid trematodes (Digenea:  Haploporidae)","281-291","","Revista Ibérica de Parasitología","","","","<!--MARK--><a href='nulld354be1a-d488-478a-8d58-779e1cbbea15' class='mouseoverHref'>Ahmad, J. 1985. Studies on digenetic trematodes of marine fishes from the Arabian sea, off the Panjim coast, Goa, India.  Part 49.  On three new haploporid trematodes (Digenea:  Haploporidae).</a> <!--MARK--><!--MARK--><a href='nullfa6208b5-52c7-4d84-9f3f-13754cb0926e' class='mouseoverHref'><em>Revista Ibérica de Parasitología</em></a> <strong>45</strong>: 281-291<!--MARK-->","","Article in Journal","d354be1a-d488-478a-8d58-779e1cbbea15","20121031T04:23:12.893+0000","fa6208b5-52c7-4d84-9f3f-13754cb0926e"
"Ahmad, J.","1987","On seven new digenetic trematodes of marine fishes from the Arabian Sea, off the Panjim coast, Goa","321-340","","Pakistan Journal of Zoology","","","","<!--MARK--><a href='nulla51219c2-527f-4d30-a84a-03487dd2866a' class='mouseoverHref'>Ahmad, J. 1987. On seven new digenetic trematodes of marine fishes from the Arabian Sea, off the Panjim coast, Goa.</a> <!--MARK--><!--MARK--><a href='null081074dd-60e4-4c95-a008-e3087b39d30c' class='mouseoverHref'><em>Pakistan Journal of Zoology</em></a> <strong>19</strong>: 321-340<!--MARK-->","","Article in Journal","a51219c2-527f-4d30-a84a-03487dd2866a","20120828T01:32:21.811+0000","081074dd-60e4-4c95-a008-e3087b39d30c"
"Aken'Ova, T.O.","2003","<i>Allopodocotyle skoliorchis</i> n. sp. (Opecoelidae: Plagioporinae) from <i>Parequula melbournensis</i> (Castelnau) (Gerreidae), a temperate marine fish in Australian waters","153-158","","Systematic Parasitology","","","","<!--MARK--><a href='null88742f6d-ce45-4413-bcc2-ac7b656ae645' class='mouseoverHref'>Aken'Ova, T.O. 2003. <i>Allopodocotyle skoliorchis</i> n. sp. (Opecoelidae: Plagioporinae) from <i>Parequula melbournensis</i> (Castelnau) (Gerreidae), a temperate marine fish in Australian waters.</a> <!--MARK--><!--MARK--><a href='nullb0bb30a0-dfa7-4cf2-bf21-216d851b8d01' class='mouseoverHref'><em>Systematic Parasitology</em></a> <strong>54</strong>: 153-158<!--MARK-->","","Article in Journal","88742f6d-ce45-4413-bcc2-ac7b656ae645","20130723T23:53:03.428+0000","b0bb30a0-dfa7-4cf2-bf21-216d851b8d01"
"Aken'Ova, T.O.","2003","<i>Bartoliella pritchardae</i> n.g., n.sp (Digenea: Opecoelidae) in <i>Epinephelides armatus</i> (Serranidae) from temperate marine waters of Western Australia","67-72","","Systematic Parasitology","","","","<!--MARK--><a href='null862a2b35-1a25-4d8f-8c1f-178b9f3728a8' class='mouseoverHref'>Aken'Ova, T.O. 2003. <i>Bartoliella pritchardae</i> n.g., n.sp (Digenea: Opecoelidae) in <i>Epinephelides armatus</i> (Serranidae) from temperate marine waters of Western Australia.</a> <!--MARK--><!--MARK--><a href='nullb0bb30a0-dfa7-4cf2-bf21-216d851b8d01' class='mouseoverHref'><em>Systematic Parasitology</em></a> <strong>55</strong>: 67-72<!--MARK-->","","Article in Journal","862a2b35-1a25-4d8f-8c1f-178b9f3728a8","20130723T23:52:56.221+0000","b0bb30a0-dfa7-4cf2-bf21-216d851b8d01"
"Aken'Ova, T.O.","2003","<i>Dactylomyza gibsoni</i> n.g., n.sp. (Digenea: Opecoelidae) from <i>Schuettea woodwardi</i> (Waite) (Monodactylidae) from off Western Australia","61-65","","Systematic Parasitology","","","","<!--MARK--><a href='null43c3efab-a489-443a-a086-c7987373a37c' class='mouseoverHref'>Aken'Ova, T.O. 2003. <i>Dactylomyza gibsoni</i> n.g., n.sp. (Digenea: Opecoelidae) from <i>Schuettea woodwardi</i> (Waite) (Monodactylidae) from off Western Australia.</a> <!--MARK--><!--MARK--><a href='nullb0bb30a0-dfa7-4cf2-bf21-216d851b8d01' class='mouseoverHref'><em>Systematic Parasitology</em></a> <strong>55</strong>: 61-65<!--MARK-->","","Article in Journal","43c3efab-a489-443a-a086-c7987373a37c","20130723T23:52:44.153+0000","b0bb30a0-dfa7-4cf2-bf21-216d851b8d01"
"Aken'Ova, T.O.","2003","A new species of <i>Podocotyloides</i> Yamaguti, 1934 (Digenea: Opecoelidae) from a Western Australian temperate marine fish","127-133","","Systematic Parasitology","","","","<!--MARK--><a href='nullf2ff5df0-81f2-4a7e-a3f9-ceb684d1d480' class='mouseoverHref'>Aken'Ova, T.O. 2003. A new species of <i>Podocotyloides</i> Yamaguti, 1934 (Digenea: Opecoelidae) from a Western Australian temperate marine fish.</a> <!--MARK--><!--MARK--><a href='nullb0bb30a0-dfa7-4cf2-bf21-216d851b8d01' class='mouseoverHref'><em>Systematic Parasitology</em></a> <strong>55</strong>: 127-133<!--MARK-->","","Article in Journal","f2ff5df0-81f2-4a7e-a3f9-ceb684d1d480","20130723T23:52:25.297+0000","b0bb30a0-dfa7-4cf2-bf21-216d851b8d01"
"Aken'Ova, T.O.","2003","Three species of <i>Pycnadenoides</i> Yamaguti, 1938 (Digenea : Opecoelidae), including two new species from temperate marine fishes of Australia","221-232","","Systematic Parasitology","","","","<!--MARK--><a href='null19cb8093-6ed8-495d-a930-cb45a6af5495' class='mouseoverHref'>Aken'Ova, T.O. 2003. Three species of <i>Pycnadenoides</i> Yamaguti, 1938 (Digenea : Opecoelidae), including two new species from temperate marine fishes of Australia.</a> <!--MARK--><!--MARK--><a href='nullb0bb30a0-dfa7-4cf2-bf21-216d851b8d01' class='mouseoverHref'><em>Systematic Parasitology</em></a> <strong>53</strong>: 221-232<!--MARK-->","","Article in Journal","19cb8093-6ed8-495d-a930-cb45a6af5495","20130723T23:52:35.262+0000","b0bb30a0-dfa7-4cf2-bf21-216d851b8d01"
"Aken'Ova, T.O.","2007","The taxonomic status of <i>Opegaster</i> Ozaki, 1928 and the description of four new species of <i>Opecoelus</i> Ozaki, 1925 (Digenea: Opecoelidae) from marine teleosts in Australian waters","25-42","","Systematic Parasitology","","","","<!--MARK--><a href='null687aaa6b-53d6-49de-be6e-94c7d7e740fd' class='mouseoverHref'>Aken'Ova, T.O. 2007. The taxonomic status of <i>Opegaster</i> Ozaki, 1928 and the description of four new species of <i>Opecoelus</i> Ozaki, 1925 (Digenea: Opecoelidae) from marine teleosts in Australian waters.</a> <!--MARK--><!--MARK--><a href='nullb0bb30a0-dfa7-4cf2-bf21-216d851b8d01' class='mouseoverHref'><em>Systematic Parasitology</em></a> <strong>67</strong>: 25-42<!--MARK-->","","Article in Journal","687aaa6b-53d6-49de-be6e-94c7d7e740fd","20130723T04:40:25.276+0000","b0bb30a0-dfa7-4cf2-bf21-216d851b8d01"
"Aken'Ova, T.O., Cribb, T.H. & Bray, R.A.","2003","A new species of <i>Dactylostomum</i> Woolcock, 1935 (Digenea: Opecoelidae) from the goatfish <i>Upeneichthys lineatus</i> (Bloch & Schneider) (Mullidae) in Western Australian waters","63-68","","Systematic Parasitology","","","","<!--MARK--><a href='nullba35a420-8d54-40a6-b57d-8a8861fd16d3' class='mouseoverHref'>Aken'Ova, T.O., Cribb, T.H. & Bray, R.A. 2003. A new species of <i>Dactylostomum</i> Woolcock, 1935 (Digenea: Opecoelidae) from the goatfish <i>Upeneichthys lineatus</i> (Bloch & Schneider) (Mullidae) in Western Australian waters.</a> <!--MARK--><!--MARK--><a href='nullb0bb30a0-dfa7-4cf2-bf21-216d851b8d01' class='mouseoverHref'><em>Systematic Parasitology</em></a> <strong>56</strong>: 63-68<!--MARK-->","","Article in Journal","ba35a420-8d54-40a6-b57d-8a8861fd16d3","20120423T00:43:25.234+0000","b0bb30a0-dfa7-4cf2-bf21-216d851b8d01"
"Aken'Ova, T.O., Cribb, T.H. & Bray, R.A.","2006","<i>Helicometra</i> Odhner, 1902 (Digenea: Opecoelidae) in Australian waters: problems of species identification and a description of <i>H. sprenti</i> n. sp","17-27","","Systematic Parasitology","","","","<!--MARK--><a href='nullff27d84e-64d9-4764-a1b4-512dc6402f7b' class='mouseoverHref'>Aken'Ova, T.O., Cribb, T.H. & Bray, R.A. 2006. <i>Helicometra</i> Odhner, 1902 (Digenea: Opecoelidae) in Australian waters: problems of species identification and a description of <i>H. sprenti</i> n. sp.</a> <!--MARK--><!--MARK--><a href='nullb0bb30a0-dfa7-4cf2-bf21-216d851b8d01' class='mouseoverHref'><em>Systematic Parasitology</em></a> <strong>67</strong>: 17-27<!--MARK-->","","Article in Journal","ff27d84e-64d9-4764-a1b4-512dc6402f7b","20120423T00:43:00.802+0000","b0bb30a0-dfa7-4cf2-bf21-216d851b8d01"
"Aken'Ova, T.O., Cribb, T.H. & Bray, R.A.","2008","Eight new species of <i>Macvicaria</i> Gibson and Bray, 1982 (Digenea: Opecoelidae) mainly from endemic temperate marine fishes of Australia","23-58","","ZooKeys","","","","<!--MARK--><a href='nullf761a588-bd3d-4f3b-a4a2-55325e966aa1' class='mouseoverHref'>Aken'Ova, T.O., Cribb, T.H. & Bray, R.A. 2008. Eight new species of <i>Macvicaria</i> Gibson and Bray, 1982 (Digenea: Opecoelidae) mainly from endemic temperate marine fishes of Australia.</a> <!--MARK--><!--MARK--><a href='null8cb7bef9-51f4-441c-a060-649dc8095e71' class='mouseoverHref'><em>ZooKeys</em></a> <strong>1</strong>: 23-58<!--MARK-->","","Article in Journal","f761a588-bd3d-4f3b-a4a2-55325e966aa1","20120423T00:43:58.182+0000","8cb7bef9-51f4-441c-a060-649dc8095e71"
"Aken'Ova, T.O. & Cribb, T.H.","1996","Two species of <i>Coitocaecum</i> Nicoll, 1915 (Digenea: Opecoelidae) from Moreton Bay, Queensland, Australia","217-224","","Systematic Parasitology","","","","<!--MARK--><a href='nullc11d3732-ebf7-42e3-b628-d9d764ba911f' class='mouseoverHref'>Aken'Ova, T.O. & Cribb, T.H. 1996. Two species of <i>Coitocaecum</i> Nicoll, 1915 (Digenea: Opecoelidae) from Moreton Bay, Queensland, Australia.</a> <!--MARK--><!--MARK--><a href='nullb0bb30a0-dfa7-4cf2-bf21-216d851b8d01' class='mouseoverHref'><em>Systematic Parasitology</em></a> <strong>33</strong>(3): 217-224<!--MARK-->","","Article in Journal","c11d3732-ebf7-42e3-b628-d9d764ba911f","20111020T23:05:08.076+0000","b0bb30a0-dfa7-4cf2-bf21-216d851b8d01"
"Aken'Ova, T.O. & Cribb, T.H.","2000","<i>Diplobulbus brayi</i> n. sp. (Digenea: Opecoelidae) from <i>Odax acroptilus</i> (Perciformes: Odacidae) off Western Australia","99-103","","Systematic Parasitology","","","","<!--MARK--><a href='null25c68b62-edfa-44bc-96f5-c333560df407' class='mouseoverHref'>Aken'Ova, T.O. & Cribb, T.H. 2000. <i>Diplobulbus brayi</i> n. sp. (Digenea: Opecoelidae) from <i>Odax acroptilus</i> (Perciformes: Odacidae) off Western Australia.</a> <!--MARK--><!--MARK--><a href='nullb0bb30a0-dfa7-4cf2-bf21-216d851b8d01' class='mouseoverHref'><em>Systematic Parasitology</em></a> <strong>46</strong>(2): 99-103<!--MARK-->","","Article in Journal","25c68b62-edfa-44bc-96f5-c333560df407","20111021T02:44:21.005+0000","b0bb30a0-dfa7-4cf2-bf21-216d851b8d01"
"Aken'Ova, T.O. & Cribb, T.H.","2001","Two new species of <i>Neolebouria</i> Gibson, 1976 (Digenea:  Opecoelidae) from temperate marine fishes of Australia","65-71","","Systematic Parasitology","","","","<!--MARK--><a href='null425ab42d-0471-484c-bef6-9ce75302a1a7' class='mouseoverHref'>Aken'Ova, T.O. & Cribb, T.H. 2001. Two new species of <i>Neolebouria</i> Gibson, 1976 (Digenea:  Opecoelidae) from temperate marine fishes of Australia.</a> <!--MARK--><!--MARK--><a href='nullb0bb30a0-dfa7-4cf2-bf21-216d851b8d01' class='mouseoverHref'><em>Systematic Parasitology</em></a> <strong>49</strong>: 65-71<!--MARK-->","","Article in Journal","425ab42d-0471-484c-bef6-9ce75302a1a7","20120423T00:41:45.917+0000","b0bb30a0-dfa7-4cf2-bf21-216d851b8d01"
"Aken'Ova, T.O. & Cribb, T.H.","2003","<i>Scorpidotrema longistipes</i> n. g., n. sp. (Digenea:  Opecoelidae) from <i>Scorpis georgiana</i> (Teleostei:  Scorpididae) from southern Western Australia","97-102","","Systematic Parasitology","","","","<!--MARK--><a href='nulle8335fce-2956-448a-b03d-afca784eca7b' class='mouseoverHref'>Aken'Ova, T.O. & Cribb, T.H. 2003. <i>Scorpidotrema longistipes</i> n. g., n. sp. (Digenea:  Opecoelidae) from <i>Scorpis georgiana</i> (Teleostei:  Scorpididae) from southern Western Australia.</a> <!--MARK--><!--MARK--><a href='nullb0bb30a0-dfa7-4cf2-bf21-216d851b8d01' class='mouseoverHref'><em>Systematic Parasitology</em></a> <strong>54</strong>: 97-102<!--MARK-->","","Article in Journal","e8335fce-2956-448a-b03d-afca784eca7b","20120423T00:43:38.240+0000","b0bb30a0-dfa7-4cf2-bf21-216d851b8d01"
"Al-Yamani, F.Y. & Nahhas, F.M.","1981","Digenetic trematodes of marine fishes from the Kuwaiti Coast of the Arabian Gulf","1-22","","Kuwait Bulletin of Marine Science","","","","<!--MARK--><a href='null5978c524-6dfc-4760-b0cf-5e312951a90c' class='mouseoverHref'>Al-Yamani, F.Y. & Nahhas, F.M. 1981. Digenetic trematodes of marine fishes from the Kuwaiti Coast of the Arabian Gulf.</a> <!--MARK--><!--MARK--><a href='null11644295-599f-4142-a919-9ea59d11129b' class='mouseoverHref'><em>Kuwait Bulletin of Marine Science</em></a> <strong>3</strong>: 1-22<!--MARK-->","","Article in Journal","5978c524-6dfc-4760-b0cf-5e312951a90c","20120830T02:57:04.571+0000","11644295-599f-4142-a919-9ea59d11129b"
"Andres, M.J., Pulis, E.E. & Overstreet, R.M.","2016","Description of three species of Isorchis (Digenea: Atractotrematidae) from Australia","590-601","","Acta Parasitologica","","","","<!--MARK--><a href='nullbfc6119c-11fc-42aa-bbde-62c309c3e700' class='mouseoverHref'>Andres, M.J., Pulis, E.E. & Overstreet, R.M. 2016. Description of three species of Isorchis (Digenea: Atractotrematidae) from Australia.</a> <!--MARK--><!--MARK--><a href='nullecf36501-b69a-4b49-b012-73f88f771f24' class='mouseoverHref'><em>Acta Parasitologica</em></a> <strong>61</strong>(3): 590-601<!--MARK-->","","Article in Journal","bfc6119c-11fc-42aa-bbde-62c309c3e700","20161121T00:44:58.505+0000","ecf36501-b69a-4b49-b012-73f88f771f24"
"Angel, L.M.","1959","An account of <em>Plagiorchis maculosus</em> (Rud.) its synonymy and its life history in South Australia","265-281","","Transactions of the Royal Society of South Australia","","","","<!--MARK--><a href='null23619a32-db98-4ceb-95e7-c5bb4e41ec3f' class='mouseoverHref'>Angel, L.M. 1959. An account of <em>Plagiorchis maculosus</em> (Rud.) its synonymy and its life history in South Australia.</a> <!--MARK--><!--MARK--><a href='null8b48b0a3-dd7a-4aea-be0d-10a223710ebc' class='mouseoverHref'><em>Transactions of the Royal Society of South Australia</em></a> <strong>82</strong>: 265-281<!--MARK-->","","Article in Journal","23619a32-db98-4ceb-95e7-c5bb4e41ec3f","20181115T03:22:07.718+0000","8b48b0a3-dd7a-4aea-be0d-10a223710ebc"
"Angel, L.M.","1970","<i>Coelomotrema antichinomes</i>, gen. et sp. nov., a prosthogonimid trematode from <i>Antichinomys</i> and <i>Antechinus</i> (Marsupiala: Dasyuridae) from Australia","119-124, 7 figs, 1 tab.","","Australian Journal of Zoology","","","","<!--MARK--><a href='nullf6f8710b-0912-47d5-b725-4e0b82b68443' class='mouseoverHref'>Angel, L.M. 1970. <i>Coelomotrema antichinomes</i>, gen. et sp. nov., a prosthogonimid trematode from <i>Antichinomys</i> and <i>Antechinus</i> (Marsupiala: Dasyuridae) from Australia.</a> <!--MARK--><!--MARK--><a href='null53c3abd8-0254-4532-a73e-d9ef6b7ac2ef' class='mouseoverHref'><em>Australian Journal of Zoology</em></a> <strong>18</strong>: 119-124, 7 figs, 1 tab.<!--MARK-->","","Article in Journal","f6f8710b-0912-47d5-b725-4e0b82b68443","20111025T00:13:34.839+0000","53c3abd8-0254-4532-a73e-d9ef6b7ac2ef"
"Angel, L.M.","1973","The family Prosthogonimidae (Trematoda) in Australia","853-862","","International Journal for Parasitology","","","","<!--MARK--><a href='nulle2d5488d-7034-49ba-8086-fe31a36e84b1' class='mouseoverHref'>Angel, L.M. 1973. The family Prosthogonimidae (Trematoda) in Australia.</a> <!--MARK--><!--MARK--><a href='nullee565201-8306-4966-89b6-878f1edfe304' class='mouseoverHref'><em>International Journal for Parasitology</em></a> <strong>3</strong>(6): 853-862<!--MARK-->","","Article in Journal","e2d5488d-7034-49ba-8086-fe31a36e84b1","20111025T20:33:16.708+0000","ee565201-8306-4966-89b6-878f1edfe304"
"Angel, L.M. & Pearson, J.C.","1977","Dicrocoeliid trematodes from Australian hosts","115-132, illust.","","Transactions of the Royal Society of South Australia","","","","<!--MARK--><a href='null0c2a64d8-821a-4f53-b509-cc87dbbdeb0b' class='mouseoverHref'>Angel, L.M. & Pearson, J.C. 1977. Dicrocoeliid trematodes from Australian hosts.</a> <!--MARK--><!--MARK--><a href='null8b48b0a3-dd7a-4aea-be0d-10a223710ebc' class='mouseoverHref'><em>Transactions of the Royal Society of South Australia</em></a> <strong>101</strong>(5): 115-132, illust.<!--MARK-->","","Article in Journal","0c2a64d8-821a-4f53-b509-cc87dbbdeb0b","20111011T04:13:31.997+0000","8b48b0a3-dd7a-4aea-be0d-10a223710ebc"
"Baeva, O.M.","1968","Helminth fauna of <i>Pleurogrammus azonus</i> Jordan & Metz in the Sea of Japan","pp. 80-88","[Helminths of Animals from the Pacific Ocean]","","","","","<!--MARK--><a href='nulld480e6b0-b291-4117-9d22-14548cff63bd' class='mouseoverHref'>Baeva, O.M. 1968. Helminth fauna of <i>Pleurogrammus azonus</i> Jordan & Metz in the Sea of Japan. pp. 80-88</a> <!--MARK--><em>in</em> <!--MARK--><a href='nulle0ac1a9c-f8c5-4da5-8cb7-8e4aeff9fdd6' class='mouseoverHref'>Skryabin, K.I. & Manaev, Yu.L. (eds). <em>[Helminths of Animals from the Pacific Ocean]</em>. Moscow : Nauka.</a><!--MARK-->","","Chapter in Book","d480e6b0-b291-4117-9d22-14548cff63bd","20120823T05:14:55.705+0000","e0ac1a9c-f8c5-4da5-8cb7-8e4aeff9fdd6"
"Barker, S.C., Cribb, T.H., Bray, R.A. & Adlard, R.D.","1994","Host-parasite associations on a coral reef: pomacentrid fishes and digenean trematodes","643-647","","International Journal for Parasitology","","","","<!--MARK--><a href='nullfa5d3feb-d0c9-4ea7-b7b8-91c1a24ac395' class='mouseoverHref'>Barker, S.C., Cribb, T.H., Bray, R.A. & Adlard, R.D. 1994. Host-parasite associations on a coral reef: pomacentrid fishes and digenean trematodes.</a> <!--MARK--><!--MARK--><a href='nullee565201-8306-4966-89b6-878f1edfe304' class='mouseoverHref'><em>International Journal for Parasitology</em></a> <strong>24</strong>: 643-647<!--MARK-->","","Article in Journal","fa5d3feb-d0c9-4ea7-b7b8-91c1a24ac395","20081009T05:11:37.000+0000","ee565201-8306-4966-89b6-878f1edfe304"
"Bartoli, P., Bray, R.A. & Montero, F.E.","2004","<i>Tormopsolus orientalis</i> Yamaguti, 1934 (Digenea: Acanthocolpidae) from <i>Seriola dumerili</i> (Risso) (Perciformes: Carangidae) in the western Mediterranean Sea","201-209","","Systematic Parasitology","","","","<!--MARK--><a href='nulle7d26ed9-0f67-424a-9128-4c85c7d4a1c2' class='mouseoverHref'>Bartoli, P., Bray, R.A. & Montero, F.E. 2004. <i>Tormopsolus orientalis</i> Yamaguti, 1934 (Digenea: Acanthocolpidae) from <i>Seriola dumerili</i> (Risso) (Perciformes: Carangidae) in the western Mediterranean Sea.</a> <!--MARK--><!--MARK--><a href='nullb0bb30a0-dfa7-4cf2-bf21-216d851b8d01' class='mouseoverHref'><em>Systematic Parasitology</em></a> <strong>57</strong>: 201-209<!--MARK-->","","Article in Journal","e7d26ed9-0f67-424a-9128-4c85c7d4a1c2","20120521T06:42:14.712+0000","b0bb30a0-dfa7-4cf2-bf21-216d851b8d01"
"Barton, D.P.","1994","Three species of the genus <i>Dolichosaccus</i> Johnston, 1912 (Digenea: Telorchiidae) from the introduced toad <i>Bufo marinus</i> (Amphibia: Bufonidae) in Australia, with the erection of <i>Meditypus</i> n. subg.","121-131","","Systematic Parasitology","","","","<!--MARK--><a href='nulla0fc1de2-b020-4a5a-8c5b-6d59988f5ba7' class='mouseoverHref'>Barton, D.P. 1994. Three species of the genus <i>Dolichosaccus</i> Johnston, 1912 (Digenea: Telorchiidae) from the introduced toad <i>Bufo marinus</i> (Amphibia: Bufonidae) in Australia, with the erection of <i>Meditypus</i> n. subg.</a> <!--MARK--><!--MARK--><a href='nullb0bb30a0-dfa7-4cf2-bf21-216d851b8d01' class='mouseoverHref'><em>Systematic Parasitology</em></a> <strong>29</strong>: 121-131<!--MARK-->","","Article in Journal","a0fc1de2-b020-4a5a-8c5b-6d59988f5ba7","20111025T03:17:59.120+0000","b0bb30a0-dfa7-4cf2-bf21-216d851b8d01"
"Belopolskaya, M.M.","1952","[unknown]","","Trematodes of Animals and Man: Principles of Trematodology","","","","","<!--MARK--><a href='null143005c0-a692-480a-a300-964bfaf8def8' class='mouseoverHref'>Belopolskaya, M.M. 1952. [unknown].</a> <!--MARK--><em>In,</em> <!--MARK--><a href='null1c535b94-26a0-43df-87d2-28521ecca4d3' class='mouseoverHref'>Skryabin, K.I. <em>Trematodes of Animals and Man: Principles of Trematodology</em>. Moscow Vol. 6.</a><!--MARK-->","","Chapter in Book","143005c0-a692-480a-a300-964bfaf8def8","20111012T04:32:39.935+0000","1c535b94-26a0-43df-87d2-28521ecca4d3"
"Belopolskaya, M.M. & Bychovskaya-Pavlovskaya, I.E.","1954","[<i>Proacetabulorchis dogieli</i> spec. nov. belonging to the family Dicrocoeliidae, new parasite of bird liver]","160-162 fig.","","Travaux de l'Institut Zoologique de l'Académy des Sciences de l'U.R.S.S","","","","<!--MARK--><a href='null25afc226-fd12-438f-82d0-1a5f28e14353' class='mouseoverHref'>Belopolskaya, M.M. & Bychovskaya-Pavlovskaya, I.E. 1954. [<i>Proacetabulorchis dogieli</i> spec. nov. belonging to the family Dicrocoeliidae, new parasite of bird liver].</a> <!--MARK--><!--MARK--><a href='null680388d3-7b23-4765-a4f3-a1ef1c6733ef' class='mouseoverHref'><em>Travaux de l'Institut Zoologique de l'Académy des Sciences de l'U.R.S.S</em></a> <strong>13</strong>: 160-162 fig.<!--MARK-->","","Article in Journal","25afc226-fd12-438f-82d0-1a5f28e14353","20111011T23:08:08.639+0000","680388d3-7b23-4765-a4f3-a1ef1c6733ef"
"Belous, E.V.","1954","[Contribution to the systematics of trematode Family Haploporidae Nicoll, 1914]. (In Russian)","277-279","","Trudy Gel'mintologicheskoi Laboratorii Akademiya Nauk","","","","<!--MARK--><a href='nulla7ac44c9-5470-40a4-b401-e7ab68741563' class='mouseoverHref'>Belous, E.V. 1954. [Contribution to the systematics of trematode Family Haploporidae Nicoll, 1914]. (In Russian).</a> <!--MARK--><!--MARK--><a href='null4f0b4f8a-9efa-4868-88a9-fa019a26859f' class='mouseoverHref'><em>Trudy Gel'mintologicheskoi Laboratorii Akademiya Nauk</em></a> <strong>7</strong>: 277-279<!--MARK-->","","Article in Journal","a7ac44c9-5470-40a4-b401-e7ab68741563","20120828T00:58:22.619+0000","4f0b4f8a-9efa-4868-88a9-fa019a26859f"
"Bilqees, F.M.","1972","Marine fish trematodes of West Pakistan.  VIII.  Description of thirteen new species including a new genus <i>Pseudocoitocaecum</i> from fishes of Karachi coast","pp. 1-40","Helminth parasites of some vertebrates chiefly from fishes of West Pakistan","","","","","<!--MARK--><a href='null1449cbc2-2352-4644-9b5a-d49f16fe0763' class='mouseoverHref'>Bilqees, F.M. 1972. Marine fish trematodes of West Pakistan.  VIII.  Description of thirteen new species including a new genus <i>Pseudocoitocaecum</i> from fishes of Karachi coast. pp. 1-40</a> <!--MARK--><em>in</em> <!--MARK--><a href='null717a1d59-0059-44c3-abc6-c63b1b5d32a7' class='mouseoverHref'>Agricultural Research Council. <em>Helminth parasites of some vertebrates chiefly from fishes of West Pakistan</em>. Karachi : Government of Pakistan 1-110pp.</a><!--MARK--> [Date published 1977]","","Chapter in Book","1449cbc2-2352-4644-9b5a-d49f16fe0763","20120823T02:14:51.618+0000","717a1d59-0059-44c3-abc6-c63b1b5d32a7"
"Bilqees, F.M.","1976","<i>Olivacreadium</i> n. gen. (Trematoda:  Opecoelidae) based on two new species from the fishes of the Karachi coast","33-36","","Norwegian Journal of Zoology","","","","<!--MARK--><a href='null347eac85-d956-423d-9f1f-b209401673da' class='mouseoverHref'>Bilqees, F.M. 1976. <i>Olivacreadium</i> n. gen. (Trematoda:  Opecoelidae) based on two new species from the fishes of the Karachi coast.</a> <!--MARK--><!--MARK--><a href='null7c87154b-28c5-4745-801e-02c1621789aa' class='mouseoverHref'><em>Norwegian Journal of Zoology</em></a> <strong>24</strong>: 33-36<!--MARK-->","","Article in Journal","347eac85-d956-423d-9f1f-b209401673da","20120821T10:57:12.363+0000","7c87154b-28c5-4745-801e-02c1621789aa"
"Bilqees, F.M., Shaukat, N. & Haseeb, M.F","2003","<i>Neodiptherostomum karachiensis</i> gen. n. sp. n. (Zoogonidae : Diptherostominae) from the fish <i>Pseudosciaena diacanthus</i> of Karachi coast","1-5","","Proceedings of Parasitology (Pakistan)","","","","<!--MARK--><a href='nullc7e449fe-2b17-45c4-b780-739714b068f7' class='mouseoverHref'>Bilqees, F.M., Shaukat, N. & Haseeb, M.F 2003. <i>Neodiptherostomum karachiensis</i> gen. n. sp. n. (Zoogonidae : Diptherostominae) from the fish <i>Pseudosciaena diacanthus</i> of Karachi coast.</a> <!--MARK--><!--MARK--><a href='null7331f0b1-4aaa-4f64-afbb-f901cdcb2e99' class='mouseoverHref'><em>Proceedings of Parasitology (Pakistan)</em></a> <strong>36</strong>: 1-5<!--MARK-->","","Article in Journal","c7e449fe-2b17-45c4-b780-739714b068f7","20120827T08:46:30.862+0000","7331f0b1-4aaa-4f64-afbb-f901cdcb2e99"
"Blair, D.","1985","<i>Deurithitrema gingae</i> n.g., n.sp. (Digenea: Plagiorchioidea) from the kidneys of a salt-water crocodile (<I>Crocodylus porosus</I> Schneider) from Australia","69-73","","Systematic Parasitology","","","","<!--MARK--><a href='null59e8513f-0a95-4000-a09a-561b3ebf13cd' class='mouseoverHref'>Blair, D. 1985. <i>Deurithitrema gingae</i> n.g., n.sp. (Digenea: Plagiorchioidea) from the kidneys of a salt-water crocodile (<I>Crocodylus porosus</I> Schneider) from Australia.</a> <!--MARK--><!--MARK--><a href='nullb0bb30a0-dfa7-4cf2-bf21-216d851b8d01' class='mouseoverHref'><em>Systematic Parasitology</em></a> <strong>7</strong>(1): 69-73<!--MARK-->","","Article in Journal","59e8513f-0a95-4000-a09a-561b3ebf13cd","20111024T03:43:25.720+0000","b0bb30a0-dfa7-4cf2-bf21-216d851b8d01"
