"PUB_AUTHOR","PUB_YEAR","PUB_TITLE","PUB_PAGES","PUB_PARENT_BOOK_TITLE","PUB_PARENT_JOURNAL_TITLE","PUB_PARENT_ARTICLE_TITLE","PUB_PUBLICATION_DATE","PUB_PUBLISHER","PUB_FORMATTED","PUB_QUALIFICATION","PUB_TYPE","PUBLICATION_GUID","PUBLICATION_LAST_UPDATE","PARENT_PUBLICATION_GUID"
"Martin, W.E.","1958","Hawaian helminths. 1. <i>Trigonocryptus conus</i> n. gen., n. sp. (Trematoda: Fellodistomidae)","251-254","","Pacific Science","","","","<!--MARK--><a href='null9c6c0be6-15e7-4f8b-87bf-8d74901278df' class='mouseoverHref'>Martin, W.E. 1958. Hawaian helminths. 1. <i>Trigonocryptus conus</i> n. gen., n. sp. (Trematoda: Fellodistomidae).</a> <!--MARK--><!--MARK--><a href='nullcc032c8b-89bc-474b-8046-90fbdaad884c' class='mouseoverHref'><em>Pacific Science</em></a> <strong>12</strong>: 251-254<!--MARK-->","","Article in Journal","9c6c0be6-15e7-4f8b-87bf-8d74901278df","20110502T04:02:18.939+0000","cc032c8b-89bc-474b-8046-90fbdaad884c"
"Martin, W.E.","1973","<i>Iorchis manteri</i> sp. n. from Australian mullet and a key to haploporid trematode genera with two testes","237-240, 3 figs","","Proceedings of the Helminthological Society of Washington","","","","<!--MARK--><a href='null2e45fd2d-2eb3-4058-bedf-6a6355ac4555' class='mouseoverHref'>Martin, W.E. 1973. <i>Iorchis manteri</i> sp. n. from Australian mullet and a key to haploporid trematode genera with two testes.</a> <!--MARK--><!--MARK--><a href='nullac26e4c4-eedb-4d31-bc72-d2296528bf60' class='mouseoverHref'><em>Proceedings of the Helminthological Society of Washington</em></a> <strong>40</strong>(2): 237-240, 3 figs<!--MARK-->","","Article in Journal","2e45fd2d-2eb3-4058-bedf-6a6355ac4555","20110802T04:07:04.486+0000","ac26e4c4-eedb-4d31-bc72-d2296528bf60"
"Martin, W.E.","1973","A new genus and species of haploporid trematode (Haploporidae: Trematoda) from Australian mullet","166-168","","Bulletin of the Southern California Academy of Sciences","","","","<!--MARK--><a href='null58c35697-95f9-4510-a650-40ebf3c26eb0' class='mouseoverHref'>Martin, W.E. 1973. A new genus and species of haploporid trematode (Haploporidae: Trematoda) from Australian mullet.</a> <!--MARK--><!--MARK--><a href='nulld80e4486-eae1-40f7-b48a-ad53fb351e8a' class='mouseoverHref'><em>Bulletin of the Southern California Academy of Sciences</em></a> <strong>72</strong>(2): 166-168<!--MARK-->","","Article in Journal","58c35697-95f9-4510-a650-40ebf3c26eb0","20110802T05:00:31.091+0000","d80e4486-eae1-40f7-b48a-ad53fb351e8a"
"Martin, W.E.","1973","A new subfamily, two new genera, and three new species of haploporid trematodes","112-117","","Proceedings of the Helminthological Society of Washington","","","","<!--MARK--><a href='null8b48d5c7-2aa2-4fc0-9699-e0340561090f' class='mouseoverHref'>Martin, W.E. 1973. A new subfamily, two new genera, and three new species of haploporid trematodes.</a> <!--MARK--><!--MARK--><a href='nullac26e4c4-eedb-4d31-bc72-d2296528bf60' class='mouseoverHref'><em>Proceedings of the Helminthological Society of Washington</em></a> <strong>40</strong>(1): 112-117<!--MARK-->","","Article in Journal","8b48d5c7-2aa2-4fc0-9699-e0340561090f","20110803T01:37:30.496+0000","ac26e4c4-eedb-4d31-bc72-d2296528bf60"
"Martin, W.E.","1973","Life history of <i>Saccocoelioides pearsoni</i> n. sp. and the description of <i>Lecithobotrys sprenti</i> n. sp. (Trematoda: Haploporidae)","80-95, 5 figs, 2 pls","","Transactions of the American Microscopical Society","","","","<!--MARK--><a href='null96e9c3e4-2142-4ce2-8d08-ceaeaf7a90f2' class='mouseoverHref'>Martin, W.E. 1973. Life history of <i>Saccocoelioides pearsoni</i> n. sp. and the description of <i>Lecithobotrys sprenti</i> n. sp. (Trematoda: Haploporidae).</a> <!--MARK--><!--MARK--><a href='nullf15eea71-ec47-4501-b080-54e1a4b394fb' class='mouseoverHref'><em>Transactions of the American Microscopical Society</em></a> <strong>92</strong>(1): 80-95, 5 figs, 2 pls<!--MARK-->","","Article in Journal","96e9c3e4-2142-4ce2-8d08-ceaeaf7a90f2","20110802T04:45:55.592+0000","f15eea71-ec47-4501-b080-54e1a4b394fb"
"Martin, W.E.","1974","<i>Paralecithobotrys brisbanensis</i> sp. n. from Australian mullet (Trematoda: Haploporidae)","16-18","","Proceedings of the Helminthological Society of Washington","","","","<!--MARK--><a href='nullb8edd5f1-efef-4014-a3d0-1ad4c0a863a7' class='mouseoverHref'>Martin, W.E. 1974. <i>Paralecithobotrys brisbanensis</i> sp. n. from Australian mullet (Trematoda: Haploporidae).</a> <!--MARK--><!--MARK--><a href='nullac26e4c4-eedb-4d31-bc72-d2296528bf60' class='mouseoverHref'><em>Proceedings of the Helminthological Society of Washington</em></a> <strong>41</strong>: 16-18<!--MARK-->","","Article in Journal","b8edd5f1-efef-4014-a3d0-1ad4c0a863a7","","ac26e4c4-eedb-4d31-bc72-d2296528bf60"
"Martin, W.E. & Hammerich, B.","1970","<i>Paradiscogaster eniwetokensis</i> n. sp. (Fellodistomidae: Trematoda) from Eniwetok, Marshall Islands","379-380","","Pacific Science","","","","<!--MARK--><a href='null7aa1486e-1cc5-4682-8080-45504d166853' class='mouseoverHref'>Martin, W.E. & Hammerich, B. 1970. <i>Paradiscogaster eniwetokensis</i> n. sp. (Fellodistomidae: Trematoda) from Eniwetok, Marshall Islands.</a> <!--MARK--><!--MARK--><a href='nullcc032c8b-89bc-474b-8046-90fbdaad884c' class='mouseoverHref'><em>Pacific Science</em></a> <strong>24</strong>(3): 379-380<!--MARK-->","","Article in Journal","7aa1486e-1cc5-4682-8080-45504d166853","20110502T02:05:58.602+0000","cc032c8b-89bc-474b-8046-90fbdaad884c"
"Mehra, H.R.","1960","On a new trematode <i>Staphylorchis scoliodonii</i> n. sp. (Family Gorgoderidae Looss, 1901; Subfamily Anaporrhutinae Looss, 1901) from South Indian shark <i>Scoliodon sorrakowah</i> with a phylogenetic discussion and classification of the family","143-165","","Proceedings of the National Academy of Sciences, India, Biological Sciences","","","","<!--MARK--><a href='null42c0f66e-b430-419d-8183-2a56396d8660' class='mouseoverHref'>Mehra, H.R. 1960. On a new trematode <i>Staphylorchis scoliodonii</i> n. sp. (Family Gorgoderidae Looss, 1901; Subfamily Anaporrhutinae Looss, 1901) from South Indian shark <i>Scoliodon sorrakowah</i> with a phylogenetic discussion and classification of the family.</a> <!--MARK--><!--MARK--><a href='null6ce14888-02a1-4550-b919-e2f9721e415a' class='mouseoverHref'><em>Proceedings of the National Academy of Sciences, India, Biological Sciences</em></a> <strong>30</strong>: 143-165<!--MARK-->","","Article in Journal","42c0f66e-b430-419d-8183-2a56396d8660","20121007T04:30:10.845+0000","6ce14888-02a1-4550-b919-e2f9721e415a"
"Munoz, G., Grutter, A.S. & Cribb, T.H.","2006","Endoparasite communities of five fish species (Labridae : Cheilininae) from Lizard Island: how important is the ecology and phylogeny of the hosts?","363-374","","Parasitology","","","","<!--MARK--><a href='nulleb2a3f39-1de2-43d1-9176-a0d9e6be1244' class='mouseoverHref'>Munoz, G., Grutter, A.S. & Cribb, T.H. 2006. Endoparasite communities of five fish species (Labridae : Cheilininae) from Lizard Island: how important is the ecology and phylogeny of the hosts?</a> <!--MARK--><!--MARK--><a href='nullb2746c84-c004-431c-8966-2f153b82b814' class='mouseoverHref'><em>Parasitology</em></a> <strong>132</strong>: 363-374<!--MARK-->","","Article in Journal","eb2a3f39-1de2-43d1-9176-a0d9e6be1244","20120823T06:01:47.893+0000","b2746c84-c004-431c-8966-2f153b82b814"
"Munoz, G., Grutter, A.S. & Cribb, T.H.","2007","Structure of the parasite communities of a coral reef fish assemblage (Labridae): Testing ecological and phylogenetic host factors","17-30","","Journal of Parasitology","","","","<!--MARK--><a href='null0a36ca9b-6ca8-43cf-8e91-f9564b36aa5d' class='mouseoverHref'>Munoz, G., Grutter, A.S. & Cribb, T.H. 2007. Structure of the parasite communities of a coral reef fish assemblage (Labridae): Testing ecological and phylogenetic host factors.</a> <!--MARK--><!--MARK--><a href='nulle52ecfa4-7e99-4ea0-acd3-ce3d83537d01' class='mouseoverHref'><em>Journal of Parasitology</em></a> <strong>93</strong>: 17-30<!--MARK-->","","Article in Journal","0a36ca9b-6ca8-43cf-8e91-f9564b36aa5d","20120802T06:21:37.884+0000","e52ecfa4-7e99-4ea0-acd3-ce3d83537d01"
"Munoz, G. & Cribb, T.H.","2006","Parasite communities and diet of <i>Coris batuensis</i> (Pisces: Labridae) from Lizard Island, Great Barrier Reef","191-198","","Memoirs of the Queensland Museum","","","","<!--MARK--><a href='null9acd610f-24bb-4730-8621-86e44ff4f0e3' class='mouseoverHref'>Munoz, G. & Cribb, T.H. 2006. Parasite communities and diet of <i>Coris batuensis</i> (Pisces: Labridae) from Lizard Island, Great Barrier Reef.</a> <!--MARK--><!--MARK--><a href='null1a0a2982-9f30-43e1-a641-b0379699837c' class='mouseoverHref'><em>Memoirs of the Queensland Museum</em></a> <strong>52</strong>: 191-198<!--MARK-->","","Article in Journal","9acd610f-24bb-4730-8621-86e44ff4f0e3","20120823T06:04:39.665+0000","1a0a2982-9f30-43e1-a641-b0379699837c"
"Nagaty, H.F.","1948","Trematodes of fishes from the Red Sea  Part 4.  On some new and known forms with a single testis","355-363","","Journal of Parasitology","","","","<!--MARK--><a href='nulle327e49a-3f42-4023-ada2-8e14c6072b7d' class='mouseoverHref'>Nagaty, H.F. 1948. Trematodes of fishes from the Red Sea  Part 4.  On some new and known forms with a single testis.</a> <!--MARK--><!--MARK--><a href='nulle52ecfa4-7e99-4ea0-acd3-ce3d83537d01' class='mouseoverHref'><em>Journal of Parasitology</em></a> <strong>34</strong>: 355-363<!--MARK-->","","Article in Journal","e327e49a-3f42-4023-ada2-8e14c6072b7d","20120828T00:14:51.055+0000","e52ecfa4-7e99-4ea0-acd3-ce3d83537d01"
"Nagaty, H.F.","1956","Trematodes of fishes from the Red Sea  Part 7.  On two gyliauchenids and three allocreadoids, including four new species","523-527","","Journal of Parasitology","","","","<!--MARK--><a href='null4fb8ed45-54fa-4b3c-9588-093277513e3e' class='mouseoverHref'>Nagaty, H.F. 1956. Trematodes of fishes from the Red Sea  Part 7.  On two gyliauchenids and three allocreadoids, including four new species.</a> <!--MARK--><!--MARK--><a href='nulle52ecfa4-7e99-4ea0-acd3-ce3d83537d01' class='mouseoverHref'><em>Journal of Parasitology</em></a> <strong>42</strong>: 523-527<!--MARK-->","","Article in Journal","4fb8ed45-54fa-4b3c-9588-093277513e3e","20120820T07:30:03.620+0000","e52ecfa4-7e99-4ea0-acd3-ce3d83537d01"
"Nagaty, H.F. & Abel Aal, T.M.","1962","Trematodes of fishes from the Red Sea. Part 19. On three new species of <i>Podocotyle</i> (family Allocreadiidae)","746-747","","Journal of Parasitology","","","","<!--MARK--><a href='null79af9f2e-d219-433b-9be8-89e9571c6fc0' class='mouseoverHref'>Nagaty, H.F. & Abel Aal, T.M. 1962. Trematodes of fishes from the Red Sea. Part 19. On three new species of <i>Podocotyle</i> (family Allocreadiidae).</a> <!--MARK--><!--MARK--><a href='nulle52ecfa4-7e99-4ea0-acd3-ce3d83537d01' class='mouseoverHref'><em>Journal of Parasitology</em></a> <strong>48</strong>: 746-747<!--MARK-->","","Article in Journal","79af9f2e-d219-433b-9be8-89e9571c6fc0","20111024T02:47:47.408+0000","e52ecfa4-7e99-4ea0-acd3-ce3d83537d01"
"Nahhas, F.M. & Cable, R.M.","1964","Digenic and aspidogastrid trematodes from marine fishes of Curaçao and Jamaica","167-228","","Tulane Studies in Zoology","","","","<!--MARK--><a href='nulla9e4aac8-3aca-4860-9d4f-5ec5e3a6e210' class='mouseoverHref'>Nahhas, F.M. & Cable, R.M. 1964. Digenic and aspidogastrid trematodes from marine fishes of Curaçao and Jamaica.</a> <!--MARK--><!--MARK--><a href='null3aee39bc-39c1-4500-8876-29a916a465a4' class='mouseoverHref'><em>Tulane Studies in Zoology</em></a> <strong>11</strong>: 167-228<!--MARK-->","","Article in Journal","a9e4aac8-3aca-4860-9d4f-5ec5e3a6e210","20110502T03:31:08.392+0000","3aee39bc-39c1-4500-8876-29a916a465a4"
"Nicoll, W.","1907","Observations on the trematode parasites of British birds","245-271","","Annals and Magazine of Natural History","","","","<!--MARK--><a href='null310f19fa-daf7-4d21-9e9c-d6711e4724d3' class='mouseoverHref'>Nicoll, W. 1907. Observations on the trematode parasites of British birds.</a> <!--MARK--><!--MARK--><a href='nullefa8de69-3a29-4a43-8ef2-cbefda205976' class='mouseoverHref'><em>Annals and Magazine of Natural History</em></a> 7 <strong>20</strong>: 245-271<!--MARK-->","","Article in Journal","310f19fa-daf7-4d21-9e9c-d6711e4724d3","20111012T22:50:59.290+0000","efa8de69-3a29-4a43-8ef2-cbefda205976"
"Nicoll, W.","1909","Studies on the structure and classification of the digenetic trematodes","391-487, pls ix, x","","Quarterly Journal of Microscopical Science","","","","<!--MARK--><a href='null8af77aa4-5c92-42dd-a6db-6c1b2d485fbc' class='mouseoverHref'>Nicoll, W. 1909. Studies on the structure and classification of the digenetic trematodes.</a> <!--MARK--><!--MARK--><a href='null0f162f90-df4f-47f1-908a-687f940ac834' class='mouseoverHref'><em>Quarterly Journal of Microscopical Science</em></a> <strong>53</strong>: 391-487, pls ix, x<!--MARK-->","","Article in Journal","8af77aa4-5c92-42dd-a6db-6c1b2d485fbc","20111020T22:44:07.399+0000","0f162f90-df4f-47f1-908a-687f940ac834"
"Nicoll, W.","1914","The Trematode parasites of fishes from the English Channel","466-505","","Journal of the Marine Biological Association of the United Kingdom","","","","<!--MARK--><a href='null5308813d-7368-4593-a341-0e5535dfb932' class='mouseoverHref'>Nicoll, W. 1914. The Trematode parasites of fishes from the English Channel.</a> <!--MARK--><!--MARK--><a href='null4fa35909-ec30-4e98-8b22-c9c9151656e2' class='mouseoverHref'><em>Journal of the Marine Biological Association of the United Kingdom</em></a> <strong>10</strong>: 466-505<!--MARK-->","","Article in Journal","5308813d-7368-4593-a341-0e5535dfb932","20110429T04:42:25.656+0000","4fa35909-ec30-4e98-8b22-c9c9151656e2"
"Nicoll, W.","1914","The Trematode parasites of North Queensland. I","330-350","","Parasitology","","","","<!--MARK--><a href='null2ec9d51b-7e37-4e02-81be-c77ada3e7cbc' class='mouseoverHref'>Nicoll, W. 1914. The Trematode parasites of North Queensland. I.</a> <!--MARK--><!--MARK--><a href='nullb2746c84-c004-431c-8966-2f153b82b814' class='mouseoverHref'><em>Parasitology</em></a> <strong>6</strong>: 330-350<!--MARK-->","","Article in Journal","2ec9d51b-7e37-4e02-81be-c77ada3e7cbc","20110419T01:15:27.930+0000","b2746c84-c004-431c-8966-2f153b82b814"
"Nicoll, W.","1914","The trematode parasites of North Queensland. II. Parasites of birds","105-126","","Parasitology","","","","<!--MARK--><a href='null457a56ea-08ff-4ea5-a810-981aa70e057d' class='mouseoverHref'>Nicoll, W. 1914. The trematode parasites of North Queensland. II. Parasites of birds.</a> <!--MARK--><!--MARK--><a href='nullb2746c84-c004-431c-8966-2f153b82b814' class='mouseoverHref'><em>Parasitology</em></a> <strong>7</strong>: 105-126<!--MARK-->","","Article in Journal","457a56ea-08ff-4ea5-a810-981aa70e057d","20110728T03:39:58.545+0000","b2746c84-c004-431c-8966-2f153b82b814"
"Nicoll, W.","1915","The trematode parasites of north Queensland. III. Parasites of fishes","22-41","","Parasitology","","","","<!--MARK--><a href='null8b9089a9-0b9b-4d58-95b5-1def642a0153' class='mouseoverHref'>Nicoll, W. 1915. The trematode parasites of north Queensland. III. Parasites of fishes.</a> <!--MARK--><!--MARK--><a href='nullb2746c84-c004-431c-8966-2f153b82b814' class='mouseoverHref'><em>Parasitology</em></a> <strong>8</strong>: 22-41<!--MARK-->","","Article in Journal","8b9089a9-0b9b-4d58-95b5-1def642a0153","","b2746c84-c004-431c-8966-2f153b82b814"
"Nicoll, W.","1918","The Trematode parasites of North Queensland. IV. Parasites of reptiles and frogs","368-374","","Parasitology","","","","<!--MARK--><a href='nullbfb4bd16-94d7-47f2-bda2-283df2e732a7' class='mouseoverHref'>Nicoll, W. 1918. The Trematode parasites of North Queensland. IV. Parasites of reptiles and frogs.</a> <!--MARK--><!--MARK--><a href='nullb2746c84-c004-431c-8966-2f153b82b814' class='mouseoverHref'><em>Parasitology</em></a> <strong>10</strong>: 368-374<!--MARK-->","","Article in Journal","bfb4bd16-94d7-47f2-bda2-283df2e732a7","20110816T03:57:05.090+0000","b2746c84-c004-431c-8966-2f153b82b814"
"Nitta, M. & Tanaka, M.","2018","<i>Choanotrema</i> nom. nov. (Trematoda: Opecoelidae), a new replacement name for <i>Choanostoma</i> Yamaguti, 1934, a junior homonym of <i>Choanostoma</i> Wang, 1930 (Ciliophora: Haptorida: Didiniidae)","969-970","","Systematic Parasitology","","","","<!--MARK--><a href='null8aa9b740-b504-4fe4-87b6-737e4ee804b6' class='mouseoverHref'>Nitta, M. & Tanaka, M. 2018. <i>Choanotrema</i> nom. nov. (Trematoda: Opecoelidae), a new replacement name for <i>Choanostoma</i> Yamaguti, 1934, a junior homonym of <i>Choanostoma</i> Wang, 1930 (Ciliophora: Haptorida: Didiniidae).</a> <!--MARK--><!--MARK--><a href='nullb0bb30a0-dfa7-4cf2-bf21-216d851b8d01' class='mouseoverHref'><em>Systematic Parasitology</em></a> <strong>95</strong>: 969-970<!--MARK-->","","Article in Journal","8aa9b740-b504-4fe4-87b6-737e4ee804b6","20200507T04:43:39.670+0000","b0bb30a0-dfa7-4cf2-bf21-216d851b8d01"
"Odhner, T.","1902","Mittheilungen zur Kenntnis der <i>Distomum</i>, I. Ueber die Gattung <i>Zoogonus</i> Lss. 2. Zur Kenntnis der Harnblase-distomen der Fische","58-69, 3 figs","","Centralblatt für Bakteriologie","","","","<!--MARK--><a href='nullbba196c1-208e-43c2-8738-0e7497412223' class='mouseoverHref'>Odhner, T. 1902. Mittheilungen zur Kenntnis der <i>Distomum</i>, I. Ueber die Gattung <i>Zoogonus</i> Lss. 2. Zur Kenntnis der Harnblase-distomen der Fische.</a> <!--MARK--><!--MARK--><a href='null5a88f427-9c04-4e89-8b76-786d3ead2588' class='mouseoverHref'><em>Centralblatt für Bakteriologie</em></a> <strong>31</strong>: 58-69, 3 figs<!--MARK-->","","Article in Journal","bba196c1-208e-43c2-8738-0e7497412223","20111021T02:56:30.158+0000","5a88f427-9c04-4e89-8b76-786d3ead2588"
"Odhner, T.","1902","Mittheilungen zur Kenntnis der <i>Distomum</i>. II. 1. Drei neue <i>Distomen</i> aus der Gallenblase von Nilfischen. 2. <i>Deropristis</i> n. g.. 3. <i>Helicometra</i> n. g. Allocreadiinarum.","152-162, 3 text-figs","","Centralblatt für Bakteriologie","","","","<!--MARK--><a href='null79558754-8d84-4e28-9717-f7e842c17b03' class='mouseoverHref'>Odhner, T. 1902. Mittheilungen zur Kenntnis der <i>Distomum</i>. II. 1. Drei neue <i>Distomen</i> aus der Gallenblase von Nilfischen. 2. <i>Deropristis</i> n. g.. 3. <i>Helicometra</i> n. g. Allocreadiinarum.</a> <!--MARK--><!--MARK--><a href='null5a88f427-9c04-4e89-8b76-786d3ead2588' class='mouseoverHref'><em>Centralblatt für Bakteriologie</em></a> <strong>36</strong>: 152-162, 3 text-figs<!--MARK-->","","Article in Journal","79558754-8d84-4e28-9717-f7e842c17b03","20130724T00:47:09.841+0000","5a88f427-9c04-4e89-8b76-786d3ead2588"
"Odhner, T.","1911","Zum natürlichen System der digenen Trematoden","97-117, 513-531","","Zoologischer Anzeiger","","","","<!--MARK--><a href='nulleadecea9-bc1d-4432-bbb3-5aabf94dff03' class='mouseoverHref'>Odhner, T. 1911. Zum natürlichen System der digenen Trematoden.</a> <!--MARK--><!--MARK--><a href='null4b894062-2782-48ef-bf96-6997840d9060' class='mouseoverHref'><em>Zoologischer Anzeiger</em></a> <strong>38</strong>: 97-117, 513-531<!--MARK-->","","Article in Journal","eadecea9-bc1d-4432-bbb3-5aabf94dff03","20111010T21:25:56.368+0000","4b894062-2782-48ef-bf96-6997840d9060"
"Olson, P.D., Cribb, T.H., Tkach, V.V., Bray, R.A. & Littlewood, D.T.J.","2003","Phylogeny and classification of the Digenea (Platyhelminthes: Trematoda).","733-755","","International Journal for Parasitology","","","","<!--MARK--><a href='null9430e9c4-4f59-4859-9ce6-61f7c863b784' class='mouseoverHref'>Olson, P.D., Cribb, T.H., Tkach, V.V., Bray, R.A. & Littlewood, D.T.J. 2003. Phylogeny and classification of the Digenea (Platyhelminthes: Trematoda).</a> <!--MARK--><!--MARK--><a href='nullee565201-8306-4966-89b6-878f1edfe304' class='mouseoverHref'><em>International Journal for Parasitology</em></a> <strong>33</strong>: 733-755<!--MARK-->","","Article in Journal","9430e9c4-4f59-4859-9ce6-61f7c863b784","20130716T22:18:09.275+0000","ee565201-8306-4966-89b6-878f1edfe304"
"Oshmarin, P.G.","1952","Dicrocoeliidae Odhner, 1911","pp. 33-604","Trematodes of Animals and Man: Principles of Trematodology","","","","","<!--MARK--><a href='null55c2f5bd-b8ef-42ba-876b-a0b13569a4e8' class='mouseoverHref'>Oshmarin, P.G. 1952. Dicrocoeliidae Odhner, 1911. pp. 33-604</a> <!--MARK--><em>in</em> <!--MARK--><a href='null9d11f0cb-06bc-4aff-8857-81af6dbdbda0' class='mouseoverHref'>Skryabin, K.I. <em>Trematodes of Animals and Man: Principles of Trematodology</em>. Moscow Vol. 7.</a><!--MARK-->","","Chapter in Book","55c2f5bd-b8ef-42ba-876b-a0b13569a4e8","20111011T21:27:51.459+0000","9d11f0cb-06bc-4aff-8857-81af6dbdbda0"
"Oshmarin, P.G.","1964","Some new for science species and genera of trematodes from birds of the Democratic Republic of Vietnam.","652-661","","Zoologicheskii Zhurnal","","","","<!--MARK--><a href='nullbe1ac96a-810a-4ebb-aca6-9b04e08da60a' class='mouseoverHref'>Oshmarin, P.G. 1964. Some new for science species and genera of trematodes from birds of the Democratic Republic of Vietnam.</a> <!--MARK--><!--MARK--><a href='null9ca52805-abf8-43a8-bbd5-8b91ddb0efd4' class='mouseoverHref'><em>Zoologicheskii Zhurnal</em></a> <strong>43</strong>: 652-661<!--MARK-->","","Article in Journal","be1ac96a-810a-4ebb-aca6-9b04e08da60a","20120821T13:30:58.918+0000","9ca52805-abf8-43a8-bbd5-8b91ddb0efd4"
"Oshmarin, P.G., Alekseev, V.M. & Smetanina, Z.B.","1969","New representatives of the genus <i>Basantisia</i> Pande, 1938 and on the position of this genus in the system of trematodes","244-248 1 fig.","","Parazitologiya","","","","<!--MARK--><a href='nullb3afaba9-2fd7-4a0d-b3db-ea4ad086c7fa' class='mouseoverHref'>Oshmarin, P.G., Alekseev, V.M. & Smetanina, Z.B. 1969. New representatives of the genus <i>Basantisia</i> Pande, 1938 and on the position of this genus in the system of trematodes.</a> <!--MARK--><!--MARK--><a href='null7167ef1d-6679-44d9-8a39-40f49cb120ef' class='mouseoverHref'><em>Parazitologiya</em></a> <strong>3</strong>: 244-248 1 fig.<!--MARK--> [in Russian, English summary]","in Russian, English summary","Article in Journal","b3afaba9-2fd7-4a0d-b3db-ea4ad086c7fa","20111012T04:34:43.098+0000","7167ef1d-6679-44d9-8a39-40f49cb120ef"
"Overstreet, R.M. & Curran, S.S.","2005","Family Haploporidae Nicoll, 1914","pp. 129-165","Keys to the Trematoda. Volume 2","","","","","<!--MARK--><a href='null49865921-d916-4a55-b01a-0dc43dffc6b6' class='mouseoverHref'>Overstreet, R.M. & Curran, S.S. 2005. Family Haploporidae Nicoll, 1914. pp. 129-165</a> <!--MARK--><em>in</em> <!--MARK--><a href='null8385bb59-924c-4d6c-865a-76b416d101ea' class='mouseoverHref'>Jones, A., Bray, R.A. & Gibson, D.I. <em>Keys to the Trematoda. Volume 2</em>. Wallingford : CAB International 745 pp.</a><!--MARK-->","","Chapter in Book","49865921-d916-4a55-b01a-0dc43dffc6b6","20120828T00:49:24.763+0000","8385bb59-924c-4d6c-865a-76b416d101ea"
"Ozaki, Y.","1925","Preliminary notes on the Trematode with anus","51-53","","Journal of Parasitology","","","","<!--MARK--><a href='nulla4d8b22a-8428-4641-a644-5b6ab0e1613d' class='mouseoverHref'>Ozaki, Y. 1925. Preliminary notes on the Trematode with anus.</a> <!--MARK--><!--MARK--><a href='nulle52ecfa4-7e99-4ea0-acd3-ce3d83537d01' class='mouseoverHref'><em>Journal of Parasitology</em></a> <strong>12</strong>: 51-53<!--MARK-->","","Article in Journal","a4d8b22a-8428-4641-a644-5b6ab0e1613d","20111021T03:30:06.513+0000","e52ecfa4-7e99-4ea0-acd3-ce3d83537d01"
"Ozaki, Y.","1928","On some Trematodes with anus","5-33 17 figs","","Japanese Journal of Zoology","","","","<!--MARK--><a href='null898e14be-fea1-411c-ba6d-4197efa9c0c9' class='mouseoverHref'>Ozaki, Y. 1928. On some Trematodes with anus.</a> <!--MARK--><!--MARK--><a href='null4fe3e59d-c70b-4eda-8886-af20df04ba68' class='mouseoverHref'><em>Japanese Journal of Zoology</em></a> <strong>2</strong>: 5-33 17 figs<!--MARK-->","","Article in Journal","898e14be-fea1-411c-ba6d-4197efa9c0c9","20130122T23:43:39.680+0000","4fe3e59d-c70b-4eda-8886-af20df04ba68"
"Ozaki, Y.","1928","Some gasterostomous Trematodes of Japan","35-60 27 figs","","Japanese Journal of Zoology","","","","<!--MARK--><a href='null4bbe742a-cf88-48aa-a54a-0a24888d657b' class='mouseoverHref'>Ozaki, Y. 1928. Some gasterostomous Trematodes of Japan.</a> <!--MARK--><!--MARK--><a href='null4fe3e59d-c70b-4eda-8886-af20df04ba68' class='mouseoverHref'><em>Japanese Journal of Zoology</em></a> <strong>2</strong>: 35-60 27 figs<!--MARK-->","","Article in Journal","4bbe742a-cf88-48aa-a54a-0a24888d657b","20130122T23:43:39.680+0000","4fe3e59d-c70b-4eda-8886-af20df04ba68"
"Ozaki, Y.","1937","Studies on the Trematode families Gyliauchenidae and Opistholebitae, with special reference to lymph system. II","167-244","","Journal of Science of the Hiroshima University","","","","<!--MARK--><a href='null769a7f85-35f4-42f6-9c7b-d7f546372d5b' class='mouseoverHref'>Ozaki, Y. 1937. Studies on the Trematode families Gyliauchenidae and Opistholebitae, with special reference to lymph system. II.</a> <!--MARK--><!--MARK--><a href='nullb2a862c6-069a-4e2d-8425-8f00680706b3' class='mouseoverHref'><em>Journal of Science of the Hiroshima University</em></a> <strong>5</strong>: 167-244<!--MARK-->","","Article in Journal","769a7f85-35f4-42f6-9c7b-d7f546372d5b","20110822T03:24:45.846+0000","b2a862c6-069a-4e2d-8425-8f00680706b3"
